feed,title,long_url,short_url
RS,Dynamics of Physical Autonomous Robotic Network With Constant And Time-Varying Communication Delays,https://www.researchsquare.com/article/rs-1157959/latest,https://j.mp/3qgBaxX
RS,Coverage Prediction for Target Coverage in WSN Using Machine Learning Approaches,https://www.researchsquare.com/article/rs-1163536/latest,https://j.mp/3H463fV
RS,Identification of a Cancer Stemness Driven Prognostic Model and Therapeutic Drug Targets by Machine Learning in Hepatocellular Carcinoma,https://www.researchsquare.com/article/rs-1161100/latest,https://j.mp/3yTa97y
RS,FG-Droid: Grouping Based Feature Size Reduction for Android Malware Detection through Machine Learning,https://www.researchsquare.com/article/rs-1126907/latest,https://j.mp/32eO2wO
RS,MPPT Based On Artificial Neural Networks (ANN) For a Photovoltaic System Under Unstable Environmental Conditions,https://www.researchsquare.com/article/rs-1067676/latest,https://j.mp/3H7mVCm
