feed,title,long_url,short_url
GN:S:C,Want to get a job as one of Biden's 20000 climate workers? Here's what you need to know - Fast Company,https://news.google.com/rss/articles/CBMieWh0dHBzOi8vd3d3LmZhc3Rjb21wYW55LmNvbS85MTA3MzI3MS93YW50LXRvLWdldC1hLWpvYi1hcy1vbmUtb2YtYmlkZW5zLTIwMDAwLWNsaW1hdGUtd29ya2Vycy1oZXJlcy13aGF0LXlvdS1uZWVkLXRvLWtub3fSAQA?oc=5,https://da.gd/lnAm4
GN:S:C,"With States Leading on Climate Policy, New Tools Peer Into Lobbying 'Black Box' - InsideClimate News",https://news.google.com/rss/articles/CBMiVGh0dHBzOi8vaW5zaWRlY2xpbWF0ZW5ld3Mub3JnL25ld3MvMDIwNDIwMjQvc3RhdGUtbG9iYnlpbmctZGF0YWJhc2VzLWNsaW1hdGUtcG9saWN5L9IBAA?oc=5,https://da.gd/sNek0
GN:S:C,"Savannah to feel heat of climate change in spring, forecasters say - Savannah Morning News",https://news.google.com/rss/articles/CBMijAFodHRwczovL3d3dy5zYXZhbm5haG5vdy5jb20vc3RvcnkvbmV3cy9lbnZpcm9ubWVudC8yMDI0LzA0LzAyL3NhdmFubmFoLXRvLWZlZWwtaGVhdC1vZi1jbGltYXRlLWNoYW5nZS1pbi1zcHJpbmctZm9yZWNhc3RlcnMtc2F5LzczMTA3MTc4MDA3L9IBAA?oc=5,https://da.gd/gitR6f
GN:S:C,Indigenous peoples' climate labor benefits everyone. Should it be paid? - Grist,https://news.google.com/rss/articles/CBMiYmh0dHBzOi8vZ3Jpc3Qub3JnL2luZGlnZW5vdXMvaW5kaWdlbm91cy1wZW9wbGVzLWNsaW1hdGUtbGFib3ItYmVuZWZpdHMtZXZlcnlvbmUtc2hvdWxkLWl0LWJlLXBhaWQv0gEA?oc=5,https://da.gd/oapan7
GN:S:C,Florida Legislature fails Floridians yet again on climate change - Tallahassee Democrat,https://news.google.com/rss/articles/CBMihgFodHRwczovL3d3dy50YWxsYWhhc3NlZS5jb20vc3Rvcnkvb3Bpbmlvbi8yMDI0LzA0LzAyL3RoZS1mbG9yaWRhLWxlZ2lzbGF0dXJlLWZhaWxzLWZsb3JpZGlhbnMteWV0LWFnYWluLW9uLWNsaW1hdGUtY2hhbmdlLzczMTQ5OTM3MDA3L9IBAA?oc=5,https://da.gd/H2pLrL
GN:S:C,Climate disinformation is on the rise. Here's how to fight back - Salon,https://news.google.com/rss/articles/CBMiX2h0dHBzOi8vd3d3LnNhbG9uLmNvbS8yMDI0LzA0LzAyL2NsaW1hdGUtZGlzaW5mb3JtYXRpb24taXMtb24tdGhlLXJpc2UtaGVyZXMtaG93LXRvLWZpZ2h0LWJhY2sv0gEA?oc=5,https://da.gd/eABOwb
GN:S:C,Florida is about to scrub climate change from most of its laws - Canada's National Observer,https://news.google.com/rss/articles/CBMiYWh0dHBzOi8vd3d3Lm5hdGlvbmFsb2JzZXJ2ZXIuY29tLzIwMjQvMDQvMDIvbmV3cy9mbG9yaWRhLWFib3V0LXNjcnViLWNsaW1hdGUtY2hhbmdlLW1vc3QtaXRzLWxhd3PSAQA?oc=5,https://da.gd/Jv5kK
GN:S:C,Climate Change Superfund Act: How would it help NY communities dealing with flooding? - FingerLakes1,https://news.google.com/rss/articles/CBMifGh0dHBzOi8vd3d3LmZpbmdlcmxha2VzMS5jb20vMjAyNC8wNC8wMi9jbGltYXRlLWNoYW5nZS1zdXBlcmZ1bmQtYWN0LWhvdy13b3VsZC1pdC1oZWxwLW55LWNvbW11bml0aWVzLWRlYWxpbmctd2l0aC1mbG9vZGluZy_SAQA?oc=5,https://da.gd/qLceEs
GN:S:C,Can we engineer our way out of the climate crisis? - The Economic Times,https://news.google.com/rss/articles/CBMigAFodHRwczovL20uZWNvbm9taWN0aW1lcy5jb20vc21hbGwtYml6L3N1c3RhaW5hYmlsaXR5L2Nhbi13ZS1lbmdpbmVlci1vdXItd2F5LW91dC1vZi10aGUtY2xpbWF0ZS1jcmlzaXMvYXJ0aWNsZXNob3cvMTA4OTYxNTI4LmNtc9IBAA?oc=5,https://da.gd/JmdjdJ
GN:S:C,Shell heads to court to appeal landmark climate change ruling - DutchNews,https://news.google.com/rss/articles/CBMiX2h0dHBzOi8vd3d3LmR1dGNobmV3cy5ubC8yMDI0LzA0L3NoZWxsLWhlYWRzLXRvLWNvdXJ0LXRvLWFwcGVhbC1sYW5kbWFyay1jbGltYXRlLWNoYW5nZS1ydWxpbmcv0gEA?oc=5,https://da.gd/o1IyQ
