feed,title,long_url,short_url
LitCovid,Analysis and Acoustic Event Classification of Environmental Data Collected in a Citizen Science Project,https://pubmed.ncbi.nlm.nih.gov/36834378,
LitCovid,Time-to-Event Analysis of Factors Influencing Delay in Discharge from a Subacute Complex Discharge Unit during the First Year of the Pandemic (2020) in an Irish Tertiary Centre Hospital,https://pubmed.ncbi.nlm.nih.gov/36833162,
LitCovid,Pandemic-Related Stress and Other Emotional Difficulties in a Sample of Men and Women Living in Romantic Relationships during the COVID-19 Pandemic,https://pubmed.ncbi.nlm.nih.gov/36833681,
LitCovid,Recognition of Differentially Expressed Molecular Signatures and Pathways Associated with COVID-19 Poor Prognosis in Glioblastoma Patients,https://pubmed.ncbi.nlm.nih.gov/36834974,
LitCovid,Multiclass Mask Classification with a New Convolutional Neural Model and Its Real-Time Implementation,https://pubmed.ncbi.nlm.nih.gov/36836725,
LitCovid,Trends in Pseudomonas aeruginosa (P. aeruginosa) Bacteremia during the COVID-19 Pandemic: A Systematic Review.,https://pubmed.ncbi.nlm.nih.gov/36830319,
LitCovid,"Cystatin-c May Indicate Subclinical Renal Involvement, While Orosomucoid Is Associated with Fatigue in Patients with Long-COVID Syndrome",https://pubmed.ncbi.nlm.nih.gov/36836605,
LitCovid,Principles of Treatment and Clinical-Evolutionary Peculiarities of Deep Cervical Spaces Suppurations-Clinical Study,https://pubmed.ncbi.nlm.nih.gov/36836892,
LitCovid,Chemosensory Ability and Sensitivity in Health and Disease: Epigenetic Regulation and COVID-19,https://pubmed.ncbi.nlm.nih.gov/36835589,
LitCovid,Perception of Remote Learning by Fixed Prosthodontic Students at a Romanian Faculty of Dentistry,https://pubmed.ncbi.nlm.nih.gov/36834316,
LitCovid,"Transformational Leadership, Employee Engagement, Job Satisfaction, and Psychological Well-Being among Hotel Employees after the Height of the COVID-19 Pandemic: A Serial Mediation Model",https://pubmed.ncbi.nlm.nih.gov/36834304,
LitCovid,Association between Body Mass Index and Hospital Outcomes for COVID-19 Patients: A Nationwide Study,https://pubmed.ncbi.nlm.nih.gov/36836153,
LitCovid,Adherence to the Mediterranean Diet Association with Serum Inflammatory Factors Stress Oxidative and Appetite in COVID-19 Patients,https://pubmed.ncbi.nlm.nih.gov/36837428,
LitCovid,Explaining the Consumption Technology Acceptance in the Elderly Post-Pandemic: Effort Expectancy Does Not Matter,https://pubmed.ncbi.nlm.nih.gov/36829316,
LitCovid,The Electronic Mental Wellness Tool as a Self-Administered Brief Screening Instrument for Mental Disorders in the General Spanish Population during the Post-COVID-19 Era,https://pubmed.ncbi.nlm.nih.gov/36833900,
LitCovid,Cryptocurrencies Are Becoming Part of the World Global Financial Market,https://pubmed.ncbi.nlm.nih.gov/36832743,
LitCovid,"Exploring the Protective Effect of Food Drugs against Viral Diseases: Interaction of Functional Food Ingredients and SARS-CoV-2, Influenza Virus, and HSV",https://pubmed.ncbi.nlm.nih.gov/36836758,
LitCovid,Uptake of COVID-19 Vaccination and Its Associated Factors among College Students in China: A Nationwide Cross-Sectional Study,https://pubmed.ncbi.nlm.nih.gov/36833647,
LitCovid,Immunothrombosis: Molecular Aspects and New Therapeutic Perspectives,https://pubmed.ncbi.nlm.nih.gov/36835934,
LitCovid,"The ""Vertigo"" of the Food Sector within the Triangle of Climate Change, the Post-Pandemic World, and the Russian-Ukrainian War",https://pubmed.ncbi.nlm.nih.gov/36832796,
LitCovid,Understanding the Role of CalFresh Participation and Food Insecurity on Academic Outcomes among College Students during the COVID-19 Pandemic,https://pubmed.ncbi.nlm.nih.gov/36839256,
LitCovid,Sustained Myocarditis following Messenger RNA Vaccination against Coronavirus Disease 2019: Relation to Neutralizing Antibody and Amelioration by Low-Dose Booster Vaccination,https://pubmed.ncbi.nlm.nih.gov/36835957,
LitCovid,Prevalence of Burnout in Healthcare Workers of Tertiary-Care Hospitals during the COVID-19 Pandemic: A Cross-Sectional Survey from Two Central European Countries,https://pubmed.ncbi.nlm.nih.gov/36834414,
LitCovid,Hand Eczema in Apprentice Nurses during the COVID-19 Pandemic after a Skin Prevention Program,https://pubmed.ncbi.nlm.nih.gov/36833687,
LitCovid,Out-of-State Travel for Abortion among Texas Residents following an Executive Order Suspending In-State Services during the Coronavirus Pandemic,https://pubmed.ncbi.nlm.nih.gov/36834376,
LitCovid,Stigmatizing Monkeypox and COVID-19: A Comparative Framing Study of The Washington Post's Online News,https://pubmed.ncbi.nlm.nih.gov/36834039,
LitCovid,Tailored Multiplex Real-Time RT-PCR with Species-Specific Internal Positive Controls for Detecting SARS-CoV-2 in Canine and Feline Clinical Samples,https://pubmed.ncbi.nlm.nih.gov/36830388,
LitCovid,Compliance with Ministry of Health Regulations among Israeli Nurses during the COVID-19 Pandemic: The Mediating Role of Risk Perception,https://pubmed.ncbi.nlm.nih.gov/36833135,
LitCovid,"The Resilience of South African School Teachers in the Time of COVID-19: Coping with Risk of Infection, Loneliness, and Anxiety",https://pubmed.ncbi.nlm.nih.gov/36834157,
LitCovid,Using the Health Belief Model to Assess the Physical Exercise Behaviors of International Students in South Korea during the Pandemic,https://pubmed.ncbi.nlm.nih.gov/36833003,
LitCovid,Mental Health of Working Adults during the COVID-19 Pandemic: Does Physical Activity Level Matter?,https://pubmed.ncbi.nlm.nih.gov/36833655,
LitCovid,A Comprehensive Review of Risk Factors for Venous Thromboembolism: From Epidemiology to Pathophysiology,https://pubmed.ncbi.nlm.nih.gov/36834580,
LitCovid,Adaptations in orthodontics for current and future coronavirus disease 2019 best practices,https://pubmed.ncbi.nlm.nih.gov/36841666,
LitCovid,"Knowledge, Attitude, and Practice towards COVID-19 among Patients Attending Phuentsholing Hospital, Bhutan: A Cross-Sectional Study",https://pubmed.ncbi.nlm.nih.gov/36833636,
LitCovid,Social Media in Adolescents: A Retrospective Correlational Study on Addiction,https://pubmed.ncbi.nlm.nih.gov/36832407,
LitCovid,Identification of and Mechanistic Insights into SARS-CoV-2 Main Protease Non-Covalent Inhibitors: An In-Silico Study,https://pubmed.ncbi.nlm.nih.gov/36835648,
LitCovid,A Study of Psychometric Instruments and Constructs of Work-Related Stress among Seafarers: A Qualitative Approach,https://pubmed.ncbi.nlm.nih.gov/36833563,
LitCovid,Using Text Mining and Data Visualization Approaches for Investigating Mental Illness from the Perspective of Traditional Chinese Medicine,https://pubmed.ncbi.nlm.nih.gov/36837398,
LitCovid,"Past, Present and (Foreseeable) Future of Biological Anti-TNF Alpha Therapy",https://pubmed.ncbi.nlm.nih.gov/36836166,
LitCovid,Humor Coping Reduces the Positive Relationship between Avoidance Coping Strategies and Perceived Stress: A Moderation Analysis,https://pubmed.ncbi.nlm.nih.gov/36829408,
LitCovid,Routine Ophthalmological Examination Rates in Adults with Sickle Cell Disease Are Low and Must Be Improved,https://pubmed.ncbi.nlm.nih.gov/36834146,
LitCovid,"alpha(1)-Adrenergic Receptors: Insights into Potential Therapeutic Opportunities for COVID-19, Heart Failure, and Alzheimer's Disease",https://pubmed.ncbi.nlm.nih.gov/36835598,
LitCovid,Task Challenge and Employee Performance: A Moderated Mediation Model of Resilience and Digitalization,https://pubmed.ncbi.nlm.nih.gov/36829348,
LitCovid,Permethrin as a Potential Furin Inhibitor through a Novel Non-Competitive Allosteric Inhibition,https://pubmed.ncbi.nlm.nih.gov/36838867,
LitCovid,Empanelment of the Population to the Primary Medical Care Institution of Sri Lanka: A Mixed-Methods Study on Outcomes and Challenges,https://pubmed.ncbi.nlm.nih.gov/36833109,
LitCovid,"Crisis, What Crisis? The Effect of Economic Crises on Spending on Online and Offline Gambling in Spain: Implications for Preventing Gambling Disorder",https://pubmed.ncbi.nlm.nih.gov/36833606,
LitCovid,Addressing Microbial Resistance Worldwide: Challenges over Controlling Life-Threatening Fungal Infections,https://pubmed.ncbi.nlm.nih.gov/36839565,
LitCovid,Understanding Use Intention of mHealth Applications Based on the Unified Theory of Acceptance and Use of Technology 2 (UTAUT-2) Model in China,https://pubmed.ncbi.nlm.nih.gov/36833830,
LitCovid,An Innovative Polymer-Based Electrochemical Sensor Encrusted with Tb Nanoparticles for the Detection of Favipiravir: A Potential Antiviral Drug for the Treatment of COVID-19,https://pubmed.ncbi.nlm.nih.gov/36832009,
LitCovid,Viruses and Endocrine Diseases,https://pubmed.ncbi.nlm.nih.gov/36838326,
LitCovid,The Role of Bacterial Polyhydroalkanoate (PHA) in a Sustainable Future: A Review on the Biological Diversity,https://pubmed.ncbi.nlm.nih.gov/36833658,
LitCovid,Dietary Intervention on Overweight and Obesity after Confinement by COVID-19,https://pubmed.ncbi.nlm.nih.gov/36839270,
LitCovid,The Influence of Ventilation Measures on the Airborne Risk of Infection in Schools: A Scoping Review,https://pubmed.ncbi.nlm.nih.gov/36834438,
LitCovid,Influence of Previous Mental State on Psychological Outcomes of Spanish Out-of-Hospital Professionals during the COVID-19 Pandemic,https://pubmed.ncbi.nlm.nih.gov/36834266,
LitCovid,A Novel Low-Cost Uroflowmetry for Patient Telemonitoring,https://pubmed.ncbi.nlm.nih.gov/36833979,
LitCovid,Contribution of Trimethylamine N-Oxide (TMAO) to Chronic Inflammatory and Degenerative Diseases,https://pubmed.ncbi.nlm.nih.gov/36830968,
LitCovid,Employees Working from Home: Do Leadership Factors Influence Work-Related Stress and Musculoskeletal Pain?,https://pubmed.ncbi.nlm.nih.gov/36833739,
LitCovid,Tooth Loss and Caries Experience of Elderly Chileans in the Context of the COVID-19 Pandemic in Five Regions of Chile,https://pubmed.ncbi.nlm.nih.gov/36833696,
LitCovid,The Emotion Regulation Questionnaire: Psychometric Properties and Prediction of Posttraumatic Consequences during the COVID-19 Pandemic in Chilean Adults,https://pubmed.ncbi.nlm.nih.gov/36834148,
LitCovid,Juglans regia Linn.: A Natural Repository of Vital Phytochemical and Pharmacological Compounds,https://pubmed.ncbi.nlm.nih.gov/36836737,
LitCovid,"Mobile App-Based Coaching for Alcohol Prevention among Adolescents: Pre-Post Study on the Acceptance and Effectiveness of the Program ""MobileCoach Alcohol""",https://pubmed.ncbi.nlm.nih.gov/36833958,
LitCovid,The Role of Cluster of Differentiation 39 (CD39) and Purinergic Signaling Pathway in Viral Infections,https://pubmed.ncbi.nlm.nih.gov/36839551,
LitCovid,The Knowledge Gap: Mentorship in Emergency Medicine Residency,https://pubmed.ncbi.nlm.nih.gov/36841659,
LitCovid,A Scoping Review of Observational Studies on Food and Beverage Advertising on Social Media: A Public Health Perspective,https://pubmed.ncbi.nlm.nih.gov/36834312,
LitCovid,Audio long read: How your first brush with COVID warps your immunity,https://pubmed.ncbi.nlm.nih.gov/36829058,
LitCovid,The time is now for committed and comprehensive action to attain more broadly protective coronavirus vaccines: The coronavirus vaccines R&D roadmap,https://pubmed.ncbi.nlm.nih.gov/36828718,
LitCovid,"SARS-CoV-2 infection of airway organoids reveals conserved use of Tetraspanin-8 by Ancestral, Delta, and Omicron variants",https://pubmed.ncbi.nlm.nih.gov/36827975,
LitCovid,Orthostatic tachycardia after covid-19,https://pubmed.ncbi.nlm.nih.gov/36828559,
LitCovid,Alemka Markotic-from hantavirus to COVID-19,https://pubmed.ncbi.nlm.nih.gov/36828593,
LitCovid,Concurrent Infection with SARS-CoV-2 and Orientia tsutsugamushi during the COVID-19 Pandemic in the Maldives,https://pubmed.ncbi.nlm.nih.gov/36828498,
LitCovid,The SpACE-CCM: A facile and versatile cell culture medium-based biosensor for detection of SARS-CoV-2 spike-ACE2 interaction,https://pubmed.ncbi.nlm.nih.gov/36827795,
LitCovid,Cost effectiveness of fractional doses of COVID-19 vaccine boosters in India,https://pubmed.ncbi.nlm.nih.gov/36827972,
LitCovid,"The Impact of COVID-19 Infection and Characterization of ""Long COVID"" in Adolescents With Anxiety Disorders: A Prospective Longitudinal Study",https://pubmed.ncbi.nlm.nih.gov/36828133,
LitCovid,Harnessing the Power of Venomous Animal-Derived Toxins against COVID-19,https://pubmed.ncbi.nlm.nih.gov/36828473,
LitCovid,"Wellens' syndrome following severe COVID-19 infection, an innocent coincidence or a deadly association: two case reports",https://pubmed.ncbi.nlm.nih.gov/36829118,
LitCovid,SARS CoV-2 seropositivity in haemodialysis patients,https://pubmed.ncbi.nlm.nih.gov/36828704,
LitCovid,High Plasma Levels of Fibroblast Growth Factor 23 Are Associated with Increased Risk of COVID-19 in End-Stage Renal Disease Patients on Hemodialysis: Results of a Prospective Cohort,https://pubmed.ncbi.nlm.nih.gov/36828412,
LitCovid,SARS-CoV-2 Post-Infection and Sepsis by Saccharomyces cerevisiae: A Fatal Case Report-Focus on Fungal Susceptibility and Potential Virulence Attributes,https://pubmed.ncbi.nlm.nih.gov/36828515,
LitCovid,A retrospective evaluation of seroconversion after COVID-19 during the early Omicron wave in fully vaccinated multiple sclerosis patients receiving anti-CD20 therapies,https://pubmed.ncbi.nlm.nih.gov/36827874,
LitCovid,Hospital bed replacement for acute care of children at home during the COVID-19 pandemic through a Hospital-in-the-Home programme,https://pubmed.ncbi.nlm.nih.gov/36828574,
LitCovid,US COVID-19 clinical trial leadership gender disparities,https://pubmed.ncbi.nlm.nih.gov/36828602,
LitCovid,Severity of COVID-19 in Patients with Diarrhoea: A Systematic Review and Meta-Analysis,https://pubmed.ncbi.nlm.nih.gov/36828500,
LitCovid,COVID-19: Current Status and Future Prospects,https://pubmed.ncbi.nlm.nih.gov/36828510,
LitCovid,Effectiveness of BBIBP-CorV vaccine in preventing SARS-CoV2 infection and severe outcomes in people living with multiple sclerosis: A population-based study,https://pubmed.ncbi.nlm.nih.gov/36827877,
LitCovid,The Effects of CoronaVac and ChAdOx1 nCoV-19 in Reducing Severe Illness in Thailand: A Retrospective Cohort Study,https://pubmed.ncbi.nlm.nih.gov/36828511,
LitCovid,Does caring for others affect our mental health? Evidence from the COVID-19 pandemic,https://pubmed.ncbi.nlm.nih.gov/36827903,
LitCovid,Telepharmacy during home isolation: drug-related problems and pharmaceutical care in COVID-19 patients receiving antiviral therapy in Thailand,https://pubmed.ncbi.nlm.nih.gov/36829248,
LitCovid,Exploring the Well-Being of Slovenian and Serbian Sport Science Students during the COVID-19 Pandemic of Summer 2022,https://pubmed.ncbi.nlm.nih.gov/36828325,
LitCovid,Strongyloides and COVID-19: Challenges and Opportunities for Future Research,https://pubmed.ncbi.nlm.nih.gov/36828543,
LitCovid,Diabetes and Covid-19: Diabetes research funding and support during the pandemic,https://pubmed.ncbi.nlm.nih.gov/36828337,
LitCovid,Hygiene and Health Coaching for Community Readiness to Perform the Hajj during an Ongoing COVID-19 Pandemic,https://pubmed.ncbi.nlm.nih.gov/36828506,
LitCovid,Study of some immunological signatures and their association with COVID-19 in a sample of recovered Iraqi patients,https://pubmed.ncbi.nlm.nih.gov/36827832,
LitCovid,Usefulness of Inhaled Sedation in Patients With Severe ARDS Due to COVID-19,https://pubmed.ncbi.nlm.nih.gov/36828582,
LitCovid,Mining of EHR for interface terminology concepts for annotating EHRs of COVID patients,https://pubmed.ncbi.nlm.nih.gov/36829139,
LitCovid,COVID and perio,https://pubmed.ncbi.nlm.nih.gov/36828995,
LitCovid,Sociodemographic differences in Covid-19 vaccine uptake in Denmark: a nationwide register-based cohort study,https://pubmed.ncbi.nlm.nih.gov/36829138,
LitCovid,Cost-Effectiveness Analysis of COVID-19 Vaccine Booster Dose in the Thai Setting during the Period of Omicron Variant Predominance,https://pubmed.ncbi.nlm.nih.gov/36828507,
LitCovid,Long-term interplay between COVID-19 and chronic kidney disease,https://pubmed.ncbi.nlm.nih.gov/36828919,
LitCovid,Assessment of the clinical and analytical performance of the Aptima SARS-CoV-2 assay using the VALCOR protocol,https://pubmed.ncbi.nlm.nih.gov/36829164,
LitCovid,Concomitant Severe Psoriasis and Bullous Pemphigoid Induced by COVID-19,https://pubmed.ncbi.nlm.nih.gov/36828523,
LitCovid,Non-pharmaceutical interventions and risk of COVID-19 infection: survey of U.K. public from November 2020 - May 2021.,https://pubmed.ncbi.nlm.nih.gov/36829127,
LitCovid,Plasma exchange improves cognitive function in long-COVID related postural orthostatic tachycardia syndrome and autoimmune neurological dysfunction: Seeley et al. Plasmapheresis in long-COVID.,https://pubmed.ncbi.nlm.nih.gov/36828209,
LitCovid,COVID-19 Vaccination Intention in Patients with Autoimmune Diseases in Indonesia: An Application of the Integrated Behavioural Model,https://pubmed.ncbi.nlm.nih.gov/36828525,
LitCovid,"Impact of the COVID-19 Pandemic on Adults With Type 2 Diabetes Care and Clinical Parameters in a Primary Care Setting in Ontario, Canada: A Cross-sectional Study",https://pubmed.ncbi.nlm.nih.gov/36828737,
LitCovid,Routine healthcare disruptions: a longitudinal study on changes in self-management behavior during the COVID-19 pandemic,https://pubmed.ncbi.nlm.nih.gov/36829185,
LitCovid,Somatically hypermutated antibodies isolated from SARS-CoV-2 Delta infected patients cross-neutralize heterologous variants,https://pubmed.ncbi.nlm.nih.gov/36828833,
LitCovid,Enriched CXCR3(+) CXCR5(+) CD8(+) T cells in SARS-CoV-2 infected and vaccinated individuals effectively respond to the antigen in recallRunning title: CXCR3(+) CXCR5(+) CD8(+) T cells in infection and vaccination,https://pubmed.ncbi.nlm.nih.gov/36828335,
LitCovid,Opioid prescribing among aged care residents during the first year of the COVID-19 pandemic: an analysis using general practice health records in Australia,https://pubmed.ncbi.nlm.nih.gov/36829128,
LitCovid,"Phase II randomized, double blind, placebo controlled, clinical trial of safety and immunogenicity of an inactivated SARS-CoV-2 vaccine FAKHRAVAC in adults aged 18-70 years",https://pubmed.ncbi.nlm.nih.gov/36829111,
LitCovid,"Intragenomic rearrangements involving 5'-untranslated region segments in SARS-CoV-2, other betacoronaviruses, and alphacoronaviruses",https://pubmed.ncbi.nlm.nih.gov/36829234,
LitCovid,"Impact of COVID-19 Pandemic on Seroprevalence of HIV, HBV, HCV and HTLV I-II in a Blood Bank in Medellin, Colombia, 2019-2022",https://pubmed.ncbi.nlm.nih.gov/36828534,
LitCovid,The Role of Functional Urban Areas in the Spread of COVID-19 Omicron (Northern Spain),https://pubmed.ncbi.nlm.nih.gov/36829090,
LitCovid,Liver Injury in Favipiravir-Treated COVID-19 Patients: Retrospective Single-Center Cohort Study,https://pubmed.ncbi.nlm.nih.gov/36828545,
LitCovid,The use of complementary and traditional medicine for the treatment of patients with COVID-19: A systematic review,https://pubmed.ncbi.nlm.nih.gov/36828766,
LitCovid,Information overload in the context of COVID-19 pandemic: A repeated cross-sectional study,https://pubmed.ncbi.nlm.nih.gov/36827879,
LitCovid,"Predictors of Long-COVID-19 and its Impact on Quality of Life: Longitudinal Analysis at 3, 6 and 9 Months after Discharge from a Portuguese Centre",https://pubmed.ncbi.nlm.nih.gov/36827994,
LitCovid,Analyzing the Trends of COVID-19 and Human Activity Intensity in Malaysia,https://pubmed.ncbi.nlm.nih.gov/36828488,
LitCovid,"Vaccination and mortality from COVID-19: a comparative study between hemodialysis, peritoneal dialysis, and non-dialysis adult population in Panama",https://pubmed.ncbi.nlm.nih.gov/36828920,
LitCovid,Association of statin use with outcomes of patients admitted with COVID-19: an analysis of electronic health records using superlearner,https://pubmed.ncbi.nlm.nih.gov/36829115,
LitCovid,Targeted plasma proteomics reveals signatures discriminating COVID-19 from sepsis with pneumonia,https://pubmed.ncbi.nlm.nih.gov/36829233,
LitCovid,Exposure to psychotropic medications and COVID-19 course after hospital admission: Results from a prospective cohort study,https://pubmed.ncbi.nlm.nih.gov/36827888,
LitCovid,Colchicine and high-intensity rosuvastatin in the treatment of non-critically ill patients hospitalised with COVID-19: a randomised clinical trial,https://pubmed.ncbi.nlm.nih.gov/36828654,
LitCovid,Update in carotid disease,https://pubmed.ncbi.nlm.nih.gov/36828045,
LitCovid,MSCCov19Net: multi-branch deep learning model for COVID-19 detection from cough sounds,https://pubmed.ncbi.nlm.nih.gov/36828944,
LitCovid,A Practical Approach in Refining Binary Outcome for Treatment Effect of COVID-19 According to Geographical Diversity,https://pubmed.ncbi.nlm.nih.gov/36828499,
LitCovid,"Health worker education during the COVID-19 pandemic: global disruption, responses and lessons for the future-a systematic review and meta-analysis",https://pubmed.ncbi.nlm.nih.gov/36829158,
LitCovid,Cross-national presence and sociodemographic correlates of the suicide crisis syndrome,https://pubmed.ncbi.nlm.nih.gov/36828142,
LitCovid,Cancer nursing research priorities: A rapid review,https://pubmed.ncbi.nlm.nih.gov/36827837,
LitCovid,Telehealth outpatient palliative care in the COVID-19 pandemic: patient experience qualitative study,https://pubmed.ncbi.nlm.nih.gov/36828625,
LitCovid,Production of antiviral vaccine antigens using a silkworm-baculovirus expression system,https://pubmed.ncbi.nlm.nih.gov/36828618,
LitCovid,Impact of policy response on health protection and economic recovery in OECD and BRIICS countries during the early stages of the COVID-19 pandemic,https://pubmed.ncbi.nlm.nih.gov/36827784,
LitCovid,"Puff, Puff, Don't Pass: harm reduction for cannabis use during a viral respiratory pandemic",https://pubmed.ncbi.nlm.nih.gov/36829150,
LitCovid,Restricting access to antibiotics: The effectiveness of a 'no repeats' government policy intervention,https://pubmed.ncbi.nlm.nih.gov/36828673,
LitCovid,Socioeconomic and Racial Disparities in Vision Care Access and Impairment Among U.S. Children.,https://pubmed.ncbi.nlm.nih.gov/36828234,
LitCovid,Toxic Exposures Among Young Children One Year into the COVID-19 Pandemic: A Retrospective Review of Three San Francisco Bay Area Emergency Departments,https://pubmed.ncbi.nlm.nih.gov/36828751,
LitCovid,Increasing capacity in acute day care settings: patients' experiences of a pop-up day care unit,https://pubmed.ncbi.nlm.nih.gov/36828560,
LitCovid,Effects of remdesivir in patients hospitalised with COVID-19: a systematic review and individual patient data meta-analysis of randomised controlled trials,https://pubmed.ncbi.nlm.nih.gov/36828006,
LitCovid,Effect of Increasing the Number of Substitutions on Physical Performance during Periods of Congested Fixtures in Football,https://pubmed.ncbi.nlm.nih.gov/36828310,
LitCovid,Implementation of online workshops on image-guided adaptive brachytherapy (interventional radiotherapy) in locally advanced cervical cancer: Experience of BrachyAcademy,https://pubmed.ncbi.nlm.nih.gov/36828765,
