feed,title,long_url,short_url
LitCovid,Study on college students' willingness to inoculate COVID-19 vaccine based on bioinformatics and KAP analysis,https://pubmed.ncbi.nlm.nih.gov/36841943,
LitCovid,"Consequences of COVID-19 and Its Variants: Understanding the Physical, Oral, and Psychological Impact",https://pubmed.ncbi.nlm.nih.gov/36833792,
LitCovid,Supporting the Aspecific Physiological Defenses of Upper Airways against Emerging SARS-CoV-2 Variants,https://pubmed.ncbi.nlm.nih.gov/36839483,
LitCovid,"Is there a causal nexus between COVID-19 infection, COVID-19 vaccination, and Guillain-Barre syndrome?",https://pubmed.ncbi.nlm.nih.gov/36841799,
LitCovid,Coronavirus Disease-2019 Vaccine Hesitancy,https://pubmed.ncbi.nlm.nih.gov/36841593,
LitCovid,Are monoclonal antibodies effective in patients with severe obesity in SARS-CoV-2 infected?,https://pubmed.ncbi.nlm.nih.gov/36840489,
LitCovid,COVID-19 Vaccination and Alcohol Consumption: Justification of Risks,https://pubmed.ncbi.nlm.nih.gov/36839435,
LitCovid,Insights into organoid-based modeling of COVID-19 pathology,https://pubmed.ncbi.nlm.nih.gov/36841795,
LitCovid,Hematological Questions in Personalized Management of COVID-19 Vaccination,https://pubmed.ncbi.nlm.nih.gov/36836493,
LitCovid,Inherited and acquired errors of type I interferon immunity govern susceptibility to COVID-19 and multisystem inflammatory syndrome in children,https://pubmed.ncbi.nlm.nih.gov/36841740,
LitCovid,"Mechanisms, Effects, and Management of Neurological Complications of Post-Acute Sequelae of COVID-19 (NC-PASC)",https://pubmed.ncbi.nlm.nih.gov/36830913,
LitCovid,"COVID-19 in Pluralea Interactions: A Case Study in Santo Tome (Corrientes, Argentina)",https://pubmed.ncbi.nlm.nih.gov/36839563,
LitCovid,Long-COVID in Patients with Cancer Previously Treated with Early Anti-SARS-CoV-2 Therapies in an Out-of-Hospital Setting: A Single-Center Experience,https://pubmed.ncbi.nlm.nih.gov/36831611,
LitCovid,Association of CYP24A1 Gene rs6127099 (A > T) Polymorphism with Lower Risk to COVID-19 Infection in Kazakhstan,https://pubmed.ncbi.nlm.nih.gov/36833234,
LitCovid,"Health and Well-Being through COVID-19 Vaccination: Physical, Oral, and Psychological Effects",https://pubmed.ncbi.nlm.nih.gov/36833813,
LitCovid,"Trained Immunity, BCG and SARS-CoV-2 General Outline and Possible Management in COVID-19",https://pubmed.ncbi.nlm.nih.gov/36834629,
LitCovid,"COVID-19 among People Living with HTLV-1 Infection in Rio de Janeiro, Brazil",https://pubmed.ncbi.nlm.nih.gov/36839514,
LitCovid,Plant Extracts and SARS-CoV-2: Research and Applications,https://pubmed.ncbi.nlm.nih.gov/36836744,
LitCovid,Potent Therapeutic Strategies for COVID-19 with Single-Domain Antibody Immunoliposomes Neutralizing SARS-CoV-2 and Lip/cGAMP Enhancing Protective Immunity,https://pubmed.ncbi.nlm.nih.gov/36835479,
LitCovid,Saponins: Research Progress and Their Potential Role in the Post-COVID-19 Pandemic Era,https://pubmed.ncbi.nlm.nih.gov/36839670,
LitCovid,On the Waves of the COVID-19 Pandemic,https://pubmed.ncbi.nlm.nih.gov/36835874,
LitCovid,"Editorial for ""Post COVID-19 Syndrome in Patients with Asymptomatic/Mild Form""",https://pubmed.ncbi.nlm.nih.gov/36839439,
LitCovid,Epigenetic Targets and Pathways Linked to SARS-CoV-2 Infection and Pathology,https://pubmed.ncbi.nlm.nih.gov/36838306,
LitCovid,Emergency Department Visits among Cancer Patients during SARS-CoV-2 Pandemic,https://pubmed.ncbi.nlm.nih.gov/36831581,
LitCovid,The Use of Rapid COVID-19 Antigen Test in the Emergency Department as a Decision-Support Tool,https://pubmed.ncbi.nlm.nih.gov/36838249,
LitCovid,Hybrid Immunity to SARS-CoV-2 from Infection and Vaccination-Evidence Synthesis and Implications for New COVID-19 Vaccines,https://pubmed.ncbi.nlm.nih.gov/36830907,
LitCovid,Understanding the Response of Canadians to the COVID-19 Pandemic Using the Kubler-Ross Model: Twitter Data Analysis,https://pubmed.ncbi.nlm.nih.gov/36833891,
LitCovid,Characterizing and Predicting Post-Acute Sequelae of SARS CoV-2 Infection (PASC) in a Large Academic Medical Center in the US,https://pubmed.ncbi.nlm.nih.gov/36835863,
LitCovid,Pregnancy Outcomes in SARS-CoV-2-Positive Patients: A 20-Month Retrospective Analysis of Delivery Cases,https://pubmed.ncbi.nlm.nih.gov/36837541,
LitCovid,Clinical Features and Paraclinical Findings in Patients with SARS CoV-2 Pneumonia and the Impact of Pulmonary Rehabilitation on the Instrumental Activities of Daily Living in POST-COVID-19 Patients,https://pubmed.ncbi.nlm.nih.gov/36836416,
LitCovid,Global landscape of SARS-CoV-2 mutations and conserved regions,https://pubmed.ncbi.nlm.nih.gov/36841805,
LitCovid,COVID-19-Associated Acute Psychotic Disorder-Longitudinal Case Report and Brief Review of Literature,https://pubmed.ncbi.nlm.nih.gov/36837609,
LitCovid,Rapid and Sensitive Diagnosis of COVID-19 Using an Electricity-Free Self-Testing System,https://pubmed.ncbi.nlm.nih.gov/36831946,
LitCovid,Acute Kidney Injury with SARS-CoV-2 Infection in Pediatric Patients Receiving High-Dose Methotrexate Chemotherapy: A Report of Three Cases,https://pubmed.ncbi.nlm.nih.gov/36832467,
LitCovid,Plasma Proteomic Variables Related to COVID-19 Severity: An Untargeted nLC-MS/MS Investigation,https://pubmed.ncbi.nlm.nih.gov/36834989,
LitCovid,"Safety of COVID-19 Vaccines in Patients with Autoimmune Diseases, in Patients with Cardiac Issues, and in the Healthy Population",https://pubmed.ncbi.nlm.nih.gov/36839505,
LitCovid,Extraction Bottleneck in the Diagnosis of SARS-CoV-2: Evaluation of an Alternative Protocol Derived from Veterinary Use,https://pubmed.ncbi.nlm.nih.gov/36838500,
LitCovid,Advanced Vaccine Design Strategies against SARS-CoV-2 and Emerging Variants,https://pubmed.ncbi.nlm.nih.gov/36829642,
LitCovid,T Cell Response to SARS-CoV-2 Coinfection and Comorbidities,https://pubmed.ncbi.nlm.nih.gov/36839596,
LitCovid,The Influence of SARS-CoV-2 Infection on the Thyroid Gland,https://pubmed.ncbi.nlm.nih.gov/36831150,
LitCovid,Association between Glutathione S-Transferases Gene Variants and COVID-19 Severity in Previously Vaccinated and Unvaccinated Polish Patients with Confirmed SARS-CoV-2 Infection,https://pubmed.ncbi.nlm.nih.gov/36834445,
LitCovid,The SARS-CoV-2 Pandemic at the Wildlife-Domestic Animal-Human Interface,https://pubmed.ncbi.nlm.nih.gov/36839494,
LitCovid,"Epidemiological Predictors of Positive SARS-CoV-2 Polymerase Chain Reaction Test in Three Cohorts: Hospitalized Patients, Healthcare Workers, and Military Population, Serbia, 2020",https://pubmed.ncbi.nlm.nih.gov/36834297,
LitCovid,Identification of SARS-CoV-2 M(pro) inhibitors containing P1' 4-fluorobenzothiazole moiety highly active against SARS-CoV-2,https://pubmed.ncbi.nlm.nih.gov/36841831,
LitCovid,Liver Damage Associated with SARS-CoV-2 Infection-Myth or Reality?,https://pubmed.ncbi.nlm.nih.gov/36836583,
LitCovid,Exploring the Role of Immune System and Inflammatory Cytokines in SARS-CoV-2 Induced Lung Disease: A Narrative Review,https://pubmed.ncbi.nlm.nih.gov/36829456,
LitCovid,Comparison of Different Antiviral Regimens in the Treatment of Patients with Severe COVID-19: A Retrospective Cohort,https://pubmed.ncbi.nlm.nih.gov/36837462,
LitCovid,New Psychoactive Substances Intoxications and Fatalities during the COVID-19 Epidemic,https://pubmed.ncbi.nlm.nih.gov/36829550,
LitCovid,The Role of Nutrition in Mitigating the Effects of COVID-19 from Infection through PASC,https://pubmed.ncbi.nlm.nih.gov/36839224,
LitCovid,Severe COVID-19 Illness and alpha1-Antitrypsin Deficiency: COVID-AATD Study,https://pubmed.ncbi.nlm.nih.gov/36831051,
LitCovid,Symptomatic Popliteal Artery Aneurysms in Recently SARS-CoV-2-Infected Patients: The Microangiopathic Thrombosis That Undermines Treatment,https://pubmed.ncbi.nlm.nih.gov/36832134,
LitCovid,Cross-Reactivity of Antibodies in Intravenous Immunoglobulin Preparation for Protection against SARS-CoV-2,https://pubmed.ncbi.nlm.nih.gov/36838436,
LitCovid,Exploring the Role of ACE2 as a Connecting Link between COVID-19 and Parkinson's Disease,https://pubmed.ncbi.nlm.nih.gov/36836893,
LitCovid,Identifying SARS-CoV-2 Drugs Binding to the Spike Fatty Acid Binding Pocket Using In Silico Docking and Molecular Dynamics,https://pubmed.ncbi.nlm.nih.gov/36835602,
LitCovid,Accurate Detection of SARS-CoV-2 by Next-Generation Sequencing in Low Viral Load Specimens,https://pubmed.ncbi.nlm.nih.gov/36834888,
LitCovid,Multiple mutations of IFITM3 are associated with COVID-19 susceptibility,https://pubmed.ncbi.nlm.nih.gov/36841343,
LitCovid,Distinct Conformations of SARS-CoV-2 Omicron Spike Protein and Its Interaction with ACE2 and Antibody,https://pubmed.ncbi.nlm.nih.gov/36835186,
LitCovid,Bilateral Branch Retinal Vein Occlusion after mRNA-SARS-CoV-2 Booster Dose Vaccination,https://pubmed.ncbi.nlm.nih.gov/36835860,
LitCovid,"Characteristics, Outcomes, and Factors Affecting Mortality in Hospitalized Patients with CAP Due to Different Variants of SARS-CoV-2 and Non-COVID-19 CAP",https://pubmed.ncbi.nlm.nih.gov/36835923,
LitCovid,"Identify the Virus-like Models for COVID-19 as Bio-Threats: Combining Phage Display, Spectral Detection and Algorithms Analysis",https://pubmed.ncbi.nlm.nih.gov/36834622,
LitCovid,Spontaneous Pulmonary Hematoma: Case Report of a Giant Post-COVID-19 Hematoma and Literature Review,https://pubmed.ncbi.nlm.nih.gov/36833061,
LitCovid,Severe COVID-19 Infection during Pregnancy Requiring ECMO: Case Report and Review of the Literature,https://pubmed.ncbi.nlm.nih.gov/36836497,
LitCovid,Antiviral Effect of Ephedrine Alkaloids-Free Ephedra Herb Extract against SARS-CoV-2 In Vitro,https://pubmed.ncbi.nlm.nih.gov/36838499,
LitCovid,Total Anomalous Pulmonary Venous Return in the Time of SARS-CoV-2-Case Report,https://pubmed.ncbi.nlm.nih.gov/36832516,
LitCovid,"Clinical Validation of GenBody COVID-19 Ag, Nasal and Nasopharyngeal Rapid Antigen Tests for Detection of SARS-CoV-2 in European Adult Population",https://pubmed.ncbi.nlm.nih.gov/36831028,
LitCovid,Aspects of Nanotechnology for COVID-19 Vaccine Development and Its Delivery Applications,https://pubmed.ncbi.nlm.nih.gov/36839773,
LitCovid,Impact of COVID-19 Pandemic Lockdown on Migraine Patients in Latin America,https://pubmed.ncbi.nlm.nih.gov/36834292,
LitCovid,What are the key pediatric public policy priorities as the COVID-19 pandemic persists?,https://pubmed.ncbi.nlm.nih.gov/36841882,
LitCovid,Chronic spontaneous urticaria following vaccination against SARS-CoV-2,https://pubmed.ncbi.nlm.nih.gov/36841654,
LitCovid,Severity and Outcomes of SARS-CoV-2 Reinfection Compared with Primary Infection: A Systematic Review and Meta-Analysis,https://pubmed.ncbi.nlm.nih.gov/36834029,
LitCovid,Did the COVID-19 Pandemic Restrict Access to Emergency Urological Services: Assessment of Reorganisation Effectiveness for Hospital Treatment,https://pubmed.ncbi.nlm.nih.gov/36834430,
LitCovid,Immune Response and Molecular Mechanisms of Cardiovascular Adverse Effects of Spike Proteins from SARS-CoV-2 and mRNA Vaccines,https://pubmed.ncbi.nlm.nih.gov/36830987,
LitCovid,"SARS-CoV-2 Prevalence on and Incidence after Arrival in Travelers on Direct Flights from Cape Town, South Africa to Munich, Germany Shortly after Occurrence of the Omicron Variant in November/December 2021: Results from the OMTRAIR Study",https://pubmed.ncbi.nlm.nih.gov/36839626,
LitCovid,Neurological Manifestations of Non-Severe COVID-19-A Multidirectional Approach,https://pubmed.ncbi.nlm.nih.gov/36831898,
LitCovid,COVID-19-Associated Paediatric Inflammatory Multisystem Syndrome (PIMS-TS) in Intensive Care: A Retrospective Cohort Trial (PIMS-TS INT),https://pubmed.ncbi.nlm.nih.gov/36832477,
LitCovid,The Potential of the Remote Monitoring Digital Solutions to Sustain the Mental and Emotional Health of the Elderly during and Post COVID-19 Crisis in Romania,https://pubmed.ncbi.nlm.nih.gov/36833143,
LitCovid,"Investigating Functioning Profile of Adolescents with Anorexia before and during the COVID-19 Pandemic: A Cross-Sectional Study on Mentalizing, Alexithymia, and Impulsiveness",https://pubmed.ncbi.nlm.nih.gov/36834365,
LitCovid,Observational Study on Antibody Response to COVID-19 Vaccines in PAtients with Gastro-Entero-PanCreatic Cancers and NeuroendocrIne NeoplAsms on Systemic TreatmEnts (VACCINATE),https://pubmed.ncbi.nlm.nih.gov/36830873,
LitCovid,Autism and Neurodevelopmental Disorders: The SARS-CoV-2 Pandemic Implications,https://pubmed.ncbi.nlm.nih.gov/36831814,
LitCovid,A Prospective Analysis of Vitamin D Levels in Pregnant Women Diagnosed with Gestational Hypertension after SARS-CoV-2 Infection,https://pubmed.ncbi.nlm.nih.gov/36836551,
LitCovid,Cost-Benefit of Real-Time Multiplex PCR Testing of SARS-CoV-2 in German Hospitals,https://pubmed.ncbi.nlm.nih.gov/36834141,
LitCovid,Performance Evaluation of RapiSure (EDGC) COVID-19 S1 RBD IgG/Neutralizing Ab Test for the Rapid Detection of SARS-CoV-2 Antibodies,https://pubmed.ncbi.nlm.nih.gov/36832131,
LitCovid,Dual-Domain Reporter Approach for Multiplex Identification of Major SARS-CoV-2 Variants of Concern in a Microarray-Based Assay,https://pubmed.ncbi.nlm.nih.gov/36832035,
LitCovid,The paradigm of prophylactic viral outbreaks measures by microbial biosurfactants,https://pubmed.ncbi.nlm.nih.gov/36840992,
LitCovid,Staphylococcus aureus bacteremia in patients with SARS-CoV-2 infection,https://pubmed.ncbi.nlm.nih.gov/36841646,
LitCovid,Incidence determinants and serological correlates of reactive symptoms following SARS-CoV-2 vaccination,https://pubmed.ncbi.nlm.nih.gov/36841835,
LitCovid,Evaluating the Virology and Evolution of Seasonal Human Coronaviruses Associated with the Common Cold in the COVID-19 Era,https://pubmed.ncbi.nlm.nih.gov/36838410,
LitCovid,Thrombo-Inflammation in COVID-19 and Sickle Cell Disease: Two Faces of the Same Coin,https://pubmed.ncbi.nlm.nih.gov/36830874,
LitCovid,New Monoclonal Antibodies Specific for Different Epitopes of the Spike Protein of SARS-CoV-2 and Its Major Variants: Additional Tools for a More Specific COVID-19 Diagnosis,https://pubmed.ncbi.nlm.nih.gov/36831149,
LitCovid,Association between Gut Microbiota and SARS-CoV-2 Infection and Vaccine Immunogenicity,https://pubmed.ncbi.nlm.nih.gov/36838417,
LitCovid,Detection of Circulating SARS-CoV-2 Variants of Concern (VOCs) Using a Multiallelic Spectral Genotyping Assay,https://pubmed.ncbi.nlm.nih.gov/36836661,
LitCovid,The Impact of COVID-19 on Surgical Training and Education,https://pubmed.ncbi.nlm.nih.gov/36831609,
LitCovid,Salivary Metabolomic Analysis Reveals Amino Acid Metabolism Shift in SARS-CoV-2 Virus Activity and Post-Infection Condition,https://pubmed.ncbi.nlm.nih.gov/36837882,
LitCovid,"The Immune, Inflammatory and Hematological Response in COVID-19 Patients, According to the Severity of the Disease",https://pubmed.ncbi.nlm.nih.gov/36838284,
LitCovid,A Protein Co-Conservation Network Model Characterizes Mutation Effects on SARS-CoV-2 Spike Protein,https://pubmed.ncbi.nlm.nih.gov/36834664,
LitCovid,Clinical Characteristics and Outcomes of Patients with Acute Respiratory Failure Due to SARS-CoV-2 Interstitial Pneumonia Treated with CPAP in a Medical Intermediate Care Setting: A Retrospective Observational Study on Comparison of Four Waves,https://pubmed.ncbi.nlm.nih.gov/36836094,
LitCovid,Comparison of Two Commercially Available Interferon-gamma Release Assays for T-Cell-Mediated Immunity and Evaluation of Humoral Immunity against SARS-CoV-2 in Healthcare Workers,https://pubmed.ncbi.nlm.nih.gov/36832126,
LitCovid,COVID-19-Related Neuropathic Pain: A Systematic Review and Meta-Analysis,https://pubmed.ncbi.nlm.nih.gov/36836207,
LitCovid,Persistent effects of COVID-19 in patients hospitalized during the first wave of the pandemic: The impact of persistent fatigue on quality of life in a cross-sectional study,https://pubmed.ncbi.nlm.nih.gov/36832543,
LitCovid,Use of COVID-19 Convalescent Plasma for Treatment of Symptomatic SARS-CoV-2 Infection at a Children's Hospital: A Contribution to a Still Inadequate Body of Evidence,https://pubmed.ncbi.nlm.nih.gov/36832478,
LitCovid,Investigating the Use of SARS-CoV-2 (COVID-19) Odor Expression as a Non-Invasive Diagnostic Tool-Pilot Study,https://pubmed.ncbi.nlm.nih.gov/36832195,
LitCovid,A review of neurological side effects of COVID-19 vaccination,https://pubmed.ncbi.nlm.nih.gov/36841774,
LitCovid,The effect of BCG vaccination on infection and antibody levels against SARS-CoV-2 - The results of ProBCG: A Multicenter Randomized Clinical Trial in Brazil,https://pubmed.ncbi.nlm.nih.gov/36841502,
LitCovid,Employing T-Cell Memory to Effectively Target SARS-CoV-2,https://pubmed.ncbi.nlm.nih.gov/36839573,
LitCovid,Endogenous miRNA-Based Innate-Immunity against SARS-CoV-2 Invasion of the Brain,https://pubmed.ncbi.nlm.nih.gov/36834773,
LitCovid,"Emergence of BS.1 and BS.1.1, highly mutated new SARS-CoV-2 Omicron variants",https://pubmed.ncbi.nlm.nih.gov/36840401,
LitCovid,"""Mitochondrial pathogenic mutations and metabolic alterations associated with COVID-19 disease severity""",https://pubmed.ncbi.nlm.nih.gov/36832542,
LitCovid,The Prognostic Value of Pentraxin-3 in COVID-19 Patients: A Systematic Review and Meta-Analysis of Mortality Incidence,https://pubmed.ncbi.nlm.nih.gov/36834949,
LitCovid,Breath Analysis of COVID-19 Patients in a Tertiary UK Hospital by Optical Spectrometry: The E-Nose CoVal Study,https://pubmed.ncbi.nlm.nih.gov/36831932,
LitCovid,Remdesivir Influence on SARS-CoV-2 RNA Viral Load Kinetics in Nasopharyngeal Swab Specimens of COVID-19 Hospitalized Patients: A Real-Life Experience,https://pubmed.ncbi.nlm.nih.gov/36838277,
LitCovid,Metabolic Activation of PARP as a SARS-CoV-2 Therapeutic Target-Is It a Bait for the Virus or the Best Deal We Could Ever Make with the Virus? Is AMBICA the Potential Cure?,https://pubmed.ncbi.nlm.nih.gov/36830743,
LitCovid,Dine (Navajo) Traditional Knowledge Holders' Perspective of COVID-19,https://pubmed.ncbi.nlm.nih.gov/36834423,
LitCovid,Changes in Physical Fitness Parameters in a Portuguese Sample of Adolescents during the COVID-19 Pandemic: A One-Year Longitudinal Study,https://pubmed.ncbi.nlm.nih.gov/36834116,
LitCovid,Implementation of MRSA Nasal Swabs as an Antimicrobial Stewardship Intervention to Decrease Anti-MRSA Therapy in COVID-19 Infection,https://pubmed.ncbi.nlm.nih.gov/36830164,
LitCovid,Analysis of Changes in Antibiotic Use Patterns in Korean Hospitals during the COVID-19 Pandemic,https://pubmed.ncbi.nlm.nih.gov/36830109,
LitCovid,Anakinra for the treatment of COVID-19 patients: a systematic review and meta-analysis,https://pubmed.ncbi.nlm.nih.gov/36841793,
LitCovid,Association of the Mannose-Binding Lectin 2 BB Genotype with COVID-19-Related Mortality,https://pubmed.ncbi.nlm.nih.gov/36836739,
LitCovid,Lung Ultrasound Is Useful for Evaluating Lung Damage in COVID-19 Patients Treated with Bamlanivimab and Etesevimab: A Single-Center Pilot Study,https://pubmed.ncbi.nlm.nih.gov/36837405,
LitCovid,Sulforaphane is a reversible covalent inhibitor of 3-chymotrypsin-like protease of SARS-CoV-2,https://pubmed.ncbi.nlm.nih.gov/36840402,
LitCovid,Inflammation as Prognostic Hallmark of Clinical Outcome in Patients with SARS-CoV-2 Infection,https://pubmed.ncbi.nlm.nih.gov/36836679,
LitCovid,Psychosocial and Health Effects of the COVID-19 Pandemic Experienced by Staff Employed in Social Welfare Facilities in Poland and Spain,https://pubmed.ncbi.nlm.nih.gov/36834030,
LitCovid,Discovery and Development Strategies for SARS-CoV-2 NSP3 Macrodomain Inhibitors,https://pubmed.ncbi.nlm.nih.gov/36839595,
LitCovid,"Inflammatory Biomarkers Differ among Hospitalized Veterans Infected with Alpha, Delta, and Omicron SARS-CoV-2 Variants",https://pubmed.ncbi.nlm.nih.gov/36833680,
LitCovid,Dreams Shared on Social Networks during the COVID-19 Pandemic: A Tower of Babel or Noah's Ark?-A Group-Analytic Perspective,https://pubmed.ncbi.nlm.nih.gov/36834229,
LitCovid,Dysregulated Levels of Circulating Autoantibodies against Neuronal and Nervous System Autoantigens in COVID-19 Patients,https://pubmed.ncbi.nlm.nih.gov/36832180,
LitCovid,Flexible Label-Free Platinum and Bio-PET-Based Immunosensor for the Detection of SARS-CoV-2,https://pubmed.ncbi.nlm.nih.gov/36831956,
LitCovid,Group Cognitive Behavioural Therapy for Non-Rapid Eye Movement Parasomnias: Long-Term Outcomes and Impact of COVID-19 Lockdown,https://pubmed.ncbi.nlm.nih.gov/36831890,
LitCovid,Monitoring and immunogenicity of SARS-CoV-2 vaccination of laboratory rhesus monkeys (Macaca mulatta),https://pubmed.ncbi.nlm.nih.gov/36841887,
LitCovid,"'COVID Is Coming, and I'm Bloody Scared': How Adults with Co-Morbidities' Threat Perceptions of COVID-19 Shape Their Vaccination Decisions",https://pubmed.ncbi.nlm.nih.gov/36833657,
LitCovid,Does the SARS-CoV-2 Spike Receptor-Binding Domain Hamper the Amyloid Transformation of Alpha-Synuclein after All?,https://pubmed.ncbi.nlm.nih.gov/36831034,
LitCovid,Trends in Long COVID Symptoms in Japanese Teenage Patients,https://pubmed.ncbi.nlm.nih.gov/36837463,
LitCovid,"Increased rhinovirus/enterovirus infections including Ev-D68 in the United States, a challenge for healthcare providers amidst influenza virus infection and the COVID-19 pandemic",https://pubmed.ncbi.nlm.nih.gov/36841228,
LitCovid,Clinical Consequences for Individuals Treated with Tocilizumab for Serious COVID-19 Infection,https://pubmed.ncbi.nlm.nih.gov/36833140,
LitCovid,Remote Psychotherapy during the COVID-19 Pandemic: A Mixed-Methods Study on the Changes Experienced by Austrian Psychotherapists,https://pubmed.ncbi.nlm.nih.gov/36836720,
LitCovid,"SARS-CoV-2-Specific T Cell Responses in Immunocompromised Individuals with Cancer, HIV or Solid Organ Transplants",https://pubmed.ncbi.nlm.nih.gov/36839516,
LitCovid,Parent-Reported Changes in Ontario Children's Physical Activity Levels during the COVID-19 Pandemic,https://pubmed.ncbi.nlm.nih.gov/36832350,
LitCovid,Pleiotropic Functions of Nitric Oxide Produced by Ascorbate for the Prevention and Mitigation of COVID-19: A Revaluation of Pauling's Vitamin C Therapy,https://pubmed.ncbi.nlm.nih.gov/36838362,
LitCovid,Factors Influencing SARS-CoV-2 Infection Control Practices of Nurses Caring for COVID-19 Patients in South Korea: Based on Health Belief Model,https://pubmed.ncbi.nlm.nih.gov/36833918,
LitCovid,Psychosocial Factors Associated with Memory Complaints during the First Wave of the COVID-19 Pandemic: A Multi-Country Survey,https://pubmed.ncbi.nlm.nih.gov/36831792,
LitCovid,Natural Flavonoid Derivatives Have Pan-Coronavirus Antiviral Activity,https://pubmed.ncbi.nlm.nih.gov/36838279,
LitCovid,Molecular Evolution of SARS-CoV-2 during the COVID-19 Pandemic,https://pubmed.ncbi.nlm.nih.gov/36833334,
LitCovid,Exploring Radiologists' Burnout in the COVID-19 Era: A Narrative Review,https://pubmed.ncbi.nlm.nih.gov/36834044,
LitCovid,Psychological State and Exam Performance among Paramedics' Students in Geneva during the COVID-19 Pandemic: A Mixed Methods Study,https://pubmed.ncbi.nlm.nih.gov/36834431,
LitCovid,Genetic Variations of the Vitamin D Metabolic Pathway and COVID-19 Susceptibility and Severity: Current Understanding and Existing Evidence,https://pubmed.ncbi.nlm.nih.gov/36830936,
LitCovid,Impedimetric Sensing: An Emerging Tool for Combating the COVID-19 Pandemic,https://pubmed.ncbi.nlm.nih.gov/36831970,
LitCovid,The Role of Hand-Held Cardiac Ultrasound in Patients with COVID-19,https://pubmed.ncbi.nlm.nih.gov/36830776,
LitCovid,Induced Pluripotent Stem Cell-Derived Organoids: Their Implication in COVID-19 Modeling,https://pubmed.ncbi.nlm.nih.gov/36834870,
LitCovid,Age-Related Associations of Altruism with Attitudes towards COVID-19 and Vaccination: A Representative Survey in the North of Italy,https://pubmed.ncbi.nlm.nih.gov/36829417,
LitCovid,Excess mortality among non-COVID-19 surgical patients attributable to the exposure of French intensive and intermediate care units to the pandemic,https://pubmed.ncbi.nlm.nih.gov/36840798,
LitCovid,Low prevalence of influenza viruses and predominance of A(H3N2) virus with respect to SARS-CoV-2 during the 2021-2022 season in Bulgaria,https://pubmed.ncbi.nlm.nih.gov/36832544,
LitCovid,From Biowaste to Lab-Bench: Low-Cost Magnetic Iron Oxide Nanoparticles for RNA Extraction and SARS-CoV-2 Diagnostics,https://pubmed.ncbi.nlm.nih.gov/36831962,
LitCovid,"Psychological Factors Explaining the COVID-19 Pandemic Impact on Mental Health: The Role of Meaning, Beliefs, and Perceptions of Vulnerability and Mortality",https://pubmed.ncbi.nlm.nih.gov/36829391,
LitCovid,Nucleoside Analogs That Inhibit SARS-CoV-2 Replication by Blocking Interaction of Virus Polymerase with RNA,https://pubmed.ncbi.nlm.nih.gov/36834771,
LitCovid,Vaccination status and outcomes of COVID-19 patients admitted to a tertiary hospital in Iran during the dominant Delta variant period,https://pubmed.ncbi.nlm.nih.gov/36840484,
LitCovid,SARS-CoV-2 Infection and the Male Reproductive System: A Brief Review,https://pubmed.ncbi.nlm.nih.gov/36836943,
LitCovid,Role of Selective Digestive Decontamination in the Prevention of Ventilator-Associated Pneumonia in COVID-19 Patients: A Pre-Post Observational Study,https://pubmed.ncbi.nlm.nih.gov/36835966,
LitCovid,Impact of the COVID-19 pandemic on cancer care in Ireland - Perspectives from a COVID-19 and Cancer Working Group,https://pubmed.ncbi.nlm.nih.gov/36841473,
LitCovid,Cerebral Venous Sinus Thrombosis Following an mRNA COVID-19 Vaccination and Recent Oral Contraceptive Use,https://pubmed.ncbi.nlm.nih.gov/36836821,
LitCovid,China's COVID-19 reopening measures-warriors and weapons,https://pubmed.ncbi.nlm.nih.gov/36841613,
LitCovid,Apalutamide Prevents SARS-CoV-2 Infection in Lung Epithelial Cells and in Human Nasal Epithelial Cells,https://pubmed.ncbi.nlm.nih.gov/36834705,
LitCovid,SMART: A Swing-Assisted Multiplexed Analyzer for Point-of-Care Respiratory Tract Infection Testing,https://pubmed.ncbi.nlm.nih.gov/36831994,
