feed,title,long_url,short_url
LitCovid,Computational Analysis Predicts Correlations among Amino Acids in SARS-CoV-2 Proteomes,https://pubmed.ncbi.nlm.nih.gov/36831052,
LitCovid,"Influence of COVID-19 Pandemic on Colorectal Cancer Presentation, Management and Outcome during the COVID-19 Pandemic",https://pubmed.ncbi.nlm.nih.gov/36835958,
LitCovid,Evaluating Whether and How Public Health Event Information Frameworks Promote Pro-Environmental Behavior,https://pubmed.ncbi.nlm.nih.gov/36834413,
LitCovid,How the Competition for Cysteine May Promote Infection of SARS-CoV-2 by Triggering Oxidative Stress,https://pubmed.ncbi.nlm.nih.gov/36830041,
LitCovid,Loneliness and Well-Being in Children and Adolescents during the COVID-19 Pandemic: A Systematic Review,https://pubmed.ncbi.nlm.nih.gov/36832408,
LitCovid,Investigation on the Essential Oils of the Achillea Species: From Chemical Analysis to the In Silico Uptake against SARS-CoV-2 Main Protease,https://pubmed.ncbi.nlm.nih.gov/36836736,
LitCovid,Impact of COVID-19 Confinement on the Health-Related Habits of People at High Risk of Type 2 Diabetes,https://pubmed.ncbi.nlm.nih.gov/36839200,
LitCovid,Understanding the Impact of COVID-19 on Chronic Lymphocytic Leukemia (CLL) Caregiving and Related Resource Needs,https://pubmed.ncbi.nlm.nih.gov/36836183,
LitCovid,"The Clash of the Titans: COVID-19, Carbapenem-Resistant Enterobacterales, and First mcr-1-Mediated Colistin Resistance in Humans in Romania",https://pubmed.ncbi.nlm.nih.gov/36830235,
LitCovid,When Cigarette Smoking Meets COVID-19: How the Two Types of Threat and Efficacy Perceptions Interactively Predict Danger Control and Fear Control Processes,https://pubmed.ncbi.nlm.nih.gov/36833665,
LitCovid,Impact of Coronavirus Disease COVID-19 on the Relationship between Healthcare Expenditures and Sustainable Economic Growth,https://pubmed.ncbi.nlm.nih.gov/36833742,
LitCovid,The Impact of Multidrug-Resistant Acinetobacter baumannii Infection in Critically Ill Patients with or without COVID-19 Infection,https://pubmed.ncbi.nlm.nih.gov/36833021,
LitCovid,"Functional Movement Disorders during COVID-19: Psychological Distress, Affective Temperament and Emotional Dysregulation",https://pubmed.ncbi.nlm.nih.gov/36836408,
LitCovid,How COVID-19 Broke the Barriers Related to the Implementation of Telecare-Patients' Experiences with a New form of Providing Health Services in Primary Health Care,https://pubmed.ncbi.nlm.nih.gov/36833033,
LitCovid,Pre and Post Pandemic Depressive and Anxious Symptoms in Children and Adolescents in Northern Chile,https://pubmed.ncbi.nlm.nih.gov/36836135,
LitCovid,Effect of Vitamin D(3) Supplementation vs. Dietary-Hygienic Measures on SARS-CoV-2 Infection Rates in Hospital Workers with 25-Hydroxyvitamin D3 [25(OH)D3] Levels >/=20 ng/mL.,https://pubmed.ncbi.nlm.nih.gov/36838247,
LitCovid,An Intensive Longitudinal Assessment Approach to Surveilling Trajectories of Burnout over the First Year of the COVID Pandemic,https://pubmed.ncbi.nlm.nih.gov/36833628,
LitCovid,"A Creative and Movement-Based Blended Intervention for Children in Outpatient Residential Care: A Mixed-Method, Multi-Center, Single-Arm Feasibility Trial",https://pubmed.ncbi.nlm.nih.gov/36832336,
LitCovid,Which Aspects of Work Safety Satisfaction Are Important to Mental Health of Healthcare Workers during COVID-19 Pandemic in Poland?,https://pubmed.ncbi.nlm.nih.gov/36833567,
LitCovid,Investigating Dynamical Complexity and Fractal Characteristics of Bitcoin/US Dollar and Euro/US Dollar Exchange Rates around the COVID-19 Outbreak,https://pubmed.ncbi.nlm.nih.gov/36832580,
LitCovid,Influence of Information Blocking on the Spread of Virus in Multilayer Networks,https://pubmed.ncbi.nlm.nih.gov/36832598,
LitCovid,Types and Sources of Social Support Accessible to University Students with Disabilities in Saudi Arabia during the COVID-19 Pandemic,https://pubmed.ncbi.nlm.nih.gov/36832998,
LitCovid,Acute kidney failure and nephrotic syndrome secondary to COVID-19-associated focal segmental glomerulosclerosis,https://pubmed.ncbi.nlm.nih.gov/36841681,
LitCovid,Critical Care Teamwork in the Future: The Role of TeamSTEPPS((R)) in the COVID-19 Pandemic and Implications for the Future,https://pubmed.ncbi.nlm.nih.gov/36833133,
LitCovid,The Moderating Role of Family Resilience on the Relationship between COVID-19-Related Psychological Distress and Mental Health among Caregivers of Individuals with Eating Disorders in Post-Pandemic China,https://pubmed.ncbi.nlm.nih.gov/36834112,
LitCovid,A Clinical Prediction Rule for Thrombosis in Critically Ill COVID-19 Patients: Step 1 Results of the Thromcco Study,https://pubmed.ncbi.nlm.nih.gov/36835788,
LitCovid,Barriers to Telemedicine Adoption during the COVID-19 Pandemic in Taiwan: Comparison of Perceived Risks by Socioeconomic Status Correlates,https://pubmed.ncbi.nlm.nih.gov/36834205,
LitCovid,The Organization of Outreach Work for Vulnerable Patients in General Practice during COVID-19: Results from the Cross-Sectional PRICOV-19 Study in 38 Countries,https://pubmed.ncbi.nlm.nih.gov/36833862,
LitCovid,"Changes in Body Mass, Physical Activity, and Dietary Intake during the COVID-19 Pandemic Lockdowns in Canadian University Students",https://pubmed.ncbi.nlm.nih.gov/36829601,
LitCovid,COVID-19 and Acute Ischemic Stroke Mortality and Clinical Outcomes among Hospitalized Patients in the United States: Insight from National Inpatient Sample,https://pubmed.ncbi.nlm.nih.gov/36835876,
LitCovid,Changes in Physical Activity and Depression among Korean Adolescents Due to COVID-19: Using Data from the 17th (2021) Korea Youth Risk Behavior Survey,https://pubmed.ncbi.nlm.nih.gov/36833051,
LitCovid,The Course and Surgical Treatment of Acute Appendicitis during the First and Second Wave of the COVID-19 Pandemic: A Retrospective Analysis in University Affiliated Hospital in Latvia,https://pubmed.ncbi.nlm.nih.gov/36837497,
LitCovid,Neurological Consequences of Pulmonary Emboli in COVID-19 Patients: A Study of Incidence and Outcomes in the Kingdom of Saudi Arabia,https://pubmed.ncbi.nlm.nih.gov/36831886,
LitCovid,Molecular Screening of Bioactive Compounds of Garlic for Therapeutic Effects against COVID-19,https://pubmed.ncbi.nlm.nih.gov/36831179,
LitCovid,Incidence and Risk Factors for Clostridioides difficile Infections in Non-COVID and COVID-19 Patients: Experience from a Tertiary Care Hospital,https://pubmed.ncbi.nlm.nih.gov/36838400,
LitCovid,Predictors of Post-Traumatic Growth in a Sample of United Kingdom Mental and Community Healthcare Workers during the COVID-19 Pandemic,https://pubmed.ncbi.nlm.nih.gov/36834236,
LitCovid,Exploring COVID-19 Vaccine Attitudes among Racially and Ethnically Minoritized Communities: Community Partners' and Residents' Perspectives,https://pubmed.ncbi.nlm.nih.gov/36834067,
LitCovid,"Excessive Food Buying in Saudi Arabia Amid COVID-19: Examining the Effects of Perceived Severity, Religiosity, Consumption Culture and Attitude toward Behavior",https://pubmed.ncbi.nlm.nih.gov/36833820,
LitCovid,Parental Worry About COVID-19 in Preschool Children's Mothers During the Pandemic Waves: The Role of Maternal Negative Feelings and Parenting Styles,https://pubmed.ncbi.nlm.nih.gov/36840784,
LitCovid,"Challenge, threat, coping potential: How primary and secondary appraisals of job demands predict nurses' affective states during the COVID-19 pandemic",https://pubmed.ncbi.nlm.nih.gov/36840623,
LitCovid,Healthy Food Prices Increased More Than the Prices of Unhealthy Options during the COVID-19 Pandemic and Concurrent Challenges to the Food System,https://pubmed.ncbi.nlm.nih.gov/36833837,
LitCovid,Pandemic Preparedness among Big Energy Companies: Call to Research and Action,https://pubmed.ncbi.nlm.nih.gov/36833468,
LitCovid,Is a Genetic Diathesis for Poor Nutrition Becoming More Crucial Due to the Uniformity of COVID Social Stress?,https://pubmed.ncbi.nlm.nih.gov/36839316,
LitCovid,Lung Injury in COVID-19 Has Pulmonary Edema as an Important Component and Treatment with Furosemide and Negative Fluid Balance (NEGBAL) Decreases Mortality,https://pubmed.ncbi.nlm.nih.gov/36836076,
LitCovid,Microfluidics for COVID-19: From Current Work to Future Perspective,https://pubmed.ncbi.nlm.nih.gov/36831930,
LitCovid,First Impressions Matter: Immune Imprinting and Antibody Cross-Reactivity in Influenza and SARS-CoV-2,https://pubmed.ncbi.nlm.nih.gov/36839441,
LitCovid,Hope Buffers the Effect of Fear of COVID-19 on Depression among College Students: Insomnia as a Mediator,https://pubmed.ncbi.nlm.nih.gov/36833940,
LitCovid,Differences between Rural and Urban Practices in the Response to the COVID-19 Pandemic: Outcomes from the PRICOV-19 Study in 38 Countries,https://pubmed.ncbi.nlm.nih.gov/36834369,
LitCovid,Serial Changes in Blood-Cell-Count-Derived and CRP-Derived Inflammatory Indices of COVID-19 Patients,https://pubmed.ncbi.nlm.nih.gov/36832234,
LitCovid,Yeast Bloodstream Infections in the COVID-19 Patient: A Multicenter Italian Study (FiCoV Study),https://pubmed.ncbi.nlm.nih.gov/36836391,
LitCovid,Respiratory Immune Responses during Infection and Pollution Inhalation,https://pubmed.ncbi.nlm.nih.gov/36837444,
LitCovid,"Relationship between COVID-19 vaccine hesitancy and willingness to pay for the booster dose of COVID-19 vaccine of oncology patients in Taizhou, China",https://pubmed.ncbi.nlm.nih.gov/36840655,
LitCovid,Melastoma malabathricum L. Suppresses Neutrophil Extracellular Trap Formation Induced by Synthetic Analog of Viral Double-Stranded RNA Associated with SARS-CoV-2 Infection.,https://pubmed.ncbi.nlm.nih.gov/36839613,
LitCovid,Attitudes and Feelings towards the Work of Teachers Who Had a School Nurse in Their Educational Center during the COVID-19 Pandemic,https://pubmed.ncbi.nlm.nih.gov/36834273,
LitCovid,Towards Quantum-Chemical Level Calculations of SARS-CoV-2 Spike Protein Variants of Concern by First Principles Density Functional Theory,https://pubmed.ncbi.nlm.nih.gov/36831053,
LitCovid,Identification of SARS-CoV-2 Main Protease (Mpro) Cleavage Sites Using Two-Dimensional Electrophoresis and In Silico Cleavage Site Prediction,https://pubmed.ncbi.nlm.nih.gov/36834648,
LitCovid,Mental Health of Healthcare Professionals: Two Years of the COVID-19 Pandemic in Portugal,https://pubmed.ncbi.nlm.nih.gov/36833822,
LitCovid,Impacts of the COVID-19 epidemic on carbon emissions from international shipping,https://pubmed.ncbi.nlm.nih.gov/36841209,
LitCovid,Emergency Department Point-Of-Care Echocardiography and Lung Ultrasound in Predicting COVID-19 Severity,https://pubmed.ncbi.nlm.nih.gov/36840721,
LitCovid,Delayed Medical Care of Underserved Middle-Aged and Older African Americans with Chronic Disease during COVID-19 Pandemic,https://pubmed.ncbi.nlm.nih.gov/36833128,
LitCovid,Impact of COVID-19 pandemic on acute Dermatology referrals in a secondary and tertiary care Central London Hospital. A retrospective comparison review of pre-COVID-19 era and COVID-19 pandemic.,https://pubmed.ncbi.nlm.nih.gov/36840373,
LitCovid,Unexpected Repercussions of the COVID-19 Pandemic on Total Hip Arthroplasty with Cemented Hip Prosthesis versus Cementless Implants,https://pubmed.ncbi.nlm.nih.gov/36837270,
LitCovid,"Correction: Diaz-Garcia et al. Candida Genotyping of Blood Culture Isolates from Patients Admitted to 16 Hospitals in Madrid: Genotype Spreading during the COVID-19 Pandemic Driven by Fluconazole-Resistant C. parapsilosis. J. Fungi 2022, 8, 1228.",https://pubmed.ncbi.nlm.nih.gov/36836395,
LitCovid,Multisystem Inflammatory Syndrome in Adults (MIS-A) Reported in Patient with Hematological Malignancy: A Case Report,https://pubmed.ncbi.nlm.nih.gov/36836412,
LitCovid,Point-of-Care Diagnostic Biosensors to Monitor Anti-SARS-CoV-2 Neutralizing IgG/sIgA Antibodies and Antioxidant Activity in Saliva,https://pubmed.ncbi.nlm.nih.gov/36831933,
LitCovid,Vitamin D3 and COVID-19 Outcomes: An Umbrella Review of Systematic Reviews and Meta-Analyses,https://pubmed.ncbi.nlm.nih.gov/36829806,
LitCovid,Association between Circulating Amino Acids and COVID-19 Severity,https://pubmed.ncbi.nlm.nih.gov/36837819,
LitCovid,Vaccines and Autoimmunity-From Side Effects to ASIA Syndrome,https://pubmed.ncbi.nlm.nih.gov/36837564,
LitCovid,"Correction: Cipolletta et al. Risk Perception towards COVID-19: A Systematic Review and Qualitative Synthesis. Int. J. Environ. Res. Public Health 2022, 19, 4649.",https://pubmed.ncbi.nlm.nih.gov/36834469,
LitCovid,Prevalence of Burnout Syndrome and Fear of COVID-19 among Adolescent University Students,https://pubmed.ncbi.nlm.nih.gov/36832372,
LitCovid,Feasibility of Developing Audiovisual Material for Training Needs in a Vietnam Orphanage: A Mixed-Method Design,https://pubmed.ncbi.nlm.nih.gov/36833811,
LitCovid,Psychological Effect of Discrete Outbreak Events of COVID-19 on Health Information Search in China,https://pubmed.ncbi.nlm.nih.gov/36829338,
LitCovid,"Impact of COVID-19 Pandemic on Caregivers of People with an Intellectual Disability, in Comparison to Carers of Those with Other Disabilities and with Mental Health Issues: A Multicountry Study",https://pubmed.ncbi.nlm.nih.gov/36833954,
LitCovid,Assessing the Suitability of a Virtual 'Pink Warrior' for Older Breast Cancer Survivors during COVID-19: A Pilot Study,https://pubmed.ncbi.nlm.nih.gov/36836931,
LitCovid,Tele-Physical Activity Promotion Program among College Students during the COVID-19 Pandemic,https://pubmed.ncbi.nlm.nih.gov/36837532,
LitCovid,Parameters to Predict the Outcome of Severe and Critical COVID-19 Patients when Admitted to the Hospital,https://pubmed.ncbi.nlm.nih.gov/36835858,
LitCovid,Factors Influencing Spiritual Health among Nursing Students in the Prolonged COVID-19 Situation,https://pubmed.ncbi.nlm.nih.gov/36834411,
LitCovid,An Interplay between Oxidative Stress (Lactate Dehydrogenase) and Inflammation (Anisocytosis) Mediates COVID-19 Severity Defined by Routine Clinical Markers,https://pubmed.ncbi.nlm.nih.gov/36829793,
LitCovid,The Impact of an Online Mindfulness-Based Practice Program on the Mental Health of Brazilian Nurses during the COVID-19 Pandemic,https://pubmed.ncbi.nlm.nih.gov/36834361,
LitCovid,"Perception of Work-Related Stress and Quality of Life among Nurses during COVID-19 Pandemic-An International, Multicenter Prospective Study",https://pubmed.ncbi.nlm.nih.gov/36834087,
LitCovid,The Impact of the COVID-19 Pandemic on Kidney Transplant Candidate Waitlist Status across Demographic and Geographic Groups: A National Analysis of UNOS STAR Data,https://pubmed.ncbi.nlm.nih.gov/36833146,
LitCovid,"Operational Status of Isolation Rooms in Emergency Departments and Patient Concentration in Higher-Level Emergency Departments in Daegu Metropolitan City and Neighboring Provinces, South Korea, during the COVID-19 Pandemic",https://pubmed.ncbi.nlm.nih.gov/36833808,
LitCovid,Axillary Treatment Management in Breast Cancer during COVID-19 Pandemic (Association between ACOSOG Z0011 Criteria and OSNA Test),https://pubmed.ncbi.nlm.nih.gov/36836475,
LitCovid,Social Environment and Attitudes toward COVID-19 Anti-Contagious Measures: An Explorative Study from Italy,https://pubmed.ncbi.nlm.nih.gov/36834315,
LitCovid,"Indian Healthcare Workers' Issues, Challenges, and Coping Strategies during the COVID-19 Pandemic: A Cross-Sectional Study",https://pubmed.ncbi.nlm.nih.gov/36834354,
LitCovid,Neonatal Pictures in a NICU as a Mode of Nursing Intervention to Enhance Parent-Infant Bonding: Parents' Experience during the COVID Pandemic,https://pubmed.ncbi.nlm.nih.gov/36834269,
LitCovid,Opposite Effects of mRNA-Based and Adenovirus-Vectored SARS-CoV-2 Vaccines on Regulatory T Cells: A Pilot Study,https://pubmed.ncbi.nlm.nih.gov/36831046,
LitCovid,Prevalence and Factors Associated with Eating Disorders in Military First Line of Defense against COVID-19: A Cross-Sectional Study during the Second Epidemic Wave in Peru,https://pubmed.ncbi.nlm.nih.gov/36833544,
LitCovid,"Impact of the Global Fear Index (COVID-19 Panic) on the S&P Global Indices Associated with Natural Resources, Agribusiness, Energy, Metals, and Mining: Granger Causality and Shannon and Renyi Transfer Entropy",https://pubmed.ncbi.nlm.nih.gov/36832679,
LitCovid,Impact of Social Support on Depressive Symptoms among Postgraduates during the Coronavirus Disease 2019 Pandemic: A Moderated Mediation Analysis,https://pubmed.ncbi.nlm.nih.gov/36834129,
LitCovid,Distress Signals: Age Differences in Psychological Distress before and during the COVID-19 Pandemic,https://pubmed.ncbi.nlm.nih.gov/36834239,
LitCovid,Food Security in the Time of COVID-19 for a Marshallese Community,https://pubmed.ncbi.nlm.nih.gov/36833883,
LitCovid,Population Pharmacokinetics of Isavuconazole in Critical Care Patients with COVID-19-Associated Pulmonary Aspergillosis and Monte Carlo Simulations of High Off-Label Doses,https://pubmed.ncbi.nlm.nih.gov/36836325,
LitCovid,Mucorales/Fusarium Mixed Infection in Hematologic Patient with COVID-19 Complications: An Unfortunate Combination,https://pubmed.ncbi.nlm.nih.gov/36839576,
LitCovid,The Relationship between Physical Activity and Mental Depression in Older Adults during the Prevention and Control of COVID-19: A Mixed Model with Mediating and Moderating Effects,https://pubmed.ncbi.nlm.nih.gov/36833928,
LitCovid,"Financial and Other Life Stressors, Psychological Distress, and Food and Beverage Consumption among Students Attending a Large California State University during the COVID-19 Pandemic",https://pubmed.ncbi.nlm.nih.gov/36834363,
LitCovid,Role of the MicroRNAs in the Pathogenic Mechanism of Painful Symptoms in Long COVID: Systematic Review,https://pubmed.ncbi.nlm.nih.gov/36834984,
LitCovid,Telemedicine Use and the Perceived Risk of COVID-19: Patient Experience,https://pubmed.ncbi.nlm.nih.gov/36833755,
LitCovid,Chronic voice disorder after coronavirus disease 2019 infection and its treatment using the cricothyroid visor maneuver: a case report,https://pubmed.ncbi.nlm.nih.gov/36841775,
LitCovid,Assessment of Medical Students Burnout during COVID-19 Pandemic,https://pubmed.ncbi.nlm.nih.gov/36834259,
LitCovid,COVID-19 Effects on Environmentally Responsible Behavior: A Social Impact Perspective from Latin American Countries,https://pubmed.ncbi.nlm.nih.gov/36834024,
LitCovid,Undocumented immigrants suffering from inequality of vaccination access in Japan: measuring the institutional barriers and exploring the associated factors,https://pubmed.ncbi.nlm.nih.gov/36841034,
LitCovid,Effects of Tocilizumab on Inflammation and Iron Metabolism in Critically Ill Patients with COVID-19,https://pubmed.ncbi.nlm.nih.gov/36839968,
LitCovid,Community Research Fellows Training Program: Evaluation of a COVID-19-Precipitated Virtual Adaptation,https://pubmed.ncbi.nlm.nih.gov/36833948,
LitCovid,"Knowledge, Attitudes and Perceptions towards COVID-19 Vaccinations: A Cross-Sectional Survey in Pakistan",https://pubmed.ncbi.nlm.nih.gov/36837473,
LitCovid,Expanding Paid Sick Leave Laws: The Public Health Imperative,https://pubmed.ncbi.nlm.nih.gov/36840328,
LitCovid,Factors Associated with Fertility Intention among Chinese Married Youth during the COVID-19 Pandemic,https://pubmed.ncbi.nlm.nih.gov/36829413,
LitCovid,Prognostic Value of Magnesium in COVID-19: Findings from the COMEPA Study,https://pubmed.ncbi.nlm.nih.gov/36839188,
LitCovid,Phase Separation: The Robust Modulator of Innate Antiviral Signaling and SARS-CoV-2 Infection,https://pubmed.ncbi.nlm.nih.gov/36839515,
LitCovid,Disparities in greenspace access during COVID-19 mobility restrictions,https://pubmed.ncbi.nlm.nih.gov/36841525,
LitCovid,Ergonomics of E-Learning Workstations and the Prevalence of Musculoskeletal Disorders-Study among University Students,https://pubmed.ncbi.nlm.nih.gov/36834004,
LitCovid,We Are Not Islands: The Role of Social Support in the Relationship between Perceived Stress during the COVID-19 Pandemic and Psychological Distress,https://pubmed.ncbi.nlm.nih.gov/36833874,
LitCovid,"Travel patterns of patients seeking cancer care during the COVID-19 pandemic: multi-centre cohort study in Osaka, Japan",https://pubmed.ncbi.nlm.nih.gov/36841474,
LitCovid,Assessment of Excess Mortality in Italy in 2020-2021 as a Function of Selected Macro-Factors,https://pubmed.ncbi.nlm.nih.gov/36833508,
LitCovid,Insights from COVID-19: Reflecting on the Promotion of Long-Term Health Policies in China,https://pubmed.ncbi.nlm.nih.gov/36833590,
LitCovid,Boosting the Performance of Artificial Intelligence-Driven Models in Predicting COVID-19 Mortality in Ethiopia,https://pubmed.ncbi.nlm.nih.gov/36832146,
LitCovid,Change in Diet Quality and Meal Sources during the COVID-19 Pandemic in a Diverse Subset of Men and Women in the Cancer Prevention Study-3,https://pubmed.ncbi.nlm.nih.gov/36839207,
LitCovid,Smart Mask as Wearable for Post-Pandemic Personal Healthcare,https://pubmed.ncbi.nlm.nih.gov/36831971,
LitCovid,An Investigation for Future Practice of Elective Hip and Knee Arthroplasties during COVID-19 in Romania,https://pubmed.ncbi.nlm.nih.gov/36837514,
LitCovid,The Impact of COVID-19 Confinement on Substance Use and Mental Health in Portuguese Higher Education Students,https://pubmed.ncbi.nlm.nih.gov/36833153,
LitCovid,Investigation of the Exposure of Schoolchildren to Ultrafine Particles (PM(0.1)) during the COVID-19 Pandemic in a Medium-Sized City in Indonesia,https://pubmed.ncbi.nlm.nih.gov/36833643,
LitCovid,Emergence of Clonally-Related South Asian Clade I Clinical Isolates of Candida auris in a Greek COVID-19 Intensive Care Unit,https://pubmed.ncbi.nlm.nih.gov/36836357,
LitCovid,"Integrated Assessment of Heart, Lung and Lower Extremity Veins Using Hand-Held Ultrasound Device in COVID-19 Patients: Feasibility and Clinical Application",https://pubmed.ncbi.nlm.nih.gov/36832210,
LitCovid,A Novel Social Distancing Approach for Limiting the Number of Vehicles in Smart Buildings Using LiFi Hybrid-Network,https://pubmed.ncbi.nlm.nih.gov/36834127,
LitCovid,"Analysis of Bacteriophage Behavior of a Human RNA Virus, SARS-CoV-2, through the Integrated Approach of Immunofluorescence Microscopy, Proteomics and D-Amino Acid Quantification",https://pubmed.ncbi.nlm.nih.gov/36835341,
LitCovid,"Ventilator-Associated Pneumonia in COVID-19 Patients Admitted in Intensive Care Units: Relapse, Therapeutic Failure and Attributable Mortality-A Multicentric Observational Study from the OutcomeRea Network",https://pubmed.ncbi.nlm.nih.gov/36835834,
LitCovid,"Factors Affecting Access to Public Healthcare Facilities in the City of Tshwane, South Africa",https://pubmed.ncbi.nlm.nih.gov/36834345,
LitCovid,Telehealth Use in Pediatric Care during the COVID-19 Pandemic: A Qualitative Study on the Perspectives of Caregivers,https://pubmed.ncbi.nlm.nih.gov/36832439,
LitCovid,Depression and Anxiety in Old Age during the COVID-19 Pandemic: A Comparative Study of Individuals at Cardiovascular Risk and the General Population,https://pubmed.ncbi.nlm.nih.gov/36833671,
LitCovid,Infectious Pneumonia and Lung Ultrasound: A Review,https://pubmed.ncbi.nlm.nih.gov/36835938,
LitCovid,A Prospective Observational Study on Short and Long-Term Outcomes of COVID-19 Patients with Acute Hypoxic Respiratory Failure Treated with High-Flow Nasal Cannula,https://pubmed.ncbi.nlm.nih.gov/36835785,
LitCovid,Anticancer Therapy and Mortality of Adult Patients with Hematologic Malignancy and COVID-19: A Systematic Review and Meta-Analysis,https://pubmed.ncbi.nlm.nih.gov/36836738,
LitCovid,Cell Type-Specific Anti-Viral Effects of Novel SARS-CoV-2 Main Protease Inhibitors,https://pubmed.ncbi.nlm.nih.gov/36835380,
LitCovid,"Grateful Workers, Satisfied Workers? A Portuguese Study about Organizational Happiness during COVID-19 Quarantine",https://pubmed.ncbi.nlm.nih.gov/36829310,
LitCovid,Upholding Quality and Patient Safety during COVID-19 Pandemic-A Jordanian Case Study,https://pubmed.ncbi.nlm.nih.gov/36833057,
LitCovid,Altered expression of DNA methyltransferases and methylation status of the TLR4 and TNF-alpha promoters in COVID-19,https://pubmed.ncbi.nlm.nih.gov/36840831,
LitCovid,"Psychosocial Effects of COVID-19 pandemic on Yemeni healthcare workers: A Web-based, Cross-sectional Survey",https://pubmed.ncbi.nlm.nih.gov/36840952,
LitCovid,"Ethical, Legal, Organisational and Social Issues of Teleneurology: A Scoping Review",https://pubmed.ncbi.nlm.nih.gov/36834388,
LitCovid,Anxiety and Depression during the Second Wave of the COVID-19 Pandemic: The Role of Coping Strategies,https://pubmed.ncbi.nlm.nih.gov/36833670,
LitCovid,"Mobile Phones: Reservoirs of Resistant Bacteria during the COVID-19 Pandemic in Abu Dhabi, United Arab Emirates",https://pubmed.ncbi.nlm.nih.gov/36838487,
LitCovid,Suicide before and during the COVID-19 Pandemic: A Systematic Review with Meta-Analysis,https://pubmed.ncbi.nlm.nih.gov/36834037,
LitCovid,Distinguish the Severity of Illness Associated with Novel Coronavirus (COVID-19) Infection via Sustained Vowel Speech Features,https://pubmed.ncbi.nlm.nih.gov/36834110,
LitCovid,Causal Inference of Central Nervous System-Regulated Hormones in COVID-19: A Bidirectional Two-Sample Mendelian Randomization Study,https://pubmed.ncbi.nlm.nih.gov/36836216,
LitCovid,Next-Generation Sequencing in Critically Ill COVID-19 Patients with Suspected Bloodstream Infections: A Retrospective Cohort Study,https://pubmed.ncbi.nlm.nih.gov/36836001,
LitCovid,"Knotify+: Toward the Prediction of RNA H-Type Pseudoknots, Including Bulges and Internal Loops",https://pubmed.ncbi.nlm.nih.gov/36830677,
LitCovid,The association between team resilience and team performance in nurses during COVID-19 pandemic: a network analysis,https://pubmed.ncbi.nlm.nih.gov/36841817,
LitCovid,Analysis of the Return to Work Program for Disabled Workers during the Pandemic COVID-19 Using the Quality of Life and Work Ability Index: Cross-Sectional Study,https://pubmed.ncbi.nlm.nih.gov/36833789,
LitCovid,Genetic Ethnic Differences in Human 2'-5'-Oligoadenylate Synthetase and Disease Associations: A Systematic Review,https://pubmed.ncbi.nlm.nih.gov/36833454,
