feed,title,long_url,short_url
LitCovid,"Long COVID: Clinical Framing, Biomarkers, and Therapeutic Approaches",https://pubmed.ncbi.nlm.nih.gov/36836568,
LitCovid,Impact of Social Media Use on Mental Health within Adolescent and Student Populations during COVID-19 Pandemic: Review,https://pubmed.ncbi.nlm.nih.gov/36834091,
LitCovid,"Autoimmunity, COVID-19 Omicron Variant, and Olfactory Dysfunction: A Literature Review",https://pubmed.ncbi.nlm.nih.gov/36832129,
LitCovid,Tocilizumab in Combination with Corticosteroids in COVID-19 Pneumonia: A Single-Centre Retrospective Controlled Study,https://pubmed.ncbi.nlm.nih.gov/36830885,
LitCovid,Drug Reaction with Eosinophilia and Systemic Symptoms (DRESS): Focus on the Pathophysiological and Diagnostic Role of Viruses,https://pubmed.ncbi.nlm.nih.gov/36838310,
LitCovid,Psychological Adjustment Profiles of LGBTQ+ Young Adults Residing with Their Parents during the COVID-19 Pandemic: An International Study,https://pubmed.ncbi.nlm.nih.gov/36833881,
LitCovid,"Epidemiological features, genomic characteristics, and origin tracing of the COVID-19 outbreaks in Beijing from January to September 2022",https://pubmed.ncbi.nlm.nih.gov/36840406,
LitCovid,"COVID-19 Workplace Mitigation Strategies and Employee Leave Policies Implemented during the Height of the Pandemic, United States, Fall 2020 and 2021",https://pubmed.ncbi.nlm.nih.gov/36833588,
LitCovid,Increasing Couriers' Job Satisfaction through Social-Sustainability Practices: Perceived Fairness and Psychological-Safety Perspectives,https://pubmed.ncbi.nlm.nih.gov/36829354,
LitCovid,"COVID-19, Mental Health, and Chronic Illnesses: A Syndemic Perspective",https://pubmed.ncbi.nlm.nih.gov/36833955,
LitCovid,"The Role of Interventional Radiology and Management of an Angiography Suite in the Treatment of COVID-19 Patients: Single-Center, 2-Year Experience",https://pubmed.ncbi.nlm.nih.gov/36837390,
LitCovid,The Association Between Antioxidants and COVID-19 Outcomes: a Systematic Review on Observational Studies,https://pubmed.ncbi.nlm.nih.gov/36840911,
LitCovid,Enhancement of immunogenicity and neutralizing responses against SARS-CoV-2 spike protein using the Fc fusion fragment,https://pubmed.ncbi.nlm.nih.gov/36841470,
LitCovid,Research on Knowledge Learning of COVID-19 Video Viewers: Based on Cognitive Mediation Model,https://pubmed.ncbi.nlm.nih.gov/36833104,
LitCovid,Sleep and Circadian Rhythm in Relation to COVID-19 and COVID-19 Vaccination-National Sleep Survey of South Korea 2022,https://pubmed.ncbi.nlm.nih.gov/36836053,
LitCovid,Personalized Computerized Training for Cognitive Dysfunction after COVID-19: A Before-and-After Feasibility Pilot Study,https://pubmed.ncbi.nlm.nih.gov/36833793,
LitCovid,"Clinical Characteristics and Laboratory Findings in Children with Multisystem Inflammatory Syndrome (MIS-C)-A Retrospective Study of a Tertiary Care Center from Constanta, Romania",https://pubmed.ncbi.nlm.nih.gov/36833078,
LitCovid,"Alcohol Consumption, Hangovers, and Smoking among Buenos Aires University Students during the COVID-19 Pandemic",https://pubmed.ncbi.nlm.nih.gov/36836026,
LitCovid,Invasive Pulmonary Aspergillosis in Patients with and without SARS-CoV-2 Infection,https://pubmed.ncbi.nlm.nih.gov/36836245,
LitCovid,COVID-19 mRNA Vaccine Effectiveness against Elderly Frail People,https://pubmed.ncbi.nlm.nih.gov/36837403,
LitCovid,Changes in Student's Breakfast and Snack Consumption during the Second COVID-19 Lockdown in Portugal: A Five-Wave Study,https://pubmed.ncbi.nlm.nih.gov/36833732,
LitCovid,Changes of Oral and Physical Functions in Older Japanese Who Participated in Keyboard Harmonica and Exercise Classes during COVID-19-Related Movement Restrictions,https://pubmed.ncbi.nlm.nih.gov/36834392,
LitCovid,Impact of COVID-19 on Patients with Decompensated Liver Cirrhosis,https://pubmed.ncbi.nlm.nih.gov/36832088,
LitCovid,"Spillover of Vaccine Hesitancy into Adult COVID-19 and Influenza: The Role of Race, Religion, and Political Affiliation in the United States",https://pubmed.ncbi.nlm.nih.gov/36834071,
LitCovid,Distressed Work: Chronic Imperatives and Distress in Covid-19 Critical Care,https://pubmed.ncbi.nlm.nih.gov/36840335,
LitCovid,Cardiopulmonary Long-Term Sequelae in Patients after Severe COVID-19 Disease,https://pubmed.ncbi.nlm.nih.gov/36836071,
LitCovid,Exploring the Impact of Storytelling for Hospitalized Patients Recovering from COVID-19,https://pubmed.ncbi.nlm.nih.gov/36833123,
LitCovid,Use of Systemic Antibiotics in Patients with COVID-19 in Colombia: A Cross-Sectional Study,https://pubmed.ncbi.nlm.nih.gov/36830163,
LitCovid,Understanding COVID: Collaborative Government Campaign for Citizen Digital Health Literacy in the COVID-19 Pandemic,https://pubmed.ncbi.nlm.nih.gov/36836945,
LitCovid,Structural-based design of HD-TAC7 PROteolysis TArgeting chimeras (PROTACs) candidate transformations to abrogate SARS-CoV-2 infection,https://pubmed.ncbi.nlm.nih.gov/36841549,
LitCovid,Certainty in Uncertain Times: Dental Education during the COVID-19 Pandemic-A Qualitative Study,https://pubmed.ncbi.nlm.nih.gov/36833785,
LitCovid,Acute central nervous system inflammation following COVID-19 vaccination: An observational cohort study,https://pubmed.ncbi.nlm.nih.gov/36840605,
LitCovid,"Determinants of COVID-19 Knowledge, Perception and Attitudes in Indonesia: A Cross-Sectional Survey",https://pubmed.ncbi.nlm.nih.gov/36834408,
LitCovid,"Changes in Mental Health, Emotional Distress, and Substance Use Affecting Women Experiencing Violence and Their Service Providers during COVID-19 in a U.S. Southern State.",https://pubmed.ncbi.nlm.nih.gov/36833591,
LitCovid,Changes in Physical Activity Associated with Mental Health in People with Type 1 Diabetes during the COVID-19 Pandemic,https://pubmed.ncbi.nlm.nih.gov/36833773,
LitCovid,Changes in Etiology and Clinical Outcomes of Pleural empyema during the COVID-19 Pandemic,https://pubmed.ncbi.nlm.nih.gov/36838268,
LitCovid,"Religiosity, Theism, Perceived Social Support, Resilience, and Well-Being of University Undergraduate Students in Singapore during the COVID-19 Pandemic",https://pubmed.ncbi.nlm.nih.gov/36834313,
LitCovid,"Spatial and Temporal Analysis of COVID-19 Cases in West Java, Indonesia and Its Influencing Factors",https://pubmed.ncbi.nlm.nih.gov/36833893,
LitCovid,Laboratory Findings and Clinical Outcomes of ICU-admitted COVID-19 Patients: A Retrospective Assessment of Particularities Identified among Romanian Minorities,https://pubmed.ncbi.nlm.nih.gov/36836429,
LitCovid,Plasma N-Cleaved Galectin-9 Is a Surrogate Marker for Determining the Severity of COVID-19 and Monitoring the Therapeutic Effects of Tocilizumab,https://pubmed.ncbi.nlm.nih.gov/36835000,
LitCovid,Efficacy and Safety of Inhaled Ethanol in Early-Stage SARS-CoV-2 Infection in Older Adults: A Phase II Randomized Clinical Trial,https://pubmed.ncbi.nlm.nih.gov/36839987,
LitCovid,How Did the Two Years of the COVID-19 Pandemic Affect the Outcomes of the Patients with Inflammatory Rheumatic Diseases in Lithuania?,https://pubmed.ncbi.nlm.nih.gov/36837512,
LitCovid,Factors Affecting Sleep Quality of College Students during the Coronavirus Disease 2019 Pandemic: A Cross-Sectional Study,https://pubmed.ncbi.nlm.nih.gov/36837616,
LitCovid,The Diagnostic Accuracy of SARS-CoV-2 Nasal Rapid Antigen Self-Test: A Systematic Review and Meta-Analysis,https://pubmed.ncbi.nlm.nih.gov/36836639,
LitCovid,The Comparison of Retinal Microvascular Findings in Acute COVID-19 and 1-Year after Hospital Discharge Assessed with Multimodal Imaging-A Prospective Longitudinal Cohort Study,https://pubmed.ncbi.nlm.nih.gov/36835445,
LitCovid,Diet-Related Inflammation Is Associated with Worse COVID-19 Outcomes in the UK Biobank Cohort,https://pubmed.ncbi.nlm.nih.gov/36839240,
LitCovid,The Threat of Adversarial Attack on a COVID-19 CT Image-Based Deep Learning System,https://pubmed.ncbi.nlm.nih.gov/36829688,
LitCovid,Influence of COVID-19-Related Interventions on the Number of Inpatients with Acute Viral Respiratory Infections: Using Interrupted Time Series Analysis,https://pubmed.ncbi.nlm.nih.gov/36833505,
LitCovid,Blockchain-Federated and Deep-Learning-Based Ensembling of Capsule Network with Incremental Extreme Learning Machines for Classification of COVID-19 Using CT Scans,https://pubmed.ncbi.nlm.nih.gov/36829697,
LitCovid,"Value of Verbal Autopsy in a Fragile Setting: Reported versus Estimated Community Deaths Associated with COVID-19, Banadir, Somalia",https://pubmed.ncbi.nlm.nih.gov/36839600,
LitCovid,A Qualitative Study of Hospital Interior Environments during the COVID-19 Pandemic,https://pubmed.ncbi.nlm.nih.gov/36833965,
LitCovid,Impact of COVID-19 Pandemic in Antibiotic Consumption in Navarre (Spain): An Interrupted Time Series Analysis,https://pubmed.ncbi.nlm.nih.gov/36830228,
LitCovid,"""We Should Be Working Together, and It Felt like They Disrupted That"": Pregnant Women and Partners' Experiences of Maternity Care in the First UK COVID-19 Pandemic Lockdown",https://pubmed.ncbi.nlm.nih.gov/36834076,
LitCovid,"Children First, a Debate on the Restrictions to Tackle COVID-19",https://pubmed.ncbi.nlm.nih.gov/36832340,
LitCovid,"Non-Pharmacological Therapies for Post-Viral Syndromes, Including Long COVID: A Systematic Review",https://pubmed.ncbi.nlm.nih.gov/36834176,
LitCovid,Affiliation to a Social Group as a Preventive Factor in Suicidal Behaviors in Children and Adolescents during the COVID-19 Pandemic,https://pubmed.ncbi.nlm.nih.gov/36832461,
LitCovid,Social Bots' Role in the COVID-19 Pandemic Discussion on Twitter,https://pubmed.ncbi.nlm.nih.gov/36833983,
LitCovid,Impact of COVID-19 Preventative Measures on Otolaryngology in Taiwan: A Nationwide Study,https://pubmed.ncbi.nlm.nih.gov/36834066,
LitCovid,"Endogenous Catecholamine Release in COVID-19 Related Acute Respiratory Distress Syndrome: Link between Enhanced Sympathetic Stimulation, Cardiac Dysfunction and Outcome",https://pubmed.ncbi.nlm.nih.gov/36836097,
LitCovid,SARS-CoV-2 Infection: A Clinical and Histopathological Study in Pregnancy,https://pubmed.ncbi.nlm.nih.gov/36829453,
LitCovid,Using Rapid-Cycle Change to Improve COVID-19 Vaccination Strategy in Primary Care,https://pubmed.ncbi.nlm.nih.gov/36833600,
LitCovid,Update: Preoperative Evaluation of the Elective Plastic Surgery Patient in the Era of COVID-19,https://pubmed.ncbi.nlm.nih.gov/36840502,
LitCovid,Challenges in Care for Non-COVID-19 Patients with Severe Chronic Illnesses during COVID-19 Pandemic: A Qualitative Study of Healthcare Providers Working around Acute Care Hospitals in South Korea,https://pubmed.ncbi.nlm.nih.gov/36833145,
LitCovid,Unveiling the Potentiality of Shikonin Derivatives Inhibiting SARS-CoV-2 Main Protease by Molecular Dynamic Simulation Studies,https://pubmed.ncbi.nlm.nih.gov/36834524,
LitCovid,Anxiety and Depression Levels and Coping Strategies among Polish Healthcare Workers during the COVID-19 Pandemic,https://pubmed.ncbi.nlm.nih.gov/36834013,
LitCovid,Sepsis-Associated Delirium: A Narrative Review,https://pubmed.ncbi.nlm.nih.gov/36835809,
LitCovid,Screening for and Disclosure of Domestic Violence during the COVID-19 Pandemic: Results of the PRICOV-19 Cross-Sectional Study in 33 Countries,https://pubmed.ncbi.nlm.nih.gov/36834213,
LitCovid,The Effect of Vinyasa Yoga Practice on the Well-Being of Breast-Cancer Patients during COVID-19 Pandemic,https://pubmed.ncbi.nlm.nih.gov/36834464,
LitCovid,Recognizing and Responding to Anti-Science in Environmental and Public Health Research and Practice,https://pubmed.ncbi.nlm.nih.gov/36833623,
LitCovid,Maternal Vaccination and Vaccine Hesitancy,https://pubmed.ncbi.nlm.nih.gov/36841594,
LitCovid,Characterization of a Vesicular Stomatitis Virus-Vectored Recombinant Virus Bearing Spike Protein of SARS-CoV-2 Delta Variant,https://pubmed.ncbi.nlm.nih.gov/36838396,
LitCovid,"Effects of Dimerization, Dendrimerization, and Chirality in p-BthTX-I Peptide Analogs on the Antibacterial Activity and Enzymatic Inhibition of the SARS-CoV-2 PL(pro) Protein",https://pubmed.ncbi.nlm.nih.gov/36839758,
LitCovid,Phage-Derived Depolymerase: Its Possible Role for Secondary Bacterial Infections in COVID-19 Patients,https://pubmed.ncbi.nlm.nih.gov/36838389,
LitCovid,Seroprevalence of Anti-SARS-CoV-2 Antibodies Following the Omicron BA.1 Wave,https://pubmed.ncbi.nlm.nih.gov/36834360,
LitCovid,COVID-19 Causes Ferroptosis and Oxidative Stress in Human Endothelial Cells,https://pubmed.ncbi.nlm.nih.gov/36829885,
LitCovid,Why Individuals Do (Not) Use Contact Tracing Apps: A Health Belief Model Perspective on the German Corona-Warn-App,https://pubmed.ncbi.nlm.nih.gov/36833115,
LitCovid,Novel Inhibitory Role of Fenofibric Acid by Targeting Cryptic Site on the RBD of SARS-CoV-2,https://pubmed.ncbi.nlm.nih.gov/36830728,
LitCovid,The Role of Community Health Workers in the Health and Well-Being of Vulnerable Older Adults during the COVID Pandemic,https://pubmed.ncbi.nlm.nih.gov/36833462,
LitCovid,"The GABA and GABA-Receptor System in Inflammation, Anti-Tumor Immune Responses, and COVID-19",https://pubmed.ncbi.nlm.nih.gov/36830790,
LitCovid,SARS-CoV2 Infection and Comorbidity in Inmates: A Study of Central Italy,https://pubmed.ncbi.nlm.nih.gov/36833774,
LitCovid,"Evaluation of Health Care Professionals' Knowledge, Attitudes, and Practice to Prevent the Pandemic Spread of COVID-19: A Questionnaire-Based Cross-Sectional Study from Abha, Saudi Arabia",https://pubmed.ncbi.nlm.nih.gov/36833043,
LitCovid,Health Service Management and Patient Safety in Primary Care during the COVID-19 Pandemic in Kosovo,https://pubmed.ncbi.nlm.nih.gov/36834461,
LitCovid,"Trajectories of Seroprevalence and Neutralizing Activity of Antibodies against SARS-CoV-2 in Southern Switzerland between July 2020 and July 2021: An Ongoing, Prospective Population-Based Cohort Study",https://pubmed.ncbi.nlm.nih.gov/36834397,
LitCovid,Examining the Contributions of Parents' Daily Hassles and Parenting Approaches to Children's Behavior Problems during the COVID-19 Pandemic,https://pubmed.ncbi.nlm.nih.gov/36832441,
LitCovid,Materials for Infectious Diseases,https://pubmed.ncbi.nlm.nih.gov/36834707,
LitCovid,Long-Term Effects of COVID-19 Pandemic on Migraine in Adolescents. A Retrospective Analysis of the Population Attending the Headache Center in Different Phases of the Pandemic.,https://pubmed.ncbi.nlm.nih.gov/36831817,
LitCovid,Impact of Multiple COVID-19 Waves on Gynaecological Cancer Services in the UK,https://pubmed.ncbi.nlm.nih.gov/36831615,
LitCovid,The Impact of Telemedicine-Augmented Integrated Personalized Diabetes Management on Glycemic Control in Adults With Diabetes Mellitus During the COVID-19 Pandemic: A Retrospective Study,https://pubmed.ncbi.nlm.nih.gov/36840347,
LitCovid,"COVID-19 Vaccination: Comparison of Attitudes, Decision-Making Processes, and Communication among Vaccinated and Unvaccinated Black Americans",https://pubmed.ncbi.nlm.nih.gov/36834175,
LitCovid,COVID-19 Stressors and Aggression among Chinese College Students: The Mediation Role of Coping Strategies,https://pubmed.ncbi.nlm.nih.gov/36833866,
LitCovid,Cessation of Face Mask Use after COVID-19 Vaccination in Patients with Diabetes: Prevalence and Determinants,https://pubmed.ncbi.nlm.nih.gov/36833465,
LitCovid,Depression and Medicine Use among Older Adults during the COVID-19 Pandemic: The Role of Psychosocial Resources and COVID-19 Perceived Susceptibility,https://pubmed.ncbi.nlm.nih.gov/36834090,
LitCovid,"It was a pleasure to read, ""Exploring COVID-19 Vaccine Hesitancy Among Stakeholders in African American and Latinx Communities in the Deep South Through the Lens of the Health Belief Model""",https://pubmed.ncbi.nlm.nih.gov/36840695,
LitCovid,Impact of COVID-19 Infection on the Clinical Outcomes of Pulmonary Embolism Hospitalizations : A Nationwide Analysis,https://pubmed.ncbi.nlm.nih.gov/36841316,
LitCovid,Report on fraying resilience among the Ontario Registered Practical Nurse Workforce in long-term care homes during COVID-19,https://pubmed.ncbi.nlm.nih.gov/36840935,
LitCovid,A Comparison of COVID-19 and Influenza in Heart Transplant Recipients: A Nationwide Study in the United States,https://pubmed.ncbi.nlm.nih.gov/36841277,
LitCovid,The Psychological Impact of the COVID-19 Pandemic on Alcohol Abuse and Drunkorexia Behaviors in Young Adults,https://pubmed.ncbi.nlm.nih.gov/36834161,
LitCovid,mRNA-From COVID-19 Treatment to Cancer Immunotherapy,https://pubmed.ncbi.nlm.nih.gov/36830845,
LitCovid,The Role of Pre-Pandemic Mental Health Status and Personality Traits on Psychological Distress during the COVID-19 Lockdown among Italian Young Adults,https://pubmed.ncbi.nlm.nih.gov/36829370,
LitCovid,Parental Happiness Socialization and Youth Adjustment in Italy and Azerbaijan in the COVID-19 Pandemic Era,https://pubmed.ncbi.nlm.nih.gov/36834299,
LitCovid,Assessing the Clinical Characteristics and Management of COVID-19 among Pediatric Patients in Ghana: Findings and Implications,https://pubmed.ncbi.nlm.nih.gov/36830194,
LitCovid,Loneliness in University Students during Two Transitions: A Mixed Methods Approach Including Biographical Mapping,https://pubmed.ncbi.nlm.nih.gov/36834028,
LitCovid,Visiting Urban Green Space and Orientation to Nature Is Associated with Better Wellbeing during COVID-19,https://pubmed.ncbi.nlm.nih.gov/36834254,
LitCovid,The Impact of the COVID-19 Pandemic on Mental Health and Quality of Life in COVID-19 Department Healthcare Workers in Central Greece,https://pubmed.ncbi.nlm.nih.gov/36836484,
LitCovid,Cellular and Humoral Responses in Dialysis Patients after Vaccination with the BNT162b2 or mRNA-1273 Vaccines,https://pubmed.ncbi.nlm.nih.gov/36836831,
LitCovid,Adapting Family Planning Service Delivery in Title X and School-Based Settings during COVID-19: Provider and Staff Experiences,https://pubmed.ncbi.nlm.nih.gov/36834286,
LitCovid,Artificial Intelligence-Assisted Chest X-ray for the Diagnosis of COVID-19: A Systematic Review and Meta-Analysis,https://pubmed.ncbi.nlm.nih.gov/36832072,
LitCovid,Encephalopathy after COVID-19 vaccination during treatment with nivolumab: A case report,https://pubmed.ncbi.nlm.nih.gov/36841006,
LitCovid,"Being a Parent of Children with Disabilities during the COVID-19 Pandemic: Multi-Method Study of Health, Social Life, and Occupational Situation",https://pubmed.ncbi.nlm.nih.gov/36833804,
LitCovid,Australian Youth Resilience and Help-Seeking during COVID-19: A Cross-Sectional Study,https://pubmed.ncbi.nlm.nih.gov/36829350,
LitCovid,"Changes in Apathy, Depression, and Anxiety in Parkinson's Disease from before to during the COVID-19 Era",https://pubmed.ncbi.nlm.nih.gov/36831742,
LitCovid,COVID-19 Related Early Google Search Behavior and Health Communication in the United States: Panel Data Analysis on Health Measures,https://pubmed.ncbi.nlm.nih.gov/36833701,
LitCovid,Physical Activity in the COVID-19 Era and Its Impact on Adolescents' Well-Being,https://pubmed.ncbi.nlm.nih.gov/36833968,
LitCovid,"Correspondence between Aortic and Arterial Stiffness, and Diastolic Dysfunction in Apparently Healthy Female Patients with Post-Acute COVID-19 Syndrome",https://pubmed.ncbi.nlm.nih.gov/36831027,
LitCovid,COVID-19 Pandemic Has Changed the Psychiatric Profile of Adolescents Attempting Suicide: A Cross-Sectional Comparison,https://pubmed.ncbi.nlm.nih.gov/36833651,
LitCovid,Equity in provision and access to obstetric anaesthesia care in Nigeria,https://pubmed.ncbi.nlm.nih.gov/36841064,
LitCovid,Real-World Clinical Outcomes of Molnupiravir for the Treatment of Mild to Moderate COVID-19 in Adult Patients during the Dominance of the Omicron Variant: A Meta-Analysis,https://pubmed.ncbi.nlm.nih.gov/36830302,
LitCovid,A Prospective Evaluation of the Effects of the COVID-19 Pandemic on Youth with Primary Headache Disorders,https://pubmed.ncbi.nlm.nih.gov/36832313,
LitCovid,"Long COVID-19 Syndrome Severity According to Sex, Time from the Onset of the Disease, and Exercise Capacity-The Results of a Cross-Sectional Study",https://pubmed.ncbi.nlm.nih.gov/36836865,
LitCovid,Molnupiravir: A Versatile Prodrug against SARS-CoV-2 Variants,https://pubmed.ncbi.nlm.nih.gov/36837928,
LitCovid,Occupational well-being of the work community in social and health care education during the COVID-19 pandemic-A cross-sectional study,https://pubmed.ncbi.nlm.nih.gov/36829291,
LitCovid,Impact of the COVID-19 Pandemic on Inappropriate Use of the Emergency Department,https://pubmed.ncbi.nlm.nih.gov/36838388,
LitCovid,"Influence of the Sanitary, Economic, and Social Crisis of COVID-19 on the Emotional State of Dentistry in Galicia (Spain)",https://pubmed.ncbi.nlm.nih.gov/36833783,
LitCovid,Monocytic HLA-DR Expression in Immune Responses of Acute Pancreatitis and COVID-19,https://pubmed.ncbi.nlm.nih.gov/36834656,
LitCovid,SARS-CoV-2 Induces Epithelial-Enteric Neuronal Crosstalk Stimulating VIP Release,https://pubmed.ncbi.nlm.nih.gov/36830577,
LitCovid,"The immunogenicity of an extended dosing interval of BNT162b2 against SARS-CoV-2 Omicron variant among healthy school-aged children, a randomized controlled trial",https://pubmed.ncbi.nlm.nih.gov/36841501,
LitCovid,Effect of the COVID-19 Pandemic on Surgical Outcomes for Rhegmatogenous Retinal Detachments,https://pubmed.ncbi.nlm.nih.gov/36836058,
LitCovid,Time to Lift up COVID-19 Restrictions? Public Support towards Living with the Virus Policy and Associated Factors among Hong Kong General Public,https://pubmed.ncbi.nlm.nih.gov/36833683,
LitCovid,Potential of Nano-Antioxidants and Nanomedicine for Recovery from Neurological Disorders Linked to Long COVID Syndrome,https://pubmed.ncbi.nlm.nih.gov/36829952,
LitCovid,Danger Zone or Newfound Freedoms: Exploring Women and Girls' Experiences in the Virtual Space during COVID-19 in Iraq,https://pubmed.ncbi.nlm.nih.gov/36834092,
LitCovid,Mechanisms of Physical Exercise Effects on Anxiety in Older Adults during the COVID-19 Lockdown: An Analysis of the Mediating Role of Psychological Resilience and the Moderating Role of Media Exposure,https://pubmed.ncbi.nlm.nih.gov/36834282,
LitCovid,Analysis of Non-Compulsory Influenza and COVID-19 Vaccination among Polish Soldiers,https://pubmed.ncbi.nlm.nih.gov/36833996,
LitCovid,The Association between Physical and Psychological Domestic Violence Experienced during the COVID-19 Pandemic and Mental Health Symptoms,https://pubmed.ncbi.nlm.nih.gov/36834007,
LitCovid,PEGylation Prolongs the Half-Life of Equine Anti-SARS-CoV-2 Specific F(ab')(2),https://pubmed.ncbi.nlm.nih.gov/36834803,
LitCovid,"The Association of Social Support and Loneliness with Symptoms of Depression, Anxiety, and Posttraumatic Stress during the COVID-19 Pandemic: A Meta-Analysis",https://pubmed.ncbi.nlm.nih.gov/36833463,
LitCovid,Quinones as Promising Compounds against Respiratory Viruses: A Review,https://pubmed.ncbi.nlm.nih.gov/36838969,
LitCovid,"COVID-19 Detection by Means of ECG, Voice, and X-ray Computerized Systems: A Review",https://pubmed.ncbi.nlm.nih.gov/36829692,
LitCovid,Continuous Exposure to Terrorism during the COVID-19 Pandemic: A Moderated Mediation Model in the Israeli Context,https://pubmed.ncbi.nlm.nih.gov/36833494,
LitCovid,COVID-19 Affects Serum Brain-Derived Neurotrophic Factor and Neurofilament Light Chain in Aged Men: Implications for Morbidity and Mortality,https://pubmed.ncbi.nlm.nih.gov/36831321,
LitCovid,Impact of Bacterial Infections on COVID-19 Patients: Is Timing Important?,https://pubmed.ncbi.nlm.nih.gov/36830290,
LitCovid,The Mental Health Burden of Patients with Colorectal Cancer Receiving Care during the COVID-19 Pandemic: Results of the PICO-SM Study,https://pubmed.ncbi.nlm.nih.gov/36831568,
LitCovid,Prognostic models in COVID-19 infection that predict severity: a systematic review,https://pubmed.ncbi.nlm.nih.gov/36840867,
LitCovid,"The Work, Economic, and Remittance Stress and Distress of the COVID-19 Pandemic Containment Policies: The Case of Venezuelan Migrants in Argentina and Chile",https://pubmed.ncbi.nlm.nih.gov/36834263,
LitCovid,Dementia and COVID-19 among Older African American Adults: A Scoping Review of Healthcare Access and Resources,https://pubmed.ncbi.nlm.nih.gov/36834189,
LitCovid,Validation of Rapid and Economic Colorimetric Nanoparticle Assay for SARS-CoV-2 RNA Detection in Saliva and Nasopharyngeal Swabs,https://pubmed.ncbi.nlm.nih.gov/36832041,
LitCovid,"Towards Effective, Sustainable Solution for Hospital Wastewater Treatment to Cope with the Post-Pandemic Era",https://pubmed.ncbi.nlm.nih.gov/36833551,
LitCovid,A Systematic Review of Chest Imaging Findings in Long COVID Patients,https://pubmed.ncbi.nlm.nih.gov/36836515,
LitCovid,Synthesising evidence of the effects of COVID-19 regulatory changes on methadone treatment for opioid use disorder: implications for policy,https://pubmed.ncbi.nlm.nih.gov/36841564,
LitCovid,"Fear God, Not COVID-19: Is Conservative Protestantism Associated with Risky Pandemic Lifestyles?",https://pubmed.ncbi.nlm.nih.gov/36833117,
LitCovid,"Therapeutic Approaches to Dysautonomia in Childhood, with a Special Focus on Long COVID",https://pubmed.ncbi.nlm.nih.gov/36832445,
LitCovid,Acute Myocarditis and Pericarditis After m-RNA COVID-19 Vaccinations-A Single-Centre Retrospective Analysis,https://pubmed.ncbi.nlm.nih.gov/36841638,
LitCovid,Comparing the Clinical Manifestations of Bell's Palsy between Pre-COVID-19 Pandemic and COVID-19 Pandemic Periods,https://pubmed.ncbi.nlm.nih.gov/36836235,
LitCovid,From the first to the fourth critical period of COVID-19: what has changed in nursing practice environments in hospital settings?,https://pubmed.ncbi.nlm.nih.gov/36841780,
LitCovid,Maternal Psychopathological Profile during Childbirth and Neonatal Development during the COVID-19 Pandemic: A Pre-Posttest Study,https://pubmed.ncbi.nlm.nih.gov/36829309,
LitCovid,SARS-CoV-2 Infection as a Possible Trigger for IgA-Associated Vasculitis: A Case Report,https://pubmed.ncbi.nlm.nih.gov/36832473,
