feed,title,long_url,short_url
GN:S:C,Letter: Climate facts and climate solutions - Bangor Daily News,https://www.bangordailynews.com/2022/11/06/opinion/letters/letter-climate-facts-and-climate-solutions/,
GN:S:C,COP27: How is Northern Ireland tackling climate change? - BBC,https://www.bbc.com/news/uk-northern-ireland-63520214,
GN:S:C,"Iraq stands up for the environment at COP 27, UN climate change conference [EN/AR] - Iraq - ReliefWeb",https://reliefweb.int/report/iraq/iraq-stands-environment-cop-27-un-climate-change-conference-enar,
GN:S:C,FACT SHEET: President Biden’s Executive Actions on Climate to Address Extreme Heat and Boost Offshore Wind - The White House,https://www.whitehouse.gov/briefing-room/statements-releases/2022/07/20/fact-sheetpresident-bidens-executive-actions-on-climate-to-address-extreme-heat-and-boost-offshore-wind/,
GN:S:C,July 2022 Global Climate Report - National Centers for Environmental Information,https://www.ncei.noaa.gov/access/monitoring/monthly-report/global/202207,
