feed,title,long_url,short_url
GN:T:RE,Perciasepe: State's Net-Zero Emissions Goals Can't Be Met Anytime Soon Without Nuclear Power - Josh Kurtz,https://www.marylandmatters.org/2022/03/11/perciasepe-states-net-zero-emissions-goals-cant-be-met-anytime-soon-without-nuclear-power/,
GN:T:RE,Green groups say gas crisis makes transition to renewables even more urgent | TheHill - The Hill,https://thehill.com/policy/energy-environment/597743-green-groups-democrats-say-gas-crisis-makes-transition-to,
GN:T:RE,New law: HOAs can no longer stop homeowners from getting rooftop solar - IndyStar,https://www.indystar.com/story/news/environment/2022/03/11/indiana-solar-panels-homeowners-association-hoa/6987099001/,
GN:T:RE,Trevor Noah: Putin has ‘shined a spotlight’ on fossil fuel dependency - The Guardian,https://www.theguardian.com/culture/2022/mar/10/trevor-noah-putin-oil-seth-meyers-stephen-colbert,
GN:T:RE,Scotland sourced almost all 'gross electricity' from renewables in 2020 - pv magazine International,https://www.pv-magazine.com/2022/03/10/scotland-sourced-almost-all-gross-electricity-from-renewables-in-2020/,
