feed,title,long_url,short_url
GN:S:RL,Reinforcement learning of adaptive control strategies | Communications Psychology - Nature,https://news.google.com/rss/articles/CBMiMmh0dHBzOi8vd3d3Lm5hdHVyZS5jb20vYXJ0aWNsZXMvczQ0MjcxLTAyNC0wMDA1NS150gEA?oc=5,https://da.gd/xjAx7
GN:S:RL,What is RLHF? - IBM,https://news.google.com/rss/articles/CBMiH2h0dHBzOi8vd3d3LmlibS5jb20vdG9waWNzL3JsaGbSAQA?oc=5,https://da.gd/ajXA
GN:S:RL,Distributional reinforcement learning in prefrontal cortex - Nature,https://news.google.com/rss/articles/CBMiMmh0dHBzOi8vd3d3Lm5hdHVyZS5jb20vYXJ0aWNsZXMvczQxNTkzLTAyMy0wMTUzNS130gEA?oc=5,https://da.gd/EckTV
GN:S:RL,Reinforcement learning algorithm captures previously inaccessible mesoscale phenomena - Argonne National Laboratory,https://news.google.com/rss/articles/CBMidWh0dHBzOi8vd3d3LmFubC5nb3YvY25tL2FydGljbGUvcmVpbmZvcmNlbWVudC1sZWFybmluZy1hbGdvcml0aG0tY2FwdHVyZXMtcHJldmlvdXNseS1pbmFjY2Vzc2libGUtbWVzb3NjYWxlLXBoZW5vbWVuYdIBAA?oc=5,https://da.gd/ov3K
GN:S:RL,"RLAIF: Reinforcement Learning from AI Feedback | by Cameron R. Wolfe, Ph.D. | Jan, 2024 - Towards Data Science",https://news.google.com/rss/articles/CBMiWWh0dHBzOi8vdG93YXJkc2RhdGFzY2llbmNlLmNvbS9ybGFpZi1yZWluZm9yY2VtZW50LWxlYXJuaW5nLWZyb20tYWktZmVlZGJhY2stZDdkYmRhZThmMDkz0gEA?oc=5,https://da.gd/C0ZyRa
GN:S:RL,Author Correction: Self-play reinforcement learning guides protein engineering - Nature,https://news.google.com/rss/articles/CBMiMmh0dHBzOi8vd3d3Lm5hdHVyZS5jb20vYXJ0aWNsZXMvczQyMjU2LTAyMy0wMDcxMy020gEA?oc=5,https://da.gd/O1H1Rn
GN:S:RL,Deep reinforcement learning spacecraft guidance with state uncertainty for autonomous shape reconstruction of ... - ScienceDirect,https://news.google.com/rss/articles/CBMiQ2h0dHBzOi8vd3d3LnNjaWVuY2VkaXJlY3QuY29tL3NjaWVuY2UvYXJ0aWNsZS9waWkvUzAyNzMxMTc3MjMwMDUyNzbSAQA?oc=5,https://da.gd/yJ70L
GN:S:RL,"Teaching AI to Play Board Games. Using reinforcement learning from… | by Heiko Hotz | Dec, 2023 - Towards Data Science",https://news.google.com/rss/articles/CBMiS2h0dHBzOi8vdG93YXJkc2RhdGFzY2llbmNlLmNvbS90ZWFjaGluZy1haS10by1wbGF5LWJvYXJkLWdhbWVzLTc3ZTVkMTc0OWRkOdIBAA?oc=5,https://da.gd/PmbW3
GN:S:RL,Top 10 Machine Learning Projects and Ideas For Beginners - Simplilearn,https://news.google.com/rss/articles/CBMiS2h0dHBzOi8vd3d3LnNpbXBsaWxlYXJuLmNvbS9tYWNoaW5lLWxlYXJuaW5nLXByb2plY3RzLWZvci1iZWdpbm5lcnMtYXJ0aWNsZdIBAA?oc=5,https://da.gd/rSxyUC
