feed,title,long_url,short_url
j:MDPI:N,Association of Maternal Dietary Habits and Infant MTHFR Gene Polymorphisms with Ventricular Septal Defect in Offspring: A Case–Control Study,https://mdpi.com/2072-6643/16/13/2005,
j:MDPI:N,The Impact of Vitamin D and L-Cysteine Co-Supplementation on Upregulating Glutathione and Vitamin D-Metabolizing Genes and in the Treatment of Circulating 25-Hydroxy Vitamin D Deficiency,https://mdpi.com/2072-6643/16/13/2004,
j:MDPI:N,The Lipid-Metabolism-Associated Anti-Obesity Properties of Rapeseed Diacylglycerol Oil,https://mdpi.com/2072-6643/16/13/2003,
j:MDPI:N,Regulations of Citrus Pectin Oligosaccharide on Cholesterol Metabolism: Insights from Integrative Analysis of Gut Microbiota and Metabolites,https://mdpi.com/2072-6643/16/13/2002,
j:MDPI:N,"Integrative Approach of Treating Early Undernutrition with an Enriched Black Corn Chip, Study on a Murine Model",https://mdpi.com/2072-6643/16/13/2001,
j:MDPI:N,Health and Nutrition Promotion Programs in Papua New Guinea: A Scoping Review,https://mdpi.com/2072-6643/16/13/1999,
j:MDPI:N,More Adult Women than Men at High Cardiometabolic Risk Reported Worse Lifestyles and Self-Reported Health Status in the COVID-19 Lockdown,https://mdpi.com/2072-6643/16/13/2000,
