feed,title,long_url,short_url
GN:T:RE,6 Cities and Local Governments Accelerating Zero Carbon Buildings - TheCityFix,https://thecityfix.com/blog/six-cities-and-local-governments-accelerating-zero-carbon-buildings/,
GN:T:RE,Photovoltaics vs. nuclear power on Mars – pv magazine International - pv magazine International,https://www.pv-magazine.com/2022/04/28/photovoltaics-vs-nuclear-power-on-mars/,
GN:T:RE,Florida gov vetoes bill that would end solar power credits - WJXT News4JAX,https://www.news4jax.com/business/2022/04/27/florida-gov-vetoes-bill-that-would-end-solar-power-credits/,
GN:T:RE,The US generated a record 18% of its electricity from wind and solar in March - Electrek,https://electrek.co/2022/04/28/the-us-generated-a-record-18-of-its-electricity-from-wind-and-solar-in-march/,
GN:T:RE,Palau reaffirms commitment to generating 100% renewable energy by 2032 - Maui Now,https://mauinow.com/2022/04/28/palau-reaffirms-commitment-to-generating-100-renewable-energy-by-2032/,
