feed,title,long_url,short_url
GN:T:NF,Toshiba completes initial toroidal field coil for ITER : New Nuclear - World Nuclear News,https://world-nuclear-news.org/Articles/Toshiba-completes-initial-toroidal-field-coil-for,
GN:T:NF,EUROfusion Entrusts BSC with Creation of Advanced Computing Hub for Fusion Energy - HPCwire,https://www.hpcwire.com/off-the-wire/eurofusion-entrusts-bsc-with-creation-of-advanced-computing-hub-for-fusion-energy/,
GN:T:NF,Team improves polar direct drive fusion neutron sources for use in laser experiments - Phys,https://phys.org/news/2021-04-team-polar-fusion-neutron-sources.html,
GN:T:NF,Record neutron numbers at Sandia Labs’ Z machine fusion experiments - Newswise,https://www.newswise.com/articles/record-neutron-numbers-at-sandia-labs-z-machine-fusion-experiments,
GN:T:NF,Machine-learning technique from Sandia Labs could improve fusion energy outputs - EurekAlert,https://www.eurekalert.org/pub_releases/2020-10/dnl-mtf101220.php,
