feed,title,long_url,short_url
GN:T:WP,Simple Tax Changes Can Unleash Clean Energy Deployment In USA - CleanTechnica,https://cleantechnica.com/2021/06/19/simple-tax-changes-can-unleash-clean-energy-deployment-in-usa/,
GN:T:WP,"Artificial Photosynthesis Promises Clean, Sustainable Source of Energy - SciTechDaily",https://scitechdaily.com/artificial-photosynthesis-promises-clean-sustainable-source-of-energy/,
GN:T:WP,Xcel Energy sets new regional wind energy records - Amarillo,https://www.amarillo.com/story/business/2021/06/18/xcel-energy-sets-new-regional-wind-energy-records/7734168002/,
GN:T:WP,Seattle Receives Giant Container Cranes Preparing for T5 Reopening - The Maritime Executive,https://www.maritime-executive.com/article/seattle-receives-giant-container-cranes-preparing-for-t5-reopening,
GN:T:WP,The U.S. consumed a record amount of renewable energy in 2020 - Houston Chronicle,https://www.houstonchronicle.com/business/energy/article/The-U-S-consumed-a-record-amount-of-renewable-16257281.php,
GN:T:WP,Fall River Electric to hosts Energy Expo today - East Idaho News,https://www.eastidahonews.com/2021/06/fall-river-electric-to-hosts-energy-expo-today/,
