feed,title,long_url,short_url
GN:T:RE,Renewable energy meets entire Greece's power demand for the first time - Interesting Engineering,https://interestingengineering.com/culture/greece-powered-by-renewables-first-time,
GN:T:RE,Want green energy but can’t afford solar panels? Buy a bit of a wind farm - Euronews,https://www.euronews.com/green/2022/10/12/want-green-energy-but-cant-afford-solar-panels-buy-a-bit-of-a-wind-farm,
GN:T:RE,"Subsea cable to bring wind, solar power from Egypt to Europe - pv magazine International",https://www.pv-magazine.com/2022/10/12/subsea-cable-to-bring-wind-solar-power-from-egypt-to-europe/,
GN:T:RE,Hitachi Energy will expand its Virginia power transformer factory to meet soaring US demand - Electrek,https://electrek.co/2022/10/12/hitachi-energy-power-transformer-factory/,
GN:T:RE,Putin blames Europe for energy crisis as EU works on remedies - Reuters,https://www.reuters.com/business/energy/polish-oil-pipe-hit-by-leak-eu-ministers-tackle-energy-crisis-2022-10-12/,
