feed,title,long_url,short_url
ArXiv,ASM2TV: An Adaptive Semi-Supervised Multi-Task Multi-View Learning Framework,https://arxiv.org/abs/2105.08643v1,
ArXiv,A Human-in-the-loop Framework to Construct Context-aware Mathematical Notions of Outcome Fairness,https://arxiv.org/abs/1911.03020v2,
ArXiv,ENTMOOT: A Framework for Optimization over Ensemble Tree Models,https://arxiv.org/abs/2003.04774v3,
ArXiv,ModelPS: An Interactive and Collaborative Platform for Editing Pre-trained Models at Scale,https://arxiv.org/abs/2105.08275v1,
ArXiv,A Clustering Framework for Residential Electric Demand Profiles,https://arxiv.org/abs/2105.08537v1,
ArXiv,A multimodal deep learning framework for scalable content based visual media retrieval,https://arxiv.org/abs/2105.08665v1,
ArXiv,OmiEmbed: a unified multi-task deep learning framework for multi-omics data,https://arxiv.org/abs/2102.02669v2,
