feed,title,long_url,short_url
GN:S:C,The SEC Sets Its Sights On Climate Change - Forbes,https://www.forbes.com/sites/kevindowd/2021/06/27/the-sec-sets-its-sights-on-climate-change/,
GN:S:C,Report Predicts Drastic Change In Yellowstone National Park's Climate - National Parks Traveler,https://www.nationalparkstraveler.org/2021/06/report-predicts-drastic-change-yellowstone-national-parks-climate-0,
GN:S:C,'The house is burning': Palestinian activists pick up the climate justice gauntlet - Haaretz,https://www.haaretz.com/israel-news/.premium.MAGAZINE-the-house-is-burning-palestinian-activists-pick-up-the-climate-justice-gauntlet-1.9945165,
GN:S:C,Eternals #5 Preview - The Upside of Climate Change - Bleeding Cool News,https://bleedingcool.com/comics/eternals-5-preview-the-upside-of-climate-change/,
GN:S:C,The Biggest Obstacle In The Climate Fight? Not Enough Women Leaders – Q&A w/ She Changes Climate Co-Founder Bianca Pitt - Green Queen Media,https://www.greenqueen.com.hk/the-biggest-obstacle-in-the-climate-fight-not-enough-women-leaders-qa-w-she-changes-climate-co-founder-bianca-pitt/,
GN:S:C,The Crypto Climate Accord Walks a Fine Line Between Self-Interest and the Greater Good – Op-Ed Bitcoin News - Bitcoin News,https://news.bitcoin.com/crypto-climate-accord-walks-fine-line-between-self-interest-and-greater-good/,
