feed,title,long_url,short_url
GN:S:C,‘Vicious cycle’: Storms intensify in the Gulf as climate changes - Al Jazeera English,https://www.aljazeera.com/news/2022/6/2/a-vicious-cycle-intensifying-storms-in-gulf-as-climate-changes,
GN:S:C,"Here’s how climate change will impact the Boston area, according to a new report - Boston",https://www.boston.com/news/environment/2022/06/02/heres-how-climate-change-will-impact-the-boston-area-according-to-a-new-report/,
GN:S:C,Readers respond: Learn from young climate protesters - OregonLive,https://www.oregonlive.com/opinion/2022/06/readers-respond-learn-from-young-climate-protesters.html,
GN:S:C,Scientists develop environmental justice lens to identify neighborhoods vulnerable to climate change - Phys,https://phys.org/news/2022-06-scientists-environmental-justice-lens-neighborhoods.html,
GN:S:C,"Summit of the Americas: Climate on the agenda, but tensions will dominate - Diálogo Chino",https://dialogochino.net/en/climate-energy/54589-summit-of-the-americas-climate-agenda-tensions-dominate/,
GN:S:C,"Bill McKibben, dirty deals & unrecognizable seasons - DW (English)",https://www.dw.com/en/bill-mckibben-dirty-deals-unrecognizable-seasons/av-62014619,
GN:S:C,Climate crisis making Britain wetter as Europe sees 'extreme' rainfall changes - The Independent,https://www.independent.co.uk/climate-change/news/met-office-study-rainfall-europe-b2092605.html,
GN:S:C,Impact of climate change on river water temperature and dissolved oxygen: Indian riverine thermal regimes | Scientific Reports - Nature,https://www.nature.com/articles/s41598-022-12996-7,
GN:S:C,Greenpeace: European Airlines Not Doing Enough to Protect Climate - Aviation Pros,https://www.aviationpros.com/aircraft/commercial-airline/news/21269727/greenpeace-european-airlines-not-doing-enough-to-protect-climate,
