feed,title,long_url,short_url
GN:T:SL,Barnstable County climate change plan wins assembly and community approval - Cape Cod Times,https://www.capecodtimes.com/story/news/2021/02/22/cape-cod-commission-climate-change-plan-approved-county-delegates/6765821002/,
GN:T:SL,Ga. House OKs bill to prohibit local bans against natural gas hookups - Georgia Recorder,https://georgiarecorder.com/2021/02/23/ga-house-oks-bill-to-prohibit-local-bans-against-natural-gas-hookups/,
GN:T:SL,Annapolis sues 26 oil and gas companies for their role in contributing to climate change - Capital Gazette,https://www.capitalgazette.com/maryland/annapolis/ac-cn-annapolis-fossil-fuels-lawsuit-20210222-20210223-vs2ff7eiibfgje6fvjwticys2i-story.html,
GN:T:SL,Climate change: 5 places where global warming is a security risk - Thomson Reuters Foundation,https://news.trust.org/item/20210223112425-ykgvq,
GN:T:SL,UP's third international airport in Kushinagar gets DGCA's nod | Details - IBTimes India,https://www.ibtimes.co.in/s-third-international-airport-kushinagar-gets-dgcas-nod-details-833516,
