feed,title,long_url,short_url
ArXiv:eess,HEAR: An EEG Foundation Model with Heterogeneous Electrode Adaptive Representation,https://arxiv.org/abs/2510.12515,
ArXiv:eess,Disentangling Neurodegeneration with Brain Age Gap Prediction Models: A Graph Signal Processing Perspective,https://arxiv.org/abs/2510.12763,
ArXiv:eess,Variational Quantum Eigensolver Models of Molecular Quantum Dot Cellular Automata,https://arxiv.org/abs/2510.12656,
ArXiv:eess,Robust Real-Time Endoscopic Stereo Matching under Fuzzy Tissue Boundaries,https://arxiv.org/abs/2503.00731,
ArXiv:eess,Semi-Unsupervised Microscopy Segmentation with Fuzzy Logic and Spatial Statistics for Cross-Domain Analysis Using a GUI,https://arxiv.org/abs/2508.15979,
ArXiv:eess,"Algorithmic Implementation: An Introduction to a Low-Cost, GUI-Based, Semi-Unsupervised Microscopy Segmentation Framework",https://arxiv.org/abs/2509.11354,
