feed,title,long_url,short_url
ArXiv:q-bio,Adaptive Nonparametric Psychophysics,https://arxiv.org/abs/2104.09549v1,
ArXiv:q-bio,Accelerating key bioinformatics tasks 100-fold by improving memory access,https://arxiv.org/abs/2104.09565v1,
ArXiv:q-bio,Strategies for COVID-19 vaccination under a shortage scenario: a geo-stochastic modelling approach,https://arxiv.org/abs/2104.09590v1,
ArXiv:q-bio,A model of COVID-19 pandemic evolution in African countries,https://arxiv.org/abs/2104.09675v1,
ArXiv:q-bio,Neural tuning and representational geometry,https://arxiv.org/abs/2104.09743v1,
ArXiv:q-bio,Enzyme regulation and mutation in a model serial dilution ecosystem,https://arxiv.org/abs/2104.09769v1,
ArXiv:q-bio,The principle of weight divergence facilitation for unsupervised pattern recognition in spiking neural networks,https://arxiv.org/abs/2104.09943v1,
ArXiv:q-bio,Dynamics of COVID-19 mitigation inefficiency in Brazil,https://arxiv.org/abs/2104.09999v1,
ArXiv:q-bio,Theoretical Modeling of Structure-Toxicity Relationship of Cyanides,https://arxiv.org/abs/2104.10031v1,
ArXiv:q-bio,Cross-population coupling of neural activity based on Gaussian process current source densities,https://arxiv.org/abs/2104.10070v1,
ArXiv:q-bio,Exploring Evolved Multicellular Life Histories in a Open-Ended Digital Evolution System,https://arxiv.org/abs/2104.10081v1,
ArXiv:q-bio,Modeling biological networks: from single gene systems to large microbial communities,https://arxiv.org/abs/2104.10082v1,
ArXiv:q-bio,Accessibility Percolation on Cartesian Power Graphs,https://arxiv.org/abs/1912.07925v2,
ArXiv:q-bio,"covid19.analytics: An R Package to Obtain, Analyze and Visualize Data from the Coronavirus Disease Pandemic",https://arxiv.org/abs/2009.01091v2,
ArXiv:q-bio,Species-area relationships emerge from the assembly of complex ecological communities,https://arxiv.org/abs/2103.07721v2,
ArXiv:q-bio,Transcription-translation machinery -- an autocatalytic network coupling all cellular cycles and generating a plethora of growth laws,https://arxiv.org/abs/2103.15356v2,
ArXiv:q-bio,A contrastive rule for meta-learning,https://arxiv.org/abs/2104.01677v2,
