feed,title,long_url,short_url
GN:S:C,Americans Are Well Aware Of Climate Change — But Not About The Government's Efforts To Fight It - FiveThirtyEight,https://fivethirtyeight.com/features/climate-change-inflation/,
GN:S:C,The moral imperative to tackle climate change - Colorado Newsline,https://coloradonewsline.com/2022/08/19/the-moral-imperative-to-tackle-climate-change/,
GN:S:C,Climate Policy Workshop at Rangeley Public Library - Lewiston Sun Journal - Lewiston Sun Journal,https://www.sunjournal.com/2022/08/19/climate-policy-workshop-at-rangeley-public-library/,
GN:S:C,Covid – not climate change – has nudged Australians towards greener lifestyles: study - Eco-Business,https://www.eco-business.com/news/covid-not-climate-change-has-nudged-australians-towards-greener-lifestyles-study/,
GN:S:C,5 documentaries exploring Indigenous wisdom and climate justice | Greenbiz - GreenBiz,https://www.greenbiz.com/article/5-documentaries-exploring-indigenous-wisdom-and-climate-justice,
