feed,title,long_url,short_url
GN:T:RE,‘A scam all around’: Navajo Nation groups oppose hydropower projects - The Guardian,https://news.google.com/rss/articles/CBMiXWh0dHBzOi8vd3d3LnRoZWd1YXJkaWFuLmNvbS9lbnZpcm9ubWVudC8yMDIzL2RlYy8xMC9uYXZham8tbmF0aW9uLWFyaXpvbmEtaHlkcm9wb3dlci1wcm9qZWN0c9IBXWh0dHBzOi8vYW1wLnRoZWd1YXJkaWFuLmNvbS9lbnZpcm9ubWVudC8yMDIzL2RlYy8xMC9uYXZham8tbmF0aW9uLWFyaXpvbmEtaHlkcm9wb3dlci1wcm9qZWN0cw?oc=5,https://da.gd/OJ41d
GN:T:RE,Creating the World's Most Efficient Solar Electric Car - Video - CNET,https://news.google.com/rss/articles/CBMiVWh0dHBzOi8vd3d3LmNuZXQuY29tL3JvYWRzaG93L3ZpZGVvcy9jcmVhdGluZy10aGUtd29ybGRzLW1vc3QtZWZmaWNpZW50LWVsZWN0cmljLWNhci_SAQA?oc=5,https://da.gd/jKAuj
GN:T:RE,China's largest onshore wind power base starts full-capacity production - Xinhua,https://news.google.com/rss/articles/CBMiSGh0dHBzOi8vZW5nbGlzaC5uZXdzLmNuLzIwMjMxMjEwLzFkMmY5NWUyZTAxZTRmNmY4ZGNkZGM3NjdhNGQ3YmUwL2MuaHRtbNIBAA?oc=5,https://da.gd/QyRgSZ
GN:T:RE,High interest rates threaten to bury one of COP28's brightest hopes - POLITICO,https://news.google.com/rss/articles/CBMiXGh0dHBzOi8vd3d3LnBvbGl0aWNvLmNvbS9uZXdzLzIwMjMvMTIvMDkvY2xpbWF0ZS10YWxrcy1uZXdlc3QtdGhyZWF0LWludGVyZXN0LXJhdGVzLTAwMTMwOTQ50gEA?oc=5,https://da.gd/BRQli
GN:T:RE,"New York City Makes 8,500 Acres Of Parking Lots Eligible For Solar Canopy Development - CleanTechnica",https://news.google.com/rss/articles/CBMiemh0dHBzOi8vY2xlYW50ZWNobmljYS5jb20vMjAyMy8xMi8wOS9uZXcteW9yay1jaXR5LW1ha2VzLTg1MDAtYWNyZXMtb2YtcGFya2luZy1sb3RzLWVsaWdpYmxlLWZvci1zb2xhci1jYW5vcHktZGV2ZWxvcG1lbnQv0gEA?oc=5,https://da.gd/9QYOq
