feed,title,long_url,short_url
GN:T:CC,Asian markets set for modest upswing after gains on Wall Street - Yahoo Finance UK,https://uk.finance.yahoo.com/news/asian-markets-set-modest-upswing-235200538.html,
GN:T:CC,These 6 numbers show the state of the climate crisis Biden inherits - National Geographic,https://www.nationalgeographic.com/environment/2021/01/6-numbers-define-climate-challenge-in-changing-us/,
GN:T:CC,Biden to kick off $2 trillion climate plan on his first day in office - Business Insider - Business Insider,https://www.businessinsider.com/biden-enact-climate-plan-on-first-day-in-office-2021-1,
GN:T:CC,What a Biden administration means for Canada - CBC News,https://www.youtube.com/watch?v=OlZyrsRdUYc,
GN:T:CC,Federal court strikes down major Trump climate rollback - Associated Press,https://apnews.com/article/clean-air-act-climate-district-of-columbia-air-pollution-environment-2f8a7d53108add01872c121c68f2c0fb,
GN:T:CC,Climate crisis: Ferocious winds reignite wildfires in California in what should be rainy season - The Independent,https://www.independent.co.uk/environment/climate-change/california-wildfires-winter-climate-change-b1789701.html,
GN:T:CC,"Sensing a shifting tide with Biden tackling climate change, this major business lobby gets on board - MarketWatch",https://www.marketwatch.com/story/sensing-a-shifting-tide-with-biden-tackling-climate-change-this-major-business-lobby-gets-on-board-11611094468,
