feed,title,long_url,short_url
Medium,ML Fomula Derivation — Logistic Regression Gradient Descent Derivatives,https://medium.com/p/e4786830fac6,
Medium,AutoML: a próxima disrupção de sistemas inteligentes,https://medium.com/p/abbb2a6a6d87,
Medium,AI: The world is changing fast and some of us are sleeping,https://medium.com/p/c185c86adb91,
Medium,Training tabular data models with TabTransformer and Amazon SageMaker,https://medium.com/p/47d1e85f185e,
Medium,Find feature that best predict the Developers salary,https://medium.com/p/4598c4bdc62a,
Medium,Download Books in the Public Domain w/ Python,https://medium.com/p/728d198f421d,
Medium,Predictive Scaling: Tackling Traffic Spikes Using Machine Learning,https://medium.com/p/bb1e4064ce5a,
Medium,Open Positions in AI For The Week 4/7 to 10/7,https://medium.com/p/4baf6811f7b4,
