feed,title,long_url,short_url
MX,International team identifies a new regulatory pathway in bladder cancer,https://medicalxpress.com/news/2020-08-international-team-regulatory-pathway-bladder.html,https://j.mp/2ElQzJ4
MX,Research shows air pollution could play role in development of cardiometabolic diseases,https://medicalxpress.com/news/2020-08-air-pollution-role-cardiometabolic-diseases.html,https://j.mp/2Ei8Oz8
MX,A healthy lifestyle for cardiovascular health also promotes good eye health,https://medicalxpress.com/news/2020-08-healthy-lifestyle-cardiovascular-health-good.html,https://j.mp/31f1zAX
MX,Help your child cope with back-to-school jitters,https://medicalxpress.com/news/2020-08-child-cope-back-to-school-jitters.html,https://j.mp/2Ei6oAy
MX,Generic public health messages work best at shifting dietary behaviours,https://medicalxpress.com/news/2020-08-health-messages-shifting-dietary-behaviours.html,https://j.mp/31hwQn3
MX,Florida Keys to release modified mosquitoes to fight illness,https://medicalxpress.com/news/2020-08-florida-keys-mosquitoes-illness.html,https://j.mp/3gef8oz
MX,Kids with special needs struggling to receive good care during pandemic,https://medicalxpress.com/news/2020-08-kids-special-struggling-good-pandemic.html,https://j.mp/2FBDv2Q
