feed,title,long_url,short_url
RS,Nursing Documentation Transformation through AI-Enhanced Electronic Health Records and Standardized Terminologies: A Systematic Review,https://www.researchsquare.com/article/rs-7693354/latest,
RS,Ensemble Machine Learning And Deep Learning Framework For Flood Susceptibility Mapping In The Transboundary Rapti River Basin,https://www.researchsquare.com/article/rs-7393798/latest,
RS,Rethinking the Negativity Bias Online: The Heterogeneous Effects of Negative Language on Online News Engagement,https://www.researchsquare.com/article/rs-7042600/latest,
RS,Efficient UAV-Based Maritime Search and Rescue: A Multi-Scale Edge-Enhanced Detection Algorithm with Frequency-Spatial Collaborative Processing,https://www.researchsquare.com/article/rs-7399724/latest,
RS,HGACH: Hypergraph Attention Convolutional Hashing for Semi-supervised Cross-modal Retrieval,https://www.researchsquare.com/article/rs-7331317/latest,
