feed,title,long_url,short_url
GN:T:WP,Chemicals giants speed up switch to renewables to meet climate goals - South China Morning Post,https://www.scmp.com/business/article/3156848/climate-change-basf-covestro-clinch-renewable-energy-deals-china-achieve,
GN:T:WP,Foxconn: The Stealth Bomber Of EV Manufacturers That Most Won’t See Coming (Part 3) - CleanTechnica,https://cleantechnica.com/2021/11/21/foxconn-the-stealth-bomber-of-ev-manufacturers-that-most-wont-see-coming-part-3/,
GN:T:WP,East Bay county sued over wind turbine project's threat to bats and birds - Santa Rosa Press Democrat,https://www.pressdemocrat.com/article/news/east-bay-county-sued-over-wind-turbine-projects-threat-to-bats-and-birds/?ref=TSM,
GN:T:WP,US missionaries say 2 of 17 abductees freed in Haiti - Santa Rosa Press Democrat,https://www.pressdemocrat.com/article/news/us-missionaries-say-2-of-17-abductees-freed-in-haiti/,
GN:T:WP,Sichuan Daily: le volume des négociations CCER sur le marché du carbone de Sichuan quintuple pratiquement en glissement actuel - Valdosta Daily Times,https://www.valdostadailytimes.com/news/business/sichuan-daily-le-volume-des-n-gociations-ccer-sur-le-march-du-carbone-de-sichuan/image_54ef091d-dc71-5719-a40e-f508b4b9943c.html,
GN:T:WP,Meridian flags possible capital return as it sells Australian business for $750 million - New Zealand Herald,https://www.nzherald.co.nz/business/meridian-flags-possible-capital-return-as-it-sells-australian-business-for-750-million/FCN2EYHWEXVY2IYPKXWQBSSSLY/,
GN:T:WP,Our energy future - Philstar,https://www.philstar.com/business/2021/11/22/2142880/our-energy-future,
GN:T:WP,Prof Andrew Keane: Ireland has potential to deliver more clean energy than it can consume - Irish Examiner,https://www.irishexaminer.com/business/economy/arid-40749291.html,
