feed,title,long_url,short_url
GN:S:GW,Climate Change lessons from King Canute - The Spectator Australia,https://www.spectator.com.au/2022/04/climate-change-lessons-from-king-canute/,
GN:S:GW,Opinion: Climate Change Is Dangerous to Your Health - The Scientist,https://www.the-scientist.com/critic-at-large/opinion-climate-change-is-dangerous-to-your-health-69801,
GN:S:GW,'Code red' for region's climate should increase focus on adaptation - World - ReliefWeb,https://reliefweb.int/report/world/code-red-region-s-climate-should-increase-focus-adaptation,
GN:S:GW,Opinion: Connecticut must better educate its students on climate change - The Connecticut Mirror,https://ctmirror.org/2022/04/04/connecticut-must-better-educate-its-students-on-climate-change/,
GN:S:GW,It’s Time for Charles Koch to Testify About His Climate Change Disinformation Campaign - CleanTechnica,https://cleantechnica.com/2022/04/03/its-time-for-charles-koch-to-testify-about-his-climate-change-disinformation-campaign/,
