feed,title,long_url,short_url
GN:S:GW,UN to release handbook of climate change solutions - Phys,https://phys.org/news/2022-04-handbook-climate-solutions.html,
GN:S:GW,All of us are already affected by climate change - Kennebec Journal and Morning Sentinel,https://www.centralmaine.com/2022/04/03/all-of-use-are-already-affected-by-climate-change/,
GN:S:GW,Climate change: Coffee and tomatoes among the foods on the decline - EU Reporter,https://www.eureporter.co/environment/climate-change/2022/04/04/climate-change-coffee-and-tomatoes-among-the-foods-on-the-decline/,
GN:S:GW,There is evidence that thunderstorms are increasing due to climate change - expert - News24,https://www.news24.com/news24/southafrica/news/there-is-evidence-that-thunderstorms-are-increasing-due-to-climate-change-expert-20220404,
GN:S:GW,Climate Change Regulatory Update for US Insurers | McDermott Will & Emery - JDSupra - JD Supra,https://www.jdsupra.com/legalnews/climate-change-regulatory-update-for-us-4472518/,
