feed,title,long_url,short_url
GN:T:RE,"Louisiana moving away from oil and gas and shifting to renewable energy, Governor says - KLFY",https://www.klfy.com/local/louisiana-moving-away-from-oil-and-gas-and-shifting-to-renewable-energy-governor-says/,
GN:T:RE,"Has Exxon Mobil turned over a new, green leaf? - Reuters",https://www.reuters.com/article/events-exxon-idUSMTZSPDEH3NFKFEUF,
GN:T:RE,Ingenuity Mars helicopter prepares for the first flight on another planet - CNN,https://www.cnn.com/2021/03/23/world/mars-ingenuity-helicopter-update-scn-trnd/index.html,
GN:T:RE,Solar Ready Vets Network looking for transitioning service members and Veterans - VAntage Point - VAntage Point Blog,https://blogs.va.gov/VAntage/86224/bright-future-military-transitioning-servicemembers-veterans-solar-energy-industry/,
GN:T:RE,Why New York is clearing forest for Northland Power's wind farm - Christian Science Monitor,https://www.csmonitor.com/Environment/2021/0323/Trees-store-carbon-but-a-wind-farm-produces-power.-Which-is-greener,
