feed,title,long_url,short_url
GN:T:SL,"The BroadsheetDAILY ~ 3/24/21 ~ As the administration of Mayor Bill de Blasio considers how to protect Manhattan's southern tip from climate change, rising sea levels, and future extreme-weather events, residents Are Invited to Brainstorm about Bulwark for the Battery - ebroadsheet",https://www.ebroadsheet.com/the-broadsheetdaily-3-24-21-as-the-administration-of-mayor-bill-de-blasio-considers-how-to-protect-manhattans-southern-tip-from-climate-change-rising-sea-levels-and-future-extreme-w/,
GN:T:SL,Dr. Fauci: US has not yet turned the corner on coronavirus despite vaccinations - Orlando Sentinel,https://www.orlandosentinel.com/coronavirus/ct-aud-nw-coronavirus-vaccine-updates-20210324-tr43agsfpvcidc4jogh43lmu4i-story.html,
GN:T:SL,"#OSNow PODCAST: Airport restaurant workers replaced, Lake Eola property purchased, and Florida GOP manufacture election problems (Ep. 614) - Orlando Sentinel",https://www.orlandosentinel.com/news/conversations-podcast/os-ne-s6-orlando-sentinel-now-podcast-ep-614-20210324-7ydtjlgedrafpeszew6o7n3wwu-story.html,
GN:T:SL,"Fired employee shoots former coworker at Florida car wash, cops say - Orlando Sentinel",https://www.orlandosentinel.com/news/florida/fl-ne-car-wash-shooting-arrest-20210324-ljyahynrgncs3krmpc3tq4qwdi-story.html,
GN:T:SL,Research and policy in a changing Arctic - ScienceBlog,https://scienceblog.com/521888/research-and-policy-in-a-changing-arctic/,
GN:T:SL,Hull flood defences leave city 'better protected' - BBC News,https://www.bbc.co.uk/news/uk-england-humber-56511123,
