feed,title,long_url,short_url
j:MDPI:N,The Impact of Diet on miRNA Regulation and Its Implications for Health: A Systematic Review,https://mdpi.com/2072-6643/16/6/770,
j:MDPI:N,Reduction in Placental Metal and Metalloid in Preeclampsia: A Case–Control Study,https://mdpi.com/2072-6643/16/6/769,
j:MDPI:N,Factors Impacting the Reduction in Neophobia Prevalence in Phenylketonuria Patients,https://mdpi.com/2072-6643/16/6/768,
j:MDPI:N,The sDOR.2-6y™ Is a Valid Measure of Nutrition Risk Independent of BMI-for-Age z-Score and Household Food Security Status in Preschool Aged-Children,https://mdpi.com/2072-6643/16/6/767,
j:MDPI:N,Glycerophospholipids in Red Blood Cells Are Associated with Aerobic Performance in Young Swimmers,https://mdpi.com/2072-6643/16/6/765,
j:MDPI:N,"The Effect of Creatine Nitrate and Caffeine Individually or Combined on Exercise Performance and Cognitive Function: A Randomized, Crossover, Double-Blind, Placebo-Controlled Trial",https://mdpi.com/2072-6643/16/6/766,
j:MDPI:N,"Prevalence of Food Insecurity and Associations with Academic Performance, Food Consumption and Social Support among University Students during the COVID-19 Pandemic: FINESCOP Project in Iceland",https://mdpi.com/2072-6643/16/6/764,
j:MDPI:N,Dietary Factors and the Risk of Depression among Women with Polycystic Ovary Syndrome,https://mdpi.com/2072-6643/16/6/763,
j:MDPI:N,"Exploring Eating Habits, Healthy Food Awareness, and Inclination toward Functional Foods of Italian Elderly People through Computer-Assisted Telephone Interviews (CATIs)",https://mdpi.com/2072-6643/16/6/762,
