feed,title,long_url,short_url
MX,"Low-carb, no sugar, no fat: the fad diets popular in the 20th century",https://medicalxpress.com/news/2021-01-low-carb-sugar-fat-fad-diets.html,https://j.mp/35vS0PU
MX,Health benefits of replacing wheat flour with chickpea flour,https://medicalxpress.com/news/2021-01-health-benefits-wheat-flour-chickpea.html,https://j.mp/3snGkZx
MX,Study reveals new link to arthritis,https://medicalxpress.com/news/2021-01-reveals-link-arthritis.html,https://j.mp/3siEQPV
MX,"Study reveals strong links between gut microbes, diet and metabolic health",https://medicalxpress.com/news/2021-01-landmark-human-reveal-strong-links.html,https://j.mp/35vrcPD
MX,Vitamin K: A little-known but noteworthy nutrient,https://medicalxpress.com/news/2021-01-vitamin-little-known-noteworthy-nutrient.html,https://j.mp/2Ln1rKG
MX,How the circadian clock regulates liver genes in time and space,https://medicalxpress.com/news/2021-01-circadian-clock-liver-genes-space.html,https://j.mp/3broBKw
MX,Researchers provide new insights into how antibiotic resistance develops,https://medicalxpress.com/news/2021-01-insights-antibiotic-resistance.html,https://j.mp/39qCnKC
