feed,title,long_url,short_url
j.mp/ml-reviews,Explanation-Based Human Debugging of NLP Models: A Survey (2021) (cs.CL),http://arxiv.org/abs/2104.15135v1,
j.mp/ml-reviews,Ontology-based Feature Selection: A Survey (2021) (cs.AI),http://arxiv.org/abs/2104.07720v2,
j.mp/ml-reviews,On In-network learning. A Comparative Study with Federated and Split Learning (2021) (stat.ML),http://arxiv.org/abs/2104.14929v1,
j.mp/ml-reviews,The Factual Inconsistency Problem in Abstractive Text Summarization: A Survey (2021) (cs.CL),http://arxiv.org/abs/2104.14839v1,
j.mp/ml-reviews,"A Survey on sentiment analysis in Persian: A Comprehensive System Perspective Covering Challenges and Advances in Resources, and Methods (2021) (cs.CL)",http://arxiv.org/abs/2104.14751v1,
j.mp/ml-reviews,A Review of Cooperative Multi-Agent Deep Reinforcement Learning (2019-2021) (cs.LG),http://arxiv.org/abs/1908.03963v4,
j.mp/ml-reviews,A comparative study of neural network techniques for automatic software vulnerability detection (2021) (cs.SE),http://arxiv.org/abs/2104.14978v1,
