feed,title,long_url,short_url
GN:S:C,Council policies 'inconsistent' with climate goals - BBC News,https://www.bbc.com/news/science-environment-58102578,
GN:S:C,Renewable Stocks To Pick As IPCC Sounds Alarm Bells On Climate Change - Forbes,https://www.forbes.com/sites/greatspeculations/2021/08/13/renewable-stocks-to-pick-as-ipcc-sounds-alarm-bells-on-climate-change/,
GN:S:C,JNF Canada to Award $1M Annually to Israelis Combatting the Climate Crisis Through Innovation - The Largest Incentive Prize of its Kind - PRNewswire,https://www.prnewswire.com/news-releases/jnf-canada-to-award-1m-annually-to-israelis-combatting-the-climate-crisis-through-innovation--the-largest-incentive-prize-of-its-kind-301354527.html,
GN:S:C,"Northwest heat wave targeted vulnerable, tested climate prep - New York Post",https://nypost.com/2021/08/12/northwest-heat-wave-targeted-vulnerable-tested-climate-prep/,
GN:S:C,Why Scott Morrison’s climate inaction is a ‘code red’ in itself - South China Morning Post,https://www.scmp.com/week-asia/opinion/article/3144858/scott-morrisons-stance-climate-change-code-red-itself,
