feed,title,long_url,short_url
GN:T:CC,UK political factions in the battle against the climate crisis - The Guardian,https://www.theguardian.com/environment/2021/aug/13/uk-political-factions-in-the-battle-against-the-climate-crisis,
GN:T:CC,"Study: Political violence, not climate change, to blame for rising hunger in Africa - UPI News",https://www.upi.com/Science_News/2021/08/12/sudan-violence-hunger-food-crisis/4161628777146/,
GN:T:CC,"Fighting Climate Change, One Vine-Covered Tree at a Time – Maryland Matters - Josh Kurtz",https://www.marylandmatters.org/2021/08/13/fighting-climate-change-one-vine-covered-tree-at-a-time/,
GN:T:CC,"July was Earth's hottest month on record, NOAA says - NBC News",https://www.nbcnews.com/science/environment/july-was-earth-s-hottest-month-record-noaa-says-n1276764,
GN:T:CC,A Sicilian Town Sends an Omen of a Much Hotter Future - The New York Times,https://www.nytimes.com/2021/08/13/world/europe/sicily-heat-wave-record-temperature-floridia-italy.html,
GN:T:CC,"Two thirds of southeast Louisiana voters already feel effects of climate change, poll says - NOLA",https://www.nola.com/news/environment/article_00f41904-fb78-11eb-9dda-2bf81c7d6026.html,
