feed,title,long_url,short_url
GN:S:C,How and why we built Climate Answers - The Washington Post - The Washington Post,https://news.google.com/rss/articles/CBMiX2h0dHBzOi8vd3d3Lndhc2hpbmd0b25wb3N0LmNvbS9jbGltYXRlLWVudmlyb25tZW50LzIwMjQvMDcvMDkvaG93LXdoeS13ZS1idWlsdC1jbGltYXRlLWFuc3dlcnMv0gEA?oc=5,https://da.gd/3V4J0
GN:S:C,"In Satirical Spoof, Exxon Admits to Gaslighting Public on Climate Change - Rolling Stone",https://news.google.com/rss/articles/CBMidGh0dHBzOi8vd3d3LnJvbGxpbmdzdG9uZS5jb20vcG9saXRpY3MvcG9saXRpY3MtbmV3cy9leHhvbi1zYXRpcmljYWwtYWQtZ2FzbGlnaHRpbmctcHVibGljLWNsaW1hdGUtY2hhbmdlLTEyMzUwNTUyMjYv0gEA?oc=5,https://da.gd/KGtPP
GN:S:C,"As climate change alters lakes, tribes and conservationists fight for the future of spearfishing - The Independent",https://news.google.com/rss/articles/CBMiU2h0dHBzOi8vd3d3LmluZGVwZW5kZW50LmNvLnVrL25ld3MvYXAtaGF5d2FyZC1zdXByZW1lLWNvdXJ0LWluc3RhZ3JhbS1iMjU3NjYzOC5odG1s0gEA?oc=5,https://da.gd/wFiOd
GN:S:C,Meet the Californians serving in the first class of the American Climate Corps - Los Angeles Times,https://news.google.com/rss/articles/CBMiZ2h0dHBzOi8vd3d3LmxhdGltZXMuY29tL2Vudmlyb25tZW50L3N0b3J5LzIwMjQtMDctMDkvbWVldC10aGUtZmlyc3QtY2xhc3Mtb2YtdGhlLWFtZXJpY2FuLWNsaW1hdGUtY29ycHPSAQA?oc=5,https://da.gd/vQqrZ
GN:S:C,"As climate change alters lakes, tribes and conservationists fight for the future of spearfishing - The Associated Press",https://news.google.com/rss/articles/CBMiZGh0dHBzOi8vYXBuZXdzLmNvbS9hcnRpY2xlL3NwZWFyZmlzaGluZy1vamlid2UtdHJpYmUtY2xpbWF0ZS1jaGFuZ2UtNmM5M2Y3MmMwNmRiMDA4NmJjMzYxMjcxZWM0MDI2ODHSAQA?oc=5,https://da.gd/ZUlb
GN:S:C,Why judicial appointments by the next president are important to climate change law - WUFT,https://news.google.com/rss/articles/CBMic2h0dHBzOi8vd3d3Lnd1ZnQub3JnLzIwMjQtMDctMDkvd2h5LWp1ZGljaWFsLWFwcG9pbnRtZW50cy1ieS10aGUtbmV4dC1wcmVzaWRlbnQtYXJlLWltcG9ydGFudC10by1jbGltYXRlLWNoYW5nZS1sYXfSAQA?oc=5,https://da.gd/oLc9
GN:S:C,"When it comes to climate issues, not much middle ground - Cardinal News",https://news.google.com/rss/articles/CBMiW2h0dHBzOi8vY2FyZGluYWxuZXdzLm9yZy8yMDI0LzA3LzA5L3doZW4taXQtY29tZXMtdG8tY2xpbWF0ZS1pc3N1ZXMtbm90LW11Y2gtbWlkZGxlLWdyb3VuZC_SAQA?oc=5,https://da.gd/mHs5
GN:S:C,'Antidotes to despair': five things we've learned from the world's best climate journalists - The Guardian,https://news.google.com/rss/articles/CBMiWGh0dHBzOi8vd3d3LnRoZWd1YXJkaWFuLmNvbS9lbnZpcm9ubWVudC9hcnRpY2xlLzIwMjQvanVsLzA5L2NvdmVyaW5nLWNsaW1hdGUtbm93LWxlc3NvbnPSAQA?oc=5,https://da.gd/5iuy5i
GN:S:C,Average Global Temperature Has Warmed 1.5 Degrees Celsius Above Pre-industrial Levels for 12 Months in a Row - InsideClimate News,https://news.google.com/rss/articles/CBMicmh0dHBzOi8vaW5zaWRlY2xpbWF0ZW5ld3Mub3JnL25ld3MvMDkwNzIwMjQvYXZlcmFnZS1nbG9iYWwtdGVtcGVyYXR1cmVzLWFib3ZlLXByZS1pbmR1c3RyaWFsLWxldmVscy1mb3ItMTItbW9udGhzL9IBAA?oc=5,https://da.gd/DpejU4
GN:S:C,Q&A: How Denmark plans to tax agriculture emissions to meet climate goals - Carbon Brief,https://news.google.com/rss/articles/CBMiZGh0dHBzOi8vd3d3LmNhcmJvbmJyaWVmLm9yZy9xYS1ob3ctZGVubWFyay1wbGFucy10by10YXgtYWdyaWN1bHR1cmUtZW1pc3Npb25zLXRvLW1lZXQtY2xpbWF0ZS1nb2Fscy_SAQA?oc=5,https://da.gd/7wM72
GN:S:C,OECD employment at record high while the climate transition expected to lead to significant shifts in labour markets - OECD,https://news.google.com/rss/articles/CBMiswFodHRwczovL3d3dy5vZWNkLm9yZy9lbi9hYm91dC9uZXdzL3ByZXNzLXJlbGVhc2VzLzIwMjQvMDcvb2VjZC1lbXBsb3ltZW50LWF0LXJlY29yZC1oaWdoLXdoaWxlLXRoZS1jbGltYXRlLXRyYW5zaXRpb24tZXhwZWN0ZWQtdG8tbGVhZC10by1zaWduaWZpY2FudC1zaGlmdHMtaW4tbGFib3VyLW1hcmtldHMuaHRtbNIBAA?oc=5,https://da.gd/Xt2Q
GN:S:C,Climate Negotiations Finally Get the Shakespeare Treatment - Bloomberg,https://news.google.com/rss/articles/CBMiemh0dHBzOi8vd3d3LmJsb29tYmVyZy5jb20vbmV3cy9hcnRpY2xlcy8yMDI0LTA3LTA5L2NsaW1hdGUtbmVnb3RpYXRpb25zLWZpbmFsbHktZ2V0LXRoZS1zaGFrZXNwZWFyZS10cmVhdG1lbnQ_c3JuZD1jaXR5bGFi0gEA?oc=5,https://da.gd/GeEPC
GN:S:C,Editorial: What should be in Bend's climate plan? - The Bulletin,https://news.google.com/rss/articles/CBMihQFodHRwczovL3d3dy5iZW5kYnVsbGV0aW4uY29tL29waW5pb24vZWRpdG9yaWFsLXdoYXQtc2hvdWxkLWJlLWluLWJlbmRzLWNsaW1hdGUtcGxhbi9hcnRpY2xlXzhkNGU2MTQyLTNkNTItMTFlZi1iZjRjLTA3NGNjNjVlZTdhOS5odG1s0gEA?oc=5,https://da.gd/7Nfc
GN:S:C,"As climate change alters lakes, tribes and conservationists fight for the future of spearfishing - El Paso Inc",https://news.google.com/rss/articles/CBMiqwFodHRwczovL3d3dy5lbHBhc29pbmMuY29tL2FzLWNsaW1hdGUtY2hhbmdlLWFsdGVycy1sYWtlcy10cmliZXMtYW5kLWNvbnNlcnZhdGlvbmlzdHMtZmlnaHQtZm9yLXRoZS1mdXR1cmUtb2Ytc3BlYXJmaXNoaW5nL2FydGljbGVfOGYwNmJjYTUtODRmNy01ODViLWI2MDQtNjAzZWEwODg2MDM0Lmh0bWzSAQA?oc=5,https://da.gd/jtqO
GN:S:C,UK playwrights 'the two Joes' turn climate crisis into drama of hope - WHTC,https://news.google.com/rss/articles/CBMiX2h0dHBzOi8vd2h0Yy5jb20vMjAyNC8wNy8wOS91ay1wbGF5d3JpZ2h0cy10aGUtdHdvLWpvZXMtdHVybi1jbGltYXRlLWNyaXNpcy1pbnRvLWRyYW1hLW9mLWhvcGUv0gEA?oc=5,https://da.gd/tVJONx
GN:S:C,"Dirty water, more pollution, and oil wells on public lands: How a second Trump term would torpedo the environment - Fast Company",https://news.google.com/rss/articles/CBMikwFodHRwczovL3d3dy5mYXN0Y29tcGFueS5jb20vOTExNTE2MjAvZGlydHktd2F0ZXItbW9yZS1wb2xsdXRpb24tYW5kLW9pbC13ZWxscy1vbi1wdWJsaWMtbGFuZHMtaG93LWEtc2Vjb25kLXRydW1wLXRlcm0td291bGQtdG9ycGVkby10aGUtZW52aXJvbm1lbnTSAQA?oc=5,https://da.gd/s9WzL
