feed,title,long_url,short_url
GN:S:C,Canada Govt Links June Heat Wave To Climate Change - Barron's,https://news.google.com/rss/articles/CBMiXGh0dHBzOi8vd3d3LmJhcnJvbnMuY29tL2FydGljbGVzL2NhbmFkYS1nb3Z0LWxpbmtzLWp1bmUtaGVhdC13YXZlLXRvLWNsaW1hdGUtY2hhbmdlLTk2M2VmNDc20gFcaHR0cHM6Ly93d3cuYmFycm9ucy5jb20vYW1wL25ld3MvY2FuYWRhLWdvdnQtbGlua3MtanVuZS1oZWF0LXdhdmUtdG8tY2xpbWF0ZS1jaGFuZ2UtOTYzZWY0NzY?oc=5,https://da.gd/hqRUtW
GN:S:C,"James Inhofe, former Republican senator who called climate change a ‘hoax’, dies aged 89 - The Guardian US",https://news.google.com/rss/articles/CBMiUWh0dHBzOi8vd3d3LnRoZWd1YXJkaWFuLmNvbS91cy1uZXdzL2FydGljbGUvMjAyNC9qdWwvMDkvamFtZXMtaW5ob2ZlLWRpZXMtYWdlZC04OdIBUWh0dHBzOi8vYW1wLnRoZWd1YXJkaWFuLmNvbS91cy1uZXdzL2FydGljbGUvMjAyNC9qdWwvMDkvamFtZXMtaW5ob2ZlLWRpZXMtYWdlZC04OQ?oc=5,https://da.gd/wuVis
GN:S:C,GFDL's ocean model set to enhance NOAA's hurricane forecasting - Climate,https://news.google.com/rss/articles/CBMiZGh0dHBzOi8vd3d3LmNsaW1hdGUuZ292L25ld3MtZmVhdHVyZXMvZmVlZC9nZmRscy1vY2Vhbi1tb2RlbC1zZXQtZW5oYW5jZS1ub2Fhcy1odXJyaWNhbmUtZm9yZWNhc3RpbmfSAQA?oc=5,https://da.gd/PVLF
GN:S:C,The Great Climate Change Wealth Transfer Is Here - Bloomberg,https://news.google.com/rss/articles/CBMiZmh0dHBzOi8vd3d3LmJsb29tYmVyZy5jb20vb3Bpbmlvbi9hcnRpY2xlcy8yMDI0LTA3LTA5L3RoZS1ncmVhdC1jbGltYXRlLWNoYW5nZS13ZWFsdGgtdHJhbnNmZXItaXMtaGVyZdIBAA?oc=5,https://da.gd/cRw1nQ
GN:S:C,"Joy, Love, and Climate Action: A Church Draws from Ayana Elizabeth Johnson - United Church of Christ",https://news.google.com/rss/articles/CBMiXGh0dHBzOi8vd3d3LnVjYy5vcmcvam95LWxvdmUtYW5kLWNsaW1hdGUtYWN0aW9uLWEtY2h1cmNoLWRyYXdzLWZyb20tYXlhbmEtZWxpemFiZXRoLWpvaG5zb24v0gEA?oc=5,https://da.gd/UbJfV
GN:S:C,E&E News: How Kamala Harris' climate record would play at the top of the ticket - POLITICO Pro,https://news.google.com/rss/articles/CBMiigFodHRwczovL3N1YnNjcmliZXIucG9saXRpY29wcm8uY29tL2FydGljbGUvZWVuZXdzLzIwMjQvMDcvMDkvaG93LWthbWFsYS1oYXJyaXMtY2xpbWF0ZS1yZWNvcmQtd291bGQtcGxheS1hdC10aGUtdG9wLW9mLXRoZS10aWNrZXQtMDAxNjY4OTnSAQA?oc=5,https://da.gd/GeXg
GN:S:C,"High heat bears down on NJ, climate warming faster than other regions | Video - NJ Spotlight News",https://news.google.com/rss/articles/CBMiUGh0dHBzOi8vd3d3Lm5qc3BvdGxpZ2h0bmV3cy5vcmcvdmlkZW8vY2xpbWF0ZS1jaGFuZ2UtbmotaGVhdC13YXZlLWNsaW1hdG9sb2dpc3Qv0gEA?oc=5,https://da.gd/akfjZ
GN:S:C,Climate Smart Missoula shares tips for reducing wildfire smoke impacts - KPAX News,https://news.google.com/rss/articles/CBMicGh0dHBzOi8vd3d3LmtwYXguY29tL25ld3MvbWlzc291bGEtY291bnR5L2NsaW1hdGUtc21hcnQtbWlzc291bGEtc2hhcmVzLXRpcHMtZm9yLXJlZHVjaW5nLXdpbGRmaXJlLXNtb2tlLWltcGFjdHPSAQA?oc=5,https://da.gd/NTh00
GN:S:C,Ohio Joins California Climate Plan Opponents in US Supreme Court Plea - U,https://news.google.com/rss/articles/CBMieGh0dHBzOi8vd3d3LnVzbmV3cy5jb20vbmV3cy91cy9hcnRpY2xlcy8yMDI0LTA3LTA5L29oaW8tam9pbnMtY2FsaWZvcm5pYS1jbGltYXRlLXBsYW4tb3Bwb25lbnRzLWluLXVzLXN1cHJlbWUtY291cnQtcGxlYdIBAA?oc=5,https://da.gd/vnPt8
GN:S:C,"Climate protesters won't be deterred by fines, jail or political mixed messages on the environment | Adam Morton - The Guardian",https://news.google.com/rss/articles/CBMiqgFodHRwczovL3d3dy50aGVndWFyZGlhbi5jb20vZW52aXJvbm1lbnQvY29tbWVudGlzZnJlZS9hcnRpY2xlLzIwMjQvanVsLzA5L2NsaW1hdGUtcHJvdGVzdGVycy13b250LWJlLWRldGVycmVkLWJ5LWZpbmVzLWphaWwtb3ItcG9saXRpY2FsLW1peGVkLW1lc3NhZ2VzLW9uLXRoZS1lbnZpcm9ubWVudNIBAA?oc=5,https://da.gd/fYIsDv
GN:S:C,"Jim Inhofe, Former Oklahoma Senator Who Denied Climate Science, Dies at 89 - The Wall Street Journal",https://news.google.com/rss/articles/CBMiWmh0dHBzOi8vd3d3Lndzai5jb20vcG9saXRpY3MvcG9saWN5L2ppbS1pbmhvZmUtZm9ybWVyLW9rbGFob21hLXNlbmF0b3ItZGllcy1hdC04OS1iYjNiNWI2Y9IBAA?oc=5,https://da.gd/LS2cRC
GN:S:C,New Climate Works program aims to create green energy careers in Illinois - FOX 32 Chicago,https://news.google.com/rss/articles/CBMiZWh0dHBzOi8vd3d3LmZveDMyY2hpY2Fnby5jb20vbmV3cy9uZXctY2xpbWF0ZS13b3Jrcy1wcm9ncmFtLWFpbXMtY3JlYXRlLWdyZWVuLWVuZXJneS1jYXJlZXJzLWlsbGlub2lz0gFpaHR0cHM6Ly93d3cuZm94MzJjaGljYWdvLmNvbS9uZXdzL25ldy1jbGltYXRlLXdvcmtzLXByb2dyYW0tYWltcy1jcmVhdGUtZ3JlZW4tZW5lcmd5LWNhcmVlcnMtaWxsaW5vaXMuYW1w?oc=5,https://da.gd/Sx0mqg
GN:S:C,"Longtime Oklahoma Senator James Inhofe, MAGA enthusiast and climate change denier, dead at 89 - New York Daily News",https://news.google.com/rss/articles/CBMiUWh0dHBzOi8vd3d3Lm55ZGFpbHluZXdzLmNvbS8yMDI0LzA3LzA5L29rbGFob21hLXNlbmF0b3ItamFtZXMtaW5ob2ZlLWRlYWQtc3Ryb2tlL9IBAA?oc=5,https://da.gd/8mKwOB
GN:S:C,Scientists say they can now forecast a strong El Niño years in advance - Livescience,https://news.google.com/rss/articles/CBMifmh0dHBzOi8vd3d3LmxpdmVzY2llbmNlLmNvbS9wbGFuZXQtZWFydGgvY2xpbWF0ZS1jaGFuZ2Uvc2NpZW50aXN0cy1zYXktdGhleS1jYW4tbm93LWZvcmVjYXN0LWEtc3Ryb25nLWVsLW5pbm8teWVhcnMtaW4tYWR2YW5jZdIBAA?oc=5,https://da.gd/SI716T
GN:S:C,India's climate crisis: new coal mining spreads as heatwaves drain hydro dams - Nikkei Asia,https://news.google.com/rss/articles/CBMifGh0dHBzOi8vYXNpYS5uaWtrZWkuY29tL1Nwb3RsaWdodC9UaGUtQmlnLVN0b3J5L0luZGlhLXMtY2xpbWF0ZS1jcmlzaXMtbmV3LWNvYWwtbWluaW5nLXNwcmVhZHMtYXMtaGVhdHdhdmVzLWRyYWluLWh5ZHJvLWRhbXPSAQA?oc=5,https://da.gd/rcflmH
