feed,title,long_url,short_url
GN:T:RE,"Amazon, despite climate pledge, fought to kill emissions bill in Oregon - The Washington Post",https://news.google.com/rss/articles/CBMiV2h0dHBzOi8vd3d3Lndhc2hpbmd0b25wb3N0LmNvbS90ZWNobm9sb2d5LzIwMjMvMDQvMDQvYW1hem9uLWNsaW1hdGUtZW5lcmd5LWZ1ZWwtb3JlZ29uL9IBAA?oc=5,https://da.gd/Dpjn74
GN:T:RE,Lawmaker introduces bill to 100% transition Pennsylvania to renewable energy - ABC27,https://news.google.com/rss/articles/CBMic2h0dHBzOi8vd3d3LmFiYzI3LmNvbS9uZXdzL3RvcC1zdG9yaWVzL2xhd21ha2VyLWludHJvZHVjZXMtYmlsbC10by0xMDAtdHJhbnNpdGlvbi1wZW5uc3lsdmFuaWEtdG8tcmVuZXdhYmxlLWVuZXJneS_SAXdodHRwczovL3d3dy5hYmMyNy5jb20vbmV3cy90b3Atc3Rvcmllcy9sYXdtYWtlci1pbnRyb2R1Y2VzLWJpbGwtdG8tMTAwLXRyYW5zaXRpb24tcGVubnN5bHZhbmlhLXRvLXJlbmV3YWJsZS1lbmVyZ3kvYW1wLw?oc=5,https://da.gd/S7Zd0z
GN:T:RE,"Interior Department Announces Start of Turbine Construction for Commercial-Scale, Offshore Wind Energy Project in Federal Waters - US Department of the Interior",https://news.google.com/rss/articles/CBMidGh0dHBzOi8vd3d3LmRvaS5nb3YvcHJlc3NyZWxlYXNlcy9pbnRlcmlvci1kZXBhcnRtZW50LWFubm91bmNlcy1zdGFydC10dXJiaW5lLWNvbnN0cnVjdGlvbi1jb21tZXJjaWFsLXNjYWxlLW9mZnNob3Jl0gEA?oc=5,https://da.gd/vqe5
GN:T:RE,Growing sales but not emissions – Polestar reduces CO2 intensity by 8% during a record year - Electrek,https://news.google.com/rss/articles/CBMiXmh0dHBzOi8vZWxlY3RyZWsuY28vMjAyMy8wNC8wMy9wb2xlc3Rhci1jdXRzLXJlbGF0aXZlLWNvMi1lbWlzc2lvbnMtYnktOC1kdXJpbmctYS1yZWNvcmQteWVhci_SAQA?oc=5,https://da.gd/b3DVnD
GN:T:RE,UAE's Top Oil Executive Has a Plan to Fix COP28 - Bloomberg,https://news.google.com/rss/articles/CBMiYmh0dHBzOi8vd3d3LmJsb29tYmVyZy5jb20vbmV3cy9mZWF0dXJlcy8yMDIzLTA0LTAzL3VhZS1zLXRvcC1vaWwtZXhlY3V0aXZlLWhhcy1hLXBsYW4tdG8tZml4LWNvcDI40gEA?oc=5,https://da.gd/5jau7q
