feed,title,long_url,short_url
LitCovid,First Breathalyzer Test to Diagnose COVID-19,https://pubmed.ncbi.nlm.nih.gov/35579654,
LitCovid,"Anxiety, pediatric type 1 diabetes and COVID-19 lockdown",https://pubmed.ncbi.nlm.nih.gov/35580867,
LitCovid,"What COVID-19 Has Taught Us: ""VAP is Back!""",https://pubmed.ncbi.nlm.nih.gov/35579660,
LitCovid,Changes to Hospital Availability of Prone Positioning after the COVID-19 Pandemic,https://pubmed.ncbi.nlm.nih.gov/35580345,
LitCovid,"The need to define ""who"" rather than ""if"" for ECMO in COVID-19",https://pubmed.ncbi.nlm.nih.gov/35579687,
LitCovid,Journal club,https://pubmed.ncbi.nlm.nih.gov/35580904,
LitCovid,Global impacts of COVID-19 on sustainable ocean development,https://pubmed.ncbi.nlm.nih.gov/35578628,
LitCovid,What Studying Postpartum Depression During the COVID-19 Pandemic Tells Us About Early Maternal Needs,https://pubmed.ncbi.nlm.nih.gov/35580130,
LitCovid,Caregiver's Perspective on Psychosocial Issues of Paediatric Cancer Patients during COVID 19 Pandemic Lockdown,https://pubmed.ncbi.nlm.nih.gov/35578913,
LitCovid,Is It Possible to Predict Respiratory Evolution in COVID-19 Patients?,https://pubmed.ncbi.nlm.nih.gov/35580562,
LitCovid,Letter to the Editor: The Clinical Features of SARS-CoV-2 Infection Are Becoming Milder with Limited Symptomatic Effects,https://pubmed.ncbi.nlm.nih.gov/35580073,
LitCovid,Dying to Breathe: Air Pollution Adds Insult to Injury in COVID-19,https://pubmed.ncbi.nlm.nih.gov/35580063,
LitCovid,Does periodontitis influence the risk of COVID-19? A scoping review,https://pubmed.ncbi.nlm.nih.gov/35578891,
LitCovid,Inferior cellular and humoral immunity against Omicron and Delta VOC compared to SARS-CoV-2 wild-type in hemodialysis patients immunized with four SARS-CoV-2 vaccine doses,https://pubmed.ncbi.nlm.nih.gov/35580654,
LitCovid,The impact of COVID-19 on A fertility center in Indonesia: A brief report,https://pubmed.ncbi.nlm.nih.gov/35578606,
LitCovid,SARS-CoV-2 RNA load and detection rate in exhaled breath condensate collected from COVID-19 patients infected with Delta variant,https://pubmed.ncbi.nlm.nih.gov/35580553,
LitCovid,Effects of COVID-19-related worry and rumination on mental health and loneliness during the pandemic: longitudinal analyses of adults in the UK COVID-19 mental health & wellbeing study,https://pubmed.ncbi.nlm.nih.gov/35579054,
LitCovid,Firm-level short selling and the local COVID-19 pandemic: Evidence from China,https://pubmed.ncbi.nlm.nih.gov/35578633,
LitCovid,"COVID-19 in G6PD-deficient patients, oxidative stress, and neuropathology",https://pubmed.ncbi.nlm.nih.gov/35578850,
LitCovid,"Transfusing convalescent plasma as post-exposure prophylaxis against SARS-CoV-2 infection: a double-blinded, phase 2 randomized, controlled trial",https://pubmed.ncbi.nlm.nih.gov/35579509,
LitCovid,Bioactivity and Pharmacological Potential of Date Palm (Phoenix dactylifera L.) Against Pandemic COVID-19: a Comprehensive Review,https://pubmed.ncbi.nlm.nih.gov/35579740,
LitCovid,Prioritizing Equity When Resources are Scarce: Innovating Solutions During the COVID Pandemic,https://pubmed.ncbi.nlm.nih.gov/35580062,
LitCovid,Comparative study of CNR1 and CNR2 cannabinoid receptors expression levels in COVID-19 patients with and without diabetes mellitus: Recommendations for future research targets,https://pubmed.ncbi.nlm.nih.gov/35580523,
LitCovid,Application of Extracorporeal Apheresis in Treatment of COVID-19: a Rapid Review,https://pubmed.ncbi.nlm.nih.gov/35578681,
LitCovid,Rapid Antigen Tests for SARS-CoV-2,https://pubmed.ncbi.nlm.nih.gov/35579649,
LitCovid,Introduction of the special issue on COVID-19 and the financial and economic systems,https://pubmed.ncbi.nlm.nih.gov/35578637,
LitCovid,"Genomic characteristics of SARS-CoV-2 in Beijing, 2021",https://pubmed.ncbi.nlm.nih.gov/35578696,
LitCovid,Several major issues concerning the environmental transmission and risk prevention of SARS-CoV-2,https://pubmed.ncbi.nlm.nih.gov/35578665,
LitCovid,Liver transplantation from active COVID-19 donors: is it ethically justifiable?,https://pubmed.ncbi.nlm.nih.gov/35579913,
LitCovid,Antidiabetic Drugs and their Potential Use in COVID-19: A Mechanistic Approach,https://pubmed.ncbi.nlm.nih.gov/35578871,
LitCovid,Towards digital justice: participatory action research in global digital health,https://pubmed.ncbi.nlm.nih.gov/35580914,
LitCovid,Rapid Antigen Tests for SARS-CoV-2-Reply,https://pubmed.ncbi.nlm.nih.gov/35579645,
LitCovid,The adenosine analog prodrug ATV006 is orally bioavailable and has preclinical efficacy against parental SARS-CoV-2 and variants,https://pubmed.ncbi.nlm.nih.gov/35579533,
LitCovid,Strong SARS-CoV-2 Antibody Response After Booster Dose of BNT162b2 mRNA Vaccines in Uninfected Healthcare Workers,https://pubmed.ncbi.nlm.nih.gov/35578582,
LitCovid,COVID-19 infection enhances susceptibility to oxidative-stress induced parkinsonism,https://pubmed.ncbi.nlm.nih.gov/35579496,
LitCovid,Covid-19: North Korean leader blames his party's incompetence after 393 000 cases of fever reported in a day,https://pubmed.ncbi.nlm.nih.gov/35580881,
LitCovid,Southeast Asian ovalocytosis detected in a critical patient with COVID-19 pneumonia,https://pubmed.ncbi.nlm.nih.gov/35580896,
LitCovid,Provider and Caregiver Satisfaction with Telehealth Evaluation of Autism Spectrum Disorder in Young Children During the COVID-19 Pandemic,https://pubmed.ncbi.nlm.nih.gov/35579789,
LitCovid,"Relationship between dementia, COVID-19 risk, and adherence to COVID-19 mitigation behaviors among older adults in the United States",https://pubmed.ncbi.nlm.nih.gov/35578831,
LitCovid,Safety and Efficacy of Favipiravir for the management of COVID-19 Patients: A Randomized Control Trial,https://pubmed.ncbi.nlm.nih.gov/35578658,
LitCovid,Environmental impact of COVID-19 Vaccine waste: A perspective on potential role of natural and biodegradable materials,https://pubmed.ncbi.nlm.nih.gov/35578627,
LitCovid,Violence in the big apple throughout the COVID-19 pandemic: A borough-specific analysis,https://pubmed.ncbi.nlm.nih.gov/35578726,
LitCovid,Evaluating the Ability to ID (COVID-19) NOW: a Large Real-World Prospective Evaluation of the Abbott ID NOW COVID-19 Assay,https://pubmed.ncbi.nlm.nih.gov/35579469,
LitCovid,Telemedicine for the Clinical Management of Diabetes; Implications and Considerations After COVID-19 Experience,https://pubmed.ncbi.nlm.nih.gov/35579849,
LitCovid,Favipiravir-based treatment for outcomes of patients with COVID-19: a systematic review and meta-analysis of randomized controlled trials,https://pubmed.ncbi.nlm.nih.gov/35579014,
LitCovid,Post-COVID-19 vaccine-associated menstrual cycle changes: A multifaceted problem for Pakistan,https://pubmed.ncbi.nlm.nih.gov/35578607,
LitCovid,Under-graduate nursing students working during the first outbreak of the COVID-19 pandemic: A qualitative study of psychosocial effects and coping strategies,https://pubmed.ncbi.nlm.nih.gov/35580863,
LitCovid,Impact of Fear of COVID-19 Pandemic on Job Insecurity and Subjective Well-Being,https://pubmed.ncbi.nlm.nih.gov/35580933,
LitCovid,Lack of cross-reactivity between rheumatoid factor IgM and anti-S1 receptor binding domain of SARS-CoV-2 IgM: a case-control study,https://pubmed.ncbi.nlm.nih.gov/35579083,
LitCovid,Understanding the effect of fear of COVID-19 on COVID-19 burnout and job satisfaction: a mediation model of psychological capital,https://pubmed.ncbi.nlm.nih.gov/35579863,
LitCovid,Angiotensin converting enzyme and sodium glucose cotransporter inhibitors alleviate inflammatory effects of SARS-CoV-2 in cardiomyocytes,https://pubmed.ncbi.nlm.nih.gov/35578759,
LitCovid,Impact of COVID-19 on substance use disorder treatment services in Kenya: Qualitative findings from healthcare providers,https://pubmed.ncbi.nlm.nih.gov/35580533,
LitCovid,Strengthening tobacco control policies during the COVID-19 pandemic in India,https://pubmed.ncbi.nlm.nih.gov/35578719,
LitCovid,Delayed visit and treatment of lung cancer during the coronavirus disease 2019 pandemic in Japan: a retrospective study,https://pubmed.ncbi.nlm.nih.gov/35579175,
LitCovid,Third-dose BNT162b2 vaccination elicits markedly high-level SARS-CoV-2-neutralizing antibodies in vaccinees who poorly responded to second dose in Japan,https://pubmed.ncbi.nlm.nih.gov/35580786,
LitCovid,Effective Multiscale Deep Learning Model for COVID19 Segmentation Tasks: A Further Step Towards helping Radiologist,https://pubmed.ncbi.nlm.nih.gov/35578654,
LitCovid,Evaluation of Age Patterns of COVID-19 Mortality by Race and Ethnicity From March 2020 to October 2021 in the US,https://pubmed.ncbi.nlm.nih.gov/35579900,
LitCovid,Pre-operative prevalence of asymptomatic carriers of COVID-19 in hospitals in Catalonia during the first wave after the resumption of surgical activity,https://pubmed.ncbi.nlm.nih.gov/35580757,
LitCovid,"A spatial-temporal analysis at the early stages of the COVID-19 pandemic and its determinants: The case of Recife neighborhoods, Brazil",https://pubmed.ncbi.nlm.nih.gov/35580093,
LitCovid,Vaccine-induced immune thrombotic thrombocytopenia after ChAdOx1 nCoV-19 vaccine in an older patient: Minireview and a case report,https://pubmed.ncbi.nlm.nih.gov/35580449,
LitCovid,"Positive personal resources and psychological distress during the COVID-19 pandemic: resilience, optimism, hope, courage, trait mindfulness, and self-efficacy in breast cancer patients and survivors",https://pubmed.ncbi.nlm.nih.gov/35579755,
LitCovid,Higher education students' achievement emotions and their antecedents in E-learning amid COVID-19 pandemic: A multi-country survey,https://pubmed.ncbi.nlm.nih.gov/35578734,
LitCovid,Olfactory dysfunction is more severe in wild-type SARS-CoV-2 infection than in the Delta variant (B.1.617.2),https://pubmed.ncbi.nlm.nih.gov/35578676,
LitCovid,Eating Disorders and Internalizing/Externalizing Symptoms in Adolescents before and during the COVID-19 Pandemic,https://pubmed.ncbi.nlm.nih.gov/35579970,
LitCovid,Face Off: 3D Printed Masks as a Cost-Effective and Reusable Alternative to N95 Respirators: A Feasibility Study,https://pubmed.ncbi.nlm.nih.gov/35580720,
LitCovid,Measuring Basic Reproduction Number to Assess Effects of Nonpharmaceutical Interventions on Nosocomial SARS-CoV-2 Transmission,https://pubmed.ncbi.nlm.nih.gov/35580960,
LitCovid,Immunodeficiency Should Be Excluded in Patients With Recurrent Viral Meningitis and Breakthrough COVID-19,https://pubmed.ncbi.nlm.nih.gov/35578591,
LitCovid,"Characterizing Unusual Spatial Clusters of Male Mental Health Emergencies Occurring During the First National COVID-19 ""Lockdown"" in the East Midlands Region, UK: A Geospatial Analysis of Ambulance 999 Data",https://pubmed.ncbi.nlm.nih.gov/35579400,
LitCovid,Association of Congenital and Acquired Cardiovascular Conditions With COVID-19 Severity Among Pediatric Patients in the US,https://pubmed.ncbi.nlm.nih.gov/35579899,
LitCovid,Parent decision-making regarding youth sport participation during the COVID-19 pandemic,https://pubmed.ncbi.nlm.nih.gov/35579728,
LitCovid,Impact of solid organ transplant status on outcomes of hospitalized patients with COVID-19 infection,https://pubmed.ncbi.nlm.nih.gov/35579437,
LitCovid,Efficacy of Hemoperfusion in Severe and Critical Cases of COVID-19,https://pubmed.ncbi.nlm.nih.gov/35580567,
LitCovid,[Impact of the COVID-19 pandemic on urology residency training programs in Germany],https://pubmed.ncbi.nlm.nih.gov/35580617,
LitCovid,A retrospective observational insight into COVID-19 exposures resulting from personal protective equipment (PPE) breaches,https://pubmed.ncbi.nlm.nih.gov/35580133,
LitCovid,Women's attitudes towards healthy life awareness and breast cancer screening during the coronavirus disease 2019 pandemic: a cross-sectional descriptive study,https://pubmed.ncbi.nlm.nih.gov/35579177,
LitCovid,"Increased airborne transmission of COVID-19 with new variants, implications for health policies",https://pubmed.ncbi.nlm.nih.gov/35578697,
LitCovid,Psychological impacts of the COVID-19 pandemic on medical students in the United States of America,https://pubmed.ncbi.nlm.nih.gov/35580431,
LitCovid,Role-play Games (RPGs) for Mental Health (Why Not?): Roll for Initiative,https://pubmed.ncbi.nlm.nih.gov/35578675,
LitCovid,"Invalidation of dieckol and 1,2,3,4,6-pentagalloylglucose (PGG) as SARS-CoV-2 main protease inhibitors and the discovery of PGG as a papain-like protease inhibitor",https://pubmed.ncbi.nlm.nih.gov/35578732,
LitCovid,Exploring the impact of COVID-19 movement control orders on eating habits and physical activity in low-resource urban settings in Malaysia,https://pubmed.ncbi.nlm.nih.gov/35578553,
LitCovid,Determination of the UV Inactivation Constant under 280 nm UV LED Irradiation for SARS-CoV-2,https://pubmed.ncbi.nlm.nih.gov/35578782,
LitCovid,Olverembatinib inhibits SARS-CoV-2-Omicron variant-mediated cytokine release in human peripheral blood mononuclear cells,https://pubmed.ncbi.nlm.nih.gov/35579119,
LitCovid,"Machine Learning-Based Research for COVID-19 Detection, Diagnosis, and Prediction: A Survey",https://pubmed.ncbi.nlm.nih.gov/35578678,
LitCovid,Development and evaluation of a machine learning-based in-hospital COvid-19 disease outcome predictor (CODOP): a multicontinental retrospective study,https://pubmed.ncbi.nlm.nih.gov/35579324,
LitCovid,"An Open, Prospective Cohort Study of VV116 in Chinese Participants Infected with SARS-CoV-2 Omicron Variants",https://pubmed.ncbi.nlm.nih.gov/35579892,
LitCovid,Subacute thyroiditis associated with thyrotoxic periodic paralysis after COVID-19 vaccination: a case report,https://pubmed.ncbi.nlm.nih.gov/35578985,
LitCovid,Analysis of the impact of a fresh air system on the indoor environment in office buildings,https://pubmed.ncbi.nlm.nih.gov/35578686,
LitCovid,Protection of mRNA vaccines against hospitalized COVID-19 in adults over the first year following authorization in the United States,https://pubmed.ncbi.nlm.nih.gov/35580849,
LitCovid,Impact of natural selection on global patterns of genetic variation and association with clinical phenotypes at genes involved in SARS-CoV-2 infection,https://pubmed.ncbi.nlm.nih.gov/35580180,
LitCovid,The Long View on COVID-19 Theranostics and Oral Antivirals: Living with Endemic Disease and Lessons from Molnupiravir,https://pubmed.ncbi.nlm.nih.gov/35580151,
LitCovid,High-flow nasal oxygen versus conventional oxygen therapy in patients with COVID-19 pneumonia and mild hypoxaemia: a randomised controlled trial,https://pubmed.ncbi.nlm.nih.gov/35580898,
LitCovid,Comparison of Chest CT and RT-PCR Assay for Indication of Disease Course of Coronavirus Disease 2019 (COVID-19) Pneumonia,https://pubmed.ncbi.nlm.nih.gov/35579141,
LitCovid,Gestational diabetes mellitus and COVID-19: results from the CRONOS study,https://pubmed.ncbi.nlm.nih.gov/35580632,
LitCovid,Intensive Care Unit- Acquired Weakness and Hospital Functional Mobility Outcomes Following Invasive Mechanical Ventilation in Patients with COVID-19: A Single-Centre Prospective Cohort Study,https://pubmed.ncbi.nlm.nih.gov/35578542,
LitCovid,Molnupiravir inhibits SARS-CoV-2 variants including Omicron in the hamster model,https://pubmed.ncbi.nlm.nih.gov/35579953,
LitCovid,Association Between Known Close Contact History and Severity of COVID-19 Pneumonia: A Preliminary Evidence Supporting Importance of Filiation,https://pubmed.ncbi.nlm.nih.gov/35579225,
LitCovid,"A Virtual, Simulated Code White for Undergraduate Nursing Students",https://pubmed.ncbi.nlm.nih.gov/35578409,
LitCovid,Virtual management of hypertension: lessons from the COVID-19 pandemic-International Society of Hypertension position paper endorsed by World Hypertension League and European Society of Hypertension,https://pubmed.ncbi.nlm.nih.gov/35579481,
LitCovid,Small popliteal aneurysm thrombosis after SARS-CoV-2 vaccination,https://pubmed.ncbi.nlm.nih.gov/35578624,
LitCovid,Psychological responses of medical staff during COVID-19 and the adjustment effect of brief mindfulness meditation,https://pubmed.ncbi.nlm.nih.gov/35580535,
LitCovid,"Effectiveness of first, second, and third COVID-19 vaccine doses in solid organ transplant recipients: A population-based cohort study from Canada",https://pubmed.ncbi.nlm.nih.gov/35578576,
LitCovid,"How did the COVID-19 pandemic influence health-related behaviour? An online survey on food choice, physical activity and changes in body weight among Swiss adults",https://pubmed.ncbi.nlm.nih.gov/35578621,
LitCovid,The mental health of children and young people living in big cities in a revolving postpandemic world,https://pubmed.ncbi.nlm.nih.gov/35579874,
LitCovid,Post COVID-19 Vaccination acute Disseminated Encephalomyelitis: A case report,https://pubmed.ncbi.nlm.nih.gov/35579135,
LitCovid,Forging Ahead the Repositioning of Multitargeted Drug Ivermectin,https://pubmed.ncbi.nlm.nih.gov/35578879,
LitCovid,The Relationship Between Splenomegaly And Lung Involvement Patterns And Severity Score In COVID-19 Pneumonia,https://pubmed.ncbi.nlm.nih.gov/35579138,
LitCovid,"Impact of COVID-19 outbreak in knee arthroplasty in Chile: a cross-sectional, national registry-based analysis",https://pubmed.ncbi.nlm.nih.gov/35580323,
LitCovid,Microscopic Polyangiitis Following mRNA COVID-19 Vaccination: A Case Report,https://pubmed.ncbi.nlm.nih.gov/35578586,
LitCovid,LOng COvid Multidisciplinary consortium Optimising Treatments and servIces acrOss the NHS (LOCOMOTION): protocol for a mixed-methods study in the UK,https://pubmed.ncbi.nlm.nih.gov/35580970,
LitCovid,Fostering compliance with physical distancing by interactive feedback in the context of the COVID-19 pandemic: A web-based randomized controlled trial,https://pubmed.ncbi.nlm.nih.gov/35578655,
LitCovid,"Can 10x cheaper, lower-efficiency particulate air filters and box fans complement High-Efficiency Particulate Air (HEPA) purifiers to help control the COVID-19 pandemic?",https://pubmed.ncbi.nlm.nih.gov/35580674,
LitCovid,Corporate social performance and firm debt levels: Impacts of the covid-19 pandemic and institutional environments,https://pubmed.ncbi.nlm.nih.gov/35578609,
LitCovid,Diabetes Mellitus Type 1 During the COVID 19: Psychological Symptoms and Eating Attitudes,https://pubmed.ncbi.nlm.nih.gov/35578842,
LitCovid,Hyper-eosinophilic syndrome with myocarditis after inactivated SARS-CoV-2 vaccination - a case study,https://pubmed.ncbi.nlm.nih.gov/35579125,
LitCovid,Prioritization versus rationing of healthcare - elective surgery is not optional surgery : how should priority be assessed to ensure equity?,https://pubmed.ncbi.nlm.nih.gov/35579001,
LitCovid,"Ultraviolet-coupled advanced oxidation processes for anti-COVID-19 drugs treatment: Degradation mechanisms, transformation products and toxicity evolution",https://pubmed.ncbi.nlm.nih.gov/35580642,
LitCovid,Clinical Predictors of Response to Tocilizumab: A Retrospective Multicenter Study,https://pubmed.ncbi.nlm.nih.gov/35579229,
LitCovid,Macroeconomic and Monetary Policy Responses in Selected Highly Indebted MENA Countries Post Covid 19: A Structural VAR Approach,https://pubmed.ncbi.nlm.nih.gov/35578664,
LitCovid,"Durability and Immunogenicity of Neutralizing Antibodies Response Against Omicron Variants After Three Doses of Subunit SARS-CoV-2 Vaccine MVC-COV1901: An Extension to an Open-Label, Dose-Escalation Phase 1 Study",https://pubmed.ncbi.nlm.nih.gov/35579840,
LitCovid,Clinical Differences Between Elderly and Non-elderly Patients with COVID-19,https://pubmed.ncbi.nlm.nih.gov/35579231,
LitCovid,Structuring knowledge-building in online design education,https://pubmed.ncbi.nlm.nih.gov/35578646,
LitCovid,Pediatric Mental Health Presentations and Boarding: First Year of the COVID-19 Pandemic,https://pubmed.ncbi.nlm.nih.gov/35578918,
LitCovid,Antibody responses against SARS-CoV-2 variants induced by four different SARS-CoV-2 vaccines in health care workers in the Netherlands: A prospective cohort study,https://pubmed.ncbi.nlm.nih.gov/35580156,
LitCovid,HLAncPred: a method for predicting promiscuous non-classical HLA binding sites,https://pubmed.ncbi.nlm.nih.gov/35580839,
LitCovid,Cross-cultural validity of the five items Mindful Attention Awareness Scale (MAAS-5) in Peru and Mexico during the COVID-19 pandemic,https://pubmed.ncbi.nlm.nih.gov/35579764,
LitCovid,"The potential of remdesivir to affect function, metabolism and proliferation of cardiac and kidney cells in vitro",https://pubmed.ncbi.nlm.nih.gov/35579693,
LitCovid,Force application of laparoscopic surgeons under the impact of heavy personal protective equipment,https://pubmed.ncbi.nlm.nih.gov/35578593,
LitCovid,Synergistic deciphering of bioenergy production and electron transport characteristics to screen traditional Chinese medicine (TCM) for COVID-19 drug development,https://pubmed.ncbi.nlm.nih.gov/35578714,
LitCovid,A Network-Biology led Computational Drug repurposing Strategy to prioritize therapeutic options for COVID-19,https://pubmed.ncbi.nlm.nih.gov/35578630,
LitCovid,How and to what extent does the anti-social behavior of violating self-quarantine measures increase the spread of disease?,https://pubmed.ncbi.nlm.nih.gov/35578625,
LitCovid,The state of the art for artificial intelligence in lung digital pathology,https://pubmed.ncbi.nlm.nih.gov/35579955,
LitCovid,Useof Video Consultation in Irish General Practice:The Views of General Practitioners,https://pubmed.ncbi.nlm.nih.gov/35579994,
LitCovid,Three cases of clinically significant inaccurate carboxyhemoglobin measurement,https://pubmed.ncbi.nlm.nih.gov/35580484,
LitCovid,Current synopsis on siRNA therapeutics as a novel anti-cancer and antiviral strategy: Progress and challenges,https://pubmed.ncbi.nlm.nih.gov/35578839,
LitCovid,Graphite nanocrystals coated paper-based electrode for detection of SARS-Cov-2 gene using DNA-functionalized Au@carbon dot core-shell nanoparticles,https://pubmed.ncbi.nlm.nih.gov/35578710,
LitCovid,"Plant-Based Natural Bioactive Compounds 2,4-Ditert-Butylphenolas: A Potential Candidates Against SARS-Cov-2019",https://pubmed.ncbi.nlm.nih.gov/35578668,
LitCovid,"Physicochemical effect of the N501Y, E484K/Q, K417N/T, L452R and T478K mutations on the SARS-CoV-2 spike protein RBD and its influence on agent fitness and on attributes developed by emerging variants of concern",https://pubmed.ncbi.nlm.nih.gov/35580380,
LitCovid,Attitudes toward telemedicine among urban and rural residents,https://pubmed.ncbi.nlm.nih.gov/35578537,
LitCovid,United Kingdom: Health System Review,https://pubmed.ncbi.nlm.nih.gov/35579557,
LitCovid,Multi-layered micro/nanofibrous nonwovens for functional face mask filter,https://pubmed.ncbi.nlm.nih.gov/35578617,
LitCovid,Safety and efficacy of a dose-dense short-term therapy in patients with MYC-translocated aggressive lymphoma,https://pubmed.ncbi.nlm.nih.gov/35580327,
LitCovid,"Trypsin may induce cytokine storm in M1 macrophages, resulting in critical coronavirus disease",https://pubmed.ncbi.nlm.nih.gov/35580821,
LitCovid,The Synthesis of Urolithins and Their Derivatives and the Modes of Antitumor Action,https://pubmed.ncbi.nlm.nih.gov/35578881,
LitCovid,Lullabies for long COVID,https://pubmed.ncbi.nlm.nih.gov/35578130,
LitCovid,Effectiveness of COVID-19 vaccination among people living with HIV during a COVID-19 outbreak,https://pubmed.ncbi.nlm.nih.gov/35577735,
LitCovid,"Re: Reifferscheid et al., ""COVID-19 vaccine uptake and intention during pregnancy in Canada""",https://pubmed.ncbi.nlm.nih.gov/35578017,
LitCovid,Anti-nucleocapsid antibodies enhance the production of IL-6 induced by SARS-CoV-2 N protein,https://pubmed.ncbi.nlm.nih.gov/35577892,
LitCovid,"Sexual orientation, gender identity and COVID: a complicated picture",https://pubmed.ncbi.nlm.nih.gov/35577920,
LitCovid,"Atrial fibrillation in COVID-19 patients receiving remdesivir, matched case-control analysis",https://pubmed.ncbi.nlm.nih.gov/35577624,
LitCovid,"Acceptance of COVID-19 vaccination and influencing factors among people living with HIV in Guangxi, China: a cross-sectional survey",https://pubmed.ncbi.nlm.nih.gov/35578187,
LitCovid,"Public health and social measures to mitigate the health and economic impact of the COVID-19 pandemic in Turkey, Egypt, Ukraine, Kazakhstan, and Poland during 2020-2021: situational analysis",https://pubmed.ncbi.nlm.nih.gov/35578330,
LitCovid,"Comment on ""Association-19 of body mass index with COVID-19 related in-hospital death"" Clinical Nutrition 2022",https://pubmed.ncbi.nlm.nih.gov/35577618,
LitCovid,A machine learning approach to predict resilience and sickness absence in the healthcare workforce during the COVID-19 pandemic,https://pubmed.ncbi.nlm.nih.gov/35577884,
LitCovid,The post-COVID future of research conferences should be virtual,https://pubmed.ncbi.nlm.nih.gov/35578143,
LitCovid,Correction to: Characterization of COVID-19-associated cardiac injury: evidence for a multifactorial disease in an autopsy cohort,https://pubmed.ncbi.nlm.nih.gov/35577997,
LitCovid,No apparent association between mRNA COVID-19 vaccination and venous thromboembolism,https://pubmed.ncbi.nlm.nih.gov/35577626,
LitCovid,Adverse events after BNT162b2 mRNA COVID-19 vaccination in health care workers and medical students in Japan,https://pubmed.ncbi.nlm.nih.gov/35577684,
LitCovid,A case of facial nerve palsy in a pediatric patient associated with Covid-19,https://pubmed.ncbi.nlm.nih.gov/35578290,
LitCovid,Perceived Changes of Attitudes and Behaviors of Seventh-Day Adventists During the COVID-19 Pandemic: Findings from a Cross-Sectional Survey in Germany,https://pubmed.ncbi.nlm.nih.gov/35578058,
LitCovid,SARS-CoV-2 in silico binding affinity to human leukocyte antigen (HLA) Class II molecules predicts vaccine effectiveness across variants of concern (VOC),https://pubmed.ncbi.nlm.nih.gov/35577837,
