feed,title,long_url,short_url
LitCovid,"Management of BNT162b2 mRNA COVID-19 vaccine in children aged 5-11 years with allergies, asthma, and immunodeficiency: consensus of the Italian Society of Pediatric Allergy and Immunology (SIAIP)",https://pubmed.ncbi.nlm.nih.gov/35578294,
LitCovid,Documenting response to COVID-individual and systems successes and challenges: a longitudinal qualitative study,https://pubmed.ncbi.nlm.nih.gov/35578197,
LitCovid,"The effectiveness of testing, vaccinations and contact restrictions for containing the CoViD-19 pandemic",https://pubmed.ncbi.nlm.nih.gov/35577826,
LitCovid,Inclusive health: modeling COVID-19 in correctional facilities and communities,https://pubmed.ncbi.nlm.nih.gov/35578258,
LitCovid,Rapid scale-up of COVID-19 training for frontline health workers in 11 African countries,https://pubmed.ncbi.nlm.nih.gov/35578284,
LitCovid,Examining the impact of sharing COVID-19 misinformation online on mental health,https://pubmed.ncbi.nlm.nih.gov/35577820,
LitCovid,Repurposing the natural compounds as potential therapeutic agents for COVID-19 based on the molecular docking study of the main protease and the receptor-binding domain of spike protein,https://pubmed.ncbi.nlm.nih.gov/35578055,
LitCovid,Acceptance of COVID-19 vaccine and determinant factors in the Iranian population: a web-based study,https://pubmed.ncbi.nlm.nih.gov/35578251,
LitCovid,PrEP Use in Times of COVID-19 in the Netherlands: Men Who Have Sex With Men (MSM) on PrEP Test Less for HIV and Renal Functioning During a COVID-19 Related Lockdown,https://pubmed.ncbi.nlm.nih.gov/35578141,
LitCovid,COVID-19 vaccines in patients with decompensated cirrhosis: a retrospective cohort on safety data and risk factors associated with unvaccinated status,https://pubmed.ncbi.nlm.nih.gov/35578350,
LitCovid,"COVID-19 as a social disease: qualitative analysis of COVID-19 prevention needs, impact of control measures and community responses among racialized/ethnic minorities in Antwerp, Belgium",https://pubmed.ncbi.nlm.nih.gov/35578292,
LitCovid,ZERO projects in intensive care units: Challenges during pandemia by SARS-CoV-2 and future recommendations,https://pubmed.ncbi.nlm.nih.gov/35577740,
LitCovid,Cytotoxic Edema Involving the Corpus Callosum and Middle Cerebellar Peduncles in a Young Patient With Mild COVID-19,https://pubmed.ncbi.nlm.nih.gov/35577573,
LitCovid,Tracking COVID-19 urban activity changes in the Middle East from nighttime lights,https://pubmed.ncbi.nlm.nih.gov/35577917,
LitCovid,Development of a new antigen-based microarray platform for screening and detection of human IgG antibodies against SARS-CoV-2,https://pubmed.ncbi.nlm.nih.gov/35577791,
LitCovid,Reduced neutralizing antibody potency of COVID-19 convalescent vaccinated plasma against SARS-CoV-2 Omicron variant,https://pubmed.ncbi.nlm.nih.gov/35577569,
LitCovid,"rVSV-DeltaG-SARS-CoV-2-S vaccine: repeated intramuscular (IM) toxicity, local tolerance, immunogenicity and biodistribution study in NZW rabbits",https://pubmed.ncbi.nlm.nih.gov/35577986,
LitCovid,"Study protocol to test the efficacy of self-administration of dexmedetomidine sedative therapy on anxiety, delirium, and ventilator days in critically ill mechanically ventilated patients: an open-label randomized clinical trial",https://pubmed.ncbi.nlm.nih.gov/35578315,
LitCovid,"Genomics of Post-Vaccination SARS-CoV-2 Infections During the Delta Dominated Second Wave of COVID-19 Pandemic, from Mumbai Metropolitan Region (MMR), India",https://pubmed.ncbi.nlm.nih.gov/35578378,
LitCovid,Correction to: Acid suppressant use in association with incidence and severe outcomes of COVID19: a systematic review and metaanalysis,https://pubmed.ncbi.nlm.nih.gov/35578041,
LitCovid,"Patient and family experience with telemedicine and in-person pediatric and obstetric ambulatory encounters throughout 2020, during the COVID-19 epidemic: the distance effect",https://pubmed.ncbi.nlm.nih.gov/35578239,
LitCovid,BNT162b2-induced memory T cells respond to the Omicron variant with preserved polyfunctionality,https://pubmed.ncbi.nlm.nih.gov/35577972,
LitCovid,'Leading from the front' implementation increases the success of influenza vaccination drives among healthcare workers: a reanalysis of systematic review evidence using Intervention Component Analysis (ICA) and Qualitative Comparative Analysis (QCA),https://pubmed.ncbi.nlm.nih.gov/35578203,
LitCovid,The impact of small-group virtual patient simulator training on perceptions of individual learning process and curricular integration: a multicentre cohort study of nursing and medical students,https://pubmed.ncbi.nlm.nih.gov/35578233,
LitCovid,"Safety and immunogenicity of an egg-based inactivated Newcastle disease virus vaccine expressing SARS-CoV-2 spike: Interim results of a randomized, placebo-controlled, phase 1/2 trial in Vietnam",https://pubmed.ncbi.nlm.nih.gov/35577631,
LitCovid,RT-qPCR-based tests for SARS-CoV-2 detection in pooled saliva samples for massive population screening to monitor epidemics,https://pubmed.ncbi.nlm.nih.gov/35577836,
LitCovid,Famotidine activates the vagus nerve inflammatory reflex to attenuate cytokine storm,https://pubmed.ncbi.nlm.nih.gov/35578169,
LitCovid,Molecular docking analysis reveals the functional inhibitory effect of Genistein and Quercetin on TMPRSS2: SARS-COV-2 cell entry facilitator spike protein,https://pubmed.ncbi.nlm.nih.gov/35578172,
