feed,title,long_url,short_url
RS,Bed Management Strategies in Hospital during the COVID-19 Pandemic,https://www.researchsquare.com/article/rs-3780668/latest,https://da.gd/K6UL9B
RS,Ramsay-Hunt-Syndrome Associated with Unilateral Parotitis Following COVID-19 Vaccine,https://www.researchsquare.com/article/rs-3811498/latest,https://da.gd/FH1YuY
RS,Immunological sub-phenotypes and response to Convalescent Plasma in COVID-19 induced ARDS: a secondary analysis of the CONFIDENT trial,https://www.researchsquare.com/article/rs-3793271/latest,https://da.gd/fotq5
RS,Oral NAC and post-infectious symptoms of COVID-19 and its biological role,https://www.researchsquare.com/article/rs-3733892/latest,https://da.gd/od5v
RS,Changes in respiratory infection trends during the COVID-19 pandemic in patients with haematologic malignancy,https://www.researchsquare.com/article/rs-3810411/latest,https://da.gd/QRvET5
RS,Impact and Resiliency of the Early Phase of the COVID-19 pandemic on Healthcare Providers and their Household Members,https://www.researchsquare.com/article/rs-3756112/latest,https://da.gd/Dpfh3F
RS,Exploring Requirements for the Development and Implementation of VR Rehabilitation Programs for Long/Post COVID Patients – A Qualitative Mixed-Methods Study,https://www.researchsquare.com/article/rs-3800596/latest,https://da.gd/61dn
RS,COVID-19 severity in patients with chronic lymphocytic leukemia treated with venetoclax: a single-center observational cohort study,https://www.researchsquare.com/article/rs-3750075/latest,https://da.gd/3LPUUw
