feed,title,long_url,short_url
j.mp/lc-ml-reviews,Theoretical Foundations of t-SNE for Visualizing High-Dimensional Clustered Data (2021-2022) (stat.ML),http://arxiv.org/abs/2105.07536v3,
j.mp/lc-ml-reviews,"Deep Generative Modelling: A Comparative Review of VAEs, GANs, Normalizing Flows, Energy-Based and Autoregressive Models (2021-2022) (cs.LG)",http://arxiv.org/abs/2103.04922v4,
j.mp/lc-ml-reviews,Image-text Retrieval: A Survey on Recent Research and Development (2022) (cs.IR),http://arxiv.org/abs/2203.14713v1,
j.mp/lc-ml-reviews,MolGenSurvey: A Systematic Survey in Machine Learning Models for Molecule Design (2022) (cs.LG),http://arxiv.org/abs/2203.14500v1,
j.mp/lc-ml-reviews,Joint Gaussian Graphical Model Estimation: A Survey (2021-2022) (stat.ME),http://arxiv.org/abs/2110.10281v2,
j.mp/lc-ml-reviews,A Benchmark and Comprehensive Survey on Knowledge Graph Entity Alignment via Representation Learnin (2021-2022) (cs.AI),http://arxiv.org/abs/2103.15059v3,
j.mp/lc-ml-reviews,Encoder-Decoder Architecture for Supervised Dynamic Graph Learning: A Survey (2022) (cs.LG),http://arxiv.org/abs/2203.10480v2,
j.mp/lc-ml-reviews,A Survey on Aspect-Based Sentiment Classification (2022) (cs.CL),http://arxiv.org/abs/2203.14266v1,
j.mp/lc-ml-reviews,A General Survey on Attention Mechanisms in Deep Learning (2022) (cs.LG),http://arxiv.org/abs/2203.14263v1,
j.mp/lc-ml-reviews,A Survey of Super-Resolution in Iris Biometrics with Evaluation of Dictionary-Learning (2022) (cs.CV),http://arxiv.org/abs/2203.14203v1,
j.mp/lc-ml-reviews,RGBD Object Tracking: An In-depth Review (2022) (cs.CV),http://arxiv.org/abs/2203.14134v1,
j.mp/lc-ml-reviews,"Getting more from the skyline operator through restricted skylines, regret minimizing sets and skyline ordering: a survey on their properties and comparison (2022) (cs.DB)",http://arxiv.org/abs/2203.14086v1,
j.mp/lc-ml-reviews,"A Survey of Robust Adversarial Training in Pattern Recognition: Fundamental, Theory, and Methodologies (2022) (cs.CV)",http://arxiv.org/abs/2203.14046v1,
j.mp/lc-ml-reviews,Combining Evolution and Deep Reinforcement Learning for Policy Search: a Survey (2022) (cs.LG),http://arxiv.org/abs/2203.14009v1,
j.mp/lc-ml-reviews,Tutorial: Modern Theoretical Tools for Understanding and Designing Next-generation Information Retrieval System (2022) (cs.IR),http://arxiv.org/abs/2203.13962v1,
j.mp/lc-ml-reviews,AI-augmented histopathologic review using image analysis to optimize DNA yield and tumor purity from FFPE slides (2022) (cs.CV),http://arxiv.org/abs/2203.13948v1,
j.mp/lc-ml-reviews,A Meta Survey of Quality Evaluation Criteria in Explanation Methods (2022) (cs.AI),http://arxiv.org/abs/2203.13929v1,
j.mp/lc-ml-reviews,AutoML for Deep Recommender Systems: A Survey (2022) (cs.IR),http://arxiv.org/abs/2203.13922v1,
j.mp/lc-ml-reviews,Concept Embedding Analysis: A Review (2022) (cs.LG),http://arxiv.org/abs/2203.13909v1,
