feed,title,long_url,short_url
ArXiv:q-fin,Signature-Based Optimal Execution for Statistical Arbitrage with Path-Dependent Trading Signals,https://arxiv.org/abs/2606.31387,
ArXiv:q-fin,Settlement Manipulation in Prediction Markets,https://arxiv.org/abs/2606.31675,
ArXiv:q-fin,Regime-Conditional Distributional Comparison of Trading Strategies: A GAMLSS/ZAGA Framework Applied to the S&P 500,https://arxiv.org/abs/2606.31251,
ArXiv:q-fin,Real-time identification of the onset of financial rogue waves,https://arxiv.org/abs/2606.31475,
ArXiv:q-fin,"Same Firms, Different Verdicts: ESG Rating Choice and the Measurement of Greenwashing",https://arxiv.org/abs/2606.31469,
