feed,title,long_url,short_url
GN:T:CC,"Climate change stoked US, Mexico heatwave - report - BBC",https://news.google.com/rss/articles/CBMiLmh0dHBzOi8vd3d3LmJiYy5jb20vbmV3cy9hcnRpY2xlcy9jenZ2cWRnOHp4bm_SATJodHRwczovL3d3dy5iYmMuY29tL25ld3MvYXJ0aWNsZXMvY3p2dnFkZzh6eG5vLmFtcA?oc=5,https://da.gd/iDje
GN:T:CC,"Deadly heatwaves in US, Mexico made more likely by climate change - Al Jazeera English",https://news.google.com/rss/articles/CBMia2h0dHBzOi8vd3d3LmFsamF6ZWVyYS5jb20vZ2FsbGVyeS8yMDI0LzYvMjAvZGVhZGx5LWhlYXR3YXZlLWluLXVzLW1leGljby1tYWRlLW1vcmUtbGlrZWx5LWJ5LWNsaW1hdGUtY2hhbmdl0gFvaHR0cHM6Ly93d3cuYWxqYXplZXJhLmNvbS9hbXAvZ2FsbGVyeS8yMDI0LzYvMjAvZGVhZGx5LWhlYXR3YXZlLWluLXVzLW1leGljby1tYWRlLW1vcmUtbGlrZWx5LWJ5LWNsaW1hdGUtY2hhbmdl?oc=5,https://da.gd/gaSGu
GN:T:CC,"At Least 1,000, Including 68 Indians, Die In Scorching Heat During Hajj: Report - NDTV",https://news.google.com/rss/articles/CBMiX2h0dHBzOi8vd3d3Lm5kdHYuY29tL3dvcmxkLW5ld3MvYXQtbGVhc3QtMS0wMDAtZGllLWluLXNjb3JjaGluZy1oZWF0LWR1cmluZy1oYWpqLXJlcG9ydC01OTMwNDE20gFlaHR0cHM6Ly93d3cubmR0di5jb20vd29ybGQtbmV3cy9hdC1sZWFzdC0xLTAwMC1kaWUtaW4tc2NvcmNoaW5nLWhlYXQtZHVyaW5nLWhhamotcmVwb3J0LTU5MzA0MTYvYW1wLzE?oc=5,https://da.gd/mRNXFG
GN:T:CC,80 percent of people globally want stronger climate action by governments according to UN Development Programme survey - United Nations Development Programme,https://news.google.com/rss/articles/CBMikQFodHRwczovL3d3dy51bmRwLm9yZy9wcmVzcy1yZWxlYXNlcy84MC1wZXJjZW50LXBlb3BsZS1nbG9iYWxseS13YW50LXN0cm9uZ2VyLWNsaW1hdGUtYWN0aW9uLWdvdmVybm1lbnRzLWFjY29yZGluZy11bi1kZXZlbG9wbWVudC1wcm9ncmFtbWUtc3VydmV50gEA?oc=5,https://da.gd/2FW9I5
GN:T:CC,Dilemma on Wall Street: Short-Term Gain or Climate Benefit? - The New York Times,https://news.google.com/rss/articles/CBMiU2h0dHBzOi8vd3d3Lm55dGltZXMuY29tLzIwMjQvMDYvMjAvYnVzaW5lc3MvZWNvbm9teS9maW5hbmNpYWwtaW5kdXN0cnktY2xpbWF0ZS5odG1s0gEA?oc=5,https://da.gd/bE8Er
GN:T:CC,Fewer swallows grace summer skies in Britain amid changing climate - The Guardian,https://news.google.com/rss/articles/CBMibmh0dHBzOi8vd3d3LnRoZWd1YXJkaWFuLmNvbS9lbnZpcm9ubWVudC9hcnRpY2xlLzIwMjQvanVuLzIwL2Zld2VyLXN3YWxsb3dzLWJyaXRhaW4tc3VtbWVyLXNraWVzLWNsaW1hdGUtY2hhbmdl0gFuaHR0cHM6Ly9hbXAudGhlZ3VhcmRpYW4uY29tL2Vudmlyb25tZW50L2FydGljbGUvMjAyNC9qdW4vMjAvZmV3ZXItc3dhbGxvd3MtYnJpdGFpbi1zdW1tZXItc2tpZXMtY2xpbWF0ZS1jaGFuZ2U?oc=5,https://da.gd/uZ0BpG
GN:T:CC,"Extreme heat, wildfires and climate change are causing Canadians to feel heightened sense of eco anxiety: 'How are we going to live?' - Yahoo Life",https://news.google.com/rss/articles/CBMirwFodHRwczovL3d3dy55YWhvby5jb20vbGlmZXN0eWxlL2V4dHJlbWUtaGVhdC13aWxkZmlyZXMtYW5kLWNsaW1hdGUtY2hhbmdlLWFyZS1jYXVzaW5nLWNhbmFkaWFucy10by1mZWVsLWhlaWdodGVuZWQtc2Vuc2Utb2YtZWNvLWFueGlldHktaG93LWFyZS13ZS1nb2luZy10by1saXZlLTE4MDA0OTkyMi5odG1s0gEA?oc=5,https://da.gd/Z7ySfN
