feed,title,long_url,short_url
GN:T:CC,"Silicon Valley, Wall Street donors committed to funding research to block the sun to slow climate change - Fox News",https://news.google.com/rss/articles/CBMieGh0dHBzOi8vd3d3LmZveG5ld3MuY29tL21lZGlhL3NpbGljb24tdmFsbGV5LXdhbGwtc3RyZWV0LWRvbm9ycy1jb21taXR0ZWQtZnVuZGluZy1yZXNlYXJjaC1ibG9jay1zdW4tc2xvdy1jbGltYXRlLWNoYW5nZdIBfGh0dHBzOi8vd3d3LmZveG5ld3MuY29tL21lZGlhL3NpbGljb24tdmFsbGV5LXdhbGwtc3RyZWV0LWRvbm9ycy1jb21taXR0ZWQtZnVuZGluZy1yZXNlYXJjaC1ibG9jay1zdW4tc2xvdy1jbGltYXRlLWNoYW5nZS5hbXA?oc=5,https://da.gd/Ar3Vpj
GN:T:CC,"George Woodwell, Scientist Who Helped Shape Environmental Policy, Dies at 95 - The New York Times",https://news.google.com/rss/articles/CBMiRGh0dHBzOi8vd3d3Lm55dGltZXMuY29tLzIwMjQvMDYvMjAvc2NpZW5jZS9nZW9yZ2Utd29vZHdlbGwtZGVhZC5odG1s0gEA?oc=5,https://da.gd/Yd3dt
GN:T:CC,How the 2024 US election could affect global fight against climate change - Al Jazeera English,https://news.google.com/rss/articles/CBMicmh0dHBzOi8vd3d3LmFsamF6ZWVyYS5jb20vbmV3cy8yMDI0LzYvMjAvaG93LXRoZS0yMDI0LXVzLWVsZWN0aW9uLWNvdWxkLWFmZmVjdC1nbG9iYWwtZmlnaHQtYWdhaW5zdC1jbGltYXRlLWNoYW5nZdIBdmh0dHBzOi8vd3d3LmFsamF6ZWVyYS5jb20vYW1wL25ld3MvMjAyNC82LzIwL2hvdy10aGUtMjAyNC11cy1lbGVjdGlvbi1jb3VsZC1hZmZlY3QtZ2xvYmFsLWZpZ2h0LWFnYWluc3QtY2xpbWF0ZS1jaGFuZ2U?oc=5,https://da.gd/4VNk8
GN:T:CC,Eye-popping data details climate change's drastic impact on heat wave - USA TODAY,https://news.google.com/rss/articles/CBMiYmh0dHBzOi8vd3d3LnVzYXRvZGF5LmNvbS9zdG9yeS9uZXdzL25hdGlvbi8yMDI0LzA2LzIwL2NsaW1hdGUtY2hhbmdlLWhlYXQtd2F2ZS1pbXBhY3QvNzQxNTU1MTcwMDcv0gEA?oc=5,https://da.gd/2rDIG
GN:T:CC,Airfield with Taylor Swift's private jet targeted by climate activists using orange paint - CBS News,https://news.google.com/rss/articles/CBMiZmh0dHBzOi8vd3d3LmNic25ld3MuY29tL25ld3MvdGF5bG9yLXN3aWZ0LXByaXZhdGUtamV0LWNsaW1hdGUtYWN0aXZpc3RzLW9yYW5nZS1wYWludC1icml0aXNoLWFpcmZpZWxkL9IBamh0dHBzOi8vd3d3LmNic25ld3MuY29tL2FtcC9uZXdzL3RheWxvci1zd2lmdC1wcml2YXRlLWpldC1jbGltYXRlLWFjdGl2aXN0cy1vcmFuZ2UtcGFpbnQtYnJpdGlzaC1haXJmaWVsZC8?oc=5,https://da.gd/ZmVYJ
