feed,title,long_url,short_url
GN:T:RE,Wind power critics: What's the truth about their claims? - Deutsche Welle,https://www.dw.com/en/wind-power-critics-whats-the-truth-about-their-claims/a-60048961,
GN:T:RE,Pedernales Electric Cooperative wants to change buyback rate for solar members - KVUE,https://www.kvue.com/article/news/investigations/defenders/pedernales-electric-cooperative-buyback-rate-solar-members/269-9cd7bf56-178c-4479-8187-743a1300a90f,
GN:T:RE,"Colorado Weather: Damaging Wind Through Wednesday Afternoon, Travel Discouraged - CBS Denver",https://denver.cbslocal.com/2021/12/15/colorado-high-wind-warning-denver-weather-damaging-travel-discouraged/,
GN:T:RE,"Nearly 50,000 homes and businesses in metro Denver lose power as winds whip Colorado - The Denver Post",https://www.denverpost.com/2021/12/15/power-outages-denver-wind-xcel-energy/,
GN:T:RE,Utrecht wants to be the first city to use its electric car fleet as a giant battery - Fast Company,https://www.fastcompany.com/90705832/utrecht-wants-to-be-the-first-city-to-use-its-electric-car-fleet-as-a-giant-battery,
GN:T:RE,"Fires, Overturned Semis & Power Outages All Possible During Wednesday Wind Event - CBS Denver",https://denver.cbslocal.com/2021/12/14/high-wind-warning-power-outage-fires/,
GN:T:RE,Dangerous weather Wednesday: Minnesota ripe for first-ever December tornadoes - MPR News,https://www.mprnews.org/story/2021/12/15/wednesdays-weather-turns-dangerous-and-will-make-history,
GN:T:RE,"Updates: High winds in Kansas causing power outages, darkening skies and highway closings due to overturned semis - KSN-TV",https://www.ksn.com/weather/weather-stories/kansas-high-wind-storm-updates/,
