feed,title,long_url,short_url
ArXiv,A Decentralized Approach Towards Responsible AI in Social Ecosystems,https://arxiv.org/abs/2102.06362v1,
ArXiv,VitrAI -- Applying Explainable AI in the Real World,https://arxiv.org/abs/2102.06518v1,
ArXiv,Leveraging Artificial Intelligence to Analyze the COVID-19 Distribution Pattern based on Socio-economic Determinants,https://arxiv.org/abs/2102.06656v1,
ArXiv,Leveraging Artificial Intelligence to Analyze Citizens' Opinions on Urban Green Space,https://arxiv.org/abs/2102.06659v1,
ArXiv,"Design of a dynamic and self adapting system, supported with artificial intelligence, machine learning and real time intelligence for predictive cyber risk analytics in extreme environments, cyber risk in the colonisation of Mars",https://arxiv.org/abs/2005.12150v2,
ArXiv,"Artificial Intelligence based Anomaly Detection of Energy Consumption in Buildings: A Review, Current Trends and New Perspectives",https://arxiv.org/abs/2010.04560v5,
ArXiv,A Definition and a Test for Human-Level Artificial Intelligence,https://arxiv.org/abs/2011.09410v3,
