feed,title,long_url,short_url
GN:S:C,"As Election Nears, Trump Makes a Final Push Against Climate Science - The New York Times",https://www.nytimes.com/2020/10/27/climate/trump-election-climate-noaa.html,
GN:S:C,"When it comes to climate change, says Mark Carney, this financial crisis is different—and maybe better - Fortune",https://fortune.com/2020/10/27/covid-climate-change-recession-mark-carney-un-financial-crisis/,
GN:S:C,U.S. group urges Biden to use financial regulation to control climate change - WTVB News,https://wtvbam.com/2020/10/27/u-s-group-urges-biden-to-use-financial-regulation-to-control-climate-change/,
GN:S:C,Energy at risk: The impact of climate change on supply and costs - Phys,https://phys.org/news/2020-10-energy-impact-climate.html,
GN:S:C,"State-level Opinions on Climate Change, From the Redwood Forest to the Gulf Stream Waters - YubaNet",https://yubanet.com/enviro/state-level-opinions-on-climate-change-from-the-redwood-forest-to-the-gulf-stream-waters/,
GN:S:C,Leadership and funding at centre of climate policy study in sub-Saharan Africa - Climate Home,https://www.climatechangenews.com/2020/10/27/leadership-funding-centre-climate-policy-study-sub-saharan-africa/,
GN:S:C,Weather Q&A: Brian Soden discusses climate change - KXAN,https://www.kxan.com/weather-traffic-qas/weather-qa-brian-soden-discusses-climate-change/,
GN:S:C,Colorado's Record-Breaking Wildfire Season Fueled by Climate Climate - One Green Planet,https://www.onegreenplanet.org/environment/colorados-record-breaking-wildfire-season-fueled-by-climate-climate/,
GN:S:C,Urgent action needed to protect human health from the effects of climate change - Science Business,https://sciencebusiness.net/news/urgent-action-needed-protect-human-health-effects-climate-change,
GN:S:C,"With Climate Impacts Hitting Home, a Tahoe-Area Community Foundation Backs Forest Health - Inside Philanthropy",https://www.insidephilanthropy.com/home/2020/10/27/with-climate-impacts-hitting-home-a-tahoe-area-community-foundation-supports-forest-health,
GN:S:C,Boris Johnson asks Scott Morrison to take 'bold action' on climate change - Sydney Morning Herald,https://www.smh.com.au/world/europe/boris-johnson-asks-scott-morrison-to-take-bold-action-on-climate-change-20201027-p56973.html,
GN:S:C,Racing To Save Earth's Climate Record | WOSU Radio - WOSU,https://radio.wosu.org/post/racing-save-earth-s-climate-record,
GN:S:C,Climate Policymaking in the Shadow of the Supreme Court - Resources Magazine,https://www.resourcesmag.org/common-resources/climate-policymaking-shadow-supreme-court/,
