feed,title,long_url,short_url
GN:T:RE,Will Biden's Offshore Wind Plan Be Enough? - TIME,https://time.com/5952586/biden-offshore-wind/,
GN:T:RE,"EVs Are Great, But 'Active Travel' Is The Best Way to Achieve Net-Zero Cities - ScienceAlert",https://www.sciencealert.com/evs-are-great-but-active-travel-is-the-best-way-to-achieve-net-zero-cities,
GN:T:RE,Why Solar Energy Stocks Popped Today - Motley Fool,https://www.fool.com/investing/2021/04/06/why-solar-energy-stocks-popped-today/,
GN:T:RE,"Gov. Lujan Grisham signs community solar, trapping ban, Gila Diversion bills - New Mexico Political Report",https://nmpoliticalreport.com/2021/04/05/gov-michelle-lujan-grisham-signs-community-solar-act/,
GN:T:RE,Renewable Energy Deadline Alert - Yahoo Finance,https://finance.yahoo.com/news/renewable-energy-deadline-alert-232100308.html,
GN:T:RE,Demand Concerns Continue To Plague Oil Markets - OilPrice,https://oilprice.com/Energy/Energy-General/Demand-Concerns-Continue-To-Plague-Oil-Markets.html,
