feed,title,long_url,short_url
GN:T:CC,The First Step Toward Saving the Planet Is Ignoring the Economists - Rolling Stone,https://www.rollingstone.com/politics/politics-news/ipcc-climate-report-climate-change-economics-1316106/,
GN:T:CC,LETTERS || Better to export technology that will help address climate change - The Advocate,https://www.theadvocate.com.au/story/7642842/renewable-components-ahead-of-fossil-fuels/?cs=92,
GN:T:CC,"UNEP combats pollution, restores ozone and protects seas – UN chief tells 50th anniversary session - UN News",https://news.un.org/en/story/2022/03/1113202,
GN:T:CC,"Ex-Unilever CEO namechecks Tesla, says firms need to focus on longer term models - CNBC",https://www.cnbc.com/2022/03/04/ex-unilever-ceo-namechecks-tesla-says-firms-should-focus-on-long-term.html,
GN:T:CC,China’s top investor urges Beijing to invest in tech to meet climate goals - South China Morning Post,https://www.scmp.com/tech/policy/article/3169259/sequoia-capital-china-founder-urges-beijing-invest-tech-fight-climate,
