feed,title,long_url,short_url
GN:T:ML,How Chain-of-Thought Reasoning Helps Neural Networks Compute - Quanta Magazine,https://news.google.com/rss/articles/CBMiZWh0dHBzOi8vd3d3LnF1YW50YW1hZ2F6aW5lLm9yZy9ob3ctY2hhaW4tb2YtdGhvdWdodC1yZWFzb25pbmctaGVscHMtbmV1cmFsLW5ldHdvcmtzLWNvbXB1dGUtMjAyNDAzMjEv0gEA?oc=5,https://da.gd/qUMPgj
GN:T:ML,Why adversarial AI is the cyber threat no one sees coming - VentureBeat,https://news.google.com/rss/articles/CBMiW2h0dHBzOi8vdmVudHVyZWJlYXQuY29tL3NlY3VyaXR5L3doeS1hZHZlcnNhcmlhbC1haS1pcy10aGUtY3liZXItdGhyZWF0LW5vLW9uZS1zZWVzLWNvbWluZy_SAQA?oc=5,https://da.gd/75Uc
GN:T:ML,Machine 'Unlearning' Helps Generative AI 'Forget' Copyright-Protected and Violent Content - The University of Texas at Austin,https://news.google.com/rss/articles/CBMieWh0dHBzOi8vbmV3cy51dGV4YXMuZWR1LzIwMjQvMDMvMjEvbWFjaGluZS11bmxlYXJuaW5nLWhlbHBzLWdlbmVyYXRpdmUtYWktZm9yZ2V0LWNvcHlyaWdodC1wcm90ZWN0ZWQtYW5kLXZpb2xlbnQtY29udGVudC_SAQA?oc=5,https://da.gd/h3Xya
GN:T:ML,The Rise of Mixture-of-Experts for Efficient Large Language Models - Unite,https://news.google.com/rss/articles/CBMiWGh0dHBzOi8vd3d3LnVuaXRlLmFpL3RoZS1yaXNlLW9mLW1peHR1cmUtb2YtZXhwZXJ0cy1mb3ItZWZmaWNpZW50LWxhcmdlLWxhbmd1YWdlLW1vZGVscy_SAQA?oc=5,https://da.gd/glUCj
GN:T:ML,"Crypto Entities That Neglect AI and Machine Learning Investment Will Lag Behind, Warns Binance CTO – Bitcoin News - Bitcoin",https://news.google.com/rss/articles/CBMie2h0dHBzOi8vbmV3cy5iaXRjb2luLmNvbS9jcnlwdG8tZW50aXRpZXMtdGhhdC1uZWdsZWN0LWFpLWFuZC1tYWNoaW5lLWxlYXJuaW5nLWludmVzdG1lbnQtd2lsbC1sYWctYmVoaW5kLXdhcm5zLWJpbmFuY2UtY3RvL9IBAA?oc=5,https://da.gd/u3Bew
GN:T:ML,"The enormous potential of binarized and 1,58-bit neural networks - DataDrivenInvestor",https://news.google.com/rss/articles/CBMic2h0dHBzOi8vbWVkaXVtLmRhdGFkcml2ZW5pbnZlc3Rvci5jb20vdGhlLWVub3Jtb3VzLXBvdGVudGlhbC1vZi1iaW5hcml6ZWQtYW5kLTEtNTgtYml0LW5ldXJhbC1uZXR3b3Jrcy1lNDIwOTc2NmY2ZjPSAQA?oc=5,https://da.gd/A9Cc9r
