feed,title,long_url,short_url
GN:T:CC,"Cities are sinking, and it's making them more vulnerable to climate change - The Verge",https://news.google.com/rss/articles/CBMiXmh0dHBzOi8vd3d3LnRoZXZlcmdlLmNvbS8yMDI0LzMvNi8yNDA5MTU0MS9zaW5raW5nLWNpdGllcy1jb2FzdC1zZWEtbGV2ZWwtcmlzZS1uYXR1cmUtcmVzZWFyY2jSAQA?oc=5,https://da.gd/D04De
GN:T:CC,SEC Expected to Approve Weakened Climate Disclosures Rule - The Wall Street Journal,https://news.google.com/rss/articles/CBMiV2h0dHBzOi8vd3d3Lndzai5jb20vZmluYW5jZS9yZWd1bGF0aW9uL3NlYy1jbGltYXRlLWRpc2Nsb3N1cmUtZ3JlZW5ob3VzZS1nYXNlcy1kNTdkZTI3Y9IBAA?oc=5,https://da.gd/hNlU9s
GN:T:CC,Jerome Powell Speech: Fed Chair says they are not climate change policymakers - FXStreet,https://news.google.com/rss/articles/CBMiamh0dHBzOi8vd3d3LmZ4c3RyZWV0LmNvbS9uZXdzL2plcm9tZS1wb3dlbGwtc3BlZWNoLXByZXZpZXctZmVkLWNoYWlyLXRlc3RpZmllcy1pbi11cy1jb25ncmVzcy0yMDI0MDMwNjEyMDDSAQA?oc=5,https://da.gd/22NY6
GN:T:CC,SEC finalizes weakened rule to make companies disclose climate information - The Hill,https://news.google.com/rss/articles/CBMiWGh0dHBzOi8vdGhlaGlsbC5jb20vcG9saWN5L2VuZXJneS1lbnZpcm9ubWVudC80NTEyNTc4LXNlYy1maW5hbC1jbGltYXRlLWRpc2Nsb3N1cmUtcnVsZS_SAVxodHRwczovL3RoZWhpbGwuY29tL3BvbGljeS9lbmVyZ3ktZW52aXJvbm1lbnQvNDUxMjU3OC1zZWMtZmluYWwtY2xpbWF0ZS1kaXNjbG9zdXJlLXJ1bGUvYW1wLw?oc=5,https://da.gd/LrYS
GN:T:CC,Disappearing cities on US coasts - Nature,https://news.google.com/rss/articles/CBMiMmh0dHBzOi8vd3d3Lm5hdHVyZS5jb20vYXJ0aWNsZXMvczQxNTg2LTAyNC0wNzAzOC0z0gEA?oc=5,https://da.gd/PzONJU
GN:T:CC,"Gray whale, species extinct in Atlantic Ocean for 200 years, seen off Nantucket - Yahoo! Voices",https://news.google.com/rss/articles/CBMiTWh0dHBzOi8vd3d3LnlhaG9vLmNvbS9uZXdzL2dyYXktd2hhbGUtc3BlY2llcy1leHRpbmN0LWF0bGFudGljLTE2NDUwMDM3Ny5odG1s0gEA?oc=5,https://da.gd/t4e6F
GN:T:CC,Powell reinforces position that the Fed is not ready to start cutting interest rates - CNBC,https://news.google.com/rss/articles/CBMieWh0dHBzOi8vd3d3LmNuYmMuY29tLzIwMjQvMDMvMDYvcG93ZWxsLXJlaW5mb3JjZXMtcG9zaXRpb24tdGhhdC10aGUtZmVkLWlzLW5vdC1yZWFkeS10by1zdGFydC1jdXR0aW5nLWludGVyZXN0LXJhdGVzLmh0bWzSAX1odHRwczovL3d3dy5jbmJjLmNvbS9hbXAvMjAyNC8wMy8wNi9wb3dlbGwtcmVpbmZvcmNlcy1wb3NpdGlvbi10aGF0LXRoZS1mZWQtaXMtbm90LXJlYWR5LXRvLXN0YXJ0LWN1dHRpbmctaW50ZXJlc3QtcmF0ZXMuaHRtbA?oc=5,https://da.gd/zfhIl
GN:T:CC,Open Newsroom: A Talk on NYC's Toxic Sites in the Age of Climate Change - THE CITY,https://news.google.com/rss/articles/CBMiVmh0dHBzOi8vd3d3LnRoZWNpdHkubnljLzIwMjQvMDMvMDUvb3Blbi1uZXdzcm9vbS10b3hpYy1zdXBlcmZ1bmQtc2l0ZXMtY2xpbWF0ZS1jaGFuZ2Uv0gEA?oc=5,https://da.gd/E8JK
GN:T:CC,Scientists say they're closer to reviving mammoths. What could go wrong? - The Washington Post,https://news.google.com/rss/articles/CBMihgFodHRwczovL3d3dy53YXNoaW5ndG9ucG9zdC5jb20vY2xpbWF0ZS1lbnZpcm9ubWVudC8yMDI0LzAzLzA2L3NjaWVudGlzdHMtc2F5LXRoZXlyZS1zdGVwLWNsb3Nlci1yZXZpdmluZy1tYW1tb3Rocy13aGF0LWNvdWxkLWdvLXdyb25nL9IBAA?oc=5,https://da.gd/kyuL
GN:T:CC,"In Mongolia, a Killer Winter Is Ravaging Herds and a Way of Life - Yale Environment 360",https://news.google.com/rss/articles/CBMiO2h0dHBzOi8vZTM2MC55YWxlLmVkdS9mZWF0dXJlcy9tb25nb2xpYS1kenVkLWNsaW1hdGUtY2hhbmdl0gEA?oc=5,https://da.gd/JzyNwy
