feed,title,long_url,short_url
GN:T:CC,"On Earth Day, The Planet Shows Off Its Beauty - Videos from The Weather Channel - The Weather Channel",https://news.google.com/rss/articles/CBMiU2h0dHBzOi8vd2VhdGhlci5jb20vbmV3cy9jbGltYXRlL3ZpZGVvL29uLWVhcnRoLWRheS10aGUtcGxhbmV0LXNob3dzLW9mZi1pdHMtYmVhdXR50gEA?oc=5,https://da.gd/0Ecis
GN:T:CC,Climate change impact on Seabrook nuclear plant demands deeper reporting: Letters - Seacoastonline,https://news.google.com/rss/articles/CBMijwFodHRwczovL3d3dy5zZWFjb2FzdG9ubGluZS5jb20vc3Rvcnkvb3Bpbmlvbi9sZXR0ZXJzLzIwMjQvMDQvMjIvY2xpbWF0ZS1jaGFuZ2UtaW1wYWN0LW9uLXNlYWJyb29rLXN0YXRpb24tZGVtYW5kcy1kZWVwZXItcmVwb3J0aW5nLzczNDA1MzEyMDA3L9IBAA?oc=5,https://da.gd/H0lVhj
GN:T:CC,California Supreme Court To Hear Home Solar Rate Case And It's A Mess - Forbes,https://news.google.com/rss/articles/CBMie2h0dHBzOi8vd3d3LmZvcmJlcy5jb20vc2l0ZXMvYnJhZHRlbXBsZXRvbi8yMDI0LzA0LzIyL2NhbGlmb3JuaWEtc3VwcmVtZS1jb3VydC10by1oZWFyLWhvbWUtc29sYXItcmF0ZS1jYXNlLWFuZC1pdHMtYS1tZXNzL9IBAA?oc=5,https://da.gd/lIzMT
GN:T:CC,Experts say election brings new stakes to Earth Day - The Hill,https://news.google.com/rss/articles/CBMiZ2h0dHBzOi8vdGhlaGlsbC5jb20vcG9saWN5L2VuZXJneS1lbnZpcm9ubWVudC80NjA2NDU2LWVsZWN0aW9uLWVhcnRoLWRheS1jbGltYXRlLWNoYW5nZS1nbG9iYWwtd2FybWluZy_SAWtodHRwczovL3RoZWhpbGwuY29tL3BvbGljeS9lbmVyZ3ktZW52aXJvbm1lbnQvNDYwNjQ1Ni1lbGVjdGlvbi1lYXJ0aC1kYXktY2xpbWF0ZS1jaGFuZ2UtZ2xvYmFsLXdhcm1pbmcvYW1wLw?oc=5,https://da.gd/NQqu5y
GN:T:CC,California wants to harness more than half its land to combat climate change by 2045. Here's how - Yahoo! Voices,https://news.google.com/rss/articles/CBMiTGh0dHBzOi8vd3d3LnlhaG9vLmNvbS9uZXdzL2NhbGlmb3JuaWEtd2FudHMtaGFybmVzcy1tb3JlLWhhbGYtMTMwMDA3MDQ0Lmh0bWzSAQA?oc=5,https://da.gd/FM7f
GN:T:CC,"Pope Francis invites Gov. Maura Healey, Mayor Michelle Wu and other Bay State leaders to speak at Vatican Climate Summit - Boston Herald",https://news.google.com/rss/articles/CBMinwFodHRwczovL3d3dy5ib3N0b25oZXJhbGQuY29tLzIwMjQvMDQvMjIvcG9wZS1mcmFuY2lzLWludml0ZXMtZ292LW1hdXJhLWhlYWxleS1tYXlvci1taWNoZWxsZS13dS1hbmQtb3RoZXItYmF5LXN0YXRlLWxlYWRlcnMtdG8tc3BlYWstYXQtdmF0aWNhbi1jbGltYXRlLXN1bW1pdC_SAaMBaHR0cHM6Ly93d3cuYm9zdG9uaGVyYWxkLmNvbS8yMDI0LzA0LzIyL3BvcGUtZnJhbmNpcy1pbnZpdGVzLWdvdi1tYXVyYS1oZWFsZXktbWF5b3ItbWljaGVsbGUtd3UtYW5kLW90aGVyLWJheS1zdGF0ZS1sZWFkZXJzLXRvLXNwZWFrLWF0LXZhdGljYW4tY2xpbWF0ZS1zdW1taXQvYW1wLw?oc=5,https://da.gd/GU5u4l
GN:T:CC,Biden to Unveil $7 Billion in Solar Power Grants - TIME,https://news.google.com/rss/articles/CBMiNWh0dHBzOi8vdGltZS5jb20vNjk2OTYwNy9iaWRlbi1zb2xhci1wb3dlci1lYXJ0aC1kYXkv0gEA?oc=5,https://da.gd/udsF4
GN:T:CC,Robert Kennedy Jr. pivots right on climate change — but sharpens his threat to Biden - POLITICO,https://news.google.com/rss/articles/CBMiU2h0dHBzOi8vd3d3LnBvbGl0aWNvLmNvbS9uZXdzLzIwMjQvMDQvMTkvYmlkZW4tdHJ1bXAtY2xpbWF0ZS12b3RlcnMtcmZrLWpyLTAwMTUzNDcx0gEA?oc=5,https://da.gd/iaDOK
