feed,title,long_url,short_url
GN:S:GW,Coastal cities not safe from sea level rise - oceanographer - Cosmos,https://news.google.com/rss/articles/CBMiU2h0dHBzOi8vY29zbW9zbWFnYXppbmUuY29tL2VhcnRoL2NsaW1hdGUvY29hc3QtY2l0aWVzLW5vdC1zYWZlLWZyb20tc2VhLWxldmVsLXJpc2Uv0gEA?oc=5,https://da.gd/ni1sxe
GN:S:GW,Earth Day 2024: A Look at 3 Places Adapting Quickly to Fight Climate Change - The New York Times,https://news.google.com/rss/articles/CBMiSGh0dHBzOi8vd3d3Lm55dGltZXMuY29tLzIwMjQvMDQvMjIvY2xpbWF0ZS9lYXJ0aC1kYXktY2xpbWF0ZS1jaGFuZ2UuaHRtbNIBAA?oc=5,https://da.gd/vUeImo
GN:S:GW,"A Dual Mission: Growing Green, UConn Professor Earns Income Licensing Plants that Fight Climate Change - UConn",https://news.google.com/rss/articles/CBMihQFodHRwczovL3RvZGF5LnVjb25uLmVkdS8yMDI0LzA0L2EtZHVhbC1taXNzaW9uLWdyb3dpbmctZ3JlZW4tdWNvbm4tcHJvZmVzc29yLWVhcm5zLWluY29tZS1saWNlbnNpbmctcGxhbnRzLXRoYXQtZmlnaHQtY2xpbWF0ZS1jaGFuZ2Uv0gEA?oc=5,https://da.gd/duzZsh
GN:S:GW,Warming climate turns tundra from carbon sink to source - Earth,https://news.google.com/rss/articles/CBMiU2h0dHBzOi8vd3d3LmVhcnRoLmNvbS9uZXdzL3dhcm1pbmctY2xpbWF0ZS10dXJucy10dW5kcmEtZnJvbS1jYXJib24tc2luay10by1zb3VyY2Uv0gEA?oc=5,https://da.gd/VeDe
GN:S:GW,Emergency Response to Climate Tipping Points - Harvard Magazine,https://news.google.com/rss/articles/CBMiQGh0dHBzOi8vd3d3LmhhcnZhcmRtYWdhemluZS5jb20vMjAyNC8wNC9jbGltYXRlLXRpcHBpbmctZWxlbWVudHPSAQA?oc=5,https://da.gd/cbmL
GN:S:GW,Robert Taylor & Mark Reynolds: Climate Change Conversations Can Start with You | Opinions - Noozhawk,https://news.google.com/rss/articles/CBMiZWh0dHBzOi8vd3d3Lm5vb3poYXdrLmNvbS9yb2JlcnQtdGF5bG9yLW1hcmstcmV5bm9sZHMtY2xpbWF0ZS1jaGFuZ2UtY29udmVyc2F0aW9ucy1jYW4tc3RhcnQtd2l0aC15b3Uv0gEA?oc=5,https://da.gd/QLzTy
GN:S:GW,Excess heat and climate change pose health hazards for global workers - Africanews English,https://news.google.com/rss/articles/CBMibGh0dHBzOi8vd3d3LmFmcmljYW5ld3MuY29tLzIwMjQvMDQvMjIvZXhjZXNzLWhlYXQtYW5kLWNsaW1hdGUtY2hhbmdlLXBvc2UtaGVhbHRoLWhhemFyZHMtZm9yLWdsb2JhbC13b3JrZXJzL9IBcGh0dHBzOi8vd3d3LmFmcmljYW5ld3MuY29tL2FtcC8yMDI0LzA0LzIyL2V4Y2Vzcy1oZWF0LWFuZC1jbGltYXRlLWNoYW5nZS1wb3NlLWhlYWx0aC1oYXphcmRzLWZvci1nbG9iYWwtd29ya2Vycy8?oc=5,https://da.gd/vfszWO
