feed,title,long_url,short_url
GN:T:WP,Reps: Fed center could power offshore wind efforts - SouthCoastToday,https://www.southcoasttoday.com/news/20200701/reps-fed-center-could-power-offshore-wind-efforts,
GN:T:WP,Wind turbine debate returns as Gage County prepares to resume zoning business - Norfolk Daily News,https://norfolkdailynews.com/news/wind-turbine-debate-returns-as-gage-county-prepares-to-resume-zoning-business/article_23a90dbb-9cfa-5205-b7d4-881fc06ce29b.html,
GN:T:WP,"With much of the world’s economy slowed down, green energy powers on - South Florida Sun Sentinel - Sun Sentinel",https://www.sun-sentinel.com/featured/sns-nyt-green-energy-powers-on-slowed-economy-20200701-i72xpcdsgzgxffnnskf26mv3hy-story.html,
GN:T:WP,"Innogy Delaying Wind Project To Avoid Paying $70M, Suit Says - Law360",https://www.law360.com/newyork/articles/1288352/innogy-delaying-wind-project-to-avoid-paying-70m-suit-says-,
GN:T:WP,"New Synaptec Platform Designed for Predictive Maintenance In T&D, Offshore Renewables - Transmission & Distribution World",https://www.tdworld.com/test-and-measurement/article/21135652/new-synaptec-platform-designed-for-predictive-maintenance-in-td-offshore-renewables,
GN:T:WP,Jasper emergency services organizations receive grants - Pipestone County Star,https://www.pipestonestar.com/articles/jasper-emergency-services-organizations-receive-grants/,
