feed,title,long_url,short_url
GN:S:C,A rare ‘monster’ El Niño could emerge this summer. Here’s what that means for New England. - The Boston Globe,https://news.google.com/rss/articles/CBMihAFBVV95cUxPZGxZM2Z4bnBkOGIwTWdMdEI1SDhVWDVhdWNpX2RNRlFtSWxPbUY3NmtCUndRdWFRczRWVXBVb2F6QW5pSjE5UlQzNFBtbGJHb0NkSGxrdmtfSlBnOE5nWWlwQlhXWG14cWc5T2V0SGh1Z01TeGx2SVRFbGc0S0NlOFdzaGw?oc=5,
GN:S:C,"Permitting Reform, Climate Policy Top Environment Committee Agenda - CBIA",https://news.google.com/rss/articles/CBMiiAFBVV95cUxPMHpjeTRPV2o4NlYydFJZVkM1V2NQRl9tbnVOanFvSlhfYm13TXk3ajFRbHN0d3d3Z0ZOckVGWmx5S0ZiemhnZE95NEFUNjNfTXlrRjlaT2tJUGpNajZyLTNEVzQta3R1bVIxa2s5d0VhX2JmTTE1a3Fha2lsWHQyZktMdUlIdGVn?oc=5,
GN:S:C,The Airbrushing of Climate Change - Institute for Policy Studies,https://news.google.com/rss/articles/CBMiY0FVX3lxTE91djhmNjNyNnRGMEhnQ2ZoeFJMZHVBdkdJSnZWd0pKeHBCZ2kyLS0zemdmQkczWXF1YXBiOGZuQ3FQX2N2anVwQ0xjTnhUSVZPdVVpMnJwNmVTSnN6Uk0xS3BvNA?oc=5,
GN:S:C,New AI solution developed for smarter urban and climate planning - Phys,https://news.google.com/rss/articles/CBMid0FVX3lxTFBOTF9OTVNoSjhSMDRwRFM1V09Jb09GazVHaGlLaGtlOUhYeC1JczJ6Y0V4YTBKLTRVeTQ4V2tOVjI5SklWVHQyZnBRb1RGdEg3VlZWUm5RQW5WcE9SOFVra1JuZTd1Tkl2VW1aRDF4cV9keFp0VEc4?oc=5,
GN:S:C,Trump-appointed panel calls for overhauling how FEMA operates - The Washington Post,https://news.google.com/rss/articles/CBMimwFBVV95cUxQaXg5YVpDRU9FSUpUTm1mZGw2ZkxsOG5HUFhiS0Q1dU1HVUpORVk1MjBKOG5sUVgzVGRUbHZ4a2xzQWRJZnVodjBVNTZQbE5SQ3R0cy12bGxFWHNVT01aWlRUel85NHltTkRyblBoY1E0VURUYy1NTDFLNEtkekxJSXM4VlJRRTF4MXN3eDdLWnFlVV9GakNmbmVPVQ?oc=5,
GN:S:C,Jane Fonda joins Tom Steyer amid personal loss to push climate awareness - Daily Kos,https://news.google.com/rss/articles/CBMi1gFBVV95cUxNNEpfZ0RQdmFseDViN2tGajlxSUhTOE1iTHVYeWk3T3loWGNOZllMUFFqWEhGWjVVaDdyWDRPZDcxVXhDVDF3QzlXMmJCVjhZNDczeTJvVmo5VjZiVWNMcXVGNGQwSEZRcDItZVVreWhpWkcxdkRxZXgwaTJYOWZwZGQyQTJMbHpUZ1pRTEY4eVZKMGNPa19jTkVEQlR3Xzh6SVBDa0dscEVfZlBFQ1JSN0lfdmh0QWxIcFFDSWpZcXhkTHNCckRlMGhOc3B6VkhXLTJOZmJR?oc=5,
GN:S:C,"Polish president pushes referendum on EU climate policy, faces political roadblocks - Anadolu Ajansı",https://news.google.com/rss/articles/CBMivwFBVV95cUxQOVRzbHYzTFZjQnJGU21FbFdDQ280aDZfRHZBemlJcEE3ZHVmZHc3dllVLU5xLVlGZ0U3QmJUdk5Hekx1U1lza2ZRRUxaUEpwZ2traV9EQ2FSd1p3M0xhV0QwTmlXT0NYaEwzY2hjZ3h3bmJoaFFHWFlSdm1YZnV5UHk3M2lOY3F5NFIwVloybV9XNWRIcVJlVjVwYXM2QW1SNWZCNXJFOG1ZS196b1NIcU81X0hmUXJkSmdoNHRPMA?oc=5,
