feed,title,long_url,short_url
GN:T:AI,SentinelOne Earnings Point to Strong AI-Driven Cybersecurity Demand - Investopedia,https://news.google.com/rss/articles/CBMiqAFBVV95cUxNV3dUVFVUempHd0xHdW10TnhJQng2bjdsNFh0clZjekRnaUNqUmdtdnExc0hQdTltN1ZwN0R2bl85UDA1TTAzSmotV09kbmdkeVJScEZWT2wwOERqdVpfWk82eC1ZOTA5dllRT3RpUFY2TEZoMFVDazJfbkdGdkRyYXRoRVY2Q0FSU2FybWt3ZmVReU9LOGlpYVk1UlZTbG1sQmtjUW1jeVY?oc=5,
GN:T:AI,Cracks are forming in Meta’s partnership with Scale AI - TechCrunch,https://news.google.com/rss/articles/CBMikgFBVV95cUxORHRXLXVUMGpzd0xVWnpGX0N2UVhlTVo4enJKcUxYVnZpNk1ZbHdjdDl2Tm5YVkt2VTE1RkQyUzY2R2NfSjVrQmQ5QXNOVDlKYmk4VGwxWUkwWERnNzJjcll5clA4QTljbVF1akx0RWREVmt5STJ3cDhKWDJ4Wk9PbzBRVEJKczVpOFdkMDdqMkMzZw?oc=5,
GN:T:AI,"The crawl-to-click gap: Cloudflare data on AI bots, training, and referrals - The Cloudflare Blog",https://news.google.com/rss/articles/CBMibEFVX3lxTE9SUkRlRWhRSnJEYkx4S2RjSjdoSnpyaC1DR21tRlh5cFE4a3pyNGl5dHhlSXRyakN0VGlmNER6VGFWSUNudEJfajlVd3NKRzllQVZzM3I5X2ZBWjdQT0ZaeG9reDI4cy1uSVJLMQ?oc=5,
GN:T:AI,'AI Death Panels': Trump Pilot Program Seeks to Bring 'Very Worst' For-Profit Insurance Practices to Medicare - Common Dreams,https://news.google.com/rss/articles/CBMia0FVX3lxTE9kTHJ5bzNFeGZqTUlmS0FhUGxRSG5yM3N5ZEdhLWtRNW82YVlycUVaTlpkUXo2aS1hVWJQYUdma2tzYmRmcVU0Y3ZpWlROM0VMUXQ4U0pzbWN2YmtfdzBTVEhIdU9yX3lZd2JR?oc=5,
GN:T:AI,How Silicon Valley is using religious language to talk about AI - NBC News,https://news.google.com/rss/articles/CBMiqAFBVV95cUxNUkNhNldMc0QtdzM0NmpsNE9lTEc1SHV4dVViTXkyREF6R1o2TUJkbG45cXlubW9vRE1jS3hyeGN4ZkNkYlNCYVR5eDdwcUtZUmFIMEZ4MVRmbVVJNEJTSWE4bTViMFlJckNLbmpIN3J6N0lxR203SlJ3dzBabUxuZmhPWmRYS2N3NVhWLUthdmN3YUZHcU5zemIxYkdjbWZDVzh0cHE5M1bSAVZBVV95cUxNeWM4QThSb0M4UDNBVVdPQkQ2TTlzUEZlMVVsRkxGRE5BVWF3QjNyTWZSeXFNbGdrX1VndEMydlpwLXRPcFozMWJIVW9UMDA0cDdXMGdGdw?oc=5,
GN:T:AI,"To fuel AI's insatiable appetite, Nvidia and Big Tech double down on nuclear - MarketWatch",https://news.google.com/rss/articles/CBMiwAFBVV95cUxOZ3Fha0xKWVVLTHhBOXlNRWVVNGREZkd3cGh3SzBiSVg0SnRxSmRibGhUVXRmd01iXzh0bXVmMXBxQlhRNUVrZHZpZ1NWUTBKczlJOW5RSjdIWGs1aENVOFp5VzVvanVXUjZTdlhUb19HYUd1YWtmNFkySXYtM1l5NmxvQWpKdkI4dUlkNWIyS3RZNUVxQW1IM0VZVDAzV245X0NRUGhOZjZESF9GZk9raWJ6TlE2RXQxbjFyUFctLWE?oc=5,
