feed,title,long_url,short_url
RS,Identification of TCR repertoires in functionally competent cytotoxic T cells cross-reactive to SARS-CoV-2,https://www.researchsquare.com/article/rs-474980/latest,https://j.mp/3aS6lJg
RS,Clinical outcomes of intravenous immunoglobulin therapy in COVID-19 related acute respiratory distress syndrome: a retrospective cohort study,https://www.researchsquare.com/article/rs-468871/latest,https://j.mp/3gSEIn0
RS,Postpartum depression and breastfeeding practices during the COVID-19 pandemic lockdown in Mexican mothers: a cross-sectional study,https://www.researchsquare.com/article/rs-443381/latest,https://j.mp/3gNfPJx
RS,Nurses' Experiences During the COVID-19 Pandemic in Iran: A Qualitative Study,https://www.researchsquare.com/article/rs-431697/latest,https://j.mp/3vqBs6v
RS,Intimate Partner Violence and Mental Health Within the Community During Lockdown of Covid-19 Pandemic,https://www.researchsquare.com/article/rs-418428/latest,https://j.mp/32XIVhd
