feed,title,long_url,short_url
GN:T:SL,Rising seas wiped out an entire US species for the first time. Scientists say it’s a sign of things to come - CNN,https://news.google.com/rss/articles/CBMiT2h0dHBzOi8vd3d3LmNubi5jb20vMjAyNC8wNy8xNC9jbGltYXRlL2Zsb3JpZGEtY2FjdHVzLXNlYS1sZXZlbC1yaXNlL2luZGV4Lmh0bWzSAUhodHRwczovL2FtcC5jbm4uY29tL2Nubi8yMDI0LzA3LzE0L2NsaW1hdGUvZmxvcmlkYS1jYWN0dXMtc2VhLWxldmVsLXJpc2U?oc=5,https://da.gd/0OygMU
GN:T:SL,For at least a decade Quinault Nation has tried to escape the rising Pacific. Time is running out - Daily Herald,https://news.google.com/rss/articles/CBMilwFodHRwczovL3d3dy5kYWlseWhlcmFsZC5jb20vMjAyNDA3MTQvbmF0aW9uLWFuZC13b3JsZC9mb3ItYXQtbGVhc3QtYS1kZWNhZGUtcXVpbmF1bHQtbmF0aW9uLWhhcy10cmllZC10by1lc2NhcGUtdGhlLXJpc2luZy1wYWNpZmljLXRpbWUtaXMtcnVubmluZy1vdXQv0gEA?oc=5,https://da.gd/4e7J7g
GN:T:SL,Floods occur in China's third-largest freshwater lake - China Daily,https://news.google.com/rss/articles/CBMiSWh0dHBzOi8vd3d3LmNoaW5hZGFpbHkuY29tLmNuL2EvMjAyNDA3LzE0L1dTNjY5MzU0ODZhMzEwOTVjNTFjNTBkZWVkLmh0bWzSAQA?oc=5,https://da.gd/pbRaaN
GN:T:SL,"Unprecedented numbers of gray whales are visiting San Francisco Bay, and nobody quite knows why - Yahoo News UK",https://news.google.com/rss/articles/CBMiU2h0dHBzOi8vdWsubmV3cy55YWhvby5jb20vdW5wcmVjZWRlbnRlZC1udW1iZXJzLWdyYXktd2hhbGVzLXZpc2l0aW5nLTEwMDAxOTg5NS5odG1s0gEA?oc=5,https://da.gd/Te3T
GN:T:SL,Half of all mangrove forests at risk of collapse - DIVE Magazine,https://news.google.com/rss/articles/CBMiW2h0dHBzOi8vZGl2ZW1hZ2F6aW5lLmNvbS9zY3ViYS1kaXZpbmctbmV3cy9oYWxmLW9mLWFsbC1tYW5ncm92ZS1mb3Jlc3RzLWF0LXJpc2stb2YtY29sbGFwc2XSAQA?oc=5,https://da.gd/rxv4f
GN:T:SL,"Forgotten, Half-Century Old Film Photographs Reveal A Hidden Truth About Antartica's Glaciers - Inverse",https://news.google.com/rss/articles/CBMieWh0dHBzOi8vd3d3LmludmVyc2UuY29tL3NjaWVuY2UvZm9yZ290dGVuLWhhbGYtY2VudHVyeS1vbGQtZmlsbS1waG90b2dyYXBocy1yZXZlYWwtaGlkZGVuLXRydXRoLWFib3V0LWFudGFyY3RpY2EtZ2xhY2llcnPSAQA?oc=5,https://da.gd/97qaV
GN:T:SL,A climate Q&A: Why it's hard for human brains to understand climate risk and other conundrums - WBUR News,https://news.google.com/rss/articles/CBMib2h0dHBzOi8vd3d3LndidXIub3JnL2NvZ25vc2NlbnRpLzIwMjQvMDcvMTQvbWFzc2FjaHVzZXR0cy1sZWdpc2xhdHVyZS1jbGltYXRlLWNoYW5nZS1lbnZpcm9ubWVudC1hbXktYm95ZC1yYWJpbtIBAA?oc=5,https://da.gd/lNWYc1
GN:T:SL,South Africa is taking a beating – and its biggest fans are watching - BusinessTech,https://news.google.com/rss/articles/CBMib2h0dHBzOi8vYnVzaW5lc3N0ZWNoLmNvLnphL25ld3MvYnVzaW5lc3MvNzgyMzc5L3NvdXRoLWFmcmljYS10YWtlcy1hLWJlYXRpbmctYW5kLWl0cy1iaWdnZXN0LWZhbnMtYXJlLXdhdGNoaW5nL9IBAA?oc=5,https://da.gd/4cx00
GN:T:SL,"Japan to Increase MSDF Port Calls to Pacific Island Nations, Seeking Stronger Presence in Region - The Japan News",https://news.google.com/rss/articles/CBMiTWh0dHBzOi8vamFwYW5uZXdzLnlvbWl1cmkuY28uanAvcG9saXRpY3MvcG9saXRpY3MtZ292ZXJubWVudC8yMDI0MDcxNC0xOTg2OTMv0gEA?oc=5,https://da.gd/XB83z
