feed,title,long_url,short_url
LitCovid,Emergency Medicine Journal COVID-19 monthly top five,https://pubmed.ncbi.nlm.nih.gov/33975894,
LitCovid,Ghana and the COVID-19 pandemic,https://pubmed.ncbi.nlm.nih.gov/33976434,
LitCovid,COVID-19: build on Belgium's psychosocial findings,https://pubmed.ncbi.nlm.nih.gov/33976427,
LitCovid,Nurses' mental health and COVID-19 pandemic: Is there any approach?,https://pubmed.ncbi.nlm.nih.gov/33979027,
LitCovid,Fluvoxamine for COVID-19?,https://pubmed.ncbi.nlm.nih.gov/33976099,
LitCovid,"Possible Human-to-Dog Transmission of SARS-CoV-2, Italy, 2020",https://pubmed.ncbi.nlm.nih.gov/33979566,
LitCovid,Corona virus infectious disease (COVID-19) pandemic and eye health care services,https://pubmed.ncbi.nlm.nih.gov/33978611,
LitCovid,Food allergic reactions during the Covid-19 pandemic Lockdown in Israeli Children,https://pubmed.ncbi.nlm.nih.gov/33978968,
LitCovid,"COVID-19 Outbreak on a Passenger Ship and Assessment of Response Measures, Greece, 2020",https://pubmed.ncbi.nlm.nih.gov/33979565,
LitCovid,Managing a Primary Care Pediatric Practice Through COVID-19,https://pubmed.ncbi.nlm.nih.gov/33977888,
LitCovid,CT scan chest findings in symptomatic COVID-19 patients: a reliable alternative for diagnosis,https://pubmed.ncbi.nlm.nih.gov/33976447,
LitCovid,In brief: Johnson & Johnson COVID-19 vaccine suspended,https://pubmed.ncbi.nlm.nih.gov/33976102,
LitCovid,SARS-CoV-2 (COVID-19) pandemic and a possible impact in the future of menstrual cycle research,https://pubmed.ncbi.nlm.nih.gov/33977158,
LitCovid,Covid-19: Caution urged while lockdown eases in England because of vaccine success,https://pubmed.ncbi.nlm.nih.gov/33975884,
LitCovid,Performance of the Abbott ID NOW rapid SARS-CoV-2 amplification assay in relation to nasopharyngeal viral RNA loads,https://pubmed.ncbi.nlm.nih.gov/33979738,
LitCovid,Thrombosis of the Portal Vein and Superior Mesenteric Vein in a Patient With Subclinical COVID-19 Infection,https://pubmed.ncbi.nlm.nih.gov/33976989,
LitCovid,Comparison of provision of maxillofacial emergency service during the two COVID-19 national lockdowns in the United Kingdom,https://pubmed.ncbi.nlm.nih.gov/33975765,
LitCovid,"Medicalizacion del albergue ""El Burgo"" con medidas de bioseguridad frente al COVID-19",https://pubmed.ncbi.nlm.nih.gov/33978338,
LitCovid,Implementation of a Sample Pooling Strategy for the Direct Detection of SARS-CoV-2 by Real-Time Polymerase Chain Reaction During the COVID-19 Pandemic,https://pubmed.ncbi.nlm.nih.gov/33978164,
LitCovid,Efectos colaterales de la pandemia COVID-19 sobre la patologia pediatrica urgente,https://pubmed.ncbi.nlm.nih.gov/33978342,
LitCovid,Nurses' uncertainty about medical gloves safety during the COVID-19 pandemic,https://pubmed.ncbi.nlm.nih.gov/33975815,
LitCovid,Nuevos dispositivos sanitarios en la pandemia COVID-19: uso de hoteles para hospitalizacion,https://pubmed.ncbi.nlm.nih.gov/33978339,
LitCovid,"Science, misinformation and digital technology during the Covid-19 pandemic",https://pubmed.ncbi.nlm.nih.gov/33977437,
LitCovid,Covid-19 Vaccine Acceptance in California State Prisons,https://pubmed.ncbi.nlm.nih.gov/33979505,
LitCovid,Nanobased Platforms for Diagnosis and Treatment of COVID-19: From Benchtop to Bedside,https://pubmed.ncbi.nlm.nih.gov/33979143,
LitCovid,Management of aplastic anemia during the phase of defervescence of the COVID-19 pandemic,https://pubmed.ncbi.nlm.nih.gov/33975721,
LitCovid,Advanced manufacturing and processing in the time of COVID-19,https://pubmed.ncbi.nlm.nih.gov/33977275,
LitCovid,Delayed post-hypoxic leukoencephalopathy in an adult with COVID-19,https://pubmed.ncbi.nlm.nih.gov/33977501,
LitCovid,In brief: Suspension of Johnson & Johnson COVID-19 vaccine lifted,https://pubmed.ncbi.nlm.nih.gov/33976095,
LitCovid,Neutralizing antibody responses to SARS-CoV-2 in symptomatic COVID-19 is persistent and critical for survival,https://pubmed.ncbi.nlm.nih.gov/33976165,
LitCovid,COVID-19 pandemic and dental practice in Ghana,https://pubmed.ncbi.nlm.nih.gov/33976448,
LitCovid,Vietnam's Success Story Against COVID-19,https://pubmed.ncbi.nlm.nih.gov/33977280,
LitCovid,Key factors in the contingency plan for COVID-19 during the Magal celebration in 2020,https://pubmed.ncbi.nlm.nih.gov/33975716,
LitCovid,"Industry Sectors Highly Affected by Worksite Outbreaks of Coronavirus Disease, Los Angeles County, California, USA, March 19-September 30, 2020",https://pubmed.ncbi.nlm.nih.gov/33979564,
LitCovid,The Covid-19 Infodemic - Applying the Epidemiologic Model to Counter Misinformation,https://pubmed.ncbi.nlm.nih.gov/33979506,
LitCovid,COVID-19: When more might be less,https://pubmed.ncbi.nlm.nih.gov/33975740,
LitCovid,A bibliometric study of COVID-19 research in Web of Science,https://pubmed.ncbi.nlm.nih.gov/33979689,
LitCovid,FDA authorizes Johnson & Johnson COVID-19 vaccine,https://pubmed.ncbi.nlm.nih.gov/33976088,
LitCovid,A SARS-CoV-2 neutralizing antibody with extensive Spike binding coverage and modified for optimal therapeutic outcomes,https://pubmed.ncbi.nlm.nih.gov/33976198,
LitCovid,Plasma Therapy to Prevent Severe Covid-19 in Older Adults,https://pubmed.ncbi.nlm.nih.gov/33979509,
LitCovid,Plasma Therapy to Prevent Severe Covid-19 in Older Adults,https://pubmed.ncbi.nlm.nih.gov/33979510,
LitCovid,Covid-19: BMA demands better psychological support for trainees,https://pubmed.ncbi.nlm.nih.gov/33975856,
LitCovid,"Covid-19: Government must invest in primary care to aid pandemic recovery, say leaders",https://pubmed.ncbi.nlm.nih.gov/33975859,
LitCovid,COVID-19 epidemic response in Ghana,https://pubmed.ncbi.nlm.nih.gov/33976435,
LitCovid,"The COVID-19 pandemic, Black mistrust, and a path forward",https://pubmed.ncbi.nlm.nih.gov/33977258,
LitCovid,Presentation and outcome of COVID-19 in HIV patients with high viral loads and opportunistic infections: a case series,https://pubmed.ncbi.nlm.nih.gov/33976453,
LitCovid,Erythroid precursors and progenitors suppress adaptive immunity and get invaded by SARS-CoV-2,https://pubmed.ncbi.nlm.nih.gov/33979601,
LitCovid,A SARS-CoV-2 antibody curbs viral nucleocapsid protein-induced complement hyperactivation,https://pubmed.ncbi.nlm.nih.gov/33976229,
LitCovid,"The increasing risk of domestic violence, including parricide, during the COVID-19 pandemic: reflections and recommendations",https://pubmed.ncbi.nlm.nih.gov/33978112,
LitCovid,The impact of COVID-19 on the development and consolidation of telemedicine,https://pubmed.ncbi.nlm.nih.gov/33978134,
LitCovid,"Efficacy and safety of Xiyanping injection in the treatment of COVID-19: A multicenter, prospective, open-label and randomized controlled trial",https://pubmed.ncbi.nlm.nih.gov/33979464,
LitCovid,"Daily briefing: For some people with COVID-19, surviving is just the beginning",https://pubmed.ncbi.nlm.nih.gov/33976407,
LitCovid,Plasma Therapy to Prevent Severe Covid-19 in Older Adults. Reply.,https://pubmed.ncbi.nlm.nih.gov/33979511,
LitCovid,Effects of the COVID-19 pandemic on provision of electroconvulsive therapy,https://pubmed.ncbi.nlm.nih.gov/33977894,
LitCovid,"Perinatal Outcomes During the COVID-19 Pandemic in Ontario, Canada",https://pubmed.ncbi.nlm.nih.gov/33978727,
LitCovid,Impact of COVID-19 on TB services in Korea,https://pubmed.ncbi.nlm.nih.gov/33977909,
LitCovid,Coronavirus variants are spreading in India - what scientists know so far,https://pubmed.ncbi.nlm.nih.gov/33976409,
LitCovid,Potential for supportive Ayurvedic care in hypoxemic COVID-19 patients,https://pubmed.ncbi.nlm.nih.gov/33976504,
LitCovid,Persisting Salivary IgG against SARS-CoV-2 at 9 Months After Mild COVID-19: A Complementary Approach to Population Surveys,https://pubmed.ncbi.nlm.nih.gov/33978762,
LitCovid,Guillain-Barre syndrome with COVID-19,https://pubmed.ncbi.nlm.nih.gov/33977897,
LitCovid,Symptoms of depression and anxiety during the COVID-19 pandemic: implications for mental health,https://pubmed.ncbi.nlm.nih.gov/33977529,
LitCovid,Covid-19: FDA authorises Pfizer vaccine for children 12-15,https://pubmed.ncbi.nlm.nih.gov/33975874,
LitCovid,Electroconvulsive Therapy Is an Essential Procedure,https://pubmed.ncbi.nlm.nih.gov/33979536,
LitCovid,"""It was a nightmare until I saw my wife"": the importance of family presence for patients with COVID-19 hospitalized in the ICU",https://pubmed.ncbi.nlm.nih.gov/33977347,
LitCovid,High titers and low fucosylation of early human anti-SARS-CoV-2 IgG promote inflammation by alveolar macrophages,https://pubmed.ncbi.nlm.nih.gov/33979301,
LitCovid,Cruise ship travel in the era of COVID-19: A summary of outbreaks and a model of public health interventions,https://pubmed.ncbi.nlm.nih.gov/33978720,
LitCovid,Endogenous Carboxyhemoglobin Concentrations in Predicting Prognosis of Patients with COVID-19 Pneumonia,https://pubmed.ncbi.nlm.nih.gov/33978369,
LitCovid,Impact of influenza A co-infection with COVID-19,https://pubmed.ncbi.nlm.nih.gov/33977913,
LitCovid,Emerging technologies and COVID-19 Digital Vaccination Certificates and Passports,https://pubmed.ncbi.nlm.nih.gov/33977281,
LitCovid,"Peer Learning, Research, and Support in Times of the COVID-19 Pandemic: a Case Study of the Early Career Psychiatrists Model",https://pubmed.ncbi.nlm.nih.gov/33978955,
LitCovid,Malnutrition is associated with hyperinflammation and immunosuppression in COVID-19 patients: A prospective observational study,https://pubmed.ncbi.nlm.nih.gov/33978988,
LitCovid,Ultrasonic humidifier lung as a mimic of COVID-19,https://pubmed.ncbi.nlm.nih.gov/33976890,
LitCovid,Enriched Opportunistic Pathogens Revealed by Metagenomic Sequencing Hint Potential Linkages between Pharyngeal Microbiota and COVID-19,https://pubmed.ncbi.nlm.nih.gov/33978940,
LitCovid,"Rituximab, but not other antirheumatic therapies, is associated with impaired serological response to SARS- CoV-2 vaccination in patients with rheumatic diseases",https://pubmed.ncbi.nlm.nih.gov/33975857,
LitCovid,A Unique Case of Spontaneous Pneumomediastinum in a Patient With COVID-19 and Influenza Coinfection,https://pubmed.ncbi.nlm.nih.gov/33978499,
LitCovid,"Influenza Vaccination in Health Centers during the COVID-19 Pandemic-United States, November 7-27, 2020",https://pubmed.ncbi.nlm.nih.gov/33977297,
LitCovid,More on SARS-CoV-2 Infection after Vaccination in Health Care Workers,https://pubmed.ncbi.nlm.nih.gov/33979507,
LitCovid,SARS-CoV-2 targets glial cells in human cortical organoids,https://pubmed.ncbi.nlm.nih.gov/33979600,
LitCovid,Pneumomediastinum in a patient with COVID-19 due to diffuse alveolar damage,https://pubmed.ncbi.nlm.nih.gov/33975848,
LitCovid,[COVID-19: Humanization in neonatal units],https://pubmed.ncbi.nlm.nih.gov/33975811,
LitCovid,COVID-19 vaccination in pregnancy,https://pubmed.ncbi.nlm.nih.gov/33976529,
LitCovid,Small-Molecule Inhibitors of the Coronavirus Spike: ACE2 Protein-Protein Interaction as Blockers of Viral Attachment and Entry for SARS-CoV-2,https://pubmed.ncbi.nlm.nih.gov/33979123,
LitCovid,Critical Interactions Between the SARS-CoV-2 Spike Glycoprotein and the Human ACE2 Receptor,https://pubmed.ncbi.nlm.nih.gov/33979162,
LitCovid,Gastroenterology practice in the COVID-19 era: Ghana Association for the Study of Liver and Digestive Diseases (GASLIDD) position statement,https://pubmed.ncbi.nlm.nih.gov/33976449,
LitCovid,Comparative immune profiling of acute respiratory distress syndrome patients with or without SARS-CoV2 infection,https://pubmed.ncbi.nlm.nih.gov/33977279,
LitCovid,How healthcare workers are coping with mental health challenges during COVID-19 pandemic? - A cross-sectional multi-countries study,https://pubmed.ncbi.nlm.nih.gov/33977169,
LitCovid,Tapping the immunological imprints to design chimeric SARS-CoV-2 vaccine for elderly population,https://pubmed.ncbi.nlm.nih.gov/33978550,
LitCovid,The Challenges: Management of Infectious Medical Waste During the Pandemic COVID-19 in Health Care Facilities in Indonesia,https://pubmed.ncbi.nlm.nih.gov/33978504,
LitCovid,BNT162b2-Elicited Neutralization against New SARS-CoV-2 Spike Variants,https://pubmed.ncbi.nlm.nih.gov/33979486,
LitCovid,"Computational and experimental insights on the interaction of artemisinin, dihydroartemisinin and chloroquine with SARS-CoV-2 spike protein receptor-binding domain (RBD)",https://pubmed.ncbi.nlm.nih.gov/33977847,
LitCovid,Drug Overdose Deaths Before and After Shelter-in-Place Orders During the COVID-19 Pandemic in San Francisco,https://pubmed.ncbi.nlm.nih.gov/33978726,
LitCovid,Diversity and genomic determinants of the microbiomes associated with COVID-19 and non-COVID respiratory diseases,https://pubmed.ncbi.nlm.nih.gov/33977168,
LitCovid,TB and COVID-19 in migrants - the need to focus on both conditions,https://pubmed.ncbi.nlm.nih.gov/33977899,
LitCovid,Prevalence of depression and its impact on quality of life in frontline otorhinolaryngology nurses during the COVID-19 pandemic in China,https://pubmed.ncbi.nlm.nih.gov/33976957,
LitCovid,Coronavirus disease 2019 (COVID-19)-associated constrictive pericarditis,https://pubmed.ncbi.nlm.nih.gov/33975843,
LitCovid,"Covid-19: ""Exhausted"" GPs need more support for future crises, says leader",https://pubmed.ncbi.nlm.nih.gov/33975911,
LitCovid,SARS-CoV-2 in patients with cancer: possible role of mimicry of human molecules by viral proteins and the resulting anti-cancer immunity,https://pubmed.ncbi.nlm.nih.gov/33977496,
LitCovid,Delivery of systemic anti-cancer therapy during the COVID-19 pandemic,https://pubmed.ncbi.nlm.nih.gov/33977394,
LitCovid,A review of chest radiographic patterns in mild to moderate novel corona virus disease 2019 at an urban hospital in Ghana,https://pubmed.ncbi.nlm.nih.gov/33976441,
LitCovid,More on SARS-CoV-2 Infection after Vaccination in Health Care Workers. Reply.,https://pubmed.ncbi.nlm.nih.gov/33979508,
LitCovid,COVID-19 vaccines in older adults with cancer: a Young International Society of Geriatric Oncology perspective,https://pubmed.ncbi.nlm.nih.gov/33977283,
LitCovid,COVID-19 and elective joint arthroplasty: Patient perspectives and considerations,https://pubmed.ncbi.nlm.nih.gov/33976477,
LitCovid,COVID-19 Lesion Discrimination and Localization Network Based on Multi-Receptive Field Attention Module on CT Images,https://pubmed.ncbi.nlm.nih.gov/33976457,
LitCovid,COVID-19: the urgent call for academic research in research ethics,https://pubmed.ncbi.nlm.nih.gov/33977117,
LitCovid,Mathematical modeling of the COVID-19 pandemic with intervention strategies,https://pubmed.ncbi.nlm.nih.gov/33977079,
LitCovid,"Well-being, Interventions and Support during Epidemics (WISE): Protocol for a qualitative longitudinal study of older adults' experiences during COVID-19",https://pubmed.ncbi.nlm.nih.gov/33977225,
LitCovid,COVID-19 infection in CVID patients: What we know so far,https://pubmed.ncbi.nlm.nih.gov/33979068,
LitCovid,Randomized Prospective Open Label Study Shows No Impact on Clinical Outcome of Adding Losartan to Hospitalized COVID-19 Patients with Mild Hypoxemia,https://pubmed.ncbi.nlm.nih.gov/33977506,
LitCovid,"Life after lockdown: The role of sport, exercise and physical activity in ameliorating the mental health implications of COVID-19 restrictions",https://pubmed.ncbi.nlm.nih.gov/33977854,
LitCovid,Results of a Shortened Quarantine Protocol on a Midwestern College Campus,https://pubmed.ncbi.nlm.nih.gov/33977300,
LitCovid,"A simple, sensitive, and low-cost FACS assay for detecting antibodies against the native SARS-CoV-2 spike protein",https://pubmed.ncbi.nlm.nih.gov/33979020,
LitCovid,Profile and outcomes of hospitalized patients with COVID-19 at a tertiary institution hospital in Ghana,https://pubmed.ncbi.nlm.nih.gov/33976440,
LitCovid,"Differences in risk perception, knowledge and protective behaviour regarding COVID-19 by education level among women and men in Germany. Results from the COVID-19 Snapshot Monitoring (COSMO) study.",https://pubmed.ncbi.nlm.nih.gov/33979413,
LitCovid,Thymoquinone: A Promising Natural Compound with Potential Benefits for COVID-19 Prevention and Cure,https://pubmed.ncbi.nlm.nih.gov/33976534,
LitCovid,Projecting COVID-19 isolation bed requirements for people experiencing homelessness,https://pubmed.ncbi.nlm.nih.gov/33979360,
LitCovid,Use of repurposed and adjuvant drugs in hospital patients with covid-19: multinational network cohort study,https://pubmed.ncbi.nlm.nih.gov/33975825,
LitCovid,Community-based TB testing as an essential part of TB recovery plans in the COVID-19 era,https://pubmed.ncbi.nlm.nih.gov/33977911,
LitCovid,"Risk perceptions, fear, depression, anxiety, stress and coping among Saudi nursing students during the COVID-19 pandemic",https://pubmed.ncbi.nlm.nih.gov/33978543,
LitCovid,An Engineered Receptor-Binding Domain Improves the Immunogenicity of Multivalent SARS-CoV-2 Vaccines,https://pubmed.ncbi.nlm.nih.gov/33975938,
LitCovid,Telephone Fracture Clinic Consultations: A Satisfactory Solution in Lockdown,https://pubmed.ncbi.nlm.nih.gov/33976993,
LitCovid,"COVID-19 knowledge, attitudes, and practices of United Arab Emirates medical and health sciences students: A cross sectional study",https://pubmed.ncbi.nlm.nih.gov/33979340,
LitCovid,Afghanistan: vaccinate drug users against COVID-19,https://pubmed.ncbi.nlm.nih.gov/33976426,
LitCovid,Blood neutrophils from children with COVID-19 exhibit both inflammatory and anti-inflammatory markers,https://pubmed.ncbi.nlm.nih.gov/33979758,
LitCovid,Persistence of Antibody and Cellular Immune Responses in COVID-19 patients over Nine Months after Infection,https://pubmed.ncbi.nlm.nih.gov/33978754,
LitCovid,The impact of COVID-19 and healthcare system changes on the well-being of rheumatic patients,https://pubmed.ncbi.nlm.nih.gov/33976460,
LitCovid,Radiographers and COVID-19 pneumonia: Diagnostic performance using CO-RADS,https://pubmed.ncbi.nlm.nih.gov/33975783,
LitCovid,Association of smoking and cardiovascular disease with disease progression in COVID-19: A systematic review and meta-analysis,https://pubmed.ncbi.nlm.nih.gov/33975666,
LitCovid,COVID-19 and the role of chronic inflammation in patients with type 2 diabetes and depression,https://pubmed.ncbi.nlm.nih.gov/33979072,
LitCovid,Correction to: Online medication purchasing during the Covid-19 pandemic: a pilot study from the United Arab Emirates,https://pubmed.ncbi.nlm.nih.gov/33975632,
LitCovid,Discovery of human ACE2 variants with altered recognition by the SARS-CoV-2 spike protein,https://pubmed.ncbi.nlm.nih.gov/33979391,
LitCovid,The first non-radiographic axial spondyloarthrits with COVID-19,https://pubmed.ncbi.nlm.nih.gov/33979033,
LitCovid,"COVID-19 Surveillance for Local Decision Making : An Academic, School District, and Public Health Collaboration",https://pubmed.ncbi.nlm.nih.gov/33979558,
LitCovid,"Atypical presentation of COVID-19 in a patient with type 2 diabetes at an urban primary care facility in Accra, Ghana",https://pubmed.ncbi.nlm.nih.gov/33976452,
LitCovid,Increased incidence of idiopathic paediatric facial palsy during the coronavirus disease 2019 pandemic,https://pubmed.ncbi.nlm.nih.gov/33975658,
LitCovid,Segmenting lung lesions of COVID-19 from CT images via pyramid pooling improved Unet,https://pubmed.ncbi.nlm.nih.gov/33979791,
LitCovid,"Eating behaviour, physical activity and lifestyle of Italian children during lockdown for COVID-19",https://pubmed.ncbi.nlm.nih.gov/33975495,
LitCovid,A simple criterion to design optimal non-pharmaceutical interventions for mitigating epidemic outbreaks,https://pubmed.ncbi.nlm.nih.gov/33975462,
LitCovid,"Racial/Ethnic Disparities In COVID-19 Exposure Risk, Testing, And Cases At The Subcounty Level In California",https://pubmed.ncbi.nlm.nih.gov/33979192,
LitCovid,Sources of SARS-CoV-2 and Other Microorganisms in Dental Aerosols,https://pubmed.ncbi.nlm.nih.gov/33977764,
LitCovid,Inflammatory Response Assessment in Patients with COVID-19 Under Extracorporeal Membrane Oxygenation Support,https://pubmed.ncbi.nlm.nih.gov/33978378,
LitCovid,"Co-infection with Coronavirus Disease 2019, previously undiagnosed Human Immunodeficiency Virus, Pneumocystis jirovecii pneumonia and Cytomegalovirus pneumonitis, with possible Immune Reconstitution Inflammatory Syndrome",https://pubmed.ncbi.nlm.nih.gov/33977081,
LitCovid,Cost Effectiveness Analysis Comparing PCR Versus IgG Test for Initial COVID-19 Screening,https://pubmed.ncbi.nlm.nih.gov/33978385,
LitCovid,"Sociodemographic and clinical characteristics of the first cohort of COVID-19 recoveries at two national treatment centres in Accra, Ghana",https://pubmed.ncbi.nlm.nih.gov/33976437,
LitCovid,The epidemiological impact of the NHS COVID-19 App,https://pubmed.ncbi.nlm.nih.gov/33979832,
LitCovid,Intravenous immunoglobulin in COVID-19 associated Guillain-Barre syndrome in pregnancy,https://pubmed.ncbi.nlm.nih.gov/33975846,
LitCovid,Clinical and Intestinal Histopathological Findings in SARS-CoV-2/COVID-19 Patients with Hematochezia,https://pubmed.ncbi.nlm.nih.gov/33976619,
LitCovid,Reducing mask resistance among White evangelical Christians with value-consistent messages,https://pubmed.ncbi.nlm.nih.gov/33975906,
LitCovid,Correction to: Satirical contribution: COVID-19 research updates: does wearing tinfoil hats pose neurodegenerative threats to conspiracists and the general public?,https://pubmed.ncbi.nlm.nih.gov/33977346,
LitCovid,"Comparison of Clinical, Laboratory and Demographic Characteristics of Patients Diagnosed with COVID-19 as Symptomatic and Atypical Symptoms",https://pubmed.ncbi.nlm.nih.gov/33978366,
LitCovid,Correction: Effects of cancer screening restart strategies after COVID-19 disruption,https://pubmed.ncbi.nlm.nih.gov/33976368,
LitCovid,Development of potent and selective inhibitors targeting the papain-like protease of SARS-CoV-2,https://pubmed.ncbi.nlm.nih.gov/33979649,
LitCovid,Managing the COVID-19 Pandemic Using Quality Improvement Principles: A New York City Pediatric Primary Care Experience,https://pubmed.ncbi.nlm.nih.gov/33977191,
LitCovid,Patient Concerns Regarding Suspended Ophthalmic Care Due to COVID-19,https://pubmed.ncbi.nlm.nih.gov/33979109,
LitCovid,Predictive factors associated with high-flow nasal cannula success for COVID-19-related acute hypoxemic respiratory failure,https://pubmed.ncbi.nlm.nih.gov/33977167,
LitCovid,COVID-19 preferred practice pattern for eye care professional - An initiative by Nepal Ophthalmic Society,https://pubmed.ncbi.nlm.nih.gov/33978612,
LitCovid,Dysbalance of ACE2 levels - a possible cause for severe COVID-19 outcome in COPD,https://pubmed.ncbi.nlm.nih.gov/33978304,
LitCovid,Performance of Diagnostic Model for Differentiating Between COVID-19 and Influenza: A 2-Center Retrospective Study,https://pubmed.ncbi.nlm.nih.gov/33976103,
LitCovid,Lactoferrin for Mental Health: Neuro-Redox Regulation and Neuroprotective Effects across the Blood-Brain Barrier with Special Reference to Neuro-COVID-19,https://pubmed.ncbi.nlm.nih.gov/33977807,
LitCovid,"""Oral lesions post injection of the first administration of Pfizer-BioNTech SARS-CoV-2 (BNT162b2) vaccine""",https://pubmed.ncbi.nlm.nih.gov/33978308,
LitCovid,Predictive factors of insomnia during the COVID-19 pandemic in Bangladesh: a GIS-based nationwide distribution,https://pubmed.ncbi.nlm.nih.gov/33975776,
LitCovid,Inflammatory Bowel Disease and COVID-19 Vaccination: A Patients' Survey,https://pubmed.ncbi.nlm.nih.gov/33977419,
LitCovid,Erratum: Diagnosis and Management of Vaccine-Related Thrombosis following AstraZeneca COVID-19 Vaccination: Guidance Statement from the GTH,https://pubmed.ncbi.nlm.nih.gov/33979842,
LitCovid,Transformation of primary care during the COVID-19 pandemic: experiences of healthcare professionals in eight European countries,https://pubmed.ncbi.nlm.nih.gov/33979303,
LitCovid,A positive COVID-19 test is associated with high mortality in RR-TB-HIV patients,https://pubmed.ncbi.nlm.nih.gov/33977912,
LitCovid,Molecular diagnosis for the novel coronavirus SARS-CoV-2: lessons learnt from the Ghana experience,https://pubmed.ncbi.nlm.nih.gov/33976445,
LitCovid,Correction to: Applying a Precautionary Approach to Mobile Contact Tracing for COVID-19: The Value of Reversibility,https://pubmed.ncbi.nlm.nih.gov/33978951,
LitCovid,Beyond brick and mortar: staying connected in post-pandemic blended learning environments,https://pubmed.ncbi.nlm.nih.gov/33977575,
LitCovid,Implication of nanotechnology-based approaches to combat SARS-CoV-2 infection,https://pubmed.ncbi.nlm.nih.gov/33976004,
LitCovid,Predicting patients with false negative SARS-CoV-2 testing at hospital admission: A retrospective multi-center study,https://pubmed.ncbi.nlm.nih.gov/33979353,
LitCovid,Caregiver views on virtual management of food allergy: a mixed-methods study,https://pubmed.ncbi.nlm.nih.gov/33978254,
LitCovid,Twelve Months Down the Line: do we know Anything more about the Presence of the SARS-CoV-2 in Human Semen?,https://pubmed.ncbi.nlm.nih.gov/33979895,
LitCovid,A Novel Diagnostic Test to Screen SARS-CoV-2 Variants Containing E484K and N501Y Mutations,https://pubmed.ncbi.nlm.nih.gov/33977858,
LitCovid,Concomitant allergic contact dermatitis and aquagenic urticaria caused by personal protective equipment in a healthcare worker during COVID-19 pandemic,https://pubmed.ncbi.nlm.nih.gov/33978247,
LitCovid,Biological markers and follow-up after discharge home of patients with COVID-19 pneumonia,https://pubmed.ncbi.nlm.nih.gov/33978330,
LitCovid,Proteccion ocular de la transmision de SARS-CoV-2 a traves de la superficie ocular en urgencias,https://pubmed.ncbi.nlm.nih.gov/33978349,
LitCovid,Correction: Knowledge About COVID-19 Among Adults in China: Cross-sectional Online Survey,https://pubmed.ncbi.nlm.nih.gov/33979299,
LitCovid,Randomized controlled trial of convalescent plasma therapy against standard therapy in patients with severe COVID-19 disease,https://pubmed.ncbi.nlm.nih.gov/33976287,
