feed,title,long_url,short_url
LitCovid,"RAASI, NSAIDs, antidiabetics, and anticoagulants: More data needed to be labeled as harmful or neutral in SARS-CoV-2 infection",https://pubmed.ncbi.nlm.nih.gov/33975949,
LitCovid,The value of computed tomography in assessing the risk of death in COVID-19 patients presenting to the emergency room,https://pubmed.ncbi.nlm.nih.gov/33978822,
LitCovid,SARS-CoV-2 gene content and COVID-19 mutation impact by comparing 44 Sarbecovirus genomes,https://pubmed.ncbi.nlm.nih.gov/33976134,
LitCovid,"The Barts Health NHS Trust COVID-19 cohort: characteristics, outcomes and risk scoring of patients in East London",https://pubmed.ncbi.nlm.nih.gov/33977903,
LitCovid,The diagnostic accuracy of Artificial Intelligence-Assisted CT imaging in COVID-19 disease: A systematic review and meta-analysis,https://pubmed.ncbi.nlm.nih.gov/33977119,
LitCovid,Eating Behavior Changes of People with Obesity During the COVID-19 Pandemic,https://pubmed.ncbi.nlm.nih.gov/33976559,
LitCovid,The SCQ-SCORE: initial validation of a new scoring system for elective stone surgery prioritization in the COVID-19 era,https://pubmed.ncbi.nlm.nih.gov/33976921,
LitCovid,"Breast imaging hindered during covid-19 pandemic, in Brazil",https://pubmed.ncbi.nlm.nih.gov/33978114,
LitCovid,"Correction to: Methylprednisolone or dexamethasone, which one is superior corticosteroid in the treatment of hospitalized COVID-19 patients: a triple-blinded randomized controlled trial",https://pubmed.ncbi.nlm.nih.gov/33975548,
LitCovid,"Frequency, signs and symptoms, and criteria adopted for long COVID: a systematic review",https://pubmed.ncbi.nlm.nih.gov/33977626,
LitCovid,Erratum: Monitoring COVID-19 Vaccine Acceptance in Kuwait During the Pandemic: Results from a National Serial Study [Erratum],https://pubmed.ncbi.nlm.nih.gov/33976577,
LitCovid,Commentary on Wu et al.: Sustaining and advancing the global war on tobacco,https://pubmed.ncbi.nlm.nih.gov/33979026,
LitCovid,"Impact of active cancer on COVID-19 survival: a matched-analysis on 557 consecutive patients at an Academic Hospital in Lombardy, Italy",https://pubmed.ncbi.nlm.nih.gov/33976367,
LitCovid,"How to specify healthcare process improvements collaboratively using rapid, remote consensus-building: a framework and a case study of its application",https://pubmed.ncbi.nlm.nih.gov/33975550,
LitCovid,"Serological identification of past and recent SARS-CoV-2 infection through antibody screening in Luanda, Angola",https://pubmed.ncbi.nlm.nih.gov/33977162,
LitCovid,"Teledentistry and COVID-19: Be Mindful of Bogus ""Good"" Ideas!",https://pubmed.ncbi.nlm.nih.gov/33978515,
LitCovid,RIG-I triggers a signaling-abortive anti-SARS-CoV-2 defense in human lung cells,https://pubmed.ncbi.nlm.nih.gov/33976430,
LitCovid,Use of ureteric stent related mobile phone application (UROSTENTZ App) in COVID-19 for improving patient communication and safety: a prospective pilot study from a university hospital,https://pubmed.ncbi.nlm.nih.gov/33976916,
LitCovid,Coronary artery calcification and epicardial adipose tissue as independent predictors of mortality in COVID-19,https://pubmed.ncbi.nlm.nih.gov/33978937,
LitCovid,"Adolescent well-being and learning in times of COVID-19-A multi-country study of basic psychological need satisfaction, learning behavior, and the mediating roles of positive emotion and intrinsic motivation",https://pubmed.ncbi.nlm.nih.gov/33979397,
LitCovid,Experimental Analysis of Solar Powered Disinfection Tunnel Mist Spray System for Coronavirus Prevention in Public and Remote Places,https://pubmed.ncbi.nlm.nih.gov/33977082,
LitCovid,Rapid development and deployment of high-volume vaccines for pandemic response,https://pubmed.ncbi.nlm.nih.gov/33977274,
LitCovid,The evaluation of psychological state of dental students during the COVID-19 pandemic,https://pubmed.ncbi.nlm.nih.gov/33978075,
LitCovid,Access to Mental Healthcare in the 21st Century: An Evolutionary Concept Analysis,https://pubmed.ncbi.nlm.nih.gov/33978509,
LitCovid,Virtual Resident Mentorship Groups for Fourth Year Medical Students Applying into Otolaryngology-Head and Neck Surgery,https://pubmed.ncbi.nlm.nih.gov/33978510,
LitCovid,Coping With Tinnitus During the COVID-19 Pandemic,https://pubmed.ncbi.nlm.nih.gov/33979227,
LitCovid,SARS-CoV-2 transmission in students of public schools of Catalonia (Spain) after a month of reopening,https://pubmed.ncbi.nlm.nih.gov/33979410,
LitCovid,Using Virtual Reality to Enhance Food Technology Education,https://pubmed.ncbi.nlm.nih.gov/33976475,
LitCovid,Pool Testing as a Strategy for Avoidance of SARS-CoV-2 Outbreaks in Schools (STACAMA): Protocol for a Feasibility Study,https://pubmed.ncbi.nlm.nih.gov/33979297,
LitCovid,Droplets and aerosols: An artificial dichotomy in respiratory virus transmission,https://pubmed.ncbi.nlm.nih.gov/33977157,
LitCovid,A patient education intervention improved rates of successful video visits during rapid implementation of telehealth,https://pubmed.ncbi.nlm.nih.gov/33975506,
LitCovid,Rethinking health policy student practicums through the application of the multiple streams framework: A case study,https://pubmed.ncbi.nlm.nih.gov/33977772,
LitCovid,Bilateral Traumatic Maculopathy after Closed-Globe Injury in Context of National Lockdown: A Case Report,https://pubmed.ncbi.nlm.nih.gov/33976675,
LitCovid,CRISPR Enzyme Kinetics for Molecular Diagnostics,https://pubmed.ncbi.nlm.nih.gov/33979119,
LitCovid,Immunomodulatory and antioxidant activity from Indonesian anti-degenerative herbs water extract,https://pubmed.ncbi.nlm.nih.gov/33977681,
LitCovid,Political identities of Chinese international students: Patterns and change in transnational space,https://pubmed.ncbi.nlm.nih.gov/33978957,
LitCovid,Aptamer-based lateral flow assay on-site biosensors,https://pubmed.ncbi.nlm.nih.gov/33979718,
LitCovid,The Dockstore: enhancing a community platform for sharing reproducible and accessible computational protocols,https://pubmed.ncbi.nlm.nih.gov/33978761,
