feed,title,long_url,short_url
GN:T:WP,"Floating solar combined with wave, tidal, wind power - pv magazine International",https://www.pv-magazine.com/2022/10/28/floating-solar-combined-with-wave-tidal-wind-power/,
GN:T:WP,Feds unveil plan to grow wind power while sparing rare whale - The Seattle Times,https://www.seattletimes.com/business/feds-unveil-plan-to-grow-wind-power-while-sparing-rare-whale/,
GN:T:WP,"Commonwealth Wind seeks project pause, cites economic turbulence - SouthCoastToday",https://www.southcoasttoday.com/story/business/2022/10/29/commonwealth-wind-seeks-project-pause-cites-economic-turbulence-offshore-wind-ma/69601141007/,
GN:T:WP,Look for this sight this weekend! - fishersisland,https://fishersisland.net/2022/10/look-for-this-sight-this-weekend/,
GN:T:WP,German Gas and Knowledge Problems - Econlib,https://www.econlib.org/german-gas-and-knowledge-problems/,
GN:T:WP,Offshore Wind — Victoria Won’t Wait - CleanTechnica,https://cleantechnica.com/2022/10/28/offshore-wind-victoria-wont-wait/,
GN:T:WP,An influential energy group sees reason for climate optimism - Capital Public Radio News,https://www.capradio.org/news/npr/story?storyid=1132003727,
GN:T:WP,CommonWealth Magazine - CommonWealth magazine,https://commonwealthmagazine.org/state-government/3b-in-tax-cap-checks-to-start-going-out-tuesday/,
GN:T:WP,Japan's First Commercial-Scale Offshore Wind Farm Takes Final Shape - Offshore WIND,https://www.offshorewind.biz/2022/10/05/japans-first-commercial-scale-offshore-wind-farm-takes-final-shape/,
