feed,title,long_url,short_url
GN:T:RE,"Floating solar combined with wave, tidal, wind power - pv magazine International",https://www.pv-magazine.com/2022/10/28/floating-solar-combined-with-wave-tidal-wind-power/,
GN:T:RE,"Singapore exploring hybrid energy generation system that taps wind, solar and tidal energy - The Straits Times",https://www.straitstimes.com/singapore/singapore-exploring-hybrid-energy-generation-system-that-taps-wind-solar-and-tidal-energy,
GN:T:RE,Feds unveil plan to grow wind power while sparing rare whale - Press Herald,https://www.pressherald.com/2022/10/29/feds-unveil-plan-to-grow-wind-power-while-sparing-rare-whale/,
GN:T:RE,Climate-Proof Towns Are Popping Up Across the U.S. But Not Everyone Can Afford To Live There - TIME,https://time.com/6225970/climate-proof-towns-extreme-weather/,
GN:T:RE,Red Planet's massive dust storm finally weakening as Mars changes seasons - Space,https://www.space.com/mars-massive-dust-storm-october-2022-update,
