feed,title,long_url,short_url
GN:T:SP,Iowa’s newest solar garden can power 400 homes - KCCI Des Moines,https://www.kcci.com/article/marshalltown-iowas-newest-solar-garden-can-power-400-homes/34449183,
GN:T:SP,Study finds shifting to 100% clean electricity could save average US household $2500 per year - Solar Power World,https://www.solarpowerworldonline.com/2020/10/study-finds-shift-to-100-percent-clean-electricity-could-save-households-2500-per-year/,
GN:T:SP,IMO FireRaptor receives UL rapid shutdown system certification with Fronius inverters - Solar Power World,https://www.solarpowerworldonline.com/2020/10/imo-fireraptor-ul-rapid-shutdown-system-certification-fronius-inverters/,
GN:T:SP,Vistra Corp. Selects First Solar PV Modules For Texas Projects - Printed Electronics Now Magazine,https://www.printedelectronicsnow.com/contents/view_breaking-news/2020-10-22/vistra-corp-selects-first-solar-pv-modules-for-texas-projects/,
GN:T:SP,New LG NeON 2 ACe Solar Module Features Integrated 320 W Microinverter - ThomasNet News,https://news.thomasnet.com/fullstory/new-lg-neon-2-ace-solar-module-features-integrated-320-w-microinverter-40040150,
