feed,title,long_url,short_url
GN:T:GP,Tiny Toad Could Upend Nevada Geothermal Power Plant Project - The New York Times,https://www.nytimes.com/2022/04/05/us/nevada-toad-endangered.html,
GN:T:GP,Vulcan Energy inks 20-year geothermal energy supply deal with Germany's MVV - MINING.COM - MINING,https://www.mining.com/web/vulcan-energy-inks-20-year-geothermal-energy-supply-deal-with-germanys-mvv/,
GN:T:GP,"These energy innovations could transform how we mitigate climate change, and save money in the process – ... - Cobb County Courier",https://cobbcountycourier.com/2022/04/energy-innovations-climate-change/,
GN:T:GP,UC Berkeley digs big hole for geothermal heat pump - pv magazine International,https://www.pv-magazine.com/2022/04/05/uc-berkeley-digs-big-hole-for-geothermal-heat-pump/,
GN:T:GP,How 34 Women Set Out to Save the Planet and Make a Difference - Thrive Global,https://thriveglobal.com/stories/how-34-women-set-out-to-save-the-planet-and-make-a-difference/,
