feed,title,long_url,short_url
GN:T:RE,It's the perfect moment for a clean-energy future: But war and greed are getting in the way - Salon,https://www.salon.com/2022/07/02/its-the-perfect-moment-for-a-clean-energy-future-but-and-greed-are-getting-in-the-way/,
GN:T:RE,"As electricity prices soar, Houstonians are turning to solar power - Community Impact Newspaper",https://communityimpact.com/houston/bellaire-meyerland-west-university/environment/2022/07/02/as-electricity-prices-soar-houstonians-are-turning-to-solar-power/,
GN:T:RE,"The weekend read: Solar reforms loom, Cyprus begins to move - pv magazine International",https://www.pv-magazine.com/2022/07/02/the-weekend-read-solar-reforms-loom-cyprus-begins-to-move/,
GN:T:RE,"Entergy Arkansas Requests Proposals for 1,000 MW of Wind, Solar Energy - North American Windpower",https://nawindpower.com/entergy-arkansas-requests-proposals-for-1000-mw-of-wind-solar-energy,
GN:T:RE,Mexico's Environment Ministry Denies Permit for Audi Solar Plant - U,https://money.usnews.com/investing/news/articles/2022-07-01/mexicos-environment-ministry-denies-permit-for-audi-solar-plant,
GN:T:RE,"Staffing, Solar Stocks Form Bases As Health Care And Solar Energy Lift Sectors - Investor's Business Daily",https://www.investors.com/stock-lists/sector-leaders/solar-stocks-form-bases-as-health-care-and-solar-energy-lift-sectors/,
GN:T:RE,ABQ event gives solar its day in the sun - Albuquerque Journal,https://www.abqjournal.com/2513309/educating.html,
