feed,title,long_url,short_url
GN:S:C,The politics and economics of climate change and energy in 2023 - CBS News,https://www.cbsnews.com/video/the-politics-and-economics-of-climate-change-and-energy-in-2023/,https://da.gd/kkwqB
GN:S:C,The year extreme weather events seeped into international law - Axios,https://www.axios.com/2023/01/01/extreme-weather-events-of-2022-international-law,https://da.gd/jggtL
GN:S:C,"2022’s climate disasters, from storms and floods to heat waves and droughts - WATE 6 On Your Side",https://www.wate.com/news/2022s-climate-disasters-from-storms-and-floods-to-heat-waves-and-droughts/,https://da.gd/3fHR5
GN:S:C,"With climate education, Hitchcock Center looks to help children ... - Athol Daily News",https://www.atholdailynews.com/With-climate-education-Hitchcock-Center-looks-to-help-children-envision-ideal-world-49376816,https://da.gd/2iVv
GN:S:C,Transilience: A New Way to Think About Climate Change - Psychology Today,https://www.psychologytoday.com/us/blog/psychiatry-for-the-people/202301/transilience-a-new-way-to-think-about-climate-change,https://da.gd/JxUV
GN:S:C,"13 movies about climate change, you won't want to miss - News24",https://www.news24.com/fin24/climate_future/news/13-movies-about-climate-change-you-wont-want-to-miss-20230101,https://da.gd/yyAC2
