feed,title,long_url,short_url
GN:T:ML,Improve RAG accuracy with fine-tuned embedding models on Amazon SageMaker | Amazon Web Services - AWS Blog,https://news.google.com/rss/articles/CBMieGh0dHBzOi8vYXdzLmFtYXpvbi5jb20vYmxvZ3MvbWFjaGluZS1sZWFybmluZy9pbXByb3ZlLXJhZy1hY2N1cmFjeS13aXRoLWZpbmUtdHVuZWQtZW1iZWRkaW5nLW1vZGVscy1vbi1hbWF6b24tc2FnZW1ha2VyL9IBAA?oc=5,https://da.gd/8KdIs
GN:T:ML,Deep learning application of vertebral compression fracture detection using mask R-CNN | Scientific Reports - Nature,https://news.google.com/rss/articles/CBMiMmh0dHBzOi8vd3d3Lm5hdHVyZS5jb20vYXJ0aWNsZXMvczQxNTk4LTAyNC02NzAxNy020gEA?oc=5,https://da.gd/MWPHa9
GN:T:ML,"New EY Research Finds AI Investment Is Surging, With Senior Leaders Seeing More Positive ROI as Hype Continues to Become Reality - AiThority",https://news.google.com/rss/articles/CBMipwFodHRwczovL2FpdGhvcml0eS5jb20vbWFjaGluZS1sZWFybmluZy9uZXctZXktcmVzZWFyY2gtZmluZHMtYWktaW52ZXN0bWVudC1pcy1zdXJnaW5nLXdpdGgtc2VuaW9yLWxlYWRlcnMtc2VlaW5nLW1vcmUtcG9zaXRpdmUtcm9pLWFzLWh5cGUtY29udGludWVzLXRvLWJlY29tZS1yZWFsaXR5L9IBAA?oc=5,https://da.gd/6nqkP
GN:T:ML,AI Model Harnesses Physics to Autocorrect Remote S | Newswise - Newswise,https://news.google.com/rss/articles/CBMiXWh0dHBzOi8vbS5uZXdzd2lzZS5jb20vYXJ0aWNsZXMvYWktbW9kZWwtaGFybmVzc2VzLXBoeXNpY3MtdG8tYXV0b2NvcnJlY3QtcmVtb3RlLXNlbnNpbmctZGF0YdIBXWh0dHBzOi8vbS5uZXdzd2lzZS5jb20vYXJ0aWNsZXMvYWktbW9kZWwtaGFybmVzc2VzLXBoeXNpY3MtdG8tYXV0b2NvcnJlY3QtcmVtb3RlLXNlbnNpbmctZGF0YQ?oc=5,https://da.gd/Pq4Vm
GN:T:ML,How Generative AI is Transforming Litigation - Legal Reader,https://news.google.com/rss/articles/CBMiSWh0dHBzOi8vd3d3LmxlZ2FscmVhZGVyLmNvbS9ob3ctZ2VuZXJhdGl2ZS1haS1pcy10cmFuc2Zvcm1pbmctbGl0aWdhdGlvbi_SAQA?oc=5,https://da.gd/g9DU7
GN:T:ML,A machine learning driven automated system for safety data sheet indexing - Nature,https://news.google.com/rss/articles/CBMiMmh0dHBzOi8vd3d3Lm5hdHVyZS5jb20vYXJ0aWNsZXMvczQxNTk4LTAyNC01NTIzMS0x0gEA?oc=5,https://da.gd/NPt7
