feed,title,long_url,short_url
GN:T:AI,Nvidia's Jensen Huang Just Announced Something Big - The Motley Fool,https://news.google.com/rss/articles/CBMilwFBVV95cUxNTDZiSEl0eW13RXZHZm9BUkx2OW93MFFjdThLMF8xd0x3MldxZjVhRlZoRk9NVXozTTQ1Q29IaU0wZUNQcXJnU1JzNlZCSWZTN090VHdQTEpVRWM3QjlMX2E2bWE2X3JqN29JMDRidTZ5UkJ5clZfR1RmWEhPMUxMMVJ0ZjdnZjJtdkNvTTZ4TUt0alF0Nmtj?oc=5,
GN:T:AI,How vibe coders are winning big playing small ball - Business Insider,https://news.google.com/rss/articles/CBMimAFBVV95cUxOZTdHY3J3QTZZd3pOQXdBZjd3SHBKeUZON3pKSmhpWV9nQzVhQjNadTJpTjAzLVVoQ2t2OEhOWHk2bmlraXkzckhzOXFFN1BmbGhPbU85ZEZwdkQ3WTRRM2F5Qm0yODNZQVVmaHRrVFk5UldNbjQwdTFTZXZkZlkzNDJLMEpSbHZrVjJfRF83Y29EQ09zMXFLbQ?oc=5,
GN:T:AI,'Confused' AI strategy hurts firms and baffles staff - BBC,https://news.google.com/rss/articles/CBMiWkFVX3lxTE9PRWpFRzNlTE5DOWtaeEM4WlozS3Y0ZWY1RXV1aV9EVko5UmFnQlVsUS02azdidHF5SkhxM0VXbDRLTlJXQnNJUkhxMEdhVU9LV2JPWHU5WUtwUQ?oc=5,
GN:T:AI,"Cognizant CEO is swimming against the tide on AI: he's hiring over 20,000 graduates this year and says AI tokenmaxxing is a 'vanity metric' - Fortune",https://news.google.com/rss/articles/CBMipwFBVV95cUxPX1JJN3Q2Z1JKeVRqbXpDSWJid1oteThWTk5lbGQ1anhSWGNab1hLbjZkQkpXdEpLVzBwNldBbzNRS3ZCbW9janlzSFFrazZiNVFDMks4THRURlpJZ0gxS0pZNkRzMDFFdTU2NkxuazQ2YWIwdTVCQ3dXZ0JLcy1DSGNaMVdyRVFUdHdjUkRGdEtRdlVoc1FMWUprZEh1SnNZd0F1SUkxZw?oc=5,
GN:T:AI,"'Godfather of AI' says we're not just creating new beings—they'll be much smarter than us, and soon - Fortune",https://news.google.com/rss/articles/CBMijwFBVV95cUxPdW5PeDRYZG5jdUtpdGM0ZndtN2ZvNktUTUlRUlA1WWJtMWZwQmFfeXgyNDRoSXRZbUQ2dzMxaGlWbTdKNGpVLUtBZTEyUnRvZmtnc3J5V2dpdThwdkxDUDhOYnAtQi0wVjJoNWozT3RvRHQ0ZGk5MV9ZNVdxRkFWNG42Yk1MNnJNY0pNc0ZHZw?oc=5,
