feed,title,long_url,short_url
Medium,Principle of Maximum Likelihood or how to find Neural network weights,https://medium.com/p/b2cb76e8b194,
Medium,CI/CD vs RegistryOps for deploying ML models,https://medium.com/p/6baf78100b77,
Medium,Managing Multiple Machine Learning Models in Production with MLflow and Bridge,https://medium.com/p/168ae58e337,
Medium,A.I. writes on ‘CCP’,https://medium.com/p/3f40d86623a4,
Medium,Machine Learning Theory and Programming — Supervised Learning: Neural Networks,https://medium.com/p/74a598cb9e42,
