feed,title,long_url,short_url
GN:T:RE,foster + partners to build net-zero 'the william' of mass timber in london - Designboom,https://www.designboom.com/architecture/foster-partners-william-queensway-bayswater-london-11-24-2022/,
GN:T:RE,Kenya Power says electricity restored to parts of country after outage - Reuters,https://www.reuters.com/world/africa/system-disturbance-causes-power-outage-across-parts-kenya-distributor-2022-11-24/,
GN:T:RE,Goldwind and CTG claim world's largest wind turbine crown as 16MW giant rolls out in China | Recharge - Recharge,https://www.rechargenews.com/wind/goldwind-and-ctg-claim-worlds-largest-wind-turbine-crown-as-16mw-giant-rolls-out-in-china/2-1-1360638,
GN:T:RE,Indonesia's green-energy transition is serious business - Nikkei Asia,https://asia.nikkei.com/Opinion/Indonesia-s-green-energy-transition-is-serious-business,
GN:T:RE,Electric/Hybrid - Evolution unveils new fleet electrification partnership with VivoPower?s Tembo unit for its light utility vehicle fleet - Renewable Energy Magazine,https://www.renewableenergymagazine.com/electric_hybrid_vehicles/evolution-unveils-new-fleet-electrification-partnership-with-20221124,
GN:T:RE,Atlas Renewable Energy switches on 300 MW solar project in Mexico - pv magazine International,https://www.pv-magazine.com/2022/11/24/atlas-renewable-energy-switches-on-300-mw-solar-project-in-mexico/,
GN:T:RE,Renault Strikes Long-term Renewable Energy Partnerships To Accelerate French Decarbonization Goals - Marketscreener,https://www.marketscreener.com/quote/stock/RENAULT-4688/news/Renault-Strikes-Long-term-Renewable-Energy-Partnerships-To-Accelerate-French-Decarbonization-Goals-42401262/,
