feed,title,long_url,short_url
GN:T:CC,A Somali boy's mission to find food as climate change takes its toll - Reuters,https://www.reuters.com/world/africa/somali-boys-mission-find-food-climate-change-takes-its-toll-2022-06-20/,
GN:T:CC,Commission president calls to end unanimity in EU foreign policy decisions - POLITICO Europe,https://www.politico.eu/article/commission-president-ursula-von-der-leyen-end-unanimity-eu-foreign-policy/,
GN:T:CC,Record-breaking heatwave scorches Europe as climate change fears intensify - Euronews,https://www.euronews.com/green/2022/06/20/record-breaking-heatwave-scorches-europe-as-climate-change-fears-intensify,
GN:T:CC,"Photos: Food, drinking water concerns as floods batter Bangladesh - Al Jazeera English",https://www.aljazeera.com/gallery/2022/6/20/photos-food-drinking-water-concerns-as-floods-batter-bangladesh,
GN:T:CC,How the Rodeo-Chediski Fire changed Arizona forests - The Arizona Republic,https://www.azcentral.com/in-depth/news/local/arizona-environment/2022/06/20/rodeo-chediski-fire-changed-arizona-forests/7649622001/,
GN:T:CC,Sweltering streets: Hundreds of homeless die in extreme heat - The Associated Press,https://apnews.com/4f23d928ea637d239147c0e4adbad6dc,
