feed,title,long_url,short_url
GN:T:RE,"Porsche is installing a solar panel microgrid, reducing CO2 emissions by an estimated 3.2 million lbs. per year - Electrek",https://electrek.co/2022/08/15/porsche-installing-solar-panel-microgrid/,
GN:T:RE,What's in the Inflation Reduction Act for the solar industry? - pv magazine International,https://www.pv-magazine.com/2022/08/15/whats-in-the-inflation-reduction-act-for-the-solar-industry/,
GN:T:RE,PV - Monroe County Water Authority switches on one of New York State?s first bifacial solar arrays - Renewable Energy Magazine,https://www.renewableenergymagazine.com/pv_solar/monroe-county-water-authority-switches-on-one-20220815,
GN:T:RE,Zephyr solar-powered drone smashes record with 2-month-long flight - New Scientist,https://www.newscientist.com/article/2333373-zephyr-solar-powered-drone-smashes-record-with-2-month-long-flight/,
GN:T:RE,Jupiter Power contracts Energy Vault for large energy storage systems in two states - Solar Power World,https://www.solarpowerworldonline.com/2022/08/energy-vault-jupiter-power-energy-storage-contracts/,
