feed,title,long_url,short_url
SSRN,Pigs Don't Fly and You Cannot Expect Absolutely Safe COVID-19 Vaccines (But You Should Expect a Fair Compensation),https://papers.ssrn.com/sol3/papers.cfm?abstract_id=3845159,
SSRN,Quarantines: Between Precaution and Necessity. A Look at COVID-19,https://papers.ssrn.com/sol3/papers.cfm?abstract_id=3845156,
SSRN,La Covid-19 y el vacío de la postpolítica. Hacia un Estado más allá de la nación (COVID-19 and the Post-Political Void. toward a State Beyond the Nation),https://papers.ssrn.com/sol3/papers.cfm?abstract_id=3843695,
SSRN,"COVID-19: Problems, Challenges and Business Opportunities",https://papers.ssrn.com/sol3/papers.cfm?abstract_id=3845210,
SSRN,System Characteristics and Behavioural Intention to Use E-Learning,https://papers.ssrn.com/sol3/papers.cfm?abstract_id=3844956,
