feed,title,long_url,short_url
j.mp/lc-ml-reviews,Set-to-Sequence Methods in Machine Learning: a Review (2021) (cs.LG),http://arxiv.org/abs/2103.09656v2,
j.mp/lc-ml-reviews,Flying Guide Dog: Walkable Path Discovery for the Visually Impaired Utilizing Drones and Transformer-based Semantic Segmentation (2021) (cs.CV),http://arxiv.org/abs/2108.07007v1,
j.mp/lc-ml-reviews,Evolutionary Algorithms in Approximate Computing: A Survey (2021) (cs.NE),http://arxiv.org/abs/2108.07000v1,
j.mp/lc-ml-reviews,Introduction to Quantum Reinforcement Learning: Theory and PennyLane-based Implementation (2021) (cs.LG),http://arxiv.org/abs/2108.06849v1,
j.mp/lc-ml-reviews,Complex Knowledge Base Question Answering: A Survey (2021) (cs.CL),http://arxiv.org/abs/2108.06688v1,
j.mp/lc-ml-reviews,A Survey on GAN Acceleration Using Memory Compression Technique (2021) (cs.LG),http://arxiv.org/abs/2108.06626v1,
j.mp/lc-ml-reviews,"GAN Computers Generate Arts? A Survey on Visual Arts, Music, and Literary Text Generation using Generative Adversarial Network (2021) (cs.AI)",http://arxiv.org/abs/2108.03857v2,
j.mp/lc-ml-reviews,A Survey of Community Detection Approaches: From Statistical Modeling to Deep Learning (2021) (cs.SI),http://arxiv.org/abs/2101.01669v3,
j.mp/lc-ml-reviews,Multi-Objective Recommendations: A Tutorial (2021) (cs.IR),http://arxiv.org/abs/2108.06367v1,
