feed,title,long_url,short_url
GN:T:CC,Why Democrats Joined Republicans to Block a California Climate Policy - The New York Times,https://news.google.com/rss/articles/CBMilAFBVV95cUxQODJxbXhpN1RSbHBTQWExcTVycUlneFBPUTBVblRzTldRekxhcEE4UmdDZks2MkRQSE04MkpSRXFtY3JMUUNtQjhGM0Y1LWJ2QmVHSk1LMTVjTXFVZ2t3Zm83bFl4ZEhqVmNkZnhfZlpvLUhVSWM2elhFb0JCdThWV19kcVhFTXZacFJUdTBRU2xGUF9E?oc=5,https://da.gd/u64Cy
GN:T:CC,Killer fungus forecast to spread to UK as climate changes - Sky News,https://news.google.com/rss/articles/CBMimAFBVV95cUxOSTBTcUIxTE1WYlQtZFJRcEw5Y21CbUlkZEZDUHlhYjdybVhMNW5Ic1RaNlU0c0hlM0hTRkRxcjZYRTF4Mm90ZUpQTnJlN2xBQlJ2LXg0a2hiem03MkVoTGpmbWFJbHZLODdtRU1mRzFKeDZhbDhDZDZFM3V5NHp0QVEzOWM3MjBxMGVHNXNCUDAyYXNQMi1Raw?oc=5,https://da.gd/3Zomd
GN:T:CC,Thune says GOP senators are ‘still looking’ at nixing California emissions waiver - Politico,https://news.google.com/rss/articles/CBMirgFBVV95cUxNN0taRjdLaWJod2RuNms0V1hZUEkxT2MtTy1BV3d6dm1sdGRkV2lQZHV1cHlRZWhWN2VvRmR1N1VlRW9vLVJSTC1VcVZ0RlZIbFVCQnBIU1RvSXg4UXlqZnEwNEFnS0ZGY3FzT2RCVFNnYktXQ2oxR0I0NG53Y2Y3SndaSmFzOFUtSGxNR1VhdnBDb0VjUFNLNmxLb0UwYkwwRWtkd29ES29LNnV6S0E?oc=5,https://da.gd/98H74
GN:T:CC,The House Is Trying to Kill Tesla’s EV Credits. What Happens Next. - Barron's,https://news.google.com/rss/articles/CBMifEFVX3lxTFBKU05oNkdnVG1EY25jbUJnWXFqdEhuRk40ZXdhWkRoOHNkcUlqWGdUM2tGTHJhOHlCUmJXQlVvcm1SWVFQeVBlVm1MWmlUd1VtYlF5RXV6Q3JoLTI2ZzJVY1dYTFVySVItWGkxUlNpMlBiM1VFTVh2Nm51Mkw?oc=5,https://da.gd/ziip8T
GN:T:CC,Scientists Warn Athens at High Risk for Major Wildfire - tovima,https://news.google.com/rss/articles/CBMijwFBVV95cUxOOHRiRDNPMUNSUFhKbXdPRkh1U19Lc0pzUmdCbEpsVlpHS0M4SFZ0NVNmVTh1YUxQTWlqRzJVbmJTRUtUNHJrRkdTaUdzSG13VERGYkdjOEtvakVMdVZ6TlpRYzduQmxPeTdDLTU1VnUzMHNzNmRkYUZQNHU0OEY4X1ZCTUMybjItLXk3OVdka9IBlAFBVV95cUxObGhwVnRKcVhuS1AyR0FLOTZMbG81WDlhTEZ5SlB1SEdkXzVTUkVwc21GS1c3ejluRUZsSkJmaEdMMTFrZzRkUWpob3FxRE43bVZhWXZwQmgwYTFIVFhnRkFYd2tpYW1wVk5xYm1wdmdtOThVM2FveWRiVXdFM2ZTUEZPNUxrU0w5YWRvbllpT3pFM1dI?oc=5,https://da.gd/Zfci5p
GN:T:CC,"As the White House halts climate efforts, Michigan's climate plan continues full steam ahead • Michigan Advance - Michigan Advance",https://news.google.com/rss/articles/CBMiygFBVV95cUxQVHFoQXN5aGd5cG1QMkliS2ZOakxVX2N1MzVnMVhnT2djaHJrcnduQjVZV0p0SnNFS2ZTMXRfRzZDb1c4a1JrYmN3TXloSzZ1UFR3Y2dMem1HR3MtZ2pNNGFhMU1QZWlLVkxKYnBsdmNTQWZGaTJIVzcyYS00ejBnelZlaWQzM2J3czNuWkhja0g0dWtSQ0Rya2VBWDFLQl9LUWN5NGFOa3YxckVmb0oteXoyTVhTQ2N4YVZZU1VsNGtrTmtKaGRnVTln?oc=5,https://da.gd/zZn8
GN:T:CC,"Climate Change, Peace Operations and the Protection of Civilians: The impact of climate change on peace operations' ability to fulfil Protection of Civilians tasks - PoC Week Side Event to UN Security Council Open Debate on PoC - World - ReliefWeb",https://news.google.com/rss/articles/CBMizAJBVV95cUxQQWlsZm1ya3ByRU9oLXdFUDlSa3RvclpqQ0tBSW9OV3dCbVBUdXVlMzBGbTZqU3VnNHZud05PX1h6NFhEVU93b1c4RF82SURKcWVQU0lmaUV4WUIxYnYyaVM1cGdVVDc1d0hTYVBwanJuTzBaUWZ1QTZ6WU5IMjhpWG5RSXhVdWd5VlY3bXdzMzJVeTh3cFJkVmJxU2NLbkx6d0QwN3lrOHI0eU9IdWZJVTJBOVJ2VGU1YlJxTnBsM29QSWFSYWFQbFROenJjMlFsSGRnbTJYbzhwZTM5YVpxUnBIcVhueHRBaU9LbmpkLTAxUHY4MW9rS0tROWhBbWtMMTNES1gwQW5WMlg1S2Y4cjVxa2Z3MEllOVRxbXpOVDFwVEpXTjRDdTdIeTJQWFBuQWM3WGRmbUxFZjVqSlY2aTlLR0UtVE1vSFNkbw?oc=5,https://da.gd/oQ38h
