feed,title,long_url,short_url
GN:S:C,Biden's next climate hurdle: Enticing Americans to buy green - The Associated Press - en Español,https://apnews.com/f145b24414ff245f491fd68257b3db60,https://da.gd/vagQv
GN:S:C,Debunking anti-climate change propaganda - WAMC,https://www.wamc.org/commentary-opinion/2023-01-23/debunking-anti-climate-change-propaganda,https://da.gd/sCtAq
GN:S:C,Questions to Governor Hochul on climate plan - WGRZ,https://www.wgrz.com/article/news/state/questions-to-governor-hochul-on-climate-plan-wny-heat/71-8373144c-c469-425a-9e11-ba02c267552b,https://da.gd/ang8
GN:S:C,Adding climate change to the Growth Management Act adds cost but ... - Washington Policy,https://www.washingtonpolicy.org/publications/detail/adding-climate-change-to-the-growth-management-act-adds-cost-but-wont-help-the-environment,https://da.gd/i7niGX
GN:S:C,India key partner in fight against Climate Change: EU climate chief - Economic Times,https://economictimes.indiatimes.com/news/india/india-key-partner-in-fight-against-climate-change-eu-climate-chief/articleshow/97265221.cms,https://da.gd/LJTN
