feed,title,long_url,short_url
GN:T:CC,Vertical PV for clean energy and crop production - pv magazine International,https://www.pv-magazine.com/2023/01/24/vertical-pv-for-clean-energy-and-crop-production/,https://da.gd/EXnZV
GN:T:CC,A divided Texas confronts its power woes - POLITICO,https://www.politico.com/newsletters/power-switch/2023/01/23/a-divided-texas-confronts-its-power-woes-00078992,https://da.gd/bHpF
GN:T:CC,"Young, northern, and asked to come up with climate change advice - Cabin Radio",https://cabinradio.ca/118724/news/politics/young-northern-and-asked-to-come-up-with-climate-change-advice/,https://da.gd/1mT71C
GN:T:CC,'Doomsday Clock' moves closest ever to midnight - Yahoo News,https://news.yahoo.com/doomsday-clock-moves-closest-ever-154817908.html,https://da.gd/HpQXgK
GN:T:CC,"The Sierra Club Tries to Move Past John Muir, George Floyd and #MeToo - The New York Times",https://www.nytimes.com/2023/01/24/climate/ben-jealous-sierra-club.html,https://da.gd/QTulRx
GN:T:CC,Scientists moving wildlife endangered by climate change stirs debate - The Christian Science Monitor,https://www.csmonitor.com/Environment/2023/0124/If-animals-are-less-safe-in-their-habitats-should-humans-move-them,https://da.gd/9LSl
GN:T:CC,Researchers propose compulsory climate change teaching in core law curriculum - Phys,https://phys.org/news/2023-01-compulsory-climate-core-law-curriculum.html,https://da.gd/HIxy
GN:T:CC,Feds: Does Climate Change Affect Insurance Costs? - | Florida Realtors,https://www.floridarealtors.org/news-media/news-articles/2023/01/feds-does-climate-change-affect-insurance-costs,https://da.gd/6OHf
