feed,title,long_url,short_url
GN:S:C,Climate emergency demands immediate action; activists will demonstrate Monday in Raleigh | The Pulse - The Progressive Pulse,https://pulse.ncpolicywatch.org/2022/10/02/climate-emergency-demands-immediate-action-activists-will-demonstrate-monday-in-raleigh/,
GN:S:C,The first climate rights lawsuit in Canada had its day in court. It won’t be the last - Toronto Star,https://www.thestar.com/opinion/contributors/2022/10/02/the-first-climate-rights-lawsuit-in-canada-had-its-day-in-court-it-wont-be-the-last.html,
GN:S:C,No security without climate security - The Asset,https://www.theasset.com/article-esg/47729/no-security-without-climate-security,
GN:S:C,"Actor Bhumi Pednekar Warns About Climate Crisis, Says It’s A ‘Looming Threat To Humanity’ - Swachh India NDTV",https://swachhindia.ndtv.com/actor-bhumi-pednekar-warns-about-climate-crisis-says-its-a-looming-threat-to-humanity-71657/,
GN:S:C,King Charles III decides not to attend climate summit - KXAN,https://www.kxan.com/news/international/ap-king-charles-iii-decides-not-to-attend-climate-summit/,
GN:S:C,Climate Explainer: Climate Change and Air Pollution - World Bank Group,https://www.worldbank.org/en/news/feature/2022/09/01/what-you-need-to-know-about-climate-change-and-air-pollution,
