feed,title,long_url,short_url
GN:T:AI,"AI can shore up federal cybersecurity overwhelmed by data, GDIT says - Federal Times",https://news.google.com/rss/articles/CBMieGh0dHBzOi8vd3d3LmZlZGVyYWx0aW1lcy5jb20vaXQtbmV0d29ya3MvMjAyMy8xMS8yOC9haS1jYW4tc2hvcmUtdXAtZmVkZXJhbC1jeWJlcnNlY3VyaXR5LW92ZXJ3aGVsbWVkLWJ5LWRhdGEtZ2RpdC1zYXlzL9IBAA?oc=5,https://da.gd/UdKjwz
GN:T:AI,"Fake babies, real horror: Deepfakes from the Gaza war increase fears about AI's power to mislead - The Associated Press",https://news.google.com/rss/articles/CBMid2h0dHBzOi8vYXBuZXdzLmNvbS9hcnRpY2xlL2FydGlmaWNpYWwtaW50ZWxsaWdlbmNlLWhhbWFzLWlzcmFlbC1taXNpbmZvcm1hdGlvbi1haS1nYXphLWExYmIzMDNiNjM3ZmZiYmI5Y2JjM2FhMWUwMDBkYjQ30gEA?oc=5,https://da.gd/KSIxW
GN:T:AI,Why Europe Must Not Let AI Firms Put Profits Before People - TIME,https://news.google.com/rss/articles/CBMiNGh0dHBzOi8vdGltZS5jb20vNjM0MDM4OC9ldS1haS1hY3Qta2Vyc3RpLWthbGp1bGFpZC_SAQA?oc=5,https://da.gd/mDXYj0
GN:T:AI,Critical Vulnerability Found in Ray AI Framework - SecurityWeek,https://news.google.com/rss/articles/CBMiTmh0dHBzOi8vd3d3LnNlY3VyaXR5d2Vlay5jb20vY3JpdGljYWwtdnVsbmVyYWJpbGl0eS1mb3VuZC1pbi1yYXktYWktZnJhbWV3b3JrL9IBUmh0dHBzOi8vd3d3LnNlY3VyaXR5d2Vlay5jb20vY3JpdGljYWwtdnVsbmVyYWJpbGl0eS1mb3VuZC1pbi1yYXktYWktZnJhbWV3b3JrL2FtcC8?oc=5,https://da.gd/iiveh
GN:T:AI,AI singer Anna Indiana has millions of streams and about as many detractors - Business Insider,https://news.google.com/rss/articles/CBMicWh0dHBzOi8vd3d3LmJ1c2luZXNzaW5zaWRlci5jb20vYWktYXJ0aWZpY2FsLWludGVsbGlnZW5jZS1tdXNpY2lhbi1hbm5hLWluZGlhbmEtcG9wLWNoYXRncHQtc3BvdGlmeS1tdXNpYy0yMDIzLTEx0gF1aHR0cHM6Ly93d3cuYnVzaW5lc3NpbnNpZGVyLmNvbS9haS1hcnRpZmljYWwtaW50ZWxsaWdlbmNlLW11c2ljaWFuLWFubmEtaW5kaWFuYS1wb3AtY2hhdGdwdC1zcG90aWZ5LW11c2ljLTIwMjMtMTE_YW1w?oc=5,https://da.gd/7kE9P
GN:T:AI,How AI Can Help Sales Teams Craft More Personalized Pitches - HBR,https://news.google.com/rss/articles/CBMiU2h0dHBzOi8vaGJyLm9yZy8yMDIzLzExL2hvdy1haS1jYW4taGVscC1zYWxlcy10ZWFtcy1jcmFmdC1tb3JlLXBlcnNvbmFsaXplZC1waXRjaGVz0gEA?oc=5,https://da.gd/czQ7Ms
GN:T:AI,What's The Right Level of AI Investment? - Forbes,https://news.google.com/rss/articles/CBMiXGh0dHBzOi8vd3d3LmZvcmJlcy5jb20vc2l0ZXMvbWVnYW5wb2luc2tpLzIwMjMvMTEvMjgvd2hhdHMtdGhlLXJpZ2h0LWxldmVsLW9mLWFpLWludmVzdG1lbnQv0gEA?oc=5,https://da.gd/QmpKy7
GN:T:AI,AI like ChatGPT is creating huge increase in malicious phishing email - CNBC,https://news.google.com/rss/articles/CBMiamh0dHBzOi8vd3d3LmNuYmMuY29tLzIwMjMvMTEvMjgvYWktbGlrZS1jaGF0Z3B0LWlzLWNyZWF0aW5nLWh1Z2UtaW5jcmVhc2UtaW4tbWFsaWNpb3VzLXBoaXNoaW5nLWVtYWlsLmh0bWzSAQA?oc=5,https://da.gd/hjyJbr
