feed,title,long_url,short_url
GN:S:C,Near Record Jump in CO2 Emissions This Year Risks Climate Goal - Bloomberg,https://news.google.com/rss/articles/CBMicWh0dHBzOi8vd3d3LmJsb29tYmVyZy5jb20vbmV3cy9hcnRpY2xlcy8yMDI0LTAxLTE5L25lYXItcmVjb3JkLWp1bXAtaW4tY28yLWVtaXNzaW9ucy10aGlzLXllYXItcmlza3MtY2xpbWF0ZS1nb2Fs0gEA?oc=5,https://da.gd/KoRud9
GN:S:C,Talking Green: Local students drive climate action through internship program - Steamboat Pilot & Today,https://news.google.com/rss/articles/CBMidGh0dHBzOi8vd3d3LnN0ZWFtYm9hdHBpbG90LmNvbS9vcGluaW9uL3RhbGtpbmctZ3JlZW4tbG9jYWwtc3R1ZGVudHMtZHJpdmUtY2xpbWF0ZS1hY3Rpb24tdGhyb3VnaC1pbnRlcm5zaGlwLXByb2dyYW0v0gEA?oc=5,https://da.gd/Fmif2q
GN:S:C,Montana Supreme Court decides on landmark climate ruling - KFYR,https://news.google.com/rss/articles/CBMiXmh0dHBzOi8vd3d3LmtmeXJ0di5jb20vdmlkZW8vMjAyNC8wMS8xOS9tb250YW5hLXN1cHJlbWUtY291cnQtZGVjaWRlcy1sYW5kbWFyay1jbGltYXRlLXJ1bGluZy_SAQA?oc=5,https://da.gd/7m7I
GN:S:C,How frightening to see the climate change before our eyes – is this the last New York snow I'll see? | Emma Brockes - The Guardian,https://news.google.com/rss/articles/CBMicGh0dHBzOi8vd3d3LnRoZWd1YXJkaWFuLmNvbS9jb21tZW50aXNmcmVlLzIwMjQvamFuLzE4L25ldy15b3JrLTcwMS1kYXktZHJvdWdodC1zbm93LWNpdHktYmxpenphcmQtY2xpbWF0ZS1jaGFuZ2XSAQA?oc=5,https://da.gd/y8jdE
GN:S:C,Could a NASA space mission unravel the mysteries of Earth's climate? - The Jerusalem Post,https://news.google.com/rss/articles/CBMiLGh0dHBzOi8vd3d3Lmpwb3N0LmNvbS9zY2llbmNlL2FydGljbGUtNzgyODQx0gEA?oc=5,https://da.gd/7O4KS
GN:S:C,How to feng shui your fridge — and why it might help to curb climate change - CBC,https://news.google.com/rss/articles/CBMiUmh0dHBzOi8vd3d3LmNiYy5jYS9yYWRpby90aGVjdXJyZW50L2Zlbmctc2h1aS15b3VyLWZyaWRnZS1jbGltYXRlLWNoYW5nZS0xLjcwODc4MTjSASBodHRwczovL3d3dy5jYmMuY2EvYW1wLzEuNzA4NzgxOA?oc=5,https://da.gd/676Btf
