feed,title,long_url,short_url
GN:S:GW,Top climate scientists are sceptical that nations will rein in global warming - Nature,https://www.nature.com/articles/d41586-021-02990-w,
GN:S:GW,"COP26: This is what individuals can do to slow down climate change, according to experts - ABC News",https://abcnews.go.com/US/cop26-individuals-slow-climate-change-experts/story?id=80799029,
GN:S:GW,"Biden addresses COP26 climate conference as China and Russia's ""disappointing"" absence lowers expectations - CBS News",https://www.cbsnews.com/live-updates/cop26-summit-glasgow-biden-climate-live-updates-today-2021-11-01/,
GN:S:GW,Heating up: World leaders take center stage at climate talks - The Durango Herald,https://www.durangoherald.com/articles/heating-up-world-leaders-take-center-stage-at-climate-talks/,
GN:S:GW,COP26: World leaders take centre stage at climate change talks - CTV News,https://www.ctvnews.ca/climate-and-environment/u-k-s-johnson-warns-world-leaders-as-climate-summit-begins-1.5646485,
GN:S:GW,The Latest: Biden: 'No more time to hang back' on climate - Alton Telegraph,https://www.thetelegraph.com/news/article/The-Latest-COP26-delegates-face-big-lines-as-16581336.php,
GN:S:GW,The Latest: Biden apologizes for Trump's actions on climate - Richmond,https://richmond.com/business/the-latest-biden-apologizes-for-trumps-actions-on-climate/article_3a6a94ea-75b5-5917-9c50-1368dd4373c6.html,
GN:S:GW,Melting sculpture of polar bear in Strathclyde Country Park to highlight global warming - Glasgow Times,https://www.glasgowtimes.co.uk/news/19686862.polar-bear-ice-sculpture-strathclyde-country-park-highlight-global-warming/,
