feed,title,long_url,short_url
GN:T:SP,New algorithm to connect solar parks to substations – pv magazine International - pv magazine International,https://www.pv-magazine.com/2020/11/05/new-algorithm-to-connect-solar-parks-to-substations/,
GN:T:SP,Iowa's Newest Solar Garden Tests Battery-Storage Solution - Transmission & Distribution World,https://www.tdworld.com/electrification/article/21146847/iowas-newest-solar-garden-tests-batterystorage-solution,
GN:T:SP,African Trade Insurance Agency supports US$67mn solar plant in Malawi - African Review,https://www.africanreview.com/energy-a-power/renewables/african-trade-insurance-agency-supports-us-67mn-solar-plant-in-malawi,
GN:T:SP,"01Cyberaton, Dekpol set new deadline for 500-MW solar deal - Renewables Now",https://www.renewablesnow.com/news/01cyberaton-dekpol-set-new-deadline-for-500-mw-solar-deal-719718/,
GN:T:SP,Brakes Are Off For Solarcentury After Statkraft Acquisition - Greentech Media News,https://www.greentechmedia.com/articles/read/brakes-are-off-for-solarcentury-after-statkraft-acquisition,
