feed,title,long_url,short_url
GN:T:WP,Belgium: TotalEnergies Signs Renewable Power Purchase Agreement With Air Liquide - Yahoo Finance,https://finance.yahoo.com/news/belgium-totalenergies-signs-renewable-power-070700622.html,
GN:T:WP,IndianOil to build India's first green hydrogen plant - Hydrocarbon Engineering,https://www.hydrocarbonengineering.com/clean-fuels/26072021/indianoil-to-build-indias-first-green-hydrogen-plant/,
GN:T:WP,Offshore power 'will fail without subsidies' | Business - The Times,https://www.thetimes.co.uk/article/offshore-power-will-fail-without-subsidies-bx8908gm5,
GN:T:WP,BP insists it seeks value in renewables investments - The Times,https://www.thetimes.co.uk/article/bp-insists-it-seeks-value-in-renewables-investments-m9pkskcxh,
GN:T:WP,UK launches energy storage innovation competition - reNEWS,https://renews.biz/71184/uk-launches-energy-storage-innovation-competition/,
