feed,title,long_url,short_url
MX,Is couples counseling right for me and will the therapist take sides? An expert explains,https://medicalxpress.com/news/2026-02-couples-therapist-sides-expert.html,
MX,'Operation Stork Speed' prepares to overhaul baby formula guidelines,https://medicalxpress.com/news/2026-02-stork-overhaul-baby-formula-guidelines.html,
MX,Key alterations discovered in the cerebral cortex of people with psychosis,https://medicalxpress.com/news/2026-02-key-cerebral-cortex-people-psychosis.html,
MX,Q&A: How attending an HBCU can help reduce dementia risk,https://medicalxpress.com/news/2026-02-qa-hbcu-dementia.html,
MX,Preventing acute confusion after cardiovascular procedures through prevention,https://medicalxpress.com/news/2026-02-acute-cardiovascular-procedures.html,
MX,Cognitive impairment risk increased with severity of chronic kidney disease,https://medicalxpress.com/news/2026-02-cognitive-impairment-severity-chronic-kidney.html,
MX,How the brain balances continuity and segmentation,https://medicalxpress.com/news/2026-02-brain-segmentation.html,
MX,"'It's chronic disease, stupid!' The central challenge facing health care",https://medicalxpress.com/news/2026-02-chronic-disease-stupid-central-health.html,
MX,"Toxic exposure creates disease risk over 20 generations, epigenetic inheritance study suggests",https://medicalxpress.com/news/2026-02-toxic-exposure-disease-generations-epigenetic.html,
MX,"What childhood stress may change about your diet, even if your weight stays normal",https://medicalxpress.com/news/2026-02-childhood-stress-diet-weight-stays.html,
MX,Stunning new maps of myelin-making mouse brain cells advance understanding of nervous system disorders,https://medicalxpress.com/news/2026-02-stunning-myelin-mouse-brain-cells.html,
MX,Sleep loss linked to higher atrial fibrillation risk in working-age adults,https://medicalxpress.com/news/2026-02-loss-linked-higher-atrial-fibrillation.html,
MX,Why nighttime heat drives a surge in suicide-related calls to crisis lines in Louisiana,https://medicalxpress.com/news/2026-02-nighttime-surge-suicide-crisis-lines.html,
MX,"More social media use tied to stronger anabolic steroid intentions, study suggests",https://medicalxpress.com/news/2026-02-social-media-stronger-anabolic-steroid.html,
MX,Study finds tirzepatide cuts alcohol intake by more than half in rodents,https://medicalxpress.com/news/2026-02-tirzepatide-alcohol-intake-rodents.html,
