feed,title,long_url,short_url
MX,"COVID-19 causes 'unexpected' cellular response in the lungs, research finds",https://medicalxpress.com/news/2021-04-covid-unexpected-cellular-response-lungs.html,https://j.mp/3dLuDFj
MX,The impact of COVID-19 on people with kidney failure,https://medicalxpress.com/news/2021-04-impact-covid-people-kidney-failure.html,https://j.mp/3g20nbQ
MX,Europe rights court backs obligatory vaccinations,https://medicalxpress.com/news/2021-04-europe-rights-court-obligatory-vaccinations.html,https://j.mp/39Uh31j
MX,Spain widens age limit for AstraZeneca jabs,https://medicalxpress.com/news/2021-04-spain-widens-age-limit-astrazeneca.html,https://j.mp/3mAqlVd
MX,"Countries worldwide hit new records for virus cases, deaths",https://medicalxpress.com/news/2021-04-countries-worldwide-virus-cases-deaths.html,https://j.mp/39VeVpQ
MX,Scientists use malaria expertise to track COVID-19 variants,https://medicalxpress.com/news/2021-04-scientists-malaria-expertise-track-covid-.html,https://j.mp/3uzL66q
