feed,title,long_url,short_url
ChemRxiv,Identifying Therapeutic Compounds Targeting RNA-Dependent-RNA-Polymerase of Sars-Cov-2,https://chemrxiv.org/articles/preprint/Identifying_Therapeutic_Compounds_Targeting_RNA-Dependent-RNA-Polymerase_of_Sars-Cov-2/12477761,https://j.mp/2ZhJZKx
ChemRxiv,Double Lock the COVID 19: Inhibit SARS COV 2 Replication and Suppress Inflammation Cytokine Level by the Golden Compounds,https://chemrxiv.org/articles/preprint/Double_Lock_the_COVID_19_Inhibit_SARS_COV_2_Replication_and_Suppress_Inflammation_Cytokine_Level_by_the_Golden_Compounds/12560276,https://j.mp/31nCGUh
ChemRxiv,Amodiaquine as COVID-19 Mpro Inhibitor: A Theoretical Study,https://chemrxiv.org/articles/preprint/Amodiaquine_as_COVID-19_Mpro_Inhibitor_A_Theoretical_Study/12555137,https://j.mp/3g3hjvm
ChemRxiv,Network Representation Learning-Based Drug Mechanism Discovery and Anti-Inflammatory Response Against COVID-19,https://chemrxiv.org/articles/preprint/Network_Representation_Learning-Based_Drug_Mechanism_Discovery_and_Anti-Inflammatory_Response_Against_COVID-19/12531314,https://j.mp/2YH7JbN
ChemRxiv,Dose COVID-19 Uncovered a New Feature of Metronidazole Drug?,https://chemrxiv.org/articles/preprint/Dose_COVID-19_Uncovered_a_New_Feature_of_Metronidazole_Drug_/12526277,https://j.mp/2NCcXPE
ChemRxiv,A Computational and Literature-Based Evaluation for a Combination of Chiral Anti-CoV Drugs to Block and Eliminate SARS-CoV-2 Safely,https://chemrxiv.org/articles/preprint/A_Computational_and_Literature-Based_Evaluation_for_a_Combination_of_Chiral_Anti-CoV_Drugs_to_Block_and_Eliminate_SARS-CoV-2_Safely/12550523,https://j.mp/31sAKKm
ChemRxiv,A Predictive Model of the Temperature-Dependent Inactivation of Coronaviruses,https://chemrxiv.org/articles/preprint/A_Predictive_Model_of_the_Temperature-Dependent_Inactivation_of_Coronaviruses/12152970,https://j.mp/3i85qXb
ChemRxiv,Potential Docking Affinity of Three Approved Drugs Against SARS-CoV-2 for COVID-19 Treatment,https://chemrxiv.org/articles/preprint/Potential_Docking_Affinity_of_Three_Approved_Drugs_Against_SARS-CoV-2_for_COVID-19_Treatment/12548063,https://j.mp/2CJiUrU
