feed,title,long_url,short_url
RS,Double-norm constrained dictionary learning image denoising algorithm,https://www.researchsquare.com/article/rs-1696201/latest,https://bit.ly/3wOTVNv
RS,Jerk Optimization Model of Motor Control for Continuous Movement - A Genetic Algorithm Approach,https://www.researchsquare.com/article/rs-1677071/latest,https://bit.ly/3NEc2v9
RS,Segmentation of Acute Pulmonary Embolism in Computed Tomography Pulmonary Angiography Using the Deep Learning Method,https://www.researchsquare.com/article/rs-1694060/latest,https://bit.ly/3MX30cS
RS,Hybrid cryptosystem based on deterministic phase masks in Fresnel domain and Yang-Gu mixture amplitude-phase retrieval algorithm,https://www.researchsquare.com/article/rs-1503910/latest,https://bit.ly/3GtSdEI
RS,Identification of asymptomatic COVID-19 patients on chest CT images using Transformer-or CNN-based deep learning models,https://www.researchsquare.com/article/rs-1590051/latest,https://bit.ly/3MTukbV
RS,Real-time Motion Management for Robotic Treatment Couch in Proton Therapy System,https://www.researchsquare.com/article/rs-1673938/latest,https://bit.ly/3xcZMeL
RS,Historical and Future Trends in Emergency Pituitary Referrals: A Machine Learning Analysis,https://www.researchsquare.com/article/rs-1682612/latest,https://bit.ly/3MX364e
RS,Distribution Function Based- Arithmetic Optimization Algorithm for Global optimization and Engineering Applications,https://www.researchsquare.com/article/rs-822763/latest,https://bit.ly/3GsMu1y
