feed,title,long_url,short_url
GN:T:ML,3 Ways to Think Like a (Great) Data Scientist - Towards Data Science,https://news.google.com/rss/articles/CBMiV2h0dHBzOi8vdG93YXJkc2RhdGFzY2llbmNlLmNvbS8zLXdheXMtdG8tdGhpbmstbGlrZS1hLWdyZWF0LWRhdGEtc2NpZW50aXN0LTdkMGZjM2RmNjA0Y9IBAA?oc=5,https://da.gd/5hVk
GN:T:ML,Lysosome-related biomarkers in preeclampsia and cancer: Machine learning and bioinformatics analysis - ScienceDirect,https://news.google.com/rss/articles/CBMiR2h0dHBzOi8vd3d3LnNjaWVuY2VkaXJlY3QuY29tL3NjaWVuY2UvYXJ0aWNsZS9hYnMvcGlpL1MwMDEwNDgyNTI0MDAyODUz0gEA?oc=5,https://da.gd/iXGR3b
GN:T:ML,Prompt engineering is a task best left to AI models - The Register,https://news.google.com/rss/articles/CBMiRGh0dHBzOi8vd3d3LnRoZXJlZ2lzdGVyLmNvbS8yMDI0LzAyLzIyL3Byb21wdF9lbmdpbmVlcmluZ19haV9tb2RlbHMv0gFIaHR0cHM6Ly93d3cudGhlcmVnaXN0ZXIuY29tL0FNUC8yMDI0LzAyLzIyL3Byb21wdF9lbmdpbmVlcmluZ19haV9tb2RlbHMv?oc=5,https://da.gd/O2WDD2
GN:T:ML,"AI Concerns Unveiled: 74 Percent of Americans Fear Job Loss, 59 Percent Perceive Threat - AiThority",https://news.google.com/rss/articles/CBMifWh0dHBzOi8vYWl0aG9yaXR5LmNvbS9tYWNoaW5lLWxlYXJuaW5nL2FpLWNvbmNlcm5zLXVudmVpbGVkLTc0LXBlcmNlbnQtb2YtYW1lcmljYW5zLWZlYXItam9iLWxvc3MtNTktcGVyY2VudC1wZXJjZWl2ZS10aHJlYXQv0gEA?oc=5,https://da.gd/JtoD
GN:T:ML,"Machine learning-based disulfidptosis-related lncRNA signature predicts prognosis, immune infiltration and drug sensitivity in hepatocellular carcinoma | Scientific Reports - Nature",https://news.google.com/rss/articles/CBMiMmh0dHBzOi8vd3d3Lm5hdHVyZS5jb20vYXJ0aWNsZXMvczQxNTk4LTAyNC01NDExNS040gEA?oc=5,https://da.gd/30irVh
GN:T:ML,Machine Learning Reduces Polypharmacy in Behavioral Health - Pharmacy Practice News,https://news.google.com/rss/articles/CBMijgFodHRwczovL3d3dy5waGFybWFjeXByYWN0aWNlbmV3cy5jb20vUGhhcm1hY3ktVGVjaG5vbG9neS1SZXBvcnQvQXJ0aWNsZS8wMi0yNC9NYWNoaW5lLUxlYXJuaW5nLVJlZHVjZXMtUG9seXBoYXJtYWN5LWluLUJlaGF2aW9yYWwtSGVhbHRoLzcyODE50gEA?oc=5,https://da.gd/edxge3
GN:T:ML,Large language models streamline automated machine learning for clinical studies - Nature,https://news.google.com/rss/articles/CBMiMmh0dHBzOi8vd3d3Lm5hdHVyZS5jb20vYXJ0aWNsZXMvczQxNDY3LTAyNC00NTg3OS040gEA?oc=5,https://da.gd/v2xn
