feed,title,long_url,short_url
GN:S:GW,Is the world 1.3°C or 1.5°C warmer? Historical ship logs hold answers - Science,https://news.google.com/rss/articles/CBMib2h0dHBzOi8vd3d3LnNjaWVuY2Uub3JnL2NvbnRlbnQvYXJ0aWNsZS93b3JsZC0xLTMlQzIlQjBjLW9yLTEtNSVDMiVCMGMtd2FybWVyLWhpc3RvcmljYWwtc2hpcC1sb2dzLWhvbGQtYW5zd2Vyc9IBAA?oc=5,https://da.gd/A6dsXC
GN:S:GW,How More Green Jobs Will Help Limit Global Warming - The Anniston Star,https://news.google.com/rss/articles/CBMikQFodHRwczovL3d3dy5hbm5pc3RvbnN0YXIuY29tL25ld3MvbmF0aW9uX3dvcmxkL2hvdy1tb3JlLWdyZWVuLWpvYnMtd2lsbC1oZWxwLWxpbWl0LWdsb2JhbC13YXJtaW5nL3ZpZGVvXzI3Y2ZjNTY3LWM3NTEtNWEwYi04YmFhLTNjY2ExM2NjYzNkZS5odG1s0gEA?oc=5,https://da.gd/2lLDYT
GN:S:GW,High emissions or carbon neutral? Inclusion of “anthropogenic” forest sinks leads to mischaracterization of forestry ... - NRDC (Natural Resources Defense Council),https://news.google.com/rss/articles/CBMiQmh0dHBzOi8vd3d3Lm5yZGMub3JnL2Jpby9qdWxlZS1ib2FuL2NhbmFkYXMtZm9yZXN0LWNhcmJvbi1sb29waG9sZdIBAA?oc=5,https://da.gd/R9vmF
GN:S:GW,Fossil Fuel Industry Knew About Impending Climate Crisis as Early as 1954 - Truthout,https://news.google.com/rss/articles/CBMiaGh0dHBzOi8vdHJ1dGhvdXQub3JnL2FydGljbGVzL2Zvc3NpbC1mdWVsLWluZHVzdHJ5LWtuZXctYWJvdXQtaW1wZW5kaW5nLWNsaW1hdGUtY3Jpc2lzLWFzLWVhcmx5LWFzLTE5NTQv0gEA?oc=5,https://da.gd/C15SX
GN:S:GW,Dr. Sandra Koch: Climate change can be solved - Nevada Appeal,https://news.google.com/rss/articles/CBMiWmh0dHBzOi8vd3d3Lm5ldmFkYWFwcGVhbC5jb20vbmV3cy8yMDI0L2phbi8zMS9kci1zYW5kcmEta29jaC1jbGltYXRlLWNoYW5nZS1jYW4tYmUtc29sdmVkL9IBAA?oc=5,https://da.gd/hD7uwz
GN:S:GW,The Impact of Sulfur Dioxide Injection on Ice Sheet Melting - AZoCleantech,https://news.google.com/rss/articles/CBMiM2h0dHBzOi8vd3d3LmF6b2NsZWFudGVjaC5jb20vbmV3cy5hc3B4P25ld3NJRD0zNDU1NNIBAA?oc=5,https://da.gd/aO4bO
GN:S:GW,How More Green Jobs Will Help Limit Global Warming - Voice Of Alexandria,https://news.google.com/rss/articles/CBMikgFodHRwczovL3d3dy52b2ljZW9mYWxleGFuZHJpYS5jb20vbmV3cy9uYXRpb25hbC9ob3ctbW9yZS1ncmVlbi1qb2JzLXdpbGwtaGVscC1saW1pdC1nbG9iYWwtd2FybWluZy92aWRlb19mYjllZDU0NC00MjE3LTU1NWItYTI0Yi1mZTlkNmM4MGI2YzUuaHRtbNIBAA?oc=5,https://da.gd/y3Ab
GN:S:GW,"Climate Warming Impairs Trees' Ability to Breathe, Study Shows - Mirage News",https://news.google.com/rss/articles/CBMiTGh0dHBzOi8vd3d3Lm1pcmFnZW5ld3MuY29tL2NsaW1hdGUtd2FybWluZy1pbXBhaXJzLXRyZWVzLWFiaWxpdHktdG8tMTE2NTEzMy_SAQA?oc=5,https://da.gd/eRfpI1
GN:S:GW,Scientist who thought we 'were all going to die from climate change' reveals 7 reasons she was wrong - and how the,https://news.google.com/rss/articles/CBMiZGh0dHBzOi8vd3d3LmRhaWx5bWFpbC5jby51ay9zY2llbmNldGVjaC9hcnRpY2xlLTEzMDI4NTg3L3NjaWVudGlzdC13aW5uaW5nLWZpZ2h0LWdsb2JhbC13YXJtaW5nLmh0bWzSAQA?oc=5,https://da.gd/6BTYDK
GN:S:GW,Restored Wetland Emits Unexpected Levels of Greenhouse Gas - AZoCleantech,https://news.google.com/rss/articles/CBMiM2h0dHBzOi8vd3d3LmF6b2NsZWFudGVjaC5jb20vbmV3cy5hc3B4P25ld3NJRD0zNDU0N9IBAA?oc=5,https://da.gd/bLyEMZ
GN:S:GW,"Climate change: University researchers feel powerless to take action, says survey - Phys",https://news.google.com/rss/articles/CBMiTWh0dHBzOi8vcGh5cy5vcmcvbmV3cy8yMDI0LTAxLWNsaW1hdGUtdW5pdmVyc2l0eS1wb3dlcmxlc3MtYWN0aW9uLXN1cnZleS5odG1s0gFMaHR0cHM6Ly9waHlzLm9yZy9uZXdzLzIwMjQtMDEtY2xpbWF0ZS11bml2ZXJzaXR5LXBvd2VybGVzcy1hY3Rpb24tc3VydmV5LmFtcA?oc=5,https://da.gd/gmXqY
