feed,title,long_url,short_url
ArXiv:q-fin,Beyond cost reduction: Improving the value of energy storage in electricity systems,https://arxiv.org/abs/2101.10092v3,
ArXiv:q-fin,Modelling risk for commodities in Brazil: An application to live cattle spot and futures prices,https://arxiv.org/abs/2107.07556v1,
ArXiv:q-fin,Predicting Daily Trading Volume via Various Hidden States,https://arxiv.org/abs/2107.07678v1,
ArXiv:q-fin,Price graphs: Utilizing the structural information of financial time series for stock prediction,https://arxiv.org/abs/2106.02522v3,
ArXiv:q-fin,A stylized model for wealth distribution,https://arxiv.org/abs/1609.08978v2,
