feed,title,long_url,short_url
GN:T:SL,Melting ice reveals remains of climber lost on glacier 37 years ago - CNN,https://news.google.com/rss/articles/CBMiZWh0dHBzOi8vd3d3LmNubi5jb20vMjAyMy8wNy8yOC9ldXJvcGUvZ2VybWFuLWNsaW1iZXItcmVtYWlucy1nbGFjaWVyLWNsaW1hdGUtc2NsaS1pbnRsLXNjbi9pbmRleC5odG1s0gEA?oc=5,https://da.gd/SFkug
GN:T:SL,What took you so long? Unesco will ask for Venice to be added to the Endangered Heritage Sites list - Art Newspaper,https://news.google.com/rss/articles/CBMijQFodHRwczovL3d3dy50aGVhcnRuZXdzcGFwZXIuY29tLzIwMjMvMDgvMDEvd2hhdC10b29rLXlvdS1zby1sb25nLXVuZXNjby13aWxsLWFzay1mb3ItdmVuaWNlLXRvLWJlLWFkZGVkLXRvLXRoZS1lbmRhbmdlcmVkLWhlcml0YWdlLXNpdGVzLWxpc3TSAQA?oc=5,https://da.gd/ql0HCP
GN:T:SL,California winter waves may be increasing under climate change - SurferToday,https://news.google.com/rss/articles/CBMiZmh0dHBzOi8vd3d3LnN1cmZlcnRvZGF5LmNvbS9lbnZpcm9ubWVudC9jYWxpZm9ybmlhLXdpbnRlci13YXZlcy1tYXktYmUtaW5jcmVhc2luZy11bmRlci1jbGltYXRlLWNoYW5nZdIBamh0dHBzOi8vd3d3LnN1cmZlcnRvZGF5LmNvbS9lbnZpcm9ubWVudC9jYWxpZm9ybmlhLXdpbnRlci13YXZlcy1tYXktYmUtaW5jcmVhc2luZy11bmRlci1jbGltYXRlLWNoYW5nZS9hbXA?oc=5,https://da.gd/Ze0QbH
GN:T:SL,Climate change could collapse a key Atlantic Ocean current. How that could affect Wisconsin - Milwaukee Journal Sentinel,https://news.google.com/rss/articles/CBMimwFodHRwczovL3d3dy5qc29ubGluZS5jb20vc3RvcnkvbmV3cy9sb2NhbC93aXNjb25zaW4vMjAyMy8wOC8wMS9jbGltYXRlLWNoYW5nZS1jb3VsZC1jb2xsYXBzZS1hbi1hdGxhbnRpYy1jdXJyZW50LWhvdy1pdC1jb3VsZC1pbXBhY3Qtd2lzY29uc2luLzcwNDc5NDg1MDA3L9IBAA?oc=5,https://da.gd/dnwLC
GN:T:SL,Assembly speaker joins Queens lawmaker on tour of Jamaica Bay in Far Rockaway – QNS.com - QNS,https://news.google.com/rss/articles/CBMiZmh0dHBzOi8vcW5zLmNvbS8yMDIzLzA4L2Fzc2VtYmx5LXNwZWFrZXItam9pbnMtcXVlZW5zLWxhd21ha2VyLW9uLXRvdXItb2YtamFtYWljYS1iYXktaW4tZmFyLXJvY2thd2F5L9IBAA?oc=5,https://da.gd/ytNp
