feed,title,long_url,short_url
ArXiv:eess,A workflow for segmenting soil and plant X-ray CT images with deep learning in Googles Colaboratory,https://arxiv.org/abs/2203.09674v1,
ArXiv:eess,Federated Learning for Privacy Preservation in Smart Healthcare Systems: A Comprehensive Survey,https://arxiv.org/abs/2203.09702v1,
ArXiv:eess,Rethinking the optimization process for self-supervised model-driven MRI reconstruction,https://arxiv.org/abs/2203.09724v1,
ArXiv:eess,Pseudo Bias-Balanced Learning for Debiased Chest X-ray Classification,https://arxiv.org/abs/2203.09860v1,
ArXiv:eess,A Lightweight Instrument-Agnostic Model for Polyphonic Note Transcription and Multipitch Estimation,https://arxiv.org/abs/2203.09893v1,
ArXiv:eess,SynthStrip: Skull-Stripping for Any Brain Image,https://arxiv.org/abs/2203.09974v1,
ArXiv:eess,Image Storage on Synthetic DNA Using Autoencoders,https://arxiv.org/abs/2203.09981v1,
ArXiv:eess,A constrained Shannon-Fano entropy coder for image storage in synthetic DNA,https://arxiv.org/abs/2203.09988v1,
ArXiv:eess,Cervical Optical Coherence Tomography Image Classification Based on Contrastive Self-Supervised Texture Learning,https://arxiv.org/abs/2108.05081v3,
ArXiv:eess,CheXstray: Real-time Multi-Modal Data Concordance for Drift Detection in Medical Imaging AI,https://arxiv.org/abs/2202.02833v2,
ArXiv:eess,Deep Semi-supervised Metric Learning with Dual Alignment for Cervical Cancer Cell Detection,https://arxiv.org/abs/2104.03265v2,
