feed,title,long_url,short_url
GN:T:CC,Repurposing Bitcoin mining heat can solve global energy crisis: Arcane - Cointelegraph,https://cointelegraph.com/news/repurposing-bitcoin-mining-heat-can-solve-global-energy-crisis-arcane,
GN:T:CC,Pakistan Flooding: Bad Governance Exacerbates Climate Change Effects - Foreign Policy,https://foreignpolicy.com/2022/09/01/pakistan-flooding-crisis-climate-change-governance/,
GN:T:CC,Examining the game industry’s hidden impacts on climate change - Ars Technica,https://arstechnica.com/gaming/2022/09/examining-the-game-industrys-hidden-impacts-on-climate-change/,
GN:T:CC,How melting glaciers caused by climate change led to to floods in Pakistan - NPR,https://www.npr.org/2022/09/04/1120952641/how-melting-glaciers-caused-by-climate-change-led-to-to-floods-in-pakistan,
GN:T:CC,India’s Electric Vehicle Push Is Riding on Mopeds and Rickshaws - The New York Times,https://www.nytimes.com/2022/09/04/business/energy-environment/india-electric-vehicles-moped-rickshaw.html,
GN:T:CC,Fire Fests: Climate Change Is Making Some Outdoor Shows Hell This Summer - Rolling Stone,https://www.rollingstone.com/music/music-features/climate-change-outdoor-shows-1234585812/,
