feed,title,long_url,short_url
GN:S:GW,Tipping Points for the Planet - The New York Times,https://news.google.com/rss/articles/CBMiTWh0dHBzOi8vd3d3Lm55dGltZXMuY29tLzIwMjQvMDIvMTUvY2xpbWF0ZS90aXBwaW5nLXBvaW50cy1mb3ItdGhlLXBsYW5ldC5odG1s0gEA?oc=5,https://da.gd/kOC7a
GN:S:GW,Greener Snowmaking Is Helping Ski Resorts Weather Climate Change - TIME,https://news.google.com/rss/articles/CBMiP2h0dHBzOi8vdGltZS5jb20vNjY5NTQ4MS9za2ktcmVzb3J0cy1zbm93bWFraW5nLWNsaW1hdGUtY2hhbmdlL9IBAA?oc=5,https://da.gd/qz5vxu
GN:S:GW,"Rhinos can't sweat, making them vulnerable to overheating: global warming could wipe them out in southern Africa - The Conversation",https://news.google.com/rss/articles/CBMikAFodHRwczovL3RoZWNvbnZlcnNhdGlvbi5jb20vcmhpbm9zLWNhbnQtc3dlYXQtbWFraW5nLXRoZW0tdnVsbmVyYWJsZS10by1vdmVyaGVhdGluZy1nbG9iYWwtd2FybWluZy1jb3VsZC13aXBlLXRoZW0tb3V0LWluLXNvdXRoZXJuLWFmcmljYS0yMjMwMTTSAQA?oc=5,https://da.gd/aSwApM
GN:S:GW,"A year after cyclone, church in Malawi rallies residents to tackle climate change by planting trees - National Catholic Reporter",https://news.google.com/rss/articles/CBMie2h0dHBzOi8vd3d3Lm5jcm9ubGluZS5vcmcvZWFydGhiZWF0L2ZhaXRoL3llYXItYWZ0ZXItY3ljbG9uZS1jaHVyY2gtbWFsYXdpLXJhbGxpZXMtcmVzaWRlbnRzLXRhY2tsZS1jbGltYXRlLWNoYW5nZS1wbGFudGluZ9IBAA?oc=5,https://da.gd/u3I2
GN:S:GW,It's time for Northeast to prep for floods like this winter. Climate change is why - NBC New York,https://news.google.com/rss/articles/CBMisAFodHRwczovL3d3dy5uYmNuZXd5b3JrLmNvbS9uZXdzL25hdGlvbmFsLWludGVybmF0aW9uYWwvY2hhbmdpbmctY2xpbWF0ZS9pdHMtdGltZS1mb3Itbm9ydGhlYXN0LXRvLXByZXAtZm9yLWZsb29kcy1saWtlLXRob3NlLXRoYXQtaGl0LXRoaXMtd2ludGVyLWNsaW1hdGUtY2hhbmdlLWlzLXdoeS81MTQwNjA3L9IBtgFodHRwczovL3d3dy5uYmNuZXd5b3JrLmNvbS9uZXdzL25hdGlvbmFsLWludGVybmF0aW9uYWwvY2hhbmdpbmctY2xpbWF0ZS9pdHMtdGltZS1mb3Itbm9ydGhlYXN0LXRvLXByZXAtZm9yLWZsb29kcy1saWtlLXRob3NlLXRoYXQtaGl0LXRoaXMtd2ludGVyLWNsaW1hdGUtY2hhbmdlLWlzLXdoeS81MTQwNjA3Lz9hbXA9MQ?oc=5,https://da.gd/qBV1C
GN:S:GW,Global Warming's New Threat: Arctic Permafrost's Carbon Bomb - SciTechDaily,https://news.google.com/rss/articles/CBMiU2h0dHBzOi8vc2NpdGVjaGRhaWx5LmNvbS9nbG9iYWwtd2FybWluZ3MtbmV3LXRocmVhdC1hcmN0aWMtcGVybWFmcm9zdHMtY2FyYm9uLWJvbWIv0gEA?oc=5,https://da.gd/gn8Eyw
GN:S:GW,"Global Warming Will Send Thousands of Migrants to Maine, Claims Portland's Sustainability Director [VIDEO] - The Maine Wire",https://news.google.com/rss/articles/CBMijAFodHRwczovL3d3dy50aGVtYWluZXdpcmUuY29tLzIwMjQvMDIvZ2xvYmFsLXdhcm1pbmctd2lsbC1zZW5kLXRob3VzYW5kcy1vZi1taWdyYW50cy10by1tYWluZS1jbGFpbXMtcG9ydGxhbmRzLXN1c3RhaW5hYmlsaXR5LWRpcmVjdG9yLXZpZGVvL9IBAA?oc=5,https://da.gd/dIIX4r
GN:S:GW,Google is creating new feature that could be crucial in fight against climate change - UNILAD,https://news.google.com/rss/articles/CBMiYWh0dHBzOi8vd3d3LnVuaWxhZC5jb20vdGVjaG5vbG9neS9uZXdzL2dvb2dsZS1uZXctZmVhdHVyZS1zYXRlbGxpdGUtbWV0aGFuZS1sZWFrcy00ODc3NDgtMjAyNDAyMTXSAQA?oc=5,https://da.gd/yYY7H
GN:S:GW,Tropical Ocean Oxygen Levels Rose in Paleocene-Eocene Era - Mirage News,https://news.google.com/rss/articles/CBMiUmh0dHBzOi8vd3d3Lm1pcmFnZW5ld3MuY29tL3Ryb3BpY2FsLW9jZWFuLW94eWdlbi1sZXZlbHMtcm9zZS1pbi1wYWxlb2NlbmUtMTE3NTA5OS_SAQA?oc=5,https://da.gd/IOCv
