feed,title,long_url,short_url
GN:S:GW,"Australia's green energy push, Pacific ties face setback from COP31 impasse - Reuters",https://news.google.com/rss/articles/CBMiwAFBVV95cUxPWTdpeE5VdGNOVTQzT2VGYU9OMUJ6NVc4ZmJTaWV6Z0ptZmNXeFdiX3VVV1dvNU5XTEVfaGk5NUVWa0ZtWk52eVNxNF9WYmNmNEZQUW5Mc3dOV2dabHBXR3JPTUxXMGtUb3VoVnJZc0pDMnpURFZMenhSeHlSN3A2RFpRa0w2WWtMOUl4dGI2cWpUS2RDWU1HVGFCTVpKRUJQY3BvQ1cwZDBDbzRiOHpmWDdsNDFIbkoyazFwTEgwRWo?oc=5,
GN:S:GW,1.5 degrees ‘no longer plausible’ as global emissions hit record - E&E News by POLITICO,https://news.google.com/rss/articles/CBMimwFBVV95cUxPaVFKc3ZKSENTdnJ2azJKSFVIc3hrTUxjWnRwTjBXTVRoNXdIcHpnV2ZIQUNSUGozWjB4MmpmZHh4NTZ3Wnp2bnVRV3pOR3haVFhqcm1GS0QwUnpwczV6UVJ4NzI1aEdUZ0I2d0lQRC1KRnpmNXBfcnlXUi1tZnNfcm1lUDJUVTZUWGhqZkpuY0J0UFhSSXEwb2RfUQ?oc=5,
GN:S:GW,EU Parliament backs new 2040 climate target - Reuters,https://news.google.com/rss/articles/CBMinwFBVV95cUxOUnREazBIdG5sQWI3RTg1cklPZEt3TmdURWRzQlZ5ZzBaa1RZUURjdDg1NTB2WUpuV0VhTktGNmg0NjNNSUpmNXFYM0ZWVjB1ajEteWt3QmRxYzVzVmFTWFoxTWtDZ1l6ekg1d3o2Nmp3bEJuV2V5TW4xLWlodmVGdHdoMmlFdVlSdGJUVW9FRjVqWl9iRHc5T0hOTmo2VXc?oc=5,
GN:S:GW,Climate Action Tracker: World still on course for 2.6C of global warming - BusinessGreen,https://news.google.com/rss/articles/CBMingFBVV95cUxOSE1LVnJZUk4ta2xEVkRfVTNQVjYxWi05VzVYbWpRU2xhdEdTMjZ4cWlzSjl6YzRoOWJZeVFyNGNKOEpxNm12ejZpNEtzWDRmdjUyQzhHWU5ubW5oU1VTbktKTS0zbEpoMm5DSWh0YW0xajJCd0ZySWlYZ3ZpUm5zTE1ONld1ZG5UbUVTYllvQm1lR1hrTjBpWGkxYjhLZw?oc=5,
GN:S:GW,Paperwork won't prepare us for climate change: Planning might - Phys,https://news.google.com/rss/articles/CBMiaEFVX3lxTE9mT09Yb3hDenZHLWpyN3Rrd3FDRVBYNWt2WHpqVEtkdUp6Nno4Vk90VjV3OUdiUklDbm0wa3ZnVThFdkpwam81Vk5NY0V0WGwzNzdEaVp1aFZFal82YWFoUjR0QXEwTWJz?oc=5,
GN:S:GW,Catastrophic global warming looms as fossil fuel emissions hit alarming levels - RBC-Ukraine,https://news.google.com/rss/articles/CBMilgFBVV95cUxOVEdLOGN6T3k0NVc0OWNsVjkyeHZyZVVBMlNJSVJoOHFUWENvaXJweDJDMWIzcXRfMjd0MlRzazhGcGZ2alNXeWNxREJNN1JrQXptdjJDWHRxVmlBWl85VU1SclhCRkVOTTk1Q05ya1BZd2xqN3NZRGQ3SThyMUY4WGtWbUtLc05HY0UwSXBHZjNaTkktQVE?oc=5,
GN:S:GW,"WATCH: Day 3 highlight at COP30 is the fight against climate disinformation, where at least 13 countries signed the Declaration of Information Integrity on Climate Change. Climate disinformation, according to a Filipino youth and climate advocate, is also spre - facebook",https://news.google.com/rss/articles/CBMiiAFBVV95cUxOdmpFNDZrdmtiNWRSTlVycVdxQXA4Y19Eb09RYUtoQjgtcjhJdjE3QW84NENpbFV1U0tMX0lXMVF4M1dYT281Wmp0QnhRcXRGS1dRX0l2b1NHbHFPOVFmM2V4RHliakREWGdITy1idGh5NmtXQ0tlRzhPSlhDZ21wTU45TVBqQms1?oc=5,
GN:S:GW,”COP of Truth” against disinformation + 10 years of Paris: Climate is changing rapidly + CEO appeal for reasonable climate policy - Table,https://news.google.com/rss/articles/CBMia0FVX3lxTE91bUZEbVRDWkU2eG5NRFJNWXplUm96OTBVdF9EMGt3bW9SUWZ5WFZpXy1xSUdzR0xUQlVfNnJCblFudmRaYmIyeTFrbUY0NVdTV01sN0E1NXFJU1Rfa2lYWGItQWxGTlA1UVE4?oc=5,
GN:S:GW,Six ways Minnesotans are feeling the state’s changing climate - Star Tribune,https://news.google.com/rss/articles/CBMinwFBVV95cUxQaHR1SzlSbl9HTTlCMmtUbi1seGs1c21HazlKZUtQdndWS0pDa2h4M0VmVFZ6R1IyTHd2ZHZtYXhXNzVsUWxRQTVJaXFaV1B0TXRCMk1aRzkwNzBzRC1FcngxRVNSaXduMGtGZWs4Z3Q0bmNvTDhTTkctSFFyV1BmaEF4MnpFNS1oS1NITmU3cXFycXI4VThLNzBPZlUzV0k?oc=5,
GN:S:GW,Breach Of Key 1.5°C Global Warming Threshold To Occur Over A Decade Earlier Than Previously Projected - Barron's,https://news.google.com/rss/articles/CBMi2gNBVV95cUxPNTdJaUFCRGM5TzRWTWpYWm9sbG44bF9fSTU0R3h1R1luY0w4WHFnLUN1Y3FNTjFCSGlDVEVaMms0eFRXNkNsaEtOVTBkcTdnc0l3djl1cWRSWHRsV3djT1ZzdVY2TWU4N2hBZWNOUC1sVmdGbElYbGliUWkxODVFdnFQendkelI2TUlzTldPQVhOUXRuTnJwZFZSR1NsX1RucXRzTnN1ZktxcGJsbzNVdFV2TXJqdHpwYVo3SXNfMzZ5MnVId3lpeEZhNFdvTVN5aGIxbVRtVmwyeFZRWE43M01ycWVfWktQNmgyWEJEM1JDTFZrT3dyeVRuTHQ1VHZ6bXZ0SHg0ajRDNzhDN0RoM19tNFRFSXhrRDVOLThMYUthLVN4T0dKTnJQdUt2cERTMlhnYXQ5cl84RVE3RHR4QkZDcWVNRmpUakZHS2dteEczTnNTckNDWHRDSThfS29EZVlMa2tabDYwWEVXT2tJeDJ5LXVHMjU5SlM5SW5jbmRzQ3FZbkxKbVBiYzJCZzBaWlM4bHpqNmppQ1RjREZVd3RkbzNtMUJYRTdtd25tcFdkeE4teTN3WEp1UjlQcnF6TVV2S3RqdU1uNUMxTHRnaWYwQ0RGd2R0SlE?oc=5,
