feed,title,long_url,short_url
GN:T:AI,Nintendo Denies Using AI Images In New 'My Mario' Marketing - Nintendo Life,https://news.google.com/rss/articles/CBMioAFBVV95cUxOOC1oVTJhTjJ2NmxiWnpWMGdDaXAyTlNuSXR5ckZkak8wdUhFY1Y1X2JETVphSjd3bk5rTEpjMjFlcGxXQ3lkMGxjSVhQX3dLRGptaVV6bENBejQtZ3NJZDF0ZF9MTVJONWd4NG1QTUhYWkVWdk5SbVdMUVBiR1BlTHEyRkhnTURQSU8yS1BGYnF2VlUzZjR0ZTVWQ0VhRlhF?oc=5,
GN:T:AI,We All Thought It Was Going to Destroy Any Shared Reality. The Minneapolis ICE Killing Proves We Didn’t Need It. - Slate,https://news.google.com/rss/articles/CBMikwFBVV95cUxNUmMtNjBrOTZVSTk2QmRfTjFua1B3V0d5WXFZNVBhN1VaQnl5c0dxQ0wwYXgxVTZKd2kwRUFmX0djSzNJZEYwbHZzbUFMekRVZDNGdkZDeEd4blFkSGxtNzBKaEtXRHZlRVIwWTd1RGRHR1g2d0NLd2xjNGYtOTEyZmt2QVBnVGJxNG4wU3RDTHRCTGM?oc=5,
GN:T:AI,"CES 2026: Everything revealed, from Nvidia’s debuts to AMD’s new chips to Razer’s AI oddities - TechCrunch",https://news.google.com/rss/articles/CBMiwAFBVV95cUxQR1N6NGY0Yk1fck9HLUhNeWk0bnJ3Yy16MVdzcmdEZm9fYkswRFJ6N2VfMXRxcUs5Mm5GSnZCbHllakJORExsWUViWVJTUXhET3BNbFRDNm9wUWlyR3BQQlRkUjQ0QWt5S0k1eHpYLUUxc2lISXRBTHdpVm9IbjhBd1pjNVU0NDg5czNzcVl1N2NMVktES0FyTzB0OS04Rno3YjZpWUc0ZXRBb1RVaDgzYkxLYU83RDVxZUFGVkZGTlk?oc=5,
GN:T:AI,Change of mind: Larian says it will not use gen-AI at all in relation to Divinity concept art after fan backlash - Eurogamer,https://news.google.com/rss/articles/CBMiugFBVV95cUxNc2dGcm1ZOGJlbHZOT2J0eXBJQUFzNlVvSklGWXZMSEd2amZlRDJTWlpyNS03OUpHcUxva2FxTURJOVkza1NHSUxOVWRoeEpNMnQtVzlFZ3U0amhlOEpTYmJHb09OWTBNcnpqMEtIMC12clE3QVNxM3VjcXZQYWpzVTRGeWFld1kxbGlsZy1BZy0taFpOaFJHZnRZS3NzMXhMVU8xTWIyNG1Wc2NKbGc1UnFfTXBLTmlIcmc?oc=5,
GN:T:AI,"Gmail debuts a personalized AI Inbox, AI Overviews in search, and more - TechCrunch",https://news.google.com/rss/articles/CBMipgFBVV95cUxNUzA0UkVuZWNhWV80SzNXVWRRVmpSQVE5TEd3aklvMGxGZE9kRXMxbmdfbHlualZCRWIycnM3TXZ4eHphQWZiZEdCX3dMS2NBb0dQcXVSU1djaVBOdFg4aEkyWTVqY2I4cjF0N3ExdF9WMFROS2dnUW1pbjE4VHQ3X2s3Qk56SmdyQ05qTlFicU82RnZrNE9YZU9pZEtRcGM4T0dYZWxB?oc=5,
