feed,title,long_url,short_url
ArXiv:Datasets,The MONET dataset: Multimodal drone thermal dataset recorded in rural scenarios,https://arxiv.org/abs/2304.05417v1,
ArXiv:Datasets,NutritionVerse-3D: A 3D Food Model Dataset for Nutritional Intake Estimation,https://arxiv.org/abs/2304.05619v1,
ArXiv:Datasets,A Multi-Institutional Open-Source Benchmark Dataset for Breast Cancer Clinical Decision Support using Synthetic Correlated Diffusion Imaging Data,https://arxiv.org/abs/2304.05623v1,
ArXiv:Datasets,An Image Quality Assessment Dataset for Portraits,https://arxiv.org/abs/2304.05772v1,
ArXiv:Datasets,HaDR: Applying Domain Randomization for Generating Synthetic Multimodal Dataset for Hand Instance Segmentation in Cluttered Industrial Environments,https://arxiv.org/abs/2304.05826v1,
ArXiv:Datasets,ASL Citizen: A Community-Sourced Dataset for Advancing Isolated Sign Language Recognition,https://arxiv.org/abs/2304.05934v1,
ArXiv:Datasets,NusaX: Multilingual Parallel Sentiment Dataset for 10 Indonesian Local Languages,https://arxiv.org/abs/2205.15960v2,
ArXiv:Datasets,Digital Twin Tracking Dataset (DTTD): A New RGB+Depth 3D Dataset for Longer-Range Object Tracking Applications,https://arxiv.org/abs/2302.05991v2,
