feed,title,long_url,short_url
ArXiv:eess,Broad Learning System with Takagi-Sugeno Fuzzy Subsystem for Tobacco Origin Identification based on Near Infrared Spectroscopy,https://arxiv.org/abs/2301.00126v1,
ArXiv:eess,Spatiotemporal implicit neural representation for unsupervised dynamic MRI reconstruction,https://arxiv.org/abs/2301.00127v1,
ArXiv:eess,EvidenceCap: Towards trustworthy medical image segmentation via evidential identity cap,https://arxiv.org/abs/2301.00349v1,
ArXiv:eess,A plug-in graph neural network to boost temporal sensitivity in fMRI analysis,https://arxiv.org/abs/2301.00439v1,
ArXiv:eess,Spectral Bandwidth Recovery of Optical Coherence Tomography Images using Deep Learning,https://arxiv.org/abs/2301.00504v1,
ArXiv:eess,Segmentation based tracking of cells in 2D+time microscopy images of macrophages,https://arxiv.org/abs/2301.00765v1,
ArXiv:eess,Fusing Models for Prognostics and Health Management of Lithium-Ion Batteries Based on Physics-Informed Neural Networks,https://arxiv.org/abs/2301.00776v1,
ArXiv:eess,CLIP-Driven Universal Model for Organ Segmentation and Tumor Detection,https://arxiv.org/abs/2301.00785v1,
ArXiv:eess,COVID-19 Detection in Chest X-ray Images Using Swin-Transformer and Transformer in Transformer,https://arxiv.org/abs/2110.08427v2,
ArXiv:eess,Mixture Components Inference for Sparse Regression: Introduction and Application for Estimation of Neuronal Signal from fMRI BOLD,https://arxiv.org/abs/2203.07209v3,
ArXiv:eess,Medical Diffusion: Denoising Diffusion Probabilistic Models for 3D Medical Image Generation,https://arxiv.org/abs/2211.03364v6,
