feed,title,long_url,short_url
GN:S:GW,The global challenge of climate change: Was CoP-27 a cop-out? | Mint - Mint,https://www.livemint.com/opinion/online-views/the-global-challenge-of-climate-change-was-cop-27-a-copout-11669048402713.html,
GN:S:GW,COP27 ends in disappointment - No money where the mouth is - Triodos Investment Management,https://www.triodos-im.com/articles/2022/cop27-no-money-where-the-mouth-is,
GN:S:GW,What is geoengineering – and can it save the planet? - The Week UK,https://www.theweek.co.uk/news/environment/958531/what-is-geoengineering-and-can-it-save-the-planet,
GN:S:GW,Will the GOP House halt action on climate change? - Yahoo News,https://news.yahoo.com/will-the-gop-house-halt-action-on-climate-change-163830981.html,
GN:S:GW,Simon Wilson: National's approach to climate is a massive failure for farmers - New Zealand Herald,https://www.nzherald.co.nz/nz/politics/simon-wilson-nationals-approach-to-climate-is-a-massive-failure-for-farmers/NIPVWKL7RBCSDMAM5AGG2VWGYQ/,
GN:S:GW,China says 'long way to go' global cooperation after COP27 climate deal - The New Indian Express,https://www.newindianexpress.com/world/2022/nov/21/china-says-long-way-to-go-global-cooperation-after-cop27-climate-deal-2520598.html,
GN:S:GW,"Highlights of UN Climate Change Conference (COP 27) held at Sharm El Sheikh, Egypt – November 6 – 18 2022 – PART I - AffairsCloud",https://affairscloud.com/highlights-of-un-climate-change-conference-cop-27-held-at-sharm-el-sheikh-egypt-november-6-18-2022-part-i/,
