feed,title,long_url,short_url
ArXiv,schlably: A Python Framework for Deep Reinforcement Learning Based Scheduling Experiments,https://arxiv.org/abs/2301.04182v1,
ArXiv,Adversarial Online Multi-Task Reinforcement Learning,https://arxiv.org/abs/2301.04268v1,
ArXiv,SoK: Adversarial Machine Learning Attacks and Defences in Multi-Agent Reinforcement Learning,https://arxiv.org/abs/2301.04299v1,
ArXiv,Policy Mirror Descent for Regularized Reinforcement Learning: A Generalized Framework with Linear Convergence,https://arxiv.org/abs/2105.11066v4,
ArXiv,Trajectory Modeling via Random Utility Inverse Reinforcement Learning,https://arxiv.org/abs/2105.12092v2,
ArXiv,Investigating the Properties of Neural Network Representations in Reinforcement Learning,https://arxiv.org/abs/2203.15955v2,
ArXiv,When does return-conditioned supervised learning work for offline reinforcement learning?,https://arxiv.org/abs/2206.01079v3,
ArXiv,Interpretable Hidden Markov Model-Based Deep Reinforcement Learning Hierarchical Framework for Predictive Maintenance of Turbofan Engines,https://arxiv.org/abs/2206.13433v2,
ArXiv,When to Trust Your Simulator: Dynamics-Aware Hybrid Offline-and-Online Reinforcement Learning,https://arxiv.org/abs/2206.13464v3,
ArXiv,Max-Min Off-Policy Actor-Critic Method Focusing on Worst-Case Robustness to Model Misspecification,https://arxiv.org/abs/2211.03413v2,
