feed,title,long_url,short_url
GN:T:RE,Apple doubles down on investment in renewable energy and clean water - Deccan Herald,https://news.google.com/rss/articles/CBMidGh0dHBzOi8vd3d3LmRlY2NhbmhlcmFsZC5jb20vdGVjaG5vbG9neS9hcHBsZS1kb3VibGVzLWRvd24tb24taW52ZXN0bWVudC1pbi1yZW5ld2FibGUtZW5lcmd5LWFuZC1jbGVhbi13YXRlci0yOTgyNTA50gEA?oc=5,https://da.gd/UA3bB
GN:T:RE,"TWD, Seatools Outfit Green Jade for Hai Long Piling Work - Offshore WIND",https://news.google.com/rss/articles/CBMiYGh0dHBzOi8vd3d3Lm9mZnNob3Jld2luZC5iaXovMjAyNC8wNC8xNy90d2Qtc2VhdG9vbHMtb3V0Zml0LWdyZWVuLWphZGUtZm9yLWhhaS1sb25nLXBpbGluZy13b3JrL9IBAA?oc=5,https://da.gd/Ufzd6
GN:T:RE,Contractor faces off with homeowner after HOA stops solar panel installation: 'He should be working with us instead of against' - The Cool Down,https://news.google.com/rss/articles/CBMiU2h0dHBzOi8vd3d3LnRoZWNvb2xkb3duLmNvbS9ncmVlbi1ob21lL2NvbnRyYWN0b3ItaG9hLXNvbGFyLXBhbmVscy1ob21lb3duZXItYmxhbWUv0gEA?oc=5,https://da.gd/3sC85i
GN:T:RE,Booming AI demand threatens global electricity supply - Financial Times,https://news.google.com/rss/articles/CBMiP2h0dHBzOi8vd3d3LmZ0LmNvbS9jb250ZW50L2I3NTcwMzU5LWY4MDktNDljZS04Y2Q1LTkxNjZkMzZhMDU3YtIBAA?oc=5,https://da.gd/8swz
GN:T:RE,Flexible quasi-2D perovskite solar cells with high specific power and improved stability for energy-autonomous drones - Nature,https://news.google.com/rss/articles/CBMiMmh0dHBzOi8vd3d3Lm5hdHVyZS5jb20vYXJ0aWNsZXMvczQxNTYwLTAyNC0wMTUwMC0y0gEA?oc=5,https://da.gd/UDhaFP
GN:T:RE,Singapore's Foreign Minister Discusses Renewable Energy Collaboration During Visit To Philippines - SolarQuarter,https://news.google.com/rss/articles/CBMihQFodHRwczovL3NvbGFycXVhcnRlci5jb20vMjAyNC8wNC8xNy9zaW5nYXBvcmVzLWZvcmVpZ24tbWluaXN0ZXItZGlzY3Vzc2VzLXJlbmV3YWJsZS1lbmVyZ3ktY29sbGFib3JhdGlvbi1kdXJpbmctdmlzaXQtdG8tcGhpbGlwcGluZXMv0gEA?oc=5,https://da.gd/zHz2g
GN:T:RE,GRU plans rate change for rooftop solar payments - Mainstreet Daily News Gainesville,https://news.google.com/rss/articles/CBMiWGh0dHBzOi8vd3d3Lm1haW5zdHJlZXRkYWlseW5ld3MuY29tL2dvdnQtcG9saXRpY3MvZ3J1LXJhdGUtY2hhbmdlLXJvb2Z0b3Atc29sYXItcGF5bWVudHPSAQA?oc=5,https://da.gd/RoDAWl
GN:T:RE,"Funding Notice: $12 Million Available to Expand Capacity for Renewable Energy Planning, Siting, and Permitting - Energy",https://news.google.com/rss/articles/CBMieWh0dHBzOi8vd3d3LmVuZXJneS5nb3YvZWVyZS9hcnRpY2xlcy9mdW5kaW5nLW5vdGljZS0xMi1taWxsaW9uLWF2YWlsYWJsZS1leHBhbmQtY2FwYWNpdHktcmVuZXdhYmxlLWVuZXJneS1wbGFubmluZy1zaXRpbmfSAQA?oc=5,https://da.gd/LLO7
GN:T:RE,Dane County recognized as a national leader in solar power - Milwaukee Journal Sentinel,https://news.google.com/rss/articles/CBMihgFodHRwczovL3d3dy5qc29ubGluZS5jb20vc3RvcnkvbmV3cy9sb2NhbC93aXNjb25zaW4vMjAyNC8wNC8xNy9kYW5lLWNvdW50eS1yZWNvZ25pemVkLWFzLWEtbmF0aW9uYWwtbGVhZGVyLWluLXNvbGFyLXBvd2VyLzczMzUzMzQ4MDA3L9IBAA?oc=5,https://da.gd/dJInAM
