feed,title,long_url,short_url
MX,Pandemic job losses leaving many Americans uninsured: Survey,https://medicalxpress.com/news/2020-06-pandemic-job-losses-americans-uninsured.html,https://j.mp/2NoDZtU
MX,COVID-19 hospitalization up with prednisone in rheumatic disease,https://medicalxpress.com/news/2020-06-covid-hospitalization-prednisone-rheumatic-disease.html,https://j.mp/3ewnb06
MX,"Seventy-five percent of US workers can't work exclusively from home, face greater risks during pandemic",https://medicalxpress.com/news/2020-06-seventy-five-percent-workers-exclusively-home.html,https://j.mp/2YwiX33
MX,Is it safe to take an Uber or Lyft ride amid the coronavirus outbreak?,https://medicalxpress.com/news/2020-06-safe-uber-lyft-coronavirus-outbreak.html,https://j.mp/317teEo
MX,"Turkey's virus death toll crosses 5,000",https://medicalxpress.com/news/2020-06-turkey-virus-death-toll.html,https://j.mp/31a8JHe
