feed,title,long_url,short_url
ArXiv:Datasets,TaTa: A Multilingual Table-to-Text Dataset for African Languages,https://arxiv.org/abs/2211.00142v1,
ArXiv:Datasets,CONDAQA: A Contrastive Reading Comprehension Dataset for Reasoning about Negation,https://arxiv.org/abs/2211.00295v1,
ArXiv:Datasets,Should I disclose my dataset? Caveats between reproducibility and individual data rights,https://arxiv.org/abs/2211.00498v1,
ArXiv:Datasets,E2E Refined Dataset,https://arxiv.org/abs/2211.00513v1,
ArXiv:Datasets,Dungeons and Data: A Large-Scale NetHack Dataset,https://arxiv.org/abs/2211.00539v1,
ArXiv:Datasets,"Datasets of Fire and Crime Incidents in Pampanga, Philippines",https://arxiv.org/abs/2211.00555v1,
ArXiv:Datasets,Compressed Gastric Image Generation Based on Soft-Label Dataset Distillation for Medical Data Sharing,https://arxiv.org/abs/2209.14635v2,
