feed,title,long_url,short_url
GN:T:ML,Researchers at Microsoft Propose AllHands: A Novel Machine Learning Framework Designed for Large-Scale Feedback Analysis Through a Natural Language Interface - MarkTechPost,https://news.google.com/rss/articles/CBMixQFodHRwczovL3d3dy5tYXJrdGVjaHBvc3QuY29tLzIwMjQvMDMvMjcvcmVzZWFyY2hlcnMtYXQtbWljcm9zb2Z0LXByb3Bvc2UtYWxsaGFuZHMtYS1ub3ZlbC1tYWNoaW5lLWxlYXJuaW5nLWZyYW1ld29yay1kZXNpZ25lZC1mb3ItbGFyZ2Utc2NhbGUtZmVlZGJhY2stYW5hbHlzaXMtdGhyb3VnaC1hLW5hdHVyYWwtbGFuZ3VhZ2UtaW50ZXJmYWNlL9IByQFodHRwczovL3d3dy5tYXJrdGVjaHBvc3QuY29tLzIwMjQvMDMvMjcvcmVzZWFyY2hlcnMtYXQtbWljcm9zb2Z0LXByb3Bvc2UtYWxsaGFuZHMtYS1ub3ZlbC1tYWNoaW5lLWxlYXJuaW5nLWZyYW1ld29yay1kZXNpZ25lZC1mb3ItbGFyZ2Utc2NhbGUtZmVlZGJhY2stYW5hbHlzaXMtdGhyb3VnaC1hLW5hdHVyYWwtbGFuZ3VhZ2UtaW50ZXJmYWNlLz9hbXA?oc=5,https://da.gd/KtGhK
GN:T:ML,Decoding AI: Dive Deep Into Neural Networks and Create Your Own from Scratch! - hackernoon,https://news.google.com/rss/articles/CBMiYmh0dHBzOi8vaGFja2Vybm9vbi5jb20vZGVjb2RpbmctYWktZGl2ZS1kZWVwLWludG8tbmV1cmFsLW5ldHdvcmtzLWFuZC1jcmVhdGUteW91ci1vd24tZnJvbS1zY3JhdGNo0gEA?oc=5,https://da.gd/jkUuv
GN:T:ML,Machine-learning-assisted multiscale modeling strategy for predicting mechanical properties of carbon fiber reinforced polymers - ScienceDirect,https://news.google.com/rss/articles/CBMiR2h0dHBzOi8vd3d3LnNjaWVuY2VkaXJlY3QuY29tL3NjaWVuY2UvYXJ0aWNsZS9hYnMvcGlpL1MwMjY2MzUzODI0MDAwMjUz0gEA?oc=5,https://da.gd/YaOU9
GN:T:ML,Predictive Minisci late stage functionalization with transfer learning - Nature,https://news.google.com/rss/articles/CBMiMmh0dHBzOi8vd3d3Lm5hdHVyZS5jb20vYXJ0aWNsZXMvczQxNDY3LTAyMy00MjE0NS0x0gEA?oc=5,https://da.gd/vOwtZ
GN:T:ML,A vehicular network based intelligent transport system for smart cities using machine learning algorithms | Scientific Reports - Nature,https://news.google.com/rss/articles/CBMiMmh0dHBzOi8vd3d3Lm5hdHVyZS5jb20vYXJ0aWNsZXMvczQxNTk4LTAyMy01MDkwNi030gEA?oc=5,https://da.gd/K6wHZj
