feed,title,long_url,short_url
GN:T:CC,Zara founder Ortega raises bet on renewables with potential Repsol deal - sources - Reuters,https://news.google.com/rss/articles/CBMiiQFodHRwczovL3d3dy5yZXV0ZXJzLmNvbS9idXNpbmVzcy9yZXRhaWwtY29uc3VtZXIvemFyYS1mb3VuZGVyLW9ydGVnYS1yYWlzZXMtYmV0LXJlbmV3YWJsZXMtd2l0aC1wb3RlbnRpYWwtcmVwc29sLWRlYWwtc291cmNlcy0yMDIzLTExLTA4L9IBAA?oc=5,https://da.gd/Ye8D
GN:T:CC,"Analysis | GOP presidential candidates reject link between disasters, warming - The Washington Post",https://news.google.com/rss/articles/CBMidWh0dHBzOi8vd3d3Lndhc2hpbmd0b25wb3N0LmNvbS9wb2xpdGljcy8yMDIzLzExLzA4L2dvcC1wcmVzaWRlbnRpYWwtY2FuZGlkYXRlcy1yZWplY3QtbGluay1iZXR3ZWVuLWRpc2FzdGVycy13YXJtaW5nL9IBAA?oc=5,https://da.gd/bzEa3
GN:T:CC,'Like something out of a Hollywood movie': Scientists say 2023 likely to be the hottest year on record - CNBC,https://news.google.com/rss/articles/CBMiaWh0dHBzOi8vd3d3LmNuYmMuY29tLzIwMjMvMTEvMDgvY2xpbWF0ZS1zY2llbnRpc3RzLXdhcm4tMjAyMy1saWtlbHktdG8tYmUtdGhlLWhvdHRlc3QteWVhci1vbi1yZWNvcmQuaHRtbNIBbWh0dHBzOi8vd3d3LmNuYmMuY29tL2FtcC8yMDIzLzExLzA4L2NsaW1hdGUtc2NpZW50aXN0cy13YXJuLTIwMjMtbGlrZWx5LXRvLWJlLXRoZS1ob3R0ZXN0LXllYXItb24tcmVjb3JkLmh0bWw?oc=5,https://da.gd/KHquO
GN:T:CC,Humanity Keeps Upping Fossil-Fuel Production Despite Climate Pledge - WSJ - The Wall Street Journal,https://news.google.com/rss/articles/CBMibGh0dHBzOi8vd3d3Lndzai5jb20vc2NpZW5jZS9lbnZpcm9ubWVudC9mb3NzaWwtZnVlbC1lbWlzc2lvbnMtcGxlZGdlLWNsaW1hdGUtd2FybWluZy11bml0ZWQtbmF0aW9ucy0wMzM0Yjg2MtIBAA?oc=5,https://da.gd/2DL0z
GN:T:CC,Why a climate researcher pushed the limits of low-carbon travel — and his employer's patience - Nature,https://news.google.com/rss/articles/CBMiMmh0dHBzOi8vd3d3Lm5hdHVyZS5jb20vYXJ0aWNsZXMvZDQxNTg2LTAyMy0wMzQ5Ni0z0gEA?oc=5,https://da.gd/siagT
GN:T:CC,"A New Law Supercharged Electric Car Manufacturing, but Not Sales - The New York Times",https://news.google.com/rss/articles/CBMiW2h0dHBzOi8vd3d3Lm55dGltZXMuY29tLzIwMjMvMTEvMDgvYnVzaW5lc3MvZW5lcmd5LWVudmlyb25tZW50L2VsZWN0cmljLXZlaGljbGVzLWJpZGVuLmh0bWzSAQA?oc=5,https://da.gd/KyFm
GN:T:CC,"Virginia Democrats' wins thwart Youngkin on abortion, taxes, climate - The Washington Post",https://news.google.com/rss/articles/CBMiX2h0dHBzOi8vd3d3Lndhc2hpbmd0b25wb3N0LmNvbS9kYy1tZC12YS8yMDIzLzExLzA4L3ZpcmdpbmlhLXNlbmF0ZS1ob3VzZS1lbGVjdGlvbi1yZXN1bHRzLTIwMjMv0gEA?oc=5,https://da.gd/VW8Dh
