feed,title,long_url,short_url
RS,Application of radical mastectomy in ambulatory surgery centres under COVID-19,https://www.researchsquare.com/article/rs-2268680/latest,https://bit.ly/3gfX7MS
RS,Relapse of Monoclonal Gammopathy of Renal Significance after mRNA Covid-19 vaccination: a case report,https://www.researchsquare.com/article/rs-2247921/latest,https://bit.ly/3tJr0bo
RS,"Anxiety, depression and perceived social support among covid-19 patients admitted to a Covid Care Centre in Uttarakhand, India",https://www.researchsquare.com/article/rs-2209151/latest,https://bit.ly/3tFJeur
RS,A randomized controlled trial of adjuvant inhalable sodium bicarbonate role in treatment of COVID-19,https://www.researchsquare.com/article/rs-2214180/latest,https://bit.ly/3gdUbjP
RS,Characterization of tungiasis infection and morbidity in Kenya reveals increase in disease burden during COVID-19 school closures,https://www.researchsquare.com/article/rs-2251725/latest,https://bit.ly/3EKulNH
RS,"Trajectories of child mental health, physical activity and screen-time during the COVID-19 pandemic considering different family situations: results from a longitudinal birth cohort",https://www.researchsquare.com/article/rs-2276781/latest,https://bit.ly/3Gs5ZJO
RS,A rise in social media use in adolescents during the COVID-19 pandemic: the French validation of the Bergen Social Media Addiction Scale in a Canadian cohort,https://www.researchsquare.com/article/rs-2244772/latest,https://bit.ly/3tGrOO3
RS,Predictors of Long-term Muscle Weakness in Survivors of Covid-19 Acute Respiratory Distress Syndrome,https://www.researchsquare.com/article/rs-2256613/latest,https://bit.ly/3EIcaIy
RS,Diagnostic delay in multiple myeloma: the legacy of the COVID-19 pandemic,https://www.researchsquare.com/article/rs-2230271/latest,https://bit.ly/3ggAQyr
