feed,title,long_url,short_url
GN:S:C,"Climate change, population increase fuel looming water crisis: WMO - UN News",https://news.un.org/en/story/2021/10/1102162,
GN:S:C,Brookfield among first to endorse regional Climate Action Plan - Riverside Brookfield Landmark - Riverside Brookfield Landmark,https://www.rblandmark.com/2021/10/05/brookfield-among-first-to-endorse-regional-climate-action-plan/,
GN:S:C,Extreme rare lightning related to climate change says San Diego scientist - CBS News 8,https://www.cbs8.com/article/weather/severe-weather/extreme-rare-lightning-related-to-climate-change-says-san-diego-scientist/509-f377c03d-1da5-4089-8167-7c593a8a5191,
GN:S:C,Rich countries fall $10 billion short in climate finance pledges - pressherald,https://www.pressherald.com/2021/10/05/rich-countries-fall-10-billion-short-in-climate-finance-pledges/,
GN:S:C,"SEC Eyes Phased Approach to Climate Reporting, Gensler Says - Bloomberg Law",https://news.bloomberglaw.com/esg/sec-eyes-phased-approach-to-climate-reporting-gensler-says,
