feed,title,long_url,short_url
GN:T:WP,German Wind Power Hits Record as Storms Batter North Europe - Bloomberg,https://news.google.com/rss/articles/CBMibmh0dHBzOi8vd3d3LmJsb29tYmVyZy5jb20vbmV3cy9hcnRpY2xlcy8yMDIzLTEyLTIxL2dlcm1hbi13aW5kLXBvd2VyLWhpdHMtcmVjb3JkLWFzLXN0b3Jtcy1iYXR0ZXItbm9ydGgtZXVyb3Bl0gEA?oc=5,https://da.gd/f7AV
GN:T:WP,Bachmann develops Structural Health Management system to support wind energy in Antarctica - Windtech International,https://news.google.com/rss/articles/CBMijgFodHRwczovL3d3dy53aW5kdGVjaC1pbnRlcm5hdGlvbmFsLmNvbS9wcm9kdWN0LW5ld3MvYmFjaG1hbm4tZGV2ZWxvcHMtc3RydWN0dXJhbC1oZWFsdGgtbWFuYWdlbWVudC1zeXN0ZW0tdG8tc3VwcG9ydC13aW5kLWVuZXJneS1pbi1hbnRhcmN0aWNh0gEA?oc=5,https://da.gd/JVsn
GN:T:WP,"ZEBRA consortium unveils second recyclable wind turbine blade, advances sustainability in wind energy - Arkema",https://news.google.com/rss/articles/CBMihwFodHRwczovL3d3dy5hcmtlbWEuY29tL2dsb2JhbC9lbi9tZWRpYS9uZXdzbGlzdC9uZXdzL2dsb2JhbC9jb3Jwb3JhdGUvMjAyMy8yMDIzMTIyMC16ZWJyYS11bnZlaWxzLXNlY29uZC1yZWN5Y2xhYmxlLXdpbmQtdHVyYmluZS1ibGFkZS_SAQA?oc=5,https://da.gd/XXlOs
GN:T:WP,FEATURE | World's first artificial energy island to be built off Belgium - Baird Maritime,https://news.google.com/rss/articles/CBMipQFodHRwczovL3d3dy5iYWlyZG1hcml0aW1lLmNvbS93b3JrLWJvYXQtd29ybGQvb2Zmc2hvcmUtd29ybGQvb2Zmc2hvcmUtcmVuZXdhYmxlcy9vZmZzaG9yZS13aW5kL2ZlYXR1cmUtd29ybGRzLWZpcnN0LWFydGlmaWNpYWwtZW5lcmd5LWlzbGFuZC10by1iZS1idWlsdC1vZmYtYmVsZ2l1bS_SAQA?oc=5,https://da.gd/yWzmuA
GN:T:WP,CrossWind's 759MW Dutch offshore wind farm goes online - Power Technology,https://news.google.com/rss/articles/CBMiSWh0dHBzOi8vd3d3LnBvd2VyLXRlY2hub2xvZ3kuY29tL25ld3MvY3Jvc3N3aW5kLWR1dGNoLW9mZnNob3JlLXdpbmQtZmFybS_SAQA?oc=5,https://da.gd/FilY9
GN:T:WP,Marine multi-use in practice: comparing offshore wind and hydrogen production applications - Stockholm Environment Institute,https://news.google.com/rss/articles/CBMiQGh0dHBzOi8vd3d3LnNlaS5vcmcvcHVibGljYXRpb25zL21hcmluZS1tdWx0aS11c2Utd2luZC1oeWRyb2dlbi_SAQA?oc=5,https://da.gd/gXmKs
GN:T:WP,China bans export of rare earths processing technologies - Reuters,https://news.google.com/rss/articles/CBMibWh0dHBzOi8vd3d3LnJldXRlcnMuY29tL21hcmtldHMvY29tbW9kaXRpZXMvY2hpbmEtYmFucy1leHBvcnQtcmFyZS1lYXJ0aHMtcHJvY2Vzc2luZy10ZWNobm9sb2dpZXMtMjAyMy0xMi0yMS_SAQA?oc=5,https://da.gd/e1iM
GN:T:WP,"Bio-cash: How a cow-powered, controversial fuel ingests Wisconsin clean energy dollars - Tone Madison",https://news.google.com/rss/articles/CBMidmh0dHBzOi8vdG9uZW1hZGlzb24uY29tL2FydGljbGVzL2Jpby1jYXNoLWhvdy1hLWNvdy1wb3dlcmVkLWNvbnRyb3ZlcnNpYWwtZnVlbC1pbmdlc3RzLXdpc2NvbnNpbi1jbGVhbi1lbmVyZ3ktZG9sbGFycy_SAQA?oc=5,https://da.gd/Z1hC
GN:T:WP,National Energy Commission publishes its Annual Regulatory Plan for the year 2024 - BNamericas English,https://news.google.com/rss/articles/CBMidGh0dHBzOi8vd3d3LmJuYW1lcmljYXMuY29tL2VuL25ld3MvbmF0aW9uYWwtZW5lcmd5LWNvbW1pc3Npb24tcHVibGlzaGVzLWl0cy1hbm51YWwtcmVndWxhdG9yeS1wbGFuLWZvci10aGUteWVhci0yMDI00gEA?oc=5,https://da.gd/XqJg
GN:T:WP,Prysmian to Add Two More Vessels to Its CLV Fleet - Offshore WIND,https://news.google.com/rss/articles/CBMiWmh0dHBzOi8vd3d3Lm9mZnNob3Jld2luZC5iaXovMjAyMy8xMi8yMS9wcnlzbWlhbi10by1hZGQtdHdvLW1vcmUtdmVzc2Vscy10by1pdHMtY2x2LWZsZWV0L9IBAA?oc=5,https://da.gd/QB68y
GN:T:WP,Will corporate climate coalitions deliver? A progress report on 6 buyer groups - GreenBiz,https://news.google.com/rss/articles/CBMiaWh0dHBzOi8vd3d3LmdyZWVuYml6LmNvbS9hcnRpY2xlL3dpbGwtY29ycG9yYXRlLWNsaW1hdGUtY29hbGl0aW9ucy1kZWxpdmVyLXByb2dyZXNzLXJlcG9ydC02LWJ1eWVyLWdyb3Vwc9IBAA?oc=5,https://da.gd/Ivzgb
