feed,title,long_url,short_url
GN:T:RE,"PGE uses batteries to store solar, wind power at first-in-the-nation facility - KGW",https://www.kgw.com/article/tech/science/environment/pge-solar-wind-batteries-morrow-county-facility/283-54c5a68a-c6d5-4c6a-b8ba-2fd7bdf47d21,
GN:T:RE,Solar panels are dying in Austin; what now? - KXAN,https://www.kxan.com/weather-traffic-qas/solar-panels-are-dying-in-austin-what-now/,
GN:T:RE,USGBC announces more than 23 million square feet of LEED certified net zero space - Building Design + Construction,https://www.bdcnetwork.com/usgbc-announces-more-23-million-square-feet-leed-certified-net-zero-space,
GN:T:RE,First-of-its-kind facility in Oregon stores wind and solar power - KGW News,https://www.youtube.com/watch?v=EXiqLBGrKJ4,
GN:T:RE,This Dutch solar car could drive months without a recharge - TimesLIVE,https://www.timeslive.co.za/motoring/new-models/2022-06-16-this-dutch-solar-car-could-drive-months-without-a-recharge/,
GN:T:RE,Malaysia's Petronas launches clean energy firm to lead carbon-free push - Reuters,https://www.reuters.com/markets/commodities/malaysias-petronas-launches-clean-energy-firm-lead-carbon-free-push-2022-06-16/,
GN:T:RE,China tests world-first full-function space solar verification tower - New Atlas,https://newatlas.com/energy/china-xidian-space-solar-test/,
GN:T:RE,How does the land use of different electricity sources compare? - Our World in Data,https://ourworldindata.org/land-use-per-energy-source,
GN:T:RE,Biden halts solar tariffs for two years. What's next? - pv magazine International,https://www.pv-magazine.com/2022/06/15/biden-halts-solar-tariffs-for-two-years-whats-next/,
