feed,title,long_url,short_url
GN:S:C,"Climate Science: The new clock is ticking, and it's in Union Square - Plattsburgh Press Republican",https://www.pressrepublican.com/opinion/climate-science-the-new-clock-is-ticking-and-it-s-in-union-square/article_0fa69274-af74-11eb-9127-3717a669d62b.html,
GN:S:C,"Warming Trends: Farming for City Dwellers, an Upbeat Climate Podcast and Soil Bacteria That May Outsmart Warming - InsideClimate News",https://insideclimatenews.org/news/08052021/warming-trends-farming-for-city-dwellers-an-upbeat-climate-podcast-and-soil-bacteria-that-may-outsmart-warming/,
GN:S:C,Weather talk: Jets contribute to air pollution and climate change - INFORUM,https://www.inforum.com/news/weather/7016814-Weather-talk-Jets-contribute-to-air-pollution-and-climate-change,
GN:S:C,EKU graduate leading in local climate change research - The Eastern Progress Online,https://www.easternprogress.com/lifestyles/eku-graduate-leading-in-local-climate-change-research/article_4a811b3a-af6a-11eb-b5c7-e7be29e00647.html,
GN:S:C,"Nation NASA's new chief big on climate, moon landing - USA TODAY",https://www.usatoday.com/videos/news/nation/2021/05/07/nasas-new-chief-big-climate-moon-landing/4996878001/,
