feed,title,long_url,short_url
GN:S:C,Covering swimming came with a climate that can't be taught in school [column] - LancasterOnline,https://news.google.com/rss/articles/CBMiiwJBVV95cUxQb0kwZVZFdVhSdEFjUDhnbXJkUU9uTmdTb24taFVLMUF5eUN3NkNwanM2a2NBSUF5YTRjVWVlZFdpeTRwaV9BWlpCaVpfT2N0d3kwVmxSYS1rRHFmd0xsVGlYdDB0c2QyOTMydkJQal9GRUl3aGl3aWc0R3o0R2tMTlp0elZ1cFY3ZFlKbXZhZER3d1kycHhNckRhNy0ta05MSzlOdGZEZ2RZUXBBbU9JRGtfWWROQWJIU0tOWXZrSDJLaEVrcHAtVlduNXc2NWwwX0Q0TjI1UWdNTTBEaEdmQ2V0ekVOSzZKT3NLcDlocWk1U0dUT2Mtd05SMVpJc1g4amFyUUQwUkFiMTg?oc=5,
GN:S:C,"Climate change is coming for Rudolph, your hot chocolate and your white Christmas - PhillyVoice",https://news.google.com/rss/articles/CBMilwFBVV95cUxOUjFjZ3E3YkpmTmpFM1R3cE0taTJoTFppMXJveEV2R21yRnJITE1LSVRUVWhCTnVRVERZWFZwSUg1UFUzWTV1NjlDb1FzSlRscmU2YTFDS2o4dFhOaE5aNDFyMVZpdi10YVFTaTZfa24tcmZPN0ZBSTRaTHlFUVlvWVN0MC1XYVdhTkI5anVrVnpHMG9sS09Z?oc=5,
GN:S:C,From the Birthplace of Earth Day: A Warning and a Way Forward - The Santa Barbara Independent,https://news.google.com/rss/articles/CBMiogFBVV95cUxQT2RMeWxNVV9zYVVxYkVIZTVLbkdBd1lfSVhpalpDb21xUXFxTUI0MGlWYlBBZnVyeW42Nk8tcGJUSndabkNYYVB0MXdmcU9kWjkxZ1lSOVZzT3pVVHN3VXZXOFNJWi1uN2h2ekZGcjc2bUFrcEg5RXhMN3lRNWJYNDZhbFM3UkVmakc4TXlvZ1M5UmpNUXJGUFJtSTdkR0IxQkE?oc=5,
GN:S:C,"Córdoba promotes climate action from classrooms, recognizing three technical schools for their environmental projects - Noticias Ambientales",https://news.google.com/rss/articles/CBMi9wFBVV95cUxQMldOY2hqWW5ERFNkbTZiZUpnaEVWaUd6V0p5NDRFVjQ3a1pCZXpwLVQzclFrb2Z4TWo2SWNRSXl0QkZhdVFuVW0ydkVBNUp0M2Z4OVhIeHAzaVpLcy01STJFdFRZeEwxaGdmNDdCY01Ga0V0T0NDOVc0bkxYcjJESEstWjVnUDZheVY4em5kcFZyVzF4WkdkSVJ3QmJsT29heWFKYWRTOExCUW00LU0tT2dyYno2SXQ3dHBkS2c0cWlCSE9xMmI0Z1NzVjNGQTd0bmU2czdseTlJaVhLMU1KMkxyYlJTa3BlY0dYNjhtTzk3Y0FWVl9J?oc=5,
GN:S:C,Sea turtles change their nesting beaches in the Mediterranean as a result of climate change - Noticias Ambientales,https://news.google.com/rss/articles/CBMizAFBVV95cUxOeWZyT01fenQ5Q01tMEdiamhZYjVFZFNLVmhRWjFpQ2RKdWh5TmJtam1OX1o2N0RuTC0tXzJBMzZPcGN3ZHNhdUJUZ3hKZnBEZVNZVU9oSEVnRWVnTk5lVFZsd0NVc3RLc0JESXpVelRGNEhIaTBIM1o3cFhDbFp2clpVTDNoZUVlTmpTUS1QWHJGNGRtU3RsVDdQelFQU1ZnV3lEV2NDNXJZWmNZa0ZzVDduT2Q3VjlyQ2syNndPSFcwRE1VU2dIX2FNYXE?oc=5,
GN:S:C,"'Too much regulation, not enough action': Carney rebuffs Trudeau's climate policies - cbc",https://news.google.com/rss/articles/CBMifkFVX3lxTE5yZjVUNm1SRDdzM1RlWmhxREN5UHRNMDBvUENaSmxWMW4tTGZLaDczS1JKRDVKZGI1c29lQ1JXdUxDSjVmT25GN0dTUExEaUdkLTdvanpSSW5Pb0tfVHdsNkJpTk03eTZVWUxneEtMMEQwaE5jU3I5RUFJTUZSdw?oc=5,
