feed,title,long_url,short_url
MX,China locks down city of 1.2 million after three virus cases,https://medicalxpress.com/news/2022-01-china-city-million-virus-cases.html,https://j.mp/31ot2mN
MX,Philippines widens COVID restrictions outside capital,https://medicalxpress.com/news/2022-01-philippines-widens-covid-restrictions-capital.html,https://j.mp/3HCa4Iz
MX,Why are so many vaccinated people getting COVID-19 lately?,https://medicalxpress.com/news/2022-01-vaccinated-people-covid-.html,https://j.mp/3FNTJAd
MX,"Australia's COVID-19 cases, hospitalizations hit new records",https://medicalxpress.com/news/2022-01-australia-covid-cases-hospitalizations.html,https://j.mp/3ESprLe
MX,"Japan leader promises boosters, new measures against omicron",https://medicalxpress.com/news/2022-01-japan-leader-boosters-omicron.html,https://j.mp/3FUHC4s
