feed,title,long_url,short_url
GN:T:WP,Wind farm commissioning spree in Middle East and Africa - Windpower Monthly,https://www.windpowermonthly.com/article/1794409/wind-farm-commissioning-spree-middle-east-africa,
GN:T:WP,This giant 'water battery' under the Alps could be a game-changer for renewable energy in Europe - CNN International,https://edition.cnn.com/2022/08/01/world/water-battery-switzerland-renewable-energy-climate-scn-hnk-spc-intl/index.html,
GN:T:WP,"More states back offshore wind, citing economic potential - The Union Leader",https://www.unionleader.com/news/business/energy/more-states-back-offshore-wind-citing-economic-potential/article_ddb89282-3360-5b55-ba15-84e8d4d202e6.html,
GN:T:WP,US solar and wind projects stalled in Q2. What happened? - Canary Media,https://www.canarymedia.com/articles/clean-energy/us-solar-and-wind-projects-stalled-in-q2-what-happened,
GN:T:WP,The innovations solving renewable energy's biggest problem - CNN,https://www.cnn.com/2022/08/01/world/gallery/innovations-renewable-energy-storage-hnk-spc-intl/index.html,
GN:T:WP,Climate Policy Sent Back To Baker With Sweeteners - NBC10 Boston,https://www.nbcboston.com/news/local/climate-policy-sent-back-to-baker-with-sweeteners/2795104/,
GN:T:WP,ABB's subsea technology wins accolade for saving power and cutting emissions - Offshore Energy,https://www.offshore-energy.biz/abbs-subsea-technology-wins-accolade-for-saving-power-and-cutting-emissions/,
GN:T:WP,German spot power to remain above EUR 400 on low wind - Montel,https://www.montelnews.com/news/1339445/german-spot-power-to-remain-above-eur-400-on-low-wind,
GN:T:WP,EDP to sell stake in hydropower JV to China Three Gorges - Renewables Now,https://renewablesnow.com/news/edp-to-sell-stake-in-hydropower-jv-to-china-three-gorges-793329/,
GN:T:WP,Onshore and Offshore Surveys Wrap Up at Australia's First Offshore Wind Farm - Offshore WIND,https://www.offshorewind.biz/2022/08/01/onshore-and-offshore-surveys-wrap-up-at-australias-first-offshore-wind-farm/,
GN:T:WP,Owners of German utility Steag aim at full sale - spokesman - Reuters,https://www.reuters.com/business/energy/owners-german-utility-steag-aim-full-sale-spokesman-2022-08-01/,
GN:T:WP,First recyclable SGRE offshore blades spinning at RWE project in Germany | Recharge - Recharge,https://www.rechargenews.com/wind/first-recyclable-sgre-offshore-blades-spinning-at-rwe-project-in-germany/2-1-1269319,
GN:T:WP,Rosneft begins production drill at Vostok Oil projects Payakhskoye field - Business Standard,https://www.business-standard.com/article/companies/rosneft-begins-production-drill-at-vostok-oil-project-s-payakhskoye-field-122080100470_1.html,
GN:T:WP,"Bajaj Auto 2-wheeler sales drop by 5 pc to 3,15,054 units in July - DTNEXT",https://www.dtnext.in/business/2022/08/01/bajaj-auto-2-wheeler-sales-drop-by-5-pc-to-315054-units-in-july,
GN:T:WP,"After 40 years, Kaminoseki nuclear power project faces bleak future - The Japan Times",https://www.japantimes.co.jp/news/2022/08/01/national/nuclear-plant-kaminoseki/,
