feed,title,long_url,short_url
GN:T:CC,Solar is growing faster than any electricity source as Big Tech seeks clean energy for data centers - CNBC,https://news.google.com/rss/articles/CBMic2h0dHBzOi8vd3d3LmNuYmMuY29tLzIwMjQvMDYvMTkvc29sYXItaXMtZ3Jvd2luZy1mYXN0ZXItdGhhbi1hbnktZW5lcmd5LXNvdXJjZS1hcy1jbGVhbi1wb3dlci1mb3ItZGF0YS1jZW50ZXJzLmh0bWzSAQA?oc=5,https://da.gd/rHOL
GN:T:CC,GE Vernova CEO Scott Strazik on what's really holding back renewable energy - Fast Company,https://news.google.com/rss/articles/CBMiTmh0dHBzOi8vd3d3LmZhc3Rjb21wYW55LmNvbS85MTE0MjY1Mi9nZS12ZXJub3ZhLWNlby1zY290dC1zdHJhemlrLWdyZWVuLWVuZXJnedIBAA?oc=5,https://da.gd/35W3p9
GN:T:CC,Climate change linked to brain damage in children — and poor kids are at greater risk - Salon,https://news.google.com/rss/articles/CBMidmh0dHBzOi8vd3d3LnNhbG9uLmNvbS8yMDI0LzA2LzE4L2NsaW1hdGUtY2hhbmdlLWxpbmtlZC10by1icmFpbi1kYW1hZ2UtaW4tY2hpbGRyZW4tLWFuZC1wb29yLWtpZHMtYXJlLWF0LWdyZWF0ZXItcmlzay_SAQA?oc=5,https://da.gd/Fmue1
GN:T:CC,Stonehenge sprayed with paint by environmental protesters - DW (English),https://news.google.com/rss/articles/CBMiWmh0dHBzOi8vd3d3LmR3LmNvbS9lbi9zdG9uZWhlbmdlLXNwcmF5ZWQtd2l0aC1wYWludC1ieS1lbnZpcm9ubWVudGFsLXByb3Rlc3RlcnMvYS02OTQxNDc3MdIBWmh0dHBzOi8vYW1wLmR3LmNvbS9lbi9zdG9uZWhlbmdlLXNwcmF5ZWQtd2l0aC1wYWludC1ieS1lbnZpcm9ubWVudGFsLXByb3Rlc3RlcnMvYS02OTQxNDc3MQ?oc=5,https://da.gd/8cDyX
GN:T:CC,5 things that may make you feel worse during extreme heat - The Washington Post,https://news.google.com/rss/articles/CBMiZWh0dHBzOi8vd3d3Lndhc2hpbmd0b25wb3N0LmNvbS9jbGltYXRlLWVudmlyb25tZW50LzIwMjQvMDYvMTkvaGVhdC10aXBzLWFsY29ob2wtY2FmZmVpbmUtbWVkaWNhdGlvbnMv0gEA?oc=5,https://da.gd/fU2nEY
GN:T:CC,"This election season, vote pro-life by voting pro-creation - National Catholic Reporter",https://news.google.com/rss/articles/CBMiYGh0dHBzOi8vd3d3Lm5jcm9ubGluZS5vcmcvZWFydGhiZWF0L3ZpZXdwb2ludHMvZWxlY3Rpb24tc2Vhc29uLXZvdGUtcHJvLWxpZmUtdm90aW5nLXByby1jcmVhdGlvbtIBAA?oc=5,https://da.gd/n1kSc
GN:T:CC,"Mayor Cherelle Parker has promised to make Philly 'safer, cleaner, and greener.' Here's what she's doing on the 'green' part. - The Philadelphia Inquirer",https://news.google.com/rss/articles/CBMidGh0dHBzOi8vd3d3LmlucXVpcmVyLmNvbS9wb2xpdGljcy9waGlsYWRlbHBoaWEvbWF5b3ItY2hlcmVsbGUtcGFya2VyLWNsZWFuLWdyZWVuLWNsaW1hdGUtY2hhbmdlLWNhcmJvbi0yMDI0MDYxOS5odG1s0gEA?oc=5,https://da.gd/jEdg8
