feed,title,long_url,short_url
MX,"In blow to Biden, Supreme Court blocks vaccine mandate for businesses",https://medicalxpress.com/news/2022-01-biden-supreme-court-blocks-vaccine.html,https://j.mp/3fpMSBm
MX,Hong Kong airport bans transit passengers from 153 countries,https://medicalxpress.com/news/2022-01-hong-kong-airport-transit-passengers.html,https://j.mp/3rgJu1o
MX,Quebec to lift COVID-19 curfew on Monday,https://medicalxpress.com/news/2022-01-quebec-covid-curfew-monday.html,https://j.mp/3nsS7Vv
MX,Masks rules get tighter in Europe in winter's COVID-19 wave,https://medicalxpress.com/news/2022-01-masks-tighter-europe-winter-covid-.html,https://j.mp/34RgdCQ
MX,WHO approves two new Covid-19 treatments,https://medicalxpress.com/news/2022-01-covid-treatments.html,https://j.mp/3KlZzeW
MX,"One in ten people may still be infectious for COVID after ten days, new research indicates",https://medicalxpress.com/news/2022-01-ten-people-infectious-covid-days.html,https://j.mp/3A0zcWR
MX,SKorea slightly eases distancing but warns of omicron surge,https://medicalxpress.com/news/2022-01-skorea-slightly-eases-distancing-omicron.html,https://j.mp/3K9hR2S
