feed,title,long_url,short_url
MX,Data supports early COVID-19 vaccination for essential workers,https://medicalxpress.com/news/2021-10-early-covid-vaccination-essential-workers.html,https://j.mp/3vcTyd9
MX,High BMI independently associated with death and longer ICU stay for COVID patients,https://medicalxpress.com/news/2021-10-high-bmi-independently-death-longer.html,https://j.mp/3lDqtEx
MX,WHO unveils new pandemic pathogen sleuth squad,https://medicalxpress.com/news/2021-10-unveils-pandemic-pathogen-sleuth-squad.html,https://j.mp/3mNylCZ
MX,"Russia, WHO differ on when approval will come for Sputnik V",https://medicalxpress.com/news/2021-10-russia-differ-sputnik.html,https://j.mp/3mQBl1h
MX,Solving mystery of rare cancers directly caused by HIV,https://medicalxpress.com/news/2021-10-mystery-rare-cancers-hiv.html,https://j.mp/3FLfHUY
MX,Gold mine workers face risk of death in the community more than double that of non-miners,https://medicalxpress.com/news/2021-10-gold-workers-death-non-miners.html,https://j.mp/2YVqTgW
MX,Antibodies improve nanoparticle delivery of therapeutic nucleic acids,https://medicalxpress.com/news/2021-10-antibodies-nanoparticle-delivery-therapeutic-nucleic.html,https://j.mp/3lCvwFc
