feed,title,long_url,short_url
GN:S:C,Climate tech crucial in transitioning away from fossil fuels - Energy Digital,https://news.google.com/rss/articles/CBMiX2h0dHBzOi8vZW5lcmd5ZGlnaXRhbC5jb20vYXJ0aWNsZXMvY2xpbWF0ZS10ZWNoLWNydWNpYWwtaW4tdHJhbnNpdGlvbmluZy1hd2F5LWZyb20tZm9zc2lsLWZ1ZWxz0gEA?oc=5,https://da.gd/h4BZ
GN:S:C,Opinion: Don't blame kids for climate change - CT Insider,https://news.google.com/rss/articles/CBMiXmh0dHBzOi8vd3d3LmN0aW5zaWRlci5jb20vb3Bpbmlvbi9hcnRpY2xlL29waW5pb24tZG9uLXQtYmxhbWUta2lkcy1jbGltYXRlLWNoYW5nZS0xODU1NTU5My5waHDSAQA?oc=5,https://da.gd/EjYRqN
GN:S:C,Rich nations won’t meet energy transition goals by shunning Chinese firms - South China Morning Post,https://news.google.com/rss/articles/CBMicmh0dHBzOi8vd3d3LnNjbXAuY29tL2NvbW1lbnQvb3Bpbmlvbi9hcnRpY2xlLzMyNDUxMDcvZmFjZS1pdC1jaGluYXMtY2xlYW4tZW5lcmd5LWZpcm1zLWFyZS1rZXktY29wMjgtY2xpbWF0ZS1nb2Fsc9IBcmh0dHBzOi8vYW1wLnNjbXAuY29tL2NvbW1lbnQvb3Bpbmlvbi9hcnRpY2xlLzMyNDUxMDcvZmFjZS1pdC1jaGluYXMtY2xlYW4tZW5lcmd5LWZpcm1zLWFyZS1rZXktY29wMjgtY2xpbWF0ZS1nb2Fscw?oc=5,https://da.gd/elHTR
GN:S:C,Toxic drugs. Climate change. A health-care crisis. Here are the health stories we're watching in 2024 - CBC,https://news.google.com/rss/articles/CBMiV2h0dHBzOi8vd3d3LmNiYy5jYS9uZXdzL2hlYWx0aC8yMDI0LWhlYWx0aC1zdG9yaWVzLXRveGljLWRydWdzLWNsaW1hdGUtY2hhbmdlLTEuNzA1OTUyONIBIGh0dHBzOi8vd3d3LmNiYy5jYS9hbXAvMS43MDU5NTI4?oc=5,https://da.gd/WdDXt
GN:S:C,These are the ways rural Canadians are more vulnerable to climate change - CBC,https://news.google.com/rss/articles/CBMiPmh0dHBzOi8vd3d3LmNiYy5jYS9uZXdzL3NjaWVuY2UvcnVyYWwtY2xpbWF0ZS1jaGFuZ2UtMS43MDU5NDc40gEgaHR0cHM6Ly93d3cuY2JjLmNhL2FtcC8xLjcwNTk0Nzg?oc=5,https://da.gd/A8P9n
