feed,title,long_url,short_url
ArXiv:stat,Individualized Multi-Treatment Response Curves Estimation using RBF-net with Shared Neurons,https://arxiv.org/abs/2401.16571v1,
ArXiv:stat,Bayesian scalar-on-network regression with applications to brain functional connectivity,https://arxiv.org/abs/2401.16749v1,
ArXiv:stat,CAFCT: Contextual and Attentional Feature Fusions of Convolutional Neural Networks and Transformer for Liver Tumor Segmentation,https://arxiv.org/abs/2401.16886v1,
ArXiv:stat,An analytic approach for understanding mechanisms driving breakthrough infections,https://arxiv.org/abs/2401.17164v1,
ArXiv:stat,Joint model with latent disease age: overcoming the need for reference time,https://arxiv.org/abs/2401.17249v1,
ArXiv:stat,Multi-modal Molecule Structure-text Model for Text-based Retrieval and Editing,https://arxiv.org/abs/2212.10789v3,
