feed,title,long_url,short_url
ArXiv:math,Algebraic Complexity and Neurovariety of Linear Convolutional Networks,https://arxiv.org/abs/2401.16613,
ArXiv:math,Forms of biisometric operators and biorthogonality,https://arxiv.org/abs/2401.16790,
ArXiv:math,Sharp estimates for biorthogonal families to exponential functions associated to complex sequences without gap conditions,https://arxiv.org/abs/2401.17128,
ArXiv:math,Towards Optimal Grammars for RNA Structures,https://arxiv.org/abs/2401.16623,
ArXiv:math,Wasserstein contraction for the stochastic Morris-Lecar neuron model,https://arxiv.org/abs/2307.13362,
ArXiv:math,Universal Virasoro Constraints for Quivers with Relations,https://arxiv.org/abs/2310.18311,
ArXiv:math,Unrestricted Error-Type Codebook Generation for Error Correction Code in DNA Storage Inspired by NLP,https://arxiv.org/abs/2401.15915,
ArXiv:math,Optimal service resource management strategy for IoT-based health information system considering value co-creation of users,https://arxiv.org/abs/2204.02521,
ArXiv:math,"A relation between $(2,2m-1)$ minimal strings and the Virasoro minimal string",https://arxiv.org/abs/2401.06216,
