feed,title,long_url,short_url
GN:S:C,Climate change may not expand drylands - EurekAlert,https://www.eurekalert.org/pub_releases/2021-03/hjap-ccm031121.php,
GN:S:C,Climate Clash at the Commission? | Goodwin - JDSupra - JD Supra,https://www.jdsupra.com/legalnews/climate-clash-at-the-commission-3202290/,
GN:S:C,"Making green energy the default choice can help tackle climate change, study finds - Science Daily",https://www.sciencedaily.com/releases/2021/03/210311123507.htm,
GN:S:C,"Climate Change Damaging North America’s Largest Temperate Rainforest, Harming Salmon - CU Denver News",https://news.ucdenver.edu/climate-change-damaging-north-americas-largest-temperate-rainforest-harming-salmon/,
GN:S:C,Massachusetts Republicans slow push on climate change bill - MetroWest Daily News,https://www.metrowestdailynews.com/story/news/2021/03/11/senate-republicans-block-vote-climate-bill-say-process-rushed/4654936001/,
GN:S:C,Bills to address effects of climate change receive full committee support - Florida Politics,https://floridapolitics.com/archives/411388-bills-to-address-effects-of-climate-change-receive-full-committee-support,
GN:S:C,Mitigating climate change requires leadership in managing urban air quality – the Commonwealth is positioned to do just that! - AirQualityNews,https://airqualitynews.com/2021/03/11/mitigating-climate-change-requires-leadership-in-managing-urban-air-quality-the-commonwealth-is-positioned-to-do-just-that/,
GN:S:C,"Climate lawsuits, Mark Hofmann and the year in COVID on this week's 'Behind the Headlines' - Salt Lake Tribune",https://www.sltrib.com/news/2021/03/11/climate-lawsuits-mark/,
GN:S:C,Cleaner air could actually increase climate warming - E&T Magazine,https://eandt.theiet.org/content/articles/2021/03/air-pollution-reductions-could-actually-increase-climate-warming-study-finds/,
GN:S:C,Evolution of 'twilight zone' ocean creatures linked to climate change - Sky News,https://news.sky.com/story/evolution-of-twilight-zone-ocean-creatures-linked-to-climate-change-12242588,
GN:S:C,Stateside Chat: Working Toward an Equitable and Just Climate Future - Center For American Progress,https://www.americanprogress.org/events/2021/03/03/496672/stateside-chat-working-toward-equitable-just-climate-future/,
