feed,title,long_url,short_url
ArXiv:stat,Compressed Sensing MRI Reconstruction Regularized by VAEs with Structured Image Covariance,https://arxiv.org/abs/2210.14586v1,
ArXiv:stat,How precise are performance estimates for typical medical image segmentation tasks?,https://arxiv.org/abs/2210.14677v1,
ArXiv:stat,High-dimensional order-free multivariate spatial disease mapping,https://arxiv.org/abs/2210.14849v1,
ArXiv:stat,Combining cytotoxic agents with continuous dose levels in seamless phase I-II clinical trials,https://arxiv.org/abs/2109.14231v3,
ArXiv:stat,Estimating a Causal Exposure Response Function with a Continuous Error-Prone Exposure: A Study of Fine Particulate Matter and All-Cause Mortality,https://arxiv.org/abs/2109.15264v4,
ArXiv:stat,Online Critical-State Detection of Sepsis Among ICU Patients using Jensen-Shannon Divergence,https://arxiv.org/abs/2210.13639v2,
ArXiv:stat,Mitigating Health Data Poverty: Generative Approaches versus Resampling for Time-series Clinical Data,https://arxiv.org/abs/2210.13958v2,
