feed,title,long_url,short_url
GN:T:CC,Climate change could spell even worse winter storms in California - NPR,https://news.google.com/rss/articles/CBMid2h0dHBzOi8vd3d3Lm5wci5vcmcvMjAyMy8wNC8wOC8xMTY4NTI3MjEyL3doeS1jYWxpZm9ybmlhcy1mbG9vZHMtbWF5LWJlLW9ubHktYS10YXN0ZS1vZi13aGF0cy10by1jb21lLWluLWEtd2FybWVyLXdvcmxk0gEA?oc=5,https://da.gd/OdNmmr
GN:T:CC,Will climate change make N.J. more tornado-prone? Experts weigh in after 7 twister outbreak. - NJ,https://news.google.com/rss/articles/CBMif2h0dHBzOi8vd3d3Lm5qLmNvbS9uZXdzLzIwMjMvMDQvd2lsbC1jbGltYXRlLWNoYW5nZS1jYXVzZS1tb3JlLXRvcm5hZG9lcy1pbi1uai1leHBlcnRzLXdlaWdoLWluLWFmdGVyLWJpZy10d2lzdGVyLW91dGJyZWFrLmh0bWzSAY4BaHR0cHM6Ly93d3cubmouY29tL25ld3MvMjAyMy8wNC93aWxsLWNsaW1hdGUtY2hhbmdlLWNhdXNlLW1vcmUtdG9ybmFkb2VzLWluLW5qLWV4cGVydHMtd2VpZ2gtaW4tYWZ0ZXItYmlnLXR3aXN0ZXItb3V0YnJlYWsuaHRtbD9vdXRwdXRUeXBlPWFtcA?oc=5,https://da.gd/ayUpMF
GN:T:CC,Green energy jobs: Wind tech hiring boom doesn't require 4-year degree - USA TODAY,https://news.google.com/rss/articles/CBMihwFodHRwczovL3d3dy51c2F0b2RheS5jb20vc3RvcnkvbmV3cy9uYXRpb24vMjAyMy8wNC8wOC9ncmVlbi1lbmVyZ3ktam9icy13aW5kLXRlY2gtaGlyaW5nLWJvb20tZG9lc250LXJlcXVpcmUtNC15ZWFyLWRlZ3JlZS8xMTU1NjAwMjAwMi_SAQA?oc=5,https://da.gd/erCBaN
GN:T:CC,"Once considered an international issue, climate change needs reporters digging in at home - Poynter",https://news.google.com/rss/articles/CBMiW2h0dHBzOi8vd3d3LnBveW50ZXIub3JnL3JlcG9ydGluZy1lZGl0aW5nLzIwMjMvaG93LXRvLWNvdmVyLWNsaW1hdGUtY2hhbmdlLWxvY2FsLXJlcG9ydGluZy_SAQA?oc=5,https://da.gd/oKEHL
GN:T:CC,Video New study says climate change could be cause of more home runs this season - ABC News,https://news.google.com/rss/articles/CBMiYWh0dHBzOi8vYWJjbmV3cy5nby5jb20vR01BL0N1bHR1cmUvdmlkZW8vbmV3LXN0dWR5LWNsaW1hdGUtY2hhbmdlLWNhdXNlLWhvbWUtcnVucy1zZWFzb24tOTg0NDY1ODLSAQA?oc=5,https://da.gd/LBrB
GN:T:CC,Judge cancels Montana gas plant permit over climate impacts - The Associated Press,https://news.google.com/rss/articles/CBMiYmh0dHBzOi8vYXBuZXdzLmNvbS9hcnRpY2xlL3llbGxvd3N0b25lLXBvd2VyLXBsYW50LXBlcm1pdC1jbGltYXRlLTNlNjI4MTE2NjFmNWZhMDBlZTgxYTAyYTVkNGQ4ZDMx0gEA?oc=5,https://da.gd/YHlF
