feed,title,long_url,short_url
ArXiv:stat,Regularized regression on compositional tree with application to MRI analysis,https://arxiv.org/abs/2104.07113v1,
ArXiv:stat,COVID-19 Clinical footprint to infer about mortality,https://arxiv.org/abs/2104.07172v1,
ArXiv:stat,Bayesian Synthetic Likelihood Estimation for Underreported Non-Stationary Time Series: Covid-19 Incidence in Spain,https://arxiv.org/abs/2104.07575v1,
ArXiv:stat,Demographic-Guided Attention in Recurrent Neural Networks for Modeling Neuropathophysiological Heterogeneity,https://arxiv.org/abs/2104.07654v1,
ArXiv:stat,Variational Autoencoder for Anti-Cancer Drug Response Prediction,https://arxiv.org/abs/2008.09763v7,
ArXiv:stat,Seasonal association between viral causes of hospitalised acute lower respiratory infections and meteorological factors in China: a retrospective study,https://arxiv.org/abs/2012.00229v2,
ArXiv:stat,"""Thought I'd Share First"" and Other Conspiracy Theory Tweets from the COVID-19 Infodemic: Exploratory Study",https://arxiv.org/abs/2012.07729v2,
ArXiv:stat,A Review of Spatiotemporal Models for Count Data in R Packages. A Case Study of COVID-19 Data,https://arxiv.org/abs/2103.04697v2,
