feed,title,long_url,short_url
ArXiv,Cascading Neural Network Methodology for Artificial Intelligence-Assisted Radiographic Detection and Classification of Lead-Less Implanted Electronic Devices within the Chest,https://arxiv.org/abs/2108.11954v1,
ArXiv,JUWELS Booster -- A Supercomputer for Large-Scale AI Research,https://arxiv.org/abs/2108.11976v1,
ArXiv,UNICEF Guidance on AI for Children: Application to the Design of a Social Robot For and With Autistic Children,https://arxiv.org/abs/2108.12166v1,
ArXiv,Key Considerations for the Responsible Development and Fielding of Artificial Intelligence,https://arxiv.org/abs/2108.12289v1,
ArXiv,Towards the Right Kind of Fairness in AI,https://arxiv.org/abs/2102.08453v6,
