feed,title,long_url,short_url
ArXiv,Two-Stage COVID19 Classification Using BERT Features,https://arxiv.org/abs/2206.14861v1,
ArXiv,PVT-COV19D: Pyramid Vision Transformer for COVID-19 Diagnosis,https://arxiv.org/abs/2206.15069v1,
ArXiv,Custom Pretrainings and Adapted 3D-ConvNeXt Architecture for COVID Detection and Severity Prediction,https://arxiv.org/abs/2206.15073v1,
ArXiv,Two-Stage Classifier for COVID-19 Misinformation Detection Using BERT: a Study on Indonesian Tweets,https://arxiv.org/abs/2206.15359v1,
ArXiv,Ensemble CNN models for Covid-19 Recognition and Severity Perdition From 3D CT-scan,https://arxiv.org/abs/2206.15431v1,
ArXiv,UFRC: A Unified Framework for Reliable COVID-19 Detection on Crowdsourced Cough Audio,https://arxiv.org/abs/2204.07763v2,
