feed,title,long_url,short_url
ArXiv,Temporal Difference Uncertainties as a Signal for Exploration,https://arxiv.org/abs/2010.02255v1,
ArXiv,Using Soft Actor-Critic for Low-Level UAV Control,https://arxiv.org/abs/2010.02293v1,
ArXiv,Sentiment Analysis for Reinforcement Learning,https://arxiv.org/abs/2010.02316v1,
ArXiv,A Reinforcement Learning Approach for Rebalancing Electric Vehicle Sharing Systems,https://arxiv.org/abs/2010.02369v1,
ArXiv,Interactive Fiction Game Playing as Multi-Paragraph Reading Comprehension with Reinforcement Learning,https://arxiv.org/abs/2010.02386v1,
ArXiv,Interactive Reinforcement Learning for Feature Selection with Decision Tree in the Loop,https://arxiv.org/abs/2010.02506v1,
ArXiv,Heterogeneous Multi-Agent Reinforcement Learning for Unknown Environment Mapping,https://arxiv.org/abs/2010.02663v1,
ArXiv,Safety Aware Reinforcement Learning (SARL),https://arxiv.org/abs/2010.02846v1,
ArXiv,Reinforcement Learning in Deep Structured Teams: Initial Results with Finite and Infinite Valued Features,https://arxiv.org/abs/2010.02868v1,
ArXiv,Accelerating Reinforcement Learning through GPU Atari Emulation,https://arxiv.org/abs/1907.08467v2,
ArXiv,Policy-focused Agent-based Modeling using RL Behavioral Models,https://arxiv.org/abs/2006.05048v2,
ArXiv,QTRAN++: Improved Value Transformation for Cooperative Multi-Agent Reinforcement Learning,https://arxiv.org/abs/2006.12010v2,
ArXiv,Offline Meta-Reinforcement Learning with Advantage Weighting,https://arxiv.org/abs/2008.06043v2,
ArXiv,SUMBT+LaRL: End-to-end Neural Task-oriented Dialog System with Reinforcement Learning,https://arxiv.org/abs/2009.10447v2,
ArXiv,Deep Reinforcement Learning with Mixed Convolutional Network,https://arxiv.org/abs/2010.00717v2,
