feed,title,long_url,short_url
GN:T:WP,Building transmission takes forever. The Biden administration is pushing to change that. - Louisana Illuminator,https://news.google.com/rss/articles/CBMiPWh0dHBzOi8vbGFpbGx1bWluYXRvci5jb20vMjAyMy8xMi8xNi9lbGVjdHJpYy10cmFuc21pc3Npb24tMi_SAQA?oc=5,https://da.gd/s29Hu
GN:T:WP,American Clean Power Awards Iowa Clean Energy Champions - Yahoo Finance,https://news.google.com/rss/articles/CBMiTmh0dHBzOi8vZmluYW5jZS55YWhvby5jb20vbmV3cy9hbWVyaWNhbi1jbGVhbi1wb3dlci1hd2FyZHMtaW93YS0yMzI1MDA3MTQuaHRtbNIBAA?oc=5,https://da.gd/esjmX
GN:T:WP,Week in tech: Big solar flare temporarily disrupts radio signals on Earth - Mint Lounge,https://news.google.com/rss/articles/CBMijAFodHRwczovL2xpZmVzdHlsZS5saXZlbWludC5jb20vc21hcnQtbGl2aW5nL2lubm92YXRpb24vd2Vlay1pbi10ZWNoLXNvbGFyLWZsYXJlLWVhcnRoLXJhZGlvLXNpZ25hbHMtaXNyby1jb3AyOC1jb2FsLWllYS0xMTE3MDI3MTE1Mzc1MTMuaHRtbNIBkAFodHRwczovL2xpZmVzdHlsZS5saXZlbWludC5jb20vYW1wL3NtYXJ0LWxpdmluZy9pbm5vdmF0aW9uL3dlZWstaW4tdGVjaC1zb2xhci1mbGFyZS1lYXJ0aC1yYWRpby1zaWduYWxzLWlzcm8tY29wMjgtY29hbC1pZWEtMTExNzAyNzExNTM3NTEzLmh0bWw?oc=5,https://da.gd/DHK4N
GN:T:WP,Propelling the Building of a Community of Shared Future between China and Vietnam: A Chinese Company Signed a Contract for a 916 MW Wind Power Project in Vietnam - TravelDailyNews Asia & Pacific - TravelDailyNews Asia-Pacific,https://news.google.com/rss/articles/CBMi0AFodHRwczovL3d3dy50cmF2ZWxkYWlseW5ld3MuYXNpYS9idXNpbmVzcy1idXp6L3Byb3BlbGxpbmctdGhlLWJ1aWxkaW5nLW9mLWEtY29tbXVuaXR5LW9mLXNoYXJlZC1mdXR1cmUtYmV0d2Vlbi1jaGluYS1hbmQtdmlldG5hbS1hLWNoaW5lc2UtY29tcGFueS1zaWduZWQtYS1jb250cmFjdC1mb3ItYS05MTYtbXctd2luZC1wb3dlci1wcm9qZWN0LWluLXZpZXRuYW0v0gEA?oc=5,https://da.gd/C3J0L
GN:T:WP,"Germany at Crossroads: Navalny Support, Political Shifts, and Energy Challenges - BNN Breaking",https://news.google.com/rss/articles/CBMicGh0dHBzOi8vYm5uYnJlYWtpbmcuY29tL3BvbGl0aWNzL2dlcm1hbnktYXQtY3Jvc3Nyb2Fkcy1uYXZhbG55LXN1cHBvcnQtcG9saXRpY2FsLXNoaWZ0cy1hbmQtZW5lcmd5LWNoYWxsZW5nZXMtMi_SAQA?oc=5,https://da.gd/ywxel
GN:T:WP,"Alberta's renewable energy pause could become lingering stumble, observers say - CTV News Edmonton",https://news.google.com/rss/articles/CBMic2h0dHBzOi8vZWRtb250b24uY3R2bmV3cy5jYS9hbGJlcnRhLXMtcmVuZXdhYmxlLWVuZXJneS1wYXVzZS1jb3VsZC1iZWNvbWUtbGluZ2VyaW5nLXN0dW1ibGUtb2JzZXJ2ZXJzLXNheS0xLjY2OTAzMzLSAQA?oc=5,https://da.gd/hX0MDf
GN:T:WP,Scotland's papers: SNP tax plans and energy bills rise - BBC,https://news.google.com/rss/articles/CBMiMGh0dHBzOi8vd3d3LmJiYy5jby51ay9uZXdzL2FydGljbGVzL2M2cDFnMXBldjBlb9IBNGh0dHBzOi8vd3d3LmJiYy5jby51ay9uZXdzL2FydGljbGVzL2M2cDFnMXBldjBlby5hbXA?oc=5,https://da.gd/dAs2V
