feed,title,long_url,short_url
GN:T:CC,"Spain, Portugal to lead renewables in Europe, says Rystad - pv magazine International",https://www.pv-magazine.com/2022/11/01/spain-portugal-to-lead-renewables-in-europe-says-rystad/,
GN:T:CC,"UAE, US sign partnership to invest $100b to produce 100GW of clean energy - Gulf News",https://www.youtube.com/watch?v=5Zc-Q1j5M2Y,
GN:T:CC,November 2022: Community resilience talk kicks off SRP climate change webinar series - Environmental Factor Newsletter,https://factor.niehs.nih.gov/2022/11/science-highlights/srp-climate-strategies/index.htm,
GN:T:CC,Pledges to plant trees are great news for the fight against climate change—but we don’t have enough seeds - Fortune,https://fortune.com/2022/11/01/pledges-plant-trees-climate-change-enough-seeds-reforestation-fires-solutions-daley-wong/,
GN:T:CC,Environmental group funds ads for 4 state Senate Democrats - Spectrum News,https://spectrumlocalnews.com/nys/central-ny/ny-state-of-politics/2022/11/01/environmental-group-funds-ads-for-4-state-senate-democrats,
GN:T:CC,UND geologist takes part in multinational climate-change research - UND Today - University of North Dakota,https://blogs.und.edu/und-today/2022/11/und-geologist-takes-part-in-multinational-climate-change-research/,
GN:T:CC,"U.S. disaster response system is no match, as climate change leads to more extreme calamities, report says - WMFE",https://www.wmfe.org/climate-change-is-causing-more-extreme-calamities-and-our-disaster-response-system-is-no-match-report-says/205289,
