feed,title,long_url,short_url
GN:T:GP,Honduras inks geothermal studies deal - BNamericas English,https://news.google.com/rss/articles/CBMiSGh0dHBzOi8vd3d3LmJuYW1lcmljYXMuY29tL2VuL25ld3MvaG9uZHVyYXMtaW5rcy1nZW90aGVybWFsLXN0dWRpZXMtZGVhbNIBAA?oc=5,https://da.gd/F9uvY7
GN:T:GP,Turkish geothermal-heated greenhouse firm wants to beat Netherlands in food exports - Balkan Green Energy News,https://news.google.com/rss/articles/CBMidmh0dHBzOi8vYmFsa2FuZ3JlZW5lbmVyZ3luZXdzLmNvbS90dXJraXNoLWdlb3RoZXJtYWwtaGVhdGVkLWdyZWVuaG91c2UtZmlybS13YW50cy10by1iZWF0LW5ldGhlcmxhbmRzLWluLWZvb2QtZXhwb3J0cy_SAQA?oc=5,https://da.gd/us5Q
GN:T:GP,Industry Chief Slams Germany's Energy Policy as 'Absolutely Toxic' - OilPrice,https://news.google.com/rss/articles/CBMid2h0dHBzOi8vb2lscHJpY2UuY29tL0xhdGVzdC1FbmVyZ3ktTmV3cy9Xb3JsZC1OZXdzL0luZHVzdHJ5LUNoaWVmLVNsYW1zLUdlcm1hbnlzLUVuZXJneS1Qb2xpY3ktYXMtQWJzb2x1dGVseS1Ub3hpYy5odG1s0gF7aHR0cHM6Ly9vaWxwcmljZS5jb20vTGF0ZXN0LUVuZXJneS1OZXdzL1dvcmxkLU5ld3MvSW5kdXN0cnktQ2hpZWYtU2xhbXMtR2VybWFueXMtRW5lcmd5LVBvbGljeS1hcy1BYnNvbHV0ZWx5LVRveGljLmFtcC5odG1s?oc=5,https://da.gd/twKg
GN:T:GP,The UK's first geothermal power plant holds promise for a greener and more sustainable future - Open Access Government,https://news.google.com/rss/articles/CBMiiQFodHRwczovL3d3dy5vcGVuYWNjZXNzZ292ZXJubWVudC5vcmcvdGhlLXVrcy1maXJzdC1nZW90aGVybWFsLXBvd2VyLXBsYW50LWhvbGRzLXByb21pc2UtZm9yLWEtZ3JlZW5lci1hbmQtbW9yZS1zdXN0YWluYWJsZS1mdXR1cmUvMTczMjE4L9IBAA?oc=5,https://da.gd/PdbXDG
GN:T:GP,"""The Emmerting community also benefits from our new lighting technology"" - hortidaily",https://news.google.com/rss/articles/CBMicmh0dHBzOi8vd3d3LmhvcnRpZGFpbHkuY29tL2FydGljbGUvOTU5NzY4OC90aGUtZW1tZXJ0aW5nLWNvbW11bml0eS1hbHNvLWJlbmVmaXRzLWZyb20tb3VyLW5ldy1saWdodGluZy10ZWNobm9sb2d5L9IBAA?oc=5,https://da.gd/KOPa98
GN:T:GP,Maryland bill proposes pilot networked geothermal heating project - ThinkGeoEnergy - Geothermal Energy News,https://news.google.com/rss/articles/CBMiYWh0dHBzOi8vd3d3LnRoaW5rZ2VvZW5lcmd5LmNvbS9tYXJ5bGFuZC1iaWxsLXByb3Bvc2VzLXBpbG90LW5ldHdvcmtlZC1nZW90aGVybWFsLWhlYXRpbmctcHJvamVjdC_SAWFodHRwczovL3d3dy50aGlua2dlb2VuZXJneS5jb20vbWFyeWxhbmQtYmlsbC1wcm9wb3Nlcy1waWxvdC1uZXR3b3JrZWQtZ2VvdGhlcm1hbC1oZWF0aW5nLXByb2plY3Qv?oc=5,https://da.gd/IxFH2
GN:T:GP,Geothermal developer CeraPhi Energy buys former fracking firm - Energy Voice,https://news.google.com/rss/articles/CBMihQFodHRwczovL3d3dy5lbmVyZ3l2b2ljZS5jb20vcmVuZXdhYmxlcy1lbmVyZ3ktdHJhbnNpdGlvbi81NDcyNDEvZ2VvdGhlcm1hbC1kZXZlbG9wZXItY2VyYXBoaS1lbmVyZ3ktYWNxdWlyZXMtZm9ybWVyLWZyYWNraW5nLWNvbXBhbnkv0gEA?oc=5,https://da.gd/LoporT
GN:T:GP,Indonesia And China Discuss Strengthening Comprehensive Strategic Partnership | Portal Kementerian Luar Negeri Republik Indonesia - Kementerian Luar Negeri,https://news.google.com/rss/articles/CBMifGh0dHBzOi8va2VtbHUuZ28uaWQvcG9ydGFsL2VuL3JlYWQvNTczNi9iZXJpdGEvaW5kb25lc2lhLWFuZC1jaGluYS1kaXNjdXNzLXN0cmVuZ3RoZW5pbmctY29tcHJlaGVuc2l2ZS1zdHJhdGVnaWMtcGFydG5lcnNoaXDSAQA?oc=5,https://da.gd/RKzVCs
