feed,title,long_url,short_url
GN:T:WP,Top US diplomat says China needs more ambitious climate goal - WJXT News4JAX,https://www.news4jax.com/business/2021/12/13/top-us-diplomat-says-china-needs-more-ambitious-climate-goal/,
GN:T:WP,Warm up your mind with the Newport Art Museum's Winter Speaker Series - newportri,https://www.newportri.com/story/entertainment/arts/2021/12/11/warm-up-your-mind-newport-art-museums-winter-speaker-series/6449255001/,
GN:T:WP,See the latest McLean County building permits | Local Business | pantagraph.com - Bloomington Pantagraph,https://pantagraph.com/business/local/see-the-latest-mclean-county-building-permits/article_3ad439a9-ca31-5e20-976d-9bd7018c21d2.html,
GN:T:WP,NBN Co commits to source 100 per cent renewables by 2026 - RenewEconomy,https://reneweconomy.com.au/nbn-co-commits-to-source-100-per-cent-renewables-by-2026/,
GN:T:WP,Promoting solar equipment manufacturing - The Express Tribune,https://tribune.com.pk/story/2333601/promoting-solar-equipment-manufacturing,
