feed,title,long_url,short_url
GN:T:WP,Wind farm proponent touts benefits to Crawford County - Telegraph-Forum,https://www.bucyrustelegraphforum.com/story/news/2022/08/28/wind-farm-proponent-touts-benefits-to-crawford-county/65410887007/,
GN:T:WP,Icebreaker demonstration wind farm proposed for Lake Erie has ‘new lease on life’ - cleveland,https://www.cleveland.com/news/2022/08/icebreaker-demonstration-wind-farm-proposed-for-lake-erie-has-new-lease-on-life.html,
GN:T:WP,Germany: Baltic Sea has ‘enormous’ wind energy potential - YourCentralValley,https://www.yourcentralvalley.com/news/business/ap-germany-baltic-sea-has-enormous-wind-energy-potential/,
GN:T:WP,Oil Firms Show Interest to Build Gulf of Mexico Offshore Wind - Engineering News-Record,https://www.enr.com/articles/54695-oil-firms-show-interest-to-build-gulf-of-mexico-offshore-wind,
GN:T:WP,Pig poo power praised but more needed - Boorowa News,https://www.boorowanewsonline.com.au/story/7878593/pig-poo-power-praised-but-more-needed/?cs=12,
GN:T:WP,New ITV drama starring Adrian Dunbar to hit screens this weekend - scenes filmed in Todmorden earlier this year - Halifax Courier,https://www.halifaxcourier.co.uk/arts-and-culture/film-and-tv/new-itv-drama-starring-adrian-dunbar-to-hit-screens-scenes-filmed-in-todmorden-earlier-this-year-3816373,
GN:T:WP,Galetech buys NI engineering firm for £1m - Business Post,https://www.businesspost.ie/news/galetech-buys-ni-engineering-firm-for-1m/,
GN:T:WP,Snapshot of round one of the AFLW season - Boorowa News,https://www.boorowanewsonline.com.au/story/7879142/snapshot-of-round-one-of-the-aflw-season/?cs=10372,
GN:T:WP,Energy company seeking to connect Westmeath wind farm to Offaly substation - Offaly Live,https://www.offalyexpress.ie/news/home/895373/energy-company-seeking-to-connect-westmeath-wind-farm-to-offaly-substation.html,
