feed,title,long_url,short_url
SSRN,Political and Legal Responses to Human Mobility in South America in the Context of the COVID-19 Crisis. More Fuel for the Fire?,https://papers.ssrn.com/sol3/papers.cfm?abstract_id=3852194,
SSRN,Entrepreneurs and Regulations: Removing State and Local Barriers to New Businesses,https://papers.ssrn.com/sol3/papers.cfm?abstract_id=3852154,
SSRN,War Metaphors As the Main Means of Figurative Representation of the COVID-19 Pandemic in the English Political Discourse (МЕТАФОРА ВОЙНЫ КАК ОСНОВНОЙ СПОСОБ ОБРАЗНОЙ РЕПРЕЗЕНТАЦИИ ПАНДЕМИИ КОРОНАВИРУСА В АНГЛОЯЗЫЧНОМ ПОЛИТИЧЕСКОМ ДИСКУРСЕ),https://papers.ssrn.com/sol3/papers.cfm?abstract_id=3852032,
SSRN,How International Governmental COVID-19 Measures Impacted Freedom of Speech Around the World,https://papers.ssrn.com/sol3/papers.cfm?abstract_id=3852028,
SSRN,Factoring in Trust in the Alliance for Multilateralism,https://papers.ssrn.com/sol3/papers.cfm?abstract_id=3851517,
SSRN,"Knowledge, Behaviour and Perception of the Traders Toward’s Receiving COVID-19 Vaccine in Lapai Local Government Area of Niger State, Nigeria",https://papers.ssrn.com/sol3/papers.cfm?abstract_id=3851477,
SSRN,Country image and consumer choice: The case of the beer market during the COVID-19 pandemic,https://papers.ssrn.com/sol3/papers.cfm?abstract_id=3851976,
