feed,title,long_url,short_url
GN:T:RE,Tesla unveils new virtual power plant in Japan - Electrek,https://electrek.co/2022/08/29/tesla-unveils-new-virtual-power-plant-japan/,
GN:T:RE,Elon Musk says world still needs oil and gas - CNBC,https://www.cnbc.com/2022/08/29/elon-musk-says-world-still-needs-oil-and-gas.html,
GN:T:RE,Peter Sterling: The Inflation Reduction Act just shattered the ceiling for clean energy in Vermont - vtdigger,https://vtdigger.org/2022/08/29/peter-sterling-the-inflation-reduction-act-just-shattered-the-ceiling-for-clean-energy-in-vermont/,
GN:T:RE,Iowa Events Center roof may be updated to include solar panels - Des Moines Register,https://www.desmoinesregister.com/story/news/local/government/2022/08/29/installing-solar-panels-iowa-events-center-roof-could-reach-renewable-energy-goal/7905695001/,
GN:T:RE,Renewables Solution - Rystad Energy,https://www.rystadenergy.com/services/renewables-solution,
