feed,title,long_url,short_url
GN:T:CC,California rooftop solar proposal sparks firestorm | TheHill - The Hill,https://thehill.com/policy/equilibrium-sustainability/592917-california-rooftop-solar-proposal-sparks-firestorm,
GN:T:CC,Lost time means a steeper climb on climate | TheHill - The Hill,https://thehill.com/opinion/energy-environment/593049-lost-time-means-a-steeper-climb-on-climate,
GN:T:CC,Many states demand insurance companies prove they can weather the growing costs of climate disasters - but not Texas - WFAA,https://www.wfaa.com/article/tech/science/climate-change/texas-no-policy-address-risk-climate-change-insurance-policies/287-7e5ee5fe-404f-4d4f-833f-57813ea0849c,
GN:T:CC,"Our Environmental Crisis Requires Political Fixes, Not Technological Ones - Scientific American",https://www.scientificamerican.com/article/our-environmental-crisis-requires-political-fixes-not-technological-ones/,
GN:T:CC,USDA to spend $1 billion to promote climate-friendly agriculture - Reuters,https://www.reuters.com/markets/commodities/usda-spend-1-bln-promote-climate-friendly-agriculture-2022-02-07/,
