feed,title,long_url,short_url
ArXiv:q-bio,Automated discovery of interpretable hyperelastic material models for human brain tissue with EUCLID,https://arxiv.org/abs/2305.16362v1,
ArXiv:q-bio,An AI-Ready Multiplex Staining Dataset for Reproducible and Accurate Characterization of Tumor Immune Microenvironment,https://arxiv.org/abs/2305.16465v1,
ArXiv:q-bio,Machine Learning for Protein Engineering,https://arxiv.org/abs/2305.16634v1,
ArXiv:q-bio,Fractional model of COVID--19 with pathogens as shedding effects,https://arxiv.org/abs/2305.16689v1,
ArXiv:q-bio,Interior operators and their relationship to autocatalytic networks,https://arxiv.org/abs/2305.16714v1,
ArXiv:q-bio,Are Deep Neural Networks Adequate Behavioural Models of Human Visual Perception?,https://arxiv.org/abs/2305.17023v1,
ArXiv:q-bio,The reaction-diffusion basis of animated patterns in eukaryotic flagella,https://arxiv.org/abs/2305.17032v1,
ArXiv:q-bio,The Brain Tumor Segmentation (BraTS) Challenge 2023: Focus on Pediatrics (CBTN-CONNECT-DIPGR-ASNR-MICCAI BraTS-PEDs),https://arxiv.org/abs/2305.17033v1,
ArXiv:q-bio,Unsupervised machine learning framework for discriminating major variants of concern during COVID-19,https://arxiv.org/abs/2208.01439v3,
ArXiv:q-bio,End-to-End Full-Atom Antibody Design,https://arxiv.org/abs/2302.00203v3,
ArXiv:q-bio,"Self-Organization, Evolutionary Entropy and Directionality Theory",https://arxiv.org/abs/2304.14877v2,
ArXiv:q-bio,Nine tips for ecologists using machine learning,https://arxiv.org/abs/2305.10472v2,
ArXiv:q-bio,Explaining V1 Properties with a Biologically Constrained Deep Learning Architecture,https://arxiv.org/abs/2305.11275v2,
ArXiv:q-bio,Coarse-to-Fine: a Hierarchical Diffusion Model for Molecule Generation in 3D,https://arxiv.org/abs/2305.13266v2,
ArXiv:q-bio,Gene Set Summarization using Large Language Models,https://arxiv.org/abs/2305.13338v2,
ArXiv:q-bio,Improving few-shot learning-based protein engineering with evolutionary sampling,https://arxiv.org/abs/2305.15441v2,
ArXiv:q-bio,Deep Representation Learning of Tissue Metabolome and Computed Tomography Images Annotates Non-invasive Classification and Prognosis Prediction of NSCLC,https://arxiv.org/abs/2305.15590v2,
ArXiv:q-bio,Can NLI Provide Proper Indirect Supervision for Low-resource Biomedical Relation Extraction?,https://arxiv.org/abs/2212.10784v2,
