feed,title,long_url,short_url
GN:T:WP,"Germany introduces new provisions to support solar, wind - pv magazine International",https://www.pv-magazine.com/2022/04/06/germany-introduces-new-provisions-to-support-solar-wind/,
GN:T:WP,"Solectrac Launches Dealer Network for Electric Tractors, Adds New Facility - CleanTechnica",https://cleantechnica.com/2022/04/06/electric-tractor-company-solectrac-launches-dealer-network-adds-new-facility/,
GN:T:WP,"Enercon installs turbine with power converter systems in its 'E-nacelle', rather than tower base | Recharge - Recharge",https://www.rechargenews.com/wind/enercon-installs-turbine-with-power-converter-systems-in-its-e-nacelle-rather-than-tower-base/2-1-1197122,
GN:T:WP,The Elon Musk Interview With Axel Springer Offers A Glance Into His Mind - CleanTechnica,https://cleantechnica.com/2022/04/06/the-elon-musk-interview-with-axel-springer-offers-a-glance-into-his-mind/,
GN:T:WP,"EV Conversions — Should You, or Shouldn’t You? - CleanTechnica",https://cleantechnica.com/2022/04/06/to-retrofit-or-not-to-retrofit/,
GN:T:WP,Shell writes down up to $5bn after Russia exit; UK house price surge continues – business live - The Guardian,https://www.theguardian.com/business/live/2022/apr/07/business-live-shell-russia-energy-house-prices-uk-economy-growth-markets-business-live,
GN:T:WP,Scots blade protection kit passes durability test - reNEWS,https://renews.biz/77053/scots-blade-protection-kit-passes-durability-test/,
