feed,title,long_url,short_url
GN:T:SL,'It's happening now': how rising sea levels are causing a US migration crisis - The Guardian,https://www.theguardian.com/environment/2022/apr/07/its-happening-now-how-rising-sea-levels-are-causing-a-us-migration-crisis,
GN:T:SL,Everything's On The Table As Kauai Writes Its First Climate Change Action Plan - Honolulu Civil Beat,https://www.civilbeat.org/2022/04/everythings-on-the-table-as-kauai-writes-its-first-climate-change-action-plan/,
GN:T:SL,This Ethereal National Park Is Home to Ancient Glaciers and Unmatched Wildlife - Thrillist,https://www.thrillist.com/travel/nation/kenai-fjords-national-park,
GN:T:SL,Guidelines approved for Christchurch's move to adapt to sea level rise - Stuff,https://www.stuff.co.nz/environment/128286471/guidelines-approved-for-christchurchs-move-to-adapt-to-sea-level-rise,
GN:T:SL,Wider prom and new seawall approved for Mumbles - Wales Online,https://www.walesonline.co.uk/news/wales-news/mumbles-seawall-tourism-gower-swansea-23615341,
GN:T:SL,"Meltwater drainage, break-away icebergs linked at shrinking Helheim Glacier - EurekAlert",https://www.eurekalert.org/news-releases/948346,
GN:T:SL,"Researchers heading north to study glaciers in N.W.T., Nunavut - CBC",https://www.cbc.ca/news/canada/north/glaciers-study-nwt-nunavut-1.6411007,
