feed,title,long_url,short_url
MX,Financial stress burdens more than half of new U.S. moms: study,https://medicalxpress.com/news/2021-11-financial-stress-burdens-moms.html,https://j.mp/3mxRFVF
MX,Pediatric critical care professionals experiencing moral distress,https://medicalxpress.com/news/2021-11-pediatric-critical-professionals-experiencing-moral.html,https://j.mp/3q5g8Uq
MX,Cerebral venous sinus thrombosis rate up after Ad26.COV2.S shot,https://medicalxpress.com/news/2021-11-cerebral-venous-sinus-thrombosis-ad26cov2s.html,https://j.mp/3nPzPNj
MX,Age and health factors in COVID breakthrough deaths,https://medicalxpress.com/news/2021-11-age-health-factors-covid-breakthrough.html,https://j.mp/3pUAzDJ
MX,"Comprehensive patient blood management program can reduce use of transfusions, improve patient outcomes",https://medicalxpress.com/news/2021-11-comprehensive-patient-blood-transfusions-outcomes.html,https://j.mp/3byoCeC
MX,FDA approves Pfizer COVID vaccine for kids 5-11,https://medicalxpress.com/news/2021-11-fda-pfizer-covid-vaccine-kids.html,https://j.mp/3CE6Z8V
MX,"Guard dogs, panic buttons: Nurses under threat from rising violence",https://medicalxpress.com/news/2021-11-dogs-panic-buttons-nurses-threat.html,https://j.mp/3EDYdZ1
