feed,title,long_url,short_url
GN:T:WP,"Texas and California built different power grids, but neither stood up to climate change - POLITICO",https://www.politico.com/news/2021/02/21/texas-california-climate-change-power-grids-470434,
GN:T:WP,"Texas congressman: One energy company alerted ERCOT, Texas officials days before winter storms of potential problems. No one listened - WFAA",https://www.wfaa.com/article/news/politics/inside-politics/texas-politics/texas-congressman-one-energy-company-alerted-ercot-texas-officials-days-before-winter-storms-of-potential-problems-no-one-listened/287-3448f926-6a40-41f9-b5a7-b081a775a958,
GN:T:WP,The US added 16.5 GW of PV in 2020 – pv magazine International - pv magazine International,https://www.pv-magazine.com/2021/02/22/the-us-added-16-5-gw-of-pv-in-2020/,
GN:T:WP,Turbines are being adapted for extreme weather—but can they handle ‘Black Swan’ events? - Fortune,https://fortune.com/2021/02/20/wind-turbines-texas-winter-storms-ice-extreme-weather/,
GN:T:WP,Danish and Asian companies compete for contract to build offshore wind project in Taiwan - ScandAsia,https://scandasia.com/danish-and-asian-companies-compete-for-contract-to-build-offshore-wind-project-in-taiwan/,
GN:T:WP,This Morning's Bulletin — 2.22.21 - East End Beacon,https://www.eastendbeacon.com/this-mornings-bulletin-2-22-21/,
