feed,title,long_url,short_url
GN:T:WP,Port: Xcel Energy should stop blaming the pandemic for rising utility bills - Grand Forks Herald,https://www.grandforksherald.com/opinion/7252840-Port-Xcel-Energy-should-stop-blaming-the-pandemic-for-rising-utility-bills,
GN:T:WP,Strong Nor'easter Wind Knocks Out Power in Mass. - NBC10 Boston,https://www.nbcboston.com/news/local/noreaster-causes-traffic-delays-power-outages-in-mass/2536069/,
GN:T:WP,UNILIN master oak interior panelling out-performs its natural namesake - Designboom,https://www.designboom.com/design/unilin-panels-master-oak-interior-panelling-10-26-2021/,
GN:T:WP,GE lifts 2021 earnings forecast - Yahoo Finance,https://finance.yahoo.com/news/ge-lifts-2021-earnings-forecast-103328038.html,
GN:T:WP,"Bomb cyclone brings heavy rain, wind to Lane County - The Register-Guard",https://www.registerguard.com/story/news/2021/10/25/bomb-cyclone-brings-heavy-rain-wind-lane-county/8539694002/,
GN:T:WP,Stunt cyclist rides bike along the blade of a 230ft wind turbine - Daily Mail,https://www.dailymail.co.uk/news/article-10131523/Stunt-cyclist-rides-bike-blade-230ft-wind-turbine.html,
GN:T:WP,"Huawei wins 1,300MWh Red Sea battery deal - MEED - Power Technology",https://www.power-technology.com/marketdata/south-and-central-america-generation-equipment-contracts-activity-down-13-in-q3-2021/,
GN:T:WP,MingYang wins order for 'Southeast Asia's largest offshore wind project' | Recharge - Recharge,https://www.rechargenews.com/wind/mingyang-wins-order-for-southeast-asias-largest-offshore-wind-project/2-1-1088207,
GN:T:WP,Wind farm near Langholm heads to inquiry - BBC News,https://www.bbc.com/news/articles/cdddj5zz8vno,
GN:T:WP,"Long Island Preparing For Potential Flooding, Power Outages As Rain And Wind Pick Up - CBS New York",https://newyork.cbslocal.com/2021/10/26/noreaster-long-island-flood-watch/,
