feed,title,long_url,short_url
GN:T:CC,$2.35 billion tidal lagoon project with underwater turbines planned for UK - CNBC,https://www.cnbc.com/2021/10/26/2point35-billion-tidal-lagoon-project-with-underwater-turbines-planned.html,
GN:T:CC,Clean energy is 'our first defense against' soaring energy prices: White House national climate advisor - Yahoo Finance,https://finance.yahoo.com/news/clean-energy-is-the-first-defense-against-spiked-energy-prices-white-house-national-climate-advisor-132612235.html,
GN:T:CC,It's not just carbon emissions. Human failures are ruining the climate too - CNN,https://www.cnn.com/2021/10/26/opinions/cop26-climate-justice-is-racial-justice-magee/index.html,
GN:T:CC,"Fossil fuel messaging has won over Republican voters, poll reveals - The Guardian",https://www.theguardian.com/environment/2021/oct/26/republicans-climate-crisis-big-oil-poll,
GN:T:CC,Majority in US concerned about climate: AP-NORC/EPIC poll - Yahoo News,https://news.yahoo.com/ap-norc-epic-poll-majority-050504166.html,
GN:T:CC,"New Mexico leaders discuss plans for climate change action, reducing greenhouse gases - Santa Fe New Mexican",https://www.santafenewmexican.com/news/local_news/new-mexico-leaders-discuss-plans-for-climate-change-action-reducing-greenhouse-gases/article_167e97a2-3531-11ec-9772-2fcc270a213e.html,
