feed,title,long_url,short_url
GN:T:CC,‘Project 2025’: plan to dismantle US climate policy for next Republican president - The Guardian,https://news.google.com/rss/articles/CBMidmh0dHBzOi8vd3d3LnRoZWd1YXJkaWFuLmNvbS9lbnZpcm9ubWVudC8yMDIzL2p1bC8yNy9wcm9qZWN0LTIwMjUtZGlzbWFudGxlLXVzLWNsaW1hdGUtcG9saWN5LW5leHQtcmVwdWJsaWNhbi1wcmVzaWRlbnTSAXZodHRwczovL2FtcC50aGVndWFyZGlhbi5jb20vZW52aXJvbm1lbnQvMjAyMy9qdWwvMjcvcHJvamVjdC0yMDI1LWRpc21hbnRsZS11cy1jbGltYXRlLXBvbGljeS1uZXh0LXJlcHVibGljYW4tcHJlc2lkZW50?oc=5,https://da.gd/5o3mqR
GN:T:CC,"Climate Litigation Has Exploded, but Is it Making a Difference? - InsideClimate News",https://news.google.com/rss/articles/CBMiUGh0dHBzOi8vaW5zaWRlY2xpbWF0ZW5ld3Mub3JnL25ld3MvMjcwNzIwMjMvY2xpbWF0ZS1jaGFuZ2UtbGl0aWdhdGlvbi1leHBsb3Npb24v0gEA?oc=5,https://da.gd/HDSa9
GN:T:CC,The Climate Is Changing Everything—Including Our Sex Lives - The New Republic,https://news.google.com/rss/articles/CBMiVWh0dHBzOi8vbmV3cmVwdWJsaWMuY29tL2FydGljbGUvMTczNjI5L2NsaW1hdGUtY2hhbmdpbmctZXZlcnl0aGluZ2luY2x1ZGluZy1zZXgtbGl2ZXPSAQA?oc=5,https://da.gd/Uyvpdw
GN:T:CC,British Gas: Anger as energy bill change leads to record profits - BBC,https://news.google.com/rss/articles/CBMiKmh0dHBzOi8vd3d3LmJiYy5jb20vbmV3cy9idXNpbmVzcy02NjMxNTExN9IBLmh0dHBzOi8vd3d3LmJiYy5jb20vbmV3cy9idXNpbmVzcy02NjMxNTExNy5hbXA?oc=5,https://da.gd/gu3ff
GN:T:CC,Warming trend in Asia set to cause more disruption: UN weather agency - UN News,https://news.google.com/rss/articles/CBMiLGh0dHBzOi8vbmV3cy51bi5vcmcvZW4vc3RvcnkvMjAyMy8wNy8xMTM5MTUy0gEA?oc=5,https://da.gd/hbl5bx
