feed,title,long_url,short_url
gNews,High-efficiency reinforcement learning with hybrid architecture photonic integrated circuit - Nature,https://news.google.com/rss/articles/CBMiMmh0dHBzOi8vd3d3Lm5hdHVyZS5jb20vYXJ0aWNsZXMvczQxNDY3LTAyNC00NTMwNS160gEA?oc=5,https://da.gd/20OGMo
gNews,AlphaFlow: autonomous discovery and optimization of multi-step chemistry using a self-driven fluidic lab guided by ... - Nature,https://news.google.com/rss/articles/CBMiMmh0dHBzOi8vd3d3Lm5hdHVyZS5jb20vYXJ0aWNsZXMvczQxNDY3LTAyMy0zNzEzOS150gEA?oc=5,https://da.gd/6nz5hw
gNews,(PDF) Improving the Performance of Autonomous Driving through Deep Reinforcement Learning - ResearchGate,https://news.google.com/rss/articles/CBMihgFodHRwczovL3d3dy5yZXNlYXJjaGdhdGUubmV0L3B1YmxpY2F0aW9uLzM3Mzk5NTM4N19JbXByb3ZpbmdfdGhlX1BlcmZvcm1hbmNlX29mX0F1dG9ub21vdXNfRHJpdmluZ190aHJvdWdoX0RlZXBfUmVpbmZvcmNlbWVudF9MZWFybmluZ9IBAA?oc=5,https://da.gd/S448f
gNews,Deep reinforcement learning based controller with dynamic feature extraction for an industrial claus process - ScienceDirect,https://news.google.com/rss/articles/CBMiQ2h0dHBzOi8vd3d3LnNjaWVuY2VkaXJlY3QuY29tL3NjaWVuY2UvYXJ0aWNsZS9waWkvUzE4NzYxMDcwMjMwMDEwODbSAQA?oc=5,https://da.gd/PGSyR
gNews,Solving Unity Environment with Deep Reinforcement Learning | by Gabriel Cassimiro - Towards Data Science,https://news.google.com/rss/articles/CBMiZmh0dHBzOi8vdG93YXJkc2RhdGFzY2llbmNlLmNvbS9zb2x2aW5nLXVuaXR5LWVudmlyb25tZW50LXdpdGgtZGVlcC1yZWluZm9yY2VtZW50LWxlYXJuaW5nLTgzNmRjMTgxZWUzYtIBAA?oc=5,https://da.gd/SujsTy
