feed,title,long_url,short_url
Medium,Short Info of Tuple vs List,https://medium.com/p/c69fc8880956,
Medium,Machine Bias and ways to improve. Your business/product with Machine Learning,https://medium.com/p/1716f09fa12a,
Medium,Predicting Song Popularity on Spotify!,https://medium.com/p/e61074865251,
Medium,구글 머신러닝 부트캠프 2021 후기,https://medium.com/p/87c8859ce8c4,
Medium,Formal grammar and information theory,https://medium.com/p/f9b293e2c385,
Medium,Inteligencia artificial ¿inofensiva o peligrosa?,https://medium.com/p/a643e2213900,
Medium,The power of feature engineering,https://medium.com/p/a3025a7c6cb6,
