feed,title,long_url,short_url
gNews,Simar Dugal: One of India’s top models who started her career after becoming a mother - The Indian Express,https://indianexpress.com/article/lifestyle/fashion/simar-dugal-model-fashion-designer-career-6552808/,https://j.mp/2DWzXaE
gNews,"Zydus Cadila Launches India's Cheapest Remdesivir Version At Rs 2,800 Per Vial - NDTV Profit",https://www.ndtv.com/business/zydus-cadila-launches-indias-cheapest-remdesivir-version-at-37-per-vial-to-treat-covid-19-patients-2278716,https://j.mp/2XUoLCo
gNews,The economic reality that'll hit India as soon as reopening relief fades - Economic Times,https://economictimes.indiatimes.com/news/economy/indicators/the-economic-reality-thatll-hit-india-as-soon-as-reopening-relief-fades/articleshow/77520097.cms,https://j.mp/3kA5VKN
gNews,"Exclusive | India and the world were already overleveraged when COVID-19 hit, hence there will be massive... - Moneycontrol",https://www.moneycontrol.com/news/business/exclusive-india-and-the-world-were-already-overleveraged-when-covid-19-hit-hence-there-will-be-massive-bankruptcies-nyu-professor-emeritus-edward-altman-5691841.html,https://j.mp/2CnXUY5
gNews,How online education is driving the growth of second-hand smartphones in India - The Indian Express,https://indianexpress.com/article/technology/tech-news-technology/how-online-education-is-driving-the-growth-of-second-hand-smartphones-in-india-6552702/,https://j.mp/30T5jYY
gNews,"Mi 10 Ultra, Redmi K30 Ultra Will Not Launch In India And Globally: Upcoming Xiaomi Phones In India? - Trak",https://trak.in/tags/business/2020/08/13/mi-10-ultra-redmi-k30-ultra-will-not-launch-in-india-and-globally-upcoming-xiaomi-phones-in-india/,https://j.mp/3iCJmDe
gNews,Who will get covid-19 vaccine in India first? Committee meets today - Livemint,https://www.livemint.com/science/health/who-will-get-covid-19-vaccine-in-india-first-committee-meets-today-11597234515887.html,https://j.mp/33STyDC
gNews,5G to have a better future in India: Trai's Gupta - ETTelecom,https://telecom.economictimes.indiatimes.com/news/5g-to-have-a-better-future-in-india-trais-gupta/77520161,https://j.mp/3iGEeOn
