feed,title,long_url,short_url
GN:T:AI,Ancient Herculaneum scroll piece revealed by AI – here's what it says - New Scientist,https://news.google.com/rss/articles/CBMicGh0dHBzOi8vd3d3Lm5ld3NjaWVudGlzdC5jb20vYXJ0aWNsZS8yNDE1ODIxLWFuY2llbnQtaGVyY3VsYW5ldW0tc2Nyb2xsLXBpZWNlLXJldmVhbGVkLWJ5LWFpLWhlcmVzLXdoYXQtaXQtc2F5cy_SAQA?oc=5,https://da.gd/f3CuHL
GN:T:AI,Elon Musk's AI startup courting investors with access to 'Muskonomy' - Business Insider,https://news.google.com/rss/articles/CBMiZ2h0dHBzOi8vd3d3LmJ1c2luZXNzaW5zaWRlci5jb20vZWxvbi1tdXNrLWFpLXN0YXJ0dXAtY291cnRpbmctaW52ZXN0b3JzLXdpdGgtYWNjZXNzLXRvLW11c2tvbm9teS0yMDI0LTLSAWtodHRwczovL3d3dy5idXNpbmVzc2luc2lkZXIuY29tL2Vsb24tbXVzay1haS1zdGFydHVwLWNvdXJ0aW5nLWludmVzdG9ycy13aXRoLWFjY2Vzcy10by1tdXNrb25vbXktMjAyNC0yP2FtcA?oc=5,https://da.gd/CKkVW
GN:T:AI,How Odyssey Tour reps helped Wyndham Clark find a winning putter - Golf,https://news.google.com/rss/articles/CBMiSGh0dHBzOi8vZ29sZi5jb20vZ2Vhci9wdXR0ZXJzL3d5bmRoYW0tY2xhcmstb2R5c3NleS1haS1vbmUtcGViYmxlLWJlYWNoL9IBSGh0dHBzOi8vZ29sZi5jb20vZ2Vhci9wdXR0ZXJzL3d5bmRoYW0tY2xhcmstb2R5c3NleS1haS1vbmUtcGViYmxlLWJlYWNoLw?oc=5,https://da.gd/qxYmy
GN:T:AI,"AI-tested, artist-approved poisoning tools - Marketplace",https://news.google.com/rss/articles/CBMiWGh0dHBzOi8vd3d3Lm1hcmtldHBsYWNlLm9yZy9zaG93cy9tYXJrZXRwbGFjZS9haS10ZXN0ZWQtYXJ0aXN0LWFwcHJvdmVkLXBvaXNvbmluZy10b29scy_SAQA?oc=5,https://da.gd/FZaAN
GN:T:AI,"World News in Brief: Artificial Intelligence pledge, child abuse online, Sudan crisis deepens - UN News",https://news.google.com/rss/articles/CBMiLGh0dHBzOi8vbmV3cy51bi5vcmcvZW4vc3RvcnkvMjAyNC8wMi8xMTQ2MjE30gEA?oc=5,https://da.gd/sVhn8
GN:T:AI,Bumble launches AI tool to weed out scams and fake profiles - Mashable,https://news.google.com/rss/articles/CBMiTmh0dHBzOi8vbWFzaGFibGUuY29tL2FydGljbGUvYnVtYmxlLWRlY2VwdGlvbi1kZXRlY3Rvci1zcGFtLXNjYW0tZmFrZS1wcm9maWxlc9IBAA?oc=5,https://da.gd/JwMyf
