feed,title,long_url,short_url
GN:T:CC,"Cutting clean energy won’t lower New England utility bills, advocates say - Canary Media",https://news.google.com/rss/articles/CBMiigFBVV95cUxOa0hqb09hb200clMwdXlTTnk5MXlTTm1fWE10Yk5iZXRfMkdmUHN1VW01Yy0zajYyck9FbEF6T0ZuRC1YZFBTLTV1eGRMUjZtRzhGaGFfMXhYNVN1Q0wxc2s3M015eXNlTEpSUzE4NlZsdFQxUS1yeW5yMnFLVm9RbnluMVE4ajJLSWc?oc=5,https://da.gd/yyZuE9
GN:T:CC,The UN has declared 2025 as the year of glacier preservation. Here's how to visit one safely - BBC,https://news.google.com/rss/articles/CBMiuAFBVV95cUxPOEtjX1BmY1hPb1NGQmNwcWhxQXFJVHgzbUw3TjBZX1l3enVXdWM0dE5ieE4zWGJqWm1kM3o4TGxtYVBxbjFfdzFMVjRVR21mcTNiWnRsbGxUTThOdEtUSkFwb2RrVEJYZk13b1ZXQUUySUh6eEt6U0xXWjFqUXVMaHVCYjJoZzJHaldaLXJWUnpCSUhXc1RCeUFxbHpHSVItSE1EUGZwU0p4Znk3aEtGbUFfdUVRaE1J?oc=5,https://da.gd/TJqKg
GN:T:CC,Meet the EPA's new regional administrator in charge of California (and the rest of the Pacific Southwest) - Los Angeles Times,https://news.google.com/rss/articles/CBMiqAFBVV95cUxNOXl0VlRBYndxRzZWeTlCb1gtUkZHdTNta3dQZzdrWlkwTkhXS0k1VVFnVUJMV1RBdHhBejVWTzlXRXZVd2FzdU93R2ctdl84YkhnM2MydlZCY3lTbWVONWxjMnNWVHNFUl9naVpGVFo3eWo4TmV4Tlh1MjFncmhYLS1STnRSMGF6bjJjOURyZEdGNnMyMVY3UzY4aWFkQi1aM2dmNFFQcmk?oc=5,https://da.gd/UulK2
GN:T:CC,Trump wants states to handle disasters. States aren't prepared - NPR,https://news.google.com/rss/articles/CBMijwFBVV95cUxOdl9pUlFtM01uV3BpVnNNUUZ5Y1QwN0tyV2l5Y3VjU3FOMnBPV1lOZnhLeldDTHZYUU84SW9YWkxmUXFZNzBGRGNWV0FHYWR5ZC1KX3ZRSTFxVlBHcV9UZUstaHVDZXhIeVcwcEhRYURFeV9JM0RKaHZpYzdFSXZUU3VvazJIX3puWlVtT0ZjVQ?oc=5,https://da.gd/JgFTx
GN:T:CC,Developing Countries Chart New Climate Path as Trump Returns - TIME,https://news.google.com/rss/articles/CBMiggFBVV95cUxNM0puX3NLQ3l6cFdtd0ZGME92TWVoczAzRlJDbDhvZzFPQmotb0NrQUN3eUJUdnNvUTFXdU9WQmhyekYyb2l2WlNqUzdISTYyek1URnlQWUFSZzEtNHJkN2VEZzBZektPRHZxNS1ERFZ1Y3ZJM01fandkdEpOSUc4Z0VR?oc=5,https://da.gd/vr55TT
GN:T:CC,Ecuador: Presidential candidates must put human rights at the center of their proposals - Amnesty International,https://news.google.com/rss/articles/CBMiogFBVV95cUxOTmhGWk15aWFhSm82c2Nzbm92QVB1RmdKN2NoN1pNWllKT3VxU3FlOGVKdzlVUUdkaXpnSU8yOHNkMi12dVRoelZrZGk5Z0lCOTdiN3JiVWlvODFKdTJpZjE2YWs1SEJKb090UHJLYTJlWVd1aE5Dcy1VQ1d2WEVBT2VmMFllREVsbzJJMUlqbmlYcmdBblZ4OUQyaEJwQ1BZVHc?oc=5,https://da.gd/vP7iC
