feed,title,long_url,short_url
GN:T:WP,Types of Power Purchase Agreements and Why Each PPA Might Be Used - POWER magazine,https://www.powermag.com/types-of-power-purchase-agreements-and-why-each-ppa-might-be-used/,
GN:T:WP,"United Way launches green-energy training with $250,000 grant - Newsday",https://www.newsday.com/business/united-way-orsted-bank-of-america-eversource-1.50348688,
GN:T:WP,"In climate reversal, Biden okays new oil and gas mega auction - Phys",https://phys.org/news/2021-09-climate-reversal-biden-okays-oil.html,
GN:T:WP,German think-tanks ring climate alarm as candidates squabble over minutiae - EURACTIV,https://www.euractiv.com/section/energy/news/german-think-tanks-ring-climate-alarm-as-candidates-squabble-over-minutiae/,
GN:T:WP,'Green superpower' Denmark plans second gigawatt-scale offshore wind-to-H2 plant at Esbjerg | Recharge - Recharge,https://www.rechargenews.com/wind/green-superpower-denmark-plans-second-gigawatt-scale-offshore-wind-to-h2-plant-at-esbjerg/2-1-1060264,
