feed,title,long_url,short_url
GN:S:C,Ida turns New York City into a front line of extreme weather supercharged by climate change - CNN,https://www.cnn.com/2021/09/02/world/ida-climate-change-floods-rain-intl/index.html,
GN:S:C,Climate Change Is Bankrupting America’s Small Towns - The New York Times,https://www.nytimes.com/2021/09/02/climate/climate-towns-bankruptcy.html,
GN:S:C,The problem with playing God to fix the climate: It might not work - POLITICO,https://www.politico.eu/article/climate-change-global-warming-ipcc-geoengineering-technology/,
GN:S:C,Climate hawks pressure Biden to replace Fed chair | TheHill - The Hill,https://thehill.com/policy/finance/570475-climate-hawks-pressure-biden-to-replace-fed-chair,
GN:S:C,How BCG helps corporations invest in climate tech | Greenbiz - GreenBiz,https://www.greenbiz.com/article/how-bcg-helps-corporations-invest-climate-tech,
GN:S:C,Climate change threatens traditional extractive resources in the Amazon - Landscape News,https://news.globallandscapesforum.org/54681/climate-change-threatens-traditional-extractive-communities-in-the-amazon/,
