feed,title,long_url,short_url
GN:T:WP,Wind power adds to state's prosperity -- Brodie Dockendorf - Madison,https://madison.com/opinion/letters/wind-power-adds-to-states-prosperity----brodie-dockendorf/article_e4d68d33-4694-5cad-abee-ac69f110df23.html,
GN:T:WP,James Fisher forms wind partnerships in Taiwan - Offshore magazine,https://www.offshore-mag.com/renewable-energy/article/14280271/james-fisher-forms-wind-partnerships-in-taiwan,
GN:T:WP,Three months to go: Japan Wind Energy 2022 at Yokohama - Yahoo Finance,https://finance.yahoo.com/news/three-months-japan-wind-energy-053000386.html,
GN:T:WP,"As congressional path for climate change measures appears to close, Biden announces executive actions - USA TODAY",https://www.usatoday.com/story/news/politics/2022/07/20/biden-climate-executive-actions/10103660002/,
GN:T:WP,"China to export $100bn in renewable energy technology in 2022, bright future ahead - News for the Energy Sector - Energy Voice",https://www.energyvoice.com/renewables-energy-transition/431020/china-to-export-100bn-in-renewable-energy-technology-in-2022-bright-future-ahead/,
GN:T:WP,Top 10 challenges with corporate net zero transformation - Energy Digital,https://energydigital.com/top10/top-10-challenges-with-net-zero-transformation,
GN:T:WP,Wind Power Company Lixin Energy Jumps 32% in Shenzhen Debut - Marketscreener,https://www.marketscreener.com/news/latest/Wind-Power-Company-Lixin-Energy-Jumps-32-in-Shenzhen-Debut--41092771/,
GN:T:WP,Wollongong's offshore wind farm made with BlueScope steel - Illawarra Mercury,https://www.illawarramercury.com.au/story/7834716/bluescope-puts-wollongong-in-box-seat-for-offshore-wind-farm/,
GN:T:WP,Eesti Energia selling Tootsi Wind Farm to subsidiary Enefit Green - ERR News,https://news.err.ee/1608667885/eesti-energia-selling-tootsi-wind-farm-to-subsidiary-enefit-green,
