feed,title,long_url,short_url
GN:T:WP,Reality Check: Fossil Gas No Longer Needed As Bridge To Clean Energy Future - CleanTechnica,https://cleantechnica.com/2022/01/05/reality-check-fossil-gas-no-longer-needed-as-bridge-to-clean-energy-future/,
GN:T:WP,"Judge tosses lawsuit from F-35 opponents, says National Guard environmental review OK - Madison",https://madison.com/wsj/news/local/environment/judge-tosses-lawsuit-from-f-35-opponents-says-national-guard-environmental-review-ok/article_0868667a-0349-5d78-a6e7-b7f31270e15e.html,
GN:T:WP,Volvo FH Electric Heavy Duty Truck Exceeds Expectations On Test Run - CleanTechnica,https://cleantechnica.com/2022/01/05/volvo-fh-electric-heavy-duty-truck-exceeds-expectations-on-test-run/,
GN:T:WP,Nordex Group receives an order Finnish wind farm - Energy Global,https://www.energyglobal.com/wind/05012022/nordex-group-receives-an-order-finnish-wind-farm/,
GN:T:WP,Startup Uses Innovative Gravity System To Store And Distribute Green Energy - Screen Rant,https://screenrant.com/meet-a-new-type-of-green-energy-gravity/,
GN:T:WP,Coast to Coast in a Tesla Model Y - CleanTechnica,https://cleantechnica.com/2022/01/05/coast-to-coast-in-a-tesla-model-y/,
GN:T:WP,Gardai appeal for information after 'large amount of copper' stolen from windfarm in Offaly - Offaly Express,https://www.offalyexpress.ie/news/home/715333/gardai-appeal-for-information-after-large-amount-of-copper-stolen-from-windfarm-in-offaly.html,
GN:T:WP,Fortescue buys battery-powered trains as green shift for miners heats up - Sydney Morning Herald,https://www.smh.com.au/business/companies/slow-but-sure-miners-are-looking-for-cleaner-power-as-green-shift-heats-up-20220105-p59m3c.html,
GN:T:WP,"'If it ain't broke, don't fix it': Welsh Secretary says there is no 'public appetite' for giving Wales control of Crown Estate - Nation",https://nation.cymru/news/if-it-aint-broke-dont-fix-it-welsh-secretary-says-there-is-no-public-appetite-for-giving-wales-control-of-crown-estate/,
GN:T:WP,Norway’s Plugin EVs Take 90% Share In December — Even Facing One-Off Headwinds - CleanTechnica,https://cleantechnica.com/2022/01/05/norways-plugin-evs-take-90-share-in-december-even-facing-one-off-headwinds/,
GN:T:WP,How Many Americans Have Access To Electricity Where They Park? - CleanTechnica,https://cleantechnica.com/2022/01/05/how-many-americans-have-access-to-electricity-where-they-park/,
GN:T:WP,Washington State Could Lead USA In Building Electrification Codes - CleanTechnica,https://cleantechnica.com/2022/01/05/washington-state-could-lead-usa-in-building-electrification-codes/,
