feed,title,long_url,short_url
GN:T:RE,Zoetis commits to going carbon neutral by 2030 - DVM 360,https://www.dvm360.com/view/zoetis-commits-to-going-carbon-neutral-by-2030,
GN:T:RE,The 9 Best Energy Stocks to Buy for 2022 - Kiplinger's Personal Finance,https://www.kiplinger.com/investing/stocks/energy-stocks/604030/best-energy-stocks-to-buy-for-2022,
GN:T:RE,These new nailable solar shingles are installed like a traditional roof [Update] - Electrek,https://electrek.co/2022/01/06/these-new-nailable-solar-shingles-are-installed-like-a-traditional-roof/,
GN:T:RE,"Hydrogen power is gaining momentum, but critics say it's neither efficient nor green enough - CNBC",https://www.cnbc.com/2022/01/06/what-is-green-hydrogen-vs-blue-hydrogen-and-why-it-matters.html,
GN:T:RE,"Kazakhstan's deadly protests hit bitcoin, as the world's second-biggest mining hub shuts down - CNBC",https://www.cnbc.com/2022/01/06/kazakhstan-bitcoin-mining-shuts-down-amid-fatal-protests.html,
GN:T:RE,Brazil tops 13GW of installed PV capacity – pv magazine International - pv magazine International,https://www.pv-magazine.com/2022/01/06/brazil-tops-13gw-of-installed-pv-capacity/,
