feed,title,long_url,short_url
GN:T:RE,How industry is tackling the net zero transition - World Economic Forum,https://www.weforum.org/agenda/2022/01/net-zero-industrial-transition-climate-action/,
GN:T:RE,Milan's L'Innesto development to provide net-zero social housing - Dezeen,https://www.dezeen.com/2022/01/18/milan-linnesto-net-zero-social-housing-linnesto-development-architecture/,
GN:T:RE,Garmin Fenix 7 Series In-Depth Review - DC Rainmaker,https://www.dcrainmaker.com/2022/01/garmin-fenix7-7s-7x-in-depth-review.html,
GN:T:RE,Philippines clears 62 PV projects totaling 1.3GW for renewable portfolio standards - pv magazine International,https://www.pv-magazine.com/2022/01/17/philippines-clears-62-pv-projects-totaling-1-3gw-for-renewable-portfolio-standards/,
GN:T:RE,A Mayor and the Challenge of Making the City Safer - The New York Times,https://www.nytimes.com/2022/01/18/nyregion/a-mayor-and-the-challenge-of-making-the-city-safer.html,
