feed,title,long_url,short_url
LitCovid,"mRNA vaccine against SARS-CoV-2 response is comparable between patients on dialysis and healthy controls after adjustment for age, gender and history of COVID-19 infection",https://pubmed.ncbi.nlm.nih.gov/39704990,
LitCovid,SARS-CoV-2 ORF8 drives osteoclastogenesis in preexisting immune-mediated inflammatory diseases,https://pubmed.ncbi.nlm.nih.gov/39704167,
LitCovid,Early antiviral CD4+ and CD8+ T cells are associated with upper airway clearance of SARS-CoV-2,https://pubmed.ncbi.nlm.nih.gov/39704169,
LitCovid,IL-25 and Periostin Serum Concentrations May Be Associated With COVID-19 Severity and Recovery,https://pubmed.ncbi.nlm.nih.gov/39704394,
LitCovid,Post-COVID Condition Risk Factors and Symptom Clusters and Associations with Return to Pre-COVID Health-Results from a 2021 Multi-State Survey,https://pubmed.ncbi.nlm.nih.gov/39705503,
LitCovid,Women's Immune Systems May Explain Increased Long COVID Diagnoses,https://pubmed.ncbi.nlm.nih.gov/39705022,
LitCovid,In Search of COVID-19 Vaccines That Elicit Mucosal Immunity and Stop Transmission,https://pubmed.ncbi.nlm.nih.gov/39705023,
LitCovid,Circulating endothelial cells: a key biomarker of persistent fatigue after hospitalization for COVID-19,https://pubmed.ncbi.nlm.nih.gov/39704834,
LitCovid,COVID-19 mRNA-Vaccines During Pregnancy are Safe Based on Postpartum Placental Immune Profiles in Both Maternal and Fetal Compartments,https://pubmed.ncbi.nlm.nih.gov/39705527,
LitCovid,SARS-CoV-2: The Interplay Between Evolution and Host Immunity,https://pubmed.ncbi.nlm.nih.gov/39705164,
LitCovid,Dynamics of SARS-CoV-2 lineages in children and adults in 2021 and 2022,https://pubmed.ncbi.nlm.nih.gov/39705295,
LitCovid,"""The COVID-19 pandemic in BRICS: Milestones, interventions, and molecular epidemiology""",https://pubmed.ncbi.nlm.nih.gov/39705269,
LitCovid,Cardiovascular complications in vascular connective tissue disorders after COVID-19 infection and vaccination,https://pubmed.ncbi.nlm.nih.gov/39705273,
LitCovid,Evaluation of the efficacy of convalescent plasma in moderate to severe COVID-19 during 2020-2021: a retrospective observational study,https://pubmed.ncbi.nlm.nih.gov/39704231,
LitCovid,Impact of Changes in Criminal-Legal Practices During the COVID-19 Pandemic on the HIV Risk Behaviors of Women Who Use Drugs: Protocol for a Multimethods Qualitative Study,https://pubmed.ncbi.nlm.nih.gov/39705687,
LitCovid,Fully remote versus hybrid supervision of pulmonary telerehabilitation in COVID-19: a randomized clinical trial,https://pubmed.ncbi.nlm.nih.gov/39704643,
LitCovid,Factors affecting covid-19 outcomes in patients with hematological malignancies,https://pubmed.ncbi.nlm.nih.gov/39704454,
LitCovid,Cost-effectiveness of outpatient COVID-19 antiviral treatment with Nirmatrelvir/Ritonavir versus usual care in Swedish patients with various risk factors,https://pubmed.ncbi.nlm.nih.gov/39704673,
LitCovid,Application of a Language Model Tool for COVID-19 Vaccine Adverse Event Monitoring Using Web and Social Media Content: Algorithm Development and Validation Study,https://pubmed.ncbi.nlm.nih.gov/39705077,
LitCovid,In Reply: High Fatality Rates in Pediatric Multisystem Inflammatory Syndrome: A Multicenter Experience From the Epicenter of Brazil's Coronavirus Pandemic,https://pubmed.ncbi.nlm.nih.gov/39705407,
LitCovid,Taking Action to Support Nursing Home Resident Wellbeing: Perspectives of U.S. Nursing Home Staff During COVID-19.,https://pubmed.ncbi.nlm.nih.gov/39704334,
LitCovid,Being vulnerable with viewers: Exploring how medical YouTubers communicated about COVID-19 with the public,https://pubmed.ncbi.nlm.nih.gov/39705277,
LitCovid,Scope+: An open source generalizable architecture for single-cell RNA-seq atlases at sample and cell levels,https://pubmed.ncbi.nlm.nih.gov/39705183,
LitCovid,Patient Organizations' Digital Responses to the COVID-19 Pandemic: Scoping Review,https://pubmed.ncbi.nlm.nih.gov/39705075,
LitCovid,Platelet spleen tyrosine kinase is a key regulator of anti-PF4 antibody-induced immunothrombosis,https://pubmed.ncbi.nlm.nih.gov/39705541,
LitCovid,"Food insecurity and BMI are associated with depressive symptoms among adolescents in Yogyakarta province, Indonesia, during the COVID-19 pandemic: a 1-year longitudinal study",https://pubmed.ncbi.nlm.nih.gov/39704447,
LitCovid,"Chlorine disinfectant significantly changed microfauna habitat, community structure, and colonization mode in wastewater treatment plants",https://pubmed.ncbi.nlm.nih.gov/39704533,
LitCovid,Association of Polypharmacy and Burden of Comorbidities on COVID-19 Adverse Outcomes in People with Type 1 or Type 2 Diabetes,https://pubmed.ncbi.nlm.nih.gov/39704965,
LitCovid,Exploring Resources and Reasoning Practices in Socioscientific System Modeling for Justice-Centered Science Education,https://pubmed.ncbi.nlm.nih.gov/39705680,
LitCovid,Clinical and cost-effectiveness of parenting intervention for mothers experiencing psychosocial stress: insights from the early closure of the Mellow Babies RCT,https://pubmed.ncbi.nlm.nih.gov/39704733,
LitCovid,"Efficacy and safety of a 72-h infusion of prostacyclin (1 ng/kg/min) in mechanically ventilated patients with pulmonary infection and endotheliopathy-protocol for the multicenter randomized, placebo-controlled, blinded, investigator-initiated COMBAT-ARF trial",https://pubmed.ncbi.nlm.nih.gov/39704260,
LitCovid,Effect of modified intravascular laser irradiation of blood in the oral and systemic conditions during dental treatment-A systematic review,https://pubmed.ncbi.nlm.nih.gov/39704836,
LitCovid,Howell-Jolly Body-Like Neutrophil Inclusions Following Hematopoietic Stem Cell Transplantation: A Case Report,https://pubmed.ncbi.nlm.nih.gov/39705216,
LitCovid,New Diagnoses of Juvenile Idiopathic Arthritis Early in the COVID-19 Pandemic: Analysis of a Large United States Commercial Insurance Database,https://pubmed.ncbi.nlm.nih.gov/39705125,
LitCovid,Contribution of the community pharmacist workforce to primary care through the lens of medicines classification: comparison of Aotearoa New Zealand and Australia,https://pubmed.ncbi.nlm.nih.gov/39704767,
LitCovid,Patient demographics and psychotropic medication prescribing in Australian general practices: pre- and during COVID-19 pandemic,https://pubmed.ncbi.nlm.nih.gov/39704762,
LitCovid,scGraph2Vec: a deep generative model for gene embedding augmented by graph neural network and single-cell omics data,https://pubmed.ncbi.nlm.nih.gov/39704704,
