feed,title,long_url,short_url
GN:T:WP,"Mercedes-Benz to build wind farm in northwestern Germany, examining solar options - Reuters",https://www.reuters.com/business/energy/mercedes-benz-build-wind-farm-northwestern-germany-examining-solar-options-2022-09-19/,
GN:T:WP,EDS wins contract for Formosa II offshore wind farm in Taiwan - Power Technology,https://www.power-technology.com/news/eds-formosa-wind-farm/,
GN:T:WP,Governor Hochul Announces New Competitive Solicitation Calling for 2000 Megawatts or More of New Large-Scale Renewable Energy Projects - ny,https://www.governor.ny.gov/news/governor-hochul-announces-new-competitive-solicitation-calling-2000-megawatts-or-more-new,
GN:T:WP,United States progresses toward climate goals - ShareAmerica,https://share.america.gov/united-states-progresses-toward-climate-goals/,
GN:T:WP,Wind energy battle waged at county commission – The Kansan - Newton Kansan,https://www.thekansan.com/2022/09/22/wind-energy-battle-waged-at-county-commission/,
GN:T:WP,"Mining, Land Grabs, and More: When Decarbonization Conflicts With Human Rights - Columbia University",https://news.climate.columbia.edu/2022/09/22/mining-land-grabs-and-more-when-decarbonization-conflicts-with-human-rights/,
GN:T:WP,Manchin's Red Tape Reform Could Supercharge Renewable Energy - TIME,https://time.com/6215549/joe-manchins-red-tape-reform-could-supercharge-renewable-energy/,
GN:T:WP,Nexans to supply Ørsted - Eversource offshore wind project serving Connecticut and Rhode Island states - PR Newswire,https://www.prnewswire.com/news-releases/nexans-to-supply-orsted--eversource-offshore-wind-project-serving-connecticut-and-rhode-island-states-301630437.html,
GN:T:WP,Wind energy industry warns: actions not words needed from governments to address energy security and climate crises ahead of COP27 - PR Newswire,https://www.prnewswire.com/news-releases/wind-energy-industry-warns-actions-not-words-needed-from-governments-to-address-energy-security-and-climate-crises-ahead-of-cop27-301630657.html,
GN:T:WP,"The Pathway to 90% Clean Electricity Is Mostly Clear. The Last 10%, Not So Much - InsideClimate News",https://insideclimatenews.org/news/22092022/inside-clean-energy-last-10-percent/,
GN:T:WP,"McKee, environmental leaders to celebrate Block Island Wind Farm - WLNE-TV (ABC6)",https://www.abc6.com/mckee-environmental-leaders-to-celebrate-block-island-wind-farm/,
GN:T:WP,Putin Forces All Energy Workers To Register For Military Draft - OilPrice,https://oilprice.com/Latest-Energy-News/World-News/The-Coal-Unit-Britain-Cant-Afford-To-Close-Down.html,
GN:T:WP,Could conservation and wind turbine port coexist on Sears Island? Some think so - Republican Journal,https://waldo.villagesoup.com/2022/09/22/could-conservation-and-wind-turbine-port-coexist-on-sears-island-some-think-so/,
GN:T:WP,Prysmian awarded more than €800M for two offshore wind farm grid connection cable systems in Germany - Prysmian Group,https://www.prysmiangroup.com/en/press-release/prysmian-awarded-more-than-%E2%82%AC-800-m-for-two-offshore-wind-farm-grid-connection-cable-systems-in-germany,
GN:T:WP,Campbell Leads LPSC in Favor of Caddo Solar Project - Bossier Press-Tribune Online,https://bossierpress.com/campbell-leads-lpsc-in-favor-of-caddo-solar-project/,
GN:T:WP,"Vertical Axis Wind Turbine #3DThursday #3DPrinting « Adafruit Industries – Makers, hackers, artists, designers and engineers! - Adafruit Blog",https://blog.adafruit.com/2022/09/22/vertical-axis-wind-turbine-3dthursday-3dprinting/,
GN:T:WP,Ocean Winds: a symbol of the rise of offshore wind power - ENGIE,https://www.engie.com/en/news/offshore-wind-ocean-winds,
GN:T:WP,Wind farm charity funding rural projects in Conwy and Denbighshire - North Wales Pioneer,https://www.northwalespioneer.co.uk/news/22446592.wind-farm-charity-funding-rural-projects-conwy-denbighshire/,
GN:T:WP,There’s a huge surge in solar production under way – and Australia could show the world how to use it - RenewEconomy,https://reneweconomy.com.au/theres-a-huge-surge-in-solar-production-under-way-and-australia-could-show-the-world-how-to-use-it/,
GN:T:WP,Millions handed energy lifeline with 'cost effective' fix to save £10bn in 'simple switch' - Express,https://www.express.co.uk/news/science/1672680/energy-crisis-lifeline-radiator-fix-insulation-10billion-simple-switch,
GN:T:WP,"SA is not an island – load shedding happens everywhere, says Mantashe - The Citizen",https://www.citizen.co.za/news/south-africa/load-shedding/sa-is-not-an-island-load-shedding-happens-everywhere-says-mantashe/,
GN:T:WP,Wind energy: It's not too late to learn from Denmark - The Irish Times,https://www.irishtimes.com/environment/climate-crisis/2022/09/22/wind-energy-its-not-too-late-to-learn-from-denmark/,
