feed,title,long_url,short_url
GN:T:WP,"Novel database on existing, planned renewables, solar projects in Africa - pv magazine International",https://www.pv-magazine.com/2023/01/09/novel-database-on-existing-planned-renewables-solar-projects-in-africa/,https://da.gd/ywz8qv
GN:T:WP,DEME lands USA installation contract | News - HeavyLift & Project Forwarding International,https://www.heavyliftpfi.com/sectors/deme-lands-usa-installation-contract/21915.article,https://da.gd/iFiPk
GN:T:WP,California weather: Newsom seeks federal help ahead of brutal storms - USA TODAY,https://www.usatoday.com/story/news/nation/2023/01/08/california-storm-billion-dollar-disaster/11012995002/,https://da.gd/wew7GM
GN:T:WP,Old wind turbines need replacement - Kathimerini English Edition,https://www.ekathimerini.com/economy/1201791/old-wind-turbines-need-replacement/,https://da.gd/rIjZd
GN:T:WP,Port Esbjerg adds Liebherr crane | News - HeavyLift & Project Forwarding International,https://www.heavyliftpfi.com/sectors/port-esbjerg-adds-liebherr-crane/21914.article,https://da.gd/m58f7M
GN:T:WP,Sacramento digs out from major wind damage as officials brace for more storms - Sacramento Bee,https://www.sacbee.com/news/weather-news/article270921507.html,https://da.gd/LzYHtb
GN:T:WP,UK’s EV Share Hits 40% In December – Tesla Model Y Overall Bestseller - CleanTechnica,https://cleantechnica.com/2023/01/09/uks-ev-share-hits-40-in-december-tesla-model-y-overall-bestseller/,https://da.gd/UueJos
GN:T:WP,Nel and Statkraft give boost to hydrogen value chain in Norway - Offshore Energy,https://www.offshore-energy.biz/nel-and-statkraft-give-boost-to-hydrogen-value-chain-in-norway/,https://da.gd/5Nffs
GN:T:WP,"Aker Solutions, Drydocks to Upgrade Petrojarl Knarr FPSO for Deployment at Equinor's Rosebank Field - Offshore Engineer",https://www.oedigital.com/news/502007-aker-solutions-drydocks-to-upgrade-petrojarl-knarr-fpso-for-deployment-at-equinor-s-rosebank-field,https://da.gd/IcMrrt
GN:T:WP,The Philippines Gets $13.7B Investment Pledges From Chinese Companies For Renewable Energy - SolarQuarter,https://solarquarter.com/2023/01/09/the-philippines-gets-13-7b-investment-pledges-from-chinese-companies-for-renewable-energy/,https://da.gd/PdeEeY
GN:T:WP,Former Czech Prime Minister Andrej Babis acquitted in fraud case involving European Union subsidies - Taiwan News,https://www.taiwannews.com.tw/en/news/4775322,https://da.gd/EfSlw
GN:T:WP,Tories want free energy for people living near wind farms - The Times,https://www.thetimes.co.uk/article/tories-want-free-energy-people-living-near-wind-farms-xsf36hfbm,https://da.gd/wYIXPH
