feed,title,long_url,short_url
Medium,Yapay Öğrenme: Rastgele Orman,https://medium.com/p/e8debdc886e7,
Medium,Software engineering for Machine Learning,https://medium.com/p/af70bd348fef,
Medium,"These experts will bet you $500,000 that you are wrong about the future of artificial intelligence…",https://medium.com/p/2995d3120df6,
Medium,ML design book errata,https://medium.com/p/4b4500609b2d,
Medium,Which Inference?,https://medium.com/p/997e2eeacc81,
Medium,How To Speed Up Your Grid Search 60x,https://medium.com/p/fec2a8250517,
Medium,What is MLOPS?,https://medium.com/p/9789b1489a9a,
Medium,Personality Prediction System End to End Deployment on Flask,https://medium.com/p/10d1af9faf78,
