feed,title,long_url,short_url
Medium,Increasing Model Throughput with Variable Tensor Shape Computations,https://medium.com/p/703d34765ee1,
Medium,#8: AI With Me by Richmond Alake — HalfWay Already!,https://medium.com/p/c343d8adf9d4,
Medium,Applied RL: Customized Deep Reinforcement Learning for Algorithmic Trading,https://medium.com/p/106b1a2daa16,
Medium,Applied RL: Custom Gym environment for multi-stock RL based Algo trading,https://medium.com/p/113b07dd445d,
Medium,Applied RL: Custom RL for Algo Trading — Data Preprocessing,https://medium.com/p/4478251b9676,
Medium,Applied RL: Customization of RL policies using StableBaselines3,https://medium.com/p/a5a9e2cf763e,
Medium,Applied RL: Advanced deep learning customization of neural networks for RL based Algo trading,https://medium.com/p/3e73ca771bac,
Medium,Top 11 learning management systems of 2022,https://medium.com/p/9da4d1526bd7,
Medium,Five Approaches To Managing Conversational Dialog,https://medium.com/p/3f43d3255584,
