feed,title,long_url,short_url
GN:S:GW,U.N. Security Council to meet on global warming impact on world peace - The Japan Times,https://www.japantimes.co.jp/news/2021/02/21/world/un-security-council-climate/,
GN:S:GW,"Heating Arctic may be to blame for snowstorms in Texas, scientists argue - The Guardian",https://www.theguardian.com/science/2021/feb/17/arctic-heating-winter-storms-climate-change,
GN:S:GW,Natural Selections: This Topsy-Turvy Winter: Blame Climate Change - Montgomery Newspapers,https://www.montgomerynews.com/news/natural-selections-this-topsy-turvy-winter-blame-climate-change/article_2e4b4a4e-744b-11eb-9516-8bc120720ec3.html,
GN:S:GW,Facebook Will Start Debunking Climate Change Myths by Adding Labels to Posts - One Green Planet,https://www.onegreenplanet.org/environment/facebook-will-start-debunking-climate-change-myths-by-adding-labels-to-posts/,
GN:S:GW,2.7 Million Texas Households Are Without Power Due to Severe Winter Weather: Is Global Warming to Blame? - One Green Planet,https://www.onegreenplanet.org/environment/2-7-million-texas-households-are-without-power-due-to-severe-winter-weather-is-global-warming-to-blame/,
GN:S:GW,Freak cold in Texas has scientists discussing whether climate change is to blame - CNA,https://www.channelnewsasia.com/news/world/freak-cold-in-texas-has-scientists-discussing-whether-climate-change-is-to-blame-14222652,
