feed,title,long_url,short_url
GN:T:WP,"3 dead after bus, tractor-trailer collide in Virginia - WTOP",https://wtop.com/virginia/2022/12/3-dead-after-bus-tractor-trailer-collide-in-virginia/,https://da.gd/840S
GN:T:WP,US lab hits fusion milestone raising hopes for clean power - The Business Standard,https://www.tbsnews.net/tech/us-lab-hits-fusion-milestone-raising-hopes-clean-power-552982,https://da.gd/SNsq9c
GN:T:WP,"Another Incentive for Tesla Car Buyers in Q4 Push: 10,000 Free Supercharger Miles - CleanTechnica",https://cleantechnica.com/2022/12/16/another-incentive-for-tesla-car-buyers-in-q4-push-10000-free-supercharger-miles/,https://da.gd/ObikVy
GN:T:WP,Our Order Book Is Likely To Exceed 4 GW by March 2023 at Envision Energy India - Saurenergy,https://www.saurenergy.com/solar-energy-news/our-order-book-is-likely-to-exceed-4-gw-by-march-2023-at-envision-energy-india,https://da.gd/kOnCUW
GN:T:WP,SSEN Transmission announce work to connect Creag Riabhach Wind Farm on Altnaharra Estate to grid is now complete - Northern Times,https://www.northern-times.co.uk/news/ssen-transmission-announce-work-to-connect-creag-riabhach-wi-296935/,https://da.gd/zsW0s4
