feed,title,long_url,short_url
GN:T:WP,Vestas nabs 347 MW of wind turbine contracts in Brazil - Renewables Now,https://renewablesnow.com/news/vestas-nabs-347-mw-of-wind-turbine-contracts-in-brazil-790307/,
GN:T:WP,Ørsted's Ortiz Says Wind Industry Jobs in RI Can Grow From Hundreds to Thousands - GoLocalProv,https://www.golocalprov.com/business/rsteds-ortiz-says-the-wind-industry-in-ri-can-grow-from-hundreds-to-thousan,
GN:T:WP,Foundation Installation Starts at Saint-Brieuc Offshore Wind Farm - Offshore WIND,https://www.offshorewind.biz/2022/07/01/foundation-installation-starts-at-saint-brieuc-offshore-wind-farm/,
GN:T:WP,"wpd, Australis to develop 1.4GW offshore projects in Australia - Power Technology",https://www.power-technology.com/news/wpd-australis-australia/,
GN:T:WP,Youngkin administration warns feds new wind areas could hurt commercial fisheries - Virginia Mercury,https://www.virginiamercury.com/2022/07/01/youngkin-administration-warns-feds-new-wind-areas-could-hurt-commercial-fisheries/,
GN:T:WP,Rovco signs contract with Van Oord - Energy Global,https://www.energyglobal.com/wind/01072022/rovco-signs-contract-with-van-oord/,
