feed,title,long_url,short_url
GN:T:RE,#TECH: Solar power makes the future of electric mobility brighter - New Straits Times,https://www.nst.com.my/lifestyle/bots/2022/07/809794/tech-solar-power-makes-future-electric-mobility-brighter,
GN:T:RE,US Energy Information Administration - EIA,https://www.eia.gov/todayinenergy/detail.php?id=52959,
GN:T:RE,Hybridizing floating solar with hydropower – pv magazine International - pv magazine International,https://www.pv-magazine.com/2022/07/01/hybridizing-floating-solar-with-hydropower/,
GN:T:RE,Buying A House With Solar Panels - Bankrate,https://www.bankrate.com/real-estate/buying-house-with-solar-panels/,
GN:T:RE,NM Solar and Renewable Energy Companies - Albuquerque Business First - The Business Journals,https://www.bizjournals.com/albuquerque/subscriber-only/2022/07/01/nm-solar-and-renewable-energy-companies.html,
GN:T:RE,"Crypto's Climate Impact: 8 Claims, Fact-Checked - TIME",https://time.com/6193004/crypto-climate-impact-facts/,
