feed,title,long_url,short_url
GN:T:CC,Sanders Warns New Cold War With China 'Could Doom Our Planet' - Common Dreams,https://news.google.com/rss/articles/CBMiM2h0dHBzOi8vd3d3LmNvbW1vbmRyZWFtcy5vcmcvbmV3cy91cy1jaGluYS1jb2xkLXdhctIBAA?oc=5,https://da.gd/Jn9hDH
GN:T:CC,Navigating the continuum between adaptation and maladaptation - Nature,https://news.google.com/rss/articles/CBMiMmh0dHBzOi8vd3d3Lm5hdHVyZS5jb20vYXJ0aWNsZXMvczQxNTU4LTAyMy0wMTc3NC020gEA?oc=5,https://da.gd/bjiyF
GN:T:CC,More than a thousand fires burning across Canada - CGTN America,https://news.google.com/rss/articles/CCAiC2lIczZTWTRla1pZmAEB?oc=5,https://da.gd/zKCM
GN:T:CC,What Oppenheimer Might Teach Us About Climate Change and Geoengineering - Foreign Policy,https://news.google.com/rss/articles/CBMiiwFodHRwczovL2ZvcmVpZ25wb2xpY3kuY29tLzIwMjMvMDgvMjEvb3BwZW5oZWltZXItbW92aWUtYXRvbS1ib21iLWNsaW1hdGUtY2hhbmdlLWdlb2VuZ2luZWVyaW5nLXNvbGFyLXJhZGlhdGlvbi1tb2RpZmljYXRpb24tc3JtLXJlZ3VsYXRpb24v0gEA?oc=5,https://da.gd/OygPY
GN:T:CC,How we broke the water cycle and can no longer rely on rain to fall - New Scientist,https://news.google.com/rss/articles/CBMieGh0dHBzOi8vd3d3Lm5ld3NjaWVudGlzdC5jb20vYXJ0aWNsZS9tZzI1OTM0NTMwLTQwMC1ob3ctd2UtYnJva2UtdGhlLXdhdGVyLWN5Y2xlLWFuZC1jYW4tbm8tbG9uZ2VyLXJlbHktb24tcmFpbi10by1mYWxsL9IBAA?oc=5,https://da.gd/E9ZzKR
