feed,title,long_url,short_url
RS,Effect of COVID-19 Period on Tuberculosis Treatment Success; a Mixed Methods Study among Tuberculosis patients at Jinja Regional Referral Hospital,https://www.researchsquare.com/article/rs-2056991/latest,https://bit.ly/3f2uuBI
RS,Machine Learning Approaches for Predicting Suicidal Behaviors among University Students in Bangladesh during the COVID-19 Pandemic,https://www.researchsquare.com/article/rs-2069873/latest,https://bit.ly/3UkEJl7
RS,Targeting TRIM28-mediated SUMOylation of SARS-CoV-2 Nucleocapsid Protein Inhibits SARS-CoV-2 Infection,https://www.researchsquare.com/article/rs-2069394/latest,https://bit.ly/3f7BOvK
RS,IFN-γ mediated-cellular immunity is essential to the vaccine-induced protection against SARS-CoV-2,https://www.researchsquare.com/article/rs-2035535/latest,https://bit.ly/3Lt2ROq
RS,"The relationship between COVID-19 protection behaviors and pandemic-related knowledge, perceptions, worry content and public trust in a Turkish sample",https://www.researchsquare.com/article/rs-2067425/latest,https://bit.ly/3QZJIES
