feed,title,long_url,short_url
GN:T:CC,Opinion | Biden Set an Ambitious Goal for Nature. It’s Time He Went After It. - The New York Times,https://www.nytimes.com/2022/12/31/opinion/biodiversity-summit.html,https://da.gd/ZdQqq
GN:T:CC,NASA sensors could help detect landfill methane from space to help limit climate change - Space,https://www.space.com/nasa-mapping-methane-from-space-climate-change,https://da.gd/w1Bi
GN:T:CC,"Burst pipes in Jackson, Mississippi, are just the latest of the city's water woes - NPR",https://www.npr.org/2022/12/31/1145966097/water-problems-jackson-mississippi-explanation,https://da.gd/6AMCh4
GN:T:CC,Guess Who’s Loving Climate Change: Mosquitos And The Pathogens They Carry - Forbes,https://www.forbes.com/sites/jeffmcmahon/2022/12/31/guess-whos-loving-climate-change-mosquitos-and-the-pathogens-they-carry/,https://da.gd/LvtmDV
GN:T:CC,2022 was the year of drought - NBC News,https://www.nbcnews.com/science/environment/2022-was-year-drought-rcna62410,https://da.gd/pYlXw
