feed,title,long_url,short_url
GN:T:CC,Michigan just passed one of the country's most ambitious clean energy… - Canary Media,https://news.google.com/rss/articles/CBMieGh0dHBzOi8vd3d3LmNhbmFyeW1lZGlhLmNvbS9hcnRpY2xlcy9wb2xpdGljcy9taWNoaWdhbi1qdXN0LXBhc3NlZC1vbmUtb2YtdGhlLWNvdW50cnlzLW1vc3QtYW1iaXRpb3VzLWNsZWFuLWVuZXJneS1iaWxsc9IBAA?oc=5,https://da.gd/Q8llM
GN:T:CC,Michigan Gov. Gretchen Whitmer’s 100% Clean Energy Bills Pass - HuffPost,https://news.google.com/rss/articles/CBMiYmh0dHBzOi8vd3d3Lmh1ZmZwb3N0LmNvbS9lbnRyeS9ncmV0Y2hlbi13aGl0bWVyLW1pY2hpZ2FuLWVuZXJneS1jbGltYXRlX25fNjU0MmE4ZjhlNGIwNmJjMDFlMjJjY2Fh0gFmaHR0cHM6Ly93d3cuaHVmZnBvc3QuY29tL2VudHJ5L2dyZXRjaGVuLXdoaXRtZXItbWljaGlnYW4tZW5lcmd5LWNsaW1hdGVfbl82NTQyYThmOGU0YjA2YmMwMWUyMmNjYWEvYW1w?oc=5,https://da.gd/f41wR
GN:T:CC,The Woman Who Demonstrated the Greenhouse Effect - Scientific American,https://news.google.com/rss/articles/CBMiXGh0dHBzOi8vd3d3LnNjaWVudGlmaWNhbWVyaWNhbi5jb20vYXJ0aWNsZS90aGUtd29tYW4td2hvLWRlbW9uc3RyYXRlZC10aGUtZ3JlZW5ob3VzZS1lZmZlY3Qv0gFlaHR0cHM6Ly93d3cuc2NpZW50aWZpY2FtZXJpY2FuLmNvbS9hcnRpY2xlL3RoZS13b21hbi13aG8tZGVtb25zdHJhdGVkLXRoZS1ncmVlbmhvdXNlLWVmZmVjdC8_YW1wPXRydWU?oc=5,https://da.gd/wxDGyG
GN:T:CC,Many California cities are understaffed and unprepared to mobilize climate funds: report - The Hill,https://news.google.com/rss/articles/CBMiTGh0dHBzOi8vdGhlaGlsbC5jb20vaG9tZW5ld3MvNDMwMjA0OS1jYWxpZm9ybmlhLWNpdGllcy1jbGltYXRlLWZ1bmRzLXJlcG9ydC_SAVBodHRwczovL3RoZWhpbGwuY29tL2hvbWVuZXdzLzQzMDIwNDktY2FsaWZvcm5pYS1jaXRpZXMtY2xpbWF0ZS1mdW5kcy1yZXBvcnQvYW1wLw?oc=5,https://da.gd/AUEou
GN:T:CC,Luminous 'mother-of-pearl' clouds explain why climate models miss so much Arctic and Antarctic warming - The Conversation,https://news.google.com/rss/articles/CBMihwFodHRwczovL3RoZWNvbnZlcnNhdGlvbi5jb20vbHVtaW5vdXMtbW90aGVyLW9mLXBlYXJsLWNsb3Vkcy1leHBsYWluLXdoeS1jbGltYXRlLW1vZGVscy1taXNzLXNvLW11Y2gtYXJjdGljLWFuZC1hbnRhcmN0aWMtd2FybWluZy0yMTcwNjbSAQA?oc=5,https://da.gd/CkEYT2
GN:T:CC,Canada says it can fight climate change and be major oil nation. Massive fires may force a reckoning - Yahoo News,https://news.google.com/rss/articles/CBMiRmh0dHBzOi8vbmV3cy55YWhvby5jb20vY2FuYWRhLXNheXMtZmlnaHQtY2xpbWF0ZS1jaGFuZ2UtMTQzMzA4ODgxLmh0bWzSAU5odHRwczovL25ld3MueWFob28uY29tL2FtcGh0bWwvY2FuYWRhLXNheXMtZmlnaHQtY2xpbWF0ZS1jaGFuZ2UtMTQzMzA4ODgxLmh0bWw?oc=5,https://da.gd/oc3p48
GN:T:CC,"Smart climate policy is good for people, not just the environment - Salon",https://news.google.com/rss/articles/CBMiYmh0dHBzOi8vd3d3LnNhbG9uLmNvbS8yMDIzLzExLzA5L3NtYXJ0LWNsaW1hdGUtcG9saWN5LWlzLWdvb2QtZm9yLXBlb3BsZS1ub3QtanVzdC10aGUtZW52aXJvbm1lbnQv0gEA?oc=5,https://da.gd/3F9XCF
GN:T:CC,"In a first, pope to have day of private meetings with world leaders in Dubai - Reuters",https://news.google.com/rss/articles/CBMiZ2h0dHBzOi8vd3d3LnJldXRlcnMuY29tL3dvcmxkL2ZpcnN0LXBvcGUtaGF2ZS1kYXktcHJpdmF0ZS1tZWV0aW5ncy13aXRoLXdvcmxkLWxlYWRlcnMtZHViYWktMjAyMy0xMS0wOS_SAQA?oc=5,https://da.gd/ax1S
