feed,title,long_url,short_url
GN:T:CC,Water battery: Utah company advances Wyoming pumped-storage project - Salt Lake Tribune,https://www.sltrib.com/renewable-energy/2023/01/28/water-battery-utah-company/,https://da.gd/BarbiG
GN:T:CC,We are ‘greening’ ourselves to extinction - Al Jazeera English,https://www.aljazeera.com/opinions/2023/1/29/greening-ourselves-to-extinction,https://da.gd/0EnTbH
GN:T:CC,US actor Adrian Grenier to host TRT documentary on climate change | Daily Sabah - Daily Sabah,https://www.dailysabah.com/arts/cinema/us-actor-adrian-grenier-to-host-trt-documentary-on-climate-change,https://da.gd/E5u1oG
GN:T:CC,"On The Global Stage, Jacinda Ardern Was a Climate Champion, But Victories Were Hard to Come by at Home - InsideClimate News",https://insideclimatenews.org/news/29012023/jacinda-ardern-new-zealand-climate-change/,https://da.gd/KXMBc
GN:T:CC,The Life-Changing Magic of a Urologist - The New York Times,https://www.nytimes.com/2023/01/27/well/the-life-changing-magic-of-a-urologist.html,https://da.gd/V2Zd
