feed,title,long_url,short_url
GN:S:GW,The world agreed to ban this dangerous pollutant — and it's working - The Washington Post,https://news.google.com/rss/articles/CBMiZGh0dHBzOi8vd3d3Lndhc2hpbmd0b25wb3N0LmNvbS9jbGltYXRlLXNvbHV0aW9ucy8yMDI0LzA2LzExL2hjZmMtZ2FzLXJlZHVjdGlvbi1vem9uZS1nbG9iYWwtd2FybWluZy_SAQA?oc=5,https://da.gd/4PoS
GN:S:GW,Brazil joins the International Drought Resilience Alliance - UNCCD Website,https://news.google.com/rss/articles/CBMiaGh0dHBzOi8vd3d3LnVuY2NkLmludC9uZXdzLXN0b3JpZXMvcHJlc3MtcmVsZWFzZXMvYnJhemlsLWpvaW5zLWludGVybmF0aW9uYWwtZHJvdWdodC1yZXNpbGllbmNlLWFsbGlhbmNl0gEA?oc=5,https://da.gd/O9eCa
GN:S:GW,Research signals major milestone in cutting harmful gases that deplete ozone and worsen global warming - Phys,https://news.google.com/rss/articles/CBMiRmh0dHBzOi8vcGh5cy5vcmcvbmV3cy8yMDI0LTA2LW1ham9yLW1pbGVzdG9uZS1nYXNlcy1kZXBsZXRlLW96b25lLmh0bWzSAUVodHRwczovL3BoeXMub3JnL25ld3MvMjAyNC0wNi1tYWpvci1taWxlc3RvbmUtZ2FzZXMtZGVwbGV0ZS1vem9uZS5hbXA?oc=5,https://da.gd/EXbQC
GN:S:GW,From flood damage to coral bleaching: Global warming hits ocean economies hard - Fast Company,https://news.google.com/rss/articles/CBMicmh0dHBzOi8vd3d3LmZhc3Rjb21wYW55LmNvbS85MTEzODY1MC9mcm9tLWZsb29kLWRhbWFnZS10by1jb3JhbC1ibGVhY2hpbmctZ2xvYmFsLXdhcm1pbmctaGl0cy1vY2Vhbi1lY29ub21pZXMtaGFyZNIBAA?oc=5,https://da.gd/2Rovv
GN:S:GW,A decrease in radiative forcing and equivalent effective chlorine from hydrochlorofluorocarbons - Nature,https://news.google.com/rss/articles/CBMiMmh0dHBzOi8vd3d3Lm5hdHVyZS5jb20vYXJ0aWNsZXMvczQxNTU4LTAyNC0wMjAzOC030gEA?oc=5,https://da.gd/ZqdoB
GN:S:GW,Global Efforts Pay Off: Scientific Insights Into a Key Environmental Victory - SciTechDaily,https://news.google.com/rss/articles/CBMiZWh0dHBzOi8vc2NpdGVjaGRhaWx5LmNvbS9nbG9iYWwtZWZmb3J0cy1wYXktb2ZmLXNjaWVudGlmaWMtaW5zaWdodHMtaW50by1hLWtleS1lbnZpcm9ubWVudGFsLXZpY3Rvcnkv0gEA?oc=5,https://da.gd/g5fK71
GN:S:GW,EU puts digital Earth in orbit for climate-change fight - Phys,https://news.google.com/rss/articles/CBMiQWh0dHBzOi8vcGh5cy5vcmcvbmV3cy8yMDI0LTA2LWV1LWRpZ2l0YWwtZWFydGgtb3JiaXQtY2xpbWF0ZS5odG1s0gFAaHR0cHM6Ly9waHlzLm9yZy9uZXdzLzIwMjQtMDYtZXUtZGlnaXRhbC1lYXJ0aC1vcmJpdC1jbGltYXRlLmFtcA?oc=5,https://da.gd/Ufbpf
GN:S:GW,Researchers find association between media diet and science-consistent beliefs about climate change - Phys,https://news.google.com/rss/articles/CBMiSWh0dHBzOi8vcGh5cy5vcmcvbmV3cy8yMDI0LTA2LWFzc29jaWF0aW9uLW1lZGlhLWRpZXQtc2NpZW5jZS1iZWxpZWZzLmh0bWzSAUhodHRwczovL3BoeXMub3JnL25ld3MvMjAyNC0wNi1hc3NvY2lhdGlvbi1tZWRpYS1kaWV0LXNjaWVuY2UtYmVsaWVmcy5hbXA?oc=5,https://da.gd/7B3gLo
