feed,title,long_url,short_url
GN:S:C,2022 Hurricane season underscores that it only takes one storm - NPR,https://www.npr.org/2022/12/28/1140983972/the-2022-hurricane-season-shows-why-climate-change-is-so-dangerous,https://da.gd/JEc1fz
GN:S:C,"Climate labels on food lower red meat consumption, study finds - ABC 10 News San Diego KGTV",https://www.10news.com/news/national/climate-labels-on-food-lower-red-meat-consumption-study-finds,https://da.gd/DHbD
GN:S:C,Climate change can be daunting. One woman creates music to help ... - South Carolina Public Radio,https://www.southcarolinapublicradio.org/2022-12-28/climate-change-can-be-daunting-one-woman-creates-music-to-help-process-feelings-around-it,https://da.gd/Xcg6j
GN:S:C,"Climate change is coming for the Jersey Shore, retiring coastal expert warns - Phys",https://phys.org/news/2022-12-climate-jersey-shore-coastal-expert.html,https://da.gd/GW6iD0
GN:S:C,The role of young people in climate action across the world and in ... - kawarthaNOW,https://kawarthanow.com/2022/12/28/the-role-of-young-people-in-climate-action-across-the-world-and-in-peterborough/,https://da.gd/QK1lb
GN:S:C,Alaska leaders call for public comment on the 5th National Climate ... - kinyradio,https://www.kinyradio.com/news/news-of-the-north/alaska-leaders-call-for-public-comment-on-the-5th-national-climate-assessment/,https://da.gd/0Gtl
GN:S:C,Researchers lead study to develop climate-adapted pecan trees - Brownwood News,https://www.brownwoodnews.com/2022/12/28/researchers-lead-study-to-develop-climate-adapted-pecan-trees/,https://da.gd/xQ7voo
