feed,title,long_url,short_url
ArXiv:eess,Invariant Scattering Transform for Medical Imaging,https://arxiv.org/abs/2304.10582v1,
ArXiv:eess,Deep reproductive feature generation framework for the diagnosis of COVID-19 and viral pneumonia using chest X-ray images,https://arxiv.org/abs/2304.10677v1,
ArXiv:eess,SkinGPT: A Dermatology Diagnostic System with Vision Large Language Model,https://arxiv.org/abs/2304.10691v1,
ArXiv:eess,Interpretable and Robust AI in EEG Systems: A Survey,https://arxiv.org/abs/2304.10755v1,
ArXiv:eess,Boosting multiple sclerosis lesion segmentation through attention mechanism,https://arxiv.org/abs/2304.10790v1,
ArXiv:eess,Multi-frame-based Cross-domain Image Denoising for Low-dose Computed Tomography,https://arxiv.org/abs/2304.10839v1,
ArXiv:eess,Heart Rate Extraction from Abdominal Audio Signals,https://arxiv.org/abs/2304.11020v1,
ArXiv:eess,Color-based classification of EEG Signals for people with the severe locomotive disorder,https://arxiv.org/abs/2304.11068v1,
ArXiv:eess,Autoregressive models for biomedical signal processing,https://arxiv.org/abs/2304.11070v1,
ArXiv:eess,Multimodal contrastive learning for diagnosing cardiovascular diseases from electrocardiography (ECG) signals and patient metadata,https://arxiv.org/abs/2304.11080v1,
ArXiv:eess,A Convolutional Spiking Network for Gesture Recognition in Brain-Computer Interfaces,https://arxiv.org/abs/2304.11106v1,
ArXiv:eess,Self Pre-training with Masked Autoencoders for Medical Image Classification and Segmentation,https://arxiv.org/abs/2203.05573v2,
ArXiv:eess,When SAM Meets Medical Images: An Investigation of Segment Anything Model (SAM) on Multi-phase Liver Tumor Segmentation,https://arxiv.org/abs/2304.08506v2,
