feed,title,long_url,short_url
GN:S:GW,Republicans ask why White House removed climate scientist - The Associated Press,https://apnews.com/article/politics-science-climate-climate-change-environment-and-nature-27e8f788b654cfc4c4967add6d136748,
GN:S:GW,Activist Thunberg says global leaders still in denial over climate - Reuters,https://www.reuters.com/business/environment/activist-thunberg-says-global-leaders-still-denial-over-climate-2021-05-04/,
GN:S:GW,Climate change: The state of melting glaciers on sea levels - World Economic Forum,https://www.weforum.org/agenda/2021/05/melting-glaciers-sea-level-rise-climate-change-global-warming,
GN:S:GW,Gases used in refrigerators and air conditioners will be phased out in a new EPA rule - KCCI Des Moines,https://www.kcci.com/article/refrigerator-coolant-gases-phased-out-epa-rule/36329768,
GN:S:GW,California Sen. Padilla Proposes Vast Expansion Of Federally-Protected Public Lands In Fight Against Climate Change - CBS San Francisco,https://sanfrancisco.cbslocal.com/2021/05/04/california-sen-padilla-proposes-vast-expansion-of-federally-protected-public-lands-in-fight-against-climate-change/,
GN:S:GW,"A New Book Feeds Climate Doubters, but Scientists Say the Conclusions are Misleading and Out of Date - InsideClimate News",https://insideclimatenews.org/news/04052021/a-new-book-feeds-climate-doubters-but-scientists-say-the-conclusions-are-misleading-and-out-of-date/,
