feed,title,long_url,short_url
GN:T:AI,Haven wants to clarify machine learning's fuzzy future - GamesIndustry,https://www.gamesindustry.biz/haven-wants-to-clarify-machine-learnings-fuzzy-future,https://bit.ly/3rRsDD4
GN:T:AI,Users Are Building Their Own AI-Powered Alternatives to Amazon’s Ring Cameras - VICE,https://www.vice.com/en/article/bvm5p8/users-are-building-their-own-ai-powered-alternatives-to-amazons-ring-cameras,https://bit.ly/3RXdWsv
GN:T:AI,Google chases Amazon and Microsoft in cloud with AI technology - Tech Xplore,https://techxplore.com/news/2022-10-google-amazon-microsoft-cloud-ai.html,https://bit.ly/3CT8O4q
GN:T:AI,Neurons in a dish learn to play Pong — what's next? - Nature,https://www.nature.com/articles/d41586-022-03229-y,https://go.nature.com/3yxX5py
GN:T:AI,"Agencies should make internal workforce investments to improve AI implementation, experts say - Federal News Network",https://federalnewsnetwork.com/artificial-intelligence/2022/10/agencies-should-make-internal-workforce-investments-to-improve-ai-implementation-experts-say/,https://bit.ly/3CTZ7Ta
