feed,title,long_url,short_url
GN:T:WP,$5 Billion For Electric School Buses In US Infrastructure Investment & Jobs Act - CleanTechnica,https://cleantechnica.com/2021/12/18/5-billion-for-electric-school-buses-in-us-infrastructure-investment-jobs-act/,
GN:T:WP,Most PG&E customers who lost power in Vault Fire have been restored - KRON4,https://www.kron4.com/news/most-pge-customers-who-lost-power-in-vault-fire-have-been-restored/,
GN:T:WP,More details emerge on Onusberget wind farm financing - TXF,https://www.txfnews.com/Tracker/Details/71e32694-7d75-46c5-9a92-9b1f1ccc5bd5/More-details-emerge-on-Onusberget-wind-farm-financing,
GN:T:WP,City cleans up after second wind storm - Owen Sound Sun Times,https://www.owensoundsuntimes.com/news/local-news/city-cleans-up-after-second-wind-storm,
GN:T:WP,TTD to take up energy efficient measures - Times of India,https://timesofindia.indiatimes.com/city/visakhapatnam/ttd-to-take-up-energy-efficient-measures/articleshow/88347172.cms,
