feed,title,long_url,short_url
GN:T:SL,"Glen Cove waterfront at risk of flooding, report says, prompting city to adopt state climate pledge - Newsday",https://news.google.com/rss/articles/CBMiUWh0dHBzOi8vd3d3Lm5ld3NkYXkuY29tL2xvbmctaXNsYW5kL3Rvd25zL2dsZW4tY292ZS1jbGltYXRlLXN0dWR5LXBsZWRnZS10cjhjd3R2NdIBAA?oc=5,https://da.gd/9b5A
GN:T:SL,Using Data Visualizations to Reinforce Ecopedagogy - Teachers College Press,https://news.google.com/rss/articles/CBMiZmh0dHBzOi8vd3d3LnRjcHJlc3MuY29tL2Jsb2cvZWNvcGVkYWdvZ2ljYWwtcG90ZW50aWFsLWVjby12aXN1YWxpemF0aW9ucy1yaXNpbmctc2VhLWxldmVsLXByb2plY3Rpb25zL9IBAA?oc=5,https://da.gd/Ok7blR
GN:T:SL,Extreme Ocean Temperatures: Proof of the Suffering We Cause Our Home - Earth Day - Earth Day,https://news.google.com/rss/articles/CBMiXWh0dHBzOi8vd3d3LmVhcnRoZGF5Lm9yZy9leHRyZW1lLW9jZWFuLXRlbXBlcmF0dXJlcy1wcm9vZi1vZi10aGUtc3VmZmVyaW5nLXdlLWNhdXNlLW91ci1ob21lL9IBAA?oc=5,https://da.gd/aHQHNn
GN:T:SL,Owner plans to shift beachfront home on north shore Oahu to save it from erosion - erienewsnow,https://news.google.com/rss/articles/CBMie2h0dHBzOi8vd3d3LmVyaWVuZXdzbm93LmNvbS9zdG9yeS80OTM3MDk1OC9vd25lci1wbGFucy10by1zaGlmdC1iZWFjaGZyb250LWhvbWUtb24tbm9ydGgtc2hvcmUtb2FodS10by1zYXZlLWl0LWZyb20tZXJvc2lvbtIBAA?oc=5,https://da.gd/0NRiD
GN:T:SL,California's Waves Threaten to Plunge Homes Into Ocean - Newsweek,https://news.google.com/rss/articles/CBMiTmh0dHBzOi8vd3d3Lm5ld3N3ZWVrLmNvbS9jYWxpZm9ybmlhcy13YXZlcy10aHJlYXRlbi1wbHVuZ2UtaG9tZXMtb2NlYW4tMTgxODA3N9IBVGh0dHBzOi8vd3d3Lm5ld3N3ZWVrLmNvbS9jYWxpZm9ybmlhcy13YXZlcy10aHJlYXRlbi1wbHVuZ2UtaG9tZXMtb2NlYW4tMTgxODA3Nz9hbXA9MQ?oc=5,https://da.gd/eF2t
GN:T:SL,Australia needs an overarching maritime security strategy | The Strategist - The Strategist,https://news.google.com/rss/articles/CBMiXGh0dHBzOi8vd3d3LmFzcGlzdHJhdGVnaXN0Lm9yZy5hdS9hdXN0cmFsaWEtbmVlZHMtYW4tb3ZlcmFyY2hpbmctbWFyaXRpbWUtc2VjdXJpdHktc3RyYXRlZ3kv0gEA?oc=5,https://da.gd/JooIj
GN:T:SL,Melting Glacier Reveals Hiker Missing Since 1986 - Unofficial Networks,https://news.google.com/rss/articles/CBMiQGh0dHBzOi8vdW5vZmZpY2lhbG5ldHdvcmtzLmNvbS8yMDIzLzA4LzA4L21pc3NpbmctaGlrZXItZ2xhY2llci_SAURodHRwczovL3Vub2ZmaWNpYWxuZXR3b3Jrcy5jb20vMjAyMy8wOC8wOC9taXNzaW5nLWhpa2VyLWdsYWNpZXIvYW1wLw?oc=5,https://da.gd/bXnX
GN:T:SL,Kandal authorities warn of rising water level on Prek Tnaot River - Khmer Times,https://news.google.com/rss/articles/CBMiaWh0dHBzOi8vd3d3LmtobWVydGltZXNraC5jb20vNTAxMzM5MjA2L2thbmRhbC1hdXRob3JpdGllcy13YXJuLW9mLXJpc2luZy13YXRlci1sZXZlbC1vbi1wcmVrLXRuYW90LXJpdmVyL9IBAA?oc=5,https://da.gd/bKxsi
