feed,title,long_url,short_url
GN:S:C,"Administration Targeted Climate Lab in Effort to Free Trump Ally, Lawsuit Claims - The New York Times",https://news.google.com/rss/articles/CBMihAFBVV95cUxPTHFVYzFueWtTVmNTM200NWhTM3NLS1JjRm5ZOWlsZ2J2dWRneUNHamdNSU1rWDFjdjlWMXYwNXg4N2hZUlh3SWNIVWVjUkd5TGhlN2FyS0VpbFM5aWRmUEIzM1UwZ3Z6ZFMydGtZS3FBNlFFZU1uYjRJSWRQR2tLdzBGUnA?oc=5,
GN:S:C,"Reduced physical activity due to global heating will lead to rise in health issues, study says - The Guardian",https://news.google.com/rss/articles/CBMiwgFBVV95cUxPY3l5bFh5a2NDWDd5YWRJUTNzUWtnX3R0S1ZBSm1GTEY4RHRhQkc1R25fX25oQW9HS3BUWmlOcVVpd0plVGdwbFpaaUxFTHhIU0ZEZUxOWktMdlVhUXY2UFcyOEc5UFBmLS1LQUhIbTE0N1FDeDNPZi1zUGNyTmQ0eko3MENWX083UWtYbGhORHo1ZUlEN3lUaEJYTE95eTd2aHllOUUzV1JtVnlDYjltZWxzNXZVSXpJVTVIczQ4MC1UUQ?oc=5,
GN:S:C,Is Climate Change Quietly Fueling a Global Physical Inactivity Crisis? - The American Journal of Managed Care® (AJMC®),https://news.google.com/rss/articles/CBMinAFBVV95cUxPMG9Zcl9wM3I4U0ZaNkVVeEpYM2FLQ1AweWtRLWlyZFktWU9CTV84QjV4eTRuSjk3amhSc0RGeEtRcmZzZ2M5WHF4dDNrdHJxNTVlNVc3R2k1TFg1eHNoeXAwcTZjLVMxZlkxRDRMbkpYYkN2MEhWazRpZXRmMjM2SnVLLWNjMENVeHdYQjdHZFBVc01yakhsQWhPR1c?oc=5,
GN:S:C,Modeling suggests climate change could drive millions into physical inactivity by 2050 - Medical Xpress,https://news.google.com/rss/articles/CBMihwFBVV95cUxPbHA4THJRYTlQS0xJc1NYck1xV3g3LWZSLUR2ODBobGYzcWNtajliUFhKUVhqNXhHWDBWdTh0RTFEZUFnMFNDNGc4SUlKb1ZqakdwcW5QWTNaUWtYWTdpZC1vU0JSQWF1UWlnOVc2ckRvVG1rOEY3S2dFMVVyNUNfbDZ6eGVwRFE?oc=5,
GN:S:C,Springfield Cooler Communities Climate Fair showcases student talent - Western Mass News,https://news.google.com/rss/articles/CBMisgFBVV95cUxNQXNnaVVqb0pnVjhKLTU3NFVLNmhnd29SVDdzb2Rhc2NHaFhWM2tiX2ZkelpuU1VBMWlMc0JxZXMxZHJuTjZYSUF4SFJyMVJ1QXVLSjd5bzRhSmxId2owVDFhazRTaldWWjlYRnMwOV9uZDYwMlJ4eTQybFNvY09yNGRKS2pPRm5KWTUxZzU5a2hqWlZFMURQZEdnb21wd0lVWGpjdS1ZeHpOMV9ULU1qZVV3?oc=5,
GN:S:C,Inactivity in a warming world could spur hundreds of thousands of deaths - The Washington Post,https://news.google.com/rss/articles/CBMiqwFBVV95cUxQU3FzXzJtOWNTV1JBQ0Q0RVRuanYwWVVYVkVzMFpSR2RneFQ4bElLQ2dLMmU3cXRDcGhrcjVqRURGSkxncGVPRDhmb2RJMExMSHlTcEZHVUQzZkhaQVAtRVBWa0lsdTVmVVRIMVE2cEp1a29NSHh4MDdaMWdMdjRNN2R2Smd2WU1EN3RlWDlDblpyUTNuVE0tcHdCR0JmQ2ZObzB3NWZnZlJQek0?oc=5,
GN:S:C,"‘Godzilla’ El Niño: A Climate Scientist Explains What Could Happen in Terms of Surf, Snow, and Coastal Erosion - The Inertia",https://news.google.com/rss/articles/CBMiiwFBVV95cUxQZTZRR1ZmWXg1b1k2SndGU1YtLUFPUmw0ZzZQR1U3U2xER1VQd1BOMm90WkZ3NjV3VVdZVVNxWjdsTjdHdW1zY3BRaHBBUmRfWjVkM1djblF3VllQVDNjNndIdXc3aFpIcVR1WVVtSW51U0tPRVRqaWk3anUzV3BJTmtJNnctS2lJOGln?oc=5,
GN:S:C,"Spring, climate change, jet stream serves up buffet of wild weather hitting US - AP News",https://news.google.com/rss/articles/CBMiqwFBVV95cUxNVDRYT20xTnNIVEFnTlFhd3hmc2lydWNSMWkyWXRJZlNzTnFUZHZhUFdZMmVFeGVMSDFHQjdJN3UyWnZkMVNvYXhUdjcwbHc3STlDbDJGdEktOHdOdlFYMDRnWng4ZEhaeVpnUlN2UXlGZm1yM0RKcnN5Qmp1aHAwSGNLVGpBWUpoblpDdWdWR0JZUVhLMFpGaGhfVkEzSWg4WEJXZ2hEYmxwOFk?oc=5,
GN:S:C,Explore a hopeful climate future with new Field notes on climate collection - Chippewa Herald,https://news.google.com/rss/articles/CBMijgFBVV95cUxOWTI5VTd1Zkl2bGN4YkNwMmN1aWtWcG5feTlCR2tMOGk2QUxYT0FiNGFOS20wVzlYcjAtMEZqVXNKd3FaalIyT0NtNWNBUEZqS1JzUm1zeWVoaGNmWmZ0OXIyNkFTWFY5eFNHb2FXeUJXRVNZQm8xc05wNGRTbTlha0pSMDFydVphNHlEUFlR?oc=5,
GN:S:C,"Sunshine Coast Climate Faire to transform anxiety into tangible, positive action - Coast Reporter",https://news.google.com/rss/articles/CBMi0AFBVV95cUxPQUMtTDR4MTByemZKWmtfcnBlVzZsYUIwOWZHNzQ4aE9ubnZhZDNuZF8yaW4wMk1JT0cyWE1VV1lmYThUb3IxMGVqaC1NZVdxOHFpMUFDaExNQWgyTnE1YkZYRTVUREFVanlIVl9jZ2wwNU9pRTNCNTFxcWZGcVlfb0Y0UTNMZzZkQXBKaXRjalRKSktnaHdpdUMwNWNaNl9ZZTFYbnNuQkJDS3JoV19BdGpmSUVvUU5ZUTFELXAyY3NBaHlyZzJRLWlRUHI3X3F5?oc=5,
GN:S:C,Sable’s president in shining armor - Politico,https://news.google.com/rss/articles/CBMirgFBVV95cUxQZS1wcE85OVpoNHN0cVJYbnRrX2lyQ3pNVUNpeFdhLWo1a2dGWWZ3cEJFLWZ3dTgtMUx3ZDVMZl9zeGhidDgxV1NUNTQwMDJVak80Vm12TDJsY2FzMFludUk4UDhTMVFMM0M1bDVSbHNTcUpSci1rTHB4Nlp6NWdWdHVhNkpGOXN6eFZ5WWFrNTNaWlR0ZGZxVmd3Ul94aE92bDdhamNEVVlLWjRJQnc?oc=5,
GN:S:C,"Sharks, it turns out, have friends - The Washington Post",https://news.google.com/rss/articles/CBMioAFBVV95cUxPQTRuQThTMFh1OVh6ZjZENS1aYjkzMGF5YWJlNkprYzJDd0UzLXVLNmpWTzRTN3BQWEFoV296bFUtckVLREp4YzVDVi16WXBZNk1iNGpkUFpZdE5odmpmekh5ZDkyMXM1ZWdBR1c1ajRFMFBmdkR6aERvWGRROUE1bk85cTZ2MjExbkR2Z2FJcFJCYWJlb0xsOEcxeDliRlhC?oc=5,
