feed,title,long_url,short_url
GN:S:GW,"Extraordinary, climate change-linked heat wave envelops the West with mounting consequences - CNN",https://news.google.com/rss/articles/CBMiggFBVV95cUxNSXdXNURQU1ZQNXA0cXh0U2xoVnlzM09ZVHoyaFMzYlZ0dk5XeC0yZFE5eXh5dWU5cHpPTkNfS1BSNm03RkZrakFvNnRkeUMwUzlxclk2NjNXeG9ibW9NUFhVbmhhN290T1VkbUZqcUxZU0FySkZnUVlubE9KZl9sa2FB?oc=5,
GN:S:GW,How a Melting Glacier in Antarctica Could Affect Tens of Millions Around the Globe - The New York Times,https://news.google.com/rss/articles/CBMiqAFBVV95cUxNWUZDT0E1NEVqdWk5azZkQVdzeENRQm5Ld0hHbFZpd0YtcG1jd2hHX0FSZUFEdFRlVTF5aURFRUZBUnhvWGNhS05MVE1UbjVGT0NQVFE3SmE1cFpyck5tMFc3MTREbzJZUW1BTHkyeDFqV2JUUWFDZ0xOOWlNZGgxNnZEV0ZmVjUtclctUmMwUHdPdmxkTXZhYjJyZ3N4ZldCaVZMZGlqeHc?oc=5,
GN:S:GW,"Uh-Oh—Global Warming Is Actually Speeding Up, Scientists Say - Yahoo",https://news.google.com/rss/articles/CBMihwFBVV95cUxPNFRPMkpnX3k3RUVpMkw3WUZRNzNxRVpjUWVWYXctZEh1b3BIRzZHLWExay1fUmJ2SzUwX0dGVnBpblNQN0xsdjFKemRGMEtjaHMybWRXVl9NQmdqMHp1X1BuV1RFbV9iUGF5SVU3Qmo2RGp6UEFQOEViT1dLSDhRNmVYTUV6VDQ?oc=5,
GN:S:GW,How New England fights climate change with help from local organizations (Episode 28) - Peterson Institute for International Economics,https://news.google.com/rss/articles/CBMiuwFBVV95cUxNVlRkalFnUUZMQWFPOUh4TkpKUGpVWWh4eWVmUkZQX3poakxMUl9sazJkR3BoeDJQNG5zT3lEWWk3Y2E4STRyNE9pUk92bklzdDVRWVYzaUg1d01OWWJyaGhyRS1nS1Z0NzBtb2NxX1pyNTNvNDY0dUFzQXA1bXJXT0FZSndvTnlQOXllQ3Ewb2FGSjlWczluVUF0bVJkODRwNmJ3Y0pXbnMtRktPemN2a0paYm1ERUV1TlNZ?oc=5,
GN:S:GW,"Neural adaptation to climate change: mechanisms, limits and opportunities - Nature",https://news.google.com/rss/articles/CBMiX0FVX3lxTE5nZUtKREZxLWhyZjJYT1c5bE91WTBoZ2JTeHRIRmpRaS1tcktKVmZPbkFKSWprM3NXdUg2Nld0TDNpMW81T2FDcU9LaDJHcHE0a0V3bHlDdDg0Y0NNeHNn?oc=5,
GN:S:GW,"Climate change is making days longer, new research shows - Yahoo",https://news.google.com/rss/articles/CBMijAFBVV95cUxPeHFHOEdyMjZIVWJ0MnBJTmlCSG55b2x0RHdMMXREYXlLdXMxSFBEZDY1U2QybUdfbTE5amwtVFRzamxBSk9MR1hqWkdpZjg0dE1hQldvTExGWjdBbHFUMlBJamlEc3ZGazlzNkJxanVzSFlLWUFBSUIyNjZwYlhRdFR4X3FMR1pSelN1cA?oc=5,
GN:S:GW,EV batteries may withstand a warming climate better than expected - Chemical & Engineering News,https://news.google.com/rss/articles/CBMimgFBVV95cUxOWFJQdXJ5cnBFWkdTeTJZazc5eHJlcmRpT21FazFiYlhrbXNEdHdkdmNFWWdDZWFaejlRSzlLUGhqdDk3dEV3REFGeHhEejZzZzY4SlhzRGZpYWJnZUVjbEdWeGlLYnE1V3FHR3JXQjktb3Y0ZnBOd0RNVU9mS1JFMVpmcDgtNFNoV2otUGhVTlZBVG1PRnltN3VB?oc=5,
GN:S:GW,Danone nears methane goal five years early - DairyReporter,https://news.google.com/rss/articles/CBMipwFBVV95cUxQSWZsVVh6a3psS25ad0JSVDBZUklCdzJsSmxxcWprczJiQWFIRk81dGhuWDlJcFRsejBXSHpMNkkwVk5rNERMM3dvOFlRQUFkQkVDdnhfOEI2a2hRRVVFeWt0UGNOUDU4NXhPSmFVZ0ZYcm5qUk9OWWZhdzc4TnlnY0R4V2tZcjZOSmN1di1FUVM1LTYyTkU5SlpOOGhBU1FkbmJ4Vy1kaw?oc=5,
