feed,title,long_url,short_url
GN:S:C,Climate lawsuits will raise cost of energy | Columns | gjsentinel.com - The Grand Junction Daily Sentinel,https://www.gjsentinel.com/opinion/columns/climate-lawsuits-will-raise-cost-of-energy/article_56f9315a-bcce-11ec-b7ca-6f193b92a558.html,
GN:S:C,NJ finds the most expensive way to fight climate change | Moran - NJ,https://www.nj.com/opinion/2022/04/nj-finds-the-most-expensive-way-to-fight-climate-change-moran.html,
GN:S:C,Climate Change: The current state of global climate action - Mint Lounge,https://lifestyle.livemint.com/smart-living/environment/climate-change-the-current-state-of-global-climate-action-111650174937392.html,
GN:S:C,Letter: Spring reminds of climate crisis - The Columbian,https://www.columbian.com/news/2022/apr/17/letter-spring-reminds-of-climate-crisis/,
GN:S:C,‘We’re trying to turn the magnet towards optimism’: Cate Blanchett on her new climate crisis podcast - The Guardian,https://www.theguardian.com/film/2022/apr/17/were-trying-to-turn-the-magnet-towards-optimism-cate-blanchett-on-her-new-climate-crisis-podcast,
GN:S:C,New climate change GCSE will teach students 'how to conserve the planet' - Sky News,https://news.sky.com/story/new-climate-change-gcse-will-teach-students-how-to-conserve-the-planet-12592227,
GN:S:C,"Changing climate an issue for Clark County farms, air, wildlife and rivers - The Columbian",https://www.columbian.com/news/2022/apr/17/changing-climate-hurt-clark-county-farms-air-wildlife-and-rivers/,
