feed,title,long_url,short_url
GN:S:C,These recent pieces take a ‘big picture’ look at the climate challenge - Yale Climate Connections,https://yaleclimateconnections.org/2022/09/these-recent-pieces-take-a-big-picture-look-at-the-climate-challenge/,
GN:S:C,Africa Climate Week 2022 Builds Important Regional Momentum for Climate Action ahead of COP27 - UNFCCC,https://unfccc.int/news/africa-climate-week-2022-builds-important-regional-momentum-for-climate-action-ahead-of-cop27,
GN:S:C,Climate change in Michigan: How it's affected the state's weather - Detroit Free Press,https://www.freep.com/in-depth/news/local/michigan/2022/09/02/climate-change-michigan/7865014001/,
GN:S:C,Ways Hollywood Can Solve The Climate Crisis - Forbes,https://www.forbes.com/sites/michaellynch/2022/09/02/ways-hollywood-can-solve-the-climate-crisis/,
GN:S:C,Meet Patrick Beckley From the Climate and Society Class of 2023 - Columbia University,https://news.climate.columbia.edu/2022/09/02/meet-patrick-beckley-from-the-climate-and-society-class-of-2023/,
GN:S:C,A New Approach to an Unresolved Mystery in Climate Economics - Eos,https://eos.org/articles/a-new-approach-to-an-unresolved-mystery-in-climate-economics,
GN:S:C,Green dating: the singles swiping left on climate complacency - Mashable,https://mashable.com/article/green-dating-climate-change,
GN:S:C,Some climate change impacts will happen no matter what we do - Grid,https://www.grid.news/story/climate/2022/09/02/some-climate-change-impacts-melting-ice-sheets-disappearing-rainforests-will-happen-no-matter-what-we-do/,
GN:S:C,EPA head: Advanced nuke tech key to mitigate climate change - The Associated Press - en Español,https://apnews.com/article/technology-japan-tokyo-fumio-kishida-dcae07616d7569c17f8b9043189e2125,
GN:S:C,Could Climate Change Alter the Length of the Day? - WIRED,https://www.wired.com/story/could-climate-change-alter-the-length-of-a-day/,
GN:S:C,"Climate change may increase turbulence, researchers say - KSWO",https://www.kswo.com/2022/09/02/climate-change-may-increase-turbulence-researchers-say/,
GN:S:C,Could Philly’s steam system provide a climate solution? PGW says no - WHYY,https://whyy.org/articles/philadelphia-pgw-vicinity-customers-gas-steam-loop-climate-change/,
GN:S:C,Physicists want the next Large Hadron Collider to be climate-friendly - New Scientist,https://www.newscientist.com/article/2336407-physicists-want-the-next-large-hadron-collider-to-be-climate-friendly/,
GN:S:C,The Inflation Reduction Act will create climate jobs for Wisconsin workers - Wisconsin Examiner,https://wisconsinexaminer.com/2022/09/02/the-inflation-reduction-act-will-create-climate-jobs-for-wisconsin-workers/,
GN:S:C,Environment Canada says online reports of 'climate police' are false - CBC News,https://www.cbc.ca/news/politics/climate-police-misinformation-1.6569812,
