feed,title,long_url,short_url
GN:S:GW,Global Warming Solutions launches electric mobility vehicle fleet for last mile delivery in US and Europe - Seeking Alpha,https://seekingalpha.com/news/3646063-global-warming-solutions-launches-electric-mobility-vehicle-fleet-for-last-mile-delivery-in,
GN:S:GW,"Capitol Hill deal would cut major greenhouse gas, boost energy credits - Axios",https://www.axios.com/greenhouse-gases-hydrofluorocarbons-congress-20903db5-bb91-43c1-9030-74ebdba63a37.html,
GN:S:GW,A Wolf Pup Mummy From the Ancient Arctic - The New York Times,https://www.nytimes.com/2020/12/21/science/wolf-puppy-mummy.html,
GN:S:GW,Warming world will fry power plant production in coming years - Tech Xplore,https://techxplore.com/news/2020-12-world-power-production-years.html,
GN:S:GW,Living Less Unsustainably: Trees - KLCC FM Public Radio,https://www.klcc.org/post/living-less-unsustainably-trees,
GN:S:GW,Brazilian forests found to be transitioning from carbon sinks to carbon sources - Phys,https://phys.org/news/2020-12-brazilian-forests-transitioning-carbon-sources.html,
GN:S:GW,Policy's Best Stories of 2020 on Energy and Climate Change. - Foreign Policy,https://foreignpolicy.com/2020/12/21/the-new-geopolitics-of-energy/,
GN:S:GW,2 Reasons Why Tesla Is a Risky Buy Right Now - Motley Fool,https://www.fool.com/investing/2020/12/21/2-reasons-why-tesla-is-a-risky-buy-right-now/,
