feed,title,long_url,short_url
GN:T:AI,Microsoft Teams is using AI to prevent awkward interruptions in video calls - Engadget,https://www.engadget.com/microsoft-teams-ai-acoustics-improvement-155617197.html,https://engt.co/3aWnNyT
GN:T:AI,"How PyTorch Beat TensorFlow, Forcing Google to Bet on JAX - Business Insider",https://www.businessinsider.com/facebook-pytorch-beat-google-tensorflow-jax-meta-ai-2022-6,https://bit.ly/39k2I1e
GN:T:AI,Leadership Key to Moving Defense Department Toward Data-Driven Future - Department of Defense,https://www.defense.gov/News/News-Stories/Article/Article/3059694/leadership-key-to-moving-defense-department-toward-data-driven-future/,https://bit.ly/3zALl6H
GN:T:AI,AI maturity: Only 12% of companies are 'AI Achievers' - ZDNet,https://www.zdnet.com/article/what-is-ai-maturity-and-why-does-it-matter/,https://zd.net/3QmF1Wo
GN:T:AI,Unleash Natural Language Processing for Survey Comments | Legaltech News - Law,https://www.law.com/legaltechnews/2022/06/13/unleash-natural-language-processing-for-survey-comments/,https://bit.ly/3aWnNin
