feed,title,long_url,short_url
LitCovid,Downregulation of protein S in patients with severe COVID-19 augments the prothrombotic state,https://pubmed.ncbi.nlm.nih.gov/38703586,
LitCovid,Chronic Chest CT Findings following COVID-19 pneumonia,https://pubmed.ncbi.nlm.nih.gov/38704055,
LitCovid,SARS-CoV-2 spike protein expression as an identification in quality control testing for Adenovector based COVID-19 vaccine,https://pubmed.ncbi.nlm.nih.gov/38703946,
LitCovid,Emerging Trends of Gold Nanostructures for Point-of-Care Biosensor-Based Detection of COVID-19,https://pubmed.ncbi.nlm.nih.gov/38703305,
LitCovid,Correction: Kinome and phosphoproteome reprogramming underlies the aberrant immune responses in critically ill COVID-19 patients,https://pubmed.ncbi.nlm.nih.gov/38704547,
LitCovid,"Development of aesthetic surgery in the Czech Republic - the situation before the COVID pandemic, during the pandemic, and expected changes in the practice of aesthetic surgery in the post-COVID period",https://pubmed.ncbi.nlm.nih.gov/38704237,
LitCovid,Myelin basic protein antagonizes the SARS-CoV-2 protein ORF3a-induced autophagy inhibition,https://pubmed.ncbi.nlm.nih.gov/38703943,
LitCovid,"Efficacy, Safety, and Pharmacokinetics of AZD7442 (Tixagevimab/Cilgavimab) for Prevention of Symptomatic COVID-19: 15-Month Final Analysis of the PROVENT and STORM CHASER Trials",https://pubmed.ncbi.nlm.nih.gov/38703336,
LitCovid,Immunogenicity and safety of a recombinant Omicron BA.4/5-Delta COVID-19 vaccine ZF2202-A in Chinese adults,https://pubmed.ncbi.nlm.nih.gov/38704251,
LitCovid,Cerebellar encephalitis and peripheral neuropathy with an atypical clinical and neuroimaging signature following Covid-19 vaccine: a report of two cases,https://pubmed.ncbi.nlm.nih.gov/38704487,
LitCovid,Insecure attachment and support-seeking during COVID-19: a sequential mixed methods investigation,https://pubmed.ncbi.nlm.nih.gov/38704616,
LitCovid,Chromosome-Y haplogroups in Asturias (Northern Spain) and their association with severe COVID-19,https://pubmed.ncbi.nlm.nih.gov/38704518,
LitCovid,"Progressive multifocal leukoencephalopathy in a patient with B-cell chronic lymphocytic leukemia after COVID-19 vaccination, complicated with COVID-19 and mucormycosis: a case report",https://pubmed.ncbi.nlm.nih.gov/38704555,
LitCovid,"Safety, tolerability, viral kinetics, and immune correlates of protection in healthy, seropositive UK adults inoculated with SARS-CoV-2: a single-centre, open-label, phase 1 controlled human infection study",https://pubmed.ncbi.nlm.nih.gov/38703782,
LitCovid,"Sexually transmitted infections, the epidemic that persists after the COVID-19 pandemic: an analysis of the primary care electronic health records covering about 5 million people in Catalonia",https://pubmed.ncbi.nlm.nih.gov/38704552,
LitCovid,"The coagulation process for enveloped and non-enveloped virus removal in turbid water: Removal efficiencies, mechanisms and its application to SARS-CoV-2 omicron BA.2",https://pubmed.ncbi.nlm.nih.gov/38703849,
LitCovid,"FURIN, IFNL4, and TLR2 gene polymorphisms in relation to COVID-19 severity: a case-control study in Egyptian patients",https://pubmed.ncbi.nlm.nih.gov/38703289,
LitCovid,Immunoinformatics design of a structural proteins driven multi-epitope candidate vaccine against different SARS-CoV-2 variants based on fynomer,https://pubmed.ncbi.nlm.nih.gov/38704475,
LitCovid,The correlation between conspiracy mentality and vaccine intentions is moderated by social events: Evidence from longitudinal data during COVID-19 pandemic in the UK,https://pubmed.ncbi.nlm.nih.gov/38704262,
LitCovid,Midwives' experiences with PPE during the COVID-19 pandemic: The Birth in the Time of COVID (BITTOC) study,https://pubmed.ncbi.nlm.nih.gov/38703427,
LitCovid,The impact of COVID-19 vaccination campaign on pediatric vaccine uptake based on parents' attitudes towards mandatory and recommended vaccination in Southern Italy,https://pubmed.ncbi.nlm.nih.gov/38704254,
LitCovid,Clinical effectiveness of nirmatrelvir plus ritonavir for patients with COVID-19 and preexisting psychiatric disorders,https://pubmed.ncbi.nlm.nih.gov/38703086,
LitCovid,"External validation of two clinical prediction models for mortality in COVID-19 patients (4C and NEWS2), in three centers in Medellin, Colombia: Assessing the impact of vaccination over time",https://pubmed.ncbi.nlm.nih.gov/38703825,
LitCovid,"The impact of the COVID-19 pandemic on HIV treatment gap lengths and viremia among people living with HIV British Columbia, Canada, during the COVID-19 pandemic: Are we ready for the next pandemic?",https://pubmed.ncbi.nlm.nih.gov/38703468,
LitCovid,Increased COVID-19 mortality among immigrants compared with US-born individuals: a cross-sectional analysis of 2020 mortality data,https://pubmed.ncbi.nlm.nih.gov/38703491,
LitCovid,Altered development of face recognition among infants born amid the COVID-19 pandemic,https://pubmed.ncbi.nlm.nih.gov/38703752,
LitCovid,Examining the influence of community leaders and other community actors on immunisation practices in Australia: A national cross-sectional study,https://pubmed.ncbi.nlm.nih.gov/38704260,
LitCovid,Factors associated with vaccination intention and uptake over time in a sample of older Australians,https://pubmed.ncbi.nlm.nih.gov/38704261,
LitCovid,What factors influence the uptake of vaccinations amongst pregnant women following the Covid-19 pandemic: A qualitative study,https://pubmed.ncbi.nlm.nih.gov/38703426,
LitCovid,"Comment on ""Glioblastoma patients' survival and its relevant risk factors during the pre- and post-COVID-19 pandemic: Real-world cohort study in the USA and China""",https://pubmed.ncbi.nlm.nih.gov/38704369,
LitCovid,Protocol implementation during the COVID-19 pandemic: experiences from a randomized trial of stress ulcer prophylaxis,https://pubmed.ncbi.nlm.nih.gov/38704520,
LitCovid,Patient satisfaction and sexual issues in vulvar lichen sclerosus treatment: a monocentric certified dysplasia unit survey analysis,https://pubmed.ncbi.nlm.nih.gov/38703281,
LitCovid,Impact of the COVID-19 pandemic on breast cancer patient pathways and outcomes in the United Kingdom and the Republic of Ireland - a scoping review,https://pubmed.ncbi.nlm.nih.gov/38704477,
LitCovid,"Infant neurodevelopment during the COVID-19 pandemic: Associations with maternal pandemic-related experiences, parenting stress, and self-efficacy",https://pubmed.ncbi.nlm.nih.gov/38703424,
LitCovid,Challenges and benefits of telepathology in education: lessons learned from COVID-19-a systematic review,https://pubmed.ncbi.nlm.nih.gov/38704152,
LitCovid,Predicting vaccination hesitancy: The role of basic needs satisfaction and institutional trust,https://pubmed.ncbi.nlm.nih.gov/38704252,
LitCovid,"Views of Hong Kong Chinese medicine practitioners on the application of the ""Chinese Medicine Anti-epidemic Plans"" prepared by the Chinese medicine expert group of central authorities: a focus group study",https://pubmed.ncbi.nlm.nih.gov/38704524,
LitCovid,The Compatibility of Mandatory Vaccination with the European Convention on Human Rights: Implications for a National Vaccination Policy,https://pubmed.ncbi.nlm.nih.gov/38704150,
LitCovid,Development and assessment of a virtual escape-room game for teaching industrial bioprocesses,https://pubmed.ncbi.nlm.nih.gov/38703032,
LitCovid,Work as a health risk,https://pubmed.ncbi.nlm.nih.gov/38704163,
LitCovid,Complement system is overactivated in patients with IgA nephropathy after COVID-19,https://pubmed.ncbi.nlm.nih.gov/38701960,
LitCovid,Four years into the COVID-19 pandemic: Timely published articles for patient care and EAACI's leadership role,https://pubmed.ncbi.nlm.nih.gov/38702913,
LitCovid,Immunologic responses to the third and fourth doses of severe acute respiratory syndrome coronavirus 2 (SARS-CoV-2) vaccines in cell therapy recipients: a systematic review and meta-analysis,https://pubmed.ncbi.nlm.nih.gov/38702752,
LitCovid,Adjuvant-dependent impact of inactivated SARS-CoV-2 vaccines during heterologous infection by a SARS-related coronavirus,https://pubmed.ncbi.nlm.nih.gov/38702297,
LitCovid,"Alterations in Circadian Rhythms, Sleep, and Physical Activity in COVID-19: Mechanisms, Interventions, and Lessons for the Future",https://pubmed.ncbi.nlm.nih.gov/38702566,
LitCovid,Decreased progenitor TCF1 + T-cells correlate with COVID-19 disease severity,https://pubmed.ncbi.nlm.nih.gov/38702425,
LitCovid,Use of UK faith Centre as a COVID-19 community vaccination clinic: exploring a potential model for community-based health care delivery,https://pubmed.ncbi.nlm.nih.gov/38702294,
LitCovid,New framework to assess tracing and testing based on South Korea's response to COVID-19,https://pubmed.ncbi.nlm.nih.gov/38702610,
LitCovid,COVID-19 Pandemic and Stroke Care in Patients With Dementia Compared to Other Stroke Patients,https://pubmed.ncbi.nlm.nih.gov/38702044,
LitCovid,Oxidative stress in patients with coronavirus disease and end-stage renal disease: a pilot study,https://pubmed.ncbi.nlm.nih.gov/38702607,
LitCovid,Effects of Preoperative COVID-19 Status on Emergent or Urgent Colectomy Outcomes,https://pubmed.ncbi.nlm.nih.gov/38701852,
LitCovid,Correction: A qualitative assessment of barriers and facilitators of telemedicine volunteerism during the COVID-19 pandemic in India,https://pubmed.ncbi.nlm.nih.gov/38702715,
LitCovid,The severity of COVID-19 upon hospital admission is associated with plasma omega-3 fatty acids,https://pubmed.ncbi.nlm.nih.gov/38702342,
LitCovid,"Comparing vitamin D receptor gene polymorphisms in rs11568820, rs7970314, rs4334089 between COVID-19 patients with mild and severe symptoms: a case control study",https://pubmed.ncbi.nlm.nih.gov/38702336,
LitCovid,Integrating molecular and radiological screening tools during community-based active case-finding for tuberculosis and COVID-19 in southern Africa,https://pubmed.ncbi.nlm.nih.gov/38701914,
LitCovid,Impact of COVID-19 pandemic on care of maintenance hemodialysis patients: a multicenter study,https://pubmed.ncbi.nlm.nih.gov/38702493,
LitCovid,"Statistical analysis of three data sources for Covid-19 monitoring in Rhineland-Palatinate, Germany",https://pubmed.ncbi.nlm.nih.gov/38702453,
LitCovid,Effectiveness of recently-approved oral antiviral medications on the outcome of patients with mild-to-moderate COVID-19 and preexisting chronic obstructive pulmonary diseases,https://pubmed.ncbi.nlm.nih.gov/38702925,
LitCovid,Best practices for government agencies to publish data: lessons from COVID-19,https://pubmed.ncbi.nlm.nih.gov/38701811,
LitCovid,Qualitative Study of Food Insecurity in Hospitalized Pediatric Patients during the COVID-19 Pandemic,https://pubmed.ncbi.nlm.nih.gov/38701847,
LitCovid,Cardiovascular involvement in children with COVID-19 temporally related multisystem inflammatory syndrome (MIS-C): can cardiac magnetic resonance arrive to the heart of the problem?,https://pubmed.ncbi.nlm.nih.gov/38702753,
LitCovid,Minding the gaps: Recognizing ancillary staff contributions in care homes during the COVID-19 pandemic,https://pubmed.ncbi.nlm.nih.gov/38701809,
LitCovid,Assessment of Covid-19 vaccine confidence among healthcare personnel in the safety-net sector in the United States and Puerto Rico,https://pubmed.ncbi.nlm.nih.gov/38702754,
LitCovid,COVID-19 Prevention and Mitigation Decision-Making Processes While Navigating Chronic Disease Care: Perspectives of Black Adults with Heart Failure and Diabetes,https://pubmed.ncbi.nlm.nih.gov/38702490,
LitCovid,"Long term care facilities in England during the COVID-19 pandemic-a scoping review of guidelines, policy and recommendations",https://pubmed.ncbi.nlm.nih.gov/38702669,
LitCovid,Association of COVID-19 vaccination with risks of hospitalization due to cardiovascular and other diseases: a study using data from the UK Biobank,https://pubmed.ncbi.nlm.nih.gov/38701913,
LitCovid,Voice handicap and voice-related quality of life in COVID-19 patients,https://pubmed.ncbi.nlm.nih.gov/38701618,
LitCovid,The impact of the COVID-19 pandemic on 397 631 elective dental admissions among the under-25s in England: a retrospective study,https://pubmed.ncbi.nlm.nih.gov/38702840,
LitCovid,Nailfold Videocapillaroscopy findings in COVID19: a new mimicker of the scleroderma pattern?,https://pubmed.ncbi.nlm.nih.gov/38702759,
LitCovid,Clinical nursing competency during epidemics: a qualitative content analysis,https://pubmed.ncbi.nlm.nih.gov/38702690,
LitCovid,Evaluation of an online arts-based platform to support the health and well-being of older adults during the COVID-19 pandemic: a cross-sectional survey,https://pubmed.ncbi.nlm.nih.gov/38702646,
LitCovid,Sleep initiation patterns and sleep quality among toddlers in the southeast of China: initial study results,https://pubmed.ncbi.nlm.nih.gov/38702673,
LitCovid,"Burden of COVID-19 pandemic on tuberculosis hospitalisation patterns at a tertiary care hospital in Rajasthan, India: a retrospective analysis",https://pubmed.ncbi.nlm.nih.gov/38702079,
LitCovid,An identity-based learning community intervention enhances the lived experience and success of first-generation college students in the biological sciences,https://pubmed.ncbi.nlm.nih.gov/38702457,
LitCovid,Exotic Animal Practice in Europe,https://pubmed.ncbi.nlm.nih.gov/38702231,
LitCovid,Developing a typology of interventions to support doctors' mental health and wellbeing,https://pubmed.ncbi.nlm.nih.gov/38702774,
LitCovid,Development and in vitro antiviral activity of ivermectin liposomes as a potential drug carrier system,https://pubmed.ncbi.nlm.nih.gov/38702288,
LitCovid,Impact of Annexin A2 on virus life cycles,https://pubmed.ncbi.nlm.nih.gov/38702018,
LitCovid,Resilience of human-nature interaction network to pandemic conditions,https://pubmed.ncbi.nlm.nih.gov/38701924,
LitCovid,mRNA-based therapeutic strategies for cancer treatment,https://pubmed.ncbi.nlm.nih.gov/38702886,
LitCovid,N-95/P2 respirator compliance with fit testing recommendations and respirator satisfaction amongst hospital staff,https://pubmed.ncbi.nlm.nih.gov/38702235,
LitCovid,"Age-specific and cause-specific mortality contributions to the socioeconomic gap in life expectancy in Germany, 2003-21: an ecological study",https://pubmed.ncbi.nlm.nih.gov/38702094,
LitCovid,Identification of environmental and methodological factors driving variability of Pepper Mild Mottle Virus (PMMoV) across three wastewater treatment plants in the City of Toronto,https://pubmed.ncbi.nlm.nih.gov/38701931,
LitCovid,"Effectiveness and impact of universal prophylaxis with nirsevimab in infants against hospitalisation for respiratory syncytial virus in Galicia, Spain: initial results of a population-based longitudinal study",https://pubmed.ncbi.nlm.nih.gov/38701823,
LitCovid,Pandemic lockdowns were less of a shock for people with fewer ties,https://pubmed.ncbi.nlm.nih.gov/38693242,
