feed,title,long_url,short_url
j:MDPI:N,"The Temporal Change in Ionised Calcium, Parathyroid Hormone and Bone Metabolism Following Ingestion of a Plant-Sourced Marine Mineral + Protein Isolate in Healthy Young Adults",https://mdpi.com/2072-6643/16/18/3110,
j:MDPI:N,Understanding the Health Literacy Experiences and Practices of Australian-Resettled Myanmar Refugees: Relevance for Nutrition and Dietetics Practice,https://mdpi.com/2072-6643/16/18/3109,
j:MDPI:N,Substitutive Effects of Milk vs. Vegetable Milk on the Human Gut Microbiota and Implications for Human Health,https://mdpi.com/2072-6643/16/18/3108,
j:MDPI:N,Hesperetin Attenuates T-2 Toxin-Induced Chondrocyte Injury by Inhibiting the p38 MAPK Signaling Pathway,https://mdpi.com/2072-6643/16/18/3107,
j:MDPI:N,Relationship between the Mediterranean Diet and Vascular Function in Subjects with and without Increased Insulin Resistance,https://mdpi.com/2072-6643/16/18/3106,
j:MDPI:N,Practical Guidelines by the Andalusian Group for Nutrition Reflection and Investigation (GARIN) on Nutritional Management of Patients with Chronic Obstructive Pulmonary Disease: A Review,https://mdpi.com/2072-6643/16/18/3105,
j:MDPI:N,Nutrient Analysis of Raw United States Beef Offal Items,https://mdpi.com/2072-6643/16/18/3104,
