feed,title,long_url,short_url
GN:T:RE,"Investment in clean energy likely to be double figure for fossil fuels in 2024, IEA says - The Guardian",https://news.google.com/rss/articles/CBMikAFodHRwczovL3d3dy50aGVndWFyZGlhbi5jb20vYnVzaW5lc3MvYXJ0aWNsZS8yMDI0L2p1bi8wNi9pbnZlc3RtZW50LWluLWNsZWFuLWVuZXJneS1saWtlbHktdG8tYmUtZG91YmxlLWZpZ3VyZS1mb3ItZm9zc2lsLWZ1ZWxzLWluLTIwMjQtaWVhLXNheXPSAQA?oc=5,https://da.gd/uHVsw
GN:T:RE,IEA expects global clean energy investment to hit $2 trillion in 2024 - Reuters,https://news.google.com/rss/articles/CBMigAFodHRwczovL3d3dy5yZXV0ZXJzLmNvbS9zdXN0YWluYWJpbGl0eS9jbGltYXRlLWVuZXJneS9pZWEtZXhwZWN0cy1nbG9iYWwtY2xlYW4tZW5lcmd5LWludmVzdG1lbnQtaGl0LTItdHJpbGxpb24tMjAyNC0yMDI0LTA2LTA2L9IBAA?oc=5,https://da.gd/aHt0
GN:T:RE,"EV sales boom in Nepal, helping to save on oil imports, alleviate smog - The Associated Press",https://news.google.com/rss/articles/CBMiVmh0dHBzOi8vYXBuZXdzLmNvbS9hcnRpY2xlL25lcGFsLWV2LWVuZXJneS1oeWRyb3Bvd2VyLTI0MWQ0ODZmMjI4MDUxYzczZmYyNzkzZTA0M2IwY2Nh0gEA?oc=5,https://da.gd/6WIG
GN:T:RE,Montco hosts public meeting on Norristown Dam hydroelectric project - WHYY,https://news.google.com/rss/articles/CBMiR2h0dHBzOi8vd2h5eS5vcmcvYXJ0aWNsZXMvZGFtLXNjaHV5bGtpbGwtcml2ZXItbm9ycmlzdG93bi1ncmVlbi1lbmVyZ3kv0gEA?oc=5,https://da.gd/2xKNNq
GN:T:RE,Legislators soften stance on renewable energy projects but rural residents question state's commitment to cooperation - Colorado Public Radio,https://news.google.com/rss/articles/CBMiZGh0dHBzOi8vd3d3LmNwci5vcmcvMjAyNC8wNi8wNi9lbGJlcnQtY291bnR5LXhjZWwtcmVuZXdhYmxlLWVuZXJneS1wcm9qZWN0LXJ1cmFsLWNvbW11bml0eS1wdXNoYmFjay_SAQA?oc=5,https://da.gd/SByLEP
GN:T:RE,Swiss renewable energy battle moves to the ballots - Tech Xplore,https://news.google.com/rss/articles/CBMiR2h0dHBzOi8vdGVjaHhwbG9yZS5jb20vbmV3cy8yMDI0LTA2LXN3aXNzLXJlbmV3YWJsZS1lbmVyZ3ktYmFsbG90cy5odG1s0gEA?oc=5,https://da.gd/QwV1
GN:T:RE,American solar panel manufacturing capacity increases 71 percent in Q1 2024 - Renewable Energy Magazine,https://news.google.com/rss/articles/CBMicmh0dHBzOi8vd3d3LnJlbmV3YWJsZWVuZXJneW1hZ2F6aW5lLmNvbS9wdl9zb2xhci9hbWVyaWNhbi1zb2xhci1wYW5lbC1tYW51ZmFjdHVyaW5nLWNhcGFjaXR5LWluY3JlYXNlcy03MS0yMDI0MDYwNtIBAA?oc=5,https://da.gd/SAiuO6
GN:T:RE,Final day of International Renewable Energy Conference in Brazil - CGTN America,https://news.google.com/rss/articles/CBMiZGh0dHBzOi8vYW1lcmljYS5jZ3RuLmNvbS8yMDI0LzA2LzA1L2ZpbmFsLWRheS1vZi1pbnRlcm5hdGlvbmFsLXJlbmV3YWJsZS1lbmVyZ3ktY29uZmVyZW5jZS1pbi1icmF6aWzSAQA?oc=5,https://da.gd/AtZ8M
GN:T:RE,Southampton's Utilitia Bowl to have thousand solar panels fitted - BBC,https://news.google.com/rss/articles/CBMiLmh0dHBzOi8vd3d3LmJiYy5jb20vbmV3cy9hcnRpY2xlcy9jcmdncWU3MWxkMG_SATJodHRwczovL3d3dy5iYmMuY29tL25ld3MvYXJ0aWNsZXMvY3JnZ3FlNzFsZDBvLmFtcA?oc=5,https://da.gd/XpDLR
