feed,title,long_url,short_url
GN:T:WP,EGEB: Service vessels for the world’s largest offshore wind farm look amazing in CGI - Electrek,https://electrek.co/2021/03/19/egeb-service-operation-vessels-worlds-largest-offshore-wind-farm-bp-hydrogen/,
GN:T:WP,Offshore wind could meet all Maine's electricity needs by 2050 - Bangor Daily News,https://bangordailynews.com/2021/03/18/business/offshore-wind-could-meet-all-maines-electricity-needs-by-2050/,
GN:T:WP,Fanning the Gains: Why Wind Is Wonderful for Investors - ETF Trends,https://www.etftrends.com/nasdaq-portfolio-solutions-channel/fanning-gains-wind-wonderful-for-investors/,
GN:T:WP,"Regulators, utilities at odds over legislation on power grid reliability - Bismarck Tribune",https://bismarcktribune.com/news/state-and-regional/govt-and-politics/regulators-utilities-at-odds-over-legislation-on-power-grid-reliability/article_2dfd727a-108c-5d03-852e-8c08c3b1ebf1.html,
GN:T:WP,Netflix’s best sci-fi series of 2021 reveals an urgent crisis facing America today - Inverse,https://www.inverse.com/science/tribes-of-europa-netflix-energy-grid-science,
GN:T:WP,GWEC: China breaks world record with 2020 wind installations - Power Engineering International,https://www.powerengineeringint.com/renewables/wind/gwec-china-breaks-world-record-with-2020-wind-installations/,
