feed,title,long_url,short_url
ArXiv:stat,Efficient surrogate-assisted inference for patient-reported outcome measures with complex missing mechanism,https://arxiv.org/abs/2210.09362v1,
ArXiv:stat,SQ Lower Bounds for Learning Single Neurons with Massart Noise,https://arxiv.org/abs/2210.09949v1,
ArXiv:stat,Projected Least-Squares Quantum Process Tomography,https://arxiv.org/abs/2107.01060v2,
ArXiv:stat,Combining Evidence from Clinical Trials in Conditional or Accelerated Approval,https://arxiv.org/abs/2112.11898v2,
ArXiv:stat,"Plasticity Neural Network Based on Astrocytic effects at Critical Period, Synaptic Competition and Strength Rebalance by Current and Mnemonic Brain Plasticity and Synapse Formation",https://arxiv.org/abs/2203.11740v6,
ArXiv:stat,Inference after latent variable estimation for single-cell RNA sequencing data,https://arxiv.org/abs/2207.00554v2,
