feed,title,long_url,short_url
GN:T:WP,Sudden Freeze-Up Disrupts Supply Chain on Russia's Northern Sea Route - The Maritime Executive,https://www.maritime-executive.com/editorials/sudden-freeze-up-disrupts-supply-chain-on-russia-s-northern-sea-route,
GN:T:WP,European Commission approves €2.3bn renewables incentive plan by Greece - pv magazine International,https://www.pv-magazine.com/2021/11/25/european-commission-approves-e2-3bn-renewables-incentive-plan-by-greece/,
GN:T:WP,A net-zero Canada would need 1.6 GW of solar per year from now on - pv magazine International,https://www.pv-magazine.com/2021/11/25/a-net-zero-canada-would-need-1-6-gw-of-solar-per-year-from-now-on/,
GN:T:WP,Wind accounted for 35% of October electricity demand - RTE,https://www.rte.ie/news/business/2021/1125/1263021-wind-accounted-for-35-of-october-electricity-demand/,
GN:T:WP,First Hollandse Kust Zuid Offshore Substation Topside Leaves Dubai - Offshore WIND,https://www.offshorewind.biz/2021/11/25/first-hollandse-kust-zuid-offshore-substation-topside-leaves-dubai/,
