feed,title,long_url,short_url
ArXiv,Asynchronous Distributed Reinforcement Learning for LQR Control via Zeroth-Order Block Coordinate Descent,https://arxiv.org/abs/2107.12416v1,
ArXiv,"Human-Level Reinforcement Learning through Theory-Based Modeling, Exploration, and Planning",https://arxiv.org/abs/2107.12544v1,
ArXiv,Double Deep Q-learning Based Real-Time Optimization Strategy for Microgrids,https://arxiv.org/abs/2107.12545v1,
ArXiv,Deep Reinforcement Learning for L3 Slice Localization in Sarcopenia Assessment,https://arxiv.org/abs/2107.12800v1,
ArXiv,Persistent Reinforcement Learning via Subgoal Curricula,https://arxiv.org/abs/2107.12931v1,
ArXiv,Reinforcement Learning with Formal Performance Metrics for Quadcopter Attitude Control under Non-nominal Contexts,https://arxiv.org/abs/2107.12942v1,
ArXiv,Prospect-theoretic Q-learning,https://arxiv.org/abs/2104.05311v2,
ArXiv,Reinforcement Learning Compensated Extended Kalman Filter for Attitude Estimation,https://arxiv.org/abs/2107.11777v2,
