feed,title,long_url,short_url
GN:T:WP,Govt. Fights Injunction For Tribe's Wind Energy Project - Law360,https://www.law360.com/nativeamerican/articles/1399752/govt-fights-injunction-for-tribe-s-wind-energy-project,
GN:T:WP,"Storm pummels Wappingers Falls, knocks out power for thousands - Poughkeepsie Journal",https://www.poughkeepsiejournal.com/story/news/local/2021/06/30/wappingers-falls-pummeled-storm-metro-north-train-delayed/7820771002/,
GN:T:WP,Duke Energy CEO Lynn Good on developing a diverse power supply - Fortune,https://fortune.com/2021/07/01/duke-energy-ceo-lynn-good-climate-carbon-wind-solar-leadership-next/,
GN:T:WP,"As U.S. Temperatures Spike, So Does The Need For Natural Gas - Forbes",https://www.forbes.com/sites/judeclemente/2021/07/01/as-us-temperatures-spike-so-does-the-need-for-natural-gas/,
GN:T:WP,"Biden's Plan For More Power Lines Could Bring More Reliable, Renewable Energy To Indiana - WBAA",https://www.wbaa.org/post/bidens-plan-more-power-lines-could-bring-more-reliable-renewable-energy-indiana,
