feed,title,long_url,short_url
ArXiv:stat,Comparing Malaria Trends in the Comoros Islands: ARIMA Modeling and Retrospective Analysis,https://arxiv.org/abs/2508.16018,
ArXiv:stat,Evaluation of Time Series Forecasting Models for Predicting Lung Cancer Mortality Rates in the United States: A Comparison with Altuhaifa (2023) Study,https://arxiv.org/abs/2508.16052,
ArXiv:stat,Estimating the growth rate of a birth and death process using data from a small sample,https://arxiv.org/abs/2508.16110,
ArXiv:stat,Principled type I error rate inflation in two-arm clinical trial designs with external control information borrowing,https://arxiv.org/abs/2508.16348,
ArXiv:stat,Multivariate Shared Frailty Cure-Rate models: a focus on Breast Cancer family history,https://arxiv.org/abs/2508.16350,
ArXiv:stat,"Machine Learning for Medicine Must Be Interpretable, Shareable, Reproducible and Accountable by Design",https://arxiv.org/abs/2508.16097,
