feed,title,long_url,short_url
GN:T:GP,Energy & Environment — Sanders opposed to Manchin permitting push - The Hill,https://thehill.com/policy/energy-environment/overnights/3635121-energy-environment-sanders-opposed-to-manchin-permitting-push/,
GN:T:GP,Enel gets nod to start up 161-MW solar park in Chile - Renewables Now,https://renewablesnow.com/news/enel-gets-nod-to-start-up-161-mw-solar-park-in-chile-797315/,
GN:T:GP,"LNG Could Be ""Really, Really Tight"" This Winter Cheniere - OilPrice",https://oilprice.com/Latest-Energy-News/World-News/LNG-Could-Be-Really-Really-Tight-This-Winter-Cheniere.html,
GN:T:GP,Rotorua and Taupō schools win 2022 GNS Science school science competitions - New Zealand Herald,https://www.nzherald.co.nz/rotorua-daily-post/news/rotorua-and-taupo-schools-win-2022-gns-science-school-science-competitions/NJCZ4BZ6PCHIZSVORTVOBRHER4/,
GN:T:GP,Shell Canada signs deal with Kitselas Geothermal in northwest B.C. – Boundary Creek Times - Boundary Creek Times,https://www.boundarycreektimes.com/news/shell-canada-signs-deal-with-kitselas-geothermal-in-northwest-b-c/,
