feed,title,long_url,short_url
GN:T:AI,Futurist Predicts Nanorobots Will Extend Human Lifespans Past 120 - Popular Mechanics,https://news.google.com/rss/articles/CBMiamh0dHBzOi8vd3d3LnBvcHVsYXJtZWNoYW5pY3MuY29tL3NjaWVuY2UvaGVhbHRoL2E2MTA5OTE3OS9odW1hbnMtc2luZ3VsYXJpdHktaW1tb3J0YWxpdHktcmF5bW9uZC1rdXJ6d2VpbC_SAQA?oc=5,https://da.gd/KNQe7o
GN:T:AI,"Bacon ice cream, a handful of butter: McDonald's scraps AI drive-thru orders after hilarious glitches - Fast Company",https://news.google.com/rss/articles/CBMiTmh0dHBzOi8vd3d3LmZhc3Rjb21wYW55LmNvbS85MTE0Mjg4Mi9tY2RvbmFsZHMtYWktZHJpdmUtdGhydS1vcmRlcmluZy1nbGl0Y2hlc9IBAA?oc=5,https://da.gd/Rre1k
GN:T:AI,Nvidia (NVDA) Tops Microsoft (MSFT) to Become World’s Most Valuable Company - Bloomberg,https://news.google.com/rss/articles/CBMib2h0dHBzOi8vd3d3LmJsb29tYmVyZy5jb20vbmV3cy9hcnRpY2xlcy8yMDI0LTA2LTE4L252aWRpYS1iZWNvbWVzLXdvcmxkLXMtbGFyZ2VzdC1maXJtLWFzLWFpLXJhbGx5LXN0ZWFtcy1haGVhZNIBAA?oc=5,https://da.gd/XBIJR
GN:T:AI,Adobe's new terms of service say it won't use your work to train AI - The Verge,https://news.google.com/rss/articles/CBMiYGh0dHBzOi8vd3d3LnRoZXZlcmdlLmNvbS8yMDI0LzYvMTgvMjQxODEwMDEvYWRvYmUtdXBkYXRlZC10ZXJtcy1vZi1zZXJ2aWNlLXdvbnQtdHJhaW4tYWktb24td29ya9IBAA?oc=5,https://da.gd/qp0r
GN:T:AI,Why artists are becoming less scared of AI - MIT Technology Review,https://news.google.com/rss/articles/CBMiW2h0dHBzOi8vd3d3LnRlY2hub2xvZ3lyZXZpZXcuY29tLzIwMjQvMDYvMTgvMTA5Mzk5OC93aHktYXJ0aXN0cy1iZWNvbWluZy1sZXNzLXNjYXJlZC1vZi1haS_SAV9odHRwczovL3d3dy50ZWNobm9sb2d5cmV2aWV3LmNvbS8yMDI0LzA2LzE4LzEwOTM5OTgvd2h5LWFydGlzdHMtYmVjb21pbmctbGVzcy1zY2FyZWQtb2YtYWkvYW1wLw?oc=5,https://da.gd/FuRt6i
GN:T:AI,UN agency warns AI could spawn Holocaust denial surge - The Hill,https://news.google.com/rss/articles/CBMiWGh0dHBzOi8vdGhlaGlsbC5jb20vcG9saWN5L3RlY2hub2xvZ3kvNDcyNzA0Ny1hcnRpZmljaWFsLWludGVsbGlnZW5jZS1ob2xvY2F1c3QtaGlzdG9yeS_SAVxodHRwczovL3RoZWhpbGwuY29tL3BvbGljeS90ZWNobm9sb2d5LzQ3MjcwNDctYXJ0aWZpY2lhbC1pbnRlbGxpZ2VuY2UtaG9sb2NhdXN0LWhpc3RvcnkvYW1wLw?oc=5,https://da.gd/5vpt2
GN:T:AI,"World-first research dissects an AI's mind, and starts editing its thoughts - New Atlas",https://news.google.com/rss/articles/CBMiNWh0dHBzOi8vbmV3YXRsYXMuY29tL3RlY2hub2xvZ3kvYWktdGhpbmtpbmctcGF0dGVybnMv0gEA?oc=5,https://da.gd/j7qi
GN:T:AI,This new OpenAI Sora rival makes frighteningly realistic AI videos – and you can try it soon - TechRadar,https://news.google.com/rss/articles/CBMikAFodHRwczovL3d3dy50ZWNocmFkYXIuY29tL2NvbXB1dGluZy9hcnRpZmljaWFsLWludGVsbGlnZW5jZS9ydW53YXlzLW5ldy1vcGVuYWktc29yYS1yaXZhbC1zaG93cy10aGF0LWFpLXZpZGVvLWlzLWdldHRpbmctZnJpZ2h0ZW5pbmdseS1yZWFsaXN0aWPSAQA?oc=5,https://da.gd/0oRh
GN:T:AI,"Opinion: As AI is embraced, what happens to the artists whose work was stolen to build it? - Los Angeles Times",https://news.google.com/rss/articles/CBMiY2h0dHBzOi8vd3d3LmxhdGltZXMuY29tL29waW5pb24vc3RvcnkvMjAyNC0wNi0xOC9hcnRpZmljaWFsLWludGVsbGlnZW5jZS1vcGVuYWktbWVkaWEtbWFuYWdlci1hcHBsZdIBAA?oc=5,https://da.gd/5w33W
