feed,title,long_url,short_url
GN:T:CC,Colombia oil regulator to invest $135 mln in renewable energy - Reuters,https://news.google.com/rss/articles/CBMiamh0dHBzOi8vd3d3LnJldXRlcnMuY29tL2J1c2luZXNzL2VuZXJneS9jb2xvbWJpYS1vaWwtcmVndWxhdG9yLWludmVzdC0xMzUtbWxuLXJlbmV3YWJsZS1lbmVyZ3ktMjAyMy0wNS0wMy_SAQA?oc=5,https://da.gd/rBjC
GN:T:CC,"United Auto Workers Hold Off on Backing Biden, for Now - The New York Times",https://news.google.com/rss/articles/CBMiUmh0dHBzOi8vd3d3Lm55dGltZXMuY29tLzIwMjMvMDUvMDMvdXMvcG9saXRpY3MvYmlkZW4tYXV0by13b3JrZXJzLWVuZG9yc2VtZW50Lmh0bWzSAQA?oc=5,https://da.gd/lp0X
GN:T:CC,Concerns about climate change's ongoing impact on NZ wine - 1News,https://news.google.com/rss/articles/CCAiCzhjb09pSXg4V1FRmAEB?oc=5,https://da.gd/7Rvyn
GN:T:CC,Democrats still aim to probe oil giants’ climate-change knowledge - Roll Call,https://news.google.com/rss/articles/CBMiZWh0dHBzOi8vd3d3LnJvbGxjYWxsLmNvbS8yMDIzLzA1LzAzL2RlbW9jcmF0cy1zdGlsbC1haW0tdG8tcHJvYmUtb2lsLWdpYW50cy1jbGltYXRlLWNoYW5nZS1rbm93bGVkZ2Uv0gEA?oc=5,https://da.gd/mTf2w
GN:T:CC,"Amid climate change, migrating redstarts show flexibility - The Wildlife Society",https://news.google.com/rss/articles/CBMiTmh0dHBzOi8vd2lsZGxpZmUub3JnL2FtaWQtY2xpbWF0ZS1jaGFuZ2UtbWlncmF0aW5nLXJlZHN0YXJ0cy1zaG93LWZsZXhpYmlsaXR5L9IBAA?oc=5,https://da.gd/p9p0qA
GN:T:CC,Murcia’s farmers fear for the future as Spain cuts water supplies from River Tagus - Euronews,https://news.google.com/rss/articles/CBMifGh0dHBzOi8vd3d3LmV1cm9uZXdzLmNvbS9ncmVlbi8yMDIzLzA1LzAzL211cmNpYXMtZmFybWVycy1mZWFyLWRlc2VydGlmaWNhdGlvbi1hcy1zcGFpbi1jdXRzLXdhdGVyLXN1cHBsaWVzLWZyb20tcml2ZXItdGFndXPSAQA?oc=5,https://da.gd/69NPEt
GN:T:CC,Is the Shift in Tornado Alley Related to Climate Change? - FLYING Magazine - FLYING,https://news.google.com/rss/articles/CBMiUmh0dHBzOi8vd3d3LmZseWluZ21hZy5jb20vaXMtdGhlLXNoaWZ0LWluLXRvcm5hZG8tYWxsZXktcmVsYXRlZC10by1jbGltYXRlLWNoYW5nZS_SAQA?oc=5,https://da.gd/mmXBr
GN:T:CC,Colombia's Petro urges Spain to lead EU on climate change - ABC News,https://news.google.com/rss/articles/CBMiZWh0dHBzOi8vYWJjbmV3cy5nby5jb20vQnVzaW5lc3Mvd2lyZVN0b3J5L2NvbG9tYmlhcy1wZXRyby11cmdlcy1zcGFpbi1sZWFkLWV1LWNsaW1hdGUtY2hhbmdlLTk5MDQwMzMz0gFpaHR0cHM6Ly9hYmNuZXdzLmdvLmNvbS9hbXAvQnVzaW5lc3Mvd2lyZVN0b3J5L2NvbG9tYmlhcy1wZXRyby11cmdlcy1zcGFpbi1sZWFkLWV1LWNsaW1hdGUtY2hhbmdlLTk5MDQwMzMz?oc=5,https://da.gd/5kpzsX
