feed,title,long_url,short_url
GN:S:C,Northern Great Plains 'greening' during recent climate change - Idaho State University,https://www.isu.edu/news/2020-spring/northern-great-plains-greening-during-recent-climate-change.html,
GN:S:C,Why don't we take climate change seriously? Racism is the answer - Open Democracy,https://www.opendemocracy.net/en/why-dont-we-take-climate-change-seriously-racism-is-the-answer/,
GN:S:C,Rainforest Alliance aims to help ethical growers get climate-smart - Reuters,https://www.reuters.com/article/us-climate-change-farming-food-trfn/rainforest-alliance-aims-to-help-ethical-growers-get-climate-smart-idUSKBN2426SC,
GN:S:C,Portland Declares A Climate Emergency . News - OPB News,https://www.opb.org/news/article/portland-oregon-climate-emergency-ted-wheeler-city-council-i5/,
GN:S:C,The pandemic may be a preview of our climate future | Opinion - NJ,https://www.nj.com/opinion/2020/07/the-pandemic-may-be-a-preview-of-our-climate-future-opinion.html,
GN:S:C,Will the Democratic Party's Climate Platform Address Injustice? - Capital and Main,https://capitalandmain.com/will-the-democratic-partys-climate-platform-address-injustice-0701,
GN:S:C,"Today, Australia's Kyoto climate targets end and our Paris cop-out begins. That's nothing to be proud of, Mr Taylor - The Conversation AU",https://theconversation.com/today-australias-kyoto-climate-targets-end-and-our-paris-cop-out-begins-thats-nothing-to-be-proud-of-mr-taylor-131137,
GN:S:C,NYSEG and RG&E File Action Plan to Support New York State Climate Goals - WIVT - NewsChannel 34,https://www.binghamtonhomepage.com/news/up-to-the-minute/nyseg-and-rge-file-action-plan-to-support-new-york-state-climate-goals/,
GN:S:C,Atmanirbhar Bharat: Missing a focus on air pollution and climate change - Observer Research Foundation,https://www.orfonline.org/research/atmanirbhar-bharat-missing-a-focus-on-air-pollution-and-climate-change-68841/,
GN:S:C,EU hopes to strike deal on climate change law this year - CNA,https://www.channelnewsasia.com/news/world/eu-climate-change-deal-law-this-year-12887758,
GN:S:C,Emmanuel Macron commits €15bn to definitive climate action - Power Engineering International,https://www.powerengineeringint.com/emissions-environment/emmanuel-macron-commits-e15bn-to-definitive-climate-action/,
