feed,title,long_url,short_url
GN:S:C,UK climate protesters glued themselves to a 500-year-old painting - NPR,https://www.npr.org/2022/07/05/1109848464/climate-protesters-in-england-glued-themselves-to-a-copy-of-the-last-supper,
GN:S:C,GermanZero Assists Politicians In Tackling The Climate Crisis - CleanTechnica,https://cleantechnica.com/2022/07/05/germanzero-assists-politicians-in-tackling-the-climate-crisis/,
GN:S:C,Ecofeminism and Environmental Ethics: The Interconnection Between Women and Climate Justice - EARTH,https://earth.org/ecofeminism-and-environmental-ethics/,
GN:S:C,Climate Change Might Keep Humpback Whales Away From Hawaiʻi - Big Island Video News,https://www.bigislandvideonews.com/2022/07/05/climate-change-might-keep-humpback-whales-away-from-hawai%CA%BBi/,
GN:S:C,Dutch Police Shoot at Tractor During Climate Mandate Protests - The Epoch Times,https://www.theepochtimes.com/dutch-police-shoot-at-tractor-during-climate-mandate-protests_4579111.html,
GN:S:C,Climate protesters in England glued themselves to a copy of 'The Last Supper' – Nation & World News - WUFT,https://www.wuft.org/nation-world/2022/07/05/climate-protesters-in-england-glued-themselves-to-a-copy-of-the-last-supper/,
