feed,title,long_url,short_url
GN:T:RE,China Huadian’s green energy unit files for US$4.5 billion Shanghai IPO - South China Morning Post,https://www.scmp.com/business/banking-finance/article/3184277/china-huadians-renewable-energy-unit-files-us45-billion,
GN:T:RE,"South Korea bets on nuclear power, restarting construction on two reactors - CNN",https://www.cnn.com/2022/07/06/asia/south-korea-nuclear-plants-renewable-energy-intl-hnk/index.html,
GN:T:RE,The Net‐Zero‐2050 Web-Atlas: Using a digital tool for knowledge transfer - Open Access Government,https://www.openaccessgovernment.org/the-net-zero-2050-web-atlas-digital-tool-knowledge-transfer-decision-support/138812/,
GN:T:RE,S. Korea presents new energy policies to strengthen energy security - Arirang News,https://www.youtube.com/watch?v=97UjE9pB8-o,
GN:T:RE,Gov. Ige signs bills advancing Hawaiʻi's clean energy economy - Maui Now,https://mauinow.com/2022/07/05/gov-ige-signs-bills-advancing-hawai%CA%BBis-clean-energy-economy/,
GN:T:RE,Soluna Computing Engages Truist Securities as Pipeline Growth Accelerates - Yahoo Finance,https://finance.yahoo.com/news/soluna-computing-engages-truist-securities-200100863.html,
GN:T:RE,Morocco launches EPC tender for 260 MW of solar - pv magazine International,https://www.pv-magazine.com/2022/07/06/morocco-launches-epc-tender-for-260-mw-of-solar/,
GN:T:RE,Tanzania's new electric rail will help it cut carbon emissions - Quartz,https://qz.com/africa/2185031/tanzanias-new-electric-rail-will-help-it-cut-carbon-emissions/,
GN:T:RE,"In Light Of EPA Court Ruling, New Focus On States' Power - Jamestown Post Journal",https://www.post-journal.com/news/latest-news/2022/07/in-light-of-epa-court-ruling-new-focus-on-states-power/,
GN:T:RE,Tucson Electric Power Picks Solar FlexRack for 15 MW Community Solar Project in Arizona - T&D World,https://www.tdworld.com/distributed-energy-resources/article/21245888/tucson-electric-power-picks-solar-flexrack-for-15-mw-community-solar-project-in-arizona,
GN:T:RE,LandGate's Yoann Hispa: Renewables Are Driving Sales of Land Resources – Commercial Observer - Commercial Observer,https://commercialobserver.com/2022/07/landgate-yoann-hispa-land-sales/,
