feed,title,long_url,short_url
GN:S:C,Climate change boosts soybean production but worsens bean quality - Phys,https://news.google.com/rss/articles/CBMiggFBVV95cUxQVzBGY1ozbExqZWs5NnZjQnVCS1ZmSDNYc3hzNzRvVm5GejlXMTRQWFhYbzBjZXBlbWZmVjRaY3o5R3dwOU9JaHVIUWhVYjhENVJ0X19ZRWpGMnpSenhReWhNcjNHRXZJdWZoOEUybEdmQzdaVWlGcUU5MEJJdzJlRTRR?oc=5,
GN:S:C,Why we need to (keep) talking about climate change - E3G,https://news.google.com/rss/articles/CBMif0FVX3lxTE15Y0IxaVptSV94N2FoMW04LU4yd2tpcTNreEhQYkdKQUF2ME5JUGU3MUZocmNRMGViOG5kRDQ0bTIwM2xLRWdUcVpmQWlaN243alpJN0xBRmdrRXJtZ2FJUHhqMVl0UzJ1SHJMd1huOEJoa2JoREk5SjVvY0J2LTA?oc=5,
GN:S:C,Mitigating Climate Change One White Roof at a Time - The Good Men Project,https://news.google.com/rss/articles/CBMimwFBVV95cUxNM2lSZGRJZ0dxdnpCMVhlTTBzdGtTb2xSUFR2ZGU4U2JTV1ZCVDliZmt4Rnl4dU9RWTdBelJpVFNRTTZGS3VSeFpuUEtWVXJjS0JtUU9Ia1B3UFAxTkZMTWN3cjVGYzBwQVJjc3I4REdqT2lfeDFwa2RyNXV6N0tCWFNNbWluWV9QdFZxTEQ3V0tZa0l4LUdfU2l1SQ?oc=5,
GN:S:C,London Climate Action Week: Half time team talk on accelerating the energy transition - E3G,https://news.google.com/rss/articles/CBMic0FVX3lxTE9FSFBvZ0JxNzlGWHlySEI4SDhqQjM3Sk5OdnNqZkJQdnVOaDFEb3BFTXptZG9jck9VdnRHWDI2SEVEWFhhN2RoR04zdlpzaGdvNG53REhqV292cmkwYkZmbWpKUWhLVFFMYkNBV3BrTnVCOWM?oc=5,
GN:S:C,"Sherbrooke climate runner Steven Guérard pushes into Ontario, nears Sudbury after gruelling 87-km night run - The Pulse of the Eastern Townships",https://news.google.com/rss/articles/CBMie0FVX3lxTFBCZVJuLUVIUzNUQUp2aHdERTFUclJyZjg4YWhGbF9pekllUWZJMVdpZElWQmFJaTFHLTIzUUkxOXFWWFZGSWpkVVg1bG1fRVZnQnhVdm5pVG1ZdzNzR2FpOS1OcUZaSGR2X01vbU5saWtjNkxlaXd1OFpzZw?oc=5,
