feed,title,long_url,short_url
GN:T:WP,Panorama - K2 Management launches new asset management system in collaboration with Emerson - Renewable Energy Magazine,https://www.renewableenergymagazine.com/panorama/k2-management-launches-new-asset-management-system-20220309,
GN:T:WP,Romania's Simtel Team targets 87% rise in net profit in 2022 - Renewables Now,https://renewablesnow.com/news/romanias-simtel-team-targets-87-rise-in-net-profit-in-2022-776302/,
GN:T:WP,Decoding A Tesla VIN Reveals “ELON” Easter Egg - CleanTechnica,https://cleantechnica.com/2022/03/08/decoding-a-tesla-vin-reveals-elon-easter-egg/,
GN:T:WP,"Driven by coal, IEA says energy-related CO2 emissions hit their highest level in history in 2021 - CNBC",https://www.cnbc.com/2022/03/09/energy-related-co2-emissions-hit-highest-ever-level-in-2021-iea.html,
GN:T:WP,Sustainable tourism in Germany | All media content - DW (English),https://www.dw.com/en/sustainable-tourism-in-germany/g-60913360,
GN:T:WP,"EDPR, Vestas relaunches Spanish jobs programme - reNEWS",https://renews.biz/76264/edpr-vestas-relaunches-spanish-jobs-programme/,
GN:T:WP,EDF Renewables launches UK green hydrogen scheme - reNEWS,https://renews.biz/76265/edf-renewables-launches-uk-green-hydrogen-scheme/,
