feed,title,long_url,short_url
GN:T:CC,Himalayan glaciers melting at 'exceptional' rate: research | TheHill - The Hill,https://thehill.com/policy/energy-environment/586600-himalayan-glaciers-melting-at-exceptional-rate-research,
GN:T:CC,Manchin blasts WH staff for leaking 'absolutely inexcusable' things about him after rejecting BBB - Fox News,https://www.foxnews.com/politics/manchin-blasts-wh-staff-leak-bbb,
GN:T:CC,"As climate change makes storms more dangerous, some consider leaving Louisiana for good - KLFY",https://www.klfy.com/louisiana/as-climate-change-makes-storms-more-dangerous-some-consider-leaving-louisiana-for-good/,
GN:T:CC,Protecting the freedom to vote will help us tackle the climate crisis | TheHill - The Hill,https://thehill.com/changing-america/opinion/586620-protecting-the-freedom-to-vote-will-help-us-tackle-the-climate,
GN:T:CC,"Shortest day, longest night: The winter solstice is Tuesday - USA TODAY",https://www.usatoday.com/story/news/nation/2021/12/20/winter-solstice-december-2022/8968412002/,
