feed,title,long_url,short_url
GN:T:RE,Taiwan to execute majority of net-zero emission efforts in 2030–2050 - DIGITIMES,https://news.google.com/rss/articles/CBMiXGh0dHBzOi8vd3d3LmRpZ2l0aW1lcy5jb20vbmV3cy9hMjAyMzA3MTdQRDIwMy90YWl3YW4tcmVuZXdhYmxlLWVuZXJneS1pY3QtbWFudWZhY3R1cmluZy5odG1s0gEA?oc=5,https://da.gd/sRKjb
GN:T:RE,Natac awarded €14m to develop dynamic biorefining model and meet net zero goals - FeedNavigator,https://news.google.com/rss/articles/CBMif2h0dHBzOi8vd3d3LmZlZWRuYXZpZ2F0b3IuY29tL0FydGljbGUvMjAyMy8wNy8xNy9OYXRhYy1hd2FyZGVkLTE0bS10by1kZXZlbG9wLWR5bmFtaWMtYmlvcmVmaW5pbmctbW9kZWwtYW5kLW1lZXQtbmV0LXplcm8tZ29hbHPSAQA?oc=5,https://da.gd/ePQGn
GN:T:RE,Kerry: Beijing has agreed to have methane action plan | World DNA - WION,https://news.google.com/rss/articles/CCAiC1FzTGM3dEdRenhnmAEB?oc=5,https://da.gd/KVS00H
GN:T:RE,Crown Estate kicks off Celtic Sea surveys - reNEWS,https://news.google.com/rss/articles/CBMiQ2h0dHBzOi8vcmVuZXdzLmJpei84NzAwOS9jcm93bi1lc3RhdGUta2lja3Mtb2ZmLWNlbHRpYy1zZWEtc3VydmV5cy_SAQA?oc=5,https://da.gd/q6SW
GN:T:RE,"Japan, Saudi Arabia push forward on decarbonization tech tie-up - Kyodo News Plus",https://news.google.com/rss/articles/CBMie2h0dHBzOi8vZW5nbGlzaC5reW9kb25ld3MubmV0L25ld3MvMjAyMy8wNy82ODBlMzc5OTg0MTYtamFwYW4tc2F1ZGktYXJhYmlhLXB1c2gtZm9yd2FyZC1vbi1kZWNhcmJvbml6YXRpb24tdGVjaC10aWUtdXAuaHRtbNIBAA?oc=5,https://da.gd/w950
