feed,title,long_url,short_url
GN:T:CC,Wind turbine maker GE Renewable Energy reports heavy losses in 2021 - Windpower Monthly,https://www.windpowermonthly.com/article/1738328/wind-turbine-maker-ge-renewable-energy-reports-heavy-losses-2021,
GN:T:CC,Wildfires in January? Scientists say climate change could fuel 'a continuous fire season' - San Francisco Chronicle,https://www.sfchronicle.com/bayarea/article/Wildfires-in-January-Scientists-say-climate-16804109.php,
GN:T:CC,How Leaders Can Move Beyond Greenwashing Toward Real Change - Harvard Business Review,https://hbr.org/2022/01/how-leaders-can-move-beyond-greenwashing-toward-real-change,
GN:T:CC,The Supreme Court’s Plan to Block Climate Action We Haven’t Even Taken Yet - Slate,https://slate.com/news-and-politics/2022/01/supreme-court-wv-epa-climate-doom.html,
GN:T:CC,GOP senator from North Dakota wants to tackle climate change - NPR,https://www.npr.org/2022/01/26/1075717107/gop-senator-from-north-dakota-wants-to-tackle-climate-change,
GN:T:CC,The climate crisis demands courage not optimism - The Conversation CA,https://theconversation.com/the-climate-crisis-demands-courage-not-optimism-175432,
GN:T:CC,Biodiversity loss is as big of a threat as climate change - but 90% of Brits don’t see it - Euronews,https://www.euronews.com/green/2022/01/25/biodiversity-loss-is-as-big-of-a-threat-as-climate-change-but-90-of-brits-don-t-see-it,
