feed,title,long_url,short_url
GN:T:GP,"Ormat Technologies, Inc. to Host Conference Call Announcing - GlobeNewswire",https://www.globenewswire.com/news-release/2022/01/26/2373392/0/en/Ormat-Technologies-Inc-to-Host-Conference-Call-Announcing-Fourth-Quarter-and-Year-end-2021-Financial-Results.html,
GN:T:GP,EU tapped renewables for nearly two-fifths of power in 2020 - Eurostat - Reuters,https://www.reuters.com/business/cop/eu-tapped-renewables-nearly-two-fifths-power-2020-eurostat-2022-01-26/,
GN:T:GP,Stock car racing to continue at United Downs Raceway for 2022 - BBC News,https://www.bbc.com/news/uk-england-cornwall-60140600,
GN:T:GP,Energy diversification can minimize power crisis threat: ministry - ANTARA English,https://en.antaranews.com/news/211901/energy-diversification-can-minimize-power-crisis-threat-ministry,
GN:T:GP,Merging Uganda's electricity sector agencies is a bad idea - Independent,https://www.independent.co.ug/merging-ugandas-electricity-sector-agencies-is-a-bad-idea/,
