feed,title,long_url,short_url
ArXiv,Graph-enabled Reinforcement Learning for Time Series Forecasting with Adaptive Intelligence,https://arxiv.org/abs/2309.10186v1,
ArXiv,Clinically-Inspired Multi-Agent Transformers for Disease Trajectory Forecasting from Multimodal Data,https://arxiv.org/abs/2210.13889v2,
ArXiv,ChatGPT Informed Graph Neural Network for Stock Movement Prediction,https://arxiv.org/abs/2306.03763v4,
ArXiv,BayOTIDE: Bayesian Online Multivariate Time series Imputation with functional decomposition,https://arxiv.org/abs/2308.14906v2,
ArXiv,Short-Term Load Forecasting Using A Particle-Swarm Optimized Multi-Head Attention-Augmented CNN-LSTM Network,https://arxiv.org/abs/2309.03694v2,
ArXiv,Quantitative Analysis of Forecasting Models:In the Aspect of Online Political Bias,https://arxiv.org/abs/2309.05589v2,
ArXiv,Transformed-Linear Innovations Algorithm for Modeling and Forecasting of Time Series Extremes,https://arxiv.org/abs/2309.10061v1,
ArXiv,"An overview of time series point and interval forecasting based on similarity of trajectories, with an experimental study on traffic flow forecasting",https://arxiv.org/abs/2309.10613v1,
