feed,title,long_url,short_url
GN:T:CC,Protesters blocked Paris Hilton's car and models condemned the Gala's honoree - Los Angeles Times,https://news.google.com/rss/articles/CBMicmh0dHBzOi8vd3d3LmxhdGltZXMuY29tL2VudGVydGFpbm1lbnQtYXJ0cy9zdG9yeS8yMDIzLTA1LTAxL21vZGVscy1hbmQtY2xpbWF0ZS1hY3RpdmlzdHMtcHJvdGVzdC10aGUtMjAyMy1tZXQtZ2FsYdIBAA?oc=5,https://da.gd/f1aWS
GN:T:CC,Fossil Fuel Says It Can Be Part of Clean Future. ExxonMobil Is on Board. - Barron's,https://news.google.com/rss/articles/CBMiPmh0dHBzOi8vd3d3LmJhcnJvbnMuY29tL2FydGljbGVzL2V4eG9uLWNhcmJvbi1jbGltYXRlLTk1ZTY4ODRj0gFCaHR0cHM6Ly93d3cuYmFycm9ucy5jb20vYW1wL2FydGljbGVzL2V4eG9uLWNhcmJvbi1jbGltYXRlLTk1ZTY4ODRj?oc=5,https://da.gd/VhCE0
GN:T:CC,Scientists: Climate change worsened Eastern Africa drought - The Associated Press,https://news.google.com/rss/articles/CBMicGh0dHBzOi8vYXBuZXdzLmNvbS9hcnRpY2xlL2hvcm4tb2YtYWZyaWNhLWVhc3Rlcm4tYWZyaWNhLWRyb3VnaHQtY2xpbWF0ZS1jaGFuZ2UtYTExZjYxMmJjNmMwZjFhMjczMjQ2NTIxNDZkMjRlNTXSAQA?oc=5,https://da.gd/jXQiy2
GN:T:CC,California redwoods suffering from effects of climate change-fueled weather whiplash - CBS News,https://news.google.com/rss/articles/CBMigAFodHRwczovL3d3dy5jYnNuZXdzLmNvbS9zYW5mcmFuY2lzY28vdmlkZW8vY2FsaWZvcm5pYS1yZWR3b29kcy1zdWZmZXJpbmctZnJvbS1lZmZlY3RzLW9mLWNsaW1hdGUtY2hhbmdlLWZ1ZWxlZC13ZWF0aGVyLXdoaXBsYXNoL9IBAA?oc=5,https://da.gd/OtmYg
GN:T:CC,Can cities help us fight climate change? – podcast - The Guardian,https://news.google.com/rss/articles/CBMiZWh0dHBzOi8vd3d3LnRoZWd1YXJkaWFuLmNvbS9zY2llbmNlL2F1ZGlvLzIwMjMvbWF5LzAyL2Nhbi1jaXRpZXMtaGVscC11cy1maWdodC1jbGltYXRlLWNoYW5nZS1wb2RjYXN00gEA?oc=5,https://da.gd/889Z
GN:T:CC,Enlightening acronyms and the happiness equation: Deepak Chopra on the climate crisis - The Stanford Daily,https://news.google.com/rss/articles/CBMiemh0dHBzOi8vc3RhbmZvcmRkYWlseS5jb20vMjAyMy8wNC8zMC9lbmxpZ2h0ZW5pbmctYWNyb255bXMtYW5kLXRoZS1oYXBwaW5lc3MtZXF1YXRpb24tZGVlcGFrLWNob3ByYS1vbi10aGUtY2xpbWF0ZS1jcmlzaXMv0gEA?oc=5,https://da.gd/vQFpi8
