feed,title,long_url,short_url
GN:S:GW,"Seminars at Steamboat: Climate Change - Status, Outlook, Impacts and Viable Actions - KUNC",https://news.google.com/rss/articles/CBMic2h0dHBzOi8vd3d3Lmt1bmMub3JnL25ld3MvMjAyNC0wNy0xMi9zZW1pbmFycy1hdC1zdGVhbWJvYXQtY2xpbWF0ZS1jaGFuZ2Utc3RhdHVzLW91dGxvb2staW1wYWN0cy1hbmQtdmlhYmxlLWFjdGlvbnPSAQA?oc=5,https://da.gd/5SALN
GN:S:GW,Investigating variation in the permafrost active layer over the Tibetan Plateau from 1980 to 2020 - Phys,https://news.google.com/rss/articles/CBMiTWh0dHBzOi8vcGh5cy5vcmcvbmV3cy8yMDI0LTA3LXZhcmlhdGlvbi1wZXJtYWZyb3N0LWxheWVyLXRpYmV0YW4tcGxhdGVhdS5odG1s0gEA?oc=5,https://da.gd/FHghWr
GN:S:GW,How Bad Is Warming? La Niña May Reveal - Yahoo! Voices,https://news.google.com/rss/articles/CBMiP2h0dHBzOi8vd3d3LnlhaG9vLmNvbS9uZXdzL2JhZC13YXJtaW5nLWxhLW5pLW1heS0xMzQyMDAxMjAuaHRtbNIBAA?oc=5,https://da.gd/OOGm
GN:S:GW,Here’s What Nigel Farage’s Reform Party MPs Have to Say About Climate Change - DeSmog,https://news.google.com/rss/articles/CBMibWh0dHBzOi8vd3d3LmRlc21vZy5jb20vMjAyNC8wNy8xMi9oZXJlcy13aGF0LW5pZ2VsLWZhcmFnZXMtcmVmb3JtLXBhcnR5LW1wcy1oYXZlLXRvLXNheS1hYm91dC1jbGltYXRlLWNoYW5nZS_SAQA?oc=5,https://da.gd/XVg39
GN:S:GW,"With record breaking rain and heat, Uttarakhand reels under climate change impacts - Carbon Copy",https://news.google.com/rss/articles/CBMiamh0dHBzOi8vY2FyYm9uY29weS5pbmZvL3dpdGgtcmVjb3JkLWJyZWFraW5nLXJhaW4tYW5kLWhlYXQtdXR0YXJha2hhbmQtcmVlbHMtdW5kZXItY2xpbWF0ZS1jaGFuZ2UtaW1wYWN0cy_SAQA?oc=5,https://da.gd/HTMp1
