feed,title,long_url,short_url
RS,Lacto-ovo vegetarian diet mitigated the risk of chronic kidney disease in overweight individuals,https://www.researchsquare.com/article/rs-3489352/latest,https://da.gd/sudbc
RS,Development and validation of a novel nutrition-based nomogram to predict prognosis in pancreatic cancer patients receiving first-line systemic chemotherapy from three centres,https://www.researchsquare.com/article/rs-3410338/latest,https://da.gd/XTgcB
RS,The Utility of Monocyte-to-High-Density Lipoprotein- Cholesterol Ratio (MHR) in Estimating Renal Function Impairment: Cross-Sectional Data from the National Health and Nutrition Examination Survey (NHANES) 2007-2018,https://www.researchsquare.com/article/rs-3498743/latest,https://da.gd/DhRU3
RS,Vitamin D3 Supplementation Could Improve the Effect of Exercise Training on Type 2 Diabetes -Induced Metabolic Disorders via BDNF/Irisin Axis in Elderly Women,https://www.researchsquare.com/article/rs-3495715/latest,https://da.gd/xiZtK
RS,Assessment of vitamin K2 status in children with chronic kidney diseases,https://www.researchsquare.com/article/rs-3464006/latest,https://da.gd/nluiH
RS,"ZnO/Chitosan Nanocomposite: Ecofriendly Biosynthesis, Characterization and Application for the Removal of Pyridoxine Hydrochloride (Vitamin B6) from Wastewater",https://www.researchsquare.com/article/rs-3391453/latest,https://da.gd/OIQ6k
RS,Host-specific co-evolution likely driven by diet in Buchnera aphidicola,https://www.researchsquare.com/article/rs-3493959/latest,https://da.gd/BmJnGh
RS,Betaine addition to dietary can alleviate intestinal injury to growing meat rabbits in summer heat through the AAT/mTOR pathway,https://www.researchsquare.com/article/rs-3473438/latest,https://da.gd/b1FC
