feed,title,long_url,short_url
GN:S:C,Scientists just got some ancient clues about future sea level rise — and it’s bad news - The Washington Post,https://news.google.com/rss/articles/CBMilAFBVV95cUxPeWdoNFI3YXV6bDF2QWRxTFBDNGtnS2tLZzhwbmotRmxtMmdvcVVRQ1FzbVIyWExUWmFmNEtDT3FUSFVwdUxpOGhKUDVtQlZ4ZWtseVZKZU1BY2xCVUxjRmJ2M2tRQzhhVGczVl9zZ3JYQTE3R2NadTBkUVp4andsbVdwQTdlUGotMHpsMjdlcVRkRXZf?oc=5,
GN:S:C,January Green Drinks focuses on the financial system’s role in climate change - Park Record,https://news.google.com/rss/articles/CBMitgFBVV95cUxON2JBTjRPdHZVT25lanBma2c0bHhqUGJpQlM1aVIyMjJGWW1XRFBEb20tNTJTNkVDRTNQUnAxVlhEalNrSU5vWWNCR2l0NE5wYmExa2lHTzNMTlhPb1FucW1jSlVBSzVmX3FXcHV0MkFOcDFYX1BrYUdaZ1hnU3c0bFVUTXU3N3FyZXRnRl9fTFAzM0VYbXh0Wlc3TWVNNnpyTVV2eFhQU1dZSUFUUXlHVFdYd05GZw?oc=5,
GN:S:C,There’s No Need for a Climate Change Debate - Dan’s Papers,https://news.google.com/rss/articles/CBMie0FVX3lxTE54YVV6OGNUT0gtLS1fOTJZbUxrZkpsbnVoUEZTaEtQeEVQU0huRE5RLXF4d2dWd0QzZk1FWENybHU4MjFfT096Z1d0ME5WLUZMZGNwUXhWb2d2R0NnMXpYc0p4RGRKbXp1TkF6aWkxbnI3eEN6QVdZXzh0Zw?oc=5,
GN:S:C,Cruise Sector and U.S. Government Block Hawaii’s Climate Tax on Cruise Ships - Skift,https://news.google.com/rss/articles/CBMipwFBVV95cUxOLTlOQ25hcTRKV3E5TUdEZUNRRWxfSmYyUktiVmtNaTB2TE05TnRWM0ZjR21nazBfQ1ZDVVlxcDhIS3VTVTNzMXdfLS1TbHV1NXVUYmQwY3FWajg1WUhybkVsQXE0MWhEd2QybF9LSURHaHhKRFJfUTZPeFBrdUx1OFg3aGtsNm4tYy1tVHg1UXptMHJwWTR4TjJYOG1VNkRjQjZ3aGc0TQ?oc=5,
GN:S:C,Washington’s Next Climate Push Targets Big Trucks - NewsRadio 560 KPQ,https://news.google.com/rss/articles/CBMiakFVX3lxTE1GaTNKWlZZamU4M1dDbDF3NXhzWGZFam5Ec251QXlYbVhhYnVQVDdBaUppVDh1SHJFZ0Jqbk81THJxTnZPUzBDNlhHY3FBN1VSUEVCQWY1UzJINmhuWUF3dWdybDdNMnNROXc?oc=5,
GN:S:C,"Why Carbon Pricing Is the Missing Link in U.S. Climate Policy, According to a New Study - Carbon Herald",https://news.google.com/rss/articles/CBMikgFBVV95cUxPcWM3Z3liWTdXU0VTR3BnekFWZm9tOVNxdVRROWE4NVpSYW9EQ25YMVA1VlFvU2dzcmNNUmpyTExHa0YtaVNpR0h3YmpXZDRXLVBOWGlSSkV0djVpQ1liT1Bsb0Zpd2t5X0VXYnZXdVRYeFpDaENVSFBKcXJOU05qTnpFRjAxTWtWeXZRMWpLbC1Idw?oc=5,
GN:S:C,"Report: Google Searches for Veganism Outpace Those for Climate Change, While Flexitarianism is Now Mainstream Globally - vegconomist - the vegan business magazine",https://news.google.com/rss/articles/CBMiygFBVV95cUxNZGNxOFgwdXRUZjZoeDYwM1d5VHFfREh5NzJkcWJwTk1pZ0Zvak11X09kZHpZbzdQeXE2ZXlhMXpLUVh3dm1Ed2hkdmVhV2xvc1ZZUkJuM0tSNDJWZVRfYmV6akI1cjFlaW1sMVF0WkRlblA0dXhhQzBWalB0VXp6WjFmVVpwcWgzMFhGQ2hqODctTDJncE9CdDFyS0NhOVNkLXo2VVowMnpZWFJSa0ZETzhkRE5pU3hVTV9lb1ViaG5lUk9KdVMtbG1B?oc=5,
GN:S:C,Groundbreaking AccuWeather climate study reveals profoundclimate trends with far-reaching impacts - AccuWeather,https://news.google.com/rss/articles/CBMi3AFBVV95cUxOT0dsdk1mb3IxbF91azdWR0lLSFBoYVc4TGFOVVgteWExNjdCRnV4RnpvSEtxb0F1NXhxS2ZSRmZQQlhKMER5amc2VXV6bFlMTVRvYmZqWU5ndjNrc3NmMUZCSFNHTG9Rb25zUURMakxnYnhGTVBuT0c5Z25zMlMweE5GMnUwa0dsVGxwQ05hWS1qNFp5bktQNXYwS1NYQUlPNkpLb0JSNXFRc1g1Ui1TekRCdGtrWE5YaVVELXlzUmVPZU50UnNsSmpTdWFaZ1lmdzhzcXBXU2cwR1dM?oc=5,
GN:S:C,Egypt Mobilizes $750 Million in Green Bond Finance to Advance Climate Strategy 2050 - ESG News,https://news.google.com/rss/articles/CBMipgFBVV95cUxNMTNNaGpLOFEyLVkyR3pmS2xaQTM1ejJvanpjU2l4MGtLQ2lIZ2NycEpheWdON29yYmk4bDZjM2xURW9mQUJ5dmhDZkJYb0RBRkZCcEtQUWF6YWJ3aXdVbHQzNTYwNTJKeVlaU1I5N2k5TUI3Mk82Q1FMWGszd1BwQldqSFNTV0dSbEhLQVVRdUlPWUtWRmlKbnpsNnF6blQwUTdjaXVR?oc=5,
