feed,title,long_url,short_url
gNews,Coronavirus: India tops daily deaths and cases for first time - BBC News,https://www.bbc.com/news/live/world-53591031,https://j.mp/31feKRb
gNews,India's Narendra Modi to lay foundation stone at divisive Ayodhya temple despite rise in coronavirus cases - CNN,https://www.cnn.com/2020/08/04/asia/ayodhya-temple-modi-foundation-stone-intl-hnk/index.html,https://j.mp/2Xq5BnQ
gNews,Sun Pharma latest to sell COVID-19 drug favipiravir in India - Reuters,https://www.reuters.com/article/healthcoronavirus-india/sun-pharma-latest-to-sell-covid-19-drug-favipiravir-in-india-idUSL4N2F62NT,https://j.mp/2XohRp2
gNews,Japan curry house tries luck with true connoisseurs -- in India - Nikkei Asian Review,https://asia.nikkei.com/Business/Food-Beverage/Japan-curry-house-tries-luck-with-true-connoisseurs-in-India,https://j.mp/2PoGDRq
gNews,"Google Pixel 4a arriving in India in October – Price, specs and more - Zee News",https://zeenews.india.com/mobiles/google-pixel-4a-arriving-in-india-in-october-price-specs-and-more-2300395.html,https://j.mp/30o9Kui
gNews,"Outside Reliance, not many proxies for Covid beneficiaries in India: Rahul Chadha - Economic Times",https://economictimes.indiatimes.com/markets/expert-view/outside-reliance-not-many-clear-proxies-for-covid-beneficiaries-in-india-rahul-chadha/articleshow/77345917.cms,https://j.mp/3kalMzl
gNews,"Indias Wockhardt signs pact with UK to guarantee filling, packaging of purchased COVID-19 vaccines - Firstpost",https://www.firstpost.com/india/indias-wockhardt-signs-pact-with-uk-to-guarantee-filling-packaging-of-purchased-covid-19-vaccines-8670261.html,https://j.mp/3fva8vk
gNews,What it Takes to Ramp Up Solar Manufacturing in India - Mercom India,https://mercomindia.com/ramp-up-solar-manufacturing-india/,https://j.mp/2Dl61Fh
