feed,title,long_url,short_url
gNews,India Inc. Raises Rs 2.78 Lakh Crore In Pandemic-Hit Quarter - BloombergQuint,https://www.bloombergquint.com/bq-blue-exclusive/india-inc-raises-rs-278-lakh-crore-in-pandemic-hit-quarter,https://j.mp/3kleUiW
gNews,"Coronavirus India LIVE Updates: Daily increase of 50,000 cases for a week; Lakshadweep only region free of pandemic - The Indian Express",https://indianexpress.com/article/india/coronavirus-india-news-live-updates-covid-19-cases-death-toll-symptoms-worldwide-cases-tally-lockdown-vaccine-oxford-6541329/,https://j.mp/2PvfFYu
gNews,India’s Hindu Nationalists Reverse the Tide of History - BloombergQuint,https://www.bloombergquint.com/view/ayodhya-temple-marks-triumph-of-modi-s-hindu-nationalists,https://j.mp/31nKpQz
gNews,Master of the stage - The Indian Express,https://indianexpress.com/article/opinion/editorials/ebrahim-alkazi-death-modern-indian-theatre-6541351/,https://j.mp/2C6lWXs
gNews,These Are India's 10 Most Valuable Companies - NDTV Profit,https://www.ndtv.com/business/indias-most-valuable-companies-ril-tcs-hdfc-bank-hold-top-3-spots-here-are-top-10-2274759,https://j.mp/3keCUnD
gNews,"Coronavirus LIVE: India again sees 50000+ cases in a day, tally at 1960865 - Business Standard",https://www.business-standard.com/article/current-affairs/coronavirus-live-updates-india-total-cases-near-2-million-global-death-toll-statewise-corona-vaccine-covid19-update-120080600016_1.html,https://j.mp/2EQsIBr
gNews,"COVID-19 Live Updates: Coronavirus Recovery Rate In India Now At 67.19%, Says Centre - NDTV",https://www.ndtv.com/india-news/coronavirus-live-updates-covid-19-recovery-rate-in-india-now-at-67-19-says-centre-2274918,https://j.mp/30wyDnF
gNews,Zydus to start second phase of Covid-19 vaccine candidate trials today - Hindustan Times,https://www.hindustantimes.com/india-news/zydus-to-start-second-phase-of-vaccine-candidate-trials-today/story-AkiC1iDUI9azdTSVbDFOQM.html,https://j.mp/2XvfH76
