feed,title,long_url,short_url
GN:S:C,"Committees, visas and climate change: Brexit experts' verdicts on the deal details - The Guardian",https://www.theguardian.com/politics/2020/dec/28/brexit-experts-verdict-uk-eu-trade-deal-details-visas,
GN:S:C,Climate change: How strong whisky helped Scotland's efforts to persuade the world to take action – Dr Richard Dixon - The Scotsman,https://www.scotsman.com/news/opinion/columnists/climate-change-how-strong-whisky-helped-scotlands-efforts-persuade-world-take-action-dr-richard-dixon-3079667,
GN:S:C,Trump Administration Finalizes Do-nothing 'Standards' for Airplane Climate Emissions - Center for Biological Diversity,https://biologicaldiversity.org/w/news/press-releases/trump-administration-finalizes-do-nothing-standards-for-airplane-climate-emissions-2020-12-28/,
GN:S:C,Climate Change Is Threatening One of America's Most Beloved Farm-to-Table Restaurants - InsideHook,https://www.insidehook.com/daily_brief/restaurants-bars/singlethread-farm-to-table-climate-change,
GN:S:C,Climate change education: The young campaigners fighting for lessons to tackle ecological crisis - The Courier,https://www.thecourier.co.uk/fp/news/schools/1846831/climate-change-education-the-young-campaigners-fighting-for-lessons-to-tackle-ecological-crisis/,
