feed,title,long_url,short_url
GN:T:WP,"San Francisco Bay Area storm live updates: Hundreds without power in Marin after tree knocks down power lines, shuts down Hwy 1 - KGO-TV",https://abc7news.com/san-francisco-bay-area-flood-watch-storm-damage-atmospheric-river/12701380/,https://da.gd/7wjtWI
GN:T:WP,"RWE selects Siemens Gamesa as preferred supplier for 1,000-MW offshore wind farm in Denmark | REVE News of the wind sector in Spain and in the world - REVE",https://www.evwind.es/2023/01/13/rwe-selects-siemens-gamesa-as-preferred-supplier-for-1000-mw-offshore-wind-farm-in-denmark/89713,https://da.gd/pXzr
GN:T:WP,"Storm-battered California gets more wind, rain and snow - WTOP",https://wtop.com/national/2023/01/storm-battered-california-gets-more-wind-rain-and-snow/,https://da.gd/SIYLm
GN:T:WP,Silversea Cruises Hires Massimo Brancealeoni as SVP Global Sales - The Maritime Executive,https://maritime-executive.com/corporate/silversea-cruises-hires-massimo-brancealeoni-as-svp-global-sales,https://da.gd/PfEM5
GN:T:WP,Maine gets 1st Mega Millions jackpot with $1.35B grand prize - The Morning Call,https://www.mcall.com/news/nation-world/ct-aud-nw-mega-millions-jackpot-maine-20230114-aakeirhdfrh3vknsghh2y5jl54-story.html,https://da.gd/wphdM5
