feed,title,long_url,short_url
MX,Working the steps during coronavirus can be tough. Experts offer tips on managing recovery,https://medicalxpress.com/news/2020-09-coronavirus-tough-experts-recovery.html,https://j.mp/33Qo3Z1
MX,Wildfires' toxic air leaves damage long after the smoke clears,https://medicalxpress.com/news/2020-09-wildfires-toxic-air.html,https://j.mp/2EplODy
MX,Think you have chemical intolerance? Answer three questions,https://medicalxpress.com/news/2020-09-chemical-intolerance.html,https://j.mp/2RJsob7
MX,"COVID-19 screening of asymptomatic people could decrease infections, deaths",https://medicalxpress.com/news/2020-09-covid-screening-asymptomatic-people-decrease.html,https://j.mp/32QUVSw
MX,Over 60 wealthy nations join WHO's COVID-19 vaccine plan,https://medicalxpress.com/news/2020-09-wealthy-nations-covid-vaccine.html,https://j.mp/3chdvWW
MX,Researchers find diminished response by 'killer' T cells in elderly COVID-19 patients,https://medicalxpress.com/news/2020-09-diminished-response-killer-cells-elderly.html,https://j.mp/3hY7kbC
MX,"Obesity increasing in U.S. adults, CDC report finds",https://medicalxpress.com/news/2020-09-obesity-adults-cdc.html,https://j.mp/35ZZE67
MX,"Scientists discover potential coronavirus remedy—at least, for mice and hamsters",https://medicalxpress.com/news/2020-09-scientists-potential-coronavirus-remedyat-mice.html,https://j.mp/3iTMxad
MX,Could coronavirus cause a better flu season? Maybe. Here's why.,https://medicalxpress.com/news/2020-09-coronavirus-flu-season.html,https://j.mp/2FU2kHE
