feed,title,long_url,short_url
GN:T:CC,"There's a battle over your gas stove, climate change and health - NPR",https://www.npr.org/2021/10/07/1015460605/gas-stove-emissions-climate-change-health-effects,
GN:T:CC,Gina Rinehart takes issue with climate change ‘propaganda’ in speech to private girls’ school - The Guardian,https://www.theguardian.com/business/2021/oct/07/gina-rinehart-takes-issue-with-climate-change-propaganda-in-speech-to-private-girls-school,
GN:T:CC,International Energy Agency says hydrogen investment falling far short of net zero - Hydrogen Fuel News,https://www.hydrogenfuelnews.com/hydrogen-investment-iea/8548641/,
GN:T:CC,Aerial footage shows damage in Amazon rainforest - CNN,https://www.cnn.com/videos/world/2021/10/07/rainforest-amazon-desforestation-fires-isa-soares-pkg-intl-ldn-vpx.cnn,
GN:T:CC,EU recommends relief funds for consumers hit by energy costs - Associated Press,https://apnews.com/article/climate-change-business-poverty-prices-europe-c38b970ff9f978516a4ca43450b020ea,
