feed,title,long_url,short_url
GN:T:GP,Croatia's ENSOLX invites expression of interest in geothermal power project - Renewables Now,https://renewablesnow.com/news/croatias-ensolx-invites-expression-of-interest-in-geothermal-power-project-756693/,
GN:T:GP,From natural gas to geothermal in the Netherlands - ThinkGeoEnergy,https://www.thinkgeoenergy.com/from-natural-gas-to-geothermal-in-the-netherlands/,
GN:T:GP,Scalding water and steam send Bitcoin soaring—but analysts say be wary of El Salvador’s ‘stunt’ - Fortune,https://fortune.com/2021/10/01/scalding-water-and-steam-send-bitcoin-soaring-but-analysts-say-be-wary-of-el-salvadors-stunt/,
GN:T:GP,Japan's Eneos keen on buying JRE for USD 1.8bn - report - Renewables Now,https://renewablesnow.com/news/japans-eneos-keen-on-buying-jre-for-usd-18bn-report-756611/,
GN:T:GP,Global Food Prices Are Soaring Amid Energy Crunch | OilPrice.com - OilPrice,https://oilprice.com/Latest-Energy-News/World-News/Energy-Crunch-Worsens-Food-Inflation.html,
GN:T:GP,Various Different Types Of Generator And How To Choose The Right One? - vermontpressbureau,https://www.vermontpressbureau.com/types-of-generator/,
GN:T:GP,"Ormat Technologies, Inc. to Host Conference Call Announcing Third Quarter 2021 Financial Results on November 4, 2021 - Marketscreener",https://www.marketscreener.com/quote/stock/ORMAT-TECHNOLOGIES-INC-40449526/news/Ormat-Technologies-Inc-to-Host-Conference-Call-Announcing-Third-Quarter-2021-Financial-Results-on-36628842/,
GN:T:GP,"Geothermal Development Faces Serious Challenge from Solar, Wind Energy | D-Insights - Katadata",https://dinsights.katadata.co.id/read/2021/10/07/geothermal-development-faces-serious-challenge-from-solar-wind-energy,
