feed,title,long_url,short_url
GN:T:CC,"Researchers just gave developing nations a scientific basis for legal action against US, China for climate damages - CNN",https://www.cnn.com/2022/07/12/world/greenhouse-gas-climate-emissions-gdp-loss-us-china/index.html,
GN:T:CC,Breaking down the Supreme Court ruling on the EPA - FreightWaves,https://www.freightwaves.com/news/breaking-down-the-supreme-court-ruling-on-the-epa,
GN:T:CC,How the green energy transition is key to creating sustainable economies | World Economic Forum - World Economic Forum,https://www.weforum.org/agenda/2022/07/green-energy-transition-democracy-economy/,
GN:T:CC,"New report outlines Juneau's climate future, and what we can do about it - KTOO",https://www.ktoo.org/2022/07/11/juneau-climate-change-report/,
GN:T:CC,New state park could help California answer climate change - CalMatters,https://calmatters.org/commentary/2022/07/new-state-park-could-help-california-answer-climate-change/,
