feed,title,long_url,short_url
GN:T:GP,"GeoTHERM Expo & Congress - March 2 to 3, 2023; Offenburg, Germany - ThinkGeoEnergy",https://www.thinkgeoenergy.com/geotherm-expo-offenburg-germany/,https://da.gd/O4YUao
GN:T:GP,Visualizing China's Dominance in Battery Manufacturing (2022-2027) - Visual Capitalist,https://www.visualcapitalist.com/chinas-dominance-in-battery-manufacturing/,https://da.gd/W68kL7
GN:T:GP,Renewable geothermal energy is moving toward the mainstream. Some lawmakers want investment to get NM onboard. - Yahoo News,https://news.yahoo.com/renewable-geothermal-energy-moving-toward-200200070.html,https://da.gd/JtpdQ
GN:T:GP,News of Difference and the EV Transition - CleanTechnica,https://cleantechnica.com/2023/01/19/news-of-difference-and-the-ev-transition/,https://da.gd/2AV4
GN:T:GP,El Salvador beyond bitcoin - INQUIRER,https://opinion.inquirer.net/160454/el-salvador-beyond-bitcoin,https://da.gd/LWJK
GN:T:GP,"Nissan Pushes The Ariya To The Limits, Gets Decent e-POWER Series Hybrid Sales - CleanTechnica",https://cleantechnica.com/2023/01/19/nissan-pushes-the-ariya-to-the-limits-gets-decent-e-power-series-hybrid-sales/,https://da.gd/bcRZP
GN:T:GP,Increasing Renewables Likely To Reduce Coal & Natural Gas Generation Over Next Two Years - CleanTechnica,https://cleantechnica.com/2023/01/19/increasing-renewables-likely-to-reduce-coal-natural-gas-generation-over-next-two-years/,https://da.gd/2f3pNa
