feed,title,long_url,short_url
GN:T:RE,Biden Infrastructure and Spending Bill Tracker: Live Updates - The New York Times,https://www.nytimes.com/live/2021/10/28/us/biden-bill-plan,
GN:T:RE,"Wisconsin bill would clarify third-party solar’s legal status, once and for all - Energy News Network",https://energynews.us/2021/10/28/wisconsin-bill-would-clarify-third-party-solars-legal-status-once-and-for-all/,
GN:T:RE,"Weather updates: 100,000 lose power in Texas as windy conditions roll through - WFAA",https://www.wfaa.com/article/news/local/dfw-dallas-fort-worth-weather-updates-windy-conditions-could-delay-flights-cause-power-outages/287-7b2f055f-1687-4804-9f3b-042d1fb81c48,
GN:T:RE,Ciattarelli would ratchet back pace of climate response - NJ Spotlight,https://www.njspotlight.com/2021/10/ciattarelli-gop-challenger-nj-governor-climate-change-alternative-energy-solar-power-offshore-wind/,
GN:T:RE,Supply Chain Woes Threaten to Drive Up Clean-Power Costs - gcaptain,https://gcaptain.com/supply-chain-woes-threaten-to-drive-up-clean-power-costs/,
GN:T:RE,Power outages spread as strong winds whip the Houston region - Houston Chronicle,https://www.houstonchronicle.com/news/houston-weather/article/Wind-advisory-in-place-for-parts-of-Texas-16571867.php,
