feed,title,long_url,short_url
gNews,India Coronavirus Cases Surge Past One Million - The New York Times,https://www.nytimes.com/2020/07/16/world/asia/coronavirus-india-million-cases.html,https://j.mp/30cbyVS
gNews,India records 1 million cases of Covid-19 ... and it's the poorest who are hardest hit - CNN,https://www.cnn.com/2020/07/16/asia/india-wealth-gap-coronavirus-intl-hnk/index.html,https://j.mp/2OyAUrG
gNews,HSBC downgrades stocks in China and India - CNBC,https://www.cnbc.com/2020/07/17/investing-hsbc-downgrades-china-india-stocks-upgrades-south-korea.html,https://j.mp/32xisrT
gNews,"""Record COVID-19 Tests Carried Out By US, 2nd Highest By India"": White House - NDTV",https://www.ndtv.com/india-news/coronavirus-white-house-says-us-has-carried-out-record-tests-india-has-done-2nd-largest-number-of-tests-2264218,https://j.mp/3jdHx0E
gNews,Indian online tutoring platform Vedantu raises $100 million - TechCrunch,https://techcrunch.com/2020/07/16/indian-online-tutoring-platform-vedantu-raises-100-million/,https://j.mp/2Wodyt2
gNews,iPhone-maker Pegatron registers India subsidiary as Apple pushes to diversify supply - Economic Times,https://economictimes.indiatimes.com/tech/hardware/iphone-maker-pegatron-registers-indian-subsidiary-lays-foundation-for-apple-to-kick-china-habit/articleshow/77010035.cms,https://j.mp/3h5DVfo
gNews,"""Our Heritage Known All Over World"": Foreign Ministry On Nepal PM Remark - NDTV",https://www.ndtv.com/india-news/foreign-ministry-on-nepal-pm-k-p-sharma-oli-remark-india-rich-heritage-known-all-over-world-2264215,https://j.mp/2CEWxnJ
gNews,"Coronavirus India LIVE Updates: Total cases 1,003,832; Centre asks 3 states to use lockdown to contain virus spread - The Indian Express",https://indianexpress.com/article/india/coronavirus-india-live-updates-lockdown-latest-news-today-covid-19-cases-tracker-coronavirus-vaccine-corona-cases-in-india-update-6509543/,https://j.mp/2ZCpOsg
gNews,"Sensex, Nifty rise as investors bet on strong earnings - Hindustan Times",https://www.hindustantimes.com/business-news/sensex-nifty-rise-as-investors-bet-on-strong-earnings/story-ECJMbt6F2XhN8AOfEsoIGI.html,https://j.mp/2Wvisop
