feed,title,long_url,short_url
GN:S:C,Kerry laments ‘wasted years’ in climate fight under Trump - PBS NewsHour,https://www.pbs.org/newshour/politics/kerry-laments-wasted-years-in-climate-fight-under-trump,
GN:S:C,Climate Change Returns to White House Agenda with Biden Executive Order - Voice of America,https://www.voanews.com/usa/us-politics/climate-change-returns-white-house-agenda-biden-executive-order,
GN:S:C,Pres. Biden's swift action on climate change draws criticism and praise - WMTV – NBC15,https://www.nbc15.com/2021/01/22/pres-bidens-swift-action-on-climate-change-draws-criticism-and-praise/,
GN:S:C,"Biden's climate plan could have big impacts on energy, auto industries - KGW",https://www.kgw.com/article/news/nation-world/biden-climate-plan-economy-impact/507-7689fbb4-9f25-46a6-9f8c-a42a4ff7d9df,
GN:S:C,Can the Biden Administration Lead a Revolution to Avert Catastrophic Climate Change? - The New Yorker,https://www.newyorker.com/podcast/political-scene/can-the-biden-administration-lead-a-revolution-to-avert-catastrophic-climate-change,
GN:S:C,Biden's climate steps could have big impact on energy firms - OPB News,https://www.opb.org/article/2021/01/21/president-joe-biden-climate-environment-executive-orders/,
GN:S:C,"Consumer NZ calls Instachill air cooler 'at best, pointless' in NZ climate - Stuff",https://www.stuff.co.nz/business/124025146/consumer-nz-calls-instachill-air-cooler-at-best-pointless-in-nz-climate,
