feed,title,long_url,short_url
ArXiv:Datasets,MultiSV: Dataset for Far-Field Multi-Channel Speaker Verification,https://arxiv.org/abs/2111.06458v1,
ArXiv:Datasets,SynthBio: A Case Study in Human-AI Collaborative Curation of Text Datasets,https://arxiv.org/abs/2111.06467v1,
ArXiv:Datasets,AnswerSumm: A Manually-Curated Dataset and Pipeline for Answer Summarization,https://arxiv.org/abs/2111.06474v1,
ArXiv:Datasets,Dataset of Philippine Presidents Speeches from 1935 to 2016,https://arxiv.org/abs/2111.06649v1,
ArXiv:Datasets,NRC-GAMMA: Introducing a Novel Large Gas Meter Image Dataset,https://arxiv.org/abs/2111.06827v1,
ArXiv:Datasets,ASOD60K: An Audio-Induced Salient Object Detection Dataset for Panoramic Videos,https://arxiv.org/abs/2107.11629v4,
