feed,title,long_url,short_url
ArXiv,Revealing drivers and risks for power grid frequency stability with explainable AI,https://arxiv.org/abs/2106.04341v2,
ArXiv,Explainable AI for engineering design: A unified approach of systems engineering and component-based deep learning,https://arxiv.org/abs/2108.13836v2,
ArXiv,Human-Centered Explainable AI (XAI): From Algorithms to User Experiences,https://arxiv.org/abs/2110.10790v4,
ArXiv,A Critical Review of Inductive Logic Programming Techniques for Explainable AI,https://arxiv.org/abs/2112.15319v2,
ArXiv,A Research Agenda for Artificial Intelligence in the Field of Flexible Production Systems,https://arxiv.org/abs/2112.15484v2,
ArXiv,Detection of extragalactic Ultra-Compact Dwarfs and Globular Clusters using Explainable AI techniques,https://arxiv.org/abs/2201.01604v2,
