feed,title,long_url,short_url
GN:S:GW,California's Climate Leadership: A Timeline - Legal Planet,https://news.google.com/rss/articles/CBMiR2h0dHBzOi8vbGVnYWwtcGxhbmV0Lm9yZy8yMDI0LzAyLzIxL2NhbGlmb3JuaWEtY2xpbWF0ZS1sYXdzLWEtdGltZWxpbmUv0gEA?oc=5,https://da.gd/BzGPgi
GN:S:GW,Addressing the climate crisis through engineering biology | npj Climate Action - Nature,https://news.google.com/rss/articles/CBMiMmh0dHBzOi8vd3d3Lm5hdHVyZS5jb20vYXJ0aWNsZXMvczQ0MTY4LTAyMy0wMDA4OS040gEA?oc=5,https://da.gd/iaPSu
GN:S:GW,Heatwaves in Peninsular Malaysia: a spatiotemporal analysis | Scientific Reports - Nature,https://news.google.com/rss/articles/CBMiMmh0dHBzOi8vd3d3Lm5hdHVyZS5jb20vYXJ0aWNsZXMvczQxNTk4LTAyNC01Mzk2MC140gEA?oc=5,https://da.gd/RnncH9
GN:S:GW,World's First Year-Long Breach of 1.5C Limit: What Does It Mean? - Plant Based News,https://news.google.com/rss/articles/CBMiUGh0dHBzOi8vcGxhbnRiYXNlZG5ld3Mub3JnL25ld3MvZW52aXJvbm1lbnQvd29ybGRzLWZpcnN0LXllYXItbG9uZy1icmVhY2gtbGltaXQv0gEA?oc=5,https://da.gd/Cz6uK
GN:S:GW,Could Climate Change Benefit Russia? - Mirage News,https://news.google.com/rss/articles/CBMiR2h0dHBzOi8vd3d3Lm1pcmFnZW5ld3MuY29tL2NvdWxkLWNsaW1hdGUtY2hhbmdlLWJlbmVmaXQtcnVzc2lhLTExNzg4MzAv0gEA?oc=5,https://da.gd/v21pW
GN:S:GW,Stanford's Climate Action Plan Needs To Think Bigger - AOL,https://news.google.com/rss/articles/CBMiWWh0dHBzOi8vd3d3LmFvbC5jb20vbS83OTYzMGUxOC03NzA4LTNmYTctYTE1ZC05MTkzODYxYmY5NjIvc3RhbmZvcmQtcy1jbGltYXRlLWFjdGlvbi5odG1s0gEA?oc=5,https://da.gd/CGKrk
GN:S:GW,Copernicus Interactive Climate Atlas: guide to the powerful new C3S tool - Copernicus Climate Change Service,https://news.google.com/rss/articles/CBMiXmh0dHBzOi8vY2xpbWF0ZS5jb3Blcm5pY3VzLmV1L2NvcGVybmljdXMtaW50ZXJhY3RpdmUtY2xpbWF0ZS1hdGxhcy1ndWlkZS1wb3dlcmZ1bC1uZXctYzNzLXRvb2zSAQA?oc=5,https://da.gd/1vMajX
