feed,title,long_url,short_url
GN:S:C,Book Review: “The Story of More: How We Got to Climate Change and Where to Go from Here” - Roanoke Times,https://roanoke.com/entertainment/book-review-the-story-of-more-how-we-got-to-climate-change-and-where-to/article_5ee7f7ea-90b8-11eb-98cf-5f06fb563f38.html,
GN:S:C,Suga to join Biden in leading efforts to tackle climate change 1 hour ago - Kyodo News Plus,https://english.kyodonews.net/news/2021/04/f2a6892bcff7-suga-to-join-biden-in-leading-efforts-to-tackle-climate-change.html,
GN:S:C,8 Jobs That Are Helping To Fight Climate Change - Yahoo Finance,https://finance.yahoo.com/news/8-jobs-helping-fight-climate-180041184.html,
GN:S:C,"John Kerry hopes US, China can work together on climate change - South China Morning Post",https://www.scmp.com/news/china/diplomacy/article/3128257/us-china-ties-john-kerry-hopes-sides-can-cooperate-climate,
GN:S:C,Letter: Climate plan needs transparency - Lincoln Journal Star,https://journalstar.com/opinion/letters/letter-climate-plan-needs-transparency/article_dfac68cf-422f-5028-84a7-b199a9079b7a.html,
