feed,title,long_url,short_url
RS,Investigation of parametric and artificial neural network modeling approaches for total tree height prediction in cedar plantations,https://www.researchsquare.com/article/rs-96662/latest,https://j.mp/2JdnH8n
RS,ASFP (AI-based Scoring Function Platform): a web server for the development of customized scoring functions,https://www.researchsquare.com/article/rs-96877/latest,https://j.mp/3oHwCPM
RS,Artificial intelligence for reduced dose 18F-FDG PET examinations: A real-world deployment through a standardized framework and business case assessment,https://www.researchsquare.com/article/rs-96541/latest,https://j.mp/3mr7UAZ
RS,Domain Multiplexed Computer-generated Holography by Embedded Wavevector Filtering Algorithm,https://www.researchsquare.com/article/rs-95986/latest,https://j.mp/34yo5X9
RS,An Improved Method for the Segmentation of Roots from X-ray Computed Tomography 3D Images: Rootine v.2,https://www.researchsquare.com/article/rs-96550/latest,https://j.mp/35HtI4y
RS,Walking Stability in Patients With Benign Paroxysmal Positional Vertigo: An Objective Assessment Using Wearable Accelerometers and Machine Learning,https://www.researchsquare.com/article/rs-94351/latest,https://j.mp/35DW53F
