feed,title,long_url,short_url
GN:T:RE,Net zero warning as Britons told to 'accept higher pricing' of energy bills: 'Transformation is painful!' - GB News,https://news.google.com/rss/articles/CBMiQWh0dHBzOi8vd3d3LmdibmV3cy5jb20vbW9uZXkvbmV0LXplcm8tZW5lcmd5LWJpbGxzLWhpZ2hlci1wcmljaW5n0gEA?oc=5,https://da.gd/S7iYb5
GN:T:RE,You Might Be Surprised to Learn Where This Renewable Energy Company Gets 60% of Its Profit - Yahoo Finance,https://news.google.com/rss/articles/CBMiU2h0dHBzOi8vZmluYW5jZS55YWhvby5jb20vbmV3cy9taWdodC1zdXJwcmlzZWQtbGVhcm4td2hlcmUtcmVuZXdhYmxlLTEwMDMwMDA1MS5odG1s0gEA?oc=5,https://da.gd/iCPPBG
GN:T:RE,Andy Harris tries blowing up a storm as MD waits for wind energy - The Baltimore Banner,https://news.google.com/rss/articles/CBMigAFodHRwczovL3d3dy50aGViYWx0aW1vcmViYW5uZXIuY29tL29waW5pb24vY29sdW1uL3dpbmQtZW5lcmd5LXVzLXdpbmQtb3JzdGVhZC1vY2Vhbi1jaXR5LWFuZHktaGFycmlzLVpSWDJJNkZTWVZCNkZLSFhWTExRRlRLWENZL9IBAA?oc=5,https://da.gd/Xgd8w3
GN:T:RE,'It's not game over – it's game on': why 2024 is an inflection point for the climate crisis - The Conversation,https://news.google.com/rss/articles/CBMid2h0dHBzOi8vdGhlY29udmVyc2F0aW9uLmNvbS9pdHMtbm90LWdhbWUtb3Zlci1pdHMtZ2FtZS1vbi13aHktMjAyNC1pcy1hbi1pbmZsZWN0aW9uLXBvaW50LWZvci10aGUtY2xpbWF0ZS1jcmlzaXMtMjIxNDk30gEA?oc=5,https://da.gd/4siqPh
GN:T:RE,Canada's Uranium Is Fueling the World's Nuclear Energy Boom - OilPrice,https://news.google.com/rss/articles/CBMidGh0dHBzOi8vb2lscHJpY2UuY29tL0FsdGVybmF0aXZlLUVuZXJneS9OdWNsZWFyLVBvd2VyL0NhbmFkYXMtVXJhbml1bS1Jcy1GdWVsaW5nLXRoZS1Xb3JsZHMtTnVjbGVhci1FbmVyZ3ktQm9vbS5odG1s0gF4aHR0cHM6Ly9vaWxwcmljZS5jb20vQWx0ZXJuYXRpdmUtRW5lcmd5L051Y2xlYXItUG93ZXIvQ2FuYWRhcy1VcmFuaXVtLUlzLUZ1ZWxpbmctdGhlLVdvcmxkcy1OdWNsZWFyLUVuZXJneS1Cb29tLmFtcC5odG1s?oc=5,https://da.gd/hVWjKi
GN:T:RE,Turning wasteland to energy: New Hanover County plans solar farm in landfill - Port City Daily,https://news.google.com/rss/articles/CBMifWh0dHBzOi8vcG9ydGNpdHlkYWlseS5jb20vbGF0ZXN0LW5ld3MvMjAyNC8wMS8yMi90dXJuaW5nLXdhc3RlbGFuZC10by1lbmVyZ3ktbmV3LWhhbm92ZXItY291bnR5LXBsYW5zLXNvbGFyLWZhcm0taW4tbGFuZGZpbGwv0gEA?oc=5,https://da.gd/C0Hnb1
GN:T:RE,Public comments at Graves County Fiscal Court meeting address concerns with solar facility coming to Farmington - WPSD Local 6,https://news.google.com/rss/articles/CBMixAFodHRwczovL3d3dy53cHNkbG9jYWw2LmNvbS9uZXdzL2tlbnR1Y2t5LW5ld3MvcHVibGljLWNvbW1lbnRzLWF0LWdyYXZlcy1jb3VudHktZmlzY2FsLWNvdXJ0LW1lZXRpbmctYWRkcmVzcy1jb25jZXJucy13aXRoLXNvbGFyLWZhY2lsaXR5LWNvbWluZy10by9hcnRpY2xlXzc1OTE3YzEwLWI5ODYtMTFlZS04MWVkLWFmZmNjNTYyNWY1Yy5odG1s0gEA?oc=5,https://da.gd/jfBX
GN:T:RE,TotalEnergies swoops for Nordic offshore wind and German battery storage - Recharge,https://news.google.com/rss/articles/CBMidmh0dHBzOi8vd3d3LnJlY2hhcmdlbmV3cy5jb20vd2luZC90b3RhbGVuZXJnaWVzLXN3b29wcy1mb3Itbm9yZGljLW9mZnNob3JlLXdpbmQtYW5kLWdlcm1hbi1iYXR0ZXJ5LXN0b3JhZ2UvMi0xLTE1ODcxMjnSAQA?oc=5,https://da.gd/87WM2K
GN:T:RE,BG's aging wind turbines may be replaced with 40-acre solar field – BG Independent News - BG Independent Media,https://news.google.com/rss/articles/CBMiYGh0dHBzOi8vYmdpbmRlcGVuZGVudG1lZGlhLm9yZy9iZ3MtYWdpbmctd2luZC10dXJiaW5lcy1tYXktYmUtcmVwbGFjZWQtd2l0aC00MC1hY3JlLXNvbGFyLWZpZWxkL9IBAA?oc=5,https://da.gd/Qg2Q
