feed,title,long_url,short_url
GN:T:AI,Turing Award Won by Programmer Who Paved Way for Supercomputers - The New York Times,https://www.nytimes.com/2022/03/30/technology/turing-award-jack-dongarra.html,https://nyti.ms/3Lv8M43
GN:T:AI,When scientific information is dangerous - Vox,https://www.vox.com/future-perfect/2022/3/30/23001712/ai-research-virus-scientific-information-dangerous,https://bit.ly/3NBZXHB
GN:T:AI,Fighting discrimination in mortgage lending | MIT News | Massachusetts Institute of Technology - MIT News,https://news.mit.edu/2022/machine-learning-model-discrimination-lending-0330,https://bit.ly/3LrcYBV
GN:T:AI,How to find the business value in AI and ML - VentureBeat,https://venturebeat.com/2022/03/30/how-to-find-the-business-value-in-ai-and-ml/,https://bit.ly/381lCbV
GN:T:AI,How to tackle machine learning’s MLOps tooling mess - TechRepublic,https://www.techrepublic.com/article/how-to-tackle-machine-learnings-mlops-tooling-mess/,https://tek.io/3tTHu1D
GN:T:AI,Artificial intelligence classes at Chandler-Gilbert Community College have backing from Intel - The Arizona Republic,https://www.azcentral.com/story/money/business/tech/2022/03/30/intel-backed-program-mcccd-expands-artificial-intelligence-training/7192979001/,https://bit.ly/3K9ex7D
