feed,title,long_url,short_url
GN:T:CC,Declassified Satellite Images Show Glaciers Are Melting Faster Than Ever - Gizmodo,https://earther.gizmodo.com/declassified-satellite-images-show-glaciers-are-melting-1846789832,
GN:T:CC,Countries Might Actually Hit Their Climate Targets. Really! - VICE,https://www.vice.com/en/article/z3xv54/us-biden-canada-trudeau-climate-targets-emissions,
GN:T:CC,Too hot to handle? Experts weigh in on if Phoenix could really become uninhabitable due to climate change - ABC15 Arizona,https://www.abc15.com/news/region-phoenix-metro/too-hot-to-handle-experts-weigh-in-on-if-phoenix-could-really-become-uninhabitable-due-to-climate-change,
GN:T:CC,The Climate Solution Actually Adding Millions of Tons of CO2 Into the Atmosphere - ProPublica,https://www.propublica.org/article/the-climate-solution-actually-adding-millions-of-tons-of-co2-into-the-atmosphere,
GN:T:CC,"President Biden picks dandelion for Jill, Twitter swoons - Yahoo Lifestyle",https://www.yahoo.com/lifestyle/president-biden-dandelion-jill-biden-182411826.html,
