feed,title,long_url,short_url
GN:S:C,"As The World Heats Up, Could 'Carbon Clubs' Supercharge Climate Action? - Forbes",https://www.forbes.com/sites/davidrvetter/2022/02/16/as-the-world-heats-up-could-carbon-clubs-supercharge-climate-action/,
GN:S:C,A global dataset for the projected impacts of climate change on four major crops | Scientific Data - Nature,https://www.nature.com/articles/s41597-022-01150-7,
GN:S:C,Climate change is eroding cleanup of pollution in a Summit County river. - The Colorado Sun,https://coloradosun.com/2022/02/16/snake-river-summit-county-water-pollution-snowmaking-climate-change/,
GN:S:C,Harnessing the fossil fuel industry to combat climate change? It’s more than a pipe dream - The Conversation AU,https://theconversation.com/harnessing-the-fossil-fuel-industry-to-combat-climate-change-its-more-than-a-pipe-dream-177141,
GN:S:C,"Due to climate change, Alaska may be able to grow an array of new crops - The Counter",https://thecounter.org/due-climate-change-alaska-may-be-able-grow-array-new-crops/,
