feed,title,long_url,short_url
GN:T:WP,Statkraft supplies Umicore with wind power for their Finnish production site in Kokkola - GlobeNewswire,https://www.globenewswire.com/news-release/2022/09/15/2516574/0/en/Statkraft-supplies-Umicore-with-wind-power-for-their-Finnish-production-site-in-Kokkola.html,
GN:T:WP,Analysis: Nordex takes evolutionary step in Delta4000 series with rotor-size leap - Windpower Monthly,https://www.windpowermonthly.com/article/1798915/analysis-nordex-takes-evolutionary-step-delta4000-series-rotor-size-leap,
GN:T:WP,Rail Dispute Could Trigger An Energy Shortage In The Northeast - OilPrice,https://oilprice.com/Latest-Energy-News/World-News/Rail-Dispute-Could-Trigger-An-Energy-Shortage-In-The-Northeast.html,
GN:T:WP,National Renewable Solutions achieves critical leasing milestone for 2 wind projects - Holyoke Enterprise,https://www.holyokeenterprise.com/ag-business/national-renewable-solutions-achieves-critical-leasing-milestone-2-wind-projects,
GN:T:WP,Ethereum stops wasting more energy than Chile uses - New Atlas,https://newatlas.com/technology/ethereum-merge/,
GN:T:WP,Is Geothermal Power the Missing Piece of a Renewable Future? - Governing,https://www.governing.com/next/is-geothermal-power-the-missing-piece-of-a-renewable-future,
GN:T:WP,Can community energy save lives this winter? - Power Technology,https://www.power-technology.com/analysis/community-energy-crisis/,
GN:T:WP,Eneti Inc. Authorizes $50 Million Share Repurchase Program - Yahoo Finance,https://finance.yahoo.com/news/eneti-inc-authorizes-50-million-201000795.html,
