feed,title,long_url,short_url
GN:S:GW,2022's supercharged summer of climate extremes: How global warming and La Niña fueled disasters on top of disasters - Jacksonville Journal-Courier,https://www.myjournalcourier.com/news/article/2022-s-supercharged-summer-of-climate-extremes-17443264.php,
GN:S:GW,Can nature help us get to net-zero and tackle climate change? - Zurich Insurance,https://www.zurich.com/en/media/magazine/2022/can-nature-help-us-get-to-net-zero-and-tackle-climate-change,
GN:S:GW,Nature an underrated ally against flood and drought - chinadialogue,https://chinadialogue.net/en/nature/nature-an-underrated-ally-against-flood-and-drought/,
GN:S:GW,Urban flooding cost in China could jump six-fold to US$477 billion a year - South China Morning Post,https://www.scmp.com/business/article/3192582/climate-change-chinas-cost-urban-flooding-could-jump-six-fold-us477,
GN:S:GW,30% higher carbon emissions produced by deforestation than climate change - Open Access Government,https://www.openaccessgovernment.org/co2-emissions-deforestation/143554/,
