feed,title,long_url,short_url
GN:T:ML,Researchers use AI to discover new planet outside solar system - Phys,https://news.google.com/rss/articles/CBMiMmh0dHBzOi8vcGh5cy5vcmcvbmV3cy8yMDIzLTA0LWFpLXBsYW5ldC1zb2xhci5odG1s0gExaHR0cHM6Ly9waHlzLm9yZy9uZXdzLzIwMjMtMDQtYWktcGxhbmV0LXNvbGFyLmFtcA?oc=5,https://da.gd/NHgv2
GN:T:ML,This machine learning project could help jumpstart self-driving cars again - ZDNet,https://news.google.com/rss/articles/CBMiaWh0dHBzOi8vd3d3LnpkbmV0LmNvbS9hcnRpY2xlL3RoaXMtbWFjaGluZS1sZWFybmluZy1wcm9qZWN0LWNvdWxkLWhlbHAtanVtcHN0YXJ0LXNlbGYtZHJpdmluZy1jYXJzLWFnYWluL9IBdGh0dHBzOi8vd3d3LnpkbmV0LmNvbS9nb29nbGUtYW1wL2FydGljbGUvdGhpcy1tYWNoaW5lLWxlYXJuaW5nLXByb2plY3QtY291bGQtaGVscC1qdW1wc3RhcnQtc2VsZi1kcml2aW5nLWNhcnMtYWdhaW4v?oc=5,https://da.gd/pbs9
GN:T:ML,Why an AI ethical framework is necessary for insurers - Digital Insurance,https://news.google.com/rss/articles/CBMiVGh0dHBzOi8vd3d3LmRpZy1pbi5jb20vb3Bpbmlvbi93aHktYW4tYWktZXRoaWNhbC1mcmFtZXdvcmstaXMtbmVjZXNzYXJ5LWZvci1pbnN1cmVyc9IBAA?oc=5,https://da.gd/pXzqmE
GN:T:ML,A machine learning algorithm for studying how molecules self-assemble and function - Nature,https://news.google.com/rss/articles/CBMiMmh0dHBzOi8vd3d3Lm5hdHVyZS5jb20vYXJ0aWNsZXMvczQzNTg4LTAyMy0wMDQ0MS0y0gEA?oc=5,https://da.gd/Krzo
GN:T:ML,Study: Generative AI Platforms Boost Worker Productivity by 14% - Tech,https://news.google.com/rss/articles/CBMiOmh0dHBzOi8vdGVjaC5jby9uZXdzL3N0dWR5LWFpLWltcHJvdmVzLXdvcmtlci1wcm9kdWN0aXZpdHnSAQA?oc=5,https://da.gd/mEbNy
GN:T:ML,Spotify shares its secret sauce: 3 layers of AI-driven algorithms - hypebot,https://news.google.com/rss/articles/CBMibWh0dHBzOi8vd3d3Lmh5cGVib3QuY29tL2h5cGVib3QvMjAyMy8wNC9zcG90aWZ5LXNoYXJlcy1pdHMtc2VjcmV0LXNhdWNlLTMtbGF5ZXJzLW9mLWFpLWRyaXZlbi1hbGdvcml0aG1zLmh0bWzSAQA?oc=5,https://da.gd/EeQo3
