feed,title,long_url,short_url
GN:T:WP,"Snow, wind, flood advisories abound as snowstorm slams parts of US - USA TODAY",https://news.google.com/rss/articles/CBMia2h0dHBzOi8vd3d3LnVzYXRvZGF5LmNvbS9zdG9yeS9uZXdzL25hdGlvbi8yMDI0LzA0LzA0L3N0b3JtLXNub3ctd2luZC10b3JuYWRvLXRodXJzZGF5LXdlYXRoZXIvNzMyMDA2MzkwMDcv0gEA?oc=5,https://da.gd/r53N
GN:T:WP,Resolution might halt commercial wind energy - Southeast Iowa Union,https://news.google.com/rss/articles/CBMibWh0dHBzOi8vd3d3LnNvdXRoZWFzdGlvd2F1bmlvbi5jb20vc2UtaW93YS11bmlvbi1tb3VudC1wbGVhc2FudC9yZXNvbHV0aW9uLW1pZ2h0LWhhbHQtY29tbWVyY2lhbC13aW5kLWVuZXJneS_SAQA?oc=5,https://da.gd/k6iXR0
GN:T:WP,Edda Wind receives new SOV - Energy Global,https://news.google.com/rss/articles/CBMiRmh0dHBzOi8vd3d3LmVuZXJneWdsb2JhbC5jb20vd2luZC8wNDA0MjAyNC9lZGRhLXdpbmQtcmVjZWl2ZXMtbmV3LXNvdi_SAQA?oc=5,https://da.gd/fn3GV
GN:T:WP,Exploring the resilience of the Texas power grid against extreme weather conditions - Tech Xplore,https://news.google.com/rss/articles/CBMiTmh0dHBzOi8vdGVjaHhwbG9yZS5jb20vbmV3cy8yMDI0LTA0LWV4cGxvcmluZy1yZXNpbGllbmNlLXRleGFzLXBvd2VyLWdyaWQuaHRtbNIBTWh0dHBzOi8vdGVjaHhwbG9yZS5jb20vbmV3cy8yMDI0LTA0LWV4cGxvcmluZy1yZXNpbGllbmNlLXRleGFzLXBvd2VyLWdyaWQuYW1w?oc=5,https://da.gd/Bsqkt0
GN:T:WP,The energy transition: Technology versus political backlash - CEPR,https://news.google.com/rss/articles/CBMiVWh0dHBzOi8vY2Vwci5vcmcvdm94ZXUvY29sdW1ucy9lbmVyZ3ktdHJhbnNpdGlvbi10ZWNobm9sb2d5LXZlcnN1cy1wb2xpdGljYWwtYmFja2xhc2jSAQA?oc=5,https://da.gd/eYhAD8
GN:T:WP,Analysts explain the rise of China's EV sector—and how it might navigate protectionist backlash and Beijing withdrawing support - Fortune,https://news.google.com/rss/articles/CBMifmh0dHBzOi8vZm9ydHVuZS5jb20vYXNpYS8yMDI0LzA0LzAzL2FuYWx5c3RzLWV4cGxhaW4tcmlzZS1jaGluYS1ldi1zZWN0b3ItcHJvdGVjdGlvbmlzdC1iYWNrbGFzaC1nb3Zlcm5tZW50LXN1cHBvcnQtYnlkLXRlc2xhL9IBAA?oc=5,https://da.gd/sL1ba
GN:T:WP,"Thousands Lose Power, Several Roads Closed As Major Storm Hits CT - Patch",https://news.google.com/rss/articles/CBMiZWh0dHBzOi8vcGF0Y2guY29tL2Nvbm5lY3RpY3V0L2Fjcm9zcy1jdC90aG91c2FuZHMtbG9zZS1wb3dlci1zZXZlcmFsLXJvYWRzLWNsb3NlZC1tYWpvci1zdG9ybS1oaXRzLWN00gF1aHR0cHM6Ly9wYXRjaC5jb20vY29ubmVjdGljdXQvYWNyb3NzLWN0L2FtcC8zMTcxMzA1OC90aG91c2FuZHMtbG9zZS1wb3dlci1zZXZlcmFsLXJvYWRzLWNsb3NlZC1hcy1tYWpvci1zdG9ybS1oaXRzLWN0?oc=5,https://da.gd/jtrfjF
GN:T:WP,Enel Green Power Hellas rebrands after JV deal with Macquarie - Renewables Now,https://news.google.com/rss/articles/CBMiZGh0dHBzOi8vcmVuZXdhYmxlc25vdy5jb20vbmV3cy9lbmVsLWdyZWVuLXBvd2VyLWhlbGxhcy1yZWJyYW5kcy1hZnRlci1qdi1kZWFsLXdpdGgtbWFjcXVhcmllLTg1MzgzMi_SAQA?oc=5,https://da.gd/CkjM3
GN:T:WP,RWE wins exclusive South Korea offshore wind development rights (OTCMKTS:RWEOY) - Seeking Alpha,https://news.google.com/rss/articles/CBMiuAFodHRwczovL3NlZWtpbmdhbHBoYS5jb20vbmV3cy80MDg3MjQ2LXJ3ZS13aW5zLWV4Y2x1c2l2ZS1zb3V0aC1rb3JlYS1vZmZzaG9yZS13aW5kLWRldmVsb3BtZW50LXJpZ2h0cz9zb3VyY2U9Y29udGVudF90eXBlJTNBcmVhY3QlN0NmaXJzdF9sZXZlbF91cmwlM0FtYXJrZXQtbmV3cyU3Q3NlY3Rpb25fYXNzZXQlM0FtYWlu0gEA?oc=5,https://da.gd/BpL7D
GN:T:WP,Nebraska teen dies while working at governor's pig farm - AGDAILY,https://news.google.com/rss/articles/CBMiWWh0dHBzOi8vd3d3LmFnZGFpbHkuY29tL2xpdmVzdG9jay9uZWJyYXNrYS10ZWVuLWRpZXMtd2hpbGUtd29ya2luZy1hdC1nb3Zlcm5vcnMtcGlnLWZhcm0v0gEA?oc=5,https://da.gd/SeIzVW
GN:T:WP,Permit granted for IKEAs offshore wind farm - 4C Offshore,https://news.google.com/rss/articles/CBMiWWh0dHBzOi8vd3d3LjRjb2Zmc2hvcmUuY29tL25ld3MvcGVybWl0LWdyYW50ZWQtZm9yLWlrZWFzLW9mZnNob3JlLXdpbmQtZmFybS1uaWQyOTY0Ni5odG1s0gEA?oc=5,https://da.gd/TEDz
GN:T:WP,How West Virginia's Coal Country Could Get a Clean-Energy Makeover - Newsweek,https://news.google.com/rss/articles/CBMiYGh0dHBzOi8vd3d3Lm5ld3N3ZWVrLmNvbS9ob3ctd2VzdC12aXJnaW5pYXMtY29hbC1jb3VudHJ5LWNvdWxkLWdldC1jbGVhbi1lbmVyZ3ktbWFrZW92ZXItMTg4NjQxMdIBAA?oc=5,https://da.gd/W56Y4A
GN:T:WP,Gusty nor’easter sparks spinouts and power outages across Massachusetts - Boston Herald,https://news.google.com/rss/articles/CBMiZ2h0dHBzOi8vd3d3LmJvc3RvbmhlcmFsZC5jb20vMjAyNC8wNC8wNC9ndXN0eS1ub3JlYXN0ZXItc3BhcmtzLXNwaW5vdXRzLWFuZC1wb3dlci1vdXRhZ2VzLWFjcm9zcy1zdGF0ZS_SAWtodHRwczovL3d3dy5ib3N0b25oZXJhbGQuY29tLzIwMjQvMDQvMDQvZ3VzdHktbm9yZWFzdGVyLXNwYXJrcy1zcGlub3V0cy1hbmQtcG93ZXItb3V0YWdlcy1hY3Jvc3Mtc3RhdGUvYW1wLw?oc=5,https://da.gd/sk0Yn
GN:T:WP,Wife of southern Arizona rancher accused of second-degree murder takes the stand - KVOA Tucson News,https://news.google.com/rss/articles/CBMinAFodHRwczovL3d3dy5rdm9hLmNvbS9uZXdzL3dpZmUtb2Ytc291dGhlcm4tYXJpem9uYS1yYW5jaGVyLWFjY3VzZWQtb2Ytc2Vjb25kLWRlZ3JlZS1tdXJkZXItdGFrZXMtdGhlLXN0YW5kL2FydGljbGVfNTRlMzNjM2MtZjFiMy0xMWVlLWEwNzAtN2ZjOWViODFiNWUwLmh0bWzSAQA?oc=5,https://da.gd/45tB
GN:T:WP,"MBTA suspends ferry service amid nor'easter, thousands without power - WBUR News",https://news.google.com/rss/articles/CBMiUWh0dHBzOi8vd3d3LndidXIub3JnL25ld3MvMjAyNC8wNC8wNC9hcHJpbC1ub3JlYXN0ZXItYm9zdG9uLXNub3ctd2luZC1yYWluLWRlbGF5c9IBAA?oc=5,https://da.gd/EeFE2
GN:T:WP,"As Biden Pushes For Clean Factories, a New ‘How-To’ Guide Offers a Path Forward - InsideClimate News",https://news.google.com/rss/articles/CBMiXmh0dHBzOi8vaW5zaWRlY2xpbWF0ZW5ld3Mub3JnL25ld3MvMDQwNDIwMjQvaW5zaWRlLWNsZWFuLWVuZXJneS1iaWRlbi1mYWN0b3J5LWRlY2FyYm9uaXphdGlvbi_SAQA?oc=5,https://da.gd/b3ls1
GN:T:WP,Offshore wind proposals help New Bedford focus its workforce development - The New Bedford Light,https://news.google.com/rss/articles/CBMiZWh0dHBzOi8vbmV3YmVkZm9yZGxpZ2h0Lm9yZy9vZmZzaG9yZS13aW5kLXByb3Bvc2Fscy1oZWxwLW5ldy1iZWRmb3JkLWZvY3VzLWl0cy13b3JrZm9yY2UtZGV2ZWxvcG1lbnQv0gEA?oc=5,https://da.gd/URUAj
GN:T:WP,Vermont State University Randolph Hosts Bridge Building Competition - ourherald,https://news.google.com/rss/articles/CBMiZ2h0dHBzOi8vd3d3Lm91cmhlcmFsZC5jb20vYXJ0aWNsZXMvdmVybW9udC1zdGF0ZS11bml2ZXJzaXR5LXJhbmRvbHBoLWhvc3RzLWJyaWRnZS1idWlsZGluZy1jb21wZXRpdGlvbi_SAQA?oc=5,https://da.gd/Q6coo
