feed,title,long_url,short_url
ArXiv:Datasets,STONE Dataset: A Scalable Multi-Modal Surround-View 3D Traversability Dataset for Off-Road Robot Navigation,https://arxiv.org/abs/2603.09175,
ArXiv:Datasets,Democratising Clinical AI through Dataset Condensation for Classical Clinical Models,https://arxiv.org/abs/2603.09356,
ArXiv:Datasets,"AI Act Evaluation Benchmark: An Open, Transparent, and Reproducible Evaluation Dataset for NLP and RAG Systems",https://arxiv.org/abs/2603.09435,
ArXiv:Datasets,Benchmarking Dataset for Presence-Only Passive Reconnaissance in Wireless Smart-Grid Communications,https://arxiv.org/abs/2603.09590,
ArXiv:Datasets,AutoViVQA: A Large-Scale Automatically Constructed Dataset for Vietnamese Visual Question Answering,https://arxiv.org/abs/2603.09689,
ArXiv:Datasets,ENIGMA-360: An Ego-Exo Dataset for Human Behavior Understanding in Industrial Scenarios,https://arxiv.org/abs/2603.09741,
ArXiv:Datasets,Do What I Say: A Spoken Prompt Dataset for Instruction-Following,https://arxiv.org/abs/2603.09881,
ArXiv:Datasets,"NanoBench: A Multi-Task Benchmark Dataset for Nano-Quadrotor System Identification, Control, and State Estimation",https://arxiv.org/abs/2603.09908,
