feed,title,long_url,short_url
GN:T:SP,PowerOptions partners with Solect Energy for solar and storage solutions - Worcester Business Journal,https://www.wbjournal.com/article/poweroptions-partners-with-solect-energy-for-solar-and-storage-solutions,
GN:T:SP,Largest solar project in Duke Energy Renewables fleet comes online in Texas - Daily Energy Insider,https://dailyenergyinsider.com/news/26229-largest-solar-project-in-duke-energy-renewables-fleet-comes-online-in-texas/,
GN:T:SP,Jacobs Awarded Solar Photovoltaic Power Plant Contract in Malaysia - Yahoo Finance,https://finance.yahoo.com/news/jacobs-awarded-solar-photovoltaic-power-114500408.html,
GN:T:SP,Project Briefing: South Africa's largest solar project springs into operation - PV-Tech,https://www.pv-tech.org/features/52717,
GN:T:SP,Solar Steel supplies 31 MW of structures in Colombia - Renewables Now,https://renewablesnow.com/news/solar-steel-supplies-31-mw-of-structures-in-colombia-705783/,
GN:T:SP,BHEL commissions world’s first solar PV plant for rail traction system - ETEnergyworld,https://energy.economictimes.indiatimes.com/news/renewable/bhel-commissions-worlds-first-solar-pv-plant-for-rail-traction-system/76871199,
