feed,title,long_url,short_url
YT:AWS,Nitro Commerce Boosts Ad Performance and Customer Insights with AI | Amazon Web Services,https://youtu.be/hziQWDI1vAw,
YT:AWS,Zamp Accelerates Banking Operations with AI Agents | Amazon Web Services,https://youtu.be/o9w9Ncc6Dnk,
YT:AWS,Get My Parking Speeds Up Parking Operations with AI | Amazon Web Services,https://youtu.be/6vp3CWM5aOY,
YT:AWS,"How Autodesk Uses AWS to Build Secure, AI-Powered Design Workflows | Amazon Web Services",https://youtu.be/b0OQV7a4TpM,
YT:AWS,Mission-Critical Modernization. CBA's Core Banking Migration | Amazon Web Services,https://youtu.be/OJD-hEFecig,
YT:AWS,Run AI Models Inference on Amazon SageMaker HyperPod EKS | Amazon Web Services,https://youtu.be/2YGjaYif8Cw,
YT:AWS,Train AI Models on Amazon SageMaker HyperPod EKS | Amazon Web Services,https://youtu.be/UxRq5zT3UzM,
YT:AWS,AI Model Training and Inference on Amazon SageMaker HyperPod EKS | Amazon Web Services,https://youtu.be/r5-nV57NpZ8,
