feed,title,long_url,short_url
j:EBV:N,Body mass index and weight change are associated with mortality in chronic kidney disease: A retrospective cohort study using a Japanese medical claims database,https://www.sciencedirect.com/science/article/pii/S0899900723001764?dgcid=rss_sd_all,https://da.gd/Wz47o
j:EBV:N,Mechanism of action of buckwheat quercetin in regulating lipid metabolism and intestinal flora via TLR4/NF-κB pathway in rats on high-fat diet,https://www.sciencedirect.com/science/article/pii/S0899900723001776?dgcid=rss_sd_all,https://da.gd/TpJX2z
j:EBV:N,"Milk and dairy product intakes, intestinal bacteria, and respiratory infections among children of elementary school age and older in Japan",https://www.sciencedirect.com/science/article/pii/S0899900723001740?dgcid=rss_sd_all,https://da.gd/rITy
j:EBV:N,Skeletal muscle gauge prediction by a machine learning model in patients with colorectal cancer,https://www.sciencedirect.com/science/article/pii/S0899900723001752?dgcid=rss_sd_all,https://da.gd/2VS783
j:EBV:N,Evaluation of a Novel Platform for Placement Confirmation of Enteral Feeding Tubes in Adults,https://www.sciencedirect.com/science/article/pii/S0899900723001739?dgcid=rss_sd_all,https://da.gd/O7jFG
