feed,title,long_url,short_url
LitCovid,Experience in responding to COVID-19 outbreaks from Vietnam,https://pubmed.ncbi.nlm.nih.gov/33532745,
LitCovid,Coronavirus Disease (COVID-19): A Perspective from Immunosenescence,https://pubmed.ncbi.nlm.nih.gov/33532121,
LitCovid,COVID-19: Lab medicine expect due respect,https://pubmed.ncbi.nlm.nih.gov/33532375,
LitCovid,Is dexamethasone an effective treatment for severe COVID-19 patients: Journal Club review,https://pubmed.ncbi.nlm.nih.gov/33534117,
LitCovid,Face Masks for All and All for Face Masks in the COVID-19 Pandemic: Community Level Production to Face the Global Shortage and Shorten the Epidemic - Corrigendum,https://pubmed.ncbi.nlm.nih.gov/33531100,
LitCovid,COVID-19 vaccines: call for global push to maintain efficacy,https://pubmed.ncbi.nlm.nih.gov/33531701,
LitCovid,Mimickers of novel coronavirus disease 2019 (COVID-19) on chest CT: spectrum of CT and clinical features,https://pubmed.ncbi.nlm.nih.gov/33533965,
LitCovid,Immunological surrogate endpoints of COVID-2019 vaccines: the evidence we have versus the evidence we need,https://pubmed.ncbi.nlm.nih.gov/33531462,
LitCovid,Monoclonal Antibody for Patients with Covid-19,https://pubmed.ncbi.nlm.nih.gov/33534967,
LitCovid,In silico virtual screening-based study of nutraceuticals predicts the therapeutic potentials of folic acid and its derivatives against COVID-19,https://pubmed.ncbi.nlm.nih.gov/33532517,
LitCovid,Community Hospital Perioperative Services Department Responds to the COVID-19 Pandemic,https://pubmed.ncbi.nlm.nih.gov/33534154,
LitCovid,"[COVID-19 in urology : Influence of the pandemic on telemedicine, education and surgery]",https://pubmed.ncbi.nlm.nih.gov/33533961,
LitCovid,Investigation and analysis of psychological stress among non-severe COVID-19 patients,https://pubmed.ncbi.nlm.nih.gov/33532855,
LitCovid,Position statement for a pragmatic approach to immunotherapeutics in patients with inflammatory skin diseases during the coronavirus disease 2019 pandemic and beyond,https://pubmed.ncbi.nlm.nih.gov/33533553,
LitCovid,A bulletin from Greece: a health system under the pressure of the second COVID-19 wave,https://pubmed.ncbi.nlm.nih.gov/33533705,
LitCovid,Nucleic Acid-Sensing Pathways During SARS-CoV-2 Infection: Expectations versus Reality,https://pubmed.ncbi.nlm.nih.gov/33531826,
LitCovid,Response to Letter to the Editor: Glaucoma Surgery During the COVID-19 Pandemic in Italy: How Novel Coronavirus has Changed the Surgical Management of Glaucoma Patients,https://pubmed.ncbi.nlm.nih.gov/33534513,
LitCovid,Potential mechanisms of cerebrovascular diseases in COVID-19 patients,https://pubmed.ncbi.nlm.nih.gov/33534131,
LitCovid,Lessons From Bacille Calmette-Guerin for SARS-CoV-2 Vaccine Candidates,https://pubmed.ncbi.nlm.nih.gov/33535239,
LitCovid,Learning and Leading: The Impact of COVID-19 in Perioperative Areas,https://pubmed.ncbi.nlm.nih.gov/33534163,
LitCovid,Necessity of 2 Doses of the Pfizer and Moderna COVID-19 Vaccines,https://pubmed.ncbi.nlm.nih.gov/33533893,
LitCovid,"A commentary on ""Diagnosis and treatment of coronavirus disease 2019 (COVID-19) Laboratory, PCR, and chest CT imaging findings""",https://pubmed.ncbi.nlm.nih.gov/33535086,
LitCovid,The impact of COVID-19 on surgical practice in Jordan during the second outbreak: A survey,https://pubmed.ncbi.nlm.nih.gov/33532069,
LitCovid,Intestinal ischemia in a COVID-19 patient: case report from Northern Tanzania,https://pubmed.ncbi.nlm.nih.gov/33532049,
LitCovid,Transient monocular visual impairment as an initial symptom of COVID-19 infection in an individual with multiple sclerosis receiving teriflunomide,https://pubmed.ncbi.nlm.nih.gov/33534122,
LitCovid,Pain Symptoms in Patients with Coronavirus Disease (COVID-19): A Literature Review,https://pubmed.ncbi.nlm.nih.gov/33531833,
LitCovid,Immunopathological Roles of Neutrophils in Virus Infection and COVID-19,https://pubmed.ncbi.nlm.nih.gov/33534399,
LitCovid,Audio Interview: Covid-19 and the States - A Conversation with Ralph Northam,https://pubmed.ncbi.nlm.nih.gov/33534981,
LitCovid,Factors Associated With Drug Overdoses During the COVID-19 Pandemic,https://pubmed.ncbi.nlm.nih.gov/33534278,
LitCovid,Role of self-care in COVID-19 pandemic for people living with comorbidities of diabetes and hypertension,https://pubmed.ncbi.nlm.nih.gov/33532385,
LitCovid,Olfactory and Gustatory Alterations in Covid-19 Patients: A Tertiary Care Covid-19 Centre Inpatient Experience,https://pubmed.ncbi.nlm.nih.gov/33532344,
LitCovid,Monoclonal Antibody for Patients with Covid-19. Reply.,https://pubmed.ncbi.nlm.nih.gov/33534968,
LitCovid,Risk of Strongyloides Hyperinfection Syndrome when prescribing Dexamethasone in Severe COVID-19,https://pubmed.ncbi.nlm.nih.gov/33535106,
LitCovid,Covid-19 in outpatients-Is fever a useful indicator for SARS-CoV-2 infection?,https://pubmed.ncbi.nlm.nih.gov/33534829,
LitCovid,Face mask - An essential armour in the fight of India against COVID-19,https://pubmed.ncbi.nlm.nih.gov/33533732,
LitCovid,Time course of the sensitivity and specificity of anti-SARS-CoV-2 IgM and IgG antibodies for symptomatic COVID-19 in Japan,https://pubmed.ncbi.nlm.nih.gov/33531605,
LitCovid,BCG Vaccination Program mitigates COVID19 Related Mortality: A Reality check,https://pubmed.ncbi.nlm.nih.gov/33530904,
LitCovid,Optimize the management of urological tube-related emergencies during the coronavirus disease 2019 (COVID-19) pandemic,https://pubmed.ncbi.nlm.nih.gov/33532334,
LitCovid,"COVID-19 (SARS-COV-2): Transformations in medicine, our existence, and world order?",https://pubmed.ncbi.nlm.nih.gov/33532442,
LitCovid,A Comprehensive Summary of the Knowledge on COVID-19 Treatment,https://pubmed.ncbi.nlm.nih.gov/33532135,
LitCovid,"Covid-19 vaccination: the dangers of ""values"" imperialism",https://pubmed.ncbi.nlm.nih.gov/33531343,
LitCovid,Comparison of clinical and serological features of RT-PCR positive and negative COVID-19 patients,https://pubmed.ncbi.nlm.nih.gov/33530774,
LitCovid,The Challenge of Forecasting Demand of Medical Resources and Supplies During a Pandemic: A Comparative Evaluation of Three Surge Calculators for COVID-19,https://pubmed.ncbi.nlm.nih.gov/33531094,
LitCovid,Waves of infection and waves of communication: the importance of sharing in the era of Covid-19,https://pubmed.ncbi.nlm.nih.gov/33534067,
LitCovid,Venoarteriovenous ECMO in Concomitant Acute Respiratory Distress Syndrome and Cardiomyopathy Associated with COVID-19 Infection,https://pubmed.ncbi.nlm.nih.gov/33532098,
LitCovid,Managing COVID-19 Lockdown Impacts: Sustaining GLP Compliance and Man Material Medium (MMM) Strategy for Augmenting Prevention of Workplace Infections,https://pubmed.ncbi.nlm.nih.gov/33530813,
LitCovid,"Cluster analysis of coronavirus sequences using computational sequence descriptors: With applications to SARS, MERS and SARS-CoV-2 (CoVID-19)",https://pubmed.ncbi.nlm.nih.gov/33530913,
LitCovid,Coronavirus is in the air - there's too much focus on surfaces,https://pubmed.ncbi.nlm.nih.gov/33531707,
LitCovid,The effect of the COVID-19 pandemic on working practices of UK primary care optometrists,https://pubmed.ncbi.nlm.nih.gov/33533077,
LitCovid,Preparing for a COVID-19 pandemic: Redefining roles of multidisciplinary team in a large tertiary hospital in Rajasthan,https://pubmed.ncbi.nlm.nih.gov/33532376,
LitCovid,"The successful containment of COVID-19 outbreak in Union Territory of Ladakh, India, 2020",https://pubmed.ncbi.nlm.nih.gov/33532397,
LitCovid,A multiplex chemiluminescent immunoassay for serological profiling of COVID-19-positive symptomatic and asymptomatic patients,https://pubmed.ncbi.nlm.nih.gov/33531472,
LitCovid,"Side effect of a 6 p.m curfew for preventing the spread of SARS-CoV-2: a modelling study from Toulouse, France",https://pubmed.ncbi.nlm.nih.gov/33535066,
LitCovid,Non autoimmune type 1B diabetes after mild COVID-19: Report of three cases,https://pubmed.ncbi.nlm.nih.gov/33534177,
LitCovid,Impact of COVID-19 on management of urogynaecology patients: a rapid review of the literature,https://pubmed.ncbi.nlm.nih.gov/33533991,
LitCovid,Covid-19: People who have had infection might only need one dose of mRNA vaccine,https://pubmed.ncbi.nlm.nih.gov/33531333,
LitCovid,Perioperative Nurse Educators: Rapid Response to the COVID-19 Pandemic,https://pubmed.ncbi.nlm.nih.gov/33534158,
LitCovid,Promoting Resilience in the Age of COVID-19 Pandemic: A New Era of Strategic Foresight,https://pubmed.ncbi.nlm.nih.gov/33532120,
LitCovid,[COVID-19 and renal transplantation],https://pubmed.ncbi.nlm.nih.gov/33532003,
LitCovid,Life of doctor parents during COVID-19 pandemic,https://pubmed.ncbi.nlm.nih.gov/33532439,
LitCovid,Saliva for Detection of SARS-CoV-2,https://pubmed.ncbi.nlm.nih.gov/33534973,
LitCovid,"COVID-19 Pandemic and Its Impact on Pediatric Dentistry in Austria: Knowledge, Perception and Attitude Among Pediatric Dentists in a Cross-Sectional Survey",https://pubmed.ncbi.nlm.nih.gov/33531814,
LitCovid,Managing Attention Deficit Hyperactivity Disorder during COVID-19 Pandemic,https://pubmed.ncbi.nlm.nih.gov/33531752,
LitCovid,Progress in mental health research and service provision in China: Lessons learnt from COVID-19 and SARS epidemics,https://pubmed.ncbi.nlm.nih.gov/33532744,
LitCovid,Impact of COVID-19 Pandemic on Neurosurgical Practice in a Tertiary Care Center in India,https://pubmed.ncbi.nlm.nih.gov/33531756,
LitCovid,Computational and Experimental Studies Reveal That Thymoquinone Blocks the Entry of Coronaviruses Into In Vitro Cells,https://pubmed.ncbi.nlm.nih.gov/33532909,
LitCovid,"Focus on atrial fibrillation, syncope, and arrhythmias during COVID-19 pandemic",https://pubmed.ncbi.nlm.nih.gov/33532851,
LitCovid,Prediction of SARS-CoV Interaction with Host Proteins during Lung Aging Reveals a Potential Role for TRIB3 in COVID-19,https://pubmed.ncbi.nlm.nih.gov/33532126,
LitCovid,Glycemic control of children and adolescents with type 1 diabetes improved after COVID-19 lockdown in Italy,https://pubmed.ncbi.nlm.nih.gov/33532867,
LitCovid,From Genomes to Molecular Dynamics - a Bottom Up Approach in Extrication of SARS CoV-2 Main Protease Inhibitors,https://pubmed.ncbi.nlm.nih.gov/33532671,
LitCovid,Implementation of universal health coverage by South Korea during the COVID-19 pandemic,https://pubmed.ncbi.nlm.nih.gov/33532746,
LitCovid,Paediatric dental care during and post-COVID-19 era: changes and challenges ahead,https://pubmed.ncbi.nlm.nih.gov/33531735,
LitCovid,Covid-19: Surge testing for the South Africa variant begins in England,https://pubmed.ncbi.nlm.nih.gov/33531353,
LitCovid,Factors associated with anti-SARS-CoV-2 IgG antibody production in patients convalescing from COVID-19,https://pubmed.ncbi.nlm.nih.gov/33531292,
LitCovid,Analogue discovery of safer alternatives to HCQ and CQ drugs for SAR-CoV-2 by computational design,https://pubmed.ncbi.nlm.nih.gov/33535144,
LitCovid,"COVID-19 Vaccine: Development, Testing, and Distribution",https://pubmed.ncbi.nlm.nih.gov/33534247,
LitCovid,"COVID-19 Vaccine: Development, Testing, and Distribution",https://pubmed.ncbi.nlm.nih.gov/33534255,
LitCovid,Genetic risks and association with severe COVID-19 among global populations,https://pubmed.ncbi.nlm.nih.gov/33533704,
LitCovid,Covid-19 risk data during lockdown-like policy in Indonesia,https://pubmed.ncbi.nlm.nih.gov/33532521,
LitCovid,Service utilization and saved travel cost in telepsychiatry consultation by outpatients at a psychiatric hospital in India during COVID-19 pandemic,https://pubmed.ncbi.nlm.nih.gov/33535135,
LitCovid,Clinical characteristics and outcomes of people living with HIV hospitalized with COVID-19: a nationwide experience,https://pubmed.ncbi.nlm.nih.gov/33533294,
LitCovid,Characteristics of COVID-19 infection and antibody formation in a Tertiary Immunology department,https://pubmed.ncbi.nlm.nih.gov/33532723,
LitCovid,Changes in the management of acute appendicitis during the COVID-19 pandemic,https://pubmed.ncbi.nlm.nih.gov/33533983,
LitCovid,"Metabolic Healthy Obesity, Vitamin D Status, and Risk of COVID-19",https://pubmed.ncbi.nlm.nih.gov/33532128,
LitCovid,Use of convalescent plasma for COVID-19 in India: A review & practical guidelines,https://pubmed.ncbi.nlm.nih.gov/33533733,
LitCovid,Addressing the COVID-19 Pandemic Among Persons Experiencing Homelessness: Steps to Protect a Vulnerable Population,https://pubmed.ncbi.nlm.nih.gov/33532960,
LitCovid,The impact of face masks on children - a mini review,https://pubmed.ncbi.nlm.nih.gov/33533522,
LitCovid,Saliva for Detection of SARS-CoV-2. Reply.,https://pubmed.ncbi.nlm.nih.gov/33534974,
LitCovid,Application of Nanotechnology in the COVID-19 Pandemic,https://pubmed.ncbi.nlm.nih.gov/33531805,
LitCovid,De novo design and bioactivity prediction of SARS-CoV-2 main protease inhibitors using recurrent neural network-based transfer learning,https://pubmed.ncbi.nlm.nih.gov/33531083,
LitCovid,Leveraging Early Discharge and Telehealth Technology to Safely Conserve Resources and Minimize Personal Contact During COVID-19 in an Arthroplasty Practice,https://pubmed.ncbi.nlm.nih.gov/33531175,
LitCovid,Arbidol combined with the Chinese medicine Lianhuaqingwen capsule versus arbidol alone in the treatment of COVID-19,https://pubmed.ncbi.nlm.nih.gov/33530261,
LitCovid,Diabetic neuropathy: a risk factor for severe COVID-19?,https://pubmed.ncbi.nlm.nih.gov/33533971,
LitCovid,Sleep and mental health in athletes during COVID-19 lockdown,https://pubmed.ncbi.nlm.nih.gov/33535229,
LitCovid,Low level of Vitamin C and dysregulation of Vitamin C transporter might be involved in the severity of COVID-19 Infection,https://pubmed.ncbi.nlm.nih.gov/33532123,
LitCovid,Ageism in Indonesia's national covid-19 vaccination programme,https://pubmed.ncbi.nlm.nih.gov/33531349,
LitCovid,Prosociality predicts health behaviors during the COVID-19 pandemic,https://pubmed.ncbi.nlm.nih.gov/33531719,
LitCovid,COVID-19 and emergencies in patients with diabetes: two case reports,https://pubmed.ncbi.nlm.nih.gov/33531061,
LitCovid,One Year of SARS-CoV-2: How Much Has the Virus Changed?,https://pubmed.ncbi.nlm.nih.gov/33530355,
LitCovid,ACE2 and FURIN variants are potential predictors of SARS-CoV-2 outcome: A time to implement precision medicine against COVID-19,https://pubmed.ncbi.nlm.nih.gov/33532652,
LitCovid,The Professional Identity of Nursing Students and Their Intention to Leave the Nursing Profession During the Coronavirus Disease (COVID-19) Pandemic,https://pubmed.ncbi.nlm.nih.gov/33534354,
LitCovid,"The History of Methylprednisolone, Ascorbic Acid, Thiamine, and Heparin Protocol and I-MASK+ Ivermectin Protocol for COVID-19",https://pubmed.ncbi.nlm.nih.gov/33532161,
LitCovid,"COVID-19 is Not a Story of Race, but a Record of Racism-Our Scholarship Should Reflect That Reality",https://pubmed.ncbi.nlm.nih.gov/33534670,
LitCovid,COVID-19 in a dialysis center in Milan from March to June 2020: understanding how to respond to the second wave of the pandemic,https://pubmed.ncbi.nlm.nih.gov/33534068,
LitCovid,The Impact of Preparedness in Defying COVID-19 Pandemic Expectations in the Lower Mekong Region: A Case Study,https://pubmed.ncbi.nlm.nih.gov/33534744,
LitCovid,Adherence to COVID-19 Preventive Measures in Mozambique: Two Consecutive Online Surveys,https://pubmed.ncbi.nlm.nih.gov/33530538,
LitCovid,Paediatric allergy practice in the era of coronavirus disease 2019,https://pubmed.ncbi.nlm.nih.gov/33534416,
LitCovid,A Case of Guillain-Barre Syndrome Related to COVID-19 Infection,https://pubmed.ncbi.nlm.nih.gov/33535007,
LitCovid,The importance of supplementary immunisation activities to prevent measles outbreaks during the COVID-19 pandemic in Kenya,https://pubmed.ncbi.nlm.nih.gov/33531015,
LitCovid,COVID-19 Pandemic: Clinical Nurse Specialist Practice Supporting Preparedness in the Spheres of Impact,https://pubmed.ncbi.nlm.nih.gov/33534250,
LitCovid,Innate and Adaptive Immune Responses to SARS-CoV-2 in Humans: Relevance to Acquired Immunity and Vaccine Responses,https://pubmed.ncbi.nlm.nih.gov/33534923,
LitCovid,COVID-19 Response in Thailand and Its Implications on Future Preparedness,https://pubmed.ncbi.nlm.nih.gov/33530526,
LitCovid,Commentary on Meyers et al: Ethically prioritizing trials in the COVID-19 era - practical considerations,https://pubmed.ncbi.nlm.nih.gov/33530735,
LitCovid,Local Nasal Response Against COVID-19: Debate Regarding the Absence of Nasal Inflammatory Symptoms,https://pubmed.ncbi.nlm.nih.gov/33530741,
LitCovid,The Pathogenesis and Treatment of COVID-19: A System Review,https://pubmed.ncbi.nlm.nih.gov/33531107,
LitCovid,Full-length title: Introduction into the Marseille geographical area of a mild SARS-CoV-2 variant originating from sub-Saharan Africa: an investigational study,https://pubmed.ncbi.nlm.nih.gov/33535105,
LitCovid,[Employment of pregnant women in the health care system during the second wave of the COVID-19 pandemic],https://pubmed.ncbi.nlm.nih.gov/33533979,
LitCovid,"Rapid, Sensitive, and Specific Severe Acute Respiratory Syndrome Coronavirus 2 Detection: A Multicenter Comparison Between Standard Quantitative Reverse-Transcriptase Polymerase Chain Reaction and CRISPR-Based DETECTR",https://pubmed.ncbi.nlm.nih.gov/33535237,
LitCovid,Mental Health and Psychosocial Characteristics Associated With COVID-19 Among U.S. Adults.,https://pubmed.ncbi.nlm.nih.gov/33530731,
LitCovid,Challenges and Opportunities for COVID-19 Vaccines in Patients with Cancer,https://pubmed.ncbi.nlm.nih.gov/33534645,
LitCovid,Potential Risks and Benefits of Multiple Sclerosis Immune Therapies in the COVID-19 Era: Clinical and Immunological Perspectives,https://pubmed.ncbi.nlm.nih.gov/33533012,
LitCovid,An ethics framework for consolidating and prioritizing COVID-19 clinical trials,https://pubmed.ncbi.nlm.nih.gov/33530721,
LitCovid,Managing low-risk febrile neutropenia in children in the time of COVID-19: What matters to parents and clinicians,https://pubmed.ncbi.nlm.nih.gov/33533525,
LitCovid,Clinical characteristics and risk factors for symptomatic venous thromboembolism in hospitalized COVID-19 patients: A multicenter retrospective study,https://pubmed.ncbi.nlm.nih.gov/33534149,
LitCovid,Learning From the Past to Guide the Future: HIV and COVID-19,https://pubmed.ncbi.nlm.nih.gov/33534245,
LitCovid,Impact and trend of COVID-19 in the Brazilian prison system: an ecological study,https://pubmed.ncbi.nlm.nih.gov/33533837,
LitCovid,"Here, but Apart During COVID-19: Bringing Connection and Empathy to the Socially Distant Family Meeting",https://pubmed.ncbi.nlm.nih.gov/33532964,
LitCovid,Mobility Patterns During COVID-19 Travel Restrictions in Nairobi Urban Informal Settlements: Who Is Leaving Home and Why,https://pubmed.ncbi.nlm.nih.gov/33533010,
LitCovid,Blood ozonization in patients with mild to moderate COVID-19 pneumonia: a single centre experience: reply,https://pubmed.ncbi.nlm.nih.gov/33534080,
LitCovid,The Limit of Detection Matters: The Case for Benchmarking Severe Acute Respiratory Syndrome Coronavirus 2 Testing,https://pubmed.ncbi.nlm.nih.gov/33532847,
LitCovid,Counteracting COVID-19 Healthcare Inequity: Supporting Antiracist Practices at Bedside,https://pubmed.ncbi.nlm.nih.gov/33534695,
LitCovid,The impact of epidemic information on the public's worries and attitude toward epidemic prevention measures during the COVID-19 outbreak,https://pubmed.ncbi.nlm.nih.gov/33531791,
LitCovid,The impact of COVID-19 on statewide EMS use for cardiac emergencies and stroke in Massachusetts,https://pubmed.ncbi.nlm.nih.gov/33532755,
LitCovid,Age in the Time of COVID-19: An Ethical Analysis,https://pubmed.ncbi.nlm.nih.gov/33532122,
LitCovid,Old test for the diagnosis of novel corona virus infection: Role of GeneXpert in COVID-19 testing,https://pubmed.ncbi.nlm.nih.gov/33532451,
LitCovid,COVID-19 Management in Clinical Dental Care Part II: Personal Protective Equipment for the Dental Care Professional,https://pubmed.ncbi.nlm.nih.gov/33531145,
LitCovid,Surveilling COVID-19 emotional contagion on Twitter,https://pubmed.ncbi.nlm.nih.gov/33531097,
LitCovid,Prevalence of Depression and Anxiety during the COVID-19 Pandemic among the Residents of an Urban Slum in North India,https://pubmed.ncbi.nlm.nih.gov/33531775,
LitCovid,Anti-BRAF/anti-MEK targeted therapies for metastatic melanoma patients during the COVID-19 outbreak: experience from an Italian skin cancer unit,https://pubmed.ncbi.nlm.nih.gov/33533662,
LitCovid,Big Five Traits as Predictors of Perceived Stressfulness of the COVID-19 Pandemic,https://pubmed.ncbi.nlm.nih.gov/33531723,
LitCovid,Methylprednisolone in adults hospitalized with COVID-19 pneumonia : An open-label randomized trial (GLUCOCOVID),https://pubmed.ncbi.nlm.nih.gov/33534047,
LitCovid,Telerehabilitation in Subjects With Respiratory Disease: A Scoping Review,https://pubmed.ncbi.nlm.nih.gov/33531356,
LitCovid,"Covid-19: Russian vaccine efficacy is 91.6%, show phase III trial results",https://pubmed.ncbi.nlm.nih.gov/33531342,
LitCovid,Best-Practices for Preventing Skin Injury Beneath Personal Protective Equipment During the COVID-19 Pandemic: A Position Paper from the National Pressure Injury Advisory Panel (NPIAP),https://pubmed.ncbi.nlm.nih.gov/33534939,
LitCovid,A low-cost solution for converting existing stethoscope into tele-stethoscope in resource-constrained setting for COVID-19 pandemic,https://pubmed.ncbi.nlm.nih.gov/33532374,
LitCovid,Central line-associated bloodstream infections in hemodialysis patients in the COVID-19 era,https://pubmed.ncbi.nlm.nih.gov/33533126,
LitCovid,Strategies to tackle by primary care physicians to mental health issues in India in COVID-19 pandemic,https://pubmed.ncbi.nlm.nih.gov/33532447,
LitCovid,IDentif.AI: Rapidly optimizing combination therapy design against severe Acute Respiratory Syndrome Coronavirus 2 (SARS-Cov-2) with digital drug development,https://pubmed.ncbi.nlm.nih.gov/33532594,
LitCovid,"Author Correction: Magnitude, demographics and dynamics of the effect of the first wave of the COVID-19 pandemic on all-cause mortality in 21 industrialized countries",https://pubmed.ncbi.nlm.nih.gov/33531711,
LitCovid,Social media effectiveness as a humanitarian response to mitigate influenza epidemic and COVID-19 pandemic,https://pubmed.ncbi.nlm.nih.gov/33531729,
LitCovid,"Smallpox Eradication: African Origin, African Solutions, and Relevance for COVID-19",https://pubmed.ncbi.nlm.nih.gov/33534731,
LitCovid,From Paternalism to Engagement: Bioethics Needs a Paradigm Shift to Address Racial Injustice During COVID-19,https://pubmed.ncbi.nlm.nih.gov/33534680,
LitCovid,Identification of SARS-CoV-2 spike mutations that attenuate monoclonal and serum antibody neutralization,https://pubmed.ncbi.nlm.nih.gov/33535027,
LitCovid,"COVID-19 Conspiracy Beliefs: Relations with Anxiety, Quality of Life, and Schemas",https://pubmed.ncbi.nlm.nih.gov/33531727,
LitCovid,Preventive home therapy for symptomatic patients affected by COVID-19 and followed by teleconsultations,https://pubmed.ncbi.nlm.nih.gov/33532070,
LitCovid,Case Numbers Beyond Contact Tracing Capacity Are Endangering the Containment of COVID-19,https://pubmed.ncbi.nlm.nih.gov/33533714,
LitCovid,Impact of COVID-19 pandemic on adolescent health in India,https://pubmed.ncbi.nlm.nih.gov/33532383,
LitCovid,Scientometric analyzing the output of researchers and organizations on COVID-19 for better conducting the scientific efforts: with a glance to endocrinology,https://pubmed.ncbi.nlm.nih.gov/33532371,
LitCovid,COVID-19-Related Giant Coronary Aneurysms in an Infant with Multisystem Inflammatory Disorder in Children: The First Case Report from the United Arab Emirates and the Arab Region,https://pubmed.ncbi.nlm.nih.gov/33532103,
LitCovid,Outcome of SARS-CoV-2 infection is linked to MAIT cell activation and cytotoxicity,https://pubmed.ncbi.nlm.nih.gov/33531712,
LitCovid,Potential compounds from several Indonesian plants to prevent SARS-CoV-2 infection: A mini-review of SARS-CoV-2 therapeutic targets,https://pubmed.ncbi.nlm.nih.gov/33532640,
LitCovid,Acute pulmonary embolism following acute type A aortic dissection in a patient with COVID-19,https://pubmed.ncbi.nlm.nih.gov/33533105,
LitCovid,Coronavirus Disease 2019: A Wake-Up Call for Neurosurgeons to Learn Percutaneous Tracheostomy,https://pubmed.ncbi.nlm.nih.gov/33531783,
LitCovid,Rethink how we plan research to shrink COVID health disparities,https://pubmed.ncbi.nlm.nih.gov/33531706,
LitCovid,Open-source RNA extraction and RT-qPCR methods for SARS-CoV-2 detection,https://pubmed.ncbi.nlm.nih.gov/33534838,
LitCovid,The impact of the COVID-19 pandemic on emergency general surgery: a retrospective study,https://pubmed.ncbi.nlm.nih.gov/33533872,
LitCovid,Restructuring service at a mastology outpatient clinic during the COVID-19 pandemic,https://pubmed.ncbi.nlm.nih.gov/33533804,
LitCovid,Delayed onset of fatal encephalitis in a COVID-19 positive patient,https://pubmed.ncbi.nlm.nih.gov/33535011,
LitCovid,Consequences of COVID19-pandemic lockdown on Italian occupational physicians' psychosocial health,https://pubmed.ncbi.nlm.nih.gov/33534805,
LitCovid,A Case of Bedside Ultrasound in COVID-19 to Prognosticate Functional Lung Recovery,https://pubmed.ncbi.nlm.nih.gov/33532100,
LitCovid,COVID-19 epidemiologic surveillance using wastewater,https://pubmed.ncbi.nlm.nih.gov/33531884,
LitCovid,The Novel Perspectives Opened by ST2 in the Pandemic: A Review of Its Role in the Diagnosis and Prognosis of Patients with Heart Failure and COVID-19,https://pubmed.ncbi.nlm.nih.gov/33530550,
LitCovid,[Nationwide exposure model for COVID-19 intensive care unit admission],https://pubmed.ncbi.nlm.nih.gov/33533980,
LitCovid,Liver injury predicts overall mortality in severe COVID-19: a prospective multicenter study in Brazil,https://pubmed.ncbi.nlm.nih.gov/33534084,
LitCovid,SARS-CoV-2 induces human plasmacytoid predendritic cell diversification via UNC93B and IRAK4,https://pubmed.ncbi.nlm.nih.gov/33533916,
