feed,title,long_url,short_url
LitCovid,MMR Vaccine and COVID-19: Measles Protein Homology May Contribute to Cross-Reactivity or to Complement Activation Protection,https://pubmed.ncbi.nlm.nih.gov/33531391,
LitCovid,Watch the P wave in COVID-19 patients: the interatrial block,https://pubmed.ncbi.nlm.nih.gov/33534300,
LitCovid,"Skin manifestations in COVID-19 patients, state of the art. A systematic review.",https://pubmed.ncbi.nlm.nih.gov/33533036,
LitCovid,Comparative Analysis of Intravenous Pumps Relocation for Critically Ill Isolated COVID-19 Patients From Bedside to Outside the Patient Room,https://pubmed.ncbi.nlm.nih.gov/33530822,
LitCovid,Investigation of potential aerosol transmission and infectivity of SARS-CoV-2 through central ventilation systems,https://pubmed.ncbi.nlm.nih.gov/33531734,
LitCovid,Public health response to COVID-19 in selected countries - Hits and misses,https://pubmed.ncbi.nlm.nih.gov/33532398,
LitCovid,The Application of Sample Pooling for Mass Screening of SARS-CoV-2 in an Outbreak of COVID-19 in Vietnam,https://pubmed.ncbi.nlm.nih.gov/33534751,
LitCovid,Fever as a predictor of adverse outcomes in COVID-19,https://pubmed.ncbi.nlm.nih.gov/33533902,
LitCovid,Spatial statistical analysis of pre-existing mortalities of 20 diseases with COVID-19 mortalities in the continental United States,https://pubmed.ncbi.nlm.nih.gov/33532175,
LitCovid,[Analysis of human coronaviruses circulation],https://pubmed.ncbi.nlm.nih.gov/33533210,
LitCovid,Recent Advances in Nanomaterials based Biosensors for Point of Care (PoC) Diagnosis of Covid-19 - A Minireview,https://pubmed.ncbi.nlm.nih.gov/33531721,
LitCovid,Mathematical Modelling and Analysis of COVID-19 Epidemic and Predicting its Future Situation in Ethiopia,https://pubmed.ncbi.nlm.nih.gov/33532177,
LitCovid,Exploratory study on the psychological impact of COVID-19 on the general Brazilian population,https://pubmed.ncbi.nlm.nih.gov/33534820,
LitCovid,COVID control strategy--is there any light at the end of the tunnel?,https://pubmed.ncbi.nlm.nih.gov/33532386,
LitCovid,Case Report: Iliopsoas Hematoma during the Clinical Course of Severe COVID-19 in Two Male Patients,https://pubmed.ncbi.nlm.nih.gov/33534775,
LitCovid,HIV pre-exposure prophylaxis in the time of COVID-19: How a robust and responsive HIV PrEP intervention can avert loss of HIV prevention coverage during a global pandemic,https://pubmed.ncbi.nlm.nih.gov/33534275,
LitCovid,"Critical Considerations for COVID-19 Vaccination of Refugees, Immigrants, and Migrants",https://pubmed.ncbi.nlm.nih.gov/33534734,
LitCovid,School in Italy: a safe place for children and adolescents,https://pubmed.ncbi.nlm.nih.gov/33531046,
LitCovid,"Anxiety, sleep disorders and self-efficacy among nurses during COVID-19 pandemic: A cross-sectional study",https://pubmed.ncbi.nlm.nih.gov/33534934,
LitCovid,Psychological impact and social support in pregnant women during lockdown due to SARS-CoV2 pandemic: A cohort study,https://pubmed.ncbi.nlm.nih.gov/33533051,
LitCovid,Remote Monitoring for Heart Failure Management during COVID-19,https://pubmed.ncbi.nlm.nih.gov/33532544,
LitCovid,A 75-Year-Old Woman with COVID-19 Pneumonia and Wellens Syndrome Diagnosed by Electrocardiography,https://pubmed.ncbi.nlm.nih.gov/33531454,
LitCovid,"Dental personnel in Israel, Canada, and France during the COVID-19 pandemic: attitudes, worries, emotional responses, and posttraumatic growth",https://pubmed.ncbi.nlm.nih.gov/33533236,
LitCovid,The effect of tocilizumab on mortality in hospitalized patients with COVID-19: a meta-analysis of randomized controlled trials,https://pubmed.ncbi.nlm.nih.gov/33532896,
LitCovid,COVID-19 gender policy changes support female scientists and improve research quality,https://pubmed.ncbi.nlm.nih.gov/33531366,
LitCovid,Community Informatics for Sustainable Management of Pandemics in Developing Countries: A Case Study of COVID-19 in Nigeria,https://pubmed.ncbi.nlm.nih.gov/33532534,
LitCovid,Lactic dehydrogenase-lymphocyte ratio for predicting prognosis of severe COVID-19,https://pubmed.ncbi.nlm.nih.gov/33530248,
LitCovid,"Changes in Healthy Behaviors and Meeting 24-h Movement Guidelines in Spanish and Brazilian Preschoolers, Children and Adolescents during the COVID-19 Lockdown",https://pubmed.ncbi.nlm.nih.gov/33530315,
LitCovid,Effects of COVID-19 government travel restrictions on mobility in a rural border area of Northern Thailand: A mobile phone tracking study,https://pubmed.ncbi.nlm.nih.gov/33534857,
LitCovid,On Ambiguity Reduction and the Role of Decision Analysis during the Pandemic,https://pubmed.ncbi.nlm.nih.gov/33534949,
LitCovid,"In-hospital mortality from severe COVID-19 in a tertiary care center in Mexico City; causes of death, risk factors and the impact of hospital saturation",https://pubmed.ncbi.nlm.nih.gov/33534813,
LitCovid,Rapid Transition to Virtual Care during the COVID-19 Epidemic: Experience of a Supportive Care Clinic at a Tertiary Care Cancer Center,https://pubmed.ncbi.nlm.nih.gov/33535019,
LitCovid,Prediction of Single Point Mutations in Human Coronavirus and Their Effects on Binding to 9-O-Acetylated Sialic Acid and Hidroxychloroquine,https://pubmed.ncbi.nlm.nih.gov/33533428,
LitCovid,Risk factors associated with intensive care unit (ICU) admission and in-hospital death among adults hospitalized with COVID-19: a two-center retrospective observational study in tertiary care hospitals,https://pubmed.ncbi.nlm.nih.gov/33534017,
LitCovid,Control and prevention of infectious diseases from a One Health perspective,https://pubmed.ncbi.nlm.nih.gov/33533395,
LitCovid,Trends in acute myocardial infarction volume and related outcomes during the coronavirus disease 2019 pandemic in Turkey,https://pubmed.ncbi.nlm.nih.gov/33534239,
LitCovid,Graphene Sheets with Defined Dual Functionalities for the Strong SARS-CoV-2 Interactions,https://pubmed.ncbi.nlm.nih.gov/33533178,
LitCovid,Correction: Impact of PD-1 Blockade on Severity of COVID-19 in Patients with Lung Cancers,https://pubmed.ncbi.nlm.nih.gov/33531427,
LitCovid,Learning from past respiratory infections to predict COVID-19 Outcomes: A retrospective study,https://pubmed.ncbi.nlm.nih.gov/33534724,
LitCovid,Use and perception of telemedicine in people with type 1 diabetes during the COVID-19 pandemic-Results of a global survey,https://pubmed.ncbi.nlm.nih.gov/33532617,
LitCovid,Why COVID-19 pandemic builds a convincing case for investing in 'Young Physician Leaders (YPL)',https://pubmed.ncbi.nlm.nih.gov/33532373,
LitCovid,Sensitivity of anti-SARS-CoV-2 serological assays in a high-prevalence setting,https://pubmed.ncbi.nlm.nih.gov/33534090,
LitCovid,Femoral and popliteal venous Doppler during prone and supine position in COVID-19 patients: a potential diagnostic tool to detect abnormal right ventricular function,https://pubmed.ncbi.nlm.nih.gov/33532997,
LitCovid,The value of telephone consultations during COVID-19 pandemic. An observational study.,https://pubmed.ncbi.nlm.nih.gov/33533911,
LitCovid,"COVID-19 related masks increase severity of both acne (Maskne) and rosacea (Mask rosacea): Multi-center, real-life, telemedical, observational prospective study",https://pubmed.ncbi.nlm.nih.gov/33533563,
LitCovid,"Reply to Marakasova and Baranova, ""MMR Vaccine and COVID-19: Measles Protein Homology May Contribute to Cross-Reactivity or to Complement Activation Protection""",https://pubmed.ncbi.nlm.nih.gov/33531392,
LitCovid,Obesity and Critical Illness in COVID-19: Respiratory Pathophysiology,https://pubmed.ncbi.nlm.nih.gov/33533193,
LitCovid,A single dose of in situ gel formulation of antimalarial drug chloroquine phosphate as a sustained prophylactic candidate for COVID-19,https://pubmed.ncbi.nlm.nih.gov/33532356,
LitCovid,Loneliness and negative effects on mental health as trade-offs of the policy response to COVID-19,https://pubmed.ncbi.nlm.nih.gov/33532922,
LitCovid,Measuring the impact of COVID-19 on mental health as a preliminary procedure in primary care provision: A cross-sectional study using COVID-19 anxiety scale,https://pubmed.ncbi.nlm.nih.gov/33532394,
LitCovid,Automated Severity Assessment of COVID-19 based on Clinical and Imaging Data: Algorithm Development and Validation,https://pubmed.ncbi.nlm.nih.gov/33534723,
LitCovid,The Classifiers Established with Clinical Laboratory Indicators to Distinguish COVID-19 from Community-Acquired Pneumonia: Retrospective Cohort Study,https://pubmed.ncbi.nlm.nih.gov/33534722,
LitCovid,Characteristics of Three Different Chemiluminescence Assays for Testing for SARS-CoV-2 Antibodies,https://pubmed.ncbi.nlm.nih.gov/33532006,
LitCovid,Correction to: The relationship between COVID-19 and the dental damage stage determined by radiological examination,https://pubmed.ncbi.nlm.nih.gov/33534039,
LitCovid,"[Formation of population gene pools of zoonotic viruses, potentially threatening biosafety]",https://pubmed.ncbi.nlm.nih.gov/33533208,
LitCovid,Lymphopenia as a Biological Predictor of Outcomes in COVID-19 Patients: A Nationwide Cohort Study,https://pubmed.ncbi.nlm.nih.gov/33530509,
LitCovid,Cross-sectional survey of the impact of the COVID-19 pandemic on cancer screening programmes in selected low- and middle-income countries: study from the IARC COVID-19 impact study group,https://pubmed.ncbi.nlm.nih.gov/33533501,
LitCovid,Incidence of thrombotic complications and overall survival in hospitalized patients with COVID-19 in the second and first wave,https://pubmed.ncbi.nlm.nih.gov/33535120,
LitCovid,"Nitric oxide and Covid-19: dose, timing and how to administer it might be crucial",https://pubmed.ncbi.nlm.nih.gov/33533477,
LitCovid,"Effects of Chinese Medicine on Symptoms, Syndrome Evolution, and Lung Inflammation Absorption in COVID-19 Convalescent Patients during 84-Day Follow-up after Hospital Discharge: A Prospective Cohort and Nested Case-Control Study",https://pubmed.ncbi.nlm.nih.gov/33534076,
LitCovid,"Pragmatic Recommendations for Tracheostomy, Discharge, and Rehabilitation Measures in Hospitalized Patients Recovering From Severe COVID-19 in Low- and Middle-Income Countries",https://pubmed.ncbi.nlm.nih.gov/33534772,
LitCovid,COVID-19 Outcomes Among Persons Living With or Without Diagnosed HIV Infection in New York State,https://pubmed.ncbi.nlm.nih.gov/33533933,
LitCovid,Six artificial intelligence paradigms for tissue characterisation and classification of non-COVID-19 pneumonia against COVID-19 pneumonia in computed tomography lungs,https://pubmed.ncbi.nlm.nih.gov/33532975,
LitCovid,Pragmatic Recommendations for the Management of Acute Respiratory Failure and Mechanical Ventilation in Patients with COVID-19 in Low- and Middle-Income Countries,https://pubmed.ncbi.nlm.nih.gov/33534774,
LitCovid,"""The doctor will see you now"": Direct support professionals' perspectives on supporting adults with intellectual and developmental disabilities accessing health care during COVID-19",https://pubmed.ncbi.nlm.nih.gov/33531290,
LitCovid,A novel Covid-19 and Pneumonia Classification Method based on F-transform,https://pubmed.ncbi.nlm.nih.gov/33531722,
LitCovid,Age-associated Ligand-receptor Interactions Imputed from Nasopharyngeal Transcriptomes of COVID-19 Patients,https://pubmed.ncbi.nlm.nih.gov/33533266,
LitCovid,[Meralgia paresthetica after prolonged prone position at the intensive care unit among COVID-19 patients. A case report].,https://pubmed.ncbi.nlm.nih.gov/33534911,
LitCovid,COVID-19 Viral Pneumonia Complicated with Acute Pulmonary Embolism: A Descriptive Study,https://pubmed.ncbi.nlm.nih.gov/33532097,
LitCovid,Protecting women: new domestic violence countermeasures for COVID-19 in Japan,https://pubmed.ncbi.nlm.nih.gov/33533321,
LitCovid,ACE2 and energy metabolism: the connection between COVID-19 and chronic metabolic disorders,https://pubmed.ncbi.nlm.nih.gov/33533405,
LitCovid,Simultaneous cardio-cerebral infarction in the coronavirus disease pandemic era: A case series,https://pubmed.ncbi.nlm.nih.gov/33530272,
LitCovid,Viral time capsule: a global photo-elicitation study of child and adolescent mental health professionals during COVID-19,https://pubmed.ncbi.nlm.nih.gov/33531051,
LitCovid,Using machine learning to estimate the effect of racial segregation on COVID-19 mortality in the United States,https://pubmed.ncbi.nlm.nih.gov/33531345,
LitCovid,COVID-19_ad_210x280.pdf,https://pubmed.ncbi.nlm.nih.gov/33531716,
LitCovid,Psychological Morbidity among People in Quarantine,https://pubmed.ncbi.nlm.nih.gov/33531762,
LitCovid,Concordance of Pre-Procedure Testing With Time of Surgery Testing for SARS-CoV-2 in Children,https://pubmed.ncbi.nlm.nih.gov/33531335,
LitCovid,Aurintricarboxylic acid and its metal ion complexes in comparative virtual screening versus Lopinavir and Hydroxychloroquine in fighting COVID-19 pandemic: synthesis and characterization,https://pubmed.ncbi.nlm.nih.gov/33531865,
LitCovid,Persistent cellular immunity to SARS-CoV-2 infection,https://pubmed.ncbi.nlm.nih.gov/33533915,
LitCovid,Coping with COVID-19 - Longitudinal analysis of coping strategies and the role of trait mindfulness in mental well-being,https://pubmed.ncbi.nlm.nih.gov/33531724,
LitCovid,Droplet and Bone Dust Contamination from High-speed Drilling During Mastoidectomy,https://pubmed.ncbi.nlm.nih.gov/33533176,
LitCovid,Isoelectric point determination by imaged CIEF of commercially available SARS-CoV-2 proteins and the hACE2 receptor,https://pubmed.ncbi.nlm.nih.gov/33533060,
LitCovid,[Saddle thrombus in the region of the aortic bifurcation and critical limb ischaemia of the left leg associated with SARS-CoV-2 infection],https://pubmed.ncbi.nlm.nih.gov/33531737,
LitCovid,National outcomes and characteristics of patients admitted to Swedish intensive care units for COVID-19: A registry-based cohort study,https://pubmed.ncbi.nlm.nih.gov/33534266,
LitCovid,Facility-Based Surveillance Activities for COVID-19 Infection and Outcomes among Healthcare Workers in a Nigerian Tertiary Hospital,https://pubmed.ncbi.nlm.nih.gov/33534753,
LitCovid,Information about COVID-19 for deaf people: an analysis of Youtube videos in Brazilian sign language,https://pubmed.ncbi.nlm.nih.gov/33533803,
LitCovid,Structure of papain-like protease from SARS-CoV-2 and its complexes with non-covalent inhibitors,https://pubmed.ncbi.nlm.nih.gov/33531496,
LitCovid,"Uncovering potential host proteins and pathways that may interact with eukaryotic short linear motifs in viral proteins of MERS, SARS and SARS2 coronaviruses that infect humans",https://pubmed.ncbi.nlm.nih.gov/33534852,
LitCovid,Pathophysiologic mechanisms of cerebral endotheliopathy and stroke due to Sars-CoV-2,https://pubmed.ncbi.nlm.nih.gov/33530831,
LitCovid,A predictable home environment may protect child mental health during the COVID-19 pandemic,https://pubmed.ncbi.nlm.nih.gov/33532520,
LitCovid,Enhanced production of camptothecin by immobilized callus of Ophiorrhiza mungos and a bioinformatic insight into its potential antiviral effect against SARS-CoV-2,https://pubmed.ncbi.nlm.nih.gov/33531790,
LitCovid,Mental health and psychosocial support strategies in highly contagious emerging disease outbreaks of substantial public concern: A systematic scoping review,https://pubmed.ncbi.nlm.nih.gov/33534786,
LitCovid,Brazilian Adaptation of the Coronavirus Anxiety Scale: A Psychometric Investigation of a Measure of Coronaphobia,https://pubmed.ncbi.nlm.nih.gov/33530891,
LitCovid,Validation of the Brazilian Portuguese version of the Obsession with COVID-19 Scale (BP-OCS) using a large University Sample in Brazil,https://pubmed.ncbi.nlm.nih.gov/33530895,
LitCovid,Improving Care for Older Adults in China: Development of Long-Term Care Policy and System,https://pubmed.ncbi.nlm.nih.gov/33530855,
LitCovid,Mortality is Not Increased in SARS-CoV-2 Infected Persons With Hepatitis C Virus Infection,https://pubmed.ncbi.nlm.nih.gov/33534931,
LitCovid,Personality and motivational predictors of well-being and coping during COVID-19: A reversal theory analysis,https://pubmed.ncbi.nlm.nih.gov/33531726,
LitCovid,"Men, masculinity and the new coronavirus: sharing gender issues in the first phase of the pandemic",https://pubmed.ncbi.nlm.nih.gov/33533839,
LitCovid,Viral Evasion of RIG-I-Like Receptor-Mediated Immunity through Dysregulation of Ubiquitination and ISGylation,https://pubmed.ncbi.nlm.nih.gov/33530371,
LitCovid,Variation in SARS-CoV-2 outbreaks across sub-Saharan Africa,https://pubmed.ncbi.nlm.nih.gov/33531710,
LitCovid,Effect of remote online exam delivery on student experience and performance in applied knowledge tests,https://pubmed.ncbi.nlm.nih.gov/33530962,
LitCovid,Bias in Medicine: Lessons Learned and Mitigation Strategies,https://pubmed.ncbi.nlm.nih.gov/33532668,
LitCovid,Author Correction: Genetic architecture of host proteins involved in SARS-CoV-2 infection,https://pubmed.ncbi.nlm.nih.gov/33531486,
LitCovid,Blended programmatic assessment for competency based curricula,https://pubmed.ncbi.nlm.nih.gov/33533748,
LitCovid,Effect of Taping Face Masks on Quantitative Particle Counts Near the Eye: Implications for Intravitreal Injections in the COVID-19 Era,https://pubmed.ncbi.nlm.nih.gov/33535060,
LitCovid,A Case of Atypical Skull Base Osteomyelitis Secondary to Otitis Media Due to Delayed Diagnosis,https://pubmed.ncbi.nlm.nih.gov/33534308,
LitCovid,"Influenza, but not SARS-CoV-2, infection induces a rapid interferon response that wanes with age and diminished tissue-resident memory CD8(+) T cells",https://pubmed.ncbi.nlm.nih.gov/33532071,
LitCovid,Moving Beyond the Momentum: Innovative Approaches to Clinical Trial Implementation,https://pubmed.ncbi.nlm.nih.gov/33534616,
LitCovid,"Effects of mind-body exercise on PTSD symptoms, depression and anxiety in PTSD patients: A protocol of systematic review and meta-analysis",https://pubmed.ncbi.nlm.nih.gov/33530251,
LitCovid,"An Asynchronous, Mobile Text-Based Platform (XatJove Anoia) for Providing Health Services to Teenagers: Protocol for a Quasiexperimental Study",https://pubmed.ncbi.nlm.nih.gov/33533729,
LitCovid,LncRNAs: Promising new targets in pulmonary fibrosis,https://pubmed.ncbi.nlm.nih.gov/33533071,
LitCovid,Patient Experiences with Screening and Assistance for Social Isolation in Primary Care Settings,https://pubmed.ncbi.nlm.nih.gov/33532968,
LitCovid,Could Alcohol-Based Hand Sanitizer Be an Option for Hand Hygiene for Households in Rural Bangladesh?,https://pubmed.ncbi.nlm.nih.gov/33534756,
LitCovid,Analysis of the Patients Who Admitted To A Turkish Emergency Department During COVID-19 Pandemic,https://pubmed.ncbi.nlm.nih.gov/33525265,
