feed,title,long_url,short_url
GN:T:WP,Construction on Salem wind terminal expected to begin late summer - The Salem News,https://news.google.com/rss/articles/CBMikgFodHRwczovL3d3dy5zYWxlbW5ld3MuY29tL25ld3MvY29uc3RydWN0aW9uLW9uLXNhbGVtLXdpbmQtdGVybWluYWwtZXhwZWN0ZWQtdG8tYmVnaW4tbGF0ZS1zdW1tZXIvYXJ0aWNsZV8yMjU4ZDliZS1hOTdjLTExZWQtYjVjOS1iYjI5NjE3NWVmYzAuaHRtbNIBAA?oc=5,https://da.gd/wZRvQi
GN:T:WP,Boat Tours Bring Visitors to Offshore Wind Turbines - Bloomberg,https://news.google.com/rss/articles/CBMiZmh0dHBzOi8vd3d3LmJsb29tYmVyZy5jb20vbmV3cy9mZWF0dXJlcy8yMDIzLTAyLTE4L2JvYXQtdG91cnMtYnJpbmctdmlzaXRvcnMtdG8tb2Zmc2hvcmUtd2luZC10dXJiaW5lc9IBAA?oc=5,https://da.gd/GrXNc
GN:T:WP,Ramboll Joins BRUNEL Floating Offshore Wind Foundation Project - Offshore WIND,https://news.google.com/rss/articles/CBMiZ2h0dHBzOi8vd3d3Lm9mZnNob3Jld2luZC5iaXovMjAyMy8wMi8xNy9yYW1ib2xsLWpvaW5zLWJydW5lbC1mbG9hdGluZy1vZmZzaG9yZS13aW5kLWZvdW5kYXRpb24tcHJvamVjdC_SAQA?oc=5,https://da.gd/xT5B
GN:T:WP,EBRD doubles its investments in Morocco in a year marked by recession fears - Atalayar,https://news.google.com/rss/articles/CBMiYGh0dHBzOi8vYXRhbGF5YXIuY29tL2VuL2NvbnRlbnQvZWJyZC1kb3VibGVzLWl0cy1pbnZlc3RtZW50cy1tb3JvY2NvLXllYXItbWFya2VkLXJlY2Vzc2lvbi1mZWFyc9IBAA?oc=5,https://da.gd/3zZi
GN:T:WP,Siemens Gamesa to establish offshore wind turbine nacelle facility in New York - CompositesWorld,https://news.google.com/rss/articles/CBMic2h0dHBzOi8vd3d3LmNvbXBvc2l0ZXN3b3JsZC5jb20vbmV3cy9zaWVtZW5zLWdhbWVzYS10by1lc3RhYmxpc2gtb2Zmc2hvcmUtd2luZC10dXJiaW5lLW5hY2VsbGUtZmFjaWxpdHktaW4tbmV3LXlvcmvSAQA?oc=5,https://da.gd/1w6BJK
GN:T:WP,How misinformation about solar power hinders the fight against climate change - NPR,https://news.google.com/rss/articles/CBMiXGh0dHBzOi8vd3d3Lm5wci5vcmcvMjAyMy8wMi8xOC8xMTU0ODY3MDY0L3NvbGFyLXBvd2VyLW1pc2luZm9ybWF0aW9uLWFjdGl2aXN0cy1ydXJhbC1hbWVyaWNh0gEA?oc=5,https://da.gd/4if1
GN:T:WP,Norway: Project Launched to Develop Offshore Charging Solutions for Offshore Wind Vessels - Offshore Engineer,https://news.google.com/rss/articles/CBMifmh0dHBzOi8vd3d3Lm9lZGlnaXRhbC5jb20vbmV3cy81MDI5ODMtbm9yd2F5LXByb2plY3QtbGF1bmNoZWQtdG8tZGV2ZWxvcC1vZmZzaG9yZS1jaGFyZ2luZy1zb2x1dGlvbnMtZm9yLW9mZnNob3JlLXdpbmQtdmVzc2Vsc9IBggFodHRwczovL3d3dy5vZWRpZ2l0YWwuY29tL2FtcC9uZXdzLzUwMjk4My1ub3J3YXktcHJvamVjdC1sYXVuY2hlZC10by1kZXZlbG9wLW9mZnNob3JlLWNoYXJnaW5nLXNvbHV0aW9ucy1mb3Itb2Zmc2hvcmUtd2luZC12ZXNzZWxz?oc=5,https://da.gd/8KIxP9
GN:T:WP,EnBW and Equinor to develop offshore wind together - reNews - Renewable Energy News - reNEWS,https://news.google.com/rss/articles/CBMiTGh0dHBzOi8vcmVuZXdzLmJpei84Mzg5MC9lbmJ3LWFuZC1lcXVpbm9yLXRvLWRldmVsb3Atb2Zmc2hvcmUtd2luZC10b2dldGhlci_SAQA?oc=5,https://da.gd/PXTc7J
GN:T:WP,DTE Union Township solar farm under construction draws protest - Coldwater Daily Reporter,https://news.google.com/rss/articles/CBMiiAFodHRwczovL3d3dy50aGVkYWlseXJlcG9ydGVyLmNvbS9zdG9yeS9uZXdzL2xvY2FsLzIwMjMvMDIvMTgvZHRlLXVuaW9uLXRvd25zaGlwLXNvbGFyLWZhcm0tdW5kZXItY29uc3RydWN0aW9uLWRyYXdzLXByb3Rlc3QvNjk5MDU3MTgwMDcv0gEA?oc=5,https://da.gd/TLOW
