feed,title,long_url,short_url
ArXiv:q-fin,From Knowing to Doing: A Memory-Controlled Benchmark for LLM Trading Agents on Stock Markets,https://arxiv.org/abs/2605.28359,
ArXiv:q-fin,Regime-Based Portfolio Allocation Using Hidden Markov Models and Reinforcement Learning,https://arxiv.org/abs/2605.27848,
ArXiv:q-fin,"Stochastic Volatility, Jumps, and Rates: A Unified Framework for Option Pricing and Term-Structure Simulation",https://arxiv.org/abs/2605.27945,
ArXiv:q-fin,Deep Learning Forecasting of the U.S. Aggregate Bond Index,https://arxiv.org/abs/2605.27977,
ArXiv:q-fin,"PortBench: A Correlation-Aware, Full-Pipeline Benchmark for LLM-Driven Portfolio Management",https://arxiv.org/abs/2605.27887,
ArXiv:q-fin,Historical Developments in Probability Measures for Asset Pricing: From State Prices to Modern Pricing Kernels,https://arxiv.org/abs/2605.27658,
