feed,title,long_url,short_url
ArXiv,Learning to Team-Based Navigation: A Review of Deep Reinforcement Learning Techniques for Multi-Agent Pathfinding,https://arxiv.org/abs/2308.05893v1,
ArXiv,A Deep Recurrent-Reinforcement Learning Method for Intelligent AutoScaling of Serverless Functions,https://arxiv.org/abs/2308.05937v1,
ArXiv,CyberForce: A Federated Reinforcement Learning Framework for Malware Mitigation,https://arxiv.org/abs/2308.05978v1,
ArXiv,Robust Quadruped Jumping via Deep Reinforcement Learning,https://arxiv.org/abs/2011.07089v3,
ArXiv,Imitation Is Not Enough: Robustifying Imitation with Reinforcement Learning for Challenging Driving Scenarios,https://arxiv.org/abs/2212.11419v2,
ArXiv,Image-based Regularization for Action Smoothness in Autonomous Miniature Racing Car with Deep Reinforcement Learning,https://arxiv.org/abs/2307.08230v2,
