feed,title,long_url,short_url
GN:T:WP,Brazil connects 234 MW of wind farms in May - Renewables Now,https://renewablesnow.com/news/brazil-connects-234-mw-of-wind-farms-in-may-743316/,
GN:T:WP,ABO Wind lands operational management for 160 MW of Finnish wind farms - Renewables Now,https://renewablesnow.com/news/abo-wind-lands-operational-management-for-160-mw-of-finnish-wind-farms-743349/,
GN:T:WP,CS Wind to acquire Vestas’ Pueblo tower factory - Energy Global,https://www.energyglobal.com/special-reports/03062021/cs-wind-to-acquire-vestas-pueblo-tower-factory/,
GN:T:WP,China Three Gorges Renewables’ IPO is oversubscribed in Shanghai - South China Morning Post,https://www.scmp.com/business/companies/article/3135909/china-three-gorges-renewables-ipo-receives-strong-response,
GN:T:WP,'Plain wrong': Spanish wind legislation draft undermining investment: WindEurope | Recharge - Recharge,https://www.rechargenews.com/wind/plain-wrong-spanish-wind-legislation-draft-undermining-investment-windeurope/2-1-1019992,
GN:T:WP,Suffolk School Notebook: Junior takes top spot in LI Youth Summit - Newsday,https://www.newsday.com/long-island/education/suffolk-school-notebook-junior-takes-top-spot-in-li-youth-summit-1.50260121,
GN:T:WP,Equinor Drills Duster Near Wisting Discovery in Barents Sea - Offshore Engineer,https://www.oedigital.com/news/488143-equinor-drills-duster-near-wisting-discovery-in-barents-sea,
GN:T:WP,"Scatec, ACME to co-develop 900-MW solar plant in India - Renewables Now",https://renewablesnow.com/news/scatec-acme-to-co-develop-900-mw-solar-plant-in-india-743335/,
GN:T:WP,Belgium plans pipeline network by 2026 to cut CO2 emissions - Montel,https://www.montelnews.com/en/story/belgium-plans-pipeline-network-by-2026-to-cut-co2-emissions-/1226768,
