feed,title,long_url,short_url
GN:T:RE,NASA Mars lander dumps dirt on itself to battle dusty solar panels - CNET,https://www.cnet.com/news/nasa-mars-lander-dumps-dirt-on-itself-to-battle-dusty-solar-panels/,
GN:T:RE,United Airlines is bringing supersonic travel back with order for net-zero carbon jets - Euronews,https://www.euronews.com/2021/06/03/united-airlines-is-bringing-supersonic-travel-back-with-order-for-net-zero-carbon-jets,
GN:T:RE,"Agilitas acquires New England Battery Storage, Maine battery portfolio - pv magazine USA",https://pv-magazine-usa.com/2021/06/03/agilitas-acquires-new-england-battery-storage-maine-battery-portfolio/,
GN:T:RE,"SpaceX launches new solar arrays to space station, nails rocket landing at sea - Space",https://www.space.com/spacex-dragon-crs-22-nasa-cargo-launch-success,
GN:T:RE,"Bill Gates, Warren Buffett building nuclear reactor in nation's biggest coal-producing state | TheHill - The Hill",https://thehill.com/changing-america/sustainability/energy/556702-bill-gates-and-warren-buffett-building-nuclear-reactor,
