feed,title,long_url,short_url
GN:S:C,Pathways of Climate Insecurity: Guidance for Policymakers - World - ReliefWeb,https://reliefweb.int/report/world/pathways-climate-insecurity-guidance-policymakers,
GN:S:C,How seaweed farming can help to tackle climate change - The Fish Site,https://thefishsite.com/articles/how-seaweed-farming-can-help-to-tackle-climate-change,
GN:S:C,"Climate change and water: Are we doing enough, fast enough? - GOV",https://www.gov.uk/government/speeches/climate-change-and-water-are-we-doing-enough-fast-enough--2,
GN:S:C,Why America Needs a Climate-Resilient Recovery - Greentech Media News,https://www.greentechmedia.com/articles/read/why-america-needs-a-climate-resilient-recovery,
GN:S:C,How To Talk To People About the Climate Crisis When Scary Facts Are Not Enough - EcoWatch,https://www.ecowatch.com/how-to-talk-about-climate-change-2649044390.html,
