feed,title,long_url,short_url
GN:S:C,"Global rich must pay more to tackle climate crisis, says architect of Paris deal - The Guardian",https://news.google.com/rss/articles/CBMie2h0dHBzOi8vd3d3LnRoZWd1YXJkaWFuLmNvbS9nbG9iYWwtZGV2ZWxvcG1lbnQvYXJ0aWNsZS8yMDI0L2p1bi8wNC9nbG9iYWwtcmljaC1wYXktbW9yZS1jbGltYXRlLWNyaXNpcy1hcmNoaXRlY3QtcGFyaXMtZGVhbNIBe2h0dHBzOi8vYW1wLnRoZWd1YXJkaWFuLmNvbS9nbG9iYWwtZGV2ZWxvcG1lbnQvYXJ0aWNsZS8yMDI0L2p1bi8wNC9nbG9iYWwtcmljaC1wYXktbW9yZS1jbGltYXRlLWNyaXNpcy1hcmNoaXRlY3QtcGFyaXMtZGVhbA?oc=5,https://da.gd/TmPlU
GN:S:C,Hype Or Reality: Will AI Really Solve Climate Change? - Forbes,https://news.google.com/rss/articles/CBMiaGh0dHBzOi8vd3d3LmZvcmJlcy5jb20vc2l0ZXMvYmVybmFyZG1hcnIvMjAyNC8wNi8wNC9oeXBlLW9yLXJlYWxpdHktd2lsbC1haS1yZWFsbHktc29sdmUtY2xpbWF0ZS1jaGFuZ2Uv0gEA?oc=5,https://da.gd/ZT7lYX
GN:S:C,"Climate change, El Niño to blame for deadly floods in Brazil - Voice of America - VOA News",https://news.google.com/rss/articles/CBMiZ2h0dHBzOi8vd3d3LnZvYW5ld3MuY29tL2EvY2xpbWF0ZS1jaGFuZ2UtZWwtbmklQzMlQjFvLXRvLWJsYW1lLWZvci1kZWFkbHktZmxvb2RzLWluLWJyYXppbC83NjQxNzU5Lmh0bWzSAWlodHRwczovL3d3dy52b2FuZXdzLmNvbS9hbXAvY2xpbWF0ZS1jaGFuZ2UtZWwtbmklQzMlQjFvLXRvLWJsYW1lLWZvci1kZWFkbHktZmxvb2RzLWluLWJyYXppbC83NjQxNzU5Lmh0bWw?oc=5,https://da.gd/rrQzp
GN:S:C,Climate change made Brazil floods more likely: experts - Yahoo! Voices,https://news.google.com/rss/articles/CBMiS2h0dHBzOi8vd3d3LnlhaG9vLmNvbS9uZXdzL2NsaW1hdGUtY2hhbmdlLW1hZGUtYnJhemlsLWZsb29kcy0wNDQyMDI4NjUuaHRtbNIBAA?oc=5,https://da.gd/N2C0Mo
GN:S:C,No respite from permafrost-thaw impacts in the absence of a global tipping point - Nature,https://news.google.com/rss/articles/CBMiMmh0dHBzOi8vd3d3Lm5hdHVyZS5jb20vYXJ0aWNsZXMvczQxNTU4LTAyNC0wMjAxMS000gEA?oc=5,https://da.gd/P7CQGq
GN:S:C,Europe's steelmakers risk missing climate targets despite billions in subsidies - Financial Times,https://news.google.com/rss/articles/CBMiP2h0dHBzOi8vd3d3LmZ0LmNvbS9jb250ZW50L2EzYzQ4NjJlLTZmMzItNGViNS1hMzE2LTJkOGVmMTMwOTZkNtIBAA?oc=5,https://da.gd/31ith
