feed,title,long_url,short_url
GN:S:GW,Relentless Heat Waves Make AC Too Expensive for Many People - Scientific American,https://news.google.com/rss/articles/CBMiXGh0dHBzOi8vd3d3LnNjaWVudGlmaWNhbWVyaWNhbi5jb20vYXJ0aWNsZS9oZWF0LXdhdmVzLW1ha2UtYWMtdG9vLWV4cGVuc2l2ZS1mb3ItbWFueS1wZW9wbGUv0gEA?oc=5,https://da.gd/kN6e1
GN:S:GW,When Hydropower Runs Dry - The New York Times,https://news.google.com/rss/articles/CBMiSWh0dHBzOi8vd3d3Lm55dGltZXMuY29tLzIwMjQvMDYvMDQvY2xpbWF0ZS9nbG9iYWwtaHlkcm9wb3dlci1kZWNsaW5lLmh0bWzSAQA?oc=5,https://da.gd/0dnG9
GN:S:GW,Mexico's new president is a climate scientist. Here's what that could mean for the country's emissions - Fast Company,https://news.google.com/rss/articles/CBMihwFodHRwczovL3d3dy5mYXN0Y29tcGFueS5jb20vOTExMzUyMjEvbWV4aWNvcy1uZXctcHJlc2lkZW50LWlzLWEtY2xpbWF0ZS1zY2llbnRpc3QtaGVyZXMtd2hhdC10aGF0LWNvdWxkLW1lYW4tZm9yLXRoZS1jb3VudHJ5cy1lbWlzc2lvbnPSAQA?oc=5,https://da.gd/cNG0r
GN:S:GW,When Activist Research Contradicts the… - Breakthrough Institute,https://news.google.com/rss/articles/CBMiZmh0dHBzOi8vdGhlYnJlYWt0aHJvdWdoLm9yZy9qb3VybmFsL25vLTIwLXNwcmluZy0yMDI0L3doZW4tYWN0aXZpc3QtcmVzZWFyY2gtY29udHJhZGljdHMtdGhlLWNvbnNlbnN1c9IBAA?oc=5,https://da.gd/sNljQR
GN:S:GW,Lakes in Tibet to expand 50% by 2100 due to climate change: Study - Phayul,https://news.google.com/rss/articles/CBMiJ2h0dHA6Ly93d3cucGhheXVsLmNvbS8yMDI0LzA2LzA0LzUwMzczL9IBAA?oc=5,https://da.gd/jzyp4
