feed,title,long_url,short_url
ArXiv:q-bio,The geometry of chromatin,https://arxiv.org/abs/2402.09408,
ArXiv:q-bio,Deep Manifold Transformation for Protein Representation Learning,https://arxiv.org/abs/2402.09416,
ArXiv:q-bio,AI-Enabled Lung Cancer Prognosis,https://arxiv.org/abs/2402.09476,
ArXiv:q-bio,Evaluation of simulation methods for tumor subclonal reconstruction,https://arxiv.org/abs/2402.09599,
ArXiv:q-bio,Canalization reduces the nonlinearity of regulation in biological networks,https://arxiv.org/abs/2402.09703,
ArXiv:q-bio,Data Smoothing Filling Method based on ScRNA-Seq Data Zero-Value Identification,https://arxiv.org/abs/2402.09755,
ArXiv:q-bio,Optimizing Temporal Waveform Analysis: A Novel Pipeline for Efficient Characterization of Left Coronary Artery Velocity Profiles,https://arxiv.org/abs/2402.10146,
ArXiv:q-bio,Transition from time-variant to static networks: timescale separation in NIMFA SIS epidemics,https://arxiv.org/abs/2305.12446,
ArXiv:q-bio,Wavelet Analysis of Noninvasive EEG Signals Discriminates Complex and Natural Grasp Types,https://arxiv.org/abs/2402.09447,
ArXiv:q-bio,Different Algorithms (Might) Uncover Different Patterns: A Brain-Age Prediction Case Study,https://arxiv.org/abs/2402.09464,
ArXiv:q-bio,ProtChatGPT: Towards Understanding Proteins with Large Language Models,https://arxiv.org/abs/2402.09649,
ArXiv:q-bio,DFORM: Diffeomorphic vector field alignment for assessing dynamics across learned models,https://arxiv.org/abs/2402.09735,
ArXiv:q-bio,Generating Visual Stimuli from EEG Recordings using Transformer-encoder based EEG encoder and GAN,https://arxiv.org/abs/2402.10115,
ArXiv:q-bio,Str2Str: A Score-based Framework for Zero-shot Protein Conformation Sampling,https://arxiv.org/abs/2306.03117,
ArXiv:q-bio,The Nature of Intelligence,https://arxiv.org/abs/2307.11114,
