feed,title,long_url,short_url
GN:T:ML,Bridging the expectation-reality gap in machine learning - MIT Technology Review,https://news.google.com/rss/articles/CBMibWh0dHBzOi8vd3d3LnRlY2hub2xvZ3lyZXZpZXcuY29tLzIwMjMvMTEvMDgvMTA4MjgyMS9icmlkZ2luZy10aGUtZXhwZWN0YXRpb24tcmVhbGl0eS1nYXAtaW4tbWFjaGluZS1sZWFybmluZy_SAXFodHRwczovL3d3dy50ZWNobm9sb2d5cmV2aWV3LmNvbS8yMDIzLzExLzA4LzEwODI4MjEvYnJpZGdpbmctdGhlLWV4cGVjdGF0aW9uLXJlYWxpdHktZ2FwLWluLW1hY2hpbmUtbGVhcm5pbmcvYW1wLw?oc=5,https://da.gd/8NWS
GN:T:ML,Octo Secures Army Option Year Funding for Machine Learning R&D Work; Rob Albritton Quoted - ExecutiveBiz,https://news.google.com/rss/articles/CBMiZ2h0dHBzOi8vZXhlY3V0aXZlYml6LmNvbS8yMDIzLzExL29jdG8tc2VjdXJlcy1hcm15LW9wdGlvbi15ZWFyLWZ1bmRpbmctZm9yLW1hY2hpbmUtbGVhcm5pbmctcmFuZGQtd29yay_SAQA?oc=5,https://da.gd/YDvx2
GN:T:ML,"MobileFuse Unveils Proprietary Machine Learning Platform, Advances Traffic Shaping Capabilities, Reduces Carbon Emissions and Costs Further - Yahoo Finance",https://news.google.com/rss/articles/CBMiXWh0dHBzOi8vZmluYW5jZS55YWhvby5jb20vbmV3cy9tb2JpbGVmdXNlLXVudmVpbHMtcHJvcHJpZXRhcnktbWFjaGluZS1sZWFybmluZy0xNDAwMDAwMTMuaHRtbNIBZWh0dHBzOi8vZmluYW5jZS55YWhvby5jb20vYW1waHRtbC9uZXdzL21vYmlsZWZ1c2UtdW52ZWlscy1wcm9wcmlldGFyeS1tYWNoaW5lLWxlYXJuaW5nLTE0MDAwMDAxMy5odG1s?oc=5,https://da.gd/oBl7
GN:T:ML,Introducing PSoC™ Edge: The Next Generation of ML Enabled Microcontrollers - Embedded Computing Design,https://news.google.com/rss/articles/CBMijQFodHRwczovL2VtYmVkZGVkY29tcHV0aW5nLmNvbS90ZWNobm9sb2d5L3Byb2Nlc3Npbmcvc2VtaWNvbmR1Y3Rvci1pcC9pbnRyb2R1Y2luZy1wc29jLWVkZ2UtdGhlLW5leHQtZ2VuZXJhdGlvbi1vZi1tbC1lbmFibGVkLW1pY3JvY29udHJvbGxlcnPSAQA?oc=5,https://da.gd/WCiCf
GN:T:ML,Data Leakage in Machine Learning: Detect and Minimize Risk - Built In,https://news.google.com/rss/articles/CBMiMWh0dHBzOi8vYnVpbHRpbi5jb20vbWFjaGluZS1sZWFybmluZy9kYXRhLWxlYWthZ2XSAQA?oc=5,https://da.gd/HiqFQ
