feed,title,long_url,short_url
GN:T:GP,AI-Tech Leads To NASA Energy Breakthrough | OilPrice.com - OilPrice,https://news.google.com/rss/articles/CBMiWWh0dHBzOi8vb2lscHJpY2UuY29tL0VuZXJneS9FbmVyZ3ktR2VuZXJhbC9BSS1UZWNoLUxlYWRzLVRvLU5BU0EtRW5lcmd5LUJyZWFrdGhyb3VnaC5odG1s0gEA?oc=5,https://da.gd/qfe7j
GN:T:GP,Croatia licenses three cos for geothermal water exploration - SeeNews,https://news.google.com/rss/articles/CBMiW2h0dHBzOi8vc2VlbmV3cy5jb20vbmV3cy9jcm9hdGlhLWxpY2Vuc2VzLXRocmVlLWNvcy1mb3ItZ2VvdGhlcm1hbC13YXRlci1leHBsb3JhdGlvbi04MzU1NjnSAQA?oc=5,https://da.gd/pendx
GN:T:GP,TEVERRA Awarded DoD Contract to Pioneer Geothermal Energy Development at Fort Wainwright Alaska - Baystreet,https://news.google.com/rss/articles/CBMiMmh0dHA6Ly93d3cuYmF5c3RyZWV0LmNhL3ZpZXdhcnRpY2xlLmFzcHg_aWQ9Nzg5MDI00gE2aHR0cDovL3d3dy5iYXlzdHJlZXQuY2EvYW1wL3ZpZXdhcnRpY2xlLmFzcHg_aWQ9Nzg5MDI0?oc=5,https://da.gd/XjqoAX
GN:T:GP,Can Costa Rica Maintain Its Renewable Energy Leadership? : - The Tico Times,https://news.google.com/rss/articles/CBMiWGh0dHBzOi8vdGljb3RpbWVzLm5ldC8yMDIzLzEwLzAyL2Nhbi1jb3N0YS1yaWNhLW1haW50YWluLWl0cy1yZW5ld2FibGUtZW5lcmd5LWxlYWRlcnNoaXDSAQA?oc=5,https://da.gd/riYsAM
GN:T:GP,Developing thermal power plants in Poland and other countries - Iceland Monitor,https://news.google.com/rss/articles/CBMiZ2h0dHBzOi8vaWNlbGFuZG1vbml0b3IubWJsLmlzL25ld3MvbmV3cy8yMDIzLzEwLzAyL2RldmVsb3BpbmdfdGhlcm1hbF9wb3dlcl9wbGFudHNfaW5fcG9sYW5kX2FuZF9vdGhlci_SAQA?oc=5,https://da.gd/gUTNJ
