feed,title,long_url,short_url
MX,"Mobile app for improving heart health among African Americans shows promise, study finds",https://medicalxpress.com/news/2022-07-mobile-app-heart-health-african.html,https://bit.ly/3yKirPE
MX,Overly restrictive salt intake may worsen outcomes for common form of heart failure,https://medicalxpress.com/news/2022-07-overly-restrictive-salt-intake-worsen.html,https://bit.ly/3zgdaRu
MX,Avoid summer E. coli infection with proper burger cooking,https://medicalxpress.com/news/2022-07-summer-coli-infection-proper-burger.html,https://bit.ly/3zdC7wG
MX,Three things to know about insurance coverage for abortion,https://medicalxpress.com/news/2022-07-coverage-abortion.html,https://bit.ly/3zebNCz
MX,Food recalls and sickness: What should you know?,https://medicalxpress.com/news/2022-07-food-recalls-sickness.html,https://bit.ly/3zcrdr8
MX,Study findings offer roadmap for medication abortions,https://medicalxpress.com/news/2022-07-roadmap-medication-abortions.html,https://bit.ly/3yPRzhd
MX,"Cardiac death rates declined for both Black and white Americans since 1999, but racial disparities persist",https://medicalxpress.com/news/2022-07-cardiac-death-declined-black-white.html,https://bit.ly/3zhxTEy
MX,Tanzania identifies mystery illness as 'rat fever',https://medicalxpress.com/news/2022-07-tanzania-mystery-illness-rat-fever.html,https://bit.ly/3o990EC
