feed,title,long_url,short_url
GN:T:WP,"The Hydrogen Stream: 30 GW power-to-X project in Mauritania, 250 MW of wind for power-to-X in Denmark - pv magazine International",https://www.pv-magazine.com/2021/06/01/the-hydrogen-stream-30-gw-power-to-x-project-in-mauritania-250-mw-of-wind-for-power-to-x-in-denmark/,
GN:T:WP,Advancements in Digital Technologies for Solar and Wind Farm Inspection - Yahoo Finance UK,https://uk.finance.yahoo.com/news/advancements-digital-technologies-solar-wind-132400326.html,
GN:T:WP,Anheuser-Busch Celebrates Early Achievement of 2025 Renewable Electricity Sustainability Goal - GlobeNewswire,https://www.globenewswire.com/news-release/2021/06/01/2239554/0/en/Anheuser-Busch-Celebrates-Early-Achievement-of-2025-Renewable-Electricity-Sustainability-Goal-Domestic-Portfolio-Now-Brewed-with-100-Renewable-Electricity-from-Solar-and-Wind-Power.html,
GN:T:WP,"IEA Backpedals, Says Oil Demand Will Soon Reach Pre-Crisis Levels - OilPrice",https://oilprice.com/Energy/Crude-Oil/IEA-Backpeddles-Says-Oil-Demand-Will-Soon-Reach-Pre-Crisis-Levels.html,
GN:T:WP,Valaris Bags Drillship Contract in Ivory Coast - Offshore Engineer,https://www.oedigital.com/news/488078-valaris-bags-drillship-contract-in-ivory-coast,
GN:T:WP,Washington Renews Chevron's Waiver To Keep Operating In Venezuela - OilPrice,https://oilprice.com/Latest-Energy-News/World-News/Washington-Renews-Chevrons-Waiver-To-Keep-Operating-In-Venezuela.html,
GN:T:WP,"Danville School to remove wind turbine, add solar - New Canaan Advertiser",https://www.ncadvertiser.com/news/article/Danville-School-to-remove-wind-turbine-add-solar-16214641.php,
GN:T:WP,"1,000 Arrests Expected Over Enbridge Line 3 Tar Sands Pipeline - CleanTechnica",https://cleantechnica.com/2021/06/01/1000-arrests-expected-over-enbridge-line-3-tar-sands-pipeline/,
GN:T:WP,Eurus breaks ground on 80 MW of solar plants in Chile - Renewables Now,https://renewablesnow.com/news/eurus-breaks-ground-on-80-mw-of-solar-plants-in-chile-743032/,
