feed,title,long_url,short_url
RS,Safety of systemic anti-cancer treatment in oncology patients with non-severe COVID-19: a prospective cohort study,https://www.researchsquare.com/article/rs-102553/latest,https://j.mp/2TWohJS
RS,"Clinical characteristics and risk factors for mortality in patients with COVID-19 and chronic obstructive pulmonary disease in Wuhan, China",https://www.researchsquare.com/article/rs-102351/latest,https://j.mp/3oWtKyz
RS,Teleradiology as a relevant indicator of the impact of COVID-19 pandemic management on Emergency Room activities: a nationwide worrisome survey,https://www.researchsquare.com/article/rs-102260/latest,https://j.mp/2Jsg2D9
RS,Bayesian small-area modelling of COVID-19 cases and deaths in England and association with key risk factors: a combined space–time Susceptible-Exposed-Infected-Removed (SEIR) model,https://www.researchsquare.com/article/rs-102191/latest,https://j.mp/38e7YAy
RS,"Predictions of daily contagions of CoViD-19 from October 10, 2020 until February 2021 in Italy with a new Epidemiologic FRActal Model plus Expolinear (EpiFRAME) to better frame the pandemic due to the 2B-BetaSarbeco-virus SARS-CoV-2",https://www.researchsquare.com/article/rs-102042/latest,https://j.mp/3l1uDmZ
RS,"Sex differences in viral entry protein expression, host responses to SARS-CoV-2, and in vitro responses to sex steroid hormone treatment in COVID-19",https://www.researchsquare.com/article/rs-100914/latest,https://j.mp/3mTaDDM
RS,A moderated-mediation model of fear of illness and subjective psychological well-being during COVID-19 pandemic,https://www.researchsquare.com/article/rs-100641/latest,https://j.mp/389COdq
