feed,title,long_url,short_url
GN:T:WP,Wind - Codling Wind Park Successful in Ireland?s First Offshore Wind Energy Auction - Renewable Energy Magazine,https://news.google.com/rss/articles/CBMiYGh0dHBzOi8vd3d3LnJlbmV3YWJsZWVuZXJneW1hZ2F6aW5lLmNvbS93aW5kL2NvZGxpbmctd2luZC1wYXJrLXN1Y2Nlc3NmdWwtaW4taXJlbGFuZGEtcy0yMDIzMDUxMtIBAA?oc=5,https://da.gd/Q7qZc
GN:T:WP,Swiss tech giant ABB confirms 'IT security incident' - The Record by Recorded Future,https://news.google.com/rss/articles/CBMiOWh0dHBzOi8vdGhlcmVjb3JkLm1lZGlhL2FiYi1jb25maXJtcy1pdC1zZWN1cml0eS1pbmNpZGVudNIBAA?oc=5,https://da.gd/7tnPHH
GN:T:WP,Mexico’s Querétaro state plans US$300mn tran... - BNamericas English,https://news.google.com/rss/articles/CBMiYWh0dHBzOi8vd3d3LmJuYW1lcmljYXMuY29tL2VuL25ld3MvbWV4aWNvcy1xdWVyZXRhcm8tc3RhdGUtcGxhbnMtdXMzMDBtbi10cmFuc21pc3Npb24taW52ZXN0bWVudHPSAQA?oc=5,https://da.gd/gYJW
GN:T:WP,Walk for common sense: Stop the wind turbines in NJ - New Jersey 101,https://news.google.com/rss/articles/CBMiRmh0dHBzOi8vbmoxMDE1LmNvbS93YWxrLWZvci1jb21tb24tc2Vuc2Utc3RvcC10aGUtd2luZC10dXJiaW5lcy1pbi1uai_SAQA?oc=5,https://da.gd/5wKlLq
GN:T:WP,PM asked to implement cheaper energy projects - Business - DAWN.COM - DAWN,https://news.google.com/rss/articles/CBMiIWh0dHBzOi8vd3d3LmRhd24uY29tL25ld3MvMTc1Mjc3N9IBAA?oc=5,https://da.gd/6i70M3
GN:T:WP,The Elecnor Group makes a net profit of EUR 27.4 million in the first quarter of 2023 | REVE News of the wind sector in Spain and in the world - REVE,https://news.google.com/rss/articles/CBMifGh0dHBzOi8vd3d3LmV2d2luZC5lcy8yMDIzLzA1LzEyL3RoZS1lbGVjbm9yLWdyb3VwLW1ha2VzLWEtbmV0LXByb2ZpdC1vZi1ldXItMjctNC1taWxsaW9uLWluLXRoZS1maXJzdC1xdWFydGVyLW9mLTIwMjMvOTE3NzPSAQA?oc=5,https://da.gd/Av2l1N
