feed,title,long_url,short_url
AWS:WhatsNew,AWS Control Tower introduces APIs to register Organizational Units,https://aws.amazon.com/about-aws/whats-new/2024/02/aws-control-tower-apis-register-organizational-units/,https://da.gd/q3ljX
AWS:WhatsNew,AWS Batch now supports private registry on ECS compute environments,https://aws.amazon.com/about-aws/whats-new/2024/02/aws-batch-private-registry-ecs-compute-environments/,https://da.gd/cgyFlI
AWS:WhatsNew,Amazon EC2 R6in and R6idn instances are now available in an additional region,https://aws.amazon.com/about-aws/whats-new/2024/02/amazon-ec2-r6in-r6idn-instances-additional-region/,https://da.gd/u7ys
AWS:WhatsNew,API Gateway now supports TLS 1.3,https://aws.amazon.com/about-aws/whats-new/2024/02/api-gateway-tls-1-3/,https://da.gd/HkXdQ1
AWS:WhatsNew,Amazon OpenSearch Ingestion is now available in 2 additional commercial regions,https://aws.amazon.com/about-aws/whats-new/2024/02/amazon-opensearch-ingestion-additional-commercial-regions/,https://da.gd/wWVri
AWS:WhatsNew,Amazon AppStream 2.0 adds support for session scripts and Audio Out on multi-session fleets,https://aws.amazon.com/about-aws/whats-new/2024/02/amazon-appstream-2-0-scripts-audio-out-multi-session-fleets/,https://da.gd/sVMIb
