feed,title,long_url,short_url
GN:S:C,Anti-methane vaccine could reduce the huge climate impact of cow burps - New Scientist,https://news.google.com/rss/articles/CBMidGh0dHBzOi8vd3d3Lm5ld3NjaWVudGlzdC5jb20vYXJ0aWNsZS8yNDQxNzMxLWFudGktbWV0aGFuZS12YWNjaW5lLWNvdWxkLXJlZHVjZS10aGUtaHVnZS1jbGltYXRlLWltcGFjdC1vZi1jb3ctYnVycHMv0gEA?oc=5,https://da.gd/7Vrm6
GN:S:C,"Boiling Point: Change change, the everything story - Los Angeles Times",https://news.google.com/rss/articles/CBMieGh0dHBzOi8vd3d3LmxhdGltZXMuY29tL2Vudmlyb25tZW50L25ld3NsZXR0ZXIvMjAyNC0wNy0zMC9ib2lsaW5nLXBvaW50LWNoYW5nZS1jaGFuZ2UtdGhlLWV2ZXJ5dGhpbmctc3RvcnktYm9pbGluZy1wb2ludNIBAA?oc=5,https://da.gd/EBKre
GN:S:C,How to Blunt the ‘New Climate Denial’ with Better Language - DeSmog,https://news.google.com/rss/articles/CBMiW2h0dHBzOi8vd3d3LmRlc21vZy5jb20vMjAyNC8wNy8yOS9ob3ctdG8tYmx1bnQtdGhlLW5ldy1jbGltYXRlLWRlbmlhbC13aXRoLWJldHRlci1sYW5ndWFnZS_SAQA?oc=5,https://da.gd/WyEc
GN:S:C,Reconsidering and rescaling climate change predictions for coral reefs - Nature,https://news.google.com/rss/articles/CBMiMmh0dHBzOi8vd3d3Lm5hdHVyZS5jb20vYXJ0aWNsZXMvczQxNTU4LTAyNC0wMjA3OS150gEA?oc=5,https://da.gd/SpxSG5
GN:S:C,Study uncovers key to delayed climate recovery following mass extinction event - Phys,https://news.google.com/rss/articles/CBMiSGh0dHBzOi8vcGh5cy5vcmcvbmV3cy8yMDI0LTA3LXVuY292ZXJzLWtleS1kZWxheWVkLWNsaW1hdGUtcmVjb3ZlcnkuaHRtbNIBAA?oc=5,https://da.gd/4M9JRk
GN:S:C,GUEST COLUMN: A student's view on climate change in the Rogue Valley - Rogue Valley Times,https://news.google.com/rss/articles/CBMilQFodHRwczovL3d3dy5ydi10aW1lcy5jb20vb3Bpbmlvbi9ndWVzdC1jb2x1bW4tYS1zdHVkZW50cy12aWV3LW9uLWNsaW1hdGUtY2hhbmdlLWluLXRoZS1yb2d1ZS12YWxsZXkvYXJ0aWNsZV8xYzBlMzhjYS00Yjc4LTExZWYtYTQ2Yy1jYjRjYTEwYzQwZTAuaHRtbNIBAA?oc=5,https://da.gd/aZDZ1
GN:S:C,Should Companies Get Paid When Governments Phase Out Fossil Fuels? They Already Are - InsideClimate News,https://news.google.com/rss/articles/CBMibWh0dHBzOi8vaW5zaWRlY2xpbWF0ZW5ld3Mub3JnL25ld3MvMjgwNzIwMjQvY2FzaGluZy1vdXQtZm9zc2lsLWZ1ZWwtaW5kdXN0cnktZm9yY2VzLXBheW91dHMtZnJvbS1nb3Zlcm5tZW50cy_SAQA?oc=5,https://da.gd/F6nMtV
