feed,title,long_url,short_url
ArXiv,Background Knowledge in Schema Matching: Strategy vs. Data,https://arxiv.org/abs/2107.00001v1,
ArXiv,Stochastic Performance Modeling for Practical Byzantine Fault Tolerance Consensus in Blockchain,https://arxiv.org/abs/2107.00183v1,
ArXiv,"A Survey on Federated Learning Systems: Vision, Hype and Reality for Data Privacy and Protection",https://arxiv.org/abs/1907.09693v6,
ArXiv,Efficient Trajectory Compression and Range Query Processing,https://arxiv.org/abs/2007.04503v6,
ArXiv,Proof of Reference(PoR): A unified informetrics based consensus mechanism,https://arxiv.org/abs/2107.00214v1,
ArXiv,MIDV-2020: A Comprehensive Benchmark Dataset for Identity Document Analysis,https://arxiv.org/abs/2107.00396v1,
ArXiv,Automatic Metadata Extraction Incorporating Visual Features from Scanned Electronic Theses and Dissertations,https://arxiv.org/abs/2107.00516v1,
ArXiv,POSNoise: An Effective Countermeasure Against Topic Biases in Authorship Analysis,https://arxiv.org/abs/2005.06605v2,
