feed,title,long_url,short_url
j:MDPI:N,Molecular Mechanism of Tocotrienol-Mediated Anticancer Properties: A Systematic Review of the Involvement of Endoplasmic Reticulum Stress and Unfolded Protein Response,https://mdpi.com/2072-6643/15/8/1854,
j:MDPI:N,The Relationship between the Dietary Inflammatory Index (DII) and Metabolic Syndrome (MetS) in Middle-Aged and Elderly Individuals in the United States,https://mdpi.com/2072-6643/15/8/1857,
j:MDPI:N,Human Milk Composition and Nutritional Status of Omnivore Human Milk Donors Compared with Vegetarian/Vegan Lactating Mothers,https://mdpi.com/2072-6643/15/8/1855,
j:MDPI:N,Optimal Serum 25(OH)D Levels and Vitamin D Intake in Korean Postmenopausal Women,https://mdpi.com/2072-6643/15/8/1856,
j:MDPI:N,Serum Appetite-Regulating Hormone Levels in Cystic Fibrosis Patients: Influence of the Disease Severity and the Type of Bacterial Infection—A Pilot Study,https://mdpi.com/2072-6643/15/8/1851,
j:MDPI:N,High-Dose Spermidine Supplementation Does Not Increase Spermidine Levels in Blood Plasma and Saliva of Healthy Adults: A Randomized Placebo-Controlled Pharmacokinetic and Metabolomic Study,https://mdpi.com/2072-6643/15/8/1852,
j:MDPI:N,Sarcopenia and Cognitive Decline in Older Adults: Targeting the Muscle–Brain Axis,https://mdpi.com/2072-6643/15/8/1853,
j:MDPI:N,Association of Body Mass Index with Insulin-like Growth Factor-1 Levels among 3227 Chinese Children Aged 2–18 Years,https://mdpi.com/2072-6643/15/8/1849,
j:MDPI:N,Emerging Roles of Gut Microbial Modulation of Bile Acid Composition in the Etiology of Cardiovascular Diseases,https://mdpi.com/2072-6643/15/8/1850,
j:MDPI:N,The Association between Vegan Dietary Patterns and Physical Activity—A Cross-Sectional Online Survey,https://mdpi.com/2072-6643/15/8/1847,
j:MDPI:N,Association of Oral or Intravenous Vitamin C Supplementation with Mortality: A Systematic Review and Meta-Analysis,https://mdpi.com/2072-6643/15/8/1848,
j:MDPI:N,Revisiting PINI Scoring in Light of Recent Biological Advances,https://mdpi.com/2072-6643/15/8/1846,
j:MDPI:N,2′-Fucosyllactose and 3-Fucosyllactose Alleviates Interleukin-6-Induced Barrier Dysfunction and Dextran Sodium Sulfate-Induced Colitis by Improving Intestinal Barrier Function and Modulating the Intestinal Microbiome,https://mdpi.com/2072-6643/15/8/1845,
j:MDPI:N,Adherence to Mediterranean Diet: A Population-Based Longitudinal Cohort Study,https://mdpi.com/2072-6643/15/8/1844,
