feed,title,long_url,short_url
j.mp/lc-ml-reviews,Split Computing and Early Exiting for Deep Learning Applications: Survey and Research Challenges (2021-2022) (eess.SP),http://arxiv.org/abs/2103.04505v4,
j.mp/lc-ml-reviews,Generalization bounds for learning under graph-dependence: A survey (2022) (cs.LG),http://arxiv.org/abs/2203.13534v1,
j.mp/lc-ml-reviews,A Comparative Survey of Deep Active Learning (2022) (cs.LG),http://arxiv.org/abs/2203.13450v1,
j.mp/lc-ml-reviews,From Distributed Machine Learning to Federated Learning: A Survey (2021-2022) (cs.DC),http://arxiv.org/abs/2104.14362v4,
j.mp/lc-ml-reviews,Shoring Up the Foundations: Fusing Model Embeddings and Weak Supervision (2022) (stat.ML),http://arxiv.org/abs/2203.13270v1,
