feed,title,long_url,short_url
GN:T:SP,Community solar proposal getting bipartisan support in legislature - StateImpact Pennsylvania,https://stateimpact.npr.org/pennsylvania/2020/09/02/community-solar-proposal-getting-bipartisan-support-in-legislature/,
GN:T:SP,Alabama Public Service Commission Upholds and Increases 'Sun Tax' on Solar Power Users - InsideClimate News,https://insideclimatenews.org/news/01092020/alabama-public-service-commission-solar-sun-tax,
GN:T:SP,Sonnedix gets okay to move on with 192-MWp PV project in Chile - Renewables Now,https://renewablesnow.com/news/sonnedix-gets-okay-to-move-on-with-192-mwp-pv-project-in-chile-712082/,
GN:T:SP,New Jersey farmers fear big solar arrays will cause thousands of acres of prime land to vanish - The Philadelphia Inquirer,https://www.inquirer.com/science/climate/new-jersey-farmland-preservation-events-solar-renewables-climate-change-20200902.html,
GN:T:SP,Global Hop Supplier Installs Largest Solar Array in State of Washington - CleanTechnica,https://cleantechnica.com/2020/08/31/global-hop-supplier-installs-largest-solar-array-in-state-of-washington/,
GN:T:SP,Adani Green rallies 10% on becoming largest solar power generation company - Economic Times,https://economictimes.indiatimes.com/markets/stocks/news/adani-green-rallies-10-on-becoming-largest-solar-power-generation-company/articleshow/77885043.cms,
GN:T:SP,NAIF backs 10MW solar and battery plant in Northern Territory - RenewEconomy,https://reneweconomy.com.au/naif-backs-10mw-solar-and-battery-plant-in-northern-territory-81981/,
