feed,title,long_url,short_url
Medium,This AI newsletter is all you need #21,https://medium.com/p/39511c79dfcd,
Medium,Best tools for social listening,https://medium.com/p/9f6840638f6e,
Medium,How AI Images Are Created,https://medium.com/p/75a15e140174,
Medium,Product Name Classifier — Build a ML model from scratch,https://medium.com/p/58ae8228e86f,
Medium,Recapping the Computer Vision Meetup — November 2022,https://medium.com/p/a2392afd7366,
Medium,Video: Accelerate Transformer inference with Optimum and Intel OpenVINO,https://medium.com/p/f71e4cf9a83e,
Medium,Time Series Forecasting: ARIMA Model,https://medium.com/p/64bb9bc6c47b,
Medium,Time Series Forecasting: SARIMAX Model,https://medium.com/p/655ce0416c67,
Medium,Model Evaluation And Improvement,https://medium.com/p/7dbdd1e7fc5d,
