feed,title,long_url,short_url
GN:T:ML,Analyzing microstructure relationships in porous copper using a multi-method machine learning-based approach | Communications Materials - Nature,https://news.google.com/rss/articles/CBMiMmh0dHBzOi8vd3d3Lm5hdHVyZS5jb20vYXJ0aWNsZXMvczQzMjQ2LTAyNC0wMDQ5My010gEA?oc=5,https://da.gd/YSbyj2
GN:T:ML,Predicting FFAR4 agonists using structure-based machine learning approach based on molecular fingerprints | Scientific Reports - Nature,https://news.google.com/rss/articles/CBMiMmh0dHBzOi8vd3d3Lm5hdHVyZS5jb20vYXJ0aWNsZXMvczQxNTk4LTAyNC02MDA1Ni160gEA?oc=5,https://da.gd/HbWza
GN:T:ML,Is artificial intelligence combat ready? - Washington Technology,https://news.google.com/rss/articles/CBMiYWh0dHBzOi8vd3d3Lndhc2hpbmd0b250ZWNobm9sb2d5LmNvbS9vcGluaW9uLzIwMjQvMDQvYXJ0aWZpY2lhbC1pbnRlbGxpZ2VuY2UtY29tYmF0LXJlYWR5LzM5NjAwNS_SAQA?oc=5,https://da.gd/b9KT
GN:T:ML,Near-Term Machine Learning Use Cases for Hospitality - Hospitality Net,https://news.google.com/rss/articles/CBMiN2h0dHBzOi8vd3d3Lmhvc3BpdGFsaXR5bmV0Lm9yZy92aWV3cG9pbnQvMTI1MDAwMjE1Lmh0bWzSAQA?oc=5,https://da.gd/ZU7BI
GN:T:ML,An Overview of Advancements in Deep Reinforcement Learning (Deep RL) - MarkTechPost,https://news.google.com/rss/articles/CBMia2h0dHBzOi8vd3d3Lm1hcmt0ZWNocG9zdC5jb20vMjAyNC8wNC8yNC9hbi1vdmVydmlldy1vZi1hZHZhbmNlbWVudHMtaW4tZGVlcC1yZWluZm9yY2VtZW50LWxlYXJuaW5nLWRlZXAtcmwv0gFvaHR0cHM6Ly93d3cubWFya3RlY2hwb3N0LmNvbS8yMDI0LzA0LzI0L2FuLW92ZXJ2aWV3LW9mLWFkdmFuY2VtZW50cy1pbi1kZWVwLXJlaW5mb3JjZW1lbnQtbGVhcm5pbmctZGVlcC1ybC8_YW1w?oc=5,https://da.gd/HyhH5q
