feed,title,long_url,short_url
ArXiv,Reusable Templates and Guides For Documenting Datasets and Models for Natural Language Processing and Generation: A Case Study of the HuggingFace and GEM Data and Model Cards,https://arxiv.org/abs/2108.07374v1,
ArXiv,Computing and Maintaining Provenance of Query Result Probabilities in Uncertain Knowledge Graphs,https://arxiv.org/abs/2108.07758v1,
ArXiv,AnonTokens: tracing re-identification attacks through decoy records,https://arxiv.org/abs/1906.09829v1,
ArXiv,ACM-CR: A Manually Annotated Test Collection for Citation Recommendation,https://arxiv.org/abs/2108.07571v1,
ArXiv,On the social and cognitive dimensions of wicked environmental problems characterized by conceptual and solution uncertainty,https://arxiv.org/abs/2104.10279v2,
