feed,title,long_url,short_url
MedRxiv,The impact of the initial and 2nd national COVID-19 lockdown on mental health in young people with and without pre-existing depressive symptoms,https://medrxiv.org/cgi/content/short/2021.11.03.21265861v1?rss=1,https://j.mp/3mKGUzH
MedRxiv,REACT-1 round 15 interim report: High and rising prevalence of SARS-CoV-2 infection in England from end of September 2021 followed by a fall in late October 2021,https://medrxiv.org/cgi/content/short/2021.11.03.21265877v1?rss=1,https://j.mp/3mDPikh
MedRxiv,"Investigating the relationship between interventions, contact patterns, and SARS-CoV-2 transmissibility",https://medrxiv.org/cgi/content/short/2021.11.03.21265876v1?rss=1,https://j.mp/2ZNc9Rt
MedRxiv,Hypothyroidism does not lead to worse prognosis in COVID-19: findings from the Brazilian COVID-19 registry,https://medrxiv.org/cgi/content/short/2021.11.03.21265685v1?rss=1,https://j.mp/3k6WgMW
MedRxiv,Waning of the Humoral Response to SARS-CoV-2 in Pregnancy is Variant-Dependent,https://medrxiv.org/cgi/content/short/2021.11.03.21265478v1?rss=1,https://j.mp/3BIVoEc
