feed,title,long_url,short_url
GN:S:C,Sand-sized fossils hold secrets to the history of climate change - The Conversation,https://news.google.com/rss/articles/CBMioAFBVV95cUxOZmFqUU1UZkhESkRIdFVReS12dllTZG9VdjRqYUQzRThkbkNJN2V4VERjRFM4anZLal9FdHhmRHU3NVJ0clUwelBIbWxSbmxYRjFRUE83YndPWXpaWlAyRmJacFNra29pc0JnUVBmc19LVHJYXzZiSzVHTkQyenFFclFsNGU2WjVJY0wtYko1cU1OSFUzeDNxM3dmcXUzaG1m?oc=5,https://da.gd/9R6TDb
GN:S:C,Research Tools: ERA Explorer App: Global Climate Data Made Accessible to All - LJ INFOdocket,https://news.google.com/rss/articles/CBMiswFBVV95cUxNUzVsQUJHQkRQUm80aWZIenk1MWdOY0Q4VUdfRm1HX2ZQek5RX3QtWnVGMGhkSXpGSWxndjZXOWItbEJwMDB3bjA5QmNvQkx4VThBOU5SeXdmX0ljbHdLeFFTa2psQnRQTjdQQzJ6WXpiUXZOOEVFcm5RNkUzSDB1MW8wa2p4Qk12aXdtbmJwX1I3dlVGNkFTbHJ0SXFiTjA5OG1wTm9hXzhvMk00bF9CRnFVdw?oc=5,https://da.gd/Lbbb
GN:S:C,Early warning of complex climate risk with integrated artificial intelligence - Nature,https://news.google.com/rss/articles/CBMiX0FVX3lxTE91dEpaVG5HOGlHRkk0dUtlTVZhdTcxYXlTSkMtVUhrN0ZZMzB0anlyWmFFNHZJbXZwVjFQMy10SHBqQ1FnZFlZSEMxVHVVVV93S3h3cWR0UGpJNy02VWx3?oc=5,https://da.gd/j1mT2
GN:S:C,What the nation is now doing on climate instead of science - Star Tribune,https://news.google.com/rss/articles/CBMinAFBVV95cUxOV095WE4tTGdhWTN3dmplSjI2NGZPNnpiZHBNaS1IRDFlUEc1dGVfRS01ejJsQTNKNjhJUVowV2kyVFNfeG9HTFpfTHdFREREUmkxVGU0aklnWHhmNjQxWDVDVHVsbFNSQ1FtdjcyYzZKMkhodkU2LTZQbGpTUGx2aXkyZ3ZSc3JoXzIwcjQxT2hYX1ZIQ1Vxc05temE?oc=5,https://da.gd/GKN7y
GN:S:C,Church World Service partners gather in Cleveland to collaborate on disaster relief in changing political climate - United Church of Christ,https://news.google.com/rss/articles/CBMizwFBVV95cUxNdlhzYnRtbkNxcGR3bDlLYm8teFllMmhLTkpVVmc3MXgtRUdUdV8xTjhteGhCaEdnRWZkWU4wVU5JejhQVEdjZkhzNUVCVktVSU4wSWtFeWIwNFpaMTdOTlNDaFdYMnlBM2R1RlpSaldpc0VQSnZjQ2w0a21RT2NZTHowdDRyYjBqQ2RybzZTLXJVVzZKMFdIajFXVmxSLWhadUFqZVhsRU42SEsxMDRiVkxxRGRUQ2UwNzVhZi1DNnpxeC1FMWliWTFkNFFnVWM?oc=5,https://da.gd/CA9REV
GN:S:C,UN Cuts Down Part of Amazon Rainforest to Make Way for Climate Summit - Turning Point USA,https://news.google.com/rss/articles/CBMinAFBVV95cUxOb2p1bmhJUHpDaDhrSHBjb3M2aWlCT29QSG9sb3JmVDlydmJfRVYybmxiZUw4SGJKWEhHLTVwNUxDekVrZWttcVo1aEtSa1dfckhPX29kN0hkRmNHT0lpTlBWMndwc2tUZ2xGNW1ET1NVdlNRLXBtMEhiREoxbDNDLXhJVS1IYnRUZlFTbDVVekJqWFFCZnhrUTdOaVI?oc=5,https://da.gd/FO4i
