feed,title,long_url,short_url
MX,"Wind phones help the bereaved deal with death, loss and grief—a clinical social worker explains",https://medicalxpress.com/news/2024-09-bereaved-death-loss-grief-clinical.html,https://da.gd/8lnRIw
MX,"Australia spends about $140 per person on public health measures, but it's hard to know exactly what they are",https://medicalxpress.com/news/2024-09-australia-person-health-hard.html,https://da.gd/UgAYCi
MX,Researchers 'turbocharge' vaccine delivery by jolting 'bystander' immune cells into action in animal models,https://medicalxpress.com/news/2024-09-turbocharge-vaccine-delivery-jolting-bystander.html,https://da.gd/25x9Q
MX,Social media posts may provide early warning of PTSD problems,https://medicalxpress.com/news/2024-09-social-media-early-ptsd-problems.html,https://da.gd/OMvnp
MX,Study sheds new light on immune dysfunction in children with severe infections and inflammatory diseases,https://medicalxpress.com/news/2024-09-immune-dysfunction-children-severe-infections.html,https://da.gd/mXWY0J
MX,Expert discusses mosquito-borne diseases and prevention measures,https://medicalxpress.com/news/2024-09-expert-discusses-mosquito-borne-diseases.html,https://da.gd/n33F
MX,Innovative model using CRISPR provides valuable insights into prostate cancer spread,https://medicalxpress.com/news/2024-09-crispr-valuable-insights-prostate-cancer.html,https://da.gd/8uDlq
