feed,title,long_url,short_url
SSRN,"Internet Use, eHealth Literacy and Fear of COVID-19 among Nursing Students in the Philippines",https://papers.ssrn.com/sol3/papers.cfm?abstract_id=3762848,
SSRN,The Mutual Constraints of States and Global Value Chains during COVID-19: The Case of Personal Protective Equipment,https://papers.ssrn.com/sol3/papers.cfm?abstract_id=3763218,
SSRN,Information Processing Skills of Short Sellers: Empirical Evidence from the COVID-19 Pandemic,https://papers.ssrn.com/sol3/papers.cfm?abstract_id=3763198,
SSRN,Development of Digitalization Mechanism of Institute of Financial Ombudsman on Example of Ukraine,https://papers.ssrn.com/sol3/papers.cfm?abstract_id=3763196,
SSRN,Türk Bankacılık Sektöründe Kovid-19 Döneminde Alınan Tedbirler Bağlamında Aktif Rasyosu Düzenlemesinin Muhtemel Etkileri: Mevduat Bankaları Üzerine Bir İnceleme (Possible Effects of Asset Ratio Regulation in the Context of Measures Taken in the COVID-19 Period in the Turkish Banking Sector: An Examination upon Deposit Banks),https://papers.ssrn.com/sol3/papers.cfm?abstract_id=3763186,
SSRN,Theoretical and Practical Modeling Innovation and Trends Developement in the Competitiveness of the Market of Tourist Services: Regional Aspect,https://papers.ssrn.com/sol3/papers.cfm?abstract_id=3763174,
SSRN,Compulsory COVID-19 Vaccination,https://papers.ssrn.com/sol3/papers.cfm?abstract_id=3761720,
SSRN,Restructuring Tourism Industry in the after month of Corona (COVID-19) Pandemic: Sri Lankan Perspective,https://papers.ssrn.com/sol3/papers.cfm?abstract_id=3763116,
SSRN,"International Trade in the Age of Turbulent Uncertainty, Globalization, Regionalization and Pandemic",https://papers.ssrn.com/sol3/papers.cfm?abstract_id=3763101,
SSRN,The Growth and Development Analytical Controversies in Economic Science: A Reassessment for the Post-COVID-19 Era,https://papers.ssrn.com/sol3/papers.cfm?abstract_id=3763038,
SSRN,"Exploring Economic Populism, a Neglected, but Growing, Phenomenon",https://papers.ssrn.com/sol3/papers.cfm?abstract_id=3758349,
SSRN,The Economics of Crisis Innovation Policy: A Historical Perspective,https://papers.ssrn.com/sol3/papers.cfm?abstract_id=3762862,
SSRN,A Decision Support System for Prioritised COVID-19 Two-dosage Vaccination Allocation and Distribution,https://papers.ssrn.com/sol3/papers.cfm?abstract_id=3762826,
SSRN,Social Volatility and Temporal Foci as Accelerators of Economic Trends,https://papers.ssrn.com/sol3/papers.cfm?abstract_id=3762722,
SSRN,Heterodox Economic Cycles Theories,https://papers.ssrn.com/sol3/papers.cfm?abstract_id=3762704,
SSRN,"Job Destruction, Unemployment, and Unemployment Insurance Benefits: Evidence from the Outbreak of COVID-19 across US Counties",https://papers.ssrn.com/sol3/papers.cfm?abstract_id=3762663,
SSRN,Indian Education in Pandemic COVID-19,https://papers.ssrn.com/sol3/papers.cfm?abstract_id=3762907,
SSRN,Could the United States Benefit from a Lockdown? A Cost-Benefit Analysis,https://papers.ssrn.com/sol3/papers.cfm?abstract_id=3764250,
SSRN,Life Admin When Life Turns Upside Down: A Book Review (Of Sorts),https://papers.ssrn.com/sol3/papers.cfm?abstract_id=3762654,
SSRN,COVID-19 Effects on the Canadian Term Structure of Interest Rates,https://papers.ssrn.com/sol3/papers.cfm?abstract_id=3762628,
SSRN,Parenthood and Politics in the Era of COVID-19,https://papers.ssrn.com/sol3/papers.cfm?abstract_id=3762600,
SSRN,ODR and Mediation,https://papers.ssrn.com/sol3/papers.cfm?abstract_id=3762593,
SSRN,Emerging Market Economy Exchange Rates and Local Currency Bond Markets Amid the COVID-19 Pandemic,https://papers.ssrn.com/sol3/papers.cfm?abstract_id=3761875,
SSRN,Leverage and Margin Spirals in Fixed Income Markets during the COVID-19 Crisis,https://papers.ssrn.com/sol3/papers.cfm?abstract_id=3761873,
SSRN,"COVID-19 Crisis, Bankruptcy Risk, and Transition Dynamics",https://papers.ssrn.com/sol3/papers.cfm?abstract_id=3762494,
