feed,title,long_url,short_url
GN:S:GW,"Earth sees third straight hottest day on record, though it's unofficial: ""Brutally hot"" - CBS News",https://news.google.com/rss/articles/CBMiP2h0dHBzOi8vd3d3LmNic25ld3MuY29tL25ld3MvZWFydGgtaG90dGVzdC1kYXlzLXRoaXJkLXN0cmFpZ2h0L9IBQ2h0dHBzOi8vd3d3LmNic25ld3MuY29tL2FtcC9uZXdzL2VhcnRoLWhvdHRlc3QtZGF5cy10aGlyZC1zdHJhaWdodC8?oc=5,https://da.gd/zwEdw
GN:S:GW,Earth's average temperature matches record high set a day earlier - Yahoo News,https://news.google.com/rss/articles/CBMiQWh0dHBzOi8vbmV3cy55YWhvby5jb20vdGhpcmQtZGF5LWhvdHRlc3QtZGF5LWVhcnRoLTA1NTM0NDYyNi5odG1s0gFJaHR0cHM6Ly9uZXdzLnlhaG9vLmNvbS9hbXBodG1sL3RoaXJkLWRheS1ob3R0ZXN0LWRheS1lYXJ0aC0wNTUzNDQ2MjYuaHRtbA?oc=5,https://da.gd/6bXwc
GN:S:GW,Cornwall beaches study gives clues to climate change impact - BBC,https://news.google.com/rss/articles/CBMiLmh0dHBzOi8vd3d3LmJiYy5jb20vbmV3cy9hcnRpY2xlcy9jcTVxNW43MDRyZ2_SATJodHRwczovL3d3dy5iYmMuY29tL25ld3MvYXJ0aWNsZXMvY3E1cTVuNzA0cmdvLmFtcA?oc=5,https://da.gd/wZsYVV
GN:S:GW,Why Are So Many Climate Records Breaking All At Once? - IFLScience,https://news.google.com/rss/articles/CBMiVWh0dHBzOi8vd3d3LmlmbHNjaWVuY2UuY29tL3doeS1hcmUtc28tbWFueS1jbGltYXRlLXJlY29yZHMtYnJlYWtpbmctYWxsLWF0LW9uY2UtNjk2OTPSAQA?oc=5,https://da.gd/cnmPq
GN:S:GW,Global warming could reduce European flax harvest by a third this ... - FashionNetwork,https://news.google.com/rss/articles/CBMidmh0dHBzOi8vd3cuZmFzaGlvbm5ldHdvcmsuY29tL25ld3MvR2xvYmFsLXdhcm1pbmctY291bGQtcmVkdWNlLWV1cm9wZWFuLWZsYXgtaGFydmVzdC1ieS1hLXRoaXJkLXRoaXMteWVhciwxNTMzNzA3Lmh0bWzSAQA?oc=5,https://da.gd/iwkM
GN:S:GW,Cornwall beaches study gives clues to climate change impact - BBC,https://news.google.com/rss/articles/CBMiMGh0dHBzOi8vd3d3LmJiYy5jby51ay9uZXdzL2FydGljbGVzL2NxNXE1bjcwNHJnb9IBNGh0dHBzOi8vd3d3LmJiYy5jby51ay9uZXdzL2FydGljbGVzL2NxNXE1bjcwNHJnby5hbXA?oc=5,https://da.gd/tqHALj
