feed,title,long_url,short_url
GN:T:CC,Greta Thunberg charged with disobeying police orders during a protest in Sweden - CNN,https://news.google.com/rss/articles/CBMiW2h0dHBzOi8vd3d3LmNubi5jb20vMjAyMy8wNy8wNi9ldXJvcGUvZ3JldGEtdGh1bmJlcmctY2hhcmdlZC1zd2VkZW4tY2xpbWF0ZS1pbnRsL2luZGV4Lmh0bWzSAV9odHRwczovL2FtcC5jbm4uY29tL2Nubi8yMDIzLzA3LzA2L2V1cm9wZS9ncmV0YS10aHVuYmVyZy1jaGFyZ2VkLXN3ZWRlbi1jbGltYXRlLWludGwvaW5kZXguaHRtbA?oc=5,https://da.gd/dgCCk9
GN:T:CC,Is China really leading the clean energy revolution? Not exactly - The Guardian,https://news.google.com/rss/articles/CBMiXmh0dHBzOi8vd3d3LnRoZWd1YXJkaWFuLmNvbS9jb21tZW50aXNmcmVlLzIwMjMvanVsLzA2L2NoaW5hLWNsZWFuLWVuZXJneS1yZXZvbHV0aW9uLWNvYWwtcG93ZXLSAV5odHRwczovL2FtcC50aGVndWFyZGlhbi5jb20vY29tbWVudGlzZnJlZS8yMDIzL2p1bC8wNi9jaGluYS1jbGVhbi1lbmVyZ3ktcmV2b2x1dGlvbi1jb2FsLXBvd2Vy?oc=5,https://da.gd/2Sz1bK
GN:T:CC,British Billionaire Ratcliffe Slams UK Energy Policy as - Bloomberg,https://news.google.com/rss/articles/CBMiamh0dHBzOi8vd3d3LmJsb29tYmVyZy5jb20vbmV3cy9hcnRpY2xlcy8yMDIzLTA3LTA2L2JyaXRpc2gtYmlsbGlvbmFpcmUtcmF0Y2xpZmZlLXNsYW1zLXVrLWVuZXJneS1wb2xpY3ktYXPSAQA?oc=5,https://da.gd/v5ecuz
GN:T:CC,Last month was the planet's hottest June on record by a huge margin - CNN,https://news.google.com/rss/articles/CBMiUmh0dHBzOi8vd3d3LmNubi5jb20vMjAyMy8wNy8wNi93b3JsZC93YXJtZXN0LWp1bmUtZ2xvYmFsLXJlY29yZC1jbGltYXRlL2luZGV4Lmh0bWzSAQA?oc=5,https://da.gd/Gtor8
GN:T:CC,Climate change is turning Hawaii into a giant cesspool—literally - Fortune,https://news.google.com/rss/articles/CBMiYGh0dHBzOi8vZm9ydHVuZS5jb20vMjAyMy8wNy8wNi9jbGltYXRlLWNoYW5nZS1pcy10dXJuaW5nLWhhd2FpaS1pbnRvLWEtZ2lhbnQtY2Vzc3Bvb2wtbGl0ZXJhbGx5L9IBZGh0dHBzOi8vZm9ydHVuZS5jb20vMjAyMy8wNy8wNi9jbGltYXRlLWNoYW5nZS1pcy10dXJuaW5nLWhhd2FpaS1pbnRvLWEtZ2lhbnQtY2Vzc3Bvb2wtbGl0ZXJhbGx5L2FtcC8?oc=5,https://da.gd/Jc817T
GN:T:CC,What to Know About Climate Change and Looming UPS Strike - TIME,https://news.google.com/rss/articles/CBMiM2h0dHBzOi8vdGltZS5jb20vNjI5MjI0NC91cHMtc3RyaWtlLWNsaW1hdGUtY2hhbmdlL9IBAA?oc=5,https://da.gd/0e1d
GN:T:CC,"El Niño is officially here and may cause temperature spikes and major weather events, scientists warn - Space",https://news.google.com/rss/articles/CBMiRGh0dHBzOi8vd3d3LnNwYWNlLmNvbS9lbC1uaW5vLTIwMjMtdGVtcGVyYXR1cmUtc3Bpa2VzLXdlYXRoZXItZXZlbnRz0gEA?oc=5,https://da.gd/rbVZS5
