feed,title,long_url,short_url
RS,Explainable Machine Learning Model for Predicting Early Neurological Deterioration in Patients with Acute Ischemic Stroke,https://www.researchsquare.com/article/rs-9044703/latest,
RS,Prediction of Drill-Tip Position During Cortical Bone Drilling Using Force and Torque Signals with a Deep Learning Model,https://www.researchsquare.com/article/rs-8923025/latest,
RS,Weather State Ants Optimizer (WSAO): A Novel Dynamic Variable Structure Metaheuristic Algorithm Incorporating Markov Processes,https://www.researchsquare.com/article/rs-8958426/latest,
RS,Personalized Travel Route Recommendation Using a Hybrid PSO–ACO Algorithm,https://www.researchsquare.com/article/rs-8561558/latest,
RS,Psychological Drivers of Organizational Ambidexterity: Evidence from Agentic Artificial Intelligence Supported Fuzzy Decision Modeling,https://www.researchsquare.com/article/rs-8653058/latest,
RS,Why Artificial Intelligence Cannot Possess Ethics,https://www.researchsquare.com/article/rs-8838508/latest,
RS,Spatial interaction effects of population mobility on the development of urban artificial intelligence industries: A multidimensional test based on the spatial Durbin model,https://www.researchsquare.com/article/rs-9135522/latest,
RS,The Silent Costs of Digital Transformation in Education: Redistribution of Responsibility and Digital Inequality,https://www.researchsquare.com/article/rs-9055455/latest,
RS,Intelligent QoS Optimization in 5G and 6G Networks Using Reinforcement Learning and Shannon Capacity,https://www.researchsquare.com/article/rs-9060436/latest,
