feed,title,long_url,short_url
GN:T:WP,"Dept. of Education Opens Investigation Into Harvard's Donor, Legacy Admissions Preferences | News - Harvard Crimson",https://news.google.com/rss/articles/CBMiV2h0dHBzOi8vd3d3LnRoZWNyaW1zb24uY29tL2FydGljbGUvMjAyMy83LzI2L2RvZS1pbnZlc3RpZ2F0aW9uLWRvbm9yLWxlZ2FjeS1hZG1pc3Npb25zL9IBAA?oc=5,https://da.gd/bYYq
GN:T:WP,Renewables could crisis-proof Europe's small and medium businesses - Euronews,https://news.google.com/rss/articles/CBMiamh0dHBzOi8vd3d3LmV1cm9uZXdzLmNvbS8yMDIzLzA3LzI1L3JlbmV3YWJsZXMtY291bGQtbWFrZS1ldXJvcGVzLXNtYWxsLWFuZC1tZWRpdW0tYnVzaW5lc3Nlcy1jcmlzaXMtcHJvb2bSAQA?oc=5,https://da.gd/otqbNa
GN:T:WP,"Wind-driven Newell Road Fire explodes in Washington as it threatens homes, gas pipeline - Fox Weather",https://news.google.com/rss/articles/CBMiT2h0dHBzOi8vd3d3LmZveHdlYXRoZXIuY29tL3dlYXRoZXItbmV3cy9uZXdlbGwtcm9hZC1maXJlLXdhc2hpbmd0b24tY29udGFpbm1lbnTSAVNodHRwczovL3d3dy5mb3h3ZWF0aGVyLmNvbS93ZWF0aGVyLW5ld3MvbmV3ZWxsLXJvYWQtZmlyZS13YXNoaW5ndG9uLWNvbnRhaW5tZW50LmFtcA?oc=5,https://da.gd/G77ASL
GN:T:WP,"Oil Prices Eye Gasoline Inventory Draws, Ignore Crude Build - OilPrice",https://news.google.com/rss/articles/CBMicmh0dHBzOi8vb2lscHJpY2UuY29tL0xhdGVzdC1FbmVyZ3ktTmV3cy9Xb3JsZC1OZXdzL09pbC1QcmljZXMtRXllLUdhc29saW5lLUludmVudG9yeS1EcmF3cy1JZ25vcmUtQ3J1ZGUtQnVpbGQuaHRtbNIBdmh0dHBzOi8vb2lscHJpY2UuY29tL0xhdGVzdC1FbmVyZ3ktTmV3cy9Xb3JsZC1OZXdzL09pbC1QcmljZXMtRXllLUdhc29saW5lLUludmVudG9yeS1EcmF3cy1JZ25vcmUtQ3J1ZGUtQnVpbGQuYW1wLmh0bWw?oc=5,https://da.gd/M7IH
GN:T:WP,‘We hit the biggest guy in the room’ - The New Bedford Light,https://news.google.com/rss/articles/CBMiP2h0dHBzOi8vbmV3YmVkZm9yZGxpZ2h0Lm9yZy93ZS1oaXQtdGhlLWJpZ2dlc3QtZ3V5LWluLXRoZS1yb29tL9IBAA?oc=5,https://da.gd/djRl
GN:T:WP,EJET Electric Tender Resets The High Performance Bar - CleanTechnica,https://news.google.com/rss/articles/CBMiWmh0dHBzOi8vY2xlYW50ZWNobmljYS5jb20vMjAyMy8wNy8yNC9lamV0LWVsZWN0cmljLXRlbmRlci1yZXNldHMtdGhlLWhpZ2gtcGVyZm9ybWFuY2UtYmFyL9IBXmh0dHBzOi8vY2xlYW50ZWNobmljYS5jb20vMjAyMy8wNy8yNC9lamV0LWVsZWN0cmljLXRlbmRlci1yZXNldHMtdGhlLWhpZ2gtcGVyZm9ybWFuY2UtYmFyL2FtcC8?oc=5,https://da.gd/qo5jC
GN:T:WP,'Flawed Push' to Keep California Nuclear Plant Open Could Cost Customers $45 Billion - Common Dreams,https://news.google.com/rss/articles/CBMiRmh0dHBzOi8vd3d3LmNvbW1vbmRyZWFtcy5vcmcvbmV3cy9kaWFibG8tY2FueW9uLXBvd2VyLXBsYW50LTI2NjIzNDM4OTTSAQA?oc=5,https://da.gd/P8H2j
