feed,title,long_url,short_url
MX,AI analysis finds no clear brain-structure link to navigation in young adults,https://medicalxpress.com/news/2026-03-ai-analysis-brain-link-young.html,
MX,Experts urge age-tailored sleep apnea strategies for seniors,https://medicalxpress.com/news/2026-03-experts-urge-age-tailored-apnea.html,
MX,"Tracking mysteries of loss of Y chromosome, cancer",https://medicalxpress.com/news/2026-03-tracking-mysteries-loss-chromosome-cancer.html,
MX,"No matter your age, don't ignore these colorectal cancer symptoms, surgeons say",https://medicalxpress.com/news/2026-03-age-dont-colorectal-cancer-symptoms.html,
MX,Smart patch detects allergies before symptoms strike,https://medicalxpress.com/news/2026-03-smart-patch-allergies-symptoms.html,
MX,Growth hormone receptor could serve as possible target for improving lung cancer treatment,https://medicalxpress.com/news/2026-03-growth-hormone-receptor-lung-cancer.html,
MX,"Asthma LABA medications do not increase severity of food allergy reactions during oral food challenges, study suggests",https://medicalxpress.com/news/2026-03-asthma-laba-medications-severity-food.html,
MX,FDA to offer cash bonuses for faster drug reviews,https://medicalxpress.com/news/2026-03-fda-cash-bonuses-faster-drug.html,
MX,Where are the doctors? Patients leading the conversation on TikTok about hidradenitis suppurativa in skin of color,https://medicalxpress.com/news/2026-03-doctors-patients-conversation-tiktok-hidradenitis.html,
MX,New drug could boost efforts to wipe out sleeping sickness,https://medicalxpress.com/news/2026-03-drug-boost-efforts-sickness.html,
MX,Babies exposed to poverty show delays in motor development as early as six months,https://medicalxpress.com/news/2026-03-babies-exposed-poverty-delays-motor.html,
MX,Supposedly harmless peptide may be linked to Alzheimer's disease,https://medicalxpress.com/news/2026-03-harmless-peptide-linked-alzheimer-disease.html,
