feed,title,long_url,short_url
GN:T:WP,Virginia wind farm job claims questioned by state regulators - WOWK 13 News,https://www.wowktv.com/news/u-s-world/virginia-wind-farm-job-claims-questioned-by-state-regulators/,
GN:T:WP,Duke Energy to present several carbon-cutting paths to North Carolina regulators - Charlotte Business Journal - The Business Journals,https://www.bizjournals.com/charlotte/news/2022/04/27/duke-energy-will-include-wind-and-possibly-small-n.html,
GN:T:WP,SSE and Brookfield to bid for Dutch offshore wind farm zone - Power Technology,https://www.power-technology.com/news/sse-brookfield-dutch-offshore/,
GN:T:WP,General Electric Earnings: The 10% Drop Is An Overreaction - Seeking Alpha,https://seekingalpha.com/article/4503881-general-electric-q1-earnings-ge-stock-drop-overreaction,
GN:T:WP,Quebec publishes draft documents for 1.3 GW tender – pv magazine International - pv magazine International,https://www.pv-magazine.com/2022/04/27/quebec-publishes-draft-documents-for-1-3-gw-tender/,
GN:T:WP,Wind Will Power A New Energy Future For Saint John - Huddle Today,https://huddle.today/2022/04/27/wind-will-power-a-new-energy-future-for-saint-john/,
GN:T:WP,Octopus fund acquires minority stake in 270MW Lincs - reNEWS,https://renews.biz/77444/octopus-fund-acquires-minority-stake-in-270mw-lincs/,
