feed,title,long_url,short_url
GN:T:WP,"Wind damage leaves thousands without power, trees on homes - RochesterFirst",https://www.rochesterfirst.com/news/local-news/wind-damage-leaves-thousands-without-power-trees-on-homes/,
GN:T:WP,Mich. Appeals Court Rules for Wind Turbines near Airport - RTO Insider,https://www.rtoinsider.com/articles/29707-mich-appeals-court-rules-wind-turbines-airport,
GN:T:WP,Thousands lose power in southern Ontario due to high winds - Ottawa,https://ottawa.citynews.ca/local-news/thousands-lose-power-southern-ontario-high-winds-5131298,
GN:T:WP,Collegiate Wind Team Works on New Tasks as the Competition Focus Shifts to Offshore Wind - CSUM - Cal Maritime,https://www.csum.edu/campus-news/2022/collegiate-wind-team-shifts-focus-to-offshore-wind.html,
GN:T:WP,Tesla Full Self Driving (FSD) — What Its Not So Good At - CleanTechnica,https://cleantechnica.com/2022/03/06/tesla-full-self-driving-fsd-what-its-not-so-good-at/,
