feed,title,long_url,short_url
j.mp/lc-ml-reviews,A Survey on Self-Evolution of Large Language Models (2024) (cs.CL),http://arxiv.org/abs/2404.14387v2,
j.mp/lc-ml-reviews,A survey on multi-player bandits (2022-2024) (stat.ML),http://arxiv.org/abs/2211.16275v2,
j.mp/lc-ml-reviews,Hierarchical Tree-structured Knowledge Graph For Academic Insight Survey (2024) (cs.DL),http://arxiv.org/abs/2402.04854v3,
j.mp/lc-ml-reviews,Review of deep learning models for crypto price prediction: implementation and evaluation (2024) (cs.LG),http://arxiv.org/abs/2405.11431v2,
j.mp/lc-ml-reviews,A tutorial on learning from preferences and choices with Gaussian Processes (2024) (cs.LG),http://arxiv.org/abs/2403.11782v4,
j.mp/lc-ml-reviews,"DMLR: Data-centric Machine Learning Research -- Past, Present and Future (2023-2024) (cs.LG)",http://arxiv.org/abs/2311.13028v2,
j.mp/lc-ml-reviews,A Systematic Survey of Blockchained Federated Learning (2021-2024) (cs.CR),http://arxiv.org/abs/2110.02182v2,
