feed,title,long_url,short_url
GN:T:SL,State report raises fresh alarms over sea-level rise - Press-Enterprise,https://www.pe.com/2021/08/27/state-report-raises-fresh-alarms-over-sea-level-rise/,
GN:T:SL,"Yes, the IPCC report was bad. But we can still salvage a livable planet. - Bulletin of the Atomic Scientists",https://thebulletin.org/2021/08/yes-the-ipcc-report-was-bad-but-we-can-still-salvage-a-livable-planet/,
GN:T:SL,"Safety concerns at Turkey Point are rising, along with the sea level | Opinion - South Florida Sun Sentinel",https://www.sun-sentinel.com/opinion/commentary/fl-op-com-invading-sea-turkey-point-20210827-eja46eabf5bwdcatlykmgavfqa-story.html,
GN:T:SL,"Yes, rising sea levels are threatening coastal areas across the US - CBS News 8",https://www.cbs8.com/article/news/verify/environment-verify/rising-sea-levels-united-states-coast/536-e0d7b201-5b16-4348-8299-57345a851bdc,
GN:T:SL,Glaciers on Turkey's highest mountain melting - english - Bianet,https://bianet.org/english/environment/249249-glaciers-on-turkey-s-highest-mountain-melting,
