feed,title,long_url,short_url
TDS,Five Technologies to Deploy Your Machine Learning Models,https://medium.com/p/bddaad69e0d4,
TDS,A Machine Learning Engineer’s Tutorial to Transfer Learning for Multi-class Image Segmentation…,https://medium.com/p/b34818caec6b,
TDS,Deep Learning for Land Cover Classification of Satellite Imagery Using Python,https://medium.com/p/e7ca9f7bfa0a,
TDS,A Journey through XGBoost: Milestone 3,https://medium.com/p/a5569c72d72b,
TDS,Boost your Network Performance,https://medium.com/p/cc0a2a95c5ef,
TDS,A Journey Through Neural Networks (Part 1) — Artificial Neural Network and Perceptron,https://medium.com/p/e970614b9cc7,
TDS,Open source operationalisation: identifying solutions to help achieve three-star deployments,https://medium.com/p/34230c690904,
