feed,title,long_url,short_url
GN:T:WP,"Three myths about renewable energy and the grid, debunked | Greenbiz - GreenBiz",https://www.greenbiz.com/article/three-myths-about-renewable-energy-and-grid-debunked,
GN:T:WP,Tesla & Elon Musk Take A Stand For California Homeowners Who Want Solar - CleanTechnica,https://cleantechnica.com/2022/01/13/tesla-elon-musk-take-a-stand-for-california-homeowners-who-want-solar/,
GN:T:WP,It's not easy being green: Ireland is failing to respond to the climate crisis - America Magazine,https://www.americamagazine.org/politics-society/2022/01/13/hargaden-emerald-island-not-so-green-242177,
GN:T:WP,True Wind invests in W Energy Software - PE Hub,https://www.pehub.com/true-wind-invests-in-w-energy-software/,
GN:T:WP,Saudi Arabia plans 2 more auctions for copper mines after Al-Khunayqiyah tender - Arab News,https://www.arabnews.com/node/2003896/business-economy,
GN:T:WP,The sleeping giants that are changing the Highlands - Readers' Letters - The Scotsman,https://www.scotsman.com/news/opinion/letters/the-sleeping-giants-that-are-changing-the-highlands-readers-letters-3524922,
GN:T:WP,"Kevin Fletcher’s Big Farm Adventure: what is ex Emmerdale actor’s new TV show about, and when is it on TV? - NationalWorld",https://www.nationalworld.com/culture/television/kevin-fletchers-big-farm-adventure-what-is-ex-emmerdale-actors-new-tv-show-about-and-when-is-it-on-tv-3526057,
