feed,title,long_url,short_url
GN:T:SP,Scaling up Rooftop Solar in Vietnam – More than 9GW installed in 2020 - pv magazine International,https://www.pv-magazine.com/press-releases/scaling-up-rooftop-solar-in-vietnam-more-than-9gw-installed-in-2020/,
GN:T:SP,Off Grid Electricity Fund invests Energy Systems Group to bring solar electricity to Haiti - ImpactAlpha,https://impactalpha.com/off-grid-electricity-fund-invests-500000-in-esg-group-to-bring-solar-electricity-to-haiti/,
GN:T:SP,City of Montrose installs new solar-powered lights at Rotary Park - KKCO,https://www.nbc11news.com/2021/01/19/city-of-montrose-installs-new-solar-powered-lights-at-rotary-park/,
GN:T:SP,Designing Effective Lightning Protection for Residential Rooftop Solar Systems - Mercom India,https://mercomindia.com/designing-effective-lightning-protection-residential/,
GN:T:SP,Adani Solar Energy commissions 150 MW solar power project in Kutchh - Business Standard,https://www.business-standard.com/article/companies/adani-solar-energy-commissions-150-mw-solar-power-project-in-kutchh-121012000381_1.html,
