feed,title,long_url,short_url
GN:T:WP,"'Global Wind Energy Alliance' | Irena, GWEC and Denmark team up for massive offshore wind boost | Recharge - Recharge",https://www.rechargenews.com/wind/global-wind-energy-alliance-irena-gwec-and-denmark-team-up-for-massive-offshore-wind-boost/2-1-1302824,
GN:T:WP,Can AI stop rare eagles flying into wind turbines in Germany? - The Guardian,https://www.theguardian.com/environment/2022/sep/20/germany-hopes-ai-can-stop-rare-eagles-flying-into-wind-turbines,
GN:T:WP,Solar PV employed around 3.4 million people in 2021 – pv magazine India - pv magazine India,https://www.pv-magazine-india.com/2022/09/20/solar-pv-employed-around-3-4-million-people-in-2021/,
GN:T:WP,KKR Invests in Hero Future Energies in $450 Million Transaction KKR Invests in Hero Future Energies in $450 Million Transaction - Business Wire,https://www.businesswire.com/news/home/20220918005083/en/%C2%A0KKR-Invests-in-Hero-Future-Energies-in-450-Million-Transaction%C2%A0KKR-Invests-in-Hero-Future-Energies-in-450-Million-Transaction,
GN:T:WP,China's Shanghai launches infrastructure projects worth $257 billion | The Mighty 790 KFGO - KFGO,https://kfgo.com/2022/09/20/chinas-shanghai-launches-infrastructure-projects-worth-257-billion/,
GN:T:WP,"After climate bill passage, WVa natural gas plant unveiled - WDTV",https://www.wdtv.com/2022/09/19/after-climate-bill-passage-wva-natural-gas-plant-unveiled/,
GN:T:WP,"UPL, Cleanmax partner for renewable energy project in Gujarat - Construction Week Online India",https://www.constructionweekonline.in/projects-tenders/upl-cleanmax-partner-for-renewable-energy-project-in-gujarat,
