feed,title,long_url,short_url
GN:T:RE,"more than a camper: NS-1 by campworks is an off-road, solar-powered micro-grid - Designboom",https://www.designboom.com/technology/ns-1-campworks-off-road-solar-powered-micro-grid-09-20-2022/,
GN:T:RE,Can AI stop rare eagles flying into wind turbines in Germany? - The Guardian,https://www.theguardian.com/environment/2022/sep/20/germany-hopes-ai-can-stop-rare-eagles-flying-into-wind-turbines,
GN:T:RE,Hydrogen - SunHydrogen shares update on its progress towards commercialisation of nanoparticle-based green hydrogen technology - Renewable Energy Magazine,https://www.renewableenergymagazine.com/hydrogen/sunhydrogen-shares-update-on-its-progress-towards-20220919,
GN:T:RE,Could the war in Ukraine make winter in New England more expensive? - Grid,https://www.grid.news/story/economy/2022/09/19/could-russias-invasion-of-ukraine-make-it-more-expensive-to-keep-the-lights-on-in-new-england-this-winter/,
GN:T:RE,The 7 Best Solar Companies in Pennsylvania (2022) - MarketWatch,https://www.marketwatch.com/picks/guides/home-improvement/solar-companies-pennsylvania/,
GN:T:RE,How the Inflation Reduction Act Will Help the United States to Lead in the Clean Energy Economy - Council on Foreign Relations,https://www.cfr.org/blog/how-inflation-reduction-act-will-help-united-states-lead-clean-energy-economy,
