feed,title,long_url,short_url
GN:T:SP,Agrivoltaics for soybeans – pv magazine International - pv magazine International,https://www.pv-magazine.com/2022/12/14/agrivoltaics-for-soybeans/,https://da.gd/fLniF
GN:T:SP,Stellantis and DTE Energy partner up for 2nd largest clean power deal - http://cbtnews,https://www.cbtnews.com/stellantis-and-dte-energy-partner-up-for-2nd-largest-clean-power-deal/,https://da.gd/I38r
GN:T:SP,"Meyer Burger, Partners Developing High-Performance PV Modules with Perovskite Tech - Solar Industry",https://solarindustrymag.com/meyer-burger-partners-develop-high-performance-pv-modules-with-perovskite-tech,https://da.gd/EIjGPU
GN:T:SP,Vast Solar and Sage Geosystems Announce Strategic Collaboration on Hybrid Power Generation and Storage Projects - Batteries News,https://batteriesnews.com/vast-solar-sage-geosystems-announce-strategic-collaboration-hybrid-power-generation-and-storage-projects/,https://da.gd/yL21j8
GN:T:SP,SIERRA LEONE: Baoma 1 solar PV plant goes live as a PPP - AFRIK 21,https://www.afrik21.africa/en/sierra-leone-baoma-1-solar-pv-plant-goes-live-as-a-ppp/,https://da.gd/AVy8
