feed,title,long_url,short_url
GN:S:C,Climate-friendly cooling can slow global warming - Bangkok Post,https://www.bangkokpost.com/business/1988955/climate-friendly-cooling-can-slow-global-warming,
GN:S:C,Wild rice growers worry about climate change hurting crops - Journal Times,https://journaltimes.com/news/state-and-regional/wild-rice-growers-worry-about-climate-change-hurting-crops/article_2d32d79d-4158-5371-935e-29ae0d18cfe9.html,
GN:S:C,Silicon Valley Falls for European Climate Tech Made of Timber - Yahoo Finance,https://finance.yahoo.com/news/silicon-valley-falls-european-climate-062539301.html,
GN:S:C,Walmart outlines climate-friendly goal to decarbonize operations within 20 years - Yahoo Finance,https://finance.yahoo.com/news/walmart-sets-goal-to-reach-zero-emissions-by-2040-040115149.html,
GN:S:C,"On This Day: Climate march draws 300,000 to NYC - UPI",https://www.upi.com/Top_News/2020/09/21/On-This-Day-Climate-march-draws-300000-to-NYC/1041600632367/,
GN:S:C,Europe's new climate plan heralds energy 'transformation' - EURACTIV,https://www.euractiv.com/section/energy/news/europes-new-climate-plan-heralds-energy-transformation/,
GN:S:C,World's top companies urge climate change action before UN talk - Deccan Herald,https://www.deccanherald.com/science-and-environment/worlds-top-companies-urge-climate-change-action-before-un-talk-890683.html,
