feed,title,long_url,short_url
ArXiv,Using Hybrid Scheduling Algorithms for Solving Blockchain Allocation on Cloud,https://arxiv.org/abs/2201.11124v1,
ArXiv,Towards a Secure and Reliable Federated Learning using Blockchain,https://arxiv.org/abs/2201.11311v1,
ArXiv,Towards a Scalable and Trustworthy Blockchain: IoT Use Case,https://arxiv.org/abs/2201.11337v1,
ArXiv,An IoT Blockchain Architecture Using Oracles and Smart Contracts: the Use-Case of a Food Supply Chain,https://arxiv.org/abs/2201.11370v1,
ArXiv,An Overview of Blockchain and 5G Networks,https://arxiv.org/abs/2201.11385v1,
