feed,title,long_url,short_url
GN:S:C,Israeli experts warn that extreme climate events suggest dawn of 'uncharted waters' - The Times of Israel,https://news.google.com/rss/articles/CBMicGh0dHBzOi8vd3d3LnRpbWVzb2Zpc3JhZWwuY29tL2lzcmFlbGktZXhwZXJ0cy13YXJuLXRoYXQtZXh0cmVtZS1jbGltYXRlLWV2ZW50cy1zdWdnZXN0LWRhd24tb2YtdW5jaGFydGVkLXdhdGVycy_SAQA?oc=5,https://da.gd/SGgJ65
GN:S:C,Ask Eartha: A summer of climate change - Summit Daily,https://news.google.com/rss/articles/CBMiSmh0dHBzOi8vd3d3LnN1bW1pdGRhaWx5LmNvbS9vcGluaW9uL2Fzay1lYXJ0aGEtYS1zdW1tZXItb2YtY2xpbWF0ZS1jaGFuZ2Uv0gEA?oc=5,https://da.gd/CSCDt9
GN:S:C,Dr. Dan Barkhuff: Health effects of climate change are showing up at ... - VTDigger,https://news.google.com/rss/articles/CBMicGh0dHBzOi8vdnRkaWdnZXIub3JnLzIwMjMvMDcvMjQvZHItZGFuLWJhcmtodWZmLWhlYWx0aC1lZmZlY3RzLW9mLWNsaW1hdGUtY2hhbmdlLWFyZS1zaG93aW5nLXVwLWF0LXRoZS1ob3NwaXRhbC_SAQA?oc=5,https://da.gd/fxZuH2
GN:S:C,New project will help address the impact of climate change on ... - Innovation News Network,https://news.google.com/rss/articles/CBMibWh0dHBzOi8vd3d3Lmlubm92YXRpb25uZXdzbmV0d29yay5jb20vbmV3LXByb2plY3QtaGVscC1hZGRyZXNzLWltcGFjdC1vZi1jbGltYXRlLWNoYW5nZS1vbi1jb21tdW5pdGllcy8zNTIzOS_SAQA?oc=5,https://da.gd/LAXp
GN:S:C,Sunak Warns UK Climate Goals Must Not Become 'Hassle' for Voters - Bloomberg,https://news.google.com/rss/articles/CBMicWh0dHBzOi8vd3d3LmJsb29tYmVyZy5jb20vbmV3cy9hcnRpY2xlcy8yMDIzLTA3LTI0L3N1bmFrLXdhcm5zLXVrLWNsaW1hdGUtZ29hbHMtbXVzdC1ub3QtYmVjb21lLWhhc3NsZS1mb3Itdm90ZXJz0gEA?oc=5,https://da.gd/RdUFmB
GN:S:C,Opinion | Backlash to climate policies is growing. A new strategy is ... - The Washington Post,https://news.google.com/rss/articles/CBMiUmh0dHBzOi8vd3d3Lndhc2hpbmd0b25wb3N0LmNvbS9vcGluaW9ucy8yMDIzLzA3LzI0L2NsaW1hdGUtY2hhbmdlLWJhY2tsYXNoLWV1cm9wZS_SAQA?oc=5,https://da.gd/DzW3h
GN:S:C,Greta Thunberg fined for disobeying police during climate protest in Sweden - POLITICO Europe,https://news.google.com/rss/articles/CBMibGh0dHBzOi8vd3d3LnBvbGl0aWNvLmV1L2FydGljbGUvZ3JldGEtdGh1bmJlcmctZmluZWQtZm9yLWRpc29iZXlpbmctcG9saWNlLWR1cmluZy1jbGltYXRlLXByb3Rlc3QtaW4tc3dlZGVuL9IBcGh0dHBzOi8vd3d3LnBvbGl0aWNvLmV1L2FydGljbGUvZ3JldGEtdGh1bmJlcmctZmluZWQtZm9yLWRpc29iZXlpbmctcG9saWNlLWR1cmluZy1jbGltYXRlLXByb3Rlc3QtaW4tc3dlZGVuL2FtcC8?oc=5,https://da.gd/trUR4
GN:S:C,RI's Offshore Wind Strategy in Unraveling — Climate Change Goals ... - GoLocalProv,https://news.google.com/rss/articles/CBMibGh0dHBzOi8vd3d3LmdvbG9jYWxwcm92LmNvbS9uZXdzL3Jpcy1vZmZzaG9yZS13aW5kLXN0cmF0ZWd5LWluLXVucmF2ZWxpbmctY2xpbWF0ZS1jaGFuZ2UtZ29hbHMtbm93LWVuZGFuZ2VyZdIBAA?oc=5,https://da.gd/si7iL
GN:S:C,Imperial students win climate prize for peatland wet farms funding project - Imperial College London,https://news.google.com/rss/articles/CBMiVWh0dHBzOi8vd3d3LmltcGVyaWFsLmFjLnVrL25ld3MvMjQ2NDEzL2ltcGVyaWFsLXN0dWRlbnRzLWNsaW1hdGUtcHJpemUtcGVhdGxhbmQtZmFybXPSAVpodHRwczovL3d3dy5pbXBlcmlhbC5hYy51ay9uZXdzLzI0NjQxMy9pbXBlcmlhbC1zdHVkZW50cy1jbGltYXRlLXByaXplLXBlYXRsYW5kLWZhcm1zL2FtcC8?oc=5,https://da.gd/vzqEf
GN:S:C,"Rethinking food systems in East Africa amid conflict, climate change ... - ReliefWeb",https://news.google.com/rss/articles/CBMidWh0dHBzOi8vcmVsaWVmd2ViLmludC9yZXBvcnQvd29ybGQvcmV0aGlua2luZy1mb29kLXN5c3RlbXMtZWFzdC1hZnJpY2EtYW1pZC1jb25mbGljdC1jbGltYXRlLWNoYW5nZS1hbmQtcmlzaW5nLWh1bmdlctIBAA?oc=5,https://da.gd/V8Hc
GN:S:C,"Global shipping has a new climate strategy – it's vague, obscure and almost noncommittal, but it may be pointing the industry in the right direction - Yahoo News",https://news.google.com/rss/articles/CBMiTGh0dHBzOi8vbmV3cy55YWhvby5jb20vZ2xvYmFsLXNoaXBwaW5nLWNsaW1hdGUtc3RyYXRlZ3ktdmFndWUtMTIxMzUwODI0Lmh0bWzSAVRodHRwczovL25ld3MueWFob28uY29tL2FtcGh0bWwvZ2xvYmFsLXNoaXBwaW5nLWNsaW1hdGUtc3RyYXRlZ3ktdmFndWUtMTIxMzUwODI0Lmh0bWw?oc=5,https://da.gd/0wOq
