feed,title,long_url,short_url
ArXiv,A Biomedically oriented automatically annotated Twitter COVID-19 Dataset,https://arxiv.org/abs/2107.12565v1,
ArXiv,Measuring daily-life fear perception change: a computational study in the context of COVID-19,https://arxiv.org/abs/2107.12606v1,
ArXiv,"Deep Transfer Learning based COVID-19 Detection in Cough, Breath and Speech using Bottleneck Features",https://arxiv.org/abs/2104.02477v3,
ArXiv,Analysis of Spatiotemporal Anomalies Using Persistent Homology: Case Studies with COVID-19 Data,https://arxiv.org/abs/2107.09188v2,
ArXiv,Sequentially estimating the dynamic contact angle of sessile saliva droplets in view of SARS-CoV-2,https://arxiv.org/abs/2107.12857v1,
ArXiv,A mechanistic model for airborne and direct human-to-human transmission of COVID-19: Effect of mitigation strategies and immigration of infectious persons,https://arxiv.org/abs/2107.12785v1,
ArXiv,New Candidates for Furin Inhibition as Probable Treat for COVID-19: Docking Output,https://arxiv.org/abs/2107.12799v1,
ArXiv,Analysis of a SEIR model with social distancing considerations in the paradigm of COVID-19 outbreak in India,https://arxiv.org/abs/2105.00643v2,
ArXiv,Shape Complementarity Optimization of Antibody-Antigen Interfaces: the Application to SARS-CoV-2 Spike Protein,https://arxiv.org/abs/2107.07295v2,
