feed,title,long_url,short_url
GN:T:WP,Massive expansion of renewable power opens door to achieving global tripling goal set at COP28 - News - IEA - IEA,https://news.google.com/rss/articles/CBMid2h0dHBzOi8vd3d3LmllYS5vcmcvbmV3cy9tYXNzaXZlLWV4cGFuc2lvbi1vZi1yZW5ld2FibGUtcG93ZXItb3BlbnMtZG9vci10by1hY2hpZXZpbmctZ2xvYmFsLXRyaXBsaW5nLWdvYWwtc2V0LWF0LWNvcDI40gEA?oc=5,https://da.gd/5cn2Cu
GN:T:WP,Overnight winter storm effects on Chittenden County and Vermont - Burlington Free Press,https://news.google.com/rss/articles/CBMijgFodHRwczovL3d3dy5idXJsaW5ndG9uZnJlZXByZXNzLmNvbS9zdG9yeS9uZXdzL2xvY2FsL3Zlcm1vbnQvMjAyNC8wMS8xMC93aW50ZXItc3Rvcm0tY2hpdHRlbmRlbi1jb3VudHktdmVybW9udC1wb3dlci1vdXRhZ2VzLXdpbmQvNzIxNzM2MjYwMDcv0gEA?oc=5,https://da.gd/vh04
GN:T:WP,Squadron unveils USD-1.85bn wind turbine deal with GE Vernova - Renewables Now,https://news.google.com/rss/articles/CBMiY2h0dHBzOi8vcmVuZXdhYmxlc25vdy5jb20vbmV3cy9zcXVhZHJvbi11bnZlaWxzLXVzZC0xODVibi13aW5kLXR1cmJpbmUtZGVhbC13aXRoLWdlLXZlcm5vdmEtODQ1MzUzL9IBAA?oc=5,https://da.gd/KT3t
GN:T:WP,Cv International's WindSuite: Elevating Safety Standards and Wind Turbine Maintenance - NRToday,https://news.google.com/rss/articles/CBMiqQFodHRwczovL3d3dy5ucnRvZGF5LmNvbS9hcC9idXNpbmVzcy9jdi1pbnRlcm5hdGlvbmFscy13aW5kc3VpdGUtZWxldmF0aW5nLXNhZmV0eS1zdGFuZGFyZHMtYW5kLXdpbmQtdHVyYmluZS1tYWludGVuYW5jZS9hcnRpY2xlXzFjNmQ1MTVhLTMyYWMtNTA1OS1hNTVlLWE2OTI5MTRmZTYwMC5odG1s0gEA?oc=5,https://da.gd/pHOIP
GN:T:WP,"Mahoning County Commissioners plan hearing on restricting large solar, wind farms in 10 townships - WFMJ",https://news.google.com/rss/articles/CBMihAFodHRwczovL3d3dy53Zm1qLmNvbS9zdG9yeS81MDMxODQ0MC9tYWhvbmluZy1jb3VudHktY29tbWlzc2lvbmVycy1wbGFuLWhlYXJpbmctb24tcmVzdHJpY3RpbmctbGFyZ2Utc29sYXItd2luZC1mYXJtcy1pbi0xMC10b3duc2hpcHPSAQA?oc=5,https://da.gd/aHIfHs
GN:T:WP,Lawsuit dismissed in latest chapter of wind turbine dispute in Orono - Minnesota Lawyer,https://news.google.com/rss/articles/CBMiZ2h0dHBzOi8vbWlubmxhd3llci5jb20vMjAyNC8wMS8xMS9sYXdzdWl0LWRpc21pc3NlZC1pbi1sYXRlc3QtY2hhcHRlci1vZi13aW5kLXR1cmJpbmUtZGlzcHV0ZS1pbi1vcm9uby_SAQA?oc=5,https://da.gd/FlYjd
GN:T:WP,"Westport elementary school music teacher charged after hitting car in parking lot, police say - CTPost",https://news.google.com/rss/articles/CBMiXmh0dHBzOi8vd3d3LmN0cG9zdC5jb20vbmV3cy9hcnRpY2xlL3dlc3Rwb3J0LXRlYWNoZXItaGl0LWFuZC1ydW4tY29sZXl0b3duLXNjaG9vbC0xODYwMTExNS5waHDSAQA?oc=5,https://da.gd/HtKGKe
GN:T:WP,Polish Court Bars Lawmakers From Probing Central Bank Head - Bloomberg,https://news.google.com/rss/articles/CBMicWh0dHBzOi8vd3d3LmJsb29tYmVyZy5jb20vbmV3cy9hcnRpY2xlcy8yMDI0LTAxLTExL3RvcC1wb2xpc2gtY291cnQtYmFycy1sYXdtYWtlcnMtZnJvbS1wcm9iaW5nLWNlbnRyYWwtYmFuay1oZWFk0gEA?oc=5,https://da.gd/sxG6VJ
GN:T:WP,Global Energy Group Gets Subsea 7 Contract for Aker BP's North Sea Field - Marine Technology News,https://news.google.com/rss/articles/CBMiS2h0dHBzOi8vd3d3Lm1hcmluZXRlY2hub2xvZ3luZXdzLmNvbS9uZXdzL2dsb2JhbC1lbmVyZ3ktZ3JvdXAtc3Vic2VhLTYzMzc3M9IBAA?oc=5,https://da.gd/VQAPK
GN:T:WP,Azule Energy To Use Futureon'S Digital Twin Software On - Marine Technology News,https://news.google.com/rss/articles/CBMiTmh0dHBzOi8vd3d3Lm1hcmluZXRlY2hub2xvZ3luZXdzLmNvbS9uZXdzL2F6dWxlLWVuZXJneS1mdXR1cmVvbi1kaWdpdGFsLTYzMzc2OdIBAA?oc=5,https://da.gd/O6Aw
GN:T:WP,"Providence woman killed when car crashed into Route 2 bridge abutment in Lebanon, CT police say - CT Insider",https://news.google.com/rss/articles/CBMiX2h0dHBzOi8vd3d3LmN0aW5zaWRlci5jb20vbmV3cy9hcnRpY2xlL3Byb3ZpZGVuY2UtdGVzc2llci1yb3V0ZS0yLWNyYXNoLWxlYmFub24tY3QtMTg2MDIxNzcucGhw0gEA?oc=5,https://da.gd/tfhMOi
GN:T:WP,PNNL and Microsoft launch partnership to advance energy storage - Power Engineering®️,https://news.google.com/rss/articles/CBMiYWh0dHBzOi8vd3d3LnBvd2VyLWVuZy5jb20vbmV3cy9wbm5sLWFuZC1taWNyb3NvZnQtbGF1bmNoLXBhcnRuZXJzaGlwLXRvLWFkdmFuY2UtZW5lcmd5LXN0b3JhZ2UtMi_SAQA?oc=5,https://da.gd/4cGe
GN:T:WP,"Demolition Underway for Brooklyn Clean Energy Hub in Vinegar Hill, Brooklyn - New York YIMBY",https://news.google.com/rss/articles/CBMicGh0dHBzOi8vbmV3eW9ya3lpbWJ5LmNvbS8yMDI0LzAxL2RlbW9saXRpb24tdW5kZXJ3YXktZm9yLWJyb29rbHluLWNsZWFuLWVuZXJneS1odWItaW4tdmluZWdhci1oaWxsLWJyb29rbHluLmh0bWzSAQA?oc=5,https://da.gd/Wv3fKT
GN:T:WP,"Target moves forward with plan for Norwalk store, replacing Walmart - Thehour",https://news.google.com/rss/articles/CBMiWmh0dHBzOi8vd3d3LnRoZWhvdXIuY29tL25ld3MvYXJ0aWNsZS90YXJnZXQtcHJvZ3Jlc3Nlcy1wbGFucy1ub3J3YWxrLWxvY2F0aW9uLTE4NjAwNTQ4LnBocNIBAA?oc=5,https://da.gd/IkdY
GN:T:WP,"Nichushkin scores 2 power-play goals, MacKinnon extends home points streak as Avs beat Knights 3-0 - CTPost",https://news.google.com/rss/articles/CBMiYWh0dHBzOi8vd3d3LmN0cG9zdC5jb20vc3BvcnRzL2FydGljbGUvbmljaHVzaGtpbi1zY29yZXMtMi1wb3dlci1wbGF5LWdvYWxzLW1hY2tpbm5vbi0xODYwMjAwMC5waHDSAQA?oc=5,https://da.gd/d2S4LY
GN:T:WP,Sen. Whitehouse seeks stakeholder feedback on bill to improve offshore wind development - Daily Energy Insider,https://news.google.com/rss/articles/CBMigQFodHRwczovL2RhaWx5ZW5lcmd5aW5zaWRlci5jb20vbmV3cy80MjM3MS1zZW4td2hpdGVob3VzZS1zZWVrcy1zdGFrZWhvbGRlci1mZWVkYmFjay1vbi1iaWxsLXRvLWltcHJvdmUtb2Zmc2hvcmUtd2luZC1kZXZlbG9wbWVudC_SAQA?oc=5,https://da.gd/W15Av
