feed,title,long_url,short_url
GN:S:GW,"News from the Noteworthy: Birds, Climate Change, Ways to Make an Impact - AllOTSEGO",https://news.google.com/rss/articles/CBMiX2h0dHBzOi8vd3d3LmFsbG90c2Vnby5jb20vbmV3cy1mcm9tLXRoZS1ub3Rld29ydGh5LWJpcmRzLWNsaW1hdGUtY2hhbmdlLXdheXMtdG8tbWFrZS1hbi1pbXBhY3Qv0gEA?oc=5,https://da.gd/6ja85h
GN:S:GW,"Climate change behind sharp drop in snowpack since 1980s, study shows - Phys",https://news.google.com/rss/articles/CBMiP2h0dHBzOi8vcGh5cy5vcmcvbmV3cy8yMDI0LTAxLWNsaW1hdGUtc2hhcnAtc25vd3BhY2stMTk4MHMuaHRtbNIBPmh0dHBzOi8vcGh5cy5vcmcvbmV3cy8yMDI0LTAxLWNsaW1hdGUtc2hhcnAtc25vd3BhY2stMTk4MHMuYW1w?oc=5,https://da.gd/b2v3p
GN:S:GW,"Oceans break record for highest temperatures five years in a row, study warns - RFI English",https://news.google.com/rss/articles/CBMid2h0dHBzOi8vd3d3LnJmaS5mci9lbi9lbnZpcm9ubWVudC8yMDI0MDExMS1vY2VhbnMtYnJlYWstcmVjb3JkLWZvci1oaWdoZXN0LXRlbXBlcmF0dXJlcy1maXZlLXllYXJzLWluLWEtcm93LXN0dWR5LXdhcm5z0gEA?oc=5,https://da.gd/Jt2KZ
GN:S:GW,7 Climate Records That Were Broken in 2023 - Global Citizen,https://news.google.com/rss/articles/CBMiUWh0dHBzOi8vd3d3Lmdsb2JhbGNpdGl6ZW4ub3JnL2VuL2NvbnRlbnQvYnJva2VuLWNsaW1hdGUtcmVjb3Jkcy0yMDIzLWVudmlyb25tZW50L9IBAA?oc=5,https://da.gd/AqU47w
GN:S:GW,Warming threatening penguins in Antarctica - ecns,https://news.google.com/rss/articles/CBMiP2h0dHA6Ly93d3cuZWNucy5jbi9uZXdzLzIwMjQtMDEtMTEvZGV0YWlsLWloY3dycHZ2MzgxMDExNS5zaHRtbNIBAA?oc=5,https://da.gd/HhOxq
GN:S:GW,Comment: Why Brazilian investors need to be on the frontline of fighting climate change - Reuters,https://news.google.com/rss/articles/CBMikgFodHRwczovL3d3dy5yZXV0ZXJzLmNvbS9zdXN0YWluYWJpbGl0eS9sYW5kLXVzZS1iaW9kaXZlcnNpdHkvY29tbWVudC13aHktYnJhemlsaWFuLWludmVzdG9ycy1uZWVkLWJlLWZyb250bGluZS1maWdodGluZy1jbGltYXRlLWNoYW5nZS0yMDI0LTAxLTEwL9IBAA?oc=5,https://da.gd/byLFYb
