feed,title,long_url,short_url
GN:S:C,Lauren Boebert's Hot Take On The Cold Weather Goes Embarrassingly Awry - Yahoo News,https://news.google.com/rss/articles/CBMiRWh0dHBzOi8vbmV3cy55YWhvby5jb20vbGF1cmVuLWJvZWJlcnQtaG90LWNvbGQtd2VhdGhlci0wNzIxMDY1NjEuaHRtbNIBAA?oc=5,https://da.gd/1Ve1Q
GN:S:C,"Readers sound off on hometown homelessness, covering Trump and climate science - New York Daily News",https://news.google.com/rss/articles/CBMidWh0dHBzOi8vd3d3Lm55ZGFpbHluZXdzLmNvbS8yMDI0LzAxLzE1L3JlYWRlcnMtc291bmQtb2ZmLW9uLWhvbWV0b3duLWhvbWVsZXNzbmVzcy1jb3ZlcmluZy10cnVtcC1hbmQtY2xpbWF0ZS1zY2llbmNlL9IBAA?oc=5,https://da.gd/dOdhO
GN:S:C,Climate Change and Wars Are Breaking Down the Foundations of Civilization - CounterPunch,https://news.google.com/rss/articles/CBMicmh0dHBzOi8vd3d3LmNvdW50ZXJwdW5jaC5vcmcvMjAyNC8wMS8xNS9jbGltYXRlLWNoYW5nZS1hbmQtd2Fycy1hcmUtYnJlYWtpbmctZG93bi10aGUtZm91bmRhdGlvbnMtb2YtY2l2aWxpemF0aW9uL9IBAA?oc=5,https://da.gd/Y6Gd
GN:S:C,DEP creating Priority Climate Action Plan - The Mon Valley Independent,https://news.google.com/rss/articles/CBMiU2h0dHBzOi8vbW9udmFsbGV5aW5kZXBlbmRlbnQuY29tLzIwMjQvMDEvZGVwLWNyZWF0aW5nLXByaW9yaXR5LWNsaW1hdGUtYWN0aW9uLXBsYW4v0gEA?oc=5,https://da.gd/05es
GN:S:C,350 Humboldt Hosting 'Climate Change and California's Marine Protected Areas' Talk January 23 - Redheaded Blackbelt,https://news.google.com/rss/articles/CBMiemh0dHBzOi8va3lta2VtcC5jb20vMjAyNC8wMS8xNS8zNTAtaHVtYm9sZHQtaG9zdGluZy1jbGltYXRlLWNoYW5nZS1hbmQtY2FsaWZvcm5pYXMtbWFyaW5lLXByb3RlY3RlZC1hcmVhcy10YWxrLWphbnVhcnktMjMv0gEA?oc=5,https://da.gd/AgqkO
GN:S:C,States with big climate goals strip local power to block green projects - Jackson Hole News&Guide,https://news.google.com/rss/articles/CBMitAFodHRwczovL3d3dy5qaG5ld3NhbmRndWlkZS5jb20vamFja3Nvbl9ob2xlX2RhaWx5L2J1c2luZXNzL3N0YXRlcy13aXRoLWJpZy1jbGltYXRlLWdvYWxzLXN0cmlwLWxvY2FsLXBvd2VyLXRvLWJsb2NrLWdyZWVuLXByb2plY3RzL2FydGljbGVfMTU4YTg4OWUtODFlYi01NDUwLWJiZTgtZTAwOWE4NWU4YWNkLmh0bWzSAQA?oc=5,https://da.gd/Jkje
