feed,title,long_url,short_url
j.mp/lc-ml-reviews,Fine-Grained Image Analysis with Deep Learning: A Survey (2021) (cs.CV),http://arxiv.org/abs/2111.06119v1,
j.mp/lc-ml-reviews,A Survey of Visual Transformers (2021) (cs.CV),http://arxiv.org/abs/2111.06091v1,
j.mp/lc-ml-reviews,"A Survey on Hyperdimensional Computing aka Vector Symbolic Architectures, Part I: Models and Data Transformations (2021) (cs.AI)",http://arxiv.org/abs/2111.06077v1,
j.mp/lc-ml-reviews,Edge-Cloud Polarization and Collaboration: A Comprehensive Survey (2021) (cs.LG),http://arxiv.org/abs/2111.06061v1,
j.mp/lc-ml-reviews,Deep Learning in Human Activity Recognition with Wearable Sensors: A Review on Advances (2021) (cs.HC),http://arxiv.org/abs/2111.00418v2,
j.mp/lc-ml-reviews,Importance Estimation from Multiple Perspectives for Keyphrase Extraction (2021) (cs.CL),http://arxiv.org/abs/2110.09749v4,
j.mp/lc-ml-reviews,Recent Advances in Automated Question Answering In Biomedical Domain (2021) (cs.AI),http://arxiv.org/abs/2111.05937v1,
