feed,title,long_url,short_url
GN:T:WP,Massive new wind farm goes online in Oklahoma | TheHill - The Hill,https://thehill.com/changing-america/sustainability/energy/600044-massive-new-wind-farm-goes-online-in-oklahoma,
GN:T:WP,"Bountiful wind, sun boost German renewable power this year - WHIO",https://www.whio.com/news/bountiful-wind-sun/TVNUTRQ4WUQOP44BFVAVFM4AIA/,
GN:T:WP,NASA is officially tracking over 5K planets beyond our solar system | TheHill - The Hill,https://thehill.com/changing-america/enrichment/education/600045-nasa-tallies-over-5000-planets-beyond-our-solar-system,
GN:T:WP,The most stressed Americans live in these states | TheHill - The Hill,https://thehill.com/changing-america/well-being/mental-health/600043-the-most-stressed-americans-live-in-these-states,
GN:T:WP,Feds schedule offshore wind leases near Carolina coast - Triangle Business Journal - The Business Journals,https://www.bizjournals.com/triangle/news/2022/03/28/feds-schedule-offshore-wind-leases-near-nc-coast.html,
GN:T:WP,"TikTok unsafe for moderators screening traumatic content, lawsuit alleges | TheHill - The Hill",https://thehill.com/changing-america/well-being/mental-health/600047-tiktok-unsafe-for-moderators-screening-traumatic,
GN:T:WP,Kurdistan Says It Can Help Ease Europe's Oil Shortage - OilPrice,https://oilprice.com/Latest-Energy-News/World-News/Kurdistan-Says-It-Can-Help-Ease-Europes-Oil-Shortage.html,
GN:T:WP,Regional High School Science Fair Students Put Environment First - The Vineyard Gazette - Martha's Vineyard News,https://vineyardgazette.com/news/2022/03/28/regional-high-school-science-fair-puts-environment-first,
