feed,title,long_url,short_url
MX,Study shows how Paxlovid resistance emerges in persistent infections,https://medicalxpress.com/news/2023-09-paxlovid-resistance-emerges-persistent-infections.html,https://da.gd/TRXv
MX,Study sheds light on increased reports of suicidal behavior in teens,https://medicalxpress.com/news/2023-09-suicidal-behavior-teens.html,https://da.gd/hATrYp
MX,"COVID patients exhale up to 1,000 copies of the virus per minute during first eight days of symptoms",https://medicalxpress.com/news/2023-09-covid-patients-exhale-virus-minute.html,https://da.gd/Jmkff
MX,Consortium discovers 28 new risk genes for COVID-19,https://medicalxpress.com/news/2023-09-consortium-genes-covid-.html,https://da.gd/d31QA
MX,How does fever help fight infections? There's more to it than even some scientists realize,https://medicalxpress.com/news/2023-09-fever-infections-scientists.html,https://da.gd/r3EyFI
MX,Researchers find genetically intact HIV virus prefers to 'hide' in organs of the immune system,https://medicalxpress.com/news/2023-09-genetically-intact-hiv-virus-immune.html,https://da.gd/ZN4ohn
