feed,title,long_url,short_url
RS,Machine Learning-Enabled In-Situ Defect Detection in Extrusion-Based Additive Manufacturing: A Step Toward Qualification and Certification,https://www.researchsquare.com/article/rs-8347880/latest,
RS,"Building Dynamic AI Capabilities for Sustainable Employee Performance: The Roles of Trust, Knowledge Management, and Competitive Advantage",https://www.researchsquare.com/article/rs-8078220/latest,
RS,Unveiling Population Heterogeneity in Health Risks Posed by Environmental Hazards Using Regression- Guided Neural Network,https://www.researchsquare.com/article/rs-8066259/latest,
RS,"Parkinson’s disease in real life healthcare organization database: Medication based algorithm, incidence and prodromal symptoms",https://www.researchsquare.com/article/rs-8253566/latest,
RS,Murine Organ Auto-Contouring in Small-Animal Precision Irradiation: A Comprehensive Approach Integrating Deep Learning and Contrast Enhancement for Onboard CBCT,https://www.researchsquare.com/article/rs-6891084/latest,
RS,Diagnostic accuracy of an algorithm identifying US veterans with Inclusion Body Myositis from the Corporate Data Warehouse,https://www.researchsquare.com/article/rs-8387113/latest,
RS,Deep Learning Based Multiclass Detection of Corn Leaf Diseases Using a Convolutional Neural Network,https://www.researchsquare.com/article/rs-7872919/latest,
RS,"Nationwide Comparison of Robotic and Navigation-Assisted Total Knee Arthroplasty: Trends, Perioperative Complications, and 90-Day Readmissions (2020–2022 NRD)",https://www.researchsquare.com/article/rs-8149205/latest,
RS,Comparing Incisional Hernia Risk Between Single-Port and Multiport Robot-Assisted Partial Nephrectomy: A Retrospective Analysis,https://www.researchsquare.com/article/rs-8315687/latest,
RS,Role of Relative Intentional Rotation of the Femoral Component in Robotic-Assisted Primary Total Knee Arthroplasty as a Tool for the Correction of Medial Flexion Laxity,https://www.researchsquare.com/article/rs-8372749/latest,
RS,Machine Learning and Remote Sensing for Soil Moisture and Nutrient Estimation: A Systematic Review and Future Research Roadmap,https://www.researchsquare.com/article/rs-8220871/latest,
RS,Detection and Prognostic Stratification of Left Ventricular Systolic Dysfunction in Left Bundle Branch Block Using an Artificial Intelligence-enabled ECG,https://www.researchsquare.com/article/rs-8313177/latest,
RS,Evaluation of robotic exposure among gynecological surgeons: results of survey from the Young European Advocates of Robotic Surgery (YEARS),https://www.researchsquare.com/article/rs-8302218/latest,
RS,Standardisation in Robotic Surgery for Inflammatory Bowel Disease: A Systematic Review,https://www.researchsquare.com/article/rs-8296594/latest,
RS,A Deep Learning-Based Ni Classification System for Laryngeal NBI Images: A Multicenter Diagnostic Study Running title: DL for Ni Classification in Larynx,https://www.researchsquare.com/article/rs-8157582/latest,
RS,Impact of patient factors on outcomes in robotic major and minor hepatectomy: Importance of patient selection,https://www.researchsquare.com/article/rs-8355046/latest,
RS,Behavioral and Microbial Differences in Dental Caries among 5-Year-Old Children in Urban and Rural Yunnan: A Multifactorial Machine Learning Study,https://www.researchsquare.com/article/rs-8112291/latest,
RS,Experimenting with an Artificial Intelligence Initiative in a Public Administration: Contributions from an Action Research Approach,https://www.researchsquare.com/article/rs-8290777/latest,
RS,Sustainability Driven Adoption of Digital Twin Technology in the Malaysian Construction Industry,https://www.researchsquare.com/article/rs-8046522/latest,
RS,Machine Learning approaches in the evaluation of pXRF data in provenance studies of transport amphorae,https://www.researchsquare.com/article/rs-8310173/latest,
RS,Low-Dose Cardiac Exposure (Heart V5) as an Independent Predictor of Radiation-Induced Pericarditis in Breast Cancer: An Interpretable Machine Learning Study,https://www.researchsquare.com/article/rs-8105555/latest,
RS,The Effect of Gamification Design of Online Learning Platforms on User Learning Performance,https://www.researchsquare.com/article/rs-8267663/latest,
RS,Development and validation of an Explainable Machine Learning Model for Predicting Multiple Organ Failure in Patients with Acute Pancreatitis: a Multicenter Cohort Study,https://www.researchsquare.com/article/rs-8086659/latest,
RS,Pre-service Secondary Teachers’ Perceptions on Artificial Intelligence Acceptance in Teaching – learning,https://www.researchsquare.com/article/rs-7949370/latest,
RS,Analysis of Performance Differences Between Self-Developed Fundus Surgery Image Evaluation Software and Kinovea in Ophthalmic Microsurgery,https://www.researchsquare.com/article/rs-8029636/latest,
RS,"From Return on Investment to Return on Health: The CARE Framework for AI Governance, Accountability, and Equitable Transformation in Healthcare Systems",https://www.researchsquare.com/article/rs-8117140/latest,
RS,Machine learning unlocks robust convergence for chemical process simulations,https://www.researchsquare.com/article/rs-8262500/latest,
RS,Supporting Iranian Teachers’ Language Assessment Literacy: A Hybrid AI–Human Feedback Approach within Collaborative Action Research,https://www.researchsquare.com/article/rs-8281675/latest,
RS,High-Precision Prediction Method for Mine Deformation Based on GNSS RTK and Stacking Ensemble Learning,https://www.researchsquare.com/article/rs-8350515/latest,
RS,An Efficient EEG based Neurological Disorder Prediction and Classification using hybrid Modified Residual Attention U-net with ABMO Algorithm,https://www.researchsquare.com/article/rs-8199351/latest,
RS,Tri-Paradigm analysis of computational complexity in NP-Hard Sudoku solvers using explainable AI,https://www.researchsquare.com/article/rs-8392292/latest,
RS,Research on the multi-dimensional impact effects of rural digital economy on the resilience of agricultural development: evidence from 30 provinces in China,https://www.researchsquare.com/article/rs-8062605/latest,
RS,Short-Term and Long-Term Prediction of South China Sea SST Based on Multiple Meteorological Factors and Machine Learning,https://www.researchsquare.com/article/rs-8257774/latest,
RS,Physics Informed Activation Functions and Loss Functions for Signal Reconstruction and Digital Twinning,https://www.researchsquare.com/article/rs-8140679/latest,
RS,A 3D Convolutional Neural Network for Design Optimization of Minimal Surface Scaffolds in Bone Tissue Engineering,https://www.researchsquare.com/article/rs-8295059/latest,
RS,Probabilistic pathways from chronic pain to suicidal ideation in Qatar: a Bayesian-network study,https://www.researchsquare.com/article/rs-8361889/latest,
RS,Forecasting Carbon Price Volatility in China's Ets a Policy-augmented Deep Learning Frame-work Inte-grating Innovation-driven Policies and Green Investment Thresholds,https://www.researchsquare.com/article/rs-8326151/latest,
RS,Consensus or Chaos? The Impact of Listed Companies' Generative AI Disclosure on ESG Rating Divergence: A Signaling Theory Perspective,https://www.researchsquare.com/article/rs-8037100/latest,
RS,Embedding PPIE Training in Postgraduate Cancer Research Education,https://www.researchsquare.com/article/rs-8347079/latest,
RS,Dual Pathways of Digital Finance Inclusion in Alleviating Rural Multidimensional Poverty: Empowerment through Financial Literacy and Strengthening Risk Resilience,https://www.researchsquare.com/article/rs-8154617/latest,
RS,Digital Frontiers in the Battle Against Violence and Forced Migration: A Bibliometric Analysis of Emerging Technologies and Data-Driven Solutions,https://www.researchsquare.com/article/rs-8161995/latest,
RS,Strategic Perspectives on Artificial Intelligence Applications in Ocular Oncology: Managerial Insights and General Use Cases,https://www.researchsquare.com/article/rs-8354984/latest,
RS,Automated Transformation of Financial Regulations into SBVR: An Ontology-Based and Natural Language Processing Approach,https://www.researchsquare.com/article/rs-8301991/latest,
RS,"Human-AI Co-Ideation in VR Experience Design: Evaluating the Dimensionality Framework (8Df) with LLMs (ChatGPT, Gemini, DeepSeek)",https://www.researchsquare.com/article/rs-8274845/latest,
RS,High-Speed Monitoring and Control of Forming Defects in Coarse-Wire MAG Welding Based on Multi-Frame Spatio-Temporal Neural Networks,https://www.researchsquare.com/article/rs-8235508/latest,
RS,AI-Cloud for Next Generation Smart Cites and Smarter Infrastructure,https://www.researchsquare.com/article/rs-8182696/latest,
RS,Using Artificial Intelligence and Deep Learning to Analyze the Impact of Moroccan Investments in Africa on Trade Flows(2007– 2023),https://www.researchsquare.com/article/rs-8264596/latest,
RS,A 3D Convolutional Neural Network Model for Figure Skating Action Capture and Pose Recognition Based on Spatiotemporal Geometric Theory,https://www.researchsquare.com/article/rs-8033131/latest,
RS,Machine Learning Driven Land Surface Temperature Prediction and Urban Heat Risk Assessment in The Gambia,https://www.researchsquare.com/article/rs-8220651/latest,
RS,IoT-Driven Water Leak Detection: A Comparative Study of Machine Learning and Deep Learning Models for Time-Series Sensor Data with Explainable AI,https://www.researchsquare.com/article/rs-8184331/latest,
RS,"Pilot Study of Hypertension Screening and Machine-Learning Prediction Using Community Outreach Data from Nkpokiti, Enugu, Nigeria Short Title: Machine Learning Prediction of Hypertension using Community Blood Pressure Data in Nigeria",https://www.researchsquare.com/article/rs-8088844/latest,
