feed,title,long_url,short_url
GN:T:RE,Introducing Invert: A Visionary Net Zero Company - Business Wire,https://www.businesswire.com/news/home/20220201005145/en/Introducing-Invert-A-Visionary-Net-Zero-Company,
GN:T:RE,"Sponsor of net-metering bill offers compromise to solar users, but opposition remains - Miami Herald",https://www.miamiherald.com/news/politics-government/article258008533.html,
GN:T:RE,Solar trailer for off-grid applications from France - pv magazine International,https://www.pv-magazine.com/2022/02/03/solar-trailer-for-off-grid-applications-from-france/,
GN:T:RE,SLC mayor's midterm report card: some passes and some incompletes - Salt Lake Tribune,https://www.sltrib.com/news/politics/2022/02/03/slc-mayors-midterm-report/,
GN:T:RE,First Solar cut at BofA as Section 201 tariffs not likely to be extended - Seeking Alpha,https://seekingalpha.com/news/3795711-first-solar-cut-at-bofa-as-section-201-tariffs-not-likely-to-be-extended,
GN:T:RE,Turbine down | Brazil wind farm collapse sparks Siemens Gamesa probe - Recharge,https://www.rechargenews.com/wind/turbine-down-brazil-wind-farm-collapse-sparks-siemens-gamesa-probe/2-1-1161586,
