feed,title,long_url,short_url
GN:T:WP,Solar secures 95.5 MW in Italy's third renewables auction - pv magazine International,https://www.pv-magazine.com/2020/10/02/solar-secures-95-5-mw-in-italys-third-renewables-auction/,
GN:T:WP,Oil Falls As Trump Tests Positive For COVID-19 - OilPrice,https://oilprice.com/Energy/Oil-Prices/Oil-Falls-As-Trump-Tests-Positive-For-COVID-19.html,
GN:T:WP,Coalition Urges Mass. Lawmakers to Oppose Pro-Utility Legislative Provisions - Solar Industry,https://solarindustrymag.com/coalition-urges-mass-lawmakers-to-oppose-pro-utility-legislative-provisions,
GN:T:WP,Brookfield all clear for 30MW California repowering - reNEWS,https://renews.biz/63508/brookfield-all-clear-for-30mw-california-repowering/,
GN:T:WP,Italy's Enel to help build green hydrogen plant in Chile - Reuters,https://www.reuters.com/article/us-enel-hydrogen/italys-enel-to-help-build-green-hydrogen-plant-in-chile-idUSKBN26N2IA,
