feed,title,long_url,short_url
GN:T:AI,3 Tips for Becoming the Champion of Your Organization's AI Committee - Dark Reading,https://news.google.com/rss/articles/CBMic2h0dHBzOi8vd3d3LmRhcmtyZWFkaW5nLmNvbS9jeWJlcnNlY3VyaXR5LW9wZXJhdGlvbnMvMy10aXBzLWZvci1iZWNvbWluZy1jaGFtcGlvbi1vZi15b3VyLW9yZ2FuaXphdGlvbi1haS1jb21taXR0ZWXSAQA?oc=5,https://da.gd/LKA60
GN:T:AI,Google Launches AI-Powered Theft and Data Protection Features for Android Devices - The Hacker News,https://news.google.com/rss/articles/CBMiTmh0dHBzOi8vdGhlaGFja2VybmV3cy5jb20vMjAyNC8wNS9nb29nbGUtYWRkcy1haS1wb3dlcmVkLXRoZWZ0LXByb3RlY3Rpb24uaHRtbNIBAA?oc=5,https://da.gd/oeE8KV
GN:T:AI,AI Robot Gives Graduation Speech at Buffalo’s D’Youville University - The New York Times,https://news.google.com/rss/articles/CBMiYGh0dHBzOi8vd3d3Lm55dGltZXMuY29tLzIwMjQvMDUvMTUvbnlyZWdpb24vZHlvdXZpbGxlLXVuaXZlcnNpdHktY29tbWVuY2VtZW50LXJvYm90LXNwZWFrZXIuaHRtbNIBAA?oc=5,https://da.gd/VBlX
GN:T:AI,"Stability AI, Facing Cash Crunch, Discusses Sale - The Information",https://news.google.com/rss/articles/CBMiVmh0dHBzOi8vd3d3LnRoZWluZm9ybWF0aW9uLmNvbS9hcnRpY2xlcy9zdGFiaWxpdHktYWktZmFjaW5nLWNhc2gtY3J1bmNoLWRpc2N1c3Nlcy1zYWxl0gEA?oc=5,https://da.gd/R3YNr
GN:T:AI,"Inside YouTube’s Brandcast: Billie Eilish, Roger Goodell, AI Talk and Lots of Creators - Hollywood Reporter",https://news.google.com/rss/articles/CBMidmh0dHBzOi8vd3d3LmhvbGx5d29vZHJlcG9ydGVyLmNvbS9idXNpbmVzcy9kaWdpdGFsL2luc2lkZS15b3V0dWJlLWJyYW5kY2FzdC1iaWxsaWUtZWlsaXNoLXJvZ2VyLWdvb2RlbGwtYWktMTIzNTkwMDYzMC_SAXpodHRwczovL3d3dy5ob2xseXdvb2RyZXBvcnRlci5jb20vYnVzaW5lc3MvZGlnaXRhbC9pbnNpZGUteW91dHViZS1icmFuZGNhc3QtYmlsbGllLWVpbGlzaC1yb2dlci1nb29kZWxsLWFpLTEyMzU5MDA2MzAvYW1wLw?oc=5,https://da.gd/oFfLd5
GN:T:AI,"In first AI dialogue, U.S. cites ‘misuse’ of AI by China, Beijing protests Washington’s restrictions - PBS NewsHour",https://news.google.com/rss/articles/CBMigwFodHRwczovL3d3dy5wYnMub3JnL25ld3Nob3VyL3BvbGl0aWNzL2luLWZpcnN0LWFpLWRpYWxvZ3VlLXVzLWNpdGVzLW1pc3VzZS1vZi1haS1ieS1jaGluYS1iZWlqaW5nLXByb3Rlc3RzLXdhc2hpbmd0b25zLXJlc3RyaWN0aW9uc9IBhwFodHRwczovL3d3dy5wYnMub3JnL25ld3Nob3VyL2FtcC9wb2xpdGljcy9pbi1maXJzdC1haS1kaWFsb2d1ZS11cy1jaXRlcy1taXN1c2Utb2YtYWktYnktY2hpbmEtYmVpamluZy1wcm90ZXN0cy13YXNoaW5ndG9ucy1yZXN0cmljdGlvbnM?oc=5,https://da.gd/gRPYb
GN:T:AI,InnovationRx: Battle Of The AI Medical Scribes - Forbes,https://news.google.com/rss/articles/CBMiZGh0dHBzOi8vd3d3LmZvcmJlcy5jb20vc2l0ZXMva2F0aWVqZW5uaW5ncy8yMDI0LzA1LzE1L2lubm92YXRpb25yeC1iYXR0bGUtb2YtdGhlLWFpLW1lZGljYWwtc2NyaWJlcy_SAQA?oc=5,https://da.gd/eB0A
GN:T:AI,Microsoft's carbon footprint keeps growing as AI drives data center expansions - GeekWire,https://news.google.com/rss/articles/CBMibGh0dHBzOi8vd3d3LmdlZWt3aXJlLmNvbS8yMDI0L21pY3Jvc29mdHMtY2FyYm9uLWZvb3RwcmludC1rZWVwcy1ncm93aW5nLWFzLWFpLWRyaXZlcy1kYXRhLWNlbnRlci1leHBhbnNpb25zL9IBAA?oc=5,https://da.gd/Avvxrc
GN:T:AI,AI is listening: Omnipresent robo-moderators are the latest online anti-toxicity strategy - PC Gamer,https://news.google.com/rss/articles/CBMiPGh0dHBzOi8vd3d3LnBjZ2FtZXIuY29tL2FpLW1vZGVyYXRvcnMtZ2FtaW5nLWdkYy1pbnRlcnZpZXdzL9IBAA?oc=5,https://da.gd/DtMa7U
