feed,title,long_url,short_url
GN:T:AI,Altman Sought Billions For AI Chip Venture Before OpenAI Ouster - Bloomberg,https://news.google.com/rss/articles/CBMicmh0dHBzOi8vd3d3LmJsb29tYmVyZy5jb20vbmV3cy9hcnRpY2xlcy8yMDIzLTExLTE5L2FsdG1hbi1zb3VnaHQtYmlsbGlvbnMtZm9yLWFpLWNoaXAtdmVudHVyZS1iZWZvcmUtb3BlbmFpLW91c3RlctIBAA?oc=5,https://da.gd/7hdrQd
GN:T:AI,Actors are concerned about AI terms in new SAG-AFTRA contract - Mashable,https://news.google.com/rss/articles/CBMiKWh0dHBzOi8vbWFzaGFibGUuY29tL2FydGljbGUvc2FnLWFmdHJhLWFp0gEA?oc=5,https://da.gd/P9yVI
GN:T:AI,OpenAI's leadership drama underscores why its GPT model security needs fixing - VentureBeat,https://news.google.com/rss/articles/CBMiaGh0dHBzOi8vdmVudHVyZWJlYXQuY29tL2FpL29wZW5haXMtbGVhZGVyc2hpcC1kcmFtYS11bmRlcnNjb3Jlcy13aHktaXRzLWdwdC1tb2RlbC1zZWN1cml0eS1uZWVkcy1maXhpbmcv0gEA?oc=5,https://da.gd/WMduP
GN:T:AI,UC Berkeley Researchers Propose an Artificial Intelligence Algorithm that Achieves Zero-Shot Acquisition of Goal-Directed Dialogue Agents - MarkTechPost,https://news.google.com/rss/articles/CBMisgFodHRwczovL3d3dy5tYXJrdGVjaHBvc3QuY29tLzIwMjMvMTEvMTgvdWMtYmVya2VsZXktcmVzZWFyY2hlcnMtcHJvcG9zZS1hbi1hcnRpZmljaWFsLWludGVsbGlnZW5jZS1hbGdvcml0aG0tdGhhdC1hY2hpZXZlcy16ZXJvLXNob3QtYWNxdWlzaXRpb24tb2YtZ29hbC1kaXJlY3RlZC1kaWFsb2d1ZS1hZ2VudHMv0gG2AWh0dHBzOi8vd3d3Lm1hcmt0ZWNocG9zdC5jb20vMjAyMy8xMS8xOC91Yy1iZXJrZWxleS1yZXNlYXJjaGVycy1wcm9wb3NlLWFuLWFydGlmaWNpYWwtaW50ZWxsaWdlbmNlLWFsZ29yaXRobS10aGF0LWFjaGlldmVzLXplcm8tc2hvdC1hY3F1aXNpdGlvbi1vZi1nb2FsLWRpcmVjdGVkLWRpYWxvZ3VlLWFnZW50cy8_YW1w?oc=5,https://da.gd/x0wDF
GN:T:AI,Stadium card stunts and the art of programming a crowd - Engadget,https://news.google.com/rss/articles/CBMiYWh0dHBzOi8vd3d3LmVuZ2FkZ2V0LmNvbS9oaXR0aW5nLXRoZS1ib29rcy1jb2RlLXRvLWpveS1taWNoYWVsLWwtbGl0dG1hbi1taXQtcHJlc3MtMTUzMDM2MjQxLmh0bWzSAQA?oc=5,https://da.gd/gbVxD3
