feed,title,long_url,short_url
PwC:Latest,Exploring Machine Speech Chain for Domain Adaptation and Few-Shot Speaker Adaptation,https://paperswithcode.com/paper/exploring-machine-speech-chain-for-domain,https://j.mp/3mxbvPm
PwC:Latest,Semantic Scene Completion via Integrating Instances and Scene in-the-Loop,https://paperswithcode.com/paper/semantic-scene-completion-via-integrating,https://j.mp/2OxBjhF
PwC:Latest,Learning What To Do by Simulating the Past,https://paperswithcode.com/paper/learning-what-to-do-by-simulating-the-past-1,https://j.mp/2PRQ1ka
PwC:Latest,Low-Complexity Probing via Finding Subnetworks,https://paperswithcode.com/paper/low-complexity-probing-via-finding,https://j.mp/39UHDHw
PwC:Latest,Handwriting Transformers,https://paperswithcode.com/paper/handwriting-transformers,https://j.mp/3t5RWjx
PwC:Latest,MetricGAN+: An Improved Version of MetricGAN for Speech Enhancement,https://paperswithcode.com/paper/metricgan-an-improved-version-of-metricgan,https://j.mp/39WAUwZ
PwC:Latest,Learning optical flow from still images,https://paperswithcode.com/paper/learning-optical-flow-from-still-images,https://j.mp/3uC2ZBv
PwC:Latest,Robust Differentiable SVD,https://paperswithcode.com/paper/robust-differentiable-svd,https://j.mp/3rYNuC1
PwC:Latest,GrASP: A Library for Extracting and Exploring Human-Interpretable Textual Patterns,https://paperswithcode.com/paper/grasp-a-library-for-extracting-and-exploring,https://j.mp/3dQxNHJ
PwC:Latest,BR-NS: an Archive-less Approach to Novelty Search,https://paperswithcode.com/paper/br-ns-an-archive-less-approach-to-novelty,https://j.mp/3uv28lY
PwC:Latest,Speech Denoising without Clean Training Data: a Noise2Noise Approach,https://paperswithcode.com/paper/speech-denoising-without-clean-training-data,https://j.mp/3uzn77g
PwC:Latest,A Proposal for an Interactive Shell Based on a Typed Lambda Calculus,https://paperswithcode.com/paper/a-proposal-for-an-interactive-shell-based-on,https://j.mp/31WLcJ3
PwC:Latest,Probing BERT in Hyperbolic Spaces,https://paperswithcode.com/paper/probing-bert-in-hyperbolic-spaces-1,https://j.mp/3muqKso
PwC:Latest,"Exploring the Relationship Between Algorithm Performance, Vocabulary, and Run-Time in Text Classification",https://paperswithcode.com/paper/exploring-the-relationship-between-algorithm,https://j.mp/3d41Blm
PwC:Latest,InAugment: Improving Classifiers via Internal Augmentation,https://paperswithcode.com/paper/inaugment-improving-classifiers-via-internal,https://j.mp/3mxFvKR
PwC:Latest,Progressive Temporal Feature Alignment Network for Video Inpainting,https://paperswithcode.com/paper/progressive-temporal-feature-alignment,https://j.mp/3d2WnGr
PwC:Latest,Efficient time stepping for numerical integration using reinforcement learning,https://paperswithcode.com/paper/efficient-time-stepping-for-numerical,https://j.mp/3uC2Z4t
PwC:Latest,Stable deep neural network architectures for mitochondria segmentation on electron microscopy volumes,https://paperswithcode.com/paper/stable-deep-neural-network-architectures-for,https://j.mp/3rYKaH3
PwC:Latest,EXPATS: A Toolkit for Explainable Automated Text Scoring,https://paperswithcode.com/paper/expats-a-toolkit-for-explainable-automated,https://j.mp/3uw0Tms
PwC:Latest,Bootstrapping of memetic from genetic evolution via inter-agent selection pressures,https://paperswithcode.com/paper/bootstrapping-of-memetic-from-genetic,https://j.mp/39XGQFJ
PwC:Latest,Evolutionary rates of information gain and decay in fluctuating environments,https://paperswithcode.com/paper/evolutionary-rates-of-information-gain-and,https://j.mp/3s52tKq
PwC:Latest,Rethinking the Backdoor Attacks' Triggers: A Frequency Perspective,https://paperswithcode.com/paper/rethinking-the-backdoor-attacks-triggers-a,https://j.mp/3wRbXNg
PwC:Latest,Multimodal Entity Linking for Tweets,https://paperswithcode.com/paper/multimodal-entity-linking-for-tweets,https://j.mp/3ta2Zsg
PwC:Latest,SOLD2: Self-supervised Occlusion-aware Line Description and Detection,https://paperswithcode.com/paper/sold2-self-supervised-occlusion-aware-line,https://j.mp/3wIzVu0
PwC:Latest,Generating multi-type sequences of temporal events to improve fraud detection in game advertising,https://paperswithcode.com/paper/generating-multi-type-sequences-of-temporal,https://j.mp/2QdGcwI
