feed,title,long_url,short_url
GN:T:DS,5 Ways You Can Use ChatGPT’s Code Interpreter For Data Science - KDnuggets,https://news.google.com/rss/articles/CBMiU2h0dHBzOi8vd3d3LmtkbnVnZ2V0cy5jb20vMjAyMy8wOC81LXdheXMtY2hhdGdwdC1jb2RlLWludGVycHJldGVyLWRhdGEtc2NpZW5jZS5odG1s0gEA?oc=5,https://da.gd/I0iSG
GN:T:DS,The Evolving Role of Data Scientists from Data to Solutions - Analytics India Magazine,https://news.google.com/rss/articles/CBMiQ2h0dHBzOi8vYW5hbHl0aWNzaW5kaWFtYWcuY29tL3RoZS1ldm9sdmluZy1yb2xlLW9mLWRhdGEtc2NpZW50aXN0cy_SAQA?oc=5,https://da.gd/As40Ay
GN:T:DS,10 Resume Keywords for Data Scientists Valued by Recruiters - Times of India,https://news.google.com/rss/articles/CBMijgFodHRwczovL3RpbWVzb2ZpbmRpYS5pbmRpYXRpbWVzLmNvbS9lZHVjYXRpb24vd2ViLXN0b3JpZXMvMTAtcmVzdW1lLWtleXdvcmRzLWZvci1kYXRhLXNjaWVudGlzdHMtdmFsdWVkLWJ5LXJlY3J1aXRlcnMvcGhvdG9zdG9yeS8xMDQ1ODAzNDIuY21z0gGOAWh0dHBzOi8vdGltZXNvZmluZGlhLmluZGlhdGltZXMuY29tL2VkdWNhdGlvbi93ZWItc3Rvcmllcy8xMC1yZXN1bWUta2V5d29yZHMtZm9yLWRhdGEtc2NpZW50aXN0cy12YWx1ZWQtYnktcmVjcnVpdGVycy9waG90b3N0b3J5LzEwNDU4MDM0Mi5jbXM?oc=5,https://da.gd/rmRe
GN:T:DS,It's a Wrap on the Women in Data Science Conference at Intuit - Analytics India Magazine,https://news.google.com/rss/articles/CBMiW2h0dHBzOi8vYW5hbHl0aWNzaW5kaWFtYWcuY29tL2l0cy1hLXdyYXAtb24tdGhlLXdvbWVuLWluLWRhdGEtc2NpZW5jZS1jb25mZXJlbmNlLWF0LWludHVpdC_SAQA?oc=5,https://da.gd/H084hG
GN:T:DS,"Summer of AI, Part 2 | Carolina Data Science Now - Carolina Data Science Now - The University of North Carolina at Chapel Hill",https://news.google.com/rss/articles/CBMiN2h0dHBzOi8vZGF0YXNjaWVuY2Vub3cudW5jLmVkdS9ldmVudC9qdW5lLXNlbWluYXItMjAyMy_SAQA?oc=5,https://da.gd/7TPNO
GN:T:DS,"Stanford, Harvard revise high school math curriculum recommendations, exclude data science - The Stanford Daily",https://news.google.com/rss/articles/CBMifmh0dHBzOi8vc3RhbmZvcmRkYWlseS5jb20vMjAyMy8wNC8yNS9zdGFuZm9yZC1oYXJ2YXJkLXJldmlzZS1oaWdoLXNjaG9vbC1tYXRoLWN1cnJpY3VsdW0tcmVjb21tZW5kYXRpb25zLWV4Y2x1ZGUtZGF0YS1zY2llbmNlL9IBAA?oc=5,https://da.gd/N0HpNi
