feed,title,long_url,short_url
GN:T:RE,Could This Be the Final Frontier for Renewable Energy? - CNET,https://news.google.com/rss/articles/CBMiU2h0dHBzOi8vd3d3LmNuZXQuY29tL3NjaWVuY2UvY291bGQtdGhpcy1iZS10aGUtZmluYWwtZnJvbnRpZXItZm9yLXJlbmV3YWJsZS1lbmVyZ3kv0gEA?oc=5,https://da.gd/NIfzU
GN:T:RE,EU countries to finalise 42.5% renewable energy target - Reuters,https://news.google.com/rss/articles/CBMiZGh0dHBzOi8vd3d3LnJldXRlcnMuY29tL3N1c3RhaW5hYmlsaXR5L2V1LWNvdW50cmllcy1maW5hbGlzZS00MjUtcmVuZXdhYmxlLWVuZXJneS10YXJnZXQtMjAyMy0wNS0xNS_SAQA?oc=5,https://da.gd/PGDmOy
GN:T:RE,Here's what the the US needs to do right now to upgrade the grid - Electrek,https://news.google.com/rss/articles/CBMiL2h0dHBzOi8vZWxlY3RyZWsuY28vMjAyMy8wNS8xNS91cy1ncmlkLXVwZ3JhZGUv0gEA?oc=5,https://da.gd/SUEOsw
GN:T:RE,Japan opts for wind and hydrogen to help achieve its green future - Euronews,https://news.google.com/rss/articles/CBMiZWh0dHBzOi8vd3d3LmV1cm9uZXdzLmNvbS8yMDIzLzA1LzE1L2phcGFuLW9wdHMtZm9yLXdpbmQtYW5kLWh5ZHJvZ2VuLXRvLWhlbHAtYWNoaWV2ZS1pdHMtZ3JlZW4tZnV0dXJl0gEA?oc=5,https://da.gd/LS2r
GN:T:RE,French startup Holosolis to build 5GW PV module assembly plant - PV Tech,https://news.google.com/rss/articles/CBMiV2h0dHBzOi8vd3d3LnB2LXRlY2gub3JnL2ZyZW5jaC1zdGFydHVwLWhvbG9zb2xpcy10by1idWlsZC01Z3ctcHYtbW9kdWxlLWFzc2VtYmx5LXBsYW50L9IBAA?oc=5,https://da.gd/WR3y
