feed,title,long_url,short_url
GN:S:RL,Using machine learning to decode animal communication - Science,https://news.google.com/rss/articles/CBMiM2h0dHBzOi8vd3d3LnNjaWVuY2Uub3JnL2RvaS8xMC4xMTI2L3NjaWVuY2UuYWRnNzMxNNIBAA?oc=5,https://da.gd/jQeZQS
GN:S:RL,Improving artificial intelligence with games - Science,https://news.google.com/rss/articles/CBMiM2h0dHBzOi8vd3d3LnNjaWVuY2Uub3JnL2RvaS8xMC4xMTI2L3NjaWVuY2UuYWRoODEzNdIBAA?oc=5,https://da.gd/Y3ATGt
GN:S:RL,F.T.C. Is Investigating ChatGPT Maker - The New York Times,https://news.google.com/rss/articles/CBMiU2h0dHBzOi8vd3d3Lm55dGltZXMuY29tLzIwMjMvMDcvMTMvdGVjaG5vbG9neS9jaGF0Z3B0LWludmVzdGlnYXRpb24tZnRjLW9wZW5haS5odG1s0gEA?oc=5,https://da.gd/vWXQAZ
GN:S:RL,Could dynamic sparsity end GPU shortages for good? - TechHQ,https://news.google.com/rss/articles/CBMiZmh0dHBzOi8vdGVjaGhxLmNvbS8yMDIzLzA3L2xpa2UtdGhlLXNvdW5kLW9mLXByaXZhdGUtYWlyLWdhcHBlZC1sbG1zLXdlbGNvbWUtdG8tZ2VuZXJhdGl2ZS1haS1vbi1jcHVzL9IBAA?oc=5,https://da.gd/rHL5
GN:S:RL,It's a '90s Browser War Redux as Musk and Meta Enter AI Race - PYMNTS,https://news.google.com/rss/articles/CBMicWh0dHBzOi8vd3d3LnB5bW50cy5jb20vYXJ0aWZpY2lhbC1pbnRlbGxpZ2VuY2UtMi8yMDIzL2l0cy1hLTkwcy1icm93c2VyLXdhci1yZWR1eC1hcy1tdXNrLWFuZC1tZXRhLWVudGVyLWFpLXJhY2Uv0gEA?oc=5,https://da.gd/iGTjl
GN:S:RL,LZH researches method to make formable hybrid components - Optics,https://news.google.com/rss/articles/CBMiH2h0dHBzOi8vb3B0aWNzLm9yZy9uZXdzLzE0LzcvMTnSAQA?oc=5,https://da.gd/XRm29z
