feed,title,long_url,short_url
GN:S:C,Some $340 bln of pledged climate cash did not go where needed ... - Reuters,https://news.google.com/rss/articles/CBMif2h0dHBzOi8vd3d3LnJldXRlcnMuY29tL2J1c2luZXNzL2Vudmlyb25tZW50L3NvbWUtMzQwLWJsbi1wbGVkZ2VkLWNsaW1hdGUtY2FzaC1kaWQtbm90LWdvLXdoZXJlLW5lZWRlZC1vbmUtY2FtcGFpZ24tMjAyMy0xMS0zMC_SAQA?oc=5,https://da.gd/se1p5
GN:S:C,Feds Can Fight Climate Change by Buying the Right Food - Earthjustice,https://news.google.com/rss/articles/CBMiZGh0dHBzOi8vZWFydGhqdXN0aWNlLm9yZy9leHBlcnRzL3BldGVyLWxlaG5lci9mZWRzLWNhbi1maWdodC1jbGltYXRlLWNoYW5nZS1ieS1idXlpbmctdGhlLXJpZ2h0LWZvb2TSAQA?oc=5,https://da.gd/wAEfn
GN:S:C,"San José Climate Art Program | City of San José - City of San Jose, CA",https://news.google.com/rss/articles/CBMiWmh0dHBzOi8vd3d3LnNhbmpvc2VjYS5nb3YveW91ci1nb3Zlcm5tZW50L2RlcGFydG1lbnRzLW9mZmljZXMvc2FuLWpvc2UtY2xpbWF0ZS1hcnQtcHJvZ3JhbdIBAA?oc=5,https://da.gd/84G5T
GN:S:C,"Researching climate trends through the study of ancient, single ... - Rowan Today",https://news.google.com/rss/articles/CBMiPGh0dHBzOi8vdG9kYXkucm93YW4uZWR1L25ld3MvMjAyMy8xMS9tZWV0LWdlcmFsZC1ydXN0aWMuaHRtbNIBAA?oc=5,https://da.gd/zmwxLl
GN:S:C,Meteorologists face pushback in regions that are more skeptical of ... - NPR,https://news.google.com/rss/articles/CBMiemh0dHBzOi8vd3d3Lm5wci5vcmcvMjAyMy8xMS8yOS8xMjE1OTgyODE2L21ldGVvcm9sb2dpc3RzLWZhY2UtcHVzaGJhY2staW4tcmVnaW9ucy10aGF0LWFyZS1tb3JlLXNrZXB0aWNhbC1vZi1jbGltYXRlLXNjaWVu0gEA?oc=5,https://da.gd/r7EQ
GN:S:C,Missoula County asks DEQ to add climate impacts to policy review - KPAX News,https://news.google.com/rss/articles/CBMiamh0dHBzOi8vd3d3LmtwYXguY29tL25ld3MvbWlzc291bGEtY291bnR5L21pc3NvdWxhLWNvdW50eS1hc2tzLWRlcS10by1hZGQtY2xpbWF0ZS1pbXBhY3RzLXRvLXBvbGljeS1yZXZpZXfSAQA?oc=5,https://da.gd/puFr3
