feed,title,long_url,short_url
GN:S:GW,Climate scientist Michael Mann: 'Our destiny is still mostly in our own hands' - Financial Times,https://news.google.com/rss/articles/CBMiP2h0dHBzOi8vd3d3LmZ0LmNvbS9jb250ZW50LzNkMjBmMGIwLTQ2NzAtNDU2NC05YzlhLWQyOWMxM2Y5MjMzNdIBAA?oc=5,https://da.gd/mnTI
GN:S:GW,Five lessons from a London neighbourhood's battle against global warming - Financial Times,https://news.google.com/rss/articles/CBMiP2h0dHBzOi8vd3d3LmZ0LmNvbS9jb250ZW50LzlmNjI4YjBmLWM1YzAtNDk4Zi05OGI3LTAwOGU3Y2NiNmJjONIBAA?oc=5,https://da.gd/UXNjWm
GN:S:GW,UNFCCC partners with Microsoft to use AI and advanced data ... - Microsoft,https://news.google.com/rss/articles/CBMiuwFodHRwczovL25ld3MubWljcm9zb2Z0LmNvbS8yMDIzLzExLzI5L3VuZmNjYy1wYXJ0bmVycy13aXRoLW1pY3Jvc29mdC10by11c2UtYWktYW5kLWFkdmFuY2VkLWRhdGEtdGVjaG5vbG9neS10by10cmFjay1nbG9iYWwtY2FyYm9uLWVtaXNzaW9ucy1hbmQtYXNzZXNzLXByb2dyZXNzLXVuZGVyLXRoZS1wYXJpcy1hZ3JlZW1lbnQv0gEA?oc=5,https://da.gd/t0Ts7
GN:S:GW,How do you flee climate change? - UNHCR,https://news.google.com/rss/articles/CBMiJGh0dHBzOi8vd3d3LnVuaGNyLm9yZy9jbGltYXRlLWFjdGlvbtIBAA?oc=5,https://da.gd/aGQcZh
GN:S:GW,Climate change thins 'marimo' moss balls in Hokkaido lake | The ... - 朝日新聞デジタル,https://news.google.com/rss/articles/CBMiK2h0dHBzOi8vd3d3LmFzYWhpLmNvbS9hancvYXJ0aWNsZXMvMTUwNTc4MjLSAQA?oc=5,https://da.gd/Qhd7x
