feed,title,long_url,short_url
RS,Advancing Building Damage Classification Accuracy through Machine Learning-based Model Design,https://www.researchsquare.com/article/rs-4219712/latest,https://da.gd/Xaxje
RS,Machine learning-based models predict postoperative cardiovascular and neurological complications after pneumonectomy: A 10-year retrospective observational study,https://www.researchsquare.com/article/rs-4164223/latest,https://da.gd/pIJ6y
RS,Comparative analysis of machine learning and time series models for cotton yield prediction in major growing districts of Karnataka,https://www.researchsquare.com/article/rs-3991818/latest,https://da.gd/NNea7
RS,Establishment and Validation of Predictive Model of ARDS in critically ill patients,https://www.researchsquare.com/article/rs-4160584/latest,https://da.gd/59rF
RS,The detection of absence seizures using cross-frequency coupling analysis with a deep learning network,https://www.researchsquare.com/article/rs-4178484/latest,https://da.gd/624BZ
RS,Effects of attention on the asymmetric serial dependences between form and motion patterns and their computational processes,https://www.researchsquare.com/article/rs-4149226/latest,https://da.gd/s6jSZb
RS,"Digitally enabled, self-referral as an effective approach for young autistic people to access support",https://www.researchsquare.com/article/rs-4048189/latest,https://da.gd/ybA3H
RS,A Machine Learning Algorithm for the Detection of Paroxysmal Nocturnal Haemoglobinuria (PNH) in UK Primary Care Electronic Health Records,https://www.researchsquare.com/article/rs-4236637/latest,https://da.gd/ZueTf
RS,Influence of Bifurcation Morphology on Exercise-Induced PAH Deposition in the Lungs: A Computational Modeling Approach for Air Quality Research,https://www.researchsquare.com/article/rs-4209055/latest,https://da.gd/dX8ky8
RS,Artificial Neural Network models (ANNs) in identifying Idiopathic Normal Pressure Hydrocephalus (INPH) and Alzheimer Dementia (AD) patients: clinical psychological features and differential diagnosis,https://www.researchsquare.com/article/rs-4202698/latest,https://da.gd/ubmPy1
RS,An analysis of the mediating factors of suicide risk in adolescents with depressive disorder based on machine learning,https://www.researchsquare.com/article/rs-4217941/latest,https://da.gd/s7e8
RS,Contention-aware Greedy Heuristic Method and Learning based Method for Load Balancing through Scheduling for Containers in Cloud Computing Environments,https://www.researchsquare.com/article/rs-4180411/latest,https://da.gd/oAmWgC
RS,Anatomical factor associated with thoracic procedural difficulty in robot-assisted minimally invasive esophagectomy,https://www.researchsquare.com/article/rs-4187756/latest,https://da.gd/t1XS0A
RS,A deep learning-based approach for automated two-stage femur segmentation,https://www.researchsquare.com/article/rs-4200861/latest,https://da.gd/iTsPqU
