feed,title,long_url,short_url
GN:T:CC,"Solar supply chains must diversify away from China, warns EDP - Financial Times",https://news.google.com/rss/articles/CBMiP2h0dHBzOi8vd3d3LmZ0LmNvbS9jb250ZW50LzZlY2VlNWQyLWU4NmItNDlkMy05YjdmLWRhOTM3YmY4Yjk5M9IBAA?oc=5,https://da.gd/jg20tn
GN:T:CC,How early warning systems saves lives in climate change emergencies - Vox,https://news.google.com/rss/articles/CBMiZ2h0dHBzOi8vd3d3LnZveC5jb20vY2xpbWF0ZS8yMzg4NjExOC9jbGltYXRlLWNoYW5nZS1kaXNhc3Rlci13YXJuaW5nLWh1cnJpY2FuZS1tYXJpYS1kb21pbmljYS1jYXJpYmJlYW7SAQA?oc=5,https://da.gd/nSOYm
GN:T:CC,"Thousands of new trees coming to 10 Bay Area cities in bid to right old wrongs, address climate change - The Mercury News",https://news.google.com/rss/articles/CBMijQFodHRwczovL3d3dy5tZXJjdXJ5bmV3cy5jb20vMjAyMy8wOS8yNS90aG91c2FuZHMtb2YtbmV3LXRyZWVzLWNvbWluZy10by0xMC1iYXktYXJlYS1jaXRpZXMtaW4tYmlkLXRvLXJpZ2h0LW9sZC13cm9uZ3MtYWRkcmVzcy1jbGltYXRlLWNoYW5nZS_SAZEBaHR0cHM6Ly93d3cubWVyY3VyeW5ld3MuY29tLzIwMjMvMDkvMjUvdGhvdXNhbmRzLW9mLW5ldy10cmVlcy1jb21pbmctdG8tMTAtYmF5LWFyZWEtY2l0aWVzLWluLWJpZC10by1yaWdodC1vbGQtd3JvbmdzLWFkZHJlc3MtY2xpbWF0ZS1jaGFuZ2UvYW1wLw?oc=5,https://da.gd/jsI1Z
GN:T:CC,"Extreme global warming could eventually wipe out humans, first-ever supercomputer climate models warn - Sky News",https://news.google.com/rss/articles/CBMiiAFodHRwczovL25ld3Muc2t5LmNvbS9zdG9yeS9leHRyZW1lLWdsb2JhbC13YXJtaW5nLWNvdWxkLWV2ZW50dWFsbHktd2lwZS1vdXQtaHVtYW5zLWZpcnN0LWV2ZXItc3VwZXJjb21wdXRlci1jbGltYXRlLW1vZGVscy13YXJuLTEyOTY5NzE40gGMAWh0dHBzOi8vbmV3cy5za3kuY29tL3N0b3J5L2FtcC9leHRyZW1lLWdsb2JhbC13YXJtaW5nLWNvdWxkLWV2ZW50dWFsbHktd2lwZS1vdXQtaHVtYW5zLWZpcnN0LWV2ZXItc3VwZXJjb21wdXRlci1jbGltYXRlLW1vZGVscy13YXJuLTEyOTY5NzE4?oc=5,https://da.gd/aCipmn
GN:T:CC,Breaching the Limit: Global Concerns Rise As Six Key Planetary Boundaries Are Exceeded - SciTechDaily,https://news.google.com/rss/articles/CBMib2h0dHBzOi8vc2NpdGVjaGRhaWx5LmNvbS9icmVhY2hpbmctdGhlLWxpbWl0LWdsb2JhbC1jb25jZXJucy1yaXNlLWFzLXNpeC1rZXktcGxhbmV0YXJ5LWJvdW5kYXJpZXMtYXJlLWV4Y2VlZGVkL9IBAA?oc=5,https://da.gd/a5N7La
GN:T:CC,"Standing ovation for Ukrainian who fought with Nazis sparks anger, apology in Canada - NBC News",https://news.google.com/rss/articles/CBMifmh0dHBzOi8vd3d3Lm5iY25ld3MuY29tL3ZpZGVvL3N0YW5kaW5nLW92YXRpb24tZm9yLXVrcmFpbmlhbi13aG8tZm91Z2h0LXdpdGgtbmF6aXMtc3BhcmtzLWFuZ2VyLWFwb2xvZ3ktaW4tY2FuYWRhLTE5MzY5NTgxMzcyOdIBN2h0dHBzOi8vd3d3Lm5iY25ld3MuY29tL25ld3MvYW1wLXZpZGVvL21tdm8xOTM2OTU4MTM3Mjk?oc=5,https://da.gd/1jJ19V
GN:T:CC,"Insurers' role, essential to addressing impacts of climate change - APCIA - Insurance Business",https://news.google.com/rss/articles/CBMijQFodHRwczovL3d3dy5pbnN1cmFuY2VidXNpbmVzc21hZy5jb20vdXMvbmV3cy9icmVha2luZy1uZXdzL2luc3VyZXJzLXJvbGUtZXNzZW50aWFsLXRvLWFkZHJlc3NpbmctaW1wYWN0cy1vZi1jbGltYXRlLWNoYW5nZS0tYXBjaWEtNDYwODA3LmFzcHjSAQA?oc=5,https://da.gd/I4Sx
GN:T:CC,FAO's Kaveh Zahedi on food systems transformation in challenging times - FoodNavigator,https://news.google.com/rss/articles/CBMid2h0dHBzOi8vd3d3LmZvb2RuYXZpZ2F0b3IuY29tL0FydGljbGUvMjAyMy8wOS8yNS9mYW8tcy1rYXZlaC16YWhlZGktb24tZm9vZC1zeXN0ZW1zLXRyYW5zZm9ybWF0aW9uLWluLWNoYWxsZW5naW5nLXRpbWVz0gEA?oc=5,https://da.gd/dxyUp
