feed,title,long_url,short_url
RS,Forecasting earthquakes by Machine Learning techniques: lights and shadows,https://www.researchsquare.com/article/rs-7590274/latest,
RS,GraphAware: Interpretable machine learning on graphs,https://www.researchsquare.com/article/rs-7471432/latest,
RS,Leveraging EMR Data with AI to Forecast Genetic Testing Results in Neonatal Care using LUMINA,https://www.researchsquare.com/article/rs-7632718/latest,
RS,Using AI to Create Cultural Content: Ethnographic Insights into Everyday Ethics,https://www.researchsquare.com/article/rs-6926166/latest,
RS,BiRLNN: Bidirectional Reinforcement-Learning Neural Network for Constrained Molecular Design,https://www.researchsquare.com/article/rs-7540516/latest,
RS,Mapping Multipolarity: Soft and Hard Power in the Digital Age,https://www.researchsquare.com/article/rs-7276683/latest,
RS,Hardware-Aware RNA-seq Diagnostics: Plant Virus Detection via Cloud and AI,https://www.researchsquare.com/article/rs-6667739/latest,
RS,A Study of the Impact of Digital Competence on Household Sports Consumption,https://www.researchsquare.com/article/rs-7472716/latest,
RS,Team dynamics and efficiency in post-editing: Machine translation systems versus artificial intelligence chatbots under tight deadline conditions,https://www.researchsquare.com/article/rs-6892673/latest,
RS,Nutrient–response modeling with a single and interpretable artificial neuron,https://www.researchsquare.com/article/rs-7700387/latest,
RS,"A bibliometric review on the trends, issues and concerns on AI assisting in diagnostics, drug discovery, personalized medicine, and treatment planning",https://www.researchsquare.com/article/rs-7370235/latest,
RS,Root and Root Canal Morphology of Mandibular Anterior Teeth in a Jordanian Subpopulation: A Cross-Sectional Cone-Beam Computed Tomography Study,https://www.researchsquare.com/article/rs-7704890/latest,
RS,Machine Learning Approaches for Predicting Mobile Financial Services Growth: A Comprehensive Multi-Target Analysis of Bangladesh's Digital Financial Ecosystem,https://www.researchsquare.com/article/rs-7383963/latest,
