feed,title,long_url,short_url
GN:T:RE,Flipkart announces 2040 net zero charge | Materials & Production News | News - Ecotextile News,https://www.ecotextile.com/2022062729534/materials-production-news/flipkart-announces-2040-net-zero-charge.html,
GN:T:RE,EcoFlow's turnkey off-grid power system just needs sun - The Verge,https://www.theverge.com/2022/6/27/23184578/vanlife-all-in-one-solar-power-battery-price-specs,
GN:T:RE,"Borqs’ Solar Energy Storage Systems Subsidiary Presents at Cantor Fitzgerald Conference Started in Hawaii with over $128 million in contracts to be signed within 2022, and now coming to California - Yahoo Finance",https://finance.yahoo.com/news/borqs-solar-energy-storage-systems-130000336.html,
GN:T:RE,Historical court ruling for agrivoltaics in Italy – pv magazine International - pv magazine International,https://www.pv-magazine.com/2022/06/27/historical-court-ruling-for-agrivoltaics-in-italy/,
GN:T:RE,"Go-With-the-Flow Wind Turbine, Conceived by UVA Prof, Completes Successful Demo - UVA Today",https://news.virginia.edu/content/go-flow-wind-turbine-conceived-uva-prof-completes-successful-demo,
GN:T:RE,The G7’s chance for a just climate transition - POLITICO Europe,https://www.politico.eu/article/g7-chance-just-climate-transition/,
GN:T:RE,A rethink of the building blocks for solar panels could help mass production - Tech Xplore,https://techxplore.com/news/2022-06-rethink-blocks-solar-panels-mass.html,
