feed,title,long_url,short_url
ArXiv,Deep Reinforcement Learning Empowered Rate Selection of XP-HARQ,https://arxiv.org/abs/2308.02140v1,
ArXiv,Learning to Shape by Grinding: Cutting-surface-aware Model-based Reinforcement Learning,https://arxiv.org/abs/2308.02150v1,
ArXiv,ESRL: Efficient Sampling-based Reinforcement Learning for Sequence Generation,https://arxiv.org/abs/2308.02223v1,
ArXiv,Communication-Efficient Decentralized Multi-Agent Reinforcement Learning for Cooperative Adaptive Cruise Control,https://arxiv.org/abs/2308.02345v1,
ArXiv,Nonprehensile Planar Manipulation through Reinforcement Learning with Multimodal Categorical Exploration,https://arxiv.org/abs/2308.02459v1,
ArXiv,Exploiting Multiple Abstractions in Episodic RL via Reward Shaping,https://arxiv.org/abs/2303.00516v2,
