feed,title,long_url,short_url
MX,"Lessons learned during Ebola crisis can help manage Marburg outbreak, says expert",https://medicalxpress.com/news/2023-03-lessons-ebola-crisis-marburg-outbreak.html,https://da.gd/Zgvqex
MX,"Study: Paxlovid reduces risk of long-term health problems, death from COVID-19",https://medicalxpress.com/news/2023-03-paxlovid-long-term-health-problems-death.html,https://da.gd/6gfZ
MX,Updated treatment guidelines for drug-resistant TB,https://medicalxpress.com/news/2023-03-treatment-guidelines-drug-resistant-tb.html,https://da.gd/qLfA5j
MX,Tuberculosis deaths rising again in Europe: WHO,https://medicalxpress.com/news/2023-03-tuberculosis-deaths-europe.html,https://da.gd/6B4Kj
MX,A readily available dietary supplement may reverse organ damage caused by HIV and antiretroviral therapy,https://medicalxpress.com/news/2023-03-readily-dietary-supplement-reverse-hiv.html,https://da.gd/y7v7n
