feed,title,long_url,short_url
ArXiv:q-bio,Mind the gap: Challenges of deep learning approaches to Theory of Mind,https://arxiv.org/abs/2203.16540v1,
ArXiv:q-bio,"Joint Sensing, Communication and Localization of a Silent Abnormality Using Molecular Diffusion",https://arxiv.org/abs/2203.16641v1,
ArXiv:q-bio,The ideal data compression and automatic discovery of hidden law using neural network,https://arxiv.org/abs/2203.16941v1,
ArXiv:q-bio,Human wealth evolution is an accelerating expansion underpinned by a decelerating optimization process,https://arxiv.org/abs/2203.17087v1,
ArXiv:q-bio,A Computational Architecture for Machine Consciousness and Artificial Superintelligence: Updating Working Memory Iteratively,https://arxiv.org/abs/2203.17255v1,
ArXiv:q-bio,An Introductory Tutorial on Cohort State-Transition Models in R Using a Cost-Effectiveness Analysis Example,https://arxiv.org/abs/2001.07824v4,
ArXiv:q-bio,Metastable dynamics of neural circuits and networks,https://arxiv.org/abs/2110.03025v3,
ArXiv:q-bio,A Bayesian Approach to Modelling Biological Pattern Formation with Limited Data,https://arxiv.org/abs/2203.14742v2,
ArXiv:q-bio,Cusp Bifurcation in Metastatic Breast Cancer Cells,https://arxiv.org/abs/2203.15888v2,
ArXiv:q-bio,Cointegration of SARS-CoV-2 Transmission with Weather Conditions and Mobility during the First Year of the COVID-19 Pandemic in the United States,https://arxiv.org/abs/2203.16330v2,
