feed,title,long_url,short_url
GN:T:AI,Unearthing Data: Vision AI Startup Digs Into Digital Twins for Mining and Construction - Nvidia,https://blogs.nvidia.com/blog/2022/11/03/skycatch-vision-ai-digital-twins/,https://bit.ly/3NvInWi
GN:T:AI,EU companies in danger of AI 'dependence' on US and China - Science Business,https://sciencebusiness.net/news/eu-companies-danger-ai-dependence-us-and-china,https://bit.ly/3NxQnWE
GN:T:AI,AMP Robotics raises $91m for AI-based recycling ... - eeNews Europe,https://www.eenewseurope.com/en/amp-robotics-raises-91m-for-ai-based-recycling/,https://bit.ly/3FHHDva
GN:T:AI,A.I.’s industrial age is dawning. These tech executives can help you navigate the new era - Fortune,https://fortune.com/2022/11/03/ai-artificial-intelligence-brainstorm-ai-2022-meta-microsoft-apple-stanford/,https://bit.ly/3zKT4yr
GN:T:AI,Onsite Apartment Staff Sometimes Struggles with AI - Globe St,https://www.globest.com/2022/11/03/stubborn-onsite-apartment-staff-sometimes-struggles-with-ai/,https://bit.ly/3FHM8pD
