feed,title,long_url,short_url
MX,Allergic asthma transforms cells of the airway,https://medicalxpress.com/news/2020-09-allergic-asthma-cells-airway.html,https://j.mp/3jLNvWf
MX,"Weekly injection could treat type 2 diabetes, new enzyme discovery suggests",https://medicalxpress.com/news/2020-09-weekly-diabetes-enzyme-discovery.html,https://j.mp/32SvaQl
MX,Choosing the wrong health insurance could kill you,https://medicalxpress.com/news/2020-09-wrong-health.html,https://j.mp/350WVc9
MX,Chadwick Boseman died of colon cancer at just 43. Here's what under-50s need to know about bowel cancer,https://medicalxpress.com/news/2020-09-chadwick-boseman-died-colon-cancer.html,https://j.mp/3blz8F5
MX,Exposure to cadmium in the womb linked to childhood asthma and allergies,https://medicalxpress.com/news/2020-09-exposure-cadmium-womb-linked-childhood.html,https://j.mp/31SPjq8
