feed,title,long_url,short_url
Medium,Live Project Based Training in Noida,https://medium.com/p/7d606a3805f2,
Medium,Artificial Intelligence Enters the Era of No Code,https://medium.com/p/ec8f5e600687,
Medium,Microsoft Sentinel Machine Learning (ML) based Threat Detection Rules,https://medium.com/p/283c22af2f6d,
Medium,Singular Value Decomposition and LSI,https://medium.com/p/d6e13c55200d,
Medium,Trading Crypto with Facebook’s Machine Learning Model and News Sentiment,https://medium.com/p/d3aadaec84c4,
Medium,Machine Learning — 給自己的機器學習筆記 — Kaggle競賽必備!!,https://medium.com/p/86305848a0c4,
Medium,Creating a shapefile from a set of coordinates,https://medium.com/p/c1783fee607f,
Medium,Random Variables And Its Types In Statistics In Just 5 Minutes,https://medium.com/p/d3dd4d06542f,
Medium,Merkle Sokrati interview experience,https://medium.com/p/78afabc40d75,
