feed,title,long_url,short_url
GN:S:C,"Danish firm’s ‘climate-controlled pork’ claim misleading, court rules - The Guardian",https://news.google.com/rss/articles/CBMidGh0dHBzOi8vd3d3LnRoZWd1YXJkaWFuLmNvbS9lbnZpcm9ubWVudC8yMDI0L21hci8wMS9kYW5pc2gtZmlybS1jbGltYXRlLWNvbnRyb2xsZWQtcG9yay1jbGFpbS1taXNsZWFkaW5nLWNvdXJ0LXJ1bGVz0gF0aHR0cHM6Ly9hbXAudGhlZ3VhcmRpYW4uY29tL2Vudmlyb25tZW50LzIwMjQvbWFyLzAxL2RhbmlzaC1maXJtLWNsaW1hdGUtY29udHJvbGxlZC1wb3JrLWNsYWltLW1pc2xlYWRpbmctY291cnQtcnVsZXM?oc=5,https://da.gd/893ltG
GN:S:C,"Lobster catch dips to lowest level since 2009 as fishers grapple with climate change, whale rules - Yahoo! Voices",https://news.google.com/rss/articles/CBMiSWh0dHBzOi8vd3d3LnlhaG9vLmNvbS9uZXdzL2xvYnN0ZXItY2F0Y2gtZGlwcy1sb3dlc3QtbGV2ZWwtMTQ1MjIzNzQ3Lmh0bWzSAQA?oc=5,https://da.gd/p7Eeiw
GN:S:C,E.P.A. Sets New Rules to Limit Damage From Disasters at Chemical Facilities - The New York Times,https://news.google.com/rss/articles/CBMiWWh0dHBzOi8vd3d3Lm55dGltZXMuY29tLzIwMjQvMDMvMDEvY2xpbWF0ZS9lcGEtY2hlbWljYWwtcnVsZXMtd2lsZGZpcmUtZmxvb2QtY2xpbWF0ZS5odG1s0gEA?oc=5,https://da.gd/otj8gy
GN:S:C,NIH Climate Change and Health Coordinating Center hosts first conference - Environmental Factor Newsletter,https://news.google.com/rss/articles/CBMiTmh0dHBzOi8vZmFjdG9yLm5pZWhzLm5paC5nb3YvMjAyNC8zL2JleW9uZC10aGUtYmVuY2gvY2xpbWF0ZS1oZWFsdGgtY29uZmVyZW5jZdIBAA?oc=5,https://da.gd/Lbpb3
GN:S:C,Does Climate Fiction (and Filmmaking) Work? - Colby News,https://news.google.com/rss/articles/CBMiRmh0dHBzOi8vbmV3cy5jb2xieS5lZHUvc3RvcnkvZG9lcy1jbGltYXRlLWZpY3Rpb24tYW5kLWZpbG1tYWtpbmctd29yay_SAQA?oc=5,https://da.gd/5RynyA
GN:S:C,"Republicans’ views of climate change, energy issues - Pew Research Center",https://news.google.com/rss/articles/CBMiaWh0dHBzOi8vd3d3LnBld3Jlc2VhcmNoLm9yZy9zaG9ydC1yZWFkcy8yMDI0LzAzLzAxL2hvdy1yZXB1YmxpY2Fucy12aWV3LWNsaW1hdGUtY2hhbmdlLWFuZC1lbmVyZ3ktaXNzdWVzL9IBAA?oc=5,https://da.gd/OqEZA
GN:S:C,Zombie climate myths that refuse to die (feat. Bob Henson) » Yale Climate Connections - Yale Climate Connections,https://news.google.com/rss/articles/CBMiY2h0dHBzOi8veWFsZWNsaW1hdGVjb25uZWN0aW9ucy5vcmcvMjAyNC8wMy96b21iaWUtY2xpbWF0ZS1teXRocy10aGF0LXJlZnVzZS10by1kaWUtZmVhdC1ib2ItaGVuc29uL9IBAA?oc=5,https://da.gd/3AT0
GN:S:C,Challenges and Prospects for Modeling Lake Water Temperature in a Changing Climate - Eos,https://news.google.com/rss/articles/CBMibmh0dHBzOi8vZW9zLm9yZy9lZGl0b3JzLXZveC9jaGFsbGVuZ2VzLWFuZC1wcm9zcGVjdHMtZm9yLW1vZGVsaW5nLWxha2Utd2F0ZXItdGVtcGVyYXR1cmUtaW4tYS1jaGFuZ2luZy1jbGltYXRl0gEA?oc=5,https://da.gd/QPjHZb
GN:S:C,Antonio Diaz Aranda: The young engineer elevating youth voices in climate issues - UNESCO,https://news.google.com/rss/articles/CBMia2h0dHBzOi8vd3d3LnVuZXNjby5vcmcvZW4vYXJ0aWNsZXMvYW50b25pby1kaWF6LWFyYW5kYS15b3VuZy1lbmdpbmVlci1lbGV2YXRpbmcteW91dGgtdm9pY2VzLWNsaW1hdGUtaXNzdWVz0gEA?oc=5,https://da.gd/f6UZzl
GN:S:C,Climate protesters in Germany join forces with public transport workers to push for change - Clean Energy Wire,https://news.google.com/rss/articles/CBMicGh0dHBzOi8vd3d3LmNsZWFuZW5lcmd5d2lyZS5vcmcvbmV3cy9jbGltYXRlLXByb3Rlc3RlcnMtZ2VybWFueS1qb2luLWZvcmNlcy1wdWJsaWMtdHJhbnNwb3J0LXdvcmtlcnMtcHVzaC1jaGFuZ2XSAQA?oc=5,https://da.gd/rntW7
GN:S:C,Big oil pays for increasing production despite climate pledges - Euronews,https://news.google.com/rss/articles/CBMidGh0dHBzOi8vd3d3LmV1cm9uZXdzLmNvbS9idXNpbmVzcy8yMDI0LzAzLzAxL2JpZy1vaWwtcmV3YXJkcy1leGVjcy1mb3ItaW5jcmVhc2luZy1wcm9kdWN0aW9uLWRlc3BpdGUtY2xpbWF0ZS1wbGVkZ2Vz0gEA?oc=5,https://da.gd/EDUpS
GN:S:C,Mayor concerned over Austin Energy's climate plan revisions - The Daily Texan,https://news.google.com/rss/articles/CBMiYGh0dHBzOi8vdGhlZGFpbHl0ZXhhbi5jb20vMjAyNC8wMy8wMS9tYXlvci1jb25jZXJuZWQtb3Zlci1hdXN0aW4tZW5lcmd5cy1jbGltYXRlLXBsYW4tcmV2aXNpb25zL9IBAA?oc=5,https://da.gd/Dza9mx
GN:S:C,How can startups raise funds in this shitty economical climate? 3 investors share their insider tips - TNW,https://news.google.com/rss/articles/CBMif2h0dHBzOi8vdGhlbmV4dHdlYi5jb20vbmV3cy9ob3ctY2FuLXN0YXJ0dXBzLXJhaXNlLWZ1bmRzLWluLXRoaXMtc2hpdHR5LWVjb25vbWljYWwtY2xpbWF0ZS0zLWludmVzdG9ycy1zaGFyZS10aGVpci1pbnNpZGVyLXRpcHPSAQA?oc=5,https://da.gd/Pc4Hj
GN:S:C,ExxonMobil CEO blames public for climate inaction while Texas burns - American Journal of Transportation,https://news.google.com/rss/articles/CBMiXWh0dHBzOi8vd3d3LmFqb3QuY29tL25ld3MvZXh4b25tb2JpbC1jZW8tYmxhbWVzLXB1YmxpYy1mb3ItY2xpbWF0ZS1pbmFjdGlvbi13aGlsZS10ZXhhcy1idXJuc9IBAA?oc=5,https://da.gd/C7ih
