feed,title,long_url,short_url
Medium,How to create SaaS within 24 hours. Part 1,https://medium.com/p/46ab9d32d1f6,
Medium,Google Natural Language API — Google NLP Project with Python,https://medium.com/p/becb21150805,
Medium,5 Data Science Careers That Will Make You a Fortune!,https://medium.com/p/9179fba034af,
Medium,What is AutoML? is it Good and should YOU be using it?,https://medium.com/p/2f77577259ee,
Medium,PyTorch basics: The only guide you need to get started — Part-1,https://medium.com/p/f8e67b3d056a,
