feed,title,long_url,short_url
GN:T:WP,How wind energy is made and how it helps the Texas grid - KVUE,https://www.kvue.com/article/news/local/how-wind-energy-is-made-and-how-it-helps-the-texas-grid/269-852d1efc-b9be-492d-b2a5-a2750cbe9d7e,
GN:T:WP,UPDATE 2-Canada's Northland Power buys Spanish wind farms and solar parks - Yahoo Finance,https://finance.yahoo.com/news/1-canadas-northland-power-buys-215315286.html,
GN:T:WP,East Hampton Trustees Urge Orsted To Get Wind Farm Fisheries Studies Underway Immediately - 27 East - 27east,https://www.27east.com/east-hampton-press/east-hampton-trustees-urge-orsted-to-get-wind-farm-fisheries-studies-underway-immediately-1770071/,
GN:T:WP,"SWEPCO wind facility now producing renewable energy for customers in Louisiana, Arkansas - ArkLaTexHomepage",https://www.arklatexhomepage.com/news/local-news/swepco-wind-facility-now-producing-renewable-energy-for-customers-in-louisiana-arkansas/,
GN:T:WP,Gardline to Survey German Offshore Wind Farm - Offshore WIND,https://www.offshorewind.biz/2021/04/13/gardline-to-survey-german-offshore-wind-farm/,
GN:T:WP,"King: Alternative energy hailed as a megatrend, disrupting world order - Roanoke Times",https://roanoke.com/opinion/columnists/king-alternative-energy-hailed-as-a-megatrend-disrupting-world-order/article_d406582e-9d37-11eb-8e37-ef01c0112829.html,
