feed,title,long_url,short_url
GN:T:CC,Climate denialists find new ways to monetize disinformation on YouTube - Ars Technica,https://news.google.com/rss/articles/CBMibmh0dHBzOi8vYXJzdGVjaG5pY2EuY29tL3RlY2gtcG9saWN5LzIwMjQvMDEveW91dHViZS1wcm9maXRzLWZyb20tdmlkZW9zLWNsYWltaW5nLWdsb2JhbC13YXJtaW5nLWlzLWJlbmVmaWNpYWwv0gEA?oc=5,https://da.gd/EqnvQ9
GN:T:CC,"Expanding conflicts, U.S. election may block global climate policies - Axios",https://news.google.com/rss/articles/CBMiO2h0dHBzOi8vd3d3LmF4aW9zLmNvbS8yMDI0LzAxLzE2L2NsaW1hdGUtY2hhbmdlLXBvbGljeS0yMDI00gEA?oc=5,https://da.gd/LheciH
GN:T:CC,Pittsburgh's underground streams pose challenges and opportunities to fight climate change - PGH City Paper,https://news.google.com/rss/articles/CBMihAFodHRwczovL3d3dy5wZ2hjaXR5cGFwZXIuY29tL25ld3MvcGl0dHNidXJnaHMtdW5kZXJncm91bmQtc3RyZWFtcy1wb3NlLWNoYWxsZW5nZXMtYW5kLW9wcG9ydHVuaXRpZXMtdG8tZmlnaHQtY2xpbWF0ZS1jaGFuZ2UtMjUyNjUzNTfSAZMBaHR0cHM6Ly93d3cucGdoY2l0eXBhcGVyLmNvbS9uZXdzL3BpdHRzYnVyZ2hzLXVuZGVyZ3JvdW5kLXN0cmVhbXMtcG9zZS1jaGFsbGVuZ2VzLWFuZC1vcHBvcnR1bml0aWVzLXRvLWZpZ2h0LWNsaW1hdGUtY2hhbmdlLTI1MjY1MzU3P21lZGlhPUFNUCtIVE1M?oc=5,https://da.gd/oOh4l
GN:T:CC,A Slightly Hotter World Could Still Be a Better One - The Atlantic,https://news.google.com/rss/articles/CBMiaWh0dHBzOi8vd3d3LnRoZWF0bGFudGljLmNvbS9pZGVhcy9hcmNoaXZlLzIwMjQvMDEvc2xpZ2h0bHktaG90dGVyLXdvcmxkLWNvdWxkLXN0aWxsLWJlLWJldHRlci1vbmUvNjc3MTQ2L9IBAA?oc=5,https://da.gd/YYFHZC
GN:T:CC,"45% of CEOs fear their companies won't survive AI, climate change - Fast Company",https://news.google.com/rss/articles/CBMifmh0dHBzOi8vd3d3LmZhc3Rjb21wYW55LmNvbS85MTAxMTM3MS9uZWFybHktaGFsZi1jZW9zLWZlYXItdGhlaXItY29tcGFuaWVzLXdvbnQtc3Vydml2ZS0xMC15ZWFycy1hcy1haS1jbGltYXRlLWNoYWxsZW5nZXMtZ3Jvd9IBAA?oc=5,https://da.gd/5MXzFa
GN:T:CC,Overcoming barriers to climate-smart agriculture in South Asia - Nature,https://news.google.com/rss/articles/CBMiMmh0dHBzOi8vd3d3Lm5hdHVyZS5jb20vYXJ0aWNsZXMvczQxNTU4LTAyMy0wMTkwNS160gEA?oc=5,https://da.gd/uKVVKQ
GN:T:CC,Contrails — the lines behind airplanes — are warming the planet. Could an easy AI solution be on the horizon? - CBS News,https://news.google.com/rss/articles/CBMiP2h0dHBzOi8vd3d3LmNic25ld3MuY29tL25ld3MvY29udHJhaWxzLWFpcmxpbmVzLWNsaW1hdGUtY2hhbmdlL9IBAA?oc=5,https://da.gd/jcxg8L
GN:T:CC,"US climate envoy John Kerry, who called pope a 'moral authority' on climate, to step down - National Catholic Reporter",https://news.google.com/rss/articles/CBMiemh0dHBzOi8vd3d3Lm5jcm9ubGluZS5vcmcvZWFydGhiZWF0L3BvbGl0aWNzL3VzLWNsaW1hdGUtZW52b3ktam9obi1rZXJyeS13aG8tY2FsbGVkLXBvcGUtbW9yYWwtYXV0aG9yaXR5LWNsaW1hdGUtc3RlcC1kb3du0gEA?oc=5,https://da.gd/pipcvi
