feed,title,long_url,short_url
GN:T:RE,Could Ukraine war help end west’s reliance on hydrocarbons? - The Guardian,https://www.theguardian.com/environment/2022/mar/18/could-ukraine-war-help-end-wests-reliance-on-hydrocarbons,
GN:T:RE,New solar tiles from Denmark – pv magazine International - pv magazine International,https://www.pv-magazine.com/2022/03/17/new-solar-tiles-from-denmark/,
GN:T:RE,Blaine County leaders set sights on renewable-energy microgrid - Idaho Mountain Express and Guide,https://www.mtexpress.com/news/blaine_county/blaine-county-leaders-set-sights-on-renewable-energy-microgrid/article_84abe454-a602-11ec-9a7a-8b465037f82c.html,
GN:T:RE,A 10-Point Plan to Cut Oil Use – Analysis - IEA - IEA,https://www.iea.org/reports/a-10-point-plan-to-cut-oil-use,
GN:T:RE,China Renewable Energy Announces 2021 Annual Results - Net Profit Increased 32% to HK$113,https://finance.yahoo.com/news/china-renewable-energy-announces-2021-114300934.html,
