feed,title,long_url,short_url
GN:T:RE,China to strengthen carbon emissions measurements to help hit climate goals - South China Morning Post,https://www.scmp.com/business/china-business/article/3198141/china-set-strengthen-carbon-emissions-standard-setting-and-measurements-ensure-hitting-2060-climate,
GN:T:RE,CommonWealth Magazine - CommonWealth magazine,https://commonwealthmagazine.org/energy/baker-open-to-commonwealth-wind-negotiations/,
GN:T:RE,The UK Looks To Repurpose Natural Gas Infrastructure For Hydrogen - OilPrice,https://oilprice.com/Energy/Energy-General/The-UK-Looks-To-Repurpose-Natural-Gas-Infrastructure-For-Hydrogen.html,
GN:T:RE,Sacca’s Lowercarbon doubles down on startup bringing solar modules to Indian rooftops - TechCrunch,https://techcrunch.com/2022/11/02/saccas-lowercarbon-doubles-down-on-solarsquare-bringing-solar-modules-to-indian-rooftops/,
GN:T:RE,The world’s first offshore floating wind-solar pilot just came online in China - Electrek,https://electrek.co/2022/11/02/offshore-floating-wind-solar-pilot-china/,
GN:T:RE,Iron batteries might provide the long-term storage to clean up the energy grid - MIT Technology Review,https://www.technologyreview.com/2022/11/02/1062364/emtech-2022-innovative-moonshots-research/,
GN:T:RE,Europe's latest U-turn could threaten renewables investment - pv magazine International,https://www.pv-magazine.com/2022/11/02/europes-latest-u-turn-could-threaten-renewables-investment/,
