feed,title,long_url,short_url
GN:S:GW,"Climate change: Kilimanjaro's and Africa's last glaciers to go by 2050, says UN - BBC",https://www.bbc.com/news/science-environment-63489041,
GN:S:GW,"Cop27: what’s on the agenda of Egypt climate summit, what does it hope to achieve - will it make a difference? - NationalWorld",https://www.nationalworld.com/news/environment/cop27-agenda-issues-goals-egypt-climate-summit-what-does-it-hope-to-achieve-will-it-make-a-difference-3904319,
GN:S:GW,Emperor penguins at risk of extinction due to climate change - KY3,https://www.ky3.com/2022/11/02/emperor-penguins-risk-extinction-due-climate-change/,
GN:S:GW,G'Day COP27: Australia's global climate reset - Climate Council,https://www.climatecouncil.org.au/resources/cop27-australias-global-climate-reset/,
GN:S:GW,Report: Europe's climate warming at twice the rate of the global average - WION,https://www.wionews.com/videos/report-europes-climate-warming-at-twice-the-rate-of-the-global-average-530839,
GN:S:GW,"It’s perfectly possible to remove CO2 from the atmosphere - Professor Myles Allen, the physicist behind net zero - University of Oxford",https://www.ox.ac.uk/news-and-events/oxford-people/Myles-Allen,
