feed,title,long_url,short_url
GN:T:SP,Tandem solar modules vs commercial crystalline - pv magazine International,https://www.pv-magazine.com/2020/07/22/tandem-solar-modules-vs-commercial-crystalline/,
GN:T:SP,"Solar farm on ex-landfill brings no financial risk, SWACO says - Fci Academy",https://www.dispatch.com/news/20200721/solar-farm-on-ex-landfill-brings-no-financial-risk-swaco-says,
GN:T:SP,Solar-plus-battery project of 80 MW wins clearance in NSW - Renewables Now,https://renewablesnow.com/news/solar-plus-battery-project-of-80-mw-wins-clearance-in-nsw-707058/,
GN:T:SP,Cairns Council Releases State Of The Environment Report - Solar Quotes,https://www.solarquotes.com.au/blog/cairns-environment-solar-mb1614/,
GN:T:SP,Solar power could become cheaper and more efficient thanks to a new method that creates electricity from invisible light - Business Insider Australia,https://www.businessinsider.com.au/solar-energy-breakthrough-converts-invisible-light-into-electricity-2020-7,
