feed,title,long_url,short_url
GN:T:RE,Amazon’s latest environmental report shows innovation—not corporate promises—is the path to net-zero emissions - Fortune,https://fortune.com/2022/08/02/amazon-climate-carbon-emissions-environment-tech-innovation/,
GN:T:RE,"If the big US climate bill passes, here’s how it could turbocharge solar and wind - Electrek",https://electrek.co/2022/08/05/us-climate-solar-and-wind/,
GN:T:RE,Geothermal heating and cooling: Renewable energy’s hidden gem - Yale Climate Connections,https://yaleclimateconnections.org/2022/08/geothermal-heating-and-cooling-renewable-energys-hidden-gem/,
GN:T:RE,PV - GameChange Solar Secures 400 MW Of Genius Tracker? Orders from Bridgelink - Renewable Energy Magazine,https://www.renewableenergymagazine.com/pv_solar/gamechange-solar-secures-400-mw-of-genius-20220805,
GN:T:RE,Louisa County changing solar regulations - NBC 29,https://www.nbc29.com/2022/08/05/louisa-county-changing-solar-regulations/,
GN:T:RE,A New Orleans nonprofit hopes to keep restaurants fully operational via solar power during hurricane recovery and cool residents - Louisiana Radio Network,https://louisianaradionetwork.com/2022/08/05/a-new-orleans-nonprofit-hopes-to-keep-restaurants-fully-operational-via-solar-power-during-hurricane-recovery/,
