feed,title,long_url,short_url
GN:S:C,Vilsack: Agriculture Poised for First and Best Wins on Climate - Agweb Powered by Farm Journal,https://www.agweb.com/news/policy/politics/vilsack-agriculture-poised-first-and-best-wins-climate,
GN:S:C,Global blueprint for climate disclosures by companies due in September - Reuters,https://www.reuters.com/article/us-climate-change-accounts/global-accounting-body-to-propose-climate-related-company-disclosures-idUSKBN2A21OE,
GN:S:C,Rep. Greg Vitali: A realistic climate agenda - TribLIVE,https://triblive.com/opinion/rep-greg-vitali-a-realistic-climate-agenda/,
GN:S:C,Reader's View: State's climate-crisis stand worthy of pride - Duluth News Tribune,https://www.duluthnewstribune.com/opinion/letters/6861354-Readers-View-State%E2%80%99s-climate-crisis-stand-worthy-of-pride,
GN:S:C,Countries prepared for the climate emergency have had fewer COVID deaths - Euronews,https://www.euronews.com/living/2021/02/02/countries-prepared-for-the-climate-emergency-have-had-fewer-covid-deaths,
GN:S:C,Opinion | G.M. and the Electric-Car Comeback - The New York Times,https://www.nytimes.com/2021/02/02/opinion/GM-electric-cars.html,
GN:S:C,Climate change in South Africa could cost up to 20% of GDP - Open Access Government,https://www.openaccessgovernment.org/climate-change-in-south-africa/102813/,
