feed,title,long_url,short_url
GN:T:ML,LatticeFlow raises $12M to eliminate computer vision blind spots - TechCrunch,https://techcrunch.com/2022/10/26/latticeflow-raises-12m-to-eliminate-computer-vision-blind-spots/,https://tcrn.ch/3TWfm83
GN:T:ML,Alternatives to deep neural networks in finance - Risk,https://www.risk.net/cutting-edge/7954947/alternatives-to-deep-neural-networks-in-finance,https://bit.ly/3TVFpMz
GN:T:ML,AI As A Service For Signal Processing - SemiEngineering,https://semiengineering.com/ai-as-a-service-for-signal-processing/,https://bit.ly/3Fifbje
GN:T:ML,Machine Learning Sourcing Contract Compliance - Ericsson,https://www.ericsson.com/en/blog/2022/10/machine-learning-sourcing-contract-compliance,https://bit.ly/3U0lfRx
GN:T:ML,Owlet turns to AI for round two of its baby cam – Pickr - Pickr,https://www.pickr.com.au/news/2022/owlet-turns-to-ai-for-round-two-of-its-baby-cam/,https://bit.ly/3Fqzqv8
