feed,title,long_url,short_url
RS,"Enablers and Barriers to Handwashing and Vaccine Uptake in Kenya, Uganda, and Tanzania in Relation to COVID-19 Prevention and Control: A Systematic Review",https://www.researchsquare.com/article/rs-2877995/latest,https://da.gd/daihWS
RS,Bayesian network approach to develop generalisable predictive model for COVID-19 vaccine uptake,https://www.researchsquare.com/article/rs-2874534/latest,https://da.gd/wI34
RS,Mental health and psychosocial situation of children and adolescents in Jordan before and after the COVID-19 pandemic: A scoping review,https://www.researchsquare.com/article/rs-2555822/latest,https://da.gd/CMDe
RS,"SARS-CoV-2 3CL-protease inhibitors derived from ML300:  investigation of P1 and replacements of the 1,2,3-benzotriazole",https://www.researchsquare.com/article/rs-2880312/latest,https://da.gd/yQZWRx
RS,Altered structural connectivity in olfactory disfunction after mild COVID-19 using probabilistic tractography,https://www.researchsquare.com/article/rs-2754540/latest,https://da.gd/NfMN2
RS,Bitcoin versus Commodity assets: Impact on the US equity market before and after COVID-19 crisis: Evidence from PLS regression,https://www.researchsquare.com/article/rs-2903970/latest,https://da.gd/Kt5o
