feed,title,long_url,short_url
GN:T:SL,Legal expert and thought leader on sea-level rise adaptation selected to lead Virginia Coastal Resilience Collaborative - William & Mary,https://news.google.com/rss/articles/CBMilwFodHRwczovL25ld3Mud20uZWR1LzIwMjMvMDkvMjIvbGVnYWwtZXhwZXJ0LWFuZC10aG91Z2h0LWxlYWRlci1vbi1zZWEtbGV2ZWwtcmlzZS1hZGFwdGF0aW9uLXNlbGVjdGVkLXRvLWxlYWQtdmlyZ2luaWEtY29hc3RhbC1yZXNpbGllbmNlLWNvbGxhYm9yYXRpdmUv0gEA?oc=5,https://da.gd/AGP9hI
GN:T:SL,Satellite spots marine heat wave off the California coast (image) - Space,https://news.google.com/rss/articles/CBMiUWh0dHBzOi8vd3d3LnNwYWNlLmNvbS9uYXNhLXN3b3Qtc2F0ZWxsaXRlLWltYWdlcy1jYWxpZm9ybmlhLW9jZWFuLXdhcm1pbmctZWwtbmlub9IBAA?oc=5,https://da.gd/0QVEK
GN:T:SL,A dramatic photograph depicting an alarmingly rapid ice melt wins Nature TTL Photographer of the Year 2023 - BBC Discover Wildlife,https://news.google.com/rss/articles/CBMiVWh0dHBzOi8vd3d3LmRpc2NvdmVyd2lsZGxpZmUuY29tL3Bob3RvZ3JhcGh5L25hdHVyZS10dGwtcGhvdG9ncmFwaGVyLW9mLXRoZS15ZWFyLTIwMjPSAQA?oc=5,https://da.gd/QL2si
GN:T:SL,The Ocean Is Now Hotter Than Ever: 4 Reasons We Must Act Now - The Good Men Project,https://news.google.com/rss/articles/CBMiaGh0dHBzOi8vZ29vZG1lbnByb2plY3QuY29tL2ZlYXR1cmVkLWNvbnRlbnQvdGhlLW9jZWFuLWlzLW5vdy1ob3R0ZXItdGhhbi1ldmVyLTQtcmVhc29ucy13ZS1tdXN0LWFjdC1ub3cv0gEA?oc=5,https://da.gd/jCgfr8
GN:T:SL,"Climate change glossary: the terms you need to understand, explained - DAWN",https://news.google.com/rss/articles/CBMiZGh0dHBzOi8vd3d3LmRhd24uY29tL25ld3MvMTc3NjM5Ny9jbGltYXRlLWNoYW5nZS1nbG9zc2FyeS10aGUtdGVybXMteW91LW5lZWQtdG8tdW5kZXJzdGFuZC1leHBsYWluZWTSAQA?oc=5,https://da.gd/6w5z9N
