feed,title,long_url,short_url
GN:T:SL,Glaciers in the Alps are melting faster than ever – and 2022 was their worst summer yet - The Conversation,https://theconversation.com/glaciers-in-the-alps-are-melting-faster-than-ever-and-2022-was-their-worst-summer-yet-189197,
GN:T:SL,Microphones dropped into ocean off Greenland to record melting icebergs - The Guardian,https://www.theguardian.com/environment/2022/oct/19/microphones-dropped-into-ocean-off-greenland-to-record-melting-icebergs,
GN:T:SL,Statement on climate action | EUMETSAT - EUMETSAT,https://www.eumetsat.int/statement-climate-action,
GN:T:SL,"Climate change: Pace of ocean warming could quadruple by 2090, study finds - Newshub",https://www.newshub.co.nz/home/new-zealand/2022/10/climate-change-ocean-warming-could-quadruple-by-2090-study-finds.html,
GN:T:SL,Landowners with council-maintained stopbanks may get annual payment - Stuff,https://www.stuff.co.nz/national/politics/local-government/130218330/landowners-with-councilmaintained-stopbanks-may-get-annual-payment,
GN:T:SL,Sea level rise threatens Swedish capital - New Straits Times,https://www.nst.com.my/opinion/columnists/2022/10/841798/sea-level-rise-threatens-swedish-capital,
