feed,title,long_url,short_url
GN:S:C,The business case for closing the 'climate gap' - Fast Company,https://www.fastcompany.com/90795308/the-business-case-for-closing-the-climate-gap,
GN:S:C,"Climate Change Will Put a Drag on U.S. Corn, Soy and Wheat Harvests by 2030 - Environmental Defense Fund",https://www.edf.org/media/climate-change-will-put-drag-us-corn-soy-and-wheat-harvests-2030,
GN:S:C,"After raising hope, Biden still lacks climate migration plan - Raleigh News & Observer",https://www.newsobserver.com/news/nation-world/national/article267542572.html,
GN:S:C,Italian economy faces threat from climate change - central bank - Reuters,https://www.reuters.com/world/europe/italian-economy-faces-threat-climate-change-central-bank-2022-10-19/,
GN:S:C,The new age of climate migration - The New Statesman,https://www.newstatesman.com/culture/books/book-of-the-day/2022/10/nomad-century-gaia-vince-new-age-climate-migration,
GN:S:C,True value of climate finance is a third of what developed countries report - Oxfam | Oxfam - Oxfam America,https://www.oxfamamerica.org/press/press-releases/true-value-of-climate-finance-is-a-third-of-what-developed-countries-report-oxfam/,
GN:S:C,Tackling wastewater can help corporations achieve climate goals | World Economic Forum - World Economic Forum,https://www.weforum.org/agenda/2022/10/wastewater-corporations-climate-goals/,
GN:S:C,Protecting very old trees can help mitigate climate change - Phys,https://phys.org/news/2022-10-trees-mitigate-climate.html,
GN:S:C,New tool to simulate climate at utility-scale PV project sites - pv magazine International,https://www.pv-magazine.com/2022/10/19/new-tool-to-simulate-climate-at-utility-scale-pv-project-sites/,
GN:S:C,Germany: No Guarantee UN Climate Talks Will End With a Deal - U,https://www.usnews.com/news/world/articles/2022-10-19/germany-no-guarantee-un-climate-talks-will-end-with-a-deal,
