feed,title,long_url,short_url
GN:T:CC,WaPo article suggesting houseplant ownership could be bad for planet takes heat: Stop the 'doom-mongering' - Fox Business,https://news.google.com/rss/articles/CBMibGh0dHBzOi8vd3d3LmZveGJ1c2luZXNzLmNvbS9tZWRpYS93YXBvLWFydGljbGUtc3VnZ2VzdGluZy1vd25pbmctaG91c2UtcGxhbnRzLWJhZC1wbGFuZXQtc3RvcC1kb29tLW1vbmdlcmluZ9IBcGh0dHBzOi8vd3d3LmZveGJ1c2luZXNzLmNvbS9tZWRpYS93YXBvLWFydGljbGUtc3VnZ2VzdGluZy1vd25pbmctaG91c2UtcGxhbnRzLWJhZC1wbGFuZXQtc3RvcC1kb29tLW1vbmdlcmluZy5hbXA?oc=5,https://da.gd/Yk98r8
GN:T:CC,Chugach files plan with regulators to create community solar farm that members can buy power from - Anchorage Daily News,https://news.google.com/rss/articles/CBMimQFodHRwczovL3d3dy5hZG4uY29tL2J1c2luZXNzLWVjb25vbXkvZW5lcmd5LzIwMjQvMDEvMDYvY2h1Z2FjaC1maWxlcy1wbGFuLXdpdGgtcmVndWxhdG9ycy10by1jcmVhdGUtY29tbXVuaXR5LXNvbGFyLWZhcm0tdGhhdC1tZW1iZXJzLWNhbi1idXktcG93ZXItZnJvbS_SAQA?oc=5,https://da.gd/LLqxt
GN:T:CC,Bjorn Lomborg blasts WaPo article suggesting house plants are harming climate: Stop the 'doom-mongering' - Fox News,https://news.google.com/rss/articles/CBMiK2h0dHBzOi8vd3d3LmZveG5ld3MuY29tL3ZpZGVvLzYzNDQ0NDAzMzAxMTLSAQA?oc=5,https://da.gd/pxRfM
GN:T:CC,"Not a mythical creature, but maybe a planet-saver: Methanotrophs and climate change - KSL",https://news.google.com/rss/articles/CBMidmh0dHBzOi8vd3d3LmtzbC5jb20vYXJ0aWNsZS81MDgxNzAwMS9ub3QtYS1teXRoaWNhbC1jcmVhdHVyZS1idXQtbWF5YmUtYS1wbGFuZXQtc2F2ZXItbWV0aGFub3Ryb3Bocy1hbmQtY2xpbWF0ZS1jaGFuZ2XSAQA?oc=5,https://da.gd/kElxFw
GN:T:CC,'Pushes us closer to the abyss': Former Azerbaijani oil executive to head COP29 - FRANCE 24 English,https://news.google.com/rss/articles/CBMidWh0dHBzOi8vd3d3LmZyYW5jZTI0LmNvbS9lbi9lbnZpcm9ubWVudC8yMDI0MDEwNy1mb3JtZXItYXplcmJhaWphbmktb2lsLWV4ZWN1dGl2ZS1zcGFya3MtY29udHJvdmVyc3ktYnktaGVhZGluZy1jb3AyOdIBAA?oc=5,https://da.gd/Rj0gd
GN:T:CC,Can $500 Million Save This Glacier? - The New York Times,https://news.google.com/rss/articles/CBMiU2h0dHBzOi8vd3d3Lm55dGltZXMuY29tLzIwMjQvMDEvMDYvbWFnYXppbmUvZ2xhY2llci1lbmdpbmVlcmluZy1zZWEtbGV2ZWwtcmlzZS5odG1s0gEA?oc=5,https://da.gd/YwWZJB
GN:T:CC,Jeremy Hunt’s net zero target claims criticised by climate advisers - The Guardian,https://news.google.com/rss/articles/CBMib2h0dHBzOi8vd3d3LnRoZWd1YXJkaWFuLmNvbS9lbnZpcm9ubWVudC8yMDI0L2phbi8wNy9odW50cy1uZXQtemVyby10YXJnZXQtY2xhaW1zLWNyaXRpY2lzZWQtYnktY2xpbWF0ZS1hZHZpc29yc9IBb2h0dHBzOi8vYW1wLnRoZWd1YXJkaWFuLmNvbS9lbnZpcm9ubWVudC8yMDI0L2phbi8wNy9odW50cy1uZXQtemVyby10YXJnZXQtY2xhaW1zLWNyaXRpY2lzZWQtYnktY2xpbWF0ZS1hZHZpc29ycw?oc=5,https://da.gd/1ggEI
