feed,title,long_url,short_url
j:MDPI:N,Health-Promoting and Functional Properties of Fermented Milk Beverages with Probiotic Bacteria in the Prevention of Civilization Diseases,https://mdpi.com/2072-6643/17/1/9,
j:MDPI:N,Effects of Longer-Term Mixed Nut Consumption on Lipoprotein Particle Concentrations in Older Adults with Overweight or Obesity,https://mdpi.com/2072-6643/17/1/8,
j:MDPI:N,Effects of Metabolites Derived from Guava (Psidium guajava L.) Leaf Extract Fermented by Limosilactobacillus fermentum on Hepatic Energy Metabolism via SIRT1-PGC1α Signaling in Diabetic Mice,https://mdpi.com/2072-6643/17/1/7,
j:MDPI:N,The Effect of Nutritional Intervention in Nutritional Risk Screening on Hospitalised Lung Cancer Patients,https://mdpi.com/2072-6643/17/1/6,
j:MDPI:N,The Phytochemical Composition and Antioxidant Activity of Matricaria recutita Blossoms and Zingiber officinale Rhizome Ethanol Extracts,https://mdpi.com/2072-6643/17/1/5,
j:MDPI:N,Lactobacillus plantarum L11 and Lactobacillus reuteri LR: Ameliorate Obesity via AMPK Pathway,https://mdpi.com/2072-6643/17/1/4,
j:MDPI:N,"Association Between Nutrition, Diet Quality, Dietary Patterns, and Human Health and Diseases",https://mdpi.com/2072-6643/17/1/3,
j:MDPI:N,Ultra-Processed Food and Gut Microbiota: Do Additives Affect Eubiosis? A Narrative Review,https://mdpi.com/2072-6643/17/1/2,
j:MDPI:N,Assessing the Consumption of Ultra-Processed Foods in People with Diabetes: Is a Specific NOVA Questionnaire Always Necessary?,https://mdpi.com/2072-6643/17/1/1,
