feed,title,long_url,short_url
LitCovid,"COVID-19 vaccination acceptance among community members and health workers in Ebonyi state, Nigeria: study protocol for a concurrent-independent mixed method analyses of intention to receive, timeliness of the intention to receive, uptake and hesitancy to COVID-19 vaccination and the determinants",https://pubmed.ncbi.nlm.nih.gov/36521883,
LitCovid,Perceived stress and stress responses during COVID-19: The multiple mediating roles of coping style and resilience,https://pubmed.ncbi.nlm.nih.gov/36520828,
LitCovid,Pandemic solidarity across national borders saved lives,https://pubmed.ncbi.nlm.nih.gov/36522203,
LitCovid,Pre-pandemic support for shared reading buffers adverse parenting impacts: an RCT in Brazil,https://pubmed.ncbi.nlm.nih.gov/36522551,
LitCovid,Low thoracic skeletal muscle index is associated with negative outcomes in 244 patients with respiratory COVID-19,https://pubmed.ncbi.nlm.nih.gov/36521254,
LitCovid,Impact of SARS-CoV-2 infection and COVID-19 on patients with inborn errors of immunity,https://pubmed.ncbi.nlm.nih.gov/36522221,
LitCovid,"Collaborative, Two-Directional Live Streaming to Deliver Hands-on Dissection Experience during the COVID-19 Lockdown",https://pubmed.ncbi.nlm.nih.gov/36522595,
LitCovid,"COVID-19 and Other Underlying Causes of Cancer Deaths - United States, January 2018-July 2022",https://pubmed.ncbi.nlm.nih.gov/36520660,
LitCovid,Predictors and outcomes of delirium in the emergency department during the first wave of the COVID-19 pandemic in Milan,https://pubmed.ncbi.nlm.nih.gov/36522147,
LitCovid,From Lecture Halls to Zoom Links: How Can Educational Theory Help Us to Deliver Effective and Engaging Teaching in an Online Environment?,https://pubmed.ncbi.nlm.nih.gov/36522594,
LitCovid,Not for Room 101,https://pubmed.ncbi.nlm.nih.gov/36522601,
LitCovid,One Size Does Not Fit All in Remote Anatomy Teaching,https://pubmed.ncbi.nlm.nih.gov/36522593,
LitCovid,Biomarkers and outcomes in hospitalised patients with COVID-19: a prospective registry,https://pubmed.ncbi.nlm.nih.gov/36521904,
LitCovid,Adolescents' academic self-efficacy and emotions during the COVID-19 pandemic: A latent profile analysis of family and school risk factors,https://pubmed.ncbi.nlm.nih.gov/36521128,
LitCovid,Outpatient pharmaceutical care satisfaction survey through Telepharmacy during COVID-19 pandemic in Spain,https://pubmed.ncbi.nlm.nih.gov/36520562,
LitCovid,Challenges of using external data in clinical trials- an illustration in patients with COVID-19,https://pubmed.ncbi.nlm.nih.gov/36522698,
LitCovid,Socioeconomic and sociodemographic factors associated with food expense insufficiency during the COVID-19 pandemic in Japan,https://pubmed.ncbi.nlm.nih.gov/36520953,
LitCovid,"Trends and characteristics of attempted and completed suicides reported to general practitioners before vs during the COVID-19 pandemic in France: Data from a nationwide monitoring system, 2010-2022",https://pubmed.ncbi.nlm.nih.gov/36520827,
LitCovid,Use of Lt Systems in Large Class Lab Delivery,https://pubmed.ncbi.nlm.nih.gov/36522591,
LitCovid,Can Synchronous Online Near-Peer Teaching Offer the Same Benefits as the Face-to-Face Version When Used in Clinical Neuroanatomy Education?,https://pubmed.ncbi.nlm.nih.gov/36522598,
LitCovid,Virtual Reality for Anatomy and Surgical Teaching,https://pubmed.ncbi.nlm.nih.gov/36522597,
LitCovid,"'Dynamic zero-COVID' policy and viral clearance during an omicron wave in Tianjin, China: a city-wide retrospective observational study",https://pubmed.ncbi.nlm.nih.gov/36521897,
LitCovid,How to derive ethically appropriate recommendations for action? A methodology for applied ethics,https://pubmed.ncbi.nlm.nih.gov/36522552,
LitCovid,Telepharmacy and pharmaceutical care: A narrative review by International Pharmaceutical Federation,https://pubmed.ncbi.nlm.nih.gov/36520563,
LitCovid,In vitro screening of anti-viral and virucidal effects against SARS-CoV-2 by Hypericum perforatum and Echinacea,https://pubmed.ncbi.nlm.nih.gov/36522420,
LitCovid,The need for systematic quality controls in implementing N95 reprocessing and sterilization,https://pubmed.ncbi.nlm.nih.gov/36521581,
LitCovid,A 10-Year Follow-Up Survey of Psychiatry Resident Education in Consultation-Liaison Psychiatry,https://pubmed.ncbi.nlm.nih.gov/36521681,
LitCovid,Electromechanical RT-LAMP device for portable SARS-CoV-2 detection,https://pubmed.ncbi.nlm.nih.gov/36521325,
LitCovid,Longitudinal characterisation of B and T-cell immune responses after the booster dose of COVID-19 mRNA-vaccine in people with multiple sclerosis using different disease-modifying therapies,https://pubmed.ncbi.nlm.nih.gov/36522154,
