feed,title,long_url,short_url
LitCovid,Testis-Specific Genes Deregulation in the Testis of COVID-19 Patients: A Potential Driver of Spermatogenesis Disruption?,https://pubmed.ncbi.nlm.nih.gov/36524343,
LitCovid,"Editorial: COVID-19 pandemics: Ethical, legal and social issues",https://pubmed.ncbi.nlm.nih.gov/36523760,
LitCovid,COVID-19 pandemic as reflected in Advances in Clinical and Experimental Medicine,https://pubmed.ncbi.nlm.nih.gov/36523184,
LitCovid,COVID-19: An Update,https://pubmed.ncbi.nlm.nih.gov/36523112,
LitCovid,"Similar deposition of neutrophil extracellular traps in the dermis among COVID-19-associated IgA vasculitis, post-COVID-19 vaccination IgA vasculitis, and COVID-19-unrelated IgA vasculitis",https://pubmed.ncbi.nlm.nih.gov/36523151,
LitCovid,Surgical treatment of lung cancer during the coronavirus disease 2019 (COVID-19) pandemic: lessons learned,https://pubmed.ncbi.nlm.nih.gov/36524069,
LitCovid,Impact of COVID-19 on Pregnancy and Maternal-Neonatal Outcomes: A Narrative Review,https://pubmed.ncbi.nlm.nih.gov/36523705,
LitCovid,Pancolitis Post COVID-19 Infection: A Case Report,https://pubmed.ncbi.nlm.nih.gov/36523701,
LitCovid,Covid-19: Gabriel Leung reflects on Hong Kong's devastating fifth wave,https://pubmed.ncbi.nlm.nih.gov/36523188,
LitCovid,COVID-19-Induced Fatal Thrombotic Thrombocytopenic Purpura in a Healthy Young Patient,https://pubmed.ncbi.nlm.nih.gov/36523352,
LitCovid,Perceived Challenges Caused by Covid-19 Outbreak in Students of Medical Sciences,https://pubmed.ncbi.nlm.nih.gov/36524138,
LitCovid,Intolerance of uncertainty and future career anxiety among Chinese undergraduate students during COVID-19 period: Fear of COVID-19 and depression as mediators,https://pubmed.ncbi.nlm.nih.gov/36523580,
LitCovid,"State ownership, information asymmetry and cash holding: Impact of COVID-19 on Chinese-listed firms",https://pubmed.ncbi.nlm.nih.gov/36524178,
LitCovid,Impact of the COVID-19 pandemic on cancer care,https://pubmed.ncbi.nlm.nih.gov/36523118,
LitCovid,Psychological impact of COVID-19 on nurses caring for patients during COVID-19 pandemic in Gaborone,https://pubmed.ncbi.nlm.nih.gov/36524453,
LitCovid,Circulating tissue inhibitor of metalloproteinases 1 (TIMP-1) at COVID-19 onset predicts severity status,https://pubmed.ncbi.nlm.nih.gov/36523781,
LitCovid,Impact of the COVID-19 pandemic on the incidence of intussusception: a systematic review,https://pubmed.ncbi.nlm.nih.gov/36524523,
LitCovid,Antineutrophil Cytoplasmic Autoantibody (ANCA)-Associated Vasculitis With Mucosal Involvement Following COVID-19 Pneumonia,https://pubmed.ncbi.nlm.nih.gov/36523691,
LitCovid,Vaccine equity in COVID-19: a meta-narrative review,https://pubmed.ncbi.nlm.nih.gov/36524409,
LitCovid,Outcomes of patients with COVID-19 in the setting of chronic opioid use disorder,https://pubmed.ncbi.nlm.nih.gov/36523203,
LitCovid,Benefits of Early Thoracic Surgery in the Elderly During the COVID-19 Pandemic: Lessons Learned From Performing a Video-Assisted Thoracotomy,https://pubmed.ncbi.nlm.nih.gov/36523662,
LitCovid,Spike protein of SARS-CoV-2 Omicron variant: An in-silico study evaluating spike interactions and immune evasion,https://pubmed.ncbi.nlm.nih.gov/36523581,
LitCovid,Profile of coronavirus disease enlightened asthma as a protective factor against death: An epidemiology study from Brazil during the pandemic,https://pubmed.ncbi.nlm.nih.gov/36523782,
LitCovid,"COVID-19 and decreased asylum access: mother work, precarity and preocupacion among Central American asylum-seekers in Los Angeles",https://pubmed.ncbi.nlm.nih.gov/36523746,
LitCovid,Factors associated with hospitalisations and deaths of residential aged care residents with COVID-19 during the Omicron (BA.1) wave in Queensland,https://pubmed.ncbi.nlm.nih.gov/36524321,
LitCovid,"Public health in Global South: effect of environmental pollutant PM2.5 on the incidence and mortality of SARS-CoV-2 in Karachi, Lahore, and Islamabad",https://pubmed.ncbi.nlm.nih.gov/36524525,
LitCovid,Factors affecting the infection control behaviors of Korean dental hygienists in response to the coronavirus disease 2019 pandemic,https://pubmed.ncbi.nlm.nih.gov/36524305,
LitCovid,A new automated national register-based surveillance system for outbreaks in long-term care facilities in Norway detected three times more severe acute respiratory coronavirus virus 2 (SARS-CoV-2) clusters than traditional methods,https://pubmed.ncbi.nlm.nih.gov/36524319,
LitCovid,Hyperhomocysteinemia is related to large vessel occlusion in young patients with COVID-19: Two case reports,https://pubmed.ncbi.nlm.nih.gov/36523374,
LitCovid,Toxic epidermal necrosis following Sinopharm COVID-19 vaccine (BBIBP-CorV): A case report and literature review,https://pubmed.ncbi.nlm.nih.gov/36523388,
LitCovid,Response to the coronavirus disease 2019 pandemic of dental hygienists in South Korea-Part II: Fear and anxiety,https://pubmed.ncbi.nlm.nih.gov/36524317,
LitCovid,Quadriplegia after ECMO therapy with sluggish recovery in a COVID-19 patient: A case report with a 14-month follow-up,https://pubmed.ncbi.nlm.nih.gov/36523390,
LitCovid,Qualitative study to explore UK medical students' and junior doctors' experiences of occupational stress and mental health during the COVID-19 pandemic,https://pubmed.ncbi.nlm.nih.gov/36523252,
LitCovid,The impact of caring for COVID-19 patients on nurse professional identity: A cross-sectional study using propensity score analysis,https://pubmed.ncbi.nlm.nih.gov/36523574,
LitCovid,The Impact of Online Learning among Adolescents during the COVID-19 Pandemic: A Qualitative Study of Mothers' Perspectives,https://pubmed.ncbi.nlm.nih.gov/36524150,
LitCovid,Transforming global health education during the COVID-19 era: perspectives from a transnational collective of global health students and recent graduates,https://pubmed.ncbi.nlm.nih.gov/36524410,
LitCovid,Consumers' coping strategies when they feel negative emotions in the face of forced deconsumption during the Covid-19 pandemic lockdowns,https://pubmed.ncbi.nlm.nih.gov/36524184,
LitCovid,Editorial: Non-coding RNA in immunotherapies and immune regulation,https://pubmed.ncbi.nlm.nih.gov/36524128,
LitCovid,Influence of social responsibility and pandemic awareness of nursing students on COVID-19 preventive behaviours: a cross-sectional online survey in South Korea,https://pubmed.ncbi.nlm.nih.gov/36523217,
LitCovid,Hemophagocytic Lymphohistiocytosis in a Patient With Post-acute COVID-19 Infection,https://pubmed.ncbi.nlm.nih.gov/36523678,
LitCovid,Emergency Use of Tocilizumab in Moderate and Severe COVID-19 Patients over the Prevaccination Stage during the Pandemic in Mexico,https://pubmed.ncbi.nlm.nih.gov/36524015,
LitCovid,SARS-CoV-2 viral protein ORF3A injures renal tubules by interacting with TRIM59 to induce STAT3 activation,https://pubmed.ncbi.nlm.nih.gov/36523164,
LitCovid,Facing the unknown COVID-19 pandemic: A qualitative study with nurses and nursing assistants in three European countries,https://pubmed.ncbi.nlm.nih.gov/36523579,
LitCovid,Six Diagnoses of Separation: Impact of COVID-19 on Pediatric Emergency Department Visits: A Multicenter Study,https://pubmed.ncbi.nlm.nih.gov/36522811,
LitCovid,How to reduce the exposure risk of medical staff from SARS-CoV-2 by reducing environmental contamination: Experience from designated hospitals in China,https://pubmed.ncbi.nlm.nih.gov/36523588,
LitCovid,Estimation of the incubation period and generation time of SARS-CoV-2 Alpha and Delta variants from contact tracing data,https://pubmed.ncbi.nlm.nih.gov/36524247,
LitCovid,The relationship between length of stay in intensive care unit and Tpeak-Tend and Tpeak-Tend/QTc ratio in COVID 19 patients with acute coronary syndrome,https://pubmed.ncbi.nlm.nih.gov/36524046,
LitCovid,Epilepsia partialis continua due to COVID-19 pneumonia,https://pubmed.ncbi.nlm.nih.gov/36524524,
LitCovid,Evaluation of COVID-19 vaccine acceptance and uptake in rural Bangladesh: a cross-sectional study,https://pubmed.ncbi.nlm.nih.gov/36523245,
LitCovid,Short and Long-Term Outcomes of Kidney Transplant Recipients Diagnosed With COVID-19 Infection: A Single-Center Observational Study,https://pubmed.ncbi.nlm.nih.gov/36523681,
LitCovid,"Reduced Access to Preventive Care Due to the COVID-19 Pandemic, by Chronic Disease Status and Race and Hispanic Origin, United States, 2020-2021",https://pubmed.ncbi.nlm.nih.gov/36524404,
LitCovid,The Young were not Spared: What Death Certificates Reveal about Non-Covid Excess Deaths,https://pubmed.ncbi.nlm.nih.gov/36523146,
LitCovid,Analyzing the immunogenicity of bivalent booster vaccinations in healthcare workers: The SWITCH ON trial protocol,https://pubmed.ncbi.nlm.nih.gov/36524126,
LitCovid,Brain organoids for addressing COVID-19 challenge,https://pubmed.ncbi.nlm.nih.gov/36523428,
LitCovid,Influence of information source regarding COVID-19 knowledge among the undergraduate dental students during the early lockdown: a multi-national study,https://pubmed.ncbi.nlm.nih.gov/36524522,
LitCovid,Relationship between Tai Chi and clinical outcomes in elderly patients with COVID-19: a protocol for systematic review and dose-response meta-analysis,https://pubmed.ncbi.nlm.nih.gov/36523226,
LitCovid,Effect of COVID-19 Lockdown on Substance Use Among Middle School and High School Students: A Natural Experiment,https://pubmed.ncbi.nlm.nih.gov/36524406,
LitCovid,Safety monitoring of COVID-19 vaccines: perspective from the European Medicines Agency,https://pubmed.ncbi.nlm.nih.gov/36524423,
LitCovid,"Impact of the COVID-19 pandemic on expectant and new parents' experience of pregnancy, childbirth, breast feeding, parental responsiveness and sensitivity, and bonding and attunement in high-income countries: a systematic review of the evidence",https://pubmed.ncbi.nlm.nih.gov/36523240,
LitCovid,The Effect of the COVID-19 Vaccine on the Menstrual Cycle Among Reproductive-Aged Females in Saudi Arabia,https://pubmed.ncbi.nlm.nih.gov/36523858,
LitCovid,Remote PEERS((R)) for preschoolers: A pilot parent-mediated social skills intervention for young children with social challenges over telehealth,https://pubmed.ncbi.nlm.nih.gov/36523874,
LitCovid,The impact of self-regulated learning strategies on academic performance for online learning during COVID-19,https://pubmed.ncbi.nlm.nih.gov/36524180,
LitCovid,"Social mixing patterns in the UK following the relaxation of COVID-19 pandemic restrictions, July-August 2020: a cross-sectional online survey",https://pubmed.ncbi.nlm.nih.gov/36523221,
LitCovid,Erroneous diagnosis of COVID-19 mRNA vaccine-associated acute myocarditis due to false-positive high-sensitive troponin I assay: a case report,https://pubmed.ncbi.nlm.nih.gov/36524204,
LitCovid,"Association of individual resilience with organizational resilience, perceived social support, and job performance among healthcare professionals in township health centers of China during the COVID-19 pandemic",https://pubmed.ncbi.nlm.nih.gov/36524161,
LitCovid,Perceived stress among older adults during COVID-19 outbreak: A cross-sectional study in Southern Iran,https://pubmed.ncbi.nlm.nih.gov/36523448,
LitCovid,'No more heroes': The ILC Oxford Statement on fundamental care in times of crises,https://pubmed.ncbi.nlm.nih.gov/36523232,
LitCovid,Factors predicting mortality among patients with COVID-19 associated hospital acquired pneumonia: Insights from a tertiary care center,https://pubmed.ncbi.nlm.nih.gov/36524352,
LitCovid,Chronic graft vs. host disease and hypogammaglobulinemia predict a lower immunological response to the BNT162b2 mRNA COVID-19 vaccine after allogeneic hematopoietic stem cell transplantation.,https://pubmed.ncbi.nlm.nih.gov/36524517,
LitCovid,Inhalable exosomes outperform liposomes as mRNA and protein drug carriers to the lung,https://pubmed.ncbi.nlm.nih.gov/36523538,
LitCovid,"Describing post-traumatic stress disorder and its associations with depression, anxiety and insomnia: a descriptive study in Italian adults with Marfan syndrome during the COVID-19 third wave",https://pubmed.ncbi.nlm.nih.gov/36523249,
LitCovid,Reproducibility of cycle threshold values from severe acute respiratory coronavirus virus 2 (SARS-CoV-2) reverse-transcription polymerase chain reaction (RT-PCR) assays,https://pubmed.ncbi.nlm.nih.gov/36524313,
LitCovid,Face masks have a limited effect on the feeling of being looked at,https://pubmed.ncbi.nlm.nih.gov/36523436,
LitCovid,"Palliative care for people who use drugs during communicable disease epidemics and pandemics: A scoping review on access, policies, and programs and guidelines",https://pubmed.ncbi.nlm.nih.gov/36522840,
LitCovid,Digital health for allergen immunotherapy,https://pubmed.ncbi.nlm.nih.gov/36523960,
LitCovid,The dynamics of coordination patterns in multiteam systems response to emergency: Case study from a pharmaceutical enterprise,https://pubmed.ncbi.nlm.nih.gov/36524189,
LitCovid,Intranasal inoculation of IFN-lambda resolves SARS-CoV-2 lung infection via the rapid reduction of viral burden and improvement of tissue damage,https://pubmed.ncbi.nlm.nih.gov/36524125,
LitCovid,COVID spurs boom in genome sequencing for infectious diseases,https://pubmed.ncbi.nlm.nih.gov/36522533,
LitCovid,COVID-19 and IgA Vasculitis,https://pubmed.ncbi.nlm.nih.gov/36521918,
LitCovid,SARS-CoV-2 human T cell epitopes: Adaptive immune response against COVID-19,https://pubmed.ncbi.nlm.nih.gov/36521443,
LitCovid,COVID-19 signalome: Potential therapeutic interventions,https://pubmed.ncbi.nlm.nih.gov/36521656,
LitCovid,"Changes of coagulase-negative Staphylococci infections in children before and after the COVID-19 pandemic in Zhengzhou, China",https://pubmed.ncbi.nlm.nih.gov/36521565,
LitCovid,State Public Health Emergency Powers in Response to COVID-19,https://pubmed.ncbi.nlm.nih.gov/36521072,
LitCovid,The COVID-19 response in North America,https://pubmed.ncbi.nlm.nih.gov/36522684,
LitCovid,COVID-19 vaccination perceptions in rheumatology patients: a cross-sectional online survey,https://pubmed.ncbi.nlm.nih.gov/36521919,
LitCovid,Comparing hybrid and regular COVID-19 vaccine-induced immunity against the Omicron epidemic,https://pubmed.ncbi.nlm.nih.gov/36522341,
LitCovid,Warm Cupping in Combination with Standard Therapy in COVID-19: Correspondence,https://pubmed.ncbi.nlm.nih.gov/36521824,
LitCovid,Serum 25-hydroxycholesterol levels are increased in patients with coronavirus disease 2019,https://pubmed.ncbi.nlm.nih.gov/36522261,
LitCovid,Ginkgolic acids inhibit SARS-CoV-2 and its variants by blocking the spike protein/ACE2 interplay,https://pubmed.ncbi.nlm.nih.gov/36521705,
LitCovid,Challenges and opportunities for educating health professionals after the COVID-19 pandemic,https://pubmed.ncbi.nlm.nih.gov/36522209,
LitCovid,Lactate dehydrogenase and PaO2/FiO2 ratio at admission helps to predict CT score in patients with COVID-19: An observational study,https://pubmed.ncbi.nlm.nih.gov/36521329,
LitCovid,Impact of COVID-19 on homebound adults receiving home-based primary care,https://pubmed.ncbi.nlm.nih.gov/36522305,
LitCovid,Characteristics of the population with mild COVID-19 symptoms eligible for early treatment attended in a single center in Northern Italy,https://pubmed.ncbi.nlm.nih.gov/36521328,
LitCovid,A Bayesian susceptible-infectious-hospitalized-ventilated-recovered model to predict demand for COVID-19 inpatient care in a large healthcare system,https://pubmed.ncbi.nlm.nih.gov/36520809,
LitCovid,Oral antiviral treatment for COVID-19 in patients with systemic autoimmune rheumatic diseases,https://pubmed.ncbi.nlm.nih.gov/36521909,
LitCovid,Impact of Anti-SARS-CoV-2 monoclonal antibodies in the management of patients with lymphoma and COVID19: A retrospective study,https://pubmed.ncbi.nlm.nih.gov/36521843,
LitCovid,The Adjunctive Effects of Acupuncture for Hospitalized COVID-19 Patients: a Single-Blinded Randomized Clinical Study,https://pubmed.ncbi.nlm.nih.gov/36521773,
LitCovid,The short-term effect of COVID-19 on the cochleovestibular system in pediatric patients,https://pubmed.ncbi.nlm.nih.gov/36521194,
LitCovid,Hospital at Home treatment with Remdesivir for patients with COVID-19: Real life experience,https://pubmed.ncbi.nlm.nih.gov/36521589,
LitCovid,Changes in the number of traffic collisions during the various waves of COVID-19 infection in Japan,https://pubmed.ncbi.nlm.nih.gov/36520824,
LitCovid,Preparing ward nurses for intensive care units during a state of emergency: an example from COVID-19 pandemic,https://pubmed.ncbi.nlm.nih.gov/36522152,
LitCovid,User experience of COVID-19 chatbots: A scoping review,https://pubmed.ncbi.nlm.nih.gov/36520624,
LitCovid,Posttraumatic Stress Disorder and Hyperventilation in Post-COVID-19 Syndrome: An Underestimated Association,https://pubmed.ncbi.nlm.nih.gov/36522036,
LitCovid,Do prior neurological comorbidities predict COVID-19 severity and death? A 25-month cross-sectional multicenter study on 7370 patients,https://pubmed.ncbi.nlm.nih.gov/36522609,
LitCovid,Neutralizing monoclonal antibody in patients with coronavirus disease 2019: an observational study,https://pubmed.ncbi.nlm.nih.gov/36522677,
LitCovid,Three on Three: Universal and High-Affinity Molecular Recognition of the Symmetric Homotrimeric Spike Protein of SARS-CoV-2 with a Symmetric Homotrimeric Aptamer,https://pubmed.ncbi.nlm.nih.gov/36520671,
LitCovid,Cardiometabolic disease and multiple long-term condition healthcare provision in Sub-Saharan Africa: Opportunities for new models of care in the post-COVID era,https://pubmed.ncbi.nlm.nih.gov/36521305,
LitCovid,Multiplexed evaluation of immunity against SARS-CoV-2 variants using surface enhanced fluorescence from a nanostructured plasmonic chip,https://pubmed.ncbi.nlm.nih.gov/36522786,
LitCovid,COVID-19 infection and vaccine have no impact on in-vitro fertilization (IVF) outcome,https://pubmed.ncbi.nlm.nih.gov/36522363,
LitCovid,IgA vasculitis presenting as nephrotic syndrome following COVID-19 vaccination: a case report,https://pubmed.ncbi.nlm.nih.gov/36522629,
LitCovid,"Do you take off your mask correctly? A survey during COVID-19 pandemic in Ningbo, China",https://pubmed.ncbi.nlm.nih.gov/36520810,
LitCovid,Temporal aspects of unrealistic optimism and robustness of this bias: A longitudinal study in the context of the COVID-19 pandemic,https://pubmed.ncbi.nlm.nih.gov/36520884,
LitCovid,COVID-19 Disrupts Rheumatology Care: An Opportunity for Innovation?,https://pubmed.ncbi.nlm.nih.gov/36521925,
LitCovid,Letter to the Editor: COVID‑19 Vaccine Uptake Among Adolescents and Young Adults Diagnosed with Cancer: Correspondence,https://pubmed.ncbi.nlm.nih.gov/36520612,
LitCovid,Analysis of 394 COVID-19 cases infected with Omicron variant in Shenzhen: impact of underlying diseases to patient's symptoms,https://pubmed.ncbi.nlm.nih.gov/36522750,
LitCovid,Severe Respiratory Failure Developing in the Course of High-Altitude Pulmonary Edema in an Alpinist with COVID-19 Pneumonia: A Case Report,https://pubmed.ncbi.nlm.nih.gov/36520609,
LitCovid,COVID-19 Adaptations for Biomedical Teaching and Assessment Within the Undergraduate Dental Curriculum,https://pubmed.ncbi.nlm.nih.gov/36522592,
LitCovid,"A proof-of-concept study on the genomic evolution of Sars-Cov-2 in molnupiravir-treated, paxlovid-treated and drug-naive patients",https://pubmed.ncbi.nlm.nih.gov/36522489,
LitCovid,Processes implemented and activities carried out by the pharmacists during the COVID‑19 pandemic: A scoping review,https://pubmed.ncbi.nlm.nih.gov/36520575,
LitCovid,"Serum interleukin 1beta and sP-selectin as biomarkers of inflammation and thrombosis, could they be predictors of disease severity in COVID 19 Egyptian patients? (a cross-sectional study)",https://pubmed.ncbi.nlm.nih.gov/36522776,
LitCovid,Start-up of a high-risk COVID unit: The experience from a general hospital,https://pubmed.ncbi.nlm.nih.gov/36522194,
LitCovid,Experiences of mothers and significant others in accessing comprehensive healthcare in the first 1000 days of life post-conception during COVID-19 in rural Uganda,https://pubmed.ncbi.nlm.nih.gov/36522709,
LitCovid,"Impact of social and cultural factors on incidence, transmission and control of Coronavirus disease in Iran: a qualitative study",https://pubmed.ncbi.nlm.nih.gov/36522718,
LitCovid,Socio-demographic characteristics and their relation to medical service consumption among elderly in Israel during the COVID-19 lockdown in 2020 as compared to the corresponding period in 2019,https://pubmed.ncbi.nlm.nih.gov/36520880,
LitCovid,Unaffordability of COVID-19 tests: assessing age-related inequalities in 83 countries,https://pubmed.ncbi.nlm.nih.gov/36522636,
LitCovid,One-Year Risk of myocarditis after COVID-19 infection: a systematic review and meta-analysis,https://pubmed.ncbi.nlm.nih.gov/36521730,
LitCovid,Effectiveness of BNT162b2 and CoronaVac COVID-19 vaccination against asymptomatic and symptomatic infection of SARS-CoV-2 omicron BA.2 in Hong Kong: a prospective cohort study,https://pubmed.ncbi.nlm.nih.gov/36521506,
LitCovid,Increased solitary drug use during COVID-19: An unintended consequence of social distancing,https://pubmed.ncbi.nlm.nih.gov/36521196,
LitCovid,Effect of multiple sclerosis disease-modifying therapies on the real-world effectiveness of two doses of BBIBP-CorV (Sinopharm) vaccine,https://pubmed.ncbi.nlm.nih.gov/36521195,
LitCovid,The effect of the demonstration-based progressive muscle relaxation technique on stress and anxiety in nurses caring for COVID-19 patients: a randomized clinical trial,https://pubmed.ncbi.nlm.nih.gov/36522723,
LitCovid,"Possibility of Age and Prior Psychiatric Illnesses Affecting the Study Design on Cognitive Dysfunction, Psychiatric Distress, and Functional Decline After SARS-CoV-2 Infection",https://pubmed.ncbi.nlm.nih.gov/36522039,
LitCovid,Cardiopulmonary examinations of athletes returning to high-intensity sport activity following SARS-CoV-2 infection,https://pubmed.ncbi.nlm.nih.gov/36522351,
LitCovid,Pandemic-Era Digital Education: Insights from an Undergraduate Medical Programme,https://pubmed.ncbi.nlm.nih.gov/36522590,
LitCovid,Decentralized governance may lead to higher infection levels and sub-optimal releases of quarantines amid the COVID-19 pandemic,https://pubmed.ncbi.nlm.nih.gov/36520820,
LitCovid,Inability to contact opioid agonist therapy prescribers during the COVID-19 pandemic in a Canadian setting: a cross-sectional analysis among people on opioid agonist therapy,https://pubmed.ncbi.nlm.nih.gov/36522789,
LitCovid,B-cell reconstitution is associated with COVID-19 booster vaccine responsiveness in previously seronegative rituximab treated patients,https://pubmed.ncbi.nlm.nih.gov/36521910,
LitCovid,Hidradenitis Suppurativa Reddit Support Group: Finding New Meaning in Social Media during the COVID-19 Pandemic,https://pubmed.ncbi.nlm.nih.gov/36521015,
LitCovid,Chronic conditions patient's perception of post-COVID-19 pandemic teleconsulting continuation in primary care clinics: a qualitative descriptive study,https://pubmed.ncbi.nlm.nih.gov/36521903,
LitCovid,"Biomarkers of cell damage, neutrophil and macrophage activation associated with in-hospital mortality in geriatric COVID-19 patients",https://pubmed.ncbi.nlm.nih.gov/36522763,
LitCovid,Impact of the COVID-19 pandemic on staff turnover at long-term care facilities: a qualitative study,https://pubmed.ncbi.nlm.nih.gov/36521894,
LitCovid,"Commentary: If not you, then who: Equity, social justice, and the role of school psychologists in ensuring reading success for all learners",https://pubmed.ncbi.nlm.nih.gov/36521130,
LitCovid,A potential role for SARS-CoV-2 small viral RNAs in targeting host microRNAs and modulating gene expression,https://pubmed.ncbi.nlm.nih.gov/36522444,
LitCovid,COVID-19 Adaptations with Virtual Microscopy,https://pubmed.ncbi.nlm.nih.gov/36522599,
LitCovid,The Challenges of Visualisation During Delivery and Assessment of Clinical Teaching Under COVID-19: A Reflective Account of Problem Solving,https://pubmed.ncbi.nlm.nih.gov/36522600,
LitCovid,Socio-economic inequalities in the effect of public policies and the COVID-19 pandemic on exclusive breastfeeding in Chile,https://pubmed.ncbi.nlm.nih.gov/36521273,
LitCovid,Patients with type 1 and type 2 diabetes hospitalized with COVID-19 in comparison with influenza: mortality and cardiorenal complications assessed by nationwide Swedish registry data,https://pubmed.ncbi.nlm.nih.gov/36522650,
LitCovid,Development of criteria for cognitive dysfunction in post-COVID syndrome: the IC-CoDi-COVID approach,https://pubmed.ncbi.nlm.nih.gov/36521337,
LitCovid,"Knowledge, attitudes, practices, and its associated factors toward COVID-19 pandemic among Bangladeshi older adults",https://pubmed.ncbi.nlm.nih.gov/36520795,
LitCovid,The use of routine data from primary care practices in Germany to analyze the impact of the outbreak of SARS-CoV-2 on the utilization of primary care services for patients with type 2 diabetes mellitus,https://pubmed.ncbi.nlm.nih.gov/36522736,
LitCovid,Longitudinal Changes in Self-Reported Alcohol Consumption by Mothers' During the COVID-19 Pandemic,https://pubmed.ncbi.nlm.nih.gov/36521494,
LitCovid,"Physical, psychological and pandemic fatigue in the fourth wave of COVID-19 outbreak in Hong Kong: population-based, cross-sectional study",https://pubmed.ncbi.nlm.nih.gov/36521899,
LitCovid,A Scoping Review of Changes to Patient-Doctor Communication During COVID-19,https://pubmed.ncbi.nlm.nih.gov/36522301,
LitCovid,The effect of web-based Hatha yoga on psychological distress and sleep quality in older adults: A randomized controlled trial,https://pubmed.ncbi.nlm.nih.gov/36521407,
LitCovid,"Prevalence of SARS-CoV-2 and Influenza Coinfection and Clinical Characteristics Among Children and Adolescents Aged <18 Years Who Were Hospitalized or Died with Influenza - United States, 2021-22 Influenza Season",https://pubmed.ncbi.nlm.nih.gov/36520656,
