feed,title,long_url,short_url
j:MDPI:N,Diet Quality and Consumption of Healthy and Unhealthy Foods Measured via the Global Diet Quality Score in Relation to Cardiometabolic Outcomes in Apparently Healthy Adults from the Mediterranean Region: The ATTICA Epidemiological Cohort Study (2002–2022),https://mdpi.com/2072-6643/15/20/4428,
j:MDPI:N,Ketogenic Diet Exacerbates L-Arginine-Induced Acute Pancreatitis and Reveals the Therapeutic Potential of Butyrate,https://mdpi.com/2072-6643/15/20/4427,
j:MDPI:N,Smoothies Marketed in Spain: Are They Complying with Labeling Legislation?,https://mdpi.com/2072-6643/15/20/4426,
j:MDPI:N,Characteristics of Metabolites in the Development of Atherosclerosis in Tibetan Minipigs Determined Using Untargeted Metabolomics,https://mdpi.com/2072-6643/15/20/4425,
j:MDPI:N,No Changes in Body Composition and Adherence to the Mediterranean Diet after a 12-Week Aerobic Training Intervention in Women with Systemic Lupus Erythematosus: The EJERCITA-LES Study,https://mdpi.com/2072-6643/15/20/4424,
j:MDPI:N,Is 25OH Vitamin D Excess before 36 Weeks Corrected Age an Independent Risk Factor for Bronchopulmonary Dysplasia or Death?,https://mdpi.com/2072-6643/15/20/4423,
j:MDPI:N,"Caffeine Intake, Plasma Caffeine Level, and Kidney Function: A Mendelian Randomization Study",https://mdpi.com/2072-6643/15/20/4422,
j:MDPI:N,Perinatal Plasma Carotenoids and Vitamin E Concentrations with Glycemia and Insulin Resistance in Women during and after Pregnancy,https://mdpi.com/2072-6643/15/20/4421,
