feed,title,long_url,short_url
MX,Strength training may reduce health risks of a high-protein diet,https://medicalxpress.com/news/2023-10-strength-health-high-protein-diet.html,https://da.gd/5RThzT
MX,"Obesity raises odds for recurrence in breast cancer survivors, finds study",https://medicalxpress.com/news/2023-10-obesity-odds-recurrence-breast-cancer.html,https://da.gd/LZ24n3
MX,Gay and bisexual adolescents found to have twice the risk of binge-eating disorder,https://medicalxpress.com/news/2023-10-gay-bisexual-adolescents-binge-eating-disorder.html,https://da.gd/jGGhN1
MX,Research identifies four eating behavior patterns in children,https://medicalxpress.com/news/2023-10-behavior-patterns-children.html,https://da.gd/JUs8C
MX,New study identifies cells that drive pancreatic cancer spread while discovering their weakness,https://medicalxpress.com/news/2023-10-cells-pancreatic-cancer-weakness.html,https://da.gd/w6Oppf
MX,FDA proposes ban on formaldehyde in hair straighteners over health dangers,https://medicalxpress.com/news/2023-10-fda-formaldehyde-hair-straighteners-health.html,https://da.gd/se2o
MX,Remote consultations improve access to health care in Nigeria and Tanzania,https://medicalxpress.com/news/2023-10-remote-access-health-nigeria-tanzania.html,https://da.gd/v9a4k
MX,"Women are turning to cannabis to treat menopause symptoms, study suggests",https://medicalxpress.com/news/2023-10-women-cannabis-menopause-symptoms.html,https://da.gd/08S3t
