feed,title,long_url,short_url
ArXiv:math,Anderson Accelerated Gauss-Newton-guided deep learning for nonlinear inverse problems with Application to Electrical Impedance Tomography,https://arxiv.org/abs/2312.12693v1,
ArXiv:math,DoDo-Code: a Deep Levenshtein Distance Embedding-based Code for IDS Channel and DNA Storage,https://arxiv.org/abs/2312.12717v1,
ArXiv:math,Recovering the chemical potential from the correlation functions,https://arxiv.org/abs/2312.13144v1,
ArXiv:math,Parasite infection in a cell population: role of the partitioning kernel,https://arxiv.org/abs/2305.06962v2,
ArXiv:math,Physics-informed Neural Network Estimation of Material Properties in Soft Tissue Nonlinear Biomechanical Models,https://arxiv.org/abs/2312.09787v2,
