feed,title,long_url,short_url
GN:S:C,"Water resources to become less predictable with climate change: Declining snowpack will cause more variability in runoff, streamflow - Science Daily",https://www.sciencedaily.com/releases/2022/07/220718154343.htm,
GN:S:C,"Videos Vanish From Doug Mastriano’s Social Media, on Climate, Abortion and More - The New York Times",https://www.nytimes.com/2022/07/18/us/politics/doug-mastriano-videos-deleted.html,
GN:S:C,New climate tool shows Utah’s record heat a result of climate change - KSL NewsRadio,https://kslnewsradio.com/1971929/new-climate-tool-shows-utahs-record-heat-a-result-of-climate-change/,
GN:S:C,Commission for Environmental Cooperation Launches Second Round of $2 Million Environmental Justice and Climate Resilience Grant Program | US EPA - U,https://www.epa.gov/newsreleases/commission-environmental-cooperation-launches-second-round-2-million-environmental,
GN:S:C,City launching Climate Action Plan with open house July 28 - My Edmonds News,https://myedmondsnews.com/2022/07/city-launching-climate-action-plan-with-open-house-july-28/,
GN:S:C,Letters to the editor: Next president should be a woman; keep climate goals on track - Boulder Daily Camera,https://www.dailycamera.com/2022/07/18/letters-to-the-editor-next-president-should-be-a-woman-new-camera-look-is-cheap-keep-climate-goals-on-track-pump-pain-is-on-biden-too,
GN:S:C,Joe Manchin plays Mitch McConnell's game in bailing on climate change - MSNBC,https://www.msnbc.com/opinion/msnbc-opinion/joe-manchin-plays-mitch-mcconnell-s-game-bailing-climate-change-n1297340,
