feed,title,long_url,short_url
GN:T:WP,Arise sells Kölvallen wind farm - Energy Global,https://www.energyglobal.com/wind/19072022/arise-sells-klvallen-wind-farm/,
GN:T:WP,Macquarie's GIG invests in US renewable platform with 6-GW pipeline - Renewables Now,https://renewablesnow.com/news/macquaries-gig-invests-in-us-renewable-platform-with-6-gw-pipeline-792006/,
GN:T:WP,Windmill vs. Wind Turbine: What's the Difference? - Treehugger,https://www.treehugger.com/windmill-vs-wind-turbine-5649677,
GN:T:WP,Wind - EBRD and CTF to Repower Africa's Oldest Wind Farm - Renewable Energy Magazine,https://www.renewableenergymagazine.com/wind/ebrd-and-ctf-to-repower-africa-s-20220719,
GN:T:WP,A new rate increase was just approved for Appalachian Power customers - WSET,https://wset.com/news/local/rate-increase-appalachian-power-electricity-utilities-solar-facilities-virginia-state-corporation-commission-renewable-energy-portfolio-standard-july-18-2022,
GN:T:WP,German-Dutch consortium to build 500 kW offshore solar pilot in North Sea - pv magazine International,https://www.pv-magazine.com/2022/07/19/german-dutch-consortium-to-build-500-kw-offshore-solar-pilot-in-north-sea/,
GN:T:WP,This energy investment rivals I-70 and others in Colorado history - by Allen Best - The Ark Valley Voice,https://arkvalleyvoice.com/this-energy-investment-rivals-i-70-and-others-in-colorado-history/,
GN:T:WP,50Hertz pulls in cable for Arcadis Ost offshore platform - 4C Offshore,https://www.4coffshore.com/news/50hertz-pulls-in-cable-for-arcadis-ost-offshore-platform-nid25983.html,
GN:T:WP,ACCIONA Energía to build Opor and Boraja II wind farms in Croatia - Power Technology,https://www.power-technology.com/news/acciona-energia-croatia/,
GN:T:WP,Pattern Energy acquires energy transmission line project - The San Diego Union-Tribune,https://www.sandiegouniontribune.com/news/california/story/2022-07-18/pattern-energy-acquires-energy-transmission-line-project,
GN:T:WP,Bombora Making Progress with 'World's Most Powerful' Wave Energy Converter - Offshore Engineer,https://www.oedigital.com/news/498148-bombora-making-progress-with-world-s-most-powerful-wave-energy-converter,
GN:T:WP,First turbine to be installed at Japan's first commercial-scale offshore wind farm - Pinsent Masons,https://www.pinsentmasons.com/out-law/news/turbine-installed-japan-first-commercial-scale-offshore-wind-farm,
GN:T:WP,AKA Robotics Completes Round A Financing - Pandaily,https://pandaily.com/aka-robotics-completes-round-a-financing/,
GN:T:WP,The world's largest vertical farm using 95% less water opens in Dubai - Interesting Engineering,https://interestingengineering.com/the-worlds-largest-vertical-farm-using-95-less-water-opens-in-dubai,
GN:T:WP,"Beyond The Fist Bump, Progress On Artemis Accords For Space Exploration - CleanTechnica",https://cleantechnica.com/2022/07/19/beyond-the-fist-bump-progress-on-artemis-accords-for-space-exploration/,
GN:T:WP,Study launched into energy disputes and the use of arbitration - Pinsent Masons,https://www.pinsentmasons.com/out-law/news/study-launched-into-energy-disputes-and-the-use-of-arbitration,
GN:T:WP,First Offshore Wind Workers in the World certified with Virtual Reality in New Bedford - Canada NewsWire,https://www.newswire.ca/news-releases/first-offshore-wind-workers-in-the-world-certified-with-virtual-reality-in-new-bedford-802191555.html,
