feed,title,long_url,short_url
MX,WHO: COVID still an emergency but nearing 'inflection' point,https://medicalxpress.com/news/2023-01-covid-emergency-nearing-inflection.html,https://da.gd/fdUW8z
MX,The COVID-19 pandemic in 10 figures,https://medicalxpress.com/news/2023-01-covid-pandemic-figures.html,https://da.gd/ddDnU
MX,Which test is best? Frequent versus infrequent testing for the omicron variant of COVID-19,https://medicalxpress.com/news/2023-01-frequent-infrequent-omicron-variant-covid-.html,https://da.gd/y6gsfn
MX,WHO urges investment in neglected tropical diseases,https://medicalxpress.com/news/2023-01-urges-investment-neglected-tropical-diseases.html,https://da.gd/PSrM
MX,Researchers achieve gene therapy milestone for potential Cockayne syndrome treatment,https://medicalxpress.com/news/2023-01-gene-therapy-milestone-potential-cockayne.html,https://da.gd/xxLybj
