feed,title,long_url,short_url
GN:T:CC,Climate Change Policy: The Way It Has to Be - Resilience,https://news.google.com/rss/articles/CBMiWWh0dHBzOi8vd3d3LnJlc2lsaWVuY2Uub3JnL3N0b3JpZXMvMjAyMy0wNi0wNy9jbGltYXRlLWNoYW5nZS1wb2xpY3ktdGhlLXdheS1pdC1oYXMtdG8tYmUv0gEA?oc=5,https://da.gd/YnLr3P
GN:T:CC,A bipartisan plan to punish global climate laggards: Tax them - The Washington Post,https://news.google.com/rss/articles/CBMiUGh0dHBzOi8vd3d3Lndhc2hpbmd0b25wb3N0LmNvbS9jbGltYXRlLWVudmlyb25tZW50LzIwMjMvMDYvMDcvY2FyYm9uLWJvcmRlci10YXgv0gEA?oc=5,https://da.gd/32roUu
GN:T:CC,California homebuyers face fewer companies to insure their homes - KSBY News,https://news.google.com/rss/articles/CBMieWh0dHBzOi8vd3d3LmtzYnkuY29tL25ld3MvY2FsaWZvcm5pYS1uZXdzL2NhbGlmb3JuaWEtaG9tZWJ1eWVycy1mYWNlLWEtbmV3LXN0cnVnZ2xlLWZld2VyLWNvbXBhbmllcy10by1pbnN1cmUtdGhlaXItaG9tZXPSAQA?oc=5,https://da.gd/8bpTt
GN:T:CC,How Do Heat Waves Affect Your Neighborhood? City Wants Volunteers For Study On Climate Change Impact - Block Club Chicago,https://news.google.com/rss/articles/CBMijAFodHRwczovL2Jsb2NrY2x1YmNoaWNhZ28ub3JnLzIwMjMvMDYvMDYvaG93LWRvLWhlYXQtd2F2ZXMtYWZmZWN0LXlvdXItbmVpZ2hib3Job29kLWNpdHktd2FudHMtdm9sdW50ZWVycy1mb3Itc3R1ZHktb24tY2xpbWF0ZS1jaGFuZ2UtaW1wYWN0L9IBAA?oc=5,https://da.gd/qAgHg
GN:T:CC,Recycling failed to stop plastic pollution. A new global treaty might actually help. - Vox,https://news.google.com/rss/articles/CBMiXGh0dHBzOi8vd3d3LnZveC5jb20vZG93bi10by1lYXJ0aC8yMDIzLzYvNy8yMzc0MzY0MC9wbGFzdGljLXBvbGx1dGlvbi11bi10cmVhdHktb2NlYW5zLXdhc3Rl0gFpaHR0cHM6Ly93d3cudm94LmNvbS9wbGF0Zm9ybS9hbXAvZG93bi10by1lYXJ0aC8yMDIzLzYvNy8yMzc0MzY0MC9wbGFzdGljLXBvbGx1dGlvbi11bi10cmVhdHktb2NlYW5zLXdhc3Rl?oc=5,https://da.gd/F15cRN
GN:T:CC,"From British Columbia to Nova Scotia, Wildfires Spread Across Canada - The New York Times",https://news.google.com/rss/articles/CBMiR2h0dHBzOi8vd3d3Lm55dGltZXMuY29tLzIwMjMvMDYvMDcvd29ybGQvYW1lcmljYXMvY2FuYWRhLXdpbGRmaXJlcy5odG1s0gEA?oc=5,https://da.gd/YDv32
GN:T:CC,Paris City Council Adopts Plan to Plant Trees That Survive Extreme Heat - Bloomberg,https://news.google.com/rss/articles/CBMiemh0dHBzOi8vd3d3LmJsb29tYmVyZy5jb20vbmV3cy9hcnRpY2xlcy8yMDIzLTA2LTA2L3BhcmlzLWNpdHktY291bmNpbC1hZG9wdHMtcGxhbi10by1wbGFudC10cmVlcy10aGF0LXN1cnZpdmUtZXh0cmVtZS1oZWF00gEA?oc=5,https://da.gd/sdYvjz
