feed,title,long_url,short_url
ArXiv:q-fin,Double Auctions: Formalization and Automated Checkers,https://arxiv.org/abs/2410.18751,
ArXiv:q-fin,Generation of synthetic financial time series by diffusion models,https://arxiv.org/abs/2410.18897,
ArXiv:q-fin,A Case Study of Next Portfolio Prediction for Mutual Funds,https://arxiv.org/abs/2410.18098,
ArXiv:q-fin,Periodic portfolio selection with quasi-hyperbolic discounting,https://arxiv.org/abs/2410.18240,
ArXiv:q-fin,Dynamic Investment-Driven Insurance Pricing: Equilibrium Analysis and Welfare Implication,https://arxiv.org/abs/2410.18432,
ArXiv:q-fin,On the mean-field limit of diffusive games through the master equation: extreme value analysis,https://arxiv.org/abs/2410.18869,
ArXiv:q-fin,A minimal model of money creation under regulatory constraints,https://arxiv.org/abs/2410.18145,
