feed,title,long_url,short_url
GN:S:C,People are being displaced by the impacts of climate change — how can cities cope with newcomers? - GreenBiz,https://www.greenbiz.com/article/people-are-being-displaced-impacts-climate-change-how-can-cities-cope-newcomers,
GN:S:C,Activists discuss climate action at local panel - Daily Northwestern,https://dailynorthwestern.com/2021/01/14/city/evanston-activists-convene-to-discuss-the-climate-crisis-and-local-action/,
GN:S:C,NGOs accuse France of climate inaction in landmark court case - RFI English,https://www.rfi.fr/en/science-and-technology/20210114-ngos-accuse-france-of-climate-inaction-in-landmark-court-case,
GN:S:C,How Prince Charles’s “Terra Carta” aims to impact climate change - Quartz,https://qz.com/1956254/how-prince-charless-terra-carta-aims-to-impact-climate-change/,
GN:S:C,"Scientists say 1-2% of bugs lost every year due to climate change, agriculture, pesticides - FOX 35 Orlando",https://www.fox35orlando.com/news/scientists-say-1-2-of-bugs-lost-every-year-due-to-climate-change-agriculture-pesticides,
