feed,title,long_url,short_url
GN:S:C,How the Huge New US Climate Bill Will Save You Money - WIRED,https://www.wired.com/story/how-inflation-reduction-act-climate-bill-save-you-money/,
GN:S:C,A look at Biden’s past executive orders on climate change - The Hill,https://thehill.com/changing-america/sustainability/climate-change/3603947-a-look-at-bidens-past-executive-orders-on-climate-change/,
GN:S:C,"Biden signs sweeping health, climate and tax bill, a major win for his domestic agenda - ABC News",https://abcnews.go.com/Politics/biden-sign-major-health-climate-tax-bill-tuesday/story?id=88412221,
GN:S:C,"Fossil fuel companies' projections won't meet Paris Agreement climate goals, researchers say - Science Daily",https://www.sciencedaily.com/releases/2022/08/220816120204.htm,
GN:S:C,Scientists welcome 'enormous' US climate bill — but call for stronger action - Nature,https://www.nature.com/articles/d41586-022-02223-8,
GN:S:C,"Pa. lawmakers tout increased state, federal funding to fight climate change - TribLIVE",https://triblive.com/local/pa-lawmakers-tout-increased-state-federal-funding-to-fight-climate-change/,
GN:S:C,"US: Major Steps to Address Health Care, Climate Crisis - Human Rights Watch",https://www.hrw.org/news/2022/08/16/us-major-steps-address-health-care-climate-crisis,
GN:S:C,The combination of genomic offset and niche modelling provides insights into climate change-driven vulnerability - Nature,https://www.nature.com/articles/s41467-022-32546-z,
GN:S:C,Tanzania Has Made Huge Progress Against Malaria. Climate Change Threatens to Derail It. - Global Citizen,https://www.globalcitizen.org/en/content/impact-of-climate-change-on-malaria/,
GN:S:C,OPINION: The real 'at last' on climate change - Anchorage Daily News,https://www.adn.com/opinions/2022/08/16/opinion-the-real-at-last-on-climate-change/,
GN:S:C,Atlantic hurricane season starting earlier because of climate change - USA TODAY,https://www.usatoday.com/story/news/nation/2022/08/16/atlantic-hurricane-season-starting-earlier/10337612002/,
