feed,title,long_url,short_url
GN:T:WP,GE promotes onshore wind leader ahead of Vernova spin-off - Windpower Monthly,https://news.google.com/rss/articles/CBMiZ2h0dHBzOi8vd3d3LndpbmRwb3dlcm1vbnRobHkuY29tL2FydGljbGUvMTgzNTEyNi9nZS1wcm9tb3Rlcy1vbnNob3JlLXdpbmQtbGVhZGVyLWFoZWFkLXZlcm5vdmEtc3Bpbi1vZmbSAQA?oc=5,https://da.gd/BPuf
GN:T:WP,Crowley and Morgan Stanley Launch JV to Develop Wind Port Infrastructure - The Maritime Executive,https://news.google.com/rss/articles/CBMic2h0dHBzOi8vd3d3Lm1hcml0aW1lLWV4ZWN1dGl2ZS5jb20vYXJ0aWNsZS9jcm93bGV5LWFuZC1tb3JnYW4tc3RhbmxleS1sYXVuY2gtanYtdG8tZGV2ZWxvcC13aW5kLXBvcnQtaW5mcmFzdHJ1Y3R1cmXSAQA?oc=5,https://da.gd/y6Ot4M
GN:T:WP,World struggles to break coal habit despite looming climate risk - Nikkei Asia,https://news.google.com/rss/articles/CBMibGh0dHBzOi8vYXNpYS5uaWtrZWkuY29tL1Nwb3RsaWdodC9EYXRhd2F0Y2gvV29ybGQtc3RydWdnbGVzLXRvLWJyZWFrLWNvYWwtaGFiaXQtZGVzcGl0ZS1sb29taW5nLWNsaW1hdGUtcmlza9IBAA?oc=5,https://da.gd/XV7MX
GN:T:WP,How an arcane maritime law adds complications on land and sea - Morning Brew,https://news.google.com/rss/articles/CBMicmh0dHBzOi8vd3d3Lm1vcm5pbmdicmV3LmNvbS9kYWlseS9zdG9yaWVzLzIwMjMvMDgvMjUvaG93LWFuLWFyY2FuZS1tYXJpdGltZS1sYXctYWRkcy1jb21wbGljYXRpb25zLW9uLWxhbmQtYW5kLXNlYdIBAA?oc=5,https://da.gd/Quwxu
GN:T:WP,BESS: The charged debate over battery energy storage systems - BBC,https://news.google.com/rss/articles/CBMiMmh0dHBzOi8vd3d3LmJiYy5jb20vbmV3cy91ay1lbmdsYW5kLWxlZWRzLTY2NTg0MzM10gE2aHR0cHM6Ly93d3cuYmJjLmNvbS9uZXdzL3VrLWVuZ2xhbmQtbGVlZHMtNjY1ODQzMzUuYW1w?oc=5,https://da.gd/IaXzD
GN:T:WP,North Wales port could create 'significant' number of jobs with wind farm construction plan - North Wales Live,https://news.google.com/rss/articles/CBMiWGh0dHBzOi8vd3d3LmRhaWx5cG9zdC5jby51ay9uZXdzL25vcnRoLXdhbGVzLW5ld3Mvbm9ydGgtd2FsZXMtcG9ydC1jb3VsZC1jcmVhdGUtMjc1OTc1NjXSAVxodHRwczovL3d3dy5kYWlseXBvc3QuY28udWsvbmV3cy9ub3J0aC13YWxlcy1uZXdzL25vcnRoLXdhbGVzLXBvcnQtY291bGQtY3JlYXRlLTI3NTk3NTY1LmFtcA?oc=5,https://da.gd/JDPYUO
