feed,title,long_url,short_url
ArXiv,Provably Efficient Offline Reinforcement Learning with Trajectory-Wise Reward,https://arxiv.org/abs/2206.06426v1,
ArXiv,Distributed and Distribution-Robust Meta Reinforcement Learning (D2-RMRL) for Data Pre-storing and Routing in Cube Satellite Networks,https://arxiv.org/abs/2206.06568v1,
ArXiv,Transformers are Meta-Reinforcement Learners,https://arxiv.org/abs/2206.06614v1,
ArXiv,Stein Variational Goal Generation For Reinforcement Learning in Hard Exploration Problems,https://arxiv.org/abs/2206.06719v1,
ArXiv,Universally Expressive Communication in Multi-Agent Reinforcement Learning,https://arxiv.org/abs/2206.06758v1,
ArXiv,Robust Reinforcement Learning with Distributional Risk-averse formulation,https://arxiv.org/abs/2206.06841v1,
ArXiv,A Layered Reference Model for Penetration Testing with Reinforcement Learning and Attack Graphs,https://arxiv.org/abs/2206.06934v1,
ArXiv,Deep Reinforcement Learning for Exact Combinatorial Optimization: Learning to Branch,https://arxiv.org/abs/2206.06965v1,
ArXiv,DeepTPI: Test Point Insertion with Deep Reinforcement Learning,https://arxiv.org/abs/2206.06975v1,
ArXiv,Large Batch Experience Replay,https://arxiv.org/abs/2110.01528v2,
ArXiv,Realistic Actor-Critic: A Framework for Balance Between Value Overestimation and Underestimation,https://arxiv.org/abs/2110.09712v4,
ArXiv,Distillation of RL Policies with Formal Guarantees via Variational Abstraction of Markov Decision Processes (Technical Report),https://arxiv.org/abs/2112.09655v2,
ArXiv,A Multi-Agent Reinforcement Learning Framework for Off-Policy Evaluation in Two-sided Markets,https://arxiv.org/abs/2202.10574v2,
ArXiv,Reinforcement Learning from Partial Observation: Linear Function Approximation with Provable Sample Efficiency,https://arxiv.org/abs/2204.09787v2,
ArXiv,ActorRL: A Novel Multi-level Receptive Fields Adversary Reinforcement Learning for Automoumous Intersection Management,https://arxiv.org/abs/2205.02428v2,
ArXiv,ROI Constrained Bidding via Curriculum-Guided Bayesian Reinforcement Learning,https://arxiv.org/abs/2206.05240v2,
