feed,title,long_url,short_url
GN:T:WP,EUROPE GAS-Prices edge higher on lower wind power output - Nasdaq,https://news.google.com/rss/articles/CBMiWGh0dHBzOi8vd3d3Lm5hc2RhcS5jb20vYXJ0aWNsZXMvZXVyb3BlLWdhcy1wcmljZXMtZWRnZS1oaWdoZXItb24tbG93ZXItd2luZC1wb3dlci1vdXRwdXTSAQA?oc=5,https://da.gd/eXrR
GN:T:WP,Recycling wind turbine blades by breaking them down into their constituent chemicals - Chemistry World,https://news.google.com/rss/articles/CBMiiAFodHRwczovL3d3dy5jaGVtaXN0cnl3b3JsZC5jb20vbmV3cy9yZWN5Y2xpbmctd2luZC10dXJiaW5lLWJsYWRlcy1ieS1icmVha2luZy10aGVtLWRvd24taW50by10aGVpci1jb25zdGl0dWVudC1jaGVtaWNhbHMvNDAxNzM4NS5hcnRpY2xl0gEA?oc=5,https://da.gd/ZacsE
GN:T:WP,Dogger Bank vessel supplier places order with Norwegian yard - Upstream Online,https://news.google.com/rss/articles/CBMieGh0dHBzOi8vd3d3LnVwc3RyZWFtb25saW5lLmNvbS9yaWdzLWFuZC12ZXNzZWxzL2RvZ2dlci1iYW5rLXZlc3NlbC1zdXBwbGllci1wbGFjZXMtb3JkZXItd2l0aC1ub3J3ZWdpYW4teWFyZC8yLTEtMTQ0NzkzONIBAA?oc=5,https://da.gd/LGlU5Z
GN:T:WP,A wind port for Searsport? Public meeting planned for May 20 - Republican Journal,https://news.google.com/rss/articles/CBMikAFodHRwczovL3dhbGRvLnZpbGxhZ2Vzb3VwLmNvbS9uZXdzL2Etd2luZC1wb3J0LWZvci1zZWFyc3BvcnQtcHVibGljLW1lZXRpbmctcGxhbm5lZC1mb3ItbWF5LTIwL2FydGljbGVfZmFhZmIzNzgtZWUxOS0xMWVkLWIyOGEtNmJjYWU1MTZjNTBkLmh0bWzSAQA?oc=5,https://da.gd/2MnSz
GN:T:WP,No new wind turbine factories without government help: Siemens Gamesa CEO - Recharge,https://news.google.com/rss/articles/CBMidmh0dHBzOi8vd3d3LnJlY2hhcmdlbmV3cy5jb20vd2luZC9uby1uZXctd2luZC10dXJiaW5lLWZhY3Rvcmllcy13aXRob3V0LWdvdmVybm1lbnQtaGVscC1zaWVtZW5zLWdhbWVzYS1jZW8vMi0xLTE0NDc5MTLSAQA?oc=5,https://da.gd/3VT6U
GN:T:WP,"CA WFO LAS VEGAS Warnings, Watches, and Advisories - Houston Chronicle",https://news.google.com/rss/articles/CBMibmh0dHBzOi8vd3d3LmhvdXN0b25jaHJvbmljbGUuY29tL3dlYXRoZXIvYXJ0aWNsZS9jYS13Zm8tbGFzLXZlZ2FzLXdhcm5pbmdzLXdhdGNoZXMtYW5kLWFkdmlzb3JpZXMtMTgwODc2NDQucGhw0gEA?oc=5,https://da.gd/c6xj
GN:T:WP,Navitas Launches into High-Power Markets with GeneSiC SiCPAK™ Modules and Accelerates Bare-Die Sales - GlobeNewswire,https://news.google.com/rss/articles/CBMiqwFodHRwczovL3d3dy5nbG9iZW5ld3N3aXJlLmNvbS9uZXdzLXJlbGVhc2UvMjAyMy8wNS8wOC8yNjYzODI4LzAvZW4vTmF2aXRhcy1MYXVuY2hlcy1pbnRvLUhpZ2gtUG93ZXItTWFya2V0cy13aXRoLUdlbmVTaUMtU2lDUEFLLU1vZHVsZXMtYW5kLUFjY2VsZXJhdGVzLUJhcmUtRGllLVNhbGVzLmh0bWzSAQA?oc=5,https://da.gd/7psaR
