feed,title,long_url,short_url
GN:T:RE,New Nature Conservancy Study Says America Can Go Carbon-Free By 2050 While Benefiting Conservation and Communities - The Nature Conservancy,https://news.google.com/rss/articles/CBMiPmh0dHBzOi8vd3d3Lm5hdHVyZS5vcmcvZW4tdXMvbmV3c3Jvb20vcG93ZXItb2YtcGxhY2UtbmF0aW9uYWwv0gEA?oc=5,https://da.gd/uKlR6
GN:T:RE,Can the crypto industry reach net-zero? - Electronic Payments International,https://news.google.com/rss/articles/CBMibmh0dHBzOi8vd3d3LmVsZWN0cm9uaWNwYXltZW50c2ludGVybmF0aW9uYWwuY29tL25ld3MvcGF5c2FmZS1jbGlmZm9yZC1jaGFuY2UtcmVwb3J0LWNhbi1jcnlwdG8tcmVhY2gtbmV0LXplcm8v0gEA?oc=5,https://da.gd/8PEX
GN:T:RE,How one Maine college plans to end its reliance on fossil fuels within 20 years - Connecticut Public,https://news.google.com/rss/articles/CBMic2h0dHBzOi8vd3d3LmN0cHVibGljLm9yZy8yMDIzLTA1LTA5L2hvdy1vbmUtbWFpbmUtY29sbGVnZS1wbGFucy10by1lbmQtaXRzLXJlbGlhbmNlLW9uLWZvc3NpbC1mdWVscy13aXRoaW4tMjAteWVhcnPSAQA?oc=5,https://da.gd/BE5B
GN:T:RE,This 5.7%-Yielding Dividend Stock is Going All In on Renewable Energy to Power Growth - The Motley Fool,https://news.google.com/rss/articles/CBMiXWh0dHBzOi8vd3d3LmZvb2wuY29tL2ludmVzdGluZy8yMDIzLzA1LzA5L3RoaXMtNjQteWllbGRpbmctZGl2aWRlbmQtc3RvY2staXMtZ29pbmctYWxsLWluLW9uL9IBAA?oc=5,https://da.gd/rHaiVF
GN:T:RE,The Most Valuable U.S. Power Company Is Making a Huge Bet on Hydrogen - The Wall Street Journal,https://news.google.com/rss/articles/CBMiaWh0dHBzOi8vd3d3Lndzai5jb20vYXJ0aWNsZXMvdGhlLW1vc3QtdmFsdWFibGUtdS1zLXBvd2VyLWNvbXBhbnktaXMtbWFraW5nLWEtaHVnZS1iZXQtb24taHlkcm9nZW4tNGMxODk2ZNIBAA?oc=5,https://da.gd/KURrp
GN:T:RE,Acciona and the Blue Circle enter Thai wind power with tender win - Windpower Monthly,https://news.google.com/rss/articles/CBMiZWh0dHBzOi8vd3d3LndpbmRwb3dlcm1vbnRobHkuY29tL2FydGljbGUvMTgyMjExMS9hY2Npb25hLWJsdWUtY2lyY2xlLWVudGVyLXRoYWktd2luZC1wb3dlci10ZW5kZXItd2lu0gEA?oc=5,https://da.gd/RAB3c
GN:T:RE,Wind and Solar Aren't Nearly Enough: Why Biden Is Suddenly Supporting Fossil Fuels - RealClearEnergy,https://news.google.com/rss/articles/CBMikgFodHRwczovL3d3dy5yZWFsY2xlYXJlbmVyZ3kub3JnL2FydGljbGVzLzIwMjMvMDUvMDgvd2luZF9hbmRfc29sYXJfYXJlX25vdF9uZWFybHlfZW5vdWdoX3doeV9iaWRlbl9pc19zdWRkZW5seV9zdXBwb3J0aW5nX2Zvc3NpbF9mdWVsc184OTc1MTcuaHRtbNIBAA?oc=5,https://da.gd/yVoO6
