feed,title,long_url,short_url
GN:S:C,Collective action needed to avoid worst impacts of climate change - Mercer Island Reporter,https://www.mi-reporter.com/news/collective-action-needed-to-avoid-worst-impacts-of-climate-change/,
GN:S:C,The $270 trillion climate fund gap and other environment stories you need to read this week - World Economic Forum,https://www.weforum.org/agenda/2022/10/environment-stories-you-need-to-read-this-week-10-october/,
GN:S:C,From climate change denial to delayism: Oil firms send academics into the fray - EL PAÍS USA,https://english.elpais.com/science-tech/2022-10-10/from-climate-change-denial-to-delayism-oil-firms-send-academics-into-the-fray.html,
GN:S:C,Senate challenger Mandela Barnes wants action on climate change. Incumbent Ron Johnson sees green energy as unreliable and 'pointless' - Milwaukee Journal Sentinel,https://www.jsonline.com/story/news/politics/elections/2022/10/10/senate-candidates-ron-johnson-mandela-barnes-split-climate-change/8231090001/,
GN:S:C,How To Celebrate Indigenous People’s Day At This Moment Of Climate Crisis - CleanTechnica,https://cleantechnica.com/2022/10/10/how-to-celebrate-indigenous-peoples-day-at-this-moment-of-climate-crisis/,
GN:S:C,Drive for climate compensation grows after Pakistan's floods - The Associated Press - en Español,https://apnews.com/article/floods-pakistan-united-nations-monsoons-climate-and-environment-403ba462fe9e808714e2fa849386d29d,
GN:S:C,Letter: Jared Golden right to emphasize climate change - Bangor Daily News,https://www.bangordailynews.com/2022/10/10/opinion/letters/letter-golden-climate-change-challenge/,
GN:S:C,Climate clash or semantics squabble? - Banking Dive,https://www.bankingdive.com/news/climate-clash-or-semantics-squabble/633723/,
GN:S:C,"Climate change: Isle of Man could be a world leader, advisor says - bbc",https://www.bbc.co.uk/news/world-europe-isle-of-man-63202159,
GN:S:C,Disappearing sand billboard pushes Bank of the West's climate message - Banking Dive,https://www.bankingdive.com/news/disappearing-sand-billboard-pushes-bank-of-the-wests-climate-message/633719/,
GN:S:C,'Strongest Climate Bill Ever' May Increase Oil and Gas Production in New Mexico - Capital and Main,https://capitalandmain.com/strongest-climate-bill-ever-may-increase-oil-and-gas-production-in-new-mexico,
GN:S:C,"ESG strategies and methods must better reflect climate adaptation and resilience factors, asserts Special Report from Adaptation Leader - Yahoo Finance",https://finance.yahoo.com/news/esg-strategies-methods-must-better-160000539.html,
