feed,title,long_url,short_url
BioRxiv,The First Geographic Identification by Country of Sustainable Mutations of SARS-COV-2 Sequence Samples: Worldwide Natural Selection Trends,https://biorxiv.org/cgi/content/short/2022.07.18.500565v1?rss=1,https://bit.ly/3v1xyDk
BioRxiv,Discovering host protein interactions specific for SARS-CoV-2 RNA genome,https://biorxiv.org/cgi/content/short/2022.07.18.499583v1?rss=1,https://bit.ly/3aOxXlA
BioRxiv,Monovalent and trivalent VSV-based COVID-19 vaccines elicit potent neutralizing antibodies and immunodominant CD8+ T cells against diverse SARS-CoV-2 variants,https://biorxiv.org/cgi/content/short/2022.07.19.500626v1?rss=1,https://bit.ly/3IQP6aU
BioRxiv,COVID-associated pulmonary aspergillosis in immunocompetent patients,https://biorxiv.org/cgi/content/short/2022.07.18.500514v1?rss=1,https://bit.ly/3IRr6V8
BioRxiv,Orally administered niclosamide-based organic/inorganic hybrid suppresses SARS-CoV-2 infection,https://biorxiv.org/cgi/content/short/2022.07.19.500639v1?rss=1,https://bit.ly/3zstUVP
