feed,title,long_url,short_url
GN:S:C,Explainer-The Global Fight Over Climate Change Funding - U,https://news.google.com/rss/articles/CBMibGh0dHBzOi8vd3d3LnVzbmV3cy5jb20vbmV3cy93b3JsZC9hcnRpY2xlcy8yMDI0LTA2LTEzL2V4cGxhaW5lci10aGUtZ2xvYmFsLWZpZ2h0LW92ZXItY2xpbWF0ZS1jaGFuZ2UtZnVuZGluZ9IBAA?oc=5,https://da.gd/173Td
GN:S:C,"Annecy Climate Crisis Movie ‘Black Butterflies’: ‘We Tried to Put a Human Face to This Drama,’ Says Director David Baute - Variety",https://news.google.com/rss/articles/CBMiXmh0dHBzOi8vdmFyaWV0eS5jb20vMjAyNC9maWxtL2dsb2JhbC9ibGFjay1idXR0ZXJmbGllcy1kYXZpZC1iYXV0ZS1hbm5lY3ktZmVzdGl2YWwtMTIzNjAzNjEwMC_SAWJodHRwczovL3ZhcmlldHkuY29tLzIwMjQvZmlsbS9nbG9iYWwvYmxhY2stYnV0dGVyZmxpZXMtZGF2aWQtYmF1dGUtYW5uZWN5LWZlc3RpdmFsLTEyMzYwMzYxMDAvYW1wLw?oc=5,https://da.gd/q9bB
GN:S:C,COP29: Negotiators Gear Up for Fights Over Climate Finance - Bloomberg,https://news.google.com/rss/articles/CBMid2h0dHBzOi8vd3d3LmJsb29tYmVyZy5jb20vbmV3cy9hcnRpY2xlcy8yMDI0LTA2LTEzL2NvcDI5LW5lZ290aWF0b3JzLWdlYXItdXAtZm9yLWZpZ2h0cy1vdmVyLWNsaW1hdGUtZmluYW5jZT9zcm5kPWdyZWVu0gEA?oc=5,https://da.gd/MEuf
GN:S:C,Mapped: The Tory Network of Climate Denial and Fossil Fuel Funding - DeSmog,https://news.google.com/rss/articles/CBMiWWh0dHBzOi8vd3d3LmRlc21vZy5jb20vMjAyNC8wNi8xMi9tYXBwZWQtdG9yeS1uZXR3b3JrLWNsaW1hdGUtZGVuaWFsLWZvc3NpbC1mdWVsLWZ1bmRpbmcv0gEA?oc=5,https://da.gd/HWo7H
GN:S:C,Study: Climate change drove the route shift of the ancient Silk Road in two distinct ways - Phys,https://news.google.com/rss/articles/CBMiRGh0dHBzOi8vcGh5cy5vcmcvbmV3cy8yMDI0LTA2LWNsaW1hdGUtZHJvdmUtcm91dGUtc2hpZnQtYW5jaWVudC5odG1s0gFDaHR0cHM6Ly9waHlzLm9yZy9uZXdzLzIwMjQtMDYtY2xpbWF0ZS1kcm92ZS1yb3V0ZS1zaGlmdC1hbmNpZW50LmFtcA?oc=5,https://da.gd/yYvRK
GN:S:C,'Destination Earth' to deliver climate data for energy planning - Smart Energy International,https://news.google.com/rss/articles/CBMigwFodHRwczovL3d3dy5zbWFydC1lbmVyZ3kuY29tL2luZHVzdHJ5LXNlY3RvcnMvZGlnaXRhbGlzYXRpb24vZXVyb3Blcy1kZXN0aW5hdGlvbi1lYXJ0aC10by1kZWxpdmVyLWNsaW1hdGUtZGF0YS1mb3ItZW5lcmd5LXBsYW5uaW5nL9IBAA?oc=5,https://da.gd/L49G8
GN:S:C,Climate Protesters Storm the Field at Congressional Baseball Game - Yahoo! Voices,https://news.google.com/rss/articles/CBMiVmh0dHBzOi8vd3d3LnlhaG9vLmNvbS9uZXdzL2NsaW1hdGUtcHJvdGVzdGVycy1zdG9ybS1maWVsZC1jb25ncmVzc2lvbmFsLTAyNTY1OTkxMC5odG1s0gEA?oc=5,https://da.gd/YMqRNO
