feed,title,long_url,short_url
GN:S:GW,The UK Green Party struggles to be heard in an election where climate change is on the back burner - KXAN,https://news.google.com/rss/articles/CBMijgFodHRwczovL3d3dy5reGFuLmNvbS9uZXdzL2ludGVybmF0aW9uYWwvYXAtdGhlLXVrLWdyZWVuLXBhcnR5LXN0cnVnZ2xlcy10by1iZS1oZWFyZC1pbi1hbi1lbGVjdGlvbi13aGVyZS1jbGltYXRlLWNoYW5nZS1pcy1vbi10aGUtYmFjay1idXJuZXIv0gGSAWh0dHBzOi8vd3d3Lmt4YW4uY29tL25ld3MvaW50ZXJuYXRpb25hbC9hcC10aGUtdWstZ3JlZW4tcGFydHktc3RydWdnbGVzLXRvLWJlLWhlYXJkLWluLWFuLWVsZWN0aW9uLXdoZXJlLWNsaW1hdGUtY2hhbmdlLWlzLW9uLXRoZS1iYWNrLWJ1cm5lci9hbXAv?oc=5,https://da.gd/82ain
GN:S:GW,Ancient ocean slowdown warns of future climate chaos - Phys,https://news.google.com/rss/articles/CBMiSGh0dHBzOi8vcGh5cy5vcmcvbmV3cy8yMDI0LTA2LWFuY2llbnQtb2NlYW4tc2xvd2Rvd24tZnV0dXJlLWNsaW1hdGUuaHRtbNIBR2h0dHBzOi8vcGh5cy5vcmcvbmV3cy8yMDI0LTA2LWFuY2llbnQtb2NlYW4tc2xvd2Rvd24tZnV0dXJlLWNsaW1hdGUuYW1w?oc=5,https://da.gd/OkAwW
GN:S:GW,Is climate change making turbulence worse? What to know. - The Washington Post,https://news.google.com/rss/articles/CBMiY2h0dHBzOi8vd3d3Lndhc2hpbmd0b25wb3N0LmNvbS9jbGltYXRlLXNvbHV0aW9ucy8yMDI0LzA2LzEzL3R1cmJ1bGVuY2UtY2xpbWF0ZS1jaGFuZ2UtY2F1c2UtaW1wYWN0L9IBAA?oc=5,https://da.gd/1H6J
GN:S:GW,Early life cold and heat exposure impacts white matter development in children - Nature,https://news.google.com/rss/articles/CBMiMmh0dHBzOi8vd3d3Lm5hdHVyZS5jb20vYXJ0aWNsZXMvczQxNTU4LTAyNC0wMjAyNy130gEA?oc=5,https://da.gd/dMDns
GN:S:GW,"Bye bye, El Nino. Cooler hurricane-helping La Nina to replace the phenomenon that adds heat to Earth - Yahoo! Voices",https://news.google.com/rss/articles/CBMiQGh0dHBzOi8vd3d3LnlhaG9vLmNvbS9uZXdzL2J5ZS1ieWUtZWwtbmluby1jb29sZXItMTMwMzE3OTU3Lmh0bWzSAQA?oc=5,https://da.gd/SUaCI
