feed,title,long_url,short_url
gNews,Trailing oil demand in India shows economy not fully recovered - Hindustan Times,https://www.hindustantimes.com/business-news/trailing-oil-demand-in-india-shows-economy-not-fully-recovered/story-IBq7CcvnePlssDpkQH6KwK.html,https://j.mp/381qZE3
gNews,"Supply outstrips demand, PPE prices crash - Times of India",https://timesofindia.indiatimes.com/india/supply-outstrips-demand-ppe-prices-crash/articleshow/76607403.cms,https://j.mp/2Vgv7uG
gNews,Trump’s H1-B visa ban may be a boon for global in-house centres - Livemint,https://www.livemint.com/news/india/trump-s-h1-b-visa-ban-may-be-a-boon-for-global-in-house-centres-11593062393231.html,https://j.mp/2BCfvuE
gNews,India Plans to Impose Strict Rules and Tariffs on Chinese Imports - BloombergQuint,https://www.bloombergquint.com/economy-finance/india-is-said-to-weigh-strict-rules-tariffs-on-chinese-imports,https://j.mp/3hZGUr1
gNews,Realme X3 SuperZoom to launch in India today: Details here - Livemint,https://www.livemint.com/technology/tech-news/realme-x3-superzoom-to-launch-in-india-today-details-here-11593053485790.html,https://j.mp/2CIr0Bn
gNews,"Rs 150,000 crore plus: the govt stimulus for rural areas post lockdown - The Indian Express",https://indianexpress.com/article/explained/rs-150000-crore-plus-the-govt-stimulus-for-rural-areas-post-lockdown-6474873/,https://j.mp/2Nvj3S5
