feed,title,long_url,short_url
j:MDPI:N,The BMI Z-Score and Protein Energy Ratio in Early- and Late-Diagnosed PKU Patients from a Single Reference Center in Mexico,https://mdpi.com/2072-6643/15/4/957,
j:MDPI:N,A Novel Symbiotic Formulation Reduces Obesity and Concomitant Metabolic Syndrome in Rats by Raising the Relative Abundance of Blautia,https://mdpi.com/2072-6643/15/4/956,
j:MDPI:N,"Nutrients, Phytochemicals and In Vitro Disease Prevention of Nephelium hypoleucum Kurz Fruit",https://mdpi.com/2072-6643/15/4/950,
j:MDPI:N,Novel Lines of Research on the Environmental and Human Health Impacts of Nut Consumption,https://mdpi.com/2072-6643/15/4/955,
j:MDPI:N,The Mediating Role of Eating Attitudes in Sociocultural Attitudes toward the Body in Predicting Obligatory Exercise among Young People: A Polish and Chinese Comparison,https://mdpi.com/2072-6643/15/4/952,
j:MDPI:N,Effect of Vitamin D Supplementation on Depression in Adults: A Systematic Review of Randomized Controlled Trials (RCTs),https://mdpi.com/2072-6643/15/4/951,
j:MDPI:N,IRW (Ile–Arg–Trp) Alleviates DSS–Induced Intestinal Injury by Remodeling Gut Microbiota and Regulating Fecal SCFA Levels,https://mdpi.com/2072-6643/15/4/953,
j:MDPI:N,Protective Effects of Coumestrol on Metabolic Dysfunction and Its Estrogen Receptor-Mediated Action in Ovariectomized Mice,https://mdpi.com/2072-6643/15/4/954,
j:MDPI:N,Rheum rhaponticum and Rheum rhabarbarum Extracts as Modulators of Endothelial Cell Inflammatory Response,https://mdpi.com/2072-6643/15/4/949,
