feed,title,long_url,short_url
GN:T:WP,EDP Renewables completes Texas wind farm - Houston Business Journal - Houston Business Journal,https://www.bizjournals.com/houston/news/2021/08/11/edp-completes-86m-texas-project.html,
GN:T:WP,North Dakota's overshadowed solar industry imagines a different future - INFORUM,https://www.inforum.com/bismarck/7138189-North-Dakotas-overshadowed-solar-industry-imagines-a-different-future,
GN:T:WP,"Where does electricity come from in the Twin Cities, and how is it delivered to homes? - Minneapolis Star Tribune",https://www.startribune.com/power-plants-minneapolis-st-paul-natural-gas-transmission-wires/600086283/,
GN:T:WP,Ocean SuperCluster to Provide $2 Million for GeoScan Wide Area Acoustic Corer - Yahoo Finance,https://finance.yahoo.com/news/ocean-supercluster-2-million-geoscan-133000992.html,
GN:T:WP,"California's clean grid may lean on oil, gas to avoid summer blackouts - Reuters",https://www.reuters.com/article/usa-energy-california/californias-clean-grid-may-lean-on-oil-gas-to-avoid-summer-blackouts-idUSL1N2PH1WE,
GN:T:WP,Can Water Megaprojects Save The US Desert West? (Part 2) - CleanTechnica,https://cleantechnica.com/2021/08/11/can-water-megaprojects-save-the-us-desert-west-part-2/,
GN:T:WP,How Can Emerging Markets Capitalize On Geothermal Energy's Potential - OilPrice,https://oilprice.com/Alternative-Energy/Geothermal-Energy/How-Can-Emerging-Markets-Capitalize-On-Geothermal-Energys-Potential.html,
