feed,title,long_url,short_url
LitCovid,Financial hardship and change in emotional well-being before to during COVID-19 pandemic among middle-aged and older Americans: Moderating effects of internal coping resources,https://pubmed.ncbi.nlm.nih.gov/36473337,
LitCovid,"Desloratadine, an FDA-approved cationic amphiphilic drug, inhibits SARS-CoV-2 infection in cell culture and primary human nasal epithelial cells by blocking viral entry",https://pubmed.ncbi.nlm.nih.gov/36473907,
LitCovid,Commentary: Who and when to leave behind: Difficult decisions around extracorporeal membrane oxygenation selection in coronavirus disease 2019,https://pubmed.ncbi.nlm.nih.gov/36473748,
LitCovid,"Report on Long COVID Urges Actions to Address Needs of Patients, Caregivers",https://pubmed.ncbi.nlm.nih.gov/36472878,
LitCovid,"Synthesis of molnupiravir (MK-4482, EIDD-2801): a promising oral drug for the treatment of COVID-19 starting from cytidine",https://pubmed.ncbi.nlm.nih.gov/36472346,
LitCovid,"Viral Cultures, Cycle Threshold Values and Viral Load Estimation for Assessing SARS-CoV-2 Infectiousness in Haematopoietic Stem Cell and Solid Organ Transplant Patients: A Systematic Review",https://pubmed.ncbi.nlm.nih.gov/36473552,
LitCovid,Essential maternal health service disruptions in Ethiopia during COVID 19 pandemic: a systematic review,https://pubmed.ncbi.nlm.nih.gov/36474256,
LitCovid,"Low neutralization of SARS-CoV-2 Omicron BA.2.75.2, BQ.1.1, and XBB.1 by parental mRNA vaccine or a BA.5-bivalent booster",https://pubmed.ncbi.nlm.nih.gov/36473500,
LitCovid,COVID‑19 in pregnant women in South Africa: A retrospective review,https://pubmed.ncbi.nlm.nih.gov/36472317,
LitCovid,"Containment of SARS-CoV-2 Delta strain in Guangzhou, China by quarantine and social distancing: a modelling study",https://pubmed.ncbi.nlm.nih.gov/36473881,
LitCovid,Investigating the role of predictive death anxiety in the job satisfaction of pre-hospital emergency personnel during the COVID-19 pandemic,https://pubmed.ncbi.nlm.nih.gov/36474161,
LitCovid,MRI Assessment of Cerebral Blood Flow in Nonhospitalized Adults Who Self-Isolated Due to COVID-19,https://pubmed.ncbi.nlm.nih.gov/36472248,
LitCovid,Evaluating the neutrophil-to-lymphocyte ratio as an indicator for early referral of patients with COVID-19 pneumonia to a high-care facility,https://pubmed.ncbi.nlm.nih.gov/36472334,
LitCovid,Resurgence of Shoshin beriberi during the COVID-19 pandemic,https://pubmed.ncbi.nlm.nih.gov/36472624,
LitCovid,Surgery Clerkship Directors' Perceptions of the COVID-19 Pandemic's Impact on Medical Student Education,https://pubmed.ncbi.nlm.nih.gov/36472390,
LitCovid,Teledentistry and management protocol in a pediatric dental department during the first COVID-19 lockdown,https://pubmed.ncbi.nlm.nih.gov/36473751,
LitCovid,Trends in coronary calcium score and coronary CT angiography imaging volume during the COVID-19 pandemic,https://pubmed.ncbi.nlm.nih.gov/36473800,
LitCovid,Efficacy and safety of COVID-19 vaccines,https://pubmed.ncbi.nlm.nih.gov/36473651,
LitCovid,Face mask and protective eyewear-associated headache among healthcare workers during the COVID-19 pandemic,https://pubmed.ncbi.nlm.nih.gov/36472838,
LitCovid,Incidence of Viral Rebound After Treatment With Nirmatrelvir-Ritonavir and Molnupiravir,https://pubmed.ncbi.nlm.nih.gov/36472873,
LitCovid,How much did it cost to develop and implement an eHealth intervention for a minority children population that overlapped with the COVID-19 pandemic,https://pubmed.ncbi.nlm.nih.gov/36473682,
LitCovid,Genome Sequences of 23 SARS-CoV-2 Omicron-Lineage Strains from Bangladesh,https://pubmed.ncbi.nlm.nih.gov/36472422,
LitCovid,Telerehabilitation program maintains functional capacity in patients with chronic lung disease during a period of social isolation owing to COVID-19: a quasi-experimental retrospective study,https://pubmed.ncbi.nlm.nih.gov/36473024,
LitCovid,Changes in all-cause and cause-specific mortality during the first year of the COVID-19 pandemic in Minnesota: population-based study,https://pubmed.ncbi.nlm.nih.gov/36474190,
LitCovid,Parental stress during the COVID-19 pandemic: A one-year follow-up,https://pubmed.ncbi.nlm.nih.gov/36472999,
LitCovid,Buprenorphine Treatment Episodes During the First Year of COVID: a Retrospective Examination of Treatment Initiation and Retention,https://pubmed.ncbi.nlm.nih.gov/36474004,
LitCovid,"Race and Ethnicity and Sex Variation in COVID-19 Mortality Risks Among Adults Experiencing Homelessness in Los Angeles County, California",https://pubmed.ncbi.nlm.nih.gov/36472872,
LitCovid,Active digital pedagogies as a substitute for clinical placement during the COVID-19 pandemic: the case of physiotherapy education,https://pubmed.ncbi.nlm.nih.gov/36474236,
LitCovid,Modeling HCV elimination recovery following the COVID-19 pandemic in the United States: Pathways to regain progress,https://pubmed.ncbi.nlm.nih.gov/36473359,
LitCovid,A metabolic associated fatty liver disease risk variant in MBOAT7 regulates toll like receptor induced outcomes,https://pubmed.ncbi.nlm.nih.gov/36473860,
LitCovid,"When Peppa Pig and Confucius meet, joining forces on the battlefield of health literacy-a qualitative analysis of COVID-19 educational materials for children and adolescents from China, the USA, and Europe",https://pubmed.ncbi.nlm.nih.gov/36472972,
LitCovid,Quality of life among patients with the common chronic disease during COVID-19 pandemic in Northwest Ethiopia: A structural equation modelling,https://pubmed.ncbi.nlm.nih.gov/36472997,
LitCovid,"""I think people should be more aware:"" Uterine fibroid experiences among women living in Indiana, USA",https://pubmed.ncbi.nlm.nih.gov/36473404,
LitCovid,Career and Professional Development for Young Oncologists,https://pubmed.ncbi.nlm.nih.gov/36473447,
LitCovid,Prepandemic Mental Health and Well-being: Differences Within the Health Care Workforce and the Need for Targeted Resources,https://pubmed.ncbi.nlm.nih.gov/36472564,
LitCovid,Steroid treatment suppresses the CD4(+) T-cell response to the third dose of mRNA COVID-19 vaccine in systemic autoimmune rheumatic disease patients,https://pubmed.ncbi.nlm.nih.gov/36474011,
