feed,title,long_url,short_url
LitCovid,Uncontrolled confounding in COVID-19 epidemiology,https://pubmed.ncbi.nlm.nih.gov/36474317,
LitCovid,COVID-19-Associated Parotitis in a 10-Week-Old Male,https://pubmed.ncbi.nlm.nih.gov/36475193,
LitCovid,[How frequent is long COVID really?],https://pubmed.ncbi.nlm.nih.gov/36475055,
LitCovid,Despite COVID: showcasing new research in evolutionary biology from academic care-givers in the middle of a pandemic,https://pubmed.ncbi.nlm.nih.gov/36475441,
LitCovid,The Effects of SARS-CoV-2 Virus Type and of Vaccination Status on Causes of Death Over the Course of the COVID-19 Pandemic,https://pubmed.ncbi.nlm.nih.gov/36474340,
LitCovid,Seasonality of SARS-CoV-2 Infections in G20 Countries: Ecological Analysis of Publicly Available Data,https://pubmed.ncbi.nlm.nih.gov/36474538,
LitCovid,Terrific T cells for SARS-CoV-2,https://pubmed.ncbi.nlm.nih.gov/36475524,
LitCovid,Cerebellar infarction risk in a mild COVID-19 case,https://pubmed.ncbi.nlm.nih.gov/36474520,
LitCovid,The Number of Stem Cell Transplantations During the COVID-19 Pandemic,https://pubmed.ncbi.nlm.nih.gov/36474337,
LitCovid,Let's Be Ready: COVID-19 Related Restrictions Can Lead to an Outbreak of Social-Communication Problems in Children,https://pubmed.ncbi.nlm.nih.gov/36474693,
LitCovid,Altered and allele-specific open chromatin landscape reveals epigenetic and genetic regulators of innate immunity in COVID-19,https://pubmed.ncbi.nlm.nih.gov/36474914,
LitCovid,Unusual cases of acute pancreatitis in patients with covid-19,https://pubmed.ncbi.nlm.nih.gov/36474848,
LitCovid,REACTIVE NON-REGIONAL LYMPHADENOPATHY FROM THE COVID-19 mRNA VACCINE: A NOVEL SIDE-EFFECT,https://pubmed.ncbi.nlm.nih.gov/36474841,
LitCovid,[High Heterogeneity of Virus-Neutralizing and RBD-Binding Activities of COVID-19 Convalescent Sera],https://pubmed.ncbi.nlm.nih.gov/36475494,
LitCovid,Automatic approach for mask detection: effective for COVID-19,https://pubmed.ncbi.nlm.nih.gov/36475038,
LitCovid,The COVID-19 pandemic and food security in low- and middle-income countries: a review,https://pubmed.ncbi.nlm.nih.gov/36474782,
LitCovid,Socio-demographical Profile of 7285 SARS-Cov-2 Positive Early Cases; Comparison with National Four Epidemic Waves,https://pubmed.ncbi.nlm.nih.gov/36475093,
LitCovid,Does economic policy uncertainty drive the dynamic spillover among traditional currencies and cryptocurrencies? The role of the COVID-19 pandemic,https://pubmed.ncbi.nlm.nih.gov/36474632,
LitCovid,"Prevalence of the Risk Factors of Delirium Among COVID-19 Patients in the Intensive Care Unit at King Abdullah Medical City, Makkah: A Single-Center Study",https://pubmed.ncbi.nlm.nih.gov/36475175,
LitCovid,The Disease Course of Hospitalized COVID-19 Patients During the Delta and Omicron Periods in Consideration of Vaccination Status,https://pubmed.ncbi.nlm.nih.gov/36474339,
LitCovid,Exploring the impact of selection bias in observational studies of COVID-19: a simulation study,https://pubmed.ncbi.nlm.nih.gov/36474414,
LitCovid,Post-COVID-19 Polymyositis: A Case Report,https://pubmed.ncbi.nlm.nih.gov/36475159,
LitCovid,The Experiences of Post-Separation Survivors of Domestic Violence During the Covid-19 Pandemic: Findings From a Qualitative Study in the United Kingdom,https://pubmed.ncbi.nlm.nih.gov/36474432,
LitCovid,"Practices, Knowledge, and Attitudes of Chinese University Students Toward Traditional Chinese Herbal Medicine for the Control of COVID-19",https://pubmed.ncbi.nlm.nih.gov/36474905,
LitCovid,Between a Rock and a Hard Place: COVID Concerns and Partnered U.S. Mothers' Employment during the COVID-19 Pandemic.,https://pubmed.ncbi.nlm.nih.gov/36474868,
LitCovid,Peripheral Lymphocyte Count and Viral Clearance in COVID-19,https://pubmed.ncbi.nlm.nih.gov/36474394,
LitCovid,Characteristics of the 6th Japanese wave of COVID-19 in hemodialysis patients,https://pubmed.ncbi.nlm.nih.gov/36474652,
LitCovid,COVID-19 associated Pancytopenia (CAP): A Clinical Impact,https://pubmed.ncbi.nlm.nih.gov/36475340,
LitCovid,Randomized Open Investigation Determining Steroid Dose in Severe COVID-19: The ROIDS-Dose Clinical Trial,https://pubmed.ncbi.nlm.nih.gov/36475114,
LitCovid,COVID-19 Vaccine Side Effects among Early-Vaccinated Healthcare Workers: Correspondence,https://pubmed.ncbi.nlm.nih.gov/36475261,
LitCovid,"COVID-19 and Homelessness: Low Vaccination Rate, High Prevalence",https://pubmed.ncbi.nlm.nih.gov/36474338,
LitCovid,"COVID-19 Vaccine Hesitancy and its Reasons in Addis Ababa, Ethiopia: A Cross-Sectional Study",https://pubmed.ncbi.nlm.nih.gov/36475258,
LitCovid,Supply chain risk management with machine learning technology: A literature review and future research directions,https://pubmed.ncbi.nlm.nih.gov/36475042,
LitCovid,Eliminating Candida albicans for endodontic treatment purposes during the SARS-CoV-2 pandemic,https://pubmed.ncbi.nlm.nih.gov/36475058,
LitCovid,Mental Health Outcomes and Sleep Status among Patients with Coronavirus Disease 2019,https://pubmed.ncbi.nlm.nih.gov/36474696,
LitCovid,Racial and Ethnic Disparities in Housing Instability During the COVID-19 Pandemic: the Role of Assets and Income Shocks,https://pubmed.ncbi.nlm.nih.gov/36474600,
LitCovid,Overlapping Myocarditis and Postural Orthostatic Tachycardia Syndrome After COVID-19 Messenger RNA Vaccination: A Case Report,https://pubmed.ncbi.nlm.nih.gov/36475233,
LitCovid,Factors Associated With Persistence of Dyspnea and Change in Health-Related Quality of Life in Patients With COVID-19 After Discharge,https://pubmed.ncbi.nlm.nih.gov/36475221,
LitCovid,Could the Emergency Department Facilitate the Start of a Holistic Follow-Up Pathway for Patients Recovering from COVID-19?,https://pubmed.ncbi.nlm.nih.gov/36474847,
LitCovid,"Depression, Anxiety, Perceived Stress and Family Support in COVID-19 Patients",https://pubmed.ncbi.nlm.nih.gov/36474698,
LitCovid,Differences in Household Preparedness and Adaptation for COVID-19,https://pubmed.ncbi.nlm.nih.gov/36474401,
LitCovid,Associations Between Conventional Healthy Behaviors and Social Distancing During the COVID-19 Pandemic: Evidence From the 2020 Community Health Survey in Korea,https://pubmed.ncbi.nlm.nih.gov/36475322,
LitCovid,How immunosuppressive therapy impaires on COVID-19 mRNA-vaccine response in rheumatic diseases,https://pubmed.ncbi.nlm.nih.gov/36475533,
LitCovid,The regulatory role of sustainable product design media and environmental performance in the impact of the Covid-19 epidemic on corporate sustainability: an application in Turkey,https://pubmed.ncbi.nlm.nih.gov/36474599,
LitCovid,Burnout Syndrome During COVID-19 Second Wave on ICU Caregivers,https://pubmed.ncbi.nlm.nih.gov/36474611,
LitCovid,Attacks on Health Care Workers in Historical Pandemics and COVID-19,https://pubmed.ncbi.nlm.nih.gov/36474406,
LitCovid,Did the COVID-19 lockdown affect consumers' sustainable behaviour in food purchasing and consumption in China?,https://pubmed.ncbi.nlm.nih.gov/36474958,
LitCovid,Economic Precarity among Single Parents in the United States during the COVID-19 Pandemic,https://pubmed.ncbi.nlm.nih.gov/36474772,
LitCovid,Changes in tourist mobility after COVID-19 outbreaks,https://pubmed.ncbi.nlm.nih.gov/36474961,
LitCovid,COVID-19-Induced Thrombocytopenia: A Brief Literature Review and Case Report,https://pubmed.ncbi.nlm.nih.gov/36475163,
LitCovid,"Willingness to Receive a COVID-19 Vaccine in an Iranian Population: Assessment of Attitudes, Perceived Benefits, and Barriers",https://pubmed.ncbi.nlm.nih.gov/36475094,
LitCovid,COVID-19 in Patients with Rheumatic Disease Using Immunomodulatory Drugs: Imaging Findings and Predictors of Hospitalization,https://pubmed.ncbi.nlm.nih.gov/36475037,
LitCovid,A Prospective Questionnaire-Based Study to Evaluate Factors Affecting the Decision to Receive COVID-19 Vaccination in 267 Patients with Inflammatory Bowel Disease in Poland,https://pubmed.ncbi.nlm.nih.gov/36474411,
LitCovid,The chest X-ray radiologic severity index as a determinant of the severity of COVID-19 pneumonia: study based on the duration of treatment and inpatient rooms,https://pubmed.ncbi.nlm.nih.gov/36474596,
LitCovid,Seeing the big picture during the COVID-19 pandemic: the spillover effects of visionary leadership on employees' work-to-family conflict,https://pubmed.ncbi.nlm.nih.gov/36474483,
LitCovid,ACE2 receptor Polymorphism and its correlation with anti-SARS-CoV-2 IgM Antibodies - a case-control study,https://pubmed.ncbi.nlm.nih.gov/36475331,
LitCovid,Successful provision of hemodialysis to patients with confirmed COVID-19 in Korea: the role of a cooperative network between public and private medical systems,https://pubmed.ncbi.nlm.nih.gov/36474330,
LitCovid,Did the first wave of the COVID-19 pandemic impact the cesarean delivery rate? A retrospective cohort study at a primary care center in Switzerland,https://pubmed.ncbi.nlm.nih.gov/36474332,
LitCovid,"Variability of Steroid Prescription for COVID-19 Associated Pneumonia in Real-Life, Non-Trial Settings",https://pubmed.ncbi.nlm.nih.gov/36474608,
LitCovid,Construction of a nomogram for predicting COVID-19 in-hospital mortality: A machine learning analysis,https://pubmed.ncbi.nlm.nih.gov/36474601,
LitCovid,Effect of the COVID-19 Vaccine on the Menstrual Cycle among Females in Saudi Arabia,https://pubmed.ncbi.nlm.nih.gov/36475264,
LitCovid,Therapeutic Applications of Fucoidans and their Potential to Act against COVID-19,https://pubmed.ncbi.nlm.nih.gov/36475344,
LitCovid,Screening of Selected Stingless Bee Honey Varieties for ACE2-Spike Protein-Binding Inhibition Activity: A Potential Preventive Medicine Against SARS-Cov-2 Infection,https://pubmed.ncbi.nlm.nih.gov/36474534,
LitCovid,Mixed formulation of mRNA and protein-based COVID-19 vaccines triggered superior neutralizing antibody responses,https://pubmed.ncbi.nlm.nih.gov/36474858,
LitCovid,Recruitment challenges for a prospective telehealth cohort study,https://pubmed.ncbi.nlm.nih.gov/36475092,
LitCovid,Relative contribution of essential and non-essential activities to SARS-CoV-2 transmission following the lifting of public health restrictions in England and Wales,https://pubmed.ncbi.nlm.nih.gov/36475452,
LitCovid,Cardiological Monitoring - A Cornerstone for Pediatric Inflammatory Multisystem Syndrome Temporally Associated with COVID-19 Outcome: A Case Report and a Review from the Literature,https://pubmed.ncbi.nlm.nih.gov/36474612,
LitCovid,Study of Different Local Treatments of Post COVID-19 Smell Dysfunction,https://pubmed.ncbi.nlm.nih.gov/36474485,
LitCovid,Prevalence and Risk Factors of Venous Thromboembolism in Critically Ill Patients with Severe COVID-19 and the Association between the Dose of Anticoagulants and Outcomes,https://pubmed.ncbi.nlm.nih.gov/36474613,
LitCovid,"Significance of hematologic abnormalities in COVID-19 severity among infected patients in Lagos, Nigeria",https://pubmed.ncbi.nlm.nih.gov/36474930,
LitCovid,The course of COVID-19 in patients with hematological malignancies and risk factors affecting mortality: A cross-sectional study,https://pubmed.ncbi.nlm.nih.gov/36474859,
LitCovid,Use of Post-Mortem Computed Tomography During the COVID-19 Pandemic: The Malaysian Experience,https://pubmed.ncbi.nlm.nih.gov/36474535,
LitCovid,Parsonage-Turner syndrome after SARS-CoV-2 vaccination: A case report,https://pubmed.ncbi.nlm.nih.gov/36475106,
LitCovid,Association of COVID-19 Real-Time Reverse Transcription-Polymerase Chain Reaction (RT-PCR) Cycle Threshold Value With Surrogate Markers of Disease Severity,https://pubmed.ncbi.nlm.nih.gov/36475201,
LitCovid,"Severe COVID-19 outcomes in pediatrics: An observational cohort analysis comparing Alpha, Delta, and Omicron variants",https://pubmed.ncbi.nlm.nih.gov/36474521,
LitCovid,Mutation and SARS-CoV-2 strain competition under vaccination in a modified SIR model,https://pubmed.ncbi.nlm.nih.gov/36474823,
LitCovid,"The relationship between oxygen therapy, drug therapy, and COVID-19 mortality",https://pubmed.ncbi.nlm.nih.gov/36475061,
LitCovid,Locked down or locked out? Trends in psychiatric emergency services utilization during the COVID-19 pandemic,https://pubmed.ncbi.nlm.nih.gov/36475326,
LitCovid,Early Prediction of High-Flow Oxygen Therapy Failure in COVID-19 Acute Hypoxemic Respiratory Failure: A Retrospective Study of Scores and Thresholds,https://pubmed.ncbi.nlm.nih.gov/36475143,
LitCovid,Functional dynamics of SARS-CoV-2 3C-like protease as a member of clan PA,https://pubmed.ncbi.nlm.nih.gov/36474932,
LitCovid,Suicidal Ideation Amongst University Students During the COVID-19 Pandemic: Time Trends and Risk Factors,https://pubmed.ncbi.nlm.nih.gov/36475311,
LitCovid,An Analysis of Aesthetic Concerns Identified by Video Conferencing,https://pubmed.ncbi.nlm.nih.gov/36475135,
LitCovid,Preoperative virtual video visits only: a convenient option that should be offered to caregivers beyond the pandemic,https://pubmed.ncbi.nlm.nih.gov/36475053,
LitCovid,Lessons learnt for air pollution mitigation policies from the COVID-19 pandemic: The Italian perspective,https://pubmed.ncbi.nlm.nih.gov/36474671,
LitCovid,Intracoronary and left ventricular thrombi in a 29-year-old COVID-19 convalescent with ST-segment elevation myocardial infarction,https://pubmed.ncbi.nlm.nih.gov/36475514,
LitCovid,Teleworking Survey in Saudi Arabia: Reliability and Validity of Arabic Version of the Questionnaire,https://pubmed.ncbi.nlm.nih.gov/36475323,
LitCovid,Peruvian children toothbrushing during the COVID-19 pandemic,https://pubmed.ncbi.nlm.nih.gov/36474998,
LitCovid,Influenza A virus modulates ACE2 expression and SARS-CoV-2 infectivity in human cardiomyocytes,https://pubmed.ncbi.nlm.nih.gov/36474635,
LitCovid,A Perspective on Theatre Efficiency in Terms of Theatre Utilisation and Theatre Costs and the Effects of Infection Control Protocols on These During the COVID-19 Pandemic,https://pubmed.ncbi.nlm.nih.gov/36475146,
LitCovid,A Nomogram-Based Study: A Way Forward to Predict the Anxiety Status in Medical Staff During the COVID-19 Pandemic,https://pubmed.ncbi.nlm.nih.gov/36474598,
LitCovid,Incidentally discovered cold hemagglutinins within autologous blood bag and cardioplegia line in a patient with a recent history of COVID-19 undergoing coronary artery surgery,https://pubmed.ncbi.nlm.nih.gov/36475516,
LitCovid,The prevalence and long-term health effects of Long Covid among hospitalised and non-hospitalised populations: A systematic review and meta-analysis,https://pubmed.ncbi.nlm.nih.gov/36474804,
LitCovid,Psychometric Properties of the Utrecht Work Engagement Scale (UWES-9) in a Sample of Active Health Care Professionals in Spain,https://pubmed.ncbi.nlm.nih.gov/36474956,
LitCovid,Effectiveness of prevention of SARS-CoV-2 transmission among unvaccinated Italian healthcare workers,https://pubmed.ncbi.nlm.nih.gov/36475504,
LitCovid,"Corrigendum to ""Comprehensive Humoral and Cellular Immune Responses to SARS-CoV-2 Variants in Diverse Chinese Population""",https://pubmed.ncbi.nlm.nih.gov/36474604,
LitCovid,Report on the 25th meeting of the ECCR 30th Sep-2nd October 2022,https://pubmed.ncbi.nlm.nih.gov/36475540,
LitCovid,"Household Readiness to Care for Mild and Asymptomatic COVID-19 Cases at Home, Southwest Ethiopia: A Community-based Cross-Sectional Study",https://pubmed.ncbi.nlm.nih.gov/36475246,
LitCovid,Occupational Medicine and Total Worker Health(R): from preventing health and safety risks in the workplace to promoting health for the total well-being of the worker,https://pubmed.ncbi.nlm.nih.gov/36475501,
LitCovid,Relationship Between Screen Time and Dry Eye Symptoms During the COVID-19 Pandemic in the Pediatric Population of the Western Region of Saudi Arabia,https://pubmed.ncbi.nlm.nih.gov/36475117,
LitCovid,Distribution of intra-host variations and mutations in the genomes of SARS-CoV-2 and their implications on detection and therapeutics,https://pubmed.ncbi.nlm.nih.gov/36474856,
LitCovid,Integrating GIS in reorganizing blood supply network in a robust-stochastic approach by combating disruption damages,https://pubmed.ncbi.nlm.nih.gov/36475013,
LitCovid,Work-life balance among health administration faculty before and during the COVID-19 pandemic,https://pubmed.ncbi.nlm.nih.gov/36475090,
LitCovid,Burnout among Emergency Nurses during COVID-19 Pandemic at Hail Governmental Hospitals in the Kingdom of Saudi Arabia,https://pubmed.ncbi.nlm.nih.gov/36475250,
LitCovid,Exploring the factors that affect user experience in mobile-health applications: A text-mining and machine-learning approach,https://pubmed.ncbi.nlm.nih.gov/36475057,
LitCovid,Enhanced recovery after surgery (ERAS) nutrition protocol during COVID-19 pandemic,https://pubmed.ncbi.nlm.nih.gov/36472859,
LitCovid,Novavax COVID-19 Vaccine Booster Authorized,https://pubmed.ncbi.nlm.nih.gov/36472611,
LitCovid,SARS-CoV-2 Reduction in Shared Indoor Air-Reply,https://pubmed.ncbi.nlm.nih.gov/36472598,
LitCovid,"Reply to ""Predominance of visuoconstructive impairment after mild COVID-19?"" by Diez-Cirarda et al. 2022.",https://pubmed.ncbi.nlm.nih.gov/36473998,
LitCovid,COVID-19 effect on tuberculosis care in Sierra Leone: Are we in the recovery phase?,https://pubmed.ncbi.nlm.nih.gov/36473827,
LitCovid,Causal Inference and VAP-attributable Mortality in COVID-19: On Painting Bulls-Eyes and Dotting i's,https://pubmed.ncbi.nlm.nih.gov/36473272,
LitCovid,Timing of last COVID-19 vaccine dose and SARS-CoV-2 breakthrough infections in fully (boosted) vaccinated healthcare personnel,https://pubmed.ncbi.nlm.nih.gov/36473554,
LitCovid,Can Google Trends analysis confirm the public's need for information about the rare association of facial nerve paralysis with COVID-19 or the COVID-19 vaccination?,https://pubmed.ncbi.nlm.nih.gov/36473747,
LitCovid,Reply to: Causal Inference and VAP-attributable Mortality in COVID-19: On Painting Bulls-Eyes and Dotting i's,https://pubmed.ncbi.nlm.nih.gov/36473274,
LitCovid,Primary spontaneous intracerebral hemorrhage in COVID-19 patients: differences among presentation patterns - A systematic review,https://pubmed.ncbi.nlm.nih.gov/36472834,
LitCovid,"Vax the Max, a Gamification Intervention for COVID-19 Vaccination Task Engagement in the Inpatient Setting",https://pubmed.ncbi.nlm.nih.gov/36472420,
LitCovid,SARS-CoV-2 Reduction in Shared Indoor Air,https://pubmed.ncbi.nlm.nih.gov/36472600,
LitCovid,SARS-CoV-2 Reduction in Shared Indoor Air,https://pubmed.ncbi.nlm.nih.gov/36472601,
LitCovid,SARS-CoV-2 spike protein variant binding affinity to an angiotensin-converting enzyme 2 fusion glycoproteins,https://pubmed.ncbi.nlm.nih.gov/36472974,
LitCovid,Rapid and Unamplified Detection of SARS-CoV-2 RNA via CRISPR-Cas13a-Modified Solution-Gated Graphene Transistors,https://pubmed.ncbi.nlm.nih.gov/36472865,
LitCovid,Association Between COVID-19 Booster Vaccination and Omicron Infection in a Cohort of Players and Staff in the National Basketball Association-Reply,https://pubmed.ncbi.nlm.nih.gov/36472597,
LitCovid,Toll-like receptor-2 (TLR-2) rs111200466 variant offers protection against SARS-CoV-2 infections and mortality: a worldwide epidemiological correlation analysis,https://pubmed.ncbi.nlm.nih.gov/36472302,
LitCovid,"Equitable well-being, social trust, and the economy: An integrated health system's perspectives on the long-term implications of COVID-19",https://pubmed.ncbi.nlm.nih.gov/36473506,
LitCovid,"Short-term outcomes of COVID-19 in pregnant women unvaccinated for SARS-CoV-2 in the first, second, and third trimesters: a retrospective study",https://pubmed.ncbi.nlm.nih.gov/36472869,
LitCovid,International year of medical and social workers in ukraine: recognition of the role in the fight against the covid-19 pandemic and protecting health and well-being,https://pubmed.ncbi.nlm.nih.gov/36472292,
LitCovid,Efficacy of copper blend coatings in reducing SARS-CoV-2 contamination,https://pubmed.ncbi.nlm.nih.gov/36474101,
LitCovid,[Traditional medicine as a treatment for COVID-19 in students and family members at a university in the mountains of Peru],https://pubmed.ncbi.nlm.nih.gov/36473428,
LitCovid,Effectiveness of Pfizer-BioNTech COVID-19 vaccine as evidence for policy action: A rapid systematic review and meta-analysis of non-randomized studies,https://pubmed.ncbi.nlm.nih.gov/36473010,
LitCovid,Impaired CD4(+) T cell recognition of SARS-CoV-2 variants of concern,https://pubmed.ncbi.nlm.nih.gov/36474117,
LitCovid,Surprising Omicron origins study comes under scrutiny,https://pubmed.ncbi.nlm.nih.gov/36474049,
LitCovid,Association Between COVID-19 Booster Vaccination and Omicron Infection in a Cohort of Players and Staff in the National Basketball Association,https://pubmed.ncbi.nlm.nih.gov/36472599,
LitCovid,A call for immediate action to increase COVID-19 vaccination uptake to prepare for the third pandemic winter,https://pubmed.ncbi.nlm.nih.gov/36473855,
LitCovid,Monitoring cognitive and psychological alterations in COVID-19 patients: A longitudinal neuropsychological study,https://pubmed.ncbi.nlm.nih.gov/36473347,
LitCovid,"Structural patterns of SARS-CoV-2 variants of concern (alpha, beta, gamma, delta) spike protein are influenced by variant-specific amino acid mutations: A computational study with implications on viral evolution",https://pubmed.ncbi.nlm.nih.gov/36473508,
LitCovid,"Utilizing questionnaires for medication counselling of patients taking antipsychotics during the COVID-19 pandemic: a single site, community pharmacy-based survey study",https://pubmed.ncbi.nlm.nih.gov/36474275,
LitCovid,An unheard voice: Infection prevention professionals reflect on their experiences during the Covid-19 pandemic,https://pubmed.ncbi.nlm.nih.gov/36473616,
LitCovid,Telemedicine During COVID-19 Pandemic: Lesson Learned from the Lazio Region Infectious Diseases and Emergency Department Network,https://pubmed.ncbi.nlm.nih.gov/36473993,
LitCovid,Emotional wellbeing of student midwives during COVID-19,https://pubmed.ncbi.nlm.nih.gov/36473798,
LitCovid,Serial measurement of circulating calprotectin as a prognostic biomarker in COVID-19 patients in intensive care setting,https://pubmed.ncbi.nlm.nih.gov/36473060,
LitCovid,Vacunacion durante la pandemia de COVID-19: inverted question markcomo abordar la complejidad del fenomeno?,https://pubmed.ncbi.nlm.nih.gov/36472837,
LitCovid,"Rare complication of covid -19 disease tinu syndrome in a 11-year-old boy, features and managment",https://pubmed.ncbi.nlm.nih.gov/36472295,
LitCovid,Persistent Steroid Exposure Before Coronavirus Disease 2019 Diagnosis and Risk of Hospitalization in Patients With Chronic Obstructive Pulmonary Disease,https://pubmed.ncbi.nlm.nih.gov/36472621,
LitCovid,"Impact of Covid-19 on informal employment: A case study of women domestic workers in Khyber Pakhtunkhwa, Pakistan",https://pubmed.ncbi.nlm.nih.gov/36473004,
LitCovid,SARS-CoV-2 Non-Structural Protein 1(NSP1) Mutation Virulence and Natural Selection: Evolutionary Trends in the Six Continents,https://pubmed.ncbi.nlm.nih.gov/36473671,
LitCovid,The course of psychiatric symptoms in older age bipolar disorder during the COVID-19 pandemic,https://pubmed.ncbi.nlm.nih.gov/36472691,
LitCovid,Alcohol use among Australian parents during the COVID-19 pandemic - April-2020 to May 2021,https://pubmed.ncbi.nlm.nih.gov/36473249,
LitCovid,MRTs Speak Up: The Professional Identity Crisis Brought on by COVID-19,https://pubmed.ncbi.nlm.nih.gov/36473224,
LitCovid,Bovine lactoferrin for the prevention of COVID-19 infection in health care personnel: a double-blinded randomized clinical trial (LF-COVID),https://pubmed.ncbi.nlm.nih.gov/36474100,
LitCovid,One-year mortality in COVID-19 is associated with patients' comorbidities rather than pneumonia severity,https://pubmed.ncbi.nlm.nih.gov/36473331,
LitCovid,Pituitary-gonadal hormones associated with respiratory failure in men and women hospitalized with COVID-19: an observational cohort study,https://pubmed.ncbi.nlm.nih.gov/36472925,
LitCovid,Spatial transcriptomic characterization of COVID-19 pneumonitis identifies immune circuits related to tissue injury,https://pubmed.ncbi.nlm.nih.gov/36472908,
LitCovid,Ayurvedic management through telemedicine of covid hypoxia non-dependent of oxygen support in a patient with chest CT score of 18/25- A case report,https://pubmed.ncbi.nlm.nih.gov/36473403,
LitCovid,Use of online health forums by people living with breast cancer during the COVID-19 pandemic: a qualitative analysis,https://pubmed.ncbi.nlm.nih.gov/36473015,
LitCovid,Mental health and self-management in glaucoma patients during the COVID-19 pandemic: a cross-sectional study in China,https://pubmed.ncbi.nlm.nih.gov/36474185,
LitCovid,Gender Differences in Routine Health Maintenance Examinations Before and During the COVID-19 Pandemic,https://pubmed.ncbi.nlm.nih.gov/36473777,
LitCovid,Association of Glucose-Lowering Drugs With Outcomes in Patients With Diabetes Before Hospitalization for COVID-19: A Systematic Review and Network Meta-analysis,https://pubmed.ncbi.nlm.nih.gov/36472874,
LitCovid,Dermatologic manifestations of multisystem inflammatory syndrome in children during the COVID-19 pandemic,https://pubmed.ncbi.nlm.nih.gov/36473757,
LitCovid,Postnatal mental health during the COVID-19 pandemic: Impact on mothers' postnatal sense of security and on mother-to-infant bonding,https://pubmed.ncbi.nlm.nih.gov/36473335,
LitCovid,COVID-19 vaccination side effects among the child age group: a large cross-sectional online based survey in Saudi Arabia,https://pubmed.ncbi.nlm.nih.gov/36474174,
LitCovid,"Determinants of poor sleep quality in adults during the coronavirus disease pandemic: COVID-Inconfidentes, a population-based study",https://pubmed.ncbi.nlm.nih.gov/36472868,
LitCovid,"An efficacy and safety report based on randomized controlled single-blinded multi-centre clinical trial of ZingiVir-H, a novel herbo-mineral formulation designed as an add-on therapy in adult patients with mild to moderate COVID-19",https://pubmed.ncbi.nlm.nih.gov/36472969,
