feed,title,long_url,short_url
GN:T:WP,Siemens Gamesa wins 924MW US offshore wind firm order - Windpower Monthly,https://www.windpowermonthly.com/article/1798909/siemens-gamesa-wins-924mw-us-offshore-wind-firm-order,
GN:T:WP,Patatas Hijolusa constructs a wind farm to improve its ecological footprint - FreshPlaza,https://www.freshplaza.com/article/9459186/patatas-hijolusa-constructs-a-wind-farm-to-improve-its-ecological-footprint/,
GN:T:WP,LETTER TO THE EDITOR: Honey Creek Wind Project - crawfordcountynow,https://crawfordcountynow.com/local/letter-to-the-editor-honey-creek-wind-project-2/,
GN:T:WP,Bordelon Marine Secures Charter for Connor Bordelon Vessel - Offshore Engineer,https://www.oedigital.com/news/499439-bordelon-marine-secures-charter-for-connor-bordelon-vessel,
GN:T:WP,Edda Wind presents the first in seven CSOVs fit for zero-emission - Inceptive Mind,https://www.inceptivemind.com/edda-wind-presents-first-seven-csovs-fit-zero-emission/27404/,
GN:T:WP,"Renewable Energy Costs Have Dropped Much Faster Than Expected, But There's A Catch - Forbes",https://www.forbes.com/sites/christinero/2022/09/14/renewable-energy-costs-have-dropped-much-faster-than-expected-but-theres-a-catch/,
GN:T:WP,Drowning in decarbonisation - Seatrade Maritime News,https://www.seatrade-maritime.com/sustainability-green-technology/drowning-decarbonisation,
GN:T:WP,"Green hydrogen could counter energy crisis, says British firm - The Guardian",https://www.theguardian.com/environment/2022/sep/14/green-hydrogen-could-counter-energy-crisis-says-british-firm,
GN:T:WP,Otary seeks value propositions ahead of Belgium tender - 4C Offshore,https://www.4coffshore.com/news/otary-seeks-value-propositions-ahead-of-belgium-tender-nid26312.html,
GN:T:WP,"Yes, Tesla Cars To Get Starlink - CleanTechnica",https://cleantechnica.com/2022/09/13/yes-tesla-cars-to-get-starlink/,
GN:T:WP,ITM amends production plans - reNews - Renewable Energy News - reNEWS,https://renews.biz/80438/itm-amends-production-plans/,
