feed,title,long_url,short_url
GN:T:RE,First on CNN: New Mexico AG probing campaign finances of GOP candidate accused of orchestrating shootings - CNN,https://www.cnn.com/2023/01/20/politics/new-mexico-attorney-general-solomon-pena-campaign-finance/index.html,https://da.gd/lHJNi2
GN:T:RE,Germany publishes plans to hit 30 GW offshore wind target in 2030 - Reuters,https://www.reuters.com/business/energy/germany-publishes-plans-hit-30-gw-offshore-wind-target-2030-2023-01-20/,https://da.gd/JwhiQw
GN:T:RE,Whales navigate a perilous route off the N.J. Shore - The Philadelphia Inquirer,https://www.inquirer.com/news/dead-humpback-whales-new-jersey-offshore-wind-20230120.html,https://da.gd/tJKsp
GN:T:RE,Egat starts operation of mini-hydropower plant - Bangkok Post,https://www.bangkokpost.com/business/2487739/egat-starts-operation-of-mini-hydropower-plant,https://da.gd/aHaaum
GN:T:RE,Honda To Build Prototype For Lunar Circulative Renewable Energy System - Aviation Week,https://aviationweek.com/defense-space/space/honda-build-prototype-lunar-circulative-renewable-energy-system,https://da.gd/lqSv
