feed,title,long_url,short_url
MX,Researchers combat Zika-associated fetal abnormalities using microRNA,https://medicalxpress.com/news/2023-09-combat-zika-associated-fetal-abnormalities-microrna.html,https://da.gd/meP5
MX,Study details immune cells vital to success of vaccines against coronavirus,https://medicalxpress.com/news/2023-09-immune-cells-vital-success-vaccines.html,https://da.gd/BbdLPD
MX,"Young people's mental health deteriorated at greater rate during the pandemic, finds study",https://medicalxpress.com/news/2023-09-young-people-mental-health-deteriorated.html,https://da.gd/5QXwm
MX,Rehabilitation interventions aid post-COVID-19 condition: Study,https://medicalxpress.com/news/2023-09-interventions-aid-post-covid-condition.html,https://da.gd/DxkA
MX,"In Mississippi, a huge jump in cases of babies born with syphilis",https://medicalxpress.com/news/2023-09-mississippi-huge-cases-babies-born.html,https://da.gd/3tDI5W
MX,US resumes free COVID test program,https://medicalxpress.com/news/2023-09-resumes-free-covid.html,https://da.gd/X6RoP
MX,Aging patients receiving high-quality primary care more likely to receive doctor-recommended shingles vaccination,https://medicalxpress.com/news/2023-09-aging-patients-high-quality-primary-doctor-recommended.html,https://da.gd/no0Pxy
