feed,title,long_url,short_url
GN:T:CC,Genesis Digital Assets Leverages Renewables to Increase Bitcoin Mining Capacity at New Texas Facility - Bitcoin Magazine,https://news.google.com/rss/articles/CBMiZWh0dHBzOi8vYml0Y29pbm1hZ2F6aW5lLmNvbS9idXNpbmVzcy9nZW5lc2lzLWRpZ2l0YWwtYXNzZXRzLWxldmVyYWdlcy1yZW5ld2FibGVzLWJpdGNvaW4tbWluaW5nLXRleGFz0gEA?oc=5,https://da.gd/OIeuyY
GN:T:CC,General Electric completes split into 3 public companies Tuesday - Axios,https://news.google.com/rss/articles/CBMiQ2h0dHBzOi8vd3d3LmF4aW9zLmNvbS8yMDI0LzA0LzAyL2dlbmVyYWwtZWxlY3RyaWMtdmVybm92YS1nZXYtc3RvY2vSAQA?oc=5,https://da.gd/FZzO6N
GN:T:CC,Here's why scientists chose Alameda for geoengineering cloud research - San Francisco Chronicle,https://news.google.com/rss/articles/CBMiXmh0dHBzOi8vd3d3LnNmY2hyb25pY2xlLmNvbS93ZWF0aGVyL2FydGljbGUvZ2VvZW5naW5lZXJpbmctY2xvdWQtcmVzZWFyY2gtYWxhbWVkYS0xOTM2ODE5OS5waHDSAQA?oc=5,https://da.gd/B6AonL
GN:T:CC,Physical Climate Risk and Insurers - Liberty Street Economics - Liberty Street Economics -,https://news.google.com/rss/articles/CBMiWWh0dHBzOi8vbGliZXJ0eXN0cmVldGVjb25vbWljcy5uZXd5b3JrZmVkLm9yZy8yMDI0LzA0L3BoeXNpY2FsLWNsaW1hdGUtcmlzay1hbmQtaW5zdXJlcnMv0gEA?oc=5,https://da.gd/C7s1wN
GN:T:CC,Plan for new California water goals outlined by Gov. Newsom - Los Angeles Times,https://news.google.com/rss/articles/CBMiXmh0dHBzOi8vd3d3LmxhdGltZXMuY29tL2Vudmlyb25tZW50L3N0b3J5LzIwMjQtMDQtMDIvbmV3c29tLXJlbGVhc2VzLW5ldy1jYWxpZm9ybmlhLXdhdGVyLXBsYW7SAQA?oc=5,https://da.gd/NdxrV
GN:T:CC,Knesset passes controversial climate bill through first reading - The Times of Israel,https://news.google.com/rss/articles/CBMibWh0dHBzOi8vd3d3LnRpbWVzb2Zpc3JhZWwuY29tL2xpdmVibG9nX2VudHJ5L2tuZXNzZXQtcGFzc2VzLWNvbnRyb3ZlcnNpYWwtY2xpbWF0ZS1iaWxsLXRocm91Z2gtZmlyc3QtcmVhZGluZy_SAQA?oc=5,https://da.gd/fDgI1z
GN:T:CC,'On the Move' examines how climate change will alter where people live - Science News Magazine,https://news.google.com/rss/articles/CBMiV2h0dHBzOi8vd3d3LnNjaWVuY2VuZXdzLm9yZy9hcnRpY2xlL29uLXRoZS1tb3ZlLXJldmlldy1jbGltYXRlLWNoYW5nZS13aGVyZS1wZW9wbGUtbGl2ZdIBAA?oc=5,https://da.gd/gJoNdh
GN:T:CC,Biden speaks with Chinese President Xi Jinping - ABC News,https://news.google.com/rss/articles/CBMiXGh0dHBzOi8vYWJjbmV3cy5nby5jb20vUG9saXRpY3MvYmlkZW4tc3BlYWtzLWNoaW5lc2UtcHJlc2lkZW50LXhpLWppbnBpbmcvc3Rvcnk_aWQ9MTA4NzUyNDQ30gFgaHR0cHM6Ly9hYmNuZXdzLmdvLmNvbS9hbXAvUG9saXRpY3MvYmlkZW4tc3BlYWtzLWNoaW5lc2UtcHJlc2lkZW50LXhpLWppbnBpbmcvc3Rvcnk_aWQ9MTA4NzUyNDQ3?oc=5,https://da.gd/VojLWz
GN:T:CC,California is biggest U.S. emitter of this greenhouse gas - Los Angeles Times,https://news.google.com/rss/articles/CBMibGh0dHBzOi8vd3d3LmxhdGltZXMuY29tL2Vudmlyb25tZW50L3N0b3J5LzIwMjQtMDQtMDMvY2FsaWZvcm5pYS1pcy1iaWdnZXN0LXVzLWVtaXR0ZXItb2YtdGhpcy1ncmVlbmhvdXNlLWdhc9IBAA?oc=5,https://da.gd/uNQEi2
