feed,title,long_url,short_url
GN:S:C,What Will Bridge The Gap Between G7 Climate Ambitions And Action? - Forbes,https://www.forbes.com/sites/feliciajackson/2021/06/14/what-will-bridge-the-gap-between-g7-climate-ambitions-and-action/,
GN:S:C,Norway wealth fund to vote for shareholder climate initiative at Delta Air AGM - Reuters,https://www.reuters.com/business/aerospace-defense/norway-wealth-fund-vote-shareholder-climate-initiative-delta-air-agm-2021-06-14/,
GN:S:C,"Factbox: China, climate and vaccines - what the G7 agreed this weekend - Reuters",https://www.reuters.com/world/china-climate-vaccines-what-g7-agreed-this-weekend-2021-06-13/,
GN:S:C,Expect Climate Change to Finally Drive More Corp Travel Decisions Post-Pandemic - Skift,https://skift.com/2021/06/14/expect-climate-change-to-finally-drive-more-corp-travel-decisions-post-pandemic/,
GN:S:C,Performative Climate Action: Bolsanaro's Visit To The Yanomami Reservation - The Organization for World Peace,https://theowp.org/reports/performative-climate-action-bolsanaros-visit-to-the-yanomami-reservation/,
GN:S:C,"Germany lobbying EU for stricter climate rules, report says - Automotive News Europe",https://europe.autonews.com/environmentemissions/germany-lobbying-eu-stricter-climate-rules-report-says,
GN:S:C,WeatherTalk: Recent hot weather was not caused by climate change - PostBulletin,https://www.postbulletin.com/news/weather/7067627-WeatherTalk-Recent-hot-weather-was-not-caused-by-climate-change,
