feed,title,long_url,short_url
GN:T:RE,From net zero to carbon negative: A guide to climate buzzwords - Business Insider,https://news.google.com/rss/articles/CBMiXWh0dHBzOi8vd3d3LmJ1c2luZXNzaW5zaWRlci5jb20vbmV0LXplcm8tY2FyYm9uLW5ldXRyYWwtbmVnYXRpdmUtY2xpbWF0ZS1jb21wYW55LWdvYWxzLTIwMjMtMtIBYWh0dHBzOi8vd3d3LmJ1c2luZXNzaW5zaWRlci5jb20vbmV0LXplcm8tY2FyYm9uLW5ldXRyYWwtbmVnYXRpdmUtY2xpbWF0ZS1jb21wYW55LWdvYWxzLTIwMjMtMj9hbXA?oc=5,https://da.gd/9B8W0T
GN:T:RE,"Readers Write: Carbon-free future, dairy farming, taxes, rural counties, U.S. Bank Stadium - Star Tribune",https://news.google.com/rss/articles/CBMie2h0dHBzOi8vd3d3LnN0YXJ0cmlidW5lLmNvbS9yZWFkZXJzLXdyaXRlLWNhcmJvbi1mcmVlLWZ1dHVyZS1kYWlyeS1mYXJtaW5nLXRheGVzLXJ1cmFsLWNvdW50aWVzLXUtcy1iYW5rLXN0YWRpdW0vNjAwMjUyNzY0L9IBAA?oc=5,https://da.gd/OWVar
GN:T:RE,"Residential solar power shines on, backed by securitized lending - Federal Reserve Bank of Dallas",https://news.google.com/rss/articles/CBMiNmh0dHBzOi8vd3d3LmRhbGxhc2ZlZC5vcmcvcmVzZWFyY2gvZWNvbm9taWNzLzIwMjMvMDIxNNIBAA?oc=5,https://da.gd/JG3pNI
GN:T:RE,"How fresh tax credits, rebates can launch eco home updates - Detroit News",https://news.google.com/rss/articles/CBMijQFodHRwczovL3d3dy5kZXRyb2l0bmV3cy5jb20vc3RvcnkvYnVzaW5lc3MvcGVyc29uYWwtZmluYW5jZS8yMDIzLzAyLzE5L2hvdy1mcmVzaC10YXgtY3JlZGl0cy1yZWJhdGVzLWNhbi1sYXVuY2gtZWNvLWhvbWUtdXBkYXRlcy82OTkxMDk0OTAwNy_SAQA?oc=5,https://da.gd/bexVKU
GN:T:RE,Blue Origin Says It Can Make Solar Panels Out of Moon Dust - Singularity Hub,https://news.google.com/rss/articles/CBMiYWh0dHBzOi8vc2luZ3VsYXJpdHlodWIuY29tLzIwMjMvMDIvMTkvYmx1ZS1vcmlnaW4tc2F5cy1pdC1jYW4tbWFrZS1zb2xhci1wYW5lbHMtb3V0LW9mLW1vb24tZHVzdC_SAQA?oc=5,https://da.gd/M554XW
GN:T:RE,Raccoons and high winds: A peek inside the center that keeps the lights on for PNM customers - Albuquerque Journal,https://news.google.com/rss/articles/CBMigwFodHRwczovL3d3dy5hYnFqb3VybmFsLmNvbS8yNTc0NTYwL3JhY2Nvb25zLWFuZC1oaWdoLXdpbmRzLWEtcGVlay1pbnNpZGUtdGhlLWNlbnRlci10aGF0LWtlZXBzLXRoZS1saWdodHMtb24tZm9yLXBubS1jdXN0b21lcnMuaHRtbNIBAA?oc=5,https://da.gd/2Gra1
GN:T:RE,How soon will Arizona utilities no longer rely on coal? - The Arizona Republic,https://news.google.com/rss/articles/CBMigAFodHRwczovL3d3dy5hemNlbnRyYWwuY29tL3N0b3J5L21vbmV5L2J1c2luZXNzL2VuZXJneS8yMDIzLzAyLzE5L3doZW4td2lsbC1hcml6b25hLXV0aWxpdGllcy1uby1sb25nZXItcmVseS1vbi1jb2FsLzY5OTA0NTY5MDA3L9IBAA?oc=5,https://da.gd/3ltL
