feed,title,long_url,short_url
ArXiv:econ,The Affiliate Matching Problem: On Labor Markets where Firms are Also Interested in the Placement of Previous Workers,https://arxiv.org/abs/2009.11867v1,
ArXiv:econ,Learning in a Small/Big World,https://arxiv.org/abs/2009.11917v1,
ArXiv:econ,Pareto efficient combinatorial auctions: dichotomous preferences without quasilinearity,https://arxiv.org/abs/2009.12114v1,
ArXiv:econ,Latent Causal Socioeconomic Health Index,https://arxiv.org/abs/2009.12217v1,
ArXiv:econ,Ergodicity-breaking reveals time optimal decision making in humans,https://arxiv.org/abs/1906.04652v4,
ArXiv:econ,Manipulable outcomes within the class of scoring voting rules,https://arxiv.org/abs/1911.09173v3,
ArXiv:econ,Polarization in Networks: Identification-alienation Framework,https://arxiv.org/abs/2007.07061v4,
ArXiv:econ,On the Effectiveness of Minisum Approval Voting in an Open Strategy Setting: An Agent-Based Approach,https://arxiv.org/abs/2009.04912v2,
