feed,title,long_url,short_url
GN:T:CC,EPA moves to curb heavy truck emissions in Biden's latest anti-carbon move - Axios,https://news.google.com/rss/articles/CBMiO2h0dHBzOi8vd3d3LmF4aW9zLmNvbS8yMDI0LzAzLzI5L2VwYS1lbWlzc2lvbnMtaGVhdnktdHJ1Y2tz0gEA?oc=5,https://da.gd/eUEuVa
GN:T:CC,EPA's new rules to clean up heavy trucking met with support and criticism - NPR,https://news.google.com/rss/articles/CBMiTmh0dHBzOi8vd3d3Lm5wci5vcmcvMjAyNC8wMy8yOS8xMjQxNDEwMjc0L2VtaXNzaW9ucy1oZWF2eS1kdXR5LXRydWNrcy1ydWxlLWVwYdIBAA?oc=5,https://da.gd/IPwadV
GN:T:CC,Biochar Is 'Low-Hanging Fruit' for Sequestering Carbon and Combating Climate Change - InsideClimate News,https://news.google.com/rss/articles/CBMiSWh0dHBzOi8vaW5zaWRlY2xpbWF0ZW5ld3Mub3JnL25ld3MvMjkwMzIwMjQvYmlvY2hhci1jYXJib24tc2VxdWVzdHJhdGlvbi_SAQA?oc=5,https://da.gd/zY3oq
GN:T:CC,Biden highway climate rule struck down by Texas judge: 'Unauthorized' - Fox News,https://news.google.com/rss/articles/CBMiYGh0dHBzOi8vd3d3LmZveG5ld3MuY29tL3BvbGl0aWNzL2JpZGVuLWhpZ2h3YXktY2xpbWF0ZS1ydWxlLXN0cnVjay1kb3duLXRleGFzLWp1ZGdlLXVuYXV0aG9yaXplZNIBZGh0dHBzOi8vd3d3LmZveG5ld3MuY29tL3BvbGl0aWNzL2JpZGVuLWhpZ2h3YXktY2xpbWF0ZS1ydWxlLXN0cnVjay1kb3duLXRleGFzLWp1ZGdlLXVuYXV0aG9yaXplZC5hbXA?oc=5,https://da.gd/Eff9OL
GN:T:CC,"'Explosion in ticks': Doctors, EPA warn of climate change's impact on health in Wisconsin - WKOW",https://news.google.com/rss/articles/CBMisAFodHRwczovL3d3dy53a293LmNvbS9uZXdzL2RpZ2dpbmctZGVlcGVyL2V4cGxvc2lvbi1pbi10aWNrcy1kb2N0b3JzLWVwYS13YXJuLW9mLWNsaW1hdGUtY2hhbmdlLXMtaW1wYWN0LW9uLWhlYWx0aC1pbi13aXNjb25zaW4vYXJ0aWNsZV83MjI0ZDNmZS1lZDBlLTExZWUtOTg0Yy03N2YwMWJjMGY5NTIuaHRtbNIBAA?oc=5,https://da.gd/w3Auj
