feed,title,long_url,short_url
GN:T:CC,"Melting of polar ice having effect on global timekeeping, research says - Financial Times",https://news.google.com/rss/articles/CBMiP2h0dHBzOi8vd3d3LmZ0LmNvbS9jb250ZW50LzVkZDRhMDRmLWJhYjItNDUyMS05MjVmLTQ4NGI2NTBmOTFjYtIBAA?oc=5,https://da.gd/Vn2q
GN:T:CC,The 'all of the above' energy success that's causing Biden headaches - POLITICO,https://news.google.com/rss/articles/CBMiTWh0dHBzOi8vd3d3LnBvbGl0aWNvLmNvbS9uZXdzLzIwMjQvMDMvMjcvYmlkZW5zLXVuZWFzeS1lbmVyZ3ktZW1waXJlLTAwMTQ3NDQ50gEA?oc=5,https://da.gd/woVBjT
GN:T:CC,A faster spinning Earth may cause timekeepers to subtract a second from world clocks - The Associated Press,https://news.google.com/rss/articles/CBMiY2h0dHBzOi8vYXBuZXdzLmNvbS9hcnRpY2xlL2xlYXAtc2Vjb25kLXN1YnRyYWN0LW1lbHRpbmctaWNlLWNsb2Nrcy03NGVhYWM0N2I5YzQyOTkxMDcyM2E2MDQ4OTcwMzJhNNIBAA?oc=5,https://da.gd/uvnQZ
GN:T:CC,Understanding the Impact of Climate Change on Local Landscapes - Sonoma Magazine,https://news.google.com/rss/articles/CBMibmh0dHBzOi8vd3d3LnNvbm9tYW1hZy5jb20vaG93LWlzLWNsaW1hdGUtY2hhbmdlLWltcGFjdGluZy1zb25vbWEtY291bnR5cy1lY29zeXN0ZW1zLWxvY2FsLXNjaWVudGlzdHMtZmluZC1vdXQv0gEA?oc=5,https://da.gd/nPTNop
GN:T:CC,Antarctica needs a lot more attention - The Economist,https://news.google.com/rss/articles/CBMiUmh0dHBzOi8vd3d3LmVjb25vbWlzdC5jb20vbGVhZGVycy8yMDI0LzAzLzI3L2FudGFyY3RpY2EtbmVlZHMtYS1sb3QtbW9yZS1hdHRlbnRpb27SAQA?oc=5,https://da.gd/wYFR0
