feed,title,long_url,short_url
GN:S:C,Heat wave a glimpse of climate change's impact in North America - eagletimes,https://www.eagletimes.com/heat-wave-a-glimpse-of-climate-changes-impact-in-north-america/article_4d738b8a-bad3-5407-b103-f00fb923012f.html,
GN:S:C,Climate Negotiators Are Seriously Underestimating Methane's Warming Power – Mother Jones - Mother Jones,https://www.motherjones.com/environment/2022/03/climate-negotiators-underestimating-methane-warming-power-study-greenhouse-gas-warming/,
GN:S:C,West Orange Students & Residents Rally for Climate Action - TAPinto,https://www.tapinto.net/towns/west-orange/sections/green/articles/west-orange-students-residents-rally-for-climate-action,
GN:S:C,Studying climate-changing greenhouse gases on Earth and beyond - Rowan Today,https://today.rowan.edu/news/2022/03/meet-dr-charles-schutte.html,
GN:S:C,Major Climate Research Publisher Found To Be Supporting Oil And Gas Drilling - Green Queen Media,https://www.greenqueen.com.hk/climate-publisher-helping-oil-and-gas-drilling/,
GN:S:C,Howie Carr: Stodgy climate as Kerry won’t share payroll — until 2024 - Boston Herald,https://www.bostonherald.com/2022/03/02/howie-carr-stodgy-climate-as-kerry-wont-share-payroll-until-2024/,
GN:S:C,"Four steps to business leadership on climate, according to Maria Mendiluce - edie",https://www.edie.net/news/9/Four-steps-to-business-leadership-on-cllimate--according-to-Maria-Mendiluce/,
GN:S:C,Electric school buses benefit both the climate and students' health - Sustainability Times,https://www.sustainability-times.com/green-consumerism/electric-school-buses-benefit-both-the-climate-and-students-health/,
