feed,title,long_url,short_url
MX,"Gut microbiome changes linked to multiple sclerosis, study finds",https://medicalxpress.com/news/2025-02-gut-microbiome-linked-multiple-sclerosis.html,https://da.gd/QaW2e
MX,Eating walnuts for breakfast may boost your brain function,https://medicalxpress.com/news/2025-02-walnuts-breakfast-boost-brain-function.html,https://da.gd/xoubuo
MX,Novel inhalable gene therapy trialed for people with cystic fibrosis,https://medicalxpress.com/news/2025-02-inhalable-gene-therapy-trialed-people.html,https://da.gd/w0TFD1
MX,Decreasing appearance anxiety in women through smartphone-based interventions,https://medicalxpress.com/news/2025-02-decreasing-anxiety-women-smartphone-based.html,https://da.gd/Yswtfe
MX,Scientists warn of increased mpox transmission,https://medicalxpress.com/news/2025-02-scientists-mpox-transmission.html,https://da.gd/AvTn3
MX,Early study shows promise for retinal-surgery robot,https://medicalxpress.com/news/2025-02-early-retinal-surgery-robot.html,https://da.gd/HvD8b
MX,Paxlovid's promise fades: Vaccinated seniors see minimal COVID-19 protection,https://medicalxpress.com/news/2025-02-paxlovid-vaccinated-seniors-minimal-covid.html,https://da.gd/b3pdD
MX,CDC layoffs strike deeply at its ability to respond to the current public health emergencies,https://medicalxpress.com/news/2025-02-cdc-layoffs-deeply-ability-current.html,https://da.gd/ela6I
