feed,title,long_url,short_url
GN:S:GW,Crypto and climate change: Can blockchain tech stop global warming? - Yahoo Canada Finance,https://ca.finance.yahoo.com/news/crypto-climate-change-blockchain-tech-stop-global-warming-125143403.html,
GN:S:GW,Climate change summit leaves hope for limiting global warming | Mint - Mint,https://www.livemint.com/politics/news/climate-change-summit-leaves-hope-for-limiting-global-warming-11669837960224.html,
GN:S:GW,Should We Block the Sun to Cool the Climate? - Answers In Genesis,https://answersingenesis.org/environmental-science/climate-change/should-we-block-sun-cool-climate/,
GN:S:GW,Climate change and trade rules - The New Indian Express,https://www.newindianexpress.com/opinions/2022/dec/02/climate-change-and-trade-rules-2524155.html,
GN:S:GW,James Cameron's Avatar has an Anthropocene Problem - Orion Magazine,https://orionmagazine.org/article/avatar-james-cameron-anthropocene-colonization/,
