feed,title,long_url,short_url
ArXiv,On the Security of Permissioned Blockchain Solutions for IoT Applications,https://arxiv.org/abs/2109.03621v1,
ArXiv,On Blockchain Architectures for Trust-Based Collaborative Intrusion Detection,https://arxiv.org/abs/2109.03635v1,
ArXiv,Energy Footprint of Blockchain Consensus Mechanisms Beyond Proof-of-Work,https://arxiv.org/abs/2109.03667v1,
ArXiv,Latency Modeling of Hyperledger Fabric for Blockchain-enabled IoT Networks,https://arxiv.org/abs/2102.09166v4,
ArXiv,Secure and Efficient Blockchain based Knowledge Sharing for Intelligent Connected Vehicles,https://arxiv.org/abs/2108.01598v2,
