feed,title,long_url,short_url
GN:T:AI,MLSec could be the answer to adversarial AI and machine learning attacks - VentureBeat,https://venturebeat.com/security/mlsec-ai-machine-learning/,https://bit.ly/3UcaKuT
GN:T:AI,Viz.ai Names Jieun Choe Chief Marketing Officer - MarTech Series,https://martechseries.com/sales-marketing/viz-ai-names-jieun-choe-chief-marketing-officer/,https://bit.ly/3DvyaWj
GN:T:AI,"Lockheed, IBM's Red Hat team up to speed AI development for Pentagon - DefenseNews",https://www.defensenews.com/artificial-intelligence/2022/10/25/lockheed-ibms-red-hat-team-up-to-speed-ai-development-for-pentagon/,https://bit.ly/3srEuYu
GN:T:AI,Top 10: AI firms helping minimise supply chain disruption - Supply Chain Digital,https://supplychaindigital.com/digital-supply-chain/top-10-ai-firms-helping-minimise-supply-chain-disruption,https://bit.ly/3NbWkbO
GN:T:AI,Machine learning could vastly speed up the search for new metals - MIT Technology Review,https://www.technologyreview.com/2022/10/25/1062104/machine-learning-new-metals/,https://bit.ly/3DbnB9M
