feed,title,long_url,short_url
Medium,‘P-Meta’ Learning Approach Boosts Data and Memory Efficiency for On-Device DNN Adaptation in the…,https://medium.com/p/971542e0cb99,
Medium,Tools To Speed up Automate EDA,https://medium.com/p/5f30935da2d5,
Medium,ML model deployment in AWS Lambda: ECR update,https://medium.com/p/1892ea8ccc8d,
Medium,Using advanced data analysis in the food industry to predict its quality,https://medium.com/p/624f2384b53c,
Medium,What does a data dictionary and a refugee camp have in common?,https://medium.com/p/84a50cd18f6,
Medium,Identify Birds from Sounds with Machine Learning,https://medium.com/p/caa7fac56510,
Medium,Machine Learning in Supply Chain,https://medium.com/p/b7aa41b3e9f,
Medium,Are Summary Statistics Enough when Analyzing Data?,https://medium.com/p/4f3af59e3e7,
