feed,title,long_url,short_url
GN:S:C,"Rishi Sunak must not retreat from climate pledges, says top Tory mayor - The Guardian",https://news.google.com/rss/articles/CBMiY2h0dHBzOi8vd3d3LnRoZWd1YXJkaWFuLmNvbS9wb2xpdGljcy8yMDIzL2F1Zy8xMy9yaXNoaS1zdW5hay1jbGltYXRlLXBsZWRnZXMtdG9yeS1tYXlvci1hbmR5LXN0cmVldNIBY2h0dHBzOi8vYW1wLnRoZWd1YXJkaWFuLmNvbS9wb2xpdGljcy8yMDIzL2F1Zy8xMy9yaXNoaS1zdW5hay1jbGltYXRlLXBsZWRnZXMtdG9yeS1tYXlvci1hbmR5LXN0cmVldA?oc=5,https://da.gd/HIhI
GN:S:C,Climate change: Lecturer's day lying in ditch 'gives soil a voice' - BBC,https://news.google.com/rss/articles/CBMiKmh0dHBzOi8vd3d3LmJiYy5jb20vbmV3cy91ay13YWxlcy02NjQ4NDY1NdIBLmh0dHBzOi8vd3d3LmJiYy5jb20vbmV3cy91ay13YWxlcy02NjQ4NDY1NS5hbXA?oc=5,https://da.gd/JAWI
GN:S:C,The Maine Millennial: A long-term view on climate requires near ... - Kennebec Journal and Morning Sentinel,https://news.google.com/rss/articles/CBMidmh0dHBzOi8vd3d3LmNlbnRyYWxtYWluZS5jb20vMjAyMy8wOC8xMy90aGUtbWFpbmUtbWlsbGVubmlhbC1hLWxvbmctdGVybS12aWV3LW9uLWNsaW1hdGUtcmVxdWlyZXMtbmVhci10ZXJtLXNhY3JpZmljZS_SAQA?oc=5,https://da.gd/xg35
GN:S:C,Maine's salt marshes play key role in fight against climate change ... - Lewiston Sun Journal,https://news.google.com/rss/articles/CBMieGh0dHBzOi8vd3d3LnN1bmpvdXJuYWwuY29tLzIwMjMvMDgvMTMvbWFpbmVzLXNhbHQtbWFyc2hlcy1wbGF5LWtleS1yb2xlLWluLWZpZ2h0LWFnYWluc3QtY2xpbWF0ZS1jaGFuZ2UtbmV3LXJlcG9ydC1zYXlzL9IBAA?oc=5,https://da.gd/S0pLb
GN:S:C,"Commentary: The time to act on climate change is now, locally and ... - Roanoke Times",https://news.google.com/rss/articles/CBMioQFodHRwczovL3JvYW5va2UuY29tL29waW5pb24vY29tbWVudGFyeS9jb21tZW50YXJ5LXRoZS10aW1lLXRvLWFjdC1vbi1jbGltYXRlLWNoYW5nZS1pcy1ub3ctbG9jYWxseS1hbmQtZ2xvYmFsbHkvYXJ0aWNsZV9kZDI2Y2NjYy0zNzA0LTExZWUtODVmZS1hZjdlMjFhN2FmYzYuaHRtbNIBAA?oc=5,https://da.gd/hduK2
GN:S:C,One year on: How has US climate plan affected trade ties? - Yahoo News,https://news.google.com/rss/articles/CBMiQmh0dHBzOi8vbmV3cy55YWhvby5jb20vb25lLXVzLWNsaW1hdGUtcGxhbi1hZmZlY3RlZC0wMzA5NDkyNTYuaHRtbNIBAA?oc=5,https://da.gd/kKZO1S
