feed,title,long_url,short_url
GN:T:CC,US: Video of Presidential candidate Vivek Ramaswamy performing Oscar-winning song goes viral | WION - WION,https://news.google.com/rss/articles/CCAiC1hCVGsyT2JFVTVFmAEB?oc=5,https://da.gd/QBFw
GN:T:CC,'Greenlash': Why it's getting harder to pass environmental reforms in the EU - Euronews,https://news.google.com/rss/articles/CBMicmh0dHBzOi8vd3d3LmV1cm9uZXdzLmNvbS9ncmVlbi8yMDIzLzA4LzEzL2dyZWVubGFzaC13aHktaXRzLWdldHRpbmctaGFyZGVyLXRvLXBhc3MtZW52aXJvbm1lbnRhbC1yZWZvcm1zLWluLXRoZS1lddIBAA?oc=5,https://da.gd/8VNDN
GN:T:CC,"Hawaii Wildfires LIVE: Death toll hits 89, deadliest in modern US history | Maui Wildfires| WION - WION",https://news.google.com/rss/articles/CCAiC2RTcWh4T0RGMnk4mAEB?oc=5,https://da.gd/lQ0CJ
GN:T:CC,Jerome Gessaroli: The price of poorly planned climate policies in Vancouver - Vancouver Sun,https://news.google.com/rss/articles/CBMicWh0dHBzOi8vdmFuY291dmVyc3VuLmNvbS9vcGluaW9uL29wLWVkL2plcm9tZS1nZXNzYXJvbGktdGhlLXByaWNlLW9mLXBvb3JseS1wbGFubmVkLWNsaW1hdGUtcG9saWNpZXMtaW4tdmFuY291dmVy0gEA?oc=5,https://da.gd/tdvzcX
GN:T:CC,Rishi Sunak 'will rue his green group attacks come election time' - The Guardian,https://news.google.com/rss/articles/CBMic2h0dHBzOi8vd3d3LnRoZWd1YXJkaWFuLmNvbS9lbnZpcm9ubWVudC8yMDIzL2F1Zy8xMy9yaXNoaS1zdW5hay13aWxsLXJ1ZS1oaXMtZ3JlZW4tZ3JvdXAtYXR0YWNrcy1jb21lLWVsZWN0aW9uLXRpbWXSAQA?oc=5,https://da.gd/vCYlo
GN:T:CC,"Climate change impact has hurt F1's image in Germany, says Hulkenberg - Autosport",https://news.google.com/rss/articles/CBMib2h0dHBzOi8vd3d3LmF1dG9zcG9ydC5jb20vZjEvbmV3cy9jbGltYXRlLWNoYW5nZS1pbXBhY3QtaGFzLWh1cnQtZjFzLWltYWdlLWluLWdlcm1hbnktc2F5cy1odWxrZW5iZXJnLzEwNTA2ODU5L9IBAA?oc=5,https://da.gd/uuxI
GN:T:CC,How language can turn down the temperature of heated climate change discourse - Phys,https://news.google.com/rss/articles/CBMiSWh0dHBzOi8vcGh5cy5vcmcvbmV3cy8yMDIzLTA4LWxhbmd1YWdlLXRlbXBlcmF0dXJlLWNsaW1hdGUtZGlzY291cnNlLmh0bWzSAUhodHRwczovL3BoeXMub3JnL25ld3MvMjAyMy0wOC1sYW5ndWFnZS10ZW1wZXJhdHVyZS1jbGltYXRlLWRpc2NvdXJzZS5hbXA?oc=5,https://da.gd/CYza2U
GN:T:CC,How climate change could make your home harder to insure - cleveland,https://news.google.com/rss/articles/CBMiZGh0dHBzOi8vd3d3LmNsZXZlbGFuZC5jb20vbmV3cy8yMDIzLzA4L2hvdy1jbGltYXRlLWNoYW5nZS1jb3VsZC1tYWtlLXlvdXItaG9tZS1oYXJkZXItdG8taW5zdXJlLmh0bWzSAQA?oc=5,https://da.gd/h5oVw4
