feed,title,long_url,short_url
MX,An alternative to injections: New weight loss pill shows promise in early study,https://medicalxpress.com/news/2025-08-alternative-weight-loss-pill-early.html,
MX,Report ties to child mental health crisis to immigration enforcement,https://medicalxpress.com/news/2025-08-child-mental-health-crisis-immigration.html,
MX,"CDC warns travelers after 8,000+ chikungunya cases reported in China",https://medicalxpress.com/news/2025-08-cdc-chikungunya-cases-china.html,
MX,User-friendly tool streamlines transcriptomic data analysis for precision medicine applications,https://medicalxpress.com/news/2025-08-user-friendly-tool-transcriptomic-analysis.html,
MX,Multicenter trial confirms near-infrared autofluorescence increases detection of parathyroid glands,https://medicalxpress.com/news/2025-08-multicenter-trial-infrared-autofluorescence-parathyroid.html,
