feed,title,long_url,short_url
GN:T:WP,"Dominion Energy, Va. Attorney General Settle Petition for Coastal Virginia Offshore Wind - North American Windpower",https://nawindpower.com/dominion-energy-va-attorney-general-settle-petition-for-coastal-virginia-offshore-wind,
GN:T:WP,CommonWealth Magazine - CommonWealth magazine,https://commonwealthmagazine.org/energy/vineyard-wind-starts-laying-undersea-cable/,
GN:T:WP,Peterson scores Dutch wind farm contract - Splash247 - Splash 247,https://splash247.com/peterson-scores-dutch-wind-farm-contract/,
GN:T:WP,Energy storage: Geothermal systems better than batteries? - World Economic Forum,https://www.weforum.org/agenda/2022/11/geothermal-renewable-energy-storage/,
GN:T:WP,Energy crisis jeopardizes Europe's sustainability leaders - Euromoney magazine,https://www.euromoney.com/article/2atq9r1hl0ei8adrfdzi8/esg/energy-crisis-jeopardizes-and-galvanizes-europes-sustainability-leaders,
GN:T:WP,Wind turbine maker Vestas lowers outlook as supply chain woes continue - Windpower Monthly,https://www.windpowermonthly.com/article/1803944/wind-turbine-maker-vestas-lowers-outlook-supply-chain-woes-continue,
GN:T:WP,Uninterrupted PV generation without storage – pv magazine International - pv magazine International,https://www.pv-magazine.com/2022/11/01/uninterrupted-pv-generation-without-storage/,
GN:T:WP,CanREA Electricity Transition Hub Launches with Natural Resources Canada Funding - Solar Industry,https://solarindustrymag.com/canrea-electricity-transition-hub-launches-with-natural-resources-canada-funding,
GN:T:WP,Wärtsilä reciprocating engine undergoes hydrogen pilot - Power Engineering International,https://www.powerengineeringint.com/gas-oil-fired/wartsila-reciprocating-engine-undergoes-hydrogen-pilot/,
GN:T:WP,WATCH NOW: County prepares for dawn of solar energy systems; smaller megawatt solar farm application prompts ordinance change - Kenosha News,https://www.kenoshanews.com/watch-now-county-prepares-for-dawn-of-solar-energy-systems-smaller-megawatt-solar-farm-application/article_bf4babd2-5a78-11ed-9bc0-33a10de3bfda.html,
GN:T:WP,"Ring of Fire Metals to consider wind, carbon removal - Mining Magazine",https://www.miningmagazine.com/power-remote-power/news/1442634/ring-of-fire-metals-to-consider-wind-carbon-removal,
GN:T:WP,Why it's so hard to decide whether nuclear power is a good idea for the climate - CBC News,https://www.cbc.ca/news/business/nuclear-revival-column-don-pittis-1.6615356,
GN:T:WP,Lease agreed for floating wind farm site that could power over 2m homes - Professional Engineering,https://www.imeche.org/news/news-article/lease-agreed-for-floating-wind-farm-site-that-could-power-over-2m-homes,
GN:T:WP,Review: How Star revealed probe into Sh18b Uhuru-era power deal - The Star Kenya,https://www.the-star.co.ke/news/2022-11-02-review-how-star-revealed-probe-into-sh18b-uhuru-era-power-deal/,
