feed,title,long_url,short_url
TDS,Intuition for Independent and Identically Distributed,https://medium.com/p/dc59e1528162,
TDS,"Getting an AI to play atari Pong, with deep reinforcement learning",https://medium.com/p/47b0c56e78ae,
TDS,How the Strategy Design Pattern can help you quickly evaluate alternative models,https://medium.com/p/66e0f625016f,
TDS,How to Begin Your NLP Journey,https://medium.com/p/5dc6734dfb43,
TDS,Cross-Topic Argument Mining: Learning How to Classify Texts,https://medium.com/p/1d9e5c00c4cc,
