feed,title,long_url,short_url
GN:S:C,"Yes, humans are contributing to climate change - WUSA9",https://www.wusa9.com/article/tech/science/environment/dnp-yes-humans-are-contributing-to-climate-change-global-warming-greenhouse-gas-emissions/65-8a6e9b6a-faa2-4560-80a3-cfcfbadf56f5,
GN:S:C,Revealed: leading climate research publisher helps fuel oil and gas drilling - The Guardian,https://www.theguardian.com/environment/2022/feb/24/elsevier-publishing-climate-science-fossil-fuels,
GN:S:C,Colorado Democrats' latest climate bill would limit gas lawnmower sales - The Colorado Sun,https://coloradosun.com/2022/02/24/climate-bill-2022-colorado-legislature/,
GN:S:C,House approves climate science training funds for Maine teachers - Kennebec Journal & Morning Sentinel,https://www.centralmaine.com/2022/02/23/house-approves-climate-science-training-funds-for-teachers/,
GN:S:C,"‘Green Schools Challenge’ teaches Miami kids about climate problem, solutions - Yale Climate Connections",https://yaleclimateconnections.org/2022/02/green-schools-challenge-teaches-miami-kids-about-climate-problem-solutions/,
GN:S:C,"People only ‘somewhat concerned’ over climate crisis are ‘killing us’, Don’t Look Up director says - The Independent",https://www.independent.co.uk/climate-change/news/dont-look-up-director-climate-crisis-b2021718.html,
