feed,title,long_url,short_url
GN:T:CC,Apple will buy renewable power for its Mac mini users - TechCrunch,https://news.google.com/rss/articles/CBMikgFBVV95cUxONTFoNnpzSlEzNkp4bzB0TS1CWW1zQllSd1FVS0V2cWEzcmtoa2tqdld1MlhHMWhiMDdBeWlzMUtOdXVKejN3YjZLUzJuTkI4ZU9JZjFNSmVuVGJsMzkxVkM3TW5YWXVGQ014a2V5SnJZZmZJUGE2SU9YaVN4RFFVNHFJaHM2ZjFsdzBncDFTcHN3Zw?oc=5,https://da.gd/k9xWH
GN:T:CC,"China floats wave, wind and solar power plan for South China Sea outposts - South China Morning Post",https://news.google.com/rss/articles/CBMiwgFBVV95cUxPMWdzLXhWVlM1SEdCMnRCRlFEaUhBcl9NM2NNV3V1WmZsOHpoVC1hZl9ZUjJfTFVYcTFRbXpsQjFtRFg1UVhNVWpPdktLdW1UWTBpZXRqWEs0N2U5NWZQRzR3ODczZzNjdFpSc0dERDBaQ2RoZW1VZ1RJVUYwZlNiTEtlM3NWYmhQQmtCdlVBRzlxUUEzMmZXTXotME5WanhnOHI0cVNLb0ZmdHcxdUR2bEloZVduZWxnLXRLZE5JQ1NBdw?oc=5,https://da.gd/7attHQ
GN:T:CC,Spain battles deadliest flood disaster in decades as death toll rises to 95 - BBC,https://news.google.com/rss/articles/CBMiWkFVX3lxTE9mOFliSkY0TmNEQ3JnZGVsSXh5enNyYmV1VkxpbDcxeWYza3ZVR0FHdFFEbDFPeTFmZm5BRlBTLXkwRTdXcE9zb2ZFZ19JelF2LWE1c2VucnZFdw?oc=5,https://da.gd/XO40O
GN:T:CC,Half a Million People Killed in Deadliest Weather Disasters Since 2004 - The New York Times,https://news.google.com/rss/articles/CBMihwFBVV95cUxQZk5yZHphR2xQUER4dk0wV2hfaHZhYTdMcGFtQkdLMW5Yb0x3NUZHaEltckJCVFBpQWppWDJGWnYyWWE2dUU4R3c1cjdWckZ3WFhZUUQ3QVNmclJaTUxqMlhsXzNnaHE5clRkQkVGUlRqUWVGUXhCWHc0RHlWamRqVFI4dFU5cGs?oc=5,https://da.gd/YcaNd
GN:T:CC,How the U.S. Election Matters for the Rest of the World - The New York Times,https://news.google.com/rss/articles/CBMigAFBVV95cUxOdURVOXRldWlHMDJjODVIYUxVMXQzR2xCZlB0UHp1Z0VhaUJfSkJwbWZZSVdSQ2F0cWlGVlZpM3ZZckNXRi1CYnhPc3djNUMxU2xvVEIzdkNHVzhnVlZOT3oyRnk3OHhvQ1BrbzUxNXlHck50VUY0X3h2SkRFTXB6MQ?oc=5,https://da.gd/asdpRi
GN:T:CC,Buffalo Weavers: climate change through a spiritual lens - Macalester College The Mac Weekly,https://news.google.com/rss/articles/CBMilwFBVV95cUxQby1KaDdBZXloUHdDUkpIbWdoYm81c25IY1VLeDZQNS1iemp3UkoxSXVKRkFzQ21hWE5qLW5EQnZIZzBSVUNzdzFvdHB1OG9yMnA2bzd1S29IRXV4Z2lXMXNBLUxpa2Z1RzlTbmhuMWN4RWI4VGgydHVqSGl1MGNybUUyVjFJdVIzd3U3bmdPb2pxa28tdEw4?oc=5,https://da.gd/DegswT
