feed,title,long_url,short_url
ArXiv,Language Model Self-improvement by Reinforcement Learning Contemplation,https://arxiv.org/abs/2305.14483v1,
ArXiv,RetICL: Sequential Retrieval of In-Context Examples with Reinforcement Learning,https://arxiv.org/abs/2305.14502v1,
ArXiv,Sequence Modeling is a Robust Contender for Offline Reinforcement Learning,https://arxiv.org/abs/2305.14550v1,
ArXiv,MARC: A multi-agent robots control framework for enhancing reinforcement learning in construction tasks,https://arxiv.org/abs/2305.14586v1,
ArXiv,Inverse Reinforcement Learning with the Average Reward Criterion,https://arxiv.org/abs/2305.14608v1,
ArXiv,Reinforcement Learning finetuned Vision-Code Transformer for UI-to-Code Generation,https://arxiv.org/abs/2305.14637v1,
ArXiv,Dynamics-Adaptive Continual Reinforcement Learning via Progressive Contextualization,https://arxiv.org/abs/2209.00347v2,
ArXiv,Multi-Agent Reinforcement Learning with Common Policy for Antenna Tilt Optimization,https://arxiv.org/abs/2302.12899v2,
ArXiv,Offline Reinforcement Learning with Additional Covering Distributions,https://arxiv.org/abs/2305.12679v2,
ArXiv,Optimizing Long-term Value for Auction-Based Recommender Systems via On-Policy Reinforcement Learning,https://arxiv.org/abs/2305.13747v2,
