feed,title,long_url,short_url
MX,Geraniol attenuates oxidative stress and cognitive impairment in mouse aging model,https://medicalxpress.com/news/2024-04-geraniol-attenuates-oxidative-stress-cognitive.html,https://da.gd/PE2W
MX,Economic burden of childhood verbal abuse by adults estimated at $300 billion globally,https://medicalxpress.com/news/2024-04-economic-burden-childhood-abuse-adults.html,https://da.gd/xEqm
MX,A new screening protocol can detect aggressive prostate cancers more selectively,https://medicalxpress.com/news/2024-04-screening-protocol-aggressive-prostate-cancers.html,https://da.gd/Wzn6lC
MX,Using 3D ultrasound to improve monitoring of dangerous aneurysms,https://medicalxpress.com/news/2024-04-3d-ultrasound-dangerous-aneurysms.html,https://da.gd/Lhy8bO
MX,How a new drug prototype regenerates lung tissue,https://medicalxpress.com/news/2024-04-drug-prototype-regenerates-lung-tissue.html,https://da.gd/Cp812
