feed,title,long_url,short_url
GN:T:SL,Shell’s petrochemical plant in Pennsylvania hasn’t spurred economic growth: Report - Environmental Health News,https://news.google.com/rss/articles/CBMiQmh0dHBzOi8vd3d3LmVobi5vcmcvc2hlbGwtcGV0cm9jaGVtaWNhbHMtZWNvbm9taWNzLTI2NjE3NTM5MTguaHRtbNIBQmh0dHBzOi8vd3d3LmVobi5vcmcvc2hlbGwtcGV0cm9jaGVtaWNhbHMtZWNvbm9taWNzLTI2NjE3NTM5MTguaHRtbA?oc=5,https://da.gd/1458or
GN:T:SL,Glacial changes in sea level modulated millennial-scale variability of Southeast Asian autumn monsoon rainfall | Proceedings of the National Academy of Sciences - pnas,https://news.google.com/rss/articles/CBMiMGh0dHBzOi8vd3d3LnBuYXMub3JnL2RvaS8xMC4xMDczL3BuYXMuMjIxOTQ4OTEyMNIBAA?oc=5,https://da.gd/FzZJ0
GN:T:SL,What is watermelon snow? Pink snow spotted in Utah - Yahoo Life,https://news.google.com/rss/articles/CBMiUGh0dHBzOi8vd3d3LnlhaG9vLmNvbS9saWZlc3R5bGUvd2F0ZXJtZWxvbi1zbm93LXBpbmstc25vdy1zcG90dGVkLTE5MDQwNTY1NS5odG1s0gFPaHR0cHM6Ly9uZXdzLnlhaG9vLmNvbS9hbXBodG1sL3dhdGVybWVsb24tc25vdy1waW5rLXNub3ctc3BvdHRlZC0xOTA0MDU2NTUuaHRtbA?oc=5,https://da.gd/SiwAW
GN:T:SL,Two and five-year fixed-rate mortgages in UK at highest level for seven months - The Guardian,https://news.google.com/rss/articles/CBMifGh0dHBzOi8vd3d3LnRoZWd1YXJkaWFuLmNvbS9tb25leS8yMDIzL2p1bi8yNi90d28tYW5kLWZpdmUteWVhci1maXhlZC1yYXRlLW1vcnRnYWdlcy1pbi11ay1hdC1oaWdoZXN0LWxldmVsLWZvci1zZXZlbi1tb250aHPSAXxodHRwczovL2FtcC50aGVndWFyZGlhbi5jb20vbW9uZXkvMjAyMy9qdW4vMjYvdHdvLWFuZC1maXZlLXllYXItZml4ZWQtcmF0ZS1tb3J0Z2FnZXMtaW4tdWstYXQtaGlnaGVzdC1sZXZlbC1mb3Itc2V2ZW4tbW9udGhz?oc=5,https://da.gd/Vp88
GN:T:SL,Over 90% of Global Aquaculture at Significant Risk from Environmental Change - Mirage News,https://news.google.com/rss/articles/CBMiUGh0dHBzOi8vd3d3Lm1pcmFnZW5ld3MuY29tL292ZXItOTAtb2YtZ2xvYmFsLWFxdWFjdWx0dXJlLWF0LXNpZ25pZmljYW50LTEwMzQ3NDYv0gEA?oc=5,https://da.gd/oKhV
