feed,title,long_url,short_url
j.mp/ml-reviews,Graph signal processing for machine learning: A review and new perspectives (2020) (cs.LG),http://arxiv.org/abs/2007.16061v1,
j.mp/ml-reviews,Extraction and Analysis of Fictional Character Networks: A Survey (2019-2020) (cs.SI),http://arxiv.org/abs/1907.02704v3,
j.mp/ml-reviews,"The role of explainability in creating trustworthy artificial intelligence for health care: a comprehensive survey of the terminology, design choices, and evaluation strategies (2020) (cs.AI)",http://arxiv.org/abs/2007.15911v1,
j.mp/ml-reviews,A Survey on Concept Factorization: From Shallow to Deep Representation Learning (2020) (cs.LG),http://arxiv.org/abs/2007.15840v1,
j.mp/ml-reviews,Differentiable Rendering: A Survey (2020) (cs.CV),http://arxiv.org/abs/2006.12057v2,
j.mp/ml-reviews,A Review on the State of the Art in Non Contact Sensing for COVID-19 (2020) (cs.CY),http://arxiv.org/abs/2007.16063v1,
