feed,title,long_url,short_url
ArXiv:Data,Parallel Betweenness Computation in Graph Database for Contingency Selection,https://arxiv.org/abs/2006.16339v1,
ArXiv:Data,Handling Missing Data in Decision Trees: A Probabilistic Approach,https://arxiv.org/abs/2006.16341v1,
ArXiv:Data,On the Privacy-Utility Tradeoff in Peer-Review Data Analysis,https://arxiv.org/abs/2006.16385v1,
ArXiv:Data,Improving neural network predictions of material properties with limited data using transfer learning,https://arxiv.org/abs/2006.16420v1,
ArXiv:Data,The COVID-19 pandemic's impact on U.S. electricity demand and supply: an early view from the data,https://arxiv.org/abs/2006.16504v1,
ArXiv:Data,Spatiotemporal Multi-Resolution Approximations for Analyzing Global Environmental Data,https://arxiv.org/abs/2006.16606v1,
ArXiv:Data,BitMix: Data Augmentation for Image Steganalysis,https://arxiv.org/abs/2006.16625v1,
ArXiv:Data,A Data-driven Neural Network Architecture for Sentiment Analysis,https://arxiv.org/abs/2006.16642v1,
ArXiv:Data,Needle tip force estimation by deep learning from raw spectral OCT data,https://arxiv.org/abs/2006.16675v1,
ArXiv:Data,Classification Confidence Estimation with Test-Time Data-Augmentation,https://arxiv.org/abs/2006.16705v1,
ArXiv:Data,Neural Datalog Through Time: Informed Temporal Modeling via Logical Specification,https://arxiv.org/abs/2006.16723v1,
ArXiv:Data,Image-level Harmonization of Multi-Site Data using Image-and-Spatial Transformer Networks,https://arxiv.org/abs/2006.16741v1,
ArXiv:Data,Pricing Fresh Data,https://arxiv.org/abs/2006.16805v1,
ArXiv:Data,A GRU-based Mixture Density Network for Data-Driven Dynamic Stochastic Programming,https://arxiv.org/abs/2006.16845v1,
ArXiv:Data,Rapid Response Crop Maps in Data Sparse Regions,https://arxiv.org/abs/2006.16866v1,
ArXiv:Data,The Effect of Robo-taxi User Experience on User Acceptance: Field Test Data Analysis,https://arxiv.org/abs/2006.16870v1,
ArXiv:Data,Tomographic Auto-Encoder: Unsupervised Bayesian Recovery of Corrupted Data,https://arxiv.org/abs/2006.16938v1,
ArXiv:Data,PriorGAN: Real Data Prior for Generative Adversarial Nets,https://arxiv.org/abs/2006.16990v1,
ArXiv:Data,On approximate data reduction for the Rural Postman Problem: Theory and experiments,https://arxiv.org/abs/1812.10131v3,
ArXiv:Data,Data preprocessing to mitigate bias: A maximum entropy based approach,https://arxiv.org/abs/1906.02164v2,
ArXiv:Data,"ASVspoof 2019: A large-scale public database of synthesized, converted and replayed speech",https://arxiv.org/abs/1911.01601v3,
ArXiv:Data,Representing Unordered Data Using Complex-Weighted Multiset Automata,https://arxiv.org/abs/2001.00610v2,
ArXiv:Data,Cluster-based Zero-shot learning for multivariate data,https://arxiv.org/abs/2001.05624v3,
ArXiv:Data,Forecasting Sequential Data using Consistent Koopman Autoencoders,https://arxiv.org/abs/2003.02236v2,
ArXiv:Data,Balancing Competing Objectives with Noisy Data: Score-Based Classifiers for Welfare-Aware Machine Learning,https://arxiv.org/abs/2003.06740v3,
ArXiv:Data,Challenges in Benchmarking Stream Learning Algorithms with Real-world Data,https://arxiv.org/abs/2005.00113v2,
ArXiv:Data,Data integration in high dimension with multiple quantiles,https://arxiv.org/abs/2006.16357v1,
ArXiv:Data,Testing and Support Recovery of Correlation Structures for Matrix-Valued Observations with an Application to Stock Market Data,https://arxiv.org/abs/2006.16501v1,
ArXiv:Data,From predictions to prescriptions: A data-driven response to COVID-19,https://arxiv.org/abs/2006.16509v1,
ArXiv:Data,Autoregressive Mixture Models for Serial Correlation Clustering of Time Series Data,https://arxiv.org/abs/2006.16539v1,
