feed,title,long_url,short_url
GN:T:AI,"Flying Robots Pick Fruit 24/7, And Know Exactly When It's Ripe - NoCamels - Israeli Innovation News",https://nocamels.com/2022/09/flying-robots-pick-fruit-24-7-and-know-exactly-when-its-ripe/,https://bit.ly/3RrMlPV
GN:T:AI,"DALL-E now allows anyone to cash in on AI art, but ownership gets complicated - Quartz",https://qz.com/dall-e-now-allows-anyone-to-cash-in-on-ai-art-but-owne-1849597618,https://bit.ly/3SN8s4m
GN:T:AI,ACDSee Photo Studio Ultimate Now Lets You Edit Faces and Skies with AI - PetaPixel,https://petapixel.com/2022/09/29/acdsee-photo-studio-ultimate-now-lets-you-edit-faces-and-skies-with-ai/,https://bit.ly/3y5XPlf
GN:T:AI,"Adobe Photoshop & Premiere Elements 2023: Faster speeds, AI editing - Business Insider",https://www.businessinsider.com/guides/tech/adobe-unveils-photoshop-premiere-elements-2023-2022-9,https://bit.ly/3UUbKEQ
GN:T:AI,P&G turns to AI to create digital manufacturing of the future - CIO,https://www.cio.com/article/408351/pg-turns-to-ai-to-create-digital-manufacturing-of-the-future.html,https://bit.ly/3LXJBbP
GN:T:AI,The Callisto Protocol's AI is more interested in scaring you than killing you - VG247,https://www.vg247.com/the-callisto-protocols-ai-scaring-killing,https://bit.ly/3Rsgtea
GN:T:AI,Scientists Create AI-Powered Laser to 'Neutralize' Cockroaches - ExtremeTech,https://www.extremetech.com/extreme/339945-scientists-create-ai-powered-laser-to-neutralize-cockroaches,https://bit.ly/3SN8skS
