feed,title,long_url,short_url
MedRxiv,Analyzing the Factor Structure and Sleep Quality of Pittsburgh Sleep Quality Index in Indian Information Technology Sector,https://medrxiv.org/cgi/content/short/2024.07.25.24308199v1?rss=1,https://da.gd/JYjkDs
MedRxiv,The Role of Artificial Intelligence in Modern Medical Education and Practice: A Systematic Literature Review,https://medrxiv.org/cgi/content/short/2024.07.25.24311022v1?rss=1,https://da.gd/Igfudl
MedRxiv,"Doxycycline post-exposure prophylaxis among men who have sex with men and transgender women in Belgium: awareness, use, and antimicrobial resistance concerns in a cross-sectional online survey",https://medrxiv.org/cgi/content/short/2024.07.25.24310975v1?rss=1,https://da.gd/MbdXj
MedRxiv,De Novo Exposomic Geospatial Assembly of Chronic Disease Regions with Machine Learning & Network Analysis,https://medrxiv.org/cgi/content/short/2024.07.25.24310832v1?rss=1,https://da.gd/CilP
MedRxiv,AI-driven Integration of Multimodal Imaging Pixel Data and Genome-wide Genotype Data Enhances Precision Health for Type 2 Diabetes: Insights from a Large-scale Biobank Study,https://medrxiv.org/cgi/content/short/2024.07.25.24310650v1?rss=1,https://da.gd/bryPMX
