feed,title,long_url,short_url
GN:T:CC,Disentangling climate and policy uncertainties for the Colorado River post-2026 operations - Nature,https://news.google.com/rss/articles/CBMiX0FVX3lxTE0ySkhpdjRQVkNXeXNIVXpPT0tvNnRHZS00VGRpMmt6bjZrQkdkNEl0d0haN1hFZXFsVVZhaldKYVRfeDdRTTVfb0hvb05HN2pfZWRVUkI4OXVyVHpiRlVB?oc=5,
GN:T:CC,Schwarzenegger: ‘Catholic Church a powerhouse for environmental activism’ - Vatican News,https://news.google.com/rss/articles/CBMivAFBVV95cUxNUVFkeWVPeC1VODJDOThULUtNOFl3Y3NqRFBlQ0pnbklseE1rSjZ6eFctOGRCTUVyTnFva1pGT1VwQmVCVlFlM1U1aDQ4em95a19hdEE1aXNoQVVieVZ4aEJDNUhzSXZOVFAteFptOS12U3luWFpTS0g0X0VzWjRhUWI3aHNGTmRFakJTaXFkeENzdWFST1QxZHVaTGN5amViQ0FyS19US1Axak1Lby1GazJMdHo5V1dVVlo1cA?oc=5,
GN:T:CC,No more 'woke' in the US military: key takeaways from Pete Hegseth's speech - The Guardian,https://news.google.com/rss/articles/CBMigwFBVV95cUxPN0lzRjFYUWxYTnBCSGctcG5TekVnbEJrdWduUTF0OURMbk5CRGE0cjZCOG12MC10YlB3Z3ZxZlBMcFNHb3hEbEM1eFN3dFRRMTZMYkt3MEVveE8yaGY2U3lUM1ViTjhiaHp6TEJZX2lfUENQZW5OWjNsUDBNTUFKYUZPOA?oc=5,
GN:T:CC,Synchronization of global peak river discharge since the 1980s - Nature,https://news.google.com/rss/articles/CBMiX0FVX3lxTFB3SnpkTWZMV2N5QVZyN1VqMTFYdmdNX0FuS3B2WGdpZEtTbkZxRnpkbU5YcFZCSnUzM1dMNTNfcEw1dUtCLWpfSUpvWTBDX3EyRnRDZTRULXVZdlVVN2x3?oc=5,
GN:T:CC,"10 years after the Paris Agreement, countries are still missing climate deadlines - Grist",https://news.google.com/rss/articles/CBMid0FVX3lxTE45c19HdUVBVjd3TmxFOWM4aDI0cmMzZUdnaDA5SFhWTGhUS0xPcmNDVnVRWGNxN3I3X2NzaVBtYlFsLXZIb3dZWGxDMEJWR0NHOVZBQjdoVENzQmFGcHJvQnhaT1NCVnFDMFJ4amtOU1NPTEJHc1lz?oc=5,
GN:T:CC,The Amazon's Trees Might Be More Resilient to Climate Change Than We Thought - Smithsonian Magazine,https://news.google.com/rss/articles/CBMiygFBVV95cUxPeW5TX3Q2YmFXU01Hc2hlWmt0aWJUMkozV2NVNnlrYTBSQnEydmp6QlpSVzUxVXN6TUVVX0F4SngxbUJWdXN0c0Y2VWRtSDUzTnhONEw3ZEZmRHlnSElaT1V0ZXp3RkRMMDA2Q2Q0NER2RERlNGZ4dU1GUjYwdHNLYl9LSi1NYUJkMlJ1VklzWEtrS0JUd3RHVEU2ZnNnM3RxQWdWR2pVMDVZOXFpaE51cWxyeXJEN05peU9mOG4tLTVsS2VPV2F3cG9n?oc=5,
GN:T:CC,"EU will have new climate targets by COP30 summit, von der Leyen says - Reuters",https://news.google.com/rss/articles/CBMivwFBVV95cUxNZUI4NE1jWEw2aldVYVZzNlhycXZ1OXoySnpvNTF2aGFWVklKQ1U2QWIybXcxeVU5Z19rbUJFRklRemY1QWYxTXJIS2pHZmRqZzBhc2R5RkxUdDl3ZTBxZExidXVEQlNkTTVubG11SnVuanMwVEpqQlVNWll3MDNxYUlRM0w0OU9haEVBX3pwVUpRUW5yd2Y1TUR3UTNzVmJjSUVoU0VzNFE3Ry11NjBNcVJnVW9hTDVObGRfdjJxOA?oc=5,
