feed,title,long_url,short_url
ArXiv:q-fin,Equilibrium pricing of securities in the co-presence of cooperative and non-cooperative populations,https://arxiv.org/abs/2209.12639v2,
ArXiv:q-fin,Smooth Nested Simulation: Bridging Cubic and Square Root Convergence Rates in High Dimensions,https://arxiv.org/abs/2201.02958v4,
ArXiv:q-fin,Dynamic Risk Measurement by EVT based on Stochastic Volatility models via MCMC,https://arxiv.org/abs/2201.09434v4,
ArXiv:q-fin,Scores for Multivariate Distributions and Level Sets,https://arxiv.org/abs/2002.09578v6,
ArXiv:q-fin,Accounting statement analysis at industry level. A gentle introduction to the compositional approach,https://arxiv.org/abs/2305.16842v2,
