feed,title,long_url,short_url
j.mp/lc-ml-reviews,"A Survey on Large Language Model (LLM) Security and Privacy: The Good, the Bad, and the Ugly (2023) (cs.CR)",http://arxiv.org/abs/2312.02003v1,
j.mp/lc-ml-reviews,Foundations for Transfer in Reinforcement Learning: A Taxonomy of Knowledge Modalities (2023) (cs.LG),http://arxiv.org/abs/2312.01939v1,
j.mp/lc-ml-reviews,A Comprehensive Literature Review on Sweet Orange Leaf Diseases (2023) (cs.CV),http://arxiv.org/abs/2312.01756v1,
j.mp/lc-ml-reviews,Cybersecurity threats in FinTech: A systematic review (2023) (cs.CR),http://arxiv.org/abs/2312.01752v1,
j.mp/lc-ml-reviews,Data Management For Large Language Models: A Survey (2023) (cs.CL),http://arxiv.org/abs/2312.01700v1,
j.mp/lc-ml-reviews,Survey on deep learning in multimodal medical imaging for cancer detection (2023) (eess.IV),http://arxiv.org/abs/2312.01573v1,
j.mp/lc-ml-reviews,Robust Computer Vision in an Ever-Changing World: A Survey of Techniques for Tackling Distribution Shifts (2023) (cs.CV),http://arxiv.org/abs/2312.01540v1,
j.mp/lc-ml-reviews,Data-Driven Causal Effect Estimation Based on Graphical Causal Modelling: A Survey (2022-2023) (cs.AI),http://arxiv.org/abs/2208.09590v2,
j.mp/lc-ml-reviews,Deep learning and traditional-based CAD schemes for the pulmonary embolism diagnosis: A survey (2023) (eess.IV),http://arxiv.org/abs/2312.01351v1,
j.mp/lc-ml-reviews,"A Systematic Review of Aspect-based Sentiment Analysis (ABSA): Domains, Methods, and Trends (2023) (cs.CL)",http://arxiv.org/abs/2311.10777v3,
j.mp/lc-ml-reviews,A Review of Link Prediction Applications in Network Biology (2023) (q-bio.MN),http://arxiv.org/abs/2312.01275v1,
j.mp/lc-ml-reviews,A Review and A Robust Framework of Data-Efficient 3D Scene Parsing with Traditional/Learned 3D Descriptors (2023) (cs.CV),http://arxiv.org/abs/2312.01262v1,
j.mp/lc-ml-reviews,Recent Advances in Scalable Energy-Efficient and Trustworthy Spiking Neural networks: from Algorithms to Technology (2023) (cs.AR),http://arxiv.org/abs/2312.01213v1,
j.mp/lc-ml-reviews,Information Extraction in Low-Resource Scenarios: Survey and Perspective (2022-2023) (cs.CL),http://arxiv.org/abs/2202.08063v5,
j.mp/lc-ml-reviews,On the Effects of Randomness on Stability of Learning with Limited Labelled Data: A Systematic Literature Review (2023) (cs.LG),http://arxiv.org/abs/2312.01082v1,
j.mp/lc-ml-reviews,A Survey of Temporal Credit Assignment in Deep Reinforcement Learning (2023) (cs.LG),http://arxiv.org/abs/2312.01072v1,
j.mp/lc-ml-reviews,Towards Graph Foundation Models: A Survey and Beyond (2023) (cs.LG),http://arxiv.org/abs/2310.11829v2,
j.mp/lc-ml-reviews,End-to-End Speech-to-Text Translation: A Survey (2023) (cs.CL),http://arxiv.org/abs/2312.01053v1,
j.mp/lc-ml-reviews,Biased Random-Key Genetic Algorithms: A Review (2023) (cs.NE),http://arxiv.org/abs/2312.00961v1,
