feed,title,long_url,short_url
GN:S:C,Many species are finding it hard to adopt to a warming climate - Sustainability Times,https://www.sustainability-times.com/environmental-protection/many-species-are-finding-it-hard-to-adopt-to-a-warming-climate/,
GN:S:C,Covid-19 and climate change make hurricanes more devastating for Latin America - News8000,https://www.news8000.com/i/covid-19-and-climate-change-make-hurricanes-more-devastating-for-latin-america/,
GN:S:C,An expert's advice on talking to the climate skeptic in your life - CNN,https://www.cnn.com/2020/11/24/opinions/climate-apocalypse-talking-to-skeptics-sutter-kirk/index.html,
GN:S:C,Amazon monitors climate change groups including Greta Thunberg's: Vice - Business Insider - Business Insider,https://www.businessinsider.com/amazon-jeff-bezos-climate-change-groups-greta-thunberg-2020-11,
GN:S:C,Climate Scientists Turn Mount Everest Into a Lab - BloombergQuint,https://www.bloombergquint.com/onweb/climate-scientists-turn-mount-everest-into-a-lab-khvvbatu,
GN:S:C,Restoration of degraded grasslands can benefit climate change mitigation and key ecosystem services - Phys,https://phys.org/news/2020-11-degraded-grasslands-benefit-climate-mitigation.html,
GN:S:C,Many roads aren't ready for climate change » Yale Climate Connections - Yale Climate Connections,https://yaleclimateconnections.org/2020/11/many-roads-arent-ready-for-climate-change/,
GN:S:C,Biden names John Kerry as climate envoy - FOX 10 News Phoenix,https://www.fox10phoenix.com/news/biden-names-john-kerry-as-climate-envoy,
