feed,title,long_url,short_url
GN:T:GP,"After canceling in 2020, State Fair's flash sale deepens discount on advance tickets for 2021 - Minneapolis Star Tribune",https://www.startribune.com/state-fair-s-flash-sale-deepens-discount-on-advance-tickets-for-2021/573178151/,
GN:T:GP,OPEC To Decide The Fate Of Oil Markets In 2021 - OilPrice,https://oilprice.com/Latest-Energy-News/World-News/Iraq-Wants-A-5-Year-Prepayment-For-Oil.html,
GN:T:GP,First Nations coalition provides 'capacity support' to Clarke Lake geothermal project - Pipeline News North,https://www.pipelinenewsnorth.ca/first-nations-coalition-provides-capacity-support-to-clarke-lake-geothermal-project-1.24244403,
GN:T:GP,Geothermal major EDC in the Philippines named one of Asia's top sustainability advocates - ThinkGeoEnergy,https://www.thinkgeoenergy.com/geothermal-major-edc-in-the-philippines-named-one-of-asias-top-sustainability-advocates/,
GN:T:GP,NZ researchers exploring option to tap geothermal energy from extinct volcano - ThinkGeoEnergy,https://www.thinkgeoenergy.com/nz-researchers-exploring-option-to-tap-geothermal-energy-from-extinct-volcano/,
