feed,title,long_url,short_url
GN:T:AI,Chipotle is moving its tortilla robot to a real restaurant - Engadget,https://www.engadget.com/chipotle-chippy-tortilla-robot-in-restaurant-132117637.html,https://engt.co/3Cewujl
GN:T:AI,This New Pokémon-Creating AI Is Producing Hilarious Results - Kotaku,https://kotaku.com/pokemon-nintendo-ai-art-machine-learning-scarlet-violet-1849585148,https://bit.ly/3CeSxGP
GN:T:AI,Israel Deploys AI Powered Turret in the West Bank - VICE,https://www.vice.com/en/article/wxnp5b/israel-deploys-ai-powered-turret-in-the-west-bank,https://bit.ly/3CfbIAa
GN:T:AI,Arthur.ai machine learning monitoring gathers steam with $42M investment - TechCrunch,https://techcrunch.com/2022/09/27/arthur-ais-machine-learning-monitoring-gathering-steam-with-42m-investment/,https://tcrn.ch/3flGgar
GN:T:AI,How Artificial Intelligence Can Improve Coding Audits - insideBIGDATA,https://insidebigdata.com/2022/09/27/how-artificial-intelligence-can-improve-coding-audits/,https://bit.ly/3UITcat
