feed,title,long_url,short_url
GN:T:WP,Turbine-hating Trump poses new threat to beleaguered offshore wind - Press Herald,https://news.google.com/rss/articles/CBMiamh0dHBzOi8vd3d3LnByZXNzaGVyYWxkLmNvbS8yMDI0LzA1LzA5L3R1cmJpbmUtaGF0aW5nLXRydW1wLXBvc2VzLW5ldy10aHJlYXQtdG8tYmVsZWFndWVyZWQtb2Zmc2hvcmUtd2luZC_SAQA?oc=5,https://da.gd/HK4dAH
GN:T:WP,"At a Dinner, Trump Assailed Climate Rules and Asked $1 Billion From Big Oil - The New York Times",https://news.google.com/rss/articles/CBMiSGh0dHBzOi8vd3d3Lm55dGltZXMuY29tLzIwMjQvMDUvMDkvY2xpbWF0ZS90cnVtcC1vaWwtZ2FzLW1hci1hLWxhZ28uaHRtbNIBAA?oc=5,https://da.gd/UpVfPh
GN:T:WP,Enefit Green production data – April 2024 - GlobeNewswire,https://news.google.com/rss/articles/CBMib2h0dHBzOi8vd3d3Lmdsb2JlbmV3c3dpcmUuY29tL25ld3MtcmVsZWFzZS8yMDI0LzA1LzEwLzI4Nzk0MDYvMC9lbi9FbmVmaXQtR3JlZW4tcHJvZHVjdGlvbi1kYXRhLUFwcmlsLTIwMjQuaHRtbNIBAA?oc=5,https://da.gd/I0aj
GN:T:WP,Can the Midwest build transmission fast enough for an evolving grid? - E&E News by POLITICO,https://news.google.com/rss/articles/CBMiZGh0dHBzOi8vd3d3LmVlbmV3cy5uZXQvYXJ0aWNsZXMvY2FuLXRoZS1taWR3ZXN0LWJ1aWxkLXRyYW5zbWlzc2lvbi1mYXN0LWVub3VnaC1mb3ItYW4tZXZvbHZpbmctZ3JpZC_SAQA?oc=5,https://da.gd/UHjtZ
GN:T:WP,Chinese suppliers account for two thirds of record wind intalls in 2023 - Renewables Now,https://news.google.com/rss/articles/CBMibmh0dHBzOi8vcmVuZXdhYmxlc25vdy5jb20vbmV3cy9jaGluZXNlLXN1cHBsaWVycy1hY2NvdW50LWZvci10d28tdGhpcmRzLW9mLXJlY29yZC13aW5kLWludGFsbHMtaW4tMjAyMy04NTcyOTcv0gEA?oc=5,https://da.gd/zaNrY6
GN:T:WP,Power grid expansion proposal could lower costs for Kansans - KWCH,https://news.google.com/rss/articles/CBMiWGh0dHBzOi8vd3d3Lmt3Y2guY29tLzIwMjQvMDUvMTAvcG93ZXItZ3JpZC1leHBhbnNpb24tcHJvcG9zYWwtY291bGQtbG93ZXItY29zdHMta2Fuc2Fucy_SAQA?oc=5,https://da.gd/Or4sR
GN:T:WP,ReNew signs 2.2 GW of clean energy deals | Mint - Mint,https://news.google.com/rss/articles/CBMiZGh0dHBzOi8vd3d3LmxpdmVtaW50LmNvbS9jb21wYW5pZXMvbmV3cy9yZW5ldy1zaWducy0yLTItZ3ctb2YtY2xlYW4tZW5lcmd5LWRlYWxzLTExNzE1MjY4MDc1MjUyLmh0bWzSAWhodHRwczovL3d3dy5saXZlbWludC5jb20vY29tcGFuaWVzL25ld3MvcmVuZXctc2lnbnMtMi0yLWd3LW9mLWNsZWFuLWVuZXJneS1kZWFscy9hbXAtMTE3MTUyNjgwNzUyNTIuaHRtbA?oc=5,https://da.gd/7UFMV4
GN:T:WP,"Quonset Business Park celebrates 14,000 jobs : NEREJ - New England Real Estate Journal Online",https://news.google.com/rss/articles/CBMiPmh0dHBzOi8vbmVyZWouY29tL3F1b25zZXQtYnVzaW5lc3MtcGFyay1jZWxlYnJhdGVzLTE0LTAwMC1qb2Jz0gEA?oc=5,https://da.gd/NAgAQ5
GN:T:WP,Tender for electricity supply to regulated clients reached a price of 56.679US$/MWh - BNamericas English,https://news.google.com/rss/articles/CBMic2h0dHBzOi8vd3d3LmJuYW1lcmljYXMuY29tL2VuL25ld3MvdGVuZGVyLWZvci1lbGVjdHJpY2l0eS1zdXBwbHktdG8tcmVndWxhdGVkLWNsaWVudHMtcmVhY2hlZC1hLXByaWNlLW9mLTU2Njc5dXNtd2jSAQA?oc=5,https://da.gd/qd9Q
GN:T:WP,COLUMN | Big is better? Big finds in Namibia; big losses at Gazprom; big sale at Edda Wind; big problems at Petrofac [Offshore Accounts] - Baird Maritime,https://news.google.com/rss/articles/CBMiqAFodHRwczovL3d3dy5iYWlyZG1hcml0aW1lLmNvbS9vZmZzaG9yZS9jb2x1bW4tYmlnLWlzLWJldHRlci1iaWctZmluZHMtaW4tbmFtaWJpYS1iaWctbG9zc2VzLWF0LWdhenByb20tYmlnLXNhbGUtYXQtZWRkYS13aW5kLWJpZy1wcm9ibGVtcy1hdC1wZXRyb2ZhYy1vZmZzaG9yZS1hY2NvdW50cy_SAQA?oc=5,https://da.gd/TKCmiR
GN:T:WP,Crews begin restoring severely eroded beaches at Ortley Beach - News 12 New Jersey,https://news.google.com/rss/articles/CBMiWmh0dHBzOi8vbmV3amVyc2V5Lm5ld3MxMi5jb20vY3Jld3MtYmVnaW4tcmVzdG9yaW5nLXNldmVyZWx5LWVyb2RlZC1iZWFjaGVzLWF0LW9ydGxleS1iZWFjaNIBAA?oc=5,https://da.gd/InLZc
GN:T:WP,"Tragic Electrocution at Windmill Farm Claims Life, Willacy County Investigates - Fox Rio Grande Valley",https://news.google.com/rss/articles/CBMiYGh0dHBzOi8vZm94cmd2LnR2L3RyYWdpYy1lbGVjdHJvY3V0aW9uLWF0LXdpbmRtaWxsLWZhcm0tY2xhaW1zLWxpZmUtd2lsbGFjeS1jb3VudHktaW52ZXN0aWdhdGVzL9IBAA?oc=5,https://da.gd/WJrFqF
