feed,title,long_url,short_url
YT:AWS,AWS Training & Certification Skills Guild | Amazon Web Services,https://youtu.be/Zq1dPbM_dnk,
YT:AWS,Equipment Health & Maintenance on AWS | Amazon Web Services,https://youtu.be/JLb4VumsFDc,
YT:AWS,Soul Machines on AWS: Customer Story | Amazon Web Services,https://youtu.be/dHzNFxNj91o,
YT:AWS,Operationalizing Third-Party Data with AWS Glue DataBrew | Amazon Web Services,https://youtu.be/RYXkjlnlly4,
YT:AWS,Purpose-Built Solutions with AWS for the Edge | Amazon Web Services,https://youtu.be/DQzBbzvqj9k,
