feed,title,long_url,short_url
GN:S:RL,Dense reinforcement learning for safety validation of autonomous ... - Nature,https://news.google.com/rss/articles/CBMiMmh0dHBzOi8vd3d3Lm5hdHVyZS5jb20vYXJ0aWNsZXMvczQxNTg2LTAyMy0wNTczMi0y0gEA?oc=5,https://da.gd/6n8yB
GN:S:RL,Offline reinforcement learning can beat generative AI - Mint,https://news.google.com/rss/articles/CBMicmh0dHBzOi8vd3d3LmxpdmVtaW50LmNvbS9vcGluaW9uL2NvbHVtbnMvb2ZmbGluZS1yZWluZm9yY2VtZW50LWxlYXJuaW5nLWNhbi1iZWF0LWdlbmVyYXRpdmUtYWktMTE2NzkzMzA3NTY5NjYuaHRtbNIBAA?oc=5,https://da.gd/vT5Uu
GN:S:RL,Treehouse Adopts AI to Help Students Prepare for the Next Great ... - goskagit,https://news.google.com/rss/articles/CBMirwFodHRwczovL3d3dy5nb3NrYWdpdC5jb20vdG93bm5ld3MvaHlkcm9ncmFwaHkvdHJlZWhvdXNlLWFkb3B0cy1haS10by1oZWxwLXN0dWRlbnRzLXByZXBhcmUtZm9yLXRoZS1uZXh0LWdyZWF0LXRlY2hub2xvZ3ktd2F2ZS9hcnRpY2xlX2FiMzhhY2ZlLWU1MDItNTJjZC04MDlkLTFmYWFiMmU2ZmRhMi5odG1s0gEA?oc=5,https://da.gd/2RkwK
GN:S:RL,Real-time quantum error correction beyond break-even - Nature,https://news.google.com/rss/articles/CBMiMmh0dHBzOi8vd3d3Lm5hdHVyZS5jb20vYXJ0aWNsZXMvczQxNTg2LTAyMy0wNTc4Mi020gEA?oc=5,https://da.gd/7cYhQ2
GN:S:RL,Workday AI/ML Innovation Summit - how Accenture shifted to a skills,https://news.google.com/rss/articles/CBMicmh0dHBzOi8vZGlnaW5vbWljYS5jb20vd29ya2RheS1haW1sLWlubm92YXRpb24tc3VtbWl0LWhvdy1hY2NlbnR1cmUtc2hpZnRlZC1za2lsbHMtYmFzZWQtb3JnYW5pemF0aW9uLXNraWxscy1jbG91ZNIBAA?oc=5,https://da.gd/9nc9Z
GN:S:RL,Contentstack adds OpenAI ChatGPT integration to its digital ... - Adgully,https://news.google.com/rss/articles/CBMiaGh0dHBzOi8vd3d3LmFkZ3VsbHkuY29tL2NvbnRlbnRzdGFjay1hZGRzLW9wZW5haS1jaGF0Z3B0LWludGVncmF0aW9uLXRvLWl0cy1kaWdpdGFsLXBsYXRmb3JtLTEyOTgwMy5odG1s0gEA?oc=5,https://da.gd/NUtg
