feed,title,long_url,short_url
j.mp/lc-ml-reviews,Data Augmentation for Deep Graph Learning: A Survey (2022) (cs.LG),http://arxiv.org/abs/2202.08235v2,
j.mp/lc-ml-reviews,A Survey on Generative Diffusion Model (2022) (cs.AI),http://arxiv.org/abs/2209.02646v5,
j.mp/lc-ml-reviews,Transformers in 3D Point Clouds: A Survey (2022) (cs.CV),http://arxiv.org/abs/2205.07417v2,
j.mp/lc-ml-reviews,Partially Observable Markov Decision Processes in Robotics: A Survey (2022) (cs.RO),http://arxiv.org/abs/2209.10342v1,
j.mp/lc-ml-reviews,Review On Deep Learning Technique For Underwater Object Detection (2022) (cs.CV),http://arxiv.org/abs/2209.10151v1,
j.mp/lc-ml-reviews,"A Systematic Literature Review of Soft Computing Techniques for Software Maintainability Prediction: State-of-the-Art, Challenges and Future Directions (2022) (cs.SE)",http://arxiv.org/abs/2209.10131v1,
j.mp/lc-ml-reviews,Heterogeneous Treatment Effect Estimation using machine learning for Healthcare application: tutorial and benchmark (2021-2022) (cs.LG),http://arxiv.org/abs/2109.12769v3,
j.mp/lc-ml-reviews,A Comprehensive Survey on Trustworthy Recommender Systems (2022) (cs.IR),http://arxiv.org/abs/2209.10117v1,
