feed,title,long_url,short_url
GN:T:RE,BlackRock in talks with governments about investments to power AI - Reuters,https://news.google.com/rss/articles/CBMiZ2h0dHBzOi8vd3d3LnJldXRlcnMuY29tL3RlY2hub2xvZ3kvYmxhY2tyb2NrLWNlby1zZWVzLWdpYW50LWlzc3VlLWV1cm9wZS1kdWUtYWktcG93ZXItbmVlZHMtMjAyNC0wNS0xNy_SAQA?oc=5,https://da.gd/rjpHtd
GN:T:RE,Homeowners should stay on top of possible roof & hail damage - KY3,https://news.google.com/rss/articles/CBMiVGh0dHBzOi8vd3d3Lmt5My5jb20vMjAyNC8wNS8yMC9ob21lb3duZXJzLXNob3VsZC1zdGF5LXRvcC1wb3NzaWJsZS1yb29mLWhhaWwtZGFtYWdlL9IBAA?oc=5,https://da.gd/h0nxkU
GN:T:RE,I invented a pedal-powered home office. Now I exercise – and save energy – at my desk - The Guardian,https://news.google.com/rss/articles/CBMiXGh0dHBzOi8vd3d3LnRoZWd1YXJkaWFuLmNvbS9lbnZpcm9ubWVudC9hcnRpY2xlLzIwMjQvbWF5LzIwL3BlZGFsLXBvd2VyZWQtb2ZmaWNlLXdvcmtzdGF0aW9u0gEA?oc=5,https://da.gd/Ok9IJE
GN:T:RE,Utility watchdog calls to cap Oregon rate hikes as energy bills continue to rise - Oregon Public Broadcasting,https://news.google.com/rss/articles/CBMidmh0dHBzOi8vd3d3Lm9wYi5vcmcvYXJ0aWNsZS8yMDI0LzA1LzIwL29yZWdvbi1lbGVjdHJpY2l0eS11bHRpbGl0ZXMtY29zdC1wb3J0bGFuZC1nZW5lcmFsLWVsZWN0cmljLW5vcnRod2VzdC1uYXR1cmFscy_SAQA?oc=5,https://da.gd/q2XmYV
GN:T:RE,AWS announces new training programs and renewable energy projects in Mississippi - About Amazon,https://news.google.com/rss/articles/CBMiXmh0dHBzOi8vd3d3LmFib3V0YW1hem9uLmNvbS9uZXdzL2F3cy9hd3MtdHJhaW5pbmctcHJvZ3JhbXMtc3VzdGFpbmFiaWxpdHktcHJvamVjdHMtbWlzc2lzc2lwcGnSAQA?oc=5,https://da.gd/wude0
