feed,title,long_url,short_url
RS,Evaluation of Job Strain of Family Physicians  in COVID-19 Pandemic Period- An Example from Turkey,https://www.researchsquare.com/article/rs-103955/latest,https://j.mp/3ewqB3I
RS,Does Therapy Always Need Touch? - A cross-sectional study among Switzerland-based occupational therapists and midwives regarding their experience with health care at a distance during the COVID-19 pandemic in Spring 2020,https://www.researchsquare.com/article/rs-103168/latest,https://j.mp/2GGNXXW
RS,Competing risk between in-hospital mortality and recovery: An application of DeepHit on COVID-19 clinical data,https://www.researchsquare.com/article/rs-103866/latest,https://j.mp/2GzOcDV
RS,"Assessment on knowledge, attitude, practices and risk of infection towards COVID-19 in Ethiopia: An online cross-sectional survey",https://www.researchsquare.com/article/rs-103859/latest,https://j.mp/38qUq4q
RS,Prone position in wards for spontaneous breathing Covid-19 patients: a retrospective study,https://www.researchsquare.com/article/rs-103439/latest,https://j.mp/3k7ZWv0
RS,A Prognostic Model for Death in COVID-19 Patients Presenting to the Emergency Room: The Added Value of Computed Tomography,https://www.researchsquare.com/article/rs-100749/latest,https://j.mp/3k0cJ2I
RS,Ambient temperature change Vs confirmed cases of COVID-19: A machine learning model,https://www.researchsquare.com/article/rs-102312/latest,https://j.mp/2I2yvWP
RS,"Low Molecular Weight Heparin Protects Lung, Renal and Microcirculation Function in Patients with Covid-19 Pneumonia",https://www.researchsquare.com/article/rs-101402/latest,https://j.mp/356t5ma
RS,COVID-19 Could Trigger Systemic Juvenile Idiopathic Arthritis: First Case Report,https://www.researchsquare.com/article/rs-100798/latest,https://j.mp/3eAjjfa
