feed,title,long_url,short_url
GN:T:AI,Jamie Dimon annual shareholder letter highlights AI potential - CNBC,https://news.google.com/rss/articles/CBMihAFodHRwczovL3d3dy5jbmJjLmNvbS8yMDI0LzA0LzA4L2phbWllLWRpbW9uLXNheXMtYWktbWF5LWJlLWFzLWltcGFjdGZ1bC1vbi1odW1hbml0eS1hcy1wcmludGluZy1wcmVzcy1lbGVjdHJpY2l0eS1hbmQtY29tcHV0ZXJzLmh0bWzSAQA?oc=5,https://da.gd/ihF7V6
GN:T:AI,"Generative AI unchecked could destroy society, mildly boost worker productivity: Japanese companies - Fortune",https://news.google.com/rss/articles/CBMiXmh0dHBzOi8vZm9ydHVuZS5jb20vMjAyNC8wNC8wOC9qYXBhbmVzZS1jb21wYW5pZXMtd2FybmluZy1haS1zb2NpYWwtb3JkZXItY29sbGFwc2UtdHJ1c3QtbGllcy_SAQA?oc=5,https://da.gd/dEuIk
GN:T:AI,Microsoft Just Set the Stage for an All-Out AI Talent War With Google - Business Insider,https://news.google.com/rss/articles/CBMiYmh0dHBzOi8vd3d3LmJ1c2luZXNzaW5zaWRlci5jb20vbWljcm9zb2Z0LWFpLXRhbGVudC13YXItd2l0aC1nb29nbGUtYXJ0aWZpY2lhbC1pbnRlbGxpZ2VuY2UtMjAyNC000gEA?oc=5,https://da.gd/TvFRX
GN:T:AI,"5-ish Things on AI: Tech Giants to Pay for AI Upskilling, Meta Adding More Labels to AI Content - CNET",https://news.google.com/rss/articles/CBMiggFodHRwczovL3d3dy5jbmV0LmNvbS90ZWNoL2NvbXB1dGluZy81LWlzaC10aGluZ3Mtb24tYWktdGVjaC1naWFudHMtdG8tcGF5LWZvci1haS11cHNraWxsaW5nLW1ldGEtYWRkaW5nLW1vcmUtbGFiZWxzLXRvLWFpLWNvbnRlbnQv0gEA?oc=5,https://da.gd/R4lcJ
GN:T:AI,An Artificial Intelligence (AI) Game Changer Could Be Coming: Here Are 3 Top Stocks to Buy - Yahoo Finance,https://news.google.com/rss/articles/CBMiVWh0dHBzOi8vZmluYW5jZS55YWhvby5jb20vbmV3cy9hcnRpZmljaWFsLWludGVsbGlnZW5jZS1haS1nYW1lLWNoYW5nZXItMTAwNzAwNDA4Lmh0bWzSAQA?oc=5,https://da.gd/GB36ca
GN:T:AI,"Xbox forms new game preservation and platforms teams, moves AI division under hardware - GamesIndustry",https://news.google.com/rss/articles/CBMidmh0dHBzOi8vd3d3LmdhbWVzaW5kdXN0cnkuYml6L3hib3gtZm9ybXMtb2YtbmV3LWdhbWUtcHJlc2VydmF0aW9uLWFuZC1wbGF0Zm9ybXMtdGVhbXMtbW92ZXMtYWktZGl2aXNpb24tdW5kZXItaGFyZHdhcmXSAQA?oc=5,https://da.gd/mtubCO
GN:T:AI,How AI Is Being Used to Find Mexico's Missing People - The Daily Beast,https://news.google.com/rss/articles/CBMiUWh0dHBzOi8vd3d3LnRoZWRhaWx5YmVhc3QuY29tL2hvdy1haS1pcy1iZWluZy11c2VkLXRvLWZpbmQtbWV4aWNvcy1taXNzaW5nLXBlb3BsZdIBAA?oc=5,https://da.gd/U8zxA
