feed,title,long_url,short_url
GN:T:CC,Climate change & doomsday: Irreversible tipping points may mean end of human civilization - WRAL TechWire,https://wraltechwire.com/2022/09/16/climate-change-doomsday-irreversible-tipping-points-may-mean-end-of-human-civilization/,
GN:T:CC,69% Indians see severe effects of climate change: Survey - The Hindu,https://www.thehindu.com/news/national/69-indians-see-severe-effects-of-climate-change-survey/article65895112.ece,
GN:T:CC,'Too afraid to have kids' – how BirthStrike for Climate lost control of its political message - The Conversation,https://theconversation.com/too-afraid-to-have-kids-how-birthstrike-for-climate-lost-control-of-its-political-message-181198,
GN:T:CC,"Local students have ideas on climate change policy, but are they being heard? - Hawaiipublicradio",https://www.hawaiipublicradio.org/the-conversation/2022-09-15/local-students-have-ideas-on-climate-change-policy-but-are-they-being-heard,
GN:T:CC,Charles III and Climate Change in the U.K. - The New Yorker,https://www.newyorker.com/news/daily-comment/charles-iii-and-climate-change-in-the-uk,
GN:T:CC,"Extreme hunger soaring in world’s climate hotspots, says Oxfam - The Guardian",https://www.theguardian.com/environment/2022/sep/16/extreme-hunger-soaring-in-worlds-climate-hotspots-says-oxfam,
GN:T:CC,How can your car journey be more eco-friendly? 5 climate change stories to read this week - World Economic Forum,https://www.weforum.org/agenda/2022/09/climate-change-latest-stories-16-september/,
GN:T:CC,Climate change-sparked droughts reveal wonders lost beneath the water - The Jerusalem Post,https://www.jpost.com/archaeology/article-717339,
GN:T:CC,"Climate Change Could Reduce the Size of Butterflies, Effectively Causing Astronomical Global Food Shortages: Study - The Weather Channel",https://weather.com/en-IN/india/biodiversity/news/2022-09-16-climate-change-could-reduce-butterfly-size-create-food-shortage,
