feed,title,long_url,short_url
GN:T:WP,Explainer: How margin calls came to threaten Europe's energy firms - Reuters,https://www.reuters.com/business/energy/how-margin-calls-came-threaten-europes-energy-firms-2022-09-16/,
GN:T:WP,Chinese manufacturer Goldwind wins 'milestone' 500MW wind turbine order in Uzbekistan - Windpower Monthly,https://www.windpowermonthly.com/article/1799146/chinese-manufacturer-goldwind-wins-milestone-500mw-wind-turbine-order-uzbekistan,
GN:T:WP,CBED's Wind Innovation SOV Extends Stay at German Wind Farm Project - Offshore Engineer,https://www.oedigital.com/news/499506-cbed-s-wind-innovation-sov-extends-stay-at-german-wind-farm-project,
GN:T:WP,"EUROPE POWER-Wind supply set to drop Monday, spot untraded - Nasdaq",https://www.nasdaq.com/articles/europe-power-wind-supply-set-to-drop-monday-spot-untraded,
GN:T:WP,'Untapped potential' | RWE and Latvian utility team up for joint offshore wind projects | Recharge - Recharge,https://www.rechargenews.com/wind/untapped-potential-rwe-and-latvian-utility-team-up-for-joint-offshore-wind-projects/2-1-1301789,
GN:T:WP,New York Bight Project offcially named - 4C Offshore,https://www.4coffshore.com/news/new-york-bight-project-offcially-named-nid26330.html,
GN:T:WP,"Renewables and batteries, a natural combination - Enel Green Power",https://www.enelgreenpower.com/stories/articles/2022/09/renewables-storage-electrification-process,
GN:T:WP,Colbun withdraws EIS for USD-570m wind project in Chile - Renewables Now,https://renewablesnow.com/news/colbun-withdraws-eis-for-usd-570m-wind-project-in-chile-798238/,
GN:T:WP,States Balk at Permitting Plan's 'National Interest' Power Lines - Bloomberg Law,https://news.bloomberglaw.com/environment-and-energy/states-balk-at-permitting-plans-national-interest-power-lines,
GN:T:WP,Macquarie Asset Management sells minority stake in Lincs Offshore Wind Farm - Macquarie Group,https://www.macquarie.com/au/en/about/news/2022/macquarie-asset-management-sells-minority-stake-in-lincs-offshore-wind-farm.html,
GN:T:WP,USVs Eye Offshore Wind Opportunities - Marine Technology News,https://www.marinetechnologynews.com/news/offshore-opportunities-622577,
GN:T:WP,"State of Michigan makes $425m real estate, infrastructure commitments in Q2 - IPE Real Assets",https://realassets.ipe.com/news/state-of-michigan-makes-425m-real-estate-infrastructure-commitments-in-q2/10062115.article,
GN:T:WP,Guy Martin to help blow up power station in new show - Grimsby Live,https://www.grimsbytelegraph.co.uk/news/celebs-tv/guy-martin-help-blow-up-7593463,
