feed,title,long_url,short_url
GN:S:GW,Potential decoupling of CO2 and Hg uptake process by global vegetation in the 21st century - Nature,https://news.google.com/rss/articles/CBMiMmh0dHBzOi8vd3d3Lm5hdHVyZS5jb20vYXJ0aWNsZXMvczQxNDY3LTAyNC00ODg0OS0y0gEA?oc=5,https://da.gd/fHCRq
GN:S:GW,Our inaction in addressing climate change has already cost us. - San Antonio Express-News,https://news.google.com/rss/articles/CBMia2h0dHBzOi8vd3d3LmV4cHJlc3NuZXdzLmNvbS9vcGluaW9uL2NvbW1lbnRhcnkvYXJ0aWNsZS9jbGltYXRlLWNoYW5nZS1jb3N0bHktY29zdC10ZXhhcy1kYW1hZ2UtMTk0NzU2MjIucGhw0gEA?oc=5,https://da.gd/dDsC0d
GN:S:GW,Is climate change behind all extreme weather? – DW – 05/27/2024 - DW (English),https://news.google.com/rss/articles/CBMiYmh0dHBzOi8vd3d3LmR3LmNvbS9lbi9pcy1jbGltYXRlLWNoYW5nZS1iZWhpbmQtYWxsLXRoZS1leHRyZW1lLXdlYXRoZXItYWNyb3NzLXRoZS13b3JsZC9hLTY5MTA3MDY10gEA?oc=5,https://da.gd/Wt4j
GN:S:GW,The West’s wetlands are struggling. Some have been overlooked altogether. - High Country News,https://news.google.com/rss/articles/CBMiZGh0dHBzOi8vd3d3Lmhjbi5vcmcvYXJ0aWNsZXMvdGhlLXdlc3RzLXdldGxhbmRzLWFyZS1zdHJ1Z2dsaW5nLXNvbWUtaGF2ZS1iZWVuLW92ZXJsb29rZWQtYWx0b2dldGhlci_SAQA?oc=5,https://da.gd/PLxmgM
GN:S:GW,Global Warming Hits Home: Murcia Registered 40 Days Of Real-feel Temps As High As 46 Degrees Last Summer - Murcia Today,https://news.google.com/rss/articles/CBMikQFodHRwczovL211cmNpYXRvZGF5LmNvbS9nbG9iYWxfd2FybWluZ19oaXRzX2hvbWVfbXVyY2lhX3JlZ2lzdGVyZWRfNDBfZGF5c19vZl9yZWFsX2ZlZWxfdGVtcHNfYXNfaGlnaF9hc180Nl9kZWdyZWVzX2xhc3Rfc3VtbWVyXzEwMDAwNTk3NDYtYS5odG1s0gEA?oc=5,https://da.gd/2tD74O
