feed,title,long_url,short_url
ArXiv:stat,Bayesian Modeling of Spatial Molecular Profiling Data via Gaussian Process,https://arxiv.org/abs/2012.03326v1,
ArXiv:stat,A modified maximum contrast method for unequal sample sizes in pharmacogenomic studies,https://arxiv.org/abs/2012.03475v1,
ArXiv:stat,Teaching reproducible research for medical students and postgraduate pharmaceutical scientists,https://arxiv.org/abs/2012.03554v1,
ArXiv:stat,A predictive model for kidney transplant graft survival using machine learning,https://arxiv.org/abs/2012.03787v1,
ArXiv:stat,Bayesian modelling for spatially misaligned health areal data: a multiple membership approach,https://arxiv.org/abs/2004.05334v3,
ArXiv:stat,Clustering US States by Time Series of COVID-19 New Case Counts with Non-negative Matrix Factorization,https://arxiv.org/abs/2011.14412v2,
