feed,title,long_url,short_url
GN:T:RE,Toyota and Thai conglomerate to work toward carbon neutrality - The Japan Times,https://www.japantimes.co.jp/news/2022/12/15/business/corporate-business/toyota-thailand-carbon/,https://da.gd/fVLd3
GN:T:RE,EU countries make final push for gas price cap deal this year - Reuters,https://www.reuters.com/business/energy/eu-countries-make-final-push-gas-price-cap-deal-this-year-2022-12-19/,https://da.gd/pfRR
GN:T:RE,Norway's Hydro plans wind farm to power industrial plants - Euronews,https://www.euronews.com/next/2022/12/19/norsk-hydro-windfarm,https://da.gd/xUFcin
GN:T:RE,Investing In The Collision Of Two Energy Megatrends - Seeking Alpha,https://seekingalpha.com/article/4565186-investing-in-the-collision-of-two-energy-megatrends,https://da.gd/pSxst
GN:T:RE,"Salesforce, Cummins and more call on utilities to bring them green power - IndyStar",https://www.indystar.com/story/news/environment/2022/12/19/salesforce-cummins-and-more-call-on-utilities-to-bring-them-green-power/69728053007/,https://da.gd/XKoB
GN:T:RE,Europe's Energy Crisis Is Just Getting Started - OilPrice,https://oilprice.com/Energy/Energy-General/Europes-Energy-Crisis-Is-Just-Getting-Started.html,https://da.gd/mB9ZF
