feed,title,long_url,short_url
GN:T:CC,Energy developer delivers major blow to blue state's climate agenda by canceling offshore wind contracts - Fox News,https://news.google.com/rss/articles/CBMiYGh0dHBzOi8vd3d3LmZveG5ld3MuY29tL3BvbGl0aWNzL2VuZXJneS1kZXZlbG9wZXItZGVsaXZlcnMtbWFqb3ItYmxvdy1ibHVlLXN0YXRlcy1jbGltYXRlLWFnZW5kYdIBZGh0dHBzOi8vd3d3LmZveG5ld3MuY29tL3BvbGl0aWNzL2VuZXJneS1kZXZlbG9wZXItZGVsaXZlcnMtbWFqb3ItYmxvdy1ibHVlLXN0YXRlcy1jbGltYXRlLWFnZW5kYS5hbXA?oc=5,https://da.gd/7jkTMR
GN:T:CC,The Rooftop Solar Industry Could Be On the Verge of Collapse | TIME - TIME,https://news.google.com/rss/articles/CBMiOWh0dHBzOi8vdGltZS5jb20vNjU2NTQxNS9yb29mdG9wLXNvbGFyLWluZHVzdHJ5LWNvbGxhcHNlL9IBAA?oc=5,https://da.gd/6Ulro
GN:T:CC,Migratory birds are struggling to adapt to climate change - Earth,https://news.google.com/rss/articles/CBMiVWh0dHBzOi8vd3d3LmVhcnRoLmNvbS9uZXdzL21pZ3JhdG9yeS1iaXJkcy1hcmUtc3RydWdnbGluZy10by1hZGFwdC10by1jbGltYXRlLWNoYW5nZS_SAQA?oc=5,https://da.gd/N3kqW
GN:T:CC,What to know about the 33rd Environmental Media Association Awards - NPR,https://news.google.com/rss/articles/CBMiUGh0dHBzOi8vd3d3Lm5wci5vcmcvMjAyNC8wMS8yNy8xMjI3MjQ2MDY2L2Vudmlyb25tZW50YWwtbWVkaWEtYXNzb2NpYXRpb24tYXdhcmRz0gEA?oc=5,https://da.gd/51MZB
GN:T:CC,AI is supposed to make us more efficient – but it could mean we waste more energy - The Conversation,https://news.google.com/rss/articles/CBMicmh0dHBzOi8vdGhlY29udmVyc2F0aW9uLmNvbS9haS1pcy1zdXBwb3NlZC10by1tYWtlLXVzLW1vcmUtZWZmaWNpZW50LWJ1dC1pdC1jb3VsZC1tZWFuLXdlLXdhc3RlLW1vcmUtZW5lcmd5LTIyMDk5MNIBAA?oc=5,https://da.gd/gu3d4
