feed,title,long_url,short_url
GN:T:CC,Throwing soup at Mona Lisa is legitimate 'in-your-face' strategy on climate change: Column - Fox News,https://news.google.com/rss/articles/CBMiaWh0dHBzOi8vd3d3LmZveG5ld3MuY29tL21lZGlhL3Rocm93aW5nLXNvdXAtbW9uYS1saXNhLWxlZ2l0aW1hdGUteW91ci1mYWNlLXN0cmF0ZWd5LWNsaW1hdGUtY2hhbmdlLWNvbHVtbtIBbWh0dHBzOi8vd3d3LmZveG5ld3MuY29tL21lZGlhL3Rocm93aW5nLXNvdXAtbW9uYS1saXNhLWxlZ2l0aW1hdGUteW91ci1mYWNlLXN0cmF0ZWd5LWNsaW1hdGUtY2hhbmdlLWNvbHVtbi5hbXA?oc=5,https://da.gd/UR2QKk
GN:T:CC,Why Do Some People Deny Climate Change? Research Makes Surprising Findings! - The Weather Channel,https://news.google.com/rss/articles/CBMicWh0dHBzOi8vd2VhdGhlci5jb20vZW4tSU4vaW5kaWEvY2xpbWF0ZS1jaGFuZ2UvbmV3cy8yMDI0LTAyLTAzLXJlc2VhcmNoLXNob3dzLXdoeS1zb21lLXBlb3BsZS1kZW55LWNsaW1hdGUtY2hhbmdl0gEA?oc=5,https://da.gd/GmSS
GN:T:CC,"No more chocolate, coffee or wine? ‘Last supper’ shows stakes of climate crisis - The Guardian",https://news.google.com/rss/articles/CBMiX2h0dHBzOi8vd3d3LnRoZWd1YXJkaWFuLmNvbS9lbnZpcm9ubWVudC8yMDI0L2ZlYi8wMy9lbmRhbmdlcmVkLWRpc2FwcGVhcmluZy1mb29kLWNsaW1hdGUtY3Jpc2lz0gEA?oc=5,https://da.gd/P0od
GN:T:CC,"New California Senate leader says his priorities are climate change, homelessness and opioid crises - Yahoo News",https://news.google.com/rss/articles/CBMiTmh0dHBzOi8vbmV3cy55YWhvby5jb20vY2FsaWZvcm5pYS1zZW5hdGUtbGVhZGVyLXNheXMtcHJpb3JpdGllcy0wNTQxMTI5NzkuaHRtbNIBAA?oc=5,https://da.gd/IdtCl
GN:T:CC,Policy change in California has slashed new solar installations by 80% - San Francisco Chronicle,https://news.google.com/rss/articles/CBMiVWh0dHBzOi8vd3d3LnNmY2hyb25pY2xlLmNvbS9jbGltYXRlL2FydGljbGUvc29sYXItcGFuZWwtcG93ZXItY2FsaWZvcm5pYS0xODY0NDk0NS5waHDSAQA?oc=5,https://da.gd/69Ohj
