feed,title,long_url,short_url
GN:T:RE,Opinion | Will Texas Blow Up Its Energy Miracle to Bolster Fossil Fuels? - The New York Times,https://news.google.com/rss/articles/CBMiRmh0dHBzOi8vd3d3Lm55dGltZXMuY29tLzIwMjMvMDUvMTIvb3Bpbmlvbi90ZXhhcy1yZW5ld2FibGUtZW5lcmd5Lmh0bWzSAQA?oc=5,https://da.gd/cmcN1
GN:T:RE,"Asos, Crocs Reset Net-Zero Climate Commitments - The Business of Fashion",https://news.google.com/rss/articles/CBMidWh0dHBzOi8vd3d3LmJ1c2luZXNzb2ZmYXNoaW9uLmNvbS9hcnRpY2xlcy9zdXN0YWluYWJpbGl0eS9jcm9jcy1hc29zLW5ldC16ZXJvLWVtaXNzaW9ucy1jbGltYXRlLXRhcmdldHMtZ3JlZW53YXNoaW5nL9IBAA?oc=5,https://da.gd/XqVI
GN:T:RE,Texas Could Be the World's Clean Energy Capital—If It Wants to Be - TIME,https://news.google.com/rss/articles/CBMiLGh0dHBzOi8vdGltZS5jb20vNjI3ODY3OC90ZXhhcy1jbGVhbi1lbmVyZ3kv0gEA?oc=5,https://da.gd/Kykj5
GN:T:RE,Utility-scale solar installation goes automated – pv magazine USA - pv magazine USA,https://news.google.com/rss/articles/CBMiV2h0dHBzOi8vcHYtbWFnYXppbmUtdXNhLmNvbS8yMDIzLzA1LzExL3V0aWxpdHktc2NhbGUtc29sYXItaW5zdGFsbGF0aW9uLWdvZXMtYXV0b21hdGVkL9IBAA?oc=5,https://da.gd/SMn6
GN:T:RE,"UK solar systems to be 50% cheaper by 2035, say UK researchers - pv magazine International",https://news.google.com/rss/articles/CBMiX2h0dHBzOi8vd3d3LnB2LW1hZ2F6aW5lLmNvbS8yMDIzLzA1LzExL3B2LXN5c3RlbXMtdG8tZ2V0LWJ5LXVwLXRvLTUwLWNoZWFwZXItaW4tdGhlLXVrLWJ5LTIwMzUv0gEA?oc=5,https://da.gd/NrEWu
GN:T:RE,Solar-powered airships could help climate-friendly air travel get off the ground - Anthropocene Magazine,https://news.google.com/rss/articles/CBMifmh0dHBzOi8vd3d3LmFudGhyb3BvY2VuZW1hZ2F6aW5lLm9yZy8yMDIzLzA1L3NvbGFyLXBvd2VyZWQtYWlyc2hpcHMtY291bGQtaGVscC1jbGltYXRlLWZyaWVuZGx5LWFpci10cmF2ZWwtZ2V0LW9mZi10aGUtZ3JvdW5kL9IBAA?oc=5,https://da.gd/rxHWCl
