feed,title,long_url,short_url
GN:T:WP,Tax credit for clean energy raises concern from some U.S. industries - The Washington Post,https://news.google.com/rss/articles/CBMiYGh0dHBzOi8vd3d3Lndhc2hpbmd0b25wb3N0LmNvbS9idXNpbmVzcy8yMDIzLzA1LzEyL2NsZWFuLWVuZXJneS10YXgtY3JlZGl0LWJpZGVuLWFkbWluaXN0cmF0aW9uL9IBAA?oc=5,https://da.gd/N5Sto
GN:T:WP,Biden's Clean Energy Expansion Is Facing Local Resistance - OilPrice,https://news.google.com/rss/articles/CBMiaGh0dHBzOi8vb2lscHJpY2UuY29tL0VuZXJneS9FbmVyZ3ktR2VuZXJhbC9CaWRlbnMtQ2xlYW4tRW5lcmd5LUV4cGFuc2lvbi1Jcy1GYWNpbmctTG9jYWwtUmVzaXN0YW5jZS5odG1s0gFsaHR0cHM6Ly9vaWxwcmljZS5jb20vRW5lcmd5L0VuZXJneS1HZW5lcmFsL0JpZGVucy1DbGVhbi1FbmVyZ3ktRXhwYW5zaW9uLUlzLUZhY2luZy1Mb2NhbC1SZXNpc3RhbmNlLmFtcC5odG1s?oc=5,https://da.gd/74jie
GN:T:WP,"China's record carbon emissions expected to peak due to clean energy push, report says - CNN",https://news.google.com/rss/articles/CBMiWGh0dHBzOi8vd3d3LmNubi5jb20vMjAyMy8wNS8xMi9lY29ub215L2NoaW5hLWNhcmJvbi1lbWlzc2lvbnMtcmVjb3JkLWludGwtaG5rL2luZGV4Lmh0bWzSAQA?oc=5,https://da.gd/aWhdhx
GN:T:WP,IKEA owner bags share of massive offshore wind to supply a third of Finland's power - Recharge,https://news.google.com/rss/articles/CBMigAFodHRwczovL3d3dy5yZWNoYXJnZW5ld3MuY29tL3dpbmQvaWtlYS1vd25lci1iYWdzLXNoYXJlLW9mLW1hc3NpdmUtb2Zmc2hvcmUtd2luZC10by1zdXBwbHktYS10aGlyZC1vZi1maW5sYW5kcy1wb3dlci8yLTEtMTQ1MDE0N9IBAA?oc=5,https://da.gd/g2DSoS
GN:T:WP,RGU gets Scottish government support for hydrogen test center - Offshore magazine,https://news.google.com/rss/articles/CBMifGh0dHBzOi8vd3d3Lm9mZnNob3JlLW1hZy5jb20vcmVuZXdhYmxlLWVuZXJneS9hcnRpY2xlLzE0MjkzNzQ1L3JndS1nZXRzLXNjb3R0aXNoLWdvdmVybm1lbnQtc3VwcG9ydC1mb3ItaHlkcm9nZW4tdGVzdC1jZW50ZXLSAQA?oc=5,https://da.gd/OcGBL
GN:T:WP,"Largest US public utility switching from coal to gas, despite proposed EPA carbon pollution limits - WRAL News",https://news.google.com/rss/articles/CBMigAFodHRwczovL3d3dy53cmFsLmNvbS9sYXJnZXN0LXVzLXB1YmxpYy11dGlsaXR5LXN3aXRjaGluZy1mcm9tLWNvYWwtdG8tZ2FzLWRlc3BpdGUtcHJvcG9zZWQtZXBhLWNhcmJvbi1wb2xsdXRpb24tbGltaXRzLzIwODU3NjU0L9IBhAFodHRwczovL3d3dy53cmFsLmNvbS9hbXAvbGFyZ2VzdC11cy1wdWJsaWMtdXRpbGl0eS1zd2l0Y2hpbmctZnJvbS1jb2FsLXRvLWdhcy1kZXNwaXRlLXByb3Bvc2VkLWVwYS1jYXJib24tcG9sbHV0aW9uLWxpbWl0cy8yMDg1NzY1NC8?oc=5,https://da.gd/v52zIp
GN:T:WP,Proponents tout virtues of federal Inflation Reduction Act for cheap power - The Western News,https://news.google.com/rss/articles/CBMiX2h0dHBzOi8vdGhld2VzdGVybm5ld3MuY29tL25ld3MvMjAyMy9tYXkvMTIvcHJvcG9uZW50cy10b3V0LXZpcnR1ZXMtZmVkZXJhbC1pbmZsYXRpb24tcmVkdWN0aW8v0gEA?oc=5,https://da.gd/eiUU
