feed,title,long_url,short_url
ArXiv,Can Offline Reinforcement Learning Help Natural Language Understanding?,https://arxiv.org/abs/2212.03864v1,
ArXiv,Reinforcement Learning for Resilient Power Grids,https://arxiv.org/abs/2212.04069v1,
ArXiv,Enhanced method for reinforcement learning based dynamic obstacle avoidance by assessment of collision risk,https://arxiv.org/abs/2212.04123v1,
ArXiv,Design and Planning of Flexible Mobile Micro-Grids Using Deep Reinforcement Learning,https://arxiv.org/abs/2212.04136v1,
ArXiv,Reinforcement Learning for Few-Shot Text Generation Adaptation,https://arxiv.org/abs/2111.11030v3,
ArXiv,Reinforcement Learning based Voice Interaction to Clear Path for Robots in Elevator Environment,https://arxiv.org/abs/2203.09844v2,
ArXiv,Energy-Efficient Communication Networks via Multiple Aerial Reconfigurable Intelligent Surfaces: DRL and Optimization Approach,https://arxiv.org/abs/2207.03149v2,
ArXiv,Learning Dynamic Abstract Representations for Sample-Efficient Reinforcement Learning,https://arxiv.org/abs/2210.01955v2,
ArXiv,"A Survey on Explainable Reinforcement Learning: Concepts, Algorithms, Challenges",https://arxiv.org/abs/2211.06665v3,
ArXiv,Analysis of Anomalous Behavior in Network Systems Using Deep Reinforcement Learning with CNN Architecture,https://arxiv.org/abs/2211.16304v2,
