feed,title,long_url,short_url
GN:T:AI,AI-generated influencers are taking over social media - The Week,https://news.google.com/rss/articles/CBMiLmh0dHBzOi8vdGhld2Vlay5jb20vdGVjaC9haS1pbmZsdWVuY2VyLWVjb25vbXnSAQA?oc=5,https://da.gd/Pb4d
GN:T:AI,"Nvidia to launch in Middle East amid U.S. curbs on AI exports to region, Ooredoo CEO says - Yahoo Finance",https://news.google.com/rss/articles/CBMiTGh0dHBzOi8vZmluYW5jZS55YWhvby5jb20vbmV3cy9udmlkaWEtbGF1bmNoLW1pZGRsZS1lYXN0LWFtaWQtMTE1MjM3OTY2Lmh0bWzSAQA?oc=5,https://da.gd/Pv3rd
GN:T:AI,Researchers use AI to let you chat with your future self - Euronews,https://news.google.com/rss/articles/CBMiYWh0dHBzOi8vd3d3LmV1cm9uZXdzLmNvbS9uZXh0LzIwMjQvMDYvMjMvcmVzZWFyY2hlcnMtdXNlLWFpLXRvLWxldC15b3UtY2hhdC13aXRoLXlvdXItZnV0dXJlLXNlbGbSAQA?oc=5,https://da.gd/OEVka
GN:T:AI,Nvidia Is the Hottest Stock-Split Stock on Wall Street. The Artificial Intelligence (AI) Company Could Be Worth $10 Trillion by 2030 - The Motley Fool,https://news.google.com/rss/articles/CBMiWmh0dHBzOi8vd3d3LmZvb2wuY29tL2ludmVzdGluZy8yMDI0LzA2LzIzL252aWRpYS1zdG9jay1zcGxpdC1zdG9jay1haS1jb21wYW55LTEwLXRyaWxsaW9uL9IBAA?oc=5,https://da.gd/MZrSzj
GN:T:AI,Can artificial intelligence be a new frontier for Israel's security? - The Jerusalem Post,https://news.google.com/rss/articles/CBMiRGh0dHBzOi8vd3d3Lmpwb3N0LmNvbS9idXNpbmVzcy1hbmQtaW5ub3ZhdGlvbi9vcGluaW9uL2FydGljbGUtODA3MjMx0gEA?oc=5,https://da.gd/zjY8WV
