feed,title,long_url,short_url
GN:T:RE,Portuguese Man Crosses Atlantic Ocean Using Kites - VOA Learning English,https://learningenglish.voanews.com/a/portuguese-man-crosses-atlantic-ocean-using-wind-power/6371734.html,
GN:T:RE,How Much Cheaper Is It To Own An Electric Car? - CleanTechnica,https://cleantechnica.com/2022/01/01/how-much-cheaper-is-it-to-own-an-electric-car/,
GN:T:RE,Obscure NYC Agency Plucks 184 Ford Mustang Mach-E Electric Vehicles From EV Pot - CleanTechnica,https://cleantechnica.com/2022/01/01/obscure-nyc-agency-plucks-184-ford-mustang-mach-e-electric-vehicles-from-ev-pot/,
GN:T:RE,New Technology Increases Sequencing Power To Help Decode the Genome of All Life on Earth - SciTechDaily,https://scitechdaily.com/new-technology-increases-sequencing-power-to-help-decode-the-genome-of-all-life-on-earth/,
GN:T:RE,Can a Sustainable Mining Experiment in New Caledonia Power Tesla's Ambitions? - The New York Times,https://www.nytimes.com/2021/12/30/world/asia/tesla-batteries-nickel-new-caledonia.html,
GN:T:RE,Vinci wraps up EUR-4.9bn buy of ACS' energy biz - Renewables Now,https://renewablesnow.com/news/vinci-wraps-up-eur-49bn-buy-of-acs-energy-biz-767714/,
