feed,title,long_url,short_url
GN:T:SL,Climate change and sea level rise pose an acute challenge for cities with combined sewer systems - Smart Water Magazine,https://news.google.com/rss/articles/CBMiggFodHRwczovL3NtYXJ0d2F0ZXJtYWdhemluZS5jb20vbmV3cy9kcmV4ZWwtdW5pdmVyc2l0eS9jbGltYXRlLWNoYW5nZS1hbmQtc2VhLWxldmVsLXJpc2UtcG9zZS1hY3V0ZS1jaGFsbGVuZ2UtY2l0aWVzLWNvbWJpbmVkLXNld2Vy0gGGAWh0dHBzOi8vc21hcnR3YXRlcm1hZ2F6aW5lLmNvbS9uZXdzL2RyZXhlbC11bml2ZXJzaXR5L2NsaW1hdGUtY2hhbmdlLWFuZC1zZWEtbGV2ZWwtcmlzZS1wb3NlLWFjdXRlLWNoYWxsZW5nZS1jaXRpZXMtY29tYmluZWQtc2V3ZXI_YW1w?oc=5,https://da.gd/FW5yo
GN:T:SL,Dunes decoded: A comprehensive and precise mapping for coastal conservation - Phys,https://news.google.com/rss/articles/CBMiTmh0dHBzOi8vcGh5cy5vcmcvbmV3cy8yMDI0LTA2LWR1bmVzLWRlY29kZWQtY29tcHJlaGVuc2l2ZS1wcmVjaXNlLWNvYXN0YWwuaHRtbNIBAA?oc=5,https://da.gd/zxc5Av
GN:T:SL,"As ships grow and seas rise, can Baltimore's port use new bridge to raise the roof? - Baltimore Sun",https://news.google.com/rss/articles/CBMiT2h0dHBzOi8vd3d3LmJhbHRpbW9yZXN1bi5jb20vMjAyNC8wNi8yOC9oZWlnaHQta2V5LWJyaWRnZS1zaGlwLXNpemUtc2VhLWxldmVscy_SAQA?oc=5,https://da.gd/BKbjF
GN:T:SL,North Atlantic–Pacific salinity contrast enhanced by wind and ocean warming - Nature,https://news.google.com/rss/articles/CBMiMmh0dHBzOi8vd3d3Lm5hdHVyZS5jb20vYXJ0aWNsZXMvczQxNTU4LTAyNC0wMjAzMy150gEA?oc=5,https://da.gd/8RFv
GN:T:SL,"In North Carolina, a Legal Fight Over Wetlands Protections - InsideClimate News",https://news.google.com/rss/articles/CBMiVmh0dHBzOi8vaW5zaWRlY2xpbWF0ZW5ld3Mub3JnL25ld3MvMjgwNjIwMjQvbm9ydGgtY2Fyb2xpbmEtbGVnYWwtd2V0bGFuZHMtcHJvdGVjdGlvbnMv0gEA?oc=5,https://da.gd/qUHYvU
GN:T:SL,"US opted out of Paris Accord as India, China weren't paying: Donald Trump - Deccan Herald",https://news.google.com/rss/articles/CBMicWh0dHBzOi8vd3d3LmRlY2NhbmhlcmFsZC5jb20vd29ybGQvdXMtb3B0ZWQtb3V0LW9mLXBhcmlzLWFjY29yZC1hcy1pbmRpYS1jaGluYS13ZXJlbnQtcGF5aW5nLWRvbmFsZC10cnVtcC0zMDg0NDgy0gEA?oc=5,https://da.gd/0mLS4A
GN:T:SL,Mount Stewart wins award for climate change actions including recreating garden away from rising sea levels - MSN,https://news.google.com/rss/articles/CBMinQFodHRwczovL3d3dy5tc24uY29tL2VuLWdiL3RyYXZlbC9uZXdzL21vdW50LXN0ZXdhcnQtd2lucy1hd2FyZC1mb3ItY2xpbWF0ZS1jaGFuZ2UtYWN0aW9ucy1pbmNsdWRpbmctcmVjcmVhdGluZy1nYXJkZW4tYXdheS1mcm9tLXJpc2luZy1zZWEtbGV2ZWxzL2FyLUJCMXAxSUVE0gEA?oc=5,https://da.gd/ClInME
GN:T:SL,Award for 'exemplary' efforts to cope with climate change at historic garden - The Independent,https://news.google.com/rss/articles/CBMid2h0dHBzOi8vd3d3LmluZGVwZW5kZW50LmNvLnVrL2NsaW1hdGUtY2hhbmdlL25ld3Mvbm9ydGhlcm4taXJlbGFuZC1jaGlsZS1zb3V0aC1hZnJpY2EtbmV3LXplYWxhbmQtZGVubWFyay1iMjU3MDMzOC5odG1s0gEA?oc=5,https://da.gd/3UZ6
