feed,title,long_url,short_url
GN:T:WP,Lamprell Signs Contract Worth More Than $200 Mln for UK Offshore Wind Farm - MarketWatch,https://www.marketwatch.com/story/lamprell-signs-contract-worth-more-than-200-mln-for-uk-offshore-wind-farm-271662620162?mod=newsviewer_click,
GN:T:WP,123-Metre Wind Turbine Blade Rolls Out in China - Offshore WIND,https://www.offshorewind.biz/2022/09/07/123-metre-wind-turbine-blade-rolls-out-in-china/,
GN:T:WP,"EUROPE POWER-Spot down on less demand, more solar, nuclear supply - Yahoo Finance",https://finance.yahoo.com/news/europe-power-spot-down-less-082116563.html,
GN:T:WP,"Corio, TotalEnergies Collaborate with SK ecoplant on BadaEnergy Offshore Portfolio - North American Windpower",https://nawindpower.com/corio-totalenergies-collaborate-with-sk-ecoplant-on-badaenergy-offshore-portfolio,
GN:T:WP,PV-powered direct air electrolysis module to produce hydrogen from moisture in air - pv magazine International,https://www.pv-magazine.com/2022/09/08/pv-powered-direct-air-electrolysis-module-to-produce-hydrogen-from-moisture-in-air/,
GN:T:WP,GFO-22-402 – Advancing Designs for Floating Offshore Wind Mooring Lines and Anchors - California Grants Portal - California Grants Portal,https://www.grants.ca.gov/grants/gfo-22-402-advancing-designs-for-floating-offshore-wind-mooring-lines-and-anchors/,
