feed,title,long_url,short_url
GN:T:WP,Africa missing out on 'incredible' wind resource potential - GWEC - Windpower Monthly,https://www.windpowermonthly.com/article/1709007/africa-missing-incredible-wind-resource-potential-gwec,
GN:T:WP,Wind Power on Public Lands | Radio 570 WNAX - WNAX,https://wnax.com/news/180081-wind-power-on-public-lands/,
GN:T:WP,DTE discusses how its wind turbines work in winter - Midland Daily News,https://www.ourmidland.com/news/state/article/DTE-wind-turbines-come-with-adaptation-packages-15997776.php,
GN:T:WP,Ask a mussel how to anchor wind turbines - Electronics Weekly,https://www.electronicsweekly.com/news/research-news/ask-mussel-anchor-wind-turbines-2021-03/,
GN:T:WP,14th five-year plan is key to reaching Xi’s environmental goals - South China Morning Post,https://www.scmp.com/news/china/science/article/3124064/chinas-two-sessions-five-year-plan-key-reaching-xis,
GN:T:WP,BOEM resumes final environmental review for Vineyard Wind - National Fisherman,https://www.nationalfisherman.com/northeast/boem-resumes-final-environmental-review-for-vineyard-wind,
GN:T:WP,"Op-ed: U.S. has rejoined the Paris accord. Hoosiers, start your engines. - IndyStar",https://www.indystar.com/story/opinion/2021/03/04/op-ed-with-u-s-back-in-paris-accord-time-for-hoosiers-to/6894359002/,
GN:T:WP,Fifth Petrobras Director to Follow CEO Out - Offshore Engineer,https://www.oedigital.com/news/485740-fifth-petrobras-director-to-follow-ceo-out,
GN:T:WP,Siemens Energy to replace Beiersdorf in Germany's DAX index - Reuters,https://www.reuters.com/article/us-germany-dax-siemensenergy/siemens-energy-to-replace-beiersdorf-in-germanys-dax-index-idUSKBN2AV2TL,
