feed,title,long_url,short_url
ArXiv:math,Mixture models for spherical data with applications to protein bioinformatics,https://arxiv.org/abs/2104.13140v1,
ArXiv:math,Quadratic Optimization-Based Nonlinear Control for Protein Conformation Prediction,https://arxiv.org/abs/2104.13147v1,
ArXiv:math,An optimal control approach to determine resistance-type boundary conditions from in-vivo data for cardiovascular simulations,https://arxiv.org/abs/2104.13284v1,
ArXiv:math,Catacondensed Chemical Hexagonal Complexes: A Natural Generalisation of Benzenoids,https://arxiv.org/abs/2104.13290v1,
ArXiv:math,Optimal quantum tomography with constrained elementary measurements arising from unitary bases,https://arxiv.org/abs/1411.0152v4,
ArXiv:math,Linear time reconstruction by discrete tomography in three dimensions,https://arxiv.org/abs/2010.05868v2,
ArXiv:math,Optimal maintenance schedule for a wind turbine with aging components,https://arxiv.org/abs/2012.07307v3,
