feed,title,long_url,short_url
MX,"Study finds that microplastics infiltrate all systems of body, cause behavioral changes in mice",https://medicalxpress.com/news/2023-08-microplastics-infiltrate-body-behavioral-mice.html,https://da.gd/cnN2c7
MX,Q&A: Research reveals how the brain sets your body's dinner clock,https://medicalxpress.com/news/2023-08-qa-reveals-brain-body-dinner.html,https://da.gd/nXC4Aa
MX,Researchers study barriers and facilitators to accessing health care in rural Missouri,https://medicalxpress.com/news/2023-08-barriers-accessing-health-rural-missouri.html,https://da.gd/YBTWCo
MX,Pulsed field ablation found to be noninferior to thermal ablation in paroxysmal atrial fibrillation,https://medicalxpress.com/news/2023-08-pulsed-field-ablation-noninferior-thermal.html,https://da.gd/XtSXnR
MX,New research links wildfire smoke to increased risk of emergency room visits for people of all ages,https://medicalxpress.com/news/2023-08-links-wildfire-emergency-room-people.html,https://da.gd/MsUrt
