feed,title,long_url,short_url
GN:T:SP,"Solar Jobs, Solar Installations, & Homes Powered by Solar in Top 10 US Solar States - CleanTechnica",https://cleantechnica.com/2020/12/06/solar-jobs-solar-installations-homes-powered-by-solar-in-top-10-us-solar-states/,
GN:T:SP,County targets solar incentive's 'fiscal inequities' - Tehachapi News,https://www.tehachapinews.com/news/county-targets-solar-incentives-fiscal-inequities/article_8e75d7de-37f8-11eb-babd-433407d96686.html,
GN:T:SP,Ujjain: Professor Solanki lectures on benefits of Solar Enegry at Urja Swaraj Yatra Sabha - Free Press Journal,https://www.freepressjournal.in/ujjain/ujjain-professor-solanki-lectures-on-benefits-of-solar-enegry-at-urja-swaraj-yatra-sabha,
GN:T:SP,Australian energy industry veteran predicts 2020's pandemic-fuelled solar boom to continue into 2021 - Impress Media Australia,https://www.impress.com.au/newsroom/enphase-energy/2277-enphase-wilf-johnston-2021-predictions.html,
GN:T:SP,Australian Solar Systems Interest Index – December 2020 - Solar Quotes,https://www.solarquotes.com.au/blog/aussii-solar-november-20-mb1788/,
GN:T:SP,The Story of How Egypt Built One of the World's Largest Solar Parks - Egyptian Streets,https://egyptianstreets.com/2020/12/05/the-story-of-how-egypt-built-one-of-the-worlds-largest-solar-park/,
