feed,title,long_url,short_url
GN:S:C,Climate Change Threatens Summer Stages and Outdoor Performances - The New York Times,https://www.nytimes.com/2022/08/11/arts/climate-change-outdoor-theater.html,
GN:S:C,Is the US equipped to be a global climate change leader? - asianews,https://asianews.network/is-the-us-equipped-to-be-a-global-climate-change-leader/,
GN:S:C,The Federal Government Alone Won't Save Us from Climate Change - Undark Magazine,https://undark.org/2022/08/11/the-federal-government-alone-wont-save-us-from-climate-change/,
GN:S:C,New tool to measure health impact of climate change in at-risk communities - FierceHealthcare,https://www.fiercehealthcare.com/providers/new-tool-measure-health-impact-climate-change-risk-communities,
GN:S:C,Climate change and extreme heat are making us more anxious - The Conversation,https://theconversation.com/climate-change-and-extreme-heat-are-making-us-more-anxious-187830,
GN:S:C,"Balancing climate change, energy access and nature conservation: a multilayered challenge for Africa - BirdLife International",https://www.birdlife.org/news/2022/08/11/balancing-climate-change-energy-access-and-nature-conservation-a-multilayered-challenge-for-africa/,
GN:S:C,Wildfire threat demands action on climate change | Opinion | lmtribune.com - Lewiston Morning Tribune,https://lmtribune.com/opinion/wildfire-threat-demands-action-on-climate-change/article_b2776455-2e15-557a-b59e-d2447f4e567f.html,
