feed,title,long_url,short_url
GN:S:C,Rural voters least likely to feel Washington in their corner on climate change - Press Herald,https://www.pressherald.com/2022/12/10/rural-voters-least-likely-to-feel-washington-in-their-corner-on-climate-change/,https://da.gd/1Iia
GN:S:C,Axios AM Climate Truths: Future of climate tech - Axios,https://www.axios.com/2022/12/10/axios-am-climate-truths-future-tech,https://da.gd/BW0q
GN:S:C,5. Big Tech's mixed record on climate - Axios,https://www.axios.com/2022/12/10/big-tech-climate-mixed-verdict,https://da.gd/3MC0
GN:S:C,The slow but steady progress of climate tech - Axios,https://www.axios.com/2022/12/10/climate-tech-progress-breakthroughs,https://da.gd/vGl2d
GN:S:C,Climate tech's challenge: Make sure new strategies are adopted equally - Axios,https://www.axios.com/2022/12/10/climate-tech-equity-strategies,https://da.gd/RnE8up
GN:S:C,Building resilience through grassroots climate action - Arab News,https://www.arabnews.com/node/2214096,https://da.gd/vDLPjy
GN:S:C,Romney: U.S. Must be World Leader in Reducing Impacts of Climate Change - Mitt Romney,https://www.romney.senate.gov/romney-u-s-must-be-world-leader-in-reducing-impacts-of-climate-change/,https://da.gd/3jY13u
GN:S:C,"Students, experts discuss climate change on campus, regional, global scale - The Brown Daily Herald",https://www.browndailyherald.com/article/2022/11/students-experts-discuss-climate-change-on-campus-regional-global-scale,https://da.gd/jwnvJ
