feed,title,long_url,short_url
GN:T:AI,Sana raises $34M for its AI-based knowledge management and learning platform for workplaces - TechCrunch,https://techcrunch.com/2022/12/13/sana-raises-34m-for-its-ai-based-knowledge-management-and-learning-platform-for-workplaces/,https://da.gd/krnV
GN:T:AI,"Apple taps brake on self-driving cars, now aims for 2026 - The Register",https://www.theregister.com/2022/12/13/in_brief_ai/,https://da.gd/Odo9N
GN:T:AI,KI-FLEX AI chip tapes out with flexible videantis processor platform - Design and Reuse,https://www.design-reuse.com/news/53190/ki-flex-ai-chip-videantis-processor-platform.html,https://da.gd/0UFCi
GN:T:AI,How AI in Broadcasting Has A Hand In Improving Marketing - MarTech Series,https://martechseries.com/mts-insights/guest-authors/how-ai-in-broadcasting-has-a-hand-in-improving-marketing/,https://da.gd/6mXXMm
GN:T:AI,Making rooftop solar panels more efficient with AI - Innovation News Network,https://www.innovationnewsnetwork.com/making-rooftop-solar-panels-more-efficient-with-ai/28224/,https://da.gd/3I1rV
GN:T:AI,Deconstructed: Spaghetti ai Uni at Sanjusan - Mpls,https://mspmag.com/eat-and-drink/deconstructed-spaghetti-ai-uni-at-sanjusan/,https://da.gd/hs9u
GN:T:AI,Bangkok to deploy AI-based traffic prediction technology - SmartCitiesWorld,https://www.smartcitiesworld.net/ai-and-machine-learning/bangkok-to-deploy-ai-based-traffic-prediction-technology,https://da.gd/5Dig
GN:T:AI,Don't Fear AI — Supply Chain Leaders Need it to be Agile - SupplyChainBrain,https://www.supplychainbrain.com/blogs/1-think-tank/post/36256-dont-fear-ai-supply-chain-leaders-need-it-to-be-agile,https://da.gd/zYHV6n
