feed,title,long_url,short_url
GN:T:CC,"Scientists revive 48,500-year-old ‘zombie virus’ from Siberian permafrost - Fox News",https://www.foxnews.com/science/scientists-revive-48500-year-old-zombie-virus-siberian-permafrost,
GN:T:CC,5 Best Climate Change Stocks To Buy According To Hedge Funds - Insider Monkey,https://www.insidermonkey.com/blog/5-best-climate-change-stocks-to-buy-according-to-hedge-funds-3-1090988/,
GN:T:CC,Large parts of world drier than normal in 2021: WMO - UN News,https://news.un.org/en/story/2022/11/1131132,
GN:T:CC,China and Russia Continue to Block Protections for Antarctica - Scientific American,https://www.scientificamerican.com/article/china-and-russia-continue-to-block-protections-for-antarctica/,
GN:T:CC,Study shows that strongest Arctic cyclone on record led to surprising loss of sea ice - Phys,https://phys.org/news/2022-11-strongest-arctic-cyclone-loss-sea.html,
