feed,title,long_url,short_url
GN:T:RE,2022 SAF Production Increases 200% - More Incentives Needed to Reach Net Zero - IATA,https://www.iata.org/en/pressroom/2022-releases/2022-12-07-01/,https://da.gd/6R0ls
GN:T:RE,Biden-Harris Administration Announces Winners of California Offshore Wind Energy Auction - US Department of the Interior,https://www.doi.gov/pressreleases/biden-harris-administration-announces-winners-california-offshore-wind-energy-auction,https://da.gd/6WKqn
GN:T:RE,The first huge piece of the first major US offshore wind farm is ready - Electrek,https://electrek.co/2022/12/07/the-first-huge-piece-of-the-first-major-us-offshore-wind-farm-is-ready/,https://da.gd/mnk4aw
GN:T:RE,"Transmission needed to carry wind power from the central U.S. eastward, DOE finds - pv magazine USA",https://pv-magazine-usa.com/2022/12/07/transmission-needed-to-carry-wind-power-from-the-central-u-s-eastward-doe-finds/,https://da.gd/zSwg
GN:T:RE,Letter: New Republican leadership disappoints on renewable energy - Bangor Daily News,https://www.bangordailynews.com/2022/12/07/opinion/letters/letter-new-republican-leadership-disappoints-on-renewable-energy/,https://da.gd/xm0sSZ
