feed,title,long_url,short_url
RS,Decoding breast cancer Histopathology: Machine Learning-Enhanced Advanced Mathematical Models in Multi-B-Value MR Diffusion Imaging,https://www.researchsquare.com/article/rs-3520062/latest,https://da.gd/X1Srnq
RS,Combined Unsupervised Machine Learning and clinical cohort for phenotyping complex diseases with its application to Amyotrophic lateral sclerosis,https://www.researchsquare.com/article/rs-3437583/latest,https://da.gd/9mXS
RS,Audio Steganography Algorithm Based On Phase Coding,https://www.researchsquare.com/article/rs-3504599/latest,https://da.gd/ruST
RS,A Chinese Named Entity Recognition Model Incorporating Recurrent Cell and Information State Recursion,https://www.researchsquare.com/article/rs-3506056/latest,https://da.gd/1bP29B
RS,"Optimizing the wells location using the Machine learning algorithms, as well as optimizing the drilling time of production and injection wells in one of the reservoirs in south west of Iran",https://www.researchsquare.com/article/rs-3500561/latest,https://da.gd/hZ9Jx
RS,Language or Rating Scales Based Classifications of Emotions: Computational Analysis of Language and Alexithymia,https://www.researchsquare.com/article/rs-3533503/latest,https://da.gd/cM4ubW
RS,"‘Life became harder with COVID-19’: Impacts of COVID-19 on youth living in eThekwini district, South Africa, a qualitative analysis of responses to an online survey",https://www.researchsquare.com/article/rs-3527663/latest,https://da.gd/fcArD
