feed,title,long_url,short_url
GN:S:C,"In Indonesia, deforestation is intensifying disasters from severe weather and climate change - The Hill",https://news.google.com/rss/articles/CBMikAFodHRwczovL3RoZWhpbGwuY29tL2hvbWVuZXdzL2FwL2FwLWludGVybmF0aW9uYWwvYXAtaW4taW5kb25lc2lhLWRlZm9yZXN0YXRpb24taXMtaW50ZW5zaWZ5aW5nLWRpc2FzdGVycy1mcm9tLXNldmVyZS13ZWF0aGVyLWFuZC1jbGltYXRlLWNoYW5nZS_SAZQBaHR0cHM6Ly90aGVoaWxsLmNvbS9ob21lbmV3cy9hcC9hcC1pbnRlcm5hdGlvbmFsL2FwLWluLWluZG9uZXNpYS1kZWZvcmVzdGF0aW9uLWlzLWludGVuc2lmeWluZy1kaXNhc3RlcnMtZnJvbS1zZXZlcmUtd2VhdGhlci1hbmQtY2xpbWF0ZS1jaGFuZ2UvYW1wLw?oc=5,https://da.gd/C8tA
GN:S:C,Positive changemakers fighting climate change in NYC - CBS New York - CBS New York,https://news.google.com/rss/articles/CBMiW2h0dHBzOi8vd3d3LmNic25ld3MuY29tL25ld3lvcmsvdmlkZW8vcG9zaXRpdmUtY2hhbmdlbWFrZXJzLWZpZ2h0aW5nLWNsaW1hdGUtY2hhbmdlLWluLW55Yy_SAQA?oc=5,https://da.gd/HmTtM
GN:S:C,"Climate change could affect timekeeping, study says - BBC",https://news.google.com/rss/articles/CBMiNWh0dHBzOi8vd3d3LmJiYy5jb20vbmV3cy9zY2llbmNlLWVudmlyb25tZW50LTY4Njg0MjQ00gEA?oc=5,https://da.gd/Em22A
GN:S:C,"In Indonesia, deforestation is intensifying disasters from severe weather and climate change - ABC News",https://news.google.com/rss/articles/CBMihQFodHRwczovL2FiY25ld3MuZ28uY29tL0ludGVybmF0aW9uYWwvd2lyZVN0b3J5L2luZG9uZXNpYS1kZWZvcmVzdGF0aW9uLWludGVuc2lmeWluZy1kaXNhc3RlcnMtc2V2ZXJlLXdlYXRoZXItY2xpbWF0ZS1jaGFuZ2UtMTA4Njc0MDgw0gGJAWh0dHBzOi8vYWJjbmV3cy5nby5jb20vYW1wL0ludGVybmF0aW9uYWwvd2lyZVN0b3J5L2luZG9uZXNpYS1kZWZvcmVzdGF0aW9uLWludGVuc2lmeWluZy1kaXNhc3RlcnMtc2V2ZXJlLXdlYXRoZXItY2xpbWF0ZS1jaGFuZ2UtMTA4Njc0MDgw?oc=5,https://da.gd/hUIGQ
GN:S:C,Organizations across New York City studying climate change's varying effects on different communities - CBS New York,https://news.google.com/rss/articles/CBMiTmh0dHBzOi8vd3d3LmNic25ld3MuY29tL25ld3lvcmsvbmV3cy9jbGltYXRlLWNoYW5nZS1uZXcteW9yay1jaXR5LWNvbW11bml0aWVzL9IBUmh0dHBzOi8vd3d3LmNic25ld3MuY29tL2FtcC9uZXd5b3JrL25ld3MvY2xpbWF0ZS1jaGFuZ2UtbmV3LXlvcmstY2l0eS1jb21tdW5pdGllcy8?oc=5,https://da.gd/CShJvu
GN:S:C,Climate velocities and species tracking in global mountain regions - Nature,https://news.google.com/rss/articles/CBMiMmh0dHBzOi8vd3d3Lm5hdHVyZS5jb20vYXJ0aWNsZXMvczQxNTg2LTAyNC0wNzI2NC050gEA?oc=5,https://da.gd/5U7Yv
GN:S:C,"Climate change is slowing heat waves, prolonging misery - FRANCE 24 English",https://news.google.com/rss/articles/CBMiZWh0dHBzOi8vd3d3LmZyYW5jZTI0LmNvbS9lbi9saXZlLW5ld3MvMjAyNDAzMjktY2xpbWF0ZS1jaGFuZ2UtaXMtc2xvd2luZy1oZWF0LXdhdmVzLXByb2xvbmdpbmctbWlzZXJ50gEA?oc=5,https://da.gd/B3x1ua
GN:S:C,"University Discusses Intolerance, Harassment in 2023 Campus Climate Survey during Town Hall - The Chicago Maroon",https://news.google.com/rss/articles/CBMigAFodHRwczovL2NoaWNhZ29tYXJvb24uY29tLzQxOTU2L25ld3MvdW5pdmVyc2l0eS1kaXNjdXNzZXMtaW50b2xlcmFuY2UtaGFyYXNzbWVudC1pbi0yMDIzLWNhbXB1cy1jbGltYXRlLXN1cnZleS1kdXJpbmctdG93bi1oYWxsL9IBAA?oc=5,https://da.gd/67x8dk
GN:S:C,Mid-Ohio Valley Climate Corner: Water is life - Parkersburg News,https://news.google.com/rss/articles/CBMia2h0dHBzOi8vd3d3Lm5ld3NhbmRzZW50aW5lbC5jb20vb3Bpbmlvbi9sb2NhbC1jb2x1bW5zLzIwMjQvMDMvbWlkLW9oaW8tdmFsbGV5LWNsaW1hdGUtY29ybmVyLXdhdGVyLWlzLWxpZmUv0gEA?oc=5,https://da.gd/zxvK
GN:S:C,Hong Kong start-up nurtures algae as climate-change solution - South China Morning Post,https://news.google.com/rss/articles/CBMiY2h0dHBzOi8vd3d3LnNjbXAuY29tL3Bob3Rvcy9idXNpbmVzcy8zMjU3MjkzL2hvbmcta29uZy1zdGFydC1udXJ0dXJlcy1hbGdhZS1jbGltYXRlLWNoYW5nZS1zb2x1dGlvbtIBAA?oc=5,https://da.gd/MTcEbp
GN:S:C,"Study says climate change has made heat waves last longer, spike hotter, hurt more people - The Bulletin",https://news.google.com/rss/articles/CBMitgFodHRwczovL3d3dy5iZW5kYnVsbGV0aW4uY29tL2NsaW1hdGVfY2hhbmdlZC9zdHVkeS1zYXlzLWNsaW1hdGUtY2hhbmdlLWhhcy1tYWRlLWhlYXQtd2F2ZXMtbGFzdC1sb25nZXItc3Bpa2UtaG90dGVyLWh1cnQtbW9yZS1wZW9wbGUvYXJ0aWNsZV80MjRmZjhjMS04N2JkLTVjOTctYTE4Yi00NzM1MjM5OTU5YjYuaHRtbNIBAA?oc=5,https://da.gd/G3qoI
