feed,title,long_url,short_url
ArXiv:cs,Beyond the Rubric: Cultural Misalignment in LLM Benchmarks for Sexual and Reproductive Health,https://arxiv.org/abs/2511.17554,
ArXiv:cs,SCARE: A Benchmark for SQL Correction and Question Answerability Classification for Reliable EHR Question Answering,https://arxiv.org/abs/2511.17559,
ArXiv:cs,Dynamic Weight Adaptation in Spiking Neural Networks Inspired by Biological Homeostasis,https://arxiv.org/abs/2511.17563,
ArXiv:cs,BrainHGT: A Hierarchical Graph Transformer for Interpretable Brain Network Analysis,https://arxiv.org/abs/2511.17604,
ArXiv:cs,Copula Based Fusion of Clinical and Genomic Machine Learning Risk Scores for Breast Cancer Risk Stratification,https://arxiv.org/abs/2511.17605,
ArXiv:cs,AI-driven Generation of MALDI-TOF MS for Microbial Characterization,https://arxiv.org/abs/2511.17611,
ArXiv:cs,HSMix: Hard and Soft Mixing Data Augmentation for Medical Image Segmentation,https://arxiv.org/abs/2511.17614,
ArXiv:cs,Neurocircuitry-Inspired Hierarchical Graph Causal Attention Networks for Explainable Depression Identification,https://arxiv.org/abs/2511.17622,
ArXiv:cs,Can we use LLMs to bootstrap reinforcement learning? -- A case study in digital health behavior change,https://arxiv.org/abs/2511.17630,
ArXiv:cs,Upstream Probabilistic Meta-Imputation for Multimodal Pediatric Pancreatitis Classification,https://arxiv.org/abs/2511.17635,
ArXiv:cs,Hybrid Neuro-Symbolic Models for Ethical AI in Risk-Sensitive Domains,https://arxiv.org/abs/2511.17644,
ArXiv:cs,Explainable Deep Learning for Brain Tumor Classification: Comprehensive Benchmarking with Dual Interpretability and Lightweight Deployment,https://arxiv.org/abs/2511.17655,
ArXiv:cs,Enhancing Breast Cancer Prediction with LLM-Inferred Confounders,https://arxiv.org/abs/2511.17662,
ArXiv:cs,MedPEFT-CL: Dual-Phase Parameter-Efficient Continual Learning with Medical Semantic Adapter and Bidirectional Memory Consolidation,https://arxiv.org/abs/2511.17668,
ArXiv:cs,Boosting Brain-inspired Path Integration Efficiency via Learning-based Replication of Continuous Attractor Neurodynamics,https://arxiv.org/abs/2511.17687,
ArXiv:cs,AngioDG: Interpretable Channel-informed Feature-modulated Single-source Domain Generalization for Coronary Vessel Segmentation in X-ray Angiography,https://arxiv.org/abs/2511.17724,
ArXiv:cs,Diffusion Models are Molecular Dynamics Simulators,https://arxiv.org/abs/2511.17741,
ArXiv:cs,"See, Plan, Cut: MPC-Based Autonomous Volumetric Robotic Laser Surgery with OCT Guidance",https://arxiv.org/abs/2511.17777,
ArXiv:cs,Data-Driven Predictive Modeling of Microfluidic Cancer Cell Separation Using a Deterministic Lateral Displacement Device,https://arxiv.org/abs/2511.17787,
ArXiv:cs,Pillar-0: A New Frontier for Radiology Foundation Models,https://arxiv.org/abs/2511.17803,
ArXiv:cs,Toward explainable AI approaches for breast imaging: adapting foundation models to diverse populations,https://arxiv.org/abs/2511.17828,
ArXiv:cs,ChemVTS-Bench: Evaluating Visual-Textual-Symbolic Reasoning of Multimodal Large Language Models in Chemistry,https://arxiv.org/abs/2511.17909,
ArXiv:cs,Leveraging Evidence-Guided LLMs to Enhance Trustworthy Depression Diagnosis,https://arxiv.org/abs/2511.17947,
ArXiv:cs,HEAL: Learning-Free Source Free Unsupervised Domain Adaptation for Cross-Modality Medical Image Segmentation,https://arxiv.org/abs/2511.17958,
ArXiv:cs,HyM-UNet: Synergizing Local Texture and Global Context via Hybrid CNN-Mamba Architecture for Medical Image Segmentation,https://arxiv.org/abs/2511.17988,
ArXiv:cs,Reward Engineering for Spatial Epidemic Simulations: A Reinforcement Learning Platform for Individual Behavioral Learning,https://arxiv.org/abs/2511.18000,
ArXiv:cs,Is Complete Labeling Necessary? Understanding Active Learning in Longitudinal Medical Imaging,https://arxiv.org/abs/2511.18007,
ArXiv:cs,Modeling Retinal Ganglion Cells with Neural Differential Equations,https://arxiv.org/abs/2511.18014,
ArXiv:cs,On the stability of event-based control with neuronal dynamics,https://arxiv.org/abs/2511.18015,
ArXiv:cs,"A Lightweight, Interpretable Deep Learning System for Automated Detection of Cervical Adenocarcinoma In Situ (AIS)",https://arxiv.org/abs/2511.18063,
ArXiv:cs,Less Is More: An Explainable AI Framework for Lightweight Malaria Classification,https://arxiv.org/abs/2511.18083,
ArXiv:cs,The Alignment Paradox of Medical Large Language Models in Infertility Care: Decoupling Algorithmic Improvement from Clinical Decision-making Quality,https://arxiv.org/abs/2511.18084,
ArXiv:cs,Early Lung Cancer Diagnosis from Virtual Follow-up LDCT Generation via Correlational Autoencoder and Latent Flow Matching,https://arxiv.org/abs/2511.18185,
ArXiv:cs,Large-Scale Pre-training Enables Multimodal AI Differentiation of Radiation Necrosis from Brain Metastasis Progression on Routine MRI,https://arxiv.org/abs/2511.18208,
ArXiv:cs,Can LLMs Help Allocate Public Health Resources? A Case Study on Childhood Lead Testing,https://arxiv.org/abs/2511.18239,
ArXiv:cs,Developing an AI Course for Synthetic Chemistry Students,https://arxiv.org/abs/2511.18244,
ArXiv:cs,From Archives to Decisions: Multi-Agent Pharmaceutical Co-Scientist for Traceable Drug Discovery and Reverse Translation,https://arxiv.org/abs/2511.18259,
ArXiv:cs,Analyzing and Optimizing the Distribution of Blood Lead Level Testing for Children in New York City: A Data-Driven Approach,https://arxiv.org/abs/2511.18265,
ArXiv:cs,Vision Token Masking Alone Cannot Prevent PHI Leakage in Medical Document OCR: A Systematic Evaluation,https://arxiv.org/abs/2511.18272,
ArXiv:cs,Clinician-Directed Large Language Model Software Generation for Therapeutic Interventions in Physical Rehabilitation,https://arxiv.org/abs/2511.18274,
ArXiv:cs,TRIDENT: A Trimodal Cascade Generative Framework for Drug and RNA-Conditioned Cellular Morphology Synthesis,https://arxiv.org/abs/2511.18287,
ArXiv:cs,AIA-UltraNeRF:Acoustic-Impedance-Aware Neural Radiance Field with Hash Encodings for Robotic Ultrasound Reconstruction and Localization,https://arxiv.org/abs/2511.18293,
ArXiv:cs,MultiDiffNet: A Multi-Objective Diffusion Framework for Generalizable Brain Decoding,https://arxiv.org/abs/2511.18294,
ArXiv:cs,Stro-VIGRU: Defining the Vision Recurrent-Based Baseline Model for Brain Stroke Classification,https://arxiv.org/abs/2511.18316,
ArXiv:cs,General vs Domain-Specific CNNs: Understanding Pretraining Effects on Brain MRI Tumor Classification,https://arxiv.org/abs/2511.18326,
ArXiv:cs,Clinician-in-the-Loop Smart Home System to Detect Urinary Tract Infection Flare-Ups via Uncertainty-Aware Decision Support,https://arxiv.org/abs/2511.18334,
ArXiv:cs,Auxiliary Gene Learning: Spatial Gene Expression Estimation by Auxiliary Gene Selection,https://arxiv.org/abs/2511.18336,
ArXiv:cs,Can a Second-View Image Be a Language? Geometric and Semantic Cross-Modal Reasoning for X-ray Prohibited Item Detection,https://arxiv.org/abs/2511.18385,
ArXiv:cs,Towards Robust and Fair Next Visit Diagnosis Prediction under Noisy Clinical Notes with Large Language Models,https://arxiv.org/abs/2511.18393,
ArXiv:cs,Pre-training Graph Neural Networks on 2D and 3D Molecular Structures by using Multi-View Conditional Information Bottleneck,https://arxiv.org/abs/2511.18404,
ArXiv:cs,NeuroVascU-Net: A Unified Multi-Scale and Cross-Domain Adaptive Feature Fusion U-Net for Precise 3D Segmentation of Brain Vessels in Contrast-Enhanced T1 MRI,https://arxiv.org/abs/2511.18422,
ArXiv:cs,LungX: A Hybrid EfficientNet-Vision Transformer Architecture with Multi-Scale Attention for Accurate Pneumonia Detection,https://arxiv.org/abs/2511.18425,
ArXiv:cs,Radiation-Preserving Selective Imaging for Pediatric Hip Dysplasia: A Cross-Modal Ultrasound-Xray Policy with Limited Labels,https://arxiv.org/abs/2511.18457,
ArXiv:cs,MindEval: Benchmarking Language Models on Multi-turn Mental Health Support,https://arxiv.org/abs/2511.18491,
ArXiv:cs,Introduction and Numerical Validation of an Open-Source MATLAB Package for Quantitative Ultrasound Tomography via Ray-Born Inversion,https://arxiv.org/abs/2511.18511,
ArXiv:cs,HiFi-MambaV2: Hierarchical Shared-Routed MoE for High-Fidelity MRI Reconstruction,https://arxiv.org/abs/2511.18534,
ArXiv:cs,SAMBA: Toward a Long-Context EEG Foundation Model via Spatial Embedding and Differential Mamba,https://arxiv.org/abs/2511.18571,
ArXiv:cs,Stage-Specific Benchmarking of Deep Learning Models for Glioblastoma Follow-Up MRI,https://arxiv.org/abs/2511.18595,
ArXiv:cs,Health system learning achieves generalist neuroimaging models,https://arxiv.org/abs/2511.18640,
ArXiv:cs,From Healthy Scans to Annotated Tumors: A Tumor Fabrication Framework for 3D Brain MRI Synthesis,https://arxiv.org/abs/2511.18654,
ArXiv:cs,MedVision: Dataset and Benchmark for Quantitative Medical Image Analysis,https://arxiv.org/abs/2511.18676,
ArXiv:cs,VLM in a flash: I/O-Efficient Sparsification of Vision-Language Model via Neuron Chunking,https://arxiv.org/abs/2511.18692,
ArXiv:cs,ObjectAlign: Neuro-Symbolic Object Consistency Verification and Correction,https://arxiv.org/abs/2511.18701,
ArXiv:cs,Autonomous Surface Selection For Manipulator-Based UV Disinfection In Hospitals Using Foundation Models,https://arxiv.org/abs/2511.18709,
ArXiv:cs,VAOT: Vessel-Aware Optimal Transport for Retinal Fundus Enhancement,https://arxiv.org/abs/2511.18763,
ArXiv:cs,A Novel Dual-Stream Framework for dMRI Tractography Streamline Classification with Joint dMRI and fMRI Data,https://arxiv.org/abs/2511.18781,
ArXiv:cs,TPG-INR: Target Prior-Guided Implicit 3D CT Reconstruction for Enhanced Sparse-view Imaging,https://arxiv.org/abs/2511.18806,
ArXiv:cs,Towards Characterizing Knowledge Distillation of PPG Heart Rate Estimation Models,https://arxiv.org/abs/2511.18829,
ArXiv:cs,Enhancing Multi-Label Thoracic Disease Diagnosis with Deep Ensemble-Based Uncertainty Quantification,https://arxiv.org/abs/2511.18839,
ArXiv:cs,DualGazeNet: A Biologically Inspired Dual-Gaze Query Network for Salient Object Detection,https://arxiv.org/abs/2511.18865,
ArXiv:cs,Accelerating Reinforcement Learning via Error-Related Human Brain Signals,https://arxiv.org/abs/2511.18878,
ArXiv:cs,MetaDCSeg: Robust Medical Image Segmentation via Meta Dynamic Center Weighting,https://arxiv.org/abs/2511.18894,
ArXiv:cs,Knowledge-based Graphical Method for Safety Signal Detection in Clinical Trials,https://arxiv.org/abs/2511.18937,
ArXiv:cs,Leveraging Adversarial Learning for Pathological Fidelity in Virtual Staining,https://arxiv.org/abs/2511.18946,
ArXiv:cs,CataractCompDetect: Intraoperative Complication Detection in Cataract Surgery,https://arxiv.org/abs/2511.18968,
ArXiv:cs,Zero-shot segmentation of skin tumors in whole-slide images with vision-language foundation models,https://arxiv.org/abs/2511.18978,
ArXiv:cs,Rethinking Plant Disease Diagnosis: Bridging the Academic-Practical Gap with Vision Transformers and Zero-Shot Learning,https://arxiv.org/abs/2511.18989,
ArXiv:cs,MedSAM3: Delving into Segment Anything with Medical Concepts,https://arxiv.org/abs/2511.19046,
ArXiv:cs,Impact Analysis of COVID-19 in Bangladesh Power Sector and Recommendations based on Practical Data and Machine Learning Approach,https://arxiv.org/abs/2511.19070,
ArXiv:cs,DEAP-3DSAM: Decoder Enhanced and Auto Prompt SAM for 3D Medical Image Segmentation,https://arxiv.org/abs/2511.19071,
ArXiv:cs,EEG-VLM: A Hierarchical Vision-Language Model with Multi-Level Feature Alignment and Visually Enhanced Language-Guided Reasoning for EEG Image-Based Sleep Stage Prediction,https://arxiv.org/abs/2511.19155,
ArXiv:cs,BioArtlas: Computational Clustering of Multi-Dimensional Complexity in Bioart,https://arxiv.org/abs/2511.19162,
ArXiv:cs,nnActive: A Framework for Evaluation of Active Learning in 3D Biomedical Segmentation,https://arxiv.org/abs/2511.19183,
ArXiv:cs,Three-Dimensional Anatomical Data Generation Based on Artificial Neural Networks,https://arxiv.org/abs/2511.19198,
ArXiv:cs,Are Large Vision Language Models Truly Grounded in Medical Images? Evidence from Italian Clinical Visual Question Answering,https://arxiv.org/abs/2511.19220,
ArXiv:cs,Medusa: Cross-Modal Transferable Adversarial Attacks on Multimodal Medical Retrieval-Augmented Generation,https://arxiv.org/abs/2511.19257,
ArXiv:cs,A Nutrition Multimodal Photoplethysmography Language Model,https://arxiv.org/abs/2511.19260,
ArXiv:cs,Interpreting GFlowNets for Drug Discovery: Extracting Actionable Insights for Medicinal Chemistry,https://arxiv.org/abs/2511.19264,
ArXiv:cs,Open-weight genome language model safeguards: Assessing robustness via adversarial fine-tuning,https://arxiv.org/abs/2511.19299,
ArXiv:cs,Human-AI Teaming Under Deception: An Implicit BCI Safeguards Drone Team Performance in Virtual Reality,https://arxiv.org/abs/2511.19312,
ArXiv:cs,Design and Validation of a Modular Smart Headband with Embroidered Electrodes for Comfortable EEG Monitoring,https://arxiv.org/abs/2511.19348,
ArXiv:cs,"CellFMCount: A Fluorescence Microscopy Dataset, Benchmark, and Methods for Cell Counting",https://arxiv.org/abs/2511.19351,
ArXiv:cs,An Anatomy Aware Hybrid Deep Learning Framework for Lung Cancer Tumor Stage Classification,https://arxiv.org/abs/2511.19367,
ArXiv:cs,BackSplit: The Importance of Sub-dividing the Background in Biomedical Lesion Segmentation,https://arxiv.org/abs/2511.19394,
ArXiv:cs,"SAM3-Adapter: Efficient Adaptation of Segment Anything 3 for Camouflage Object Segmentation, Shadow Detection, and Medical Image Segmentation",https://arxiv.org/abs/2511.19425,
ArXiv:cs,SYNAPSE: Synergizing an Adapter and Finetuning for High-Fidelity EEG Synthesis from a CLIP-Aligned Encoder,https://arxiv.org/abs/2511.17547,
ArXiv:cs,TeamPath: Building MultiModal Pathology Experts with Reasoning AI Copilots,https://arxiv.org/abs/2511.17652,
ArXiv:cs,Predicting Healthcare Provider Engagement in SMS Campaigns,https://arxiv.org/abs/2511.17658,
ArXiv:cs,Dual-Path Knowledge-Augmented Contrastive Alignment Network for Spatially Resolved Transcriptomics,https://arxiv.org/abs/2511.17685,
ArXiv:cs,Robust Detection of Retinal Neovascularization in Widefield Optical Coherence Tomography,https://arxiv.org/abs/2511.17744,
ArXiv:cs,$\Delta$-ML Ensembles for Selecting Quantum Chemistry Methods to Compute Intermolecular Interactions,https://arxiv.org/abs/2511.17753,
ArXiv:cs,Canalization as a stabilizing principle of gene regulatory networks: a discrete dynamical systems perspective,https://arxiv.org/abs/2511.17905,
ArXiv:cs,Hierarchical biomarker thresholding: a model-agnostic framework for stability,https://arxiv.org/abs/2511.18030,
ArXiv:cs,"On a Reinforcement Learning Methodology for Epidemic Control, with application to COVID-19",https://arxiv.org/abs/2511.18035,
ArXiv:cs,MEDIC: a network for monitoring data quality in collider experiments,https://arxiv.org/abs/2511.18172,
ArXiv:cs,Linear Algebraic Approaches to Neuroimaging Data Compression: A Comparative Analysis of Matrix and Tensor Decomposition Methods for High-Dimensional Medical Images,https://arxiv.org/abs/2511.18197,
ArXiv:cs,Improving Forecasts of Suicide Attempts for Patients with Little Data,https://arxiv.org/abs/2511.18199,
ArXiv:cs,The Mixed Birth-death/death-Birth Moran Process,https://arxiv.org/abs/2511.18252,
ArXiv:cs,Brain-MGF: Multimodal Graph Fusion Network for EEG-fMRI Brain Connectivity Analysis Under Psilocybin,https://arxiv.org/abs/2511.18325,
ArXiv:cs,Shape-Adapting Gated Experts: Dynamic Expert Routing for Colonoscopic Lesion Segmentation,https://arxiv.org/abs/2511.18493,
ArXiv:cs,On the Appropriateness of Linear Stress Recovery in Biomechanical Analysis of Abdominal Aortic Aneurysm,https://arxiv.org/abs/2511.18741,
ArXiv:cs,Torsion-Space Diffusion for Protein Backbone Generation with Geometric Refinement,https://arxiv.org/abs/2511.19184,
ArXiv:cs,Beyond Protein Language Models: An Agentic LLM Framework for Mechanistic Enzyme Design,https://arxiv.org/abs/2511.19423,
ArXiv:cs,Prediction of Clinical Complication Onset using Neural Point Processes,https://arxiv.org/abs/2502.13290,
ArXiv:cs,Unsupervised and Source-Free Ranking of Biomedical Segmentation Models,https://arxiv.org/abs/2503.00450,
ArXiv:cs,How does Alignment Enhance LLMs' Multilingual Capabilities? A Language Neurons Perspective,https://arxiv.org/abs/2505.21505,
ArXiv:cs,"BioDisco: Multi-agent hypothesis generation with dual-mode evidence, iterative feedback and temporal evaluation",https://arxiv.org/abs/2508.01285,
ArXiv:cs,Automatic nodule identification and differentiation in ultrasound videos to facilitate per-nodule examination,https://arxiv.org/abs/2310.06339,
