feed,title,long_url,short_url
GN:T:AI,Str4ngeThing AI Generated Nike Outfits - HYPEBEAST,https://hypebeast.com/2022/10/str4ngething-ai-generated-nike-outfits-info,https://bit.ly/3gVOlUg
GN:T:AI,How an A.I. chatbot is helping Genpact retain employees and predict attrition: ‘Someone who responds to it is two times as likely to stay with the organization’ - Fortune,https://fortune.com/2022/10/28/artificial-intelligence-chatbot-predict-attrition-retain-employees/,https://bit.ly/3NgZQ4r
GN:T:AI,High-reliability wearable computer for artificial intelligence (AI) uses introduced by General Micro Systems - Military & Aerospace Electronics,https://www.militaryaerospace.com/computers/article/14284882/wearable-computer-artificial-intelligence-ai,https://bit.ly/3sCr0JR
GN:T:AI,"Graphene metamaterial, AI shrink spectrometer chip ... - eeNews Europe",https://www.eenewseurope.com/en/graphene-metamaterial-ai-shrink-spectrometer-chip/,https://bit.ly/3zovfMG
GN:T:AI,Solving First-Party Audience Expansion Using AI - MarTech Series,https://martechseries.com/mts-insights/guest-authors/solving-first-party-audience-expansion-using-ai/,https://bit.ly/3zovfwa
