feed,title,long_url,short_url
GN:S:C,The oceans just reached their hottest temperature on record as El Niño looms. Here are 6 things to watch for - CNN,https://news.google.com/rss/articles/CBMiWGh0dHBzOi8vd3d3LmNubi5jb20vMjAyMy8wNC8wMS93b3JsZC9lbC1uaW5vLWZvcmVjYXN0LXdlYXRoZXItY2xpbWF0ZS1pbXBhY3RzL2luZGV4Lmh0bWzSAVxodHRwczovL2FtcC5jbm4uY29tL2Nubi8yMDIzLzA0LzAxL3dvcmxkL2VsLW5pbm8tZm9yZWNhc3Qtd2VhdGhlci1jbGltYXRlLWltcGFjdHMvaW5kZXguaHRtbA?oc=5,https://da.gd/Z70x
GN:S:C,Current Climate: Pope Francis' Charge To Create A Sustainable Economy - Forbes,https://news.google.com/rss/articles/CBMieGh0dHBzOi8vd3d3LmZvcmJlcy5jb20vc2l0ZXMvYWxhbm9obnNtYW4vMjAyMy8wNC8wMS9jdXJyZW50LWNsaW1hdGUtcG9wZS1mcmFuY2lzLWNoYXJnZS10by1jcmVhdGUtYS1zdXN0YWluYWJsZS1lY29ub215L9IBAA?oc=5,https://da.gd/yTkTc
GN:S:C,"Washington, DC's Cherry Blooms Draw Crowds—and Climate ... - WIRED",https://news.google.com/rss/articles/CBMiUmh0dHBzOi8vd3d3LndpcmVkLmNvbS9zdG9yeS93YXNoaW5ndG9uLWNoZXJyeS1ibG9zc29tLWVhcmx5LXNwcmluZy1jbGltYXRlLWNoYW5nZS_SAQA?oc=5,https://da.gd/JXvQcX
GN:S:C,Climate graphic of the week: flood risk replaces drought across ... - Financial Times,https://news.google.com/rss/articles/CBMiP2h0dHBzOi8vd3d3LmZ0LmNvbS9jb250ZW50LzA2MDgzZjE5LTgzMzUtNGZmYi1hNDcyLWEzMDk1ZTdlYTExNNIBAA?oc=5,https://da.gd/rxasf
GN:S:C,Weather whiplash: How climate change killed thousands of ... - Salon,https://news.google.com/rss/articles/CBMiamh0dHBzOi8vd3d3LnNhbG9uLmNvbS8yMDIzLzA0LzAxL3dlYXRoZXItd2hpcGxhc2gtaG93LWNsaW1hdGUtY2hhbmdlLXRob3VzYW5kcy1vZi1taWdyYXRvcnktYmlyZHNfcGFydG5lci_SAQA?oc=5,https://da.gd/9sfu6D
