feed,title,long_url,short_url
ArXiv:cs,Localizing Anatomical Landmarks in Ocular Images using Zoom-In Attentive Networks,https://arxiv.org/abs/2210.02445v1,
ArXiv:cs,Token Classification for Disambiguating Medical Abbreviations,https://arxiv.org/abs/2210.02487v1,
ArXiv:cs,Analyzing historical diagnosis code data from NIH N3C and RECOVER Programs using deep learning to determine risk factors for Long Covid,https://arxiv.org/abs/2210.02490v1,
ArXiv:cs,Dual-Domain Cross-Iteration Squeeze-Excitation Network for Sparse Reconstruction of Brain MRI,https://arxiv.org/abs/2210.02523v1,
ArXiv:cs,Toward Knowledge-Driven Speech-Based Models of Depression: Leveraging Spectrotemporal Variations in Speech Vowels,https://arxiv.org/abs/2210.02527v1,
ArXiv:cs,Deep learning for ECoG brain-computer interface: end-to-end vs. hand-crafted features,https://arxiv.org/abs/2210.02544v1,
ArXiv:cs,MechRetro is a chemical-mechanism-driven graph learning framework for interpretable retrosynthesis prediction and pathway planning,https://arxiv.org/abs/2210.02630v1,
ArXiv:cs,Learning functional sections in medical conversations: iterative pseudo-labeling and human-in-the-loop approach,https://arxiv.org/abs/2210.02658v1,
ArXiv:cs,hyperbox-brain: A Toolbox for Hyperbox-based Machine Learning Algorithms,https://arxiv.org/abs/2210.02704v1,
ArXiv:cs,Continuous Diagnosis and Prognosis by Controlling the Update Process of Deep Neural Networks,https://arxiv.org/abs/2210.02719v1,
ArXiv:cs,Parameter estimation tools for cardiovascular flow modeling of fetal circulation,https://arxiv.org/abs/2210.02726v1,
ArXiv:cs,Few-shot Generation of Personalized Neural Surrogates for Cardiac Simulation via Bayesian Meta-Learning,https://arxiv.org/abs/2210.02967v1,
ArXiv:cs,"COVID-19 Detection Using Segmentation, Region Extraction and Classification Pipeline",https://arxiv.org/abs/2210.02992v1,
ArXiv:cs,A Novel Attention Mechanism Using Anatomical Prior Probability Maps for Thoracic Disease Classification from X-Ray Images,https://arxiv.org/abs/2210.02998v1,
ArXiv:cs,Fast and robust parameter estimation with uncertainty quantification for the cardiac function,https://arxiv.org/abs/2210.03012v1,
ArXiv:cs,LODUS: A Multi-Level Framework for Simulating Environment and Population -- A Contagion Experiment on a Pandemic World,https://arxiv.org/abs/2210.03060v1,
ArXiv:cs,Fair and Optimal Cohort Selection for Linear Utilities,https://arxiv.org/abs/2102.07684v3,
ArXiv:cs,BERN2: an advanced neural biomedical named entity recognition and normalization tool,https://arxiv.org/abs/2201.02080v3,
ArXiv:cs,Mutual information neural estimation for unsupervised multi-modal registration of brain images,https://arxiv.org/abs/2201.10305v2,
ArXiv:cs,Truth Serum: Poisoning Machine Learning Models to Reveal Their Secrets,https://arxiv.org/abs/2204.00032v2,
ArXiv:cs,Real-Time Gait Phase and Task Estimation for Controlling a Powered Ankle Exoskeleton on Extremely Uneven Terrain,https://arxiv.org/abs/2205.00155v3,
ArXiv:cs,So3krates: Equivariant attention for interactions on arbitrary length-scales in molecular systems,https://arxiv.org/abs/2205.14276v2,
ArXiv:cs,Opportunistic hip fracture risk prediction in Men from X-ray: Findings from the Osteoporosis in Men (MrOS) Study,https://arxiv.org/abs/2207.10970v2,
ArXiv:cs,A Hybrid Deep Feature-Based Deformable Image Registration Method for Pathological Images,https://arxiv.org/abs/2208.07655v3,
ArXiv:cs,Biological connectomes as a representation for the architecture of artificial neural networks,https://arxiv.org/abs/2209.14406v2,
ArXiv:cs,Bounded Future MS-TCN++ for surgical gesture recognition,https://arxiv.org/abs/2209.14647v2,
