feed,title,long_url,short_url
GN:T:ML,"AI is at an inflection point, Fei-Fei Li says - MIT Technology Review",https://news.google.com/rss/articles/CBMiYWh0dHBzOi8vd3d3LnRlY2hub2xvZ3lyZXZpZXcuY29tLzIwMjMvMTEvMTQvMTA4MzM1Mi9haS1pcy1hdC1hbi1pbmZsZWN0aW9uLXBvaW50LWZlaS1mZWktbGktc2F5cy_SAWVodHRwczovL3d3dy50ZWNobm9sb2d5cmV2aWV3LmNvbS8yMDIzLzExLzE0LzEwODMzNTIvYWktaXMtYXQtYW4taW5mbGVjdGlvbi1wb2ludC1mZWktZmVpLWxpLXNheXMvYW1wLw?oc=5,https://da.gd/6F4VQd
GN:T:ML,A New Research Paper Introduces a Machine-Learning Tool that can Easily Spot when Chemistry Papers are Written Using the Chatbot ChatGPT - MarkTechPost,https://news.google.com/rss/articles/CBMisQFodHRwczovL3d3dy5tYXJrdGVjaHBvc3QuY29tLzIwMjMvMTEvMTQvYS1uZXctcmVzZWFyY2gtcGFwZXItaW50cm9kdWNlcy1hLW1hY2hpbmUtbGVhcm5pbmctdG9vbC10aGF0LWNhbi1lYXNpbHktc3BvdC13aGVuLWNoZW1pc3RyeS1wYXBlcnMtYXJlLXdyaXR0ZW4tdXNpbmctdGhlLWNoYXRib3QtY2hhdGdwdC_SAQA?oc=5,https://da.gd/9HfE6
GN:T:ML,7 Steps to Running a Small Language Model on a Local CPU - KDnuggets,https://news.google.com/rss/articles/CBMitgFodHRwczovL3d3dy5rZG51Z2dldHMuY29tLzctc3RlcHMtdG8tcnVubmluZy1hLXNtYWxsLWxhbmd1YWdlLW1vZGVsLW9uLWEtbG9jYWwtY3B1P3V0bV9zb3VyY2U9cnNzJnV0bV9tZWRpdW09cnNzJnV0bV9jYW1wYWlnbj03LXN0ZXBzLXRvLXJ1bm5pbmctYS1zbWFsbC1sYW5ndWFnZS1tb2RlbC1vbi1hLWxvY2FsLWNwddIBAA?oc=5,https://da.gd/654OKs
GN:T:ML,See what machine learning can do for nano and biomaterial characterizations on SelectScience - SelectScience,https://news.google.com/rss/articles/CBMigQFodHRwczovL3d3dy5zZWxlY3RzY2llbmNlLm5ldC93ZWJpbmFycy9zZWUtd2hhdC1tYWNoaW5lLWxlYXJuaW5nLWNhbi1kby1mb3ItbmFuby1hbmQtYmlvbWF0ZXJpYWwtY2hhcmFjdGVyaXphdGlvbnM_V2ViaW5hcklEPTIxNTbSAQA?oc=5,https://da.gd/cOk05c
GN:T:ML,Unboxing machine learning models for concrete strength prediction using XAI | Scientific Reports - Nature,https://news.google.com/rss/articles/CBMiMmh0dHBzOi8vd3d3Lm5hdHVyZS5jb20vYXJ0aWNsZXMvczQxNTk4LTAyMy00NzE2OS030gEA?oc=5,https://da.gd/mhkYi
GN:T:ML,Pioneering AI Innovation From Rws Offers Near Human-Quality Translation - AiThority,https://news.google.com/rss/articles/CBMib2h0dHBzOi8vYWl0aG9yaXR5LmNvbS9tYWNoaW5lLWxlYXJuaW5nL3Bpb25lZXJpbmctYWktaW5ub3ZhdGlvbi1mcm9tLXJ3cy1vZmZlcnMtbmVhci1odW1hbi1xdWFsaXR5LXRyYW5zbGF0aW9uL9IBAA?oc=5,https://da.gd/tUdz
