feed,title,long_url,short_url
GN:T:CC,Scottish leader faces battle for survival after ending power-sharing deal over climate change clash - Fox News,https://news.google.com/rss/articles/CBMicmh0dHBzOi8vd3d3LmZveG5ld3MuY29tL3dvcmxkL3Njb3R0aXNoLWxlYWRlci1mYWNlcy1iYXR0bGUtc3Vydml2YWwtZW5kaW5nLXBvd2VyLXNoYXJpbmctZGVhbC1jbGltYXRlLWNoYW5nZS1jbGFzaNIBdmh0dHBzOi8vd3d3LmZveG5ld3MuY29tL3dvcmxkL3Njb3R0aXNoLWxlYWRlci1mYWNlcy1iYXR0bGUtc3Vydml2YWwtZW5kaW5nLXBvd2VyLXNoYXJpbmctZGVhbC1jbGltYXRlLWNoYW5nZS1jbGFzaC5hbXA?oc=5,https://da.gd/vt1a3
GN:T:CC,Ash Regan: Humza Yousaf's defeated leadership rival could hold the key to his political fate - Sky News,https://news.google.com/rss/articles/CBMifmh0dHBzOi8vbmV3cy5za3kuY29tL3N0b3J5L2FzaC1yZWdhbi1odW16YS15b3VzYWZzLWRlZmVhdGVkLWxlYWRlcnNoaXAtcml2YWwtY291bGQtaG9sZC10aGUta2V5LXRvLWhpcy1wb2xpdGljYWwtZmF0ZS0xMzEyMjk4NNIBhgFodHRwczovL25ld3Muc2t5LmNvbS9zdG9yeS9hbXAvYXNoLXJlZ2FuLWh1bXphLXlvdXNhZnMtZGVmZWF0ZWQtbGVhZGVyc2hpcC1yaXZhbC1jb3VsZC1ub3ctaG9sZC10aGUta2V5LXRvLWhpcy1wb2xpdGljYWwtZmF0ZS0xMzEyMjk4NA?oc=5,https://da.gd/1qgGve
GN:T:CC,NOAA Billion-Dollar Weather Disasters Are Not Evidence of Climate Change - Reason,https://news.google.com/rss/articles/CBMiZ2h0dHBzOi8vcmVhc29uLmNvbS8yMDI0LzA0LzI1L25vYWEtYmlsbGlvbi1kb2xsYXItd2VhdGhlci1kaXNhc3RlcnMtYXJlLW5vdC1ldmlkZW5jZS1vZi1jbGltYXRlLWNoYW5nZS_SAQA?oc=5,https://da.gd/MJawUK
GN:T:CC,Biden's newest climate rule takes an aggressive swing at coal power plants - POLITICO - POLITICO,https://news.google.com/rss/articles/CBMiSmh0dHBzOi8vd3d3LnBvbGl0aWNvLmNvbS9uZXdzLzIwMjQvMDQvMjUvYmlkZW4tY2xpbWF0ZS1jb2FsLXBvd2VyLTAwMTU0MjI50gEA?oc=5,https://da.gd/gat3
GN:T:CC,"LGBT couples at heightened risk from climate change, study from liberal law school claims - Yahoo! Voices",https://news.google.com/rss/articles/CBMiTmh0dHBzOi8vd3d3LnlhaG9vLmNvbS9uZXdzL2xnYnQtY291cGxlcy1oZWlnaHRlbmVkLXJpc2stY2xpbWF0ZS0xODA2MDA5NDAuaHRtbNIBAA?oc=5,https://da.gd/AcPAnc
GN:T:CC,How Temperate Forests Could Help Limit Climate Change - Scientific American,https://news.google.com/rss/articles/CBMiYWh0dHBzOi8vd3d3LnNjaWVudGlmaWNhbWVyaWNhbi5jb20vYXJ0aWNsZS9ob3ctdGVtcGVyYXRlLWZvcmVzdHMtY291bGQtaGVscC1saW1pdC1jbGltYXRlLWNoYW5nZS_SAQA?oc=5,https://da.gd/hWGh
GN:T:CC,German minister calls on 'superrich' to pay for climate - DW (English),https://news.google.com/rss/articles/CBMiVmh0dHBzOi8vd3d3LmR3LmNvbS9lbi9nZXJtYW4tbWluaXN0ZXItY2FsbHMtb24tc3VwZXJyaWNoLXRvLXBheS1mb3ItY2xpbWF0ZS9hLTY4OTE2NTAw0gFWaHR0cHM6Ly9hbXAuZHcuY29tL2VuL2dlcm1hbi1taW5pc3Rlci1jYWxscy1vbi1zdXBlcnJpY2gtdG8tcGF5LWZvci1jbGltYXRlL2EtNjg5MTY1MDA?oc=5,https://da.gd/OAgSr
