feed,title,long_url,short_url
j.mp/lc-ml-reviews#recap,Formalising the Foundations of Discrete Reinforcement Learning in Isabelle/HOL (2021),https://arxiv.org/abs/2112.05996,
j.mp/lc-ml-reviews#recap,"A Review for Deep Reinforcement Learning in Atari:Benchmarks, Challenges, and Solutions (2021)",https://arxiv.org/abs/2112.04145,
j.mp/lc-ml-reviews#recap,Recent Advances in Reinforcement Learning in Finance (2021),https://arxiv.org/abs/2112.04553,
j.mp/lc-ml-reviews#recap,ShinRL: A Library for Evaluating RL Algorithms from Theoretical and Practical Perspectives (2021),https://arxiv.org/abs/2112.04123,
j.mp/lc-ml-reviews#recap,Towards Intrinsic Interactive Reinforcement Learning: A Survey (2021),https://arxiv.org/abs/2112.01575,
