feed,title,long_url,short_url
ArXiv,Factor Representation and Decision Making in Stock Markets Using Deep Reinforcement Learning,https://arxiv.org/abs/2108.01758v1,
ArXiv,Offline Decentralized Multi-Agent Reinforcement Learning,https://arxiv.org/abs/2108.01832v1,
ArXiv,Learning Barrier Certificates: Towards Safe Reinforcement Learning with Zero Training-time Violations,https://arxiv.org/abs/2108.01846v1,
ArXiv,High Performance Across Two Atari Paddle Games Using the Same Perceptual Control Architecture Without Training,https://arxiv.org/abs/2108.01895v1,
ArXiv,Safe Reinforcement Learning with Natural Language Constraints,https://arxiv.org/abs/2010.05150v2,
ArXiv,Scalable Reinforcement Learning Policies for Multi-Agent Control,https://arxiv.org/abs/2011.08055v3,
ArXiv,Auto-Pipeline: Synthesizing Complex Data Pipelines By-Target Using Reinforcement Learning and Search,https://arxiv.org/abs/2106.13861v2,
