feed,title,long_url,short_url
j:MDPI:A,Recent Progress in Discovering the Role of Carotenoids and Metabolites in Prostatic Physiology and Pathology—A Review—Part II: Carotenoids in the Human Studies,https://mdpi.com/2076-3921/10/2/319,
j:MDPI:A,xCT-Driven Expression of GPX4 Determines Sensitivity of Breast Cancer Cells to Ferroptosis Inducers,https://mdpi.com/2076-3921/10/2/317,
j:MDPI:A,Health Potential of Aloe vera against Oxidative Stress Induced Corneal Damage: An “In Vitro” Study,https://mdpi.com/2076-3921/10/2/318,
j:MDPI:A,Health Benefits of Antioxidative Peptides Derived from Legume Proteins with a High Amino Acid Score,https://mdpi.com/2076-3921/10/2/316,
j:MDPI:A,Frataxins Emerge as New Players of the Intracellular Antioxidant Machinery,https://mdpi.com/2076-3921/10/2/315,
j:MDPI:A,Mitochondrial Oxidative and Nitrosative Stress as a Therapeutic Target in Diseases,https://mdpi.com/2076-3921/10/2/314,
