feed,title,long_url,short_url
GN:T:ML,Shimano Files Patent Detailing Machine Learning for Automatic Suspension Control - Pinkbike,https://news.google.com/rss/articles/CBMic2h0dHBzOi8vd3d3LnBpbmtiaWtlLmNvbS9uZXdzL3NoaW1hbm8tZmlsZXMtcGF0ZW50LWRldGFpbGluZy1tYWNoaW5lLWxlYXJuaW5nLWZvci1hdXRvbWF0aWMtc3VzcGVuc2lvbi1jb250cm9sLmh0bWzSAQA?oc=5,https://da.gd/8RDiU
GN:T:ML,There are holes in Europe's AI Act — and researchers can help to fill them - Nature,https://news.google.com/rss/articles/CBMiMmh0dHBzOi8vd3d3Lm5hdHVyZS5jb20vYXJ0aWNsZXMvZDQxNTg2LTAyNC0wMDAyOS000gEA?oc=5,https://da.gd/RGmkeG
GN:T:ML,Artificial Intelligence in Genetics | Article - Cureus,https://news.google.com/rss/articles/CBMiSmh0dHBzOi8vd3d3LmN1cmV1cy5jb20vYXJ0aWNsZXMvMTc3MzIwLWFydGlmaWNpYWwtaW50ZWxsaWdlbmNlLWluLWdlbmV0aWNz0gEA?oc=5,https://da.gd/QOiEGy
GN:T:ML,Meet MosaicBERT: A BERT-Style Encoder Architecture and Training Recipe that is Empirically Optimized for Fast Pretraining - MarkTechPost,https://news.google.com/rss/articles/CBMioQFodHRwczovL3d3dy5tYXJrdGVjaHBvc3QuY29tLzIwMjQvMDEvMTAvbWVldC1tb3NhaWNiZXJ0LWEtYmVydC1zdHlsZS1lbmNvZGVyLWFyY2hpdGVjdHVyZS1hbmQtdHJhaW5pbmctcmVjaXBlLXRoYXQtaXMtZW1waXJpY2FsbHktb3B0aW1pemVkLWZvci1mYXN0LXByZXRyYWluaW5nL9IBpQFodHRwczovL3d3dy5tYXJrdGVjaHBvc3QuY29tLzIwMjQvMDEvMTAvbWVldC1tb3NhaWNiZXJ0LWEtYmVydC1zdHlsZS1lbmNvZGVyLWFyY2hpdGVjdHVyZS1hbmQtdHJhaW5pbmctcmVjaXBlLXRoYXQtaXMtZW1waXJpY2FsbHktb3B0aW1pemVkLWZvci1mYXN0LXByZXRyYWluaW5nLz9hbXA?oc=5,https://da.gd/qs5p
GN:T:ML,Machine Learning Models and Innovative Technology: Predicting and Tackling Freezing of Gait in Parkinson's Disease - Medriva,https://news.google.com/rss/articles/CBMijAFodHRwczovL21lZHJpdmEuY29tL2hlYWx0aC9tYWNoaW5lLWxlYXJuaW5nLW1vZGVscy1hbmQtaW5ub3ZhdGl2ZS10ZWNobm9sb2d5LXByZWRpY3RpbmctYW5kLXRhY2tsaW5nLWZyZWV6aW5nLW9mLWdhaXQtaW4tcGFya2luc29ucy1kaXNlYXNlL9IBAA?oc=5,https://da.gd/VU79u
