feed,title,long_url,short_url
ArXiv:cs,A Classical-Quantum Convolutional Neural Network for Detecting Pneumonia from Chest Radiographs,https://arxiv.org/abs/2202.10452v1,
ArXiv:cs,"Feasibility Study of Multi-Site Split Learning for Privacy-Preserving Medical Systems under Data Imbalance Constraints in COVID-19, X-Ray, and Cholesterol Dataset",https://arxiv.org/abs/2202.10456v1,
ArXiv:cs,Demand and Price Fluctuations Effect on Risk and Profit of Single and Clustered Microgrids during COVID-19 Pandemic,https://arxiv.org/abs/2202.10494v1,
ArXiv:cs,Analysing Security and Privacy Threats in the Lockdown Periods of COVID-19 Pandemic: Twitter Dataset Case Study,https://arxiv.org/abs/2202.10543v1,
ArXiv:cs,Guidelines and evaluation for clinical explainable AI on medical image analysis,https://arxiv.org/abs/2202.10553v1,
ArXiv:cs,Characterizing Error in Noncommutative Geometric Gait Analysis,https://arxiv.org/abs/2202.10575v1,
ArXiv:cs,Benchmarking missing-values approaches for predictive models on health databases,https://arxiv.org/abs/2202.10580v1,
ArXiv:cs,Knowledge-informed Molecular Learning: A Survey on Paradigm Transfer,https://arxiv.org/abs/2202.10587v1,
ArXiv:cs,A Two-Branch Neural Network for Gait Recognition,https://arxiv.org/abs/2202.10645v1,
ArXiv:cs,An Object Aware Hybrid U-Net for Breast Tumour Annotation,https://arxiv.org/abs/2202.10691v1,
ArXiv:cs,Ensembling Handcrafted Features with Deep Features: An Analytical Study for Classification of Routine Colon Cancer Histopathological Nuclei Images,https://arxiv.org/abs/2202.10694v1,
ArXiv:cs,Bag of Visual Words (BoVW) with Deep Features -- Patch Classification Model for Limited Dataset of Breast Tumours,https://arxiv.org/abs/2202.10701v1,
ArXiv:cs,Feature reconstruction from incomplete tomographic data without detour,https://arxiv.org/abs/2202.10724v1,
ArXiv:cs,Continuous Speech for Improved Learning Pathological Voice Disorders,https://arxiv.org/abs/2202.10777v1,
ArXiv:cs,A passive admittance controller to enforce Remote Center of Motion and Tool Spatial constraints with application in hands-on surgical procedures,https://arxiv.org/abs/2202.10783v1,
ArXiv:cs,UncertaINR: Uncertainty Quantification of End-to-End Implicit Neural Representations for Computed Tomography,https://arxiv.org/abs/2202.10847v1,
ArXiv:cs,Data-Consistent Local Superresolution for Medical Imaging,https://arxiv.org/abs/2202.10875v1,
ArXiv:cs,Subtyping brain diseases from imaging data,https://arxiv.org/abs/2202.10945v1,
ArXiv:cs,Assessing the influence of French vaccine critics during the two first years of the COVID-19 pandemic,https://arxiv.org/abs/2202.10952v1,
ArXiv:cs,Improving Classification Model Performance on Chest X-Rays through Lung Segmentation,https://arxiv.org/abs/2202.10971v1,
ArXiv:cs,Organ Shape Sensing using Pneumatically Attachable Flexible Rails in Robotic-Assisted Laparoscopic Surgery,https://arxiv.org/abs/2202.10977v1,
ArXiv:cs,Tracking perovskite crystallization via deep learning-based feature detection on 2D X-ray scattering data,https://arxiv.org/abs/2202.10983v1,
ArXiv:cs,Temporal Subtyping of Alzheimer's Disease Using Medical Conditions Preceding Alzheimer's Disease Onset in Electronic Health Records,https://arxiv.org/abs/2202.10991v1,
ArXiv:cs,Multi-Objective Dual Simplex-Mesh Based Deformable Image Registration for 3D Medical Images -- Proof of Concept,https://arxiv.org/abs/2202.11001v1,
ArXiv:cs,Constrained Visual-Inertial Localization With Application And Benchmark in Laparoscopic Surgery,https://arxiv.org/abs/2202.11075v1,
ArXiv:cs,Counterfactual Phenotyping with Censored Time-to-Events,https://arxiv.org/abs/2202.11089v1,
ArXiv:cs,Pyramid Convolutional RNN for MRI Image Reconstruction,https://arxiv.org/abs/1912.00543v7,
ArXiv:cs,An adaptive neuro-fuzzy model for attitude estimation and 2 control a 3 DOF system,https://arxiv.org/abs/2004.09756v3,
ArXiv:cs,Analyzing the Impact of Covid-19 Control Policies on Campus Occupancy and Mobility via Passive WiFi Sensing,https://arxiv.org/abs/2005.12050v5,
ArXiv:cs,Towards to Robust and Generalized Medical Image Segmentation Framework,https://arxiv.org/abs/2108.03823v4,
ArXiv:cs,A Glioblastoma PDE-ODE model including chemotaxis and vasculature,https://arxiv.org/abs/2109.14322v2,
ArXiv:cs,RGB Camera-based Physiological Sensing: Challenges and Future Directions,https://arxiv.org/abs/2110.13362v2,
ArXiv:cs,Structure-Preserving Graph Kernel for Brain Network Classification,https://arxiv.org/abs/2111.10803v2,
ArXiv:cs,Multi-modal unsupervised brain image registration using edge maps,https://arxiv.org/abs/2202.04647v2,
ArXiv:cs,SAGE: SLAM with Appearance and Geometry Prior for Endoscopy,https://arxiv.org/abs/2202.09487v2,
ArXiv:cs,Synthetic CT Skull Generation for Transcranial MR Imaging-Guided Focused Ultrasound Interventions with Conditional Adversarial Networks,https://arxiv.org/abs/2202.10136v2,
