feed,title,long_url,short_url
GN:T:AI,The antithesis of the Olympics: Using AI to write a fan letter - NPR,https://news.google.com/rss/articles/CBMiQmh0dHBzOi8vd3d3Lm5wci5vcmcvMjAyNC8wNy8zMC9ueC1zMS01MDU2MjAxL2dvb2dsZS1vbHltcGljcy1haS1hZNIBAA?oc=5,https://da.gd/TVKoYk
GN:T:AI,We just learned something surprising about how Apple Intelligence was trained - Yahoo! Voices,https://news.google.com/rss/articles/CBMiUWh0dHBzOi8vd3d3LnlhaG9vLmNvbS90ZWNoL2p1c3QtbGVhcm5lZC1zb21ldGhpbmctc3VycHJpc2luZy1hcHBsZS0xODA2NTQzNzkuaHRtbNIBAA?oc=5,https://da.gd/XEV6E4
GN:T:AI,See Apple Intelligence in Action - MacRumors,https://news.google.com/rss/articles/CBMiQWh0dHBzOi8vd3d3Lm1hY3J1bW9ycy5jb20vMjAyNC8wNy8zMC9hcHBsZS1pbnRlbGxpZ2VuY2UtaGFuZHMtb24v0gEA?oc=5,https://da.gd/I8LJ
GN:T:AI,"How to use Google Photos AI editing tools, now available to everyone - The Keyword | Google Product and Technology News",https://news.google.com/rss/articles/CBMiSmh0dHBzOi8vYmxvZy5nb29nbGUvcHJvZHVjdHMvcGhvdG9zL2dvb2dsZS1haS1waG90by1lZGl0aW5nLWZlYXR1cmVzLXRpcHMv0gEA?oc=5,https://da.gd/XHhi2Y
GN:T:AI,AI is complicating plagiarism. How should scientists respond? - Nature,https://news.google.com/rss/articles/CBMiMmh0dHBzOi8vd3d3Lm5hdHVyZS5jb20vYXJ0aWNsZXMvZDQxNTg2LTAyNC0wMjM3MS160gEA?oc=5,https://da.gd/tGLjz
GN:T:AI,How machines that can solve complex math problems might usher in more powerful AI - MIT Technology Review,https://news.google.com/rss/articles/CBMihgFodHRwczovL3d3dy50ZWNobm9sb2d5cmV2aWV3LmNvbS8yMDI0LzA3LzMwLzEwOTU0NjcvaG93LW1hY2hpbmVzLXRoYXQtY2FuLXNvbHZlLWNvbXBsZXgtbWF0aC1wcm9ibGVtcy1taWdodC11c2hlci1pbi1tb3JlLXBvd2VyZnVsLWFpL9IBigFodHRwczovL3d3dy50ZWNobm9sb2d5cmV2aWV3LmNvbS8yMDI0LzA3LzMwLzEwOTU0NjcvaG93LW1hY2hpbmVzLXRoYXQtY2FuLXNvbHZlLWNvbXBsZXgtbWF0aC1wcm9ibGVtcy1taWdodC11c2hlci1pbi1tb3JlLXBvd2VyZnVsLWFpL2FtcC8?oc=5,https://da.gd/Y8FPG
GN:T:AI,How To Get Ad Creative AI-Ready In Search Ads - Search Engine Journal,https://news.google.com/rss/articles/CBMiWWh0dHBzOi8vd3d3LnNlYXJjaGVuZ2luZWpvdXJuYWwuY29tL2hvdy10by1nZXQtYWQtY3JlYXRpdmUtYWktcmVhZHktaW4tc2VhcmNoLWFkcy81MjEzNTcv0gEA?oc=5,https://da.gd/8KaCj
