feed,title,long_url,short_url
GN:T:AI,"Cyberattack hits Georgia county, officials take down network, phones - StateScoop",https://news.google.com/rss/articles/CBMiQmh0dHBzOi8vc3RhdGVzY29vcC5jb20vY3liZXJhdHRhY2stbWFjb24tYmliYi1jb3VudHktZ2VvcmdpYS0yMDI0L9IBAA?oc=5,https://da.gd/YoteA
GN:T:AI,"How the Middle East became a powerful force in AI, tech development - The Washington Post",https://news.google.com/rss/articles/CBMiZGh0dHBzOi8vd3d3Lndhc2hpbmd0b25wb3N0LmNvbS90ZWNobm9sb2d5LzIwMjQvMDUvMTQvbWlkZGxlLWVhc3QtYWktdGVjaC1jb21wYW5pZXMtc2F1ZGktYXJhYmlhLXVhZS_SAQA?oc=5,https://da.gd/KPPHYY
GN:T:AI,Amazon-backed Anthropic brings Claude AI chatbot to European users - Cointelegraph,https://news.google.com/rss/articles/CBMiQWh0dHBzOi8vY29pbnRlbGVncmFwaC5jb20vbmV3cy9hbnRocm9waWMtY2xhdWRlLWFpLWNoYXRib3QtZXVyb3Bl0gEA?oc=5,https://da.gd/oMjHq
GN:T:AI,Why Protesters Are Demanding Pause on AI Development - TIME,https://news.google.com/rss/articles/CBMiM2h0dHBzOi8vdGltZS5jb20vNjk3NzY4MC9haS1wcm90ZXN0cy1pbnRlcm5hdGlvbmFsL9IBAA?oc=5,https://da.gd/BZa9
GN:T:AI,"Will AI replace doctors who read X-rays, or just make them better than ever? - The Associated Press",https://news.google.com/rss/articles/CBMiZmh0dHBzOi8vYXBuZXdzLmNvbS9hcnRpY2xlL2FpLWFsZ29yaXRobXMtY2hhdGdwdC1kb2N0b3JzLXJhZGlvbG9naXN0cy0zYmM5NWRiNTFhNDE0NjljMzkwYjBmMWY0OGM3ZGQ0ZdIBAA?oc=5,https://da.gd/GGBHsP
GN:T:AI,Bank of America sees 60% upside for this software stock that's using AI to innovate - CNBC,https://news.google.com/rss/articles/CBMicGh0dHBzOi8vd3d3LmNuYmMuY29tLzIwMjQvMDUvMTQvYmFuay1vZi1hbWVyaWNhLXNlZXMtNjBwZXJjZW50LXVwc2lkZS1mb3Itc29mdHdhcmUtc3RvY2staW5ub3ZhdGluZy13aXRoLWFpLmh0bWzSAQA?oc=5,https://da.gd/uk91L6
