feed,title,long_url,short_url
GN:T:AI,Man uses brain-controlled prosthetic robot arms to eat a Twinkie - Digital Trends,https://www.digitaltrends.com/news/brain-controlled-robot-arms-twinkie/,https://j.mp/3hQX46B
GN:T:AI,Want Cheaper Nuclear Energy? Turn the Design Process Into a Game for Artificial Intelligence - SciTechDaily,https://scitechdaily.com/want-cheaper-nuclear-energy-turn-the-design-process-into-a-game-for-artificial-intelligence/,https://j.mp/3pMs4qQ
GN:T:AI,How Artificial Intelligence Can Power Climate Change Strategy - Forbes,https://www.forbes.com/sites/bernardmarr/2021/01/04/how-artificial-intelligence-can-power-climate-change-strategy/,https://j.mp/3rSREMC
GN:T:AI,"Viral stolen iPhone video charges and $200,000 MacBook thefts in the Apple Crime Blotter - AppleInsider",https://appleinsider.com/articles/21/01/03/viral-stolen-iphone-video-charges-and-200000-macbook-thefts-in-the-apple-crime-blotter,https://j.mp/2LfkypJ
GN:T:AI,7 SEO Digital Marketing Trends for 2021 - Business 2 Community - Business 2 Community,https://www.business2community.com/digital-marketing/7-seo-digital-marketing-trends-for-2021-02373575,https://j.mp/3ocPFki
GN:T:AI,Researchers Urge Including Machines on Opioid Stewardship Teams - Pain Medicine News,https://www.painmedicinenews.com/Science-and-Technology/Article/12-20/Researchers-Urge-Including-Machines-on-Opioid-Stewardship-Teams/61499,https://j.mp/3ogD7by
