feed,title,long_url,short_url
LitCovid,Asthma control and exacerbation risk following SARS-CoV-2 infection in the post-acute COVID-19 phase: a systematic review,https://pubmed.ncbi.nlm.nih.gov/41987304,
LitCovid,Association of pectoralis major muscle cross-sectional area and mean density on chest CT with mortality in elderly COVID-19 patients: sex and side differences,https://pubmed.ncbi.nlm.nih.gov/41987121,
LitCovid,"Delirium in critically ill COVID-19 patients: incidence, predictors, and outcomes in invasive mechanical ventilation with versus without ECMO support",https://pubmed.ncbi.nlm.nih.gov/41987283,
LitCovid,Pseudo-time reconstruction for analyzing transmission direction in COVID-19 contact-tracing data,https://pubmed.ncbi.nlm.nih.gov/41985381,
LitCovid,Commentary: 1-year risks of cancers associated with COVID-19 vaccination: a large population-based cohort study in South Korea,https://pubmed.ncbi.nlm.nih.gov/41988570,
LitCovid,Lessons learned and recommendations from the Canadian adaptive platform trial of treatments for COVID in community settings (CanTreatCOVID),https://pubmed.ncbi.nlm.nih.gov/41985658,
LitCovid,A systematic review of spatial epidemiological modeling approaches applied during the COVID-19 pandemic,https://pubmed.ncbi.nlm.nih.gov/41987119,
LitCovid,Revealing institutional vulnerabilities in Nordic health systems through multidimensional scaling of COVID-19 mortality data,https://pubmed.ncbi.nlm.nih.gov/41986502,
LitCovid,Thymidine phosphorylase promotes SARS-CoV-2 spike protein-driven lung tumor development,https://pubmed.ncbi.nlm.nih.gov/41988188,
LitCovid,"COVID-19 Antiviral Treatment: Examining Knowledge, Access, Trust in Sources of Information and Willingness to Use Among Essential Workers: A Cross-Sectional Survey of Cohort Participants",https://pubmed.ncbi.nlm.nih.gov/41988399,
LitCovid,Commentary: A cross-continental comparative analysis of the neurological manifestations of Long COVID,https://pubmed.ncbi.nlm.nih.gov/41987944,
LitCovid,Corrigendum to <' A new SARS-CoV-2 variant with high lethality poorly detected by RT-PCR on nasopharyngeal samples: an observational study.'><[Clin Microbiol Infect. 2022;28(2):298.e9-e15.]>.,https://pubmed.ncbi.nlm.nih.gov/41985673,
LitCovid,Case Report: COVID-19 unmasks factor H mutation-driven hemolytic uremic syndrome in a previously undiagnosed septuagenarian kidney transplant recipient,https://pubmed.ncbi.nlm.nih.gov/41987803,
LitCovid,Long-term trajectories of reproductive and pituitary-adrenal-thyroid hormones in young males following Omicron BA.2 infection: a two-year prospective cohort study,https://pubmed.ncbi.nlm.nih.gov/41987892,
LitCovid,"Real-world immune dynamics following COVID-19 vaccination and breakthrough infection: a paired-sample study in Zhejiang Province, China",https://pubmed.ncbi.nlm.nih.gov/41988181,
LitCovid,"Accelerated Increase in Candida auris Bloodstream Infections during COVID-19 Pandemic, South Africa",https://pubmed.ncbi.nlm.nih.gov/41986971,
LitCovid,Analysis of COVID-19-Related Influencing Variables and Post-Traumatic Growth Differences Depending on the Type of Depressive Symptoms Using Latent Profile Analysis,https://pubmed.ncbi.nlm.nih.gov/41987609,
LitCovid,The neuropsychiatric features of Long COVID in older adults and the potential association with neuroinflammation: Preliminary observations in a small cohort,https://pubmed.ncbi.nlm.nih.gov/41985377,
LitCovid,Pandemic ready or playing catch-up? A scoping review of public health training programs for pandemic preparedness and response efforts,https://pubmed.ncbi.nlm.nih.gov/41987085,
LitCovid,An Autopsy Case of a Patient With Corticobasal Degeneration and a History of Acute Restlessness and Stupor,https://pubmed.ncbi.nlm.nih.gov/41988672,
LitCovid,A cross-case analysis of coping strategies during the COVID-19 pandemic in the United Kingdom: the experiences of ethnic minority people with mental health problems,https://pubmed.ncbi.nlm.nih.gov/41987501,
LitCovid,Mechanisms underlying immunodynamics of layered defenses elicited by mRNA vaccination in children,https://pubmed.ncbi.nlm.nih.gov/41987210,
LitCovid,Equitable access to the COVID-19 vaccines in Africa (ECOVA) findings from a qualitative enquiry in Zimbabwe,https://pubmed.ncbi.nlm.nih.gov/41987935,
LitCovid,Virtual music therapy during the COVID-19 pandemic-an updated scoping review,https://pubmed.ncbi.nlm.nih.gov/41987698,
LitCovid,"Knowledge, Attitude, and Perception of Urban Indian population towards Corona Virus Vaccination",https://pubmed.ncbi.nlm.nih.gov/41988043,
LitCovid,A Scoping Review Protocol of Lung Ultrasound in Pediatric COVID-19: Clinical Utility and Lessons for Future Pandemics,https://pubmed.ncbi.nlm.nih.gov/41988397,
LitCovid,Virtual Interview Etiquette for Radiology Residency: A National Survey of Program Directors,https://pubmed.ncbi.nlm.nih.gov/41985998,
LitCovid,Like Bits in a Jigsaw: Exploring Anci'llary Staff Interactions With Care Home Residents,https://pubmed.ncbi.nlm.nih.gov/41986907,
LitCovid,Immunological memory to vaccines,https://pubmed.ncbi.nlm.nih.gov/41985440,
LitCovid,Sequential Extracorporeal Organ Support in Refractory Septic Shock: A Novel Combo Approach with Complete Recovery: A Case Report and Literature Review,https://pubmed.ncbi.nlm.nih.gov/41988541,
LitCovid,"Circulation Patterns, Genetic Diversity, and Public Health Implications of Enterovirus D68, Europe, 2014-2024",https://pubmed.ncbi.nlm.nih.gov/41986256,
LitCovid,"Long-Term Trends in Counseling for Stress and Depression Among Adults, 2009-2024, Considering the Impact of COVID-19 Pandemic: A Nationwide Representative Study in South Korea",https://pubmed.ncbi.nlm.nih.gov/41987614,
LitCovid,Neurological manifestations of respiratory viral infections,https://pubmed.ncbi.nlm.nih.gov/41987025,
LitCovid,Effectiveness of interventions to increase vaccine uptake: component network meta-analysis,https://pubmed.ncbi.nlm.nih.gov/41985976,
LitCovid,Primary care consultation modality and acute mental health service use in adults,https://pubmed.ncbi.nlm.nih.gov/41987931,
LitCovid,"Trust, Transparency, and the Fragile Promise of Data Governance in the Era of Modernization",https://pubmed.ncbi.nlm.nih.gov/41986975,
LitCovid,Psychosocial risks in Latin America: trends and research gaps,https://pubmed.ncbi.nlm.nih.gov/41988578,
LitCovid,"Debate: Young people are living in unprecedented times - too much chaos or too little resilience?: No Pain, No Gain? Why articulating distress marks youth resilience",https://pubmed.ncbi.nlm.nih.gov/41987506,
