feed,title,long_url,short_url
GN:T:RE,Adani Green Makes Investors Rich; What's Next For The Company | Details - Mint,https://news.google.com/rss/articles/CCAiC1czUUNDcnJ1ZDNjmAEB?oc=5,https://da.gd/fojt
GN:T:RE,The 3 Myths Propping Up the Fossil Fuel Industry - TIME,https://news.google.com/rss/articles/CBMiMWh0dHBzOi8vdGltZS5jb20vNjM0MzQ0Ni9mb3NzaWwtZnVlbC1teXRocy1jb3AyOC_SAQA?oc=5,https://da.gd/BJtQS0
GN:T:RE,New Passive Income Side Hustle: Selling Electricity to Neighbors - Business Insider,https://news.google.com/rss/articles/CBMicWh0dHBzOi8vd3d3LmJ1c2luZXNzaW5zaWRlci5jb20vbmV3LXBhc3NpdmUtaW5jb21lLXNpZGUtaHVzdGxlLXNlbGxpbmctZWxlY3RyaWNpdHktbmVpZ2hib3JzLXNvbGFyLXBhbmVscy0yMDIzLTEy0gEA?oc=5,https://da.gd/hVJIGI
GN:T:RE,Disruptive offshore wind pyramid moves to real-world prototype testing - New Atlas,https://news.google.com/rss/articles/CBMiPGh0dHBzOi8vbmV3YXRsYXMuY29tL2VuZXJneS90LW9tZWdhLWZsb2F0aW5nLXdpbmQtcHJvdG90eXBlL9IBAA?oc=5,https://da.gd/lh9b
GN:T:RE,Indonesian Energy Player Medco Aims To Keep Expanding - Forbes,https://news.google.com/rss/articles/CBMibWh0dHBzOi8vd3d3LmZvcmJlcy5jb20vc2l0ZXMvYXJkaWFud2liaXNvbm8vMjAyMy8xMi8wNi9pbmRvbmVzaWFuLWVuZXJneS1wbGF5ZXItbWVkY28tYWltcy10by1rZWVwLWV4cGFuZGluZy_SAQA?oc=5,https://da.gd/nnk38
