feed,title,long_url,short_url
GN:T:CC,"Jet stream will get faster as climate change continues, study finds - Phys",https://news.google.com/rss/articles/CBMiPGh0dHBzOi8vcGh5cy5vcmcvbmV3cy8yMDIzLTEyLWpldC1zdHJlYW0tZmFzdGVyLWNsaW1hdGUuaHRtbNIBO2h0dHBzOi8vcGh5cy5vcmcvbmV3cy8yMDIzLTEyLWpldC1zdHJlYW0tZmFzdGVyLWNsaW1hdGUuYW1w?oc=5,https://da.gd/m6fUL
GN:T:CC,Oil-Rich Saudi Arabia Tries to Claim Clean Energy Is Bad for the Environment - Rolling Stone,https://news.google.com/rss/articles/CBMic2h0dHBzOi8vd3d3LnJvbGxpbmdzdG9uZS5jb20vcG9saXRpY3MvcG9saXRpY3MtbmV3cy9jb3AyOC1zYXVkaS1hcmFiaWEtcmVuZXdhYmxlLWVuZXJneS1iYWQtZW52aXJvbm1lbnQtMTIzNDkxOTQ4My_SAXdodHRwczovL3d3dy5yb2xsaW5nc3RvbmUuY29tL3BvbGl0aWNzL3BvbGl0aWNzLW5ld3MvY29wMjgtc2F1ZGktYXJhYmlhLXJlbmV3YWJsZS1lbmVyZ3ktYmFkLWVudmlyb25tZW50LTEyMzQ5MTk0ODMvYW1wLw?oc=5,https://da.gd/eBmp
GN:T:CC,A City-Size Iceberg Is Moving Out of Antarctic Waters - The New York Times,https://news.google.com/rss/articles/CBMiR2h0dHBzOi8vd3d3Lm55dGltZXMuY29tLzIwMjMvMTIvMDcvY2xpbWF0ZS9pY2ViZXJnLWFudGFyY3RpY2EtYTIzYS5odG1s0gEA?oc=5,https://da.gd/zOVN
GN:T:CC,How COP28 could help developing countries confront climate change - NPR,https://news.google.com/rss/articles/CBMia2h0dHBzOi8vd3d3Lm5wci5vcmcvMjAyMy8xMi8wNy8xMjE3OTc5MzczL2hvdy1jb3AyOC1jb3VsZC1oZWxwLWRldmVsb3BpbmctY291bnRyaWVzLWNvbmZyb250LWNsaW1hdGUtY2hhbmdl0gEA?oc=5,https://da.gd/yeUEI
GN:T:CC,Catholics call on nations at COP28 to adopt new treaty to phase out fossil fuels - National Catholic Reporter,https://news.google.com/rss/articles/CBMicWh0dHBzOi8vd3d3Lm5jcm9ubGluZS5vcmcvZWFydGhiZWF0L3BvbGl0aWNzL2NhdGhvbGljcy1jYWxsLW5hdGlvbnMtY29wMjgtYWRvcHQtbmV3LXRyZWF0eS1waGFzZS1vdXQtZm9zc2lsLWZ1ZWxz0gEA?oc=5,https://da.gd/1Lgb
GN:T:CC,Axios House at COP28: Carbon Management's Role in Addressing Climate Change - Axios,https://news.google.com/rss/articles/CBMiU2h0dHBzOi8vd3d3LmF4aW9zLmNvbS8yMDIzLzEyLzA3L2F4aW9zLWhvdXNlLWNvcDI4LWNhcmJvbi1tYW5hZ2VtZW50LWNsaW1hdGUtY2hhbmdl0gEA?oc=5,https://da.gd/XgzA6P
GN:T:CC,"Polis unveils housing, transportation vision as Colorado legislators prepare for renewed land-use debate - The Denver Post",https://news.google.com/rss/articles/CBMiUGh0dHBzOi8vd3d3LmRlbnZlcnBvc3QuY29tLzIwMjMvMTIvMDcvY29sb3JhZG8tcG9saXMtcm9hZG1hcC1hZmZvcmRhYmxlLWhvdXNpbmcv0gFUaHR0cHM6Ly93d3cuZGVudmVycG9zdC5jb20vMjAyMy8xMi8wNy9jb2xvcmFkby1wb2xpcy1yb2FkbWFwLWFmZm9yZGFibGUtaG91c2luZy9hbXAv?oc=5,https://da.gd/qITopp
