feed,title,long_url,short_url
GN:T:WP,Technip Energies in new pact for South Korean offshore wind projects - Upstream Online,https://news.google.com/rss/articles/CBMigQFodHRwczovL3d3dy51cHN0cmVhbW9ubGluZS5jb20vZW5lcmd5LXRyYW5zaXRpb24vdGVjaG5pcC1lbmVyZ2llcy1pbi1uZXctcGFjdC1mb3Itc291dGgta29yZWFuLW9mZnNob3JlLXdpbmQtcHJvamVjdHMvMi0xLTE0OTQ4NDDSAQA?oc=5,https://da.gd/mzXgq
GN:T:WP,"Twins Minor League Report (8/2): Ohl, Winkel Power Wind Surge; Rodriguez, Rosario Lead Kernels - Twins Daily",https://news.google.com/rss/articles/CBMigQFodHRwczovL3R3aW5zZGFpbHkuY29tL25ld3MtcnVtb3JzL3R3aW5zLW1pbm9yLWxlYWd1ZS9taWxiLXBpZXJzb24tb2hsLXBhdC13aW5rZWwtZW1tYW51ZWwtcm9kcmlndWV6LWthbGFpLXJvc2FyaW8tamFycmV0LXdob3JmZi_SAQA?oc=5,https://da.gd/6Oqks
GN:T:WP,Floating Solar Panels Turn Old Industrial Sites Into Green Energy Goldmines - Bloomberg,https://news.google.com/rss/articles/CBMifmh0dHBzOi8vd3d3LmJsb29tYmVyZy5jb20vbmV3cy9hcnRpY2xlcy8yMDIzLTA4LTAzL2Zsb2F0aW5nLXNvbGFyLXBhbmVscy10dXJuLW9sZC1pbmR1c3RyaWFsLXNpdGVzLWludG8tZ3JlZW4tZW5lcmd5LWdvbGRtaW5lc9IBAA?oc=5,https://da.gd/I7pACF
GN:T:WP,New York Must Speed Up Climate Projects to Reach Goals - Governing,https://news.google.com/rss/articles/CBMiWGh0dHBzOi8vd3d3LmdvdmVybmluZy5jb20vY2xpbWF0ZS9uZXcteW9yay1tdXN0LXNwZWVkLXVwLWNsaW1hdGUtcHJvamVjdHMtdG8tcmVhY2gtZ29hbHPSAWJodHRwczovL3d3dy5nb3Zlcm5pbmcuY29tL2NsaW1hdGUvbmV3LXlvcmstbXVzdC1zcGVlZC11cC1jbGltYXRlLXByb2plY3RzLXRvLXJlYWNoLWdvYWxzP19hbXA9dHJ1ZQ?oc=5,https://da.gd/0iSy2H
GN:T:WP,California voters may face dueling measures on 2024 ballot about oil wells near homes and schools - CT Insider,https://news.google.com/rss/articles/CBMiZmh0dHBzOi8vd3d3LmN0aW5zaWRlci5jb20vYnVzaW5lc3MvYXJ0aWNsZS9jYWxpZm9ybmlhLXZvdGVycy1tYXktZmFjZS1kdWVsaW5nLW1lYXN1cmVzLW9uLTE4Mjc2MDUxLnBocNIBAA?oc=5,https://da.gd/aZulFh
