feed,title,long_url,short_url
GN:T:RE,The world's largest floating offshore wind farm is officially online - Electrek,https://news.google.com/rss/articles/CBMiSmh0dHBzOi8vZWxlY3RyZWsuY28vMjAyMy8wOC8yMy93b3JsZHMtbGFyZ2VzdC1mbG9hdGluZy1vZmZzaG9yZS13aW5kLWZhcm0v0gEA?oc=5,https://da.gd/EM54x
GN:T:RE,"Cargill and BAR Technologies’ Ground-Breaking Wind Technology Sets Sail, Chartering a New - BusinessWire",https://news.google.com/rss/articles/CCAiC2oxbzA5UzNxWXUwmAEB?oc=5,https://da.gd/x0BhLp
GN:T:RE,Siemens Energy's wind turbine problems could cost 4.5 bln euros -report - Reuters,https://news.google.com/rss/articles/CBMieGh0dHBzOi8vd3d3LnJldXRlcnMuY29tL2J1c2luZXNzL2VuZXJneS9zaWVtZW5zLWVuZXJneXMtd2luZC10dXJiaW5lLXByb2JsZW1zLWNvdWxkLWNvc3QtNDUtYmxuLWV1cm9zLXJlcG9ydC0yMDIzLTA4LTIzL9IBAA?oc=5,https://da.gd/0Aa6
GN:T:RE,This is what irony looks like on steroids – Daily Montanan - Daily Montanan,https://news.google.com/rss/articles/CBMiT2h0dHBzOi8vZGFpbHltb250YW5hbi5jb20vMjAyMy8wOC8yMy90aGlzLWlzLXdoYXQtaXJvbnktbG9va3MtbGlrZS1vbi1zdGVyb2lkcy_SAQA?oc=5,https://da.gd/krYXf9
GN:T:RE,Solar module prices continue to fall – pv magazine International - pv magazine International,https://news.google.com/rss/articles/CBMiTGh0dHBzOi8vd3d3LnB2LW1hZ2F6aW5lLmNvbS8yMDIzLzA4LzIzL3NvbGFyLW1vZHVsZS1wcmljZXMtY29udGludWUtdG8tZmFsbC_SAQA?oc=5,https://da.gd/3SLJAX
