feed,title,long_url,short_url
j:MDPI:N,Mapping Consumer Preference for Vegan and Omnivorous Diets for the Sensory Attributes of Flour Products with Iodine-Fortified Plant-Based Ingredients,https://mdpi.com/2072-6643/16/24/4392,
j:MDPI:N,The Evolution of Dietary Consumption in the Spanish Adult Population and Its Relationship with Environmental Sustainability,https://mdpi.com/2072-6643/16/24/4391,
j:MDPI:N,"Traditional Uses, Bioactive Compounds, and New Findings on Pharmacological, Nutritional, Cosmetic and Biotechnology Utility of Capsella bursa-pastoris",https://mdpi.com/2072-6643/16/24/4390,
j:MDPI:N,"Comparing the Effects of Collagen Hydrolysate and Dairy Protein on Recovery from Eccentric Exercise: A Double Blind, Placebo-Controlled Study",https://mdpi.com/2072-6643/16/24/4389,
j:MDPI:N,Nutritional Counseling Based on Mindful Eating for the Eating Behavior of People Living with Overweight and Obesity: A Randomized Clinical Trial,https://mdpi.com/2072-6643/16/24/4388,
j:MDPI:N,Nutritional Prehabilitation Intervention in Hematological Patients Undergoing Bone Marrow Transplant: A Systematic Review of the Literature,https://mdpi.com/2072-6643/16/24/4387,
j:MDPI:N,Micronutrient Status in Patients with Severe Obesity Before and After Laparoscopic Sleeve Gastrectomy,https://mdpi.com/2072-6643/16/24/4386,
j:MDPI:N,Navigating Nutritional Challenges on the Way to Maximum Athletic Performance,https://mdpi.com/2072-6643/16/24/4385,
j:MDPI:N,Is There a Relationship Between Physical Performance Factors and Adverse Reactions to Foodstuffs? The ALASKA Study,https://mdpi.com/2072-6643/16/24/4384,
