feed,title,long_url,short_url
GN:T:CC,Does the 1978 EnMod Convention Grant the ICJ Jurisdiction Over Climate Cases? - Foreign Policy,https://news.google.com/rss/articles/CBMiZWh0dHBzOi8vZm9yZWlnbnBvbGljeS5jb20vMjAyMy8wNC8wNS91bml0ZWQtbmF0aW9ucy1pY2otdmFudWF0dS1jbGltYXRlLWNoYW5nZS1sYXctbG9zcy1kYW1hZ2UtZW5tb2Qv0gEA?oc=5,https://da.gd/55V5lI
GN:T:CC,Here's why it's so hard to convince right-wingers climate change is a threat - Yahoo News UK,https://news.google.com/rss/articles/CBMic2h0dHBzOi8vdWsubmV3cy55YWhvby5jb20vaGVyZXMtd2h5LWl0cy1zby1oYXJkLXRvLWNvbnZpbmNlLXJpZ2h0LXdpbmdlcnMtY2xpbWF0ZS1jaGFuZ2UtaXMtYS10aHJlYXQtMTQ0MDUyMDk4Lmh0bWzSAXtodHRwczovL3VrLm5ld3MueWFob28uY29tL2FtcGh0bWwvaGVyZXMtd2h5LWl0cy1zby1oYXJkLXRvLWNvbnZpbmNlLXJpZ2h0LXdpbmdlcnMtY2xpbWF0ZS1jaGFuZ2UtaXMtYS10aHJlYXQtMTQ0MDUyMDk4Lmh0bWw?oc=5,https://da.gd/WDgo
GN:T:CC,Why Business Leaders Must Resist the Anti-ESG Movement - HBR,https://news.google.com/rss/articles/CBMiTmh0dHBzOi8vaGJyLm9yZy8yMDIzLzA0L3doeS1idXNpbmVzcy1sZWFkZXJzLW11c3QtcmVzaXN0LXRoZS1hbnRpLWVzZy1tb3ZlbWVudNIBAA?oc=5,https://da.gd/PIu4x
GN:T:CC,What You Need to Know About Turbulence on Airplanes - The New York Times,https://news.google.com/rss/articles/CBMiOGh0dHBzOi8vd3d3Lm55dGltZXMuY29tL2FydGljbGUvYWlycGxhbmUtdHVyYnVsZW5jZS5odG1s0gEA?oc=5,https://da.gd/maHrK
GN:T:CC,‘How to Blow Up a Pipeline’ Review: Climate Activism Gets Explosive in a Taut Indie Drama - Variety,https://news.google.com/rss/articles/CBMiUmh0dHBzOi8vdmFyaWV0eS5jb20vMjAyMy9maWxtL3Jldmlld3MvaG93LXRvLWJsb3ctdXAtYS1waXBlbGluZS1yZXZpZXctMTIzNTU3NTMyMy_SAVZodHRwczovL3ZhcmlldHkuY29tLzIwMjMvZmlsbS9yZXZpZXdzL2hvdy10by1ibG93LXVwLWEtcGlwZWxpbmUtcmV2aWV3LTEyMzU1NzUzMjMvYW1wLw?oc=5,https://da.gd/r9mDeC
GN:T:CC,New Zealand's Jacinda Ardern gives rousing farewell speech: 'You can lead. Just like me' - CNN,https://news.google.com/rss/articles/CBMiYmh0dHBzOi8vd3d3LmNubi5jb20vMjAyMy8wNC8wNS9hc2lhL2phY2luZGEtYXJkZXJuLW5ldy16ZWFsYW5kLWZhcmV3ZWxsLXNwZWVjaC1pbnRsLWhuay9pbmRleC5odG1s0gFmaHR0cHM6Ly9hbXAuY25uLmNvbS9jbm4vMjAyMy8wNC8wNS9hc2lhL2phY2luZGEtYXJkZXJuLW5ldy16ZWFsYW5kLWZhcmV3ZWxsLXNwZWVjaC1pbnRsLWhuay9pbmRleC5odG1s?oc=5,https://da.gd/WdEEiQ
