feed,title,long_url,short_url
GN:S:C,"Greenhouse gas emissions rose at 'alarming' rate last year, US data shows - The Guardian",https://news.google.com/rss/articles/CBMiYGh0dHBzOi8vd3d3LnRoZWd1YXJkaWFuLmNvbS9lbnZpcm9ubWVudC8yMDIzL2Fwci8wNi9ncmVlbmhvdXNlLWdhcy1lbWlzc2lvbnMtbm9hYS1yZXBvcnQtdXMtZGF0YdIBAA?oc=5,https://da.gd/3q8p
GN:S:C,Berlin Least Vulnerable to Climate Change Risks - Barron's,https://news.google.com/rss/articles/CBMiWWh0dHBzOi8vd3d3LmJhcnJvbnMuY29tL2FydGljbGVzL2Jlcmxpbi1sZWFzdC12dWxuZXJhYmxlLXRvLWNsaW1hdGUtY2hhbmdlLXJpc2tzLWM0ODhhZmQx0gEA?oc=5,https://da.gd/tTfNt
GN:S:C,"Often overlooked, 'residual emissions' are critical to fighting climate ... - University at Buffalo",https://news.google.com/rss/articles/CBMiN2h0dHBzOi8vd3d3LmJ1ZmZhbG8uZWR1L25ld3MvcmVsZWFzZXMvMjAyMy8wNC8wMDUwLmh0bWzSAQA?oc=5,https://da.gd/8GKUKP
GN:S:C,'Infecting minds': US book sent to teachers seeks to sow climate doubt - Phys,https://news.google.com/rss/articles/CBMiQ2h0dHBzOi8vcGh5cy5vcmcvbmV3cy8yMDIzLTA0LWluZmVjdGluZy1taW5kcy10ZWFjaGVycy1jbGltYXRlLmh0bWzSAUJodHRwczovL3BoeXMub3JnL25ld3MvMjAyMy0wNC1pbmZlY3RpbmctbWluZHMtdGVhY2hlcnMtY2xpbWF0ZS5hbXA?oc=5,https://da.gd/RvxLXj
GN:S:C,Climate tech tapped the brakes in Q1. Will the slowdown continue? - TechCrunch,https://news.google.com/rss/articles/CBMiO2h0dHBzOi8vdGVjaGNydW5jaC5jb20vMjAyMy8wNC8wNi9jbGltYXRlLXRlY2gtcTEtc2xvd2Rvd24v0gEA?oc=5,https://da.gd/tzP26
GN:S:C,"Alga Biosciences wants to help climate change, one bovine burp at a time - TechCrunch",https://news.google.com/rss/articles/CBMiP2h0dHBzOi8vdGVjaGNydW5jaC5jb20vMjAyMy8wNC8wNi9hbGdhLWJpb3NjaWVuY2VzLXNlcmllcy1zZWVkL9IBQ2h0dHBzOi8vdGVjaGNydW5jaC5jb20vMjAyMy8wNC8wNi9hbGdhLWJpb3NjaWVuY2VzLXNlcmllcy1zZWVkL2FtcC8?oc=5,https://da.gd/Sbh1As
GN:S:C,Experts share reasons to be hopeful about the climate crisis - Business Insider,https://news.google.com/rss/articles/CBMiU2h0dHBzOi8vd3d3LmJ1c2luZXNzaW5zaWRlci5jb20vZXhwZXJ0cy1zaGFyZS1yZWFzb25zLWhvcGVmdWwtY2xpbWF0ZS1jcmlzaXMtMjAyMy000gFXaHR0cHM6Ly93d3cuYnVzaW5lc3NpbnNpZGVyLmNvbS9leHBlcnRzLXNoYXJlLXJlYXNvbnMtaG9wZWZ1bC1jbGltYXRlLWNyaXNpcy0yMDIzLTQ_YW1w?oc=5,https://da.gd/vjTQC5
GN:S:C,Five Rutgers athletes push for climate action through NIL campaign - On3,https://news.google.com/rss/articles/CBMihAFodHRwczovL3d3dy5vbjMuY29tL25pbC9uZXdzL3J1dGdlcnMtbmlsLWNvbGxlY3RpdmUta25pZ2h0cy1vZi10aGUtcmFyaXRhbi1uYW1lLWltYWdlLWFuZC1saWtlbmVzcy1kZWFscy1lY29hdGhsZXRlcy1jbGltYXRlLWNoYW5nZS_SAQA?oc=5,https://da.gd/Pj8IZK
