feed,title,long_url,short_url
LitCovid,Rethinking the Role of the Renin-Angiotensin System in the Pandemic Era of SARS-CoV-2,https://pubmed.ncbi.nlm.nih.gov/36661909,
LitCovid,Increased mTOR Signaling and Impaired Autophagic Flux Are Hallmarks of SARS-CoV-2 Infection,https://pubmed.ncbi.nlm.nih.gov/36661509,
LitCovid,Autoimmunity and Immunodeficiency in Severe SARS-CoV-2 Infection and Prolonged COVID-19,https://pubmed.ncbi.nlm.nih.gov/36661489,
LitCovid,Cancer Care during the COVID-19 Pandemic: Challenges and Adaptations,https://pubmed.ncbi.nlm.nih.gov/36661653,
LitCovid,Characterization of two linear epitopes SARS CoV-2 spike protein formulated in tandem repeat,https://pubmed.ncbi.nlm.nih.gov/36662754,
LitCovid,Risk-benefit profiles associated with receiving Moderna COVID-19 (mRNA-1273) vaccine as an additional pre-booster dose in immune-mediated dermatologic disease patients with low SARS-CoV-2-specific immunity following the primary series: a prospective cohort study,https://pubmed.ncbi.nlm.nih.gov/36662625,
LitCovid,Professional challenges of nurses working during the SARS-CoV-2 virus pandemic,https://pubmed.ncbi.nlm.nih.gov/36661862,
LitCovid,Clinical characteristics and mortality risk among critically ill patients with COVID-19 owing to the B.1.617.2 (Delta) variant in Vietnam: A retrospective observational study,https://pubmed.ncbi.nlm.nih.gov/36662716,
LitCovid,The Potential of Stilbene Compounds to Inhibit M(pro) Protease as a Natural Treatment Strategy for Coronavirus Disease-2019,https://pubmed.ncbi.nlm.nih.gov/36661488,
LitCovid,Impact of the COVID-19 pandemic and corresponding control measures on long-term care facilities: a systematic review and meta-analysis,https://pubmed.ncbi.nlm.nih.gov/36668818,
LitCovid,Face mask ownership/utilisation and COVID-19 vaccine hesitancy amongst patients recovering from COVID-19 in Cameroon: A cross-sectional study,https://pubmed.ncbi.nlm.nih.gov/36662746,
LitCovid,The Impact of the COVID-19 Pandemic on the Number of Cancer Patients and Radiotherapy Procedures in the Warmia and Masuria Voivodeship,https://pubmed.ncbi.nlm.nih.gov/36661726,
LitCovid,COVID-19 mRNA vaccine immunogenicity decay and breakthrough illness in adolescents and young adults with childhood-onset rheumatic diseases,https://pubmed.ncbi.nlm.nih.gov/36661304,
LitCovid,Distinguishing SARS-CoV-2 Infection and Non-SARS-CoV-2 Viral Infections in Adult Patients through Clinical Score Tools,https://pubmed.ncbi.nlm.nih.gov/36668968,
LitCovid,"NLRP3, the inflammasome and COVID-19 infection",https://pubmed.ncbi.nlm.nih.gov/36661317,
LitCovid,Impact of COVID-19 on Cancer-Related Care in the United States: An Overview,https://pubmed.ncbi.nlm.nih.gov/36661702,
LitCovid,Altered host protease determinants for SARS-CoV-2 Omicron,https://pubmed.ncbi.nlm.nih.gov/36662861,
LitCovid,Assessing the role of collectivism and individualism on COVID-19 beliefs and behaviors in the Southeastern United States,https://pubmed.ncbi.nlm.nih.gov/36662888,
LitCovid,Finding a Secure Place in the Home during the First COVID-19 Lockdown: A Pattern-Oriented Analysis,https://pubmed.ncbi.nlm.nih.gov/36661581,
LitCovid,Better safe than sorry-Whole-genome sequencing indicates that missense variants are significant in susceptibility to COVID-19,https://pubmed.ncbi.nlm.nih.gov/36662838,
LitCovid,Comment on 'Eosinophilic pustular folliculitis developing at the site of COVID-19 vaccination',https://pubmed.ncbi.nlm.nih.gov/36669175,
LitCovid,"A modelling approach to estimate the transmissibility of SARS-CoV-2 during periods of high, low, and zero case incidence",https://pubmed.ncbi.nlm.nih.gov/36661303,
LitCovid,"""What's going on?"" Racism, COVID-19, and centering the voices of Black youth",https://pubmed.ncbi.nlm.nih.gov/36661477,
LitCovid,Severe Acute Respiratory Syndrome Coronavirus-2 Delta Variant Study In Vitro and Vivo,https://pubmed.ncbi.nlm.nih.gov/36661505,
LitCovid,Development of Moral Injury in ICU Professionals During the COVID-19 Pandemic: A Prospective Serial Interview Study,https://pubmed.ncbi.nlm.nih.gov/36661451,
LitCovid,"Phase 2 safety and antiviral activity of SAB-185, a novel polyclonal antibody therapy for non-hospitalized adults with COVID-19",https://pubmed.ncbi.nlm.nih.gov/36661240,
LitCovid,Analysis of mRNA COVID-19 Vaccine Uptake Among Immunocompromised Individuals in a Large US Health System,https://pubmed.ncbi.nlm.nih.gov/36662525,
LitCovid,A Clinical Update on SARS-CoV-2: Pathology and Development of Potential Inhibitors,https://pubmed.ncbi.nlm.nih.gov/36661514,
LitCovid,"""Imagine Your Career after the COVID-19 Pandemic"": An Online Group Career Counseling Training for University Students",https://pubmed.ncbi.nlm.nih.gov/36661620,
LitCovid,Qualitative changes in children's physical activity and sedentary behaviours throughout the COVID-19 pandemic: The HomeSPACE project,https://pubmed.ncbi.nlm.nih.gov/36662771,
LitCovid,Comment on 'Pityriasis rubra pilaris-like eruption following mRNA COVID-19 vaccine',https://pubmed.ncbi.nlm.nih.gov/36669180,
LitCovid,"Pediatric, Urgent Care Telemedicine During COVID-19: A Comparative Analysis",https://pubmed.ncbi.nlm.nih.gov/36662562,
LitCovid,"Safety, Biodistribution, and Dosimetry Study of Meplazumab, a Potential COVID-19 Therapeutic Drug, with (131)I-Labeling and SPECT Imaging",https://pubmed.ncbi.nlm.nih.gov/36668905,
LitCovid,COVID-19's influence on cardiac function: a machine learning perspective on ECG analysis,https://pubmed.ncbi.nlm.nih.gov/36662377,
LitCovid,"A flexible age-dependent, spatially-stratified predictive model for the spread of COVID-19, accounting for multiple viral variants and vaccines",https://pubmed.ncbi.nlm.nih.gov/36662784,
LitCovid,Higher Incidence of Cancer Therapy-Related Cardiac Dysfunction in the COVID-19 Era: A Single Cardio-Oncology Center Experience,https://pubmed.ncbi.nlm.nih.gov/36661918,
LitCovid,New Injury Patterns in Pediatric Supracondylar Fractures During COVID-19: Beds Are the New Monkey Bars,https://pubmed.ncbi.nlm.nih.gov/36662751,
LitCovid,"COVID-19, jobs and skills-Exploratory analysis of the job postings in the US and UK healthcare job market",https://pubmed.ncbi.nlm.nih.gov/36662704,
LitCovid,Effects of telework on anxiety and depression across the United States during the covid-19 crisis,https://pubmed.ncbi.nlm.nih.gov/36662792,
LitCovid,Impact of COVID-19 Pandemic on Non-Small Cell Lung Cancer Care,https://pubmed.ncbi.nlm.nih.gov/36661708,
LitCovid,Whole Genome Sequencing of SARS-CoV-2 in Cats and Dogs in South Korea in 2021,https://pubmed.ncbi.nlm.nih.gov/36669008,
LitCovid,COVID-19 in School Teachers: Job Satisfaction and Burnout through the Job Demands Control Model,https://pubmed.ncbi.nlm.nih.gov/36661648,
LitCovid,"Knowledge, Attitudes, and Practices towards COVID-19 among Pregnant Women in Northern Bangladesh: A Community-Based Cross-Sectional Study",https://pubmed.ncbi.nlm.nih.gov/36661574,
LitCovid,Effect of Ward-Based High-Flow Nasal Cannula (HFNC) Oxygen Therapy on Critical Care Utilization During the COVID-19 Pandemic: A Retrospective Cohort Analysis,https://pubmed.ncbi.nlm.nih.gov/36662403,
LitCovid,Network pharmacology- and molecular simulation-based exploration of therapeutic targets and mechanisms of heparin for the treatment of sepsis/COVID-19,https://pubmed.ncbi.nlm.nih.gov/36661370,
LitCovid,Using Social Media for Social Motives Moderates the Relationship between Post-Traumatic Symptoms during a COVID-19-Related Lockdown and Improvement of Distress after Lockdown,https://pubmed.ncbi.nlm.nih.gov/36661625,
LitCovid,Design and Transition of an Emergency E-Learning Pathology Course for Medical Students-Evaluation of a Novel Course Concept,https://pubmed.ncbi.nlm.nih.gov/36661758,
LitCovid,"Relationship between the Engel Coefficient, Life Satisfaction, and Subjective Health for Senior Citizens in Korea: Moderating Effect of COVID-19",https://pubmed.ncbi.nlm.nih.gov/36661594,
LitCovid,COVID-19 and non-communicable diseases in complex vulnerable populations: evidence from Jordan,https://pubmed.ncbi.nlm.nih.gov/36661207,
LitCovid,Psychological Distress Related to the COVID-19 Pandemic: The Protective Role of Hope,https://pubmed.ncbi.nlm.nih.gov/36661755,
LitCovid,Exploring the Social Trend Indications of Utilizing E-Commerce during and after COVID-19's Hit,https://pubmed.ncbi.nlm.nih.gov/36661577,
LitCovid,Assessment of the Function of Respiratory Muscles in Patients after COVID-19 Infection and Respiratory Rehabilitation,https://pubmed.ncbi.nlm.nih.gov/36668964,
LitCovid,Does Positive Thinking Help during Difficult Pandemic Times? The Role of Positive Orientation in the Relationship between Fear of COVID-19 and Perceived Stress,https://pubmed.ncbi.nlm.nih.gov/36661761,
LitCovid,Impact of COVID-19 Epidemic on Psycho-Oncological Distress in Neuro-Oncological Patients,https://pubmed.ncbi.nlm.nih.gov/36661678,
LitCovid,Study of covid-19 vaccine related cutaneous adverse events following immunization and establishing causal association,https://pubmed.ncbi.nlm.nih.gov/36662656,
LitCovid,The Burden of Clostridioides Difficile on COVID-19 Hospitalizations in the United States,https://pubmed.ncbi.nlm.nih.gov/36662626,
LitCovid,Exploring the Impact of COVID-19 on Individuals with Eating Disorders in Saudi Arabia: A Thematic Analysis,https://pubmed.ncbi.nlm.nih.gov/36661641,
LitCovid,Safety and Evaluation of the Immune Response of Coronavirus Nosode (BiosimCovex) in Healthy Volunteers: A Preliminary Study Extending the Homeopathic Pathogenetic Trial,https://pubmed.ncbi.nlm.nih.gov/36662492,
LitCovid,COVID-19 Stress and Teachers Well-Being: The Mediating Role of Sense of Coherence and Resilience,https://pubmed.ncbi.nlm.nih.gov/36661751,
LitCovid,Long-term respiratory follow-up of ICU hospitalized COVID-19 patients: Prospective cohort study,https://pubmed.ncbi.nlm.nih.gov/36662879,
LitCovid,"A sex-biased imbalance between Tfr, Tph, and atypical B cells determines antibody responses in COVID-19 patients",https://pubmed.ncbi.nlm.nih.gov/36669118,
LitCovid,COVID-19 Emotional and Mental Impact on Cancer Patients Receiving Radiotherapy: An Interpretation of Potential Explaining Descriptors,https://pubmed.ncbi.nlm.nih.gov/36661695,
LitCovid,How did the beginnings of the global COVID-19 pandemic affect mental well-being?,https://pubmed.ncbi.nlm.nih.gov/36662727,
LitCovid,Multidimensional machine learning on 2173 COVID-19 patients in Vietnam: Retro-prospective Validation Study,https://pubmed.ncbi.nlm.nih.gov/36668902,
LitCovid,Gender Differences in Emotional Valence and Social Media Content Engagement Behaviors in Pandemic Diaries: An Analysis Based on Microblog Texts,https://pubmed.ncbi.nlm.nih.gov/36661606,
LitCovid,Emotion regulation strategies and mental health symptoms during COVID-19: the mediating role of insomnia,https://pubmed.ncbi.nlm.nih.gov/36661865,
LitCovid,Knowledge graph of wastewater-based epidemiology development: A data-driven analysis based on research topics and trends,https://pubmed.ncbi.nlm.nih.gov/36662433,
LitCovid,High-Sensitivity Cardiac Troponin Publications during the COVID-19 Pandemic (2020-2022),https://pubmed.ncbi.nlm.nih.gov/36661900,
LitCovid,Mosaic RBD nanoparticles induce intergenus cross-reactive antibodies and protect against SARS-CoV-2 challenge,https://pubmed.ncbi.nlm.nih.gov/36669119,
LitCovid,"Trust Relationship with Suppliers, Collaborative Action, and Manufacturer Resilience in the COVID-19 Crisis",https://pubmed.ncbi.nlm.nih.gov/36661605,
LitCovid,Pandemic Financial Stress in Dental Medicine in Croatia,https://pubmed.ncbi.nlm.nih.gov/36661546,
LitCovid,"Antibiotic Consumption in Vanuatu before and during the COVID-19 Pandemic, 2018 to 2021: An Interrupted Time Series Analysis",https://pubmed.ncbi.nlm.nih.gov/36668930,
LitCovid,The Role of Emotional Intelligence and Metacognition in Teachers' Stress during Pandemic Remote Working: A Moderated Mediation Model,https://pubmed.ncbi.nlm.nih.gov/36661756,
LitCovid,Determinants and predictors of mental health during and after COVID-19 lockdown among university students in Malaysia,https://pubmed.ncbi.nlm.nih.gov/36662687,
LitCovid,Research on the Influence Mechanism of Intention to Proximity Travel under the COVID-19,https://pubmed.ncbi.nlm.nih.gov/36661582,
LitCovid,Burnout and coping strategies among resident physicians at an Indonesian tertiary referral hospital during COVID-19 pandemic,https://pubmed.ncbi.nlm.nih.gov/36662883,
LitCovid,Impact of the COVID-19 Pandemic on Malaria Control in Africa: A Preliminary Analysis,https://pubmed.ncbi.nlm.nih.gov/36668974,
LitCovid,Leisure Activities for Children with Disabilities During a Pandemic: Characteristics of Inclusive Online Activities,https://pubmed.ncbi.nlm.nih.gov/36668903,
LitCovid,Transition to a virtual model of physiotherapy and exercise physiology in response to COVID-19 for people in a rural Australia: Is it a viable solution to increase access to allied health for rural populations?,https://pubmed.ncbi.nlm.nih.gov/36662817,
LitCovid,In Vitro Antiviral Evaluations of Coldmix((R)): An Essential Oil Blend against SARS-CoV-2,https://pubmed.ncbi.nlm.nih.gov/36661531,
LitCovid,The role of historically Black colleges and universities (HBCUs) in cultivating the next generation of social justice and public service-oriented moral leaders during the racial reckoning and COVID-19 pandemics,https://pubmed.ncbi.nlm.nih.gov/36661445,
LitCovid,Participation in the nation-wide cervical cancer screening programme in Denmark during the COVID-19 pandemic: an observational study,https://pubmed.ncbi.nlm.nih.gov/36661213,
LitCovid,Correction: Internalizing symptoms and family functioning predict adolescent depressive symptoms during COVID-19: A longitudinal study in a community sample,https://pubmed.ncbi.nlm.nih.gov/36662696,
LitCovid,Prognostic factors for favorable outcomes after veno-venous extracorporeal membrane oxygenation in critical care patients with COVID-19,https://pubmed.ncbi.nlm.nih.gov/36662898,
LitCovid,Abdominal Imaging Findings on Computed Tomography as a Tool for COVID-19 Mortality Risk Assessment: Comparison With Chest Radiograph Severity Scores,https://pubmed.ncbi.nlm.nih.gov/36668978,
LitCovid,Mechanisms of Organizational Cultural Tightness on Work Engagement during the COVID-19 Pandemic: The Moderating Role of Transformational Leadership,https://pubmed.ncbi.nlm.nih.gov/36661599,
LitCovid,Impact of Coronavirus Pandemic on Tuberculosis and Other Imported Diseases Screening among Migrant Minors in Spain,https://pubmed.ncbi.nlm.nih.gov/36668935,
LitCovid,Protocol for an extended scoping review on the use of virtual nominal group technique in research,https://pubmed.ncbi.nlm.nih.gov/36662907,
LitCovid,Youth engagement to achieve health equity: Are healthcare organizations and leaders prepared?,https://pubmed.ncbi.nlm.nih.gov/36661430,
LitCovid,A Survey on Deep Learning in COVID-19 Diagnosis,https://pubmed.ncbi.nlm.nih.gov/36662099,
LitCovid,Smoke-free homes in Poland during the COVID-19 pandemic - a nationwide cross-sectional survey,https://pubmed.ncbi.nlm.nih.gov/36661866,
LitCovid,Spotlight on vaccine-induced thrombosis and thrombocytopenia (VITT),https://pubmed.ncbi.nlm.nih.gov/36669155,
LitCovid,Debriefing works: Successful retraction of misinformation following a fake news study,https://pubmed.ncbi.nlm.nih.gov/36662686,
LitCovid,Remote and on-site work stress severity during the COVID-19 pandemic: comparison and selected conditions,https://pubmed.ncbi.nlm.nih.gov/36661864,
LitCovid,"Retrospective Modeling of the Omicron Epidemic in Shanghai, China: Exploring the Timing and Performance of Control Measures",https://pubmed.ncbi.nlm.nih.gov/36668946,
LitCovid,"Predicting of Daily PM(2.5) Concentration Employing Wavelet Artificial Neural Networks Based on Meteorological Elements in Shanghai, China",https://pubmed.ncbi.nlm.nih.gov/36668777,
LitCovid,Human ELISA Detects anti-SARS-CoV-2 Antibodies in Cats: Seroprevalence and Risk Factors for Virus Spread in Domestic and Stray Cats in Bulgaria,https://pubmed.ncbi.nlm.nih.gov/36669043,
LitCovid,Social Media Devices' Influence on User Neck Pain during the COVID-19 Pandemic: Collaborating Vertebral-GLCM Extracted Features with a Decision Tree,https://pubmed.ncbi.nlm.nih.gov/36662112,
LitCovid,Factors Associated with University Students' Deterioration from Subthreshold Depression to Depression before and during the COVID-19 Pandemic,https://pubmed.ncbi.nlm.nih.gov/36661644,
LitCovid,"Factors Associated with Job Satisfaction in Medical Laboratory Professionals during the COVID-19 Pandemic: An Exploratory Study in Ontario, Canada",https://pubmed.ncbi.nlm.nih.gov/36661754,
LitCovid,Public Health Safety in Community Living Circles Based on a Behavioral Motivation Perspective: Theoretical Framework and Evaluation System,https://pubmed.ncbi.nlm.nih.gov/36661598,
LitCovid,Trends and Characteristics of Buprenorphine-Involved Overdose Deaths Prior to and During the COVID-19 Pandemic,https://pubmed.ncbi.nlm.nih.gov/36662523,
LitCovid,Repulsive Scaling Replica Exchange Molecular Dynamics in Modeling Protein-Glycosaminoglycan Complexes,https://pubmed.ncbi.nlm.nih.gov/36662469,
LitCovid,Urinary Glycosaminoglycans: Characterization and Quantification,https://pubmed.ncbi.nlm.nih.gov/36662462,
