feed,title,long_url,short_url
GN:T:AI,Prediction: This Will Be the Next Artificial Intelligence (AI) Company to Split Its Stock - The Motley Fool,https://news.google.com/rss/articles/CBMiXWh0dHBzOi8vd3d3LmZvb2wuY29tL2ludmVzdGluZy8yMDI0LzA1LzE5L3ByZWRpY3Rpb24tdGhpcy13aWxsLWJlLXRoZS1uZXh0LWFydGlmaWNpYWwtaW50ZWxsL9IBAA?oc=5,https://da.gd/k0kj50
GN:T:AI,Microsoft set to unveil its vision for AI PCs at Build developer conference - CNBC,https://news.google.com/rss/articles/CBMiQGh0dHBzOi8vd3d3LmNuYmMuY29tLzIwMjQvMDUvMTkvbWljcm9zb2Z0LWFpLXBjcy1idWlsZC0yMDI0Lmh0bWzSAURodHRwczovL3d3dy5jbmJjLmNvbS9hbXAvMjAyNC8wNS8xOS9taWNyb3NvZnQtYWktcGNzLWJ1aWxkLTIwMjQuaHRtbA?oc=5,https://da.gd/vDly
GN:T:AI,Meta's Plan to Win AI Race: Give Its Tech Away Free - The Wall Street Journal,https://news.google.com/rss/articles/CBMiVmh0dHBzOi8vd3d3Lndzai5jb20vdGVjaC9haS9tZXRhcy1wbGFuLXRvLXdpbi1haS1yYWNlLWdpdmUtaXRzLXRlY2gtYXdheS1mcmVlLTRiY2MwODBh0gEA?oc=5,https://da.gd/35ysiZ
GN:T:AI,"5 Reasons Careers Must 'Adapt To' Or 'Die From' AI Skills, Experts Say - Forbes",https://news.google.com/rss/articles/CBMieGh0dHBzOi8vd3d3LmZvcmJlcy5jb20vc2l0ZXMvYnJ5YW5yb2JpbnNvbi8yMDI0LzA1LzE5LzUtcmVhc29ucy1jYXJlZXJzLW11c3QtYWRhcHQtdG8tb3ItZGllLWZyb20tYWktc2tpbGxzLWV4cGVydHMtc2F5L9IBAA?oc=5,https://da.gd/En59V2
GN:T:AI,"5 big analyst AI moves: Baidu, Accenture downgraded to Hold - Investing",https://news.google.com/rss/articles/CBMicmh0dHBzOi8vd3d3LmludmVzdGluZy5jb20vbmV3cy9zdG9jay1tYXJrZXQtbmV3cy81LWJpZy1hbmFseXN0LWFpLW1vdmVzLWJhaWR1LWFjY2VudHVyZS1kb3duZ3JhZGVkLXRvLWhvbGQtMzQ0NzE4M9IBAA?oc=5,https://da.gd/suFgY
GN:T:AI,Alphabet Goes All In on Artificial Intelligence (AI). Is It Time to Go All In on the Stock? - Yahoo Finance,https://news.google.com/rss/articles/CBMiVmh0dHBzOi8vZmluYW5jZS55YWhvby5jb20vbmV3cy9hbHBoYWJldC1nb2VzLWFydGlmaWNpYWwtaW50ZWxsaWdlbmNlLWFpLTEyMDAwMDAyMy5odG1s0gEA?oc=5,https://da.gd/7i0jZ
