feed,title,long_url,short_url
MX,Increased coffee consumption may reduce severity of non-alcoholic fatty liver disease in those with type 2 diabetes,https://medicalxpress.com/news/2023-01-coffee-consumption-severity-non-alcoholic-fatty.html,https://da.gd/DmsHjV
MX,Food for thought: Early nutrition shapes the brain and influences what we like to eat,https://medicalxpress.com/news/2023-01-food-thought-early-nutrition-brain.html,https://da.gd/IRTu5
MX,Scientists find more evidence that breast milk of those vaccinated against COVID-19 may protect infants,https://medicalxpress.com/news/2023-01-scientists-evidence-breast-vaccinated-covid-.html,https://da.gd/SqfJ
MX,Scientists improve the equation in FDA guidance predicting drug interactions,https://medicalxpress.com/news/2023-01-scientists-equation-fda-guidance-drug.html,https://da.gd/F84dbG
MX,Study reveals commercial tool used for epigenome studies is not actually appropriate for population epigenetics,https://medicalxpress.com/news/2023-01-reveals-commercial-tool-epigenome-population.html,https://da.gd/CGBys
