feed,title,long_url,short_url
GN:T:SP,"World4Solar's Out-of-the-Box Power Plant, HelioWing™ is Changing the Landscape of Solar Energy Generation - AZoCleantech",https://news.google.com/rss/articles/CBMiM2h0dHBzOi8vd3d3LmF6b2NsZWFudGVjaC5jb20vbmV3cy5hc3B4P25ld3NJRD0zNDQ0NdIBAA?oc=5,https://da.gd/XeEJDl
GN:T:SP,"AGEL concludes PPAs for SECI's 8,000 MW tender - Power Line Magazine - Power Line Magazine",https://news.google.com/rss/articles/CBMiUWh0dHBzOi8vcG93ZXJsaW5lLm5ldC5pbi8yMDIzLzEyLzI3L2FnZWwtY29uY2x1ZGVzLXBwYXMtZm9yLXNlY2lzLTgwMDAtbXctdGVuZGVyL9IBAA?oc=5,https://da.gd/B1Fzf7
GN:T:SP,Iberdrola gets environmental permit for hydro-solar plant in Spain - Power Technology,https://news.google.com/rss/articles/CBMiV2h0dHBzOi8vd3d3LnBvd2VyLXRlY2hub2xvZ3kuY29tL25ld3MvaWJlcmRyb2xhLWVudmlyb25tZW50YWwtcGVybWl0LWh5ZHJvLXNvbGFyLXBsYW50L9IBAA?oc=5,https://da.gd/8UETzq
GN:T:SP,Solar Energy: The sunrise sector -lessons from the Gujarat story - Organiser,https://news.google.com/rss/articles/CBMibmh0dHBzOi8vb3JnYW5pc2VyLm9yZy8yMDIzLzEyLzI3LzIxMjkzMC9iaGFyYXQvc29sYXItZW5lcmd5LXRoZS1zdW5yaXNlLXNlY3Rvci1sZXNzb25zLWZyb20tdGhlLWd1amFyYXQtc3Rvcnkv0gFyaHR0cHM6Ly9vcmdhbmlzZXIub3JnLzIwMjMvMTIvMjcvMjEyOTMwL2JoYXJhdC9zb2xhci1lbmVyZ3ktdGhlLXN1bnJpc2Utc2VjdG9yLWxlc3NvbnMtZnJvbS10aGUtZ3VqYXJhdC1zdG9yeS9hbXAv?oc=5,https://da.gd/wPXc
GN:T:SP,541 MW order book: This multibagger power generation company successfully commissioned total of 34.18 MWp solar power projects under CPP segment! - Dalal Street Investment Journal,https://news.google.com/rss/articles/CBMiugFodHRwczovL3d3dy5kc2lqLmluL2RzaWphcnRpY2xlZGV0YWlsLzU0MS1tdy1vcmRlci1ib29rLXRoaXMtbXVsdGliYWdnZXItcG93ZXItZ2VuZXJhdGlvbi1jb21wYW55LXN1Y2Nlc3NmdWxseS1jb21taXNzaW9uZWQtdG90YWwtb2YtMzQxOC1td3Atc29sYXItcG93ZXItcHJvamVjdHMtdW5kZXItY3BwLXNlZ21lbnQtMzU1MDDSAQA?oc=5,https://da.gd/LHAg
