feed,title,long_url,short_url
GN:S:GW,The Next Frontier in Farming? The Ocean. - The New York Times,https://news.google.com/rss/articles/CBMiWmh0dHBzOi8vd3d3Lm55dGltZXMuY29tL2ludGVyYWN0aXZlLzIwMjMvMDMvMTUvY2xpbWF0ZS9zZWF3ZWVkLXBsYXN0aWMtY2xpbWF0ZS1jaGFuZ2UuaHRtbNIBAA?oc=5,https://da.gd/cvMqGX
GN:S:GW,"Global Warming: An urgent warning, by Sakeenah Bint Abdur ... - Halesowen News",https://news.google.com/rss/articles/CBMiemh0dHBzOi8vd3d3LmhhbGVzb3dlbm5ld3MuY28udWsvbmV3cy95b3VuZy1yZXBvcnRlci8yMzM4ODQwMS5nbG9iYWwtd2FybWluZy11cmdlbnQtd2FybmluZy1zYWtlZW5haC1iaW50LWFiZHVyLXJhaGltLWVnbGEv0gEA?oc=5,https://da.gd/JowW4
GN:S:GW,Early Deer Tick Season: What You Need To Know About Global ... - Mirage News,https://news.google.com/rss/articles/CBMiT2h0dHBzOi8vd3d3Lm1pcmFnZW5ld3MuY29tL2Vhcmx5LWRlZXItdGljay1zZWFzb24td2hhdC15b3UtbmVlZC10by1rbm93LTk2NzE2NC_SAQA?oc=5,https://da.gd/9cQQ
GN:S:GW,Biden Says Climate Change Could Dry Up Colorado River. Is It Possible? - Newsweek,https://news.google.com/rss/articles/CBMiRGh0dHBzOi8vd3d3Lm5ld3N3ZWVrLmNvbS9iaWRlbi1jbGltYXRlLWNoYW5nZS1jb2xvcmFkby1yaXZlci0xNzg3ODk50gFKaHR0cHM6Ly93d3cubmV3c3dlZWsuY29tL2JpZGVuLWNsaW1hdGUtY2hhbmdlLWNvbG9yYWRvLXJpdmVyLTE3ODc4OTk_YW1wPTE?oc=5,https://da.gd/nnCHtF
GN:S:GW,A high concentration CO2 pool over the Indo-Pacific Warm Pool ... - Nature,https://news.google.com/rss/articles/CBMiMmh0dHBzOi8vd3d3Lm5hdHVyZS5jb20vYXJ0aWNsZXMvczQxNTk4LTAyMy0zMTQ2OC0w0gEA?oc=5,https://da.gd/ZVorV1
GN:S:GW,E.P.A. Tells Dozens of States to Clean Up Their Smokestacks - The New York Times,https://news.google.com/rss/articles/CBMiSWh0dHBzOi8vd3d3Lm55dGltZXMuY29tLzIwMjMvMDMvMTUvY2xpbWF0ZS9lcGEtc3RhdGVzLXBvbGx1dGlvbi1zbW9nLmh0bWzSAU1odHRwczovL3d3dy5ueXRpbWVzLmNvbS8yMDIzLzAzLzE1L2NsaW1hdGUvZXBhLXN0YXRlcy1wb2xsdXRpb24tc21vZy5hbXAuaHRtbA?oc=5,https://da.gd/nXsdcQ
