feed,title,long_url,short_url
GN:T:AI,DNSFilter Wins 2021 CyberSecurity Breakthrough and GetApp Leader Awards - Yahoo Finance,https://finance.yahoo.com/news/dnsfilter-wins-2021-cybersecurity-breakthrough-125900173.html,https://yhoo.it/3uGARyt
GN:T:AI,Rendered.ai raises $6M on the promise of ending data scarcity - TechCrunch,https://techcrunch.com/2021/10/05/rendered-ai-raises-6m-to-scale-physics-based-synthetic-data-developer-platform/,https://tcrn.ch/3Bet5ya
GN:T:AI,Here's My Favorite Artificial Intelligence Stock Now - Motley Fool,https://www.fool.com/investing/2021/10/05/heres-my-favorite-artificial-intelligence-stock-no/,https://j.mp/2YjZl4i
GN:T:AI,Immunis.AI Chosen by Amazon Web Services to Showcase its Cloud-Based Genomic Pipeline for Machine Learning - Business Wire,https://www.businesswire.com/news/home/20211005005954/en/Immunis.AI-Chosen-by-Amazon-Web-Services-to-Showcase-its-Cloud-Based-Genomic-Pipeline-for-Machine-Learning,https://bwnews.pr/3lcMHgE
GN:T:AI,C.I.A. Admits to Losing Informants - The New York Times,https://www.nytimes.com/2021/10/05/us/politics/cia-informants-killed-captured.html,https://nyti.ms/3AjMXPi
