feed,title,long_url,short_url
ArXiv,"Distinguishable Cash, Bosonic Bitcoin, and Fermionic Non-fungible Token",https://arxiv.org/abs/2211.00291v2,
ArXiv,Educational Game on Cryptocurrency Investment: Using Microeconomic Decision Making to Understand Macroeconomics Principles,https://arxiv.org/abs/2301.10541v2,
ArXiv,Improving Blockchain Scalability with the Setchain Data-type,https://arxiv.org/abs/2302.04744v1,
ArXiv,Estimating Patch Propagation Times across (Blockchain) Forks,https://arxiv.org/abs/2205.07478v2,
ArXiv,Leveraging the Verifier's Dilemma to Double Spend in Bitcoin,https://arxiv.org/abs/2210.14072v2,
