feed,title,long_url,short_url
GN:T:WP,New York Creates Office of Renewable Energy Siting - North American Windpower,https://nawindpower.com/new-york-creates-office-of-renewable-energy-siting,
GN:T:WP,This hydrogen engine will help shipping meet EU CO2 targets - Electrek,https://electrek.co/2020/09/17/behydro-hydrogen-powered-dual-fuel-engine/,
GN:T:WP,"Two solar power, battery storage projects are submitted to PUC - Maui News",https://www.mauinews.com/news/local-news/2020/09/two-solar-power-battery-storage-projects-are-submitted-to-puc/,
GN:T:WP,"Greece to move forward with privatization of energy, mining companies - Balkan Green Energy News",https://balkangreenenergynews.com/greece-to-move-forward-with-privatization-of-energy-mining-companies/,
GN:T:WP,Wilhelmsen Takes Stake in Offshore Wind Service Firm - The Maritime Executive,https://www.maritime-executive.com/article/wilhelmsen-takes-stake-in-offshore-wind-service-firm,
GN:T:WP,"'The good, the bad and the ugly' - Uinta County Herald",https://uintacountyherald.com/article/the-good-the-bad-and-the-ugly,
