feed,title,long_url,short_url
GN:T:WP,Petition Asks Sununu For Exec. Order Telling N.H. Utilities To Invest In Offshore Wind Energy - New Hampshire Public Radio,https://www.nhpr.org/climate-change/2021-08-16/petition-asks-sununu-for-exec-order-telling-n-h-utilities-to-invest-in-offshore-wind-energy,
GN:T:WP,Opinion | Who Created the Renewable-Energy Miracle? - The New York Times,https://www.nytimes.com/2021/08/17/opinion/us-obama-renewable-energy.html,
GN:T:WP,AIP Expands Again With Seacor's Purchase of USSC - The Maritime Executive,https://www.maritime-executive.com/article/aip-expands-again-with-seacor-s-purchase-of-ussc,
GN:T:WP,"PG&E warns of possible power shut-offs in Sonoma, 17 other counties - Sonoma Index-Tribune",https://www.sonomanews.com/article/news/possible-wind-event-could-lead-to-pge-power-shut-offs-across-in-sonoma/,
GN:T:WP,Can the new infrastructure plan help fix climate change and save you money? | TheHill - The Hill,https://thehill.com/changing-america/opinion/568199-can-the-new-infrastructure-plan-help-fix-climate-change-and-save-you,
GN:T:WP,Biden administration says solar power could jump from 3% to 40% of US power by 2035 | TheHill - The Hill,https://thehill.com/changing-america/sustainability/energy/568194-biden-administration-says-solar-power-could-jump-from,
GN:T:WP,"'Dry wind event' may prompt power shutoff in Dunsmuir, Castella this evening - Mount Shasta Herald",https://www.mtshastanews.com/story/news/2021/08/17/pacific-power-may-turn-off-power-dunsmuir-castella-tuesday/8164398002/,
GN:T:WP,Energiekontor sells 3.6-MW wind project in Germany - Renewables Now,https://renewablesnow.com/news/energiekontor-sells-36-mw-wind-project-in-germany-751100/,
GN:T:WP,Lines to plug NYC into green power to be buried or submerged - WRAL,https://www.wral.com/lines-to-plug-nyc-into-green-power-to-be-buried-or-submerged/19830079/,
