feed,title,long_url,short_url
Medium,Do we really need politicians?,https://medium.com/p/ebab68926a06,
Medium,Top 10 AI Companies For 2023 To Work For | Top Artificial Intelligence Companies To Watch In 2023,https://medium.com/p/ecb62837aa37,
Medium,Working with Bayesian Frameworks part2(AI Frameworks),https://medium.com/p/7f9c28d02d1f,
Medium,Working with Bayesian Frameworks part1(AI Frameworks),https://medium.com/p/fab39008de71,
Medium,Progress in the use of Black-Box Optimization part3(Advanced Machine Learning),https://medium.com/p/e422d6c5e2ba,
Medium,Machine Learning in artificial intelligence | mL in AI 2023,https://medium.com/p/a22b37836d18,
