feed,title,long_url,short_url
RS,"A Multiplicity of Environmental, Economic and Social Factor Analyses to Understand COVID-19 Diffusion",https://www.researchsquare.com/article/rs-717943/latest,https://j.mp/3rp3L4x
RS,Spike Protein Recognizer Receptor ACE2 Targeted Identification of Potential Natural Antiviral Drug Candidates Against SARS-CoV-2,https://www.researchsquare.com/article/rs-640291/latest,https://j.mp/36WJ8mw
RS,Antibiotic resistance patterns in infections associated with health care in a Third Level Center with hospital reconversion in the COVID-19 pandemic,https://www.researchsquare.com/article/rs-685126/latest,https://j.mp/3xW9scF
RS,Immunity to SARS-CoV-2 in a Dialyzed Patient Who Developed COVID-19 Twenty Days After the Second Dose of BNT162b2 Vaccine: a Case Report,https://www.researchsquare.com/article/rs-711429/latest,https://j.mp/3zln3KL
RS,"Microvascular Injury With Secondary Edema, Bronchoconstriction and Vasoconstriction of Non-involved Lung Parenchymal Segments May Contribute to Clinical Deterioration of Non-critically Ill Patients Hospitalized for SARS-CoV-2 Pneumonia Without Evidence of Pulmonary Embolism: A Preliminary Study",https://www.researchsquare.com/article/rs-710833/latest,https://j.mp/2UrShRP
RS,Linked Nosocomial COVID-19 Outbreak in Three Facilities for People with Intellectual and Developmental Disabilities Due to SARS-CoV-2 Variant B.1.1.519 with Spike Mutation T478K in the Netherlands,https://www.researchsquare.com/article/rs-588064/latest,https://j.mp/3roWjGx
