feed,title,long_url,short_url
RS,Robotic Capital - Skill Complementarity,https://www.researchsquare.com/article/rs-1872766/latest,https://bit.ly/3vmz6HY
RS,Impact of the 99DOTS digital adherence technology on tuberculosis treatment outcomes in North India: a pre-post study,https://www.researchsquare.com/article/rs-1900171/latest,https://bit.ly/3vmz5DU
RS,Impact of Employee Digital Competence on the Relationship between Digital Autonomy and Innovative Work Behavior: A Systematic Review,https://www.researchsquare.com/article/rs-1857912/latest,https://bit.ly/3vmz5no
RS,A New Diagonal Quasi-Newton Algorithm for Unconstrained Optimization Problems,https://www.researchsquare.com/article/rs-1871447/latest,https://bit.ly/3SbaGv6
RS,"A mental health-informed, online health promotion program targeting physical activity and healthy eating for adults aged 60+ years: study protocol for the MovingTogether randomised controlled trial",https://www.researchsquare.com/article/rs-1607074/latest,https://bit.ly/3S6oxmn
RS,An enhanced YOLOv5 based on Color Harmony Algorithm for object detection in Unmanned Aerial Vehicle captured Images,https://www.researchsquare.com/article/rs-1876969/latest,https://bit.ly/3vmz6rs
RS,BotFinder: A Novel Framework for Social Bots Detection in Online Social Networks Based on Graph Embedding and Community Detection,https://www.researchsquare.com/article/rs-1871702/latest,https://bit.ly/3vmRwIP
