feed,title,long_url,short_url
GN:S:C,Effect of climate change on infectious diseases unknown to half of the population - EurekAlert,https://www.eurekalert.org/pub_releases/2020-11/uadb-eoc112520.php,
GN:S:C,Marin Voice: Civil Grand Jury gives supervisors a call for climate action - Marin Independent Journal,https://www.marinij.com/2020/11/25/marin-voice-civil-grand-jury-gives-supervisors-a-call-for-climate-action/,
GN:S:C,EU drafts deal to upgrade 2030 climate change target next month - EnerCom Inc,https://www.oilandgas360.com/eu-drafts-deal-to-upgrade-2030-climate-change-target-next-month/,
GN:S:C,Biden presidency to create 'big momentum' on tackling climate change: IEA's Birol - S&P Global,https://www.spglobal.com/platts/en/market-insights/latest-news/electric-power/112520-biden-presidency-to-create-big-momentum-on-tackling-climate-change-ieas-birol,
GN:S:C,Part 2: Recorded changes in Idaho's climate | Local News - KPVI News 6,https://www.kpvi.com/news/local_news/part-2-recorded-changes-in-idahos-climate/article_4bc50374-2f4c-11eb-adf2-a7c7a880b02e.html,
GN:S:C,Daybreak Nov 25: Biden building climate 'policy-making structure' - Agri-Pulse,https://www.agri-pulse.com/articles/14900-daybreak-nov-25-biden-building-climate-policy-making-structure,
