feed,title,long_url,short_url
GN:S:C,Fossil-fuel interests are 'carbon shaming' climate advocates - Business Insider,https://www.businessinsider.com/fossil-fuel-interests-target-climate-advocates-personally-2021-8,
GN:S:C,Experts expect climate change to cause more flooding in Vermont. Is the state ready? - vtdigger,https://vtdigger.org/2021/08/29/tropical-storm-irene-jamaica-climate-change/,
GN:S:C,"Maine Voices: The Maine reason we must act on climate, enact carbon cashback - Press Herald",https://www.pressherald.com/2021/08/29/maine-voices-the-maine-reason-we-must-act-on-climate/,
GN:S:C,Viewpoint: Fake meat is not the solution to climate change - Oklahoman,https://www.oklahoman.com/story/opinion/2021/08/29/fake-meat-is-not-the-solution-to-climate-change/5592966001/,
GN:S:C,"San Luis Valley water: Drought, climate change and diversion plans - The Colorado Sun",https://coloradosun.com/2021/08/29/san-luis-valley-water-diversion-drought-climate-change/,
GN:S:C,"State grants seed local projects to enhance forestry, economy — and fight against climate change - Berkshire Eagle",https://www.berkshireeagle.com/news/northern_berkshires/state-grants-seed-local-projects-to-enhance-forestry-economy-and-fight-against-climate-change/article_e13842c6-068e-11ec-ad31-af724bb1afbf.html,
GN:S:C,"California forum letters: Bee readers take on recall, climate change, homelessness - Sacramento Bee",https://www.sacbee.com/opinion/letters-to-the-editor/article253769588.html,
