feed,title,long_url,short_url
ArXiv,MobileASR: A resource-aware on-device personalisation framework for automatic speech recognition in mobile phones,https://arxiv.org/abs/2306.09384v1,
ArXiv,Fedstellar: A Platform for Decentralized Federated Learning,https://arxiv.org/abs/2306.09750v1,
ArXiv,Ensemble Framework for Cardiovascular Disease Prediction,https://arxiv.org/abs/2306.09989v1,
ArXiv,On the preferred extensions of argumentation frameworks: bijections with naive sets,https://arxiv.org/abs/2202.05506v2,
ArXiv,Prevention of cyberattacks in WSN and packet drop by CI framework and information processing protocol using AI and Big Data,https://arxiv.org/abs/2306.09448v1,
ArXiv,Framework and Benchmarks for Combinatorial and Mixed-variable Bayesian Optimization,https://arxiv.org/abs/2306.09803v1,
ArXiv,LabelBench: A Comprehensive Framework for Benchmarking Label-Efficient Learning,https://arxiv.org/abs/2306.09910v1,
ArXiv,Finding Reusable Machine Learning Components to Build Programming Language Processing Pipelines,https://arxiv.org/abs/2208.05596v2,
