feed,title,long_url,short_url
Medium,Create Your Own C# and F# Playground,https://medium.com/p/16a2568465df,
Medium,My Experience with Passing the Google Cloud Professional Machine Learning Engineer Certificate Exam,https://medium.com/p/2ccc700e7d08,
Medium,Image Compression with K-means Clustering,https://medium.com/p/48e989055729,
Medium,A Basic Overview of the Reinforcement Learning Techniques Behind DeepMind’s AlphaStar,https://medium.com/p/d79663d1608c,
Medium,Cybersecurity Awareness Month: Juniper Networks talks about cybersecurity and network privacy,https://medium.com/p/6494c8c25c3b,
