feed,title,long_url,short_url
GN:T:ML,"Deep machine-learning speeds assessment of fruit fly heart aging and disease, a model for human disease - University of Alabama at Birmingham",https://news.google.com/rss/articles/CBMikwFodHRwczovL3d3dy51YWIuZWR1L25ld3MvcmVzZWFyY2gvaXRlbS8xNDIzNi1kZWVwLW1hY2hpbmUtbGVhcm5pbmctc3BlZWRzLWFzc2Vzc21lbnQtb2YtZnJ1aXQtZmx5LWhlYXJ0LWFnaW5nLWFuZC1kaXNlYXNlLWEtbW9kZWwtZm9yLWh1bWFuLWRpc2Vhc2XSAQA?oc=5,https://da.gd/f9rlMd
GN:T:ML,Mintegral Enhances Intelligent UA with Advanced Machine Learning Model - Business Wire,https://news.google.com/rss/articles/CBMif2h0dHBzOi8vd3d3LmJ1c2luZXNzd2lyZS5jb20vbmV3cy9ob21lLzIwMjQwNzAzMTg1NTY1L2VuL01pbnRlZ3JhbC1FbmhhbmNlcy1JbnRlbGxpZ2VudC1VQS13aXRoLUFkdmFuY2VkLU1hY2hpbmUtTGVhcm5pbmctTW9kZWzSAQA?oc=5,https://da.gd/jSDa
GN:T:ML,Deriving general structure–activity/selectivity relationship patterns for different subfamilies of cyclin-dependent kinase inhibitors using machine learning methods | Scientific Reports - Nature,https://news.google.com/rss/articles/CBMiMmh0dHBzOi8vd3d3Lm5hdHVyZS5jb20vYXJ0aWNsZXMvczQxNTk4LTAyNC02NjE3My160gEA?oc=5,https://da.gd/7Jd3Mr
GN:T:ML,EU AI Act’s Opt-Out Trend May Limit Data Use for Training AI Models - The National Law Review,https://news.google.com/rss/articles/CBMiX2h0dHBzOi8vbmF0bGF3cmV2aWV3LmNvbS9hcnRpY2xlL2V1LWFpLWFjdHMtb3B0LW91dC10cmVuZC1tYXktbGltaXQtZGF0YS11c2UtdHJhaW5pbmctYWktbW9kZWxz0gFjaHR0cHM6Ly9uYXRsYXdyZXZpZXcuY29tL2FydGljbGUvZXUtYWktYWN0cy1vcHQtb3V0LXRyZW5kLW1heS1saW1pdC1kYXRhLXVzZS10cmFpbmluZy1haS1tb2RlbHM_YW1w?oc=5,https://da.gd/yygu
GN:T:ML,What specifications are needed for card edge connectors in AI/ML systems? - Design World Network,https://news.google.com/rss/articles/CBMiW2h0dHBzOi8vd3d3LmRlc2lnbndvcmxkb25saW5lLmNvbS9zcGVjaWZpY2F0aW9ucy1uZWVkZWQtY2FyZC1lZGdlLWNvbm5lY3RvcnMtYWktbWwtc3lzdGVtcy_SAQA?oc=5,https://da.gd/zxFPo
GN:T:ML,Avicenna.AI Secures MDR Certification for Medical Imaging AI Portfolio - AiThority,https://news.google.com/rss/articles/CBMibmh0dHBzOi8vYWl0aG9yaXR5LmNvbS9tYWNoaW5lLWxlYXJuaW5nL2F2aWNlbm5hLWFpLXNlY3VyZXMtbWRyLWNlcnRpZmljYXRpb24tZm9yLW1lZGljYWwtaW1hZ2luZy1haS1wb3J0Zm9saW8v0gEA?oc=5,https://da.gd/QTHiGi
