feed,title,long_url,short_url
GN:S:C,"When Tammy Murphy pushed to include climate change in K-12 standards, some balked - NorthJersey",https://news.google.com/rss/articles/CBMihwFodHRwczovL3d3dy5ub3J0aGplcnNleS5jb20vc3RvcnkvbmV3cy9lZHVjYXRpb24vMjAyMy8xMS8yNy90YW1teS1tdXJwaHktY2xpbWF0ZS1jaGFuZ2UtY3VycmljdWx1bS1rLTEyLWVkdWNhdGlvbi1zdGFuZGFyZC83MTY3MTgyMzAwNy_SAQA?oc=5,https://da.gd/BGaaux
GN:S:C,DC mayor travels to Dubai for climate change conference amid spiraling crime - Fox News,https://news.google.com/rss/articles/CBMiW2h0dHBzOi8vd3d3LmZveG5ld3MuY29tL3VzL2RjLW1heW9yLXRyYXZlbHMtZHViYWktY2xpbWF0ZS1jaGFuZ2UtY29uZmVyZW5jZS1zcGlyYWxpbmctY3JpbWXSAQA?oc=5,https://da.gd/uwTgYT
GN:S:C,Climate Assessment highlights a need for immediate action - UNM Daily Lobo,https://news.google.com/rss/articles/CBMiY2h0dHBzOi8vd3d3LmRhaWx5bG9iby5jb20vYXJ0aWNsZS8yMDIzLzExL2NsaW1hdGUtYXNzZXNzbWVudC1oaWdobGlnaHRzLWEtbmVlZC1mb3ItaW1tZWRpYXRlLWFjdGlvbtIBAA?oc=5,https://da.gd/VtpTMC
GN:S:C,Seven in ten people anticipate climate change will have a “severe ... - Ipsos in Canada,https://news.google.com/rss/articles/CBMif2h0dHBzOi8vd3d3Lmlwc29zLmNvbS9lbi9zZXZlbi1pbi10ZW4tcGVvcGxlLWFudGljaXBhdGUtY2xpbWF0ZS1jaGFuZ2Utd2lsbC1oYXZlLXNldmVyZS1lZmZlY3QtdGhlaXItYXJlYS13aXRoaW4tbmV4dC10ZW4teWVhcnPSAQA?oc=5,https://da.gd/0CiKJ
GN:S:C,Revealed: How colonial rule radically shifts historical responsibility ... - Carbon Brief,https://news.google.com/rss/articles/CBMidWh0dHBzOi8vd3d3LmNhcmJvbmJyaWVmLm9yZy9yZXZlYWxlZC1ob3ctY29sb25pYWwtcnVsZS1yYWRpY2FsbHktc2hpZnRzLWhpc3RvcmljYWwtcmVzcG9uc2liaWxpdHktZm9yLWNsaW1hdGUtY2hhbmdlL9IBAA?oc=5,https://da.gd/kGKeD8
GN:S:C,German economy minister: firms urgently need clarity on climate ... - Reuters,https://news.google.com/rss/articles/CBMilgFodHRwczovL3d3dy5yZXV0ZXJzLmNvbS9zdXN0YWluYWJpbGl0eS9zdXN0YWluYWJsZS1maW5hbmNlLXJlcG9ydGluZy9nZXJtYW4tZWNvbm9teS1taW5pc3Rlci1maXJtcy11cmdlbnRseS1uZWVkLWNsYXJpdHktY2xpbWF0ZS1maW5hbmNpbmctMjAyMy0xMS0yNy_SAQA?oc=5,https://da.gd/fVQsja
GN:S:C,"To fix the climate, think of food, soils, and trees - CIFOR Forests News - Forests News, Center for International Forestry Research",https://news.google.com/rss/articles/CBMiW2h0dHBzOi8vZm9yZXN0c25ld3MuY2lmb3Iub3JnLzg1MDE5L3RvLWZpeC10aGUtY2xpbWF0ZS10aGluay1vZi1mb29kLXNvaWxzLWFuZC10cmVlcz9mbmw9ZW7SAQA?oc=5,https://da.gd/6nRgaO
GN:S:C,Climate action at work made easy - The Ecologist,https://news.google.com/rss/articles/CBMiQmh0dHBzOi8vdGhlZWNvbG9naXN0Lm9yZy8yMDIzL25vdi8yNy9jbGltYXRlLWFjdGlvbi13b3JrLW1hZGUtZWFzedIBAA?oc=5,https://da.gd/89in04
GN:S:C,‘A great step forward’: ECB signs up to UN climate framework - The Guardian,https://news.google.com/rss/articles/CBMib2h0dHBzOi8vd3d3LnRoZWd1YXJkaWFuLmNvbS9zcG9ydC8yMDIzL25vdi8yNy9hLWdyZWF0LXN0ZXAtZm9yd2FyZC1jcmlja2V0LWVjYi1zaWducy11cC10by11bi1jbGltYXRlLWZyYW1ld29ya9IBb2h0dHBzOi8vYW1wLnRoZWd1YXJkaWFuLmNvbS9zcG9ydC8yMDIzL25vdi8yNy9hLWdyZWF0LXN0ZXAtZm9yd2FyZC1jcmlja2V0LWVjYi1zaWducy11cC10by11bi1jbGltYXRlLWZyYW1ld29yaw?oc=5,https://da.gd/WM35Q
GN:S:C,Climate protest: More than 100 arrested at world's largest coal port - BBC,https://news.google.com/rss/articles/CBMiMWh0dHBzOi8vd3d3LmJiYy5jb20vbmV3cy93b3JsZC1hdXN0cmFsaWEtNjc1Mzk3NTnSAQA?oc=5,https://da.gd/ygYRHX
GN:S:C,Climate Inequality Is More Than a Culture War - Bloomberg,https://news.google.com/rss/articles/CBMiY2h0dHBzOi8vd3d3LmJsb29tYmVyZy5jb20vb3Bpbmlvbi9hcnRpY2xlcy8yMDIzLTExLTI3L2NsaW1hdGUtaW5lcXVhbGl0eS1pcy1tb3JlLXRoYW4tYS1jdWx0dXJlLXdhctIBAA?oc=5,https://da.gd/GaJ9
GN:S:C,"UNHCR Environment and Climate Action in Hodh Chargui, South ... - ReliefWeb",https://news.google.com/rss/articles/CBMib2h0dHBzOi8vcmVsaWVmd2ViLmludC9yZXBvcnQvbWF1cml0YW5pYS91bmhjci1lbnZpcm9ubWVudC1hbmQtY2xpbWF0ZS1hY3Rpb24taG9kaC1jaGFyZ3VpLXNvdXRoLWVhc3QtbWF1cml0YW5pYdIBAA?oc=5,https://da.gd/gDhRRW
GN:S:C,Water and Sanitation hosts hybrid Climate Change and Water ... - South African Government,https://news.google.com/rss/articles/CBMidGh0dHBzOi8vd3d3Lmdvdi56YS9zcGVlY2hlcy9sZWFkaW5nLXNjaWVudGlzdHMtY29udmVyZ2UtbWFrZS1pbnB1dHMtcmV2aXNlZC1jbGltYXRlLWNoYW5nZS1zdHJhdGVneS0yNi1ub3YtMjAyMy0wMDAw0gEA?oc=5,https://da.gd/ibjma
