feed,title,long_url,short_url
GN:T:WP,The Best Home Wind Turbines of 2022 - Picks from Bob Vila - Bob Vila,https://www.bobvila.com/articles/best-home-wind-turbines/,
GN:T:WP,Romania launches 950MW renewables tender – pv magazine International - pv magazine International,https://www.pv-magazine.com/2022/04/01/romania-launches-950mw-renewables-tender/,
GN:T:WP,April 1st: Keeping on Your Toes - Electronic Design,https://www.electronicdesign.com/blogs/altembedded/article/21237261/electronic-design-april-1st-keeping-on-your-toes,
GN:T:WP,East Anglia ONE North Offshore Windfarm & East Anglia TWO Offshore Windfarm development consent decisions announced - GOV,https://www.gov.uk/government/news/east-anglia-one-north-offshore-windfarm-east-anglia-two-offshore-windfarmdevelopment-consent-decisions-announced,
GN:T:WP,Dale Vince to sell Ecotricity and go into politics - Daily Mail,https://www.dailymail.co.uk/news/article-10675459/Dale-Vince-sell-Ecotricity-politics.html,
