feed,title,long_url,short_url
ArXiv:q-bio,Integrating Latent Variable and Auto-Regressive Models for Goal-directed Molecule Generation,https://arxiv.org/abs/2409.00046,
ArXiv:q-bio,"Dogs on forest trails; Understanding ecology of Striped Hyena and wild Canids in the presence of free-ranging dogs in Udanti-Sitanadi Tiger Reserve, Central India using Joint Distribution and Deep Neural Networks",https://arxiv.org/abs/2409.00185,
ArXiv:q-bio,Trophic Cascades and Habitat Suitability in Udanti Sitnadi Tiger Reserve: Impacts of Prey Depletion and Climate Change on Predator Prey Dynamics,https://arxiv.org/abs/2409.00193,
ArXiv:q-bio,Quantitative Prediction of Protein-Polyelectrolyte Binding Thermodynamics: Adsorption of Heparin-Analog Polysulfates to the SARS-CoV-2 Spike Protein RBD,https://arxiv.org/abs/2409.00210,
ArXiv:q-bio,ProteinRPN: Towards Accurate Protein Function Prediction with Graph-Based Region Proposals,https://arxiv.org/abs/2409.00610,
ArXiv:q-bio,BWT construction and search at the terabase scale,https://arxiv.org/abs/2409.00613,
ArXiv:q-bio,Video-based Analysis Reveals Atypical Social Gaze in People with Autism Spectrum Disorder,https://arxiv.org/abs/2409.00664,
ArXiv:q-bio,"Associations between exposure to OPEs and rheumatoid arthritis risk among adults in NHANES, 2011-2018",https://arxiv.org/abs/2409.00745,
ArXiv:q-bio,Analysis of a mathematical model for malaria using data-driven approach,https://arxiv.org/abs/2409.00795,
ArXiv:q-bio,Exploring Neurofunctional Phase Transition Patterns in Autism Spectrum Disorder: A Thermodynamics Parameters Analysis Approach,https://arxiv.org/abs/2409.01039,
ArXiv:q-bio,Compartment model of strategy-dependent time delays in replicator dynamics,https://arxiv.org/abs/2409.01116,
ArXiv:q-bio,Mathematical model of CAR-T-cell therapy for a B-cell Lymphoma lymph node,https://arxiv.org/abs/2409.01164,
ArXiv:q-bio,MRI-based and metabolomics-based age scores act synergetically for mortality prediction shown by multi-cohort federated learning,https://arxiv.org/abs/2409.01235,
ArXiv:q-bio,Causal loop and Stock-Flow Modeling of Signal Transduction Pathways,https://arxiv.org/abs/2409.01267,
ArXiv:q-bio,Real-Time Machine Learning Strategies for a New Kind of Neuroscience Experiments,https://arxiv.org/abs/2409.01280,
ArXiv:q-bio,Bumblebees Exhibit Adaptive Flapping Responses to Air Disturbances,https://arxiv.org/abs/2409.01299,
ArXiv:q-bio,Quantum panprotopsychism and the structure and subject-summing combination problem,https://arxiv.org/abs/2409.01368,
ArXiv:q-bio,Deep multivariate autoencoder for capturing complexity in Brain Structure and Behaviour Relationships,https://arxiv.org/abs/2409.01638,
ArXiv:q-bio,Exact computation of Transfer Entropy with Path Weight Sampling,https://arxiv.org/abs/2409.01650,
ArXiv:q-bio,Toward Capturing Genetic Epistasis From Multivariate Genome-Wide Association Studies Using Mixed-Precision Kernel Ridge Regression,https://arxiv.org/abs/2409.01712,
ArXiv:q-bio,Decoding finger velocity from cortical spike trains with recurrent spiking neural networks,https://arxiv.org/abs/2409.01762,
ArXiv:q-bio,Anti-seizure medication load is not correlated with early termination of seizure spread,https://arxiv.org/abs/2409.01767,
ArXiv:q-bio,Numerical Study of Interaction Network Structures in Competitive Ecosystems,https://arxiv.org/abs/2409.01894,
ArXiv:q-bio,Connectivity structure and dynamics of nonlinear recurrent neural networks,https://arxiv.org/abs/2409.01969,
ArXiv:q-bio,FedMinds: Privacy-Preserving Personalized Brain Visual Decoding,https://arxiv.org/abs/2409.02044,
ArXiv:q-bio,Anatomical Connections of Primate Mediodorsal and Motor Thalamic Nuclei with the Cortex,https://arxiv.org/abs/2409.02065,
ArXiv:q-bio,Taming Randomness in Agent-Based Models using Common Random Numbers,https://arxiv.org/abs/2409.02086,
ArXiv:q-bio,A note on promotion time cure models with a new biological consideration,https://arxiv.org/abs/2408.17188,
ArXiv:q-bio,Cognitive Networks and Performance Drive fMRI-Based State Classification Using DNN Models,https://arxiv.org/abs/2409.00003,
ArXiv:q-bio,EEG Right & Left Voluntary Hand Movement-based Virtual Brain-Computer Interfacing Keyboard with Machine Learning and a Hybrid Bi-Directional LSTM-GRU Model,https://arxiv.org/abs/2409.00035,
ArXiv:q-bio,Uncertainty Quantification of Antibody Measurements: Physical Principles and Implications for Standardization,https://arxiv.org/abs/2409.00191,
ArXiv:q-bio,Statistical mechanics for networks of real neurons,https://arxiv.org/abs/2409.00412,
ArXiv:q-bio,Large Language Models-Enabled Digital Twins for Precision Medicine in Rare Gynecological Tumors,https://arxiv.org/abs/2409.00544,
ArXiv:q-bio,Transient contacts between filaments impart its elasticity to branched actin,https://arxiv.org/abs/2409.00549,
ArXiv:q-bio,Synchronized Memory-Dependent Intracellular Oscillations for a Cell-Bulk ODE-PDE Model in $\mathbb{R}^2$,https://arxiv.org/abs/2409.00623,
ArXiv:q-bio,Adapting Physics-Informed Neural Networks for Bifurcation Detection in Ecological Migration Models,https://arxiv.org/abs/2409.00651,
ArXiv:q-bio,Living porous ceramics for bacteria-regulated gas sensing and carbon capture,https://arxiv.org/abs/2409.00789,
ArXiv:q-bio,Beyond Efficiency: Molecular Data Pruning for Enhanced Generalization,https://arxiv.org/abs/2409.01081,
ArXiv:q-bio,Modeling contagious disease spreading,https://arxiv.org/abs/2409.01103,
ArXiv:q-bio,Forecasting infectious disease prevalence with associated uncertainty using neural networks,https://arxiv.org/abs/2409.01154,
ArXiv:q-bio,Swarm Systems as a Platform for Open-Ended Evolutionary Dynamics,https://arxiv.org/abs/2409.01469,
ArXiv:q-bio,Algebraic and diagrammatic methods for the rule-based modeling of multi-particle complexes,https://arxiv.org/abs/2409.01529,
ArXiv:q-bio,Mechanisms underlying the response of mouse cortical networks to optogenetic manipulation,https://arxiv.org/abs/1907.00816,
ArXiv:q-bio,From Static to Dynamic Structures: Improving Binding Affinity Prediction with Graph-Based Deep Learning,https://arxiv.org/abs/2208.10230,
ArXiv:q-bio,Categorization and analysis of 14 computational methods for estimating cell potency from single-cell RNA-seq data,https://arxiv.org/abs/2309.13518,
ArXiv:q-bio,Equivariant Scalar Fields for Molecular Docking with Fast Fourier Transforms,https://arxiv.org/abs/2312.04323,
ArXiv:q-bio,A model-based assessment of social isolation practices for COVID-19 outbreak response in residential care facilities,https://arxiv.org/abs/2401.01371,
ArXiv:q-bio,Multi-Fidelity Active Learning with GFlowNets,https://arxiv.org/abs/2306.11715,
ArXiv:q-bio,Enhancing Cell Tracking with a Time-Symmetric Deep Learning Approach,https://arxiv.org/abs/2308.03887,
