feed,title,long_url,short_url
GN:T:WP,Wind farm valuation judgement could impact schools | Ponca City News - Ponca City News,https://www.poncacitynews.com/news/wind-farm-valuation-judgement-could-impact-schools,
GN:T:WP,the world's first foldable iPhone is here - and it wasn't made by apple - Designboom,https://www.designboom.com/technology/world-first-foldable-iphone-not-made-apple-kjmx-10-11-2022/,
GN:T:WP,Norton Rose Fulbright advises Gore Street on battery storage project acquisition - Energy Global,https://www.energyglobal.com/energy-storage/10112022/norton-rose-fulbright-advises-gore-street-on-battery-storage-project-acquisition/,
GN:T:WP,EUROPE POWER-Fall in French demand lowers day-ahead price - Nasdaq,https://www.nasdaq.com/articles/europe-power-fall-in-french-demand-lowers-day-ahead-price,
GN:T:WP,N.J. DEP Continues Application Process for Ocean Wind 1 with Hearings - North American Windpower,https://nawindpower.com/n-j-dep-continues-application-process-for-ocean-wind-1-with-hearings,
GN:T:WP,India's hybrid wind-solar project pipeline continues to grow - pv magazine International,https://www.pv-magazine.com/2022/11/10/indias-hybrid-wind-solar-project-pipeline-continues-to-grow/,
GN:T:WP,"Nature's Generator, Inc. Releases Nature's Generator Powerhouse Wind Turbine - PR Newswire",https://www.prnewswire.com/news-releases/natures-generator-inc-releases-natures-generator-powerhouse-wind-turbine-301673924.html,
GN:T:WP,Greenhouse gas emissions could be ‘three times higher’ than oil and gas producers claim - Euronews,https://www.euronews.com/green/2022/11/09/greenhouse-gas-emissions-could-be-three-times-higher-than-oil-and-gas-producers-claim,
GN:T:WP,"Rooftop Solar Is Becoming More Accessible to People with Lower Incomes, But Not Fast Enough - InsideClimate News",https://insideclimatenews.org/news/10112022/inside-clean-energy-rooftop-solar-affordability/,
GN:T:WP,"UK at risk of facing energy shortages, report says - E&T Magazine",https://eandt.theiet.org/content/articles/2022/11/uk-at-risk-of-facing-energy-shortages-report-says/,
GN:T:WP,"Viasat, Cobham Satcom Announce Collaboration - MarineLink",https://www.marinelink.com/news/viasat-cobham-satcom-announce-500849,
GN:T:WP,"Nicole causes Florida power outages, flooding, wind damage as it moves north - UPI News",https://www.upi.com/Top_News/US/2022/11/10/Nicole-flooding-power-outages/5701668089902/,
