feed,title,long_url,short_url
RS,Partial-privacy Image Encryption Algorithm Based on Time-varying Delayed Exponentially Controlled Chaotic System,https://www.researchsquare.com/article/rs-3878123/latest,https://da.gd/I4Oq2
RS,Adaptive Lqr-based Control of 3 Dof Spherical Articulated Robotic Manipulator,https://www.researchsquare.com/article/rs-3899125/latest,https://da.gd/Atcm
RS,Research on Water Quality Prediction of Mine Surroundings Based on Improved Machine Learning Algorithm,https://www.researchsquare.com/article/rs-3856310/latest,https://da.gd/NsFuD
RS,Bio-inspired multimodal learning with organic neuromorphic electronics for behavioral conditioning in robotics,https://www.researchsquare.com/article/rs-3878146/latest,https://da.gd/nP4ue
RS,Machine Learning of Speckle Images Assisted Wearable Temperature Skin with Implanted Fiber Optic Sensor,https://www.researchsquare.com/article/rs-3897348/latest,https://da.gd/ehJ9IF
RS,Fractional variational integrators based on convolution quadrature,https://www.researchsquare.com/article/rs-3900129/latest,https://da.gd/raYjuY
RS,Dynamic Spectrum Allocation: Unleashing the Power of DRL-RW Algorithm in UAV-Based Energy Harvesting Networks,https://www.researchsquare.com/article/rs-3896351/latest,https://da.gd/RJ71O1
RS,Metaheuristic hybrid deep learning-based channel estimation and precoding for millimeter-wave massive MIMO system,https://www.researchsquare.com/article/rs-3893726/latest,https://da.gd/hTndru
RS,Comparative Study of ML Algorithms for Garbage Classification,https://www.researchsquare.com/article/rs-3903806/latest,https://da.gd/xLZD
