feed,title,long_url,short_url
GN:S:C,"Gina McCarthy, Top Climate Adviser, Is Said to Be Planning Departure - The New York Times",https://www.nytimes.com/2022/04/14/climate/gina-mccarthy-climate-adviser.html,
GN:S:C,How to prepare for mandatory climate change disclosure - Corporate Secretary,https://www.corporatesecretary.com/articles/esg/32983/how-prepare-mandatory-climate-change-disclosure,
GN:S:C,Climate Change Is Exacerbating Stress and Anxiety Among Farmers - Earth Island Journal,https://www.earthisland.org/journal/index.php/articles/entry/climate-change-is-exacerbating-stress-and-anxiety-among-farmers,
GN:S:C,"No red alert, 300 dead - Climate Weekly - Climate Home",https://www.climatechangenews.com/2022/04/14/no-red-alert-300-dead-climate-weekly/,
GN:S:C,Eric Engle: Climate change is an existential emergency (Opinion) - Charleston Gazette-Mail,https://www.wvgazettemail.com/opinion/op_ed_commentaries/eric-engle-climate-change-is-an-existential-emergency-opinion/article_1e1a7718-22d8-57c8-9830-15ae726302bc.html,
GN:S:C,Massachusetts Senate debating sweeping climate change bill - The Associated Press - en Español,https://apnews.com/aacea513d75fa82c3e056b7887938855,
GN:S:C,Supreme Court may toss an 'important tool' for regulating climate change - Yahoo News,https://news.yahoo.com/supreme-court-may-toss-an-important-tool-for-regulating-climate-change-204219368.html,
