feed,title,long_url,short_url
ArXiv,Universal Layout Emulation for Long-Term Database Archival,https://arxiv.org/abs/2009.02678v1,
ArXiv,Collaborative Management of Benchmark Instances and their Attributes,https://arxiv.org/abs/2009.02995v1,
ArXiv,Faster motif counting via succinct color coding and adaptive sampling,https://arxiv.org/abs/2009.03052v1,
ArXiv,Efficient Network Reliability Computation in Uncertain Graphs,https://arxiv.org/abs/2009.03158v1,
ArXiv,RHEEMix in the Data Jungle: A Cost-based Optimizer for Cross-platform Systems,https://arxiv.org/abs/1805.03533v3,
ArXiv,A Fully Dynamic Algorithm for k-Regret Minimizing Sets,https://arxiv.org/abs/2005.14493v2,
