feed,title,long_url,short_url
GN:S:C,10 cities where climate change is likely to be the worst by 2050 - Business Insider,https://news.google.com/rss/articles/CBMiaGh0dHBzOi8vd3d3LmJ1c2luZXNzaW5zaWRlci5jb20vY2l0aWVzLXdoZXJlLWNsaW1hdGUtY2hhbmdlLWlzLXRoZS13b3JzdC1mbG9vZGluZy1oZWF0LXdpbGRmaXJlcy0yMDIzLTEy0gFsaHR0cHM6Ly93d3cuYnVzaW5lc3NpbnNpZGVyLmNvbS9jaXRpZXMtd2hlcmUtY2xpbWF0ZS1jaGFuZ2UtaXMtdGhlLXdvcnN0LWZsb29kaW5nLWhlYXQtd2lsZGZpcmVzLTIwMjMtMTI_YW1w?oc=5,https://da.gd/mg35r
GN:S:C,Southwest Chicago is hottest part of the city during July 2023 climate study - Chicago Sun-Times,https://news.google.com/rss/articles/CBMidmh0dHBzOi8vY2hpY2Fnby5zdW50aW1lcy5jb20vMjAyMy8xMi8yOC8yNDAxNzY3My9zb3V0aHdlc3QtY2hpY2Fnby1pcy1ob3R0ZXN0LXBhcnQtb2YtY2l0eS1kdXJpbmctc3VtbWVyLWNsaW1hdGUtc3R1ZHnSAQA?oc=5,https://da.gd/Cjmy
GN:S:C,Climate change is forcing Pacific Northwest trees to move—but scientists can’t agree on what form of ‘assisted migration’ is best - Fortune,https://news.google.com/rss/articles/CBMiXWh0dHBzOi8vZm9ydHVuZS5jb20vMjAyMy8xMi8yOC9jbGltYXRlLWNoYW5nZS10cmVlcy1taWdyYXRpb24tcGFjaWZpYy1ub3J0aHdlc3QtbmV3LWhhYml0YXRzL9IBYWh0dHBzOi8vZm9ydHVuZS5jb20vMjAyMy8xMi8yOC9jbGltYXRlLWNoYW5nZS10cmVlcy1taWdyYXRpb24tcGFjaWZpYy1ub3J0aHdlc3QtbmV3LWhhYml0YXRzL2FtcC8?oc=5,https://da.gd/qBwhe
GN:S:C,Maryland offers road map for fighting climate change - The Baltimore Banner,https://news.google.com/rss/articles/CBMicmh0dHBzOi8vd3d3LnRoZWJhbHRpbW9yZWJhbm5lci5jb20vY29tbXVuaXR5L2NsaW1hdGUtZW52aXJvbm1lbnQvbWFyeWxhbmQtY2xpbWF0ZS1wbGFuLUlSSktGV0FHNFZIQUxDNllINjRUN0RWUkhVL9IBAA?oc=5,https://da.gd/T2mTdz
GN:S:C,Climate experts say Milwaukee is on track to be the warmest it's ever been in recorded history - WDJT,https://news.google.com/rss/articles/CBMieGh0dHBzOi8vd3d3LmNiczU4LmNvbS9uZXdzL2NsaW1hdGUtZXhwZXJ0cy1zYXktbWlsd2F1a2VlLWlzLW9uLXRyYWNrLXRvLWJlLXRoZS13YXJtZXN0LWl0cy1ldmVyLWJlZW4taW4tcmVjb3JkZWQtaGlzdG9yedIBAA?oc=5,https://da.gd/6iG5ne
GN:S:C,Want to Avoid Leaving Climate-Smart Money On the Table? There's An App for That - Pork Magazine,https://news.google.com/rss/articles/CBMiYmh0dHBzOi8vd3d3LnBvcmtidXNpbmVzcy5jb20vbmV3cy9pbmR1c3RyeS93YW50LWF2b2lkLWxlYXZpbmctY2xpbWF0ZS1zbWFydC1tb25leS10YWJsZS10aGVyZXMtYXBw0gEA?oc=5,https://da.gd/rg5fkx
GN:S:C,CSRWire - Alibaba's Freshippo Shows How It Harnesses Tech To Combat Climate Change at COP28 - CSRwire,https://news.google.com/rss/articles/CBMieGh0dHBzOi8vd3d3LmNzcndpcmUuY29tL3ByZXNzX3JlbGVhc2VzLzc5MTk0Ni1hbGliYWJhcy1mcmVzaGlwcG8tc2hvd3MtaG93LWl0LWhhcm5lc3Nlcy10ZWNoLWNvbWJhdC1jbGltYXRlLWNoYW5nZS1jb3AyONIBAA?oc=5,https://da.gd/t8BkWx
GN:S:C,"Climate change letting more invasive plants make their way to Illinois, Great Lakes region - Chicago Sun-Times",https://news.google.com/rss/articles/CBMia2h0dHBzOi8vY2hpY2Fnby5zdW50aW1lcy5jb20vMjAyMy8xMi8yOC8yNDAxNzc1Mi9jbGltYXRlLWNoYW5nZS1pbnZhc2l2ZS1wbGFudHMtaWxsaW5vaXMtZ3JlYXQtbGFrZXMtcmVnaW9u0gEA?oc=5,https://da.gd/Za9NlN
GN:S:C,The climate crisis in 2023 - CGTN America,https://news.google.com/rss/articles/CBMiPmh0dHBzOi8vYW1lcmljYS5jZ3RuLmNvbS8yMDIzLzEyLzI4L3RoZS1jbGltYXRlLWNyaXNpcy1pbi0yMDIz0gEA?oc=5,https://da.gd/LQXUC3
