feed,title,long_url,short_url
Medium,Machine learning with Biology !,https://medium.com/p/e178921f49a5,
Medium,How to create a touchless interface in the browser with Tensorflow.js,https://medium.com/p/6cfcbfabe5de,
Medium,Lineer Regresyon ve sklearn: Kısım 2,https://medium.com/p/314e9f404157,
Medium,Lineer Regresyon ve sklearn: Kısım 1,https://medium.com/p/2fd7b1094b6f,
Medium,Google Launches New Pixel Phone with ML Front and Center,https://medium.com/p/4850707a2ec4,
Medium,Beyond the Dashboard,https://medium.com/p/74cc68745860,
Medium,Google Launches New Pixel Phone with ML Front and Center,https://medium.com/p/87fa090509e,
Medium,DAY 1-Machine learning with Python,https://medium.com/p/d25f43855dc9,
Medium,Part-of-Speech Tagging,https://medium.com/p/9346afc20105,
