feed,title,long_url,short_url
ArXiv:cs,3D Molecular Geometry Analysis with 2D Graphs,https://arxiv.org/abs/2305.13315v1,
ArXiv:cs,A Novel Dataset Towards Extracting Virus-Host Interactions,https://arxiv.org/abs/2305.13317v1,
ArXiv:cs,Evaluating LeNet Algorithms in Classification Lung Cancer from Iraq-Oncology Teaching Hospital/National Center for Cancer Diseases,https://arxiv.org/abs/2305.13333v1,
ArXiv:cs,BioDEX: Large-Scale Biomedical Adverse Drug Event Extraction for Real-World Pharmacovigilance,https://arxiv.org/abs/2305.13395v1,
ArXiv:cs,Evaluating Model Performance in Medical Datasets Over Time,https://arxiv.org/abs/2305.13426v1,
ArXiv:cs,Differentially Private Medians and Interior Points for Non-Pathological Data,https://arxiv.org/abs/2305.13440v1,
ArXiv:cs,Trend Investigation of Biopotential Recording Front-End Channels for Invasive and Non-Invasive Applications,https://arxiv.org/abs/2305.13463v1,
ArXiv:cs,Advancing Community Engaged Approaches to Identifying Structural Drivers of Racial Bias in Health Diagnostic Algorithms,https://arxiv.org/abs/2305.13485v1,
ArXiv:cs,Detection of healthy and diseased crops in drone captured images using Deep Learning,https://arxiv.org/abs/2305.13490v1,
ArXiv:cs,A Study of Generative Large Language Model for Medical Research and Healthcare,https://arxiv.org/abs/2305.13523v1,
ArXiv:cs,LLM-empowered Chatbots for Psychiatrist and Patient Simulation: Application and Evaluation,https://arxiv.org/abs/2305.13614v1,
ArXiv:cs,Automated Metrics for Medical Multi-Document Summarization Disagree with Human Evaluations,https://arxiv.org/abs/2305.13693v1,
ArXiv:cs,Human Body Pose Estimation for Gait Identification: A Comprehensive Survey of Datasets and Models,https://arxiv.org/abs/2305.13765v1,
ArXiv:cs,Detecting automatically the layout of clinical documents to enhance the performances of downstream natural language processing,https://arxiv.org/abs/2305.13817v1,
ArXiv:cs,KidneyRegNet: A Deep Learning Method for 3DCT-2DUS Kidney Registration during Breathing,https://arxiv.org/abs/2305.13855v1,
ArXiv:cs,Probing Brain Context-Sensitivity with Masked-Attention Generation,https://arxiv.org/abs/2305.13863v1,
ArXiv:cs,Metrics Matter in Surgical Phase Recognition,https://arxiv.org/abs/2305.13961v1,
ArXiv:cs,Dual-modality Smart Shoes for Quantitative Assessment of Hemiplegic Patients' Lower Limbs' Muscle Strength,https://arxiv.org/abs/2305.13977v1,
ArXiv:cs,Control of a simulated MRI scanner with deep reinforcement learning,https://arxiv.org/abs/2305.13979v1,
ArXiv:cs,Automated Claustrum Segmentation in Human Brain MRI Using Deep Learning,https://arxiv.org/abs/2008.03465v3,
ArXiv:cs,Federated Cross Learning for Medical Image Segmentation,https://arxiv.org/abs/2204.02450v2,
ArXiv:cs,Can NLI Provide Proper Indirect Supervision for Low-resource Biomedical Relation Extraction?,https://arxiv.org/abs/2212.10784v2,
ArXiv:cs,Conditional Diffusion Based on Discrete Graph Structures for Molecular Graph Generation,https://arxiv.org/abs/2301.00427v2,
ArXiv:cs,Longformer: Longitudinal Transformer for Alzheimer's Disease Classification with Structural MRIs,https://arxiv.org/abs/2302.00901v3,
ArXiv:cs,SE(3) diffusion model with application to protein backbone generation,https://arxiv.org/abs/2302.02277v3,
ArXiv:cs,Benchmarking ChatGPT-4 on ACR Radiation Oncology In-Training (TXIT) Exam and Red Journal Gray Zone Cases: Potentials and Challenges for AI-Assisted Medical Education and Decision Making in Radiation Oncology,https://arxiv.org/abs/2304.11957v3,
ArXiv:cs,Parameter-Efficient Fine-Tuning for Medical Image Analysis: The Missed Opportunity,https://arxiv.org/abs/2305.08252v2,
ArXiv:cs,NUANCE: Near Ultrasound Attack On Networked Communication Environments,https://arxiv.org/abs/2305.10358v2,
ArXiv:cs,Numerical solution of the incompressible Navier-Stokes equations for chemical mixers via quantum-inspired Tensor Train Finite Element Method,https://arxiv.org/abs/2305.10784v2,
ArXiv:cs,Multilingual Simplification of Medical Texts,https://arxiv.org/abs/2305.12532v2,
