feed,title,long_url,short_url
GN:T:AI,Microsoft to unveil AI devices and features ahead of developer conference - Reuters,https://news.google.com/rss/articles/CBMibmh0dHBzOi8vd3d3LnJldXRlcnMuY29tL3RlY2hub2xvZ3kvbWljcm9zb2Z0LXVudmVpbC1haS1kZXZpY2VzLWZlYXR1cmVzLWFoZWFkLWRldmVsb3Blci1jb25mZXJlbmNlLTIwMjQtMDUtMjAv0gEA?oc=5,https://da.gd/fxfPS
GN:T:AI,"Frustration grows over Google's AI Overviews feature, how to disable - BleepingComputer",https://news.google.com/rss/articles/CBMicGh0dHBzOi8vd3d3LmJsZWVwaW5nY29tcHV0ZXIuY29tL25ld3MvZ29vZ2xlL2ZydXN0cmF0aW9uLWdyb3dzLW92ZXItZ29vZ2xlcy1haS1vdmVydmlld3MtZmVhdHVyZS1ob3ctdG8tZGlzYWJsZS_SAXRodHRwczovL3d3dy5ibGVlcGluZ2NvbXB1dGVyLmNvbS9uZXdzL2dvb2dsZS9mcnVzdHJhdGlvbi1ncm93cy1vdmVyLWdvb2dsZXMtYWktb3ZlcnZpZXdzLWZlYXR1cmUtaG93LXRvLWRpc2FibGUvYW1wLw?oc=5,https://da.gd/wP27
GN:T:AI,TikTok Parent ByteDance Now Has China's Most Popular AI Chatbot - Bloomberg,https://news.google.com/rss/articles/CBMicmh0dHBzOi8vd3d3LmJsb29tYmVyZy5jb20vbmV3cy9hcnRpY2xlcy8yMDI0LTA1LTIwL3Rpa3Rvay1wYXJlbnQtYnl0ZWRhbmNlLW5vdy1oYXMtY2hpbmEtcy1tb3N0LXBvcHVsYXItYWktY2hhdGJvdNIBAA?oc=5,https://da.gd/LsEvs
GN:T:AI,Missed Out on Nvidia's Ginormous Gains? Here's an Artificial Intelligence (AI) Stock You Can Buy Right Now. - The Motley Fool,https://news.google.com/rss/articles/CBMiXWh0dHBzOi8vd3d3LmZvb2wuY29tL2ludmVzdGluZy8yMDI0LzA1LzIwL252aWRpYS1hcnRpZmljaWFsLWludGVsbGlnZW5jZS1zdG9jay1idXktcmlnaHQtbm93L9IBAA?oc=5,https://da.gd/nOVCU
GN:T:AI,This Company Will Turn Your Dying Relative Into an AI Chatbot For $50K - 80,https://news.google.com/rss/articles/CBMiY2h0dHBzOi8vODAubHYvYXJ0aWNsZXMvZm9yLXVzZDUwLTAwMC10aGlzLWNvbXBhbnktd2lsbC10dXJuLXlvdXItZHlpbmctcmVsYXRpdmUtaW50by1hbi1haS1jaGF0Ym90L9IBAA?oc=5,https://da.gd/IzInF
