feed,title,long_url,short_url
GN:T:RE,Workshop on reporting net zero transition [India] - International Journalists' Network,https://ijnet.org/en/opportunity/workshop-reporting-net-zero-transition-india,
GN:T:RE,EU strikes deal to ban the sale of new diesel and gasoline cars from 2035 - CNBC,https://www.cnbc.com/2022/10/28/eu-pushes-ahead-with-plan-to-ban-new-diesel-gasoline-cars.html,
GN:T:RE,"New solar capacity 10 times cheaper than gas, says Rystad - pv magazine International",https://www.pv-magazine.com/2022/10/27/new-solar-capacity-10-times-cheaper-than-gas-says-rystad/,
GN:T:RE,The CyberPower ValuePro VP1600ELCD 1600 VA UPS Review: A Solid Budget Power Backup - AnandTech,https://www.anandtech.com/show/17622/the-cyberpower-valuepro-vp1600elcd-1600-va-ups-review,
GN:T:RE,An influential energy group sees reason for climate optimism - NPR,https://www.npr.org/2022/10/27/1132003727/an-influential-energy-group-sees-reason-for-climate-optimism,
GN:T:RE,Norwegian energy associations merge to create new entity - Energy Digital,https://energydigital.com/renewable-energy/norwegian-energy-associations-merge-to-create-new-entity,
