feed,title,long_url,short_url
GN:T:CC,ExxonMobil: Oil giant predicted climate change in 1970s - scientists - BBC,https://www.bbc.com/news/science-environment-64241994,https://da.gd/jGLKQ
GN:T:CC,North America's Biggest Sources Of Electricity By State And Province - OilPrice,https://oilprice.com/Energy/Energy-General/North-Americas-Biggest-Sources-Of-Electricity-By-State-And-Province.html,https://da.gd/KgUgte
GN:T:CC,Study: Exxon Mobil accurately predicted warming since 1970s - Phys,https://phys.org/news/2023-01-exxon-mobil-accurately-1970s.html,https://da.gd/38NyM
GN:T:CC,Climate Change Is Cutting Into Safe Fishing Weather - The Atlantic,https://www.theatlantic.com/science/archive/2023/01/indian-ocean-storms-affect-fishing/672730/,https://da.gd/huc8K
GN:T:CC,"Climate change, biodiversity efforts inseparable as mass extinction looms - South China Morning Post",https://www.scmp.com/comment/opinion/article/3206873/efforts-combat-climate-change-and-biodiversity-loss-are-inseparable-new-mass-extinction-looms,https://da.gd/dOqQYk
