feed,title,long_url,short_url
GN:T:CC,"Water crisis could cause US 58 trillion in economic value, food security and sustainability - Kuensel, Buhutan's National Newspaper",https://news.google.com/rss/articles/CBMidWh0dHBzOi8va3VlbnNlbG9ubGluZS5jb20vd2F0ZXItY3Jpc2lzLWNvdWxkLWNhdXNlLXVzLTU4LXRyaWxsaW9uLWluLWVjb25vbWljLXZhbHVlLWZvb2Qtc2VjdXJpdHktYW5kLXN1c3RhaW5hYmlsaXR5L9IBAA?oc=5,https://da.gd/RPxXz
GN:T:CC,The role of AI and Exponential Technologies in Sustainable Solutions - Forbes Middle East,https://news.google.com/rss/articles/CCAiC2g2Sm00ZG94aXM4mAEB?oc=5,https://da.gd/7KJ8A
GN:T:CC,Michigan steps up dam removal in race against climate change - Bridge Michigan,https://news.google.com/rss/articles/CBMiamh0dHBzOi8vd3d3LmJyaWRnZW1pLmNvbS9taWNoaWdhbi1lbnZpcm9ubWVudC13YXRjaC9taWNoaWdhbi1zdGVwcy1kYW0tcmVtb3ZhbC1yYWNlLWFnYWluc3QtY2xpbWF0ZS1jaGFuZ2XSAQA?oc=5,https://da.gd/TNy7SB
GN:T:CC,Trapped as fire raged: deadly perils in Mexico for migrants escaping climate catastrophe - The Guardian,https://news.google.com/rss/articles/CBMiX2h0dHBzOi8vd3d3LnRoZWd1YXJkaWFuLmNvbS93b3JsZC8yMDIzL29jdC8xOC9kZXZhc3RhdGluZy1qb3VybmV5LXRvLWVzY2FwZS1jbGltYXRlLWNhdGFzdHJvcGhl0gFfaHR0cHM6Ly9hbXAudGhlZ3VhcmRpYW4uY29tL3dvcmxkLzIwMjMvb2N0LzE4L2RldmFzdGF0aW5nLWpvdXJuZXktdG8tZXNjYXBlLWNsaW1hdGUtY2F0YXN0cm9waGU?oc=5,https://da.gd/tMYQ
GN:T:CC,Another weapon to fight climate change? Put carbon back where we found it - National Geographic,https://news.google.com/rss/articles/CBMiSmh0dHBzOi8vd3d3Lm5hdGlvbmFsZ2VvZ3JhcGhpYy5jb20vcHJlbWl1bS9hcnRpY2xlL3JlbW92ZS1jYXJib24tZW1pc3Npb25z0gEA?oc=5,https://da.gd/3ONbPN
