feed,title,long_url,short_url
GN:S:GW,Will the Earth breach its 1.5C guardrail sooner than we thought? - The Guardian,https://news.google.com/rss/articles/CBMigAFodHRwczovL3d3dy50aGVndWFyZGlhbi5jb20vZW52aXJvbm1lbnQvY29tbWVudGlzZnJlZS8yMDIzL29jdC8xOS93aWxsLXRoZS1lYXJ0aC1icmVhY2gtaXRzLTE1Yy1ndWFyZHJhaWwtc29vbmVyLXRoYW4td2UtdGhvdWdodNIBgAFodHRwczovL2FtcC50aGVndWFyZGlhbi5jb20vZW52aXJvbm1lbnQvY29tbWVudGlzZnJlZS8yMDIzL29jdC8xOS93aWxsLXRoZS1lYXJ0aC1icmVhY2gtaXRzLTE1Yy1ndWFyZHJhaWwtc29vbmVyLXRoYW4td2UtdGhvdWdodA?oc=5,https://da.gd/gDlg
GN:S:GW,EUI Surge Alert: U.S. Urban Buildings Face 110% Jump in Electricity Use - SciTechDaily,https://news.google.com/rss/articles/CBMiXmh0dHBzOi8vc2NpdGVjaGRhaWx5LmNvbS9ldWktc3VyZ2UtYWxlcnQtdS1zLXVyYmFuLWJ1aWxkaW5ncy1mYWNlLTExMC1qdW1wLWluLWVsZWN0cmljaXR5LXVzZS_SAQA?oc=5,https://da.gd/AX1Ie
GN:S:GW,Overshooting the critical threshold for the Greenland ice sheet - Nature,https://news.google.com/rss/articles/CBMiMmh0dHBzOi8vd3d3Lm5hdHVyZS5jb20vYXJ0aWNsZXMvczQxNTg2LTAyMy0wNjUwMy050gEA?oc=5,https://da.gd/pAk5vy
GN:S:GW,Greenland's massive ice sheet is melting — here's how to save it - Nature,https://news.google.com/rss/articles/CBMiMmh0dHBzOi8vd3d3Lm5hdHVyZS5jb20vYXJ0aWNsZXMvZDQxNTg2LTAyMy0wMzI1MC050gEA?oc=5,https://da.gd/QYqVk
GN:S:GW,Fur seals are declining thanks to lack of food and climate change ... - Salon,https://news.google.com/rss/articles/CBMiamh0dHBzOi8vd3d3LnNhbG9uLmNvbS8yMDIzLzEwLzE4L2Z1ci1zZWFscy1hcmUtZGVjbGluaW5nLXRoYW5rcy10by1sYWNrLW9mLWFuZC1jbGltYXRlLWNoYW5nZS1zdHVkeS1maW5kcy_SAQA?oc=5,https://da.gd/Pox1V
GN:S:GW,Could a Warming Climate Bring Yellow Fever to America? - HealthDay News,https://news.google.com/rss/articles/CBMiRWh0dHBzOi8vY29uc3VtZXIuaGVhbHRoZGF5LmNvbS9tb3NxdWl0by1ib3JuZS1pbGxuZXNzLTI2NjU5ODAwNDIuaHRtbNIBAA?oc=5,https://da.gd/ZcD1UT
