feed,title,long_url,short_url
GN:T:AI,Cyber Defenders Lead the AI Arms Race for Now - DARKReading,https://news.google.com/rss/articles/CBMiVGh0dHBzOi8vd3d3LmRhcmtyZWFkaW5nLmNvbS92dWxuZXJhYmlsaXRpZXMtdGhyZWF0cy9jeWJlci1kZWZlbmRlcnMtbGVhZC10aGUtYWktYXJtc9IBAA?oc=5,https://da.gd/La0Z
GN:T:AI,"Moemate’s AI avatar analyzes your whole screen, with spotty but intriguing results - TechCrunch",https://news.google.com/rss/articles/CBMicGh0dHBzOi8vdGVjaGNydW5jaC5jb20vMjAyMy8wOC8xNy9tb2VtYXRlcy1haS1hdmF0YXItYW5hbHl6ZXMteW91ci13aG9sZS1zY3JlZW4td2l0aC1zcG90dHktYnV0LWN1cmlvdXMtcmVzdWx0cy_SAQA?oc=5,https://da.gd/a6kW
GN:T:AI,"Arthur unveils Bench, an open-source AI model evaluator - VentureBeat",https://news.google.com/rss/articles/CBMiUmh0dHBzOi8vdmVudHVyZWJlYXQuY29tL2FpL2FydGh1ci11bnZlaWxzLWJlbmNoLWFuLW9wZW4tc291cmNlLWFpLW1vZGVsLWV2YWx1YXRvci_SAQA?oc=5,https://da.gd/cGNtW
GN:T:AI,Members Advocate for AI Regulations During Visit to U.S. Congress - IEEE Spectrum,https://news.google.com/rss/articles/CBMiPWh0dHBzOi8vc3BlY3RydW0uaWVlZS5vcmcvbWVtYmVycy1hZHZvY2F0ZS1mb3ItYWktcmVndWxhdGlvbnPSAUxodHRwczovL3NwZWN0cnVtLmllZWUub3JnL2FtcC9tZW1iZXJzLWFkdm9jYXRlLWZvci1haS1yZWd1bGF0aW9ucy0yNjY0MDA4MDI1?oc=5,https://da.gd/UOhkP
GN:T:AI,Snapchat's AI hallucination caused a privacy scare - Quartz,https://news.google.com/rss/articles/CBMiSWh0dHBzOi8vcXouY29tL3NuYXBjaGF0LW15LWFpLXNuYXBzLWhhbGx1Y2luYXRpb24tZGF0YS1wcml2YWN5LTE4NTA3NDcxNznSAQA?oc=5,https://da.gd/TDncfi
