feed,title,long_url,short_url
Medium,❌Stop Letting inferSchema Surprise You in PySpark,https://medium.com/p/da8db4cbb1a4,
Medium,OOPs Crash Course for Python Developers,https://medium.com/p/f1c6c840fbfe,
Medium,The Practical Way to Learn Python,https://medium.com/p/ad8e46be080b,
Medium,Why asof_join or merge_asof is the Most Underrated Function in Python,https://medium.com/p/b918db542e7f,
Medium,5 Underrated Python Libraries Every Data Scientist Should Know in 2026,https://medium.com/p/7d23d57ed7f2,
