feed,title,long_url,short_url
GN:S:GW,‘Climate Washing’ Lawsuits Targeting Inflated ESG Claims Become More Frequent - Bloomberg,https://news.google.com/rss/articles/CBMicGh0dHBzOi8vd3d3LmJsb29tYmVyZy5jb20vbmV3cy9hcnRpY2xlcy8yMDI0LTA2LTI2L2xhd3N1aXRzLXRhcmdldGluZy1jbGltYXRlLXdhc2hpbmctYXJlLWJlY29taW5nLW1vcmUtZnJlcXVlbnTSAQA?oc=5,https://da.gd/olDAsu
GN:S:GW,A Seminal Case for Climate Litigation - Carnegie Endowment for International Peace - Carnegie India,https://news.google.com/rss/articles/CBMiUGh0dHBzOi8vY2FybmVnaWVpbmRpYS5vcmcvcmVzZWFyY2gvMjAyNC8wNi9hLXNlbWluYWwtY2FzZS1mb3ItY2xpbWF0ZS1saXRpZ2F0aW9u0gEA?oc=5,https://da.gd/vBQrAv
GN:S:GW,Climate lawsuits against companies on the rise: report - Inquirer,https://news.google.com/rss/articles/CBMiWmh0dHBzOi8vYnVzaW5lc3MuaW5xdWlyZXIubmV0LzQ2NTc5Mi9jbGltYXRlLWxhd3N1aXRzLWFnYWluc3QtY29tcGFuaWVzLW9uLXRoZS1yaXNlLXJlcG9ydNIBXmh0dHBzOi8vYnVzaW5lc3MuaW5xdWlyZXIubmV0LzQ2NTc5Mi9jbGltYXRlLWxhd3N1aXRzLWFnYWluc3QtY29tcGFuaWVzLW9uLXRoZS1yaXNlLXJlcG9ydC9hbXA?oc=5,https://da.gd/rUwnh
GN:S:GW,"Groundwater will struggle to recover from warming temperatures, study shows - The Colorado Sun",https://news.google.com/rss/articles/CBMiY2h0dHBzOi8vY29sb3JhZG9zdW4uY29tLzIwMjQvMDYvMjQvZ3JvdW5kd2F0ZXItY29sb3JhZG8tcml2ZXItYmFzaW4tZWFzdC1yaXZlci10ZW1wZXJhdHVyZXMtc3RyZWFtL9IBAA?oc=5,https://da.gd/l1633k
GN:S:GW,The Clean Industrial Revolution has arrived | Bill Gates - Gates Notes,https://news.google.com/rss/articles/CBMiOmh0dHBzOi8vd3d3LmdhdGVzbm90ZXMuY29tL0JyZWFrdGhyb3VnaC1FbmVyZ3ktU3VtbWl0LTIwMjTSAQA?oc=5,https://da.gd/4G4UFf
