feed,title,long_url,short_url
GN:T:CC,It may be too late to prevent significant melting on West Antarctic ice shelf that includes 'Doomsday Glacier': Study - ABC News,https://news.google.com/rss/articles/CBMicWh0dHBzOi8vYWJjbmV3cy5nby5jb20vSW50ZXJuYXRpb25hbC9sYXRlLXByZXZlbnQtc2lnbmlmaWNhbnQtbWVsdGluZy13ZXN0LWFudGFyY3RpYy1pY2Utc2hlbGYvc3Rvcnk_aWQ9MTA0MTQ0NzU10gF1aHR0cHM6Ly9hYmNuZXdzLmdvLmNvbS9hbXAvSW50ZXJuYXRpb25hbC9sYXRlLXByZXZlbnQtc2lnbmlmaWNhbnQtbWVsdGluZy13ZXN0LWFudGFyY3RpYy1pY2Utc2hlbGYvc3Rvcnk_aWQ9MTA0MTQ0NzU1?oc=5,https://da.gd/t6fMw
GN:T:CC,"Antarctic ice melt unavoidable, say climate scientists - Financial Times",https://news.google.com/rss/articles/CBMiP2h0dHBzOi8vd3d3LmZ0LmNvbS9jb250ZW50LzM1MDY2ZjZmLTNlZmEtNGMxZS1hNTg1LTNlMGI2NjlmMDE0ZdIBAA?oc=5,https://da.gd/bSgcZl
GN:T:CC,"Global oil, coal, and gas demand to peak by 2030: IEA - Yahoo Finance",https://news.google.com/rss/articles/CCAiC2I0eWpvYWRzc3VBmAEB?oc=5,https://da.gd/DHYu
GN:T:CC,Climate change impacting overnight temperatures in Phoenix - ABC15 Arizona in Phoenix,https://news.google.com/rss/articles/CBMiZWh0dHBzOi8vd3d3LmFiYzE1LmNvbS93ZWF0aGVyL2ltcGFjdC1lYXJ0aC9jbGltYXRlLWNoYW5nZS1pbXBhY3Rpbmctb3Zlcm5pZ2h0LXRlbXBlcmF0dXJlcy1pbi1waG9lbml40gEA?oc=5,https://da.gd/4SGjO
GN:T:CC,Ancient rock carvings revealed by receding Amazon waters amid drought - The Guardian,https://news.google.com/rss/articles/CBMiZmh0dHBzOi8vd3d3LnRoZWd1YXJkaWFuLmNvbS9zY2llbmNlLzIwMjMvb2N0LzI0L2JyYXppbC1hbWF6b24tY2xpbWF0ZS1jaGFuZ2Utcm9jay1jYXJ2aW5ncy1wZXRyb2dseXBoc9IBAA?oc=5,https://da.gd/Rq0k9m
