feed,title,long_url,short_url
GN:T:CC,Study explores the impact of climate change on the supply and demand of wind and solar energy - Tech Xplore,https://news.google.com/rss/articles/CBMiTWh0dHBzOi8vdGVjaHhwbG9yZS5jb20vbmV3cy8yMDIzLTA4LWV4cGxvcmVzLWltcGFjdC1jbGltYXRlLWRlbWFuZC1zb2xhci5odG1s0gFMaHR0cHM6Ly90ZWNoeHBsb3JlLmNvbS9uZXdzLzIwMjMtMDgtZXhwbG9yZXMtaW1wYWN0LWNsaW1hdGUtZGVtYW5kLXNvbGFyLmFtcA?oc=5,https://da.gd/XOozH6
GN:T:CC,"On the Afghanistan-Iran border, climate change fuels a fight over water - Science",https://news.google.com/rss/articles/CBMiZWh0dHBzOi8vd3d3LnNjaWVuY2Uub3JnL2NvbnRlbnQvYXJ0aWNsZS9hZmdoYW5pc3Rhbi1pcmFuLWJvcmRlci1jbGltYXRlLWNoYW5nZS1mdWVscy1maWdodC1vdmVyLXdhdGVy0gEA?oc=5,https://da.gd/8tYw
GN:T:CC,Indigenous youth must be at the forefront of climate diplomacy - Nature,https://news.google.com/rss/articles/CBMiMmh0dHBzOi8vd3d3Lm5hdHVyZS5jb20vYXJ0aWNsZXMvZDQxNTg2LTAyMy0wMjQ4MC0x0gEA?oc=5,https://da.gd/OjLvT
GN:T:CC,UCSF doctors leading way on eliminating climate-harmful general anesthesia gas use - CBS San Francisco,https://news.google.com/rss/articles/CBMihQFodHRwczovL3d3dy5jYnNuZXdzLmNvbS9zYW5mcmFuY2lzY28vbmV3cy9wcm9qZWN0LWVhcnRoLWFuZXN0aGVzaWEtZ2FzLW5pdHJvdXMtb3hpZGUtZGVzZmx1cmFuZS1jbGltYXRlLWNoYW5nZS1ncmVlbmhvdXNlLWdhc2VzLXVjc2Yv0gGJAWh0dHBzOi8vd3d3LmNic25ld3MuY29tL2FtcC9zYW5mcmFuY2lzY28vbmV3cy9wcm9qZWN0LWVhcnRoLWFuZXN0aGVzaWEtZ2FzLW5pdHJvdXMtb3hpZGUtZGVzZmx1cmFuZS1jbGltYXRlLWNoYW5nZS1ncmVlbmhvdXNlLWdhc2VzLXVjc2Yv?oc=5,https://da.gd/2yYVWl
GN:T:CC,Ocean heat record broken and experts fear temperatures could rise even further - Euronews,https://news.google.com/rss/articles/CBMieGh0dHBzOi8vd3d3LmV1cm9uZXdzLmNvbS9ncmVlbi8yMDIzLzA4LzA0L29jZWFuLWhlYXQtcmVjb3JkLWJyb2tlbi1hbmQtZXhwZXJ0cy1mZWFyLXRlbXBlcmF0dXJlcy1jb3VsZC1yaXNlLWV2ZW4tZnVydGhlctIBAA?oc=5,https://da.gd/25j3n
