feed,title,long_url,short_url
GN:T:WP,Blyth offshore wind farm to use floating turbines - BBC News,https://www.bbc.com/news/uk-england-tyne-55842657,
GN:T:WP,One Renewable Energy Stock to Buy and One to Avoid - Motley Fool,https://www.fool.com/investing/2021/01/29/one-renewable-energy-stock-to-buy-and-one-to-avoid/,
GN:T:WP,Bechtel joint venture picked to build 115MW wind farm in West Virgina - News - GCR - GCR,https://www.globalconstructionreview.com/news/bechtel-joint-venture-picked-build-115mw-wind-farm/,
GN:T:WP,Vineyard Wind Says Federal Permitting Can Proceed - Offshore WIND,https://www.offshorewind.biz/2021/01/25/vineyard-wind-says-federal-permitting-can-proceed/,
GN:T:WP,GE wins gas-fired generation equipment supply contract in Senegal - Power Technology,https://www.power-technology.com/news/ge-wins-gas-power-generation-equipment-supply-contract-senegal/,
GN:T:WP,"Duke Energy sells subsidiary stake for $2.05bn, cancelling equity raise - Power Technology",https://www.power-technology.com/news/gic-stake-duke-energy-subsidiary-indiana-sale/,
GN:T:WP,Germany needs to double its renewable energy output -grids - Reuters,https://www.reuters.com/article/germany-renewables/germany-needs-to-double-its-renewable-energy-output-grids-idUSL8N2K35U7,
GN:T:WP,New battery factory in northern Norway to list on NYSE as world switch to green transport - The Independent Barents Observer,https://thebarentsobserver.com/en/2021/01/new-battery-factory-northern-norway-list-nyse-world-switch-green-transport,
GN:T:WP,"Report: Pennsylvania stands to gain 243,000 jobs a year from clean energy investment | StateImpact Pennsylvania - StateImpact Pennsylvania",https://stateimpact.npr.org/pennsylvania/2021/01/29/report-pennsylvania-stands-to-gain-243000-jobs-a-year-from-clean-energy-investment/,
