feed,title,long_url,short_url
ArXiv:q-fin,Market Impact in a Latent Order Book,https://arxiv.org/abs/1802.06101v3,
ArXiv:q-fin,Portfolio Optimization on the Dispersion Risk and the Asymmetric Tail Risk,https://arxiv.org/abs/2007.13972v4,
ArXiv:q-fin,Stability properties of Haezendonck-Goovaerts premium principles,https://arxiv.org/abs/1909.10735v2,
ArXiv:q-fin,Hedging and machine learning driven crude oil data analysis using a refined Barndorff-Nielsen and Shephard model,https://arxiv.org/abs/2004.14862v2,
ArXiv:q-fin,Option Pricing in Markets with Informed Traders,https://arxiv.org/abs/2006.02596v3,
ArXiv:q-fin,Multigrid Iterative Algorithms based on Compact Finite Difference Schemes and Hermite interpolation for Solving Regime Switching American Options,https://arxiv.org/abs/2008.00925v2,
ArXiv:q-fin,Tail risk forecasting using Bayesian realized EGARCH models,https://arxiv.org/abs/2008.05147v1,
ArXiv:q-fin,Gittins' theorem under uncertainty,https://arxiv.org/abs/1907.05689v2,
