feed,title,long_url,short_url
GN:S:GW,More than 100 climate groups press Kerry on Wall Street's role in global warming | TheHill - The Hill,https://thehill.com/policy/energy-environment/545719-145-climate-groups-call-on-kerry-to-acknowledge-wall-streets-role,
GN:S:GW,How to talk to people about climate change - Science Daily,https://www.sciencedaily.com/releases/2021/03/210330092522.htm,
GN:S:GW,BOJ to highlight climate risks in bank examinations next year - Reuters,https://www.reuters.com/article/japan-economy-boj-banks/update-2-boj-to-highlight-climate-risks-in-bank-examinations-next-year-idUSL4N2LS1RW,
GN:S:GW,TSE Top-Tier Firms to Be Asked to Give More Climate-Change Info - Nippon,https://www.nippon.com/en/news/yjj2021033100997/,
GN:S:GW,AP interview: EPA head committed to 'scientific integrity' - Minnesota Public Radio News,https://www.mprnews.org/story/2021/03/31/ap-interview-epa-head-committed-to-scientific-integrity,
