feed,title,long_url,short_url
AWS:WhatsNew,Amazon EC2 X8i instances are now available in additional regions,https://aws.amazon.com/about-aws/whats-new/2026/02/amazon-ec2-x8i-instances-BOM-DUB-region/,
AWS:WhatsNew,Amazon EC2 G7e instances now available in Europe (London) region,https://aws.amazon.com/about-aws/whats-new/2026/05/amazon-ec2-g7e-london-region/,
AWS:WhatsNew,Introducing Amazon EC2 R8idn and R8idb instances,https://aws.amazon.com/about-aws/whats-new/2026/03/amazon-ec2-r8idn-r8idb/,
AWS:WhatsNew,Introducing Amazon EC2 M8idn and M8idb instances,https://aws.amazon.com/about-aws/whats-new/2026/05/amazon-ec2-m8idn-m8idb/,
AWS:WhatsNew,Amazon RDS for SQL Server now supports instances powered by AMD EPYC processors,https://aws.amazon.com/about-aws/whats-new/2026/05/rds-sqlserver-supports-amd-instances/,
