feed,title,long_url,short_url
GN:T:RE,COP27: Herzog reiterates Israel net zero carbon emission promise - The Jerusalem Post,https://www.jpost.com/environment-and-climate-change/article-721722,
GN:T:RE,"Putin's war has signed death warrant for Russia's economy - gas is dead, says JOHN BRYSON - Express",https://www.express.co.uk/comment/expresscomment/1693483/Vladimir-putin-Ukraine-war-latest-news-who-is-winning-gas-price-russian-economy,
GN:T:RE,Swiss scientists' transparent solar cells will be sweet for startups - TNW,https://thenextweb.com/news/swiss-scientists-new-see-through-solar-panels-are-sweet-nectar-startups,
GN:T:RE,The transition from fossil fuels to renewable energy in 5 charts - DW (English),https://www.dw.com/en/renewable-energy-transition-graphs/a-63674250,
GN:T:RE,Switzerland Is Paying Poorer Nations to Cut Emissions on Its Behalf - The New York Times,https://www.nytimes.com/2022/11/07/climate/switzerland-emissions-ghana-peru-ukraine-georgia.html,
GN:T:RE,Optimized business model for agrivoltaics – pv magazine International - pv magazine International,https://www.pv-magazine.com/2022/11/07/optimized-business-model-for-agrivoltaics/,
