feed,title,long_url,short_url
GN:T:SL,Seminole County residents dealing with record breaking floodwaters that are expected to rise - FOX 35 Orlando,https://www.fox35orlando.com/news/massive-flooding-in-geneva-and-water-is-expected-to-rise,
GN:T:SL,First-of-its-Kind Built Coral Reef Deployed off the Coast of Antigua & Barbuda; Largest-Ever Scalable Solution will Restore Vital Ocean Ecosystem - PR Web,https://www.prweb.com/releases/2022/10/prweb18934180.htm,
GN:T:SL,Gubernatorial Candidates Newsom and Dahle Agree to Debate at KQED - KQED,https://www.kqed.org/news/11926844/gubernatorial-candidates-newsom-and-dahle-agree-to-debate-at-kqed,
GN:T:SL,Here's What We Know About How Climate Change Fuels Hurricanes - Columbia University,https://news.climate.columbia.edu/2022/10/03/heres-what-we-know-about-how-climate-change-fuels-hurricanes/,
GN:T:SL,"Malaria, other diseases spreading fast in flood-hit Pakistan - The Nation",https://www.nation.com.pk/22-Sep-2022/malaria-other-diseases-spreading-fast-in-flood-hit-pakistan,
