feed,title,long_url,short_url
GN:T:RE,The Hartford Sets Net Zero Greenhouse Gas Emissions Goal - CBIA,https://www.cbia.com/news/economy/the-hartford-greenhouse-gas-emissions/,
GN:T:RE,Britain was promised a bold and visionary energy plan. But we’ve been sold a dud - The Guardian,https://www.theguardian.com/commentisfree/2022/apr/09/britain-was-promised-bold-visionary-energy-policy-sold-a-dud,
GN:T:RE,Push against Russian fuel could accelerate clean energy transition - The Hill,https://thehill.com/policy/energy-environment/3262928-push-against-russian-fuel-could-accelerate-clean-energy-transition/,
GN:T:RE,3 Growth Stocks to Buy That Could Be Massive Long-Term Winners - The Motley Fool,https://www.fool.com/investing/2022/04/09/3-growth-stocks-to-buy-that-could-be-massive-long/,
GN:T:RE,Bosch unveils hydrogen-compatible stationary fuel cell system - pv magazine International,https://www.pv-magazine.com/2022/04/08/bosch-unveils-hydrogen-compatible-stationary-fuel-cell-system/,
