feed,title,long_url,short_url
GN:S:C,Urban agriculture beats conventional agriculture on climate — if it's done right - The Hill,https://news.google.com/rss/articles/CBMieWh0dHBzOi8vdGhlaGlsbC5jb20vcG9saWN5L2VxdWlsaWJyaXVtLXN1c3RhaW5hYmlsaXR5LzQ0MTg1NjEtY2xpbWF0ZS1jYXJib24tdXJiYW4tYWdyaWN1bHR1cmUtdmVyc3VzLWNvbnZlbnRpb25hbC1zdHVkeS_SAQA?oc=5,https://da.gd/730VAU
GN:S:C,White House puts $1 trillion price tag on climate efforts - E&E News by POLITICO,https://news.google.com/rss/articles/CBMiWWh0dHBzOi8vd3d3LmVlbmV3cy5uZXQvYXJ0aWNsZXMvd2hpdGUtaG91c2UtcHV0cy0xLXRyaWxsaW9uLXByaWNlLXRhZy1vbi1jbGltYXRlLWVmZm9ydHMv0gEA?oc=5,https://da.gd/eD16vx
GN:S:C,"FEMA expands disaster aid for extreme weather events, citing climate change - The Hill",https://news.google.com/rss/articles/CBMigQFodHRwczovL3RoZWhpbGwuY29tL3BvbGljeS9lbmVyZ3ktZW52aXJvbm1lbnQvNDQyMTcwOC1mZW1hLWV4cGFuZHMtZGlzYXN0ZXItYWlkLWZvci1leHRyZW1lLXdlYXRoZXItZXZlbnRzLWNpdGluZy1jbGltYXRlLWNoYW5nZS_SAQA?oc=5,https://da.gd/UrD3i
GN:S:C,Exxon sues over investors’ climate proposal - The Hill,https://news.google.com/rss/articles/CBMiYWh0dHBzOi8vdGhlaGlsbC5jb20vcG9saWN5L2VuZXJneS1lbnZpcm9ubWVudC80NDIxNzIwLWV4eG9uLXN1ZXMtb3Zlci1pbnZlc3RvcnMtY2xpbWF0ZS1wcm9wb3NhbC_SAWVodHRwczovL3RoZWhpbGwuY29tL3BvbGljeS9lbmVyZ3ktZW52aXJvbm1lbnQvNDQyMTcyMC1leHhvbi1zdWVzLW92ZXItaW52ZXN0b3JzLWNsaW1hdGUtcHJvcG9zYWwvYW1wLw?oc=5,https://da.gd/cSwKU
GN:S:C,Why is Exxon suing to stop two yogis from pushing their climate proposals? - MarketWatch,https://news.google.com/rss/articles/CBMidGh0dHBzOi8vd3d3Lm1hcmtldHdhdGNoLmNvbS9zdG9yeS93aHktaXMtZXh4b24tc3VpbmctdG8tc3RvcC10d28teW9naXMtZnJvbS1wdXNoaW5nLXRoZWlyLWNsaW1hdGUtcHJvcG9zYWxzLTQ0MDRjNTQ00gF4aHR0cHM6Ly93d3cubWFya2V0d2F0Y2guY29tL2FtcC9zdG9yeS93aHktaXMtZXh4b24tc3VpbmctdG8tc3RvcC10d28teW9naXMtZnJvbS1wdXNoaW5nLXRoZWlyLWNsaW1hdGUtcHJvcG9zYWxzLTQ0MDRjNTQ0?oc=5,https://da.gd/CD2snU
GN:S:C,Governments failed to set a timeline for the IPCC reports - Climate Home News,https://news.google.com/rss/articles/CBMiggFodHRwczovL3d3dy5jbGltYXRlY2hhbmdlbmV3cy5jb20vMjAyNC8wMS8yMi9nb3Zlcm5tZW50cy1mYWlsLXRvLWFncmVlLXRpbWVsaW5lLWZvci1jbGltYXRlLXNjaWVuY2UtcmVwb3J0cy1pbi1mcmF1Z2h0LWlwY2MtdGFsa3Mv0gEA?oc=5,https://da.gd/tyZV
GN:S:C,Exxon Sues ESG Investors to Stop Climate Proposals on Ballot (2) - Bloomberg Law,https://news.google.com/rss/articles/CBMia2h0dHBzOi8vbmV3cy5ibG9vbWJlcmdsYXcuY29tL3NlY3VyaXRpZXMtbGF3L2V4eG9uLXN1ZXMtZXNnLWludmVzdG9ycy10by1zdG9wLWNsaW1hdGUtcHJvcG9zYWxzLW9uLWJhbGxvdC0x0gEA?oc=5,https://da.gd/sYgY
GN:S:C,Scientists Warn Missing Russian Data Causing Arctic Climate Blind Spots - Barron's,https://news.google.com/rss/articles/CBMibWh0dHBzOi8vd3d3LmJhcnJvbnMuY29tL25ld3Mvc2NpZW50aXN0cy13YXJuLW1pc3NpbmctcnVzc2lhbi1kYXRhLWNhdXNpbmctYXJjdGljLWNsaW1hdGUtYmxpbmQtc3BvdHMtY2JmNjcxN2TSAXFodHRwczovL3d3dy5iYXJyb25zLmNvbS9hbXAvbmV3cy9zY2llbnRpc3RzLXdhcm4tbWlzc2luZy1ydXNzaWFuLWRhdGEtY2F1c2luZy1hcmN0aWMtY2xpbWF0ZS1ibGluZC1zcG90cy1jYmY2NzE3ZA?oc=5,https://da.gd/hJBw
GN:S:C,North Dakota chosen for Alliance to Advance Climate-Smart Agriculture - Jamestown Sun,https://news.google.com/rss/articles/CBMia2h0dHBzOi8vd3d3LmphbWVzdG93bnN1bi5jb20vYnVzaW5lc3Mvbm9ydGgtZGFrb3RhLWNob3Nlbi1mb3ItYWxsaWFuY2UtdG8tYWR2YW5jZS1jbGltYXRlLXNtYXJ0LWFncmljdWx0dXJl0gEA?oc=5,https://da.gd/YicQho
GN:S:C,Urban agriculture isn't as climate-friendly as it seems – but these best practices can transform gardens and city farms - The Conversation,https://news.google.com/rss/articles/CBMilwFodHRwczovL3RoZWNvbnZlcnNhdGlvbi5jb20vdXJiYW4tYWdyaWN1bHR1cmUtaXNudC1hcy1jbGltYXRlLWZyaWVuZGx5LWFzLWl0LXNlZW1zLWJ1dC10aGVzZS1iZXN0LXByYWN0aWNlcy1jYW4tdHJhbnNmb3JtLWdhcmRlbnMtYW5kLWNpdHktZmFybXMtMjIxNTM30gEA?oc=5,https://da.gd/PU8mBU
GN:S:C,Sonoma just adopted climate strategies. What are they? - Sonoma Index-Tribune,https://news.google.com/rss/articles/CBMiXWh0dHBzOi8vd3d3LnNvbm9tYW5ld3MuY29tL2FydGljbGUvbmV3cy9zb25vbWEtanVzdC1hZG9wdGVkLWNsaW1hdGUtc3RyYXRlZ2llcy13aGF0LWFyZS10aGV5L9IBAA?oc=5,https://da.gd/4fmmzr
GN:S:C,No impact without revenue? That’s ArcTern’s climate tech thesis - TechCrunch,https://news.google.com/rss/articles/CBMiX2h0dHBzOi8vdGVjaGNydW5jaC5jb20vMjAyNC8wMS8yMi9uby1pbXBhY3Qtd2l0aG91dC1yZXZlbnVlLXRoYXRzLWFyY3Rlcm5zLWNsaW1hdGUtdGVjaC10aGVzaXMv0gEA?oc=5,https://da.gd/lqFY9v
GN:S:C,Seeking Federal Storm Relief and Addressing the Impacts of Climate Change | Office of Governor Janet T. Mills - Maine,https://news.google.com/rss/articles/CBMijwFodHRwczovL3d3dy5tYWluZS5nb3YvZ292ZXJub3IvbWlsbHMvaW5kZXgucGhwL25ld3MvcmFkaW9fYWRkcmVzcy9zZWVraW5nLWZlZGVyYWwtc3Rvcm0tcmVsaWVmLWFuZC1hZGRyZXNzaW5nLWltcGFjdHMtY2xpbWF0ZS1jaGFuZ2UtMjAyNC0wMS0xOdIBAA?oc=5,https://da.gd/8ViTn
GN:S:C,Exxon Sues to Stop Investors From Voting on Climate Resolution at Annual Meeting - Truthout,https://news.google.com/rss/articles/CBMib2h0dHBzOi8vdHJ1dGhvdXQub3JnL2FydGljbGVzL2V4eG9uLXN1ZXMtdG8tc3RvcC1pbnZlc3RvcnMtZnJvbS12b3Rpbmctb24tY2xpbWF0ZS1yZXNvbHV0aW9uLWF0LWFubnVhbC1tZWV0aW5nL9IBAA?oc=5,https://da.gd/hZX2zc
