feed,title,long_url,short_url
GN:T:ML,AI Experts Provide Comprehensive Insights in Real World AI: A Practical Guide for Responsible Machine Learning - Business Wire,https://www.businesswire.com/news/home/20210316005185/en/AI-Experts-Provide-Comprehensive-Insights-in-Real-World-AI-A-Practical-Guide-for-Responsible-Machine-Learning,https://bwnews.pr/3eIHhqC
GN:T:ML,Deci and Intel Collaborate to Optimize Deep Learning Inference on Intel's CPUs - insideBIGDATA,https://insidebigdata.com/2021/03/16/deci-and-intel-collaborate-to-optimize-deep-learning-inference-on-intels-cpus/,https://j.mp/392ukVh
GN:T:ML,Why you should prioritize governance of ML and AI - TechBeacon,https://techbeacon.com/enterprise-it/why-you-should-prioritize-governance-ml-ai,https://j.mp/2OvysWK
GN:T:ML,Dascena Announces Publication of Results From Its Machine Learning Algorithm for Prediction of Acute Kidney Injury in Kidney International Reports - Yahoo Finance,https://finance.yahoo.com/news/dascena-announces-publication-results-machine-123000587.html,https://yhoo.it/38IBNIA
GN:T:ML,f-15 ew avionics ai machine learning - Intelligent Aerospace,https://www.intelligent-aerospace.com/military/article/14199355/f15-ew-avionics-ai-machine-learning,https://j.mp/2Q5E6z3
