feed,title,long_url,short_url
j.mp/lc-ml-reviews,Parameter-Efficient Continual Fine-Tuning: A Survey (2025) (cs.LG),http://arxiv.org/abs/2504.13822v1,
j.mp/lc-ml-reviews,A Survey for What Developers Require in AI-powered Tools that Aid in Component Selection in CBSD (2025) (cs.SE),http://arxiv.org/abs/2504.13751v1,
j.mp/lc-ml-reviews,Statistical Validation in Cultural Adaptations of Cognitive Tests: A Multi- Regional Systematic Review (2025) (cs.CY),http://arxiv.org/abs/2504.13495v1,
j.mp/lc-ml-reviews,A Survey on Self-supervised Contrastive Learning for Multimodal Text-Image Analysis (2025) (cs.CV),http://arxiv.org/abs/2503.11101v2,
j.mp/lc-ml-reviews,"A Comprehensive Survey of Mixture-of-Experts: Algorithms, Theory, and Applications (2025) (cs.LG)",http://arxiv.org/abs/2503.07137v3,
j.mp/lc-ml-reviews,Statistical Inference in Reinforcement Learning: A Selective Survey (2025) (stat.ML),http://arxiv.org/abs/2502.16195v2,
j.mp/lc-ml-reviews,Psycholinguistic Analyses in Software Engineering Text: A Systematic Literature Review (2025) (cs.SE),http://arxiv.org/abs/2503.05992v2,
