feed,title,long_url,short_url
RS,Influence of cinnamaldehyde supplementation on growth performance and intestinal microbial composition in broiler chickens fed a low-protein diet,https://www.researchsquare.com/article/rs-5224041/latest,https://da.gd/6r10kU
RS,"Glucose and Lipid-Lowering Activities of Some Bioactive Extracted Components from Herbs (Camellia Sinensis, Matricaria Chamomilla and Carum Carvi) in Streptozotocin-diabetic Rats: Intelligent Method for Herbal Medicines Production with Selected Active Ingredients",https://www.researchsquare.com/article/rs-5321019/latest,https://da.gd/h4tUC8
RS,Formula - synchronized nutrient fertilizer designed based on crop nutrient absorption characteristics and fertilizer nutrient release characteristics and its fertilizer efficiency verification,https://www.researchsquare.com/article/rs-5211110/latest,https://da.gd/7wM1
RS,"Nutritional composition, mineral profile and phytochemical content of new and established cultivars of chickpea as effected by cropping year",https://www.researchsquare.com/article/rs-5290145/latest,https://da.gd/RTmK
RS,Dietary fibre supplementation promotes symbiotic interactions among the intestinal microbiota in preweaning calves,https://www.researchsquare.com/article/rs-5318621/latest,https://da.gd/P9drhC
RS,Improving Growth and Nutrient Quality of Mustard Varieties Through Rhizobacterial Inoculation,https://www.researchsquare.com/article/rs-5320810/latest,https://da.gd/AS6nF9
RS,Evaluation and Prioritization of Food Safety Risks in the Nigerian Red Meat Industry: A Cross-Sectional Study on Public Health Implications and Industry-Wide Practices,https://www.researchsquare.com/article/rs-5241196/latest,https://da.gd/ZBmcJ
