feed,title,long_url,short_url
GN:S:GW,Major Setback At COP28 Threatens Progress In Combatting Global Warming - Forbes,https://news.google.com/rss/articles/CBMifGh0dHBzOi8vd3d3LmZvcmJlcy5jb20vc2l0ZXMvaGVyc2hzaGVmcmluLzIwMjMvMTIvMTQvbWFqb3Itc2V0YmFjay1hdC1jb3AyOC10aHJlYXRlbnMtcHJvZ3Jlc3MtaW4tY29tYmF0dGluZy1nbG9iYWwtd2FybWluZy_SAYABaHR0cHM6Ly93d3cuZm9yYmVzLmNvbS9zaXRlcy9oZXJzaHNoZWZyaW4vMjAyMy8xMi8xNC9tYWpvci1zZXRiYWNrLWF0LWNvcDI4LXRocmVhdGVucy1wcm9ncmVzcy1pbi1jb21iYXR0aW5nLWdsb2JhbC13YXJtaW5nL2FtcC8?oc=5,https://da.gd/1QJAjS
GN:S:GW,Analysis | U.N. climate talks chart a complex course away from fossil fuels - The Washington Post,https://news.google.com/rss/articles/CBMiUGh0dHBzOi8vd3d3Lndhc2hpbmd0b25wb3N0LmNvbS93b3JsZC8yMDIzLzEyLzE1L2NvcDI4LWZvc3NpbC1mdWVscy1vaWwtdWFlLWd1bGYv0gEA?oc=5,https://da.gd/ur1nWz
GN:S:GW,"Himalayan glaciers are cooling down, potentially slowing down effects of climate change - ABC News",https://news.google.com/rss/articles/CBMiZ2h0dHBzOi8vd3d3LmFiYy5uZXQuYXUvbmV3cy8yMDIzLTEyLTE1L25ldy1yZXBvcnQtc2hvd3MtaGltYWxheWFuLWdsYWNpZXJzLWNvb2xpbmctYW5kLWRyeWluZy8xMDMyMzEzNzLSAQA?oc=5,https://da.gd/p7bQl
GN:S:GW,Getting Serious About Global Warming | Falmouth Opinion | capenews.net - CapeNews,https://news.google.com/rss/articles/CBMigAFodHRwczovL3d3dy5jYXBlbmV3cy5uZXQvZmFsbW91dGgvb3Bpbmlvbi9nZXR0aW5nLXNlcmlvdXMtYWJvdXQtZ2xvYmFsLXdhcm1pbmcvYXJ0aWNsZV84ZTY5MWI3YS0yNWQ1LTU2N2UtOTY0MC1mZDQxZjRlMjEyNjYuaHRtbNIBAA?oc=5,https://da.gd/MbqC
GN:S:GW,"Black People Living In Southeastern States Will Face Greater Risks From Global Warming, Per New Report - Blavity News",https://news.google.com/rss/articles/CBMiVWh0dHBzOi8vYmxhdml0eS5jb20vZ2xvYmFsLXdhcm1pbmctcmlza3MtYmxhY2stY29tbXVuaXRpZXMtc291dGhlYXN0ZXJuLXN0YXRlcy1yZXBvcnTSAQA?oc=5,https://da.gd/ix2LEG
