feed,title,long_url,short_url
GN:S:C,Photos of climate change in Hungary - The Washington Post,https://news.google.com/rss/articles/CBMidWh0dHBzOi8vd3d3Lndhc2hpbmd0b25wb3N0LmNvbS9waG90b2dyYXBoeS8yMDIzLzEyLzE1L3RoaXMtcGhvdG9ncmFwaGVyLWlzLWV4cGxvcmluZy1jbGltYXRlLWNoYW5nZXMtZWZmZWN0cy1odW5nYXJ5L9IBAA?oc=5,https://da.gd/WOe3lS
GN:S:C,Meet the activists behind the new youth climate lawsuit - E&E News by POLITICO,https://news.google.com/rss/articles/CBMiWGh0dHBzOi8vd3d3LmVlbmV3cy5uZXQvYXJ0aWNsZXMvbWVldC10aGUtYWN0aXZpc3RzLWJlaGluZC10aGUtbmV3LXlvdXRoLWNsaW1hdGUtbGF3c3VpdC_SAQA?oc=5,https://da.gd/zUeSK
GN:S:C,Low-Energy Fridays: Climate Change Is—and Is Not—an Existential Risk - R Street,https://news.google.com/rss/articles/CBMiZ2h0dHBzOi8vd3d3LnJzdHJlZXQub3JnL2NvbW1lbnRhcnkvbG93LWVuZXJneS1mcmlkYXlzLWNsaW1hdGUtY2hhbmdlLWlzLWFuZC1pcy1ub3QtYW4tZXhpc3RlbnRpYWwtcmlzay_SAQA?oc=5,https://da.gd/yyRWP
GN:S:C,Effective climate adaptation must be imaginative and inclusive | Communications Earth & Environment - Nature,https://news.google.com/rss/articles/CBMiMmh0dHBzOi8vd3d3Lm5hdHVyZS5jb20vYXJ0aWNsZXMvczQzMjQ3LTAyMy0wMTE1MC000gEA?oc=5,https://da.gd/aYGpR
GN:S:C,"COP28 climate deal 'stab in the back', activist Greta Thunberg says - Reuters",https://news.google.com/rss/articles/CBMicmh0dHBzOi8vd3d3LnJldXRlcnMuY29tL2J1c2luZXNzL2Vudmlyb25tZW50L2NvcDI4LWNsaW1hdGUtZGVhbC1zdGFiLWJhY2stYWN0aXZpc3QtZ3JldGEtdGh1bmJlcmctc2F5cy0yMDIzLTEyLTE1L9IBAA?oc=5,https://da.gd/fgot
GN:S:C,Republicans were a force at climate summit. Now what? - E&E News by POLITICO,https://news.google.com/rss/articles/CBMiVGh0dHBzOi8vd3d3LmVlbmV3cy5uZXQvYXJ0aWNsZXMvcmVwdWJsaWNhbnMtd2VyZS1hLWZvcmNlLWF0LWNsaW1hdGUtc3VtbWl0LW5vdy13aGF0L9IBAA?oc=5,https://da.gd/4ddUZ
GN:S:C,What is climate change? A really simple guide - BBC,https://news.google.com/rss/articles/CBMiNWh0dHBzOi8vd3d3LmJiYy5jb20vbmV3cy9zY2llbmNlLWVudmlyb25tZW50LTI0MDIxNzcy0gE5aHR0cHM6Ly93d3cuYmJjLmNvbS9uZXdzL3NjaWVuY2UtZW52aXJvbm1lbnQtMjQwMjE3NzIuYW1w?oc=5,https://da.gd/jium
GN:S:C,Charlotte is slow to let us know its progress on specific climate goals | Opinion - Charlotte Observer,https://news.google.com/rss/articles/CBMiP2h0dHBzOi8vd3d3LmNoYXJsb3R0ZW9ic2VydmVyLmNvbS9vcGluaW9uL2FydGljbGUyODMwMDM4MjguaHRtbNIBP2h0dHBzOi8vYW1wLmNoYXJsb3R0ZW9ic2VydmVyLmNvbS9vcGluaW9uL2FydGljbGUyODMwMDM4MjguaHRtbA?oc=5,https://da.gd/Mrh1cl
GN:S:C,What Jewish College Students Have to Say About the Campus Climate - The Chronicle of Higher Education,https://news.google.com/rss/articles/CBMiY2h0dHBzOi8vd3d3LmNocm9uaWNsZS5jb20vYXJ0aWNsZS93aGF0LWpld2lzaC1jb2xsZWdlLXN0dWRlbnRzLWhhdmUtdG8tc2F5LWFib3V0LXRoZS1jYW1wdXMtY2xpbWF0ZdIBAA?oc=5,https://da.gd/rubQQI
GN:S:C,Exxon's low US tax payments ruffle Biden's climate agenda - Yahoo Finance,https://news.google.com/rss/articles/CBMiSGh0dHBzOi8vZmluYW5jZS55YWhvby5jb20vbmV3cy9leHhvbnMtbG93LXVzLXRheC1wYXltZW50cy0xMTE1NDc4MzIuaHRtbNIBAA?oc=5,https://da.gd/c845G8
GN:S:C,New ultrathin materials can pull climate-warming CO2 from the air - Science News Explores,https://news.google.com/rss/articles/CBMiSGh0dHBzOi8vd3d3LnNuZXhwbG9yZXMub3JnL2FydGljbGUvbmFub21hdGVyaWFsLW14ZW5lLWNhcmJvbi1jYXB0dXJlLWFpctIBAA?oc=5,https://da.gd/sSpD
GN:S:C,A Mixed Response to Southampton Climate Plan - East End Beacon,https://news.google.com/rss/articles/CBMiS2h0dHBzOi8vd3d3LmVhc3RlbmRiZWFjb24uY29tL2EtbWl4ZWQtcmVzcG9uc2UtdG8tc291dGhhbXB0b24tY2xpbWF0ZS1wbGFuL9IBAA?oc=5,https://da.gd/fNBkuX
GN:S:C,"Youth Climate Lawsuit Against Canadian Climate Policy Can Go to Trial, Court Rules - DeSmog",https://news.google.com/rss/articles/CBMiVGh0dHBzOi8vd3d3LmRlc21vZy5jb20vMjAyMy8xMi8xNS9jYW5hZGEteW91dGgtY2xpbWF0ZS1sYXdzdWl0LWNsaW1hdGUtcG9saWN5LXRyaWFsL9IBAA?oc=5,https://da.gd/zahk
GN:S:C,COP28 Climate Summit | Nation/World | bdtonline.com - Bluefield Daily Telegraph,https://news.google.com/rss/articles/CBMicGh0dHBzOi8vd3d3LmJkdG9ubGluZS5jb20vbmV3cy9uYXRpb25fd29ybGQvY29wMjgtY2xpbWF0ZS1zdW1taXQvaW1hZ2VfZjE0ZWQzOTMtZDc2NS01MWU3LWE3M2UtYWQxOGUxMzljMWY1Lmh0bWzSAQA?oc=5,https://da.gd/wwJK4
GN:S:C,COP28 climate summit exposes the dead end of fighting climate change under capitalism - WSWS,https://news.google.com/rss/articles/CBMiOWh0dHBzOi8vd3d3Lndzd3Mub3JnL2VuL2FydGljbGVzLzIwMjMvMTIvMTUvZXJ0ZC1kMTUuaHRtbNIBAA?oc=5,https://da.gd/svVb3Q
GN:S:C,Leaks show McKinsey pushed fossil fuel agenda at Africa climate summit - Woburn Daily Times,https://news.google.com/rss/articles/CBMiV2h0dHA6Ly9ob21lbmV3c2hlcmUuY29tL25hdGlvbmFsL25ld3MvYXJ0aWNsZV8wYzI0YTI4YS1lYjBkLTU3MTQtYTRkMC04NTg3NjFjNDM4MTguaHRtbNIBAA?oc=5,https://da.gd/beyfW
