feed,title,long_url,short_url
MedRxiv,Improved SARS-CoV-2 neutralization of Delta and Omicron variants of concern after fourth vaccination in hemodialysis patients,https://medrxiv.org/cgi/content/short/2022.06.22.22276787v1?rss=1,https://bit.ly/3QMykx5
MedRxiv,Genetic risk factors associated with SARS-CoV-2 susceptibility in multiethnic populations,https://medrxiv.org/cgi/content/short/2022.06.23.22276797v1?rss=1,https://bit.ly/3yghj7t
MedRxiv,"New, fast, and precise method of COVID-19 detection in nasopharyngeal and tracheal aspirate samples combining optical spectroscopy and machine learning",https://medrxiv.org/cgi/content/short/2022.06.22.22276755v1?rss=1,https://bit.ly/3OGo9Zj
MedRxiv,Immune Correlates Analysis of the PREVENT-19 COVID-19 Vaccine Efficacy Clinical Trial,https://medrxiv.org/cgi/content/short/2022.06.22.22276362v1?rss=1,https://bit.ly/3A3Qu7F
MedRxiv,Mathematical modelling of COVID-19 with periodic transmission: The case of South Africa,https://medrxiv.org/cgi/content/short/2022.06.22.22276298v1?rss=1,https://bit.ly/3OAWlpc
MedRxiv,Pre-Omicron vaccine breakthrough infection induces superior cross-neutralization against SARS-CoV-2 Omicron BA.1 than primo infection,https://medrxiv.org/cgi/content/short/2022.06.21.22276659v1?rss=1,https://bit.ly/3HMc2aG
