feed,title,long_url,short_url
GN:S:GW,No One Should Be Fooled by the SEC's Global Warming Stab - RealClearMarkets,https://www.realclearmarkets.com/2022/03/31/no_one_should_be_fooled_by_the_secs_global_warming_stab_824599.html,
GN:S:GW,What Impact does Climate Change have on Our Health? - News-Medical,https://www.news-medical.net/health/What-Impact-does-Climate-Change-have-on-Our-Health.aspx,
GN:S:GW,"After decades of missed targets, Canada finally has a climate roadmap - Grist",https://grist.org/climate/after-decades-missed-targets-canada-climate-roadmap/,
GN:S:GW,A new threat emerges for US lakes and rivers. Your lawn or toilet may be partly to blame. - USA TODAY,https://www.usatoday.com/story/news/2022/03/31/runaway-pollution-climate-change-threaten-u-s-lakes-and-rivers/7172227001/,
GN:S:GW,Climate change has reduced agricultural productivity by 34 percent in Africa - The Independent,https://www.independent.co.uk/voices/campaigns/giantsclub/kenya/climate-change-reduces-agricultural-africa-b2047956.html,
