feed,title,long_url,short_url
GN:T:WP,"'Please stay home and stay safe!' || Strong winds pummel East Tennessee, causing damage and outages - WBIR",https://www.wbir.com/article/weather/wind-damage-east-tennessee/51-0fec3b85-32fb-4079-a284-62cd92043aa0,
GN:T:WP,"Ukraine invasion reshaping discussion about energy, pricing, renewables - pv magazine International",https://www.pv-magazine.com/2022/03/31/ukraine-invasion-reshaping-discussion-about-energy-pricing-renewables/,
GN:T:WP,LFP Battery News — Is The End Of Nickel In Sight? - CleanTechnica,https://cleantechnica.com/2022/03/31/lfp-battery-news-is-the-end-of-nickel-in-sight/,
GN:T:WP,Climate change: Rising gas prices helping to make the case for onshore wind and solar - Sky News,https://news.sky.com/story/climate-change-rising-gas-prices-helping-to-make-the-case-for-onshore-wind-and-solar-12579108,
GN:T:WP,Iberdrola relief as rest of $9bn offshore wind mega-project gets UK planning nod | Recharge - Recharge,https://www.rechargenews.com/wind/iberdrola-relief-as-rest-of-9bn-offshore-wind-mega-project-gets-uk-planning-nod/2-1-1194453,
GN:T:WP,"Boris Johnson's push for solar energy risks funding Chinese genocide, warns Tories - iNews",https://inews.co.uk/news/politics/boris-johnson-push-solar-energy-chinese-genocide-1550464,
GN:T:WP,AXA IM and Crédit Agricole Assurances invest £3bn to Offshore Wind Farm - Built Environment Networking,https://www.built-environment-networking.com/news/axa-im-alts-and-credit-agricole-assurances-invest-3bn-to-acquire-50-of-hornsea-2-offshore-wind-farm/,
