feed,title,long_url,short_url
ArXiv:q-bio,Clustering Schemes on the Torus with Application to RNA Clashes,https://arxiv.org/abs/2104.00094v1,
ArXiv:q-bio,The population doctrine revolution in cognitive neurophysiology,https://arxiv.org/abs/2104.00145v1,
ArXiv:q-bio,Ancestral state reconstruction with large numbers of sequences and edge-length estimation,https://arxiv.org/abs/2104.00151v1,
ArXiv:q-bio,A network-based analysis of disease modules from a taxonomic perspective,https://arxiv.org/abs/2104.00386v1,
ArXiv:q-bio,Long-Time Behavior of a PDE Replicator Equation for Multilevel Selection in Group-Structured Populations,https://arxiv.org/abs/2104.00392v1,
ArXiv:q-bio,DIVERSE: bayesian Data IntegratiVE learning for precise drug ResponSE prediction,https://arxiv.org/abs/2104.00520v1,
ArXiv:q-bio,Fitting Elephants,https://arxiv.org/abs/2104.00526v1,
ArXiv:q-bio,"Stochastic Modeling of an Infectious Disease, Part III-B: Analysis of the Time-Nonhomogeneous BDI Process and Simulation Experiments of both BD and BDI Processes",https://arxiv.org/abs/2104.00529v1,
ArXiv:q-bio,Quantifying efficiency gains of innovative designs of two-arm vaccine trials for COVID-19 using an epidemic simulation model,https://arxiv.org/abs/2104.00546v1,
ArXiv:q-bio,Synergistic effect of Si-hydroxyapatite coating and VEGF adsorption on Ti6Al4V-ELI scaffolds for bone regeneration in an osteoporotic bone environment,https://arxiv.org/abs/2104.00548v1,
ArXiv:q-bio,Detecting Hidden Units and Network Size from Perceptible Dynamics,https://arxiv.org/abs/2104.00607v1,
ArXiv:q-bio,A new spin on optimal portfolios and ecological equilibria,https://arxiv.org/abs/2104.00668v1,
ArXiv:q-bio,An Efficient and Flexible Spike Train Model via Empirical Bayes,https://arxiv.org/abs/1605.02869v5,
ArXiv:q-bio,Analytical solution of linearized equations of the Morris-Lecar neuron model at large constant stimulation,https://arxiv.org/abs/1912.04083v4,
ArXiv:q-bio,The Model-Specific Markov Embedding Problem for Symmetric Group-Based Models,https://arxiv.org/abs/2005.07171v2,
ArXiv:q-bio,Parameter Estimation from ICC curves,https://arxiv.org/abs/2005.08134v2,
ArXiv:q-bio,Can artificial intelligence (AI) be used to accurately detect tuberculosis (TB) from chest X-rays? An evaluation of five AI products for TB screening and triaging in a high TB burden setting,https://arxiv.org/abs/2006.05509v2,
ArXiv:q-bio,Kinetic models for epidemic dynamics with social heterogeneity,https://arxiv.org/abs/2009.01140v2,
ArXiv:q-bio,Combining single-molecule super-resolved localization microscopy with fluorescence polarization imaging to study cellular processes,https://arxiv.org/abs/2101.00048v2,
ArXiv:q-bio,On a non-isothermal Cahn-Hilliard model for tumor growth,https://arxiv.org/abs/2102.13615v2,
ArXiv:q-bio,How will mass-vaccination change COVID-19 lockdown requirements in Australia?,https://arxiv.org/abs/2103.07061v3,
