feed,title,long_url,short_url
ArXiv:math,Dynamical system of a mosquito population with distinct birth-death rates,https://arxiv.org/abs/2007.03270v1,
ArXiv:math,Spread of premalignant mutant clones and cancer initiation in multilayered tissue,https://arxiv.org/abs/2007.03366v1,
ArXiv:math,Non-intrusive PODI-ROM for patient-specific aortic blood flow in presence of a LVAD device,https://arxiv.org/abs/2007.03527v1,
ArXiv:math,Longer lifespan for many solutions of the Kirchhoff equation,https://arxiv.org/abs/2007.03543v1,
ArXiv:math,Uncertainty quantification of viscoelastic parameters in arterial hemodynamics with the a-FSI blood flow model,https://arxiv.org/abs/2007.01907v1,
