feed,title,long_url,short_url
GN:T:RE,Tiny Magnetized Robots Can Clear Heavy Metal Pollutants Out of Water - The Daily Beast,https://www.thedailybeast.com/tiny-magnetized-robots-can-clear-heavy-metal-pollutants-out-of-water,
GN:T:RE,Cypress Creek Places Order for 300 MW of Maxeon Performance Solar Panels - Solar Industry,https://solarindustrymag.com/cypress-creek-places-order-for-300-mw-of-maxeons-performance-solar-panels,
GN:T:RE,Why Wind Turbines in Lake Erie Are So Controversial - Clevelandmagazine,https://clevelandmagazine.com/in-the-cle/news/articles/why-wind-turbines-in-lake-erie-are-so-controversial,
GN:T:RE,"France ends gas heaters subsidies, boosts heat pumps in bid to cut Russia reliance - Reuters",https://www.reuters.com/world/europe/france-ends-gas-heaters-subsidies-boosts-heat-pumps-bid-cut-russia-reliance-2022-03-16/,
GN:T:RE,Does Charging an EV Cost More Than Filling Up Your Gas Tank Today? - Yahoo Finance,https://finance.yahoo.com/news/does-charging-ev-cost-more-182042025.html,
GN:T:RE,Wind turbine radar clutter could cause new blip for US offshore build-out: BOEM report | Recharge - Recharge,https://www.rechargenews.com/wind/wind-turbine-radar-clutter-could-cause-new-blip-for-us-offshore-build-out-boem-report/2-1-1185105,
GN:T:RE,Temperature-dependent model to calculate solar LCOE – pv magazine International - pv magazine International,https://www.pv-magazine.com/2022/03/16/temperature-dependent-model-to-calculate-solar-lcoe/,
