feed,title,long_url,short_url
GN:T:CC,US and China reach 'some agreements' on climate - John Kerry - BBC,https://news.google.com/rss/articles/CBMiLGh0dHBzOi8vd3d3LmJiYy5jb20vbmV3cy93b3JsZC1hc2lhLTY3Mzc2NDcx0gEwaHR0cHM6Ly93d3cuYmJjLmNvbS9uZXdzL3dvcmxkLWFzaWEtNjczNzY0NzEuYW1w?oc=5,https://da.gd/BhM3WN
GN:T:CC,"Power grid watchdog warns of higher winter blackout risks, cites Biden energy policies as top threat - Fox Business",https://news.google.com/rss/articles/CBMifGh0dHBzOi8vd3d3LmZveGJ1c2luZXNzLmNvbS9wb2xpdGljcy9wb3dlci1ncmlkLXdhdGNoZG9nLXdhcm5zLWhpZ2hlci13aW50ZXItYmxhY2tvdXQtcmlza3MtYmlkZW4tZW5lcmd5LXBvbGljaWVzLXRvcC10aHJlYXTSAYABaHR0cHM6Ly93d3cuZm94YnVzaW5lc3MuY29tL3BvbGl0aWNzL3Bvd2VyLWdyaWQtd2F0Y2hkb2ctd2FybnMtaGlnaGVyLXdpbnRlci1ibGFja291dC1yaXNrcy1iaWRlbi1lbmVyZ3ktcG9saWNpZXMtdG9wLXRocmVhdC5hbXA?oc=5,https://da.gd/xMVH1y
GN:T:CC,Biden Finalizes Significant Overhaul in Federal Regulations - The New York Times,https://news.google.com/rss/articles/CBMiWGh0dHBzOi8vd3d3Lm55dGltZXMuY29tLzIwMjMvMTEvMDkvYnVzaW5lc3MvYmlkZW4tcmVndWxhdGlvbnMtY29zdC1iZW5lZml0LXNwZW5kaW5nLmh0bWzSAQA?oc=5,https://da.gd/lZRrdZ
GN:T:CC,Earth just had its hottest year on record — climate change is to blame - Nature,https://news.google.com/rss/articles/CBMiMmh0dHBzOi8vd3d3Lm5hdHVyZS5jb20vYXJ0aWNsZXMvZDQxNTg2LTAyMy0wMzUyMy0z0gEA?oc=5,https://da.gd/ep8tY
GN:T:CC,"US, China reach 'understandings' on climate ahead of COP28 talks -Kerry - Reuters",https://news.google.com/rss/articles/CBMiZ2h0dHBzOi8vd3d3LnJldXRlcnMuY29tL3dvcmxkL3VzLWNoaW5hLXJlYWNoLXVuZGVyc3RhbmRpbmdzLWNsaW1hdGUtYWhlYWQtY29wMjgtdGFsa3Mta2VycnktMjAyMy0xMS0xMC_SAQA?oc=5,https://da.gd/pZ5JpS
GN:T:CC,Australia Signs Historic Climate Refuge Pact With Tuvalu - TIME,https://news.google.com/rss/articles/CBMiPmh0dHBzOi8vdGltZS5jb20vNjMzMzczMS9hdXN0cmFsaWEtY2xpbWF0ZS1yZWZ1Z2UtcGFjdC10dXZhbHUv0gEA?oc=5,https://da.gd/jlDG2D
GN:T:CC,Climate changes issues force areas to consider if people shouldn't live there anymore - NPR,https://news.google.com/rss/articles/CBMieGh0dHBzOi8vd3d3Lm5wci5vcmcvMjAyMy8xMS8xMC8xMjEyMDY4ODI1L2NsaW1hdGUtY2hhbmdlcy1mb3JjZXMtYXJlYXMtdG8tY29uc2lkZXItaWYtcGVvcGxlLXNob3VsZG50LWxpdmUtdGhlcmUtYW55bW9yZdIBAA?oc=5,https://da.gd/37KZ
GN:T:CC,"Drought is transforming the Amazon, fueling fires and killing dolphins - The Washington Post",https://news.google.com/rss/articles/CBMiW2h0dHBzOi8vd3d3Lndhc2hpbmd0b25wb3N0LmNvbS9jbGltYXRlLWVudmlyb25tZW50LzIwMjMvMTEvMTAvYW1hem9uLWRyb3VnaHQtZGVmb3Jlc3RhdGlvbi_SAQA?oc=5,https://da.gd/FntZG
