feed,title,long_url,short_url
GN:T:WP,Aker and University of Strathclyde to collaborate on project to recycle wind turbine blades - Splash 247,https://splash247.com/aker-and-university-of-strathclyde-to-collaborate-on-project-to-recycle-wind-turbine-blades/,
GN:T:WP,Has Poland's Energy Diversification Drive Paid Off - OilPrice,https://oilprice.com/Energy/Crude-Oil/Has-Polands-Energy-Diversification-Drive-Paid-Off.html,
GN:T:WP,"EV Sales Forecasts For Europe, Tesla, & More — CleanTech Talk - CleanTechnica",https://cleantechnica.com/2021/04/25/ev-sales-forecasts-for-europe-tesla-more-cleantech-talk/,
GN:T:WP,MISO Manages To Log Typical March Load and Demand - RTO Insider,https://rtoinsider.com/rto/miso-load-typical-march-198737/,
GN:T:WP,Energy Transition Could Doom Africa's Oil Producers - OilPrice,https://oilprice.com/Energy/Crude-Oil/Energy-Transition-Could-Doom-Africas-Oil-Producers.html,
GN:T:WP,US Offshore Wind Critical to New England's Decarbonized Future Grid - RTO Insider,https://rtoinsider.com/rto/us-offshore-wind-critical-new-england-198731/,
GN:T:WP,Wind farm project to begin soon - Jersey Evening Post,https://jerseyeveningpost.com/news/2021/04/25/wind-farm-project-to-begin-soon/,
GN:T:WP,TD and engineer says multi-billion euro project is welcome news for Limerick - Limerick Leader,https://www.limerickleader.ie/news/home/627719/td-and-engineer-says-multi-billion-euro-project-is-welcome-news-for-limerick.html,
GN:T:WP,FOREST INK: Alternate nuclear sources needed along with solar and wind power – Williams Lake Tribune - Williams Lake Tribune,https://www.wltribune.com/opinion/forest-ink-alternate-nuclear-sources-needed-along-with-solar-and-wind-power/,
