feed,title,long_url,short_url
GN:T:RE,2024 total solar eclipse: The terrifying and awesome power - Vox,https://news.google.com/rss/articles/CBMiNGh0dHBzOi8vd3d3LnZveC5jb20vMjQxMjE0MTQvc29sYXItZWNsaXBzZS1wb3dlci1hd2XSAQA?oc=5,https://da.gd/SrXQBv
GN:T:RE,"Solar eclipse maps show 2024 totality path, peak times and how much of the eclipse you can see across the U.S. today - CBS News",https://news.google.com/rss/articles/CBMiOWh0dHBzOi8vd3d3LmNic25ld3MuY29tL25ld3Mvc29sYXItZWNsaXBzZS1wYXRoLW1hcC0yMDI0L9IBPWh0dHBzOi8vd3d3LmNic25ld3MuY29tL2FtcC9uZXdzL3NvbGFyLWVjbGlwc2UtcGF0aC1tYXAtMjAyNC8?oc=5,https://da.gd/T6qAqc
GN:T:RE,Saudi Aramco Suspends Two Oil Contractors - OilPrice,https://news.google.com/rss/articles/CBMiYWh0dHBzOi8vb2lscHJpY2UuY29tL0xhdGVzdC1FbmVyZ3ktTmV3cy9Xb3JsZC1OZXdzL1NhdWRpLUFyYW1jby1TdXNwZW5kcy1Ud28tT2lsLUNvbnRyYWN0b3JzLmh0bWzSAWVodHRwczovL29pbHByaWNlLmNvbS9MYXRlc3QtRW5lcmd5LU5ld3MvV29ybGQtTmV3cy9TYXVkaS1BcmFtY28tU3VzcGVuZHMtVHdvLU9pbC1Db250cmFjdG9ycy5hbXAuaHRtbA?oc=5,https://da.gd/ixsLv
GN:T:RE,Department of Energy announces $60M investment into essentially endless source of energy: 'These projects will help us advance' - Yahoo! Voices,https://news.google.com/rss/articles/CBMiVGh0dHBzOi8vd3d3LnlhaG9vLmNvbS9uZXdzL2RlcGFydG1lbnQtZW5lcmd5LWFubm91bmNlcy02MG0taW52ZXN0bWVudC0wNTAwMDAxMDUuaHRtbNIBAA?oc=5,https://da.gd/s2Yc6A
GN:T:RE,LM Wind Power cuts French blade production after 'technical incident' — report - Windpower Monthly,https://news.google.com/rss/articles/CBMif2h0dHBzOi8vd3d3LndpbmRwb3dlcm1vbnRobHkuY29tL2FydGljbGUvMTg2NzkzMi9sbS13aW5kLXBvd2VyLWN1dHMtZnJlbmNoLWJsYWRlLXByb2R1Y3Rpb24tdGVjaG5pY2FsLWluY2lkZW50LSVFMiU4MCU5NC1yZXBvcnTSAQA?oc=5,https://da.gd/vRG1B
GN:T:RE,SmartStop Self Storage Achieves Sustainability Milestone: 50th Property Now Powered by Solar Energy - SolarQuarter,https://news.google.com/rss/articles/CBMihwFodHRwczovL3NvbGFycXVhcnRlci5jb20vMjAyNC8wNC8wOC9zbWFydHN0b3Atc2VsZi1zdG9yYWdlLWFjaGlldmVzLXN1c3RhaW5hYmlsaXR5LW1pbGVzdG9uZS01MHRoLXByb3BlcnR5LW5vdy1wb3dlcmVkLWJ5LXNvbGFyLWVuZXJneS_SAQA?oc=5,https://da.gd/4z3vV
GN:T:RE,Russia Is Preparing for a Potential Gasoline Shortage - OilPrice,https://news.google.com/rss/articles/CBMibWh0dHBzOi8vb2lscHJpY2UuY29tL0xhdGVzdC1FbmVyZ3ktTmV3cy9Xb3JsZC1OZXdzL1J1c3NpYS1Jcy1QcmVwYXJpbmctZm9yLWEtUG90ZW50aWFsLUdhc29saW5lLVNob3J0YWdlLmh0bWzSAXFodHRwczovL29pbHByaWNlLmNvbS9MYXRlc3QtRW5lcmd5LU5ld3MvV29ybGQtTmV3cy9SdXNzaWEtSXMtUHJlcGFyaW5nLWZvci1hLVBvdGVudGlhbC1HYXNvbGluZS1TaG9ydGFnZS5hbXAuaHRtbA?oc=5,https://da.gd/eSm7d
GN:T:RE,Nepal's hydropower boom comes at the cost of its fish - Eco-Business,https://news.google.com/rss/articles/CBMiV2h0dHBzOi8vd3d3LmVjby1idXNpbmVzcy5jb20vbmV3cy9uZXBhbHMtaHlkcm9wb3dlci1ib29tLWNvbWVzLWF0LXRoZS1jb3N0LW9mLWl0cy1maXNoL9IBAA?oc=5,https://da.gd/jWLjS
GN:T:RE,"US will not accept Chinese imports decimating new industries, Yellen says - Reuters",https://news.google.com/rss/articles/CBMicmh0dHBzOi8vd3d3LnJldXRlcnMuY29tL3dvcmxkL3llbGxlbi1tZWV0cy13aXRoLWNoaW5hcy1jZW50cmFsLWJhbmstY2hpZWYtcHJlc3Nlcy1jYXNlLWV4Y2Vzcy1jYXBhY2l0eS0yMDI0LTA0LTA4L9IBAA?oc=5,https://da.gd/yV1CE
GN:T:RE,Staff at France's EDF question involvement in futuristic Saudi city - Yahoo News UK,https://news.google.com/rss/articles/CBMiUWh0dHBzOi8vdWsubmV3cy55YWhvby5jb20vc3RhZmYtZnJhbmNlcy1lZGYtaW52b2x2ZW1lbnQtZnV0dXJpc3RpYy0wNjA4MTkzMTguaHRtbNIBAA?oc=5,https://da.gd/780cR
GN:T:RE,"In Texas, Bill Gates-Backed Startup Infinium Makes Sustainable Fuel - Bloomberg",https://news.google.com/rss/articles/CBMidWh0dHBzOi8vd3d3LmJsb29tYmVyZy5jb20vbmV3cy9mZWF0dXJlcy8yMDI0LTA0LTA4L2luLXRleGFzLWJpbGwtZ2F0ZXMtYmFja2VkLXN0YXJ0dXAtaW5maW5pdW0tbWFrZXMtc3VzdGFpbmFibGUtZnVlbNIBAA?oc=5,https://da.gd/mdq6B
GN:T:RE,"Kremlin Using New Tactics to Destroy Ukrainian Energy Infrastructure, FT Report - Kyiv Post",https://news.google.com/rss/articles/CBMiI2h0dHBzOi8vd3d3Lmt5aXZwb3N0LmNvbS9wb3N0LzMwNzU10gEA?oc=5,https://da.gd/HYMqA
