feed,title,long_url,short_url
GN:T:RE,PV - Helios Nordic Energy AB enters into agreement with Nordic Solar to acquire four projects in Helios project pipeline - Renewable Energy Magazine,https://www.renewableenergymagazine.com/pv_solar/helios-nordic-energy-ab-enters-into-agreement-20220704,
GN:T:RE,China Approves Launch of First Carbon Neutral ETFs - Regulation Asia,https://www.regulationasia.com/china-approves-launch-of-first-carbon-neutral-etfs/,
GN:T:RE,Best Stocks To Buy Now? 4 Renewable Stocks For Your List - Nasdaq,https://www.nasdaq.com/articles/best-stocks-to-buy-now-4-renewable-stocks-for-your-list,
GN:T:RE,Just $126 million would give nation a 92% renewables-powered energy system - pv magazine International,https://www.pv-magazine.com/2022/07/04/just-126-million-would-give-nation-a-92-renewables-powered-energy-system/,
GN:T:RE,Neoenergia wins lots in Brazil's transmission auction - Renewables Now,https://renewablesnow.com/news/neoenergia-wins-lots-in-brazils-transmission-auction-790425/,
GN:T:RE,China's steel demand in focus as manufacturing activity picks up - S&P Global,https://www.spglobal.com/commodityinsights/en/market-insights/videos/market-movers-asia/070422-china-steel-manufacturing-ethylene-asia-naphtha-methanol-gasoline-india-wheat-renewable-carbon-market,
GN:T:RE,TGS acquires asset management firm Prediktor - PV-Tech,https://www.pv-tech.org/tgs-acquires-asset-management-firm-prediktor/,
GN:T:RE,"Intersect Power raises US$750m for renewables, storage and hydrogen - Energy Storage News",https://www.energy-storage.news/us-developer-intersect-secures-us750-million-for-renewables-energy-storage-pipeline/,
GN:T:RE,"Wisconsin's largest utilities make carbon reduction gains, but most will fall short of 2030 goals - Wisconsin Public Radio",https://www.wpr.org/wisconsins-largest-utilities-make-carbon-reduction-gains-most-will-fall-short-2030-goals,
