feed,title,long_url,short_url
MX,Unraveling key determinant of successful therapeutic vaccination against chronic hepatitis B,https://medicalxpress.com/news/2023-01-unraveling-key-successful-therapeutic-vaccination.html,https://da.gd/g9wt
MX,Inflation and a recession are top anxiety-inducing current events polled since June,https://medicalxpress.com/news/2023-01-inflation-recession-anxiety-inducing-current-events.html,https://da.gd/Or7t
MX,Study highlights insufficient funding for vaccinations in low- and middle-income countries,https://medicalxpress.com/news/2023-01-highlights-insufficient-funding-vaccinations-low-.html,https://da.gd/NZwI6p
MX,Mpox has faded in the US. Who deserves the credit?,https://medicalxpress.com/news/2023-01-mpox-credit.html,https://da.gd/wzkNY8
MX,Researchers uncover how HIV reservoir cells resist elimination by human immune responses,https://medicalxpress.com/news/2023-01-uncover-hiv-reservoir-cells-resist.html,https://da.gd/XHZd
