feed,title,long_url,short_url
GN:T:AI,Stability AI announces paid membership for commercial use of its models - The Verge,https://news.google.com/rss/articles/CBMiZGh0dHBzOi8vd3d3LnRoZXZlcmdlLmNvbS8yMDIzLzEyLzE5LzI0MDA4MTQ5L3N0YWJpbGl0eS1haS1wYWlkLXN1YnNjcmlwdGlvbi1jb21tZXJjaWFsLXJpZ2h0cy1zYWZldHnSAQA?oc=5,https://da.gd/vcWc
GN:T:AI,Magic: The Gathering Formally Bans the Use of Generative AI in 'Final' Products - Gizmodo,https://news.google.com/rss/articles/CBMiTWh0dHBzOi8vZ2l6bW9kby5jb20vbWFnaWMtdGhlLWdhdGhlcmluZy1haS1hcnQtYmFuLXdvdGMtaGFzYnJvLWRuZC0xODUxMTEzMTg20gEA?oc=5,https://da.gd/vlmAO0
GN:T:AI,Rite Aid banned from using AI facial recognition to curb shoplifting - The Hill,https://news.google.com/rss/articles/CBMiamh0dHBzOi8vdGhlaGlsbC5jb20vaG9tZW5ld3MvNDM2ODYzMy1yaXRlLWFpZC1iYW5uZWQtZnJvbS11c2luZy1haS1mYWNpYWwtcmVjb2duaXRpb24tdG8tY3VyYi1zaG9wbGlmdGluZy_SAW5odHRwczovL3RoZWhpbGwuY29tL2hvbWVuZXdzLzQzNjg2MzMtcml0ZS1haWQtYmFubmVkLWZyb20tdXNpbmctYWktZmFjaWFsLXJlY29nbml0aW9uLXRvLWN1cmItc2hvcGxpZnRpbmcvYW1wLw?oc=5,https://da.gd/sJDZtD
GN:T:AI,From Einstein to AI: how 100 years have shaped science - Nature,https://news.google.com/rss/articles/CBMiMmh0dHBzOi8vd3d3Lm5hdHVyZS5jb20vYXJ0aWNsZXMvZDQxNTg2LTAyMy0wNDAyMS0y0gEA?oc=5,https://da.gd/dBl41
GN:T:AI,Machine learning sifts through vast data from X-ray diffraction techniques to find new materials - Phys,https://news.google.com/rss/articles/CBMiR2h0dHBzOi8vcGh5cy5vcmcvbmV3cy8yMDIzLTEyLW1hY2hpbmUtc2lmdHMtdmFzdC14LXJheS1kaWZmcmFjdGlvbi5odG1s0gFGaHR0cHM6Ly9waHlzLm9yZy9uZXdzLzIwMjMtMTItbWFjaGluZS1zaWZ0cy12YXN0LXgtcmF5LWRpZmZyYWN0aW9uLmFtcA?oc=5,https://da.gd/ICDDvO
