feed,title,long_url,short_url
GN:T:SP,Utility-scale projects driving US solar growth – pv magazine International - pv magazine International,https://www.pv-magazine.com/2020/09/07/utility-scale-projects-driving-us-solar-growth/,
GN:T:SP,Australia's Solar Boom Draws Attention: 3 Stocks to Watch - Yahoo Finance,https://finance.yahoo.com/news/australias-solar-boom-draws-attention-134801139.html,
GN:T:SP,The Pitch: Installing Generac's PWRCell to provide whole-home power with existing electrical - Solar Builder,https://solarbuildermag.com/featured/the-pitch-installing-generacs-pwrcell-to-provide-whole-home-power-with-existing-electrical/,
GN:T:SP,SunPower Launches New Low-Annual Percentage Rate Loans for Solar Customers - Solar Industry,https://solarindustrymag.com/sunpower-launches-new-low-annual-percentage-rate-loans-for-solar-customers,
GN:T:SP,Sunfinity Renewable Energy selected as solar installer partner for Whisper Valley - Solar Power World,https://www.solarpowerworldonline.com/2020/09/sunfinity-renewable-energy-selected-as-solar-installer-partner-for-whisper-valley/,
GN:T:SP,Tenergie announces the acquisition of seven solar power plants in the South-East of France - en,https://en.econostrum.info/Tenergie-announces-the-acquisition-of-seven-solar-power-plants-in-the-South-East-of-France_a604.html,
