feed,title,long_url,short_url
MX,"Creative people enjoy idle time more than others, study finds",https://medicalxpress.com/news/2023-07-creative-people-enjoy-idle.html,https://da.gd/jSkmv
MX,COVID in kids: Younger children and those from deprived areas are at higher risk of being hospitalized—new research,https://medicalxpress.com/news/2023-07-covid-kids-younger-children-deprived.html,https://da.gd/yLgc8
MX,"Fresh air has long been seen as important for our health, even if we haven't always understood why",https://medicalxpress.com/news/2023-07-fresh-air-important-health-havent.html,https://da.gd/ZtLDf
MX,Researchers measure effect of war on well-being with smartphones and smartwatches,https://medicalxpress.com/news/2023-07-effect-war-well-being-smartphones-smartwatches.html,https://da.gd/223ob
MX,Simple test for COVID-19 could prioritize treatments for individuals most at risk,https://medicalxpress.com/news/2023-07-simple-covid-prioritize-treatments-individuals.html,https://da.gd/FkF5R
MX,A potential new target to treat HIV infection,https://medicalxpress.com/news/2023-07-potential-hiv-infection.html,https://da.gd/A1G3S
