feed,title,long_url,short_url
GN:T:WP,Factbox: Global offshore wind tenders and auctions in 2021 - Reuters,https://www.reuters.com/article/us-global-windpower-auctions-factbox-idUSKBN2BU0S1,
GN:T:WP,What Caused The Saudi-India Oil Rift - OilPrice,https://oilprice.com/Energy/Energy-General/What-Caused-The-Saudi-India-Oil-Rift.html,
GN:T:WP,Solving the Problem with Wind Turbine Blade Disposal - AZoCleantech,https://www.azocleantech.com/article.aspx?ArticleID=1209,
GN:T:WP,"Poland to offer support for PGE, Orsted, RWE offshore projects - Reuters",https://www.reuters.com/article/poland-energy-offshore/update-1-poland-to-offer-support-for-pge-orsted-rwe-offshore-projects-idUSL1N2M10PL,
GN:T:WP,Harvey Gulf Adds Battery Power to Harvey Champion PSV - Offshore Engineer,https://www.oedigital.com/news/486681-harvey-gulf-adds-battery-power-to-harvey-champion-psv,
GN:T:WP,Commissioners accept Rail Tie application | News | wyomingnews.com - Wyoming Tribune,https://www.wyomingnews.com/laramieboomerang/news/commissioners-accept-rail-tie-application/article_eafaa619-ad35-54e6-9c31-1ccbf0cfd6e6.html,
GN:T:WP,"China's capital envisages 10,000 fuel cell vehicles by 2025 - Reuters",https://www.reuters.com/article/china-hydrogen-beijing/chinas-capital-envisages-10000-fuel-cell-vehicles-by-2025-idUSL4N2M11YV,
GN:T:WP,Is Now the Time to Invest in Renewable Energy Stocks? - Motley Fool,https://www.fool.com/investing/2021/04/08/is-now-the-time-to-invest-in-renewable-energy-stoc/,
GN:T:WP,Many Routes to 1000 Mile Battery Vehicles - IDTechEx,https://www.idtechex.com/en/research-article/many-routes-to-1000-mile-battery-vehicles/23479,
