feed,title,long_url,short_url
j.mp/ml-reviews#recap,Notes on Deep Learning Theory (2020),https://arxiv.org/abs/2012.05760,
j.mp/ml-reviews#recap,3D Bounding Box Detection in Volumetric Medical Image Data: A Systematic Literature Review (2020),https://arxiv.org/abs/2012.05745,
j.mp/ml-reviews#recap,Recurrent Point Review Models (2020),https://arxiv.org/abs/2012.05684,
j.mp/ml-reviews#recap,Deep learning methods for SAR image despeckling: trends and perspectives (2020),https://arxiv.org/abs/2012.05508,
j.mp/ml-reviews#recap,AI Driven Knowledge Extraction from Clinical Practice Guidelines: Turning Research into Practice (2020),https://arxiv.org/abs/2012.05489,
j.mp/ml-reviews#recap,Future Trends for Human-AI Collaboration: A Comprehensive Taxonomy of AI/AGI Using Multiple Intelligences and Learning Styles (2020),https://arxiv.org/abs/2008.04793,
j.mp/ml-reviews#recap,Data and its (dis)contents: A survey of dataset development and use in machine learning research (2020),https://arxiv.org/abs/2012.05345,
j.mp/ml-reviews#recap,Machine Learning for Cataract Classification and Grading on Ophthalmic Imaging Modalities: A Survey (2020),https://arxiv.org/abs/2012.04830,
j.mp/ml-reviews#recap,Recent Advances in Computer Audition for Diagnosing COVID-19: An Overview (2020),https://arxiv.org/abs/2012.04650,
j.mp/ml-reviews#recap,"A Unifying Framework for Formal Theories of Novelty:Framework, Examples and Discussion (2020)",https://arxiv.org/abs/2012.04226,
j.mp/ml-reviews#recap,Multi-modal Visual Tracking: Review and Experimental Comparison (2020),https://arxiv.org/abs/2012.04176,
j.mp/ml-reviews#recap,A Taxonomy of Empathetic Response Intents in Human Social Conversations (2020),https://arxiv.org/abs/2012.04080,
j.mp/ml-reviews#recap,Foundations for Near-Term Quantum Natural Language Processing (2020),https://arxiv.org/abs/2012.03755,
j.mp/ml-reviews#recap,"Machine Learning Information Fusion in Earth Observation: A Comprehensive Review of Methods, Applications and Data Sources (2020)",https://arxiv.org/abs/2012.05795,
j.mp/ml-reviews#recap,An Enhanced MeanSum Method For Generating Hotel Multi-Review Summarizations (2020),https://arxiv.org/abs/2012.03656,
j.mp/ml-reviews#recap,Quantifying vegetation biophysical variables from imaging spectroscopy data: a review on retrieval methods (2020),https://arxiv.org/abs/2012.04555,
j.mp/ml-reviews#recap,Deep Transfer Learning for Industrial Automation: A Review and Discussion of New Techniques for Data-Driven Machine Learning (2020),https://arxiv.org/abs/2012.03301,
j.mp/ml-reviews#recap,Different Approaches Towards Vertical Track Irregularity Prediction – A Comparative Study (2020),https://arxiv.org/abs/2012.03062,
j.mp/ml-reviews#recap,A Survey on Deep Learning with Noisy Labels: How to train your model when you cannot trust on the annotations? (2020),https://arxiv.org/abs/2012.03061,
j.mp/ml-reviews#recap,A Review of Designs and Applications of Echo State Networks (2020),https://arxiv.org/abs/2012.02974,
j.mp/ml-reviews#recap,Review: Deep Learning Methods for Cybersecurity and Intrusion Detection Systems (2020),https://arxiv.org/abs/2012.02891,
j.mp/ml-reviews#recap,Deep Learning for Human Mobility: a Survey on Data and Models (2020),https://arxiv.org/abs/2012.02825,
j.mp/ml-reviews#recap,Deep Learning for Medical Anomaly Detection – A Survey (2020),https://arxiv.org/abs/2012.02364,
