feed,title,long_url,short_url
GN:T:AI,"Meet Ashley, the world's first AI-powered political campaign caller - Yahoo News",https://news.google.com/rss/articles/CBMiQWh0dHBzOi8vbmV3cy55YWhvby5jb20vbWVldC1hc2hsZXktd29ybGRzLWZpcnN0LWFpLTExMDgzOTE1NC5odG1s0gEA?oc=5,https://da.gd/kJV3
GN:T:AI,"AI threats pose great cyber risks to smaller companies, experts tell House panel - CyberScoop",https://news.google.com/rss/articles/CBMiRGh0dHBzOi8vY3liZXJzY29vcC5jb20vYWktY3liZXItcmlza3Mtc21hbGwtY29tcGFuaWVzLWhvdXNlLWhlYXJpbmcv0gEA?oc=5,https://da.gd/gTJg
GN:T:AI,"The US government plans to go all-in on using AI. But it lacks a plan, says a government watchdog - CNN",https://news.google.com/rss/articles/CBMiPGh0dHBzOi8vd3d3LmNubi5jb20vMjAyMy8xMi8xMi90ZWNoL2dhby1haS1yZXBvcnQvaW5kZXguaHRtbNIBAA?oc=5,https://da.gd/bDogdO
GN:T:AI,Accenture CTO says ‘there will be some consolidation’ of jobs but ‘the biggest worry is of the jobs for people who won’t be using generative AI’ - Fortune,https://news.google.com/rss/articles/CBMiTmh0dHBzOi8vZm9ydHVuZS5jb20vMjAyMy8xMi8xMi9hY2NlbnR1cmUtY3RvLXRyYWluaW5nLXdvcmtmb3JjZS1haS1icmFpbnN0b3JtL9IBUmh0dHBzOi8vZm9ydHVuZS5jb20vMjAyMy8xMi8xMi9hY2NlbnR1cmUtY3RvLXRyYWluaW5nLXdvcmtmb3JjZS1haS1icmFpbnN0b3JtL2FtcC8?oc=5,https://da.gd/E0vtT
GN:T:AI,Nvidia: 1 Unlikely Reason Why This Artificial Intelligence (AI) Stock Could Skyrocket in 2024 - Yahoo Finance,https://news.google.com/rss/articles/CBMiSmh0dHBzOi8vZmluYW5jZS55YWhvby5jb20vbmV3cy9udmlkaWEtMS11bmxpa2VseS1yZWFzb24td2h5LTE0NTkzMTIyNi5odG1s0gEA?oc=5,https://da.gd/qE4jA
