feed,title,long_url,short_url
r/FoodNerds,Calcitriol alleviates ethanol-induced hepatotoxicity via AMPK/mTOR-mediated autophagy (Jan - 2021),https://redd.it/k38l3j,
r/FoodNerds,Molecular Insights into the Multifunctional Role of Natural Compounds: Autophagy Modulation and Cancer Prevention (Nov - 2020),https://redd.it/k38jo5,
r/FoodNerds,Coptisine induces autophagic cell death through down-regulation of PI3K/Akt/mTOR signaling pathway and up-regulation of ROS-mediated mitochondrial dysfunction in hepatocellular carcinoma Hep3B cells (Nov - 2020),https://redd.it/k38im7,
r/FoodNerds,Agmatine Improves the Behavioral and Cognitive Impairments Associated with Chronic Gestational Ethanol Exposure in Rats (Nov - 2020),https://redd.it/k38hhw,
r/FoodNerds,Magnesium and inflammation: Advances and perspectives (Nov - 2020),https://redd.it/k37vs5,
