feed,title,long_url,short_url
GN:S:C,Top Military Officer Clarifies Biden’s Threat Assessment: Climate Change – But Also China and Russia - U,https://www.usnews.com/news/national-news/articles/2021-06-10/top-military-officer-clarifies-bidens-threat-assessment-climate-change-but-also-china-and-russia,
GN:S:C,New Mexico faith leaders call for climate protections from Permian Basin oilfields - Carlsbad Current-Argus,https://www.currentargus.com/story/news/local/2021/06/10/new-mexico-faith-leaders-call-climate-protections-oilfields/7602816002/,
GN:S:C,"Shades of REDD+Corresponding Adjustments, Equity, and Climate Justice - Ecosystem Marketplace",https://www.ecosystemmarketplace.com/articles/shades-of-redd-corresponding-adjustments-equity-and-climate-justice/,
GN:S:C,"Germany will contribute more to international climate financing, Merkel says - Reuters",https://www.reuters.com/business/environment/germany-will-contribute-more-international-climate-financing-merkel-says-2021-06-10/,
GN:S:C,What SOSV's Climate Tech 100 tells founders about investors in the space – TechCrunch - TechCrunch,https://techcrunch.com/2021/06/10/what-sosvs-climate-tech-100-tells-founders-about-investors-in-the-space/,
GN:S:C,Guest Opinion: Leslie Glustrom: Legislators rise to climate challenge - Boulder Daily Camera,https://www.dailycamera.com/2021/06/10/guest-opinion-leslie-glustrom-legislators-rise-to-climate-challenge,
GN:S:C,Biden's biggest G-7 climate obstacles - POLITICO - Politico,https://www.politico.com/newsletters/morning-energy/2021/06/10/bidens-biggest-g-7-climate-obstacles-795853,
GN:S:C,12 books to get your summer reading started - Yale Climate Connections,https://yaleclimateconnections.org/2021/06/12-books-to-get-your-summer-reading-started/,
GN:S:C,U.S. firms should disclose more climate risk data to investors -lawmakers - Yahoo Finance,https://finance.yahoo.com/news/u-firms-disclose-more-climate-170857990.html,
