feed,title,long_url,short_url
GN:T:WP,Breakingviews - Siemens is case study in China de-risking dilemma - Reuters,https://news.google.com/rss/articles/CBMiYGh0dHBzOi8vd3d3LnJldXRlcnMuY29tL2JyZWFraW5ndmlld3Mvc2llbWVucy1pcy1jYXNlLXN0dWR5LWNoaW5hLWRlLXJpc2tpbmctZGlsZW1tYS0yMDIzLTEwLTA0L9IBAA?oc=5,https://da.gd/VOh5
GN:T:WP,"New rules for grid connection for solar, wind projects in Serbia - Balkan Green Energy News",https://news.google.com/rss/articles/CBMiYmh0dHBzOi8vYmFsa2FuZ3JlZW5lbmVyZ3luZXdzLmNvbS9uZXctcnVsZXMtZm9yLWdyaWQtY29ubmVjdGlvbi1mb3Itc29sYXItd2luZC1wcm9qZWN0cy1pbi1zZXJiaWEv0gEA?oc=5,https://da.gd/JjJ9mv
GN:T:WP,Van Oord Set to Kick Off Cable Installation for Iberdrola's Baltic Eagle Offshore Wind Farm - MarineLink,https://news.google.com/rss/articles/CBMiT2h0dHBzOi8vd3d3Lm1hcmluZWxpbmsuY29tL25ld3MvdmFuLW9vcmQtc2V0LWtpY2stb2ZmLWNhYmxlLWluc3RhbGxhdGlvbi01MDg1MDLSAQA?oc=5,https://da.gd/No0iq
GN:T:WP,Chartwell Marine and VARD to deliver original vessel design for offshore wind - Energy Global,https://news.google.com/rss/articles/CBMieWh0dHBzOi8vd3d3LmVuZXJneWdsb2JhbC5jb20vd2luZC8wNDEwMjAyMy9jaGFydHdlbGwtbWFyaW5lLWFuZC12YXJkLXRvLWRlbGl2ZXItb3JpZ2luYWwtdmVzc2VsLWRlc2lnbi1mb3Itb2Zmc2hvcmUtd2luZC_SAQA?oc=5,https://da.gd/iwsIT
GN:T:WP,US POWER TRACKER: Western forwards tumble on gas prices as renewables rise - S&P Global,https://news.google.com/rss/articles/CBMiqQFodHRwczovL3d3dy5zcGdsb2JhbC5jb20vY29tbW9kaXR5aW5zaWdodHMvZW4vbWFya2V0LWluc2lnaHRzL2xhdGVzdC1uZXdzL2VsZWN0cmljLXBvd2VyLzEwMDMyMy11cy1wb3dlci10cmFja2VyLXdlc3Rlcm4tZm9yd2FyZHMtdHVtYmxlLW9uLWdhcy1wcmljZXMtYXMtcmVuZXdhYmxlcy1yaXNl0gEA?oc=5,https://da.gd/AwQm1m
GN:T:WP,Foxboro votes to replace high school’s logo - WPRI,https://news.google.com/rss/articles/CBMiWGh0dHBzOi8vd3d3LndwcmkuY29tL25ld3MvbG9jYWwtbmV3cy9zZS1tYXNzL2ZveGJvcm8tdm90ZXMtdG8tcmVwbGFjZS1oaWdoLXNjaG9vbHMtbG9nby_SAVxodHRwczovL3d3dy53cHJpLmNvbS9uZXdzL2xvY2FsLW5ld3Mvc2UtbWFzcy9mb3hib3JvLXZvdGVzLXRvLXJlcGxhY2UtaGlnaC1zY2hvb2xzLWxvZ28vYW1wLw?oc=5,https://da.gd/c7nhI
GN:T:WP,"Brunei Shell Petroleum Seeks Damages in Arbitration Against Sapura Fabrication, Sapura Offshore - Offshore Engineer",https://news.google.com/rss/articles/CBMihAFodHRwczovL3d3dy5vZWRpZ2l0YWwuY29tL25ld3MvNTA4NDcwLWJydW5laS1zaGVsbC1wZXRyb2xldW0tc2Vla3MtZGFtYWdlcy1pbi1hcmJpdHJhdGlvbi1hZ2FpbnN0LXNhcHVyYS1mYWJyaWNhdGlvbi1zYXB1cmEtb2Zmc2hvcmXSAYgBaHR0cHM6Ly93d3cub2VkaWdpdGFsLmNvbS9hbXAvbmV3cy81MDg0NzAtYnJ1bmVpLXNoZWxsLXBldHJvbGV1bS1zZWVrcy1kYW1hZ2VzLWluLWFyYml0cmF0aW9uLWFnYWluc3Qtc2FwdXJhLWZhYnJpY2F0aW9uLXNhcHVyYS1vZmZzaG9yZQ?oc=5,https://da.gd/CI3xq
