feed,title,long_url,short_url
ArXiv:Datasets,Benchmarking Multimodal Variational Autoencoders: GeBiD Dataset and Toolkit,https://arxiv.org/abs/2209.03048v1,
ArXiv:Datasets,Avast-CTU Public CAPE Dataset,https://arxiv.org/abs/2209.03188v1,
ArXiv:Datasets,Multi-Domain Multi-Definition Landmark Localization for Small Datasets,https://arxiv.org/abs/2203.10358v2,
ArXiv:Datasets,Survey of Aspect-based Sentiment Analysis Datasets,https://arxiv.org/abs/2204.05232v2,
ArXiv:Datasets,ELF22: A Context-based Counter Trolling Dataset to Combat Internet Trolls,https://arxiv.org/abs/2208.00176v3,
ArXiv:Datasets,INSPIRED2: An Improved Dataset for Sociable Conversational Recommendation,https://arxiv.org/abs/2208.04104v2,
ArXiv:Datasets,A Case Study on the Classification of Lost Circulation Events During Drilling using Machine Learning Techniques on an Imbalanced Large Dataset,https://arxiv.org/abs/2209.01607v2,
