feed,title,long_url,short_url
ArXiv,COVID-19 Fake News Detection Using Bidirectiona lEncoder Representations from Transformers Based Models,https://arxiv.org/abs/2109.14816v1,
ArXiv,Spark in the Dark: Evaluating Encoder-Decoder Pairs for COVID-19 CT's Semantic Segmentation,https://arxiv.org/abs/2109.14818v1,
ArXiv,Characterizing Twitter users behaviour during the Spanish Covid-19 first wave,https://arxiv.org/abs/2012.06550v2,
ArXiv,Accelerating COVID-19 research with graph mining and transformer-based learning,https://arxiv.org/abs/2102.07631v2,
ArXiv,Data Augmentation and CNN Classification For Automatic COVID-19 Diagnosis From CT-Scan Images On Small Dataset,https://arxiv.org/abs/2108.07148v2,
ArXiv,Optimal vaccine roll-out strategies with respect to social distancing measures for SARS-CoV-2 pandemic,https://arxiv.org/abs/2109.12706v2,
ArXiv,Non-stationary spatio-temporal point process modeling for high-resolution COVID-19 data,https://arxiv.org/abs/2109.09029v2,
ArXiv,Exploring the impact of under-reported cases on the COVID-19 spatiotemporal distribution using healthcare worker infection data,https://arxiv.org/abs/2011.04892v6,
ArXiv,Differential Games in the spread of Covid-19,https://arxiv.org/abs/2109.13175v2,
