feed,title,long_url,short_url
ArXiv:Datasets,EGOFALLS: A visual-audio dataset and benchmark for fall detection using egocentric cameras,https://arxiv.org/abs/2309.04579v1,
ArXiv:Datasets,MADLAD-400: A Multilingual And Document-Level Large Audited Dataset,https://arxiv.org/abs/2309.04662v1,
ArXiv:Datasets,What Are People Asking About COVID-19? A Question Classification Dataset,https://arxiv.org/abs/2005.12522v3,
ArXiv:Datasets,Deep incremental learning models for financial temporal tabular datasets with distribution shifts,https://arxiv.org/abs/2303.07925v8,
ArXiv:Datasets,SynBody: Synthetic Dataset with Layered Human Models for 3D Human Perception and Modeling,https://arxiv.org/abs/2303.17368v2,
ArXiv:Datasets,Document Understanding Dataset and Evaluation (DUDE),https://arxiv.org/abs/2305.08455v3,
ArXiv:Datasets,Creating a Dataset for High-Performance Computing Code Translation using LLMs: A Bridge Between OpenMP Fortran and C++,https://arxiv.org/abs/2307.07686v3,
ArXiv:Datasets,Comparative Analysis of Deep Learning Architectures for Breast Cancer Diagnosis Using the BreaKHis Dataset,https://arxiv.org/abs/2309.01007v2,
ArXiv:Datasets,CSPRD: A Financial Policy Retrieval Dataset for Chinese Stock Market,https://arxiv.org/abs/2309.04389v2,
