feed,title,long_url,short_url
ArXiv,OpenRL: A Unified Reinforcement Learning Framework,https://arxiv.org/abs/2312.16189v1,
ArXiv,XuanCe: A Comprehensive and Unified Deep Reinforcement Learning Library,https://arxiv.org/abs/2312.16248v1,
ArXiv,Visual Spatial Attention and Proprioceptive Data-Driven Reinforcement Learning for Robust Peg-in-Hole Task Under Variable Conditions,https://arxiv.org/abs/2312.16438v1,
ArXiv,Adaptive trajectory-constrained exploration strategy for deep reinforcement learning,https://arxiv.org/abs/2312.16456v1,
ArXiv,Inverse Reinforcement Learning with Unknown Reward Model based on Structural Risk Minimization,https://arxiv.org/abs/2312.16566v1,
ArXiv,Autonomous Driving using Residual Sensor Fusion and Deep Reinforcement Learning,https://arxiv.org/abs/2312.16620v1,
ArXiv,Foundations of Reinforcement Learning and Interactive Decision Making,https://arxiv.org/abs/2312.16730v1,
ArXiv,"Occupancy Information Ratio: Infinite-Horizon, Information-Directed, Parameterized Policy Search",https://arxiv.org/abs/2201.08832v2,
ArXiv,Attention-Based Recurrence for Multi-Agent Reinforcement Learning under Stochastic Partial Observability,https://arxiv.org/abs/2301.01649v6,
ArXiv,Adversarial Model for Offline Reinforcement Learning,https://arxiv.org/abs/2302.11048v2,
ArXiv,Heterogeneous-Agent Reinforcement Learning,https://arxiv.org/abs/2304.09870v2,
ArXiv,Safe Model-Based Multi-Agent Mean-Field Reinforcement Learning,https://arxiv.org/abs/2306.17052v2,
ArXiv,DSAC-T: Distributional Soft Actor-Critic with Three Refinements,https://arxiv.org/abs/2310.05858v4,
ArXiv,Discrete Messages Improve Communication Efficiency among Isolated Intelligent Agents,https://arxiv.org/abs/2312.15985v2,
ArXiv,Resilient Constrained Reinforcement Learning,https://arxiv.org/abs/2312.17194v1,
ArXiv,"Rethinking Model-based, Policy-based, and Value-based Reinforcement Learning via the Lens of Representation Complexity",https://arxiv.org/abs/2312.17248v1,
