feed,title,long_url,short_url
ArXiv:Datasets,Dress-Me-Up: A Dataset & Method for Self-Supervised 3D Garment Retargeting,https://arxiv.org/abs/2401.03108v1,
ArXiv:Datasets,Spatiotemporally adaptive compression for scientific dataset with feature preservation -- a case study on simulation data with extreme climate events analysis,https://arxiv.org/abs/2401.03317v1,
ArXiv:Datasets,"Revisiting Color-Event based Tracking: A Unified Network, Dataset, and Metric",https://arxiv.org/abs/2211.11010v2,
ArXiv:Datasets,RJUA-QA: A Comprehensive QA Dataset for Urology,https://arxiv.org/abs/2312.09785v3,
ArXiv:Datasets,EFHQ: Multi-purpose ExtremePose-Face-HQ dataset,https://arxiv.org/abs/2312.17205v3,
ArXiv:Datasets,Investigating Semi-Supervised Learning Algorithms in Text Datasets,https://arxiv.org/abs/2401.01843v2,
