feed,title,long_url,short_url
GN:T:AI,Committee Calls for More Guidance on Agency Use of AI - FEDweek,https://www.fedweek.com/federal-managers-daily-report/committee-calls-for-more-guidance-on-agency-use-of-ai/,https://bit.ly/3i4vgwf
GN:T:AI,How far should AI's decision-making authority go? - VentureBeat,https://venturebeat.com/2022/03/14/how-far-should-ais-decision-making-authority-go/,https://bit.ly/3iokHEF
GN:T:AI,Solana Pay Could Act as a Catalyst to Trigger SOL Price - Analytics Insight,https://www.analyticsinsight.net/solana-pay-could-act-as-a-catalyst-to-trigger-sol-price/,https://bit.ly/3IcbPwe
GN:T:AI,"Web 3’s Use of AI Will Present Challenges, but They Are Not Insurmountable - CoinDesk",https://www.coindesk.com/layer2/2022/03/14/web-3s-use-of-ai-will-present-challenges-but-they-are-not-insurmountable/,https://bit.ly/3IcbTfs
GN:T:AI,Organizing your photos can be a chore. Let AI tag them for you. - Popular Science,https://www.popsci.com/diy/ai-tags-photo-library/,https://bit.ly/3t9GQwn
GN:T:AI,Bitgert Takes Over Safemoon Hype After Revealing Its Founder Went To College - Analytics Insight,https://www.analyticsinsight.net/bitgert-takes-over-safemoon-hype-after-revealing-its-founder-went-to-college/,https://bit.ly/3q7gkBV
