feed,title,long_url,short_url
GN:S:C,Wall Street braces for climate change scrutiny under Biden - Politico,https://www.politico.com/news/2020/11/09/wall-street-braces-for-climate-change-scrutiny-under-biden-435539,
GN:S:C,British watchdog calls for global climate disclosures rules - Reuters UK,https://www.reuters.com/article/uk-climate-change-accounts-regulator/british-watchdog-calls-for-global-climate-disclosures-rules-idUKKBN27Q00D,
GN:S:C,"Biden's win brings hope for growth, jobs to local climate change industry - WLOS",https://wlos.com/news/local/bidens-win-brings-hope-for-growth-jobs-to-local-climate-change-industry,
GN:S:C,"Biden, Canada's Trudeau discuss coronavirus, climate change - Reuters",https://www.reuters.com/article/us-usa-election-china-canada/biden-canadas-trudeau-discuss-coronavirus-climate-change-idUSKBN27P2AI,
GN:S:C,US election: Climate experts react to Joe Biden’s victory - Carbon Brief,https://www.carbonbrief.org/us-election-climate-experts-react-to-joe-bidens-victory,
GN:S:C,Minister of Environment and Climate Change highlights action to stop the spread of mountain pine beetle in Rocky Mountain National Parks - Canada NewsWire,https://www.newswire.ca/news-releases/minister-of-environment-and-climate-change-highlights-action-to-stop-the-spread-of-mountain-pine-beetle-in-rocky-mountain-national-parks-858379181.html,
GN:S:C,Fitzgibbon quits Labor frontbench amid growing climate fight - Sydney Morning Herald,https://www.smh.com.au/politics/federal/joel-fitzgibbon-to-quit-labor-frontbench-amid-growing-climate-fight-20201110-p56d4g.html,
