feed,title,long_url,short_url
ArXiv:q-fin,Measuring Transition Risk in Investment Funds,https://arxiv.org/abs/2210.15329v3,
ArXiv:q-fin,Last passage American cancellable option in L\'evy models,https://arxiv.org/abs/2212.01119v1,
ArXiv:q-fin,Brazilian listed options with discrete dividends and the fast Laplace transform,https://arxiv.org/abs/2212.01315v1,
ArXiv:q-fin,Designing Universal Causal Deep Learning Models: The Geometric (Hyper)Transformer,https://arxiv.org/abs/2201.13094v2,
ArXiv:q-fin,Empirical Asset Pricing via Ensemble Gaussian Process Regression,https://arxiv.org/abs/2212.01048v1,
ArXiv:q-fin,Understanding Cryptocoins Trends Correlations,https://arxiv.org/abs/2212.01267v1,
