feed,title,long_url,short_url
GN:S:GW,Twelve-Time Grammy Winner Ruben Blades Provides Original Song to Animated Climate Change Feature 'Black ... - Yahoo Entertainment,https://news.google.com/rss/articles/CBMiUmh0dHBzOi8vd3d3LnlhaG9vLmNvbS9lbnRlcnRhaW5tZW50L3R3ZWx2ZS10aW1lLWdyYW1teS13aW5uZXItcnViZW4tMDYwMDQzOTAyLmh0bWzSAQA?oc=5,https://da.gd/9qhjZ
GN:S:GW,Steve Vavrus: COP29 will need to reckon with shocking global warming - News,https://news.google.com/rss/articles/CBMiWWh0dHBzOi8vbmV3cy5hei9uZXdzL3N0ZXZlLXZhdnJ1cy1jb3AyOS13aWxsLW5lZWQtdG8tcmVja29uLXdpdGgtLXNob2NraW5nLWdsb2JhbC13YXJtaW5n0gEA?oc=5,https://da.gd/7eIBkk
GN:S:GW,Historic iceberg surges offer insights on modern climate change - Alliance for Science,https://news.google.com/rss/articles/CBMibGh0dHBzOi8vYWxsaWFuY2Vmb3JzY2llbmNlLm9yZy9ibG9nLzIwMjQvMDYvaGlzdG9yaWMtaWNlYmVyZy1zdXJnZXMtb2ZmZXItaW5zaWdodHMtb24tbW9kZXJuLWNsaW1hdGUtY2hhbmdlL9IBAA?oc=5,https://da.gd/Yp25I4
GN:S:GW,Twelve-Time Grammy Winner Ruben Blades Provides Original Song to Animated Climate Change Feature 'Black ... - Yahoo News UK,https://news.google.com/rss/articles/CBMiSGh0dHBzOi8vdWsubmV3cy55YWhvby5jb20vdHdlbHZlLXRpbWUtZ3JhbW15LXdpbm5lci1ydWJlbi0wNjAwNDM5MDIuaHRtbNIBAA?oc=5,https://da.gd/GJGf7Z
GN:S:GW,"Urban growth fuels warming in Indian cities, finds a study - Mongabay-India",https://news.google.com/rss/articles/CBMiXWh0dHBzOi8vaW5kaWEubW9uZ2FiYXkuY29tLzIwMjQvMDYvdXJiYW4tZ3Jvd3RoLWZ1ZWxzLXdhcm1pbmctaW4taW5kaWFuLWNpdGllcy1maW5kcy1hLXN0dWR5L9IBAA?oc=5,https://da.gd/QMMQ7
