feed,title,long_url,short_url
GN:S:GW,Biden Admin Defends Massive Trump-era Drilling Project in Alaska - New York Magazine,https://nymag.com/intelligencer/2021/05/biden-admin-defends-huge-trump-era-drilling-plan-in-alaska.html,
GN:S:GW,Out of sync: How climate change is messing with nature’s timing - The Irish Times,https://www.irishtimes.com/news/science/out-of-sync-how-climate-change-is-messing-with-nature-s-timing-1.4568492,
GN:S:GW,"Critics take aim at UK financial sector, the world's 9th-largest carbon emitter - S&P Global",https://www.spglobal.com/marketintelligence/en/news-insights/latest-news-headlines/critics-take-aim-at-uk-financial-sector-the-world-s-9th-largest-carbon-emitter-64415431,
GN:S:GW,"Amid the push toward smart cities, AT&T gets smarter about climate change - S&P Global",https://www.spglobal.com/marketintelligence/en/news-insights/latest-news-headlines/amid-the-push-toward-smart-cities-at-t-gets-smarter-about-climate-change-64489500,
GN:S:GW,Morocco Calls For Action To Tackle Climate Change Causing Displacement - Morocco World News,https://www.moroccoworldnews.com/2021/05/342607/morocco-calls-for-action-to-tackle-climate-change-causing-displacement,
