feed,title,long_url,short_url
RS,Optimizing Word Embeddings for Patient Portal Message Datasets with a Small Number of Samples,https://www.researchsquare.com/article/rs-4350387/latest,https://da.gd/hWVGZ
RS,Machine learning-based hazard assessment of landslides within the rainband of typhoon Lekima,https://www.researchsquare.com/article/rs-4380308/latest,https://da.gd/k6iWhA
RS,Deep Learning Model to Differentiate Intracranial Germ Cell Tumors Subtypes and Predict Survival,https://www.researchsquare.com/article/rs-4379987/latest,https://da.gd/X3N63
RS,The Contribution of E3D Imaging Integrated with Robotic Navigation. Analysis of the First 80 Consecutive Posterior Spinal Fusion Cases.,https://www.researchsquare.com/article/rs-4369214/latest,https://da.gd/GqBKe
RS,Prognostic value of deep learning based RCA PCAT and plaque volume beyond CT-FFR in patients with stent implantation,https://www.researchsquare.com/article/rs-4343032/latest,https://da.gd/iNZbL
RS,Design of agricultural question answering information extraction method based on improved LSTM algorithm,https://www.researchsquare.com/article/rs-4370119/latest,https://da.gd/4VvswK
RS,Comparative assessment of multimodal sensor data quality collected using Android and iOS smartphones in real-world settings,https://www.researchsquare.com/article/rs-4361528/latest,https://da.gd/NxwuK
RS,Computational Pathology Assessments of Cardiac Stromal Remodeling: Clinical Correlates and Prognostic Implications in Heart Transplantation,https://www.researchsquare.com/article/rs-4364681/latest,https://da.gd/60OJqi
RS,Computed Tomography Assessment of the Conus Medullaris and the Dural Sac Termination in Adult Sheep: Anatomical Implications for Lumbosacral and Sacrococcygeal Injections,https://www.researchsquare.com/article/rs-4383537/latest,https://da.gd/21USQ
