feed,title,long_url,short_url
GN:T:WP,"Severe Sunday storm brings hail, heavy wind & power outages - Lexington Herald Leader",https://news.google.com/rss/articles/CBMiUWh0dHBzOi8vd3d3LmtlbnR1Y2t5LmNvbS9uZXdzL2xvY2FsL2NvdW50aWVzL2ZheWV0dGUtY291bnR5L2FydGljbGUyNzY5NTkyNjguaHRtbNIBAA?oc=5,https://da.gd/OJAIc
GN:T:WP,Wind - PGE and Ørsted Sign Key Contracts for Baltica Offshore Wind Farm - Renewable Energy Magazine,https://news.google.com/rss/articles/CBMiWmh0dHBzOi8vd3d3LnJlbmV3YWJsZWVuZXJneW1hZ2F6aW5lLmNvbS93aW5kL3BnZS1hbmQtcnN0ZWQtc2lnbi1rZXktY29udHJhY3RzLWZvci0yMDIzMDcwM9IBAA?oc=5,https://da.gd/g5YXC
GN:T:WP,Curious and Wondrous Travel Destinations - Atlas Obscura,https://news.google.com/rss/articles/CBMiOGh0dHBzOi8vd3d3LmF0bGFzb2JzY3VyYS5jb20vcGxhY2VzL3dpbGQtaG9yc2Utd2luZC1mYXJt0gEA?oc=5,https://da.gd/To55r
GN:T:WP,"ENGIE Initiates Operations of the Largest Wind Power Plant in Peru, Promoted by IDB Invest - BNamericas English",https://news.google.com/rss/articles/CBMifGh0dHBzOi8vd3d3LmJuYW1lcmljYXMuY29tL2VuL25ld3MvZW5naWUtaW5pdGlhdGVzLW9wZXJhdGlvbnMtb2YtdGhlLWxhcmdlc3Qtd2luZC1wb3dlci1wbGFudC1pbi1wZXJ1LXByb21vdGVkLWJ5LWlkYi1pbnZlc3TSAQA?oc=5,https://da.gd/Gty1
GN:T:WP,Central Illinois wind farm will help power Facebook parent Meta data center - WVIK,https://news.google.com/rss/articles/CBMiYmh0dHBzOi8vd3d3Lnd2aWsub3JnL2lsbGlub2lzLzIwMjMtMDYtMzAvZGV3aXR0LWNvdW50eS13aW5kLWZhcm0tdGhhdC1oZWxwcy1wb3dlci1tZXRhLWdvZXMtb25saW5l0gEA?oc=5,https://da.gd/naHr
GN:T:WP,How AI can contribute to Brazil's electric p... - BNamericas English,https://news.google.com/rss/articles/CBMiX2h0dHBzOi8vd3d3LmJuYW1lcmljYXMuY29tL2VuL2ludGVydmlld3MvaG93LWFpLWNhbi1jb250cmlidXRlLXRvLWJyYXppbHMtZWxlY3RyaWMtcG93ZXItc2VjdG9y0gEA?oc=5,https://da.gd/ponD
GN:T:WP,Opinion | Permitting reform could help with the climate crisis - The Washington Post,https://news.google.com/rss/articles/CBMiVWh0dHBzOi8vd3d3Lndhc2hpbmd0b25wb3N0LmNvbS9vcGluaW9ucy8yMDIzLzA3LzAzL3Blcm1pdC1yZWZvcm0taGVscC1jbGltYXRlLWNyaXNpcy_SAQA?oc=5,https://da.gd/wFQbw
GN:T:WP,Telenor agrees 85 GWh 10-year wind power supply deal for DNA with Statkraft - Telecompaper EN,https://news.google.com/rss/articles/CBMidmh0dHBzOi8vd3d3LnRlbGVjb21wYXBlci5jb20vbmV3cy90ZWxlbm9yLWFncmVlcy04NS1nd2gtMTAteWVhci13aW5kLXBvd2VyLXN1cHBseS1kZWFsLWZvci1kbmEtd2l0aC1zdGF0a3JhZnQtLTE0Njg0ODDSAQA?oc=5,https://da.gd/sB1H
GN:T:WP,Wyo carbon emissions come from fuels that mostly support other states - Buckrail,https://news.google.com/rss/articles/CBMiW2h0dHBzOi8vYnVja3JhaWwuY29tL3d5by1jYXJib24tZW1pc3Npb25zLWNvbWUtZnJvbS1mdWVscy10aGF0LW1vc3RseS1zdXBwb3J0LW90aGVyLXN0YXRlcy_SAQA?oc=5,https://da.gd/IXiR7I
