feed,title,long_url,short_url
GN:S:GW,Op-Ed | Charlie Benner: LaMalfa Denies Climate Change While Thousands of Homes Burn - YubaNet,https://yubanet.com/regional/op-ed-charlie-benner-lamalfa-denies-climate-change-while-thousands-of-homes-burn/,
GN:S:GW,UN: Climate change means more weather disasters every year - WMC,https://www.wmcactionnews5.com/2020/10/13/un-climate-change-means-more-weather-disasters-every-year/,
GN:S:GW,Public Records Sought Over Delays in National Climate Report - Center for Biological Diversity,https://biologicaldiversity.org/w/news/press-releases/public-records-sought-over-delays-national-climate-report-2020-10-13/,
GN:S:GW,Why China's New Climate Commitments Matter for U.S. National Security - Lawfare,https://www.lawfareblog.com/why-chinas-new-climate-commitments-matter-us-national-security,
GN:S:GW,Majority of Americans favor action on climate change - AccuWeather,https://www.accuweather.com/en/weather-blogs/climatechange/majority-of-americans-favor-action-on-climate-change/830737,
GN:S:GW,CSIRO report questions Morrison’s faith in soil carbon due to warming climate - RenewEconomy,https://reneweconomy.com.au/csiro-report-questions-morrisons-faith-in-soil-carbon-due-to-warming-climate-65935/,
GN:S:GW,"Alecta, Strathclyde and others back science-based targets ask - IPE",https://www.ipe.com/news/alecta-strathclyde-and-others-back-science-based-targets-ask/10048394.article,
