feed,title,long_url,short_url
GN:T:GP,Hungary introduces geothermal project de-risking scheme - ThinkGeoEnergy,https://www.thinkgeoenergy.com/hungary-introduces-geothermal-project-de-risking-scheme/,
GN:T:GP,Power unit of Thailand's PTT makes $635m pivot to Asia green energy - Nikkei Asia,https://asia.nikkei.com/Business/Energy/Power-unit-of-Thailand-s-PTT-makes-635m-pivot-to-Asia-green-energy,
GN:T:GP,Enel pilots 3D printing to repair geothermal components - Power Engineering International,https://www.powerengineeringint.com/digitalization/3d-printing/enel-pilots-3d-printing-to-repair-geothermal-components/,
GN:T:GP,2021 Geothermal Rising Conference - registration open - ThinkGeoEnergy,https://www.thinkgeoenergy.com/2021-geothermal-rising-conference-registration-open/,
GN:T:GP,The Automaker Powering Its Cars With Volcanos - OilPrice,https://oilprice.com/Energy/Energy-General/The-Automaker-Powering-Its-Cars-With-Volcanos.html,
GN:T:GP,China Looks To Crack Down On Speculation As Coal Prices Break Records - OilPrice,https://oilprice.com/Latest-Energy-News/World-News/China-Looks-To-Crack-Down-On-Speculation-As-Coal-Prices-Break-Records.html,
GN:T:GP,$100 Oil Is Now A Distinct Possibility - OilPrice,https://oilprice.com/Latest-Energy-News/World-News/Volkswagen-CEO-Slams-G7-Over-Slow-Coal-Phase-Out.html,
GN:T:GP,Depleted Gas Stocks Force Europe To Use More Coal - OilPrice,https://oilprice.com/Energy/Energy-General/Depleted-Gas-Stocks-Force-Europe-To-Use-More-Coal.html,
GN:T:GP,The Renewable Energy Revolution Has A Major Employment Problem - OilPrice,https://oilprice.com/Energy/Energy-General/The-Renewable-Energy-Revolution-Has-A-Major-Employment-Problem.html,
