feed,title,long_url,short_url
MedRxiv,A CRISPR/Cas9 genetically engineered organoid biobank reveals essential host factors for coronaviruses,https://biorxiv.org/cgi/content/short/2021.05.20.444952v1?rss=1,https://j.mp/3f5Om4z
MedRxiv,4'-Fluorouridine is a broad-spectrum orally efficacious antiviral blocking respiratory syncytial virus and SARS-CoV-2 replication,https://biorxiv.org/cgi/content/short/2021.05.19.444875v1?rss=1,https://j.mp/2QB4vp1
MedRxiv,Acute SARS-CoV-2 infection is associated with an expansion of bacteria pathogens in the nose including Pseudomonas aeruginosa,https://biorxiv.org/cgi/content/short/2021.05.20.445008v1?rss=1,https://j.mp/3fx15MF
MedRxiv,An AAV-ie based Vaccine effectively protects against SARS-CoV-2 and Circulating Variants,https://biorxiv.org/cgi/content/short/2021.05.19.444889v1?rss=1,https://j.mp/3bKUvkm
MedRxiv,Alum:CpG adjuvant enables SARS-CoV-2 RBD-induced protection in aged mice and synergistic activation of human elder type 1 immunity,https://biorxiv.org/cgi/content/short/2021.05.20.444848v1?rss=1,https://j.mp/3bEaSPK
MedRxiv,Single-dose AAV-based vaccine induces a high level of neutralizing antibodies and provides long-term protection against SARS-CoV-2 in rhesus macaques,https://biorxiv.org/cgi/content/short/2021.05.19.444881v1?rss=1,https://j.mp/3bEAWdp
