feed,title,long_url,short_url
GN:T:GP,"Iraq, Kurdistan Region Look To Resolve Long-Standing Oil Dispute - OilPrice",https://oilprice.com/Latest-Energy-News/World-News/China-Restarts-Coal-Mines-To-Keep-Up-With-Power-Demand.html,
GN:T:GP,WATCH: Senate expected to adopt bipartisan $1.2 trillion infrastructure bill - Washington Post,https://www.youtube.com/watch?v=h-PUyj-jBS8,
GN:T:GP,Giving Up Oil Is Impossible Alberta Premier - OilPrice,https://oilprice.com/Latest-Energy-News/World-News/Giving-Up-Oil-Is-Impossible-Alberta-Premier.html,
GN:T:RE,"Windbreaks, surprisingly, could help wind farms boost power output - Science News Magazine",https://www.sciencenews.org/article/wind-farm-windbreak-turbine-speed-power-output,
GN:T:RE,Scottish Minister For Net Zero Promised Halt To Road Building But Has Yet To Cancel Any Road Schemes - Forbes,https://www.forbes.com/sites/carltonreid/2021/08/10/scottish-minister-for-net-zero-promised-halt-to-road-building-but-has-yet-to-cancel-any-road-schemes/,
GN:T:RE,EGEB: The US’s first offshore wind farm is currently offline; here’s why - Electrek,https://electrek.co/2021/08/10/egeb-us-first-offshore-wind-farm-is-currently-offline-heres-why/,
GN:T:RE,"As Bitcoin looks to go 'green,' some miners look to nuclear power as a possible solution - CNBC",https://www.cnbc.com/2021/08/10/why-nuclear-energy-could-be-a-clean-energy-solution-for-bitcoin-miners.html,
GN:T:RE,OUC eyes purchase of Osceola power plant as interim step to a future of cleaner energy - Orlando Sentinel,https://www.orlandosentinel.com/news/environment/os-ne-ouc-new-power-plant-20210810-a5gnp2nxr5bivd3kizhr3p2ev4-story.html,
GN:T:RE,Bitcoin Mining Company CleanSpark Acquires Second Data Center - CoinDesk - CoinDesk,https://www.coindesk.com/bitcoin-mining-company-cleanspark-acquires-second-data-center,
