feed,title,long_url,short_url
GN:T:RE,Gavin Newsom hopes California can become epicenter of wind energy - Yahoo News,https://news.yahoo.com/gavin-newsom-hopes-california-can-become-epicenter-for-wind-energy-200709073.html,
GN:T:RE,"This 'Solar Tower' System Produces Jet Fuel From CO2, Water, and Sunlight - Singularity Hub",https://singularityhub.com/2022/07/25/this-solar-tower-system-produces-jet-fuel-from-co2-water-and-sunlight/,
GN:T:RE,Sono reveals final production design for Sion solar-electric family car - New Atlas,https://newatlas.com/automotive/sono-motors-final-production-design-sion-solar-bus-kit/,
GN:T:RE,"Strong winds hit Southcentral Alaska, lead to power outages - Alaska's News Source",https://www.alaskasnewssource.com/2022/07/25/strong-winds-hit-southcentral-alaska-lead-power-outages/,
GN:T:RE,Solar thermal panel for large scale applications – pv magazine International - pv magazine International,https://www.pv-magazine.com/2022/07/25/solar-thermal-panel-for-large-scale-applications/,
