feed,title,long_url,short_url
GN:T:WP,Union prods GE to add green manufacturing jobs in Schenectady - The Daily Gazette,https://dailygazette.com/2021/11/01/union-prods-ge-to-add-green-manufacturing-jobs-in-schenectady/,
GN:T:WP,German wind turbine manufacturer Enercon's CEO to leave the company - Windpower Monthly,https://www.windpowermonthly.com/article/1732045/german-wind-turbine-manufacturer-enercons-ceo-leave-company,
GN:T:WP,Greencoat UK Wind to Acquire Stake in Wind Farm; Launches Equity Raise - MarketWatch,https://www.marketwatch.com/story/greencoat-uk-wind-to-acquire-stake-in-wind-farm-launches-equity-raise-271635845778,
GN:T:WP,"SSE, Equinor Sell 20% Stake in World's Largest Offshore Wind Farm to ENI - MarketWatch",https://www.marketwatch.com/story/sse-equinor-sell-20-stake-in-world-s-largest-offshore-wind-farm-to-eni-271635848548,
GN:T:WP,"Alliant Energy plans to develop $750 million solar power project, largest in Iowa - Des Moines Register",https://www.desmoinesregister.com/story/money/business/2021/11/02/alliant-energy-invest-750-million-largest-iowa-solar-battery-storage-project/6233896001/,
GN:T:WP,These Batteries Can't Power a Car—but They Can Light Up a City - WIRED,https://www.wired.com/story/batteries-cant-power-car-light-city/,
GN:T:WP,Wichita State basketball players review exhibition game win - Wichita Eagle,https://www.kansas.com/latest-news/article255470221.html,
GN:T:WP,"Infinity Energy Resources Announces Results of Annual Shareholders Meeting Including Name Change to American Noble Gas, Inc. - Yahoo Finance",https://finance.yahoo.com/news/infinity-energy-resources-announces-results-110000505.html,
GN:T:WP,Siemens Gamesa Installs 14 MW Wind Turbine Nacelle Prototype - Offshore WIND,https://www.offshorewind.biz/2021/10/27/siemens-gamesa-installs-14-mw-wind-turbine-nacelle-prototype/,
