feed,title,long_url,short_url
GN:S:GW,Biden administration proposes rules to cut climate-warming methane emissions - KUOW News and Information,https://www.kuow.org/stories/biden-administration-proposes-rules-to-cut-climate-warming-methane-emissions,
GN:S:GW,Over 100 countries vow to end deforestation at climate talks - OPB News,https://www.opb.org/article/2021/11/02/over-100-countries-vow-to-end-deforestation-at-climate-talks/,
GN:S:GW,Even the greenest among us have not yet confronted the hard choices of climate change - MarketWatch,https://www.marketwatch.com/story/even-the-greenest-among-us-have-not-yet-confronted-the-hard-choices-of-climate-change-11635861906,
GN:S:GW,COP26 Glasgow summit: Xi's inaction turns globalisation into global warming - The Australian Financial Review,https://www.afr.com/policy/energy-and-climate/xi-s-inaction-turns-globalisation-into-global-warming-20211101-p5951u,
GN:S:GW,"In Germany, global warming is changing more than just the climate. - Yahoo News",https://news.yahoo.com/germany-global-warming-changing-more-084716719.html,
