feed,title,long_url,short_url
RS,Venomous gland transcriptome and venom proteomic analysis of the scorpion Androctonus amoreuxi reveal new peptides with anti-SARS- CoV-2 activity,https://www.researchsquare.com/article/rs-2706268/latest,https://da.gd/wzaJW
RS,The Role of Malnutrition on Outocomes of Multisystem Inflammatory Syndrome Due to Covid-19 in Children,https://www.researchsquare.com/article/rs-2637452/latest,https://da.gd/7a441j
RS,A physician strike team to disseminate accurate and timely COVID-19 vaccination information and improve responses to patient questions,https://www.researchsquare.com/article/rs-2675106/latest,https://da.gd/6X36sV
RS,Machine Learning Techniques for the Identification of Risk Factors Associated with Food Insecurity among Adults in Arab countries during the COVID-19 Pandemic,https://www.researchsquare.com/article/rs-2545270/latest,https://da.gd/qmiNCI
RS,In silico evaluation of anti SARS-CoV-2 antibodies neutralization power: A blueprint with monoclonal antibody Sotrovimab,https://www.researchsquare.com/article/rs-2696333/latest,https://da.gd/xGuBP
