feed,title,long_url,short_url
GN:T:WP,NextEra Energy Partners Acquires Wind Portfolio From Brookfield Renewable - Motley Fool,https://www.fool.com/investing/2021/04/19/nextera-energy-partners-acquires-wind-portfolio-fr/,
GN:T:WP,"Despite natural gas failures during winter storm, Texas lawmakers target renewable energy - Chron",https://www.chron.com/news/houston-texas/article/texas-renewable-energy-oil-gas-16111204.php,
GN:T:WP,Can The Energy Sector Maintain Its Crazy Momentum - OilPrice,https://oilprice.com/Energy/Energy-General/Can-The-Energy-Sector-Maintain-Its-Crazy-Momentum.html,
GN:T:WP,Electricity Companies Urge Biden to Set Standard to Reduce Emissions 80 Percent by 2030 - Rolling Stone,https://www.rollingstone.com/politics/politics-news/biden-electricity-reduce-emissions-1157639/,
GN:T:WP,"Glick, Robb Call for Transmission Build in West - RTO Insider",https://rtoinsider.com/rto/glick-robb-transmission-build-west-198137/,
GN:T:WP,Numerous power outages reported across northern Utah due to high winds - fox13now,https://www.fox13now.com/news/local-news/numerous-power-outages-reported-across-northern-utah-due-to-high-winds,
GN:T:WP,"Houston Autopilot Crash: What We Know So Far (For One, Autopilot Wasn’t On) - CleanTechnica",https://cleantechnica.com/2021/04/19/houston-autopilot-crash-what-we-know-so-far-for-one-autopilot-wasnt-on/,
GN:T:WP,Developer holds exclusive rights to purchase Kingston's wind turbine - Wicked Local,https://www.wickedlocal.com/story/kingston-reporter/2021/04/19/green-development-rhode-island-proposes-replace-kingston-turbine/7294048002/,
GN:T:WP,Disagreement over how to achieve emissions goals reveals split among clean energy supporters - North Country Public Radio,https://www.northcountrypublicradio.org/news/story/43611/20210419/disagreement-over-how-to-achieve-emissions-goals-reveals-split-among-clean-energy-supporters,
GN:T:WP,CIP's latest renewables fund reaches EUR-7bn final close - Renewables Now,https://renewablesnow.com/news/cips-latest-renewables-fund-reaches-eur-7bn-final-close-738374/,
