feed,title,long_url,short_url
GN:T:ML,Google DeepMind Introduces AlphaCode 2: An Artificial Intelligence (AI) System that Uses the Power of the Gemini Model for a Remarkable Advance in Competitive Programming Excellence - MarkTechPost,https://news.google.com/rss/articles/CBMi2wFodHRwczovL3d3dy5tYXJrdGVjaHBvc3QuY29tLzIwMjMvMTIvMTAvZ29vZ2xlLWRlZXBtaW5kLWludHJvZHVjZXMtYWxwaGFjb2RlLTItYW4tYXJ0aWZpY2lhbC1pbnRlbGxpZ2VuY2UtYWktc3lzdGVtLXRoYXQtdXNlcy10aGUtcG93ZXItb2YtdGhlLWdlbWluaS1tb2RlbC1mb3ItYS1yZW1hcmthYmxlLWFkdmFuY2UtaW4tY29tcGV0aXRpdmUtcHJvZ3JhbW1pbmctZXhjZWxsZW5jZS_SAd8BaHR0cHM6Ly93d3cubWFya3RlY2hwb3N0LmNvbS8yMDIzLzEyLzEwL2dvb2dsZS1kZWVwbWluZC1pbnRyb2R1Y2VzLWFscGhhY29kZS0yLWFuLWFydGlmaWNpYWwtaW50ZWxsaWdlbmNlLWFpLXN5c3RlbS10aGF0LXVzZXMtdGhlLXBvd2VyLW9mLXRoZS1nZW1pbmktbW9kZWwtZm9yLWEtcmVtYXJrYWJsZS1hZHZhbmNlLWluLWNvbXBldGl0aXZlLXByb2dyYW1taW5nLWV4Y2VsbGVuY2UvP2FtcA?oc=5,https://da.gd/sVEI6P
GN:T:ML,Machine learning algorithm predicts Cardano price Xmas day - Finbold - Finance in Bold,https://news.google.com/rss/articles/CBMiT2h0dHBzOi8vZmluYm9sZC5jb20vbWFjaGluZS1sZWFybmluZy1hbGdvcml0aG0tcHJlZGljdHMtY2FyZGFuby1wcmljZS14bWFzLWRheS_SAQA?oc=5,https://da.gd/vNz0wH
GN:T:ML,How Could AI Be a Tool for Workers? - How Could AI Be a Tool for Workers? - InformationWeek,https://news.google.com/rss/articles/CBMiV2h0dHBzOi8vd3d3LmluZm9ybWF0aW9ud2Vlay5jb20vbWFjaGluZS1sZWFybmluZy1haS9ob3ctY291bGQtYWktYmUtYS10b29sLWZvci13b3JrZXJzLdIBAA?oc=5,https://da.gd/vBIrg
GN:T:ML,Harnessing the Power of AI in Customer Feedback Analysis - G2,https://news.google.com/rss/articles/CBMiL2h0dHBzOi8vbGVhcm4uZzIuY29tL2N1c3RvbWVyLWZlZWRiYWNrLWFuYWx5c2lz0gEA?oc=5,https://da.gd/I5w2C
GN:T:ML,Medtronic and Cosmo Pharmaceuticals Forge Ahead in AI-driven Care - AiThority,https://news.google.com/rss/articles/CBMiaWh0dHBzOi8vYWl0aG9yaXR5LmNvbS9tYWNoaW5lLWxlYXJuaW5nL21lZHRyb25pYy1hbmQtY29zbW8tcGhhcm1hY2V1dGljYWxzLWZvcmdlLWFoZWFkLWluLWFpLWRyaXZlbi1jYXJlL9IBAA?oc=5,https://da.gd/mu8jdG
GN:T:ML,How AI and Machine Learning Will Fundamentally Transform Business Intelligence - Medium,https://news.google.com/rss/articles/CBMifWh0dHBzOi8vbWVkaXVtLmNvbS9kYW5pZWwtcGFyZW50ZS9ob3ctYWktYW5kLW1hY2hpbmUtbGVhcm5pbmctd2lsbC1mdW5kYW1lbnRhbGx5LXRyYW5zZm9ybS1idXNpbmVzcy1pbnRlbGxpZ2VuY2UtZDk1NDIxZGM2OTA50gEA?oc=5,https://da.gd/ySDV4
