feed,title,long_url,short_url
ArXiv:q-fin,Cleaning large-dimensional covariance matrices for correlated samples,https://arxiv.org/abs/2107.01352v3,
ArXiv:q-fin,Systemic Risk Models for Disjoint and Overlapping Groups with Equilibrium Strategies,https://arxiv.org/abs/2202.00662v1,
ArXiv:q-fin,Policy Evaluation and Temporal-Difference Learning in Continuous Time and Space: A Martingale Approach,https://arxiv.org/abs/2108.06655v2,
ArXiv:q-fin,Clearing Payments in Dynamic Financial Networks,https://arxiv.org/abs/2201.12898v2,
ArXiv:q-fin,New Collectivity Measures for Financial Covariances and Correlations,https://arxiv.org/abs/2202.00297v1,
ArXiv:q-fin,Problems of Tax Administration and its Impact on Budget Revenues,https://arxiv.org/abs/2202.00124v1,
ArXiv:q-fin,FiNCAT: Financial Numeral Claim Analysis Tool,https://arxiv.org/abs/2202.00631v1,
