feed,title,long_url,short_url
GN:T:CC,Why intense heat waves are more likely because of climate change - The Washington Post,https://news.google.com/rss/articles/CBMiXmh0dHBzOi8vd3d3Lndhc2hpbmd0b25wb3N0LmNvbS9jbGltYXRlLWVudmlyb25tZW50LzIwMjQvMDYvMjIvZGVhZGx5LWhlYXQtd2F2ZS1jbGltYXRlLWNoYW5nZS_SAQA?oc=5,https://da.gd/4diSI
GN:T:CC,Cloud geoengineering could push heatwaves from US to Europe - New Scientist,https://news.google.com/rss/articles/CBMiaWh0dHBzOi8vd3d3Lm5ld3NjaWVudGlzdC5jb20vYXJ0aWNsZS8yNDM2Mzc3LWNsb3VkLWdlb2VuZ2luZWVyaW5nLWNvdWxkLXB1c2gtaGVhdHdhdmVzLWZyb20tdXMtdG8tZXVyb3BlL9IBAA?oc=5,https://da.gd/sSQx
GN:T:CC,Climate change may causing more dust storms in southern Arizona - KOLD,https://news.google.com/rss/articles/CBMiY2h0dHBzOi8vd3d3LmtvbGQuY29tL3ZpZGVvLzIwMjQvMDYvMjIvY2xpbWF0ZS1jaGFuZ2UtbWF5LWNhdXNpbmctbW9yZS1kdXN0LXN0b3Jtcy1zb3V0aGVybi1hcml6b25hL9IBAA?oc=5,https://da.gd/FCacX
GN:T:CC,"On climate change, Donald Trump is ready to sell out our future | Editorial - The Philadelphia Inquirer",https://news.google.com/rss/articles/CBMigQFodHRwczovL3d3dy5pbnF1aXJlci5jb20vb3Bpbmlvbi9lZGl0b3JpYWxzL2lucTIvY2xpbWF0ZS1jaGFuZ2UtZG9uYWxkLXRydW1wLWlzLXJlYWR5LXNlbGwtb3V0LW91ci1mdXR1cmUtZWRpdG9yaWFsLTIwMjQwNjIzLmh0bWzSAQA?oc=5,https://da.gd/HG9NLp
GN:T:CC,What climate change means for Europe's 'pest demographics' haunting the Paris Olympics - Fortune,https://news.google.com/rss/articles/CBMioQFodHRwczovL3d3dy5mb3J0dW5lLmNvbS9ldXJvcGUvMjAyNC8wNi8yMi90aWdlci1tb3NxdWl0b3MtYXNpYW4taG9ybmV0cy1iZWQtYnVncy13aGF0LWNsaW1hdGUtY2hhbmdlLW1lYW5zLWZvci1ldXJvcGVzLXBlc3QtZGVtb2dyYXBoaWNzLWhhdW50aW5nLXBhcmlzLW9seW1waWNzL9IBAA?oc=5,https://da.gd/zzNDfY
