feed,title,long_url,short_url
GN:T:RE,Gas crisis: Energy regulator warns more customers face hit - BBC News,https://www.bbc.com/news/business-58652083,
GN:T:RE,Electric/Hybrid - Equipmake and Beulas unveil state-of-the-art double decker electric bus with up to 250 miles of zero emission range - Renewable Energy Magazine,https://www.renewableenergymagazine.com/electric_hybrid_vehicles/equipmake-and-beulas-unveil-stateoftheart-double-decker-20210922,
GN:T:RE,We need 'to move the energy sector forward’: Houston mayor on tackling climate change - Yahoo Finance,https://finance.yahoo.com/news/we-need-to-move-the-energy-sector-forward-houston-mayor-on-tackling-climate-change-130620589.html,
GN:T:RE,Ørsted and US gas giant Williams to explore power-to-X projects - Windpower Monthly,https://www.windpowermonthly.com/article/1728237/orsted-us-gas-giant-williams-explore-power-to-x-projects,
GN:T:RE,Worksport Makes the Impossible Possible: Green-Energy Microgrid Systems Power EV Trucking and Off-Grid Lifestyling - Yahoo Finance,https://finance.yahoo.com/news/worksport-makes-impossible-possible-green-125113459.html,
GN:T:RE,Tracking clean energy performance: Omnidian lands $33M to help companies manage solar assets - GeekWire,https://www.geekwire.com/2021/tracking-clean-energy-performance-omnidian-lands-33m-help-companies-manage-solar-assets/,
