feed,title,long_url,short_url
GN:T:WP,"Breakingviews - Time to target fossil fuel demand, not supply - Reuters",https://news.google.com/rss/articles/CBMiW2h0dHBzOi8vd3d3LnJldXRlcnMuY29tL2JyZWFraW5ndmlld3MvdGltZS10YXJnZXQtZm9zc2lsLWZ1ZWwtZGVtYW5kLW5vdC1zdXBwbHktMjAyMy0wOS0xMS_SAQA?oc=5,https://da.gd/0n4W9
GN:T:WP,France's H1 solar deployments climb 8% Y/Y - Renewables Now,https://news.google.com/rss/articles/CBMiTmh0dHBzOi8vcmVuZXdhYmxlc25vdy5jb20vbmV3cy9mcmFuY2VzLWgxLXNvbGFyLWRlcGxveW1lbnRzLWNsaW1iLTgteXktODMzNTE2L9IBAA?oc=5,https://da.gd/aQwQ
GN:T:WP,What Electricity Sources Power the World? - Elements by Visual Capitalist,https://news.google.com/rss/articles/CBMiT2h0dHBzOi8vZWxlbWVudHMudmlzdWFsY2FwaXRhbGlzdC5jb20vd2hhdC1lbGVjdHJpY2l0eS1zb3VyY2VzLXBvd2VyLXRoZS13b3JsZC_SAQA?oc=5,https://da.gd/ZHF40d
GN:T:WP,Consumers Energy: 'Clean Serving Clean': How Consumers Energy is partnering with businesses to ramp up renewables. - Site Selection Magazine,https://news.google.com/rss/articles/CBMiQmh0dHBzOi8vc2l0ZXNlbGVjdGlvbi5jb20vaXNzdWVzLzIwMjMvc2VwLy1jbGVhbi1zZXJ2aW5nLWNsZWFuLmNmbdIBAA?oc=5,https://da.gd/zN2Lw
GN:T:WP,Van Oord celebrates christening of cable-laying vessel Calypso - Windtech International,https://news.google.com/rss/articles/CBMicmh0dHBzOi8vd3d3LndpbmR0ZWNoLWludGVybmF0aW9uYWwuY29tL2NvbXBhbnktbmV3cy92YW4tb29yZC1jZWxlYnJhdGVzLWNocmlzdGVuaW5nLW9mLWNhYmxlLWxheWluZy12ZXNzZWwtY2FseXBzb9IBAA?oc=5,https://da.gd/IIIByw
GN:T:WP,Nuclear energy remains weapon of choice for climate deniers and coal lobby - RenewEconomy,https://news.google.com/rss/articles/CBMiZ2h0dHBzOi8vcmVuZXdlY29ub215LmNvbS5hdS9udWNsZWFyLWVuZXJneS1yZW1haW5zLXdlYXBvbi1vZi1jaG9pY2UtZm9yLWNsaW1hdGUtZGVuaWVycy1hbmQtY29hbC1sb2JieS_SAWtodHRwczovL3JlbmV3ZWNvbm9teS5jb20uYXUvbnVjbGVhci1lbmVyZ3ktcmVtYWlucy13ZWFwb24tb2YtY2hvaWNlLWZvci1jbGltYXRlLWRlbmllcnMtYW5kLWNvYWwtbG9iYnkvYW1wLw?oc=5,https://da.gd/zdyUkp
