feed,title,long_url,short_url
GN:T:CC,International Court Hears Island Nations’ Case on Climate Change - The New York Times,https://news.google.com/rss/articles/CBMiVWh0dHBzOi8vd3d3Lm55dGltZXMuY29tLzIwMjMvMDkvMTEvd29ybGQvYXNpYS9pc2xhbmQtbmF0aW9ucy1vY2Vhbi1jb3VydC1jbGltYXRlLmh0bWzSAQA?oc=5,https://da.gd/YdWCsE
GN:T:CC,Battery storage takes central role in powering net zero - Financial Times,https://news.google.com/rss/articles/CBMiP2h0dHBzOi8vd3d3LmZ0LmNvbS9jb250ZW50LzFmMzQzZWExLWIxNWQtNDZkZS05MDI4LWEyZjllNzA5ODY1Y9IBAA?oc=5,https://da.gd/u7lSML
GN:T:CC,How science bolstered a key European climate-change case - Nature,https://news.google.com/rss/articles/CBMiMmh0dHBzOi8vd3d3Lm5hdHVyZS5jb20vYXJ0aWNsZXMvZDQxNTg2LTAyMy0wMjgwOS130gEA?oc=5,https://da.gd/drRz
GN:T:CC,Keller @ Large: Talking climate after a bizarre and wet summer - CBS Boston,https://news.google.com/rss/articles/CBMiaGh0dHBzOi8vd3d3LmNic25ld3MuY29tL2Jvc3Rvbi9uZXdzL2tlbGxlci1sYXJnZS1jbGltYXRlLWNoYW5nZS13ZWF0aGVyLWVudmlyb25tZW50YWwtcHJvdGVjdGlvbi1hZ2VuY3kv0gFsaHR0cHM6Ly93d3cuY2JzbmV3cy5jb20vYW1wL2Jvc3Rvbi9uZXdzL2tlbGxlci1sYXJnZS1jbGltYXRlLWNoYW5nZS13ZWF0aGVyLWVudmlyb25tZW50YWwtcHJvdGVjdGlvbi1hZ2VuY3kv?oc=5,https://da.gd/PENN4j
GN:T:CC,Belgium Premiers Opera Casting Cassandra as Climate Change Scientist - U,https://news.google.com/rss/articles/CBMiemh0dHBzOi8vd3d3LnVzbmV3cy5jb20vbmV3cy93b3JsZC9hcnRpY2xlcy8yMDIzLTA5LTExL2JlbGdpdW0tcHJlbWllcnMtb3BlcmEtY2FzdGluZy1jYXNzYW5kcmEtYXMtY2xpbWF0ZS1jaGFuZ2Utc2NpZW50aXN00gEA?oc=5,https://da.gd/wCAxVd
GN:T:CC,How green infrastructure can protect our beaches from climate change - World Economic Forum,https://news.google.com/rss/articles/CBMiW2h0dHBzOi8vd3d3LndlZm9ydW0ub3JnL2FnZW5kYS8yMDIzLzA5L2NsaW1hdGUtY2hhbmdlLWVyb2RpbmctYmVhY2hlcy1ncmVlbi1pbmZyYXN0cnVjdHVyZS_SAQA?oc=5,https://da.gd/sWE0Jz
GN:T:CC,How scientists track humanity’s role in extreme weather events - The Washington Post,https://news.google.com/rss/articles/CBMiV2h0dHBzOi8vd3d3Lndhc2hpbmd0b25wb3N0LmNvbS9zY2llbmNlLzIwMjMvMDkvMTEvZXh0cmVtZS13ZWF0aGVyLWh1bWFuLWNhdXNlcy1zY2llbmNlL9IBAA?oc=5,https://da.gd/OFq2M
