feed,title,long_url,short_url
GN:T:CC,Alberta to ban renewables on ‘prime’ land and preserve ‘pristine viewscapes’ - The Guardian,https://news.google.com/rss/articles/CBMiR2h0dHBzOi8vd3d3LnRoZWd1YXJkaWFuLmNvbS93b3JsZC8yMDI0L2ZlYi8yOC9hbGJlcnRhLWVuZXJneS1yZW5ld2FibGVz0gFHaHR0cHM6Ly9hbXAudGhlZ3VhcmRpYW4uY29tL3dvcmxkLzIwMjQvZmViLzI4L2FsYmVydGEtZW5lcmd5LXJlbmV3YWJsZXM?oc=5,https://da.gd/Yp7F8
GN:T:CC,Spain Enjoys Cheap Electricity Amid Record Renewable Energy Output - OilPrice,https://news.google.com/rss/articles/CBMiemh0dHBzOi8vb2lscHJpY2UuY29tL0xhdGVzdC1FbmVyZ3ktTmV3cy9Xb3JsZC1OZXdzL1NwYWluLUVuam95cy1DaGVhcC1FbGVjdHJpY2l0eS1BbWlkLVJlY29yZC1SZW5ld2FibGUtRW5lcmd5LU91dHB1dC5odG1s0gF-aHR0cHM6Ly9vaWxwcmljZS5jb20vTGF0ZXN0LUVuZXJneS1OZXdzL1dvcmxkLU5ld3MvU3BhaW4tRW5qb3lzLUNoZWFwLUVsZWN0cmljaXR5LUFtaWQtUmVjb3JkLVJlbmV3YWJsZS1FbmVyZ3ktT3V0cHV0LmFtcC5odG1s?oc=5,https://da.gd/5DnY9d
GN:T:CC,Europe's Tool to Tax Pollution Abroad Faces Teething Pains - Bloomberg,https://news.google.com/rss/articles/CBMibWh0dHBzOi8vd3d3LmJsb29tYmVyZy5jb20vbmV3cy9hcnRpY2xlcy8yMDI0LTAyLTI5L2V1cm9wZS1zLXRvb2wtdG8tdGF4LXBvbGx1dGlvbi1hYnJvYWQtZmFjZXMtdGVldGhpbmctcGFpbnPSAQA?oc=5,https://da.gd/1Xvv4p
GN:T:CC,"Exxon's ESG lawsuit finds influential friends in Chamber, Business Roundtable - Axios",https://news.google.com/rss/articles/CBMiTmh0dHBzOi8vd3d3LmF4aW9zLmNvbS8yMDI0LzAyLzI5L2V4eG9uLWVzZy1sYXdzdWl0LWNoYW1iZXItYnVzaW5lc3Mtcm91bmR0YWJsZdIBAA?oc=5,https://da.gd/X2FsK
GN:T:CC,Smokehouse Creek fire is now the biggest wildfire in Texas history - The Washington Post,https://news.google.com/rss/articles/CBMiXmh0dHBzOi8vd3d3Lndhc2hpbmd0b25wb3N0LmNvbS93ZWF0aGVyLzIwMjQvMDIvMjkvc21va2Vob3VzZS1jcmVlay1iaWdnZXN0LWZpcmUtdGV4YXMtaGlzdG9yeS_SAQA?oc=5,https://da.gd/tH4MP
GN:T:CC,"By deleting mention of climate change, Florida legislators try to hide from the problem • Florida Phoenix - Florida Phoenix",https://news.google.com/rss/articles/CBMifWh0dHBzOi8vZmxvcmlkYXBob2VuaXguY29tLzIwMjQvMDIvMjkvYnktZGVsZXRpbmctbWVudGlvbi1vZi1jbGltYXRlLWNoYW5nZS1mbG9yaWRhLWxlZ2lzbGF0b3JzLXRyeS10by1oaWRlLWZyb20tdGhlLXByb2JsZW0v0gEA?oc=5,https://da.gd/xR0E
GN:T:CC,UPDATED: Petitioners: Public Service Commission has 'most consequential role' on future of Montana – Daily Montanan - Daily Montanan,https://news.google.com/rss/articles/CBMifGh0dHBzOi8vZGFpbHltb250YW5hbi5jb20vMjAyNC8wMi8yOC80MC1vcmdzLWJ1c2luZXNzZXMtdG8tcHVibGljLXNlcnZpY2UtY29tbWlzc2lvbi1jb25zaWRlci1jbGltYXRlLWluLXV0aWxpdHktcmVndWxhdGlvbi_SAQA?oc=5,https://da.gd/DJfW
