feed,title,long_url,short_url
LitCovid,Universal Bacterium-Vectored COVID-19 Vaccine Expressing Early SARS-CoV-2 Conserved Proteins Cross-Protects Against Late Variants in Hamsters,https://pubmed.ncbi.nlm.nih.gov/40573964,
LitCovid,Post COVID-19 Pulmonary Pseudotumor That Regressed Without Surgery,https://pubmed.ncbi.nlm.nih.gov/40575401,
LitCovid,"SARS-CoV-2 sublineages recovered from southern Brazilian cases during Omicron wave in 2023, early introduction of JN.1",https://pubmed.ncbi.nlm.nih.gov/40570671,
LitCovid,Clinical Features and Outcomes of Patients with Full Spectrum of COVID-19 Severity and Concomitant Herpesvirus Reactivation,https://pubmed.ncbi.nlm.nih.gov/40572110,
LitCovid,Successful salvage therapy of ruxolitinib on interstitial pneumonia after long COVID or post-COVID-19 syndrome with follicular lymphoma: two case reports and literature review,https://pubmed.ncbi.nlm.nih.gov/40575972,
LitCovid,"Alpha to JN.1 variants: SARS-CoV-2 genomic analysis unfolding its various lineages/sublineages evolved in Chhattisgarh, India from 2020 to 2024",https://pubmed.ncbi.nlm.nih.gov/40575649,
LitCovid,The Intersection of SARS-CoV-2 and Diabetes,https://pubmed.ncbi.nlm.nih.gov/40572277,
LitCovid,Droplet Digital PCR or Real-Time PCR as a Method for Quantifying SARS-CoV-2 RNA in Plasma-Is There a Difference?,https://pubmed.ncbi.nlm.nih.gov/40573363,
LitCovid,Rates of SARS-CoV-2 Breakthrough Infection or Severe COVID-19 and Associated Risk Factors After Primary and Booster Vaccination Against COVID-19 in the Netherlands,https://pubmed.ncbi.nlm.nih.gov/40573895,
LitCovid,"Effects of colchicine, interferon beta, IVIG, tocilizumab and corticosteroids on COVID-19 patient survival from all presently available published clinical trials: A narrative review",https://pubmed.ncbi.nlm.nih.gov/40575740,
LitCovid,Management of critically Ill COVID-19 patients: Exploring the potential of morphine and assessing disadvantages of acetaminophen,https://pubmed.ncbi.nlm.nih.gov/40575757,
LitCovid,"Behavioral Dynamics, Genomic Insights, and Social Drivers of SARS-CoV-2 Waves and Variants in Cali, Colombia (2020-2023)",https://pubmed.ncbi.nlm.nih.gov/40573391,
LitCovid,Long COVID and Biomarker Dysregulation-A Shift Toward Immune Exhaustion?,https://pubmed.ncbi.nlm.nih.gov/40572685,
LitCovid,"Genomic and demographic characterization of SARS-CoV-2 infections within early Omicron cluster, Western Sri Lanka",https://pubmed.ncbi.nlm.nih.gov/40575635,
LitCovid,Evolving SARS-CoV-2 Vaccines: From Current Solutions to Broad-Spectrum Protection,https://pubmed.ncbi.nlm.nih.gov/40573967,
LitCovid,"Ethnic Comparisons of Spike-Specific CD4+ T Cells, Serological Responses, and Neutralizing Antibody Titers Against SARS-CoV-2 Variants",https://pubmed.ncbi.nlm.nih.gov/40573938,
LitCovid,National study on pediatric acute encephalopathy in Japan (April 2020 to October 2023): Insights from the third study,https://pubmed.ncbi.nlm.nih.gov/40570505,
LitCovid,Identification of Clinical and Genomic Features Associated with SARS-CoV-2 Reinfections,https://pubmed.ncbi.nlm.nih.gov/40573431,
LitCovid,Longitudinal Immunoprofiling of the CD8(+) T-Cell Response in SARS-CoV-2 mRNA Vaccinees and COVID-19 Patients,https://pubmed.ncbi.nlm.nih.gov/40573882,
LitCovid,Long-Term Immuno-Response and Risk of Breakthrough Infection After SARS-CoV-2 Vaccination in Kidney Transplantation,https://pubmed.ncbi.nlm.nih.gov/40573897,
LitCovid,Examining rhabdomyolysis-related acute kidney injury in COVID-19 patients and its comparison to other acute kidney injury types,https://pubmed.ncbi.nlm.nih.gov/40575634,
LitCovid,Speech-language Telepractice Services During the COVID-19 Lockdown: Perspectives from Parents in Malaysia,https://pubmed.ncbi.nlm.nih.gov/40575142,
LitCovid,A Case of Graves' Disease Exacerbation Triggered by BNT162b2 Vaccination,https://pubmed.ncbi.nlm.nih.gov/40575205,
LitCovid,Bacteriome Signature in SARS-CoV-2-Infected Patients Correlates with Increased Gut Permeability and Systemic Inflammatory Cytokines,https://pubmed.ncbi.nlm.nih.gov/40572294,
LitCovid,"Antiviral Intervention of COVID-19: Linkage of Disease Severity with Genetic Markers FGB (rs1800790), NOS3 (rs2070744) and TMPRSS2 (rs12329760)",https://pubmed.ncbi.nlm.nih.gov/40573382,
LitCovid,"Real-World Effectiveness of Boosting Against Omicron Hospitalization in Older Adults, Stratified by Frailty",https://pubmed.ncbi.nlm.nih.gov/40573896,
LitCovid,Dihydrotanshinone I targets the spike N-terminal domain to inhibit SARS-CoV-2 entry and spike-induced inflammation,https://pubmed.ncbi.nlm.nih.gov/40570554,
LitCovid,Humoral and Cellular Immune Responses to SARS-CoV-2 in Participants with Head and Neck Cancer,https://pubmed.ncbi.nlm.nih.gov/40573439,
LitCovid,Quantifying all-cause healthcare resource utilization and costs of children with mild-to-moderate long COVID in France,https://pubmed.ncbi.nlm.nih.gov/40574623,
LitCovid,Soap scum in drainage during the COVID-19 pandemic,https://pubmed.ncbi.nlm.nih.gov/40571254,
LitCovid,Adverse Events After COVID-19 Vaccination Between Pregnant and Nonpregnant Women,https://pubmed.ncbi.nlm.nih.gov/40575989,
LitCovid,SARS-CoV-2 (MA10) Infection Aggravates Cerebrovascular Pathology in Endothelial Nitric Oxide Synthase-Deficient Mice,https://pubmed.ncbi.nlm.nih.gov/40573374,
LitCovid,Delayed Viral Clearance Accompanied by Early Impaired Humoral and Virus-Specific T-Cell Response in Patients with Coronavirus Disease 2019 and Interstitial Lung Disease,https://pubmed.ncbi.nlm.nih.gov/40573986,
LitCovid,SARS-CoV-2 Receptor Binding Domain (RBD) Protein-Protein Conjugate Induces Similar or Better Antibody Responses as Spike mRNA in Rhesus Macaques,https://pubmed.ncbi.nlm.nih.gov/40573979,
LitCovid,COVID-19 management in patients with comorbid conditions,https://pubmed.ncbi.nlm.nih.gov/40575645,
LitCovid,Real-time monitoring of excess mortality under a new endemic regime,https://pubmed.ncbi.nlm.nih.gov/40575909,
LitCovid,Risk of COVID-19 infection among frontline healthcare workers during the COVID-19 pandemic,https://pubmed.ncbi.nlm.nih.gov/40575632,
LitCovid,"Validation of a Traditional Medicine, Achyrocline satureioides Infusion, for the Improvement of Mild Respiratory Infection Symptoms: A Randomized, Placebo-Controlled and Open-Label Clinical Trial",https://pubmed.ncbi.nlm.nih.gov/40573256,
LitCovid,The mechanism for GTP-mediated RNA capping by the SARS-CoV-2 NiRAN domain remains unresolved,https://pubmed.ncbi.nlm.nih.gov/40570834,
LitCovid,Emergence and transmission dynamics of the FY.4 Omicron variant in Kenya,https://pubmed.ncbi.nlm.nih.gov/40574750,
LitCovid,"Impact of lifting school mask mandates on community SARS-CoV-2 cases, hospitalizations, and deaths: a retrospective observational study",https://pubmed.ncbi.nlm.nih.gov/40575098,
LitCovid,Body Mass Index and COVID-19: An Overview Among an Italian Multicentric Cohort of Healthcare Workers in the Pre- and Post-Vaccination Eras-ORCHESTRA Project,https://pubmed.ncbi.nlm.nih.gov/40573991,
LitCovid,Papain-like protease of SARS-CoV-2 inhibits dsRNA-induced type I interferon response partly by cleaving TBK1,https://pubmed.ncbi.nlm.nih.gov/40570639,
LitCovid,Steroid Pulse Therapy Leads to Secondary Infections and Poor Outcomes in Patients with Severe Acute Respiratory Syndrome Coronavirus 2 (SARS-CoV-2) in Intensive Care Units: A Retrospective Cohort Study,https://pubmed.ncbi.nlm.nih.gov/40573413,
LitCovid,Cardiopulmonary Effects of COVID-19 Vaccination: A Comprehensive Narrative Review,https://pubmed.ncbi.nlm.nih.gov/40573879,
LitCovid,Nasal Emulgel's Role in Preventing Coronavirus Infection,https://pubmed.ncbi.nlm.nih.gov/40574108,
LitCovid,Mucosal and Serum Neutralization Immune Responses Elicited by COVID-19 mRNA Vaccination in Vaccinated and Breakthrough-Infection Individuals: A Longitudinal Study from Louisville Cohort,https://pubmed.ncbi.nlm.nih.gov/40573890,
LitCovid,Safety and Immunogenicity of a Modified Self-Amplifying Ribonucleic Acid (saRNA) Vaccine Encoding SARS-CoV-2 Spike Glycoprotein in SARS-CoV-2 Seronegative and Seropositive Ugandan Individuals,https://pubmed.ncbi.nlm.nih.gov/40573884,
LitCovid,Integrative Computational Modeling of Distinct Binding Mechanisms for Broadly Neutralizing Antibodies Targeting SARS-CoV-2 Spike Omicron Variants: Balance of Evolutionary and Dynamic Adaptability in Shaping Molecular Determinants of Immune Escape,https://pubmed.ncbi.nlm.nih.gov/40573332,
LitCovid,Durability of Antibody Responses to SARS-CoV-2 Vaccination over 12 Months in Pediatric Inflammatory Bowel Disease,https://pubmed.ncbi.nlm.nih.gov/40573880,
LitCovid,Syndromic Testing in the Pandemic Era and Beyond: Rapid Detection for Respiratory Infections in Istanbul,https://pubmed.ncbi.nlm.nih.gov/40573366,
LitCovid,Associations between organizational factors and mental health outcomes: Insights from Vietnamese frontline healthcare workers in COVID-19 field hospitals,https://pubmed.ncbi.nlm.nih.gov/40570579,
LitCovid,VITT Pathophysiology: An Update,https://pubmed.ncbi.nlm.nih.gov/40573981,
LitCovid,Risk of severe outcomes from COVID-19 in comorbid populations in the Omicron era: a systematic review and meta-analysis,https://pubmed.ncbi.nlm.nih.gov/40571116,
LitCovid,Association Between Initial Symptoms and Clinical Outcomes in COVID-19,https://pubmed.ncbi.nlm.nih.gov/40575188,
LitCovid,Bias in control selection associated with the use of rapid tests in influenza vaccine effectiveness studies,https://pubmed.ncbi.nlm.nih.gov/40574484,
LitCovid,Synergizing Attribute-Guided Latent Space Exploration (AGLSE) with Classical Molecular Simulations to Design Potent Pep-Magnet Peptide Inhibitors to Abrogate SARS-CoV-2 Host Cell Entry,https://pubmed.ncbi.nlm.nih.gov/40573419,
LitCovid,Marine-Derived Peptides from Phaeodactylum tricornutum as Potential SARS-CoV-2 Mpro Inhibitors: An In Silico Approach,https://pubmed.ncbi.nlm.nih.gov/40572159,
LitCovid,The ACE2 decoy receptor can overcome immune escape by rapid mutating SARS-CoV-2 variants and reduce cytokine induction and clot formation,https://pubmed.ncbi.nlm.nih.gov/40571942,
LitCovid,The mental health and psychological wellbeing of South African athletes and coaches during the COVID-19 pandemic: lessons learned from their health experience,https://pubmed.ncbi.nlm.nih.gov/40574995,
LitCovid,Unexpected voriconazole toxicity due to nirmatrelvir/ritonavir: a case report on drug-drug interaction and the role of therapeutic drug monitoring,https://pubmed.ncbi.nlm.nih.gov/40575772,
LitCovid,The Impact of State COVID-19 Responses on People With Intellectual and Developmental Disabilities,https://pubmed.ncbi.nlm.nih.gov/40575151,
LitCovid,Evaluation of RT-LAMP for SARS-CoV-2 Detection in Animal Feces,https://pubmed.ncbi.nlm.nih.gov/40573373,
LitCovid,SARS-CoV-2 Variant-Specific Antibodies in Vaccinated Inflammatory Bowel Disease Patients,https://pubmed.ncbi.nlm.nih.gov/40573926,
LitCovid,One Health serosurveillance of anti-SARS-CoV-2 antibodies in domestic animals from the metropolitan area of Panama,https://pubmed.ncbi.nlm.nih.gov/40575714,
LitCovid,Non-Markovian Quantum State Diffusion for the tunnelling in SARS-COVID-19 virus,https://pubmed.ncbi.nlm.nih.gov/40574961,
LitCovid,ALBACOVIDIOL Study: Effect of Calcifediol Treatment on Mortality in Patients Hospitalized for COVID-19: A Retrospective Analysis,https://pubmed.ncbi.nlm.nih.gov/40573079,
LitCovid,COVID-19 and older people's wellbeing in northern KwaZulu-Natal - the importance of relationships,https://pubmed.ncbi.nlm.nih.gov/40575598,
LitCovid,Discovery of SARS-CoV-2 papain-like protease inhibitors through machine learning and molecular simulation approaches,https://pubmed.ncbi.nlm.nih.gov/40571587,
LitCovid,The Impact of COVID-19 and the Practical Importance of Vaccinations and Nirmatrelvir/Ritonavir for Patients with Cardiovascular Disease,https://pubmed.ncbi.nlm.nih.gov/40573885,
LitCovid,"Longitudinal patterns of attention-deficit/hyperactivity disorder children in Shanghai, China",https://pubmed.ncbi.nlm.nih.gov/40571692,
LitCovid,Potential therapeutic effects of zinc and copper chlorophyllins in viral respiratory infections: recent developments and future directions,https://pubmed.ncbi.nlm.nih.gov/40574520,
LitCovid,Social determinants of health and COVID-19 vaccination: An individual participant data meta-analysis of adult Latino participants,https://pubmed.ncbi.nlm.nih.gov/40570937,
LitCovid,"Safety, Tolerability, and Immunogenicity of a DNA Vaccine (pGX9501) Against SARS-CoV-2 in Healthy Volunteers: A Single-Center, Randomized, Double-Blind, Placebo-Controlled, and Dose-Ranging Phase I Trial",https://pubmed.ncbi.nlm.nih.gov/40573904,
LitCovid,Quantifying coastal water quality responses to pandemic-induced human mobility: Insights from Bohai Bay,https://pubmed.ncbi.nlm.nih.gov/40570494,
LitCovid,Discovery of Synergistic Broadly Neutralizing Antibodies Targeting Non-Dominant Epitopes on SARS-CoV-2 RBD and NTD,https://pubmed.ncbi.nlm.nih.gov/40573924,
LitCovid,Passive sampling for genomic surveillance of SARS-CoV-2 in wastewater resource recovery facility: Insights for pandemic preparedness,https://pubmed.ncbi.nlm.nih.gov/40570499,
LitCovid,"Mucormycosis in patients infected with the delta strain of COVID-19 virus, effective of some factors in the prevalence and patient prognosis in Shahid Beheshti Hospital, Kashan, central Iran",https://pubmed.ncbi.nlm.nih.gov/40575750,
LitCovid,Response to: The mechanism for GTP-mediated RNA capping by the SARS-CoV-2 NiRAN domain remains unresolved,https://pubmed.ncbi.nlm.nih.gov/40570837,
LitCovid,The Effect on Mortality of Bacterial Co-Infections on Critically Ill Patients with Community-Acquired COVID-19 and Influenza Pneumonia: A Systematic Review,https://pubmed.ncbi.nlm.nih.gov/40573442,
LitCovid,The impact of the COVID-19 pandemic on all-cause mortality and life expectancy in northern Ghana: findings from the Navrongo Health and Demographic Surveillance System,https://pubmed.ncbi.nlm.nih.gov/40571927,
LitCovid,[Vaccination behaviour of immigrants and native Icelanders during COVID-19],https://pubmed.ncbi.nlm.nih.gov/40575898,
LitCovid,How Did the Dietary Behavior of Older Korean Adults Change During the COVID-19 Pandemic?,https://pubmed.ncbi.nlm.nih.gov/40573084,
LitCovid,Antibody Kinetics of Immunological Memory in SARS-CoV-2-Vaccinated Healthcare Workers-The ORCHESTRA Project,https://pubmed.ncbi.nlm.nih.gov/40573941,
LitCovid,Protective Measures Taken in Residential Care Homes in England During the COVID-19 Pandemic. An Assessment of the Change in Mortality Rates Before and During the COVID-19 Pandemic Years.,https://pubmed.ncbi.nlm.nih.gov/40571829,
LitCovid,Clinical Characteristics and Outcomes in Multisystemic Inflammatory Syndrome in Children (MIS-C) Associated with COVID-19: A 12-Month Prospective Study,https://pubmed.ncbi.nlm.nih.gov/40572293,
LitCovid,The relationship between women's empowerment and fatalism and self-care behaviors in COVID-19 virus,https://pubmed.ncbi.nlm.nih.gov/40575501,
LitCovid,Fluorodeoxyglucose Positron Emission Tomography Detects Persistent Arterial Inflammation After Symptomatic COVID-19,https://pubmed.ncbi.nlm.nih.gov/40571445,
LitCovid,COVID-19 memorable messages as internal narratives: stability and change over time,https://pubmed.ncbi.nlm.nih.gov/40575669,
LitCovid,"Changes in handwashing knowledge, attitudes, and practices among primary schoolchildren in Ulaanbaatar, Mongolia during the COVID-19 pandemic",https://pubmed.ncbi.nlm.nih.gov/40575101,
LitCovid,"Exploring the mental health impact of COVID-19 on parents of young children: anxiety, depression, and contributing factors",https://pubmed.ncbi.nlm.nih.gov/40571934,
LitCovid,Impact of the COVID-19 Pandemic on Healthcare Utilization Rates and Obesity in Urban Minority Children With High Asthma Disease Burden: A Retrospective Cohort Study,https://pubmed.ncbi.nlm.nih.gov/40571979,
LitCovid,A Poly-Lysine-Based RBD Mucosal Vaccine Induces Potent Antibody Responses in Mice,https://pubmed.ncbi.nlm.nih.gov/40573913,
LitCovid,Research Progress on the Application of Neutralizing Nanobodies in the Prevention and Treatment of Viral Infections,https://pubmed.ncbi.nlm.nih.gov/40572239,
LitCovid,"Imiquimod, a Promising Broad-Spectrum Antiviral, Prevents SARS-CoV-2 and Canine Coronavirus Multiplication Through the MAPK/ERK Signaling Pathway",https://pubmed.ncbi.nlm.nih.gov/40573392,
LitCovid,Thiazole-fused thiazoliniums with ketone warheads as covalent inhibitors targeting Cys44 of SARS-CoV-2 3CL(pro),https://pubmed.ncbi.nlm.nih.gov/40571175,
LitCovid,"Health care worker trust in the health care system, pre- and post-COVID-19 pandemic: a scoping review protocol",https://pubmed.ncbi.nlm.nih.gov/40574621,
LitCovid,Associations Between Mothers' COVID-Related Perceived Stress and Children's Internalizing and Externalizing Symptoms in Peru,https://pubmed.ncbi.nlm.nih.gov/40571864,
LitCovid,Impact of COVID-19 on maternal health and birth outcomes: A network analysis in Alabama,https://pubmed.ncbi.nlm.nih.gov/40570784,
LitCovid,Lost time undermines return behavior,https://pubmed.ncbi.nlm.nih.gov/40575706,
LitCovid,Serological Surveillance of Betacoronaviruses in Bat Guano Collectors: Pre-COVID-19 Pandemic and Post-SARS-CoV-2 Emergence,https://pubmed.ncbi.nlm.nih.gov/40573428,
LitCovid,"Coronavirus Replication: Genomes, Subgenomic RNAs, and Defective Viral Genomes",https://pubmed.ncbi.nlm.nih.gov/40573357,
LitCovid,Generational Trends in Children's Shyness: Does COVID-19 Matter?,https://pubmed.ncbi.nlm.nih.gov/40571863,
LitCovid,"Strengthening Vaccine Regulation: Insights from COVID-19 Vaccines, Best Practices, and Lessons for Future Public Health Emergencies",https://pubmed.ncbi.nlm.nih.gov/40573969,
LitCovid,Advances in Viroporin Function and Structure: A Comparative Analysis of Alphavirus 6K with Well-Characterized Viroporins,https://pubmed.ncbi.nlm.nih.gov/40573459,
LitCovid,"Analysis of the Effect of the COVID-19 Pandemic on Syphilis in Susceptible Populations: Men Who Have Sex with Men, People Living with HIV, and Patients with Gestational and Congenital Syphilis-A Narrative Review",https://pubmed.ncbi.nlm.nih.gov/40572093,
LitCovid,Integrating communication dimensions into health models: understanding COVID-19 vaccination through multigroup analysis,https://pubmed.ncbi.nlm.nih.gov/40575092,
LitCovid,"Cracks in the JD-R model? The failure of strengths use, job crafting, and home-work spillover to support wellbeing during COVID-19",https://pubmed.ncbi.nlm.nih.gov/40575790,
LitCovid,Factors Associated With Turnover Among Perioperative Nurses After the COVID-19 Pandemic,https://pubmed.ncbi.nlm.nih.gov/40574635,
LitCovid,Prison connectivity and disease transmission to neighboring communities: The role of prison staff,https://pubmed.ncbi.nlm.nih.gov/40575702,
LitCovid,'It showed everyone what it was like in lockdown and how we felt': exploring short film-making with children to produce public health research dissemination,https://pubmed.ncbi.nlm.nih.gov/40574327,
LitCovid,Relationship Between Socioeconomic Status and Job Accommodation for Workers with Health Problems in Japan during the COVID-19 Pandemic,https://pubmed.ncbi.nlm.nih.gov/40575690,
LitCovid,"Risk Factors for Seeking Medical Care Following Nirmatrelvir-Ritonavir (Paxlovid) Treatment for COVID-19: ""Symptom Rebound""",https://pubmed.ncbi.nlm.nih.gov/40573371,
LitCovid,"Surveillance of Respiratory Pathogens Among Rapid Diagnostic Test-Negative Acute Respiratory Infection Patients in Myanmar in 2023, with a Focus on Rhinovirus and Enterovirus Genotyping",https://pubmed.ncbi.nlm.nih.gov/40573450,
LitCovid,Epidemiological trends of influenza A and B in one hospital in Chengdu and national surveillance data (2019-2024),https://pubmed.ncbi.nlm.nih.gov/40575488,
LitCovid,Radiation Recall Phenomenon Following Vaccination in a Patient With Prior Radiation to Lower Extremity Liposarcoma,https://pubmed.ncbi.nlm.nih.gov/40575221,
LitCovid,Digital inequities and emotional resilience: understanding the impact of the COVID-19 pandemic on preclinical medical students,https://pubmed.ncbi.nlm.nih.gov/40575572,
LitCovid,"Direct and indirect experiences, risk perceptions, and vaccine booster intention: A mediation study in Singapore using secondary risk theory",https://pubmed.ncbi.nlm.nih.gov/40570745,
LitCovid,Beyond the Classroom: The Role of Social Connections and Family in Adolescent Mental Health in the Transylvanian Population of Romania,https://pubmed.ncbi.nlm.nih.gov/40572719,
LitCovid,Corticosteroid-Refractory Bullous Pemphigoid Due to Immune Checkpoint Inhibitors: A Telemedicine Challenge,https://pubmed.ncbi.nlm.nih.gov/40575211,
LitCovid,Standardized Definition of Red Flags in Musculoskeletal Care: A Comprehensive Review of Clinical Practice Guidelines,https://pubmed.ncbi.nlm.nih.gov/40572690,
LitCovid,The Psychological and Physical Benefits of Progressive Muscle Relaxation in Chronic Respiratory Diseases: A Systematic Review,https://pubmed.ncbi.nlm.nih.gov/40572743,
LitCovid,Structure-Based Design and In-Silico Evaluation of Computationally Proposed Curcumin Derivatives as Potential Inhibitors of the Coronaviral PLpro Enzymes,https://pubmed.ncbi.nlm.nih.gov/40573195,
LitCovid,Implications of Anaphylaxis Following mRNA-LNP Vaccines: It Is Urgent to Eliminate PEG and Find Alternatives,https://pubmed.ncbi.nlm.nih.gov/40574110,
LitCovid,Telemedicine in Nerve Surgery: An Effective Method to Determine Indications for Surgery,https://pubmed.ncbi.nlm.nih.gov/40575609,
LitCovid,"Topical Review: Clinical, Physiological, and Functional Benefits of Home-based Telerehabilitation with Occupational Therapists for Low Vision",https://pubmed.ncbi.nlm.nih.gov/40575145,
LitCovid,Mapping Behavioral and Social Drivers of Influenza Vaccine Uptake in Older Adults: A Scoping Review,https://pubmed.ncbi.nlm.nih.gov/40573955,
LitCovid,Pediatric medication management barriers faced by providers serving underserved populations and proposed solutions,https://pubmed.ncbi.nlm.nih.gov/40575547,
LitCovid,Neonates at Risk: Understanding the Impact of High-Risk Pregnancies on Neonatal Health,https://pubmed.ncbi.nlm.nih.gov/40572764,
LitCovid,"Trust, trust repair, and public health: a scoping review",https://pubmed.ncbi.nlm.nih.gov/40575096,
LitCovid,Rapid Tests for Viral Upper Airway Respiratory Infections in the Workplace: A Pilot Study on a Professional Football Team,https://pubmed.ncbi.nlm.nih.gov/40572760,
LitCovid,mRNA Vaccine Technology Beyond COVID-19,https://pubmed.ncbi.nlm.nih.gov/40573932,
LitCovid,"Interplay between insomnia, anxiety, and depression",https://pubmed.ncbi.nlm.nih.gov/40574761,
LitCovid,"Global update on the susceptibilities of influenza viruses to neuraminidase inhibitors and the cap-dependent endonuclease inhibitor baloxavir, 2020-2023",https://pubmed.ncbi.nlm.nih.gov/40571063,
LitCovid,Facilitating Cross-border Viral Sequencing Through Nucleic Acid Sample Transport Using Dry Cards,https://pubmed.ncbi.nlm.nih.gov/40573394,
LitCovid,Determinants of Accepting or Rejecting Influenza Vaccination-Results of a Survey Among Ligurian Pharmacy Visitors During the 2023/2024 Vaccination Campaign,https://pubmed.ncbi.nlm.nih.gov/40573911,
LitCovid,Interferon Lambda: The Next Frontier in Antiviral Therapy?,https://pubmed.ncbi.nlm.nih.gov/40573183,
LitCovid,"Maternal Vaccination as an Integral Part of Life-Course Immunization: A Scoping Review of Uptake, Barriers, Facilitators, and Vaccine Hesitancy for Antenatal Vaccination in Ireland",https://pubmed.ncbi.nlm.nih.gov/40573888,
LitCovid,"Hospitalisation trends of respiratory syncytial virus (RSV) infection in adults, six European countries, before and during COVID-19, 2016 to 2023",https://pubmed.ncbi.nlm.nih.gov/40575911,
LitCovid,Paediatric Measles in Romania: A Comparative Clinical and Epidemiological Analysis of the 2017-2019 and 2023-2024 Epidemic Waves at a Tertiary Care Centre in Bucharest,https://pubmed.ncbi.nlm.nih.gov/40573346,
LitCovid,Implementation of High-Flow Oxygen Therapy in a Surgical High-Dependency Unit: A Cohort Study,https://pubmed.ncbi.nlm.nih.gov/40575242,
LitCovid,Sleep disorders and mental health: Understanding the cognitive connection,https://pubmed.ncbi.nlm.nih.gov/40574781,
LitCovid,Global disparities in access to hepatitis C medicines before and during the early phase of the COVID-19 pandemic: an ARIMA-based interrupted time series analysis,https://pubmed.ncbi.nlm.nih.gov/40575067,
LitCovid,Acute Respiratory Distress Syndrome in Active Duty Service Members: Rare and Lethal,https://pubmed.ncbi.nlm.nih.gov/40574686,
LitCovid,Outcomes of Asynchronous e-Visits vs. Telephone or Video Visits for Common Primary Care Concerns.,https://pubmed.ncbi.nlm.nih.gov/40571878,
LitCovid,Development of an Influenza/COVID-19 Combination mRNA Vaccine Containing a Novel Multivalent Antigen Design That Enhances Immunogenicity of Influenza Virus B Hemagglutinins,https://pubmed.ncbi.nlm.nih.gov/40573959,
LitCovid,"Pharmacokinetics and Metabolism of Broad-Spectrum Antivirals Remdesivir and Obeldesivir with a Consideration to Metabolite GS-441524: Same, Similar, or Different?",https://pubmed.ncbi.nlm.nih.gov/40573427,
LitCovid,Safety and Immunogenicity of Co-Administration of Herpes Zoster Vaccines with Other Vaccines in Adults: A Systematic Review and Meta-Analysis,https://pubmed.ncbi.nlm.nih.gov/40573968,
LitCovid,"[Developments in Psychiatric Care from 2005 to 2022: A Retrospective, Longitudinal Analysis of Hospital Data on 110,996 Inpatient Cases]",https://pubmed.ncbi.nlm.nih.gov/40570885,
LitCovid,"Changes in Population Immunity to Omicron SARS-CoV-2 Variants and Selected Sarbecoviruses From 2020 to 2023 in Urban Colombo, Sri Lanka",https://pubmed.ncbi.nlm.nih.gov/40569091,
LitCovid,COVID-19 and CLL in Sweden: lessons learned?,https://pubmed.ncbi.nlm.nih.gov/40569632,
LitCovid,TMPRSS2: A Key Host Factor in SARS-CoV-2 Infection and Potential Therapeutic Target,https://pubmed.ncbi.nlm.nih.gov/40569819,
