feed,title,long_url,short_url
LitCovid,The effect of antibiotic therapy on clinical outcome in patients hospitalized with moderate COVID-19 disease: a prospective multi-center cohort study,https://pubmed.ncbi.nlm.nih.gov/40569348,
LitCovid,Parental hesitancy on COVID-19 vaccination of children under the age of 16: A cross-sectional mixed-methods study among factory workers,https://pubmed.ncbi.nlm.nih.gov/40569977,
LitCovid,[Experience of using grape polyphenol concentrate in elderly patients with bronchial asthma in the post-COVID period.],https://pubmed.ncbi.nlm.nih.gov/40570227,
LitCovid,Association of RBD mutations with COVID-19 disease severity in the Iranian population,https://pubmed.ncbi.nlm.nih.gov/40569496,
LitCovid,"""I don't know if it makes a difference to safety?"" perception vs actuality: A mixed-methods study on older adults' experiences of home stair falls revealed during COVID-19 lockdown",https://pubmed.ncbi.nlm.nih.gov/40569918,
LitCovid,HAX1 mediates SARS-CoV-2 spike-triggered unfolded protein response in host cells,https://pubmed.ncbi.nlm.nih.gov/40568888,
LitCovid,"Health behavior and mental health by gender in Korean adults before, during, and after the COVID-19 pandemic",https://pubmed.ncbi.nlm.nih.gov/40570032,
LitCovid,Anxiety and Depression Among College Students Before and After the COVID-19 Pandemic Lockdown Lift: A Network Analysis Study Focus on the Transition Period,https://pubmed.ncbi.nlm.nih.gov/40568867,
LitCovid,Modularity of Online Social Networks and COVID-19 Misinformation Spreading in Russia: Combining Social Network Analysis and National Representative Survey,https://pubmed.ncbi.nlm.nih.gov/40570328,
LitCovid,"Tibetan PHD2D4E;C127S variant protects from viral diseases in hypoxia, but predispose to infections in normoxia via HIFalpha:IFN axis",https://pubmed.ncbi.nlm.nih.gov/40570045,
LitCovid,Gastrointestinal inflammation and cancer: viral and bacterial interplay,https://pubmed.ncbi.nlm.nih.gov/40568785,
LitCovid,Spotlight on Frontline Health Workers Through the Lens of Theater,https://pubmed.ncbi.nlm.nih.gov/40569137,
LitCovid,The prevalence of students meeting the Canadian 24-Hour Movement Guidelines in a sample of Ontario undergraduate university students,https://pubmed.ncbi.nlm.nih.gov/40569255,
LitCovid,Cell Phone Activity and Trauma Patient Volume in New England Through the COVID-19 Pandemic: A Research Consortium of New England Centers for Trauma (ReCONECT) Study,https://pubmed.ncbi.nlm.nih.gov/40568984,
LitCovid,Infectious touching: Has COVID-19 changed our perceptions of social touch? A neural and behavioral study,https://pubmed.ncbi.nlm.nih.gov/40569075,
LitCovid,Pneumococcal colonization dynamics among young children with and without respiratory symptoms during the first year of the SARS-CoV-2 pandemic,https://pubmed.ncbi.nlm.nih.gov/40569997,
LitCovid,The sociopolitical discourse on health data sharing in Switzerland: lessons learned from 1992 to 2023 for present public trust building - a multi-method study,https://pubmed.ncbi.nlm.nih.gov/40570247,
LitCovid,Engage and adapt: peer-led implementation of HIV navigation in Australia,https://pubmed.ncbi.nlm.nih.gov/40570146,
LitCovid,"Multi-pathogen wastewater surveillance in Malawi: An assessment of culture-based, RT-PCR, and long-read metagenomics methods with multiple ongoing outbreaks",https://pubmed.ncbi.nlm.nih.gov/40570391,
LitCovid,Unmet Nonmedication Needs After Hospital Discharge and Adverse Outcomes Among Acute Respiratory Failure Survivors in Brazil: A Prospective Feasibility Study,https://pubmed.ncbi.nlm.nih.gov/40569709,
LitCovid,Implementation of Jail and Prison-Based Medication Treatment for Opioid Use Disorder Programs: A Narrative Synthesis,https://pubmed.ncbi.nlm.nih.gov/40568792,
LitCovid,The complex interplay of personal and external factors in medical students' specialty decision-making: A qualitative study,https://pubmed.ncbi.nlm.nih.gov/40569991,
LitCovid,Age and In-Hospital Mortality in Patients With Acute Respiratory Distress Syndrome Undergoing Venovenous Extracorporeal Membrane Oxygenation,https://pubmed.ncbi.nlm.nih.gov/40569769,
LitCovid,Change in confidence in public health entities among US adults between 2020-2024,https://pubmed.ncbi.nlm.nih.gov/40569895,
LitCovid,Surveying Association Between Moral Injury and Quality of Work Life of Emergency Nurses During the Coronavirus Disease 2019 Pandemic,https://pubmed.ncbi.nlm.nih.gov/40569222,
LitCovid,Level and determinants of pentavalent vaccine dropout during infancy: A hierarchical analysis of community-level longitudinal study,https://pubmed.ncbi.nlm.nih.gov/40570067,
LitCovid,Systematic review and meta-analysis of respiratory viral triggers for acute myocardial infarction and stroke,https://pubmed.ncbi.nlm.nih.gov/40570137,
LitCovid,"Mycoplasma pneumoniae Infections in Hospitalized Children - United States, 2018-2024",https://pubmed.ncbi.nlm.nih.gov/40569891,
