feed,title,long_url,short_url
GN:T:WP,ACCIONA Powers on La Chalupa Wind Farm - North American Windpower,https://nawindpower.com/acciona-powers-on-la-chalupa-wind-farm,
GN:T:WP,Will GE's Stock Reach $20 By 2022? - Benzinga,https://www.benzinga.com/trading-ideas/long-ideas/20/12/18852712/will-ges-stock-reach-20-by-2022,
GN:T:WP,"A greener, rural-Oklahoma energy grid is generating jobs by the hundreds and revenues by the millions - Oklahoman",https://oklahoman.com/article/5678524/a-greener-rural-oklahoma-energy-grid-is-generating-jobs-by-the-hundreds-and-revenues-by-the-millions,
GN:T:WP,Iberdrola breezes into Poland with Sea Wind stake purchase - Reuters,https://www.reuters.com/article/iberdrola-seawind-poland/iberdrola-breezes-into-poland-with-sea-wind-stake-purchase-idUSL8N2IY2AU,
GN:T:WP,Odfjell Drilling Nets Four-year Term on Wintershall's Brage Platform - Offshore Engineer,https://www.oedigital.com/news/484029-odfjell-drilling-nets-four-year-term-on-wintershall-s-brage-platform,
GN:T:WP,Norway Approves Neptune's Gjøa Field Expansion - Offshore Engineer,https://www.oedigital.com/news/484030-norway-approves-neptune-s-gj-a-field-expansion,
GN:T:WP,Clean Energy Can Power America’s Economic Recovery - Greentech Media News,https://www.greentechmedia.com/articles/read/clean-energy-can-power-americas-economic-recovery,
