feed,title,long_url,short_url
GN:S:C,Roadmap to renewables unites climate and sustainability goals - EurekAlert,https://eurekalert.org/pub_releases/2020-12/uoc--rtr121820.php,
GN:S:C,Federal Financial Regulators Call For Cooperation To Address Climate Change - Forbes,https://www.forbes.com/sites/tedknutson/2020/12/18/federal-financial-regulators-call-for-cooperation-to-address-climate-change/,
GN:S:C,"With campus as a test bed, climate action starts and continues at MIT - MIT News",https://news.mit.edu/2020/campus-test-bed-climate-action-starts-continues-mit-1218,
GN:S:C,Climate change could create 63 million migrants in South Asia by 2050; 45 million Indians may forced to move: Report - Deccan Herald,https://www.deccanherald.com/international/climate-change-could-create-63-million-migrants-in-south-asia-by-2050-45-million-indians-may-forced-to-move-report-928876.html,
GN:S:C,The Virtuous Climate Tech Cycle of 2020 - Greentech Media News,https://www.greentechmedia.com/articles/read/the-virtuous-climatetech-cycle-of-2020,
