feed,title,long_url,short_url
LitCovid,"Covid-19: Biden calls for science, vaccines, and masks",https://pubmed.ncbi.nlm.nih.gov/33461964,
LitCovid,Priority setting during the COVID-19 pandemic: going beyond vaccines,https://pubmed.ncbi.nlm.nih.gov/33461979,
LitCovid,Obesity surgery and COVID-19 pandemic: What is the suitable attitude to adopt?,https://pubmed.ncbi.nlm.nih.gov/33461888,
LitCovid,ACE2 in the second act of COVID-19 syndrome: Peptide dysregulation and possible correction with oestrogen,https://pubmed.ncbi.nlm.nih.gov/33462852,
LitCovid,Risk society and COVID-19,https://pubmed.ncbi.nlm.nih.gov/33464555,
LitCovid,SCHOOLS CLOSURES DURING THE COVID-19 PANDEMIC: A Catastrophic Global Situation,https://pubmed.ncbi.nlm.nih.gov/33464019,
LitCovid,Pandemic fatigue? How adherence to covid-19 regulations has been misrepresented and why it matters,https://pubmed.ncbi.nlm.nih.gov/33461963,
LitCovid,Covid-19: What new variants are emerging and how are they being investigated?,https://pubmed.ncbi.nlm.nih.gov/33462092,
LitCovid,Dermatologists as social media contributors during the COVID-19 pandemic,https://pubmed.ncbi.nlm.nih.gov/33465197,
LitCovid,Purinergic Signaling of ATP in COVID-19 Associated Guillain-Barre Syndrome,https://pubmed.ncbi.nlm.nih.gov/33462776,
LitCovid,"Androgens, Kidney and COVID-19: An Opportunity for Translational Research",https://pubmed.ncbi.nlm.nih.gov/33464168,
LitCovid,"Association of Home Quarantine and Mental Health Among Teenagers in Wuhan, China, During the COVID-19 Pandemic",https://pubmed.ncbi.nlm.nih.gov/33464303,
LitCovid,The Intersection of Photopheresis and COVID-19 Vaccination,https://pubmed.ncbi.nlm.nih.gov/33462569,
LitCovid,Proteomic Approaches to Study SARS-CoV-2 Biology and COVID-19 Pathology,https://pubmed.ncbi.nlm.nih.gov/33464917,
LitCovid,Not only ACE2-the quest for additional host cell mediators of SARS-CoV-2 infection: Neuropilin-1 (NRP1) as a novel SARS-CoV-2 host cell entry mediator implicated in COVID-19,https://pubmed.ncbi.nlm.nih.gov/33462185,
LitCovid,Viral pathogenesis of SARS-CoV-2 infection and male reproductive health,https://pubmed.ncbi.nlm.nih.gov/33465325,
LitCovid,COVID-19 and related symptoms in patients under disulfiram for alcohol use disorder,https://pubmed.ncbi.nlm.nih.gov/33464469,
LitCovid,"Commentary: COVID-19 tracheostomies - The ""how"" but not the ""why"" or ""when""",https://pubmed.ncbi.nlm.nih.gov/33465171,
LitCovid,SARS-CoV-2 nucleocapsid-protein and ultrastructural modifications in small bowel of a four week negative COVID-19 patient,https://pubmed.ncbi.nlm.nih.gov/33465499,
LitCovid,Innovative Face Shields Help Frontliners Face-off COVID-19 Pandemic,https://pubmed.ncbi.nlm.nih.gov/33463668,
LitCovid,Commentary: Pandemic Inequities: Refugees' Health in the Rural United States During COVID-19,https://pubmed.ncbi.nlm.nih.gov/33464763,
LitCovid,Clinicopathologic Features of COVID-19: A Case Report and Value of Forensic Autopsy in Studying SARS-CoV-2 Infection,https://pubmed.ncbi.nlm.nih.gov/33464756,
LitCovid,The impact of the World Military Games on the COVID-19 pandemic,https://pubmed.ncbi.nlm.nih.gov/33464479,
LitCovid,An Updated Review on Betacoronavirus Viral Entry Inhibitors: Learning from Past Discoveries to Advance COVID-19 Drug Discovery,https://pubmed.ncbi.nlm.nih.gov/33463470,
LitCovid,The roles of signaling pathways in SARS-CoV-2 infection; lessons learned from SARS-CoV and MERS-CoV,https://pubmed.ncbi.nlm.nih.gov/33462671,
LitCovid,Development of vaccines for influenza disease: Opportunity costs of the COVID-19 pandemic,https://pubmed.ncbi.nlm.nih.gov/33461832,
LitCovid,Genome-wide DNA methylation profiling of peripheral blood reveals an epigenetic signature associated with severe COVID-19,https://pubmed.ncbi.nlm.nih.gov/33464637,
LitCovid,Why Automated E-Counseling for Chronic Heart Failure Matters in the COVID-19 Pandemic Era,https://pubmed.ncbi.nlm.nih.gov/33464946,
LitCovid,Vaccinating against covid-19 in people who report allergies,https://pubmed.ncbi.nlm.nih.gov/33461962,
LitCovid,Building Experience and Evidence: COVID-19 and Myocardial Injury,https://pubmed.ncbi.nlm.nih.gov/33461305,
LitCovid,Resuscitation teamwork during the COVID-19 pandemic in the emergency department: Challenges and solutions,https://pubmed.ncbi.nlm.nih.gov/33465434,
LitCovid,New onset adrenal insufficiency in a patient with COVID-19,https://pubmed.ncbi.nlm.nih.gov/33462013,
LitCovid,"Intensive Care Unit Strain and Mortality Risk Among Critically Ill Patients With COVID-19-There Is No ""Me"" in COVID",https://pubmed.ncbi.nlm.nih.gov/33464314,
LitCovid,Patient characteristics in the PL-ACS registry during the COVID-19 pandemic: the first report,https://pubmed.ncbi.nlm.nih.gov/33463992,
LitCovid,Convalescent hyperimmune plasma for chemo-immunotherapy induced immunodeficiency in COVID-19 patients with hematological malignancies,https://pubmed.ncbi.nlm.nih.gov/33461387,
LitCovid,COVID-19 Pandemic and Children's Health - Mitigating Unintended Consequences,https://pubmed.ncbi.nlm.nih.gov/33463664,
LitCovid,Surviving COVID-19 in Bergamo Province: a post-acute outpatient re-evaluation,https://pubmed.ncbi.nlm.nih.gov/33461632,
LitCovid,Impact of COVID-19 pandemic on functioning of cytopathology laboratory: Experience and perspective from an academic centre in New York,https://pubmed.ncbi.nlm.nih.gov/33463817,
LitCovid,Trends in suicide rates during the COVID-19 pandemic restrictions in a major German city,https://pubmed.ncbi.nlm.nih.gov/33461639,
LitCovid,COVID 19: in the eye of the cytokine storm,https://pubmed.ncbi.nlm.nih.gov/33462598,
LitCovid,"A study of community knowledge, attitudes, practices, and health in Pakistan during the COVID-19 pandemic",https://pubmed.ncbi.nlm.nih.gov/33465247,
LitCovid,COVID-19 Associated Multisystem Inflammatory Syndrome: A Systematic Review and Meta-analysis,https://pubmed.ncbi.nlm.nih.gov/33463127,
LitCovid,Post-COVID-19 Cholangiopathy: A Novel Entity,https://pubmed.ncbi.nlm.nih.gov/33464757,
LitCovid,Changes in Treatment Behavior during the COVID-19 Pandemic among Patients at a Cancer Hospital,https://pubmed.ncbi.nlm.nih.gov/33465338,
LitCovid,Antihistamines and azithromycin as a treatment for COVID-19 on primary health care - A retrospective observational study in elderly patients,https://pubmed.ncbi.nlm.nih.gov/33465426,
LitCovid,Care homes: averting market failure in a post-covid-19 world,https://pubmed.ncbi.nlm.nih.gov/33461971,
LitCovid,Impact of the COVID-19 pandemic on a trauma center of a university hospital in Japan,https://pubmed.ncbi.nlm.nih.gov/33461859,
LitCovid,Severe acute mitral valve regurgitation in a COVID-19-infected patient,https://pubmed.ncbi.nlm.nih.gov/33462059,
LitCovid,An environmental study of tracheostomy on eight COVID-19 patients,https://pubmed.ncbi.nlm.nih.gov/33461626,
LitCovid,Assessment of contact lens wearers' attitude toward contact lens wear and care during Coronavirus Disease 2019 (COVID-19) pandemic: A cross-sectional online survey,https://pubmed.ncbi.nlm.nih.gov/33461877,
LitCovid,The Role of Surgical Masks during the COVID-19 Pandemic. A Mini-Review.,https://pubmed.ncbi.nlm.nih.gov/33463923,
LitCovid,Prevalence and Clinical Characteristics of Coronavirus Disease 2019 Seen at a Testing Centre in Lagos Nigeria,https://pubmed.ncbi.nlm.nih.gov/33463708,
LitCovid,Minireview: The Introduction of COVID-19 and Microvascular Disease-Introduction of COVID-19 and the Relationship between Its Receptor and Diabetic Vascular Complications,https://pubmed.ncbi.nlm.nih.gov/33463917,
LitCovid,A complementary critical appraisal on systematic reviews regarding the most efficient therapeutic strategies for current COVID-19 (SARS-CoV-2) pandemic,https://pubmed.ncbi.nlm.nih.gov/33463727,
LitCovid,Characteristics of Liver transplant patients infected with COVID-19,https://pubmed.ncbi.nlm.nih.gov/33465372,
LitCovid,Gut and glucose: an unusual first presentation of COVID-19,https://pubmed.ncbi.nlm.nih.gov/33463889,
LitCovid,Interventional Pulmonology and COVID-19: Experience from a Malaysian Tertiary Hospital,https://pubmed.ncbi.nlm.nih.gov/33463660,
LitCovid,Lung transplantation during the outbreak of Coronavirus Disease 2019 in China,https://pubmed.ncbi.nlm.nih.gov/33461803,
LitCovid,How to monitor the brain in COVID-19 patients?,https://pubmed.ncbi.nlm.nih.gov/33461861,
LitCovid,High frequency of smell and taste dysfunctions in allergy health care professionals suffering from COVID-19,https://pubmed.ncbi.nlm.nih.gov/33465033,
LitCovid,Strategies for Management of Peritoneal Dialysis Patients in Singapore during COVID-19 Pandemic,https://pubmed.ncbi.nlm.nih.gov/33463662,
LitCovid,Pseudoviruses for the assessment of coronavirus disinfection by ozone,https://pubmed.ncbi.nlm.nih.gov/33462542,
LitCovid,A cross-sectional seroprevalence for COVID-19 among healthcare workers in a tertially care hospital in Taiwan,https://pubmed.ncbi.nlm.nih.gov/33461841,
LitCovid,"Focus on international and domestic travelers are equally important for successful SARS-COV-2 mitigation: Ecological comparison of emigrant and migrant travel patterns and COVID-19 trends in Kerala State, India",https://pubmed.ncbi.nlm.nih.gov/33462585,
LitCovid,[Recommendations for the management of COVID-19 pandemic in long term care facilities],https://pubmed.ncbi.nlm.nih.gov/33464513,
LitCovid,"Covid-19: US immigration enforcement flouts safety guidelines, report claims",https://pubmed.ncbi.nlm.nih.gov/33461960,
LitCovid,[Diabetes mellitus in the time of COVID-19],https://pubmed.ncbi.nlm.nih.gov/33464511,
LitCovid,Reply to: Autonomic dyshomeostasis in patients with diabetes mellitus during COVID-19,https://pubmed.ncbi.nlm.nih.gov/33462400,
LitCovid,The Three-Plague Nature of COVID-19 Pandemic: Implications for Women and Children and Exposure to Violence,https://pubmed.ncbi.nlm.nih.gov/33464031,
LitCovid,Colorectal Surgery in the time of Covid 19,https://pubmed.ncbi.nlm.nih.gov/33463009,
LitCovid,Nurse navigators' telemonitoring for cancer patients with COVID-19: a French case study,https://pubmed.ncbi.nlm.nih.gov/33462724,
LitCovid,"COVID-19 outbreak in Brazil: adherence to national preventive measures and impact on people's lives, an online survey",https://pubmed.ncbi.nlm.nih.gov/33461508,
LitCovid,Modeling the structure of the frameshift-stimulatory pseudoknot in SARS-CoV-2 reveals multiple possible conformers,https://pubmed.ncbi.nlm.nih.gov/33465066,
LitCovid,"Development post-Covid-19: memory, discernment, humanism, ethics, science and nature",https://pubmed.ncbi.nlm.nih.gov/33461843,
LitCovid,[COVID-19 and neurology],https://pubmed.ncbi.nlm.nih.gov/33464509,
LitCovid,17beta-estradiol reduces SARS-CoV-2 infection in vitro,https://pubmed.ncbi.nlm.nih.gov/33463909,
LitCovid,Efficacy of canakinumab in mild or severe COVID-19 pneumonia,https://pubmed.ncbi.nlm.nih.gov/33465283,
LitCovid,COVID-19 and the digestive system: implications for transforming care delivery,https://pubmed.ncbi.nlm.nih.gov/33461301,
LitCovid,[Gastrointestinal manifestations in patients with COVID-19],https://pubmed.ncbi.nlm.nih.gov/33464510,
LitCovid,Impact of a pandemic on surgical neuro-oncology-maintaining functionality in the early phase of crisis,https://pubmed.ncbi.nlm.nih.gov/33461509,
LitCovid,Socio-demographic factors associated with self-protecting behavior during the Covid-19 pandemic,https://pubmed.ncbi.nlm.nih.gov/33462529,
LitCovid,Spirituality in medical education and COVID-19,https://pubmed.ncbi.nlm.nih.gov/33465823,
LitCovid,"Results of the first 1,000 procedures after resumption of elective orthopedic services following COVID-19 pandemic: Experiences of a high-volume arthroplasty center",https://pubmed.ncbi.nlm.nih.gov/33463411,
LitCovid,[Cardiovascular manifestations of COVID-19],https://pubmed.ncbi.nlm.nih.gov/33464508,
LitCovid,Research priorities for COVID-19 sensor technology,https://pubmed.ncbi.nlm.nih.gov/33462510,
LitCovid,China health technology and stringency containment measures during COVID-19 pandemic: A discussion of first and second wave of COVID-19,https://pubmed.ncbi.nlm.nih.gov/33462559,
LitCovid,Hydroxychloroquine-mediated inhibition of SARS-CoV-2 entry is attenuated by TMPRSS2,https://pubmed.ncbi.nlm.nih.gov/33465165,
LitCovid,K18-hACE2 mice develop respiratory disease resembling severe COVID-19,https://pubmed.ncbi.nlm.nih.gov/33465158,
LitCovid,Electrocardiographic markers of increased risk of sudden cardiac death in patients with COVID-19 pneumonia,https://pubmed.ncbi.nlm.nih.gov/33463863,
LitCovid,"Pregnancy, Pandemics, and Public Health Policy: The Disparate Impact of the Novel Coronavirus Disease-2019 on Pregnant Immigrants",https://pubmed.ncbi.nlm.nih.gov/33461870,
LitCovid,Managing clinical trials during COVID-19: experience from a clinical research facility,https://pubmed.ncbi.nlm.nih.gov/33461595,
LitCovid,East Asian and the Pacific Surveillance of SARS-CoV-2 Wave Two: Longitudinal Trend Analysis,https://pubmed.ncbi.nlm.nih.gov/33464207,
LitCovid,COVID-19 among Foreign Workers in Dormitories - How One Emergency Department Responded,https://pubmed.ncbi.nlm.nih.gov/33463665,
LitCovid,In silico T cell epitope identification for SARS-CoV-2: Progress and perspectives,https://pubmed.ncbi.nlm.nih.gov/33465451,
LitCovid,COVID 19 and dementia: experience from six European countries,https://pubmed.ncbi.nlm.nih.gov/33462849,
LitCovid,Development of a large spontaneous pneumothorax after recovery from mild COVID-19 infection,https://pubmed.ncbi.nlm.nih.gov/33462033,
LitCovid,The impact of COVID-19 on the management of heart failure: a United Kingdom patient questionnaire study,https://pubmed.ncbi.nlm.nih.gov/33463044,
LitCovid,Late onset of Guillain-Barre syndrome following SARS-CoV-2 infection: part of 'long COVID-19 syndrome'?,https://pubmed.ncbi.nlm.nih.gov/33462068,
LitCovid,Outcomes of COVID-19 Positive Acute Coronary Syndrome Patients; a multisource Electronic Healthcare Records Study from England,https://pubmed.ncbi.nlm.nih.gov/33462815,
LitCovid,"The effectiveness of active surveillance measures for COVID-19 cases in Pudong New Area Shanghai, China, 2020",https://pubmed.ncbi.nlm.nih.gov/33463732,
LitCovid,COVID-19 lockdown beneficial effects on lung function in a cohort of cystic fibrosis patients,https://pubmed.ncbi.nlm.nih.gov/33461569,
LitCovid,"Facing the challenge of viral mutations in the age of pandemic: Developing highly potent, broad-spectrum, and safe COVID-19 vaccines and therapeutics",https://pubmed.ncbi.nlm.nih.gov/33463059,
LitCovid,Effects of social distancing on the spreading of COVID-19 inferred from mobile phone data,https://pubmed.ncbi.nlm.nih.gov/33462369,
LitCovid,Sterilizing Immunity against SARS-CoV-2 Infection in Mice by a Single-Shot and Lipid Amphiphile Imidazoquinoline TLR7/8 Agonist-Adjuvanted Recombinant Spike Protein Vaccine,https://pubmed.ncbi.nlm.nih.gov/33464672,
LitCovid,Glucose-6-phosphate dehydrogenase deficiency and COVID-19 mortality,https://pubmed.ncbi.nlm.nih.gov/33464223,
LitCovid,"Commentary: ""Indovation"" in retinopathy of prematurity management during COVID-19 times",https://pubmed.ncbi.nlm.nih.gov/33463599,
LitCovid,The Role of Justicia Adhatoda as prophylaxis for COVID-19 - Analysis based on docking study,https://pubmed.ncbi.nlm.nih.gov/33463480,
LitCovid,Streptococcus pneumoniae coinfection in hospitalised patients with COVID-19,https://pubmed.ncbi.nlm.nih.gov/33462723,
LitCovid,Tele-health and cancer care in the era of COVID-19: New opportunities in low and middle income countries (LMICs),https://pubmed.ncbi.nlm.nih.gov/33465561,
LitCovid,Why protect civil liberties during a pandemic?,https://pubmed.ncbi.nlm.nih.gov/33462403,
LitCovid,Mapping and role of T cell response in SARS-CoV-2-infected mice,https://pubmed.ncbi.nlm.nih.gov/33464307,
LitCovid,The Psychological Burden of COVID-19 Stigma: Evaluation of the Mental Health of Isolated Mild Condition COVID-19 Patients,https://pubmed.ncbi.nlm.nih.gov/33463098,
LitCovid,Role of vitamin D in regulating COVID-19 severity-An immunological perspective,https://pubmed.ncbi.nlm.nih.gov/33464639,
LitCovid,Community-acquired and hospital-acquired respiratory tract infection and bloodstream infection in patients hospitalized with COVID-19 pneumonia,https://pubmed.ncbi.nlm.nih.gov/33461613,
LitCovid,A Tale of Two Crises: Addressing Covid-19 Vaccine Hesitancy as Promoting Racial Justice,https://pubmed.ncbi.nlm.nih.gov/33464452,
LitCovid,ACEi reduces hypertension-induced hyperinflammation in COVID-19,https://pubmed.ncbi.nlm.nih.gov/33462417,
LitCovid,Measures for prevention of infection transmission in the operating room: Paradigm shift after COVID-19,https://pubmed.ncbi.nlm.nih.gov/33461767,
LitCovid,Knowledge and Perceptions of COVID-19 among the General Public in Singapore: A Cross-sectional Online Survey,https://pubmed.ncbi.nlm.nih.gov/33463669,
LitCovid,Medicine on Twitter: Boon or Bane?,https://pubmed.ncbi.nlm.nih.gov/33464944,
LitCovid,Predicting public take-up of digital contact tracing during the COVID-19 crisis: Results of a national survey in Singapore,https://pubmed.ncbi.nlm.nih.gov/33465034,
LitCovid,Balancing public health and civil liberties in times of pandemic,https://pubmed.ncbi.nlm.nih.gov/33462404,
LitCovid,Obesity in COVID-19: A Systematic Review and Meta-analysis,https://pubmed.ncbi.nlm.nih.gov/33463658,
LitCovid,Improved Serious Illness Communication May Help Mitigate Racial Disparities in Care Among Black Americans with COVID-19,https://pubmed.ncbi.nlm.nih.gov/33464466,
LitCovid,[Oro- and nasopharyngeal swab for detection of SARS-CoV-2 - step-by-step approach],https://pubmed.ncbi.nlm.nih.gov/33465784,
LitCovid,Emerging New Psychiatric Symptoms and the Worsening of Pre-existing Mental Disorders during the COVID-19 Pandemic: A Canadian Multisite Study: Nouveaux symptomes psychiatriques emergents et deterioration des troubles mentaux preexistants pendanturant la pandemie de la COVID-19: une etude canadienne multisite,https://pubmed.ncbi.nlm.nih.gov/33464115,
LitCovid,COVID-19 vaccines: the importance of transparency and fact-based education,https://pubmed.ncbi.nlm.nih.gov/33464636,
LitCovid,Effects of home confinement due to COVID-19 pandemic on eccentric hamstring muscle strength in football players,https://pubmed.ncbi.nlm.nih.gov/33463766,
LitCovid,Olfactory function and viral recovery in COVID-19,https://pubmed.ncbi.nlm.nih.gov/33465295,
LitCovid,Risk conditions in healthcare workers of a pediatric coronavirus disease center in Mexico City,https://pubmed.ncbi.nlm.nih.gov/33465059,
LitCovid,Effects of previous exposure to psychotherapeutic strategies on depression and anxiety symptoms during the COVID-19 pandemic,https://pubmed.ncbi.nlm.nih.gov/33461641,
LitCovid,"""I Am...""",https://pubmed.ncbi.nlm.nih.gov/33462942,
LitCovid,More than a scratch: emergency setting eye evaluation during COVID-19 lockdown,https://pubmed.ncbi.nlm.nih.gov/33462062,
LitCovid,Commentary: Rebuilding With Impacted Communities at the Center: The Case for a Civic Engagement Approach to COVID-19 Response and Recovery,https://pubmed.ncbi.nlm.nih.gov/33464764,
LitCovid,Essentials of setting up a wet lab for ophthalmic surgical training in COVID-19 pandemic,https://pubmed.ncbi.nlm.nih.gov/33463600,
LitCovid,Reasoned therapeutic protocol in outpatients with covid 19,https://pubmed.ncbi.nlm.nih.gov/33463975,
LitCovid,Impact of COVID-19 on in vivo work and patient sample availability for cancer research,https://pubmed.ncbi.nlm.nih.gov/33462500,
LitCovid,Understanding wellbeing and death obsession of young adults in the context of Coronavirus experiences: Mitigating the effect of mindful awareness,https://pubmed.ncbi.nlm.nih.gov/33464187,
LitCovid,Rapid Development of SARS-CoV-2 Spike Protein Receptor-Binding Domain Self-Assembled Nanoparticle Vaccine Candidates,https://pubmed.ncbi.nlm.nih.gov/33464829,
LitCovid,"Prevalence of SARS-CoV-2 in Patients with Severe Pneumonia in Khuzestan Province, Iran",https://pubmed.ncbi.nlm.nih.gov/33463114,
LitCovid,Exclusion of bacterial co-infection in COVID-19 using baseline inflammatory markers and their response to antibiotics,https://pubmed.ncbi.nlm.nih.gov/33463683,
LitCovid,COVID-19 and suicides in India: A pilot study of reports in the media and scientific literature,https://pubmed.ncbi.nlm.nih.gov/33465521,
LitCovid,Psychological distress in North America during COVID-19: The role of pandemic-related stressors,https://pubmed.ncbi.nlm.nih.gov/33465600,
LitCovid,Practical Considerations for Converting Operating Rooms and Post-anaesthesia Care Units into Intensive Care Units in the COVID-19 Pandemic - Experience from a Large Singapore Tertiary Hospital,https://pubmed.ncbi.nlm.nih.gov/33463659,
LitCovid,[Covid-19 vaccination and risk of anaphylaxis - Recommendations for practical management],https://pubmed.ncbi.nlm.nih.gov/33464512,
LitCovid,Surfactant therapy for COVID-19 related ARDS: a retrospective case-control pilot study,https://pubmed.ncbi.nlm.nih.gov/33461535,
LitCovid,The impact of COVID-19 on disordered eating behavior: a qualitative analysis of social media users' responses to the global pandemic,https://pubmed.ncbi.nlm.nih.gov/33465035,
LitCovid,Acute appendicitis management during the COVID-19 pandemic: A prospective cohort study from a LARGE UK centre,https://pubmed.ncbi.nlm.nih.gov/33465496,
LitCovid,Myocardial Inflammation and Dysfunction in COVID-19-Associated Myocardial Injury,https://pubmed.ncbi.nlm.nih.gov/33463366,
LitCovid,"A reflection on: Breitbart W (2020). Life and death in the age of COVID-19. Palliative and Supportive Care 18, 252-253.",https://pubmed.ncbi.nlm.nih.gov/33461635,
LitCovid,Informed Consent for Scholarly Articles during the COVID-19 Pandemic,https://pubmed.ncbi.nlm.nih.gov/33463097,
LitCovid,Lung Ultrasonography for the Diagnosis of SARS-CoV-2 Pneumonia in the Emergency Department,https://pubmed.ncbi.nlm.nih.gov/33461884,
LitCovid,A survey of psychological distress among Bangladeshi people during the COVID-19 pandemic,https://pubmed.ncbi.nlm.nih.gov/33462563,
LitCovid,"Factors associated with hospitalization, invasive mechanical ventilation treatment and death among all confirmed COVID-19 cases in Norway: Prospective cohort study",https://pubmed.ncbi.nlm.nih.gov/33461404,
LitCovid,Clinical validation of a second generation anti-SARS-CoV-2 IgG and IgM automated chemiluminescent immunoassay,https://pubmed.ncbi.nlm.nih.gov/33463719,
LitCovid,Detection-based prioritisation: Framework of multi-laboratory characteristics for asymptomatic COVID-19 carriers based on integrated Entropy-TOPSIS methods,https://pubmed.ncbi.nlm.nih.gov/33461683,
LitCovid,A critical review of point-of-care diagnostic technologies to combat viral pandemics,https://pubmed.ncbi.nlm.nih.gov/33461715,
LitCovid,Predictive value of the neutrophil to lymphocyte ratio for disease deterioration and serious adverse outcomes in patients with COVID-19: a prospective cohort study,https://pubmed.ncbi.nlm.nih.gov/33461497,
LitCovid,Parental Social Isolation and Child Maltreatment Risk during the COVID-19 Pandemic,https://pubmed.ncbi.nlm.nih.gov/33462526,
LitCovid,Severe sinus bradycardia associated with remdesivir in a child with severe SARS-COV-2 infection-reply,https://pubmed.ncbi.nlm.nih.gov/33464367,
LitCovid,"Diagnostic Modalities for the Detection of SARS-CoV-2: Principles, Advantages, and Pitfalls",https://pubmed.ncbi.nlm.nih.gov/33463960,
LitCovid,Neutrophil extracellular traps and von Willebrand factor are allies that negatively influence COVID-19 outcomes,https://pubmed.ncbi.nlm.nih.gov/33463053,
LitCovid,Can continuous remote vital sign monitoring reduce the number of room visits to patients suspected of COVID-19: A quasi-experimental study,https://pubmed.ncbi.nlm.nih.gov/33465579,
LitCovid,Different prevalence trend of depression and anxiety among healthcare workers and general public before and after the peak of COVID-19 occurred in China: A meta-analysis,https://pubmed.ncbi.nlm.nih.gov/33465749,
LitCovid,Impact of COVID-19 on the self-reported physical activity of people with complete thoracic spinal cord injury full-time manual wheelchair users,https://pubmed.ncbi.nlm.nih.gov/33465023,
LitCovid,First clinical use of real-time remote programming in cardiac implantable electronic devices,https://pubmed.ncbi.nlm.nih.gov/33462860,
LitCovid,Seroprevalence of antibodies to SARS-CoV-2 among blood donors in the early month of the pandemic in Saudi Arabia,https://pubmed.ncbi.nlm.nih.gov/33465488,
LitCovid,SARS-CoV-2 and Advanced HIV Infection,https://pubmed.ncbi.nlm.nih.gov/33463667,
LitCovid,Procalcitonin Has Good Accuracy for Prognosis of Critical Condition and Mortality in COVID-19: A Diagnostic Test Accuracy Systematic Review and Meta-analysis,https://pubmed.ncbi.nlm.nih.gov/33463126,
LitCovid,Suitability of Video Consultations During the COVID-19 Pandemic Lockdown: A Cross-Sectional Survey Among Norwegian GPs,https://pubmed.ncbi.nlm.nih.gov/33465037,
LitCovid,"Investigation of COVID-19 Fear, Well-Being and Life Satisfaction in Turkish Society",https://pubmed.ncbi.nlm.nih.gov/33461428,
LitCovid,Predicting mammalian species at risk of being infected by SARS-CoV-2 from an ACE2 perspective,https://pubmed.ncbi.nlm.nih.gov/33462320,
LitCovid,Evaluation of the efficacy and safety of inhaled magnesium sulphate in combination with standard treatment in patients with moderate or severe COVID-19: A structured summary of a study protocol for a randomised controlled trial,https://pubmed.ncbi.nlm.nih.gov/33461602,
LitCovid,A U-shaped association between baseline neutrophil count and COVID-19-related mortality: a retrospective cohort study,https://pubmed.ncbi.nlm.nih.gov/33463721,
LitCovid,Cell-Based High-Throughput Screening Protocol for Discovering Antiviral Inhibitors Against SARS-COV-2 Main Protease (3CLpro),https://pubmed.ncbi.nlm.nih.gov/33464543,
