feed,title,long_url,short_url
LitCovid,Spatial sensitivity analysis of COVID-19 infections concerning the satellite-based four air pollutants levels,https://pubmed.ncbi.nlm.nih.gov/33456479,
LitCovid,"Adverse effects, pharmacological interactions, and cardiovascular drugs in COVID-19 treatment",https://pubmed.ncbi.nlm.nih.gov/33459727,
LitCovid,COVID-19-related social support service closures and mental well-being in older adults and those affected by dementia: a UK longitudinal survey,https://pubmed.ncbi.nlm.nih.gov/33455941,
LitCovid,"Characteristics, Outcomes, and Trends of Patients With COVID-19-Related Critical Illness at a Learning Health System in the United States",https://pubmed.ncbi.nlm.nih.gov/33460330,
LitCovid,Treatment of Crimean-Congo Haemorrhagic Fever by Favipiravir in a Patient with Novel Coronavirus Co-Infection,https://pubmed.ncbi.nlm.nih.gov/33457366,
LitCovid,Inter-laboratory Agreement of Anti-Severe Acute Respiratory Syndrome Coronavirus-2 (SARS-CoV-2) Serologic Assays in the Expedited College of American Pathologists Proficiency Testing Program,https://pubmed.ncbi.nlm.nih.gov/33461214,
LitCovid,"Response to the letter to the editor for ""Obstructive Sleep Apnea and Risk of COVID-19 Infection, Hospitalization and Respiratory Failure""",https://pubmed.ncbi.nlm.nih.gov/33459914,
LitCovid,"The Challenge of maintaining good health outcomes for all during the COVID-19 pandemic-a view from family medicine in Wales, UK",https://pubmed.ncbi.nlm.nih.gov/33457149,
LitCovid,Decrease in the number of primary angioplasty procedures during the pandemic and its relationship with mortality from COVID-19. The role of competing risks.,https://pubmed.ncbi.nlm.nih.gov/33455894,
LitCovid,Biological agents for rheumatic diseases in the outbreak of COVID-19: friend or foe?,https://pubmed.ncbi.nlm.nih.gov/33455920,
LitCovid,Evolution of antibody immunity to SARS-CoV-2,https://pubmed.ncbi.nlm.nih.gov/33461210,
LitCovid,Reporting suspicions of long COVID in children is justified during this global emergency,https://pubmed.ncbi.nlm.nih.gov/33459404,
LitCovid,The use of personal protective equipment (PPE) by police during a public health crisis: An experimental test of public perception,https://pubmed.ncbi.nlm.nih.gov/33456429,
LitCovid,A big-data driven approach to analyzing and modeling human mobility trend under non-pharmaceutical interventions during COVID-19 pandemic,https://pubmed.ncbi.nlm.nih.gov/33456212,
LitCovid,"Working parents, financial insecurity, and childcare: mental health in the time of COVID-19 in the UK",https://pubmed.ncbi.nlm.nih.gov/33456425,
LitCovid,Palliative Care and COVID-19 Pandemic: Retrospective Study of Factors Associated With Infection and Death at an Oncological Palliative Care Reference Center,https://pubmed.ncbi.nlm.nih.gov/33455418,
LitCovid,A Statistical Analysis of Impact of COVID19 on the Global Economy and Stock Index Returns,https://pubmed.ncbi.nlm.nih.gov/33458697,
LitCovid,The Global Impact of COVID-19 on Craniomaxillofacial Surgeons,https://pubmed.ncbi.nlm.nih.gov/33456681,
LitCovid,Re: 'High prevalence of heterotopic ossification in critically ill patients with severe COVID-19' by Stoira et al,https://pubmed.ncbi.nlm.nih.gov/33460830,
LitCovid,A brief outlook on the current emerging trends of COVID 19 vaccines,https://pubmed.ncbi.nlm.nih.gov/33456225,
LitCovid,Post-Traumatic Growth and Stress-Related Responses During the COVID-19 Pandemic in a National Representative Sample: The Role of Positive Core Beliefs About the World and Others,https://pubmed.ncbi.nlm.nih.gov/33456320,
LitCovid,Perfusion patterns of peripheral pulmonary lesions in COVID-19 patients using contrast-enhanced ultrasound (CEUS): A case series,https://pubmed.ncbi.nlm.nih.gov/33459393,
LitCovid,Designing a next generation multi-epitope based peptide vaccine candidate against SARS-CoV-2 using computational approaches,https://pubmed.ncbi.nlm.nih.gov/33457172,
LitCovid,SARS-CoV-2 Antigen Rapid Immunoassay for Diagnosis of COVID-19 in the Emergency Department,https://pubmed.ncbi.nlm.nih.gov/33455451,
LitCovid,"""Ten years of war! You expect people to fear a 'germ'?"": A qualitative study of initial perceptions and responses to the COVID-19 pandemic among displaced communities in opposition-controlled northwest Syria",https://pubmed.ncbi.nlm.nih.gov/33458715,
LitCovid,Major Urological Cancer Surgery for Patients is Safe and Surgical Training Should Be Encouraged During the COVID-19 Pandemic: A Multicentre Analysis of 30-day Outcomes,https://pubmed.ncbi.nlm.nih.gov/33458711,
LitCovid,Adaptation and evaluation of COVID-19 related Psychological Distress Scale Turkish form,https://pubmed.ncbi.nlm.nih.gov/33455500,
LitCovid,Ligand-based approach for predicting drug targets and for virtual screening against COVID-19,https://pubmed.ncbi.nlm.nih.gov/33461215,
LitCovid,Telemedicine for patients with valvular heart disease or aortic disease in the era of COVID-19,https://pubmed.ncbi.nlm.nih.gov/33455891,
LitCovid,Waiting for Godot: A cross sectional survey based analysis of the hydroxychloroquine prophylaxis strategy against COVID-19 in India,https://pubmed.ncbi.nlm.nih.gov/33457350,
LitCovid,COVID-19 Infection in Kidney Transplant Recipients in Italy: Management Issues in a Kidney Transplant Center,https://pubmed.ncbi.nlm.nih.gov/33455573,
LitCovid,A National Survey of Radiation Oncology Experiences Completing Tele-Consultations During the Coronavirus Disease (COVID-19) Pandemic,https://pubmed.ncbi.nlm.nih.gov/33458451,
LitCovid,Bilateral renal infarction in a patient with severe COVID-19 infection,https://pubmed.ncbi.nlm.nih.gov/33460428,
LitCovid,"Identification of 1,2,3-triazole-phthalimide derivatives as potential drugs against COVID-19: a virtual screening, docking and molecular dynamic study",https://pubmed.ncbi.nlm.nih.gov/33459182,
LitCovid,"Severe Acute Respiratory Syndrome Coronavirus 2 (SARS-CoV-2) infection among health care workers in Nasarawa State, Nigeria: implications for infection prevention and control measures",https://pubmed.ncbi.nlm.nih.gov/33456645,
LitCovid,Searching for answers: Cancer care during the COVID pandemic,https://pubmed.ncbi.nlm.nih.gov/33458450,
LitCovid,COVID-19: the challenges of transitioning a hands-on and interactive Honors Reproduction course to an online format,https://pubmed.ncbi.nlm.nih.gov/33458598,
LitCovid,The histopathological features of the explanted lungs from an end-stage COVID-19 patient,https://pubmed.ncbi.nlm.nih.gov/33457054,
LitCovid,Curriculum response to the crisis,https://pubmed.ncbi.nlm.nih.gov/33456073,
LitCovid,Influences of Reopening Businesses and Social Venues: COVID-19 Incidence Rate In An East Texas County,https://pubmed.ncbi.nlm.nih.gov/33455588,
LitCovid,Impact of mitigation measures against the COVID 19 pandemic on the perinatal results of the reference maternity hospital in Uruguay,https://pubmed.ncbi.nlm.nih.gov/33455516,
LitCovid,Equity in Covid-19 vaccine development and deployment,https://pubmed.ncbi.nlm.nih.gov/33460584,
LitCovid,Sleep quality and mental health of medical workers during the coronavirus disease 2019 pandemic,https://pubmed.ncbi.nlm.nih.gov/33456342,
LitCovid,[Telerehabilitation: from the virtual world to reality-Medicine in the twenty-first century : Video-assisted treatment in times of COVID-19],https://pubmed.ncbi.nlm.nih.gov/33459797,
LitCovid,Experiences of pregnant mothers using a social media based antenatal support service during the COVID-19 lockdown in the UK: findings from a user survey,https://pubmed.ncbi.nlm.nih.gov/33455927,
LitCovid,Applying Behavioral Economics to Address COVID-19 Fear Among Oral and Maxillofacial Surgery Patients,https://pubmed.ncbi.nlm.nih.gov/33460562,
LitCovid,Autoimmune haemolytic anaemia and a marked rise in the lymphocyte count associated with COVID-19 in a patient with treatment-naive chronic lymphocytic leukaemia: a case report,https://pubmed.ncbi.nlm.nih.gov/33460041,
LitCovid,Deep Learning Models for Predicting Severe Progression in COVID-19-infected Patients,https://pubmed.ncbi.nlm.nih.gov/33455900,
LitCovid,Implementing a Pandemic Roster in a Specialty Emergency Department - Challenges & Benefits,https://pubmed.ncbi.nlm.nih.gov/33458933,
LitCovid,COVID-19 diagnosis from chest X-ray images using transfer learning: Enhanced performance by debiasing dataloader,https://pubmed.ncbi.nlm.nih.gov/33459685,
LitCovid,"SARS-CoV-2 Vaccines: Much Accomplished, Much to Learn",https://pubmed.ncbi.nlm.nih.gov/33460347,
LitCovid,Experts discuss cancer care and research in the age of COVID-19: Findings presented at the American Association for Cancer Research's virtual meeting could shift clinicians' thinking about immunotherapy and point to encouraging changes in the way that clinical trials are being conducted during the pandemic,https://pubmed.ncbi.nlm.nih.gov/33460046,
LitCovid,The histo-blood group antigens of the host cell may determine the binding of different viruses such as SARS-CoV-2,https://pubmed.ncbi.nlm.nih.gov/33459559,
LitCovid,Framing access to medicines during COVID-19: A qualitative content analysis of Gilead's Remdesivir,https://pubmed.ncbi.nlm.nih.gov/33460356,
LitCovid,Meta-MUMS COVID-19 web server: an online daily monitoring server for comparative and cumulative epidemiological analysis,https://pubmed.ncbi.nlm.nih.gov/33457187,
LitCovid,"What coronavirus 3C-like protease tells us: From structure, substrate selectivity, to inhibitor design",https://pubmed.ncbi.nlm.nih.gov/33460213,
LitCovid,On the reliability of predictions on Covid-19 dynamics: A systematic and critical review of modelling techniques,https://pubmed.ncbi.nlm.nih.gov/33458453,
LitCovid,Critical Care COVID-19 Patient with a Picture of Thrombotic Thrombocytopenic Purpura,https://pubmed.ncbi.nlm.nih.gov/33457377,
LitCovid,[COVID-19 control in Niger: an assessment of infection prevention and control practices at healthcare facilities in the city of Niamey],https://pubmed.ncbi.nlm.nih.gov/33456659,
LitCovid,Having a cluttered year from the coronavirus,https://pubmed.ncbi.nlm.nih.gov/33457381,
LitCovid,"Cytokine adsorption in patients with severe COVID-19 pneumonia requiring extracorporeal membrane oxygenation: protocol for a randomised, controlled, open-label intervention, multicentre trial",https://pubmed.ncbi.nlm.nih.gov/33455938,
LitCovid,Digital contact tracing for COVID-19 epidemic emergency management-A case study based on graph database algorithm,https://pubmed.ncbi.nlm.nih.gov/33460389,
LitCovid,Erratum: A consensus statement on spinal muscular atrophy management in Saudi Arabia in the context of COVID-19,https://pubmed.ncbi.nlm.nih.gov/33459297,
LitCovid,The assessment of high sensitivity cardiac troponin in patients with COVID-19: a multicenter study,https://pubmed.ncbi.nlm.nih.gov/33457490,
LitCovid,The Art of Prevention: COVID-19 Vaccine Preparedness for the Dermatologist,https://pubmed.ncbi.nlm.nih.gov/33457487,
LitCovid,Levels of burn-out among healthcare workers during the COVID-19 pandemic and their associated factors: a cross-sectional study in a tertiary hospital of a highly burdened area of north-east Italy,https://pubmed.ncbi.nlm.nih.gov/33455940,
LitCovid,"Characterization of the SARS-CoV-2 S Protein: Biophysical, Biochemical, Structural, and Antigenic Analysis",https://pubmed.ncbi.nlm.nih.gov/33458462,
LitCovid,Parameter Estimation and Prediction of COVID-19 Epidemic Turning Point and Ending Time of a Case Study on SIR/SQAIR Epidemic Models,https://pubmed.ncbi.nlm.nih.gov/33456496,
LitCovid,[Sorting and detection of COVID-19 by low-dose thoracic CT scan in patients consulting the radiology department of Fann hospital (Dakar-Senegal)],https://pubmed.ncbi.nlm.nih.gov/33456646,
LitCovid,Gels from hand sanitisers may be deposited on inanimate surfaces: what is the effect on viral viability and transmission if these surfaces are subsequently contaminated with SARS-CoV-2 viruses?,https://pubmed.ncbi.nlm.nih.gov/33460642,
LitCovid,Subacute stent thrombosis in a patient with COVID-19 pneumonia,https://pubmed.ncbi.nlm.nih.gov/33456191,
LitCovid,"Takotsubo Syndrome a Rare Entity in COVID-19: a Systemic Review-Focus on Biomarkers, Imaging, Treatment, and Outcome",https://pubmed.ncbi.nlm.nih.gov/33458567,
LitCovid,Natural agents modulating ACE-2: A review of compounds with potential against SARS-CoV-2 infections,https://pubmed.ncbi.nlm.nih.gov/33459225,
LitCovid,Ensuring contact: calling rural Appalachian older adults during the COVID-19 epidemic,https://pubmed.ncbi.nlm.nih.gov/33455406,
LitCovid,Orthopedic Surgery and Telemedicine in Times of COVID-19 and Beyond: a Review,https://pubmed.ncbi.nlm.nih.gov/33460020,
LitCovid,Hydroxychloroquine serum concentrations in non-critical care patients infected with SARS-CoV-2,https://pubmed.ncbi.nlm.nih.gov/33460844,
LitCovid,Telemedicine Practice in Saudi Arabia During the COVID-19 Pandemic,https://pubmed.ncbi.nlm.nih.gov/33457115,
LitCovid,Retraction: Coronavirus disease-2019: A brief compilation of facts,https://pubmed.ncbi.nlm.nih.gov/33456270,
LitCovid,Robust Detection of COVID-19 in Cough Sounds: Using Recurrence Dynamics and Variable Markov Model,https://pubmed.ncbi.nlm.nih.gov/33458700,
LitCovid,Footprint of the COVID-19 Pandemic in India: A Study of Immune Landscape and Other Factors Shielding Mortality,https://pubmed.ncbi.nlm.nih.gov/33457195,
LitCovid,Clinical Characteristics of 47 Death Cases With COVID-19: A Retrospective Study at a Tertiary Center in Lahore,https://pubmed.ncbi.nlm.nih.gov/33457138,
LitCovid,Otorhinolaryngological manifestations of coronavirus disease 2019: a prospective review of 600 patients,https://pubmed.ncbi.nlm.nih.gov/33455587,
LitCovid,Ethnicity and outcomes in patients hospitalised with COVID-19 infection in East London: an observational cohort study,https://pubmed.ncbi.nlm.nih.gov/33455936,
LitCovid,Estimation of COVID-19 epidemic curves using genetic programming algorithm,https://pubmed.ncbi.nlm.nih.gov/33459107,
LitCovid,"Amniocentesis and SARS-CoV-2, in the light of the experience with other viruses",https://pubmed.ncbi.nlm.nih.gov/33455517,
LitCovid,Airflow Characteristics in Aeromedical Aircraft: Considerations During COVID-19,https://pubmed.ncbi.nlm.nih.gov/33455627,
LitCovid,The evolution of health care in the Texas correctional system and the impact of COVID-19,https://pubmed.ncbi.nlm.nih.gov/33456150,
LitCovid,Public's understanding of swab test results for SARS-CoV-2: an online behavioural experiment during the April 2020 lockdown,https://pubmed.ncbi.nlm.nih.gov/33455939,
LitCovid,Withanolides from Withania somnifera as an immunity booster and their therapeutic options against COVID-19,https://pubmed.ncbi.nlm.nih.gov/33459174,
LitCovid,Assessing the interplay between travel patterns and SARS-CoV-2 outbreak in realistic urban setting,https://pubmed.ncbi.nlm.nih.gov/33457497,
LitCovid,Psychometric Evaluation of the Fear of COVID-19 Scale Among Chinese Population,https://pubmed.ncbi.nlm.nih.gov/33456407,
LitCovid,"World-wide tracking of major SARS-CoV-2 genome haplotypes in sequences of June 1 to November 15, 2020 and discovery of rapid expansion of a new haplotype",https://pubmed.ncbi.nlm.nih.gov/33458832,
LitCovid,Serial co-expression analysis of host factors from SARS-CoV viruses highly converges with former high-throughput screenings and proposes key regulators,https://pubmed.ncbi.nlm.nih.gov/33458747,
LitCovid,Comparison of Fit for Sealed and Loose-Fitting Surgical Masks and N95 Filtering Facepiece Respirators,https://pubmed.ncbi.nlm.nih.gov/33458738,
LitCovid,Broken Heart (Takotsubo) Syndrome Triggered by SARS-CoV-2,https://pubmed.ncbi.nlm.nih.gov/33458568,
LitCovid,Does Ibrutinib impact outcomes of viral infection by SARS-CoV-2 in mantle cell lymphoma patients?,https://pubmed.ncbi.nlm.nih.gov/33460953,
LitCovid,The FEES box: A novel barrier to contain particles during aerosol-generating procedures,https://pubmed.ncbi.nlm.nih.gov/33460980,
LitCovid,Eat to Beat Stress,https://pubmed.ncbi.nlm.nih.gov/33456419,
LitCovid,Factual insights of the allosteric inhibition mechanism of SARS-CoV-2 main protease by quercetin: an in silico analysis,https://pubmed.ncbi.nlm.nih.gov/33457176,
LitCovid,"Parent Stress in Relation to Use of Bedside Telehealth, an Initiative to Improve Family-Centeredness of Care in the Neonatal Intensive Care Unit",https://pubmed.ncbi.nlm.nih.gov/33457590,
LitCovid,Transforming student engagement in COVID-19 remote instruction: a research perspective,https://pubmed.ncbi.nlm.nih.gov/33456283,
LitCovid,Re: Case Reports and systematic review suggest that children may experience similar long-term effects to adults after clinical COVID-19,https://pubmed.ncbi.nlm.nih.gov/33459399,
LitCovid,Recent applications and strategies in nanotechnology for lung diseases,https://pubmed.ncbi.nlm.nih.gov/33456721,
LitCovid,"Mental Health, Substance Use, and Wellbeing in Higher Education: Supporting the Whole Student",https://pubmed.ncbi.nlm.nih.gov/33460324,
LitCovid,Designing video feedback to support the socioemotional aspects of online learning,https://pubmed.ncbi.nlm.nih.gov/33456286,
LitCovid,MOOC Learning Assessment in Clinical Settings: Analysis from Quality Dimensions,https://pubmed.ncbi.nlm.nih.gov/33457068,
LitCovid,Early response to caplacizumab and rituximab after anaphylaxis to Octaplas plasma in a patient with thrombotic thrombocytopenic purpura,https://pubmed.ncbi.nlm.nih.gov/33459440,
LitCovid,Persistently high SARS-CoV-2 positivity rate and incidence for Hispanic/Latinos during state reopening in an urban setting: a retrospective cohort study,https://pubmed.ncbi.nlm.nih.gov/33455608,
LitCovid,"Empathy of Medical Students and Compassionate Care for Dying Patients: An Assessment of ""No One Dies Alone"" Program",https://pubmed.ncbi.nlm.nih.gov/33457560,
LitCovid,"Pathogen detection with electrochemical biosensors: Advantages, challenges and future perspectives",https://pubmed.ncbi.nlm.nih.gov/33456428,
LitCovid,The Oncology Family Forum: Collaborating With Families to Codesign Pediatric Oncology Services,https://pubmed.ncbi.nlm.nih.gov/33457629,
LitCovid,Factors affecting the emergence of diplomacy in Iranian nurse managers: a qualitative study,https://pubmed.ncbi.nlm.nih.gov/33459367,
LitCovid,"Emotion matters for academic success: Implications of the Article by Jarrell, Harley, Lajoie, and Naismith (2017) for creating nurturing and supportive learning environments to help students manage their emotions",https://pubmed.ncbi.nlm.nih.gov/33456287,
LitCovid,Increasing risks of domestic violence in India during COVID-19 pandemic,https://pubmed.ncbi.nlm.nih.gov/33454588,
LitCovid,COVID-19 highlights Canada's care home crisis,https://pubmed.ncbi.nlm.nih.gov/33453769,
LitCovid,Impact of the COVID-19 pandemic on a cohort of ALS patients in Catalonia,https://pubmed.ncbi.nlm.nih.gov/33454120,
LitCovid,Concurrent cavitary pulmonary tuberculosis and COVID-19 pneumonia with in vitro immune cell anergy,https://pubmed.ncbi.nlm.nih.gov/33454928,
LitCovid,The inhibitory effects of PGG and EGCG against the SARS-CoV-2 3C-like protease,https://pubmed.ncbi.nlm.nih.gov/33454058,
LitCovid,COVID-19 Pandemic: the story is not over yet,https://pubmed.ncbi.nlm.nih.gov/33454391,
LitCovid,COVID-19: the lessons learned amongst the losses,https://pubmed.ncbi.nlm.nih.gov/33453757,
LitCovid,Monocytes and macrophages in COVID-19: Friends and foes,https://pubmed.ncbi.nlm.nih.gov/33454368,
LitCovid,The Counter Regulatory Axis of the Lung Renin-Angiotensin System in Severe COVID-19: Physiopathology and Clinical Implications,https://pubmed.ncbi.nlm.nih.gov/33454213,
LitCovid,Using EM data to understand COVID-19 pathophysiology,https://pubmed.ncbi.nlm.nih.gov/33453779,
LitCovid,The STRIATE-G Technique for COVID-19 ST-Segment Elevation Myocardial Infarction,https://pubmed.ncbi.nlm.nih.gov/33454298,
LitCovid,Philippine prisons and 'extreme vulnerability' during COVID-19,https://pubmed.ncbi.nlm.nih.gov/33454772,
LitCovid,Information and communication technologies in public management of the healthcare institutions network during covid-19 pandemics,https://pubmed.ncbi.nlm.nih.gov/33454697,
LitCovid,"Trends in emergency transportation due to heat illness under the new normal lifestyle in the COVID-19 era, in Japan and 47 prefectures",https://pubmed.ncbi.nlm.nih.gov/33454494,
LitCovid,"Subclinical COVID-19 Cardiac Imaging Findings: Resurgence of the Athletic ""Grey-Zone""",https://pubmed.ncbi.nlm.nih.gov/33454267,
LitCovid,Using EM data to understand COVID-19 pathophysiology - Authors' reply,https://pubmed.ncbi.nlm.nih.gov/33453781,
LitCovid,Effect of COVID-19 on colorectal cancer care in England,https://pubmed.ncbi.nlm.nih.gov/33453764,
LitCovid,Transcatheter Aortic Valve Implantation During the COVID-19 Pandemic,https://pubmed.ncbi.nlm.nih.gov/33454341,
LitCovid,COVID-19 and the ethics of human challenge trials,https://pubmed.ncbi.nlm.nih.gov/33454919,
LitCovid,High affinity binding of SARS-CoV-2 spike protein enhances ACE2 carboxypeptidase activity,https://pubmed.ncbi.nlm.nih.gov/33453855,
LitCovid,Risk factors for COVID-19 and rheumatic disease flare in a US cohort of Latino patients,https://pubmed.ncbi.nlm.nih.gov/33455077,
LitCovid,Functional impairment during post-acute COVID-19 phase: Preliminary finding in 56 patients,https://pubmed.ncbi.nlm.nih.gov/33454281,
LitCovid,ACE2 expression is elevated in airway epithelial cells from older and male healthy individuals but reduced in asthma,https://pubmed.ncbi.nlm.nih.gov/33455043,
LitCovid,"Examine the associations between perceived neighborhood conditions, physical activity, and mental health during the COVID-19 pandemic",https://pubmed.ncbi.nlm.nih.gov/33454564,
LitCovid,Cardiac involvement in COVID-19: does echocardiography matter? Response,https://pubmed.ncbi.nlm.nih.gov/33454242,
LitCovid,[Initial symptomatology of SARS-CoV-2 infection in healthcare personnel: What have we learned?],https://pubmed.ncbi.nlm.nih.gov/33454129,
LitCovid,Interferon-gamma-induced protein 10 (IP-10) and serum amyloid A (SAA) are excellent biomarkers for the prediction of COVID-19 progression and severity,https://pubmed.ncbi.nlm.nih.gov/33454365,
LitCovid,Clinically applicable approach for predicting mechanical ventilation in patients with COVID-19,https://pubmed.ncbi.nlm.nih.gov/33454051,
LitCovid,Qualitative review of promising practices for testing vulnerable populations at off-site COVID-19 testing centers,https://pubmed.ncbi.nlm.nih.gov/33454583,
LitCovid,"A New Year, the top research articles, and a call to deliver a ""net zero"" Australian health care system by 2040",https://pubmed.ncbi.nlm.nih.gov/33454973,
LitCovid,[The clinical application of blood routine and liver and kidney function test in COVID-19 disease prediction],https://pubmed.ncbi.nlm.nih.gov/33455138,
LitCovid,Impact of the COVID-19 pandemic on the detection and management of colorectal cancer in England: a population-based study,https://pubmed.ncbi.nlm.nih.gov/33453763,
LitCovid,Multi-window back-projection residual networks for reconstructing COVID-19 CT super-resolution images,https://pubmed.ncbi.nlm.nih.gov/33454574,
LitCovid,Structures of SARS-CoV-2 RNA-Binding Proteins and Therapeutic Targets,https://pubmed.ncbi.nlm.nih.gov/33454715,
LitCovid,Imaging data in COVID-19 patients: focused on echocardiographic findings,https://pubmed.ncbi.nlm.nih.gov/33454898,
LitCovid,Research Exceptionalism and Opportunism During the Coronavirus Pandemic,https://pubmed.ncbi.nlm.nih.gov/33455093,
LitCovid,Anxiety and Depressive Symptoms in Children and Adolescents during COVID-19 Pandemic: A Transcultural Approach,https://pubmed.ncbi.nlm.nih.gov/33453745,
LitCovid,Smoking prevalence among hospitalized COVID-19 patients and its association with disease severity and mortality: an expanded re-analysis of a recent publication,https://pubmed.ncbi.nlm.nih.gov/33453726,
LitCovid,Actual problems of dermatovenerological service development: opinion of service providers,https://pubmed.ncbi.nlm.nih.gov/33454668,
LitCovid,Coronavirus infection and PARP expression dysregulate the NAD metabolome: An actionable component of innate immunity,https://pubmed.ncbi.nlm.nih.gov/33453811,
LitCovid,The role of iron in the pathogenesis of COVID-19 and possible treatment with lactoferrin and other iron chelators,https://pubmed.ncbi.nlm.nih.gov/33454595,
LitCovid,Patient and Provider-Reported Satisfaction of Cancer Rehabilitation Telemedicine Visits During the COVID-19 Pandemic,https://pubmed.ncbi.nlm.nih.gov/33455066,
LitCovid,"Public support for European cooperation in the procurement, stockpiling and distribution of medicines",https://pubmed.ncbi.nlm.nih.gov/33454782,
LitCovid,Unusual zwitterionic catalytic site of SARS-CoV-2 main protease revealed by neutron crystallography,https://pubmed.ncbi.nlm.nih.gov/33453981,
LitCovid,Herd immunity by infection is not an option,https://pubmed.ncbi.nlm.nih.gov/33446540,
