feed,title,long_url,short_url
LitCovid,"Erratum to ""Cardiovascular Considerations for the Internist and Hospitalist in the COVID-19 Era"" American Journal of Medicine, 133(11); 1254-1261",https://pubmed.ncbi.nlm.nih.gov/33461734,
LitCovid,Effects of the COVID-19 pandemic on perinatal mental health in Spain: Positive and negative outcomes,https://pubmed.ncbi.nlm.nih.gov/33461897,
LitCovid,Epidemiology of Coronavirus Disease 2019 in US Immigration and Customs Enforcement Detention Facilities,https://pubmed.ncbi.nlm.nih.gov/33464315,
LitCovid,Digital health tools for the management of non-communicable diseases during and after the covid-19 pandemic: perspectives of patients and caregivers,https://pubmed.ncbi.nlm.nih.gov/33464206,
LitCovid,Fighting the storm: could novel anti-TNFalpha and anti-IL-6 C. sativa cultivars tame cytokine storm in COVID-19?,https://pubmed.ncbi.nlm.nih.gov/33465050,
LitCovid,"Age-associated difference in circulating ACE2, the gateway for SARS-COV-2, in humans: results from the InCHIANTI study",https://pubmed.ncbi.nlm.nih.gov/33462706,
LitCovid,Enhancing the performance of paper-based electrochemical impedance spectroscopy nanobiosensors: An experimental approach,https://pubmed.ncbi.nlm.nih.gov/33461849,
LitCovid,Anatomy in a Post-Covid-19 World: Tracing a New Trajectory,https://pubmed.ncbi.nlm.nih.gov/33463041,
LitCovid,Adaptation and psychometric evaluation of the Fear of COVID-19 Scale in the general Colombian population,https://pubmed.ncbi.nlm.nih.gov/33464177,
LitCovid,Factors associated with adherence to COVID-19 prevention measures in the Democratic Republic of the Congo (DRC): results of an online survey,https://pubmed.ncbi.nlm.nih.gov/33462101,
LitCovid,Higher comorbidities and early death in hospitalized African-American patients with Covid-19,https://pubmed.ncbi.nlm.nih.gov/33461499,
LitCovid,"Presidential address: Quarantine guideline to protect examinees from COVID-19, clinical skill examination for Korean dental licensing examination, and computer-based testing for Korean medical, dental, and oriental medicine licensing examinations",https://pubmed.ncbi.nlm.nih.gov/33461260,
LitCovid,"Socio-demographic, social, cognitive, and emotional correlates of adherence to physical distancing during the COVID-19 pandemic: a cross-sectional study",https://pubmed.ncbi.nlm.nih.gov/33464556,
LitCovid,[STIKO vaccination recommendations : Vaccination of immunodeficient patients and vaccination against COVID-19],https://pubmed.ncbi.nlm.nih.gov/33462654,
LitCovid,Correction to: How Resiliency and Hope Can Predict Stress of Covid-19 by Mediating Role of Spiritual Well-being Based on Machine Learning,https://pubmed.ncbi.nlm.nih.gov/33464433,
LitCovid,The coronavirus proofreading exoribonuclease mediates extensive viral recombination,https://pubmed.ncbi.nlm.nih.gov/33465137,
LitCovid,Quality and readability of web-based Arabic health information on COVID-19: an infodemiological study,https://pubmed.ncbi.nlm.nih.gov/33461516,
LitCovid,Patient preferences for telehealth services in a large multispecialty practice,https://pubmed.ncbi.nlm.nih.gov/33461397,
LitCovid,"A Little Autonomy Support Goes a Long Way: Daily Autonomy-Supportive Parenting, Child Well-Being, Parental Need Fulfillment, and Change in Child, Family, and Parent Adjustment Across the Adaptation to the COVID-19 Pandemic",https://pubmed.ncbi.nlm.nih.gov/33462836,
LitCovid,Analyzing biological models and data sets using Jupyter notebooks as an alternate to laboratory-based exercises during COVID-19,https://pubmed.ncbi.nlm.nih.gov/33462960,
LitCovid,Lessons learnt in transitioning from universal screening to universal testing of pregnant patients for SARS-CoV-2 at the largest municipal health system in America,https://pubmed.ncbi.nlm.nih.gov/33462340,
LitCovid,Therapeutic approaches targeting renin-angiotensin system in sepsis and its complications,https://pubmed.ncbi.nlm.nih.gov/33465472,
LitCovid,The Use of Topical Oxygen Therapy to Treat a Calciphylaxis Wound During a Global Pandemic: A Case Report,https://pubmed.ncbi.nlm.nih.gov/33465045,
LitCovid,Curricular uptake of virtual gaming simulation in nursing education,https://pubmed.ncbi.nlm.nih.gov/33465565,
LitCovid,Comprehensive analysis of genomic diversity of SARS-CoV-2 in different geographic regions of India: an endeavour to classify Indian SARS-CoV-2 strains on the basis of co-existing mutations,https://pubmed.ncbi.nlm.nih.gov/33464421,
LitCovid,Customer Centricity in Medical Affairs Needs Human-centric Artificial Intelligence,https://pubmed.ncbi.nlm.nih.gov/33464482,
LitCovid,"Examining the ethical underpinnings of universal basic income as a public health policy: prophylaxis, social engineering and 'good' lives",https://pubmed.ncbi.nlm.nih.gov/33462077,
LitCovid,New generation of vaccines and convalescent plasma therapy for management of CoV-2: Perspectives from the UK and potential deployment in the current global pandemic,https://pubmed.ncbi.nlm.nih.gov/33461918,
LitCovid,"Author Correction: Responses to acute infection with SARS-CoV-2 in the lungs of rhesus macaques, baboons and marmosets",https://pubmed.ncbi.nlm.nih.gov/33462437,
LitCovid,Publisher Correction: Genomic epidemiology reveals multiple introductions of SARS-CoV-2 from mainland Europe into Scotland,https://pubmed.ncbi.nlm.nih.gov/33462438,
LitCovid,Programming course for health science as a strategy to engage students during the coronavirus pandemic,https://pubmed.ncbi.nlm.nih.gov/33464193,
LitCovid,Mass spectrometry reveals potential of beta-lactams as SARS-CoV-2 M(pro) inhibitors,https://pubmed.ncbi.nlm.nih.gov/33462575,
LitCovid,Synchronous and asynchronous tele-exercise during the coronavirus disease 2019 pandemic: Comparisons of implementation and training load in individuals with spinal cord injury,https://pubmed.ncbi.nlm.nih.gov/33461399,
LitCovid,"Erratum: Correction of Text in the Article ""Pediatric Emergency Department Utilization and Coronavirus Disease in Daegu, Korea""",https://pubmed.ncbi.nlm.nih.gov/33463099,
LitCovid,Psychometric properties of the Cognitive Emotion Regulation Questionnaire (CERQ) in Spanish older adults,https://pubmed.ncbi.nlm.nih.gov/33463369,
LitCovid,COVID-19 Australia: Epidemiology Report 32: Four-week reporting period ending 3 January 2021,https://pubmed.ncbi.nlm.nih.gov/33460555,
LitCovid,Saving Limited Resources During Covid-19 Pandemic,https://pubmed.ncbi.nlm.nih.gov/33457317,
LitCovid,"Can we Turn off the ""Covid-Biting-Tail"" Inflammation?",https://pubmed.ncbi.nlm.nih.gov/33457321,
LitCovid,Decluttering,https://pubmed.ncbi.nlm.nih.gov/33457316,
LitCovid,The Many Faces of Covid-19: Organizing Pneumonia (OP) Pattern HRCT Features,https://pubmed.ncbi.nlm.nih.gov/33457315,
LitCovid,Influence of COVID-19 in patients with concurrent tuberculosis co-infections,https://pubmed.ncbi.nlm.nih.gov/33458822,
LitCovid,COVID-19: Analysis of Drug Repositioning Practice,https://pubmed.ncbi.nlm.nih.gov/33456092,
LitCovid,Strategic management of pediatric intensive care unit in a tertiary children's hospital in southwest China during the COVID-19 pandemic,https://pubmed.ncbi.nlm.nih.gov/33457308,
LitCovid,Keeping childhood immunisation rates stable during the COVID-19 pandemic,https://pubmed.ncbi.nlm.nih.gov/33460565,
LitCovid,The neuropathological impact of COVID-19: a review,https://pubmed.ncbi.nlm.nih.gov/33456304,
LitCovid,Scientific hypothesis and rational pharmacological for the use of sacubitril/valsartan in cardiac damage caused by COVID-19,https://pubmed.ncbi.nlm.nih.gov/33460992,
LitCovid,Comment on Virtual Funerals: A Feasible and Safer Option During the COVID-19 Pandemic,https://pubmed.ncbi.nlm.nih.gov/33460461,
LitCovid,Review of pharmacologic and immunologic agents in the management of COVID-19,https://pubmed.ncbi.nlm.nih.gov/33458647,
LitCovid,Assessing the importance of interleukin-6 in COVID-19,https://pubmed.ncbi.nlm.nih.gov/33460569,
LitCovid,Equitable recovery from COVID-19: bring global commitments to community level,https://pubmed.ncbi.nlm.nih.gov/33455911,
LitCovid,"COVID-19 pandemic response fatigue in Africa: causes, consequences, and counter-measures",https://pubmed.ncbi.nlm.nih.gov/33456661,
LitCovid,Potential health benefits of zinc supplementation for the management of COVID-19 pandemic,https://pubmed.ncbi.nlm.nih.gov/33458853,
LitCovid,Celebrating the third year of JHEP Reports in the COVID-19 era,https://pubmed.ncbi.nlm.nih.gov/33458626,
LitCovid,COVID-19 pandemic crisis and food safety: Implications and inactivation strategies,https://pubmed.ncbi.nlm.nih.gov/33456205,
LitCovid,The COVID-19 Pandemic and Older Adults: Institutionalised Ageism or Pragmatic Policy?,https://pubmed.ncbi.nlm.nih.gov/33456627,
LitCovid,Antibody tests for COVID-19,https://pubmed.ncbi.nlm.nih.gov/33456148,
LitCovid,"Safety of biologics for psoriasis patients during the COVID-19 pandemic: the experience from Wuhan, China",https://pubmed.ncbi.nlm.nih.gov/33459264,
LitCovid,Exuberant bullous vasculitis associated with SARS-CoV-2 infection,https://pubmed.ncbi.nlm.nih.gov/33457205,
LitCovid,Therapeutic agents against COVID-19 with clinical evidence,https://pubmed.ncbi.nlm.nih.gov/33459226,
LitCovid,Case reports in the COVID-19 pandemic: first responders to an emergency in evidence-based medicine,https://pubmed.ncbi.nlm.nih.gov/33458676,
LitCovid,"Confronting the threat of SARS-CoV-2: Realities, challenges and therapeutic strategies (Review)",https://pubmed.ncbi.nlm.nih.gov/33456522,
LitCovid,Education and Training for Craniomaxillofacial Surgeons in the Context of COVID-19,https://pubmed.ncbi.nlm.nih.gov/33456679,
LitCovid,Lockdown-related factors associated with the worsening of cardiovascular risk and anxiety or depression during the COVID-19 pandemic,https://pubmed.ncbi.nlm.nih.gov/33457196,
LitCovid,Indoor air quality and COVID-19,https://pubmed.ncbi.nlm.nih.gov/33460881,
LitCovid,Long COVID in the skin: a registry analysis of COVID-19 dermatological duration,https://pubmed.ncbi.nlm.nih.gov/33460566,
LitCovid,The calculated responses against COVID-19 in Namibia,https://pubmed.ncbi.nlm.nih.gov/33456649,
LitCovid,Prospects of biotechnological production and adoption of COVID-19 serological assays in Nigeria,https://pubmed.ncbi.nlm.nih.gov/33456655,
LitCovid,Reply to Comment on Virtual Funerals: A Feasible and Safer Option During the COVID-19 Pandemic,https://pubmed.ncbi.nlm.nih.gov/33460463,
LitCovid,Urticaria as a first clinical manifestation of COVID-19,https://pubmed.ncbi.nlm.nih.gov/33459263,
LitCovid,Importance of telecommunications in the times of COVID-19,https://pubmed.ncbi.nlm.nih.gov/33456275,
LitCovid,Molecular docking and simulation studies of natural compounds of Vitex negundo L. against papain-like protease (PL(pro)) of SARS CoV-2 (coronavirus) to conquer the pandemic situation in the world.,https://pubmed.ncbi.nlm.nih.gov/33459176,
LitCovid,Risk factors and prevention strategies for the occupational exposure of medical staff during the coronavirus disease-19 pandemic (Review),https://pubmed.ncbi.nlm.nih.gov/33456543,
LitCovid,Challenges and opportunities for undergraduate clinical teaching during and beyond the COVID-19 pandemic,https://pubmed.ncbi.nlm.nih.gov/33460334,
LitCovid,Infographic. COVID-19 RT-PCR testing for elite athletes.,https://pubmed.ncbi.nlm.nih.gov/33455908,
LitCovid,Longitudinal Monitoring of SARS-CoV-2 IgM and IgG Seropositivity to Detect COVID-19,https://pubmed.ncbi.nlm.nih.gov/33458749,
LitCovid,Hemoptysis and a Newly Formed Lung Bulla in a Case of Convalescent COVID-19 Pneumonia,https://pubmed.ncbi.nlm.nih.gov/33456035,
LitCovid,Impact of the COVID-19 pandemic on the delivery of menopause education and training,https://pubmed.ncbi.nlm.nih.gov/33459134,
LitCovid,Ascending aortic thrombus with multiple emboli associated with COVID-19,https://pubmed.ncbi.nlm.nih.gov/33456192,
LitCovid,AO CMF International Task Force Recommendations on Best Practices for Maxillofacial Procedures During COVID-19 Pandemic,https://pubmed.ncbi.nlm.nih.gov/33456680,
LitCovid,Your help is needed in the fight against COVID-19: Please contribute to the COVID-19 Global rheumatology alliance registry,https://pubmed.ncbi.nlm.nih.gov/33459531,
LitCovid,Your help is needed in the fight against COVID-19: Please contribute to the COVID-19 Global Rheumatology Alliance Registry,https://pubmed.ncbi.nlm.nih.gov/33460304,
LitCovid,Head and Neck Surgery Residency during Covid-19 Pandemic. Lessons from Southern Italy.,https://pubmed.ncbi.nlm.nih.gov/33457320,
LitCovid,Use of tocilizumab in a patient with severe COVID-19 in a Teaching Hospital in Ghana: a case report,https://pubmed.ncbi.nlm.nih.gov/33456654,
LitCovid,[SARS-CoV-2 Detection in cerebrospinal fluid in a pediatric patient. Case report].,https://pubmed.ncbi.nlm.nih.gov/33458993,
LitCovid,Decoding Covid-19 with the SARS-CoV-2 Genome,https://pubmed.ncbi.nlm.nih.gov/33457109,
LitCovid,Chemical profiling of selected Ayurveda formulations recommended for COVID-19,https://pubmed.ncbi.nlm.nih.gov/33457430,
LitCovid,Principal Component Analysis Applications in COVID-19 Genome Sequence Studies,https://pubmed.ncbi.nlm.nih.gov/33456620,
LitCovid,Protease inhibitor GC376 for COVID-19: Lessons learned from feline infectious peritonitis,https://pubmed.ncbi.nlm.nih.gov/33456770,
LitCovid,Severe COVID-19 infection in a patient with a blastic transformation of a chronic myeloid leukemia and severe treatment-induced immunosuppression: a case report,https://pubmed.ncbi.nlm.nih.gov/33456658,
LitCovid,Bioinformatics and system biology approach to identify the influences of COVID-19 on cardiovascular and hypertensive comorbidities,https://pubmed.ncbi.nlm.nih.gov/33458761,
LitCovid,Transition Planning for Chronic Illnesses in the Time of COVID-19,https://pubmed.ncbi.nlm.nih.gov/33457510,
LitCovid,Multisystem inflammatory syndrome in children related to COVID-19: An update regarding the presentation of two critically ill patients,https://pubmed.ncbi.nlm.nih.gov/33458987,
LitCovid,Risk factors for illness severity in patients with COVID-19 pneumonia: a prospective cohort study,https://pubmed.ncbi.nlm.nih.gov/33456349,
LitCovid,Assessing the importance of interleukin-6 in COVID-19 - Authors' reply,https://pubmed.ncbi.nlm.nih.gov/33460572,
LitCovid,Basic and applied science at the time of COVID-19,https://pubmed.ncbi.nlm.nih.gov/33460098,
LitCovid,Addressing the potential role of curcumin in the prevention of COVID-19 by targeting the Nsp9 replicase protein through molecular docking,https://pubmed.ncbi.nlm.nih.gov/33459817,
LitCovid,"What Is Required to Prevent a Second Major Outbreak of SARS-CoV-2 upon Lifting Quarantine in Wuhan City, China",https://pubmed.ncbi.nlm.nih.gov/33458717,
LitCovid,"Multifunctional angiotensin converting enzyme 2, the SARS-CoV-2 entry receptor, and critical appraisal of its role in acute lung injury",https://pubmed.ncbi.nlm.nih.gov/33461019,
LitCovid,Prevalence of SARS-CoV-2 contamination on food plant surfaces as determined by environmental monitoring,https://pubmed.ncbi.nlm.nih.gov/33460439,
LitCovid,"SARS-CoV-2 meta-interactome suggests disease-specific, autoimmune pathophysiologies and therapeutic targets",https://pubmed.ncbi.nlm.nih.gov/33456761,
LitCovid,A descriptive study of the trends of COVID-19 in Zimbabwe from March-June 2020: policy and strategy implications,https://pubmed.ncbi.nlm.nih.gov/33456657,
LitCovid,Saudi neurosurgery residency and COVID-19: How are we coping?,https://pubmed.ncbi.nlm.nih.gov/33459298,
LitCovid,Clinical Consideration of Glucocorticoids in COVID-19,https://pubmed.ncbi.nlm.nih.gov/33455524,
LitCovid,Proposal for safe oral pathology laboratory practices in COVID-19 pandemic,https://pubmed.ncbi.nlm.nih.gov/33456227,
LitCovid,Evolution of chest CT scan manifestations in a patient recovered from COVID-19 severe pneumonia with acute respiratory distress syndrome,https://pubmed.ncbi.nlm.nih.gov/33457203,
LitCovid,Ischaemic stroke as an initial presentation in patients with COVID-19: evaluation of a case series in an emergency in Brazil,https://pubmed.ncbi.nlm.nih.gov/33455541,
LitCovid,Annals for Hospitalists Inpatient Notes - Corticosteroids and COVID-19-Calming the Storm?,https://pubmed.ncbi.nlm.nih.gov/33460551,
LitCovid,"Life with Parkinson's Disease During the COVID-19 Pandemic: The Pressure Is ""OFF""",https://pubmed.ncbi.nlm.nih.gov/33459663,
LitCovid,Cyclosporine: hope for severe COVID-19?,https://pubmed.ncbi.nlm.nih.gov/33455917,
LitCovid,Anxiety among the Vietnamese Population during the COVID-19 Pandemic: Implications for Social Work Practice,https://pubmed.ncbi.nlm.nih.gov/33459207,
LitCovid,"Patient's Fear of Being Infected, Another Complication of COVID-19 Outbreak: A Lesson Learned from a Case of Life-Threatening Urolithiasis",https://pubmed.ncbi.nlm.nih.gov/33457685,
LitCovid,Curbing COVID-19: Kerala model,https://pubmed.ncbi.nlm.nih.gov/33456228,
LitCovid,In silico validation of potent phytochemical Orientin as inhibitor of SARS-CoV-2 spike and host cell receptor GRP78 binding,https://pubmed.ncbi.nlm.nih.gov/33458435,
LitCovid,The Effect of COVID-19 Anxiety on General Health: the Role of COVID-19 Coping,https://pubmed.ncbi.nlm.nih.gov/33456406,
LitCovid,Ensuring Business Continuity of Musculoskeletal Care During the COVID-19 Pandemic: Experience of a Tertiary Orthopaedic Surgery Department in Singapore,https://pubmed.ncbi.nlm.nih.gov/33458559,
LitCovid,COVID-19 and Outpatient Parenteral Antimicrobial Therapy,https://pubmed.ncbi.nlm.nih.gov/33460552,
LitCovid,COVID-19 and Outpatient Parenteral Antimicrobial Therapy,https://pubmed.ncbi.nlm.nih.gov/33460554,
LitCovid,Pulmonary Arterial Thrombosis in COVID-19 With Fatal Outcome,https://pubmed.ncbi.nlm.nih.gov/33460547,
LitCovid,Pulmonary Arterial Thrombosis in COVID-19 With Fatal Outcome,https://pubmed.ncbi.nlm.nih.gov/33460548,
LitCovid,An in silico analysis of Ibuprofen enantiomers in high concentrations of sodium chloride with SARS-CoV-2 main protease,https://pubmed.ncbi.nlm.nih.gov/33459192,
LitCovid,Pre-hospital lowest recorded oxygen saturation independently predicts death in patients with COVID-19,https://pubmed.ncbi.nlm.nih.gov/33456398,
LitCovid,A large-scale transcriptional study reveals inhibition of COVID-19 related cytokine storm by traditional chinese medicines,https://pubmed.ncbi.nlm.nih.gov/33457042,
LitCovid,Post Abortion Care and Management After Induced Abortion During the COVID-19 Pandemic: A Chinese Expert Consensus,https://pubmed.ncbi.nlm.nih.gov/33459975,
LitCovid,"Psychological reactions to COVID-19: Survey data assessing perceived susceptibility, distress, mindfulness, and preventive health behaviors",https://pubmed.ncbi.nlm.nih.gov/33457475,
LitCovid,Outpatient clinical pharmacy practice in the face of COVID-19 at a cancer center in New York City,https://pubmed.ncbi.nlm.nih.gov/33459159,
LitCovid,COVID-19 and Indigenous knowledge and leadership: (Re)centring public health curricula to address inequities,https://pubmed.ncbi.nlm.nih.gov/33460238,
LitCovid,Backing the Blue in the Midst of COVID-19: Simultaneous Shared Trauma and the Effects of Coping in Law Enforcement Couples,https://pubmed.ncbi.nlm.nih.gov/33456093,
LitCovid,"In silico docking analysis revealed the potential of phytochemicals present in Phyllanthus amarus and Andrographis paniculata, used in Ayurveda medicine in inhibiting SARS-CoV-2",https://pubmed.ncbi.nlm.nih.gov/33457171,
LitCovid,[Anti-COVID-19 RNA vaccines],https://pubmed.ncbi.nlm.nih.gov/33456058,
LitCovid,"Knowledge, attitude and practice towards COVID-19 among workers of a tertiary hospital in Bayelsa State, Nigeria",https://pubmed.ncbi.nlm.nih.gov/33456648,
LitCovid,Smart technologies driven approaches to tackle COVID-19 pandemic: a review,https://pubmed.ncbi.nlm.nih.gov/33457174,
LitCovid,Hedonic and eudaimonic well-being during the COVID-19 lockdown in Italy: The role of stigma and appraisals,https://pubmed.ncbi.nlm.nih.gov/33460503,
LitCovid,International Registry of OtolaryngologistHead and Neck Surgeons with COVID-19,https://pubmed.ncbi.nlm.nih.gov/33459511,
LitCovid,Differences between radiological findings of COVID-19 and non-COVID-19 infections in pediatric patients,https://pubmed.ncbi.nlm.nih.gov/33460024,
LitCovid,Recent biotechnological advances as potential intervention strategies against COVID-19,https://pubmed.ncbi.nlm.nih.gov/33457170,
LitCovid,COVID-19 and Healthcare Workers in Saudi Arabia: A Survey on Their Knowledge and Practices,https://pubmed.ncbi.nlm.nih.gov/33460390,
LitCovid,Lifestyle Medicine During (and After) the COVID-19 Pandemic,https://pubmed.ncbi.nlm.nih.gov/33456421,
LitCovid,EXPRESS: Global Impact of the COVID-19 Pandemic on Stroke Hospitalizations and Mechanical Thrombectomy Volumes,https://pubmed.ncbi.nlm.nih.gov/33459583,
LitCovid,Restoring and maintaining robust maternity services in the COVID-19 era: a public health dilemma in Zimbabwe,https://pubmed.ncbi.nlm.nih.gov/33456656,
LitCovid,A Case of Euglycemic Diabetic Ketoacidosis in a Patient With Type 2 Diabetes Mellitus and COVID-19,https://pubmed.ncbi.nlm.nih.gov/33457131,
LitCovid,Predictors of clinical deterioration in non-severe patients with COVID-19: a retrospective cohort study,https://pubmed.ncbi.nlm.nih.gov/33459077,
LitCovid,Immunomodulation using CONVEHY(R) for COVID-19: from the storm to the cytokine anticyclone,https://pubmed.ncbi.nlm.nih.gov/33455739,
LitCovid,Multiple oral ulcerations - An initial manifestation of COVID 19 infection: A personal experience!!,https://pubmed.ncbi.nlm.nih.gov/33456229,
LitCovid,Antibodies to watch in 2021,https://pubmed.ncbi.nlm.nih.gov/33459118,
LitCovid,Compounds of Citrus medica and Zingiber officinale for COVID-19 inhibition: in silico evidence for cues from Ayurveda,https://pubmed.ncbi.nlm.nih.gov/33457429,
LitCovid,Racial Disparities in COVID-19-related Deaths in Brazil: Black Lives Matter?,https://pubmed.ncbi.nlm.nih.gov/33456022,
LitCovid,Reopening Schools and the Dynamics of SARS-CoV-2 Infections in Israel: A Nationwide Study,https://pubmed.ncbi.nlm.nih.gov/33460434,
LitCovid,Public health challenges facing Environmental Health Officers during COVID-19: methamphetamine contamination of properties,https://pubmed.ncbi.nlm.nih.gov/33460218,
LitCovid,High prevalence of heterotopic ossification in critically ill patients with severe COVID-19,https://pubmed.ncbi.nlm.nih.gov/33460831,
LitCovid,Seeing and Being Seen: The Impact of Art Making on the Experience of Isolation and Fear in Patient Care,https://pubmed.ncbi.nlm.nih.gov/33457507,
LitCovid,Serum cytokines profile of critically ill COVID-19 patients with cardiac dysfunction,https://pubmed.ncbi.nlm.nih.gov/33459844,
LitCovid,[Guia de profilaxia y tratamiento antitrombotico para pacientes con COVID-19. Consenso del Grupo Cooperativo Latinoamericano en Hemostasia y Trombosis (CLAHT)].,https://pubmed.ncbi.nlm.nih.gov/33459726,
LitCovid,In silico exploration of novel protease inhibitors against coronavirus 2019 (COVID-19),https://pubmed.ncbi.nlm.nih.gov/33457495,
LitCovid,Does COVID-19 affect metro use in Taipei?,https://pubmed.ncbi.nlm.nih.gov/33456211,
LitCovid,Can efficient stimulation of myogenic microcirculatory oscillations by transient ischemia predict low incidence of COVID-19 infection?,https://pubmed.ncbi.nlm.nih.gov/33460776,
LitCovid,Trust in a COVID-19 vaccine among people with substance use disorders,https://pubmed.ncbi.nlm.nih.gov/33461150,
LitCovid,"""Making Sure We Are All Okay"": Healthcare Workers' Strategies for Emotional Connectedness During the COVID-19 Pandemic",https://pubmed.ncbi.nlm.nih.gov/33456094,
LitCovid,ABO blood grouping and COVID 19: Is there any correlation in suspectibility?,https://pubmed.ncbi.nlm.nih.gov/33456226,
LitCovid,Addressing the Psychological Needs of Workers in Health Care During the COVID-19 Pandemic Must Not Be an Afterthought,https://pubmed.ncbi.nlm.nih.gov/33455881,
LitCovid,Cytokine Profiles Before and After Immune Modulation in Hospitalized Patients with COVID-19,https://pubmed.ncbi.nlm.nih.gov/33459964,
LitCovid,HSV1 viremia with fulminant hepatitis as opportunistic sequela in severe COVID-19,https://pubmed.ncbi.nlm.nih.gov/33458783,
LitCovid,Implementing nationwide measles supplemental immunization activities in Ethiopia in the context of COVID-19: process and lessons learnt,https://pubmed.ncbi.nlm.nih.gov/33456660,
LitCovid,Altered Cholesterol and Lipid Synthesis Mediates Hyperinflammation in COVID-19,https://pubmed.ncbi.nlm.nih.gov/33455862,
LitCovid,Most notable 100 articles of COVID-19: an Altmetric study based on bibliometric analysis,https://pubmed.ncbi.nlm.nih.gov/33459942,
LitCovid,"[Risk perception of COVID-19 pandemic among health care providers: qualitative study conducted at the King Baudoin Hospital in Guediawaye, the first hospital faced with managing a community-acquired COVID-19 case in Senegal]",https://pubmed.ncbi.nlm.nih.gov/33456647,
LitCovid,COVID-19 and rheumatology: Reflecting on the first wave and preparing for the second wave,https://pubmed.ncbi.nlm.nih.gov/33459529,
LitCovid,Cross-regional variations of Covid-19 mortality in Italy: an ecological study,https://pubmed.ncbi.nlm.nih.gov/33458758,
LitCovid,[Collaboration between acadmic institutes and public health centers under public health emergecy; lessons learnt through COVID-19 epidemic],https://pubmed.ncbi.nlm.nih.gov/33456017,
LitCovid,Impact of COVID-19 pandemic on sustainability determinants: A global trend,https://pubmed.ncbi.nlm.nih.gov/33458434,
LitCovid,COVID-19-related cytokine and information storm: considerations regarding multisystem inflammatory syndrome in children,https://pubmed.ncbi.nlm.nih.gov/33458972,
LitCovid,Industry News October 2020,https://pubmed.ncbi.nlm.nih.gov/33455454,
LitCovid,COVID-19 detection and heatmap generation in chest x-ray images,https://pubmed.ncbi.nlm.nih.gov/33457446,
LitCovid,COVID-19 and the Shift in High Yield Driven Medical Education,https://pubmed.ncbi.nlm.nih.gov/33457072,
