feed,title,long_url,short_url
j.mp/ml-reviews,Graph Learning: A Survey (2021) (cs.LG),http://arxiv.org/abs/2105.00696v1,
j.mp/ml-reviews,Deep Learning Methods For Synthetic Aperture Radar Image Despeckling: An Overview Of Trends And Perspectives (2020-2021) (eess.IV),http://arxiv.org/abs/2012.05508v2,
j.mp/ml-reviews,A survey on VQA_Datasets and Approaches (2021) (cs.CV),http://arxiv.org/abs/2105.00421v1,
j.mp/ml-reviews,Canonical Correlation Analysis (CCA) Based Multi-View Learning: An Overview (2019-2021) (cs.LG),http://arxiv.org/abs/1907.01693v2,
j.mp/ml-reviews,Comprehensive Review On Twin Support Vector Machines (2021) (cs.LG),http://arxiv.org/abs/2105.00336v1,
j.mp/ml-reviews,A Survey on Deep Learning-based Architectures for Semantic Segmentation on 2D images (2019-2021) (cs.CV),http://arxiv.org/abs/1912.10230v3,
j.mp/ml-reviews,"Visually grounded models of spoken language: A survey of datasets, architectures and evaluation techniques (2021) (cs.AI)",http://arxiv.org/abs/2104.13225v2,
j.mp/ml-reviews,Deep Neural Networks for COVID-19 Detection and Diagnosis using Images and Acoustic-based Techniques: A Recent Review (2020-2021) (cs.CV),http://arxiv.org/abs/2012.07655v4,
j.mp/ml-reviews,Adversarial Example Detection for DNN Models: A Review (2021) (cs.CV),http://arxiv.org/abs/2105.00203v1,
j.mp/ml-reviews,Deep Insights of Deepfake Technology : A Review (2021) (cs.LG),http://arxiv.org/abs/2105.00192v1,
j.mp/ml-reviews,Generalizing to Unseen Domains: A Survey on Domain Generalization (2021) (cs.LG),http://arxiv.org/abs/2103.03097v3,
