feed,title,long_url,short_url
MX,Five surprising ways plants can keep you healthy,https://medicalxpress.com/news/2021-05-ways-healthy.html,https://j.mp/3w0hKPa
MX,Eating more fruit and vegetables linked to less stress: study,https://medicalxpress.com/news/2021-05-fruit-vegetables-linked-stress.html,https://j.mp/3w3os6Z
MX,"Food dyes may cause disease when the immune system is dysregulated, researchers report",https://medicalxpress.com/news/2021-05-food-dyes-disease-immune-dysregulated.html,https://j.mp/2QgUehN
MX,Cancer has ripple effect on distant tissues,https://medicalxpress.com/news/2021-05-cancer-ripple-effect-distant-tissues.html,https://j.mp/3w4EjCg
MX,Study: Obesity slows progress against cancer deaths,https://medicalxpress.com/news/2021-05-obesity-cancer-deaths.html,https://j.mp/2RM3St4
MX,New drug shows promise against tough-to-manage asthma,https://medicalxpress.com/news/2021-05-drug-tough-to-manage-asthma.html,https://j.mp/3tEoukc
MX,Thin-film electrodes reveal key insight into human brain activity,https://medicalxpress.com/news/2021-05-thin-film-electrodes-reveal-key-insight.html,https://j.mp/3eJEpcT
MX,Social media networking doesn't 'level the playing field' for women physicians,https://medicalxpress.com/news/2021-05-social-media-networking-doesnt-field.html,https://j.mp/3uKAXUS
MX,Scientists show immune cells change behavior unexpectedly to instigate psoriasis lesions,https://medicalxpress.com/news/2021-05-scientists-immune-cells-behavior-unexpectedly.html,https://j.mp/3y8Hgnh
