feed,title,long_url,short_url
MX,Is it safe to visit the dentist during the pandemic?,https://medicalxpress.com/news/2020-07-safe-dentist-pandemic.html,https://j.mp/2ZWrN9s
MX,China's new strategy to tame second-wave virus outbreaks,https://medicalxpress.com/news/2020-07-china-strategy-second-wave-virus-outbreaks.html,https://j.mp/3eaiFTP
MX,Schools or bars? Opening classrooms may mean hard choices,https://medicalxpress.com/news/2020-07-schools-bars-classrooms-hard-choices.html,https://j.mp/38GGEZV
MX,"US adds 55,000 new COVID-19 cases in 24 hours",https://medicalxpress.com/news/2020-07-covid-cases-hours.html,https://j.mp/38FaBtb
MX,Bali island begins to reopen after 3-month virus lockdown,https://medicalxpress.com/news/2020-07-bali-island-reopen-month-virus.html,https://j.mp/3eaiN5L
MX,Five million begin lockdown in Australian city,https://medicalxpress.com/news/2020-07-million-lockdown-australian-city.html,https://j.mp/3ffRLeB
MX,"Virus cases jump in worst-hit trio of US, Brazil and India",https://medicalxpress.com/news/2020-07-virus-cases-worst-hit-trio-brazil.html,https://j.mp/2Za9eQ1
