feed,title,long_url,short_url
GN:S:GW,Letter to the editor: Voters want Congress to mitigate global warming - pressherald,https://www.pressherald.com/2021/10/01/letter-to-the-editor-voters-want-congress-to-mitigate-global-warming/,
GN:S:GW,‘The kids aren’t alright’: Global warming elevates risks to children - INQUIRER,https://newsinfo.inquirer.net/1495647/the-kids-arent-alright-global-warming-elevates-risks-to-children,
GN:S:GW,VICTOR JOECKS: Las Vegas’ water situation shows why there’s no need to panic over global warming - Las Vegas Review-Journal,https://www.reviewjournal.com/opinion/opinion-columns/victor-joecks/victor-joecks-las-vegas-water-situation-shows-why-theres-no-need-to-panic-over-global-warming-2450922/,
GN:S:GW,"Global Warming | UN Secretary-General warns of ""hellish future"" - The Queens County Citizen",https://queenscitizen.ca/2021/09/30/global-warming-un-secretary-general-warns-of-hellish-future/,
GN:S:GW,Delayed Autumn: 80F on October 1 - Low 70s Expected First Week of October - Minneapolis Star Tribune,https://www.startribune.com/delayed-autumn-80f-on-october-1-low-70s-expected-first-week-of-october/600101497/,
