feed,title,long_url,short_url
GN:T:CC,Thunberg leads climate protests in Italy ahead of COP26 - Al Jazeera English,https://www.aljazeera.com/news/2021/10/1/thunberg-leads-climate-protests-in-italy-ahead-of-cop26,
GN:T:CC,"In Brazilian Amazon, savannization and climate change will expose 12 million to lethal heat stress - Phys",https://phys.org/news/2021-10-brazilian-amazon-savannization-climate-expose.html,
GN:T:CC,Greenpeace ad asks if climate change is racist | TheHill - The Hill,https://thehill.com/policy/equilibrium-sustainability/574930-greenpeace-ad-asks-if-climate-change-is-racist,
GN:T:CC,"Live: Hogan, Northam meet in Virginia Beach to announce climate change directive - WAVY",https://www.wavy.com/news/virginia/maryland-gov-hogan-meeting-with-northam-at-chesapeake-bay-foundations-brock-center-in-virginia-beach/,
GN:T:CC,Laurene Powell Jobs to invest $3.5B towards climate change initiatives - Palo Alto Online,https://paloaltoonline.com/news/2021/09/30/laurene-powell-jobs-to-invest-35b-towards-climate-change-initiatives,
