feed,title,long_url,short_url
GN:T:RE,Biden administration plans to tee up offshore wind across the nation’s coastlines - The Hill,https://news.google.com/rss/articles/CBMihwFodHRwczovL3RoZWhpbGwuY29tL3BvbGljeS9lbmVyZ3ktZW52aXJvbm1lbnQvNDYxNjM3OS1iaWRlbi1hZG1pbmlzdHJhdGlvbi1wbGFucy10by10ZWUtdXAtb2Zmc2hvcmUtd2luZC1hY3Jvc3MtdGhlLW5hdGlvbnMtY29hc3RsaW5lcy_SAYsBaHR0cHM6Ly90aGVoaWxsLmNvbS9wb2xpY3kvZW5lcmd5LWVudmlyb25tZW50LzQ2MTYzNzktYmlkZW4tYWRtaW5pc3RyYXRpb24tcGxhbnMtdG8tdGVlLXVwLW9mZnNob3JlLXdpbmQtYWNyb3NzLXRoZS1uYXRpb25zLWNvYXN0bGluZXMvYW1wLw?oc=5,https://da.gd/92C7X
GN:T:RE,Soldotna solar installation set to go online this summer - Alaska Public Media News,https://news.google.com/rss/articles/CBMiXWh0dHBzOi8vYWxhc2thcHVibGljLm9yZy8yMDI0LzA0LzIzL3NvbGRvdG5hLXNvbGFyLWluc3RhbGxhdGlvbi1zZXQtdG8tZ28tb25saW5lLXRoaXMtc3VtbWVyL9IBAA?oc=5,https://da.gd/lMXY
GN:T:RE,Want Decades of Passive Income? 2 Energy Stocks to Buy Now and Hold Forever - Yahoo Finance,https://news.google.com/rss/articles/CBMiS2h0dHBzOi8vZmluYW5jZS55YWhvby5jb20vbmV3cy93YW50LWRlY2FkZXMtcGFzc2l2ZS1pbmNvbWUtMi0wODA1MDA1OTAuaHRtbNIBAA?oc=5,https://da.gd/Fg3E
GN:T:RE,Brazil Iron: UK court case launched over mining project in Bahia - BBC,https://news.google.com/rss/articles/CBMiNWh0dHBzOi8vd3d3LmJiYy5jb20vbmV3cy93b3JsZC1sYXRpbi1hbWVyaWNhLTY4NzcyNTkw0gE5aHR0cHM6Ly93d3cuYmJjLmNvbS9uZXdzL3dvcmxkLWxhdGluLWFtZXJpY2EtNjg3NzI1OTAuYW1w?oc=5,https://da.gd/gym0P4
GN:T:RE,"Iran's Raisi inaugurates project in Sri Lanka, says West doesn't monopolize knowledge, technology - The Associated Press",https://news.google.com/rss/articles/CBMiZWh0dHBzOi8vYXBuZXdzLmNvbS9hcnRpY2xlL3NyaS1sYW5rYS1pcmFuLXJhaXNpLWh5ZHJvcG93ZXItc2FuY3Rpb25zLTY5YTg2M2Q2YWUyMTI5ODRkZGVmNDZmMGM0ZjIyNWU30gEA?oc=5,https://da.gd/v3FS9
