feed,title,long_url,short_url
GN:T:WP,Macron Lashes Out At United States Over Double Standard Energy Policies - OilPrice,https://oilprice.com/Latest-Energy-News/World-News/Frankly-Terrifying-Energy-Crisis-Could-Drag-26-Million-Brits-Into-Fuel-Povert.html,
GN:T:WP,"GMC Sierra EV Denali — 754 HP, 400-Mile Range (With Video) - CleanTechnica",https://cleantechnica.com/2022/10/21/gmc-sierra-ev-denali-754-hp-400-mile-range-with-video/,
GN:T:WP,"Portugal, Spain, France to develop Green Energy Corridor - reNEWS",https://renews.biz/81295/portugal-spain-france-to-develop-green-energy-corridor/,
GN:T:WP,"Stocks to Watch: Axis Bank, ITC, Asian Paints, Bajaj Finance, YES Bank, RIL - Business Standard",https://www.business-standard.com/article/markets/stocks-to-watch-today-axis-bank-itc-asian-paints-bajaj-finance-yes-bank-ril-wipro-indus-towers-122102100101_1.html,
GN:T:WP,Farmer's engineering skills make farm net electricity producer - FarmersWeekly,https://www.fwi.co.uk/livestock/farmers-engineering-skills-make-farm-net-electricity-producer,
