feed,title,long_url,short_url
GN:S:C,How China’s ‘Zero-Covid’ Policy Hinders Climate Research and Action - Impakter,https://impakter.com/how-chinas-zero-covid-policy-hinders-climate-research-and-action/,
GN:S:C,"From the Nile to the Mississippi, petrochemicals are the next big climate fight around the world - Louisana Illuminator",https://lailluminator.com/2022/12/02/from-the-nile-to-the-mississippi-petrochemicals-are-the-next-big-climate-fight-around-the-world/,
GN:S:C,'It's like the Oscars for climate change': Earthshot prizes to be awarded tonight in Boston - WCVB Boston,https://www.wcvb.com/article/its-like-the-oscars-for-climate-change-earthshot-prizes-to-be-awarded-tonight-in-boston/42131218,
GN:S:C,Climate-Driven Drought Is Stressing the Hopi Tribe's Foods and Traditions - Civil Eats,https://civileats.com/2022/12/02/climate-driven-drought-stress-hopi-foods-traditions/,
GN:S:C,Turning potato chips climate friendly in Argentina - GlobeNewswire,https://www.globenewswire.com/news-release/2022/12/02/2566627/0/en/Turning-potato-chips-climate-friendly-in-Argentina.html,
GN:S:C,Caribbean food security and our creeping climate emergency - Stabroek News,https://www.stabroeknews.com/2022/12/02/business/business-editorials/caribbean-food-security-and-our-creeping-climate-emergency/,
GN:S:C,TigerRisk warns of inconsistent climate conclusions from cat model indexing - Reinsurance News,https://www.reinsurancene.ws/tigerrisk-warns-of-inconsistent-climate-conclusions-from-cat-model-indexing/,
GN:S:C,EBRD offers funding to help Kyrgyz Railways address climate risk - Railway Technology,https://www.railway-technology.com/news/ebrd-kyrgyz-railways-address-climate/,
