feed,title,long_url,short_url
GN:T:CC,"As climate clock ticks, war in Ukraine upends Arctic research - Al Jazeera English",https://www.aljazeera.com/features/2022/11/13/as-climate-clock-ticks-war-in-ukraine-upends-arctic-research-2,
GN:T:CC,"US President meets Egyptian counterpart, expresses support for Egypt's water rights - Daily News Egypt",https://dailynewsegypt.com/2022/11/13/us-president-meets-egyptian-counterpart-expresses-support-for-egypts-water-rights/,
GN:T:CC,COP27: Data journalism platform launches climate hub - Daily Trust,https://dailytrust.com/cop27-data-journalism-platform-launches-climate-hub,
GN:T:CC,Cocoa farmers fear climate change lowering crop production - The Seattle Times,https://www.seattletimes.com/business/cocoa-farmers-fear-climate-change-lowering-crop-production/,
GN:T:CC,Degrowth: A dangerous idea or the answer to the world's biggest crisis? - CNN,https://www.cnn.com/2022/11/13/economy/degrowth-climate-cop27/index.html,
GN:T:CC,"Climate change pushes hurricanes earlier and later, expert says - WUSF Public Media",https://wusfnews.wusf.usf.edu/weather/2022-11-13/climate-change-pushes-hurricanes-earlier-and-later-expert-says,
GN:T:CC,Hyundai Motor Group Executive Chair Urges Bold Action on Climate Change and Energy Poverty at B20 Summit Indonesia 2022 USA - English - USA - English - PR Newswire,https://www.prnewswire.com/news-releases/hyundai-motor-group-executive-chair-urges-bold-action-on-climate-change-and-energy-poverty-at-b20-summit-indonesia-2022-301676254.html,
