feed,title,long_url,short_url
ArXiv:cs,DF-ACBlurGAN: Structure-Aware Conditional Generation of Internally Repeated Patterns for Biomaterial Microtopography Design,https://arxiv.org/abs/2603.28776,
ArXiv:cs,"Incentives, Equilibria, and the Limits of Healthcare AI: A Game-Theoretic Perspective",https://arxiv.org/abs/2603.28825,
ArXiv:cs,World2Rules: A Neuro-Symbolic Framework for Learning World-Governing Safety Rules for Aviation,https://arxiv.org/abs/2603.28952,
ArXiv:cs,MEDiC: Multi-objective Exploration of Distillation from CLIP,https://arxiv.org/abs/2603.29009,
ArXiv:cs,UltraG-Ray: Physics-Based Gaussian Ray Casting for Novel Ultrasound View Synthesis,https://arxiv.org/abs/2603.29022,
ArXiv:cs,Human-Like Lifelong Memory: A Neuroscience-Grounded Architecture for Infinite Interaction,https://arxiv.org/abs/2603.29023,
ArXiv:cs,A Latent Risk-Aware Machine Learning Approach for Predicting Operational Success in Clinical Trials based on TrialsBank,https://arxiv.org/abs/2603.29041,
ArXiv:cs,Towards Explainable Stakeholder-Aware Requirements Prioritisation in Aged-Care Digital Health,https://arxiv.org/abs/2603.29114,
ArXiv:cs,Quality-Controlled Active Learning via Gaussian Processes for Robust Structure-Property Learning in Autonomous Microscopy,https://arxiv.org/abs/2603.29135,
ArXiv:cs,Knowledge database development by large language models for countermeasures against viruses and marine toxins,https://arxiv.org/abs/2603.29149,
ArXiv:cs,CT-to-X-ray Distillation Under Tiny Paired Cohorts: An Evidence-Bounded Reproducible Pilot Study,https://arxiv.org/abs/2603.29167,
ArXiv:cs,Segmentation of Gray Matters and White Matters from Brain MRI data,https://arxiv.org/abs/2603.29171,
ArXiv:cs,Biomimetic PINNs for Cell-Induced Phase Transitions: UQ-R3 Sampling with Causal Gating,https://arxiv.org/abs/2603.29184,
ArXiv:cs,BiMoE: Brain-Inspired Experts for EEG-Dominant Affective State Recognition,https://arxiv.org/abs/2603.29205,
ArXiv:cs,FOSCU: Feasibility of Synthetic MRI Generation via Duo-Diffusion Models for Enhancement of 3D U-Nets in Hepatic Segmentation,https://arxiv.org/abs/2603.29343,
ArXiv:cs,"AI-Generated Prior Authorization Letters: Strong Clinical Content, Weak Administrative Scaffolding",https://arxiv.org/abs/2603.29366,
ArXiv:cs,Beyond Idealized Patients: Evaluating LLMs under Challenging Patient Behaviors in Medical Consultations,https://arxiv.org/abs/2603.29373,
ArXiv:cs,CounselReflect: A Toolkit for Auditing Mental-Health Dialogues,https://arxiv.org/abs/2603.29429,
ArXiv:cs,mtslearn: Machine Learning in Python for Medical Time Series,https://arxiv.org/abs/2603.29432,
ArXiv:cs,NeoNet: An End-to-End 3D MRI-Based Deep Learning Framework for Non-Invasive Prediction of Perineural Invasion via Generation-Driven Classification,https://arxiv.org/abs/2603.29449,
ArXiv:cs,Calibrated Confidence Expression for Radiology Report Generation,https://arxiv.org/abs/2603.29492,
ArXiv:cs,All-in-One Augmented Reality Guided Head and Neck Tumor Resection,https://arxiv.org/abs/2603.29495,
ArXiv:cs,Bioinspired123D: Generative 3D Modeling System for Bioinspired Structures,https://arxiv.org/abs/2603.29592,
ArXiv:cs,Modeling tumor growth with variable mass and angiogenesis-driven perfusion through a 3D-1D coupled framework,https://arxiv.org/abs/2603.29615,
ArXiv:cs,Optimizing Donor Outreach for Blood Collection Sessions: A Scalable Decision Support Framework,https://arxiv.org/abs/2603.29643,
ArXiv:cs,CoRe-DA: Contrastive Regression for Unsupervised Domain Adaptation in Surgical Skill Assessment,https://arxiv.org/abs/2603.29666,
ArXiv:cs,Clinical DVH metrics as a loss function for 3D dose prediction in head and neck radiotherapy,https://arxiv.org/abs/2603.29670,
ArXiv:cs,Exploring the Impact of Skin Color on Skin Lesion Segmentation,https://arxiv.org/abs/2603.29694,
ArXiv:cs,Symphony for Medical Coding: A Next-Generation Agentic System for Scalable and Explainable Medical Coding,https://arxiv.org/abs/2603.29709,
ArXiv:cs,"A Comprehensive Corpus of Biomechanically Constrained Piano Chords: Generation, Analysis, and Implications for Voicing and Psychoacoustics",https://arxiv.org/abs/2603.29710,
ArXiv:cs,Spontaneous Functional Differentiation in Large Language Models: A Brain-Like Intelligence Economy,https://arxiv.org/abs/2603.29735,
ArXiv:cs,CausalPulse: An Industrial-Grade Neurosymbolic Multi-Agent Copilot for Causal Diagnostics in Smart Manufacturing,https://arxiv.org/abs/2603.29755,
ArXiv:cs,Multimodal Machine Learning for Early Prediction of Metastasis in a Swedish Multi-Cancer Cohort,https://arxiv.org/abs/2603.29793,
ArXiv:cs,DiSGMM: A Method for Time-varying Microscopic Weight Completion on Road Networks,https://arxiv.org/abs/2603.29837,
ArXiv:cs,Toward Generalizable Whole Brain Representations with High-Resolution Light-Sheet Data,https://arxiv.org/abs/2603.29842,
ArXiv:cs,An Interactive LLM-Based Simulator for Dementia-Related Activities of Daily Living,https://arxiv.org/abs/2603.29856,
ArXiv:cs,"Perfecting Human-AI Interaction at Clinical Scale. Turning Production Signals into Safer, More Human Conversations",https://arxiv.org/abs/2603.29893,
ArXiv:cs,Less Is More? Selective Visual Attention to High-Importance Regions for Multimodal Radiology Summarization,https://arxiv.org/abs/2603.29901,
ArXiv:cs,Training deep learning based dynamic MR image reconstruction using synthetic fractals,https://arxiv.org/abs/2603.29922,
ArXiv:cs,XR is XR: Rethinking MR and XR as Neutral Umbrella Terms,https://arxiv.org/abs/2603.29939,
ArXiv:cs,Physiological and Semantic Patterns in Medical Teams Using an Intelligent Tutoring System,https://arxiv.org/abs/2603.29950,
ArXiv:cs,NeuroBRIDGE: Behavior-Conditioned Koopman Dynamics with Riemannian Alignment for Early Substance Use Initiation Prediction from Longitudinal Functional Connectome,https://arxiv.org/abs/2603.29960,
ArXiv:cs,SurgTEMP: Temporal-Aware Surgical Video Question Answering with Text-guided Visual Memory for Laparoscopic Cholecystectomy,https://arxiv.org/abs/2603.29962,
ArXiv:cs,Scaling Video Pretraining for Surgical Foundation Models,https://arxiv.org/abs/2603.29966,
ArXiv:cs,Learning Structural-Functional Brain Representations through Multi-Scale Adaptive Graph Attention for Cognitive Insight,https://arxiv.org/abs/2603.29967,
ArXiv:cs,"Trimodal Deep Learning for Glioma Survival Prediction: A Feasibility Study Integrating Histopathology, Gene Expression, and MRI",https://arxiv.org/abs/2603.29968,
ArXiv:cs,SurgNavAR: An Augmented Reality Surgical Navigation Framework for Optical See-Through Head Mounted Displays,https://arxiv.org/abs/2603.29990,
ArXiv:cs,Predicting Neuromodulation Outcome for Parkinson's Disease with Generative Virtual Brain Model,https://arxiv.org/abs/2603.29176,
ArXiv:cs,Retinal Malady Classification using AI: A novel ViT-SVM combination architecture,https://arxiv.org/abs/2603.29181,
ArXiv:cs,Sampling at intermediate temperatures is optimal for training large language models in protein structure prediction,https://arxiv.org/abs/2603.29529,
ArXiv:cs,Four Generations of Quantum Biomedical Sensors,https://arxiv.org/abs/2603.29944,
ArXiv:cs,From Patterns to Policy: A Scoping Review Based on Bibliometric Analysis (ScoRBA) of Intelligent and Secure Smart Hospital Ecosystems,https://arxiv.org/abs/2603.30004,
ArXiv:cs,Generative AI Enables Structural Brain Network Construction from fMRI via Symmetric Diffusion Learning,https://arxiv.org/abs/2309.16205,
ArXiv:cs,Seeing Isn't Orienting: A Cognitively Grounded Benchmark Reveals Systematic Orientation Failures in MLLMs Supplementary,https://arxiv.org/abs/2505.21649,
ArXiv:cs,The Mouth is Not the Brain: Bridging Energy-Based World Models and Language Generation,https://arxiv.org/abs/2601.17094,
ArXiv:cs,When Metrics Disagree: Automatic Similarity vs. LLM-as-a-Judge for Clinical Dialogue Evaluation,https://arxiv.org/abs/2603.00314,
