feed,title,long_url,short_url
j:MDPI:N,The Effectiveness of Transcranial Direct Current Stimulation (tDCS) in Binge Eating Disorder (BED)—Review and Insight into the Mechanisms of Action,https://mdpi.com/2072-6643/16/10/1521,
j:MDPI:N,Post-Transplant Diabetes Mellitus in Kidney-Transplanted Patients: Related Factors and Impact on Long-Term Outcome,https://mdpi.com/2072-6643/16/10/1520,
j:MDPI:N,Combined Lifestyle Interventions in the Prevention and Management of Asthma and COPD: A Systematic Review,https://mdpi.com/2072-6643/16/10/1515,
j:MDPI:N,Oral Microbiota Linking Associations of Dietary Factors with Recurrent Oral Ulcer,https://mdpi.com/2072-6643/16/10/1519,
j:MDPI:N,"Croatian Action on Salt and Health (CRASH): On the Road to Success—Less Salt, More Health",https://mdpi.com/2072-6643/16/10/1518,
j:MDPI:N,Alcohol Exposure and Disease Associations: A Mendelian Randomization and Meta-Analysis on Weekly Consumption and Problematic Drinking,https://mdpi.com/2072-6643/16/10/1517,
j:MDPI:N,Fucoidan Improves D-Galactose-Induced Cognitive Dysfunction by Promoting Mitochondrial Biogenesis and Maintaining Gut Microbiome Homeostasis,https://mdpi.com/2072-6643/16/10/1512,
j:MDPI:N,"Association between Dietary Quality and Non-Alcoholic Fatty Liver Disease in Korean Adults: A Nationwide, Population-Based Study Using the Korean Healthy Eating Index (2013–2021)",https://mdpi.com/2072-6643/16/10/1516,
j:MDPI:N,Effects of Saponins on Lipid Metabolism: The Gut–Liver Axis Plays a Key Role,https://mdpi.com/2072-6643/16/10/1514,
