feed,title,long_url,short_url
GN:T:WP,"Nexif Energy completes 222-MW Aussie wind project, closes refinancing - Renewables Now",https://renewablesnow.com/news/nexif-energy-completes-222-mw-aussie-wind-project-closes-refinancing-782169/,
GN:T:WP,"The US needs to build a bigger, stronger grid. FERC has a plan for… - Canary Media",https://www.canarymedia.com/articles/policy-regulation/the-us-needs-to-build-a-bigger-stronger-grid-ferc-has-a-plan-for-that,
GN:T:WP,US Energy Information Administration - EIA,https://www.eia.gov/todayinenergy/detail.php?id=52178,
GN:T:WP,GUEST VIEW: Some thoughts on wind turbines - Greenville Daily News,https://www.thedailynews.cc/articles/guest-view-some-thoughts-on-wind-turbines/,
GN:T:WP,Montem Resources exploration of renewable energy project in southwestern Alberta raises questions - CBC,https://www.cbc.ca/news/canada/calgary/montem-resources-exploration-of-renewable-energy-project-in-southwestern-alberta-raises-questions-1.6430903,
GN:T:WP,Cyber attack hits upscale Helsinki hotels affecting 15k customers - YLE News,https://yle.fi/news/3-12417602,
GN:T:WP,"Tuesday's papers: Åland conscription, empty flats and Chinese EVs - YLE News",https://yle.fi/news/3-12417531,
