feed,title,long_url,short_url
ArXiv:cs,A Quantitative Comparison between Shannon and Tsallis Havrda Charvat Entropies Applied to Cancer Outcome Prediction,https://arxiv.org/abs/2203.11943v1,
ArXiv:cs,A pseudospectral method for investigating the stability of linear population models with two physiological structures,https://arxiv.org/abs/2203.11998v1,
ArXiv:cs,Bioplastic Design using Multitask Deep Neural Networks,https://arxiv.org/abs/2203.12033v1,
ArXiv:cs,A Unified Substrate for Body-Brain Co-evolution,https://arxiv.org/abs/2203.12066v1,
ArXiv:cs,Learning by non-interfering feedback chemical signaling in physical networks,https://arxiv.org/abs/2203.12098v1,
ArXiv:cs,Muscle Vision: Real Time Keypoint Based Pose Classification of Physical Exercises,https://arxiv.org/abs/2203.12111v1,
ArXiv:cs,Lymphocyte Classification in Hyperspectral Images of Ovarian Cancer Tissue Biopsy Samples,https://arxiv.org/abs/2203.12112v1,
ArXiv:cs,Contrastive Transformer-based Multiple Instance Learning for Weakly Supervised Polyp Frame Detection,https://arxiv.org/abs/2203.12121v1,
ArXiv:cs,Semi-Supervised Hybrid Spine Network for Segmentation of Spine MR Images,https://arxiv.org/abs/2203.12151v1,
ArXiv:cs,Biceph-Net: A robust and lightweight framework for the diagnosis of Alzheimer's disease using 2D-MRI scans and deep similarity learning,https://arxiv.org/abs/2203.12197v1,
ArXiv:cs,Interpretable Prediction of Lung Squamous Cell Carcinoma Recurrence With Self-supervised Learning,https://arxiv.org/abs/2203.12204v1,
ArXiv:cs,MONAI Label: A framework for AI-assisted Interactive Labeling of 3D Medical Images,https://arxiv.org/abs/2203.12362v1,
ArXiv:cs,State and parameter estimation for retinal laser treatment,https://arxiv.org/abs/2203.12452v1,
ArXiv:cs,MT-UDA: Towards Unsupervised Cross-modality Medical Image Segmentation with Limited Source Labels,https://arxiv.org/abs/2203.12454v1,
ArXiv:cs,Multi-agent Searching System for Medical Information,https://arxiv.org/abs/2203.12465v1,
ArXiv:cs,Adaptively Re-weighting Multi-Loss Untrained Transformer for Sparse-View Cone-Beam CT Reconstruction,https://arxiv.org/abs/2203.12476v1,
ArXiv:cs,PhysioMTL: Personalizing Physiological Patterns using Optimal Transport Multi-Task Regression,https://arxiv.org/abs/2203.12595v1,
ArXiv:cs,Improving the Fairness of Chest X-ray Classifiers,https://arxiv.org/abs/2203.12609v1,
ArXiv:cs,Unsupervised Pre-Training on Patient Population Graphs for Patient-Level Predictions,https://arxiv.org/abs/2203.12616v1,
ArXiv:cs,More Knowledge is Better: Cross-Modality Volume Completion and 3D+2D Segmentation for Intracardiac Echocardiography Contouring,https://arxiv.org/abs/1812.03507v3,
ArXiv:cs,Skin Disease Classification versus Skin Lesion Characterization: Achieving Robust Diagnosis using Multi-label Deep Neural Networks,https://arxiv.org/abs/1812.03520v3,
ArXiv:cs,A Deep Multi-task Learning Approach to Skin Lesion Classification,https://arxiv.org/abs/1812.03527v3,
ArXiv:cs,Generative Mask Pyramid Network for CT/CBCT Metal Artifact Reduction with Joint Projection-Sinogram Correction,https://arxiv.org/abs/1907.00294v4,
ArXiv:cs,Rethinking Anticipation Tasks: Uncertainty-aware Anticipation of Sparse Surgical Instrument Usage for Context-aware Assistance,https://arxiv.org/abs/2007.00548v3,
ArXiv:cs,Coupling streaming AI and HPC ensembles to achieve 100-1000x faster biomolecular simulations,https://arxiv.org/abs/2104.04797v3,
ArXiv:cs,Programmable 3D snapshot microscopy with Fourier convolutional networks,https://arxiv.org/abs/2104.10611v4,
ArXiv:cs,LGGNet: Learning from Local-Global-Graph Representations for Brain-Computer Interface,https://arxiv.org/abs/2105.02786v2,
ArXiv:cs,Nonlinear simulation of vascular tumor growth with chemotaxis and the control of necrosis,https://arxiv.org/abs/2107.11701v2,
ArXiv:cs,Code modernization strategies for short-range non-bonded molecular dynamics simulations,https://arxiv.org/abs/2109.10876v2,
ArXiv:cs,Academic vs. Biological Age in Research on Academic Careers: A Large-scale Study with Implications for Scientifically Developing Systems,https://arxiv.org/abs/2111.04477v3,
ArXiv:cs,Omni-Seg: A Single Dynamic Network for Multi-label Renal Pathology Image Segmentation using Partially Labeled Data,https://arxiv.org/abs/2112.12665v2,
ArXiv:cs,Environmental stress level to model tumor cell growth and survival,https://arxiv.org/abs/2201.06985v2,
ArXiv:cs,Towards Visual-Prompt Temporal Answering Grounding in Medical Instructional Video,https://arxiv.org/abs/2203.06667v4,
ArXiv:cs,Root-aligned SMILES for Molecular Retrosynthesis Prediction,https://arxiv.org/abs/2203.11444v2,
