feed,title,long_url,short_url
LitCovid,"[Epidemiological study on the impact of influenza vaccination on the clinical course of patients with COVID-19 and co-infection by both viruses in Gran Canaria, Spain]",https://pubmed.ncbi.nlm.nih.gov/36709415,
LitCovid,Failure to detect SARS-CoV-2 at RNA and protein level in the sweat of patients with COVID-19,https://pubmed.ncbi.nlm.nih.gov/36708033,
LitCovid,Should COVID vaccines be given yearly? Proposal divides US scientists,https://pubmed.ncbi.nlm.nih.gov/36707704,
LitCovid,Cardiovascular Autonomic Dysfunction - a cause of acute Covid-19 complications and persistent post-Covid-19 complaints?,https://pubmed.ncbi.nlm.nih.gov/36708076,
LitCovid,Reduction of the risk of severe COVID-19 due to Omicron compared to Delta variant in Italy (November 2021 - February 2022),https://pubmed.ncbi.nlm.nih.gov/36708869,
LitCovid,In silico identification of microRNAs targeting the PPARalpha/gamma: promising therapeutics for SARS-CoV‑2 infection,https://pubmed.ncbi.nlm.nih.gov/36708330,
LitCovid,"Eruptive pseudoangiomatosis and SARS-CoV-2 infection, a case series",https://pubmed.ncbi.nlm.nih.gov/36708126,
LitCovid,"Correspondence on ""Prognostic significance of complement factors in severely ill patients with COVID-19""",https://pubmed.ncbi.nlm.nih.gov/36707935,
LitCovid,Stricter US guidelines for 'gain-of-function' research are on the way - maybe,https://pubmed.ncbi.nlm.nih.gov/36707714,
LitCovid,Evaluation of both expression and serum protein levels of caspase-8 and mitogen-activated protein kinase 1 genes in patients with different severities of COVID-19 infection,https://pubmed.ncbi.nlm.nih.gov/36708447,
LitCovid,Radiographers' Occupational Health Assessments and their Radiation Exposure during COVID-19 era; A Call for an Action,https://pubmed.ncbi.nlm.nih.gov/36708546,
LitCovid,Seroprevalence of SARS-CoV2 Infections in Health Care Personnel in a Long-Term Care Institution After the First Wave of the Pandemic: A Cross-Sectional Study,https://pubmed.ncbi.nlm.nih.gov/36708002,
LitCovid,"Epidemiology, course, and outcomes of Sars-CoV-2 infection in patients with acromegaly and Cushing's disease: a monocentric experience in Southern Italy",https://pubmed.ncbi.nlm.nih.gov/36708457,
LitCovid,Impact of pre-pandemic sick leave diagnoses on the length of COVID-19-related sick leave: a nationwide registry-based study,https://pubmed.ncbi.nlm.nih.gov/36709256,
LitCovid,Community pharmacists' perceptions and experiences of stress during COVID-19,https://pubmed.ncbi.nlm.nih.gov/36707906,
LitCovid,Long-term passaging of pseudo-typed SARS-CoV-2 reveals the breadth of monoclonal and bispecific antibody cocktails,https://pubmed.ncbi.nlm.nih.gov/36707721,
LitCovid,Differential impacts of COVID-19 variants on human microvascular function,https://pubmed.ncbi.nlm.nih.gov/36708228,
LitCovid,Vulvar Aphthous Ulcers in Perimenarchal Adolescents After COVID-19 Vaccination: A Multicenter Case Series,https://pubmed.ncbi.nlm.nih.gov/36708984,
LitCovid,COVID-19 vaccines and a perspective on Africa,https://pubmed.ncbi.nlm.nih.gov/36709083,
LitCovid,Losing Connection: Experiences of Virtual Pregnancy and Postpartum Care During the COVID-19 Pandemic,https://pubmed.ncbi.nlm.nih.gov/36707747,
LitCovid,"Decline in Veterans' Admissions to Nursing Homes During COVID-19: Fewer Beds, More Fear, and Finding Alternative Care Settings",https://pubmed.ncbi.nlm.nih.gov/36708741,
LitCovid,Assessing the effectiveness of COVID-19 vaccines in Pakistan: a test-negative case-control study,https://pubmed.ncbi.nlm.nih.gov/36708775,
LitCovid,The problem is obtaining knowledge: a qualitative analysis of provider barriers and accelerators to rapid adoption of new treatment in a public health emergency,https://pubmed.ncbi.nlm.nih.gov/36707792,
LitCovid,Inflammatory and vascular biomarkers in post-COVID-19 syndrome: A systematic review and meta-analysis of over 20 biomarkers,https://pubmed.ncbi.nlm.nih.gov/36708022,
LitCovid,Towards evidence-based and inclusive models of peer support for long covid: A hermeneutic systematic review,https://pubmed.ncbi.nlm.nih.gov/36708608,
LitCovid,"The effect of DNA repair gene variants on COVID-19 disease: susceptibility, severity, and clinical course",https://pubmed.ncbi.nlm.nih.gov/36708261,
LitCovid,Time indices of pre-hospital EMS missions before and during the COVID-19 pandemic: a cross-sectional study in Iran,https://pubmed.ncbi.nlm.nih.gov/36707773,
LitCovid,"A short-term follow-up study on breastfeeding practices, growth parameters and immunization practices among babies born to COVID-19 positive mothers in a tertiary care hospital",https://pubmed.ncbi.nlm.nih.gov/36708041,
LitCovid,Seeing the pandemic through children's eyes: exploring Turkish children's views on COVID-19 pandemic by focus-group discussions,https://pubmed.ncbi.nlm.nih.gov/36708023,
LitCovid,Energetic and frustration analysis of SARS-CoV-2 nucleocapsid protein mutations,https://pubmed.ncbi.nlm.nih.gov/36708355,
LitCovid,A Scoping Review of Digital Health Interventions for Combating COVID-19 Misinformation and Disinformation,https://pubmed.ncbi.nlm.nih.gov/36707998,
LitCovid,Peptide nucleic acid and antifouling peptide based biosensor for the non-fouling detection of COVID-19 nucleic acid in saliva,https://pubmed.ncbi.nlm.nih.gov/36708624,
LitCovid,Highly socially vulnerable communities exhibit disproportionately increased viral loads as measured in community wastewater,https://pubmed.ncbi.nlm.nih.gov/36709030,
LitCovid,Decreased plasma H(2)O(2) levels are associated with the pathogenesis leading to COVID-19 worsening and mortality,https://pubmed.ncbi.nlm.nih.gov/36708322,
LitCovid,"Correction: SARS-CoV-2 antibody seroprevalence in Togo: a national cross-sectional household survey, May-June, 2021",https://pubmed.ncbi.nlm.nih.gov/36707780,
LitCovid,Consequences of coronavirus disease in women with breast cancer,https://pubmed.ncbi.nlm.nih.gov/36708196,
LitCovid,Association of acute-to-chronic glycemic ratio and outcomes in patients with COVID-19 and undiagnosed diabetes mellitus: A retrospective nationwide cohort study,https://pubmed.ncbi.nlm.nih.gov/36708095,
LitCovid,Acceptance of COVID-19 vaccine among sub-Saharan Africans (SSA): a comparative study of residents and diasporan dwellers,https://pubmed.ncbi.nlm.nih.gov/36709269,
LitCovid,The recovery of training and education post-COVID-19: the importance of supporting the consultant workforce,https://pubmed.ncbi.nlm.nih.gov/36708341,
LitCovid,"NeoConnect: The Design, Implementation, and Impact of a Virtual Family-Centered NICU Program",https://pubmed.ncbi.nlm.nih.gov/36707750,
LitCovid,"Dissociating COVID-19 from other respiratory infections based on acoustic, motor coordination, and phonemic patterns",https://pubmed.ncbi.nlm.nih.gov/36709368,
LitCovid,"Anxiety, Stress, and Depression Among Healthcare Professionals During the COVID-19 Pandemic: A Cross-Sectional Study in Morocco",https://pubmed.ncbi.nlm.nih.gov/36708313,
LitCovid,The prevalence of mental ill-health in women during pregnancy and after childbirth during the Covid-19 pandemic: a systematic review and Meta-analysis,https://pubmed.ncbi.nlm.nih.gov/36709255,
LitCovid,A qualitative interview study exploring the psychological health impacts of the SPIN-CHAT program among people with systemic sclerosis at the onset of COVID-19: perceptions of trial participants and research team members,https://pubmed.ncbi.nlm.nih.gov/36708187,
LitCovid,"Factors Associated with Chinese Migrant Children's Social Engagement during the COVID-19 Pandemic: A Case Study in Guangzhou City, China",https://pubmed.ncbi.nlm.nih.gov/36707986,
LitCovid,Comparability of control and comparison groups in studies assessing long COVID,https://pubmed.ncbi.nlm.nih.gov/36708796,
LitCovid,Enhancing retention in care in HIV-infected adolescents during COVID-19 in Mozambique: results from the DREAM program,https://pubmed.ncbi.nlm.nih.gov/36708359,
LitCovid,Prevalence and influencing factors of self-medication during the COVID-19 pandemic in the Arab region: a multinational cross-sectional study,https://pubmed.ncbi.nlm.nih.gov/36707840,
LitCovid,Pediatric Project ECHO((R)) for Pain: implementation and mixed methods evaluation of a virtual medical education program to support interprofessional pain management in children and youth,https://pubmed.ncbi.nlm.nih.gov/36709273,
LitCovid,Design of a Nursing Home Infection Control Peer Coaching Program,https://pubmed.ncbi.nlm.nih.gov/36708742,
LitCovid,Mindset and perceived parental support of autonomy safeguard adolescents' autonomous motivation during COVID-19 home-based learning,https://pubmed.ncbi.nlm.nih.gov/36709334,
LitCovid,Medical students remote consulting from home and from the health centre: A survey of prevalence and supervisor perspectives,https://pubmed.ncbi.nlm.nih.gov/36708702,
LitCovid,Plasma from patients with pulmonary embolism show aggregates that reduce after anticoagulation,https://pubmed.ncbi.nlm.nih.gov/36709220,
LitCovid,Virtual Visitation in a Neonatal Intensive Care Unit: Insights From 5 Years Using a PDSA Model to Improve Family-Centered Care,https://pubmed.ncbi.nlm.nih.gov/36707748,
LitCovid,Transdisciplinary entrustable professional activities,https://pubmed.ncbi.nlm.nih.gov/36708704,
LitCovid,Preparing for the Next Pandemic: An After-Action Review of Infection Prevention and Control Audit Strategies Within Airport and Hotel Quarantine Program,https://pubmed.ncbi.nlm.nih.gov/36708334,
LitCovid,An Analysis of Changing U.S. Practice Advisory Guidelines on COVID-19 Vaccine Uptake in Pregnancy.,https://pubmed.ncbi.nlm.nih.gov/36707060,
LitCovid,Enzymatic approaches against SARS-CoV-2 infection with an emphasis on the telomere-associated enzymes,https://pubmed.ncbi.nlm.nih.gov/36707451,
LitCovid,Reply to: COVID-19 Vaccination in Patients who Develop COVID-19 After Cancer Surgery: Correspondence by Mungmunpuntipantip and Wiwanitkit,https://pubmed.ncbi.nlm.nih.gov/36707483,
LitCovid,Gaseous nitric oxide failed to inhibit the replication cycle of SARS-CoV-2 in vitro,https://pubmed.ncbi.nlm.nih.gov/36706864,
LitCovid,Membranous nephropathy after a recent SARS-CoV-2 infection,https://pubmed.ncbi.nlm.nih.gov/36707097,
LitCovid,Accelerated waning of immune responses to a third COVID-19 vaccination in patients with immune-mediated inflammatory diseases,https://pubmed.ncbi.nlm.nih.gov/36706534,
LitCovid,An adventure from a work in progress: Challenges and opportunities of pharmacophylogeny in combat against COVID-19,https://pubmed.ncbi.nlm.nih.gov/36706739,
LitCovid,Covid-19: JCVI recommends autumn vaccine booster for the most vulnerable,https://pubmed.ncbi.nlm.nih.gov/36707081,
LitCovid,SARS-CoV-2 infections in pediatric and young adult recipients of chimeric antigen receptor T-cell therapy: an international registry report,https://pubmed.ncbi.nlm.nih.gov/36707090,
LitCovid,Estimating the proportion of Victorians infected with COVID-19 during the Omicron BA.1 epidemic wave of January 2022 in Australia,https://pubmed.ncbi.nlm.nih.gov/36706552,
LitCovid,Treatment of patients with COVID-19 on hemodialysis: Efficacy of remdesivir,https://pubmed.ncbi.nlm.nih.gov/36707332,
LitCovid,"Neuropsychiatric post-acute sequelae of COVID-19: prevalence, severity, and impact of vaccination",https://pubmed.ncbi.nlm.nih.gov/36707454,
LitCovid,Large-Scale Web Scraping for Problem Gambling Research: A Case Study of COVID-19 Lockdown Effects in Germany,https://pubmed.ncbi.nlm.nih.gov/36707481,
LitCovid,"The role of the HLA allelic repertoire on the clinical severity of COVID-19 in Canadians, living in the Saskatchewan province",https://pubmed.ncbi.nlm.nih.gov/36707385,
LitCovid,Multiomics single timepoint measurements to predict severe COVID-19,https://pubmed.ncbi.nlm.nih.gov/36707187,
LitCovid,"Spatial modeling and socioeconomic inequities of COVID-19 in the urban area of the city of Cali, Colombia",https://pubmed.ncbi.nlm.nih.gov/36707197,
LitCovid,Systematic review and synthesis of stillbirths and late miscarriages following SARS-CoV-2 infections,https://pubmed.ncbi.nlm.nih.gov/36706855,
LitCovid,The Dose- and Time-Dependent Effectiveness and Safety Associated with COVID-19 Vaccination During Pregnancy: A Systematic Review and Meta-analysis,https://pubmed.ncbi.nlm.nih.gov/36707044,
LitCovid,Multiomics single timepoint measurements to predict severe COVID-19 - Authors' reply,https://pubmed.ncbi.nlm.nih.gov/36707188,
LitCovid,Virtual screening and molecular dynamics simulations provide insight into repurposing drugs against SARS-CoV-2 variants Spike protein/ACE2 interface,https://pubmed.ncbi.nlm.nih.gov/36707679,
LitCovid,"Psychotic-like experiences during COVID-19 lockdown among adolescents: Prevalence, risk and protective factors",https://pubmed.ncbi.nlm.nih.gov/36706476,
LitCovid,"Effect of vaccine booster, vaccine type, and hybrid immunity on humoral and cellular immunity against SARS-CoV-2 ancestral strain and Omicron variant sublineages BA.2 and BA.5 among older adults with comorbidities: a cross sectional study",https://pubmed.ncbi.nlm.nih.gov/36706582,
LitCovid,Expanding pediatric services to include adults during the COVID-19 pandemic,https://pubmed.ncbi.nlm.nih.gov/36707148,
LitCovid,Qualitative Study of the Experience of Caring for Women During Labor and Birth During the First Wave of the COVID-19 Pandemic,https://pubmed.ncbi.nlm.nih.gov/36706795,
LitCovid,"National lockdowns in England: The same restrictions for all, but do the impacts on COVID-19 mortality risks vary geographically?",https://pubmed.ncbi.nlm.nih.gov/36707192,
LitCovid,A survey of machine learning-based methods for COVID-19 medical image analysis,https://pubmed.ncbi.nlm.nih.gov/36707488,
LitCovid,Increased demand for orthodontic treatments during the COVID-19 pandemic: a commentary,https://pubmed.ncbi.nlm.nih.gov/36707571,
LitCovid,COVID-19 vaccination among different types of US Healthcare Personnel,https://pubmed.ncbi.nlm.nih.gov/36707335,
LitCovid,COVID-19 and comedications in atrial fibrillation-a case-control study in Stockholm,https://pubmed.ncbi.nlm.nih.gov/36707492,
LitCovid,High-dose intravenous anakinra treatment is safe and effective in severe and critical COVID-19 patients: a propensity score-matched study in a single center,https://pubmed.ncbi.nlm.nih.gov/36707494,
LitCovid,Potential of vibrational spectroscopy coupled with machine learning as a non-invasive diagnostic method for COVID-19,https://pubmed.ncbi.nlm.nih.gov/36706562,
LitCovid,Novel gas exchange analysis in COVID-19 lung disease,https://pubmed.ncbi.nlm.nih.gov/36707227,
LitCovid,Sagittal sinus thrombosis with subarachnoid haemorrhage in a patient with COVID-19 infection,https://pubmed.ncbi.nlm.nih.gov/36707095,
LitCovid,Anxiety and functional impairment affects undergraduate psychology students' learning in remote emergency teaching during the COVID-19 pandemic,https://pubmed.ncbi.nlm.nih.gov/36707652,
LitCovid,The case of T-ALL presenting with NK phenotype after COVID-19 vaccination,https://pubmed.ncbi.nlm.nih.gov/36706586,
LitCovid,Global investments in pandemic preparedness and COVID-19: development assistance and domestic spending on health between 1990 and 2026,https://pubmed.ncbi.nlm.nih.gov/36706770,
LitCovid,"Significantly lower infection fatality rates associated with SARS-CoV-2 Omicron (B.1.1.529) infection in children and young people: active, prospective national surveillance, January-March 2022, England",https://pubmed.ncbi.nlm.nih.gov/36706963,
LitCovid,Fine-scale variation in the effect of national border on COVID-19 spread: A case study of the Saxon-Czech border region,https://pubmed.ncbi.nlm.nih.gov/36707193,
LitCovid,CT imaging of HIV-associated pulmonary disorders in COVID-19 pandemic,https://pubmed.ncbi.nlm.nih.gov/36706642,
LitCovid,Health Belief Model and parents' acceptance of the Pfizer-BioNTech and Sinopharm COVID-19 vaccine for children aged 5-18 years Old: A national survey,https://pubmed.ncbi.nlm.nih.gov/36707336,
LitCovid,Pulmonary embolism in COVID-19 infection: a high case-fatality related to pulmonary embolism characteristics,https://pubmed.ncbi.nlm.nih.gov/36707229,
LitCovid,[TRANSLATED ARTICLE] Efficacy and marginal cost of treatment with tocilizumab in COVID-19 patients,https://pubmed.ncbi.nlm.nih.gov/36707309,
LitCovid,Low-volume label-free SARS-CoV-2 detection with the microcavity-based optical fiber sensor,https://pubmed.ncbi.nlm.nih.gov/36707671,
LitCovid,Novel model prediction time-to-event analysis: data validation and estimation of 200 million cases in the global COVID-19 epidemic,https://pubmed.ncbi.nlm.nih.gov/36707108,
LitCovid,"Telemedicine as an environmental ally - The social, financial, and environmental impact of virtual care in the otolaryngology clinic",https://pubmed.ncbi.nlm.nih.gov/36706717,
LitCovid,Evaluation of cost data associated with pediatric cochlear implantation (CI) throughout 2016-2021,https://pubmed.ncbi.nlm.nih.gov/36706716,
LitCovid,MMViT-Seg: A lightweight transformer and CNN fusion network for COVID-19 segmentation,https://pubmed.ncbi.nlm.nih.gov/36706618,
LitCovid,Proprotein convertases regulate trafficking and maturation of key proteins within the secretory pathway,https://pubmed.ncbi.nlm.nih.gov/36707198,
LitCovid,Capacity building at points of entry during COVID-19 pandemic: harmonising training curriculum for Economic Community of West African States,https://pubmed.ncbi.nlm.nih.gov/36707092,
LitCovid,"An Evaluation of Virtual Care for Gestational Diabetes Using the Quadruple Aim Framework: Assessment of Patient and Provider Experience, Cost and Clinical Outcomes",https://pubmed.ncbi.nlm.nih.gov/36707387,
LitCovid,"Anxiety and depression among people with type 2 diabetes visiting diabetes clinics of Pokhara Metropolitan, Nepal: a cross-sectional study",https://pubmed.ncbi.nlm.nih.gov/36707109,
LitCovid,Interleukin-18-primed human umbilical cord-mesenchymal stem cells achieve superior therapeutic efficacy for severe viral pneumonia via enhancing T-cell immunosuppression,https://pubmed.ncbi.nlm.nih.gov/36707501,
LitCovid,"Implementing an innovative, patient-centered approach to day case arthroplasty: improving patient outcomes through remote preoperative pharmacist consultations",https://pubmed.ncbi.nlm.nih.gov/36707237,
LitCovid,Association between psychosocial factors and satisfaction with communication in family members of intensive care unit patients during COVID-19 pandemic: An exploratory cross-sectional study,https://pubmed.ncbi.nlm.nih.gov/36706497,
