feed,title,long_url,short_url
GN:T:AI,Did this AI chatbot encourage a man to commit suicide? - The Jerusalem Post,https://news.google.com/rss/articles/CBMiT2h0dHBzOi8vd3d3Lmpwb3N0LmNvbS9idXNpbmVzcy1hbmQtaW5ub3ZhdGlvbi90ZWNoLWFuZC1zdGFydC11cHMvYXJ0aWNsZS03MzYyMznSAQA?oc=5,https://da.gd/OQI9
GN:T:AI,Welcome to the era of viral AI generated 'news' images - CNN,https://news.google.com/rss/articles/CBMiT2h0dHBzOi8vd3d3LmNubi5jb20vMjAyMy8wNC8wMi90ZWNoL2FpLWdlbmVyYXRlZC1pbWFnZXMtc29jaWFsLW1lZGlhL2luZGV4Lmh0bWzSAQA?oc=5,https://da.gd/qlgP
GN:T:AI,"People in Emerging Countries More Likely to Trust AI, Study Reveals - Decrypt",https://news.google.com/rss/articles/CBMiWGh0dHBzOi8vZGVjcnlwdC5jby8xMjUzMjkvZW1lcmdpbmctY291bnRyaWVzLW1vcmUtYXJ0aWZpY2lhbC1pbnRlbGxpZ2VuY2UtdHJ1c3QtYWktc3R1ZHnSAV5odHRwczovL2RlY3J5cHQuY28vMTI1MzI5L2VtZXJnaW5nLWNvdW50cmllcy1tb3JlLWFydGlmaWNpYWwtaW50ZWxsaWdlbmNlLXRydXN0LWFpLXN0dWR5P2FtcD0x?oc=5,https://da.gd/2aypK
GN:T:AI,"Paparazzi Photos Were the Scourge of Celebrities. Now, It's AI. - The Wall Street Journal",https://news.google.com/rss/articles/CBMiSGh0dHBzOi8vd3d3Lndzai5jb20vYXJ0aWNsZXMvYWktcGhvdG9zLXBvcGUtZnJhbmNpcy1jZWxlYnJpdGllcy1kZmI2MWYxZNIBAA?oc=5,https://da.gd/6pznEc
GN:T:AI,Nobel laureate Paul Krugman dampens expectations over A.I. like ChatGPT: ‘History suggests large economic effects will take longer than many people seem to expect’ - Fortune,https://news.google.com/rss/articles/CBMiTmh0dHBzOi8vZm9ydHVuZS5jb20vMjAyMy8wNC8wMy9ub2JlbC1sYXVyZWF0ZS1wYXVsLWtydWdtYW4tYWktY2hhdGdwdC1lY29ub215L9IBUmh0dHBzOi8vZm9ydHVuZS5jb20vMjAyMy8wNC8wMy9ub2JlbC1sYXVyZWF0ZS1wYXVsLWtydWdtYW4tYWktY2hhdGdwdC1lY29ub215L2FtcC8?oc=5,https://da.gd/rEFTq
