feed,title,long_url,short_url
MX,Why you can remember every word of a song from 25 years ago—but not why you walked into the room,https://medicalxpress.com/news/2026-03-word-song-years-room.html,
MX,Increased fitness may amplify brain boost following exercise,https://medicalxpress.com/news/2026-03-amplify-brain-boost.html,
MX,The tryptophan switch? Why exercise boosts your mood,https://medicalxpress.com/news/2026-03-tryptophan-boosts-mood.html,
MX,Researcher disputes claim that multilingualism promotes better brain aging,https://medicalxpress.com/news/2026-03-disputes-multilingualism-brain-aging.html,
MX,What does the appendix do? Biologists explain the complicated evolution of this inconvenient organ,https://medicalxpress.com/news/2026-03-appendix-biologists-complicated-evolution-inconvenient.html,
MX,Stay or stray? Why some gut microbes persist after fecal transplants,https://medicalxpress.com/news/2026-03-stay-stray-gut-microbes-persist.html,
MX,Blood immune 'fingerprint' may help predict serious side effects of new Alzheimer's drug,https://medicalxpress.com/news/2026-03-blood-immune-fingerprint-side-effects.html,
MX,"Hidden blood mutations drive severe inflammatory bowel disease, but a new treatment target is in sight",https://medicalxpress.com/news/2026-03-hidden-blood-mutations-severe-inflammatory.html,
