feed,title,long_url,short_url
RS,Independent Risk Factors and Predictive Modeling of Pulmonary Embolism in Patients with Acute Ischemic Stroke,https://www.researchsquare.com/article/rs-8494748/latest,
RS,Physioyoga as a Digital Detox: Exploring the Influence of Sensorimotor Integration on Insomnia and Stress in Smartphone Addicted Individuals - a Feasibility Study,https://www.researchsquare.com/article/rs-8650285/latest,
RS,A real-world study on the impact of hybrid online–offline management on gestational weight gain trajectories and maternal–neonatal outcomes in women with gestational diabetes mellitus,https://www.researchsquare.com/article/rs-8615013/latest,
RS,Environmental protection tax and green total factor productivity in China’s livestock enterprises: causal inference based on double machine learning,https://www.researchsquare.com/article/rs-8152419/latest,
RS,Confidence-guided Outlier Refinement and Collaborative Embedding for Unsupervised Person Re-Identification,https://www.researchsquare.com/article/rs-8466314/latest,
RS,AI-Powered Surveillance for Intelligent Construction Site Management,https://www.researchsquare.com/article/rs-8726539/latest,
RS,Smart Safety Systems: Leveraging AI and Big Data for Real-Time Construction Workforce Management,https://www.researchsquare.com/article/rs-8726485/latest,
RS,Low-complexity pedestrian intent prediction using contextual stacked ensemble learning,https://www.researchsquare.com/article/rs-8639560/latest,
