feed,title,long_url,short_url
LitCovid,Binding and Neutralization Antibody Titers After a Single Vaccine Dose in Health Care Workers Previously Infected With SARS-CoV-2,https://pubmed.ncbi.nlm.nih.gov/33646292,
LitCovid,Title of article: Mucosal-associated invariant T cells in lung diseases,https://pubmed.ncbi.nlm.nih.gov/33647824,
LitCovid,Exploring the association between compliance with measures to prevent the spread of COVID-19 and big five traits with Bayesian generalized linear model,https://pubmed.ncbi.nlm.nih.gov/33642661,
LitCovid,Adhesive rolling of nanoparticles in a lateral flow inspired from diagnostics of COVID-19,https://pubmed.ncbi.nlm.nih.gov/33644275,
LitCovid,Maintaining and maximising motivation to progress scholarly work during challenges times - Reflections from the pandemic,https://pubmed.ncbi.nlm.nih.gov/33641726,
LitCovid,Orde ab Chao Method for Disruptive Innovations Creation (With COVID-19 Pandemic Case Application),https://pubmed.ncbi.nlm.nih.gov/33643108,
LitCovid,"Severe allergic reactions after COVID-19 vaccination with the Pfizer/BioNTech vaccine in Great Britain and USA: Position statement of the German Allergy Societies: Medical Association of German Allergologists (AeDA), German Society for Allergology and Clinical Immunology (DGAKI) and Society for Pediatric Allergology and Environmental Medicine (GPA)",https://pubmed.ncbi.nlm.nih.gov/33643776,
LitCovid,"Delayed Presentation of Patients with Hip Fractures during the COVID-19 ""Stay-at-Home"" Order in the Southmost Region of the United States",https://pubmed.ncbi.nlm.nih.gov/33643668,
LitCovid,Impact of COVID-19 on workload burden of a complex radiotherapy facility,https://pubmed.ncbi.nlm.nih.gov/33646520,
LitCovid,"Young HIV-positive male patient with severe atopic dermatitis on dupilumab and SARS-CoV-2 infection, a pioneer hypothesis",https://pubmed.ncbi.nlm.nih.gov/33644864,
LitCovid,Management protocol for Fournier's gangrene in sanitary regime caused by SARS-CoV-2 pandemic: A case report,https://pubmed.ncbi.nlm.nih.gov/33644187,
LitCovid,Psychiatric Emergencies and the Potential Role of Psychiatric-Mental Health Nurse Practitioners,https://pubmed.ncbi.nlm.nih.gov/33647157,
LitCovid,Low risk of the TMPRSS2 inhibitor camostat mesylate and its metabolite GBPA to act as perpetrators of drug-drug interactions,https://pubmed.ncbi.nlm.nih.gov/33647240,
LitCovid,TAM kinases as regulators of cell death,https://pubmed.ncbi.nlm.nih.gov/33647320,
LitCovid,Nucleic acid visualization assay for Middle East Respiratory Syndrome Coronavirus (MERS-CoV) by targeting the UpE and N gene,https://pubmed.ncbi.nlm.nih.gov/33647020,
LitCovid,[Prospects for the European Union's Budgetary Policy],https://pubmed.ncbi.nlm.nih.gov/33642643,
LitCovid,Trends in appendicectomy during the COVID-19 pandemic,https://pubmed.ncbi.nlm.nih.gov/33640937,
LitCovid,Burnout and professional fulfilment among surgeons during the COVID-19 pandemic,https://pubmed.ncbi.nlm.nih.gov/33640911,
LitCovid,Evaluation of indoor hospital acclimatization of body temperature before COVID-19 fever screening,https://pubmed.ncbi.nlm.nih.gov/33640369,
LitCovid,Novel and Evolving Therapies for COVID-19 Related Pulmonary Complications,https://pubmed.ncbi.nlm.nih.gov/33640363,
LitCovid,New WTO leader faces COVID-19 challenges,https://pubmed.ncbi.nlm.nih.gov/33640051,
LitCovid,Impact of the COVID-19 pandemic on the life-space mobility of older adults with cancer,https://pubmed.ncbi.nlm.nih.gov/33640305,
LitCovid,"Comment on ""The spectrum of COVID-19-associated dermatologic manifestations: An international registry of 716 patients from 31 countries""",https://pubmed.ncbi.nlm.nih.gov/33640510,
LitCovid,Exploring algae and cyanobacteria as a promising natural source of antiviral drug against SARS-CoV-2,https://pubmed.ncbi.nlm.nih.gov/33640332,
LitCovid,Gianotti-crosti syndrome in the setting of recent coronavirus disease-19 infection,https://pubmed.ncbi.nlm.nih.gov/33641205,
LitCovid,"Reply To ""Comment on 'The spectrum of COVID-19-associated dermatologic manifestations: an international registry of 716 patients from 31 countries'""",https://pubmed.ncbi.nlm.nih.gov/33640507,
LitCovid,Acute myelopathies associated to SARS-CoV-2 infection: viral or immune-mediated damage?,https://pubmed.ncbi.nlm.nih.gov/33640477,
LitCovid,"COVID-19, children and schools: overlooked and at risk",https://pubmed.ncbi.nlm.nih.gov/33641173,
LitCovid,"COVID-19, children and schools: overlooked and at risk",https://pubmed.ncbi.nlm.nih.gov/33641174,
LitCovid,"COVID-19, children and schools: overlooked and at risk",https://pubmed.ncbi.nlm.nih.gov/33641177,
LitCovid,"COVID-19, children and schools: overlooked and at risk",https://pubmed.ncbi.nlm.nih.gov/33641179,
LitCovid,"COVID-19, children and schools: overlooked and at risk",https://pubmed.ncbi.nlm.nih.gov/33641176,
LitCovid,Sudden neck swelling with rash as late manifestation of COVID-19: a case report,https://pubmed.ncbi.nlm.nih.gov/33639889,
LitCovid,Acute transverse myelitis with Dysautonomia following SARS-CoV-2 infection: A case report and review of literature,https://pubmed.ncbi.nlm.nih.gov/33640717,
LitCovid,Intracranial Hypertension in Multisystem Inflammatory Syndrome in Children (MIS-C),https://pubmed.ncbi.nlm.nih.gov/33640331,
LitCovid,COVID-19 impacts on dermatologic surgery patients: a single institution experience,https://pubmed.ncbi.nlm.nih.gov/33640504,
LitCovid,COVID-19 illness and autoimmune diseases: recent insights,https://pubmed.ncbi.nlm.nih.gov/33640999,
LitCovid,Peruvian COVID-19 vaccine scandal spreads,https://pubmed.ncbi.nlm.nih.gov/33640052,
LitCovid,The Impact of the COVID-19 Pandemic on Journal Scholarly Activity Among Female Contributors,https://pubmed.ncbi.nlm.nih.gov/33640339,
LitCovid,Historical evidence to inform COVID-19 vaccine mandates,https://pubmed.ncbi.nlm.nih.gov/33640058,
LitCovid,COVID-19 and clinician wellbeing: challenges and opportunities,https://pubmed.ncbi.nlm.nih.gov/33640073,
LitCovid,Acute appendicitis during the COVID-19 lockdown: never waste a crisis!,https://pubmed.ncbi.nlm.nih.gov/33640949,
LitCovid,A new model to prioritize waiting lists for elective surgery under the COVID-19 pandemic pressure,https://pubmed.ncbi.nlm.nih.gov/33640936,
LitCovid,The indirect impacts of COVID-19 on Aboriginal communities across New South Wales,https://pubmed.ncbi.nlm.nih.gov/33641165,
LitCovid,Gastro-intestinal symptoms are associated with a lower in-hospital mortality rate in frail older patients hospitalized for COVID-19,https://pubmed.ncbi.nlm.nih.gov/33639706,
LitCovid,Universal preoperative SARS-CoV-2 testing can facilitate safe surgical treatment during local COVID-19 surges,https://pubmed.ncbi.nlm.nih.gov/33640925,
LitCovid,Timing and clinical outcomes of tracheostomy in patients with COVID-19,https://pubmed.ncbi.nlm.nih.gov/33640938,
LitCovid,Towards a full capacity of anaesthesia and surgical services in the epicenter (Wuhan) of the COVID-19 epidemic,https://pubmed.ncbi.nlm.nih.gov/33640907,
LitCovid,COVID-19 vaccines for patients with cancer: benefits likely outweigh risks,https://pubmed.ncbi.nlm.nih.gov/33640005,
LitCovid,Safe infection prevention and control practices with compassion - A positive legacy of COVID-19,https://pubmed.ncbi.nlm.nih.gov/33640111,
LitCovid,Comment on: Acute pancreatitis in a COVID-19 patient,https://pubmed.ncbi.nlm.nih.gov/33640914,
LitCovid,Harnessing unique experiences to build competence: Medical student engagement in frontline care during the COVID-19 pandemic,https://pubmed.ncbi.nlm.nih.gov/33641110,
LitCovid,"Inflammation, immunity and potential target therapy of SARS-COV-2: a total scale analysis review",https://pubmed.ncbi.nlm.nih.gov/33640537,
LitCovid,Developing a prioritization model for endoscopy and colorectal cancer 2-week wait referrals during the COVID-19 pandemic-is faecal immunochemical testing the answer?,https://pubmed.ncbi.nlm.nih.gov/33640923,
LitCovid,Prospective serological evaluation of anti SARS-CoV-2 IgG and anti S1-RBD antibodies in a community outbreak,https://pubmed.ncbi.nlm.nih.gov/33641271,
LitCovid,COVID-19: a test of evidence-based surgery,https://pubmed.ncbi.nlm.nih.gov/33640945,
LitCovid,COVID-19 and the reintroduction of surgical training,https://pubmed.ncbi.nlm.nih.gov/33640942,
LitCovid,Prevention of healthcare-associated respiratory-viral infections amongst oncology inpatients: Infection prevention outcomes during coronavirus disease-2019 pandemic,https://pubmed.ncbi.nlm.nih.gov/33640740,
LitCovid,Nursing home visitation restrictions during COVID-19-Balancing compassion and safety,https://pubmed.ncbi.nlm.nih.gov/33640112,
LitCovid,"Proximity to International Airports and Early Transmission of COVID-19 in the United States-An Epidemiological Assessment of the Geographic Distribution of 490,000 Cases",https://pubmed.ncbi.nlm.nih.gov/33640475,
LitCovid,Surgical management and outcome of patients with thyroid disease during the COVID-19 pandemic,https://pubmed.ncbi.nlm.nih.gov/33640933,
LitCovid,Impact of COVID-19 on operative experience of junior surgical trainees,https://pubmed.ncbi.nlm.nih.gov/33640935,
LitCovid,A multicenter analysis of the clinical microbiology and antimicrobial usage in hospitalized patients in the US with or without COVID-19,https://pubmed.ncbi.nlm.nih.gov/33639862,
LitCovid,Berberine reduces circulating inflammatory mediators in patients with severe COVID-19,https://pubmed.ncbi.nlm.nih.gov/33640910,
LitCovid,"Effects of the COVID-19 lockdown on mental health, wellbeing, sleep, and alcohol use in a UK student sample",https://pubmed.ncbi.nlm.nih.gov/33640864,
LitCovid,Strengths and limitations of video-conference multidisciplinary management of breast disease during the COVID-19 pandemic,https://pubmed.ncbi.nlm.nih.gov/33640926,
LitCovid,Artificial intelligence enabled preliminary diagnosis for COVID-19 from voice cues and questionnaires,https://pubmed.ncbi.nlm.nih.gov/33639822,
LitCovid,Chest CT findings in RT-PCR positive asymptomatic COVID-19 patients,https://pubmed.ncbi.nlm.nih.gov/33640789,
LitCovid,Monitoring the evolving impact of COVID-19 on institutional surgical services: imperative for quality improvement platforms,https://pubmed.ncbi.nlm.nih.gov/33640919,
LitCovid,COVID-19 hindering progress against female genital mutilation,https://pubmed.ncbi.nlm.nih.gov/33640072,
LitCovid,[An example of Clinical Investigations Center reorganization during the COVID-19 pandemic French national lockdown],https://pubmed.ncbi.nlm.nih.gov/33640116,
LitCovid,Experiences and Short-Term Outcomes of Kidney Transplantation During the Coronavirus Disease 2019 Pandemic From a Medium-Volume Transplantation and Superregional Coronavirus Disease 2019 Treatment Center,https://pubmed.ncbi.nlm.nih.gov/33640166,
LitCovid,Antibody response to first BNT162b2 dose in previously SARS-CoV-2-infected individuals,https://pubmed.ncbi.nlm.nih.gov/33640038,
LitCovid,Migrant health is public health: a call for equitable access to COVID-19 vaccines,https://pubmed.ncbi.nlm.nih.gov/33640075,
LitCovid,Osteoporosis care amidst the prolonged pandemic,https://pubmed.ncbi.nlm.nih.gov/33641061,
LitCovid,Correspondence Global COVID-19 Vaccine Equity Should Precede Requiring Travelers Proof of Vaccination,https://pubmed.ncbi.nlm.nih.gov/33640569,
LitCovid,Social distancing for COVID-19 decreased infectious diseases in children,https://pubmed.ncbi.nlm.nih.gov/33640227,
LitCovid,Comment on: COVID 19 and the race to publish: an ethical issue,https://pubmed.ncbi.nlm.nih.gov/33640913,
LitCovid,Impact in total ischemic time and ST-segment elevation myocardial infarction admissions during COVID-19,https://pubmed.ncbi.nlm.nih.gov/33640628,
LitCovid,Serum calprotectin as a novel biomarker for severity of COVID-19 disease,https://pubmed.ncbi.nlm.nih.gov/33641087,
LitCovid,"Impact of COVID 19 on the provision of surgical services in Ontario, Canada: population-based analysis",https://pubmed.ncbi.nlm.nih.gov/33640924,
LitCovid,Effects of COVID-19 Pandemic on the Treatment of Pancreatic Cancer: A Perspective from Central Europe,https://pubmed.ncbi.nlm.nih.gov/33640885,
LitCovid,Safety and adverse events of urgent elective surgery during COVID-19 within three UK hospitals,https://pubmed.ncbi.nlm.nih.gov/33640929,
LitCovid,The impact of the coronavirus disease 2019 epidemic on notifiable infectious diseases in Taiwan: a database analysis,https://pubmed.ncbi.nlm.nih.gov/33640476,
LitCovid,RNase in the saliva can affect the detection of severe acute respiratory syndrome coronavirus 2 by real-time one-step polymerase chain reaction using saliva samples,https://pubmed.ncbi.nlm.nih.gov/33640711,
LitCovid,Comments on: Patterns of acute surgical inflammatory processes presentation of in the COVID-19 outbreak (PIACO Study): surgery may be the best treatment option,https://pubmed.ncbi.nlm.nih.gov/33640954,
LitCovid,Comment on: Patterns of acute surgical inflammatory processes presentation of in the COVID-19 outbreak (PIACO Study): surgery may be the best treatment option,https://pubmed.ncbi.nlm.nih.gov/33640915,
LitCovid,Comment on: Patterns of acute surgical inflammatory processes presentation of in the COVID-19 outbreak (PIACO Study): surgery may be the best treatment option,https://pubmed.ncbi.nlm.nih.gov/33640953,
LitCovid,Breastfeeding and COVID-19 vaccination: position statement of the Italian scientific societies,https://pubmed.ncbi.nlm.nih.gov/33639998,
LitCovid,COVID-19 and Mycobacterium Tuberculosis Coinfection: A Case Report,https://pubmed.ncbi.nlm.nih.gov/33641155,
LitCovid,Comment on: Pre-operative CT chest as a screening tool for COVID-19: an appraisal of current evidence,https://pubmed.ncbi.nlm.nih.gov/33640916,
LitCovid,Structure-activity relationship (SAR) and molecular dynamics study of withaferin-A fragment derivatives as potential therapeutic lead against main protease (M(pro)) of SARS-CoV-2,https://pubmed.ncbi.nlm.nih.gov/33641023,
LitCovid,The Mood-5 (M5): A New Scale for Detecting COVID-19 Psychological Burden in Post-acute and Long-term Care Residents,https://pubmed.ncbi.nlm.nih.gov/33640866,
LitCovid,Inhibitors of endosomal acidification suppress SARS-CoV-2 replication and relieve viral pneumonia in hACE2 transgenic mice,https://pubmed.ncbi.nlm.nih.gov/33639976,
LitCovid,A sustainable mental health care delivery model for severe mental illness during COVID-19,https://pubmed.ncbi.nlm.nih.gov/33640699,
LitCovid,"Cancer, Mortality, and Acute Kidney Injury among Hospitalized Patients with SARS-CoV-2 Infection",https://pubmed.ncbi.nlm.nih.gov/33639668,
LitCovid,Resource requirements for reintroducing elective surgery during the COVID-19 pandemic: modelling study,https://pubmed.ncbi.nlm.nih.gov/33640927,
LitCovid,Illegal and Legal Wildlife Trade Spreads Zoonotic Diseases,https://pubmed.ncbi.nlm.nih.gov/33640271,
LitCovid,Author response to: Comment on: COVID 19 and the race to publish: an ethical issue,https://pubmed.ncbi.nlm.nih.gov/33640912,
LitCovid,"Allergic reactions including anaphylaxis after receipt of the first dose of Pfizer-BioNTech COVID-19 vaccine - United States, December 14-23, 2020",https://pubmed.ncbi.nlm.nih.gov/33641264,
LitCovid,Administration of high titer convalescent anti-SARS-CoV-2 plasma: From donor selection to monitoring recipient outcomes,https://pubmed.ncbi.nlm.nih.gov/33640208,
LitCovid,"Reply to Letter to Editor Regarding ""Economic Impact of COVID-19 on a High-Volume Academic Neurosurgical Practice """,https://pubmed.ncbi.nlm.nih.gov/33640530,
LitCovid,Phenotypes and Subphenotypes of Patients with COVID-19: a Latent Class Modeling Analysis,https://pubmed.ncbi.nlm.nih.gov/33640378,
LitCovid,Author response to: Comment on: Patterns of acute surgical inflammatory processes presentation of in the COVID-19 outbreak (PIACO Study): surgery may be the best treatment option,https://pubmed.ncbi.nlm.nih.gov/33640951,
LitCovid,Hospital admissions of acute cerebrovascular diseases during and after the first wave of the COVID-19 pandemic: a state-wide experience from Austria,https://pubmed.ncbi.nlm.nih.gov/33641003,
LitCovid,"Allergic reactions including anaphylaxis after receipt of the first dose of Moderna COVID-19 vaccine - United States, December 21, 2020-January 10, 2021",https://pubmed.ncbi.nlm.nih.gov/33641268,
LitCovid,Effect of previous SARS-CoV-2 infection on humoral and T-cell responses to single-dose BNT162b2 vaccine,https://pubmed.ncbi.nlm.nih.gov/33640037,
LitCovid,No Escape: COVID-19 Continues to Exacerbate Physician Burnout,https://pubmed.ncbi.nlm.nih.gov/33641118,
LitCovid,Age and multimorbidities as poor prognostic factors for COVID-19 in hemodialysis: a Lebanese national study,https://pubmed.ncbi.nlm.nih.gov/33639881,
LitCovid,SARS-CoV-2 infection and recurrence of anti-glomerular basement disease: a case report,https://pubmed.ncbi.nlm.nih.gov/33639869,
LitCovid,Can bilirubin nanomedicine become a hope for the management of COVID-19?,https://pubmed.ncbi.nlm.nih.gov/33640714,
LitCovid,Accurately Discriminating COVID-19 from Viral and Bacterial Pneumonia According to CT Images Via Deep Learning,https://pubmed.ncbi.nlm.nih.gov/33641077,
LitCovid,The mental health impact of COVID-19 outbreak: a Nationwide Survey in Iran,https://pubmed.ncbi.nlm.nih.gov/33640006,
LitCovid,Emulsion-based isothermal nucleic acid amplification for rapid SARS-CoV-2 detection via angle-dependent light scatter analysis,https://pubmed.ncbi.nlm.nih.gov/33640656,
LitCovid,Arterial Oxygen Saturation and other Clinical Predictors of Survival in Patients with Covid-19: A Review of Cases in a Tertiary Care Hospital in Nigeria,https://pubmed.ncbi.nlm.nih.gov/33641143,
LitCovid,The lab-confirmed interval of COVID-19 clusters and its application in the strength evaluation of prevention and control measures,https://pubmed.ncbi.nlm.nih.gov/33639863,
LitCovid,The influence of interpersonal relationships on school adaptation among Chinese university students during COVID-19 control period: Multiple mediating roles of social support and resilience,https://pubmed.ncbi.nlm.nih.gov/33640862,
LitCovid,Current Practice Trends in Primary Hip and Knee Arthroplasties Among Members of the American Association of Hip and Knee Surgeons: An Update During the COVID-19 Pandemic,https://pubmed.ncbi.nlm.nih.gov/33640185,
LitCovid,"""Comment on the article titled ""Nosocomial SARS-CoV-2 transmission in postoperative infection and mortality: analysis of 14 798 procedures"" by Elliott JA et al",https://pubmed.ncbi.nlm.nih.gov/33640939,
LitCovid,Ginkgolic acid and anacardic acid are specific covalent inhibitors of SARS-CoV-2 cysteine proteases,https://pubmed.ncbi.nlm.nih.gov/33640032,
LitCovid,"Reply to Comment on the article titled 'Nosocomial SARS-CoV-2 transmission in postoperative infection and mortality: analysis of 14,798 procedures' by Elliott JA et al",https://pubmed.ncbi.nlm.nih.gov/33640944,
LitCovid,Remote sociophonetic data collection: Vowels and nasalization over video conferencing apps,https://pubmed.ncbi.nlm.nih.gov/33639821,
LitCovid,"Results of a Randomized Trial Testing the Efficacy of Tele-Savvy, an Online Synchronous/Asynchronous Psychoeducation Program for Family Caregivers of Persons Living with Dementia",https://pubmed.ncbi.nlm.nih.gov/33640979,
