feed,title,long_url,short_url
LitCovid,Encephalitis in a Pandemic,https://pubmed.ncbi.nlm.nih.gov/33643210,
LitCovid,"Environmental investigation of SARS-CoV-2 in a karaoke bar: a survey for a cluster of COVID-19 in Hokkaido, Japan, 2020",https://pubmed.ncbi.nlm.nih.gov/33642436,
LitCovid,Christmas Festivities and COVID-19: A Foreseeable Risk to Anticipate,https://pubmed.ncbi.nlm.nih.gov/33643983,
LitCovid,AORN Guidelines in the Era of COVID-19,https://pubmed.ncbi.nlm.nih.gov/33646578,
LitCovid,Obesity and COVID-19: A Forgotten Relationship,https://pubmed.ncbi.nlm.nih.gov/33641710,
LitCovid,Diagnosis of infection by SARS-COV-2: Is one molecular test enough?,https://pubmed.ncbi.nlm.nih.gov/33642119,
LitCovid,Satisfaction of Pregnant Women in an Obstetric Ultrasound Unit During the COVID-19 Pandemic,https://pubmed.ncbi.nlm.nih.gov/33641706,
LitCovid,Depression and COVID-19 patients with chronic pain: practical considerations,https://pubmed.ncbi.nlm.nih.gov/33642852,
LitCovid,Overview of Current International Recommendations for Echocardiography Exams During the Covid-19 Pandemic and Its Local Implementation in Austria,https://pubmed.ncbi.nlm.nih.gov/33644131,
LitCovid,"Novel Mutation of SARS-CoV-2, Vietnam, July 2020",https://pubmed.ncbi.nlm.nih.gov/33647228,
LitCovid,The find of COVID-19 vaccine: Challenges and opportunities,https://pubmed.ncbi.nlm.nih.gov/33647555,
LitCovid,COVID-19 croup: Solitary infections and a coinfection case - author reply to a letter,https://pubmed.ncbi.nlm.nih.gov/33642126,
LitCovid,COVID-19 at 1 Year: American Heart Association Presidents Reflect on the Pandemic,https://pubmed.ncbi.nlm.nih.gov/33646828,
LitCovid,Digestive system involvement of infections with SARS-CoV-2 and other coronaviruses: Clinical manifestations and potential mechanisms,https://pubmed.ncbi.nlm.nih.gov/33642829,
LitCovid,[Role of university hospitals in Bavaria during the COVID-19 pandemic],https://pubmed.ncbi.nlm.nih.gov/33646331,
LitCovid,Sleep and Covid-19,https://pubmed.ncbi.nlm.nih.gov/33642266,
LitCovid,"Chest CT in ""Post"" COVID-19: What the Radiologist Must Know",https://pubmed.ncbi.nlm.nih.gov/33646900,
LitCovid,Insight into the COVID-19 led slow-down in TB notifications in India,https://pubmed.ncbi.nlm.nih.gov/33641836,
LitCovid,Bereavement management during COVID-19 Pandemic: One size may not fit all!,https://pubmed.ncbi.nlm.nih.gov/33643619,
LitCovid,[Obsessive-Compulsive Disorder in Times of COVID-19: A New Pandemic?],https://pubmed.ncbi.nlm.nih.gov/33641707,
LitCovid,"No evidence of SARS-CoV-2 circulation in the framework of influenza surveillance between October 2019 and February 2020 in Lombardy, Italy",https://pubmed.ncbi.nlm.nih.gov/33647467,
LitCovid,Post-COVID-19 heart syndrome,https://pubmed.ncbi.nlm.nih.gov/33645626,
LitCovid,COVID-19: Molecular and Cellular Response,https://pubmed.ncbi.nlm.nih.gov/33643932,
LitCovid,"A mini review on the pathogenesis, diagnosis and treatment options for COVID-19",https://pubmed.ncbi.nlm.nih.gov/33645489,
LitCovid,[Collapse of Transfer Flows: Impact of the COVID-19 Pandemic on Professional Football],https://pubmed.ncbi.nlm.nih.gov/33642650,
LitCovid,"COVID-19: Immunology, Immunopathogenesis and Potential Therapies",https://pubmed.ncbi.nlm.nih.gov/33641587,
LitCovid,Unexplained elevation of erythrocyte sedimentation rate in a patient recovering from COVID-19: A case report,https://pubmed.ncbi.nlm.nih.gov/33644207,
LitCovid,"[COVID-19 and public health: knowledge, attitudes, stresses, and communication in the crisis : Reflections on the initial situation in the population and on official communication strategies in the COVID-19 pandemic]",https://pubmed.ncbi.nlm.nih.gov/33646322,
LitCovid,In Reply: Thrombotic Neurovascular Disease in COVID-19 Patients,https://pubmed.ncbi.nlm.nih.gov/33647988,
LitCovid,COVID-19: Potential Repurposing Drugs,https://pubmed.ncbi.nlm.nih.gov/33645490,
LitCovid,MOG-associated encephalitis following SARS-COV-2 infection,https://pubmed.ncbi.nlm.nih.gov/33647592,
LitCovid,COVID-19 Reinfection,https://pubmed.ncbi.nlm.nih.gov/33643719,
LitCovid,"Rapid, Ultrasensitive, and Highly Specific Diagnosis of COVID-19 by CRISPR-Based Detection",https://pubmed.ncbi.nlm.nih.gov/33645226,
LitCovid,On-board toilets of long-haul flights: is sewage epidemiology effective for COVID-19 global surveillance?,https://pubmed.ncbi.nlm.nih.gov/33647466,
LitCovid,FDA authorizes Pfizer-BioNTech COVID-19 vaccine,https://pubmed.ncbi.nlm.nih.gov/33646996,
LitCovid,Management of Malaria in Children Younger Than 5 Years Old During Coronavirus Disease 2019 Pandemic in Sierra Leone: A Lesson Learned?,https://pubmed.ncbi.nlm.nih.gov/33643963,
LitCovid,Chest-CT mimics of COVID-19 pneumonia-a review article,https://pubmed.ncbi.nlm.nih.gov/33646498,
LitCovid,An ethical conundrum: Palliative care in the COVID-19 pandemic,https://pubmed.ncbi.nlm.nih.gov/33641698,
LitCovid,Risk Compensation and COVID-19 Vaccines,https://pubmed.ncbi.nlm.nih.gov/33646837,
LitCovid,COVID-19 and Disenfranchised Grief,https://pubmed.ncbi.nlm.nih.gov/33643101,
LitCovid,"The Age Structure, Stringency Policy, Income, and Spread of Coronavirus Disease 2019: Evidence From 209 Countries",https://pubmed.ncbi.nlm.nih.gov/33643117,
LitCovid,Acute transverse myelitis attributed to SARS-CoV-2 infection presenting as impaired mobility: a case report,https://pubmed.ncbi.nlm.nih.gov/33646523,
LitCovid,"Knowledge, Attitudes, and Practices of the Pakistani Population Regarding Facemasks During the COVID-19 Pandemic",https://pubmed.ncbi.nlm.nih.gov/33645264,
LitCovid,Revisiting the Quarantine Concept Amid the COVID-19 Pandemic,https://pubmed.ncbi.nlm.nih.gov/33645259,
LitCovid,Changes in social anxiety symptoms and loneliness after increased isolation during the COVID-19 pandemic,https://pubmed.ncbi.nlm.nih.gov/33647703,
LitCovid,Kidney Disorders as Serious Adverse Drug Reactions of Remdesivir in Covid-19: A Retrospective Case-Non case Study,https://pubmed.ncbi.nlm.nih.gov/33647327,
LitCovid,An examination of Thailand's health care system and strategies during the management of the COVID-19 pandemic,https://pubmed.ncbi.nlm.nih.gov/33643614,
LitCovid,Recent updates in COVID-19 with emphasis on inhalation therapeutics: Nanostructured and targeting systems,https://pubmed.ncbi.nlm.nih.gov/33643448,
LitCovid,Virus-associated ribozymes and nano carriers against COVID-19,https://pubmed.ncbi.nlm.nih.gov/33645342,
LitCovid,Early intervention in psychosis during the COVID-19 pandemic: Maudsley recommendations,https://pubmed.ncbi.nlm.nih.gov/33642195,
LitCovid,Silent suffering of the dying and their families: impact of COVID-19,https://pubmed.ncbi.nlm.nih.gov/33645873,
LitCovid,Epidemiology and clinical course of severe acute respiratory syndrome coronavirus 2 infection in cancer patients in the Veneto Oncology Network: The Rete Oncologica Veneta covID19 study,https://pubmed.ncbi.nlm.nih.gov/33647547,
LitCovid,COVID-19 in Kyrgyzstan: Navigating a way out,https://pubmed.ncbi.nlm.nih.gov/33643630,
LitCovid,Case Report: Insulin-Dependent Diabetes Mellitus and Diabetic Keto-Acidosis in a Child With COVID-19,https://pubmed.ncbi.nlm.nih.gov/33643977,
LitCovid,[Treatment strategy and thought on classical herbal formulae for coronavirus disease 2019],https://pubmed.ncbi.nlm.nih.gov/33645139,
LitCovid,We Are All in This Together: COVID-19 and a Call to Action for Mental Health of Children and Adolescents,https://pubmed.ncbi.nlm.nih.gov/33643080,
LitCovid,"Commentary on ""Use of Anakinra to Prevent Mechanical Ventilation in Severe COVID-19: A Case Series."": COVID-19 disease in patients with recurrent pericarditis during treatment with anakinra",https://pubmed.ncbi.nlm.nih.gov/33644988,
LitCovid,Factors Associated with a prolonged negative conversion of viral RNA in patients with Coronavirus Disease 2019 (COVID-19),https://pubmed.ncbi.nlm.nih.gov/33647508,
LitCovid,Challenges and potential solutions in the development of COVID-19 pandemic control measures,https://pubmed.ncbi.nlm.nih.gov/33643657,
LitCovid,COVID-19 and the tsunami of information,https://pubmed.ncbi.nlm.nih.gov/33645504,
LitCovid,XCOVNet: Chest X-ray Image Classification for COVID-19 Early Detection Using Convolutional Neural Networks,https://pubmed.ncbi.nlm.nih.gov/33642663,
LitCovid,"""The Tragedy of the Commons"": How Individualism and Collectivism Affected the Spread of the COVID-19 Pandemic",https://pubmed.ncbi.nlm.nih.gov/33643992,
LitCovid,Early Diffusion of SARS-CoV-2 Infection in the Inner Area of the Italian Sardinia Island,https://pubmed.ncbi.nlm.nih.gov/33643227,
LitCovid,Effect of a novel viral filter on cardiopulmonary exercise testing during the COVID-19 pandemic,https://pubmed.ncbi.nlm.nih.gov/33647166,
LitCovid,"Open Schools, Covid-19, and Child and Teacher Morbidity in Sweden",https://pubmed.ncbi.nlm.nih.gov/33646647,
LitCovid,"Open Schools, Covid-19, and Child and Teacher Morbidity in Sweden",https://pubmed.ncbi.nlm.nih.gov/33646648,
LitCovid,[Implications of the restriction of family visits due to the COVID-19 pandemic and the growth-development of the premature in the Intensive Care Unit],https://pubmed.ncbi.nlm.nih.gov/33647636,
LitCovid,Seasonal Variation and COVID-19 Infection Pattern: A Gap from Evidence to Reality,https://pubmed.ncbi.nlm.nih.gov/33644502,
LitCovid,XLVets practitioners provide online extramural studies during Covid-19,https://pubmed.ncbi.nlm.nih.gov/33645757,
LitCovid,"Nursing Homes, COVID-19, And More",https://pubmed.ncbi.nlm.nih.gov/33646882,
LitCovid,Pakistan and COVID-19: The mystery of the flattened curve,https://pubmed.ncbi.nlm.nih.gov/33643623,
LitCovid,Modalities and Mechanisms of Treatment for Coronavirus Disease 2019,https://pubmed.ncbi.nlm.nih.gov/33643033,
LitCovid,Evacuation of Residents in a Natural Disaster during the COVID-19 Era,https://pubmed.ncbi.nlm.nih.gov/33647970,
LitCovid,The hidden dangers of staying home: a London trauma unit experience of lockdown during the COVID-19 virus pandemic,https://pubmed.ncbi.nlm.nih.gov/33645278,
LitCovid,Guidelines for managing people with lymphoedema remotely: a post-COVID-19 response document,https://pubmed.ncbi.nlm.nih.gov/33641394,
LitCovid,Positive ratio of polymerase chain reaction (PCR) and validity of pre-screening criteria at an outpatient screening center during the early phase of the COVID-19 epidemic in Japan,https://pubmed.ncbi.nlm.nih.gov/33642432,
LitCovid,From lionizing to protecting health care workers during and after COVID-19-systems solutions for human tragedies,https://pubmed.ncbi.nlm.nih.gov/33647178,
LitCovid,COVID-19 anosmia and gustatory symptoms as a prognosis factor: a subanalysis of the HOPE COVID-19 (Health Outcome Predictive Evaluation for COVID-19) registry,https://pubmed.ncbi.nlm.nih.gov/33646505,
LitCovid,COVID-19: A call for awareness or mandatory vaccination even in pandemics?,https://pubmed.ncbi.nlm.nih.gov/33643615,
LitCovid,SARS-CoV-2 as Well as Anti-COVID-19 Treatment May Cause Rhabdomyolysis,https://pubmed.ncbi.nlm.nih.gov/33645298,
LitCovid,Neurologic manifestations of COVID-19,https://pubmed.ncbi.nlm.nih.gov/33641320,
LitCovid,Evaluation of China's public health system response to COVID-19,https://pubmed.ncbi.nlm.nih.gov/33643637,
LitCovid,Advancing ambulatory pharmacy practice through a crisis: Objectives and strategies used in an ambulatory care action team's response to the COVID-19 pandemic,https://pubmed.ncbi.nlm.nih.gov/33647947,
LitCovid,Alcohol Sales and Alcohol-Related Emergencies During the COVID-19 Pandemic,https://pubmed.ncbi.nlm.nih.gov/33646838,
LitCovid,The Impacts of SARS-CoV-2 Pandemic on Suicide: A Lexical Analysis,https://pubmed.ncbi.nlm.nih.gov/33643089,
LitCovid,Initiation of an inter-hospital extracorporeal membrane oxygenation transfer programme for critically ill patients with coronavirus disease 2019: bringing extracorporeal membrane oxygenation support to peripheral hospitals,https://pubmed.ncbi.nlm.nih.gov/33647975,
LitCovid,The Immunopathology of COVID-19 and the Cannabis Paradigm,https://pubmed.ncbi.nlm.nih.gov/33643316,
LitCovid,Impact of coronavirus disease 2019 in a child who underwent ventricular septal defect device closure: a case report,https://pubmed.ncbi.nlm.nih.gov/33644647,
LitCovid,"Open Schools, Covid-19, and Child and Teacher Morbidity in Sweden. Reply.",https://pubmed.ncbi.nlm.nih.gov/33646649,
LitCovid,The Relationship Between the Duration of Attention to Pandemic News and Depression During the Outbreak of Coronavirus Disease 2019: The Roles of Risk Perception and Future Time Perspective,https://pubmed.ncbi.nlm.nih.gov/33643120,
LitCovid,Recurrent and More Severe COVID-19 Infection: Two Elderly Case Reports,https://pubmed.ncbi.nlm.nih.gov/33646110,
LitCovid,Medicina Clinica during the pandemic COVID-19,https://pubmed.ncbi.nlm.nih.gov/33644401,
LitCovid,Clinical features of SARS-CoV-2-associated encephalitis and meningitis amid COVID-19 pandemic,https://pubmed.ncbi.nlm.nih.gov/33644169,
LitCovid,Impact of the COVID-19 pandemic and its related psychological effect on orthopedic surgeries conducted in different types of hospitals in Taiwan,https://pubmed.ncbi.nlm.nih.gov/33641538,
LitCovid,Automatic Detection of COVID-19 Disease using U-Net Architecture Based Fully Convolutional Network,https://pubmed.ncbi.nlm.nih.gov/33643425,
LitCovid,ST-segment elevation in patients presenting with COVID-19: case series,https://pubmed.ncbi.nlm.nih.gov/33644657,
LitCovid,Laparoscopic surgeries and carbon dioxide pneumoperitoneum during COVID-19 pandemic: problems and solutions,https://pubmed.ncbi.nlm.nih.gov/33642338,
LitCovid,The Johnson & Johnson Vaccine for COVID-19,https://pubmed.ncbi.nlm.nih.gov/33646285,
LitCovid,[Conspiracy narratives in the context of the coronavirus pandemic],https://pubmed.ncbi.nlm.nih.gov/33642698,
LitCovid,"In adults, the Oxford/AstraZeneca vaccine had 70% efficacy against COVID-19 >14 d after the 2nd dose",https://pubmed.ncbi.nlm.nih.gov/33646835,
LitCovid,COVID-19-associated surge of atopic dermatitis,https://pubmed.ncbi.nlm.nih.gov/33641743,
LitCovid,VitaminD supplementation for the prevention and treatment of COVID-19: a position statement from the Spanish Society of Geriatrics and Gerontology,https://pubmed.ncbi.nlm.nih.gov/33642133,
LitCovid,Clostridioides difficile infection during the COVID-19 pandemic: a gut microbiota-based relationship,https://pubmed.ncbi.nlm.nih.gov/33641317,
LitCovid,"In high-risk adults, the Moderna vaccine had 94% efficacy against COVID-19 >/=14 d after the 2nd dose",https://pubmed.ncbi.nlm.nih.gov/33646836,
LitCovid,COVID-19 presented as acute kidney injury with secondary myocardial damage,https://pubmed.ncbi.nlm.nih.gov/33647554,
LitCovid,The multi-agency partnership roadmap for newborns in humanitarian settings: Timely and crucial during the COVID-19 pandemic,https://pubmed.ncbi.nlm.nih.gov/33643625,
LitCovid,Targeting allosteric pockets of SARS-CoV-2 main protease M(pro),https://pubmed.ncbi.nlm.nih.gov/33645457,
LitCovid,mRNA Vaccines for COVID-19: A Simple Explanation,https://pubmed.ncbi.nlm.nih.gov/33643864,
LitCovid,Covid-19 vaccine apps should deliver more to patients,https://pubmed.ncbi.nlm.nih.gov/33642239,
LitCovid,Presymptomatic viral shedding and infective ability of SARS-CoV-2; a case report,https://pubmed.ncbi.nlm.nih.gov/33644482,
LitCovid,Admissions During the COVID-19 Pandemic: Navigating an Altered Landscape for Successful Selection of Future Healthcare Providers,https://pubmed.ncbi.nlm.nih.gov/33643684,
LitCovid,Commentary: Stronger Together: The Role of a Rural Community of Practice in Implementing a Culturally Relevant Response to the Opioid Epidemic During the COVID-19 Pandemic,https://pubmed.ncbi.nlm.nih.gov/33646981,
LitCovid,Evolution of the COVID-19 pandemic over six weeks in four French-speaking countries in West Africa,https://pubmed.ncbi.nlm.nih.gov/33643618,
LitCovid,Is Elective Neurosurgery Justified During COVID-19 Pandemic?,https://pubmed.ncbi.nlm.nih.gov/33642265,
LitCovid,Challenges and opportunities identified for lymphoedema services in Wales during the COVID-19 pandemic,https://pubmed.ncbi.nlm.nih.gov/33641406,
LitCovid,Iranian Journal of Basic Medical Sciences in times of the COVID-19 pandemic,https://pubmed.ncbi.nlm.nih.gov/33643563,
LitCovid,Retail Alcohol and Tobacco Sales During COVID-19,https://pubmed.ncbi.nlm.nih.gov/33646843,
LitCovid,"Effectiveness of interventions as part of the One Health approach to control coronavirus disease 2019 and stratified case features in Anhui Province, China: A real-world population-based cohort study",https://pubmed.ncbi.nlm.nih.gov/33644291,
LitCovid,[Economic Headlines: Commodity Prices Under the Influence of COVID-19],https://pubmed.ncbi.nlm.nih.gov/33642651,
LitCovid,Seven questions in COVID-19 airway management: 5W2H,https://pubmed.ncbi.nlm.nih.gov/33642654,
LitCovid,Pneumocystis jirovecii pneumonia in an immunocompetent patient recovered from COVID-19,https://pubmed.ncbi.nlm.nih.gov/33645461,
LitCovid,TB control in India in the COVID era,https://pubmed.ncbi.nlm.nih.gov/33641833,
LitCovid,"Orthogonal antibody testing for COVID-19 among healthcare workers in a non-epidemic place and time:Japan's Iwate Prefecture, May 18-31, 2020",https://pubmed.ncbi.nlm.nih.gov/33642419,
LitCovid,The effect of COVID-19 pandemic on daily oncology clinical practice,https://pubmed.ncbi.nlm.nih.gov/33647444,
LitCovid,Mental health-related stigma among psychiatrists in light of Covid-19,https://pubmed.ncbi.nlm.nih.gov/33647839,
LitCovid,Neurologic manifestations of COVID-19. Authors' reply.,https://pubmed.ncbi.nlm.nih.gov/33641319,
LitCovid,COVID-19 and Oral Surgery: A narrative review of preoperative mouth rinses,https://pubmed.ncbi.nlm.nih.gov/33642607,
LitCovid,COVIDC: An Expert System to Diagnose COVID-19 and Predict its Severity using Chest CT Scans: Application in Radiology,https://pubmed.ncbi.nlm.nih.gov/33644298,
LitCovid,Importance of immunoglobulin therapy for COVID-19 patients with lymphocytopenia,https://pubmed.ncbi.nlm.nih.gov/33642851,
LitCovid,Loneliness During the COVID-19 Pandemic Among Older Adults With Chronic Conditions,https://pubmed.ncbi.nlm.nih.gov/33641513,
LitCovid,Modulating a summer ophthalmology research experience for medical students during the COVID-19 pandemic,https://pubmed.ncbi.nlm.nih.gov/33645529,
LitCovid,Theatre ventilation,https://pubmed.ncbi.nlm.nih.gov/33645287,
LitCovid,Early anti-SARS-CoV-2 immunoglobulin G response may be associated with disease severity in patients with COVID-19,https://pubmed.ncbi.nlm.nih.gov/33642431,
LitCovid,COVID-19 vaccine-related myositis,https://pubmed.ncbi.nlm.nih.gov/33647971,
LitCovid,Imported covid-19 cases: a hot topic with a lack of a clear definition,https://pubmed.ncbi.nlm.nih.gov/33647510,
LitCovid,New-Onset Dysphonia: A Silent Manifestation of COVID-19,https://pubmed.ncbi.nlm.nih.gov/33645290,
LitCovid,Discovery of a New Oxygen Delivery Method During COVID-19 Pandemic: Wearing a Surgical Mask Over Oxygen Cannula,https://pubmed.ncbi.nlm.nih.gov/33646112,
LitCovid,Funding needed for future Covid-19 research,https://pubmed.ncbi.nlm.nih.gov/33645811,
LitCovid,"Development of Severe COVID-19 Adaptive Risk Predictor (SCARP), a Calculator to Predict Severe Disease or Death in Hospitalized Patients With COVID-19",https://pubmed.ncbi.nlm.nih.gov/33646849,
LitCovid,"Epidemic Risk Perception, Perceived Stress, and Mental Health During COVID-19 Pandemic: A Moderated Mediating Model",https://pubmed.ncbi.nlm.nih.gov/33643107,
LitCovid,COVID-19 Encephalopathy in Adults,https://pubmed.ncbi.nlm.nih.gov/33643747,
LitCovid,Women's health: A revised global agenda in the COVID-19 era?,https://pubmed.ncbi.nlm.nih.gov/33643856,
LitCovid,Neuroleptic malignant syndrome following COVID-19 vaccination,https://pubmed.ncbi.nlm.nih.gov/33642127,
LitCovid,Seroprevalence of SARS-CoV-2 Infection in Portugal in May-July 2020: Results of the First National Serological Survey (ISNCOVID-19),https://pubmed.ncbi.nlm.nih.gov/33641702,
LitCovid,UK's first pet case of Covid-19 confirmed by chief vet,https://pubmed.ncbi.nlm.nih.gov/33645638,
LitCovid,Cordifolioside: potent inhibitor against M(pro) of SARS-CoV-2 and immunomodulatory through human TGF-beta and TNF-alpha,https://pubmed.ncbi.nlm.nih.gov/33643762,
LitCovid,Lactate-dehydrogenase associated with mortality in hospitalized patients with COVID-19 in Mexico: a multi-centre retrospective cohort study,https://pubmed.ncbi.nlm.nih.gov/33647501,
LitCovid,A case report of multisite arterial thrombosis in a patient with coronavirus disease 2019 (COVID-19),https://pubmed.ncbi.nlm.nih.gov/33644636,
LitCovid,Stress and burnout top vet Covid-19 concerns,https://pubmed.ncbi.nlm.nih.gov/33645725,
LitCovid,The Essential Role of a Physiatrist in Recommending a COVID-19 Vaccine,https://pubmed.ncbi.nlm.nih.gov/33644964,
LitCovid,"Performance evaluation of real-time RT-PCR assays for detection of severe acute respiratory syndrome coronavirus-2 developed by the National Institute of Infectious Diseases, Japan",https://pubmed.ncbi.nlm.nih.gov/33642428,
LitCovid,Abnormal liver tests in patients with SARS-CoV-2 or influenza - prognostic similarities and temporal disparities,https://pubmed.ncbi.nlm.nih.gov/33644724,
LitCovid,COVID-19: the transition towards a new normal-experiences from the European country of Malta,https://pubmed.ncbi.nlm.nih.gov/33643778,
LitCovid,"Hurrying up but not rushing, acting and not reacting, good sense and not common sense: open thoughts and reasonable doubts on COVID-19 vaccination strategies in cancer patients",https://pubmed.ncbi.nlm.nih.gov/33647445,
LitCovid,Advances in COVID-19 research until November 2020: Update from the UNCOVER registry,https://pubmed.ncbi.nlm.nih.gov/33643632,
LitCovid,"COVID-19 in Gansu Province, China: Characteristics, measures, and effects",https://pubmed.ncbi.nlm.nih.gov/33643613,
LitCovid,Smoking and COVID-19: The Real Deal,https://pubmed.ncbi.nlm.nih.gov/33645465,
LitCovid,"Disabled people in the time of COVID-19: identifying needs, promoting inclusivity",https://pubmed.ncbi.nlm.nih.gov/33643617,
LitCovid,High Altitude and COVID-19: A Relationship Difficult to Assess,https://pubmed.ncbi.nlm.nih.gov/33642072,
LitCovid,Alert for COVID-19 second wave: A lesson from Vietnam,https://pubmed.ncbi.nlm.nih.gov/33643622,
LitCovid,Severity and 1-month outcome of SARS-CoV-2 infection in patients with solid cancers: a Danish nationwide cohort study,https://pubmed.ncbi.nlm.nih.gov/33646071,
LitCovid,Lessons learned for successful treatment of AML in the second wave of COVID-19 outbreak,https://pubmed.ncbi.nlm.nih.gov/33645389,
LitCovid,Development and validation of a questionnaire to assess preventive practices against COVID-19 pandemic in the general population,https://pubmed.ncbi.nlm.nih.gov/33643811,
LitCovid,Recruitment and Results Reporting of COVID-19 Randomized Clinical Trials Registered in the First 100 Days of the Pandemic,https://pubmed.ncbi.nlm.nih.gov/33646310,
LitCovid,Prevalence of Anxiety and Depression Among Medical Students During the Covid-19 Pandemic: A Cross-Sectional Study,https://pubmed.ncbi.nlm.nih.gov/33644399,
LitCovid,"[Diagnostic properties of case definitions of suspected COVID-19 in Chile, 2020Caracteristicas diagnosticas das definicoes de caso suspeito de COVID-19 no Chile, 2020]",https://pubmed.ncbi.nlm.nih.gov/33643397,
LitCovid,Case series: COVID-19 in patients with mild to moderate myasthenia gravis in a National Referral Hospital in Indonesia,https://pubmed.ncbi.nlm.nih.gov/33644426,
LitCovid,"Education, Training, and Practices of Neurorehabilitation in India During the COVID-19 Pandemic",https://pubmed.ncbi.nlm.nih.gov/33643202,
LitCovid,Clinical profile and outcomes of asymptomatic vs. symptomatic travellers diagnosed with COVID-19: An observational study from a coastal town in South India.,https://pubmed.ncbi.nlm.nih.gov/33642450,
LitCovid,Mutated Covid-19 found in mink farms in Denmark,https://pubmed.ncbi.nlm.nih.gov/33645789,
LitCovid,The NCD/COVID-19 intimidating relationship: An urgent call for countries in the WHO Eastern Mediterranean Region,https://pubmed.ncbi.nlm.nih.gov/33643620,
LitCovid,Pulmonary Rehabilitation in a Post-COVID-19 World: Telerehabilitation as a New Standard in Patients with COPD,https://pubmed.ncbi.nlm.nih.gov/33642858,
LitCovid,Locked and lonely? A longitudinal assessment of loneliness before and during the COVID-19 pandemic in Norway,https://pubmed.ncbi.nlm.nih.gov/33645336,
LitCovid,"Sustainable Resumption of Cardiac Catheterization Laboratory Procedures, and the Importance of Testing, During Endemic COVID-19",https://pubmed.ncbi.nlm.nih.gov/33642850,
LitCovid,Learning from previous disasters: Potential pitfalls of epidemiological psychosocial research in the COVID-19 environment,https://pubmed.ncbi.nlm.nih.gov/33645256,
LitCovid,Assessing the impact of COVID-19 on liver cancer management (CERO-19),https://pubmed.ncbi.nlm.nih.gov/33644725,
LitCovid,Investigating how individual differences influence responses to the COVID-19 crisis: The role of maladaptive and five-factor personality traits,https://pubmed.ncbi.nlm.nih.gov/33642660,
LitCovid,"Changes in Lifestyle, Behaviors, and Risk Factors for Cognitive Impairment in Older Persons During the First Wave of the Coronavirus Disease 2019 Pandemic in Finland: Results From the FINGER Study",https://pubmed.ncbi.nlm.nih.gov/33643095,
LitCovid,A potential peptide inhibitor of SARS-CoV-2 S and human ACE2 complex,https://pubmed.ncbi.nlm.nih.gov/33645443,
LitCovid,"Predictors of Intensive Care Unit Admission or Death in Patients with Coronavirus Disease 2019 Pneumonia in Istanbul, Turkey",https://pubmed.ncbi.nlm.nih.gov/33642427,
LitCovid,COVID-19 skin eruptions: incidence in hospitalized patients in Bologna,https://pubmed.ncbi.nlm.nih.gov/33644850,
LitCovid,PAP with COVID-19 Radiology - Differential Diagnosis Discussion,https://pubmed.ncbi.nlm.nih.gov/33646114,
