feed,title,long_url,short_url
LitCovid,Clinical features and outcomes of hospitalized COVID-19 patients in a low burden region,https://pubmed.ncbi.nlm.nih.gov/33645468,
LitCovid,Immunomodulatory Effects of Azithromycin Revisited: Potential Applications to COVID-19,https://pubmed.ncbi.nlm.nih.gov/33643308,
LitCovid,Serious bradycardia and remdesivir for coronavirus 2019 (COVID-19): a new safety concerns,https://pubmed.ncbi.nlm.nih.gov/33647441,
LitCovid,How pets can reduce feelings of isolation and loneliness during Covid-19 and beyond: A personal view from London,https://pubmed.ncbi.nlm.nih.gov/33641499,
LitCovid,Pinpointing the potential hits for hindering interaction of SARS-CoV-2 S-protein with ACE2 from the pool of antiviral phytochemicals utilizing molecular docking and molecular dynamics (MD) simulations,https://pubmed.ncbi.nlm.nih.gov/33647752,
LitCovid,The relationship between fear of COVID-19 and mental health problems: A meta-analysis,https://pubmed.ncbi.nlm.nih.gov/33641626,
LitCovid,Role of ROX index in the first assessment of COVID-19 patients in the emergency department,https://pubmed.ncbi.nlm.nih.gov/33646507,
LitCovid,COVID-19 Changed the Injury Patterns of Hospitalized Patients,https://pubmed.ncbi.nlm.nih.gov/33641689,
LitCovid,Strategies to protect the emotional health of frontline NHS staff in the pandemic,https://pubmed.ncbi.nlm.nih.gov/33641399,
LitCovid,Mechanistic and Therapeutic Implications of Extracellular Vesicles as a Potential Link Between Covid-19 and Cardiovascular Disease Manifestations,https://pubmed.ncbi.nlm.nih.gov/33644077,
LitCovid,Two Adult Cases of Multisystem Inflammatory Syndrome Associated with SARS-CoV-2,https://pubmed.ncbi.nlm.nih.gov/33644276,
LitCovid,"Tocilizumab, Remdesivir, Favipiravir, and Dexamethasone Repurposed for COVID-19: a Comprehensive Clinical and Pharmacovigilant Reassessment",https://pubmed.ncbi.nlm.nih.gov/33644693,
LitCovid,Fear of COVID-19 and Depression: A Comparative Study Among the General Population and Healthcare Professionals During COVID-19 Pandemic Crisis in Bangladesh,https://pubmed.ncbi.nlm.nih.gov/33642957,
LitCovid,The Balance between Two Branches of RAS Can Protect from Severe COVID-19 Course,https://pubmed.ncbi.nlm.nih.gov/33643542,
LitCovid,[Can we talk about triage of patients and with whom?],https://pubmed.ncbi.nlm.nih.gov/33643447,
LitCovid,Mental health in the post-COVID-19 era: challenges and the way forward,https://pubmed.ncbi.nlm.nih.gov/33644689,
LitCovid,"Civil disorder, authority credibility and public health: Chile's unique sociopolitical context in dealing with COVID-19",https://pubmed.ncbi.nlm.nih.gov/33643629,
LitCovid,Comparison of Different Optimizers Implemented on the Deep Learning Architectures for COVID-19 Classification,https://pubmed.ncbi.nlm.nih.gov/33643854,
LitCovid,Older adults' activity destinations before and during COVID-19 restrictions: From a variety of activities to mostly physical exercise close to home,https://pubmed.ncbi.nlm.nih.gov/33647634,
LitCovid,Clostridioides difficile infection in the COVID-19 era: old and new problems,https://pubmed.ncbi.nlm.nih.gov/33641318,
LitCovid,Severe acute respiratory syndrome coronavirus 2 infection in asymptomatic pediatric dental patients,https://pubmed.ncbi.nlm.nih.gov/33641860,
LitCovid,Factors associated with viral clearance periods from patients with COVID-19: A retrospective observational cohort study,https://pubmed.ncbi.nlm.nih.gov/33642249,
LitCovid,COVID-19 and Diarrhoea: the Therapeutic Role OF LMWH,https://pubmed.ncbi.nlm.nih.gov/33644694,
LitCovid,Workforce Mobilization From the National Institutes of Health for the Ministry of Health Malaysia: A COVID-19 Pandemic Response,https://pubmed.ncbi.nlm.nih.gov/33643985,
LitCovid,Transient Cold Agglutinins in a Patient With COVID-19,https://pubmed.ncbi.nlm.nih.gov/33643726,
LitCovid,The leadership and followership challenges of doctors in training during the COVID-19 pandemic,https://pubmed.ncbi.nlm.nih.gov/33646028,
LitCovid,Latest Covid-19 survey provides good news,https://pubmed.ncbi.nlm.nih.gov/33645819,
LitCovid,Utilizing IoT to design a relief supply chain network for the SARS-COV-2 pandemic,https://pubmed.ncbi.nlm.nih.gov/33642961,
LitCovid,COVID-19 Pandemic Action Plan of a University Hospital,https://pubmed.ncbi.nlm.nih.gov/33646113,
LitCovid,In Silico Analysis of Quranic and Prophetic Medicinals Plants for the Treatment of Infectious Viral Diseases Including Corona Virus,https://pubmed.ncbi.nlm.nih.gov/33642896,
LitCovid,Challenges of Hematopoietic Stem Cell Transplantation in the Era of COVID-19,https://pubmed.ncbi.nlm.nih.gov/33641657,
LitCovid,A COVID 19 positive preterm mother and infant: a case report,https://pubmed.ncbi.nlm.nih.gov/33645405,
LitCovid,Potential Role of Molecular Imaging with (18)F-FDG in Diagnostic Triage and Follow-Up of Suspects with COVID-19 Infection,https://pubmed.ncbi.nlm.nih.gov/33642779,
LitCovid,Forcing the Digital Economy: How will the Structure of Digital Markets Change as a Result of the COVID-19 Pandemic,https://pubmed.ncbi.nlm.nih.gov/33642845,
LitCovid,Unrecognized risks and challenges of water as a major focus of COVID-19 spread,https://pubmed.ncbi.nlm.nih.gov/33643626,
LitCovid,Predicted SARS-CoV-2 miRNAs associated with epigenetic viral pathogenesis and the detection of new possible drugs for Covid-19,https://pubmed.ncbi.nlm.nih.gov/33645482,
LitCovid,Physiologic and biochemical rationale for treating COVID-19 patients with hyperbaric oxygen,https://pubmed.ncbi.nlm.nih.gov/33648028,
LitCovid,Continuity and Discontinuity of Sport and Exercise Type During the COVID-19 Pandemic. An Exploratory Study of Effects on Mood.,https://pubmed.ncbi.nlm.nih.gov/33643151,
LitCovid,From a Healthcare Perspective: How to Preserve Person-Centred Care Using Video Conferencing to Follow Up with Patients during the Covid-19 Pandemic,https://pubmed.ncbi.nlm.nih.gov/33646965,
LitCovid,Mental health and COVID-19 pandemics: The worrisome humanitarian perspective from the Middle East,https://pubmed.ncbi.nlm.nih.gov/33643624,
LitCovid,Integrated Nutritional Supports for Diabetic Patients during COVID-19 Infection: A Comprehensive Review,https://pubmed.ncbi.nlm.nih.gov/33645486,
LitCovid,Drug-Drug Interactions and Prescription Appropriateness at Hospital Discharge: Experience with COVID-19 Patients,https://pubmed.ncbi.nlm.nih.gov/33646509,
LitCovid,"Boceprevir, Calpain Inhibitors II and XII, and GC-376 Have Broad-Spectrum Antiviral Activity against Coronaviruses",https://pubmed.ncbi.nlm.nih.gov/33645977,
LitCovid,"Executive summary: It's wrong not to test: The case for universal, frequent rapid COVID-19 testing",https://pubmed.ncbi.nlm.nih.gov/33644720,
LitCovid,"Mental health of medical workers in Japan during COVID-19: Relationships with loneliness, hope and self-compassion",https://pubmed.ncbi.nlm.nih.gov/33642837,
LitCovid,Seroprevalence of antibodies to SARS-CoV-2 in healthcare workers & implications of infection control practice in India,https://pubmed.ncbi.nlm.nih.gov/33642348,
LitCovid,"A review of the characteristics and outcomes of 900 COVID-19 patients hospitalized at a Tertiary Care Medical Center in New Jersey, USA",https://pubmed.ncbi.nlm.nih.gov/33644490,
LitCovid,Bronchoscopy for diagnosis of COVID-19 with respiratory failure: A case report,https://pubmed.ncbi.nlm.nih.gov/33644177,
LitCovid,A Comparison: Prediction of Death and Infected COVID-19 Cases in Indonesia Using Time Series Smoothing and LSTM Neural Network,https://pubmed.ncbi.nlm.nih.gov/33643496,
LitCovid,An Optimized High-Throughput Immuno-Plaque Assay for SARS-CoV-2,https://pubmed.ncbi.nlm.nih.gov/33643253,
LitCovid,"Latest updates on SARS-CoV-2 genomic characterization, drug, and vaccine development; a comprehensive bioinformatics review",https://pubmed.ncbi.nlm.nih.gov/33647446,
LitCovid,"[A Perspective about the ""Health at a Glance 2020"" OECD Report]",https://pubmed.ncbi.nlm.nih.gov/33641701,
LitCovid,Finding the silver lining in the COVID-19 crisis,https://pubmed.ncbi.nlm.nih.gov/33645297,
LitCovid,Pulmonary function and functional capacity in COVID-19 survivors with persistent dyspnea,https://pubmed.ncbi.nlm.nih.gov/33647535,
LitCovid,Factors Influencing Public Panic During the COVID-19 Pandemic,https://pubmed.ncbi.nlm.nih.gov/33643123,
LitCovid,Case Report: Concomitant Massive Cerebral Venous Thrombosis and Internal Iliac Vein Thrombosis Related to Paucisymptomatic COVID-19 Infection,https://pubmed.ncbi.nlm.nih.gov/33643200,
LitCovid,Shorter androgen receptor polyQ alleles protect against life-threatening COVID-19 disease in European males,https://pubmed.ncbi.nlm.nih.gov/33647767,
LitCovid,Anti-HMGCR myopathy misdiagnosed as motor neuron disease and complicated with COVID-19 infection,https://pubmed.ncbi.nlm.nih.gov/33646438,
LitCovid,Is Spontaneous Pneumomediastinum a Poor Prognostic Factor in Covid-19?,https://pubmed.ncbi.nlm.nih.gov/33645177,
LitCovid,"COVID-19 research in critical care: the good, the bad, and the ugly",https://pubmed.ncbi.nlm.nih.gov/33646318,
LitCovid,[Economic Policy Implications of the COVID-19 Pandemic in Air Transport],https://pubmed.ncbi.nlm.nih.gov/33642647,
LitCovid,Orthopaedic assessment unit: a service model for the delivery of orthopaedic trauma care in a major trauma centre during the global pandemic (COVID-19),https://pubmed.ncbi.nlm.nih.gov/33645286,
LitCovid,"The Investor Psychology and Stock Market Behavior During the Initial Era of COVID-19: A Study of China, Japan, and the United States",https://pubmed.ncbi.nlm.nih.gov/33643158,
LitCovid,Rapid development of a de novo convalescent plasma program in response to a global pandemic: A large southeastern U.S. blood center's experience.,https://pubmed.ncbi.nlm.nih.gov/33648025,
LitCovid,Use Of Smoking Cessation Digital Platforms During The Covid-19 Pandemic: Insights From Smokfree.Gov Initiative,https://pubmed.ncbi.nlm.nih.gov/33646963,
LitCovid,Mourning and Management of the COVID-19 Health Emergency in the Priestly Community: Qualitative Research in a Region of Northern Italy Severely Affected by the Pandemic,https://pubmed.ncbi.nlm.nih.gov/33643991,
LitCovid,Can social media data be used to evaluate the risk of human interactions during the COVID-19 pandemic?,https://pubmed.ncbi.nlm.nih.gov/33643835,
LitCovid,Mathematical modeling of the SARS-CoV-2 epidemic in Qatar and its impact on the national response to COVID-19,https://pubmed.ncbi.nlm.nih.gov/33643638,
LitCovid,"Early Antiandrogen Therapy With Dutasteride Reduces Viral Shedding, Inflammatory Responses, and Time-to-Remission in Males With COVID-19: A Randomized, Double-Blind, Placebo-Controlled Interventional Trial (EAT-DUTA AndroCoV Trial - Biochemical)",https://pubmed.ncbi.nlm.nih.gov/33643746,
LitCovid,Convolutional neural network model based on radiological images to support COVID-19 diagnosis: Evaluating database biases,https://pubmed.ncbi.nlm.nih.gov/33647062,
LitCovid,"Knowledge and practice of clients on preventive measures of COVID-19 pandemic among governmental health facilities in South Wollo, Ethiopia: A facility-based cross-sectional study",https://pubmed.ncbi.nlm.nih.gov/33647034,
LitCovid,"Sex Differences on Clinical Characteristics, Severity, and Mortality in Adult Patients With COVID-19: A Multicentre Retrospective Study",https://pubmed.ncbi.nlm.nih.gov/33644092,
LitCovid,Nurse Managers Leading the Way: Reenvisioning Stress to Maintain Healthy Work Environments,https://pubmed.ncbi.nlm.nih.gov/33647958,
LitCovid,Adherence to Remote Cardiac Rehabilitation During the Coronavirus Pandemic: A Retrospective Cohort Analysis,https://pubmed.ncbi.nlm.nih.gov/33647923,
LitCovid,COVID-19: Association Between Increase of Behavioral and Psychological Symptoms of Dementia During Lockdown and Caregivers' Poor Mental Health,https://pubmed.ncbi.nlm.nih.gov/33646163,
LitCovid,"Changes in trends during the COVID-19 lockdown: An urban, Level-1 trauma centers experience",https://pubmed.ncbi.nlm.nih.gov/33641939,
LitCovid,Potential Relationship Between Lifestyle Changes and Incidence of Hospital Admissions for Acute Coronary Syndrome During the COVID-19 Lockdown,https://pubmed.ncbi.nlm.nih.gov/33644128,
LitCovid,Estimation of parameters for a humidity-dependent compartmental model of the COVID-19 outbreak,https://pubmed.ncbi.nlm.nih.gov/33643707,
LitCovid,"Response by Szekely et al to Letters Regarding Article, ""Spectrum of Cardiac Manifestations in COVID-19: A Systematic Echocardiographic Study""",https://pubmed.ncbi.nlm.nih.gov/33646829,
LitCovid,"Community mitigation strategies for coronavirus disease 2019: An assessment of knowledge and adherence amongst residents of Benin City, Edo State, Nigeria",https://pubmed.ncbi.nlm.nih.gov/33642319,
LitCovid,[Liaison geriatrics with nursing homes in COVID time. A new coordination model arrived to stay].,https://pubmed.ncbi.nlm.nih.gov/33642134,
LitCovid,Risk Assessment and Heuristics: How Cognitive Shortcuts Can Fuel the Spread of COVID-19,https://pubmed.ncbi.nlm.nih.gov/33647433,
LitCovid,COVID-19 Vaccination in Patients With Inflammatory Bowel Disease: Communique From the Canadian Association of Gastroenterology,https://pubmed.ncbi.nlm.nih.gov/33644678,
LitCovid,Novel findings of respiratory rate increases using the multisensor HeartLogic heart failure monitoring algorithm in COVID-19-positive patients: a case series,https://pubmed.ncbi.nlm.nih.gov/33644668,
LitCovid,The Transformation of Higher Education After the COVID Disruption: Emerging Challenges in an Online Learning Scenario,https://pubmed.ncbi.nlm.nih.gov/33643144,
LitCovid,Neuropsychiatric Symptoms in Patients with Dementia Associated with Increased Psychological Distress in Caregivers During the COVID-19 Pandemic,https://pubmed.ncbi.nlm.nih.gov/33646168,
LitCovid,"Circulating cell-free DNA, peripheral lymphocyte subsets alterations and neutrophil lymphocyte ratio in assessment of COVID-19 severity",https://pubmed.ncbi.nlm.nih.gov/33646058,
LitCovid,Zinc deficiency as a possible risk factor for increased susceptibility and severe progression of COVID-19,https://pubmed.ncbi.nlm.nih.gov/33641685,
LitCovid,Associations Between Employment Changes and Mental Health: US Data From During the COVID-19 Pandemic,https://pubmed.ncbi.nlm.nih.gov/33643165,
LitCovid,Results of preoperative screening for COVID-19 correlate with the incidence of infection in the general population -a tertiary care experience,https://pubmed.ncbi.nlm.nih.gov/33647224,
LitCovid,The Effect of the COVID-19 Pandemic on the Workload of an Adult Major Trauma Centre in Northern Ireland,https://pubmed.ncbi.nlm.nih.gov/33642628,
LitCovid,National level adjustments to the challenges of the SARS-CoV2 pandemic on blood banking operations,https://pubmed.ncbi.nlm.nih.gov/33644858,
LitCovid,SARS-CoV-2 spike protein S1 subunit induces pro-inflammatory responses via toll-like receptor 4 signaling in murine and human macrophages,https://pubmed.ncbi.nlm.nih.gov/33644468,
LitCovid,Examining spatiotemporal changing patterns of bike-sharing usage during COVID-19 pandemic,https://pubmed.ncbi.nlm.nih.gov/33642707,
LitCovid,"Letter by Vazgiourakis et al Regarding Article, ""Spectrum of Cardiac Manifestations in COVID-19: A Systematic Echocardiographic Study""",https://pubmed.ncbi.nlm.nih.gov/33646831,
LitCovid,"Letter by Carrizales-Sepulveda et al Regarding Article, ""Spectrum of Cardiac Manifestations in COVID-19: A Systematic Echocardiographic Study""",https://pubmed.ncbi.nlm.nih.gov/33646833,
LitCovid,[Telemedicine and social Media in the management of ECMOs in the era of COVID-19: The Tunisian experience],https://pubmed.ncbi.nlm.nih.gov/33642046,
LitCovid,Maintaining the Uptake of Peritoneal Dialysis During the COVID-19 Pandemic: A Research Letter,https://pubmed.ncbi.nlm.nih.gov/33643659,
LitCovid,Historical and contemporary views on cholera transmission: are we repeating past discussions? Can lessons learned from cholera be applied to COVID-19?,https://pubmed.ncbi.nlm.nih.gov/33645840,
LitCovid,"Comparing ICU admission rates of mild/moderate COVID-19 patients treated with hydroxychloroquine, favipiravir, and hydroxychloroquine plus favipiravir",https://pubmed.ncbi.nlm.nih.gov/33647553,
LitCovid,COVID-19 and the right to education in Chile: An opportunity to revisit our social contract,https://pubmed.ncbi.nlm.nih.gov/33642612,
LitCovid,Airborne Spread of Coronavirus Disease-2019 and Its Implications for Nuclear Medicine Practice,https://pubmed.ncbi.nlm.nih.gov/33642778,
LitCovid,Addressing the critical need for long-term mental health data during the COVID-19 pandemic: Changes in mental health from April to September 2020,https://pubmed.ncbi.nlm.nih.gov/33647353,
LitCovid,The Impact of Coronavirus Disease 2019 Lockdown on Athletes' Subjective Vitality: The Protective Role of Resilience and Autonomous Goal Motives,https://pubmed.ncbi.nlm.nih.gov/33643114,
LitCovid,Spatial analysis of COVID-19 incidence and the sociodemographic context in Brazil,https://pubmed.ncbi.nlm.nih.gov/33647044,
LitCovid,Application of Mobile Call-Based Integrative Body-Mind-Spirit (IBMS) Intervention to Deal With Psychological Issues of COVID-19 Patients: A Case Study in India,https://pubmed.ncbi.nlm.nih.gov/33646068,
LitCovid,Nursing Professionals' Stress Level During COVID-19: A Looming Workforce Issue,https://pubmed.ncbi.nlm.nih.gov/33642956,
LitCovid,The AbC-19 Rapid Test had 85% sensitivity and 99% specificity for detecting previous SARS-CoV-2 infection,https://pubmed.ncbi.nlm.nih.gov/33646844,
LitCovid,Major bleeding complications in critically ill patients with COVID-19 pneumonia,https://pubmed.ncbi.nlm.nih.gov/33646501,
LitCovid,Persistence of SARS-CoV-2 antibodies beyond 6 months in health care workers in Mumbai,https://pubmed.ncbi.nlm.nih.gov/33647334,
LitCovid,Parental PTSD and psychological reactions during the COVID-19 pandemic among offspring of Holocaust survivors,https://pubmed.ncbi.nlm.nih.gov/33646805,
LitCovid,Low Psychological Well-being in Men Who Have Sex with Men (MSM) During the Shelter-in-Place Orders to Prevent the COVID-19 Spread: Results from a Nationwide Study,https://pubmed.ncbi.nlm.nih.gov/33643482,
LitCovid,Serum beta2-microglobulin levels in Coronavirus disease 2019 (Covid-19): Another prognosticator of disease severity?,https://pubmed.ncbi.nlm.nih.gov/33647017,
LitCovid,"Physical activity, screen time and the COVID-19 school closures in Europe - an observational study in 10 countries",https://pubmed.ncbi.nlm.nih.gov/33641633,
LitCovid,Psychometric properties of the Brazilian version of the fear of COVID-19 scale (FCV-19S),https://pubmed.ncbi.nlm.nih.gov/33642838,
LitCovid,"The Relationship Between Asthma, Eosinophilia, and Outcomes in COVID-19 Infection",https://pubmed.ncbi.nlm.nih.gov/33647451,
LitCovid,Introduction of a virtual trauma meeting in response to COVID-19,https://pubmed.ncbi.nlm.nih.gov/33645272,
LitCovid,[Methods of SARS-CoV-2 detection in tissue],https://pubmed.ncbi.nlm.nih.gov/33646360,
LitCovid,An evaluation of chest computed tomography and hemogram data in patients with COVID-19: The importance of the thymus,https://pubmed.ncbi.nlm.nih.gov/33641314,
LitCovid,Russian Enterprises in the Spring 2020: Covid-19 Pandemic Reactions and Opinions on the Role of the State in the Economy,https://pubmed.ncbi.nlm.nih.gov/33642849,
LitCovid,Media Exposure to COVID-19 Predicted Acute Stress: A Moderated Mediation Model of Intolerance of Uncertainty and Perceived Social Support,https://pubmed.ncbi.nlm.nih.gov/33643082,
LitCovid,Anxiety and Depression due to 2019 SARS-CoV-2 among Frontier Healthcare Workers in Kenya,https://pubmed.ncbi.nlm.nih.gov/33644428,
LitCovid,Initial Results and Patient Survey of Virtual Inpatient Ophthalmology Consultations During the COVID-19 Pandemic,https://pubmed.ncbi.nlm.nih.gov/33641597,
LitCovid,SARS-CoV-2 and Hemodialysis: diffusion and mortality in patients and health care team. Reflections from the Lombardy experience.,https://pubmed.ncbi.nlm.nih.gov/33646561,
LitCovid,[EHPAD: Reintroducing relational life after the health emergency],https://pubmed.ncbi.nlm.nih.gov/33643446,
LitCovid,Development of a Physiologically Based Pharmacokinetic Model for Hydroxychloroquine and Its Application in Dose Optimization in Specific COVID-19 Patients,https://pubmed.ncbi.nlm.nih.gov/33643034,
LitCovid,Novel Development of Predictive Feature Fingerprints to Identify Chemistry-Based Features for the Effective Drug Design of SARS-CoV-2 Target Antagonists and Inhibitors Using Machine Learning,https://pubmed.ncbi.nlm.nih.gov/33644594,
LitCovid,"Spillover effects of the United States economic slowdown induced by COVID-19 pandemic on energy, economy, and environment in other countries",https://pubmed.ncbi.nlm.nih.gov/33647303,
LitCovid,Tuberculous pericarditis with tamponade diagnosed concomitantly with COVID-19: a case report,https://pubmed.ncbi.nlm.nih.gov/33644650,
LitCovid,Machine learning in a time of COVID-19 - Can machine learning support Community Health Workers (CHWs) in low and middle income countries (LMICs) in the new normal?,https://pubmed.ncbi.nlm.nih.gov/33643627,
LitCovid,Inhibition of ACE2 Expression by Ascorbic Acid Alone and its Combinations with Other Natural Compounds,https://pubmed.ncbi.nlm.nih.gov/33642866,
LitCovid,[The consequences of the lockdown on cardiovascular diseases],https://pubmed.ncbi.nlm.nih.gov/33642051,
LitCovid,COVID-19 and changes in activity and treatment of ST elevation MI from a UK cardiac centre,https://pubmed.ncbi.nlm.nih.gov/33644297,
LitCovid,Assessing the potential of unmanned aerial vehicle spraying of aqueous ozone as an outdoor disinfectant for SARS-CoV-2,https://pubmed.ncbi.nlm.nih.gov/33647300,
LitCovid,The Use of Chisels in the Extraction of Mandibular Third Molars: A Technique That May Prevent the Aerosolization of Severe Acute Respiratory Syndrome Coronavirus 2,https://pubmed.ncbi.nlm.nih.gov/33647247,
LitCovid,A shorter symptom-onset to remdesivir treatment (SORT) interval is associated with a lower mortality in moderate-to-severe COVID-19: a real-world analysis,https://pubmed.ncbi.nlm.nih.gov/33647517,
LitCovid,Classification of COVID-19 pneumonia from chest CT images based on reconstructed super-resolution images and VGG neural network,https://pubmed.ncbi.nlm.nih.gov/33643612,
LitCovid,Personal and Social Resources in Coping with Coronavirus Crisis Among Israeli-Palestinian Adults: Explanatory Study,https://pubmed.ncbi.nlm.nih.gov/33642958,
LitCovid,Evaluation of automated test Lumipulse(R) G SARS-CoV-2 antigen assay for detection of SARS-CoV-2 nucleocapsid protein (NP) in nasopharyngeal swabs for community and population screening,https://pubmed.ncbi.nlm.nih.gov/33647511,
LitCovid,Association of D-dimer and Fibrinogen With Hypercoagulability in COVID-19 Requiring Extracorporeal Membrane Oxygenation,https://pubmed.ncbi.nlm.nih.gov/33641491,
LitCovid,Heuristic Thinking and Altruism towards Machines in People Impacted by Covid-19,https://pubmed.ncbi.nlm.nih.gov/33644708,
LitCovid,Design ensemble deep learning model for pneumonia disease classification,https://pubmed.ncbi.nlm.nih.gov/33643764,
LitCovid,Furin Expression in Patients With Psoriasis-A Patient Cohort Endangered to SARS-COV2?,https://pubmed.ncbi.nlm.nih.gov/33644099,
LitCovid,"Assessing sub-regional-specific strengths of healthcare systems associated with COVID-19 prevalence, deaths and recoveries in Africa",https://pubmed.ncbi.nlm.nih.gov/33647032,
LitCovid,SARS-CoV-2 Infection in Dogs and Cats: Facts and Speculations,https://pubmed.ncbi.nlm.nih.gov/33644148,
LitCovid,Impacts of the COVID-19 pandemic on healthcare access among patients receiving medication for opioid use disorder,https://pubmed.ncbi.nlm.nih.gov/33647590,
LitCovid,Phase angle and standardized phase angle from bioelectrical impedance measurements as a prognostic factor for mortality at 90 days in patients with COVID-19: A longitudinal cohort study,https://pubmed.ncbi.nlm.nih.gov/33642143,
LitCovid,Telehealth in Multiple Sclerosis Clinical Care and Research,https://pubmed.ncbi.nlm.nih.gov/33646409,
LitCovid,Initial CT features of COVID-19 predicting clinical category,https://pubmed.ncbi.nlm.nih.gov/33644690,
LitCovid,"The Effects of COVID-19 Lockdown 1.0 on Working Patterns, Income, and Wellbeing Among Performing Arts Professionals in the United Kingdom (April-June 2020)",https://pubmed.ncbi.nlm.nih.gov/33643111,
LitCovid,Diagnostic accuracy of lung ultrasound for SARS-CoV-2: a retrospective cohort study,https://pubmed.ncbi.nlm.nih.gov/33644829,
LitCovid,Factors Affecting the Survival of Early COVID-19 Patients in South Korea: An Observational Study based on the Korean National Health Insurance Big Data,https://pubmed.ncbi.nlm.nih.gov/33647512,
LitCovid,"A Reflection on the Main Ethical Obstacles Related to the Strategic Action ""O Brasil Conta Comigo""",https://pubmed.ncbi.nlm.nih.gov/33643093,
LitCovid,Perceived consequences and worries among youth in Norway during the COVID-19 pandemic lockdown,https://pubmed.ncbi.nlm.nih.gov/33645323,
LitCovid,"Impact of COVID-19 on mental health of employed women residing in Delhi-NCR, India: Mediating role of working from-for home",https://pubmed.ncbi.nlm.nih.gov/33646927,
LitCovid,"Families in the COVID-19 pandemic: parental stress, parent mental health and the occurrence of adverse childhood experiences-results of a representative survey in Germany",https://pubmed.ncbi.nlm.nih.gov/33646416,
LitCovid,"Effect of guided imagery on anxiety, muscle pain, and vital signs in patients with COVID-19: A randomized controlled trial",https://pubmed.ncbi.nlm.nih.gov/33647676,
LitCovid,"Preoperative Universal SARS-CoV-2 Screening for Asymptomatic Patients: A Report From Tokyo, Japan",https://pubmed.ncbi.nlm.nih.gov/33645509,
LitCovid,"[Corona child studies ""Co-Ki"": first results of a Germany-wide register on mouth and nose covering (mask) in children]",https://pubmed.ncbi.nlm.nih.gov/33642617,
