feed,title,long_url,short_url
GN:T:GP,Hungary eyes EU consensus on geothermal energy future by end of year - Euronews,https://news.google.com/rss/articles/CBMibmh0dHBzOi8vd3d3LmV1cm9uZXdzLmNvbS9ncmVlbi8yMDI0LzA3LzAzL2h1bmdhcnktZXllcy1ldS1jb25zZW5zdXMtb24tZ2VvdGhlcm1hbC1lbmVyZ3ktZnV0dXJlLWJ5LWVuZC1vZi15ZWFy0gEA?oc=5,https://da.gd/OAbf28
GN:T:GP,Sulzer Will Deliver Hot and Cold Molten Salt Pumps for China Solar Project - POWER magazine,https://news.google.com/rss/articles/CBMiZGh0dHBzOi8vd3d3LnBvd2VybWFnLmNvbS9zdWx6ZXItd2lsbC1kZWxpdmVyLWhvdC1hbmQtY29sZC1tb2x0ZW4tc2FsdC1wdW1wcy1mb3ItY2hpbmEtc29sYXItcHJvamVjdC_SAQA?oc=5,https://da.gd/FAPzj1
GN:T:GP,Oil Jumps on Significant Crude Inventory Draw - OilPrice,https://news.google.com/rss/articles/CBMiZWh0dHBzOi8vb2lscHJpY2UuY29tL0xhdGVzdC1FbmVyZ3ktTmV3cy9Xb3JsZC1OZXdzL09pbC1KdW1wcy1vbi1TaWduaWZpY2FudC1DcnVkZS1JbnZlbnRvcnktRHJhdy5odG1s0gFpaHR0cHM6Ly9vaWxwcmljZS5jb20vTGF0ZXN0LUVuZXJneS1OZXdzL1dvcmxkLU5ld3MvT2lsLUp1bXBzLW9uLVNpZ25pZmljYW50LUNydWRlLUludmVudG9yeS1EcmF3LmFtcC5odG1s?oc=5,https://da.gd/PLB9S
GN:T:GP,Nicaragua: Geothermal energy tender for the drilling of the Cosigüina volcano - Energynews,https://news.google.com/rss/articles/CBMiZ2h0dHBzOi8vZW5lcmd5bmV3cy5wcm8vZW4vbmljYXJhZ3VhLWdlb3RoZXJtYWwtZW5lcmd5LXRlbmRlci1mb3ItdGhlLWRyaWxsaW5nLW9mLXRoZS1jb3NpZ3VpbmEtdm9sY2Fuby_SAQA?oc=5,https://da.gd/zfR6bm
GN:T:GP,"New bipartisan superhot rock energy legislation advances out of committee, marking important step toward deployment - Clean Air Task Force",https://news.google.com/rss/articles/CBMiY2h0dHBzOi8vd3d3LmNhdGYudXMvMjAyNC8wNi9iaXBhcnRpc2FuLWZpcnN0LW9mLWl0cy1raW5kLXN1cGVyaG90LXJvY2stZW5lcmd5LWxlZ2lzbGF0aW9uLWFkdmFuY2VzL9IBAA?oc=5,https://da.gd/CEC4x1
