feed,title,long_url,short_url
GN:T:WP,RWE and BASF plan $4.9 billion wind power project - Reuters,https://www.reuters.com/article/us-basf-de-rwe-emissions/rwe-and-basf-plan-49-billion-wind-power-project-idUSKCN2D21B1,
GN:T:WP,EUROPE POWER-German Tuesday price rises on lower wind forecast - Nasdaq,https://www.nasdaq.com/articles/europe-power-german-tuesday-price-rises-on-lower-wind-forecast-2021-05-21,
GN:T:WP,Ørsted Bases Its North American Digital Operations in Newark - Offshore WIND,https://www.offshorewind.biz/2021/05/21/orsted-bases-its-north-american-digital-operations-in-newark/,
GN:T:WP,Halliburton shareholders vote against executive compensation plan - Reuters,https://www.reuters.com/business/energy/halliburton-shareholders-reject-executive-compensation-plan-2021-05-20/,
GN:T:WP,More grid upgrade costs for LIPA ratepayers? - Newsday,https://www.newsday.com/business/nypa-undersea-power-cable-repair-upgrades-1.50253276,
GN:T:WP,Brazil utility Copel agrees to $200 million wind-farm purchase - filing - Reuters,https://www.reuters.com/article/us-brazil-energy-copel-idUSKCN2CY2IH,
GN:T:WP,Nigerian Breweries aims for 70% renewables use by 2030 - Renewables Now,https://renewablesnow.com/news/nigerian-breweries-aims-for-70-renewables-use-by-2030-741908/,
