feed,title,long_url,short_url
GN:T:WP,Judge denies lower bail for CEO of Sullivan Solar Power - The San Diego Union-Tribune,https://www.sandiegouniontribune.com/business/story/2022-01-06/daniel-sullivan-bail-hearing,
GN:T:WP,Winter weather's natural solution to stress - Fast Company,https://www.fastcompany.com/90710659/the-science-behind-why-snowy-weather-is-good-for-your-mental-health,
GN:T:WP,“I have to throw away my crops because of energy prices” - hortidaily,https://www.hortidaily.com/article/9388082/i-have-to-throw-away-my-crops-because-of-energy-prices/,
GN:T:WP,"Gettr downloads rise after MTG Twitter ban, Joe Rogan tweet - Fast Company",https://www.fastcompany.com/90710983/gettr-gets-a-joe-rogan-bump-but-it-will-probably-be-short-lived,
GN:T:WP,"Man arrested for allegedly shooting at carjacker on Madison's far east side, police say - 97 Seven Country WGLR",https://www.wglr.com/2022/01/06/man-arrested-for-allegedly-shooting-at-carjacker-on-madisons-far-east-side-police-say/,
GN:T:WP,Pattern Energy completes New Mexico wind project - Kansas City Star,https://www.kansascity.com/news/business/national-international/article257099052.html,
GN:T:WP,SB Interstate 39/90/94 closed near Dane/Columbia Co. line due to crash - wglr,https://www.wglr.com/2022/01/06/sb-interstate-39-90-94-closed-near-dane-columbia-co-line-due-to-crash/,
GN:T:WP,A fissure on fission: Europeans split over nuclear power - Washington Examiner,https://www.washingtonexaminer.com/policy/energy-environment/a-fissure-on-fission-europeans-split-over-nuclear-power,
GN:T:WP,"India's Ambitious COP26 Pledge Will Run Into Funding Hurdle, Says ICRA - BloombergQuint",https://www.bloombergquint.com/business/indias-ambitious-cop26-pledge-will-run-into-funding-hurdle-says-icra,
GN:T:WP,Is Sony Really Going To Produce Electric Cars? - CleanTechnica,https://cleantechnica.com/2022/01/06/is-sony-really-going-to-produce-electric-cars/,
GN:T:WP,Michigan Utility Regulators Rejected Home Battery Pilot Project. Here’s Why That’s A Good Thing. - CleanTechnica,https://cleantechnica.com/2022/01/06/michigan-utility-regulators-rejected-home-battery-pilot-project-heres-why-thats-a-good-thing/,
