feed,title,long_url,short_url
InfoQ,Replit Introduces New AI Integrations for Multi-Model Development,https://www.infoq.com/news/2025/12/replit-ai-integrations/?utm_campaign=infoq_content&utm_source=infoq&utm_medium=feed&utm_term=global,
InfoQ,"AWS Launches Database Savings Plans, Offering Up to 35% Cost Reduction and Engine Flexibility",https://www.infoq.com/news/2025/12/aws-database-savings-plans/?utm_campaign=infoq_content&utm_source=infoq&utm_medium=feed&utm_term=global,
InfoQ,Article: Overload Protection: The Missing Pillar of Platform Engineering,https://www.infoq.com/articles/overload-protection-platform-engineering/?utm_campaign=infoq_content&utm_source=infoq&utm_medium=feed&utm_term=global,
InfoQ,Vike Releases Photon with Next-Gen JavaScript Deployment Infrastructure and Cloudflare Integration,https://www.infoq.com/news/2025/12/photon-deployment-javascript/?utm_campaign=infoq_content&utm_source=infoq&utm_medium=feed&utm_term=global,
InfoQ,Fray Detects Concurrency Issues in JVM Languages,https://www.infoq.com/news/2025/12/fray-detects-concurrency-issues/?utm_campaign=infoq_content&utm_source=infoq&utm_medium=feed&utm_term=global,
