feed,title,long_url,short_url
LitCovid,Sustaining Resilience of Healthcare Workers and Leaders during a Pandemic: A Protocol to Support Coping during the COVID-19 Pandemic,https://pubmed.ncbi.nlm.nih.gov/37707877,
LitCovid,Prescribing of Z-Drugs With and Without Opioid Coprescribing to Primary Care Patients in a Large Health Care System From 2019-2020,https://pubmed.ncbi.nlm.nih.gov/37707315,
LitCovid,Rectal cancer presentation during the COVID-19 pandemic: Are decreasing screening rates leading to an increase in acute presentations?,https://pubmed.ncbi.nlm.nih.gov/37708208,
LitCovid,"The re-emergence of influenza following the COVID-19 pandemic in Victoria, Australia, 2021 to 2022",https://pubmed.ncbi.nlm.nih.gov/37707981,
LitCovid,"Socioeconomic Status and Inequities In Treatment Initiation and Survival Among Patients With Cancer, 2011-2022",https://pubmed.ncbi.nlm.nih.gov/37707536,
LitCovid,Measuring the efficacy of a vaccine during an epidemic,https://pubmed.ncbi.nlm.nih.gov/37708163,
LitCovid,The development of Dutch COVID-19 ICU triage guidelines from an institutional work perspective,https://pubmed.ncbi.nlm.nih.gov/37708167,
LitCovid,Addressing Stigma by Increasing Empathy Toward Vulnerable Populations in Preprofessional Trainees: Impacts of the Generation Tomorrow Summer Health Disparities Scholars Program,https://pubmed.ncbi.nlm.nih.gov/37707848,
LitCovid,On a path toward a broad-spectrum anti-viral: inhibition of HIV-1 and coronavirus replication by SR kinase inhibitor harmine,https://pubmed.ncbi.nlm.nih.gov/37706687,
LitCovid,Travel Medicine: Pretravel Counseling for Healthy Travelers,https://pubmed.ncbi.nlm.nih.gov/37708465,
LitCovid,Active Control and Sensing Application of Ultra-Narrowband Circular Dichroism in Multilayer Chiral Nanorod Arrays,https://pubmed.ncbi.nlm.nih.gov/37708439,
LitCovid,"[Hemoperfusion in anesthesia and intensive care medicine: benefits, risks, and evidence for different systems]",https://pubmed.ncbi.nlm.nih.gov/37707564,
LitCovid,Telemedicine Implementation for Safety Net Populations: A Systematic Review,https://pubmed.ncbi.nlm.nih.gov/37707997,
LitCovid,Modeling a UVC irradiation standalone system for inactivating Mycobacterium tuberculosis from indoor spaces,https://pubmed.ncbi.nlm.nih.gov/37706797,
LitCovid,Validation of the IBD-Control Questionnaire across different sociodemographic and clinical subgroups: Secondary analysis of a nationwide electronic survey,https://pubmed.ncbi.nlm.nih.gov/37706542,
