feed,title,long_url,short_url
LitCovid,Daily briefing: COVID boosters are back,https://pubmed.ncbi.nlm.nih.gov/37709972,
LitCovid,"New SARS-CoV-2 Omicron Variant with Spike Protein Mutation Y451H, Kilifi, Kenya, March-May 2023",https://pubmed.ncbi.nlm.nih.gov/37708843,
LitCovid,Editorial: Risk of COVID-19 transmission to oral healthcare providers and their patients - Volume II,https://pubmed.ncbi.nlm.nih.gov/37711645,
LitCovid,Pediatric cancer care management during the COVID-19 pandemic: a review of the literature and a single-centre real-life experience of an Italian pediatric oncology unit,https://pubmed.ncbi.nlm.nih.gov/37712347,
LitCovid,Early expansion of activated adaptive but also exhausted NK cells during acute severe SARS-CoV-2 infection,https://pubmed.ncbi.nlm.nih.gov/37712059,
LitCovid,Antiviral efficacy of the SARS-CoV-2 XBB breakthrough infection sera against omicron subvariants including EG.5,https://pubmed.ncbi.nlm.nih.gov/37708910,
LitCovid,"Nosocomial SARS-COVID-19 Outbreak During the Third Wave of COVID-19 in an Oncology Facility at a Tertiary Care Hospital in Kashmir, India",https://pubmed.ncbi.nlm.nih.gov/37711953,
LitCovid,Livedoid skin reaction and mRNA Covid-19 vaccine: correspondence,https://pubmed.ncbi.nlm.nih.gov/37711042,
LitCovid,Keigai-rengyo-to as post-exposure prophylaxis for severe acute respiratory syndrome coronavirus 2 infection,https://pubmed.ncbi.nlm.nih.gov/37708631,
LitCovid,Characteristics of olfactory dysfunction in patients with long-haul covid-19,https://pubmed.ncbi.nlm.nih.gov/37711977,
LitCovid,Overreactive macrophages in SARS-CoV-2 infection: The effects of ACEI,https://pubmed.ncbi.nlm.nih.gov/37708705,
LitCovid,"COVID-19 Serological Study in Non-infected Vaccinated Subjects: Differences among Age, Sex, and Vaccine Brand",https://pubmed.ncbi.nlm.nih.gov/37709676,
LitCovid,Antibody neutralisation of emerging SARS-CoV-2 subvariants: EG.5.1 and XBC.1.6,https://pubmed.ncbi.nlm.nih.gov/37708906,
LitCovid,"Maternal, Perinatal, and Neonatal Outcomes of COVID-19 Severity in Pregnant Women: A Retrospective Study from Oman",https://pubmed.ncbi.nlm.nih.gov/37711979,
LitCovid,Cellular immunity to SARS-CoV-2 following intrafamilial exposure in seronegative family members,https://pubmed.ncbi.nlm.nih.gov/37711627,
LitCovid,"COVID-19: a modern trigger for Guillain-Barre syndrome, myasthenia gravis, and small fiber neuropathy",https://pubmed.ncbi.nlm.nih.gov/37712090,
LitCovid,Exposure to the COVID-19 news on social media and consequent psychological distress and potential behavioral change,https://pubmed.ncbi.nlm.nih.gov/37710006,
LitCovid,Stellate Ganglion Block Relieves Long COVID-19 Symptoms in 86% of Patients: A Retrospective Cohort Study,https://pubmed.ncbi.nlm.nih.gov/37711269,
LitCovid,Integrated Immunopeptidomics and Proteomics Study of SARS-CoV-2 Infected Calu-3 Cells Reveals Dynamic Changes in Allele-specific HLA Abundance and Antigen Presentation,https://pubmed.ncbi.nlm.nih.gov/37709257,
LitCovid,Molnupiravir: an antiviral drug against COVID-19,https://pubmed.ncbi.nlm.nih.gov/37710056,
LitCovid,Risk factors of Omicron variant associated acute encephalitis/encephalopathy in children,https://pubmed.ncbi.nlm.nih.gov/37709632,
LitCovid,The Abuse and Misuse of Over-the-Counter Medicines During COVID-19,https://pubmed.ncbi.nlm.nih.gov/37711408,
LitCovid,Autoimmune inflammatory reactions triggered by the COVID-19 genetic vaccines in terminally differentiated tissues,https://pubmed.ncbi.nlm.nih.gov/37710966,
LitCovid,"Long-term monitoring of COVID-19 prevalence in raw and treated wastewater in Salvador, the largest capital of the Brazilian Northeast",https://pubmed.ncbi.nlm.nih.gov/37709804,
LitCovid,Association between post-COVID-19 status and perioperative morbidity and mortality: protocol for an ambispective cohort study,https://pubmed.ncbi.nlm.nih.gov/37709339,
LitCovid,The COVID-19 Pandemic and the Surgical Workload of the UPR-affiliated Hospitals,https://pubmed.ncbi.nlm.nih.gov/37709684,
LitCovid,Factors associated with IgG titers against SARS-CoV-2 spike protein after second vaccination in people living with HIV controlled with anti-retroviral therapy,https://pubmed.ncbi.nlm.nih.gov/37708942,
LitCovid,Fortifying immunity: PLSCR1 picks battle against SARS-CoV-2,https://pubmed.ncbi.nlm.nih.gov/37708846,
LitCovid,Bleeding due to successive duodenal and rectal ulcers in an 81-year-old patient with severe COVID-19: a case report,https://pubmed.ncbi.nlm.nih.gov/37710168,
LitCovid,Polyfunctional CD4 T-cells correlating with neutralising antibody is a hallmark of COVISHIELD(TM) and COVAXIN((R)) induced immunity in COVID-19 exposed Indians,https://pubmed.ncbi.nlm.nih.gov/37709772,
LitCovid,Smoking intensity changes during the COVID-19 pandemic waves in a cohort of smokers in Italy,https://pubmed.ncbi.nlm.nih.gov/37712240,
LitCovid,Ophthalmology procedure trends in the United States during the COVID-19 pandemic,https://pubmed.ncbi.nlm.nih.gov/37709910,
LitCovid,Effects of the glycosylation of the receptor binding domain (RBD dimer)-based Covid-19 vaccine (ZF2001) on its humoral immunogenicity and immunoreactivity,https://pubmed.ncbi.nlm.nih.gov/37709229,
LitCovid,The Effects and Outcomes of the COVID-19 Pandemic on Pregnant Women in Kuwait,https://pubmed.ncbi.nlm.nih.gov/37708881,
LitCovid,"Ebselen: A Review on its Synthesis, Derivatives, Anticancer Efficacy and Utility in Combating SARS-COV-2",https://pubmed.ncbi.nlm.nih.gov/37711004,
LitCovid,Natural killer cells and BNT162b2 mRNA vaccine reactogenicity and durability,https://pubmed.ncbi.nlm.nih.gov/37711632,
LitCovid,Frailty after COVID-19: The wave after?,https://pubmed.ncbi.nlm.nih.gov/37711259,
LitCovid,"[Long COVID, diagnosis and management : a survey among general practitioners in the Bas Rhin in France]",https://pubmed.ncbi.nlm.nih.gov/37712155,
LitCovid,Guillain-Barre syndrome in patients dying with COVID-19 in Italy: a retrospective study,https://pubmed.ncbi.nlm.nih.gov/37712236,
LitCovid,Predicting the mortality of patients with Covid-19 A machine learning approach: Correspondence,https://pubmed.ncbi.nlm.nih.gov/37711677,
LitCovid,Risk factors for progressing to severe COVID-19 among people living with HIV in Japan: A hospital claims database study,https://pubmed.ncbi.nlm.nih.gov/37708941,
LitCovid,"Impact of the Covid-19 pandemic on the management of gynecologic cancer: a Spanish survey. Observational, multicenter study.",https://pubmed.ncbi.nlm.nih.gov/37710231,
LitCovid,Current understanding of nucleoside analogs inhibiting the SARS-CoV-2 RNA-dependent RNA polymerase,https://pubmed.ncbi.nlm.nih.gov/37711189,
LitCovid,Understanding community level influences on the prevalence of SARS-CoV-2 infection in England: new insights from comparison over time and space,https://pubmed.ncbi.nlm.nih.gov/37711145,
LitCovid,"Early warning of statewide COVID-19 Omicron wave by sentineled urbanized sewer network monitoring using digital PCR in a province capital city of Gandhinagar, India",https://pubmed.ncbi.nlm.nih.gov/37709091,
LitCovid,Prevalence and recovery of dysphonia in COVID-19 patients requiring intensive care treatment,https://pubmed.ncbi.nlm.nih.gov/37709656,
LitCovid,New onset of systemic lupus erythematosus following COVID-19 mRNA vaccination,https://pubmed.ncbi.nlm.nih.gov/37709553,
LitCovid,"Immunogenicity and safety of SARS-CoV-2 recombinant protein nanoparticle vaccine GBP510 adjuvanted with AS03: interim results of a randomised, active-controlled, observer-blinded, phase 3 trial",https://pubmed.ncbi.nlm.nih.gov/37711219,
LitCovid,'It's a fragile open door'-enhancing COVID-19 vaccination rates in people receiving treatment for substance use disorder,https://pubmed.ncbi.nlm.nih.gov/37709530,
LitCovid,SARS-CoV-2 sublingual vaccine with RBD antigen and poly(I:C) adjuvant: Preclinical study in cynomolgus macaques,https://pubmed.ncbi.nlm.nih.gov/37711440,
LitCovid,"Radiotherapy service amidst COVID-19: Experience from Tertiary Referral Hospital in Semarang, Indonesia",https://pubmed.ncbi.nlm.nih.gov/37711727,
LitCovid,Comment on: Randomized trial of personalized psychological feedback from a longitudinal online survey and simultaneous evaluation of randomized stepped wedge availability of in-person peer support for hospital staff during the COVID-19 pandemic,https://pubmed.ncbi.nlm.nih.gov/37709597,
LitCovid,The efficacy of colchicine as an adjunct therapy in non-hospitalized COVID-19 patients: A randomized placebo-controlled trial,https://pubmed.ncbi.nlm.nih.gov/37711106,
LitCovid,Differential practice and associated factors of COVID-19 personal preventive measures among the slum and estate communities of Uganda: A community-based cross-sectional survey,https://pubmed.ncbi.nlm.nih.gov/37712388,
LitCovid,A Suspected Case of COVID-19 with High Altitude-associated Massive Pulmonary Embolism and Right Ventricular Clots,https://pubmed.ncbi.nlm.nih.gov/37710939,
LitCovid,Long short-term memory model identifies ARDS and in-hospital mortality in both non-COVID-19 and COVID-19 cohort,https://pubmed.ncbi.nlm.nih.gov/37709302,
LitCovid,Transformative practice and its interactional challenges in COVID-19 telephone contact tracing in Flanders,https://pubmed.ncbi.nlm.nih.gov/37711333,
LitCovid,Discovering associations between radiological features and COVID-19 patients' deterioration,https://pubmed.ncbi.nlm.nih.gov/37711676,
LitCovid,Is the proposed global treaty an answer for public health emergencies?,https://pubmed.ncbi.nlm.nih.gov/37709300,
LitCovid,Nirmatrelvir/ritonavir Use and Hospitalizations or Death in Previously Uninfected Non-hospitalized High-risk Population with COVID-19: A matched cohort study,https://pubmed.ncbi.nlm.nih.gov/37711076,
LitCovid,Evaluating the Use of E-Learning in Indian Emergency Medicine Residency Programs During the COVID-19 Pandemic: A National Cross-Sectional Survey,https://pubmed.ncbi.nlm.nih.gov/37711031,
LitCovid,"Assessment of seasonality and normalization techniques for wastewater-based surveillance in Ontario, Canada",https://pubmed.ncbi.nlm.nih.gov/37711234,
LitCovid,COVID-19 Vaccination Hesitancies: A Spanish-Language Focus Group Analysis in Texas,https://pubmed.ncbi.nlm.nih.gov/37712138,
LitCovid,Editorial: Cardiovascular imaging in the integrated assessment of metabolic health,https://pubmed.ncbi.nlm.nih.gov/37711562,
LitCovid,"Transmission dynamics, responses, and clinical features for the first 1100 COVID-19 cases in South Batinah, Oman: Major lessons from a provincial perspective",https://pubmed.ncbi.nlm.nih.gov/37711758,
LitCovid,The impact of COVID-19 on chronic pain,https://pubmed.ncbi.nlm.nih.gov/37711989,
LitCovid,Older adults' perspectives towards optimizing lifestyle behaviors and strategies to support healthy brain ageing during COVID-19 restrictions,https://pubmed.ncbi.nlm.nih.gov/37711233,
LitCovid,Nucleic Acid Detection through RNA-Guided Protease Activity in Type III-E CRISPR-Cas Systems,https://pubmed.ncbi.nlm.nih.gov/37710076,
LitCovid,Significant Publications on Infectious Diseases Pharmacotherapy in 2022,https://pubmed.ncbi.nlm.nih.gov/37709274,
LitCovid,Public Health Graduate Students' Longitudinal Perceptions of Remote Learning Challenges and Career Goals During an Ongoing Public Health Crisis,https://pubmed.ncbi.nlm.nih.gov/37711141,
LitCovid,Antibiotic resistance and the COVID-19 pandemic: A dual crisis with complex challenges in LMICs,https://pubmed.ncbi.nlm.nih.gov/37711678,
LitCovid,[Not Available],https://pubmed.ncbi.nlm.nih.gov/37710125,
LitCovid,E-prescription: views and acceptance of general practitioners and pharmacists in Greater Sydney,https://pubmed.ncbi.nlm.nih.gov/37710390,
LitCovid,Experiences with remote communication in adult intensive care units during the COVID-19 pandemic: a systematic review protocol,https://pubmed.ncbi.nlm.nih.gov/37711062,
LitCovid,One-step selective layer assemble: A versatile approach for the development of a SARS-CoV-2 electrochemical immunosensor,https://pubmed.ncbi.nlm.nih.gov/37709467,
LitCovid,Capturing asymmetry in COVID-19 counts using an improved skewness measure for time series data,https://pubmed.ncbi.nlm.nih.gov/37711140,
LitCovid,The IMPACT of the COVID-19 Pandemic on Prescription Drug Use in Patients with Psoriasis Vulgaris in Germany,https://pubmed.ncbi.nlm.nih.gov/37710077,
LitCovid,Post-pandemic modeling of COVID-19: Waning immunity determines recurrence frequency,https://pubmed.ncbi.nlm.nih.gov/37708989,
LitCovid,Coinfection and superinfection in ICU critically ill patients with severe COVID-19 pneumonia and influenza pneumonia: are the pictures different?,https://pubmed.ncbi.nlm.nih.gov/37711242,
LitCovid,Risk factors for the development of interstitial lung disease following severe COVID-19 pneumonia and outcomes of systemic corticosteroid therapy: 3-month follow-up,https://pubmed.ncbi.nlm.nih.gov/37712369,
LitCovid,Parkinson's disease patients' perspective on telephone visits during the COVID-19 pandemic,https://pubmed.ncbi.nlm.nih.gov/37709927,
LitCovid,Public health leadership in the COVID-19 era: how does it fit? A scoping review,https://pubmed.ncbi.nlm.nih.gov/37709494,
LitCovid,Tele-monitoring system for intensive care ventilators in isolation rooms,https://pubmed.ncbi.nlm.nih.gov/37709819,
LitCovid,Impact of COVID-19 on hepatitis B screening in Sierra Leone: insights from a community pharmacy model of care,https://pubmed.ncbi.nlm.nih.gov/37711649,
LitCovid,[Sivelestat sodium for treatment of patients with COVID-19-associated acute respiratory distress syndrome in intensive care unit: a single-center retrospective cohort study],https://pubmed.ncbi.nlm.nih.gov/37712261,
LitCovid,Counts and child protection reports of diagnosed child maltreatment before and after the COVID-19 pandemic onset,https://pubmed.ncbi.nlm.nih.gov/37708644,
LitCovid,"Wellbeing, social media addiction and coping strategies among Chilean adolescents during the pandemic",https://pubmed.ncbi.nlm.nih.gov/37711427,
LitCovid,Remodeling Broken Systems: Addressing the National Emergency in Child and Adolescent Mental Health,https://pubmed.ncbi.nlm.nih.gov/37711021,
LitCovid,"Impact of the COVID-19 Pandemic on the Management of Gallbladder, Biliary Tract, and Pancreatic Diseases",https://pubmed.ncbi.nlm.nih.gov/37711944,
LitCovid,"HEALing Our Nation - Health Equity Achieved Through Lifestyle Medicine Capturing Highlights From the ""HEALing Our Nation"" Session at LM2023 and Outlining the Important Work of the HEAL Initiative",https://pubmed.ncbi.nlm.nih.gov/37711350,
LitCovid,Validation of the CALL score as a mortality prediction tool in a cohort of hospitalized COVID-19 patients in Chile,https://pubmed.ncbi.nlm.nih.gov/37711735,
LitCovid,[Impact of COVID-19 on primary percutaneous coronary intervention in patients with acute ST segment elevation myocardial infarction in Beijing],https://pubmed.ncbi.nlm.nih.gov/37709715,
LitCovid,"Healthcare Professionals' Experiences During the COVID-19 Pandemic in Sudan: A Cross-Sectional Survey Assessing Quality of Life, Mental Health, and Work-Life-Balance",https://pubmed.ncbi.nlm.nih.gov/37711157,
LitCovid,What's Trending? Reach and Content of the Society for Maternal-Fetal Medicine on Social Media,https://pubmed.ncbi.nlm.nih.gov/37709050,
LitCovid,Food bank operations: review of operation research methods and challenges during COVID-19,https://pubmed.ncbi.nlm.nih.gov/37710215,
LitCovid,"Telehealth access, willingness, and barriers during the COVID-19 pandemic among a nationally representative diverse sample of U.S. adults with and without chronic health conditions.",https://pubmed.ncbi.nlm.nih.gov/37709268,
LitCovid,"Vaccination coverage survey of children aged 1-3 years in Beijing, China, 2005-2021",https://pubmed.ncbi.nlm.nih.gov/37709591,
LitCovid,Successful Shoulder Disarticulation under Local Anesthesia in the COVID-19 Era,https://pubmed.ncbi.nlm.nih.gov/37711723,
LitCovid,Associations between weight discrimination and the use of potentially harmful dietary supplements during the COVID-19 pandemic in the United States,https://pubmed.ncbi.nlm.nih.gov/37708694,
LitCovid,Cardiac Tamponade Secondary to Hemorrhagic Pericardial Effusion: A Complication of STEMI,https://pubmed.ncbi.nlm.nih.gov/37711482,
LitCovid,A learning process to deliver virtual staff training involving patients in shared haemodialysis care,https://pubmed.ncbi.nlm.nih.gov/37711637,
LitCovid,Machine learning augmentation reduces prediction error in collective forecasting: development and validation across prediction markets with application to COVID events,https://pubmed.ncbi.nlm.nih.gov/37708701,
LitCovid,Emotions behind a mask: the value of disgust,https://pubmed.ncbi.nlm.nih.gov/37709796,
LitCovid,The Sociodemographic Characteristics of Indian Nursing Students and Their Intentions to Migrate Overseas for Work,https://pubmed.ncbi.nlm.nih.gov/37709271,
LitCovid,Using telemedicine to improve early medical abortion at home (UTAH): a randomised controlled trial to compare telemedicine with in-person consultation for early medical abortion,https://pubmed.ncbi.nlm.nih.gov/37709327,
LitCovid,Extracellular vesicles in acute respiratory distress syndrome: Understanding protective and harmful signaling for the development of new therapeutics,https://pubmed.ncbi.nlm.nih.gov/37712224,
LitCovid,A Theoretical Framework on the Biology of Prion Diseases,https://pubmed.ncbi.nlm.nih.gov/37711486,
LitCovid,"Feasibility, Tolerability and efficacy of the ketogenic diet in children with drug-resistant epilepsy in Vietnam",https://pubmed.ncbi.nlm.nih.gov/37712338,
LitCovid,Exploring subjective responses in high-intensity multimodal training: an online cross-sectional survey,https://pubmed.ncbi.nlm.nih.gov/37709335,
LitCovid,"Consumers' experiences, preferences, and perceptions of effectiveness in using telehealth for cancer care in Australia",https://pubmed.ncbi.nlm.nih.gov/37712136,
LitCovid,Clinical outcomes of aspergillosis among paediatric and adult inpatients: A multicentre study in a Brazilian metropolitan area,https://pubmed.ncbi.nlm.nih.gov/37708696,
LitCovid,Do masks cover more than just a face? A study on how facemasks affect the perception of emotional expressions according to their degree of intensity,https://pubmed.ncbi.nlm.nih.gov/37709269,
LitCovid,Electronic health records identify timely trends in childhood mental health conditions,https://pubmed.ncbi.nlm.nih.gov/37710303,
LitCovid,Light chain of a public SARS-CoV-2 class-3 antibody modulates neutralization against Omicron,https://pubmed.ncbi.nlm.nih.gov/37708028,
LitCovid,HLA class I associations with the severity of COVID-19 disease in the United Arab Emirates,https://pubmed.ncbi.nlm.nih.gov/37708194,
LitCovid,From past to present: Exploring COVID-19 in Qatar's hemodialysis population across Omicron dominant and pre-Omicron periods,https://pubmed.ncbi.nlm.nih.gov/37708230,
LitCovid,Therapeutic plasma exchange decreases plasma anti-SARS-CoV-2 spike IgG without increasing the proximate incidence of COVID-19,https://pubmed.ncbi.nlm.nih.gov/37706521,
LitCovid,Risk factors associated with COVID-19 pneumonia in Chinese patients with pre-existing interstitial lung disease during the SARS-CoV-2 pandemic,https://pubmed.ncbi.nlm.nih.gov/37707416,
LitCovid,The Gabrin Sign's Potential for Identifying High-Risk Patients for COVID-19 with Androgenic Alopecia,https://pubmed.ncbi.nlm.nih.gov/37708567,
LitCovid,Characterization of IL-10 Family of Cytokines in Acute and Convalescent COVID-19 Individuals,https://pubmed.ncbi.nlm.nih.gov/37708007,
LitCovid,From Archipelago to Pandemic Battleground: Unveiling Indonesia's COVID-19 Crisis,https://pubmed.ncbi.nlm.nih.gov/37707715,
LitCovid,Performance characteristics and operational feasibility assessment of a CRISPR based tata MD CHECK diagnostic test for SARS-CoV-2 (COVID-19),https://pubmed.ncbi.nlm.nih.gov/37708211,
LitCovid,"Immune response, phenotyping and molecular graft surveillance in kidney transplant recipients following severe acute respiratory syndrome coronavirus 2 vaccination",https://pubmed.ncbi.nlm.nih.gov/37707287,
LitCovid,Animal efficacy study of a plant extract complex (BEN815) as a potential treatment for COVID-19,https://pubmed.ncbi.nlm.nih.gov/37708114,
LitCovid,Broad-spectrum vaccine via combined immunization routes triggers potent immunity to SARS-CoV-2 and its variants,https://pubmed.ncbi.nlm.nih.gov/37706688,
LitCovid,Use of Additional Corticosteroids in Nonresolving COVID-19-Associated Acute Respiratory Distress Syndrome: A Resolved Issue?,https://pubmed.ncbi.nlm.nih.gov/37707381,
LitCovid,"The impact of the SARS-CoV-2 pandemic on the demographic, clinical and social profiles of patients admitted to the Pneumology Department for a COPD exacerbation",https://pubmed.ncbi.nlm.nih.gov/37708160,
LitCovid,Temporal trends in hospitalizations and 30-day mortality in older patients during the COVID pandemic from March 2020 to July 2021,https://pubmed.ncbi.nlm.nih.gov/37708110,
LitCovid,"Collective trauma: Childhood abuse, perceived discrimination, and COVID-19",https://pubmed.ncbi.nlm.nih.gov/37707479,
LitCovid,Assessment of positive selection across SARS-CoV-2 variants via maximum likelihood,https://pubmed.ncbi.nlm.nih.gov/37708144,
LitCovid,Whole genome CRISPR screening strategy to identify genes contributing to SARS-CoV-2 spike and VSV-G mediated entry,https://pubmed.ncbi.nlm.nih.gov/37707319,
LitCovid,Hypothetical framework for post-COVID 19 condition based on a fibromyalgia pathogenetic model,https://pubmed.ncbi.nlm.nih.gov/37707639,
LitCovid,Intra- vs. inter-host evolution of SARS-CoV-2 driven by uncorrelated selection -The evolution thwarted.,https://pubmed.ncbi.nlm.nih.gov/37707487,
LitCovid,When thinking you are better leads to feeling worse: Self-other asymmetries in pro-social behavior and increased anxiety during Covid-19,https://pubmed.ncbi.nlm.nih.gov/37708129,
LitCovid,Nanoscopic Elucidation of Spontaneous Self-Assembly of Severe Acute Respiratory Syndrome Coronavirus 2 (SARS-CoV-2) Open Reading Frame 6 (ORF6) Protein,https://pubmed.ncbi.nlm.nih.gov/37707320,
LitCovid,Primate field research during a pandemic: Lessons learned from the SARS-CoV-2 outbreak,https://pubmed.ncbi.nlm.nih.gov/37706674,
LitCovid,Leisure time physical activity and exercise performance in active older people in rural areas-Comparison of the first and second COVID-19 related lockdown in Germany,https://pubmed.ncbi.nlm.nih.gov/37708185,
LitCovid,"Idiopathic pulmonary fibrosis (IPF): disease pathophysiology, targets, and potential therapeutic interventions",https://pubmed.ncbi.nlm.nih.gov/37707699,
LitCovid,"Evusheld, a SARS-CoV-2 spike protein-directed attachment inhibitor, appears in serum protein electrophoresis and immunofixation: a case study",https://pubmed.ncbi.nlm.nih.gov/37707512,
LitCovid,Regulating Movement in Pandemic Times,https://pubmed.ncbi.nlm.nih.gov/37707767,
LitCovid,"Symptoms, care consumption, and healthcare costs in hospitalized patients during the first wave of the COVID-19 pandemic",https://pubmed.ncbi.nlm.nih.gov/37708157,
LitCovid,Disparities in Offering Enrollment in Remote Patient Monitoring for COVID-19,https://pubmed.ncbi.nlm.nih.gov/37707989,
LitCovid,Rates of John Cunningham virus seroconversion greatly reduced in natalizumab-treated patients during COVID-19-related lockdowns,https://pubmed.ncbi.nlm.nih.gov/37707348,
LitCovid,An Analysis of Infection Prevention and Control Practices in Designated Hospitals that Treat COVID-19: A Systematic Review and Meta-Analysis,https://pubmed.ncbi.nlm.nih.gov/37708537,
LitCovid,A computational approach to identifiability analysis for a model of the propagation and control of COVID-19 in Chile,https://pubmed.ncbi.nlm.nih.gov/37708159,
LitCovid,"The role of civil society organizations (CSOs) in the COVID-19 response across the Global South: A multinational, qualitative study",https://pubmed.ncbi.nlm.nih.gov/37708149,
LitCovid,An Exploratory Study of the Impact of COVID-19 Vaccine Spontaneous Reporting on Masking Signal Detection in EudraVigilance,https://pubmed.ncbi.nlm.nih.gov/37707778,
LitCovid,Multi-antigen pan-sarbecovirus DNA vaccines generate protective T cell immune responses,https://pubmed.ncbi.nlm.nih.gov/37707962,
LitCovid,[Pudov Surgical care in a multi-field hospital during the new coronavirus infection pandemic (SARS-COVID-19): a 5-year experience],https://pubmed.ncbi.nlm.nih.gov/37707332,
LitCovid,"Cross-sectional study of physical activity, dietary habits, and mental health of veterinary students after lifting of COVID-19 pandemic measures",https://pubmed.ncbi.nlm.nih.gov/37708218,
LitCovid,Omics data analysis reveals common molecular basis of small cell lung cancer and COVID-19,https://pubmed.ncbi.nlm.nih.gov/37708006,
LitCovid,The impact of reduced worry on general functioning: A mediation analysis from a randomized trial,https://pubmed.ncbi.nlm.nih.gov/37706604,
LitCovid,Emotional responses to COVID-19 stressors increase information avoidance about an important unrelated health threat,https://pubmed.ncbi.nlm.nih.gov/37708142,
LitCovid,Ambulatory extracorporeal membrane oxygenation simulator: The next frontier in clinical training,https://pubmed.ncbi.nlm.nih.gov/37707960,
LitCovid,The Use of Antimicrobial Drug in Patients During the COVID-19 Pandemic: A Meta-Analysis,https://pubmed.ncbi.nlm.nih.gov/37708540,
LitCovid,Context Matters: Patterns in Physical Distancing Behavior Across Situations and Over Time During the Covid-19 Pandemic in the Netherlands,https://pubmed.ncbi.nlm.nih.gov/37708324,
LitCovid,Global implementation research capacity building to address cardiovascular disease: An assessment of efforts in eight countries,https://pubmed.ncbi.nlm.nih.gov/37708090,
LitCovid,"Texas Developmental Center for AIDS Research CFAR Diversity, Equity, and Inclusion Pathway Initiative Program",https://pubmed.ncbi.nlm.nih.gov/37707853,
