feed,title,long_url,short_url
GN:T:SL,"New Zealand’s sea temperatures hit record highs, outstripping global averages - The Guardian",https://news.google.com/rss/articles/CBMibmh0dHBzOi8vd3d3LnRoZWd1YXJkaWFuLmNvbS93b3JsZC9hcnRpY2xlLzIwMjQvanVsLzEwL25ldy16ZWFsYW5kLXNlYS10ZW1wZXJhdHVyZXMtcmVjb3JkLWhpZ2hzLWdsb2JhbC1hdmVyYWdl0gEA?oc=5,https://da.gd/YimK4z
GN:T:SL,‘Stark warning’ as global temperatures hit record levels for 13th month - Al Jazeera English,https://news.google.com/rss/articles/CBMibWh0dHBzOi8vd3d3LmFsamF6ZWVyYS5jb20vbmV3cy8yMDI0LzcvOC9zdGFyay13YXJuaW5nLWFzLWdsb2JhbC10ZW1wZXJhdHVyZXMtaGl0LXJlY29yZC1sZXZlbHMtZm9yLTEzdGgtbW9udGjSAXFodHRwczovL3d3dy5hbGphemVlcmEuY29tL2FtcC9uZXdzLzIwMjQvNy84L3N0YXJrLXdhcm5pbmctYXMtZ2xvYmFsLXRlbXBlcmF0dXJlcy1oaXQtcmVjb3JkLWxldmVscy1mb3ItMTN0aC1tb250aA?oc=5,https://da.gd/6TfWcN
GN:T:SL,FEMA will now consider climate change when it rebuilds after floods - Grist,https://news.google.com/rss/articles/CBMiSGh0dHBzOi8vZ3Jpc3Qub3JnL2V4dHJlbWUtd2VhdGhlci9mZW1hLWZsb29kLXJ1bGVzLWNsaW1hdGUtY2hhbmdlLWJpZGVuL9IBAA?oc=5,https://da.gd/w9ioA
GN:T:SL,New Jersey’s first offshore wind project approved by federal government - Blackchronicle,https://news.google.com/rss/articles/CBMiaWh0dHBzOi8vYmxhY2tjaHJvbmljbGUuY29tL2VuZXJneS9uZXctamVyc2V5cy1maXJzdC1vZmZzaG9yZS13aW5kLXByb2plY3QtYXBwcm92ZWQtYnktZmVkZXJhbC1nb3Zlcm5tZW50L9IBAA?oc=5,https://da.gd/rFFbK
GN:T:SL,"What does contributions of different water sources to Mochhu mean? - Kuensel, Buhutan's National Newspaper",https://news.google.com/rss/articles/CBMiXGh0dHBzOi8va3VlbnNlbG9ubGluZS5jb20vd2hhdC1kb2VzLWNvbnRyaWJ1dGlvbnMtb2YtZGlmZmVyZW50LXdhdGVyLXNvdXJjZXMtdG8tbW9jaGh1LW1lYW4v0gEA?oc=5,https://da.gd/AJbAhe
GN:T:SL,Climate research on big ocean islands - Nature,https://news.google.com/rss/articles/CBMiMmh0dHBzOi8vd3d3Lm5hdHVyZS5jb20vYXJ0aWNsZXMvczQxNTU4LTAyNC0wMjA1My040gEA?oc=5,https://da.gd/E2tt
GN:T:SL,Dubai's beach expansion holds 'ecological benefit' to wider coastal restoration plan - The National,https://news.google.com/rss/articles/CBMihgFodHRwczovL3d3dy50aGVuYXRpb25hbG5ld3MuY29tL25ld3MvdWFlLzIwMjQvMDcvMTAvZHViYWlzLWJlYWNoLWV4cGFuc2lvbi1ob2xkcy1lY29sb2dpY2FsLWJlbmVmaXQtdG8td2lkZXItY29hc3RhbC1yZXN0b3JhdGlvbi1wbGFuL9IBAA?oc=5,https://da.gd/r7U28s
