feed,title,long_url,short_url
GN:T:RE,"China launches investigation in response to EU probes of solar, wind power and other products - The Associated Press",https://news.google.com/rss/articles/CBMiaWh0dHBzOi8vYXBuZXdzLmNvbS9hcnRpY2xlL2NoaW5hLWV1LXRyYWRlLWludmVzdGlnYXRpb24tZ3JlZW4tdGVjaG5vbG9neS1lODY2YjhhNjQ3YjBkZDdmM2FmNTRlYTQ2NmZmMzMyMdIBAA?oc=5,https://da.gd/eFGML
GN:T:RE,China Opens Tit-for-Tat Investigation Into EU Trade Barriers - Bloomberg,https://news.google.com/rss/articles/CBMicmh0dHBzOi8vd3d3LmJsb29tYmVyZy5jb20vbmV3cy9hcnRpY2xlcy8yMDI0LTA3LTEwL2NoaW5hLWxhdW5jaGVzLXRpdC1mb3ItdGF0LWludmVzdGlnYXRpb24taW50by1ldS10cmFkZS1iYXJyaWVyc9IBAA?oc=5,https://da.gd/Dv1oG
GN:T:RE,New Michigan law takes some powers away from HOAs - Crain's Detroit Business,https://news.google.com/rss/articles/CBMiXmh0dHBzOi8vd3d3LmNyYWluc2RldHJvaXQuY29tL3BvbGl0aWNzLXBvbGljeS9uZXctbWljaGlnYW4taG9hLWxhdy13b250LWFsbG93LXNvbGFyLXBhbmVsLWJhbnPSAQA?oc=5,https://da.gd/nKVYr
GN:T:RE,Marshalltown issues new solar panel ordinance - KCCI Des Moines,https://news.google.com/rss/articles/CBMiU2h0dHBzOi8vd3d3LmtjY2kuY29tL2FydGljbGUvbWFyc2hhbGx0b3duLWlzc3Vlcy1uZXctc29sYXItcGFuZWwtb3JkaW5hbmNlLzYxNTQ4MTYz0gEA?oc=5,https://da.gd/0yfG74
GN:T:RE,Recovering Hydropower Set to Reduce Fossil Fuels Growth - OilPrice,https://news.google.com/rss/articles/CBMib2h0dHBzOi8vb2lscHJpY2UuY29tL0xhdGVzdC1FbmVyZ3ktTmV3cy9Xb3JsZC1OZXdzL1JlY292ZXJpbmctSHlkcm9wb3dlci1TZXQtdG8tUmVkdWNlLUZvc3NpbC1GdWVscy1Hcm93dGguaHRtbNIBAA?oc=5,https://da.gd/6F7uGb
GN:T:RE,Subsea cable manufacturer for offshore wind farms coming to Chesapeake - 13newsnow,https://news.google.com/rss/articles/CBMiyAFodHRwczovL3d3dy4xM25ld3Nub3cuY29tL2FydGljbGUvbmV3cy9sb2NhbC9teWNpdHkvY2hlc2FwZWFrZS9zdWJzZWEtY2FibGUtbWFudWZhY3R1cmVyLW9mZnNob3JlLXdpbmQtZmFybXMtY2hlc2FwZWFrZWxzLWdyZWVubGluay11c2EtaW5mbGF0aW9uLXJlZHVjdGlvbi1hY3QvMjkxLWZhNTNmYWU4LWQ4NmYtNGMzYy04MGU2LTE4ZTEwOTM0YTQ1ZNIBAA?oc=5,https://da.gd/PoDYb
GN:T:RE,Sheepish solar symbiosis: Two very different industries work together on the green energy transition - MPR News,https://news.google.com/rss/articles/CBMiYWh0dHBzOi8vd3d3Lm1wcm5ld3Mub3JnL3N0b3J5LzIwMjQvMDcvMTAvbWlubmVzb3RhLXNvbGFyLWZhcm1zLWFuZC1zaGVlcC1sZWFkLXdheS1pbi1ncmVlbi1lbmVyZ3nSAQA?oc=5,https://da.gd/0rCo2
GN:T:RE,A nuclear accident made Three Mile Island infamous. AI’s needs may revive it. - The Washington Post,https://news.google.com/rss/articles/CBMiZWh0dHBzOi8vd3d3Lndhc2hpbmd0b25wb3N0LmNvbS9idXNpbmVzcy8yMDI0LzA3LzEwL3RocmVlLW1pbGUtaXNsYW5kLW51Y2xlYXItYXJ0aWZpY2lhbC1pbnRlbGxpZ2VuY2Uv0gEA?oc=5,https://da.gd/PhWZs
