feed,title,long_url,short_url
GN:T:WP,EU unveils sweeping climate change plan - BBC News,https://www.bbc.com/news/world-europe-57833807,
GN:T:WP,"Without offshore wind, NJ faces billions in shoreline damage, officials argue - Asbury Park Press",https://www.app.com/story/news/local/land-environment/2021/07/14/new-jersey-needs-offshore-wind-avoid-billions-damage-officials-claim/7932984002/,
GN:T:WP,Apex Clean Energy and Plug Power Partner on Largest Green - GlobeNewswire,https://www.globenewswire.com/news-release/2021/07/14/2262627/9619/en/Apex-Clean-Energy-and-Plug-Power-Partner-on-Largest-Green-Hydrogen-Power-Purchase-Agreement-in-the-United-States.html,
GN:T:WP,El Salvador's First Wind Farm Comes Online - North American Windpower,https://nawindpower.com/el-salvadors-first-wind-farm-comes-online,
GN:T:WP,Transmission delay 'could slow Colombian wind rush' - Windpower Monthly,https://www.windpowermonthly.com/article/1722170/transmission-delay-could-slow-colombian-wind-rush,
GN:T:WP,"New Ohio law authorizes local control over solar, wind projects - Hillsboro Times Gazette",https://www.timesgazette.com/news/58166/new-ohio-law-authorizes-local-control-over-solar-wind-projects,
GN:T:WP,Site in New England identified for nation’s 1st floating offshore wind research area - MassLive,https://www.masslive.com/news/2021/07/site-in-new-england-identified-for-nations-1st-floating-offshore-wind-research-area.html,
GN:T:WP,ICR to Deliver Services for All Shell's UKCS Assets - Offshore Engineer,https://www.oedigital.com/news/489162-icr-to-deliver-services-for-all-shell-s-ukcs-assets,
