feed,title,long_url,short_url
GN:T:WP,County approves Rail Tie permit application | News | wyomingnews.com - Wyoming Tribune,https://www.wyomingnews.com/laramieboomerang/news/county-approves-rail-tie-permit-application/article_5f226c25-194d-5171-8c28-fc91946704c5.html,
GN:T:WP,Ørsted announces bid to expand Skipjack wind farm - DBT - Delaware Business Times,https://delawarebusinesstimes.com/news/orated-skipjack-wind-2/,
GN:T:WP,Poland to buy 250 U.S. tanks as it seeks to beef up defences - Yahoo News,https://news.yahoo.com/poland-buy-250-u-tanks-112641227.html,
GN:T:WP,Elon Musk is building the first solar-powered town in the US | TheHill - The Hill,https://thehill.com/changing-america/sustainability/energy/562967-elon-musk-is-building-the-first-solar-powered-town-in,
GN:T:WP,$27m DoE funding to advance wave energy solutions development - Power Engineering International,https://www.powerengineeringint.com/renewables/marine/27m-doe-funding-to-advance-us-wave-energy-solutions/,
GN:T:WP,Energizing Navajo Nation: How electrification can secure a sustainable future for Indian Country - Brookings Institution,https://www.brookings.edu/blog/how-we-rise/2021/07/14/energizing-navajo-nation-how-electrification-can-secure-a-sustainable-future-for-indian-country/,
