feed,title,long_url,short_url
GN:T:AI,Generative AI for cybersecurity: Is it right for your organization? - Fast Company,https://news.google.com/rss/articles/CBMiZmh0dHBzOi8vd3d3LmZhc3Rjb21wYW55LmNvbS85MTEyNTg5My9nZW5lcmF0aXZlLWFpLWZvci1jeWJlcnNlY3VyaXR5LWlzLWl0LXJpZ2h0LWZvci15b3VyLW9yZ2FuaXphdGlvbtIBAA?oc=5,https://da.gd/uK1k7m
GN:T:AI,Gracia AI raises $1.2M for creating photorealistic volumetric spatial videos - VentureBeat,https://news.google.com/rss/articles/CBMiamh0dHBzOi8vdmVudHVyZWJlYXQuY29tL2dhbWVzL2dyYWNpYS1haS1yYWlzZXMtMS0ybS1mb3ItY3JlYXRpbmctcGhvdG9yZWFsaXN0aWMtdm9sdW1ldHJpYy1zcGF0aWFsLXZpZGVvcy_SAQA?oc=5,https://da.gd/8oI4l
GN:T:AI,AI will be incompatible with anti-fossil energy activism - The Hill,https://news.google.com/rss/articles/CBMicGh0dHBzOi8vdGhlaGlsbC5jb20vb3Bpbmlvbi9lbmVyZ3ktZW52aXJvbm1lbnQvNDcyMTc2NC1haS13aWxsLWJlLWluY29tcGF0aWJsZS13aXRoLWFudGktZm9zc2lsLWVuZXJneS1hY3RpdmlzbS_SAXRodHRwczovL3RoZWhpbGwuY29tL29waW5pb24vZW5lcmd5LWVudmlyb25tZW50LzQ3MjE3NjQtYWktd2lsbC1iZS1pbmNvbXBhdGlibGUtd2l0aC1hbnRpLWZvc3NpbC1lbmVyZ3ktYWN0aXZpc20vYW1wLw?oc=5,https://da.gd/sT7tKg
GN:T:AI,Microsoft's Japan chief sees country accelerating its use of AI - The Japan Times,https://news.google.com/rss/articles/CBMiTmh0dHBzOi8vd3d3LmphcGFudGltZXMuY28uanAvYnVzaW5lc3MvMjAyNC8wNi8xNy9jb21wYW5pZXMvbWljcm9zb2Z0LWphcGFuLWFpL9IBAA?oc=5,https://da.gd/NggVi
GN:T:AI,Want an AI career? These colleges offer degrees for the best chance - Fox Business,https://news.google.com/rss/articles/CBMiWGh0dHBzOi8vd3d3LmZveGJ1c2luZXNzLmNvbS90ZWNobm9sb2d5L3dhbnQtYWktY2FyZWVyLWNvbGxlZ2VzLW9mZmVyLWRlZ3JlZXMtYmVzdC1jaGFuY2XSAVxodHRwczovL3d3dy5mb3hidXNpbmVzcy5jb20vdGVjaG5vbG9neS93YW50LWFpLWNhcmVlci1jb2xsZWdlcy1vZmZlci1kZWdyZWVzLWJlc3QtY2hhbmNlLmFtcA?oc=5,https://da.gd/JYDK
GN:T:AI,Microsoft and Qualcomm unveil AI-powered Copilot+ PC: pre-orders surpass expectations - DIGITIMES,https://news.google.com/rss/articles/CBMiWmh0dHBzOi8vd3d3LmRpZ2l0aW1lcy5jb20vbmV3cy9hMjAyNDA2MTdQRDIwNC9taWNyb3NvZnQtcXVhbGNvbW0tY29waWxvdC1haS1wYy1kZW1hbmQuaHRtbNIBAA?oc=5,https://da.gd/LtrWWq
GN:T:AI,Palantir's Artificial Intelligence (AI) Platform Soars. Is This the Stock's Secret Weapon? - The Motley Fool,https://news.google.com/rss/articles/CBMiXWh0dHBzOi8vd3d3LmZvb2wuY29tL2ludmVzdGluZy8yMDI0LzA2LzE3L3BhbGFudGlycy1hcnRpZmljaWFsLWludGVsbGlnZW5jZS1haS1wbGF0Zm9ybS1zb2FyL9IBAA?oc=5,https://da.gd/Kva8
GN:T:AI,Can A.I. Answer the Needs of Smaller Businesses? Some Push to Find Out. - The New York Times,https://news.google.com/rss/articles/CBMiX2h0dHBzOi8vd3d3Lm55dGltZXMuY29tLzIwMjQvMDYvMTcvYnVzaW5lc3MvZWNvbm9teS9hcnRpZmljaWFsLWludGVsbGlnZW5jZS1zbWFsbC1idXNpbmVzcy5odG1s0gEA?oc=5,https://da.gd/MBhG
