feed,title,long_url,short_url
GN:S:C,Heavy rains brought on by climate change called a threat to Owasco Lake - The Citizen,https://auburnpub.com/news/local/heavy-rains-brought-on-by-climate-change-called-a-threat-to-owasco-lake/article_030e9146-da9e-5043-928a-b129d1440bc5.html,
GN:S:C,Researchers are mapping the effects of climate change on Walden Pond—with help from Thoreau. - Literary Hub,https://lithub.com/researchers-are-mapping-the-effects-of-climate-change-on-walden-pond-with-help-from-thoreau/,
GN:S:C,City Council Approves Coronado's Climate Action Plan - Coronado Times Newspaper,https://coronadotimes.com/news/2022/03/19/city-council-approves-coronados-climate-action-plan/,
GN:S:C,Climate change is here today - The New Statesman,https://www.newstatesman.com/spotlight/energy/2022/03/climate-change-is-here-today,
GN:S:C,"Kinder Morgan, Enbridge urge FERC not to apply tough new climate policy (NYSE:KMI) - Seeking Alpha",https://seekingalpha.com/news/3815091-kinder-morgan-enbridge-urge-ferc-not-to-apply-tough-new-climate-policy,
