feed,title,long_url,short_url
GN:T:SL,NW Minnesota flooding: Red Lake River crests in Crookston; water levels rising elsewhere - MPR News,https://www.mprnews.org/story/2022/04/25/nw-minnesota-flooding-red-lake-river-crests-in-crookston-water-levels-rising-elsewhere,
GN:T:SL,Louisiana's coastal communities could see $5.5B in damages in worst-case climate change scenario - NOLA,https://www.nola.com/news/environment/article_5c828372-c25c-11ec-96ee-83a2a25ac3de.html,
GN:T:SL,How the US military is waging war on climate change - Task & Purpose,https://taskandpurpose.com/news/military-climate-change-war/,
GN:T:SL,Controversy Follows California's Massive Desalination Plant Proposal - Planetizen,https://www.planetizen.com/news/2022/04/116942-controversy-follows-californias-massive-desalination-plant-proposal,
GN:T:SL,Muography for a dense tide monitoring network | Scientific Reports - Nature,https://www.nature.com/articles/s41598-022-10373-y,
GN:T:SL,"John Oliver sends man in polar bear suit to Nenana, pledges $10K to Food Bank of Alaska - Alaska Public Media News",https://www.alaskapublic.org/2022/04/01/john-oliver-sends-man-in-polar-bear-suit-to-nenana-pledges-10k-to-food-bank-of-alaska/,
