feed,title,long_url,short_url
MX,Summer colds: This may explain why so many have suffered them this year,https://medicalxpress.com/news/2022-08-summer-colds-year.html,https://bit.ly/3pwU1VO
MX,Is it Parkinson's? These 10 signs could tell,https://medicalxpress.com/news/2022-08-parkinson.html,https://bit.ly/3Avx0bY
MX,Surgical procedure volumes dropped during COVID-19 peak,https://medicalxpress.com/news/2022-08-surgical-procedure-volumes-covid-peak.html,https://bit.ly/3A7Oyt9
MX,COVID vaccines reduce mortality rates in deprived areas in England,https://medicalxpress.com/news/2022-08-covid-vaccines-mortality-deprived-areas.html,https://bit.ly/3dLYqS9
MX,Increased demand for paramedic transports contributes to emergency department wait times in Canada,https://medicalxpress.com/news/2022-08-demand-paramedic-contributes-emergency-department.html,https://bit.ly/3AAMBqS
MX,Research examines barriers to treatment of COVID-19 in Cincinnati Latinx families,https://medicalxpress.com/news/2022-08-barriers-treatment-covid-cincinnati-latinx.html,https://bit.ly/3AdjLeN
MX,What's the secret of the 15% of British people who've never had COVID?,https://medicalxpress.com/news/2022-08-secret-british-people-whove-covid.html,https://bit.ly/3CmNcNY
