feed,title,long_url,short_url
GN:T:RE,State’s big bet on wind power pumps new life into old town that once smelled like ‘rotten eggs’ - NJ,https://www.nj.com/business/2021/09/njs-big-bet-on-wind-power-pumps-new-life-into-old-town-that-once-smelled-like-rotten-eggs.html,
GN:T:RE,Build Back Better Act will help national labs jump-start technologies of tomorrow | TheHill - The Hill,https://thehill.com/blogs/congress-blog/technology/574038-build-back-better-act-will-help-national-labs-jump-start,
GN:T:RE,Wisconsin's Newest Large-Scale Solar Energy Facility Now Operating In the Lakeshore Area - seehafernews,https://www.seehafernews.com/2021/09/26/wisconsins-newest-large-scale-solar-energy-facility-now-operating-in-the-lakeshore-area/,
GN:T:RE,The solar divide: Plans for large-scale solar projects in forests and on farms have riled neighbors who are fighting back - GazetteNET,https://www.gazettenet.com/The-solar-divide-solar-power-environment-forests-Amherst-ma-Shutesbury-ma-42535037,
GN:T:RE,Power problems: Could solar solve Nigeria’s electricity woes? - Al Jazeera English,https://www.aljazeera.com/economy/2021/9/27/power-problems-could-solar-solve-nigerias-electricity-woes,
GN:T:RE,TotalEnergies expects rise in use of renewable energy in future - Nasdaq,https://www.nasdaq.com/articles/totalenergies-expects-rise-in-use-of-renewable-energy-in-future-2021-09-27,
