feed,title,long_url,short_url
GN:S:C,June 11 - Draft Climate Resilience Strategy - Washington State Department of Ecology,https://news.google.com/rss/articles/CBMiY2h0dHBzOi8vZWNvbG9neS53YS5nb3YvYWJvdXQtdXMvd2hvLXdlLWFyZS9uZXdzLzIwMjQtbmV3cy1zdG9yaWVzL2RyYWZ0LWNsaW1hdGUtcmVzaWxpZW5jZS1zdHJhdGVnedIBAA?oc=5,https://da.gd/TF2dZD
GN:S:C,"Machine learning speeds up climate model simulations at finer resolutions, making them usable on local levels - Phys",https://news.google.com/rss/articles/CBMiUGh0dHBzOi8vcGh5cy5vcmcvbmV3cy8yMDI0LTA2LW1hY2hpbmUtY2xpbWF0ZS1zaW11bGF0aW9ucy1maW5lci1yZXNvbHV0aW9ucy5odG1s0gFPaHR0cHM6Ly9waHlzLm9yZy9uZXdzLzIwMjQtMDYtbWFjaGluZS1jbGltYXRlLXNpbXVsYXRpb25zLWZpbmVyLXJlc29sdXRpb25zLmFtcA?oc=5,https://da.gd/vMaU
GN:S:C,What questions do you have about climate and environment in Mississippi? - Mississippi Today,https://news.google.com/rss/articles/CBMicGh0dHBzOi8vbWlzc2lzc2lwcGl0b2RheS5vcmcvMjAyNC8wNi8xMS93aGF0LXF1ZXN0aW9ucy1kby15b3UtaGF2ZS1hYm91dC1jbGltYXRlLWFuZC1lbnZpcm9ubWVudC1pbi1taXNzaXNzaXBwaS_SAQA?oc=5,https://da.gd/lLCQ
GN:S:C,The Trust for Governors Island receives climate-friendly outdoor equipment from STIHL - Brooklyn Daily Eagle,https://news.google.com/rss/articles/CBMihAFodHRwczovL2Jyb29rbHluZWFnbGUuY29tL2FydGljbGVzLzIwMjQvMDYvMTEvdGhlLXRydXN0LWZvci1nb3Zlcm5vcnMtaXNsYW5kLXJlY2VpdmVzLWNsaW1hdGUtZnJpZW5kbHktb3V0ZG9vci1lcXVpcG1lbnQtZnJvbS1zdGlobC_SAQA?oc=5,https://da.gd/7ywb
GN:S:C,Qlik analytics suite helps cities combat climate change - TechTarget,https://news.google.com/rss/articles/CBMicmh0dHBzOi8vd3d3LnRlY2h0YXJnZXQuY29tL3NlYXJjaGJ1c2luZXNzYW5hbHl0aWNzL2ZlYXR1cmUvUWxpay1hbmFseXRpY3Mtc3VpdGUtaGVscHMtY2l0aWVzLWNvbWJhdC1jbGltYXRlLWNoYW5nZdIBAA?oc=5,https://da.gd/aKOUE
GN:S:C,From Adam and Eve to climate change - theSun,https://news.google.com/rss/articles/CBMiTWh0dHBzOi8vdGhlc3VuLm15L29waW5pb24tbmV3cy9mcm9tLWFkYW0tYW5kLWV2ZS10by1jbGltYXRlLWNoYW5nZS1PQTEyNTYwMzU40gEA?oc=5,https://da.gd/62Ie3
