feed,title,long_url,short_url
MX,Analysis reveals lack of essential vitamins and minerals common in people with type 2 diabetes,https://medicalxpress.com/news/2025-01-analysis-reveals-lack-essential-vitamins.html,https://da.gd/3ZVx
MX,"Replacing meat with plant-based alternatives reduces total cholesterol, LDL cholesterol and weight, study finds",https://medicalxpress.com/news/2025-01-meat-based-alternatives-total-cholesterol.html,https://da.gd/7SssIi
MX,Calorie labels on menus could make eating disorders worse,https://medicalxpress.com/news/2025-01-calorie-menus-disorders-worse.html,https://da.gd/5vi1
MX,Q&A: Does bird flu affect my food?,https://medicalxpress.com/news/2025-01-qa-bird-flu-affect-food.html,https://da.gd/JtNHYi
MX,"Americans' support for school vaccine mandates remains strong, but opt-out options gain traction",https://medicalxpress.com/news/2025-01-americans-school-vaccine-mandates-strong.html,https://da.gd/GSjyQW
