feed,title,long_url,short_url
ArXiv,Multi-Agent Reinforcement Learning with Common Policy for Antenna Tilt Optimization,https://arxiv.org/abs/2302.12899v1,
ArXiv,The Dormant Neuron Phenomenon in Deep Reinforcement Learning,https://arxiv.org/abs/2302.12902v1,
ArXiv,Exponential Hardness of Reinforcement Learning with Linear Function Approximation,https://arxiv.org/abs/2302.12940v1,
ArXiv,Autonomous Exploration and Mapping for Mobile Robots via Cumulative Curriculum Reinforcement Learning,https://arxiv.org/abs/2302.13025v1,
ArXiv,Provably Efficient Gauss-Newton Temporal Difference Learning Method with Function Approximation,https://arxiv.org/abs/2302.13087v1,
ArXiv,Hierarchical Needs-driven Agent Learning Systems: From Deep Reinforcement Learning To Diverse Strategies,https://arxiv.org/abs/2302.13132v1,
ArXiv,A Human-Centered Safe Robot Reinforcement Learning Framework with Interactive Behaviors,https://arxiv.org/abs/2302.13137v1,
ArXiv,On Bellman's principle of optimality and Reinforcement learning for safety-constrained Markov decision process,https://arxiv.org/abs/2302.13152v1,
ArXiv,Understanding Adversarial Attacks on Observations in Deep Reinforcement Learning,https://arxiv.org/abs/2106.15860v3,
ArXiv,"A Review for Deep Reinforcement Learning in Atari:Benchmarks, Challenges, and Solutions",https://arxiv.org/abs/2112.04145v5,
ArXiv,Follow your Nose: Using General Value Functions for Directed Exploration in Reinforcement Learning,https://arxiv.org/abs/2203.00874v2,
ArXiv,Memory-efficient Reinforcement Learning with Knowledge Consolidation,https://arxiv.org/abs/2205.10868v4,
ArXiv,Tiered Reinforcement Learning: Pessimism in the Face of Uncertainty and Constant Regret,https://arxiv.org/abs/2205.12418v4,
ArXiv,Equivariant Reinforcement Learning for Quadrotor UAV,https://arxiv.org/abs/2206.01233v2,
ArXiv,Temporal Disentanglement of Representations for Improved Generalisation in Reinforcement Learning,https://arxiv.org/abs/2207.05480v4,
ArXiv,Global Convergence of Two-timescale Actor-Critic for Solving Linear Quadratic Regulator,https://arxiv.org/abs/2208.08744v2,
ArXiv,RTAW: An Attention Inspired Reinforcement Learning Method for Multi-Robot Task Allocation in Warehouse Environments,https://arxiv.org/abs/2209.05738v2,
ArXiv,Optimizing Crop Management with Reinforcement Learning and Imitation Learning,https://arxiv.org/abs/2209.09991v2,
ArXiv,Predict-and-Critic: Accelerated End-to-End Predictive Control for Cloud Computing through Reinforcement Learning,https://arxiv.org/abs/2212.01348v2,
ArXiv,Temporal Difference Learning with Compressed Updates: Error-Feedback meets Reinforcement Learning,https://arxiv.org/abs/2301.00944v2,
ArXiv,A Scale-Independent Multi-Objective Reinforcement Learning with Convergence Analysis,https://arxiv.org/abs/2302.04179v4,
ArXiv,A Survey on Causal Reinforcement Learning,https://arxiv.org/abs/2302.05209v2,
ArXiv,Take Me Home: Reversing Distribution Shifts using Reinforcement Learning,https://arxiv.org/abs/2302.10341v2,
ArXiv,Selective experience replay compression using coresets for lifelong deep reinforcement learning in medical imaging,https://arxiv.org/abs/2302.11510v2,
ArXiv,Reinforcement Learning based Autonomous Multi-Rotor Landing on Moving Platforms,https://arxiv.org/abs/2302.13192v1,
ArXiv,CrystalBox: Future-Based Explanations for DRL Network Controllers,https://arxiv.org/abs/2302.13483v1,
ArXiv,Revolutionizing Genomics with Reinforcement Learning Techniques,https://arxiv.org/abs/2302.13268v1,
ArXiv,A Finite Sample Complexity Bound for Distributionally Robust Q-learning,https://arxiv.org/abs/2302.13203v1,
