feed,title,long_url,short_url
GN:T:RE,Renewable Energy Credits Allow Companies to Overstate Emissions Reductions - Scientific American,https://www.scientificamerican.com/article/renewable-energy-credits-allow-companies-to-overstate-emissions-reductions/,
GN:T:RE,Study: In most cases entities behind Renewable Energy Certificates are not doing much for the climate - Tech Xplore,https://techxplore.com/news/2022-06-cases-entities-renewable-energy-certificates.html,
GN:T:RE,The weekend read: The dawn of deep green solar - pv magazine International,https://www.pv-magazine.com/2022/06/11/the-weekend-read-the-dawn-of-deep-green-solar/,
GN:T:RE,Wind power infrastructure hindering Japan defense radars: sources - Nippon,https://www.nippon.com/en/news/kd908355347533447168/wind-power-infrastructure-hindering-japan-defense-radars-sources.html,
GN:T:RE,New York has a chance to generate all its electricity from clean energy by 2030 - The Guardian,https://www.theguardian.com/commentisfree/2022/jun/11/new-york-has-a-chance-to-generate-all-its-electricity-from-clean-energy-by-2030,
GN:T:RE,"Pausing Solar Tariffs, Tesla's Stock Split And Quantum Computing For Sustainable Manufacturing - Forbes",https://www.forbes.com/sites/alexknapp/2022/06/11/pausing-solar-tariffs-teslas-stock-split-and-quantum-computing-for-sustainable-manufacturing/,
