feed,title,long_url,short_url
GN:T:WP,Rivian signs wind energy deal to power factory in Normal - WJBC News,https://www.wjbc.com/2022/12/07/rivian-signs-wind-energy-deal-to-power-factory-in-normal/,https://da.gd/E5s9OJ
GN:T:WP,Titan Wind Soars as Chinese Firm Buys Wind Power Gear Maker Strongwind for USD429 Million - Yicai Global,https://www.yicaiglobal.com/news/titan-wind-soars-as-chinese-firm-buys-wind-power-gear-maker-strongwind-for-usd429-million,https://da.gd/fAxLi
GN:T:WP,NJBPU Releases Guidance for 4 GW Offshore Wind Solicitation - North American Windpower,https://nawindpower.com/njbpu-releases-guidance-for-4-gw-offshore-wind-solicitation,https://da.gd/MShXo
GN:T:WP,Wind Power To Cut Cargo Ship Emissions 20% - CleanTechnica,https://cleantechnica.com/2022/12/06/wind-power-to-cut-cargo-ship-emissions-20/,https://da.gd/uBaV
GN:T:WP,Billionaire Forrest aims to develop 5 GW of wind farms by 2030 - Nasdaq,https://www.nasdaq.com/articles/billionaire-forrest-aims-to-develop-5-gw-of-wind-farms-by-2030,https://da.gd/8cLLM
GN:T:WP,Pampa Energía to supply renewable energy to Holcim Argentina - Global Cement,https://www.globalcement.com/news/item/15019-pampa-energia-to-supply-renewable-energy-to-holcim-argentina,https://da.gd/hmHZN
GN:T:WP,"Wind and solar power will top natural gas in Texas next year, EIA predicts - The Week",https://theweek.com/energy/1019043/texas-will-get-more-electricity-from-solar-and-wind-power-than-natural-gas-next-year,https://da.gd/gziT57
GN:T:WP,Engie CEO Says France Fell Behind in Wind Power Rollout - Offshore Engineer,https://www.oedigital.com/news/501422-engie-ceo-says-france-fell-behind-in-wind-power-rollout,https://da.gd/zOIRe
GN:T:WP,New MIT heat treatment could advance the 3D printing of energy-efficient turbine blades - 3D Printing Industry,https://3dprintingindustry.com/news/new-mit-heat-treatment-could-advance-the-3d-printing-of-energy-efficient-turbine-blades-218262/,https://da.gd/bjjGA
GN:T:WP,RWE to build 16.8 MWac PV plant at Hambach Mine - Greentech Lead,https://greentechlead.com/solar/rwe-to-build-16-8-mwac-pv-plant-at-hambach-mine-41451,https://da.gd/5rsn9
GN:T:WP,Two Thirds of Kaskasi Offshore Wind Turbines Feeding Electricity into German Grid - Offshore WIND,https://www.offshorewind.biz/2022/11/10/two-thirds-of-kaskasi-offshore-wind-turbines-feeding-electricity-into-german-grid/,https://da.gd/uyUem2
