feed,title,long_url,short_url
ArXiv:cs,Developing of a photonic hardware platform for brain-inspired computing based on $5\times5$ VCSEL arrays,https://arxiv.org/abs/2006.13933v1,
ArXiv:cs,XREF: Entity Linking for Chinese News Comments with Supplementary Article Reference,https://arxiv.org/abs/2006.14017v1,
ArXiv:cs,Explainable CNN-attention Networks (C-Attention Network) for Automated Detection of Alzheimer's Disease,https://arxiv.org/abs/2006.14135v1,
ArXiv:cs,Deep Learning for Cornea Microscopy Blind Deblurring,https://arxiv.org/abs/2006.14319v1,
ArXiv:cs,Differentially Private Health Tokens for Estimating COVID-19 Risk,https://arxiv.org/abs/2006.14329v1,
ArXiv:cs,TweetsCOV19 -- A Knowledge Base of Semantically Annotated Tweets about the COVID-19 Pandemic,https://arxiv.org/abs/2006.14492v1,
ArXiv:cs,Risk Communication in Asian Countries: COVID-19 Discourse on Twitter,https://arxiv.org/abs/2006.12218v2,
