feed,title,long_url,short_url
GN:S:C,Julia Simon is NPR's new Climate Solutions Reporter - NPR,https://www.npr.org/sections/npr-extra/2022/11/14/1136512036/julia-simon-is-nprs-new-climate-solutions-reporter,
GN:S:C,"COP27: War causing huge release of climate warming gas, claims Ukraine - BBC",https://www.bbc.com/news/science-environment-63625693,
GN:S:C,Climate Change Is Fueling a Public Health Crisis. Doctors Need to Address This - Scientific American,https://www.scientificamerican.com/article/climate-change-is-fueling-a-public-health-crisis-doctors-need-to-address-this/,
GN:S:C,Bezos Pledges To Give Most Of His $124B To Fight Climate Change - OilPrice,https://oilprice.com/Latest-Energy-News/World-News/Bezos-Pledges-To-Give-Most-Of-His-124B-To-Fight-Climate-Change.html,
GN:S:C,Climate bills brighten mood at Palo Alto summit - The Almanac Online,https://almanacnews.com/news/2022/11/14/climate-bills-brighten-mood-at-palo-alto-summit,
GN:S:C,GOP's Weak Midterm Showing Is Great News for Biden's Climate Plans – Mother Jones - Mother Jones,https://www.motherjones.com/politics/2022/11/republican-midterm-losses-gop-attacks-joe-biden-climate-policies-ira/,
GN:S:C,State Agency Claims Climate Change is Rapidly Accelerating in Golden State - California Globe,https://californiaglobe.com/articles/state-agency-claims-climate-change-is-rapidly-accelerating-in-golden-state/,
GN:S:C,Traditional Cookstoves: Fueling a Health and Climate Crisis? - Columbia University,https://news.climate.columbia.edu/2022/11/14/traditional-cookstoves-fueling-a-health-and-climate-crisis/,
GN:S:C,Vilsack sees farmers keeping climate on congressional agenda - Roll Call,https://www.rollcall.com/2022/11/14/vilsack-sees-farmers-keeping-climate-on-congressional-agenda/,
GN:S:C,Sicker patients serve as clarion call for doctors to take on climate change - AAMC,https://www.aamc.org/news-insights/sicker-patients-serve-clarion-call-doctors-take-climate-change,
GN:S:C,Secretary Haaland Visit Highlights Climate Resilience Investments in US Territories - U,https://www.doi.gov/pressreleases/secretary-haaland-visit-highlights-climate-resilience-investments-us-territories,
GN:S:C,"Polar bears, pushed on land by climate change, get their own radar - NBC News",https://www.nbcnews.com/science/environment/polar-bears-pushed-land-climate-change-get-radar-rcna56761,
GN:S:C,** MEDIA ADVISORY ** WEEK TWO COP27 – HOW PROTECTING NATURE CAN COMBAT CLIMATE CHANGE - National Geographic Voices,https://blog.nationalgeographic.org/2022/11/14/media-advisory-week-two-cop27-how-protecting-nature-can-combat-climate-change/,
