feed,title,long_url,short_url
GN:S:C,'Global Citizens' Assembly' to seek climate change solutions ahead of U.N. talks - Reuters,https://www.reuters.com/article/us-climate-change-assembly/global-citizens-assembly-to-seek-climate-change-solutions-ahead-of-u-n-talks-idUSKBN28K04H,
GN:S:C,Boulder ending contract with director of climate initiatives - Boulder Daily Camera,https://www.dailycamera.com/2020/12/09/boulder-ending-contract-with-director-of-climate-initiatives,
GN:S:C,Biden Builds Out Coronavirus and Climate Teams - FYI: Science Policy News,https://www.aip.org/fyi/2020/biden-builds-out-coronavirus-and-climate-teams,
GN:S:C,Bay Area energy tracking tool could aid Marin climate change efforts - Marin Independent Journal,https://www.marinij.com/2020/12/09/bay-area-energy-tracking-tool-could-aid-marin-climate-change-efforts/,
GN:S:C,Paper identifies opportunities for farmers to benefit from action on climate change - Beef Central,https://www.beefcentral.com/news/paper-identifies-opportunities-for-farmers-to-benefit-from-action-on-climate-change/,
GN:S:C,"New Zealand lagging in developed world on climate funding, Oxfam says - The Guardian",https://www.theguardian.com/world/2020/dec/10/new-zealand-climate-funding-oxfam-poor-countries,
