feed,title,long_url,short_url
GN:T:CC,What Does Sustainable Living Look Like? Maybe Like Uruguay - The New York Times,https://www.nytimes.com/2022/10/05/magazine/uruguay-renewable-energy.html,
GN:T:CC,How climate change is likely to worsen inflation - The Hill,https://thehill.com/changing-america/sustainability/climate-change/3673368-how-climate-change-is-likely-to-worsen-inflation/,
GN:T:CC,"Hurricane Ian: CNN, MSNBC, ABC, CBS, NBC tout climate change more than 600 times in coverage - Fox News",https://www.foxnews.com/media/hurricane-ian-cnn-msnbc-abc-cbs-nbc-climate-change-more-than-500-times,
GN:T:CC,Solar geoengineering: A new tool for fighting climate change - UTSA,https://www.utsa.edu/today/2022/10/story/new-tool-to-fight-climate-change.html,
GN:T:CC,"Risking the Future: Climate Change, Environmental Destruction, and Conflict in Yemen - Yemen - ReliefWeb",https://reliefweb.int/report/yemen/risking-future-climate-change-environmental-destruction-and-conflict-yemen,
GN:T:CC,World leaders not invited to attend critical UN biodiversity summit - Climate Home News,https://www.climatechangenews.com/2022/10/05/world-leaders-not-invited-to-attend-critical-un-biodiversity-summit/,
