feed,title,long_url,short_url
j.mp/lc-ml-reviews,A Survey of Controllable Learning: Methods and Applications in Information Retrieval (2024-2025) (cs.LG),http://arxiv.org/abs/2407.06083v2,
j.mp/lc-ml-reviews,Tensor-Based Foundations of Ordinary Least Squares and Neural Network Regression Models (2024-2025) (cs.LG),http://arxiv.org/abs/2411.12873v3,
j.mp/lc-ml-reviews,Enhancing Code LLMs with Reinforcement Learning in Code Generation: A Survey (2024-2025) (cs.SE),http://arxiv.org/abs/2412.20367v2,
j.mp/lc-ml-reviews,A survey of Monte Carlo methods for noisy and costly densities with application to reinforcement learning and ABC (2021-2025) (cs.LG),http://arxiv.org/abs/2108.00490v3,
j.mp/lc-ml-reviews,A Survey on Large Language Model Acceleration based on KV Cache Management (2024-2025) (cs.AI),http://arxiv.org/abs/2412.19442v2,
j.mp/lc-ml-reviews,Mathematical Language Models: A Survey (2023-2025) (cs.CL),http://arxiv.org/abs/2312.07622v4,
j.mp/lc-ml-reviews,PRD: Peer Rank and Discussion Improve Large Language Model based Evaluations (2023-2024) (cs.CL),http://arxiv.org/abs/2307.02762v3,
j.mp/lc-ml-reviews,ArguMentor: Augmenting User Experiences with Counter-Perspectives (2024) (cs.HC),http://arxiv.org/abs/2406.02795v3,
j.mp/lc-ml-reviews,The Prompt Report: A Systematic Survey of Prompting Techniques (2024) (cs.CL),http://arxiv.org/abs/2406.06608v5,
