feed,title,long_url,short_url
GN:T:CC,Fight climate change and food waste with one app - NPR,https://news.google.com/rss/articles/CBMiUmh0dHBzOi8vd3d3Lm5wci5vcmcvMjAyMy8xMC8wMy8xMjAyMjc4NDY4L2NsaW1hdGUtY2hhbmdlLWZvb2Qtd2FzdGUtdG9vLWdvb2QtdG8tZ2_SAQA?oc=5,https://da.gd/RHL8v0
GN:T:CC,Lawmakers withhold green light for new EU green policy chiefs - Reuters,https://news.google.com/rss/articles/CBMiemh0dHBzOi8vd3d3LnJldXRlcnMuY29tL2J1c2luZXNzL2Vudmlyb25tZW50L2xhd21ha2Vycy13aXRoaG9sZC1ncmVlbi1saWdodC1uZXctZXUtZ3JlZW4tcG9saWN5LWNoaWVmcy1zb3VyY2VzLTIwMjMtMTAtMDMv0gEA?oc=5,https://da.gd/pCXJ7R
GN:T:CC,This App Could Help You Save Money on Your Favorite Eats While Avoiding Food Waste - The Motley Fool,https://news.google.com/rss/articles/CBMijQFodHRwczovL3d3dy5mb29sLmNvbS90aGUtYXNjZW50L3BlcnNvbmFsLWZpbmFuY2UvYXJ0aWNsZXMvdGhpcy1hcHAtY291bGQtaGVscC15b3Utc2F2ZS1tb25leS1vbi15b3VyLWZhdm9yaXRlLWVhdHMtd2hpbGUtYXZvaWRpbmctZm9vZC13YXN0ZS_SAQA?oc=5,https://da.gd/xsYuBf
GN:T:CC,Facing climate change across Latin America and the Caribbean - Nature,https://news.google.com/rss/articles/CBMiMmh0dHBzOi8vd3d3Lm5hdHVyZS5jb20vYXJ0aWNsZXMvczQxNTU4LTAyMy0wMTgyMC0z0gEA?oc=5,https://da.gd/QZnL1
GN:T:CC,Coffee is in danger. Starbucks is working on solutions - CNN,https://news.google.com/rss/articles/CBMiUmh0dHBzOi8vd3d3LmNubi5jb20vMjAyMy8xMC8wMy9idXNpbmVzcy9zdGFyYnVja3MtY29mZmVlLWNsaW1hdGUtY2hhbmdlL2luZGV4Lmh0bWzSAVZodHRwczovL2FtcC5jbm4uY29tL2Nubi8yMDIzLzEwLzAzL2J1c2luZXNzL3N0YXJidWNrcy1jb2ZmZWUtY2xpbWF0ZS1jaGFuZ2UvaW5kZXguaHRtbA?oc=5,https://da.gd/AO54v
GN:T:CC,Opinion | Where Was Mayor Eric Adams During New York City Flooding? - The New York Times,https://news.google.com/rss/articles/CBMiSmh0dHBzOi8vd3d3Lm55dGltZXMuY29tLzIwMjMvMTAvMDMvb3Bpbmlvbi9tYXlvci1hZGFtcy1uZXcteW9yay1mbG9vZC5odG1s0gEA?oc=5,https://da.gd/3F3gT
GN:T:CC,"California's prescribed fire window could shrink with warming climate, study says - San Francisco Chronicle",https://news.google.com/rss/articles/CBMiZWh0dHBzOi8vd3d3LnNmY2hyb25pY2xlLmNvbS9jYWxpZm9ybmlhLXdpbGRmaXJlcy9hcnRpY2xlL3ByZXNjcmliZWQtYnVybnMtY2xpbWF0ZS1jaGFuZ2UtMTg0MDE3MzAucGhw0gEA?oc=5,https://da.gd/IgqH
