feed,title,long_url,short_url
GN:T:RE,EGEB: Blackouts and rising electric bills are driving US household solar and storage - Electrek,https://electrek.co/2021/08/19/egeb-blackouts-and-rising-electric-bills-are-driving-us-household-solar-and-storage/,
GN:T:RE,"Solar power offers $6 billion opportunity for Louisiana, expert says - Greater Baton Rouge Business Report",https://www.businessreport.com/industry/solar-power-offers-6-billion-opportunity-for-louisiana-expert-says,
GN:T:RE,Battery power capacity in the US grew big time in 2020 - The Verge,https://www.theverge.com/2021/8/19/22632172/large-battery-power-capacity-us-grew-2020,
GN:T:RE,"Even at fossil fuel's big show, renewables are showing their power - Houston Chronicle",https://www.houstonchronicle.com/business/energy/article/Even-at-fossil-fuel-s-big-show-renewables-are-16395933.php,
GN:T:RE,"Tesla, Japanese firms to build energy storage facility in Hokkaido - Yahoo Finance",https://finance.yahoo.com/news/tesla-japanese-firms-build-energy-104011235.html,
GN:T:RE,These 5 new state laws move the US closer to clean energy - Electrek,https://electrek.co/2021/08/19/these-5-new-state-laws-move-the-us-closer-to-clean-energy/,
