feed,title,long_url,short_url
GN:T:WP,Developer awards contracts for Vietnam's largest intertidal wind project - Renewables Now,https://renewablesnow.com/news/developer-awards-contracts-for-vietnams-largest-intertidal-wind-project-725207/,
GN:T:WP,Gov't to pull out of ¥60 bil wind power project off Fukushima - Japan Today,https://japantoday.com/category/tech/gov't-to-pull-out-of-60-bil.-yen-wind-power-project-off-fukushima,
GN:T:WP,The 5 best patio heaters for wind - Inverse,https://www.inverse.com/mind-body/best-patio-heaters-for-wind,
GN:T:WP,Muehlhan Bags Kriegers Flak Contract with Siemens Gamesa - Offshore WIND,https://www.offshorewind.biz/2020/12/18/muehlhan-bags-kriegers-flak-contract-with-siemens-gamesa/,
GN:T:WP,Costa Rican hybrid sailboat aims to reduce shipping industry's carbon footprint - Reuters,https://www.reuters.com/article/costa-rica-environment-sailboat/costa-rican-hybrid-sailboat-aims-to-reduce-shipping-industrys-carbon-footprint-idUSL1N2IZ0GE,
