feed,title,long_url,short_url
ArXiv,Approximate Query Processing for Group-By Queries based on Conditional Generative Models,https://arxiv.org/abs/2101.02914v1,
ArXiv,Spatial Object Recommendation with Hints: When Spatial Granularity Matters,https://arxiv.org/abs/2101.02969v1,
ArXiv,Dataset Definition Standard (DDS),https://arxiv.org/abs/2101.03020v1,
ArXiv,Answer Counting under Guarded TGDs,https://arxiv.org/abs/2101.03058v1,
ArXiv,Table2Charts: Learning Shared Representations for Recommending Charts on Multi-dimensional Data,https://arxiv.org/abs/2008.11015v2,
ArXiv,TODS: An Automated Time Series Outlier Detection System,https://arxiv.org/abs/2009.09822v3,
ArXiv,The role of scientific output in public debates in times of crisis: A case study of the reopening of schools during the COVID-19 pandemic,https://arxiv.org/abs/2101.03069v1,
ArXiv,The inconsistency of h-index: a mathematical analysis,https://arxiv.org/abs/2002.06974v2,
