feed,title,long_url,short_url
GN:S:C,New Jersey is uniquely vulnerable to climate change | Sheneman - nj,https://www.nj.com/opinion/2021/11/new-jersey-is-uniquely-vulnerable-to-climate-change-sheneman.html,
GN:S:C,Citizens' Climate Education: Children's Books About Climate Change for Holiday Giving - San Clemente Times,https://www.sanclementetimes.com/citizens-climate-education-childrens-books-about-climate-change-for-holiday-giving/,
GN:S:C,"For Maine birders, the effects of climate change are impossible to ignore - Bangor Daily News",https://bangordailynews.com/2021/11/28/outdoors/for-maine-birders-the-effects-of-climate-change-are-impossible-to-ignore/,
GN:S:C,Natural vs. artificial: Which Christmas tree option is better for the climate? - WTOP,https://wtop.com/christmas-news/2021/11/natural-vs-artificial-which-christmas-tree-option-is-better-for-the-climate/,
GN:S:C,Climate Change – Especially in the Northeast – Must Be Discussed in Parliament - The Wire,https://thewire.in/government/climate-change-especially-in-the-northeast-must-be-discussed-in-parliament,
GN:S:C,Opinion: U.S. cannot go it alone on climate change - The San Diego Union-Tribune,https://www.sandiegouniontribune.com/opinion/letters-to-the-editor/story/2021-11-28/opinion-u-s-cannot-go-it-alone-on-climate-change,
