feed,title,long_url,short_url
GN:T:WP,"Saudi Arabia Sentences Men To Death For Obstructing Its ""City Of The Future"" - OilPrice",https://oilprice.com/Latest-Energy-News/World-News/Saudi-Arabia-Sentences-Men-To-Death-For-Obstructing-Its-City-Of-The-Future.html,
GN:T:WP,German front-month power falls on mild outlook - Montel,https://www.montelnews.com/news/1358056/german-front-month-power-falls-on-mild-outlook,
GN:T:WP,Inox Green Energy Services sells entire stake in 3 arms to Adani Energy - Business Standard,https://www.business-standard.com/article/companies/inox-green-energy-services-sells-entire-stake-in-3-arms-to-adani-energy-122101001180_1.html,
GN:T:WP,Carnalbanagh wind farm decision referred to Public Appeals Commission | NorthernIrelandWorld - NorthernIrelandWorld,https://www.northernirelandworld.com/news/politics/council/carnalbanagh-wind-farm-decision-referred-to-public-appeals-commission-3874789,
GN:T:WP,CIP lines up Stiesdal foundations for Pentland floater - reNEWS,https://renews.biz/80981/cip-lines-up-stiesdal-foundations-for-pentland-floater/,
GN:T:WP,"Stocks that will see action on October 11, 2022 - BusinessLine",https://www.thehindubusinessline.com/markets/stocks-that-will-see-action-on-october-11-2022/article65995306.ece,
GN:T:WP,States plot ‘super grid’ for faster energy change - Sydney Morning Herald,https://www.smh.com.au/environment/climate-change/states-plot-super-grid-for-faster-energy-change-20221010-p5bomc.html,
GN:T:WP,Developers told 'honour pledges' despite likely legal challenges - Clare Champion,https://clarechampion.ie/developers-told-honour-pledges-despite-likely-legal-challenges/,
GN:T:WP,South Tyneside renewable scheme fails to tap into geothermal energy from old mines - Ground Engineering,https://www.geplus.co.uk/news/south-tyneside-energy-scheme-fails-to-tap-into-geothermal-energy-from-old-mines-11-10-2022/,
