feed,title,long_url,short_url
MedRxiv,Dominance of Alpha and Iota variants in SARS-CoV-2 vaccine breakthrough infections in New York City,https://medrxiv.org/cgi/content/short/2021.07.05.21259547v1?rss=1,https://j.mp/3dOlv3C
MedRxiv,Whole-genome sequencing of SARS-COV-2 reveals a substantially lower frequency of the UK variant than previously announced in Libya,https://medrxiv.org/cgi/content/short/2021.07.03.21257942v1?rss=1,https://j.mp/3AvwxV8
MedRxiv,High Seroprevalence of anti-SARS-CoV-2 antibodies among Ethiopian healthcare workers,https://medrxiv.org/cgi/content/short/2021.07.01.21259687v1?rss=1,https://j.mp/3dKFiRq
MedRxiv,Individual-Level Heterogeneity in Mask-wearing During the COVID-19 Pandemic in Malaysia,https://medrxiv.org/cgi/content/short/2021.07.02.21257837v1?rss=1,https://j.mp/36lR6Fu
MedRxiv,Humoral and cellular responses to mRNA vaccines against SARS-CoV2 in patients with a history of CD20-B-cell depleting therapy,https://medrxiv.org/cgi/content/short/2021.07.04.21259848v1?rss=1,https://j.mp/3wpZzlD
