feed,title,long_url,short_url
ArXiv,PWM2Vec: An Efficient Embedding Approach for Viral Host Specification from Coronavirus Spike Sequences,https://arxiv.org/abs/2201.02273v1,
ArXiv,Modeling International Mobility using Roaming Cell Phone Traces during COVID-19 Pandemic,https://arxiv.org/abs/2201.02470v1,
ArXiv,Monitoring Covid-19 on social media using a novel triage and diagnosis approach,https://arxiv.org/abs/2103.11850v4,
ArXiv,School Virus Infection Simulator for Customizing School Schedules During COVID-19,https://arxiv.org/abs/2110.03615v2,
ArXiv,Robust models of SARS-CoV-2 heterogeneity and control,https://arxiv.org/abs/2109.11156v2,
