feed,title,long_url,short_url
GN:S:C,Massachusetts set to enable citizens to give climate finance to vulnerable nations - Climate Home News,https://www.climatechangenews.com/2022/07/22/massachusetts-set-to-enable-citizens-to-give-climate-finance-to-vulnerable-nations/,
GN:S:C,Americans overwhelmingly connect climate change and extreme weather - Food & Environment Reporting Network,https://thefern.org/ag_insider/americans-overwhelmingly-connect-climate-change-and-extreme-weather/,
GN:S:C,‘We have travelled for a month to find grass’: climate crisis piles pressure on Senegal’s herders - The Guardian,https://www.theguardian.com/global-development/2022/jul/22/climate-crisis-piles-pressure-on-senegal-herders,
GN:S:C,Is the climate crisis a population problem or a poverty problem? - Anthropocene Magazine,https://www.anthropocenemagazine.org/2022/07/is-the-climate-crisis-a-population-problem-or-a-poverty-problem/,
GN:S:C,Explainer-Luton Airport Runway Meltdown Shows Airports Vulnerable to Climate Change - U,https://www.usnews.com/news/world/articles/2022-07-22/luton-airport-runway-meltdown-shows-airports-vulnerable-to-climate-change,
GN:S:C,Wildfire-smoke observations fill gap in estimating soot's role in climate change - Phys,https://phys.org/news/2022-07-wildfire-smoke-gap-soot-role-climate.html,
GN:S:C,"World leaders need to address climate change as promised in Glasgow: Alok Sharma, COP26 President - Economic Times",https://economictimes.indiatimes.com/industry/renewables/world-leaders-need-to-address-climate-change-as-promised-in-glasgow-alok-sharma-cop26-president/articleshow/93046055.cms,
