feed,title,long_url,short_url
GN:S:C,"Texas and California built different power grids, but neither stood up to climate change - POLITICO",https://www.politico.com/news/2021/02/21/texas-california-climate-change-power-grids-470434,
GN:S:C,Snowstorm and frigid weather: Historic event or climate change? - Shreveport Times,https://www.shreveporttimes.com/story/news/2021/02/21/winter-snowstorm-climate-change-frigid-temperatures-water-outages/6784523002/,
GN:S:C,"LETTERS TO THE EDITOR:Climate change a state issue, too - nwitimes",https://www.nwitimes.com/opinion/letters/letters-to-the-editor-climate-change-a-state-issue-too/article_7aa7eade-0a29-52e2-b586-78ee8f0e61db.html,
GN:S:C,"School board, City Council forums to discuss climate change - ABC17NEWS - ABC17News",https://abc17news.com/news/2021/02/21/school-board-city-council-forums-to-discuss-climate-change/,
GN:S:C,Report Finds Providence's Estimates of Climate Emissions 60% Greater than Reported — ecoRI News - ecoRI news,https://www.ecori.org/climate-change/2021/2/15/report-providences-estimates-of-climate-emissions-60-greater-than-reported,
GN:S:C,UN Security Council hosts climate summit on Tuesday - The Brussels Times,https://www.brusselstimes.com/news/155996/un-security-council-hosts-climate-summit-on-tuesday/,
GN:S:C,I have the solution to climate crisis anxiety – radical optimism - The Independent,https://www.independent.co.uk/climate-change/opinion/climate-crisis-anxiety-optimism-b1804835.html,
GN:S:C,'Saturday Night Live' roasts Ted Cruz's trip to Cancún amid Texas climate disaster - NBC News,https://www.nbcnews.com/news/us-news/snl-roasts-ted-cruz-s-trip-canc-n-amid-texas-n1258462,
