feed,title,long_url,short_url
GN:T:SP,Malaysian utility agrees to buy power from 500 MW of solar plants - pv magazine International,https://www.pv-magazine.com/2021/08/25/malaysian-utility-agrees-to-buy-power-from-500-mw-of-solar-plants/,
GN:T:SP,Rural Electric Co-ops in Alabama Remain Way Behind the Solar Curve - InsideClimate News,https://insideclimatenews.org/news/25082021/rural-electric-co-ops-alabama-solar/,
GN:T:SP,Offshore Floating Solar Technology Receives World's First Class AiP - The Maritime Executive,https://www.maritime-executive.com/article/offshore-floating-solar-technology-receives-world-s-first-class-aip,
GN:T:SP,"Looking to go greener, CenterPoint seeks OK to buy more solar power from upcoming projects - Courier & Press",https://www.courierpress.com/story/news/2021/08/26/centerpoint-energy-indiana-utilities-buy-solar-power-utility-bill/5593351001/,
GN:T:SP,"Global power sector emissions rise to pre-pandemic levels, finds review - Hindustan Times",https://www.hindustantimes.com/environment/emissions-power-sector-clean-energy-india-electricity-demand-renewable-energy-101629909606841.html,
