feed,title,long_url,short_url
GN:T:CC,The Home Depot is putting rooftop solar on its stores - Electrek,https://electrek.co/2023/01/19/the-home-depot-rooftop-solar/,https://da.gd/y1lXw
GN:T:CC,Climate change is killing off Maine's honey bees - WGME,https://wgme.com/news/local/climate-change-is-killing-off-maines-honey-bees-global-warming-temperature-swings-buzz-maine-department-of-agriculture-conservation-and-forestry-flowering-plants-beekeepers-hives,https://da.gd/NuSKt4
GN:T:CC,Italy's Ski Resorts Grapple With a Snowless Future - TIME,https://time.com/6248345/italy-ski-resorts-no-snow-climate-change/,https://da.gd/pCAE
GN:T:CC,Climate change is threatening Madagascar's famous forests: Study shows how serious it is - Phys,https://phys.org/news/2023-01-climate-threatening-madagascar-famous-forests.html,https://da.gd/ghztY
GN:T:CC,"Fact check: Global warming caused by greenhouse gas emissions, not mysterious ocean warming - USA TODAY",https://www.usatoday.com/story/news/factcheck/2023/01/20/fact-check-global-warming-caused-co-2-not-ocean-warming/11066134002/,https://da.gd/w15Ocb
GN:T:CC,The impact of climate change on the pharma supply chain - Pharmaceutical Technology,https://www.pharmaceutical-technology.com/sponsored/the-impact-of-climate-change-on-the-pharma-supply-chain/,https://da.gd/WClZny
