feed,title,long_url,short_url
GN:T:CC,Timber cities ‘could cut 100bn tons of CO2 emissions by 2100’ - The Guardian,https://www.theguardian.com/environment/2022/aug/30/timber-cities-could-cut-100bn-tons-of-co2-emissions-by-2100,
GN:T:CC,Greenland may have already committed us to almost a foot of sea level rise - Ars Technica,https://arstechnica.com/science/2022/08/study-sees-almost-a-foot-of-sea-level-rise-locked-in-for-greenland/,
GN:T:CC,Land use change and carbon emissions of a transformation to timber cities - Nature,https://www.nature.com/articles/s41467-022-32244-w,
GN:T:CC,"To adapt to climate impacts, come to grips with politics - Nature",https://www.nature.com/articles/d41586-022-02762-0,
GN:T:CC,Several states will follow California’s lead in banning gas-powered car sales by 2035 - The Hill,https://thehill.com/changing-america/sustainability/infrastructure/3620985-several-states-will-follow-californias-lead-in-banning-gas-powered-car-sales-by-2035/,
