feed,title,long_url,short_url
GN:S:C,Court's move hamstrings climate actions across the board | TheHill - The Hill,https://thehill.com/policy/energy-environment/595226-courts-move-hamstrings-climate-actions-across-the-board,
GN:S:C,How Mainers can use this climate change simulator to impact policy - NewsCenterMaine,https://www.newscentermaine.com/article/news/special-reports/maines-changing-climate/climate-change-simulator-helps-maine-and-the-united-nations/97-1ad334f6-b65d-4d5f-b7c2-235f29e9fdd2,
GN:S:C,PR worked for Big Oil. So can it work for climate action? - Grist,https://grist.org/language/pr-worked-for-big-oil-so-can-it-work-for-climate-action/,
GN:S:C,Climate Risk Stumps Bank Regulators Updating Anti-Redlining Plan - Bloomberg Law,https://news.bloomberglaw.com/banking-law/climate-risk-stumps-bank-regulators-updating-anti-redlining-plan,
GN:S:C,Information from the University of Washington Climate Impacts Group - Washington State Department of Health,https://doh.wa.gov/community-and-environment/climate-and-health/climate-impacts-group-information,
GN:S:C,Garrison's Green Boot program integral in Army's climate strategy - United States Army,https://www.army.mil/article/254150/garrisons_green_boot_program_integral_in_armys_climate_strategy,
