feed,title,long_url,short_url
ArXiv,Differentially Private Linear Sketches: Efficient Implementations and Applications,https://arxiv.org/abs/2205.09873v1,
ArXiv,Can Foundation Models Wrangle Your Data?,https://arxiv.org/abs/2205.09911v1,
ArXiv,ClusterEA: Scalable Entity Alignment with Stochastic Training and Normalized Mini-batch Similarities,https://arxiv.org/abs/2205.10312v1,
ArXiv,Dissecting BFT Consensus: In Trusted Components we Trust!,https://arxiv.org/abs/2202.01354v2,
ArXiv,Modellieren mit Heraklit: Prinzipien und Fallstudie,https://arxiv.org/abs/2203.09493v2,
ArXiv,Mapping Complex Technologies via Science-Technology Linkages; The Case of Neuroscience -- A transformer based keyword extraction approach,https://arxiv.org/abs/2205.10153v1,
