feed,title,long_url,short_url
GN:T:CC,Lancet Countdown Report Shows Climate Change’s Impact on Health - The New York Times,https://news.google.com/rss/articles/CBMiVGh0dHBzOi8vd3d3Lm55dGltZXMuY29tLzIwMjMvMTEvMTQvY2xpbWF0ZS9jbGltYXRlLWNoYW5nZS1oZWFsdGgtZWZmZWN0cy1sYW5jZXQuaHRtbNIBAA?oc=5,https://da.gd/YI5UA
GN:T:CC,"International Public Opinion on Climate Change, 2023 - Yale Program on Climate Change Communication",https://news.google.com/rss/articles/CBMiZ2h0dHBzOi8vY2xpbWF0ZWNvbW11bmljYXRpb24ueWFsZS5lZHUvcHVibGljYXRpb25zL2ludGVybmF0aW9uYWwtcHVibGljLW9waW5pb24tb24tY2xpbWF0ZS1jaGFuZ2UtMjAyMy_SAQA?oc=5,https://da.gd/MsJQI
GN:T:CC,"‘The science is irrefutable’: US warming faster than global average, says report - The Guardian",https://news.google.com/rss/articles/CBMiaGh0dHBzOi8vd3d3LnRoZWd1YXJkaWFuLmNvbS9lbnZpcm9ubWVudC8yMDIzL25vdi8xNC91cy1uYXRpb25hbC1jbGltYXRlLWFzc2Vzc21lbnQtZ2xvYmFsLXdhcm1pbmctcmVwb3J00gEA?oc=5,https://da.gd/qDIxV
GN:T:CC,"Global heat deaths could quadruple if action is not taken on climate change, study finds - AOL",https://news.google.com/rss/articles/CBMiRWh0dHBzOi8vd3d3LmFvbC5jb20vZ2xvYmFsLWhlYXQtZGVhdGhzLWNvdWxkLXF1YWRydXBsZS0yMzMwMDAyMDkuaHRtbNIBTWh0dHBzOi8vd3d3LmFvbC5jb20vYW1waHRtbC9nbG9iYWwtaGVhdC1kZWF0aHMtY291bGQtcXVhZHJ1cGxlLTIzMzAwMDIwOS5odG1s?oc=5,https://da.gd/3ol7
GN:T:CC,How changing weather patterns are affecting when and where people travel - The National,https://news.google.com/rss/articles/CBMiU2h0dHBzOi8vd3d3LnRoZW5hdGlvbmFsbmV3cy5jb20vdHJhdmVsLzIwMjMvMTEvMTQvY2xpbWF0ZS1jaGFuZ2UtdHJhdmVsLXdoZW4td2hlcmUv0gEA?oc=5,https://da.gd/LDMb
GN:T:CC,"Climate change, migrant safety among factors in Chicago winter preps - CBS News",https://news.google.com/rss/articles/CBMiamh0dHBzOi8vd3d3LmNic25ld3MuY29tL2NoaWNhZ28vdmlkZW8vY2xpbWF0ZS1jaGFuZ2UtbWlncmFudC1zYWZldHktYW1vbmctZmFjdG9ycy1pbi1jaGljYWdvLXdpbnRlci1wcmVwcy_SAQA?oc=5,https://da.gd/rcwTp
GN:T:CC,Climate change effects likely to include long-term inflation - Marketplace,https://news.google.com/rss/articles/CBMiZGh0dHBzOi8vd3d3Lm1hcmtldHBsYWNlLm9yZy8yMDIzLzExLzE0L2NsaW1hdGUtY2hhbmdlLWVmZmVjdHMtbGlrZWx5LXRvLWluY2x1ZGUtbG9uZy10ZXJtLWluZmxhdGlvbi_SAQA?oc=5,https://da.gd/3Ck1Qs
GN:T:CC,New climate change song aims to give hope in dark times - Connecticut Public,https://news.google.com/rss/articles/CBMiW2h0dHBzOi8vd3d3LmN0cHVibGljLm9yZy8yMDIzLTExLTE0L25ldy1jbGltYXRlLWNoYW5nZS1zb25nLWFpbXMtdG8tZ2l2ZS1ob3BlLWluLWRhcmstdGltZXPSAQA?oc=5,https://da.gd/jPb1m
