feed,title,long_url,short_url
GN:S:C,Climate change protest outside APEC summit in SF - NBC Bay Area,https://news.google.com/rss/articles/CBMiWGh0dHBzOi8vd3d3Lm5iY2JheWFyZWEuY29tL25ld3MvbG9jYWwvc2FuLWZyYW5jaXNjby9jbGltYXRlLWNoYW5nZS1wcm90ZXN0LWFwZWMvMzM3MTkzMy_SAQA?oc=5,https://da.gd/muIiez
GN:S:C,Climate Change is Disrupting Global Trade - International Monetary Fund,https://news.google.com/rss/articles/CBMiWmh0dHBzOi8vd3d3LmltZi5vcmcvZW4vQmxvZ3MvQXJ0aWNsZXMvMjAyMy8xMS8xNS9jbGltYXRlLWNoYW5nZS1pcy1kaXNydXB0aW5nLWdsb2JhbC10cmFkZdIBAA?oc=5,https://da.gd/SqX1vr
GN:S:C,Climate change and ecosystem shifts in the southwestern United ... - Nature,https://news.google.com/rss/articles/CBMiMmh0dHBzOi8vd3d3Lm5hdHVyZS5jb20vYXJ0aWNsZXMvczQxNTk4LTAyMy00NjM3MS140gEA?oc=5,https://da.gd/riwOK
GN:S:C,Beyond Climate: Fossil fuels rapidly eroding Earth's 'safe operating ... - Mongabay,https://news.google.com/rss/articles/CBMiamh0dHBzOi8vbmV3cy5tb25nYWJheS5jb20vMjAyMy8xMS9iZXlvbmQtY2xpbWF0ZS1mb3NzaWwtZnVlbHMtcmFwaWRseS1lcm9kaW5nLWVhcnRocy1zYWZlLW9wZXJhdGluZy1zcGFjZS_SAW5odHRwczovL25ld3MubW9uZ2FiYXkuY29tLzIwMjMvMTEvYmV5b25kLWNsaW1hdGUtZm9zc2lsLWZ1ZWxzLXJhcGlkbHktZXJvZGluZy1lYXJ0aHMtc2FmZS1vcGVyYXRpbmctc3BhY2UvYW1wLw?oc=5,https://da.gd/A9ETD
GN:S:C,University releases campus climate survey summary | UNC-Chapel ... - The University of North Carolina at Chapel Hill,https://news.google.com/rss/articles/CBMiV2h0dHBzOi8vd3d3LnVuYy5lZHUvcG9zdHMvMjAyMy8xMS8xNS91bml2ZXJzaXR5LXJlbGVhc2VzLWNhbXB1cy1jbGltYXRlLXN1cnZleS1zdW1tYXJ5L9IBAA?oc=5,https://da.gd/assjD0
GN:S:C,History of atmospheric carbon and the climate crisis - World Wildlife Fund,https://news.google.com/rss/articles/CBMiUWh0dHBzOi8vd3d3Lndvcmxkd2lsZGxpZmUub3JnL3N0b3JpZXMvYS1icmllZi1oaXN0b3J5LW9mLWNhcmJvbi1pbi1vdXItYXRtb3NwaGVyZdIBAA?oc=5,https://da.gd/iKDxK
GN:S:C,Grasslands key to burrowing owl expansion amid climate change ... - University of British Columbia,https://news.google.com/rss/articles/CBMieWh0dHBzOi8vbmV3cy5vay51YmMuY2EvMjAyMy8xMS8xNS9ncmFzc2xhbmRzLWtleS10by1idXJyb3dpbmctb3dsLWV4cGFuc2lvbi1hbWlkLWNsaW1hdGUtY2hhbmdlLXViYy1va2FuYWdhbi1zdHVkeS1maW5kcy_SAQA?oc=5,https://da.gd/Eb24yZ
GN:S:C,Court fails to engage with key climate risk arguments in Shell ... - ClientEarth,https://news.google.com/rss/articles/CBMijgFodHRwczovL3d3dy5jbGllbnRlYXJ0aC5vcmcvbGF0ZXN0L3ByZXNzLW9mZmljZS9wcmVzcy9jb3VydC1mYWlscy10by1lbmdhZ2Utd2l0aC1rZXktY2xpbWF0ZS1yaXNrLWFyZ3VtZW50cy1pbi1zaGVsbC1kaXJlY3RvcnMtY2FzZS1kaXNtaXNzYWwv0gEA?oc=5,https://da.gd/gJ1vR
GN:S:C,It's a Bleak Climate for Foreign Languages as Enrollments Tumble - The Chronicle of Higher Education,https://news.google.com/rss/articles/CBMiYWh0dHBzOi8vd3d3LmNocm9uaWNsZS5jb20vYXJ0aWNsZS9pdHMtYS1ibGVhay1jbGltYXRlLWZvci1mb3JlaWduLWxhbmd1YWdlcy1hcy1lbnJvbGxtZW50cy10dW1ibGXSAQA?oc=5,https://da.gd/u8QD
GN:S:C,Japan's haiku poets lost for words as climate crisis disrupts seasons - The Guardian,https://news.google.com/rss/articles/CBMiYGh0dHBzOi8vd3d3LnRoZWd1YXJkaWFuLmNvbS9lbnZpcm9ubWVudC8yMDIzL25vdi8xNC9sb3N0LXRvLXRoZS1jbGltYXRlLWNyaXNpcy1qYXBhbi1oYWlrdS1wb2V0c9IBAA?oc=5,https://da.gd/QJDVE8
GN:S:C,"Climate-neutral tech solutions: EU's strong in innovation, but lags in ... - EU Science Hub",https://news.google.com/rss/articles/CBMimQFodHRwczovL2pvaW50LXJlc2VhcmNoLWNlbnRyZS5lYy5ldXJvcGEuZXUvanJjLW5ld3MtYW5kLXVwZGF0ZXMvY2xpbWF0ZS1uZXV0cmFsLXRlY2gtc29sdXRpb25zLWV1cy1zdHJvbmctaW5ub3ZhdGlvbi1sYWdzLWNvbW1lcmNpYWxpc2F0aW9uLTIwMjMtMTEtMTVfZW7SAQA?oc=5,https://da.gd/ifcXb
