feed,title,long_url,short_url
AWS:WhatsNew,Jamba 1.5 family of models by AI21 Labs is now available in Amazon Bedrock,https://aws.amazon.com/about-aws/whats-new/2024/09/jamba-1-5-family-models-amazon-bedrock,https://da.gd/Wg0alL
AWS:WhatsNew,Amazon Time Sync Service supports Microsecond-Accurate Time in Malaysia and Ohio Regions,https://aws.amazon.com/about-aws/whats-new/2024/09/amazon-time-sync-service-microsecond-accurate-time-malaysia-ohio/,https://da.gd/CihxsB
AWS:WhatsNew,AWS Lambda adds support for Amazon Linux 2023 runtimes in the AWS GovCloud (US) Regions,https://aws.amazon.com/about-aws/whats-new/2024/09/aws-lambda-linux-2023-runtimes-govcloud-regions/,https://da.gd/sI8R
AWS:WhatsNew,AWS Elemental MediaLive introduces bandwidth reduction filter,https://aws.amazon.com/about-aws/whats-new/2024/09/aws-elemental-medialive-bandwidth-reduction-filter/,https://da.gd/fXz4S1
AWS:WhatsNew,Announcing Content Credentials for Amazon Titan Image Generator,https://aws.amazon.com/about-aws/whats-new/2024/09/content-credentials-amazon-titan-image-generator,https://da.gd/dvp88
