feed,title,long_url,short_url
GN:T:GP,Ukrainian Drones Hit Major Rosneft Refinery in Russia - OilPrice,https://news.google.com/rss/articles/CBMibWh0dHBzOi8vb2lscHJpY2UuY29tL0xhdGVzdC1FbmVyZ3ktTmV3cy9Xb3JsZC1OZXdzL1VrcmFpbmlhbi1Ecm9uZXMtSGl0LU1ham9yLVJvc25lZnQtUmVmaW5lcnktaW4tUnVzc2lhLmh0bWzSAXFodHRwczovL29pbHByaWNlLmNvbS9MYXRlc3QtRW5lcmd5LU5ld3MvV29ybGQtTmV3cy9Va3JhaW5pYW4tRHJvbmVzLUhpdC1NYWpvci1Sb3NuZWZ0LVJlZmluZXJ5LWluLVJ1c3NpYS5hbXAuaHRtbA?oc=5,https://da.gd/Oxi0G
GN:T:GP,Mexico proudly controls its energy but could find it hard to reach its climate goals - Naharnet,https://news.google.com/rss/articles/CBMif2h0dHBzOi8vd3d3Lm5haGFybmV0LmNvbS9zdG9yaWVzL2VuLzMwNDk1Ni1tZXhpY28tcHJvdWRseS1jb250cm9scy1pdHMtZW5lcmd5LWJ1dC1jb3VsZC1maW5kLWl0LWhhcmQtdG8tcmVhY2gtaXRzLWNsaW1hdGUtZ29hbHPSAQA?oc=5,https://da.gd/WsP7
GN:T:GP,"Parliament session covers disaster vulnerability, water storage, geothermal solutions - Dominica News Online",https://news.google.com/rss/articles/CBMihgFodHRwczovL2RvbWluaWNhbmV3c29ubGluZS5jb20vbmV3cy9ob21lcGFnZS9uZXdzL3BhcmxpYW1lbnQtc2Vzc2lvbi1jb3ZlcnMtZGlzYXN0ZXItdnVsbmVyYWJpbGl0eS13YXRlci1zdG9yYWdlLWdlb3RoZXJtYWwtc29sdXRpb25zL9IBAA?oc=5,https://da.gd/BbvAPz
GN:T:GP,Sofia's Terroleum UGC Limited Displays at the Pentagon STAR-TIDES Event - openPR,https://news.google.com/rss/articles/CBMiWmh0dHBzOi8vd3d3Lm9wZW5wci5jb20vbmV3cy8zNDc5NTk0L3NvZmlhLXMtdGVycm9sZXVtLXVnYy1saW1pdGVkLWRpc3BsYXlzLWF0LXRoZS1wZW50YWdvbtIBAA?oc=5,https://da.gd/uN7M
GN:T:GP,Urban Vibro Trucks To Detect Geothermal Energy Potential Without Drilling - H2 News - Hydrogen News - Green Hydrogen Report,https://news.google.com/rss/articles/CBMiSGh0dHBzOi8vd3d3Lmh5ZHJvZ2VuZnVlbG5ld3MuY29tL2dlb3RoZXJtYWwtZW5lcmd5LWhlcnJlbmtuZWNodC84NTY0MTY2L9IBAA?oc=5,https://da.gd/McJOki
