feed,title,long_url,short_url
GN:T:WP,Bring hydrogen out of the shadows of the green transition - The Hill,https://news.google.com/rss/articles/CBMicWh0dHBzOi8vdGhlaGlsbC5jb20vb3Bpbmlvbi9lbmVyZ3ktZW52aXJvbm1lbnQvNDI2OTY0Mi1icmluZy1oeWRyb2dlbi1vdXQtb2YtdGhlLXNoYWRvd3Mtb2YtdGhlLWdyZWVuLXRyYW5zaXRpb24v0gF1aHR0cHM6Ly90aGVoaWxsLmNvbS9vcGluaW9uL2VuZXJneS1lbnZpcm9ubWVudC80MjY5NjQyLWJyaW5nLWh5ZHJvZ2VuLW91dC1vZi10aGUtc2hhZG93cy1vZi10aGUtZ3JlZW4tdHJhbnNpdGlvbi9hbXAv?oc=5,https://da.gd/fx28G
GN:T:WP,Harland & Wolff to renovate SeaRose FPSO in Belfast - Offshore magazine,https://news.google.com/rss/articles/CBMiZ2h0dHBzOi8vd3d3Lm9mZnNob3JlLW1hZy5jb20vdmVzc2Vscy9hcnRpY2xlLzE0MzAwNTQxL2hhcmxhbmQtd29sZmYtdG8tcmVub3ZhdGUtc2Vhcm9zZS1mcHNvLWluLWJlbGZhc3TSAQA?oc=5,https://da.gd/HcMht
GN:T:WP,Dickinson County holding hearings on wind farm proposal - Radio Iowa,https://news.google.com/rss/articles/CBMiXWh0dHBzOi8vd3d3LnJhZGlvaW93YS5jb20vMjAyMy8xMC8yMy9kaWNraW5zb24tY291bnR5LWhvbGRpbmctaGVhcmluZ3Mtb24td2luZC1mYXJtLXByb3Bvc2FsL9IBAA?oc=5,https://da.gd/OKd5au
GN:T:WP,Barge Master and collaborators complete first feeder operation for Vineyard Wind 1 - WorkBoat,https://news.google.com/rss/articles/CBMicGh0dHBzOi8vd3d3Lndvcmtib2F0LmNvbS93aW5kL2JhcmdlLW1hc3Rlci1hbmQtY29sbGFib3JhdG9ycy1jb21wbGV0ZS1maXJzdC1mZWVkZXItb3BlcmF0aW9uLWZvci12aW5leWFyZC13aW5kLTHSAQA?oc=5,https://da.gd/cbJXG3
GN:T:WP,MVP: Covington's Ursula Owczarkowski - Law360,https://news.google.com/rss/articles/CBMiWmh0dHBzOi8vd3d3LmxhdzM2MC5jb20vcHJvamVjdGZpbmFuY2UvYXJ0aWNsZXMvMTcyMTUwMy9tdnAtY292aW5ndG9uLXMtdXJzdWxhLW93Y3phcmtvd3NradIBK2h0dHBzOi8vd3d3LmxhdzM2MC5jb20vYW1wL2FydGljbGVzLzE3MjE1MDM?oc=5,https://da.gd/7gIitu
GN:T:WP,IAEA officials say Fukushima's ongoing discharge of treated radioactive wastewater is going well - The Advocate,https://news.google.com/rss/articles/CBMicWh0dHBzOi8vd3d3LnN0YW1mb3JkYWR2b2NhdGUuY29tL25ld3Mvd29ybGQvYXJ0aWNsZS9pYWVhLW9mZmljaWFscy1zYXktZnVrdXNoaW1hLXMtb25nb2luZy1kaXNjaGFyZ2UtMTg0NDIwNjgucGhw0gEA?oc=5,https://da.gd/hSJj
GN:T:WP,"U.S. government announces tax credit boost for solar projects serving low-income, tribal communities - pv magazine International",https://news.google.com/rss/articles/CBMilAFodHRwczovL3d3dy5wdi1tYWdhemluZS5jb20vMjAyMy8xMC8yMy91LXMtZ292ZXJubWVudC1hbm5vdW5jZXMtdGF4LWNyZWRpdC1ib29zdC1hbm5vdW5jZWQtZm9yLXNvbGFyLXByb2plY3RzLXNlcnZpbmctbG93LWluY29tZS10cmliYWwtY29tbXVuaXRpZXMv0gEA?oc=5,https://da.gd/NMfvVH
GN:T:WP,"As nuclear fuel plant opens in Ohio, can small reactors compete? - Energy News Network",https://news.google.com/rss/articles/CBMiYGh0dHBzOi8vZW5lcmd5bmV3cy51cy8yMDIzLzEwLzIzL2FzLW51Y2xlYXItZnVlbC1wbGFudC1vcGVucy1pbi1vaGlvLWNhbi1zbWFsbC1yZWFjdG9ycy1jb21wZXRlL9IBAA?oc=5,https://da.gd/J5CgOe
GN:T:WP,Barcelona celebrates another talented teenager making a successful move from its La Masia academy - CTPost,https://news.google.com/rss/articles/CBMiYWh0dHBzOi8vd3d3LmN0cG9zdC5jb20vc3BvcnRzL2FydGljbGUvYmFyY2Vsb25hLWNlbGVicmF0ZXMtYW5vdGhlci10YWxlbnRlZC10ZWVuYWdlci0xODQ0MTk0MS5waHDSAQA?oc=5,https://da.gd/FUYmx
