feed,title,long_url,short_url
GN:S:GW,More heat waves and vanishing snow: The lake Tahoe basin's future on a warming planet - Phys,https://news.google.com/rss/articles/CBMiQWh0dHBzOi8vcGh5cy5vcmcvbmV3cy8yMDIzLTEwLWxha2UtdGFob2UtYmFzaW4tZnV0dXJlLXBsYW5ldC5odG1s0gEA?oc=5,https://da.gd/KYZ0g
GN:S:GW,How to Keep Buildings Cool in California's Warming Climate - Public Policy Institute of California,https://news.google.com/rss/articles/CBMiVGh0dHBzOi8vd3d3LnBwaWMub3JnL2Jsb2cvaG93LXRvLWtlZXAtYnVpbGRpbmdzLWNvb2wtaW4tY2FsaWZvcm5pYXMtd2FybWluZy1jbGltYXRlL9IBAA?oc=5,https://da.gd/AIIga6
GN:S:GW,Gavin Newsom Wants to Export California's Climate Laws to the World - The New York Times,https://news.google.com/rss/articles/CBMiVmh0dHBzOi8vd3d3Lm55dGltZXMuY29tLzIwMjMvMTAvMjMvY2xpbWF0ZS9nYXZpbi1uZXdzb20tY2FsaWZvcm5pYS1jbGltYXRlLWFjdGlvbi5odG1s0gEA?oc=5,https://da.gd/g57AL
GN:S:GW,"‘Climate change, pollution, construction to fuel more disasters’ - The Navhind Times",https://news.google.com/rss/articles/CBMicWh0dHBzOi8vd3d3Lm5hdmhpbmR0aW1lcy5pbi8yMDIzLzEwLzIzL25hdGlvbmFsbmV3cy9jbGltYXRlLWNoYW5nZS1wb2xsdXRpb24tY29uc3RydWN0aW9uLXRvLWZ1ZWwtbW9yZS1kaXNhc3RlcnMv0gEA?oc=5,https://da.gd/zpze
GN:S:GW,Climate Change Dramatically Alters School Atlas Maps - Mirage News,https://news.google.com/rss/articles/CBMiU2h0dHBzOi8vd3d3Lm1pcmFnZW5ld3MuY29tL2NsaW1hdGUtY2hhbmdlLWRyYW1hdGljYWxseS1hbHRlcnMtc2Nob29sLWF0bGFzLTExMDkwNjMv0gEA?oc=5,https://da.gd/Gg8SN
GN:S:GW,Chevron to buy Hess Corp for $53 billion in all-stock deal - Reuters,https://news.google.com/rss/articles/CBMiVGh0dHBzOi8vd3d3LnJldXRlcnMuY29tL21hcmtldHMvZGVhbHMvY2hldnJvbi1idXktaGVzcy1jb3JwLTUzLWJsbi1zdG9jay0yMDIzLTEwLTIzL9IBAA?oc=5,https://da.gd/XBPbD
