feed,title,long_url,short_url
j:MDPI:N,The Impact of Obesity on the Health of the Older Population: A Cross-Sectional Study on the Relationship between Health-Related Quality of Life and Body Mass Index across Different Age Groups,https://mdpi.com/2072-6643/16/1/51,
j:MDPI:N,"Comprehensive Care and Education Can Improve Nutritional and Growth Outcomes in Children with Persistent Cow’s Milk, Egg, or Peanut Allergies: A Five-Year Follow-Up Study of Nutritional Status",https://mdpi.com/2072-6643/16/1/48,
j:MDPI:N,"Body Mass Index Trends before and during the COVID-19 Pandemic in Primary School Students in Split-Dalmatia County, Croatia: A Retrospective Study",https://mdpi.com/2072-6643/16/1/50,
j:MDPI:N,Age-Dependent Effect of Calcitriol on Mouse Regulatory T and B Lymphocytes,https://mdpi.com/2072-6643/16/1/49,
j:MDPI:N,Impact of Maternal Mediterranean-Type Diet Adherence on Microbiota Composition and Epigenetic Programming of Offspring,https://mdpi.com/2072-6643/16/1/47,
