feed,title,long_url,short_url
GN:T:RE,China's addiction to coal clashes with carbon neutrality pledge - Nikkei Asia,https://asia.nikkei.com/Spotlight/Environment/Climate-Change/China-s-addiction-to-coal-clashes-with-carbon-neutrality-pledge,
GN:T:RE,Photographer of Japan nuke disaster training lens for all power users - The Mainichi - The Mainichi,https://mainichi.jp/english/articles/20210308/p2g/00m/0na/033000c,
GN:T:RE,Renewables = 20.6% of US Electricity in 2020 - CleanTechnica,https://cleantechnica.com/2021/03/07/renewables-20-6-of-us-electricity-in-2020/,
GN:T:RE,Bill to expand hydropower nationally back in play - Lewiston Morning Tribune,https://lmtribune.com/northwest/bill-to-expand-hydropower-nationally-back-in-play/article_72736183-2ce4-52fd-be3e-3f40a62a06ff.html,
GN:T:RE,Bitcoin’s other high price: The surging currency is leaving a massive carbon footprint - Fortune,https://fortune.com/2021/03/07/bitcoins-other-high-price-the-surging-currency-is-leaving-a-massive-carbon-footprint/,
