feed,title,long_url,short_url
RS,"Food Import Dependency, Urbanisation, and Adult Obesity Prevalence in Sub-Saharan Africa: A Longitudinal Panel Analysis of Commercial Determinants of Health",https://www.researchsquare.com/article/rs-10087014/latest,
RS,"Climate Change, Food Security, and Nanobiology: Significance of Nanoparticles in Mitigating Drought Stress in Food Crops",https://www.researchsquare.com/article/rs-10375045/latest,
RS,"Dietary habits, hydration-related practices, and club-level nutrition support among male football players in Ouagadougou, Burkina Faso: a cross-sectional pilot study",https://www.researchsquare.com/article/rs-9823639/latest,
RS,Beyond Food Acceptance: A Longitudinal Case Report Introducing Feeding Development in Autism Spectrum Disorder,https://www.researchsquare.com/article/rs-10440130/latest,
RS,Taylor-Series-Based Hybrid Adaptive Sliding Mode Control with Online Meal Disturbance Estimation for Artificial Pancreas Systems,https://www.researchsquare.com/article/rs-10448158/latest,
RS,Periodontitis and periodontal inflamed surface area in context of plant-based dietary patterns: Insights from the Hamburg City Health Study,https://www.researchsquare.com/article/rs-10317766/latest,
