feed,title,long_url,short_url
GN:S:C,Lessons on building community resilience through climate justice - Devex,https://www.devex.com/news/lessons-on-building-community-resilience-through-climate-justice-98164,
GN:S:C,"New research strengthens evidence for climate change increasing risk of wildfires, review finds - EurekAlert",https://eurekalert.org/pub_releases/2020-09/uoea-nrs092420.php,
GN:S:C,Michigan Governor Whitmer's Big Step Forward on Climate Leadership - Union of Concerned Scientists,https://blog.ucsusa.org/james-gignac/michigan-governor-whitmers-big-step-forward-on-climate-leadership,
GN:S:C,Opinion: Hampton church leading by example on climate change - The Virginian-Pilot - The Virginian-Pilot,https://www.pilotonline.com/opinion/columns/vp-ed-column-grace-0925-20200924-jbgs5st46jhlblf7o23yajjv34-story.html,
GN:S:C,U.S. Forest Service Pushes Ahead to Gut Protections for America's Climate Forest - Earthjustice,https://earthjustice.org/news/press/2020/us-forest-service-pushes-ahead-to-gut-protections-for-americas-climate-forest,
GN:S:C,Wax statue placed in Orlando to show effects of climate change - FOX 35 Orlando,https://www.fox35orlando.com/news/wax-statue-placed-in-orlando-to-show-effects-of-climate-change,
GN:S:C,UMaine set to host free webinar on climate change - WAGM,https://www.wagmtv.com/2020/09/24/umaine-set-to-host-free-webinar-on-climate-change/,
