feed,title,long_url,short_url
ArXiv:cs,Liver Segmentation using Turbolift Learning for CT and Cone-beam C-arm Perfusion Imaging,https://arxiv.org/abs/2207.10167v1,
ArXiv:cs,Pediatric Bone Age Assessment using Deep Learning Models,https://arxiv.org/abs/2207.10169v1,
ArXiv:cs,Flow-based Visual Quality Enhancer for Super-resolution Magnetic Resonance Spectroscopic Imaging,https://arxiv.org/abs/2207.10181v1,
ArXiv:cs,Auto Machine Learning for Medical Image Analysis by Unifying the Search on Data Augmentation and Neural Architecture,https://arxiv.org/abs/2207.10351v1,
ArXiv:cs,Detecting and Preventing Shortcut Learning for Fair Medical AI using Shortcut Testing (ShorT),https://arxiv.org/abs/2207.10384v1,
ArXiv:cs,Incorporating Prior Knowledge into Reinforcement Learning for Soft Tissue Manipulation with Autonomous Grasping Point Selection,https://arxiv.org/abs/2207.10438v1,
ArXiv:cs,Towards Confident Detection of Prostate Cancer using High Resolution Micro-ultrasound,https://arxiv.org/abs/2207.10485v1,
ArXiv:cs,Multi-modal Retinal Image Registration Using a Keypoint-Based Vessel Structure Aligning Network,https://arxiv.org/abs/2207.10506v1,
ArXiv:cs,Neural Network Learning of Chemical Bond Representations in Spectral Indices and Features,https://arxiv.org/abs/2207.10530v1,
ArXiv:cs,Surrey System for DCASE 2022 Task 5: Few-shot Bioacoustic Event Detection with Segment-level Metric Learning,https://arxiv.org/abs/2207.10547v1,
ArXiv:cs,Unsupervised pre-training of graph transformers on patient population graphs,https://arxiv.org/abs/2207.10603v1,
ArXiv:cs,Deep Learning Reveals Patterns of Diverse and Changing Sentiments Towards COVID-19 Vaccines Based on 11 Million Tweets,https://arxiv.org/abs/2207.10641v1,
ArXiv:cs,Zero-Shot Imitating Collaborative Manipulation Plans from YouTube Cooking Videos,https://arxiv.org/abs/1911.10686v4,
ArXiv:cs,Conditional Hierarchical Bayesian Tucker Decomposition for Genetic Data Analysis,https://arxiv.org/abs/1911.12426v5,
ArXiv:cs,Contrastive Registration for Unsupervised Medical Image Segmentation,https://arxiv.org/abs/2011.08894v3,
ArXiv:cs,Emotion analysis and detection during COVID-19,https://arxiv.org/abs/2107.11020v3,
ArXiv:cs,Identifying partial mouse brain microscopy images from Allen reference atlas using a contrastively learned semantic space,https://arxiv.org/abs/2109.06662v3,
ArXiv:cs,Algorithmic encoding of protected characteristics in image-based models for disease detection,https://arxiv.org/abs/2110.14755v4,
ArXiv:cs,Strategy Synthesis for Zero-sum Neuro-symbolic Concurrent Stochastic Games (Extended Version),https://arxiv.org/abs/2202.06255v4,
ArXiv:cs,Deep Multimodal Guidance for Medical Image Classification,https://arxiv.org/abs/2203.05683v2,
ArXiv:cs,PC-SwinMorph: Patch Representation for Unsupervised Medical Image Registration and Segmentation,https://arxiv.org/abs/2203.05684v2,
ArXiv:cs,Knee arthritis severity measurement using deep learning: a publicly available algorithm with a multi-institutional validation showing radiologist-level performance,https://arxiv.org/abs/2203.08914v2,
ArXiv:cs,AI-enabled Assessment of Cardiac Systolic and Diastolic Function from Echocardiography,https://arxiv.org/abs/2203.11726v2,
ArXiv:cs,Personalized Prediction of Future Lesion Activity and Treatment Effect in Multiple Sclerosis from Baseline MRI,https://arxiv.org/abs/2204.01702v3,
ArXiv:cs,Making the Most of Text Semantics to Improve Biomedical Vision--Language Processing,https://arxiv.org/abs/2204.09817v4,
ArXiv:cs,Machine Learning-Friendly Biomedical Datasets for Equivalence and Subsumption Ontology Matching,https://arxiv.org/abs/2205.03447v2,
ArXiv:cs,Brain-Aware Replacements for Supervised Contrastive Learning in Detection of Alzheimer's Disease,https://arxiv.org/abs/2207.04574v2,
ArXiv:cs,The Anatomy of Video Editing: A Dataset and Benchmark Suite for AI-Assisted Video Editing,https://arxiv.org/abs/2207.09812v2,
ArXiv:cs,Robust Landmark-based Stent Tracking in X-ray Fluoroscopy,https://arxiv.org/abs/2207.09933v2,
