feed,title,long_url,short_url
GN:S:C,IMF urged to create new trust to bolster work on climate resilience - Reuters,https://www.reuters.com/business/environment/imf-urged-create-new-trust-bolster-work-climate-resilience-2021-10-04/,
GN:S:C,National Climate Adviser Gina McCarthy to deliver Wege Lecture | The University Record - The University Record,https://record.umich.edu/articles/national-climate-adviser-gina-mccarthy-to-deliver-wege-lecture/,
GN:S:C,"New #ClimateChangedMe campaign sounds a global alarm: “The climate crisis is here, and we need to act now.” - International Federation of Red Cross and Red Crescent Societies",https://www.ifrc.org/press-release/new-climatechangedme-campaign-sounds-global-alarm-climate-crisis-here-and-we-need-act-now,
GN:S:C,Fossil fuel demand shakes off pandemic in blow to climate fight - Reuters,https://www.reuters.com/business/energy/fossil-fuel-demand-shakes-off-pandemic-blow-climate-fight-2021-10-04/,
GN:S:C,"Talk to a Climate Manager on Saturday, Oct. 23 - TAPinto",https://www.tapinto.net/towns/scotch-plains-slash-fanwood/sections/green/articles/talk-to-a-climate-manager-on-saturday-oct-23,
GN:S:C,"Want to help the climate crisis? Don't toss your old iPhone, fix it - ABC17News",https://abc17news.com/news/2021/10/03/want-to-help-the-climate-crisis-dont-toss-your-old-iphone-fix-it/,
