feed,title,long_url,short_url
GN:T:WP,US to expand offshore wind in the Atlantic and the Gulf of Mexico - Electrek,https://electrek.co/2021/10/29/us-to-expand-offshore-wind-in-the-atlantic-and-the-gulf-of-mexico/,
GN:T:WP,"Flights Canceled, Tens Of Thousands Without Power As High Winds Howl Across North Texas - CBS Dallas / Fort Worth",https://dfw.cbslocal.com/2021/10/28/flights-canceled-thousands-without-power-high-winds-howl-texas/,
GN:T:WP,Total Eren to lead on 1GW wind-plus-storage in Kazakhstan - Windpower Monthly,https://www.windpowermonthly.com/article/1731824/total-eren-lead-1gw-wind-plus-storage-kazakhstan,
GN:T:WP,Startup hopes to harness the energy of storms with typhoon-powered wind turbine - STLtoday,https://www.stltoday.com/news/science/startup-hopes-to-harness-the-energy-of-storms-with-typhoon-powered-wind-turbine/video_91c2b454-4bb2-5ad7-90e4-7bbb580b9111.html,
GN:T:WP,Feds to begin leasing process for wind farms off Wilmington - WWAY NewsChannel 3,https://www.wwaytv3.com/2021/10/29/feds-to-begin-leasing-process-for-wind-farms-off-wilmington/,
GN:T:WP,"Climate action must be fair, avoid suppression of developing countries' rights: Global Times editorial - Global Times",https://www.globaltimes.cn/page/202110/1237644.shtml,
